,TweetID,TweetContent,TweeterUsername,TweetDatetime,TweetLongitude,TweetLatitude,TweetPlace
589,1570840571736125443,Guy who has a good singing voice because of his juul,Dry_wall_Eater,2022-09-16 18:22:31+00:00,,,
590,1570839888920182784,"hey @PoSt0nerDegen, went for a dollar slice and these fucks had nothing. luckily i got my vape pen. https://t.co/mEVMnjPUGr",douglasisadope,2022-09-16 18:19:48+00:00,,,
591,1570839848113799168,i know this is very boomer of me but i really do love starting shit with kids who vape on the underground,mimikyucals,2022-09-16 18:19:39+00:00,,,
592,1570839824873005058,How UK is sleepwalking into a public health disaster with child vaping epidemic: Teenagers hooked on e-cigs reveal how they’ve been left needing INHALERS after being lured in by shops peddling ‘smokeable Fanta’ https://t.co/WObFoK8TIF,granthshalausa,2022-09-16 18:19:33+00:00,,,
593,1570839781059461120,me but instead of vape im taking a 5 min poop,burntherzog,2022-09-16 18:19:23+00:00,,,
594,1570839637069041666,I just swallowed my juul 😰,jadewesttwt,2022-09-16 18:18:48+00:00,,,
595,1570839495158767616,"[VAPES]
Browse through all our Vapes at: https://t.co/Fs0LOAZ2c8 https://t.co/OCR1zecyiW",tantushealthco,2022-09-16 18:18:15+00:00,,,
596,1570839242426949637,"Vape, used by 100's thousands in their path to quit smoking or help reduce the harmful impact of the cigarette, is under attack by f🍁cktard @JustinTrudeau &amp; his despotic government, with up to 100% TAX !

Is it for Ukraine ?  Climate change ?
Who knows!

Fill up, use code EXCISE https://t.co/cj08iuQUFt",punisherqip,2022-09-16 18:17:14+00:00,,,
597,1570838974557749248,literally Fuck ibs every single food is triggering me atm so I am surviving on coffee and vape 😐,_lauradern,2022-09-16 18:16:10+00:00,,,
598,1570838903707561984,"I love being part of a fantastic community. Vaping save lives!
With Covid, the community got a little lost and now with the rise in disposables, being an e-liquid manufacturer means we are struggling but today was nice to give a little back for the support we do still receive 😊 https://t.co/TcnfmpcgFW",dripdropvapour,2022-09-16 18:15:54+00:00,,,
599,1570838733074604032,"With Vape-Jet’s dedicated service and product support teams, you’re never flying solo.  Learn more about the Vape-Jet “Six Star” approach at https://t.co/eDIw89zn1n https://t.co/R26tfwE6iR",vape_jet,2022-09-16 18:15:13+00:00,,,
600,1570838710010413058,"Try new Mistifi vape carts! They use Hi-Phi™ technology to produce solventless cured resin that is free from solvents, additives, flavorings, diluents, thickening agents, carrier oils, plant wax, resin, or chlorophyll. 
Meaning, it's the good stuff! 
https://t.co/s8Rsj45dHK https://t.co/4qGwn99G8S",GoddessDelivers,2022-09-16 18:15:07+00:00,,,
601,1570838683762278401,"We have all the accessories you need for your DIY e-liquid mixing, including empty e-liquid bottles, labels and blunt needle syringes for accurate measurements. Check out the range https://t.co/pAKaiyaxHL 

#vape #vapecrew #vapesocial #ukvapers #vapeuk #ukvapescene https://t.co/QkEsl7DN8Q",DecadentVapours,2022-09-16 18:15:01+00:00,,,
602,1570838624840843267,Sar e aam idher Instagram pe CBD vape liquid bik rahay hain. LEAs ki nazar parrnay se pehle pehle stock ker lo saray.,HalalAtheist,2022-09-16 18:14:47+00:00,,,
603,1570838232816033795,"I shan’t not talk to a girl,,, i shall only admire their beauty from afar",bill_juul_burn,2022-09-16 18:13:14+00:00,,,
604,1570838142407831553,The Starkville Oktibbeha School District teaches about Vaping Dangers  https://t.co/ncthPswydr,HarTerry,2022-09-16 18:12:52+00:00,,,
605,1570838092789190660,Deep house ✅ Vape ✅ Favorite drinks ✅ Friday ✅ Solo mission ✅.. what more can I ask for,kgomotsodj,2022-09-16 18:12:40+00:00,,,
606,1570838026716348417,findom can a goddess help me quit vaping,kntrl122,2022-09-16 18:12:24+00:00,,,
607,1570837809019359232,poppers vape,konkydonga,2022-09-16 18:11:33+00:00,,,
608,1570837636520247299,My preworkout has red #40 in it. I can’t believe this (said while I rip my juul),futuremrsduggan,2022-09-16 18:10:51+00:00,,,
609,1570837539719634950,Geek Vape Sonder U Pod Kit - The Sonder gets it's overhaul https://t.co/hzSSwlvVEh,VapingWithVic,2022-09-16 18:10:28+00:00,,,
610,1570837286027431936,Vape liquid? No vape solid https://t.co/EVWN3hdkMA,zazcarti,2022-09-16 18:09:28+00:00,,,
611,1570837234315849728,2 vietnamese energy drinks and approximately 112 pre game juul rips about to demolish this interview #talksoon🤫,howdohowdohowdo,2022-09-16 18:09:16+00:00,,,
612,1570836962965164040,"Looking for new flavors and game changers? We've got it all -- come see us at 198 Lincoln Hwy, Suite 3 in Fairless Hills! https://t.co/6u4hL0sckY",RR_Vapes,2022-09-16 18:08:11+00:00,,,
613,1570836663928225792,"✨BMOR Whale Bar- New Product
Enjoy your day with the compact Whale Bar 🍇🍌

🌐Check more at https://t.co/KMwV1PCfyj

👉Visit and play the game to win: https://t.co/gwOhmuJvwt
.
#bmorwhalebar #bmorvape #bmorfam #vape #vapenation #vapefam #vaping #vapelife https://t.co/zlmpMf0Wlj",BMORVAPE,2022-09-16 18:07:00+00:00,,,
614,1570836458143125505,"If you're looking to find a new flavor for your vape, this is the place to start. https://t.co/MZqz0ZLhdU",USGrocery,2022-09-16 18:06:11+00:00,,,
615,1570836369685225472,"FLASH SALE &amp; FEDERAL VAPE TAX ALERT!! 30mL has $7 &amp; 60mL has $10 tax addition to HST from OCT 1ST.  
Order of $180.00 or above before taxes =FLASH15
Disclaimer: Promo apply to retail only. One promo or discount applicable at a time on online orders.
Link: https://t.co/6GSwUTLoTY https://t.co/xKAdMFE3NF",FlavourCrafters,2022-09-16 18:05:49+00:00,,,
616,1570836214273679360,single-use disposable vape that’s shaped like a cigarette and is particulate matter flavored,konkydonga,2022-09-16 18:05:12+00:00,,,
617,1570836055376510977,"The FDA declared teen vaping an epidemic as e-cig use increased by 78% in one year. Do your homework parents, and do not let vaping affect your teen. 🚭⠀
⠀
#LACC #PreventionEducation #DrugPrevention #NoVaping #ECigs #SayNoToDrugs https://t.co/ISnBtbLQFt",LakesArea_CC,2022-09-16 18:04:34+00:00,,,
618,1570835688584806401,my uber driver blasting dubstep and ripping a fruity ass vape get me the fuck out asheville bro,iszweliokay,2022-09-16 18:03:07+00:00,,,
619,1570835599233269761,Just posted a photo @ All Day Vape https://t.co/DHV2bbcwU1,alldayvapejax,2022-09-16 18:02:46+00:00,,,
620,1570835532263096320,why dont they have ubereats but just for vapes,KURIMUKISU,2022-09-16 18:02:30+00:00,,,
621,1570835424385576961,the only way i can describe my mental state rn is as the lucky puffs the morning after a vape dies,smidgeamie,2022-09-16 18:02:04+00:00,,,
622,1570834954308780033,"Zingvy is a, short, catchy fun #business or #brand name based on #zing - Great for:

#Food #Spices #HotSauce #Vape #Tech #Marketing #EnergyDrink

#Startups #Zingvy

https://t.co/4gE5rZxYMW",Brandulinks,2022-09-16 18:00:12+00:00,,,
623,1570834945026789376,"The SMOK Nord has been a main contender in the mouth-to-lung #Vape market for a long time now. ⌛ 

In this video,  Rich compares the devices and highlights some of the main differences.

🎥 To watch the full video click here 👉 https://t.co/n8wbiGrkdK 
 
#VapeKit #VapeCommunity https://t.co/5tNwEWclQE",EvapoHub,2022-09-16 18:00:10+00:00,,,
624,1570834929021231107,"🍨🥧 Sadboy E-Liquid - In Stock 🥧🍨
.
.
.
#vape #vapedisposables #vapepic #vapeshop #eliquid #vapenation #ejuice #vapelife #vapedaily #instavape #vapefam #vapor #vapepics #vapelyfe #vapelikeaboss #midwestgoods #wholesaleeliquid #ecig https://t.co/VAoEZ96RO9",midwestgoodsinc,2022-09-16 18:00:06+00:00,,,
625,1570834918598356992,This thing but it's a vape https://t.co/XeFD7nWxTh,sillykappalol,2022-09-16 18:00:03+00:00,,,
626,1570834856447442944,"So the vapes without terpenes taste OK but better use terpenes, high is good but I have extreme weed tolerance, next week i test gummies",smokeyepan,2022-09-16 17:59:49+00:00,,,
627,1570834733793411073,I wish they sold vapes in like those lipsmacker 3 packs,mgervay13,2022-09-16 17:59:19+00:00,,,
628,1570834725094445056,"' did i loose my vape being halal... it's in my pocket, the haram doesn't leave me for long '",another_marina,2022-09-16 17:59:17+00:00,,,
629,1570834703468613633,the face of a kid eho just got his 3rd vape charge ag school https://t.co/1ulfn7n5iz,lesbinazugawa,2022-09-16 17:59:12+00:00,,,
630,1570834397783527425,fuck do u guys think ponyboy would be one of those kids who is like a total fiend and vapes at school,lesbinazugawa,2022-09-16 17:57:59+00:00,,,
631,1570834312723050496,I was a good girl and did all my chores so I get to vape some weed yay https://t.co/c36c6lR2D1,LeaderOfTheHrd,2022-09-16 17:57:39+00:00,,,
632,1570834064432832512,Need to choose between vaping ma lungs away or scranning everything in sight and becoming a fat cunt 🙃🙃🙃 2 days aff the vapes and a cany stop eating,Emmamowat1,2022-09-16 17:56:40+00:00,,,
633,1570834048892948480,im down terrible ghosting my vape n shit,lilspinach,2022-09-16 17:56:36+00:00,,,
634,1570833936171020290,"Hubbly prices at groove are ridiculous, that's why I recently started using a vape. I remember bill ya hubbly sele yare 1 tao, was plus one not livid? Ho hlakanetse lore he  loathes smoking.",_DidiBlanco,2022-09-16 17:56:09+00:00,,,
635,1570833924896718849,lmfao me when i used to vape omg,tinamfnmontana,2022-09-16 17:56:07+00:00,,,
636,1570833610428813314,"the combination of adderall, coffee, and my vape has me levitating rn",nowyousieme_,2022-09-16 17:54:52+00:00,,,
637,1570833347626283008,*buys 2nd vape ever* Juicy bar ✨queen✨🤪,quelkills,2022-09-16 17:53:49+00:00,,,
638,1570832965307109376,"Make my vape do some great offers on home DIY vape juices

https://t.co/HiIZHe5Dhg",ticketyboo67,2022-09-16 17:52:18+00:00,,,
639,1570832723014717440,"Mate.

Yer vape smells of bubblegum that's on fire.",onlyz,2022-09-16 17:51:20+00:00,,,
640,1570832424048918528,you are now allowed to smoke/vape on busses so the drivers have less visibility and therefore cannot pick you up,TubbsTheFrog,2022-09-16 17:50:09+00:00,,,
641,1570832357200134145,they had to put my bag through the scanner like 6 times at the Daley Center bc I had too many vapes and they had to find them all and make sure I didn't have weapons and that is the most me thing ever.,abyssalkat,2022-09-16 17:49:53+00:00,,,
642,1570832126597287936,NHS Dorset Rolls Out The Vapes https://t.co/I2koUGmYAT,LgdeAntonio,2022-09-16 17:48:58+00:00,,,
643,1570832072079740928,Last vape I’ll ever buy again.,BRWNSUGA_,2022-09-16 17:48:45+00:00,,,
644,1570832068049010688,"all high school girls do is vape, text 50 other guys that wanna fuck them, and gossip",SSSlatty,2022-09-16 17:48:44+00:00,,,
645,1570831987119902723,LMAO NOW I KNOW FOR SURE MY BRO VAPES HAHAHAHA,reenkasi,2022-09-16 17:48:25+00:00,,,
646,1570831786762211328,my grandma tryna kill me w these vapes i’m convinced 😭,__tmckenzie,2022-09-16 17:47:37+00:00,,,
647,1570831669388779520,Mfs need to leave them vapes alone man 🤣……..,MoeDawg23,2022-09-16 17:47:09+00:00,,,
648,1570831647146389505,i got a gummy bear flavoured vape 😋,karlscartoons,2022-09-16 17:47:03+00:00,,,
649,1570831536693587969,Fuck outta here with yah vape!!Do some push ups!,wanmillishit,2022-09-16 17:46:37+00:00,,,
650,1570831322935095302,DON'T HIT YOUR VAPE PEN WHILE I'M TALKING TO YOU.,sorrensbot,2022-09-16 17:45:46+00:00,,,
651,1570831313825046528,"Nevada: Swing by for our Life Is Beautiful specials all weekend long!

Stock up on flower, vapes, edibles, drinks, and more from Featured Farms, Wyld, Indo, Airo, and Cann. https://t.co/znQgmUsOJa",medmen,2022-09-16 17:45:44+00:00,,,
652,1570831289779097600,This bitch dead in class on FaceTime with her nigga and smoking her vape...,margielawrldstp,2022-09-16 17:45:38+00:00,,,
653,1570831155192303617,Tax Vapes and use that money to make therapy free oh,RamzZy_,2022-09-16 17:45:06+00:00,,,
654,1570831145763508224,"Damn.

First time someone's made me want to vape in a while",Eve_More_,2022-09-16 17:45:04+00:00,,,
655,1570830718053519360,"people my age are vaping, drinking and getting into relationships meanwhile i'm here on this goddamn bird app talking abt how much i love this 21 year old man who has the word 'swag' in his daily vocabulary..",jeewonify,2022-09-16 17:43:22+00:00,,,
656,1570830591918231552,hmmm im either in a plane or a giant juul right now I can’t tell yet. a little more meth and I’ll know for sure.,amberyllis_,2022-09-16 17:42:52+00:00,,,
657,1570830504609591296,When i lose my vape in the car,PetrichorVic,2022-09-16 17:42:31+00:00,-75.563587,38.788657,"New Jersey, USA"
658,1570830359247605760,Quitting vapes I just wanna yell at the whole world,thewallisgrey,2022-09-16 17:41:56+00:00,,,
659,1570830289735421952,"New at A Critical Discourse -https://t.co/DCk1tiP2qg YOUTH VAPING, NICOTINE-DIABETES LINK: NOT GOING AWAY The direct link explains doubling of youth prediabetes rates not explained by obesity, warnings provided media 4 years ago ignored while vaping surges https://t.co/3VDhZYANet https://t.co/Dc1nfdRzxb",jclarkmiller,2022-09-16 17:41:40+00:00,,,
660,1570830197058056192,"Women were targeted by Big Tobacco in the 60's-70's. African Americans were targeted in the 70's-90's. Young people and the LGBTQ+ community have been targeted via vaping the last decade. It's not about the flavor, it's actually about predatory ads.
⭐️ https://t.co/G5s3STJGnt https://t.co/vaaiiCtPhX",FadedEndless,2022-09-16 17:41:18+00:00,,,
661,1570829875145232386,blake: *blows vape* me: ...WoW😏,sunnydragonbot,2022-09-16 17:40:01+00:00,,,
662,1570829670874238980,"Idk what I'll do through the day today
But I know what I'll do tonight
I'll turn on all my neon lights
Put some edm
And vape in my room thinking about how I wish I was smarter",MettaTaurus,2022-09-16 17:39:12+00:00,,,
663,1570829589940936705,Having friends who vape is better than having toxic and fake friends. At least they're being real in front of me.,every1hatesfar,2022-09-16 17:38:53+00:00,,,
664,1570829381844750337,"Thinkin about what vape flavours the guys like
I hope one of them likes pink lemonade bc it's objectively the best flavour 
Feel like Danny's a mango guy tho",_trip_the_light,2022-09-16 17:38:03+00:00,,,
665,1570829378707230722,"#thc #cbdhealth 
#cannabiscommunity
 Skywalker Miami High Delta-8 THC Vape Cartridge Bienvenido a Miami. The most beautiful city in the world where the people are hot. The weather is gorgeous, and the buzz from the delta 8 is High.  And https://t.co/vTHtux6hSk #hemp #cbd #cbdoil https://t.co/iv53fzAy4a",cbdhealthbasket,2022-09-16 17:38:03+00:00,,,
666,1570828798828085248,Garlic flavoured vape.,flippflop,2022-09-16 17:35:44+00:00,,,
667,1570828777231646721,"Stepping into weekend be like
👇👇😂😂😂

Follow Us @shishavapes_tz 
Tunauza Mitungi ya shisha na Vapes za Kucharge 
Whatsapp / Normal Calls 0686314724☎️☎️ https://t.co/zWsBtixvRD",shishavapes_tz,2022-09-16 17:35:39+00:00,39.0081106,-7.1906489,"Dar es Salaam, Tanzania"
668,1570828632469409794,Taking Liberties: Does Make Smoking History want to make vaping history too? https://t.co/147MX1esMK https://t.co/tYiWNOPfwC,simonclark_,2022-09-16 17:35:05+00:00,,,
669,1570828379800346626,I never fail to have the same gut reaction to seeing youths vaping before remembering I started smoking at 13 https://t.co/0cyEeF03A4,IzzieJustine,2022-09-16 17:34:04+00:00,,,
670,1570828323206631424,Vaping is the only thing keeping me sane rn ngl,lilanxiousbitch,2022-09-16 17:33:51+00:00,,,
671,1570828301840830465,I finally made some new friends- turns out they vape and do edibles..... What,L3monadeCookiE,2022-09-16 17:33:46+00:00,,,
672,1570828038593744896,"TikTok is like a digital vape, only bad things come out there",Investeo198,2022-09-16 17:32:43+00:00,,,
673,1570827598640599040,"i need to up the quality of my vape
been smoking disposables, slightly annoyed w myself cus i blocked out the concept of expensive scientifically engineered juice available to the masses",nogginsnot,2022-09-16 17:30:58+00:00,,,
674,1570827479782146049,"We offer GRAPE ICE 10ML NIC SALT BY FANTASI at reasonable price. 

Shop Now at https://t.co/l2JFtPWYVz

#ukvaporwaves #vape #vapor #vaping #ecigarette #vapers #eliquid #eliquiduk #vapejuice #Nicotine #Fantasi https://t.co/86Jh4w386O",ukvaporwaves,2022-09-16 17:30:30+00:00,,,
675,1570827422559506432,yall emos need to stop vaping look at yall huffin and puffin,hotairpark,2022-09-16 17:30:16+00:00,,,
676,1570827382063534080,"Vaping bad, Exercising good",Dont_Vape_Bot,2022-09-16 17:30:07+00:00,,,
677,1570827375935619077,this banana ice vape hurts my throat bad ugh,yelIowbrokenblu,2022-09-16 17:30:05+00:00,,,
678,1570827127389564928,not me hitting my vape and making my tummy hurt even more 🥹,moonrivver,2022-09-16 17:29:06+00:00,,,
679,1570826866591952897,Going to dress up as a vape for Halloween so that she will suck the life out of me,livefreeohio,2022-09-16 17:28:04+00:00,,,
680,1570826863207153667,Avin a funeral for me vape on Monday,orlacsm,2022-09-16 17:28:03+00:00,,,
681,1570826797889261568,Might switch from Juuling back to cigs only. This feels corrupted,JeterHater,2022-09-16 17:27:47+00:00,,,
682,1570826474911051781,Idk how y’all vape that shit be drying out the back of my throat,rieannnne,2022-09-16 17:26:30+00:00,,,
683,1570826454065385472,I'm Struggling to Quit Vaping #shorts #quitsmokingnow 🚭 https://t.co/KxXKX6S1f5 via @YouTube - I fell down and gave in to Cravings!!! :-(,mrsheltontv2,2022-09-16 17:26:25+00:00,,,
684,1570826389011697666,"Crooked Stave Sour Rosé  (@CrookedStave)  is on, replacing Prairie Vape Tricks (@prairieales)",gezelligstl,2022-09-16 17:26:10+00:00,,,
685,1570826346271768579,vaping nonstop while I watch my squishmallows drown in my flooding apartment,evilscarlett111,2022-09-16 17:26:00+00:00,,,
686,1570826148715827200,"Vaping habits differ by race and sexual orientation among teens, study finds https://t.co/S5hnm3AdAY",AnnStaples,2022-09-16 17:25:13+00:00,,,
687,1570826102419116032,"The highlight of my day is walking into the second floor school bathroom at 8 AM to the Vice principal mid argument with a sophomore because she caught her vaping, when I realized what was happening I just slowly backed out of the bathroom. Truly just an American hs experience",Sat3rnn,2022-09-16 17:25:02+00:00,,,
688,1570825973427490816,why my phone didnt save the vape video 😭😭 pls un n nga lng funny sa night namin,mhoeriarty,2022-09-16 17:24:31+00:00,,,
689,1570825900459196417,MY VAPE IS GONE  https://t.co/3MtGcKpV0q,sixmista,2022-09-16 17:24:13+00:00,,,
690,1570825487714496513,I vaped on a fat guy and he pulls out discord on his phone to complain to his friends,expl0it_attempt,2022-09-16 17:22:35+00:00,,,
691,1570825460090834945,vaping while taking potty no thoughts,beniiiibachi,2022-09-16 17:22:28+00:00,,,
692,1570825169769496577,dropped my vape in the toilet at work today.,grey_veins,2022-09-16 17:21:19+00:00,,,
693,1570824929398095877,"It’s time to invest in a vape, no ways 🥴",ThyOtis,2022-09-16 17:20:22+00:00,,,
694,1570824803040493577,Something that I think needs to be brought up more is how fun the action of smoking or vaping something is regardless of substance,neptuunejpg,2022-09-16 17:19:52+00:00,,,
695,1570824738255036420,Toxic Metals In Vapour Review https://t.co/cWO6GM4wvZ,Vivid_Vapes,2022-09-16 17:19:36+00:00,,,
696,1570824737949102080,“Sorry we are out of vapes come tomorrow xx” SCREAMS,katylnfilova,2022-09-16 17:19:36+00:00,,,
697,1570824736602730496,graveyard shift blowing cemetary vapers,unikxt6400,2022-09-16 17:19:36+00:00,,,
698,1570824734748692480,Former WHO Director Supports Ecigs https://t.co/98pxoKPWVR,Vivid_Vapes,2022-09-16 17:19:35+00:00,,,
699,1570824729552105472,This year I’d like to focus on self improvement and mastering vape tricks,deprexxy,2022-09-16 17:19:34+00:00,,,
700,1570824727429783554,"don’t reward yourself with food. that’s counterproductive. instead, buy a vape or give yourself a tattoo :)",cornvomit,2022-09-16 17:19:34+00:00,,,
701,1570824593081876481,"A new addition to the simple Zero range of pod kits is the @VaporessoEcig Zero S - our Gaz - @FlatCapVaper gives it a test drive to try to work out what the ""S"" stands for... https://t.co/8CRLgPyQHe                   #Vaporesso #VaporessoZeroS #ZeroS #PodKit #Vape #Ecigclick https://t.co/I06U9y1czl",EcigClick,2022-09-16 17:19:02+00:00,,,
702,1570824513138618369,"False alarms caused by students vaping in the bathrooms are causing lots of disruptions at a Raleigh high school. Students can't learn if they aren't in class. 
https://t.co/RppHdpRg9l",TobaccoFreeNC,2022-09-16 17:18:43+00:00,,,
703,1570824480225918977,"Use to be me 🤣 stopped vaping in February fuck that no more of it, if y’all vape rn just stop it messes with ur breathing pretty bad.",araiii00,2022-09-16 17:18:35+00:00,,,
704,1570824433534894080,I can’t find my vape and I’m losing my mind,amarisinparis,2022-09-16 17:18:24+00:00,,,
705,1570824398021754880,WHY DID I TAKE MY VAPE CHARGER OUT OF MY CAR,laurenrose235,2022-09-16 17:18:15+00:00,,,
706,1570824277573898241,not to jinx it or anything but i'm on day 4 no nicotine so i'm basically a vape free girlie for life now,apriloranges,2022-09-16 17:17:46+00:00,,,
707,1570824153800011777,a crunchie and some bbq hula hoops bc my vapes died and i have to wait an hour for bf to finish work https://t.co/snRA9gKzc3,eluxluvr,2022-09-16 17:17:17+00:00,,,
708,1570823840615534599,Why can’t i vape on an airplane,wannabe_idiot,2022-09-16 17:16:02+00:00,,,
709,1570823655881605121,I quit vaping for 3 months…I’m currently at work considering a bathroom break just to hit my vape. Pack me tf up.,jayu4ia,2022-09-16 17:15:18+00:00,,,
710,1570823642891845633,Spent 30$ on a nasty vape ☹️💔,1kDaay,2022-09-16 17:15:15+00:00,,,
711,1570823578718998530,Drake and Josh would’ve Juuled for sure,chemjay3000,2022-09-16 17:15:00+00:00,,,
712,1570823534154489857,"Dear person 20 feet away,

You have a ritual of vaping, devolving into a deep coughing fit, recovering 1-2 minutes later, and then repeating after a 5 minute break. Why?",LikeaSsur,2022-09-16 17:14:49+00:00,,,
713,1570823499048189953,someone clearly hotboxed this bathroom with grape vape and it smells delightful in here now,libbzard,2022-09-16 17:14:41+00:00,,,
714,1570823458153537536,"Don't frog-get to stop by!🐸

#SmokeShop #Florida #Tobacco #Glass #Pipes #Smoking #Vapes #Hookah #Smoke #Vape #Vaping #Smokeshops #Pipe https://t.co/39MLH3Ks6U",MikeSmokeShop1,2022-09-16 17:14:31+00:00,,,
715,1570823352595664899,"boys who never vape , will get a beautiful wife",ziuu27,2022-09-16 17:14:06+00:00,,,
716,1570823218226950148,Somebody is hitting their vape in this anti-hazing training 😭😭,scorpiolover444,2022-09-16 17:13:34+00:00,,,
717,1570822990795018241,"READ THIS IF YOU ARE ADDICTED TO NICOTINE and MALE:

nicotine produces a chemical called prolactin which is normally in women to produce energy. Do you know why u feel like a pussy its bc ur vaping dumbass. I was doing the same and am now quitting after I finish this last vape.",unmutednpc,2022-09-16 17:12:40+00:00,,,
718,1570822624271564803,"Me: this multiple retrogrades have been pretty chill nothing out of order I feel great 
Also me today: cries hysterically all the way to the vape shop in my Pyjamas for no reason",mommyc00l,2022-09-16 17:11:12+00:00,,,
719,1570822387574394882,I bought a vape.. it didn’t work- I told them and got a new one.. it worked at first but now barely works (it’s from todayyyy),taurinewhore,2022-09-16 17:10:16+00:00,,,
720,1570822227154833408,Mental illnesses are hiding in a corner today bc I’m too powerful,vape_nap,2022-09-16 17:09:38+00:00,,,
721,1570822110775480322,mister dio would ya kindly remove my vape pen from yer anus? much obliged,holhorsebot,2022-09-16 17:09:10+00:00,,,
722,1570821929849991173,as a human why are you vaping,7Sulle_,2022-09-16 17:08:27+00:00,,,
723,1570821500130951169,"Why is our generation obsessed with vaping especially, what’s the hype of it",MawuliUtd,2022-09-16 17:06:44+00:00,,,
724,1570821445483384833,Vape addicts are the worst … on the train ?,PassTheSadza_,2022-09-16 17:06:31+00:00,,,
725,1570821429687619584,juul is a cutie i love her,zmIove,2022-09-16 17:06:27+00:00,,,
726,1570821427217182722,"Wife just back after paying her respects. After queuing all night, she had her vape and bottles confiscated, her food and her torch I gave her for her safety also confiscated! Very high-handed and quite disturbing! She’s a Grandmother aged 67!",barneybear1969,2022-09-16 17:06:27+00:00,,,
727,1570821374637375489,"my doctor asked me when the last time i smoked nicotine was, and i told him i quit vaping 7 weeks ago, and he was geeked he said congratulations",dpthecreator,2022-09-16 17:06:14+00:00,,,
728,1570821324129595392,i  got swindled into spending 50$ at the vape shop today but now i have fruity pebble flavored juice so honestly im still winning,Bashley168,2022-09-16 17:06:02+00:00,,,
729,1570821155249950720,I just saw a felix biederman clone. He had a fat vape and everything. I love men again.,realjeffbez0s,2022-09-16 17:05:22+00:00,,,
730,1570821116720979968,"Prof John Britton, Emeritus Professor of Epidemiology, University of Nottingham finds egregious flaws in recent vaping study.

https://t.co/nqHoDqxc5k",eJuiceMonkeys,2022-09-16 17:05:13+00:00,,,
731,1570821095942656006,they should make a vape that attaches to your iphone with magsafe,thisyearsgurl,2022-09-16 17:05:08+00:00,,,
732,1570820957350285312,nicotine gum is actually pretty lit. I used to be pro vaping but I feel like it’s gotta somehow still be bad for you long term.,rajwolfx,2022-09-16 17:04:35+00:00,,,
