,TweetID,TweetContent,TweeterUsername,TweetDatetime,TweetLongitude,TweetLatitude,TweetPlace
1147,1570771527565512705,5 star review from Ian: No clog issues!!! https://t.co/JbGiI64IK0 #vape #vapelife #vapecommunity #vapestore #vapepenswholesale #vapeshop,VP_Wholesale,2022-09-16 13:48:10+00:00,,,
1148,1570771144369901570,Vape! I need you,aspiringdilf2,2022-09-16 13:46:38+00:00,,,
1149,1570770849627770882,the way im sober now bc all my vapes died,6vane9,2022-09-16 13:45:28+00:00,,,
1150,1570770764395159553,"The Juice Lab’s sugar rush !! Don’t worry sugar was processed from Barbados Cane Sugar and we know how the cane here hits !! #vape #vapedaily #vapebarbados @ Bridgetown, Barbados https://t.co/zDmSbMbWS2",Jason21262139,2022-09-16 13:45:08+00:00,,,
1151,1570770742660452353,Gonna quit vaping/ smoking 😬🙏🏻,urnotstuck,2022-09-16 13:45:03+00:00,,,
1152,1570770558333358082,"Wake up babe, it's time to vape your Starbucks cold brew and freebase your Claritin before going to a camping festival ✨🏕",ehmulsion,2022-09-16 13:44:19+00:00,,,
1153,1570770557293166597,"Nahhh! 💨🤣 *chokes on vape* 💨🤭😂 Well I be damned!! Season the damn fish and chicken, you get me lol 🤦🏼‍♀️",Diva_RHIactive,2022-09-16 13:44:19+00:00,,,
1154,1570770522665000962,"I work in a handful of different mines and in all of them eveydamnbody either smokes, vapes or chews feel like I gotta get my rep up. I ain’t gay so vaping is off the table. Only smoke ciggys when I’m drunk. Guess I’ll try chewing probs going to throw up we’ll see. Happy Friday",erokroybal,2022-09-16 13:44:10+00:00,,,
1155,1570770393673367558,Vaping corny asf😂 how you look gangsta and smell like strawberries.,SlutendenciesZW,2022-09-16 13:43:40+00:00,,,
1156,1570770241340452864,"random thought but dont u think its kinda weird how since vapes arent as smelly as cigs, society kinda going back to having that mindset where its ok to essentially smoke anywhere u want to in public",markipliyuh,2022-09-16 13:43:03+00:00,,,
1157,1570770197476249601,"#thc #cbdhealth 
#cannabiscommunity
 Wedding Cake Delta-8 THC Disposable Vape Pen says Bienvenido a Miami. The most beautiful city in the world where the people are hot. The weather is gorgeous, and the buzz from the delta 8 is High. And https://t.co/nsJeoDFVAE #hemp #cbd #cbdoil https://t.co/ZZpwvZYIQT",cbdhealthbasket,2022-09-16 13:42:53+00:00,,,
1158,1570770178065182724,unpopular opinion but i love the air dryers in restrooms like yes pls make that obnoxiously loud noise so i can hit my vape in quiet,slutty_sag,2022-09-16 13:42:48+00:00,,,
1159,1570769925278683140,They should make vapes for people with Virgo on their chart,jesseisrude,2022-09-16 13:41:48+00:00,,,
1160,1570769639797587969,I haven't been open for more than 30 mins and I've already heard 5 people's life stories and why they need to vape...I must be that guy everyone feels comfortable enough to tell shit to lmaooo,kenjiboijoi,2022-09-16 13:40:40+00:00,,,
1161,1570769323660279811,"Y’all I’m so ready to smokeeeeee, vape, drink, allatttttt",KristenTrimble9,2022-09-16 13:39:24+00:00,,,
1162,1570769320871104512,Vaping on an empty stomach/coffee belly is nightmare fuel,Ricky_Bobby96,2022-09-16 13:39:24+00:00,,,
1163,1570769132681072642,"YIHI SXmini SL CLASS V2 / MOD REVIEW #yihisxmini #slclassv2 #vape https://t.co/0C7HVkkfB5 via @YouTube 
EY UP GUY'S CHECK OUT MY LATEST MOD REVIEW
🙏👍😃💯🔥
@yihisxmini",SavageSimon62,2022-09-16 13:38:39+00:00,,,
1164,1570768874320035845,10 PAX at The Wreck for a Juul beatdown:  Crime Scene https://t.co/0RKqfDzpM4,F3Alpha,2022-09-16 13:37:37+00:00,,,
1165,1570768799959511042,prob help if i flip vape around other way,TOURNIKITE,2022-09-16 13:37:20+00:00,,,
1166,1570768685434023936,"Put ur vape in a small makeup bag so ur boss thinks ur going to the bathroom to change a tampon but ur actually toking up

*For legal reasons this is a joke",itsjess343,2022-09-16 13:36:52+00:00,,,
1167,1570768325785026561,"this guy vaping next 2 me in class rn, its makibg me so uncomfy",ang3lz4y,2022-09-16 13:35:26+00:00,,,
1168,1570767926315331584,"Shinsuke won't stop talking about this ""vaping"" thing...",tsurugibot_en,2022-09-16 13:33:51+00:00,,,
1169,1570767728306425856,Lmao he literally asked me again😂 now he’s telling me about how me makes his own vape juice 😭,jems4gem,2022-09-16 13:33:04+00:00,,,
1170,1570767696542978049,We will dispose / recycle your used Vapes responsibly  - box inside #Woosnam #Llanidloes #Vapes for you place them into. #Recycle #ResponsibleBusiness #ShopLocal #RecycleVapes https://t.co/dfeAf9WPkB,trudydavies1964,2022-09-16 13:32:56+00:00,-3.5508425,52.4374491,"Llanidloes, Wales"
1171,1570767384008597504,I love this site! @eightvape has the best #deals for our #Vapers #VapeFam https://t.co/OkuC2u01Ak,edygaudioso,2022-09-16 13:31:42+00:00,,,
1172,1570767355839664129,i just wish u could ring your vape when u lose it,xemmamarshall,2022-09-16 13:31:35+00:00,,,
1173,1570767331558854657,This is the first and last vape I’ll ever buy,IvarVsTheWorld,2022-09-16 13:31:29+00:00,,,
1174,1570767042365779968,I need a new vape man,MuvaaVee,2022-09-16 13:30:20+00:00,,,
1175,1570767005166473216,I just wrote a review on THC-P Vape Cartridge https://t.co/j42QWrwGpF via @yotpo,sarah_kay_gee,2022-09-16 13:30:12+00:00,,,
1176,1570766951584264194,I just realised I starting vaping ages ago cause I thought it would suppress my appetite omfg,blairue,2022-09-16 13:29:59+00:00,,,
1177,1570766779290456065,Cloud Inc Vapes Shop in London UK selling E-cigarette and E-juice https://t.co/CQz4qYD8zs,ECIGCANADAZONE,2022-09-16 13:29:18+00:00,,,
1178,1570766599539331073,"Welcome to the Orchard of The Juice Lab. Fruits were grow with love !! ❤️🤕 Who ever said we can’t vape healthy ?!🥳🥳 #vape #vaperdaily #vapejuicesale #vapebarbados @ Bridgetown, Barbados https://t.co/iIKL67srxM",Jason21262139,2022-09-16 13:28:35+00:00,,,
1179,1570766473102266369,"I don’t know if I miss him, the notifications or the attention. Or the fact that he could of got me a vape",UrbxnAngel2005,2022-09-16 13:28:05+00:00,-4.475248,55.8890245,"Clydebank, Scotland"
1180,1570766205258199040,when someone tells you to not blow your vape air into their face you apologize and stop instead of starting an argument how it’s not an actual cigarette and smells great for you :))))),zzennie_99,2022-09-16 13:27:01+00:00,,,
1181,1570766205111209986,"🙌 SP2S is one of the leading electronic cigarette brands in the vaping industry, and we welcome the SP2S Disposable device to JM Wholesale! With 6 authentic carefully curated flavours SP2S delivers the ultimate vaping experience.  

#disposablevape #vape #vapeuk #vaping https://t.co/lFoe7kfLpZ",JM_WholesaleLtd,2022-09-16 13:27:01+00:00,,,
1182,1570766148140138496,Bout to do my part and start double fisting vapes for the women in red states✊🏼,bat_boy13,2022-09-16 13:26:47+00:00,,,
1183,1570766141148233730,BRUH MY BANANA VAPE IS SO MF RIPE RN I CANT STOP SMELLING LIKE BRUH UR IN MY POCKET SHI SHUT UP,fatfatfatfattty,2022-09-16 13:26:46+00:00,,,
1184,1570766014023102465,"Big boss monstah after a killer vape hit. Waaaaah

Me, me, me, me, meeeeee.",SCI_Intel,2022-09-16 13:26:15+00:00,,,
1185,1570765591568613377,The case of a young adult with an extensive history of vaping using nicotine-delivery systems who was diagnosed with HPV-negative SCC that was rapidly progressive and fatal. https://t.co/T14FrPLI48,BizelPierre,2022-09-16 13:24:35+00:00,,,
1186,1570765558064480258,"I HAVE GOOD REASON PEOPLE CALM DOWN. I don't wanna shit in school :(

Tha bathrooms suck and are very loud and filled with vapes and annoying kids. On weekends I eat breakfast not on weekdays

I am scorched",Scorchedparody,2022-09-16 13:24:27+00:00,,,
1187,1570765181902553099,This vape tastes like grape chapstick but mostly chapstick.,WHIPPINSPORK,2022-09-16 13:22:57+00:00,,,
1188,1570764931292889098,"---VOOM Iris mini 600puffs 2ml with TPD COMPLY
Vape factory direct sales exporter with 13 years experience, Looking for vape Dealer/Wholesaler/Retailer, welcome to inquire. OEM and ODM Supported.
Whatsapp: https://t.co/b7pMr6sUlt
Vechant: 8615211709163
E-mail: Renne@itsuwacig.com https://t.co/bUzh8dPNkE",Renne_leling,2022-09-16 13:21:57+00:00,,,
1189,1570764654888243203,"dood, what the fuck is a mineral water flavored vape juice????",xzzi3_,2022-09-16 13:20:51+00:00,,,
1190,1570764597388521472,"I attended the Chula Vista City Council Meeting tonight, where the hot button topic was the vote to ban the sale of flavored tobacco vapes in the City of Chula Vista. — Nextdoor … #ImjUStSAyIn …  https://t.co/NoZCk0vSif",SophiaMechelle,2022-09-16 13:20:38+00:00,,,
1191,1570764587896819714,"#edibles #cbdoil 
#cannabiscommunity Our Sour Space Candy Live Resin #CBD Vape Pen is an enjoyable and complex flavor.  It leads with tart notes and because we use Live Resin. You will taste real natural #hemp with an earthy lemongrass and clove https://t.co/GsdXnww4GO https://t.co/vJqXZuKhkz",CBDSmokeShop,2022-09-16 13:20:35+00:00,,,
1192,1570764566572986368,booooo i forgot my fucking vape again😒,analiza_lugo,2022-09-16 13:20:30+00:00,,,
1193,1570764433563193344,"Hatori: Pass the Juul
Me: Shimazaki stole it
Shimazaki, making smoke rings with his eyes:",minegishibot_,2022-09-16 13:19:59+00:00,,,
1194,1570764326310641667,294. Jesus himself couldn’t stop me from vaping,dreambot71,2022-09-16 13:19:33+00:00,,,
1195,1570764283134484480,my mom will hit her vape then immediately use her inhaler,nettlefawn,2022-09-16 13:19:23+00:00,,,
1196,1570764271616929793,Warning to vapers as scientists raise alarm over potential 'new wave' of cancer https://t.co/t1EhwUMAZq,BizelPierre,2022-09-16 13:19:20+00:00,,,
1197,1570764216390553601,vodka just does something to me; last night i dreamt that i was hitting a watermelon flavored vape that was disguised as a hot dog.,meggy_mayyy,2022-09-16 13:19:07+00:00,,,
1198,1570764170936872960,"If you have ever wanted to go to the Vape Expo in Birmingham, you can get tickets for free using code HALFORDSUCKS in the link below

It supports me and @suckitvapes moving forwards if you sign up and if you go, they have plenty of freebies and products there for you.",Halfordsucks,2022-09-16 13:18:56+00:00,,,
1199,1570763809593204748,Cloud Inc Vapes Shop in London UK selling E-cigarette and E-juice https://t.co/ixj8npnqQ2,ECIGCANADAZONE,2022-09-16 13:17:30+00:00,,,
1200,1570763683776675840,"Brazil’s Justice Ministry Suspends Vape Sales

#politics #brazil #drugs #BrazilianPolitics 
 https://t.co/RyB41sIvtK via @vaping_post",AllBrPolitics,2022-09-16 13:17:00+00:00,,,
1201,1570763668765249542,I'm Ross Kemp and I'm at the Vape Shop to meet the man who invented banter,botskemp,2022-09-16 13:16:56+00:00,,,
1202,1570763585705607169,"Today is not my day, slept for 4 hours again, morning shits, and I left my vape at home.",theythem5lut,2022-09-16 13:16:36+00:00,,,
1203,1570763441933283328,Great news! We’ve branded our own CBD/THC products. Our products are Koma Solutions. Available at High Elevations now. We also have vapes as well. Koma Solutions storefront on the way. https://t.co/7OotWQgXCp,SSecretclothing,2022-09-16 13:16:02+00:00,,,
1204,1570763284068048897,dreamt that Bethenny Frankel was my mom and it was not a good time she kept yelling at me about vape pens,oldbitch420,2022-09-16 13:15:24+00:00,,,
1205,1570762934535729152,I Tried This No Nicotine Vape Pen &amp; I Hate It Real Bad😂,Pb_DaHustla,2022-09-16 13:14:01+00:00,,,
1206,1570762765337522179,Are you still looking for the best 3ml cbd vape pen? https://t.co/rE7z2NVj1t,casmoovape,2022-09-16 13:13:21+00:00,,,
1207,1570762549036990466,#youtube Your Complete Vaping Journey With Monster Vape Labs... https://t.co/cCt6YE1itr,FVVapeShow,2022-09-16 13:12:29+00:00,,,
1208,1570762337082085376,Totally forgot about twitter for a dark track for the comp and boy im about to send him the most depressive of vapes,quartz_ebooks,2022-09-16 13:11:39+00:00,,,
1209,1570761574578810880,"okay okay maybe they had a point, maybe guava vapes shouldn’t be legal",deemarli,2022-09-16 13:08:37+00:00,,,
1210,1570761208269262848,"This shit is stupid. Females restroom fr smell like piss, cigarettes, vape. And PREFUME. None of that mashed together smells nice",HYP3RP0PL0V3R,2022-09-16 13:07:10+00:00,,,
1211,1570760959622545409,never been bothered about vaping but that Gregg's one I might have to try 🤭,prngslvrs,2022-09-16 13:06:10+00:00,,,
1212,1570760859114442753,Coming to have a mini breakdown and a vape in the disabled toilets at work is becoming the norm x https://t.co/LgSSaIi5Lk,TJH_93,2022-09-16 13:05:46+00:00,,,
1213,1570760729367826437,Vaping: what people are getting wrong https://t.co/sn8qD7Lb4T via @YouTube,s3oulbuxan,2022-09-16 13:05:15+00:00,,,
1214,1570760719653830656,"⬅
I'm
A 
Vape-Free
Mom!",ovwmercy,2022-09-16 13:05:13+00:00,,,
1215,1570760686497824768,"You're the driving force of the day, Gemini! It's easy to feel... More for Gemini https://t.co/w23C6YGOGN",vape_loverr,2022-09-16 13:05:05+00:00,,,
1216,1570760503471001601,All I am asking for is ONE cannabis vape that looks as pretty as Elf bars do… I don’t want any nicotine I just want to puff on something that pretty with THC in it🥲,AllyTrain,2022-09-16 13:04:22+00:00,,,
1217,1570760291322892296,Michigan Bans Flavored E-Cigarettes; Officials Confirm Second Death Linked To Mysterious Vaping-Related Lung Illness https://t.co/VJvKpASJYc,1sthcc,2022-09-16 13:03:31+00:00,,,
1218,1570760237728272385,hey tepig i vape,oshawott_ebooks,2022-09-16 13:03:18+00:00,,,
1219,1570760096099205127,Just posted a photo @ Krazey Vapes https://t.co/MgRvF3VfRn,Curr946,2022-09-16 13:02:44+00:00,,,
1220,1570760048162508801,These youngsters on the town vaping in alleyways. My fucking goodness. SMOKE PROPERLY WILL YA FFS,idonthavethlnk,2022-09-16 13:02:33+00:00,,,
1221,1570759904922841088,I turned 42 yesterday one of the hard lessons I’m learning as I approach full blown middle age is that it is really inappropriate to discuss one’s personal stereo equipment with anyone at all,JUUL_user1980,2022-09-16 13:01:59+00:00,,,
1222,1570759592824504322,"Since both the #disposable unit and two refillable #Logic #vapes work as a complete system, beginner and more experienced #vapors can enjoy the same refreshing experience, regardless of their chosen #e-cig product. Read more on our blog: https://t.co/vQR74R3niJ https://t.co/lKIupQtaWn",ILoveEcigs,2022-09-16 13:00:44+00:00,,,
1223,1570759537363390465,Would be me to burn my lip from my vape lol 😂,loulalou0,2022-09-16 13:00:31+00:00,,,
1224,1570759463455592455,"Do you have a great idea for a supplement or vitamin? Sport supplement? E-cig or Vape flavor? Contact us in #tampa and make your nutraceutical dreams a reality!

https://t.co/SC3W019MyV",PeakMFG,2022-09-16 13:00:14+00:00,,,
1225,1570759214414581760,Everything went to shit ever since they took away juul mint,Austmc4_,2022-09-16 12:59:14+00:00,,,
1226,1570759201642917894,"I got a new vape, my tank full, about to book our flights… life is good.",nftbuy1,2022-09-16 12:59:11+00:00,,,
1227,1570758661664051203,how do mfs smoke vapes bro this shit gives me such a headache,maxbeckisdead,2022-09-16 12:57:02+00:00,,,
1228,1570758143168356352,"GM Fams!❤️

Today I would like to recommend the Blueberry Plum~ xx

Every Kit includes 1 device and 2 pods( 1200 puffs )

YOOZ MONTH Giveaway is still ongoing. Check the info on our Instagram account( search "" yoozofficialuk"" on IG ).

Warning: Must be above legal vaping age. https://t.co/zJGZ5UJzSw",YOOZGlobal,2022-09-16 12:54:59+00:00,,,
1229,1570758083743457285,Guest blog: It's 2018. Should people vape?,timesopinionbot,2022-09-16 12:54:45+00:00,,,
1230,1570758038729924609,E-cigarette Juul Lawsuit Settlement https://t.co/KeK506CEqm,Newswind_co_uk,2022-09-16 12:54:34+00:00,,,
1231,1570757958778355720,gotta get a vape😁😁😁,funnierbongo,2022-09-16 12:54:15+00:00,,,
1232,1570757754750640133,God riot fest doesn’t even want you taking your vuse in unless it’s in sealed packaging. There’s no way everyone is following that right??? I can only hide so many things. I am absolutely terrified to try to bring this weed vape in bc it’s definitely not allowed,Sh4rkBate,2022-09-16 12:53:26+00:00,,,
1233,1570757442371481603,(Feb2018) “What is the purpose of vaping” -A,in_writing,2022-09-16 12:52:12+00:00,,,
1234,1570757190939734016,Let’s go https://t.co/0fyqNzFApp,vape_nap,2022-09-16 12:51:12+00:00,,,
1235,1570757094353276929,"#edibles #cbdoil 
#cannabiscommunity Take your Delta-8 Vaping experience to the next level by a factor of 10. With new Delta-8 THC Disposable Vape Pen Skywalker OG. With rechargeable batteries in Skywalker OG flavor, you can help https://t.co/Yg0Quqf4lF #cbd #cannabis #hemp https://t.co/TL6ALx4Emk",CBDSmokeShop,2022-09-16 12:50:49+00:00,,,
1236,1570757043912593408,Going to lose my mind if I see one more Subaru vape joke on the Xbox X tweets,TheSubaruBot,2022-09-16 12:50:37+00:00,,,
1237,1570756940187455492,"Alexander Stafford, Conservative MP for Rother Valley, has posed a series of questions to the government about vaping and electronic cigarettes.

https://t.co/lcEIbNEHuW",europethra,2022-09-16 12:50:12+00:00,,,
1238,1570756935938637825,asking if i can vape during my bank appointment,_idrc_,2022-09-16 12:50:11+00:00,,,
1239,1570756686612426753,is this a vape or a pan https://t.co/6xAgxe0Oh3,PSYCH0L0V3RS,2022-09-16 12:49:11+00:00,,,
1240,1570756613275021313,the sun came out for my vape break 🙏 blessed be,tangerine_meow,2022-09-16 12:48:54+00:00,,,
1241,1570756506790010882,in jesus name no more vape,icymelvin,2022-09-16 12:48:29+00:00,,,
1242,1570756470416998401,"COMING SOON!
Massive raids of vape and smoke shops across the United States. Massive seizures of vape products will ensue. The war between the FDA and vape products has only begun!",LetsGoKast,2022-09-16 12:48:20+00:00,,,
1243,1570756410862108672,"Dinner Lady Disposable Vape Pen - Fruit Mix

https://t.co/hEVYe9Nze4

The Dinner Lady Disposable Vape Pen is a disposable vape device, recommended for users of all experiences especially those switching over from smoking. 

 #vaping #vapeuk #dinnerlady https://t.co/OPLMjKCVbM",vapedraw,2022-09-16 12:48:06+00:00,,,
1244,1570755838083764225,"Behold one of the first #Classic pipes that went #Vape &amp; never 👀🔙

Also it's #followfriday so check out OGs👇who've been supporting us
from inception 🤜💚🤛 @QuasarSure @TheHiddenOrder @JohncomQ
@bigjoethedon @CardanoWiz @Flawwed1Art @DAG1pnt5 @bruce59026018 &amp;
manymore 🙏#NFVC https://t.co/hi2usPrzUl",Retrosteam_,2022-09-16 12:45:49+00:00,,,
1245,1570755602082832384,vaping is hurting my throat sooooo bad,catsamee,2022-09-16 12:44:53+00:00,,,
1246,1570755551239483392,"How quaint: a child with a oui’d vape gestures for her friend to not use it in eyeshot of me. 
The house I live in is thoroughly made of glass bo, I am not casting a singular stone",FlufflgronkMP,2022-09-16 12:44:41+00:00,,,
1247,1570755515805990919,"1ml, 2ml, preheat latest generation ceramic coil disposable vape pen, black, red, yellow colors...

#1mldisposablevape #2mldisposablepen #2mlvape #vapepen #vapes #weedmap https://t.co/41lXiJlTQp",mengsweetlove,2022-09-16 12:44:32+00:00,,,
1248,1570755515369820165,might age regress n buy a juul idk,jojowildin,2022-09-16 12:44:32+00:00,,,
1249,1570755478770319362,I JUST REALISED MY VAPE IS FULL ON VISIBLE IN MY BEREAL NOO,norrisjpg,2022-09-16 12:44:24+00:00,,,
1250,1570755288352886785,"1ml, 2ml, preheat latest generation ceramic coil disposable vape pen, black, red, yellow colors...

#1mldisposablevape #2mldisposablepen #2mlvape #vapepen #vapes #weedmap https://t.co/WBW7YiW3Rr",sallyzheng01,2022-09-16 12:43:38+00:00,,,
1251,1570755165925576704,Having half a white claw and a weed vape for breaky. Skinniest I’ve been in months. #rhobh https://t.co/gCTejko5ka,matlocksinn,2022-09-16 12:43:09+00:00,,,
1252,1570755165539692545,Gm MFS. Let’s give it up to my vape pen with an extended battery for getting me through this week of In-person work https://t.co/5CAhXCAfap,gpsmattty,2022-09-16 12:43:09+00:00,,,
1253,1570754994802167810,Saw a guy on the highway vaping on a motorcycle. No helmet just vapor and vibes,maxwellrw_,2022-09-16 12:42:28+00:00,,,
1254,1570754877642383360,"It's strange how so many people are afraid of ""#covid""/""#coronavirus"".They willingly wear masks, follow all the 🐴💩 #msm, #cdc/#who,#drfauci is telling them, inject toxic chemicals into their blood stream and a lot of those same people also smoke/#vape #cigarettes all day!🤦 🚭",ChoicesMatter_,2022-09-16 12:42:00+00:00,,,
1255,1570754859846205440,thanks sa v cutie na vape cats🫶🏻,trxfjrdo_,2022-09-16 12:41:56+00:00,,,
1256,1570754833203998730,"Acabo de darle like a ""JUUL CEO: No More Advertising to Kids"" en @youtube (https://t.co/SXXAFS0zZA)",adebasbasket33,2022-09-16 12:41:50+00:00,,,
1257,1570754372442767361,"Blueberry Ice of Iplay Box

Warning: The product contains addictive chemical Nicotine. For adults (21+) only.

More details: https://t.co/EbLKQ7rngL

#iplayvape #vape #vaping #vapor #vapelife #vapenation #vaporizer https://t.co/PfST8tIUlb",VapeIplay,2022-09-16 12:40:00+00:00,,,
1258,1570754354872983555,Where the fuck is my juul,jadewesttwt,2022-09-16 12:39:56+00:00,,,
1259,1570754352872296449,Where the fuck is my juul,carlyshaytwt,2022-09-16 12:39:55+00:00,,,
1260,1570754211826245635,"Orange County CBD Disposable Vape Pen 600mg - Mango Haze

https://t.co/IzkSfiAP6b

The new Orange County CBD Disposable vape with 600MG CBD in 10 mouth watering flavours that you cannot resist. 

Mango Haze delivers a very fruity hit to your taste buds.

#cbd #cbdhealth #cbdvape https://t.co/QvdPjrqeJK",cbd_vendibles,2022-09-16 12:39:21+00:00,,,
1261,1570754085799993345,"We're excited to announce that Vapes at 88 is becoming Vape Hound - everything is the same, we're just changing the name 🤪 

Over the coming weeks you will see us making the changeover in the shop, website &amp; social media.

Happy Vaping &amp; see you soon at Vape Hound! https://t.co/1pIxqPGv69",VapeHoundUK,2022-09-16 12:38:51+00:00,1.2908213,52.0808127,"Woodbridge, England"
1262,1570753965939367939,not to be a hater but ppl posing with vapes like theyre fairy wands makes me giggle,THlSISPOP,2022-09-16 12:38:23+00:00,,,
1263,1570753871554969600,hello Friday 💚Moti UK🇬🇧 #mitiuk #motiplanet #ukvapers #ukvape #uk #ukvaper #ukvaperscommunity #ukvapeshop #ukvaperslifestyleexpo #ukvapefamily #ukvapelife #ukvapeexpo #ukvapedeals #ukvapelove #ukvapesociety #ukvapescene #ukvapenation #vape #vapecommunity #vapedaily  #vapestore https://t.co/eSE09C4jNC,uk_moti,2022-09-16 12:38:00+00:00,,,
1264,1570753545254899712,"Newsletter # 16 is out!

We feel proud to announce the 16th edition of Vaping Ape Club NFT weekly newsletter. Go give it a read!

Thanks a lot vApes for your love and support 🧡

https://t.co/mGZL2L9DVp

#Bitcoin #STX #Cryptocurency #NFTCommunity #UtilityNFTs",VapingApeNft,2022-09-16 12:36:43+00:00,,,
1265,1570753481652445190,Steam engine bulb as vape coil https://t.co/VmBTuZ5TGe,Malaika20077701,2022-09-16 12:36:27+00:00,,,
1266,1570753420113612800,Hunting for a place to  vape so hard it's like you're in the middle of a fog bank in Maine? Join us at https://t.co/j6aTlyODvN https://t.co/aZcuDndBdV,kniiife_Mom,2022-09-16 12:36:13+00:00,,,
1267,1570753226122891264,"I actually did it.

A month without vaping or smoking.

And I don't even use nic gum anymore.

Wow.",KwekkersHue,2022-09-16 12:35:26+00:00,,,
1268,1570753131142840322,"Just in! This unique Stainless Steel Water Bottle for $24.95. 
https://t.co/eQePqKka5j
#liquid #vape https://t.co/mhAsnY2k1a",IncerityCo,2022-09-16 12:35:04+00:00,,,
1269,1570753101166170112,When the alto pod a lil burnt so it tastes like a juul pod ❤️,roofrepair420,2022-09-16 12:34:57+00:00,,,
1270,1570752978856087553,vape died this morning before school 💔💔💔,cals_milk,2022-09-16 12:34:27+00:00,,,
1271,1570752935952535554,vape oil. Please I must see,friskfries_bot,2022-09-16 12:34:17+00:00,,,
1272,1570752779291103233,"WE GET IT, YOU VAPE!",Laslow_Bot,2022-09-16 12:33:40+00:00,,,
1273,1570752716246487040,Matchy matchy vape with my love. ♡ https://t.co/x4plxa3pxQ,awiiiiisaaaaa_,2022-09-16 12:33:25+00:00,121.094473,14.5270254,"Cainta, Calabarzon"
1274,1570752659220488192,Experience a fast turnaround thanks to our new lab in the UK. 🇬🇧 Our scientists can complete #TPD testing in 5-10 days to help speed up your route to market. Try it out at 👉 https://t.co/m77bJHa0eD #adactmedical #compliance #testing #vaping #ecigarettes #eliquids https://t.co/qusPvJ6a8M,AdactMedical,2022-09-16 12:33:11+00:00,,,
1275,1570752477854826497,I didn't share my achievement last week but I celebrated 2 years without a cigarette. I still vape and will be working on quitting that eventually but 2 years without a cigarette for me is a big deal,sentientmeaning,2022-09-16 12:32:28+00:00,,,
1276,1570752312452476928,Update on mercury lamp shade: I bought a vape.,JamieKnapp1313,2022-09-16 12:31:49+00:00,,,
1277,1570752299710189569,Guess I support vaping now,Void_ded,2022-09-16 12:31:46+00:00,,,
1278,1570752185595461632,Just posted a photo @ All Day Vape https://t.co/JazygwR1H7,alldayvapejax,2022-09-16 12:31:18+00:00,,,
1279,1570751976480309251,"2weeks in and no cigs have touched my lips. 

Vapes really do help.",ChubbyDarksoul,2022-09-16 12:30:29+00:00,,,
1280,1570751961900912642,Wake up vape up,jadewesttwt,2022-09-16 12:30:25+00:00,,,
1281,1570751960458104832,Wake up vape up,sampucketttwt,2022-09-16 12:30:25+00:00,,,
