,TweetID,TweetContent,TweeterUsername,TweetDatetime
2914,1158977014960812032,wtf is in a juul??? I smoked Newports for longer than I'm comfortable admitting and this mint juul was the roughest smoke I've had since an unfiltered Lucky Strike. plus my stomach hurts???,writerbxtch,2019-08-07 05:43:47+00:00
2915,1158976707623378944,"BuyBest Coupon Deals - 25% OFF With ""COUPON17"" https://t.co/v3b8yDQsx9 #vape #vaping #ecigs",vapedotto,2019-08-07 05:42:34+00:00
2916,1158976543617478656,"The movie dodgeball is so much better with our CBD Vape! 
https://t.co/FH0OdzBg2A",montanasungrown,2019-08-07 05:41:55+00:00
2917,1158976507257245696,An update to my article - a response from @JUULvapor Media Relations &amp; Communications. https://t.co/sQZL5B6qUF #teens #vaping #addiction,Cbmoss,2019-08-07 05:41:46+00:00
2918,1158976425959002113,"Congressional Hearing Ignores What’s Best for Public Health, Embraces Myths About Vaping https://t.co/LG0cHTs1Qt",publicpolicy3,2019-08-07 05:41:27+00:00
2919,1158976256018247681,"Vaffle APP, Born for Vapers! Features: Vape Friend, Vape Lifestyle, Vape Tool, Vape Challenge, Vape Giveaway! https://t.co/0rN6sGreKC https://t.co/LP9b3FvKC1",amadinda,2019-08-07 05:40:46+00:00
2920,1158976246300196866,"please please please don’t start juuling. if you do, please please please try to stop. i care about you too much 🥺",woahitslivi,2019-08-07 05:40:44+00:00
2921,1158976131443253248,"Don’t let what catches your eyes run away 👀👁
#travelpartner 🤝
• • • • • •
REMIT ℙ 𝕆 𝔻
-----------------
🔹Pod of 3.2ml
🔹Battery 1000mAh
🔹Usb Type C (Fast charge)
🔹 Mesh resistance 0.6Ω 👇👇 #vapeon #vapeitaly #vapeworld #suorin #suorinofficial #suorindrop #vape https://t.co/glFNK4nkbJ",exemptvape,2019-08-07 05:40:17+00:00
2922,1158976002036555776,"More Colorado Teens Are Choosing Edibles, Vapes Over Smoking Cannabis https://t.co/F8btamkbkd #business #news #money #investment #moneyworksmagazine",MoneyWorksMag,2019-08-07 05:39:46+00:00
2923,1158975847367241728,Study at Vogue vaper durian tunggal  santai bossku😜😜 not for kid 🔞🚭 #studentutem @ Vogue Vaper Durian Tunggal https://t.co/qX4R5eBYF5,argijan,2019-08-07 05:39:09+00:00
2924,1158975718920863744,Review:  XTAR ST2 Battery Charger Review - With 4.1A Quick Charge!! https://t.co/CQH8iV7ZGP #VapingTrain #vapefam #vapeon https://t.co/w4wO7VfvSl,Vaping_Train,2019-08-07 05:38:38+00:00
2925,1158975687031754752,Naughty ebony babe Sienna Dream revealing her voluptuous curves #sucknipples #vape #french #bath #doll https://t.co/H4DWxpbU2Y,AnnaWhether,2019-08-07 05:38:31+00:00
2926,1158975548594352128,FCK I went outside to the balcony to get some fresh air and people are coming out to vape 😫😩,xlunarx17,2019-08-07 05:37:58+00:00
2927,1158975443942481920,Pacifiers walked so juuls could run,cluntcity,2019-08-07 05:37:33+00:00
2928,1158975322374598656,"To travel with my vape is to live a better life 🧳 ❤️💨
#travelpartner 🤝
• • • • • •
REMIT ℙ 𝕆 𝔻
-----------------
🔹Pod of 3.2ml
🔹Battery 1000mAh
🔹Usb Type C (Fast charge)
🔹 Mesh resistance 0.6Ω 👇👇 #vapeon #vapeitaly #vapeworld #suorin #suorinofficial #suorindrop https://t.co/ngdHK7aZTq",exemptvape,2019-08-07 05:37:04+00:00
2929,1158975287285157889,just juuled while terrus was holding it between his toes after making luv n if that isn't romance then idk what is,killesra,2019-08-07 05:36:55+00:00
2930,1158975231400321024,"Vaffle APP, Born for Vapers! Features: Vape Friend, Vape Lifestyle, Vape Tool, Vape Challenge, Vape Giveaway! https://t.co/7qqNiTJvaZ https://t.co/EQSAPMmE65",43597febd099463,2019-08-07 05:36:42+00:00
2931,1158975145127661568,New Vaping Joyetech ESPION Solo 80W with ProCore Air TC Kit 4000mAh https://t.co/GUDnOGIQhM https://t.co/9M4mxhKHNK,VapingAve40,2019-08-07 05:36:21+00:00
2932,1158974888738054144,mfs gonna get lung cancer at 30 and still be going on about how juuls safer than smoking cigs.,hung_cletus,2019-08-07 05:35:20+00:00
2933,1158974588161810433,i hate a “where’s my juul” mf,suburbanpanzi,2019-08-07 05:34:09+00:00
2934,1158974575411175425,New Vaping Wismec Predator 228W TC Kit with Elabo https://t.co/A2hNCjzHuc https://t.co/9smzCwzigg,VapingAve40,2019-08-07 05:34:06+00:00
2935,1158974550643810306,"Ublo Numbers e liquid Concentrate Premium E Liquid No Nicotine 30ml &amp; 100ml 10 Fantastic flavors 

https://t.co/xHzX5i9V68

#concentrate #atsocialmedia #firsttmaster #vape #vapepen #vapeshop #vapestore #ecig #ejuice #vaping #vapejuice #jbrt18vape https://t.co/cNIlKuQnWy",ublo_uk,2019-08-07 05:34:00+00:00
2936,1158974511326334977,Running has not filled the giant vape shaped hole in my soul yet.,E_Lie_Gum,2019-08-07 05:33:50+00:00
2937,1158974500693794816,"my cat: tries to get my hydro flask 

me: yells at her

my mom: she just wants to juul!!",sara_leik04,2019-08-07 05:33:48+00:00
2938,1158974472541503489,"Colorado city debating possible ban of vaping products, age limit for tobacco https://t.co/WmzdCyQN2K",TheChestnutPost,2019-08-07 05:33:41+00:00
2939,1158974467961479168,"EXCLUSIVE - Student, 18, left with collapsed lung after Juuling
Is Vaping Safe, No! https://t.co/NzszgO5xML",boblister_poole,2019-08-07 05:33:40+00:00
2940,1158974326751674368,Mfs really don’t realizing that “juuling” is just a more modern version of smoking flavored CIGARETTES and y’all wonder why you’re so fucking ADDICTED it’s because you’ve been smoking watermelon flavored cigarettes for the last five months STUPID,sydnneeyhall,2019-08-07 05:33:06+00:00
2941,1158974299027509248,Juul has released an app that tracks vape use and could also stop young people from smoking https://t.co/dE09tETx4L,nowthisnews,2019-08-07 05:33:00+00:00
2942,1158974217565736966,y’all I really had a dream of smoking weed on the LOWKEY with mark and he made me try his vape and that shit was ass and no wonder why I don’t vape bro https://t.co/pbHL3EGuD8,felixsophyy,2019-08-07 05:32:40+00:00
2943,1158974206190788608,Str8 up i got 2 stop vaping 🛑,lucashome21,2019-08-07 05:32:38+00:00
2944,1158974039593050112,"EXCLUSIVE - Student, 18, left with collapsed lung after Juuling https://t.co/BFBji1KI2a via @MailOnline",JordanaSands,2019-08-07 05:31:58+00:00
2945,1158973949717311489,ey bro u wanna vape some chrono trigger,Spinny_ebooks,2019-08-07 05:31:36+00:00
2946,1158973571693260800,"😗💨 All about #Vapes and more! 😗💨

➡️ https://t.co/JcEQilldHB ⬅️

🔞🔞🔞 

#vape #vapepen #vapelife #vapeporn #vapenation #vapeblast #the420wire https://t.co/jCKAuB4nuE",the420wire,2019-08-07 05:30:06+00:00
2947,1158973433335693312,"S/o to @Dancefestopia 2018 for giving me such a bad chest infection that I had to quit vaping 
literally haven’t juuled in 11 months wtfff",mish_mitch13,2019-08-07 05:29:33+00:00
2948,1158973403543592960,"2 do list: 
- make vape juice 
- get a shower",berteatsass,2019-08-07 05:29:26+00:00
2949,1158973383272468481,"Connotations has vast experience in writing for the vaping industry. If your vaping business, website or blog needs vaping-related content, please contact us for more information: https://t.co/Z3wtfhS1Lf #vape #vaping writing https://t.co/wLOR90esyv",connotationsUK,2019-08-07 05:29:21+00:00
2950,1158973383167610880,New Vaping Joyetech eGo AIO Starter Kit New Colors https://t.co/Y4NEGh6Ay4 https://t.co/3EzHeh47WJ,VapingAve40,2019-08-07 05:29:21+00:00
2951,1158973355292278784,"me: “mom I’m gonna get a Juul”
my mom: “okay”
me: “...”
my mom: “wait, what’d you say?”
me: “a Juul mom”
my mom: “no, I don’t like those things”
me: “why not”
my mom: “I don’t like Chihuahua’s they’re deformed”
me: “HUH”
my mom: “oh, what’d you say? You said a chihuahua right?”",abbymunizcoker,2019-08-07 05:29:15+00:00
2952,1158973344093544448,"Dude, where’s my juul?",DaltonWiggy9,2019-08-07 05:29:12+00:00
2953,1158973314213142528,got a juul bussdown,slimsharknado,2019-08-07 05:29:05+00:00
2954,1158973029386293248,Check out my #Presentation on The best and amazing vape deals https://t.co/ZdN1568ru6 via @authorSTREAM,thevapedeals,2019-08-07 05:27:57+00:00
2955,1158972935429853184,"Say bruh, I need a pen😩 I gotta go back to that vape store in Eulass before September.",Sam_Huncho,2019-08-07 05:27:35+00:00
2956,1158972855599738880,"Vaffle APP, Born for Vapers! Features: Vape Friend, Vape Lifestyle, Vape Tool, Vape Challenge, Vape Giveaway! https://t.co/KfwpkXvXGJ https://t.co/XRQ6hyd5bM",aiamjuan,2019-08-07 05:27:16+00:00
2957,1158972682668351488,mom jus told me I should get my grandma a juul,muev8e,2019-08-07 05:26:34+00:00
2958,1158972648241500160,".@christycushing Lipoid pneumonia associated with vaping. The .@UUtah #Pulmonology press conference presents anecdotal evidence from 2 patients. 
https://t.co/XijBEdE77u",f_ckmarketing,2019-08-07 05:26:26+00:00
2959,1158972594726457344,Racists love explaining how racism isn’t the problem. News flash bucko you’re the KKK’s poster boy https://t.co/RJpPlIokwR,sentient_juul,2019-08-07 05:26:13+00:00
2960,1158972493165735937,ur stupid if u choose to juul cause u think it’s cool. pls explain to me how nicotine addiction is cool???,YoureSexxy,2019-08-07 05:25:49+00:00
2961,1158972323363508224,"*sam loses and finds her juul* 
“let’s take a shot in celebration”",livxngproof,2019-08-07 05:25:09+00:00
2962,1158972235488616448,"Yogurt is a probiotic... Flavored yogurt is just good for us with the fruits... Fiber. But vape pens that dispense flavored concentrated nicotine odorless to minors? Now that's ""genius.""",notgodlyone,2019-08-07 05:24:48+00:00
2963,1158971593659494400,'The pax vape pen and pax cocaine key bump keychain.' Brandon duke and carolinas,notgodlyone,2019-08-07 05:22:15+00:00
2964,1158971528018571264,Juuls were most definitely a form of natural selection,anddyyyyy_,2019-08-07 05:21:59+00:00
2965,1158971199231287296,What You Should Know about Vaping https://t.co/td31Pd6fKd,nabresource,2019-08-07 05:20:41+00:00
2966,1158971140284518400,Did you know coolio? The next radical thing is vapes ☮️ 🏈 👏!,Coolest_bot,2019-08-07 05:20:27+00:00
2967,1158970979948912640,New Vaping Innokin EQs Pod Starter Kit 800mAh https://t.co/WBv1LLlGhu https://t.co/44zs9cWVN5,VapingAve40,2019-08-07 05:19:48+00:00
2968,1158970947736657920,People are really JUST NOW realizing that juuls are bad for your lungs-,howdydocal,2019-08-07 05:19:41+00:00
2969,1158970692639109121,New Vaping Innokin Zenith Tank with Plexus Z Coil https://t.co/UDbNGpp4iW https://t.co/XBLWXWsFWx,VapingAve40,2019-08-07 05:18:40+00:00
2970,1158970621746827265,"im an old hag,, what’s a juul like one of those electric cigarettes that smell like cotton candy or smthn",su_tohruverse,2019-08-07 05:18:23+00:00
2971,1158970445699407873,New Vaping Joyetech ESPION 200W TC Box Mod  https://t.co/M8g04nsCqM https://t.co/1clTvbDHQJ,VapingAve40,2019-08-07 05:17:41+00:00
2972,1158970387138580480,"Just threw my juul &amp; it's charger in the street

Some call me a bad bitch",amandaweisbrod,2019-08-07 05:17:27+00:00
2973,1158970279718113281,The best and amazing vape deals https://t.co/Jvo7IwqQbl via @YouTube,thevapedeals,2019-08-07 05:17:01+00:00
2974,1158970228015017984,"This dude is rly judging me bc of drinking , I’m not the one who smokes weed and vape all day???",somecommonb1tch,2019-08-07 05:16:49+00:00
2975,1158970173749190657,my alter ego is a girl who wears glasses and is a writer who works at a vape shop and lives in a shitty apartment with her girlfriend,cosmicassie,2019-08-07 05:16:36+00:00
2976,1158969944656228352,How you fools look with Juuls https://t.co/NC7ILm7efv,RobynBirhd,2019-08-07 05:15:42+00:00
2977,1158969937890820096,New Vaping Wismec Reuleaux RX GEN3 Dual 230W with Gnome King Kit https://t.co/jamxcWyZcf https://t.co/WRcVn4BG08,VapingAve40,2019-08-07 05:15:40+00:00
2978,1158969930471157760,Me tryna act like my life ain’t falling apart. Like it ain’t been falling apart for quite some time now. Sitting here watching gossip girl juuling the fuck away,todo_y_nada_,2019-08-07 05:15:38+00:00
2979,1158969833058271232,"Now you can buy everything from our brilliant Vape Store Online as we bring you all kinds of vaping products readily available under one platform.

Buy online 👉🔗 https://t.co/151NJrgIu6 ✍️

#vapestoreonline #ejuicedirect #enjoyvapelife 

""share Through &amp; Help Us To Spread!"" https://t.co/kfhbWEoyz5",realVapeStore,2019-08-07 05:15:15+00:00
2980,1158969705845145601,"if you snorted crushed up candy as a child for fun, you now are addicting to juuling",CBrookwater,2019-08-07 05:14:45+00:00
2981,1158969551972966405,"""Coke, white claws, juuls, we are living our generation""",riggsgretel,2019-08-07 05:14:08+00:00
2982,1158969470578302976,11 teens hospitalized with lung damage linked to vaping https://t.co/UymyHrkIiR via @6abc,SoupPhilly,2019-08-07 05:13:49+00:00
2983,1158969338847776770,New Vaping Innokin Kroma-A + Zenith Tank Kit with Plexus Z Coil https://t.co/02kLZISiWB https://t.co/8MOSmqNf6D,VapingAve40,2019-08-07 05:13:17+00:00
2984,1158969336641589248,Dorthony Vaper,namechurner5000,2019-08-07 05:13:17+00:00
2985,1158969262637293568,fleetwood mac night.... don’t talk tobme tomorrow im quitting the juul,moldlover,2019-08-07 05:12:59+00:00
2986,1158969229875568640,"Aye yo, yuh boy can finally buy juul pods legally🎉🎉",DpSmasher,2019-08-07 05:12:51+00:00
2987,1158969086686031873,"my friends like ""im literally high on meth and youre concerned about me vaping nicotine???""

Kdhdksjsjsj",nopeitsmx,2019-08-07 05:12:17+00:00
2988,1158968836839731201,apex anyone since @TheKillaGoose is like a sick grandma for some reason?,vape_farm,2019-08-07 05:11:17+00:00
2989,1158968548276035584,Y’all ever sneeze mid JUUL hit ? Idk what just happened but I think I like it.,jarettshinault,2019-08-07 05:10:09+00:00
2990,1158968360941555712,just chilling and testing out stuff on obs https://t.co/26FWjVKnKO,_vaping_gam3r_,2019-08-07 05:09:24+00:00
2991,1158968285620293633,Survival Planning | PMTA Advice for Independent E-Liquid Companies | Published on - https://t.co/Vi5jqTjR2O #VIDEOORG #VAPINGORG #HARMREDUCTION #Vapingsaveslives #Harmreduction #vape #vaping #VapeUK #ecig https://t.co/VzOrQ7CiYi,brentstafford,2019-08-07 05:09:06+00:00
2992,1158968278934532096,Survival Planning | PMTA Advice for Independent E-Liquid Companies | Published on - https://t.co/FQmyDFSLPO #VIDEOORG #VAPINGORG #HARMREDUCTION #Vapingsaveslives #Harmreduction #vape #vaping #VapeUK #ecig https://t.co/1daPgK9ovz,RegWatchCanada,2019-08-07 05:09:04+00:00
2993,1158968162462982146,You ever swallow vape smoke so you can fart clouds?,DasYacob,2019-08-07 05:08:37+00:00
2994,1158968146134355968,sab hit a juul and drank a baja blast freeze at the same time and it made me laugh so hard i farted,tequilabongrip,2019-08-07 05:08:33+00:00
2995,1158968078832734208,New Vaping WISMEC Column Subohm Tank 6.5ml https://t.co/Po243AYu4X https://t.co/ebmjm4xUib,VapingAve40,2019-08-07 05:08:17+00:00
2996,1158968047283183616,My manager said I should get a Juul instead but idk hmmmm,charleenevd,2019-08-07 05:08:09+00:00
2997,1158968000038522880,New Vaping Joyetech ProCore Air Plus Tank https://t.co/8QkQ2PN5Zs https://t.co/Y6bJa0Zsaz,VapingAve40,2019-08-07 05:07:58+00:00
2998,1158967854428934144,"Mom, come pick me up. Everyone here is vaping.",rotworldxvx,2019-08-07 05:07:23+00:00
2999,1158967817296678914,candice why is your vape pen on the dinner table,flintebooks,2019-08-07 05:07:14+00:00
3000,1158967750385029120,"(bot) sex, vape, love and trust",Shozzie_ebooks,2019-08-07 05:06:58+00:00
3001,1158967327842611200,New Vaping Wismec Sinuous Ravage230 box mod https://t.co/YcgoF7p73u https://t.co/fUNZrqRsav,VapingAve40,2019-08-07 05:05:18+00:00
3002,1158967184795799552,Ea sports furry fut and all rhe little kids running dab celebrations before they even get a chance to buy a juul mango flavored cigarette vape concentrates. https://t.co/CtBCmNChRh,notgodlyone,2019-08-07 05:04:44+00:00
3003,1158967172913233920,"(Open Option Vaping) on Inner To Words - https://t.co/cSWP2qO80a

It’s also a standout option in its adjustable airflow feature, which allows you to alternate between strong rips or small sips, d... https://t.co/bq5NOYQ9g7",InnerToWords,2019-08-07 05:04:41+00:00
3004,1158967031540043776,earpids x vape,Shuttlesworthh_,2019-08-07 05:04:07+00:00
3005,1158966814229114881,"The owner of @Convergent_AV and host of @The_AVLife &amp; @road_av @Cbmoss contacted @JUULvapor - and did get results. Here is an article passed on, written by JUUL Chief Executive - stop kids from using #ecigarettes. Period. https://t.co/WyFUC3ac0W",digital_that,2019-08-07 05:03:15+00:00
3006,1158966526831030272,Morgan just found my red juul I lost during finals fest holy shit!!!,EHernandez978,2019-08-07 05:02:07+00:00
3007,1158966484267393024,New Vaping Wismec Sinuous SW Mod 3000mAh https://t.co/SBVnND8Vja https://t.co/5A6SiK34Mn,VapingAve40,2019-08-07 05:01:57+00:00
3008,1158966397147516928,"Vaffle APP, Born for Vapers! Features: Vape Friend, Vape Lifestyle, Vape Tool, Vape Challenge, Vape Giveaway! https://t.co/B6sB94NXHe https://t.co/tG8XhuW56E",churpy95,2019-08-07 05:01:36+00:00
3009,1158966332328763392,today im putting on my feel-good-shirt for good luck,Phi_Vape,2019-08-07 05:01:20+00:00
3010,1158966256156008456,#StopJUUL Before #1 More Child Gets Heartbreakingly💔#AddictedToNicotine #JUUL #NoSOUL @JUULvapor America’s Parents Want To Know 🔎 What EXACTLY ARE you doing to protect America’s youth after creating the #TeenVapingEpidemic @Jamie_Ducharme @Athletesdontvap @KnowNicotine #PAVe🚭 https://t.co/1LF2xoSGLZ,NYSMom4Kiddos,2019-08-07 05:01:02+00:00
3011,1158966118129815552,"Ppl that know everything 🤦🏻‍♂️ 
Went to an out of norm for me vape shop, asked for a certain coil, was proceeded to get told that coil doesn’t exist maybe I’m thinking bout a different coil(gave name)",BobbyWord,2019-08-07 05:00:29+00:00
3012,1158966095124078592,"Vaffle APP, Born for Vapers! Features: Vape Friend, Vape Lifestyle, Vape Tool, Vape Challenge, Vape Giveaway! https://t.co/gYZx11tonv https://t.co/H2kAY1ALPH",emil041973,2019-08-07 05:00:24+00:00
3013,1158966089897926656,"just spilled vape juice all over my bed, how’s your night going",meghanijones,2019-08-07 05:00:23+00:00
3014,1158966089361035265,"My mom: “Since when did you start vaping?”
Me: “Since you all started stressing me the FUCK out”",amy_naugle,2019-08-07 05:00:22+00:00
3015,1158965984612556802,New Vaping Joyetech CUBIS 2 Atomizer https://t.co/n0N3lSqHW1 https://t.co/vAJSXnE59x,VapingAve40,2019-08-07 04:59:57+00:00
3016,1158965905973567488,My mom wants a Juul. Should I be scared?,stewart_auston,2019-08-07 04:59:39+00:00
3017,1158965807260590080,"I'm at Cloud Gear Vape Studio in Subang Jaya, selangor https://t.co/rSB9sKZGDy",helmiefawazan,2019-08-07 04:59:15+00:00
3018,1158965780928761862,I was goin at my boys plug for selling BS vape pens were on facetime I said cuzz fuck all the talking show the lab test from LA you claim but avoiding &amp; He said don’t call me Cuzz I said idgaf What you wanna be called Cuzz you talking too much fuckin clown 😂,JayAree___,2019-08-07 04:59:09+00:00
3019,1158965573235150848,"EXCLUSIVE - Student, 18, left with collapsed lung after Juuling https://t.co/7dNs7NQmYb via @MailOnline",susancurran1970,2019-08-07 04:58:19+00:00
3020,1158965524769968128,If anyone has a spare vape pen they wouldn't mind giving. Away that would be great!! Need to take these dabs bro,asap_kobe24,2019-08-07 04:58:08+00:00
3021,1158965356490194944,i lost my juul and found it 20 minutes later in my bra nestled between my tits,alinktotheass,2019-08-07 04:57:28+00:00
3022,1158965342095511552,To my #2a loving #veterans TY! Always #freeshipping! Buy https://t.co/j7CoovMIpg &amp; use my coupon code masswon! #isolate #cbd #cbdoil #hemp #cannabiscommunity #cbdheals #cbdvape #health #cannabidiol #vape #wellness #marijuana #organic #cbdisolate #cannabisoil  #cbdcommunity,CbDbeast,2019-08-07 04:57:24+00:00
3023,1158965297900150784,Also wish I didn’t lose my juul 736278337 times a day,kaileyailene,2019-08-07 04:57:14+00:00
3024,1158965232028540928,New Vaping Wismec Predator 228W TC Kit with Elabo https://t.co/oJnMxOaixq https://t.co/mNVDhg7FpC,VapingAve40,2019-08-07 04:56:58+00:00
3025,1158964966495588352,bruh i been wanting 2 quit vaping 💪😐 &amp;&amp; i lost the charger lets see what happens 🥺,420NCT,2019-08-07 04:55:55+00:00
3026,1158964854994210818,New Vaping WISMEC Reuleaux Tinker 300W TC Kit with Column Tank https://t.co/SFEb9Bi5gy https://t.co/a7fk4rfuZU,VapingAve40,2019-08-07 04:55:28+00:00
3027,1158964375052378113,"My dad is so sweet. I told him I was going to bed but then I got up bc I can't get in a comfy position with my pulled muscle. He gave me a muscle relaxer &amp; after I but I went back to lay down. Then he knocks on my door &amp; hands me his dab vape. ""Just cleaned &amp; loaded it. Fat dab.""",kayxxlynnpromo,2019-08-07 04:53:34+00:00
3028,1158964078561202178,when the fuck did “smoking in the boy’s room” become “vaping in the gender neutral excretory facility” https://t.co/1fFqmeCqlj,NEETWorldOrder,2019-08-07 04:52:23+00:00
3029,1158964016338747392,I’ll never feel sorry for anyone who has a juul addiction. You did it to yourself. Ya HATE to see it!!,ASAPMokan,2019-08-07 04:52:08+00:00
3030,1158963791369035777,Vaping is dangerous! https://t.co/gboMFgLhYt,lindy_swanson,2019-08-07 04:51:15+00:00
3031,1158963484840857600,My arthritis is so bad I can’t even squeeze my vape juice sos,rakovinaa,2019-08-07 04:50:01+00:00
3032,1158963465395945473,Need Vape products? Checkout this site! https://t.co/cc6kPqaZEZ,NEMESISCOMPUTER,2019-08-07 04:49:57+00:00
3033,1158963438766448640,Like pac. #alleyesonme#golegend #teamcombofive #colombianmostwanted #instakillisback#callofdutyjoacops #oculus #joasculluela #therealtony #thenotoriousjoaquin #youngernow#vaper #connectingtheworld #ixoambassadors… https://t.co/Nup7lveUVo,workwithjoaquin,2019-08-07 04:49:50+00:00
3034,1158963393245646848,San Francisco Ballot Simplification Committee punts on summary of Juul Initiative | Center for Tobacco Control Research and Education https://t.co/EO1HsFSxDo,ParentsvsVape,2019-08-07 04:49:40+00:00
3035,1158963372416753665,Buy Vape Liquid Online | Huge Selection | Guaranteed Best Price https://t.co/qd23Rb4YxX,NEMESISGAMING69,2019-08-07 04:49:35+00:00
3036,1158963229726519297,Yall niggas be feigning that bad? You didn’t know that you can’t buy stuff for your juul until you’re 21 so you call a friend? Sad.,WallyyWorldd,2019-08-07 04:49:01+00:00
3037,1158963146104561664,For all you juul heads 🤣 https://t.co/XdyOUfB8Dv,_ohitsbrandon,2019-08-07 04:48:41+00:00
3038,1158962976927494144,#CyberDigest | Juul's New E-Cig Sure Is Collecting a Dumb Amount of Data About Its Users | @catiekeck | https://t.co/DLiQ1kytm5,ASPI_ICPC,2019-08-07 04:48:00+00:00
3039,1158962975656566784,New Vaping Wismec Reuleaux RX2 21700 230W TC Mod https://t.co/NVJU5441zF https://t.co/v9d8wQto20,VapingAve40,2019-08-07 04:48:00+00:00
3040,1158962698023034880,New Vaping WISMEC SINUOUS V200 200W TC MOD https://t.co/86KJsav518 https://t.co/OoOm0gXDKf,VapingAve40,2019-08-07 04:46:54+00:00
3041,1158962619954450432,"Part 1 of a 2 part review of my juice line It'sa Southin' Thang has been done by Wendy Vapes.   Check it out at https://t.co/mZxuTDqFbY.

Grand opening of our online store is open as well at… https://t.co/9cpXGkHy1h",mezdecc,2019-08-07 04:46:35+00:00
3042,1158962555039043585,I stopped juuling. If you see me with one just throw it far.........,takinLs1996,2019-08-07 04:46:20+00:00
3043,1158962451238572032,New Vaping Joyetech CUBIS 2 Atomizer https://t.co/n0N3lSqHW1 https://t.co/WOGoKn0XjC,VapingAve40,2019-08-07 04:45:55+00:00
3044,1158962252998946816,"Bro, you ever use your ps4 to charge your juul while playing Fortnite?",HaydenAldrich,2019-08-07 04:45:08+00:00
3045,1158961886320386048,"Vaffle APP, Born for Vapers! Features: Vape Friend, Vape Lifestyle, Vape Tool, Vape Challenge, Vape Giveaway! https://t.co/dua5Er6BO3 https://t.co/N906mvalZ2",ABohachuk,2019-08-07 04:43:40+00:00
3046,1158961880175644673,"been off the pill, turned to them juuls don’t need side hoes when i got my bitch jules. 😤👊🏾🤮 💯 https://t.co/XJden4WGmw",bratwrld444,2019-08-07 04:43:39+00:00
3047,1158961450129514497,Deepthroating your juul &gt;&gt;&gt;,the_real_ranald,2019-08-07 04:41:56+00:00
3048,1158961364687360000,"Fourteen young people in two states hospitalized after vaping, health officials say - CNN https://t.co/59ICjfodos",MihaiScorobete,2019-08-07 04:41:36+00:00
3049,1158961228342890497,"#ChuckinClouds #CloudCheck #HandCheck 
New Gen Mod 220W In a 107 Gram Body That Feels Smooth Yet Textured And Durable With The New AXON Chip Makes It Easier Than Ever To Operate. Paired With SKRR-S Tank, The Gen… https://t.co/PXImmTISVC",vape_nation411,2019-08-07 04:41:03+00:00
3050,1158961220898172928,"An unlikely ally: A pro-smoking group called Forest, is calling for restrictions on the use of vapes on hospital grounds to be lifted.
https://t.co/nNnd7hSAO4",VaperEmpire,2019-08-07 04:41:02+00:00
3051,1158961158973534209,You’re gross if u smoke juuls or cigs idgaf,icychina,2019-08-07 04:40:47+00:00
3052,1158961157807443968,"https://t.co/mMaPiIXdos

Private message me to Join!!",elektra_vapes,2019-08-07 04:40:47+00:00
3053,1158960975028150274,"pet ownership is just the same as living alone but with one more persons Box to clean, and one more person in the house who doesn’t know where my juul is",yikes_dot_gov,2019-08-07 04:40:03+00:00
3054,1158960942882988032,New Vaping Digiflavor Liip Disposable Pod Kit 250mAh https://t.co/qn0Z0AEJmQ https://t.co/jZv0Lifqq2,VapingAve40,2019-08-07 04:39:55+00:00
