,TweetID,TweetContent,TweeterUsername,TweetDatetime
1058,1159173081195171840,"Here's a 10% off coupon for your first order at The Vape Club Mexico. To accept, use my referral link: https://t.co/yepO59H1o4",CaudilloInsomne,2019-08-07 18:42:53+00:00
1059,1159173038589566976,"Scoop from @JoshMeyerDC : Jeffrey Wigand, big tobacco whistleblower played by Russell Crowe in THE INSIDER, is going to war with JUUL https://t.co/LCed1IwxKO",matthewt_ny,2019-08-07 18:42:43+00:00
1060,1159172981970464768,"i need a new small vape but don’t know what i wanna get this time,, hmmm",kelskroening,2019-08-07 18:42:29+00:00
1061,1159172977184972802,I seen someone pay another person 5$ to hit their juul ONCE. 😭😭 https://t.co/9iRWQ0uh2q,AintYouPuerto,2019-08-07 18:42:28+00:00
1062,1159172940363177984,my mom vapes now ggs,melvniely,2019-08-07 18:42:20+00:00
1063,1159172873883443200,"Before you open your shop you will likely need General Liability Insurance coverage as a condition to your lease agreement.  
Work with the experienced Vape Insurance in the industry
https://t.co/2FkdZDnVmw 

#vapelife #vapeshop #eciginsurance #smokeresponsibly #vapeinsurance https://t.co/ntFMiqRdsm",calcovapeinsure,2019-08-07 18:42:04+00:00
1064,1159172872646082560,Diesel flavor vape got me juiced https://t.co/deUQd3f1Kw,kanashibi,2019-08-07 18:42:03+00:00
1065,1159172749811736578,FDA investigating 127 reports of seizures after vaping https://t.co/XeyW0u7OkS,marketcheetah,2019-08-07 18:41:34+00:00
1066,1159172729955913728,The fact that people actually thought juuls were safer than cigarettes just shows how stupid people really are,chipchoderson,2019-08-07 18:41:29+00:00
1067,1159172721613426690,You smoke juuls or do hookah everyday and have the nerve to say me smoke tree is bad https://t.co/psbjeZQIOI,jazzEo,2019-08-07 18:41:27+00:00
1068,1159172539014209536,Stop smoking with this💨🤩✌🏼 @ Vape Escape https://t.co/9OxBOyyDmN,AndiPowell1,2019-08-07 18:40:44+00:00
1069,1159172443837227009,ALERT RT FDA investigating 127 reports of seizures after #vaping https://t.co/EIOOw3KuAS,mortgageconsult,2019-08-07 18:40:21+00:00
1070,1159172426183446528,I can out vape tf out of you @SmokesMatty,ShaneeeXOXO,2019-08-07 18:40:17+00:00
1071,1159172363713490944,Breaking911: BREAKING: FDA investigating more than 127 reports of seizures after vaping - CNBC - https://t.co/Wm9Y7ndTQW,Tr3nd1ng_N3ws,2019-08-07 18:40:02+00:00
1072,1159172358508204033,FDA investigating 127 reports of seizures after vaping https://t.co/OMrUc6nRkr,us_stock_invest,2019-08-07 18:40:01+00:00
1073,1159172341789839366,My dad went to vape and I’m too scared to ask for the dessert menu,rhichapmann,2019-08-07 18:39:57+00:00
1074,1159172252954431490,What's happened to Evil Cloud Vape Juice? 🤔,WesleyFoster94,2019-08-07 18:39:36+00:00
1075,1159172111048613888,"summer essentials ~ a new read, lots of fresh flowers, and cbd 🌻
.
a few months ago, I started using CBD oil to soothe some of my anxiety symptoms. I have vaped and used oil like this infinite_c_b_d and I have… https://t.co/YrA6ZwNXrD",KaitCzurylo,2019-08-07 18:39:02+00:00
1076,1159172072372936705,Vaping and shitting,wizardvapes,2019-08-07 18:38:53+00:00
1077,1159171940764065794,if emilee had a dollar for every juul she’s lost she could buy a new one,miranda_paige28,2019-08-07 18:38:21+00:00
1078,1159171933730234370,"FDA investigating 127 reports of seizures after vaping 
https://t.co/ZsxbU5jXEn",MacDaddy611,2019-08-07 18:38:20+00:00
1079,1159171855779082240,"Before summer fun turns to trouble. https://t.co/KSQffRIyQ5 Public classes forming now. #scottsdale #glendale #phoenix #tempe #safekids #safestreets
#AZ #ASU #Phoenix #law #lawyer #help #police #intervention #suns #workshops #drinking #prison #DWI #drugs #vaping #shoplifting https://t.co/rE720jj0TB",teenlawschool,2019-08-07 18:38:01+00:00
1080,1159171700883410946,"🚫Don't buy this junk in the Gas Stations and Vape shops or even the Healthfood stores before checking your labels!! 
💦Ingredients matter and how it is made also matters! 👩‍🌾

📜If they don't have Lab Reports showing… https://t.co/ql5ddoTLJF",SherriButler714,2019-08-07 18:37:24+00:00
1081,1159171657744957441,"Following public consultation and approval from both regional and municipal councils, an updated Smoke and Vape-Free Outdoor Spaces Bylaw is now in effect for @NiagaraRegion. Read the Media Release https://t.co/Zi6uxFdn0e",Welland,2019-08-07 18:37:14+00:00
1082,1159171603248250880,"Ask A #Pediatrician: Youth &amp; Health Effects Of Vaping. @DrGigiChawla Chief of Pediatrics at Children's Minnesota  @childrensmn talks about youth and vaping. #parenting #publichealth 
https://t.co/ICBH0GgfGN",SmokeFreeLife,2019-08-07 18:37:01+00:00
1083,1159171599062278145,"UBLO - Premium Nicotine Nic Shot - High VG 100% 10ml Bottle  15mg &amp; 18mg
Build your own vape 

https://t.co/92hPalHXFJ

#vape #vaping #vapelife #vapefam #vapeshop #shortfill #nicshot #JBRT18VAPE #ATSOCIALMEDIA #firsttmaster #nicshots https://t.co/RjHKpCFbGL",sedgepaul,2019-08-07 18:37:00+00:00
1084,1159171576014626816,someone told me that one juul pod is the same as smoking 20 cigarettes. so basically there’s no point. so basically you’re retarded.,saulmedicated,2019-08-07 18:36:54+00:00
1085,1159171461338284032,Can't wait to see what the world will be like in 20 years when all the locals drop like flies from juuling,geminisugardoll,2019-08-07 18:36:27+00:00
1086,1159171411782656000,Okay I’m officially quitting the juul. Back on my Wellbutrin prescription apparently that might help. Replace one drug with another lol but..NO MORE BEING MEAN TO MY LUNGS!,sarahhrich,2019-08-07 18:36:15+00:00
1087,1159171270501683207,"Anyone else feeling like a vape guinea pig?

We have 30+ years of anecdata on daily smokers of high-potency cannabis. We have like maybe 2 or 3 years on vape oil. Not enough time to see effects on lungs and rest of body.

Feeling a little freaked out right now",gut_tungus,2019-08-07 18:35:41+00:00
1088,1159171212314062853,Lmao Jkjk but that vape and Juul shit so cringe to me like what do you gain???,watermelonxhead,2019-08-07 18:35:28+00:00
1089,1159171163341447170,"Right.  New story from click-bait media.  But there are 10 MILLION ADULT vapers in the US.  Assume 1.2% of them have epilepsy.  Stress, alcohol and even Chantix can cause seizures.  It is a certainty that ANY group of 10m people will have some seizures...
https://t.co/nhP8K4z4L4 https://t.co/xKPADe1Kr8",ChaunceyGardner,2019-08-07 18:35:16+00:00
1090,1159171112514625538,New Vaping SMPO Pod 2pcs/Pack https://t.co/nOsUdK3KL4 https://t.co/CbE4BjelFx,VapingAve40,2019-08-07 18:35:04+00:00
1091,1159171109071335426,There are a lot of new ways to smoke. Will vaping damage your walls or can you open up your tenant pool? https://t.co/Ly7xVPdhs1,ApplyConnect,2019-08-07 18:35:03+00:00
1092,1159171107930423296,"Juul's new tracking device collects sensitive user information such as phone numbers, dates of birth, national ID numbers and vaping intake.
 
This personal data shouldn’t be in the hands of the company that caused the youth e-cig epidemic. https://t.co/HfmsFAOwGO",TobaccoFreeKids,2019-08-07 18:35:03+00:00
1093,1159171105950535680,"has just added ""Troll Drip Top Cap - Black"" to https://t.co/WciBugmQpC #vaping #ecigarette #ecigs #vape",vaporfox,2019-08-07 18:35:02+00:00
1094,1159171093934018560,"According to an excerpt of the a research performed at Icelandic Elf School theatre office, historians belive that military dolphins may unleash Juul pods.",MadeUpShitBot,2019-08-07 18:34:59+00:00
1095,1159171084715024384,Dont bring yo vape/Juul shit around me stop being a pussy and smoke a blunt,watermelonxhead,2019-08-07 18:34:57+00:00
1096,1159171069682626560,🗣PUT THE VAPE PENS IN THE GABAGE WHERE THEY BELONG https://t.co/sOaI84YNrC,JaDollar,2019-08-07 18:34:54+00:00
1097,1159171042738393088,//my vape broke 😣,SouthernSassyRP,2019-08-07 18:34:47+00:00
1098,1159171040410517504,"I just found my Juul , that I lost a month ago. So now I have two. #AnxietyParty",RahulPrajaTho,2019-08-07 18:34:47+00:00
1099,1159171034030989314,"Made myself a coffee, got out my big boy headphones, and vape for the head. 

I’m ready to listen to the new #Tool single “Fear Inoculum”

https://t.co/KUDhXriRF9 https://t.co/Ny4SLQJtYL",DewyADramherd,2019-08-07 18:34:45+00:00
1100,1159170988791218177,"Minotaur Curses Strip Club, Vapes Best Friend with Flaming Cheetos",FloridaMyth,2019-08-07 18:34:34+00:00
1101,1159170966208954369,"Credit to vienna_vapeteam : [werbung / Markenerkennung]
[Advertising / Brand recognition]
__________

S U P R E M E
__________

Brand: swag.cotton 
#werbung #vapenation #smokshow #vapegermany #vapetricks #vape… https://t.co/UCqHwyVeUF",JaypFukushima,2019-08-07 18:34:29+00:00
1102,1159170951545851910,FDA investigating 127 reports of seizures after vaping https://t.co/EIOOw3KuAS,mortgageconsult,2019-08-07 18:34:25+00:00
1103,1159170883832832001,"Rollin it today. Vape tank keeps overheating probly cus of how hot its been lately.

Been lookin for a reason to just get a pod anyway so here we go.",DaCandyDandy,2019-08-07 18:34:09+00:00
1104,1159170849011916805,My dad was real confused when he found an eyelash &amp; juul pod in our fridge &amp; honestly so am I,haley_copeland,2019-08-07 18:34:01+00:00
1105,1159170835464118272,Supreme gunna collab w JUUL and everybody named Tristan is gunna lose their fucking minds,ih8bobby,2019-08-07 18:33:58+00:00
1106,1159170825968332802,FDA investigating 127 reports of seizures after vaping https://t.co/vkSoKx0wpE #WednesdayWisdom #WednesdayThoughts #WednesdayMotivation,ItIzDanaDane,2019-08-07 18:33:55+00:00
1107,1159170807706324992,"Maybe just maybe, juuls are mango flavoured BECAUSE ADULTS ARE JUST AS CHILDISH AS US. Doesn’t mean you can get a nicotine addiction because you think it’s cool.",HolcombCaley,2019-08-07 18:33:51+00:00
1108,1159170507977060359,I just hit my juul and that bitch hit back,luisbravo__,2019-08-07 18:32:40+00:00
1109,1159170413747818496,"Arizona Beverage reaches a licensing deal with U.S. cannabis company Dixie Brands for a new line of gummies, vape pens and drinks  https://t.co/tYDc8BIY3r via @WSJ",1heathermack,2019-08-07 18:32:17+00:00
1110,1159170209980264451,lost my vape :-(,kcalslut,2019-08-07 18:31:29+00:00
1111,1159169995139624960,"Share some #WednesdayWisdom with the #VapeFam

Any vapers who build RDAs/RDTAs share a tip to beginners or those who are thinking abut starting that you wish you had heard when you first began.

https://t.co/9D58GulDTP #vapelife #vaping #vapingsaveslives #vapeshop https://t.co/grUGpi0yTL",EightVape,2019-08-07 18:30:37+00:00
1112,1159169990651785218,"While overall pot use by teens has dropped since legalization, eating, vaping, and dabbing are all on the rise by those who do.  https://t.co/Z0uKv3SeFB",HIGH_TIMES_Mag,2019-08-07 18:30:36+00:00
1113,1159169959756521473,"y’all need to stop smoking them fake ass carts, especially dank vapes lmao.",LifeOfLeRon,2019-08-07 18:30:29+00:00
1114,1159169942618550272,Great #vaping deals at https://t.co/id1ky4PIri and here's 10% off those deals with exclusive coupon code vapingtruth. #vapingtruth,thevapegoods,2019-08-07 18:30:25+00:00
1115,1159169883525079040,Congressional hearing on vaping ignores that most public health experts acknowledge vaping is safer than smoking and is effective at helping smokers quit. Instead focus the on absurd scare stories. https://t.co/PyowII0ZdN via @reason,reasonpolicy,2019-08-07 18:30:11+00:00
1116,1159169839274983426,"The laws around taking smoking and vaping breaks at work, explained https://t.co/lrkFNPA0Ki",theipaper,2019-08-07 18:30:00+00:00
1117,1159169830173306880,FDA investigating 127 reports of seizures after vaping @CNBC  https://t.co/yzcGUdkU3v,zonnchang,2019-08-07 18:29:58+00:00
1118,1159169731171143680,"Teens, stop vaping, stop smoking, stop drinking

If you truly want to rebel, set fire to a goverment building or a major corporate hq",mrjarnottman,2019-08-07 18:29:34+00:00
1119,1159169719926022145,"As your kids prepare to go back to school, now is a good time to talk to them about the dangers of vaping. But first, do you know what vaping devices look like? 

Click below to see the products on the market. #vapingdevices #dontvape

https://t.co/VR4YQEBwDB",PartnershipCC1,2019-08-07 18:29:32+00:00
1120,1159169640418988032,Vapes are bad for you. Smoke Glade Plug-Ins like a real man.,bclienesch,2019-08-07 18:29:13+00:00
1121,1159169619405336577,State briefs: Vaping ban begins at West Virginia University - Hampshire Review https://t.co/JBXPb1GcIt,OILRagz,2019-08-07 18:29:08+00:00
1122,1159169539202043910,who’s juul is that😭😭😭😭💀 https://t.co/HDEBBQTYn7,pnkIisa,2019-08-07 18:28:49+00:00
1123,1159169476388184064,So if I’ve smoked from a hookah before does that mean I’ve technically vaped,oceanjvn,2019-08-07 18:28:34+00:00
1124,1159169465491308544,FDA investigating 127 reports of seizures after vaping @CNBC  https://t.co/x5ZDrECgFA,jeannefisher17,2019-08-07 18:28:31+00:00
1125,1159169454535663616,"Vaffle APP, Born for Vapers! Features: Vape Friend, Vape Lifestyle, Vape Tool, Vape Challenge, Vape Giveaway! https://t.co/yTQBhmgvJL https://t.co/JIBDvDPuO2",langkahiman,2019-08-07 18:28:28+00:00
1126,1159169376970563585,"FDA investigating if vaping causing seizures
#FDA #vape #vaping 
https://t.co/6PsT9eKR0B",bahabusiness,2019-08-07 18:28:10+00:00
1127,1159169334020734976,"Ublo Numbers Premium E Liquid Shortfills 50ml and 100m 10 Fantastic flavours

https://t.co/ZR8huW8CQa

#ublonumbers #vape #vapepen #vapeshop #vapestore #ecig #ejuice #vaping #vapelife #vapejuice #jbrt18vape #atsocailmedia #ublo #shortfill https://t.co/ipVrTHAU1v",ublo_uk,2019-08-07 18:28:00+00:00
1128,1159169331323912192,FDA investigating 127 reports of seizures after vaping @CNBC  https://t.co/AXlhc5tn9w,Flipper51John,2019-08-07 18:27:59+00:00
1129,1159169294489415680,Single coil? Dual coil? Or triple coil? 🤔 Doesnt matter! Hellvape and Mike Vapes made sure that the Rebirth RDA could accommodate them all! Specifically designed to correct the Iconic RDA's leakage and airflow… https://t.co/iLYbsfxw6T,alldayvapejax,2019-08-07 18:27:50+00:00
1130,1159169268673630215,"You can now make health claims in some vaping ads, but they have to be verified *per vaping product* making it completely uneconomic to do so. 

If we want to educate smokers about vaping’s relative safety, we need a list of approved health statements for the whole category!",DanielPryorr,2019-08-07 18:27:44+00:00
1131,1159169218731888640,"Arizona Beverage reaches a licensing deal with U.S. cannabis company Dixie Brands for a new line of gummies, vape pens and drinks  https://t.co/0F9icOJIJQ via @WSJ",Vedanth,2019-08-07 18:27:32+00:00
1132,1159169215649210370,"PH Pipeline 3 interns talking about the vaping epidemic among their peers. In their words, “once you vape, there’s no escape! #publichealth #tobacco https://t.co/7GWnZ6T61g",elaineweigelt,2019-08-07 18:27:31+00:00
1133,1159168946513338368,I love this vape company! Check out their amazing e-liquid. They have the best vapes. Amazing flavors. #CaliSteam #DripVapeRepeat #CaliSteamEliquid https://t.co/ErXafQ4dCG,AmandaLynn1207,2019-08-07 18:26:27+00:00
1134,1159168809686536192,"Arizona Green Tea is getting in the cannabis industry now. They will be making marijuana infused drinks, vapes and gummies. We are living in different times y’all.",MaxitoElMaje,2019-08-07 18:25:55+00:00
1135,1159168741923524609,FDA investigating 127 reports of seizures after vaping – NEWPAPER24 https://t.co/xGMs0Qa4xK https://t.co/7s0RTw4htW,newpaper24,2019-08-07 18:25:39+00:00
1136,1159168725255409664,Bitch if they ask me one more time to show ID for some juul pods I’m cussing them out,JessieMascii,2019-08-07 18:25:35+00:00
1137,1159168630455750656,Compounds in 'vape juice' could be damaging to the lungs https://t.co/2gmsjff314,Summersfirm,2019-08-07 18:25:12+00:00
1138,1159168590416941056,Got banned from GroupMe for posting “inappropriate content”. Have since moved all group related communication to Slack but feel another ban may be imminent. Already had 3 vaping memes censored 🤬,TheTDFactory,2019-08-07 18:25:02+00:00
1139,1159168490248396801,Who tryna match? Just got a brand new Juul pod,balmainbadass_,2019-08-07 18:24:39+00:00
1140,1159168315454980096,They share that juul btw https://t.co/X4ZKLzSBCU,whatsaftershave,2019-08-07 18:23:57+00:00
1141,1159168305262989312,"Excellent customer service from HI, quick service all the way across the Pacific ocean, glad I found this vape shop, outstanding.",MikeMcn77343690,2019-08-07 18:23:54+00:00
1142,1159168299416129538,Any water-type Pokemon can be vaped.,iamtherog,2019-08-07 18:23:53+00:00
1143,1159168245452201986,That first hit when you change that juul pod &gt;&gt;&gt;&gt;&gt;&gt;,_laybae,2019-08-07 18:23:40+00:00
1144,1159168122450059265,'We're not playing around': City students could be expelled for vaping under updated policy https://t.co/E9QCXwi00s via @newsleadernow,moniquecalello,2019-08-07 18:23:11+00:00
1145,1159168119316865024,I really started vaping .... I’m about to get lung cancer but yolo lil bitch,wheresmyglock,2019-08-07 18:23:10+00:00
1146,1159168077256204288,"""As with all prohibitions, an ill-conceived flavor ban will come at a cost of violence, an influx of dangerous substitutes, and a strain on law enforcement"" https://t.co/bG86zr8jLz @JessDKelley @CarrieLWade @JHaggrid #CJreform #vape #vaping #ecigs #mapoli",RSI,2019-08-07 18:23:00+00:00
1147,1159168051088019457,"Did San Francisco genuinely think that a #vaping BAN wouldn't jump start a vaping black market in the city?  The youths can still get vapes, only now it's wholey un-regulated and dangerous black market counterfeit products.  WIN!!",GrimmGreen,2019-08-07 18:22:54+00:00
1148,1159168007811284992,Altria may have wasted a lot of money on Juul https://t.co/H4tPzSvw1v,TickerHistory,2019-08-07 18:22:44+00:00
1149,1159168001809272832,FDA investigating 127 reports of seizures after vaping https://t.co/5EdcGK9D3D,tellittoal,2019-08-07 18:22:42+00:00
1150,1159167988060364811,Yeah!!! #vapeo #vapeadores #salud #podcasts #eliquids #podcasting #youtube #revisiones #información #sabores #estudios #nicotina #ecig #seguridad #vape #opinión #vapertricks #vaporizadores #vapers https://t.co/gXxWwCRaGU,suave_elaroma,2019-08-07 18:22:39+00:00
1151,1159167898302238720,"i was 

                    a joint

but he only 

                    smoked juuls ~

- Rupi Kaur",TVNYX,2019-08-07 18:22:17+00:00
1152,1159167806669250561,"Maybe not all regulations or fed agencies are just bad, job-killers?  FDA investigating more 127 reports of seizures after vaping - https://t.co/0g78d7Rs4j",tunaquarter,2019-08-07 18:21:56+00:00
1153,1159167735177318407,Check out affordable Vape Products here! https://t.co/CARxvvtQId,MikeMcn77343690,2019-08-07 18:21:39+00:00
1154,1159167647344463872,I’m going back to cigs after summer ends and maybe even sooner. I dont trust the juul like at all,dgnro_,2019-08-07 18:21:18+00:00
1155,1159167610665222144,FDA investigating 127 reports of seizures after vaping @CNBC  https://t.co/C1UUg7tphQ,larrymcniel,2019-08-07 18:21:09+00:00
1156,1159167591946043393,"Vaffle APP, Born for Vapers! Features: Vape Friend, Vape Lifestyle, Vape Tool, Vape Challenge, Vape Giveaway! https://t.co/3KFIpH8DAy https://t.co/3Cs8i2kyDa",cdOZK9F8VMNDCaL,2019-08-07 18:21:04+00:00
1157,1159167473796538368,That person left handed though yeah rosie juuls https://t.co/GeJSM1kdBU,whatsaftershave,2019-08-07 18:20:36+00:00
1158,1159167465630425093,"My new baby.... should I name it?
FRENZY POD KIT BY geekvapetech 
🚨😱🇨🇷
#vaping #vape #vapelife #vapefam #vapenation #vapeporn #vapestagram #vapeon #vapecommunity #vapor #vapers #vaper #vapelyfe #instavape #eliquid… https://t.co/CBtmDj5oxU",eiguillenv,2019-08-07 18:20:34+00:00
1159,1159167435674718209,Vaping. Just say no. https://t.co/SXUFzuKYy3 via @CNBC,JohndMeyer,2019-08-07 18:20:27+00:00
1160,1159167364107317249,I'm not easily persuaded to try new things as these Millennials do. IE vape Ie Drugs,So_New_York,2019-08-07 18:20:10+00:00
1161,1159167344221966336,I drank white claws and juuled before they were popular so theres that. ✌🏼,Danica55Dani,2019-08-07 18:20:05+00:00
1162,1159167258326970368,juuls are flavored cigs. they’ve been tryna tell y’all that for a while,thankyousolape,2019-08-07 18:19:45+00:00
1163,1159167244733206529,Neon Genesis Which One Vapes?,MBMBanime,2019-08-07 18:19:42+00:00
1164,1159167234289176576,does anyone wanna come over and bring me juul pods and coffee and hang out while I work on school stuff,jimwhxreson,2019-08-07 18:19:39+00:00
1165,1159167073597218816,"Oh golly, you mean it may not be safe after all?

Who could have seen this coming?

FDA investigating more 127 reports of seizures after vaping - https://t.co/JfSHrkgO01",subsalr,2019-08-07 18:19:01+00:00
1166,1159166961139486720,"A Supreme Juul would completely tear the market up!!! Everyone from hypebeasts, little kids, and wanna be cool moms, would have one. Nicotine addiction for everyone in an even cooler way!!!",filip_siwecki,2019-08-07 18:18:34+00:00
1167,1159166891774160896,Got a juul bussdown 💎💨,AnalogJuul,2019-08-07 18:18:17+00:00
1168,1159166887198187520,"al u VAPE Lovers out There  &lt;a href=""https://t.co/TVMYSpOTjW... https://t.co/vhfEObzvnQ via @HotStocks_NYC",HotStocks_NYC,2019-08-07 18:18:16+00:00
1169,1159166809465085955,FDA investigating 127 reports of seizures after vaping https://t.co/sQcG5ht40I,KevinJona4,2019-08-07 18:17:58+00:00
1170,1159166802229964805,"Considering how potent these products are, it's not surprising. 
Esp in young kids. 

A Juul pod has the same amt of nicotine as a pack of cigarettes and it's not too hard to get through one in a night. https://t.co/0NLkywwCsQ",bluser12,2019-08-07 18:17:56+00:00
1171,1159166793086169088,FDA investigating reports of seizures after vaping https://t.co/D2WFt7unTw,tpgcats,2019-08-07 18:17:54+00:00
1172,1159166791760744449,We were just starting to tackle JUULing in youth and then Galar Wheezing had to show up 😞 https://t.co/dhjJrmsGj5,_joonpark,2019-08-07 18:17:54+00:00
1173,1159166790481485824,niggas who juul probably smell their own farts too,gleekonikk,2019-08-07 18:17:53+00:00
1174,1159166757418020867,trying to implant a false memory of me catching a foul ball and everyone cheering at the baseball game into my girlfriend’s head. I need to replace the one where the stadium security caught me vaping and my girlfriend told me to stop so i accused her of siding with “the pigs”,RyanCiecwisz,2019-08-07 18:17:45+00:00
1175,1159166624911515648,"Latest issue of @vapouround features a ""Vape Debate"" on page 54 around @CMO_England's desire for vaping to be banned everywhere, I respectfully respond that “it’s nonsense, I think vaping should be allowed in many more places than it is now” https://t.co/jBOR644c7u https://t.co/exLK0P8x8m",NannyFreeState,2019-08-07 18:17:14+00:00
1176,1159166532020314112,FDA investigating 127 reports of seizures after vaping https://t.co/XK7ut7rRqj via CNBC #news #CNBC,JacekWierzbicki,2019-08-07 18:16:52+00:00
1177,1159166514345521154,"The FDA is investigating 127 cases of people suffering from seizures after vaping. 
https://t.co/eA1xWbrgh4 #health #saftey #studysneeded #nicotine",MichaelNeedlema,2019-08-07 18:16:47+00:00
1178,1159166501510963201,FDA investigating 127 reports of seizures after vaping https://t.co/xSWfxCIW4i,SharronDark,2019-08-07 18:16:44+00:00
1179,1159166461061074946,FDA investigating 127 reports of seizures after vaping https://t.co/FnGEPyoz23,chirohill,2019-08-07 18:16:35+00:00
1180,1159166350876708866,"ALERT RT 
FDA investigating more 127 reports of seizures after vaping - https://t.co/kWAP9LOYa9",mortgageconsult,2019-08-07 18:16:08+00:00
1181,1159166334766202885,Lol when teenagers hit vape pens they’re like “bettt broh u ripped a full blinker”,DREWKKAKE,2019-08-07 18:16:05+00:00
1182,1159166302466072576,I WANT ALL THE SMOKE LIKE A JUUL,301xBhris,2019-08-07 18:15:57+00:00
1183,1159166261500219393,my friends trying to buy me vape juice pray she doesnt get carded🙏🙏🙏,BaybeeJayce,2019-08-07 18:15:47+00:00
1184,1159166236007247875,FDA investigating more than 127 reports of seizures after vaping https://t.co/3Ik7N4T0mT,getupradiomedia,2019-08-07 18:15:41+00:00
1185,1159166181074358272,FDA investigating 127 reports of seizures after vaping @CNBC  https://t.co/Cw9ItXvfwy,wlester66,2019-08-07 18:15:28+00:00
1186,1159166166754947072,I just wanna know who even buys dank VAPES 😭💀,THCRISPY,2019-08-07 18:15:25+00:00
1187,1159166151970172928,"YOU’RE INVITED! Join us for VTA’s 4th Annual Vape &amp; the FDA 4 Conference in Washington D.C., September 16-18. The three-day event will provide practical information on how our industry and your company will survive and thrive. REGISTER HERE: https://t.co/gJBgiCRHS6 https://t.co/gnmDzCCDl4",VaporTechAssoc,2019-08-07 18:15:21+00:00
1188,1159166138028367873,New: 9voltvape e-liquid from the makers of Head Candy Review!   https://t.co/X1uZkafnZp #vapeon #vapefam #Ecig #VapeCommunity #VapingTrain,Vaping_Train,2019-08-07 18:15:18+00:00
1189,1159166073872109569,New Vaping Voopoo Drag 157W Box Mod  https://t.co/lQpZuAHWYo https://t.co/JIUcvIrToS,VapingAve40,2019-08-07 18:15:02+00:00
1190,1159166062547677189,"Keyto is part of a wave of so-called digital wellness services that have proliferated in recent years. They claim their Juul can tell you how much fat you’re burning.

And no one is regulating them. Of course, that’s no accident. https://t.co/LhsFWdDpMN (via @ozm)",elemental,2019-08-07 18:15:00+00:00
1191,1159166021846130688,FDA investigating 127 reports of seizures after vaping https://t.co/ClCqBO6oIP,OriginalPING,2019-08-07 18:14:50+00:00
