,TweetID,TweetContent,TweeterUsername,TweetDatetime
0,1462571376951238657,"Give me the strength to quit vaping, this shit is stupid",AlyssaaHamblin,2021-11-21 23:59:24+00:00
1,1462571208889753613,Td garden took my fucking vape wtf,jbshitposts,2021-11-21 23:58:44+00:00
2,1462570700632432643,"Urge Congress to reject a tax on safer nicotine products like vaping, snus, and smokeless tobacco that would be the same as the tax on cigarettes, the most harmful tobacco product. https://t.co/GhcgaY60WM",DGlassel,2021-11-21 23:56:42+00:00
3,1462570651412172805,i can’t believe i finally transitioned from vapes to cigarettes (aka recently found a place where they dont ask for ID lol),beauspo,2021-11-21 23:56:31+00:00
4,1462570471744884741,I keep trying to hit the pen in my hand like a vape,3mptybed,2021-11-21 23:55:48+00:00
5,1462570389469646854,My vape uses she/it pronouns,pixiekillz,2021-11-21 23:55:28+00:00
6,1462570315842826244,Noah wants me 2 name my vape what should I name it,pixiekillz,2021-11-21 23:55:11+00:00
7,1462569598625193986,I stopped smoking vapes 2 days ago,jjennnifurrr,2021-11-21 23:52:20+00:00
8,1462569565406257164,"Warning - Vaping is an age restricted product. You must be 18 or over to use this product.

Hotcakes 100ml - £12.99 or any 2 for £22

Buy Now!

https://t.co/m6jBHkZW2B https://t.co/IKlZX4HgXv",Washington_vape,2021-11-21 23:52:12+00:00
9,1462569499744374789,"took the great minds and the vapers, and a pocketful of seed, it's time for us to leave",solarpowerbott,2021-11-21 23:51:56+00:00
10,1462569405351669761,"i should clarify i mean vaping the flower, not that weird weed vape fluid or whatever the fuck

that shit probably gives you botulism or something https://t.co/YwMMXHNKmW",zoomerbread,2021-11-21 23:51:34+00:00
11,1462569199621058565,"im still going to call vaping weed ""smoking a bowl"" despite the absence of smoke

because ""vaping a bowl"" makes me sound like an even bigger virgin",zoomerbread,2021-11-21 23:50:45+00:00
12,1462569197259542529,i watched stage 0 right after i woke up and i didn't know it was a whistle until i saw a tweet mentioning it was a whistle..... i believed it was a vape https://t.co/v2q2cl2d9c,jenjaemrkv,2021-11-21 23:50:44+00:00
13,1462569069752852486,#fire #tree #shop #smoke #vape #goodies #lighters #torches #pipes #rigs #dabs #mods #ejuice #cbd #cannabis #herbal #natural #vapelife #smokelife #joints #blunts #cigars #tobacco #herbs #vaporizer #cig GH Open Flame Creative Watch Lighter https://t.co/Li97WNzo9F,FireTreeShop,2021-11-21 23:50:14+00:00
14,1462569040854102021,Yall be hitting them vapes like blunts mid convo and mfs be blowing strawberry cheesecake in my face like relax 😭😭,59problem,2021-11-21 23:50:07+00:00
15,1462568758699077635,vape crackle ASMR~ 10 HOURS,wateryhotcocoa,2021-11-21 23:48:59+00:00
16,1462568692953141253,Nicotine gum low key kinda slaps and is actually just much nicer than smoking/vaping. Day 2 of attempting quitting again. Not making the mistake of quitting gum after a month and a half again.,FlowerCreatures,2021-11-21 23:48:44+00:00
17,1462568512094826499,The Houston Rockets Chris Paul had  to go to the bathroom during the game so he hit his juul.,Rocketsfunfacts,2021-11-21 23:48:01+00:00
18,1462568421145649160,My vape died the struggle is real,Intellektt,2021-11-21 23:47:39+00:00
19,1462568088348639241,Cleaned my entire room and bathroom today and god rewards me by making me lose my vape,lov333bug,2021-11-21 23:46:20+00:00
20,1462567880105644034,How 2 get vape stank out of room quickly,pixiekillz,2021-11-21 23:45:30+00:00
21,1462567090842447873,"Just posted a photo @ Queens, New York https://t.co/H2msm9BIoV",vape_nation411,2021-11-21 23:42:22+00:00
22,1462567000866054144,This dude is quiet now. And enjoying a very sad vape. https://t.co/sjcmZIu4iu,ClintFromOhio,2021-11-21 23:42:00+00:00
23,1462566999708647426,fruit candy flavored vapes to resist sugar cravings&gt;&gt;&gt;&gt;&gt;,starvingbellaa,2021-11-21 23:42:00+00:00
24,1462566907958104072,This song has the same production quality and aesthetics of that one Truth/.org anti-vape metal song. The entire thing feels more like an ironic take on a songs that diss these subjects than a genuine song about them. https://t.co/EKEzPUSj11,LemonSnuff,2021-11-21 23:41:38+00:00
25,1462565653957783555,Did I REALLY leave my vape juice in my desk at work... I hate myself sometimes,_justleia,2021-11-21 23:36:39+00:00
26,1462565581220196357,Stuff | Responsible investors take stand against vaping - https://t.co/22oa1qmtw0,NicotineSP,2021-11-21 23:36:22+00:00
27,1462565459715399685,My vape has a bed https://t.co/2CbAwV0XKT,pixiekillz,2021-11-21 23:35:53+00:00
28,1462564990888853508,"WE GET IT, YOU VAPE!",Laslow_Bot,2021-11-21 23:34:01+00:00
29,1462564825549221894,this menthol juul pod is scratching my brain so good rn  https://t.co/x84oG3GJGn,ovaloceans,2021-11-21 23:33:22+00:00
30,1462564633269895170,"Hatori: Pass the Juul
Me: Shimazaki stole it
Shimazaki, making smoke rings with his eyes:",minegishibot_,2021-11-21 23:32:36+00:00
31,1462564392323751937,"The Institute of Environmental Science and Research (ESR) analysed 150 vaping products, finding almost all contained ethanol, and more than half had at least 10 per cent more or less nicotine than indicated on packaging.
https://t.co/t8XllGcFch",AsthmaFndation,2021-11-21 23:31:38+00:00
32,1462564000286322689,thank god i have another vape,Baarksdale,2021-11-21 23:30:05+00:00
33,1462563771977719813,do you think renji would vape,Saturn_Kat,2021-11-21 23:29:11+00:00
34,1462563191775547395,they should make vapes for kids,omgpie3,2021-11-21 23:26:52+00:00
35,1462563176525045767,falling asleep cuddling my vape 🗿,discodotdre,2021-11-21 23:26:49+00:00
36,1462562018263638028,this vape ain’t hitting give me crack,tiiibaby,2021-11-21 23:22:12+00:00
37,1462561978577154057,"i LOVE moms
i LOVE the beach
i LOVE electronics
i LOVE the mexican nation
i LOVE inside / outside baseball
i LOVE crowd surfing
i LOVE a warm night by the fire
i LOVE early bollywood films
i LOVE social justice
i LOVE competitive vaping
i LOVE stairs",bilIwurtz,2021-11-21 23:22:03+00:00
38,1462561739728379905,my bf got rainbow lemon drop vape and it’s bringing me back to the fkn 10th grade omf,x_yanderella_x,2021-11-21 23:21:06+00:00
39,1462561480730198023,why... do i see people posting mnh0's ig pictures and saying the safety pin he's holding is a vape,junif_ck,2021-11-21 23:20:04+00:00
40,1462561131487117312,"I need Mfs to sesh w on ft 😭vapes, doe, anything &lt;",bxbyfelitxx,2021-11-21 23:18:41+00:00
41,1462560697003298821,"Meta execs claim #Instagram is just like sugar, and just needs to be used moderately. I think it's more like vaping, with one inhalation likely leading to addiction.

Please read this scathing analysis by @JonHaidt...

https://t.co/2Eo6qqUNWa

#socialmedia",AtomicTango,2021-11-21 23:16:57+00:00
42,1462560591835504650,"Doctor shows how masks handle vape particles. Includes size comparison of various particles 

Discussed on:
The Joe Rogan Experience
Episode 1730 - Cameron Hanes
@CameronHanes @joerogan

#thejrec #thejrecompanion #jre #thejre #joerogan #camhanes https://t.co/TuXFky7UNk",TheJRECompanion,2021-11-21 23:16:32+00:00
43,1462560168391159810,"#EVALI_investigation
#SARSCoV2_timeline 
[Re diagnostic criteria, e-cigarette and vaping associated lung injury, unexplained respiratory illness with systemic inflammation, radiology #pulmpath #FOAMed] https://t.co/6EbNvNUTxM",SixandLaura,2021-11-21 23:14:51+00:00
44,1462559572594348035,I own like 10 vape batteries because I just love buying vape batteries,UsagiCola,2021-11-21 23:12:29+00:00
45,1462559522808078344,PG vs VG eLiquid: Best PG VG Ratio and Its Effect on Vaping via @wotofoofficial https://t.co/1aJ9MrGpKv,FireTreeShop,2021-11-21 23:12:17+00:00
46,1462559472178671626,I feel nauseous so I'll vape and become more nauseous,pixiekillz,2021-11-21 23:12:05+00:00
47,1462559279072829447,I don’t understand how as a mother you can allow someone to smoke vape etc around your child?? Ugh those poor little babies 😢😡,_too_gee,2021-11-21 23:11:19+00:00
48,1462558852180852737,Now available from Potomac Holistics: Verano - Cherry Blossom #vape #rockville #iheartjane #cannabis https://t.co/Ll9GPfUkqS,GetFreshJane,2021-11-21 23:09:38+00:00
49,1462558415822069761,bitches will fall asleep gripping their vapes harder than they mans,iblamerusty,2021-11-21 23:07:54+00:00
50,1462558190088830977,nauuuur babe go break ur juul somewhere else https://t.co/9M9igWa8Ka,lifeaslid,2021-11-21 23:07:00+00:00
51,1462558181981401093,"these anti smoking commercials are dumb who in there right mind would trade a skateboard for a disposable vape. also depression sticks is horrible advertising. lemme know if you want advertising tips i gotcha.
@truthinitiative",z33EDUARDO,2021-11-21 23:06:58+00:00
52,1462557879924563968,what is vaping,Jawsofdcath,2021-11-21 23:05:46+00:00
53,1462557674608996352,wanting to taste ur friends boyfriends smegma is the new juul,anotherloganism,2021-11-21 23:04:57+00:00
54,1462557093425295364,damn my vape died. guess i’ll start being productive.,kirbystfu,2021-11-21 23:02:38+00:00
55,1462557083505553410,"Today I found some of a Molten Core (Sativa high CBD joint) that I mixed in with some Harlequin (lower THC, sativa high CBD flower) for my vape. 

I made sure to dose a little more in caffiene and I am doing things. I can't skip my caffiene, but I only take caffiene once a day.",VividVivisect,2021-11-21 23:02:36+00:00
56,1462557063972737025,NZ study - people with a history of mental illness significantly more likely to smoke or vape. On the up side both groups similarly interested in quitting  @sweeney_shane  https://t.co/xtNX0TCYnL,Dual_Dx_ANZ,2021-11-21 23:02:31+00:00
57,1462556658098393099,fkfhkfhixyxyidtidydhkd this is so funny!!!!!!!! come on guys? cant jimin have a smoke with the prince? the prince vapes!!! https://t.co/hrYaM0CnQP,honaemenu,2021-11-21 23:00:54+00:00
58,1462556309514031111,Does anyone have the link to the vid of dude going into an ez go during a shopping spree and asking for a pack of juuls?,Kamakauzzy,2021-11-21 22:59:31+00:00
59,1462556112209649668,"Mine crashed twice, just walking exploring. Had seven nodes and a vape thing. Sorry I don't have the patience to do it thrice. Please raffle me. @Worldwide_WEB3
#jointhewebb https://t.co/jrDugkUSDM",nullscientist,2021-11-21 22:58:44+00:00
60,1462555951731560452,When you start getting known at a different vape store. Lol almost feel like I’m cheating on my original store 😂,oliveoilog,2021-11-21 22:58:06+00:00
61,1462555851445583873,Eva is Vaping Progressives that donkey punch White people.,CCalbazana,2021-11-21 22:57:42+00:00
62,1462555594137739275,i was a pastel pink vape today for 25…,mylizluv,2021-11-21 22:56:41+00:00
63,1462555519563051010,"a list of things that have no reason being as loud as they are:

• vapes
• vibrators
• men",ineedhera,2021-11-21 22:56:23+00:00
64,1462554992989155329,why do I feel embarrassed everytime I hit the juul during sex :(,ashxtray666,2021-11-21 22:54:17+00:00
65,1462554958004293633,"@anna__vaporesso #Repost @vaporesso_uk
...
💙🤟

#vaporessouk
#vaping
#vaporessozero2
#gary_vaporesso 
#rachel_vaporesso

-
Warning: This product contains nicotine. Nicotine is an addictive chemical.
-
Not for U.S. Market https://t.co/BKlZewRvbA",vapourettesecig,2021-11-21 22:54:09+00:00
66,1462554920842899466,"GPs are busy. We could not agree more! 

GPs are busy + very few are willing to write nicotine prescriptions. 

The prescription model for 500k Aussie vapers is not workable. 

RACGP Media release: https://t.co/h3IYRPrpRq https://t.co/3CCzTCq8Gh",LegaliseVaping,2021-11-21 22:54:00+00:00
67,1462554717976936455,"Vape pens really help ..

https://t.co/zE6yBjoEkM",DyannaKatyKat,2021-11-21 22:53:12+00:00
68,1462554501420748803,also there wasn’t actually a gas leak that one time it was just some bitch with the worst smelling vape in existence beneath my window chuffing that shit back like its air,KOUKA_DESCENT,2021-11-21 22:52:20+00:00
69,1462554308801536003,thought sungchan was hitting a vape https://t.co/cSswcPYMU3,pinksneo,2021-11-21 22:51:34+00:00
70,1462554267731038208,trying to quit vaping please use caution when talking to me you’ve been warned,alexandrakuyyy,2021-11-21 22:51:25+00:00
71,1462553783246864384,the chunti girls at el rey smelled that wonka cart lastnight and immediately asked for a hit? i gave them one but lol i never understood people asking complete strangers for a hit of a vape 🧐do better,thomastoxic_,2021-11-21 22:49:29+00:00
72,1462553717467762695,"It’s my favorite thing when my chosen people are finally ✨completely✨ comfortable with me. I specifically mean using my things without asking first, or going through my cabinets etc. Alex stole my vape off of his dresser while I was hanging out with his sister and was using it",itsatrashfire,2021-11-21 22:49:13+00:00
73,1462553377884229643,"Oh god dissociation is goin hard just PTSD has been triggered I’m legit gonna cry 
✨ keeps screaming about smoking vaping and drinking and he won’t stop now my heart is beating so flipping fast rn I can’t",KLAXX0,2021-11-21 22:47:52+00:00
74,1462553320984252418,thought that was a vape https://t.co/c2aoPeyDyd,doievcr,2021-11-21 22:47:39+00:00
75,1462553164243095554,"I want to try that vape juice: ""Tatar Boxing Day"".",buttsex_subtext,2021-11-21 22:47:01+00:00
76,1462552927973912579,i have to stop calling the comcast center the juul,EZOFUJl,2021-11-21 22:46:05+00:00
77,1462552090342043648,Taxed to Death | Biden Vape Tax Pushes People Back to Smoking | RegWatch https://t.co/ZkjVGdDJak via @RegWatchCanada,MsResJudicata,2021-11-21 22:42:45+00:00
78,1462551928404164615,"So tomorrow starts “look good naked and don’t die December” 

Yea tomorrow’s not the 1st, but I gotta just fucking do it. 

Any of my “swole” followers are more than welcome to check me for 

- No vape/nicotine
- No soda
- No alcohol

Also pray for my wife 🤣 

But frfr. LFG.",0xGlasscloud,2021-11-21 22:42:07+00:00
79,1462551782572412931,"#edibles #cbdoil #prerolls #cannabis  #vapejuice #cannabiscommunity This is a great kit for CBD oil, and CBD wax with having a choice of vaping either. At the time of review I did not have any CBD wax to try live for you. But have ... https://t.co/Xn9MtHIupN #cbdedibles #delta8 https://t.co/2GPK3K8LO7",CBDSmokeShop,2021-11-21 22:41:32+00:00
80,1462551773382590466,"#edibles #cbdoil #prerolls #cannabis  #vapejuice #cannabiscommunity Delta-8 Vape Cartridge Pineapple Express now you can go extra hard with your Delta-8!  With new Chill Plus Delta-8 Vape Cartridges in Pineapple Express, you can https://t.co/lRxxNJtGQb #cbdedibles #delta8 https://t.co/hDC0sSwQuv",CBDSmokeShop,2021-11-21 22:41:30+00:00
81,1462551373317296133,"i want shrooms, weed, vape, alcohol… this is so unlike me but i’m tired or being sober omg",kuromikaIs,2021-11-21 22:39:54+00:00
82,1462551260540907526,"New @Innokintech Giveaway Now Live! -  Enter now for a chance to win the new Innokin MVP kit - https://t.co/Q4FvI7gcrf

#ecigclick #innokin #innokinMVP #vaping #vapegiveaway #vapefam #vape #vapelyfe #giveaway",schief05,2021-11-21 22:39:28+00:00
83,1462551202261053445,Moved up a tier in the vaping world. Bless https://t.co/mE3HDJor6A,superloafcat,2021-11-21 22:39:14+00:00
84,1462551136519573507,"Jus threw my vape out of the window, these commercials really working",DawsonDavis29,2021-11-21 22:38:58+00:00
85,1462551113748471811,"Total ignorance. They want to be violent just to be…They scream and shout, while they vape, smoke, drug, drink. But no vaccine. Just an excuse. No validity. https://t.co/gvG9kKs7Gb",NeNeresister,2021-11-21 22:38:53+00:00
86,1462549843579179011,"Obviously @SpeakerPelosi and @HouseDemocrats don't get that nicotine vaping is a drug war and they're on the wrong side. Taxing vaping at the same rate as cigarettes will kill people, protect cigarette sales, and make a liar of @POTUS

@CortezMasto @SenatorSinema
@Sen_JoeManchin https://t.co/9IN3aB7t6B",whycherrywhy,2021-11-21 22:33:50+00:00
87,1462549217776484355,"i’ve been asking the same “why” question at work for 3 years because i have not liked nor understood the reasoning. 
the most mundane— juuls on the patio 🥲 https://t.co/FdfQSvDkJ1",kitschy_bxtch,2021-11-21 22:31:21+00:00
88,1462548999831896066,Pussy tighter than the grip disposable vapes have on naarm,PaddyRy14383881,2021-11-21 22:30:29+00:00
89,1462548983897726976,Gen Z to their kidnapper: hey can we stop for a vape real quick,lauryn_gibas,2021-11-21 22:30:25+00:00
90,1462548900527497217,Don’t Vape have a Cape,Dont_Vape_Bot,2021-11-21 22:30:05+00:00
91,1462548852381126656,"Should https://t.co/GCZEKxIbFS be sponsoring #ImACeleb?
I mean really?
Can't advertise booze.
Can't market cigarettes or vaping.
Can't legally smoke herb.
But betting is fine.
Really?",alwaysapauled,2021-11-21 22:29:53+00:00
92,1462548053429157888,I’ve been anxious all day for some reason but I will NOT vape about it,VeeHeartrush_ox,2021-11-21 22:26:43+00:00
93,1462546745586372620,ppl saying that the flute looked like a vape https://t.co/LwwAmTreTh,markeysense,2021-11-21 22:21:31+00:00
94,1462546565424455681,Dallas show https://t.co/xdkXqmSZ8H,TWINS_VAPES,2021-11-21 22:20:48+00:00
95,1462546371031015425,How many of y’all vape?????,abelislitXO,2021-11-21 22:20:02+00:00
96,1462546270510202884,"Picked this up during the week from Modking Vapes and forgot to post it.
It's the V200 from IPV and review coming soon. @Matthew50063873 @Pioneer4you https://t.co/Nhe5xQBII0",eatmabb,2021-11-21 22:19:38+00:00
97,1462546031162310659,dream vape rotation https://t.co/Lt6qcwxajQ,valentineIjh,2021-11-21 22:18:41+00:00
98,1462545919585435654,It’s literally a Juul pod with oil in it... so peng,bot_laurel,2021-11-21 22:18:14+00:00
99,1462545755915182088,I thought sungchan was hitting a vape for a second 💀 https://t.co/icGawQOmvw,wreckme5,2021-11-21 22:17:35+00:00
100,1462545680367558659,I feel left his juul at home,ClayBorrellBot,2021-11-21 22:17:17+00:00
101,1462545569402941442,I’m out vaping on the bench at work and this guy walks by and inhales my smoke that I let out and goes haha nice,fvvk_mars,2021-11-21 22:16:51+00:00
102,1462545076052062210,Going to my car on my breaks to fart and vape 🥸,ailynnvenzor,2021-11-21 22:14:53+00:00
103,1462544945865129987,"Current *Teams*:
•Vape Hu Tao w/ Kazuha, Thoma
•Morganna
•International team
•Taser comp
First DPS: Razor
Comfort chara: Hu Tao
Comfort ship: (Y'all won't know)
Play since banner: First Venti banner https://t.co/l23Zx3GpCK",MagatsuRen,2021-11-21 22:14:22+00:00
104,1462544580943892483,"nothing beats nic tbh, only thing that suffers is my bank acct bc vapes n cigs are expensiveeeeeeee 😫😫",kindcals,2021-11-21 22:12:55+00:00
105,1462544524383645702,I’m nothing more than an ape that vapes…,YungDevilJesus,2021-11-21 22:12:42+00:00
106,1462544226055438343,Just another night of smoking my silly little vape so I don’t end my silly little life x,hyperpoppingoff,2021-11-21 22:11:30+00:00
107,1462544128147791877,"OH GUYS 

Quit smoking involuntary?? 

Like I’ve been vaping and like I tried to smoke a cig earlier n it was shit so I was like ?? So I rolled a menthol one to see 
N yeah just 
Its so bad so here I am craving a cigarette but like ?? Cannot smoke",lcvingspring,2021-11-21 22:11:07+00:00
108,1462543884379205632,"Now apply this to people who want to save their lives by quitting smoking through #vaping, you hypocritical a**… https://t.co/A3vkOWiFOO",Tim_Andrews,2021-11-21 22:10:09+00:00
109,1462543836178227205,Now available from Feel State - Kansas City: Illicit - Illicit - Cake N Chem Live Resin - .5g #vape #kansascity #leafly #cannabis https://t.co/Ga5WIFLA0j,GetFreshJane,2021-11-21 22:09:57+00:00
110,1462543481688125446,my fucking vape just died... out here taking Ls left and right bruh that’s so crazy. bonkers if u will,aam13579,2021-11-21 22:08:33+00:00
111,1462543400465580037,i want this watch https://t.co/rhzIQsD8F0,JUUL_user1980,2021-11-21 22:08:14+00:00
112,1462543018565636106,i need juul pods and a lobotomy,halzfkr,2021-11-21 22:06:43+00:00
113,1462542877657944068,where are my kang vape stans,skinnivibez,2021-11-21 22:06:09+00:00
114,1462542556072349706,i got home with 6 chapsticks and a vape and absolutely no idea how any of them got there,FOITG69,2021-11-21 22:04:52+00:00
115,1462542531611136004,Wondering if the mini van in front of me blowing huge vape clouds also has kids in it…,dubbya_c,2021-11-21 22:04:46+00:00
116,1462542435599667200,"Breath of 420 vaping
69th form

Joe",tanjiro_auto,2021-11-21 22:04:24+00:00
117,1462542243445698565,charging my dab vape in my backpack 🎒 with a portable battery pack i forgot to turn the vape battery off and my bag started smoking in the grocery store.  just glad my backpack didnt catch fire!  🤣,1nMyB4G_420,2021-11-21 22:03:38+00:00
118,1462542046615392262,"⚠️people who have had their wisdom teeth removed⚠️

how long did y’all wait before you started smoking/vaping again ?",LethalBron,2021-11-21 22:02:51+00:00
119,1462541366857138185,"Their are many things that kill you. Like vaping, so why do it when you can do less deadly things, like playing minecraft, or even FORTNITE!",Dont_Vape_Bot,2021-11-21 22:00:09+00:00
120,1462541025763684355,Every time I go a few days without a cigarette my vape wants to fuck me,willy13illy,2021-11-21 21:58:47+00:00
121,1462540859732340736,Does vape liquid go off?,valleyguitarist,2021-11-21 21:58:08+00:00
122,1462540838421118980,Our Will Jameson @WillJameson1842 takes the new Dovpo @fsecig Riva 200 mod for a test drive - a simplified more budget friendly Riva? https://t.co/EOBu64xB4q #Dovpo #Riva #Riva200 #Vape #Ecigclick https://t.co/wu8Uamxzuf,EcigClick,2021-11-21 21:58:03+00:00
123,1462540712373669897,the vape squirting in my mouth sometimes,50inmydenim,2021-11-21 21:57:33+00:00
124,1462540444492087296,do u vape ?,hilamikii,2021-11-21 21:56:29+00:00
125,1462540335096152069,cody just bought the best vape i’ve ever tasted,tiredbabyghoul,2021-11-21 21:56:03+00:00
126,1462540258357039104,how many cals are in a vape,globeluvsyou,2021-11-21 21:55:44+00:00
127,1462539999090397190,I just wrote a review on THC-P Vape Cartridge - Fruit Loops https://t.co/2zyn4lT6qK via @yotpo,JuggaloIRCNet,2021-11-21 21:54:43+00:00
128,1462539796446806017,Could Crack Cocaine Vapes Be Harm Reduction Tools of the Future? https://t.co/mQfrgleQni,IRPlawyer,2021-11-21 21:53:54+00:00
129,1462539528263012356,i swear i have to buy more juuls than the pods bc i always lose them,KaylieCarter12,2021-11-21 21:52:50+00:00
130,1462539035126255616,"A TV/movie shorthand for a friendly character to make a villain/betrayal turn used to be to have the protagonist leave the scene, then the ""friendly"" waits, camera stays on them &amp; then he/she lights a cigarette. Scene ends. Expect betrayal in 3 scenes. 

Will this become vaping?",dobbin_joshua,2021-11-21 21:50:53+00:00
131,1462538344005455874,"Cw // weed

Working an 11 hour shift today and my only comfort is knowing my ugly gojo figurine is vaping for me at home https://t.co/7sQO8m1hsk",cryptidplantboy,2021-11-21 21:48:08+00:00
132,1462538309100572673,"New Hanover has been using geofencing, a service in which an app triggers a targeted marketing action (such as a text or social media advertisement) based on one’s location, as part of a new anti-vaping campaign. 

Source https://t.co/9y3OwJSnAv

#VapeNews https://t.co/VgTPlaWhbA",Kingkongvapeuk,2021-11-21 21:48:00+00:00
133,1462538300288339970,helep me the bus will not come,juul_god69,2021-11-21 21:47:58+00:00
134,1462537865137643526,i've been one the only thing i hate. a vaper,CRAFTYNAGGlN,2021-11-21 21:46:14+00:00
135,1462537485490212883,Ai left my vape in Mbuso's car 😭💔,MarvinManele,2021-11-21 21:44:43+00:00
136,1462537386823409670,The Effects Of Nicotine On The Adolescent Brain - Vaping Side Effects. Get the Facts Here. - Tobacco Free CA https://t.co/lEHdbPuxV0,WeTheSisters,2021-11-21 21:44:20+00:00
137,1462537195550822402,Wanna know what's in my vape pipe? Molten nickel. I can feel my lungs burning,botkichiouma,2021-11-21 21:43:34+00:00
138,1462536702581305346,the feminine urge to be the main character and write + vape by urself at a cafe,oddfuckinglaura,2021-11-21 21:41:37+00:00
139,1462536514412457989,"going to start a bar called ""republic of phat cloudz"" where we only serve monster + vodka and play sandstorm 24/7 (vaping is mandatory)",GayMarxx,2021-11-21 21:40:52+00:00
140,1462535757302665217,sometimes I wish I was a vape cloud so I could disappear,agoodsqueeze,2021-11-21 21:37:51+00:00
141,1462535484773740555,Where the fuck did I put my vape pen HHHHHHHHHHH,LoavesOfBergara,2021-11-21 21:36:46+00:00
142,1462534554833629184,mngr vaping in break room call that girl boss moves,uncle__karl,2021-11-21 21:33:05+00:00
143,1462534391582781440,when alex buys me food and I can’t constantly check the status of the order https://t.co/S21h55odJn,omg_juuls,2021-11-21 21:32:26+00:00
144,1462534377125007360,"Tobacco control generals like their military counterparts - still fighting last war. It’s a new war now where primary aim should be reducing ASAP barriers to tobacco harm reduction eg #vaping, Heated Tobacco Products, snus, nicotine pouches @VaperNt @caphraorg @ChaunceyGardner https://t.co/PuFhrykOjm",AlexWodak,2021-11-21 21:32:22+00:00
145,1462534351124631560,the feminine urge to juul in the bathroom,kymrgurl,2021-11-21 21:32:16+00:00
146,1462534350101221382,"now they're saying ""juul"" whenever they say ""jewel""",4lung_ebooks,2021-11-21 21:32:16+00:00
147,1462534340412428288,"Thank you!!! We love hearing from our customers. Please leave us a review: https://t.co/XzYpHu0ARS
#GetYourVapeOn #vape #vapelife https://t.co/AKu9iR4ZM0",CanadaVapes,2021-11-21 21:32:13+00:00
