,TweetID,TweetContent,TweeterUsername,TweetDatetime
297,1462502126203150342,"Inhale and enjoy the fresh sweetness of baked apples along with a subtle hint of cinnamon spiciness followed by an exhale of the delicate but rich, flaky pie crust 🤤

👋Ask your local #vape shop for us!
👉Become a #KingKongVapeJuice stockist on https://t.co/rcK8col7P6

#vapeUK https://t.co/k1VMWxHQww",Kingkongvapeuk,2021-11-21 19:24:13+00:00
298,1462502076089610253,i thought they got him vaping for the video https://t.co/mmNWQAXZ3R,vltnsheep,2021-11-21 19:24:01+00:00
299,1462501705321435140,gotta stop smoking vapes a bitch be at work outta breath like I smoke cigarettes 🤣😭,xxMekaylaa,2021-11-21 19:22:33+00:00
300,1462501342090604549,"shame these vapes are worse than cigs, kinda like them",TheGreatJackDan,2021-11-21 19:21:06+00:00
301,1462501200893415428,"Due to The End of The World our Greeley store will close Wednesday Nov. 24th at 4pm and will continue to be closed through Thursday Nov. 25th. We will be back this Friday Nov. 26th with some awesome Black Friday deals!
#vaporcore #vape https://t.co/Fd25HQO7uI",VaporCore,2021-11-21 19:20:32+00:00
302,1462500666467880961,"So many retweets we'll change your juul 1,000 times",McNally_bot,2021-11-21 19:18:25+00:00
303,1462500374758182912,"very impressed with fernways packaging, pen &amp; vape. the pen lights up so many colors i’m in love",ebrittanyc,2021-11-21 19:17:15+00:00
304,1462500286933651456,why would the vape store have a buy one get one sale when i’m in a bad mood,gabby_kelso,2021-11-21 19:16:55+00:00
305,1462500073401733125,vape tae is sexy tae,jjkfIeur,2021-11-21 19:16:04+00:00
306,1462499663420997643,Jealous of his vape cuz it gets to spit in his mouth,httpratboy,2021-11-21 19:14:26+00:00
307,1462498894953295873,"Am the only one who feel this generation is kinda f#cked up, like kids be born racist, bi at 8, vaping at 11 and drug addicts at 14.",cert1_geeza,2021-11-21 19:11:23+00:00
308,1462498631618072576,Best vape juice you have tried? — Cush man grape  https://t.co/S64f3rVpJ9,whit3wine,2021-11-21 19:10:20+00:00
309,1462498462935646208,i just want an off brand car,juul_dad,2021-11-21 19:09:40+00:00
310,1462498179769942018,So I got in trouble for vaping at the Panthers game lol. Said they’re gonna kick me out if I do it again.,Barbadelic,2021-11-21 19:08:32+00:00
311,1462497936248606725,"20% Off Black Friday Sale Now Live
https://t.co/hrhx93Y7wD 🎁
Use Code: BLACKFRIDAY20 at checkout 🛒  #vape #sale #BlackFriday https://t.co/5IR9HZZLIg",TABlites,2021-11-21 19:07:34+00:00
312,1462497849149739012,seated at the kitchen table with my juul my macbook and one (1) drinkable yogurt….this is how i girlboss,goodboygremlin,2021-11-21 19:07:13+00:00
313,1462497629296857095,"🚨Sound the alarms!🚨 VapeGreen's Early Black Friday sale starts tomorrow and kicks into full gear on Friday the 26th. Stay tuned this week for updates on some of our best deals!😱

#vape #vaping #vapegreen #ukvapers #freeshipping #freeukdelivery #blackfriday #blackfriday2021 https://t.co/36a80gqNjA",VapeGreenUK,2021-11-21 19:06:21+00:00
314,1462497330104578048,let me put you on cake monster bars disposable vape in mint flavor gurrrl shit hits HARD!,paislie_rae,2021-11-21 19:05:10+00:00
315,1462497158515466243,"Shinsuke won't stop talking about this ""vaping"" thing...",tsurugibot_en,2021-11-21 19:04:29+00:00
316,1462496959084646402,"Our #vape bars are ONLY #cbd and contain absolutely nothing else except flavor! 100 mg per bar and completely disposable, perfect for on the go #anxiety relief and focus! Will not get you high and can be used as a replacement for smoking! #natural #cbd https://t.co/XiFdMkfx3R",CBDStoreGreeley,2021-11-21 19:03:41+00:00
317,1462496785675345923,"Quick Read: THC-O

Often, #THCO-A oil is diluted and mixed with #delta8 THC or #CBD. This is to reduce its viscosity and allow it to better maintain a clear airflow in conventional battery-powered #vape pens.

#LearnAndTeachOthers™ 👇🏽 https://t.co/HKF9ypvKXC",RobbinsGroupLLC,2021-11-21 19:03:00+00:00
318,1462496650925166599,the highschooler with juul to nicotine addict pipeline,hotgirlsheyah,2021-11-21 19:02:28+00:00
319,1462496462500028417,My wife nurse @GoSemi got me on the right recovery track every morning with some fresh fruit !! And this @PAXvapor aint half bad either. Top quality flower portable vape 👌🏾 https://t.co/0w8vKhHGgx,MrsChelseaMonet,2021-11-21 19:01:43+00:00
320,1462496307122262027,"Flavored #ecigarette #vaping was found to be less harmful to younger people compared with #smoking and may aid in #tobaccocessation, according to new research published in Addiction. https://t.co/GstL5zQXap",HealioPulm,2021-11-21 19:01:06+00:00
321,1462496201060802568,"FDA must stop marketing of vaping products to minors https://t.co/iadZXvm38r
*Curated content by RegWatch",RegWatchCanada,2021-11-21 19:00:40+00:00
322,1462496049923342341,"Have you tried watermelon sugar #Eliquid from Ohm Brew? 🤔

Sweet and refreshing, watermelon sugar is a perfect combination of watermelon and mouth-watering candy.

🗞️ Read and find out more here: https://t.co/NaIv8ldSFd

#Vaping #Eliquids https://t.co/9xOQyO6l10",EvapoHub,2021-11-21 19:00:04+00:00
323,1462496023193047044,Preston can hit the vape pen as a treat,BreakingSadd,2021-11-21 18:59:58+00:00
324,1462495879261302787,I be hitting this vape like I gotta 3.5 in this mf 😭,xQSmoove,2021-11-21 18:59:24+00:00
325,1462495669596393472,I wish I could invent something cool or start some innovative concept or business that just makes me a stupid crazy amount of money so I can afford things like vape pens and healthcare,slut4jazz,2021-11-21 18:58:34+00:00
326,1462495000248434695,"Want cigs, Tesco closed bc it's Sunday. About 1ml of vape sauce left, want to throw stuff around my room",LoveBuzzBaby1,2021-11-21 18:55:54+00:00
327,1462494952148152321,Bought myself a vape 😮‍💨 atleast it's not a pack of butts I guess ??,saddamberr,2021-11-21 18:55:43+00:00
328,1462494932824899591,i’m out of vape juice …,ciggcore,2021-11-21 18:55:38+00:00
329,1462494781888765958,"Shop 3Chi for the best in #Delta8 #CBC #CBD #CBG #CBN #CBT and #THCv

#Edibles #Tinctures #Vapes #Concentrates #Oil and #Isolate

Free Shipping on Orders Over $99

https://t.co/Ag6la2DF57 https://t.co/FPpfDQGZaG",CarverJohns,2021-11-21 18:55:02+00:00
330,1462494765275090949,I’m kinda gonna need a vape if the packers are playing like this and mine is lost. Pretty sure I threw hundreds and hundreds on them last night. Don’t really wanna check,deepseasurfing,2021-11-21 18:54:58+00:00
331,1462494532096958471,Yeah vapers a different breed https://t.co/PwZZiovF7W,nothinbut_ash,2021-11-21 18:54:02+00:00
332,1462493936518193153,tucker carlson is queer pass it on,juul_dad,2021-11-21 18:51:40+00:00
333,1462493868151218184,The actual song that was playing was wheres my juul https://t.co/kwuLfK193z,Glowlo_,2021-11-21 18:51:24+00:00
334,1462493810001391629,We should have unwinding IRL. Tired of these annoying ass kids who take forever in the bathroom. Let's see you vape when your lungs are in some 80 year old diabetic.,Carlylematth1,2021-11-21 18:51:10+00:00
335,1462493769446526977,Round 1 ...vaping outside because it's nice outside https://t.co/EV5znHTNPB,recoilnd,2021-11-21 18:51:01+00:00
336,1462493693340884994,"Vaporcore Greeley's Black Friday Deals! Come by this Friday Nov. 26th for some bangin' once-a-year savings on hardware, accessories, juice, and more!
Must be 21+ 
#vaporcore #vapestore #vapeshop #vape #vapor https://t.co/K2KqPHvtQz",VaporCore,2021-11-21 18:50:42+00:00
337,1462493043332943872,Ugh need to order juul pods again damn I need to chill,xburberrybearx,2021-11-21 18:48:07+00:00
338,1462492828177686532,"why not both?
(zombie vape store revolution) https://t.co/ZYjDaBVTB2",littlegayboots,2021-11-21 18:47:16+00:00
339,1462491987614085126,My cute lil vape 💖 of course babe is photobombing in the background . https://t.co/oDVR1Py0zM,BrownEyes0326,2021-11-21 18:43:56+00:00
340,1462491849138995200,"grandma: why do you have the window open
me, vaping: fresh air",irissilvermist,2021-11-21 18:43:23+00:00
341,1462491296652800003,"Gotta 5K to run in 2 weeks. Just stopped vaping a day ago, I should be good right? 😭",__Kadijah__,2021-11-21 18:41:11+00:00
342,1462491159331287043,hit a vape and almost died lmao,alyssuuwuu_,2021-11-21 18:40:38+00:00
343,1462490971787120640,Yes i did learn conversational Norwegian when i was 14 so i could watch Skam without subtitles through a google drive that got passed around like a 13 year old's vape,immaterialgirlz,2021-11-21 18:39:54+00:00
344,1462490901910065152,Bro my vape is fucking burnt and it taste horrible but like I really can’t handle my emotions right now so-,Eminemstwt,2021-11-21 18:39:37+00:00
345,1462490722456817673,I can’t make this up I just saw someone wearing their vape on a lanyard,apschaver,2021-11-21 18:38:54+00:00
346,1462490434706423809,ugh my vape tastes terrible :( it’s supposed to be orange but it tastes like butter ?????,bberrybbaby,2021-11-21 18:37:46+00:00
347,1462490038592323586,Puffco Peak Pro Review 2021: My #1 Vaporizer https://t.co/bDe6pdiwf0 https://t.co/m6WUArkNL7,revival_vape,2021-11-21 18:36:11+00:00
348,1462489336617009152,hey tepig i vape,oshawott_ebooks,2021-11-21 18:33:24+00:00
349,1462489314991177730,[landwolf vapes],boysclubbot,2021-11-21 18:33:19+00:00
350,1462488592836530176,"Chloé leans over the cafe table and grinds her vape pen into the chunky glass ashtray. Her lips flash red in the noonday sun. “There is nothing you can do,” she says. “The horny has died my dear. I must find another ho.”",FictionBot3000,2021-11-21 18:30:26+00:00
351,1462488502256365573,Seeing what flavour vape comes out with a baseball bat.,Ideas_Bot_au,2021-11-21 18:30:05+00:00
352,1462488431314018305,quitting smoking in the winter just so you can vape inside in the warmth,CRAFTYNAGGlN,2021-11-21 18:29:48+00:00
353,1462488326376759306,"What do professionals and students have to say about vaping? Find out in my final segment of Your Health. 💨🌫

https://t.co/aHdmO62pAi https://t.co/4jcHwBnWlL",josealonzotv,2021-11-21 18:29:23+00:00
354,1462488270705733638,i thought that was a vape... https://t.co/USfF85fF8R,twinkle_tennie,2021-11-21 18:29:10+00:00
355,1462488226694938630,"*growing up with a catholic family*

My mom just tried telling me that my blue raspberry nicotine vape made her car smell like weed lol",Shelbielk,2021-11-21 18:28:59+00:00
356,1462487888256503811,"the brunette stuffs the vape into his back pocket, crossing his arms.

right — maybe he was being a tad bit selfish (naturally).

“yeah — sorry,” the male stuttered out embarrassedly, running his hand through flaxen locks, now actively thinking of tami’s parental circumstances. https://t.co/BiM365KdDi",youfvckingfvck,2021-11-21 18:27:38+00:00
357,1462487699663826952,"sweet mother Mary and Joseph, my little vape pen fell behind my bed, I do not know what I have done to earn this, God gives his hardest battles to his dumbest soldiers",LostWolfling,2021-11-21 18:26:53+00:00
358,1462487345224114180,"“This sounds like a three-vape problem, Watson” - The Next Sherlock Holmes Show",atomcrowley,2021-11-21 18:25:29+00:00
359,1462487311694938113,"Vap’News : 21 novembre 2021
 https://t.co/ylbKR1ZOPP #vape #ecig",FernandDurand3,2021-11-21 18:25:21+00:00
360,1462487274436927492,"Vap’News : 21 novembre 2021 
https://t.co/amFbDyfgA2 #vape #ecig",benoit_durand,2021-11-21 18:25:12+00:00
361,1462487208640888845,Vap’News : 21 novembre 2021 https://t.co/amFbDyfgA2 #vape #ecig,benoit_durand,2021-11-21 18:24:56+00:00
362,1462486939743842304,Only positive thing to come from getting covid is that I’ve been able to stop vaping 🤞🏻,skevon_,2021-11-21 18:23:52+00:00
363,1462486829102288898,AYO SUNGCHAN HITTING THAT VAPE 💨 https://t.co/JUfSui7M7N,sunfIowerdoie,2021-11-21 18:23:26+00:00
364,1462486821758279686,Nothing but respect for the man vaping inside the coffee shop. Can’t knock the subtlety.,MichaelLKatz,2021-11-21 18:23:24+00:00
365,1462486697535549447,I lost my damn vape,meshayy_17,2021-11-21 18:22:55+00:00
366,1462486485484064776,"Facts:  US teen vaping just dropped 62%.  Only 4.1% of high school kids, and 0.4% in middle school, vape 'flavors' frequently (so may actually own &amp; buy products).

Context:  17% binge drink causing 3,500 deaths/year.  12% drink flavored alcohol.  7% smoke pot daily... https://t.co/WvkRBEOkdt",ChaunceyGardner,2021-11-21 18:22:04+00:00
367,1462486380869734406,Me when I started vaping https://t.co/UE3xwLf8Oe,ndngirlmom,2021-11-21 18:21:39+00:00
368,1462486230470377474,"Get voting in the #Ecigclick Vape Awards 2021 - and enter our giveaway - lots of prizes to be won from @Innokintech #Voopoo, @ivgeliquids @uk_vapour @vapeclub and #LostVape !! Enter here #ecigclickawards2021 #Vapeawards #Vape #Vaping https://t.co/fYh622M3TS https://t.co/ztvsglH6k5",EcigClick,2021-11-21 18:21:03+00:00
369,1462485991055413258,Shelock Holmes usando vape,fpguilherme_,2021-11-21 18:20:06+00:00
370,1462485724763242502,"Our Neil ""the newshound"" Humber @FlophouseFlip has sniffed out this weeks vaping headlines including Vaping at work, Flavours help kids quit smoking and more...  https://t.co/JkQNLzqf8k #BackVaping #BackVapingSaveLives #THR #Vape #Ecigclick https://t.co/NGXFarxN3n",EcigClick,2021-11-21 18:19:03+00:00
371,1462485603589791746,i literally don’t know what to do about my nic addiction. it’s gotten so bad i’m constantly tired and feeling so worn down because all i do 24/7 is smoke my vape. i wake up it’s the first thing i grab and i smoke it until i go to bed. i need help but no idea what to do,dr0vealone,2021-11-21 18:18:34+00:00
372,1462485580017594368,i know it’s a whistle but i’m pretending it’s a vape https://t.co/ZNKJPTWiht,jackseunnies,2021-11-21 18:18:28+00:00
373,1462485045915041796,"Worst Sunday ever. I’ve been eating glazed donut holes and drinking beer. Some alien life form has taken over my body. There may have been vape involved not quite sure because now I’m focusing on those the tiny donuts covered in waxy chocolate.
🍩🍩🍩",EaveryMyra,2021-11-21 18:16:21+00:00
374,1462484736874532865,"If I am considered anti vax
Are the people who don't exercise, chain smoke/vape and indulge in McDonald's every day anti 'healthy living'
Or is health only obtained through a needle nowadays?

Sadly we wont ever see the mandates for exercise &amp;consuming your five a day",Heachy_1979,2021-11-21 18:15:07+00:00
375,1462484525611634700,"Adulthood is finding my roommate’s Juul in the chip bag and not telling her about it mostly because I know it’s good for her health and partly because, for comedic reasons, I wanna see where this goes",itstiatweets,2021-11-21 18:14:17+00:00
376,1462484420162727946,Sundays line up from vapers pantry amazing juices and an amazing buisness https://t.co/8DVLRneI3G,southwestvaper,2021-11-21 18:13:52+00:00
377,1462483618417324035,A vapers best friend. Lounge Shorts with pockets.,MissCarey4life,2021-11-21 18:10:40+00:00
378,1462483373797130241,bro i lost my vape again are you FUCKING with me,3rachalesbian,2021-11-21 18:09:42+00:00
379,1462482724921348096,"am I the only one who feels like generation is kinda fucked up, kids born racist, bi at 8, vaping at 11 and drug addicts at 14.",calebwttf,2021-11-21 18:07:07+00:00
380,1462482628217552900,i need a new vape 🥲🥲,gargoylewh0re,2021-11-21 18:06:44+00:00
381,1462482448000839681,anyone looking for a roommate literally anywhere?🙂,omg_juuls,2021-11-21 18:06:01+00:00
382,1462482044231958533,"Whoever stole my vape, ur moms a ho",Rociodarcie_,2021-11-21 18:04:25+00:00
383,1462481910760939528,Vapes don’t find,xandlers_bot,2021-11-21 18:03:53+00:00
384,1462481898035372038,carrying a lil container of fruit in my purse to pull out at smoking areas. fancy a vape? nah fancy a GRAPE?,prettyIegend,2021-11-21 18:03:50+00:00
385,1462481558330216448,Thinking of buying Naked Vape Juice Pick 3 Bundle (180ml)? Read our latest review by Patricia P. https://t.co/toYKedlqhl,WCVapeSupply,2021-11-21 18:02:29+00:00
386,1462481204691755010,"Read the new NHS #EasyRead newsletter. Includes articles about smoking, vaping and lung cancer of information and using the #NHSApp https://t.co/OTKWwYUosR #LearningDisability https://t.co/tBHaSCHpQE",NHSAbility,2021-11-21 18:01:05+00:00
387,1462481202087137286,goinf out with my bestie to get her eyebrow pierced 😈😈,juul_god69,2021-11-21 18:01:04+00:00
388,1462481117613862915,"UPCOMING SALE  Starts at 6pm on 11/25 to 11/26 all smoke shop goods 30% off. 
•
•
ZenBlendz Smokez
📍2814 S. Shepherd Dr. Suite D
Houston,Tx 77098
#ZenblendzSmokez #Houston #Smokeshop #Vapeshop #cbdshop #drypipes #montrosehouston #kratom #vapes #htx #vintageshop https://t.co/S3stdIPCR8",ZenBlendz,2021-11-21 18:00:44+00:00
389,1462481096415793158,"my snitch brother told my mum about my vapes and she’s so dramatic, started crying and all🙄",t0kcals,2021-11-21 18:00:39+00:00
390,1462481007282511878,"Facebooks sigh emoji is doing vape tricks like he's abt to go ""....Adam."" https://t.co/newofwx43E",miggsboson,2021-11-21 18:00:18+00:00
391,1462480856883281926,What Vaping Does to the Body https://t.co/nNgEXuI6YF via @YouTube,RichardVincigu4,2021-11-21 17:59:42+00:00
392,1462480791385034756,Having a vape at a show is like having gum in school,morgvntvylor,2021-11-21 17:59:26+00:00
393,1462480626599276546,Reggy!!!! I love that from u and the knee slide as well https://t.co/FoVGuglQBt,Juuls_WRLD,2021-11-21 17:58:47+00:00
394,1462480544122511365,me vaping mealworms in 2030 https://t.co/32gxQmYmHr,snuskungen,2021-11-21 17:58:27+00:00
395,1462480173270376450,Pretty sure I just tried to take a sip of coffee from my vape pen. At least it wasn't the other way around.,crystalwrites83,2021-11-21 17:56:59+00:00
396,1462480062159196160,Hitting my juul in the bathroom just to feel alive,noelbethany,2021-11-21 17:56:33+00:00
397,1462479742330884106,"*me filling up my vape*
danielle: i’m sorry but this feels illegal",_pcfaith,2021-11-21 17:55:16+00:00
398,1462479518195720194,drink vape juice by the gallon,worst300,2021-11-21 17:54:23+00:00
399,1462479388344205315,"Just had grapes, raw broccoli, a beer and some vape rips for breakfast!!!!",HumbleYungMan69,2021-11-21 17:53:52+00:00
400,1462479304902676483,The Houston Rockets Nene had  to go to the bathroom during the game so he hit his juul.,Rocketsfunfacts,2021-11-21 17:53:32+00:00
401,1462479231355600907,"'Sup Vaperz and Non-Vaperz!

The Vaping Heads x 007 available tomorrow on @objktcom 

Im giving away 1 edition to a winner. To enter - retweet. Raffle in 24 hrs!

#nftart #NFTs #NFTartist #nftcollector #nftcollectors #CleanNFT #tezos #tezosart #tezosnft #cryptoartist #NFTgiveway https://t.co/GbIiTNZaJG",Some1fromspacer,2021-11-21 17:53:14+00:00
402,1462478900366393344,COMP TIME: Diamond Division  https://t.co/n2auYTOVoS,vape_yo,2021-11-21 17:51:56+00:00
403,1462478818959110149,ive quit vaping nicotine!!!!! :)) 🚭🚭🚭🚭🚭🚭,katewright38,2021-11-21 17:51:36+00:00
404,1462478632748830723,"""The writers clearly don't understand the thematic importance of thatch roofs,"" I tweet while furiously vaping and absently picking at the nits in my neckbeard.

#twitteroftime #TheWheelOfTime #WheelOfTime",ookami_nibiki,2021-11-21 17:50:52+00:00
405,1462478275725381636,"In this house we eat it, vape it, smoke it &amp; apply it. We have papers, pipes &amp; bongs. We use grinders or scissors and roll it up. In this house, we believe in weed! Have a great day and Be Kind! 💚 
#carolinescannabis https://t.co/3vonK2KtRY",CarolinesCanna1,2021-11-21 17:49:27+00:00
406,1462478251960545280,"Vape doesn’t make sense to me, le tsuba de power bank",Lmrampedi,2021-11-21 17:49:21+00:00
407,1462478205047250950,They took my vape at soldier field and I’m legit having withdrawals,PowerPackRanger,2021-11-21 17:49:10+00:00
408,1462477852297895949,"This is a joke right? Do these uninformed geniuses understand what they're asking for? What are we teaching the people? This is a effect of the dumbing down generations. This is what's wrong with America, where if communist you wouldn't be allowed to protest. https://t.co/jz2VklXdEf",DOM_FADDA,2021-11-21 17:47:46+00:00
409,1462477497141010433,edtwt start smoking or vaping istg my ed is what made me smoke on a regular basis and whenever i do my appetite literally disappears,kysbby777,2021-11-21 17:46:21+00:00
410,1462477477545222146,vaping is genuinely so stupid,Verymuchmoth,2021-11-21 17:46:16+00:00
411,1462477227782774798,6 Things You Should Know About Vaping CBD Oil by Shane Dwyer via Marijuana &amp; Cannabis News – The 420 Times https://t.co/JVakCXQKD5,RefillMyMeds,2021-11-21 17:45:17+00:00
412,1462477028721147904,"u suicidal? u suicidal? u suicidal?
vape https://t.co/AUkslvFcBU",nightloops,2021-11-21 17:44:29+00:00
413,1462476790174085120,"1:1 THC/CBD Vape tips. 
Natural hemp terpenes 
No filler/carrier oils. 
Filled to 1.2 grams. 
Reputable brand. 

$50 for 1 or $45 for 2 or more! https://t.co/Ftj9pYj2Gu",WillyWonkaHabs,2021-11-21 17:43:32+00:00
414,1462476032783437825,aite frm today imma stop vaping fr 1 week to see if im addicted onot if i aint imma gt a new devicee,tootsskii,2021-11-21 17:40:32+00:00
415,1462475802482774018,apparently vape juice has calories in going to fucking km$ /nsrs,harbingercals,2021-11-21 17:39:37+00:00
416,1462474605080170498,I think Pete Davidson is giving hope to all the vape smokers out there https://t.co/FiXzvyg6Hq,lindsspace,2021-11-21 17:34:51+00:00
417,1462474589687013377,Gen z b like cigarettes are bad then go smoke a quarter lb n vape 4 carts in one sitting,whatevermartjn,2021-11-21 17:34:48+00:00
418,1462473980808507399,"About to drive to the dispensary (for my mom, tyvm) and she picked Annie Tokeley vape cartridges. That's an amazing brand name",CurdVonnegut,2021-11-21 17:32:23+00:00
419,1462473951100112896,thought it was an mfing vape 😭 https://t.co/aDWkbZMn9M,SUHNFL0WR,2021-11-21 17:32:16+00:00
420,1462473567019454471,day 3 of no vaping and i'm miserable https://t.co/AiEwheBGGG,sadcowboykid,2021-11-21 17:30:44+00:00
421,1462473513223262214,Why boys vaping all time Kuch or kr lo,yarshutupp,2021-11-21 17:30:31+00:00
422,1462473408315228163,Why would you fucking vape you bitch,Dont_Vape_Bot,2021-11-21 17:30:06+00:00
423,1462473404133560323,"The VOOPOO Drag X Plus kit pairs perfectly with Ohm Brew's rockin' raspberry sorbet #Eliquid 🙌

The Drag X plus kit comes equipped with the TPP pod tank and has a maximum output of up to 100W

🔍 Get yours in store or online: https://t.co/6ucRJmEHvm

#Vaping #VapeKit #Ecigarette https://t.co/YaJDLE89wH",EvapoHub,2021-11-21 17:30:05+00:00
424,1462472988373266437,"Walking around Daley Plaza with two full garbage bags surounded by canada goose white folk, in a tank top in November ripping hell on my electronic juul nicotine device looking absolutely nutso,,, Vibing....... happy chrismas",DertzCee,2021-11-21 17:28:26+00:00
425,1462472980425027588,i don’t think i’ve lost a debit card or a vape like..at all recently. growth,emy_lou181,2021-11-21 17:28:24+00:00
426,1462472926541008896,I'm vaping so hard rn,BanzaiTakesAnal,2021-11-21 17:28:11+00:00
427,1462472682855882756,"NEW Community Review Features Now Live (FINALLY)!
With great power comes great responsibility, please review your fellow community creators honestly and fairly. Every flavour you have tried so far can be reviewed - just log in to try it for yourself.
#vapereviews #vape #eliquids https://t.co/pjSoiEyDIM",DripperLabs,2021-11-21 17:27:13+00:00
428,1462472430304350212,brendos smp news @CLOWNIVER bought a vape from the shop ™️,myliuryanross,2021-11-21 17:26:13+00:00
429,1462471787099439112,"I DO NOT CARE how broke you are, there is always some type of investment you can make towards your health &amp; self care. Y’all willing to go out every night or drop money on vapes, or buy fast food…..then you clearly aren’t as broke as you’d like to assume :)",alexandra_05111,2021-11-21 17:23:40+00:00
430,1462471563354132480,I know vaping has gone too far because my manager who is married with two kids and has been working at this fucking sub shop for a decade was complaining to me about how expensive juul pods are like bro just smoke some fucking cigs 😭😭,garageooze,2021-11-21 17:22:46+00:00
431,1462471340372283395,not me craving strawberry milk then realizing that’s my vape flavor 😳,gh0stkllz,2021-11-21 17:21:53+00:00
432,1462471178048741381,congratulations to taeyong finally hitting the cursèd juul,appiarian,2021-11-21 17:21:14+00:00
433,1462471140803285003,Does vaping break your wudu? 🤔,JunaidTheMalik,2021-11-21 17:21:06+00:00
434,1462470965166854145,"I don’t even smoke anymore, just vape &amp; man I smoked so much last night. LMAOO, yikes. Drinking is the only time I do it anymore. My lungs do not like it today 🥴🤣",emilyshemluk1,2021-11-21 17:20:24+00:00
435,1462470532423733250,"Coming up next on CCTV's public channel (Comcast8/Verizon43)
11/21/2021 12:58:38 PM:     PSA-vaping-Give Up",CantonCommunity,2021-11-21 17:18:40+00:00
436,1462470387921567758,Put the vaccine in a vape and this whole country will be vaccinated by tommorow😂💯😮‍💨,uk_coldquots,2021-11-21 17:18:06+00:00
437,1462470324419715079,"that feeling when boy who is 2 years younger than me is begging me to buy him a liquid for vape…looollll
that’s the cons of being 18",freakingdnf,2021-11-21 17:17:51+00:00
438,1462469609450315785,"Vaping is by no means safe. Although they are safer than cigarettes, because they exclude tobacco and other well-established carcinogens, nicotine is in itself toxic. 

https://t.co/zHO4Iat8XR",thewire_in,2021-11-21 17:15:00+00:00
439,1462469181178142721,(ASMR) Porn AND Vape Unboxing (NO TALKING),TitlesASMR,2021-11-21 17:13:18+00:00
