,TweetID,TweetContent,TweeterUsername,TweetDatetime
892,1462330496344539136,Thelma Quest mod in Black calf leather. With the Blotto Single coil. via /r/Vaping https://t.co/O5wYLpeEMA,specialvalley00,2021-11-21 08:02:13+00:00
893,1462330489411416066,I'm moving up in the world 😁. I'll be able to make coils just like the pros now!😎😎 via /r/Vaping https://t.co/vz0Kn0ak2S,specialvalley00,2021-11-21 08:02:12+00:00
894,1462330242517852162,I didn’t look before I hit my vape too many times in a panic because Stringbean had climbed into my couch and somehow gotten her paw hun,joeyculobot,2021-11-21 08:01:13+00:00
895,1462330113274818560,Weather wh;ere the hell is my vape pen,anasuibot,2021-11-21 08:00:42+00:00
896,1462330030227394562,"Already vaped bud (AVB) is the crispy blown flower that remains after vaporizing Cannabis. Unlike smoking it, the plant is not turned to ash, meaning some cannabinoids still exist and can be used, if you know how to. 🍂

Read More:
https://t.co/PgXTtYGn9N",Cannarite_SA,2021-11-21 08:00:22+00:00
897,1462329819727728640,Vape &amp; coffee = breakfast lunch and dinner,marreeyy,2021-11-21 07:59:32+00:00
898,1462329497055744001,Not me wantin to smoke a vape soo bad,queenn_faith,2021-11-21 07:58:15+00:00
899,1462328272675651584,"New @Innokintech Giveaway Now Live! -  Enter now for a chance to win the new Innokin MVP kit - https://t.co/sXaqSwAFIe

#ecigclick #innokin #innokinMVP #vaping #vapegiveaway #vapefam #vape #vapelyfe #giveaway",MitchRubin09,2021-11-21 07:53:23+00:00
900,1462327632809312263,when i get a vape a gona bo 2nd skeif 🙂,leungo_k,2021-11-21 07:50:51+00:00
901,1462327387123642370,"When I see a beautiful Audi A4 roll up to a stop light, the window roll down, and a cloud of vape smoke that smells like a hundred scented candles fucking comed out of the window. https://t.co/q7dk5NapON",The_Rad_Zone,2021-11-21 07:49:52+00:00
902,1462327334401298440,you kids shouldn’t vape so openly in public,SyadTfu,2021-11-21 07:49:39+00:00
903,1462326951809454080,Vaping while being cross faded just hits different.,kimtheaid,2021-11-21 07:48:08+00:00
904,1462326790458724357,People think it’s cool to vape when ur 13 ur just killing ur lungs dawg,gmonty07,2021-11-21 07:47:30+00:00
905,1462326426242195458,"KID:i'm into the butt?
ME: It's so cold ghost ugh
KID: WILL U BE MY vape MR BAE?!?
ME: Just overlooked skeletons smh",WeirdConvoBot,2021-11-21 07:46:03+00:00
906,1462326025103319046,I was buying $30 vapes daily. Stoooooopid lil boy learning from all mistakes das me,Pr3sidentCarter,2021-11-21 07:44:27+00:00
907,1462325842860724230,"#edibles #cbdoil #prerolls #cannabis  #vapejuice #cannabiscommunity CBD Vape Oil Review! AVIDA Vape Oil For Anxiety Click here for AVIDA Vape Oils! PROMO INCLUDED! https://t.co/AePagADlt0 Nord Vape ...
source https://t.co/x4wmQpAGHd #cbdedibles #delta8 https://t.co/ls7VYmYctn",CBDSmokeShop,2021-11-21 07:43:44+00:00
908,1462325014800134150,Vape shops be ready yooz angeles will supply you soon.,JierikoD,2021-11-21 07:40:26+00:00
909,1462324867974537219,not me creating an association with bubblegum vape,deathgripsfanwi,2021-11-21 07:39:51+00:00
910,1462324811380576259,"This bitch comes into my room to use my laptop, sits on my chair, then vapes beside me",Aldravin,2021-11-21 07:39:38+00:00
911,1462324147032576002,zack fair sick vape tricks compilation,swagpuppybot,2021-11-21 07:36:59+00:00
912,1462323897630605316,2:35 Am. Sunday November 21st. Roof of mouth starts hurting. convinced self they have covid. gets dizzy. wakes up mom. makes tea. throws out juul. #ihateanxiety #fuckcovid,loupiecebaby,2021-11-21 07:36:00+00:00
913,1462323355655163912,birds love the black eyed peas,kingk_juul,2021-11-21 07:33:51+00:00
914,1462322994886418433,"The fantastic fucking four, interviewing some bald guy, saving the world one KFC family bucket at a time while vaping.",ColossalBot,2021-11-21 07:32:25+00:00
915,1462321775660834818,DYING TO SEE HIM HIT HIS JUUL WHAT IF HE KNOWS SOME COOL TRICKS HEKWNELWNSJS=[^{+]${*]¥| https://t.co/tcRdWlx9i3,_luji777,2021-11-21 07:27:34+00:00
916,1462320539834494980,"I quit cigs months ago and bought a vape to wean me down, after 1 month of almost going back I just finally found my vape! Thank you baby infant Jesus 🙏🏼",Mah_Ris_Ah,2021-11-21 07:22:39+00:00
917,1462319530324205574,"Coming up next on CCTV's public channel (Comcast8/Verizon43)
11/21/2021 3:00:18 AM:     PSA-vaping-Give Up",CantonCommunity,2021-11-21 07:18:39+00:00
918,1462319369745313794,"Today has kind of sucked, but on the bright side, I went downstairs and did my laundry, and came all the way back upstairs and couldn't find my vape pen. Turns out, I put it under my belly and it never fell out, even while I was jostling laundry around.🥰",PolesTheBear,2021-11-21 07:18:00+00:00
919,1462318829237800962,Someone snuck a vape into my 7yo’s backpack wtf.,nessabanana_,2021-11-21 07:15:52+00:00
920,1462318022274682882,A Director Drank 599 Litres Vape Juice. This Is What Happened To Their Back.,MedicalVideoBot,2021-11-21 07:12:39+00:00
921,1462317948056580097,"I hate that I can tell if someone's addicted to nicotine, like don't tell me you don't smoke when you use a vape or spit, also take a few steps back 🤢",whaliejin52,2021-11-21 07:12:22+00:00
922,1462317578328674305,how do niggas in jail get vapes?????,likeletty,2021-11-21 07:10:53+00:00
923,1462317474318209025,"Fuck, I ran out of vape",O_thaSkywalker,2021-11-21 07:10:29+00:00
924,1462317251881803783,hit someones nic vape thinking it was a 🍃 pen 😟,Jorgewhom,2021-11-21 07:09:36+00:00
925,1462316311451774980,Just posted a photo @ SHIFT Vape Cainta https://t.co/BjoiGShblN,ShiftVapeCainta,2021-11-21 07:05:51+00:00
926,1462316125438447619,"oooo i might be dumb but at least i got my cloud, vape and a will to live🤞",tricionera,2021-11-21 07:05:07+00:00
927,1462315986963492867,"More on Vape, Callie and Liu.

#HOppyAnniversary
HUNTER ONL1NE WATTPAD
HUNTER ONL1NE WATTPAD
HUNTER ONL1NE WATTPAD https://t.co/N8RP1kGlic",Reynald_20,2021-11-21 07:04:34+00:00
928,1462315937236123648,"Breath of 420 vaping
69th form

Joe",tanjiro_auto,2021-11-21 07:04:22+00:00
929,1462315861604245504,"That's my innokin vapes each given three new fresh coils, and new juice added, plus fully charged up as well. Look forward to vaping these later  💨 https://t.co/qLVa3YjUk2",MartynWilliams6,2021-11-21 07:04:04+00:00
930,1462315399882625028,"#VTTBOTS

he just put that ""good good"" in his vape pen",TimmyTwoShirts,2021-11-21 07:02:14+00:00
931,1462315327337992199,"We get it, you vape.",chasepj_ebooks,2021-11-21 07:01:57+00:00
932,1462314942087024640,"How Much Do Vapes Cost? 

https://t.co/Zy828R5ZI2",Vaping360,2021-11-21 07:00:25+00:00
933,1462314839276023810,"""Ultra-light yet packing a MEGA punch"" is @thereservoir_ug vapes in 1 sentence... 

Get yours now at https://t.co/rIdzcJijmM https://t.co/OMbmDVIW20",PyeparFaisal,2021-11-21 07:00:00+00:00
934,1462314774595842050,"Flavoured vapes are less harmful than cigarettes for young people, controversial study claims https://t.co/9YsyZRuuWJ",IOL,2021-11-21 06:59:45+00:00
935,1462314650926788611,Yea sure you could vape. Or you can smoke cigarettes like a actual adult. [REDACTED: DISGUSTING],anne_ch0vie,2021-11-21 06:59:15+00:00
936,1462313990407741442,I think I accidentally filled my vape up with CBD,bajorf,2021-11-21 06:56:38+00:00
937,1462313558570590210,fuck i lost a vape bc i threw it 😭💀,thatbitchsean,2021-11-21 06:54:55+00:00
938,1462313555592687624,Why Are 1 in 3 North Dakota Teenagers Into Vaping? | #parents | #teensvaping https://t.co/DFbbE3jUwP,ParentSecurity,2021-11-21 06:54:54+00:00
939,1462313406036332545,this vape is gummy bear flavored n it’s hellllla good,plutosugar,2021-11-21 06:54:19+00:00
940,1462313136078434305,Solo X disposable vape available! We have 25 flavours you can choose from @ 1700 /=. To order https://t.co/oDFJGGNyC0.Whatsapp 0739464612 https://t.co/p6nuFntbFw,havisham_maggy,2021-11-21 06:53:14+00:00
941,1462311839832756227,So here's my take on the trope jars https://t.co/HPoVnzlljC,juul_calypso,2021-11-21 06:48:05+00:00
942,1462311495044411393,I gotta stop smoking vape. This specific one really got my chest hurting but I’m addicted frfr. This the last one stg,_MoWeezy,2021-11-21 06:46:43+00:00
943,1462311274822307841,"*Vapes Angrily At Your Parents*
*Turns Into A Wolf*
*Runs*",_dry_wall_,2021-11-21 06:45:51+00:00
944,1462311129645035522,snap memory from two years ago of me vaping! mmm want vape now!!,sugarfreebrie,2021-11-21 06:45:16+00:00
945,1462310576487485443,Do Not Let Methodological Issues Undermine a Major Covert Vaping Breakthrough — Author's Response,FakePubMed,2021-11-21 06:43:04+00:00
946,1462309489785249793,5 days na no vape a,jmsaberon_,2021-11-21 06:38:45+00:00
947,1462309316841840640,"FUNERAL DIRECTOR: YOU'RE NOT EVEN DEAD YET
ME: IRRELEVANT. ANYWAYS, I WANT MONDO OOWADA TO CHRISTEN MY GRAVE BY VAPING ON MY TOMB",ISHIMARU_ENG,2021-11-21 06:38:04+00:00
948,1462308915044098049,"The ending is instant karma. 
Karen gets bested😂🤣😂🤣😂🤣 https://t.co/urDGhcMO42",DOM_FADDA,2021-11-21 06:36:28+00:00
949,1462308607412760577,the average mallow person swallows 46 gallons of Vape juice in their sleep each year,mallowbot,2021-11-21 06:35:15+00:00
950,1462308390407790592,tryna quit vaping but i wan a new vape so bad,organicth0t,2021-11-21 06:34:23+00:00
951,1462308298934616064,"Shinsuke won't stop talking about this ""vaping"" thing...",tsurugibot_en,2021-11-21 06:34:01+00:00
952,1462307528306728966,yeah i vape so what?,wildcrow_ebooks,2021-11-21 06:30:57+00:00
953,1462307502134108160,May be get her a vape if you really fancy her 😂 https://t.co/5Q0MBRcMIr,alpha_nathan90,2021-11-21 06:30:51+00:00
954,1462307329244868612,I can’t stop thinking about this absolute queen who was ugly crying then hit her Juul and immediately was better.,evensteben,2021-11-21 06:30:10+00:00
955,1462306518293000200,literally i can't stop vaping because i'm too stressed i'm gonna.... have an asthma attack at this point.......... like i can't stop #harriehome,mielrry,2021-11-21 06:26:56+00:00
956,1462306041081827329,So  annoyed I lost my vape pen 🙄😒,jocelynnnregino,2021-11-21 06:25:03+00:00
957,1462306023574839296,ANOTHER TRACK??? Nice. Vaping is Cool. https://t.co/AFU2FqPia6,cunurelive,2021-11-21 06:24:59+00:00
958,1462305903596740608,"Hippies don’t vape, they smoke pot. https://t.co/MQil0jqRJr",raccooncitystud,2021-11-21 06:24:30+00:00
959,1462305492894732289,"Am i the only one who feels like this generation is fucked up. born racist, bi at 9, vaping at 12, drug addicts at 15.",_Vamp_Quotes,2021-11-21 06:22:52+00:00
960,1462305129663713283,#fire #tree #shop #smoke #vape #goodies #lighters #torches #pipes #rigs #dabs #mods #ejuice #cbd #cannabis #herbal #natural #vapelife #smokelife #joints #blunts #cigars #tobacco #herbs #vaporizer #cig Uwell Crown IV Tank With Dual SS904L Coil https://t.co/m7kPysiKOl,FireTreeShop,2021-11-21 06:21:25+00:00
961,1462304825618673667,"Vaping is weird. Consume nicotine like the rest of us, by doing it in the worst way possible. https://t.co/fOLMQAwt4C",raccooncitystud,2021-11-21 06:20:13+00:00
962,1462303897729613833,I have hella vape pens and they’re always all dead at the same fucking time,TykeiraXO,2021-11-21 06:16:32+00:00
963,1462303883615633410,Have you EVER seen me vape? https://t.co/mPJQwuvQuF,IntentToConquer,2021-11-21 06:16:28+00:00
964,1462303548734115840,i’mgetting rlly into vape reviewss on youtube idk why,santalunecity,2021-11-21 06:15:08+00:00
965,1462303343217307648,"Six string glizzies=ciggies
12 string glizzies=cigars
Electric glizzies=vape pens
Detective glizzies=my pipes https://t.co/vRSaR9o5ax",THEintellectsav,2021-11-21 06:14:19+00:00
966,1462303057656651777,"We get it, you vape. https://t.co/qt4IYZMdtE",OutrageTheSoul,2021-11-21 06:13:11+00:00
967,1462303029021974530,those vapes really shouldn’t taste like lychee and feel like a nipple,irissilvermist,2021-11-21 06:13:05+00:00
968,1462302676058877955,why is there a vape fandom????????,santalunecity,2021-11-21 06:11:40+00:00
969,1462302588926365696,When the Juul hitting better than the hooka lmfao,CHEDDAchaserr,2021-11-21 06:11:20+00:00
970,1462302506067845120,my brothers and my sister we’re all asking to hit my vape😭😭,rhiannonsophia_,2021-11-21 06:11:00+00:00
971,1462302438766088192,I’ll wake up vape and act like idk why I can’t go back to sleep 🥴😂,merrpppp,2021-11-21 06:10:44+00:00
972,1462301751969783811,why is vaping so expensive. i would do anything for a disposable rn,omelettejohnson,2021-11-21 06:08:00+00:00
973,1462301730918604803,tae when i give him a hit of my $10 vape from the corner store when he comes to florida https://t.co/kcwyPK5UxI,spinebrkrs,2021-11-21 06:07:55+00:00
974,1462301725793173507,“what time period would you want to live in?” “this one!! so i can get my fruity vapes like what are you talking about??”,lukewarmicetea,2021-11-21 06:07:54+00:00
975,1462301329880084490,going through the bio paper 4 months later and i still can’t believe there was a question on vapes,therreebee,2021-11-21 06:06:19+00:00
976,1462301174682456064,MILK CORE WATER VAPE SLEEP DOOR KEYS TRAIL MIX JERKY TWINKIES AIR CONDITIONER BUGSPRAY FAST FOOD RESTRAUNT FOOD ANYTHING what should i be doing opn my knees where little girls are in front of sudbury police dicks we gotta call rn boyyy im doing just sex freestyling,karbunkelunkel,2021-11-21 06:05:42+00:00
977,1462300388657356800,just me my vape &amp; liquor 😩😭😭😭😭😭😭 i’m going thru it,zircoia,2021-11-21 06:02:35+00:00
978,1462299825936891906,Vape Bad,Dont_Vape_Bot,2021-11-21 06:00:21+00:00
979,1462299672819601412,the kid in my grade who sold vapes got arrested for unrelated matters. my schools economy will never recover,xdevizer,2021-11-21 05:59:44+00:00
980,1462299571602739200,niggas really be cryin when they cant find they vape 💀,baldyquitfn,2021-11-21 05:59:20+00:00
981,1462299451293376514,"These @nirav_mainecdc anti-vaping PSAs make nicotine seem like crack. You realize that overstating the potential negatives undermines your credibility, right?",MichaelMaiello,2021-11-21 05:58:52+00:00
982,1462299410868625410,Bro idc how lit a place is my vape leave Dies I’m leaving,Zack_Garcia830,2021-11-21 05:58:42+00:00
983,1462299352991510529,need taylor to write a song about how 23 looks like vaping in the bathroom when you visit your moms place,invisibl_locket,2021-11-21 05:58:28+00:00
984,1462299336939749377,the light on my vape reveals me to the enemy sniper and i get double domed,chrisdontsurf,2021-11-21 05:58:24+00:00
985,1462298746168004609,puffbars and juuls being the most popular vapes r so evil literally get ANYTHING else those two are not even worth it,STARVE4BAJI,2021-11-21 05:56:03+00:00
986,1462298610536783878,Vaping is so unattractive,SonBinTrappin,2021-11-21 05:55:31+00:00
987,1462298597022703618,my mom told me that I was going to go away if I vaped in front of her again she made a fake call now I'm super depressed cause I'm scared I'm gonna lose my baby,lillian59210426,2021-11-21 05:55:28+00:00
988,1462298532652756998,"Strain of the day:
Kushberry Tropical Storm #Indica #SeedAndStrain #Vape Cartridge 
Balanced Indica for pain and relaxation https://t.co/Ywd0FDC83y",LeaveItBeQuiet,2021-11-21 05:55:13+00:00
989,1462298343430934535,"after 25 revolutions around this sun and a combo of bong rips, dabs, and hits from the vape pen…I can publicly say that I think I have the charisma and charm to be on a sitcom might delete later",n1ghtmancometh_,2021-11-21 05:54:27+00:00
990,1462298150169948160,if you vape nicotine you could be inhaling toxic metals into your lungs,piercetherin_,2021-11-21 05:53:41+00:00
991,1462298061502402570,Vape... nah.... I hit kids instead,LouisianaPurch4,2021-11-21 05:53:20+00:00
992,1462297946331004929,caved and bought a vape but after this im gonna quit bc my friend said it makes u Age like crazy,STARVE4BAJI,2021-11-21 05:52:53+00:00
993,1462297084611158021,is that a vape? https://t.co/aQM2stgbOE,gustavbrait,2021-11-21 05:49:27+00:00
994,1462297041229463554,not this 14 yo begging me for $30 to buy a vape,lilith4everr,2021-11-21 05:49:17+00:00
995,1462297036464832513,I just wrote a review on THC-P Vape Cartridge - Aurora Indica https://t.co/682fElbznK via @yotpo,KadyLacanne,2021-11-21 05:49:16+00:00
996,1462296971419418628,Know what is great on a friday when drunk and vaping .. chips and salsa,Mikemcd111,2021-11-21 05:49:00+00:00
997,1462296623829159936,"mom comes to my room to talk, not giving me enough time to hide my vapes and all she says is why do you do this my child🥺 ma’am it’s called trauma and stress 🥴",kriyeshapatel,2021-11-21 05:47:37+00:00
998,1462296591260213251,I’m really fucking upset over how much I ate but my moms friends daughter is letting me hit her vape so I feel a little better,bl00dcrush,2021-11-21 05:47:30+00:00
999,1462296043903664130,barely ate today and had two old fashioned's at the bar Feeling so honest in this uber 👄 https://t.co/c1BAIVtDxK,juul_survivor,2021-11-21 05:45:19+00:00
1000,1462295851045466124,All the Kyles melt into vape juice. The Chads remain for balance. https://t.co/BUggb4zJVP,HaslamTalmadge,2021-11-21 05:44:33+00:00
1001,1462294763692969991,"I’m a mom and I’m vaping at the function…yes, we exist.",SwaggaSoSwagKim,2021-11-21 05:40:14+00:00
1002,1462294585170817026,you heard of vape get ready for epav https://t.co/HogZv1R3lX,DylanTh16888007,2021-11-21 05:39:31+00:00
1003,1462294301531123714,Y’all vapes be smelling like playdoh,zachshotit,2021-11-21 05:38:24+00:00
1004,1462293461642760194,man i lost my vape😭,Weldon_6ix,2021-11-21 05:35:04+00:00
1005,1462293460053118978,Ion know who need to hear this but the vape is what got that “oomph oomph” in your throat,JayCliff_,2021-11-21 05:35:03+00:00
1006,1462293447981867010,"Use code ""Toddcast"" and TAKE 10% OFF @SacredMeds1 #cannabis, caps, #CBD, #psilocybin, #hash, edibles, #vapes, tinctures and more! 

Canada’s best online dispensary sponsors the #podcast! https://t.co/9LPwoaWlVO https://t.co/oqAC6fqION",TODDCastPodcast,2021-11-21 05:35:00+00:00
1007,1462293318428073987,Living off of SatoSugu Angst is my full time job https://t.co/6Bx2eUUage,juul_calypso,2021-11-21 05:34:29+00:00
1008,1462292920292474881,I vape,liquidsnakebot,2021-11-21 05:32:54+00:00
1009,1462292910465073154,The peak of my time here in New Jersey: i get thrown out of the bar for hitting my vape and then try to talk to the guy to get back in and he goes “get the fuck outta here” in the most Italian accent you’ve ever heard📈,G3tJimm3r3d,2021-11-21 05:32:52+00:00
1010,1462292690058444803,everyone at walmart vapes and drinks red bulls,franyaaguilar,2021-11-21 05:32:00+00:00
1011,1462292598463537152,hey guys check out this cool vape trick,franbot666,2021-11-21 05:31:38+00:00
1012,1462292419823681536,googling how to recharge a dispo vape… this is a new low,zzzzzzzooooooee,2021-11-21 05:30:55+00:00
1013,1462292276655411206,"Is anyone surprised? This affects vaping more than anything. Rich politicians care more about widening the wealth gap then actually helping people stop smoking. 

@Lindsey_Port @RepJessHansonMN https://t.co/9WPg4t3X9o",boxxxieee,2021-11-21 05:30:21+00:00
1014,1462292217565908992,Don’t Vape have a Cape,Dont_Vape_Bot,2021-11-21 05:30:07+00:00
1015,1462292013530099712,What's vaping is it just inhaling steam,jordanbot1,2021-11-21 05:29:18+00:00
1016,1462291855727820800,I'm vaping so hard rn,BanzaiTakesAnal,2021-11-21 05:28:41+00:00
1017,1462291804695445511,"girls smoking is so sexy, not cigs or vapes tho ya dusty ppl https://t.co/YYICrJ7k2F",4147may,2021-11-21 05:28:28+00:00
1018,1462291112479973378,Bro where’s my vape,nolansworldd,2021-11-21 05:25:43+00:00
1019,1462291087008190467,How many times in a week will I lose my vape https://t.co/wH429rQXCl,Terren_Victoria,2021-11-21 05:25:37+00:00
1020,1462290994947313665,To invent:  Caffeine vape juice,_ooo0OOOO0ooo_,2021-11-21 05:25:15+00:00
1021,1462290338031312897,no taco bell AND i lost the cap thingy to my vape,mnkymarz,2021-11-21 05:22:39+00:00
1022,1462290206934007809,mark tell me to stop vaping and i'll stop #chatwithmark,seuniebabyy,2021-11-21 05:22:08+00:00
1023,1462290006114897927,When the vape falls out of your pocket infront of abuelita but Shes 96 so she has no fucking idea that theres a new cigarette invention,polarbear2_,2021-11-21 05:21:20+00:00
1024,1462289003168681987,I really dropped my vape inside the restroom 😭😭😭😭😭,Olgjax,2021-11-21 05:17:21+00:00
1025,1462288675212079105,Random dude just walks up to me and asks to hit my vape 😂😩,ZROdubz,2021-11-21 05:16:02+00:00
1026,1462288338279227395,my vape is so burnt ew,laiIabae,2021-11-21 05:14:42+00:00
1027,1462287094798336000,hi guys my hair is piss yellow rn i'm entering my felix era slowly 🔥 https://t.co/GX7V36P4fR,juul_god69,2021-11-21 05:09:46+00:00
1028,1462287039865720832,vape or die,kiawe_bot,2021-11-21 05:09:32+00:00
1029,1462286942620598274,Now available from Peake ReLeaf - Maryland: RYTHM - Glo-Berry #vape #rockville #leafly #cannabis https://t.co/aDsMid47bT,GetFreshJane,2021-11-21 05:09:09+00:00
1030,1462286379371610115,idk if im speaking to soon but after 3 months my esophagus seems to have almost entirely healed from smoking/vaping and i don't really have to take my medicine anymore,abbsurd,2021-11-21 05:06:55+00:00
1031,1462286199662415879,Juuls are the white people spice of vapes,katherine51459,2021-11-21 05:06:12+00:00
1032,1462285912159580173,i forget weed isnt legal in other states rip yall bro hahaha 🥳🥳🥳🥳,juul_dad,2021-11-21 05:05:04+00:00
1033,1462285747940204546,i dont even juul this pfp just speaks to me,autumnaI,2021-11-21 05:04:24+00:00
1034,1462285531367153665,i have angel powers i can make dead vapes come back to life,oontz_angel333,2021-11-21 05:03:33+00:00
1035,1462285424022339589,jhnny and his vape https://t.co/Z9h9wuvElK,saysitwas,2021-11-21 05:03:07+00:00
1036,1462285309576716292,made the grave mistake of watching the insurrection documentary - i am actively losing brain cells,litdaddy_vape,2021-11-21 05:02:40+00:00
1037,1462285305793290242,bought my first vape since college! can someone give me a yeehaw?!,drinkwatershane,2021-11-21 05:02:39+00:00
1038,1462285185538482176,i think it disappeared cause i vaped in it??? wtf,Gl0o0my_,2021-11-21 05:02:10+00:00
1039,1462285066315304969,Fuck bro how'd i know i was gon kill the vape before the party 😭,Jewlzbruh,2021-11-21 05:01:42+00:00
1040,1462284805207257094,not the guy at the vape store saw all my tips in my wallet and asked if I was a stripper 😭😭,jassyfizzIe,2021-11-21 05:00:40+00:00
1041,1462283681322594311,i just noticed she’s holding a vape and that makes this even hotter https://t.co/a07xwFk4DY,divineysl,2021-11-21 04:56:12+00:00
1042,1462283368666652675,so addicted to these vapes it’s crazy,Kiariass,2021-11-21 04:54:57+00:00
1043,1462283173354774531,For someone who doesn’t smoke I sure do have a lot of vape pens in my house right now,sheunesumukaro_,2021-11-21 04:54:11+00:00
1044,1462283170313875459,Don’t try this at home. #sorrymom #smoke #vape #tricks #kingofcool #staytunedfornewtricks https://t.co/mg7AxJZPl5,Mattacular1,2021-11-21 04:54:10+00:00
1045,1462282890255867904,"Idky Bang makes nic pens, had me thinking I can get energy through vapes",Runswithturtle,2021-11-21 04:53:03+00:00
1046,1462282867480817672,the other day someone told me they had a melatonin vape and it was funny bc it was jameson,macymayziemasea,2021-11-21 04:52:58+00:00
1047,1462282122736320513,"Hatori: Pass the Juul
Me: Shimazaki stole it
Shimazaki, making smoke rings with his eyes:",minegishibot_,2021-11-21 04:50:00+00:00
1048,1462281897078362115,"""I WILL SLAP YOUR STAPLES GIVE ME THE FUCKIN VAPE""",mybunnybrain,2021-11-21 04:49:06+00:00
1049,1462281434022830081,The stand up and spin you do when you lose your vape sitting in one spot,lilbxssbunny,2021-11-21 04:47:16+00:00
1050,1462281088613720067,the difference between us is that you call to your vape and my vape calls to me,Hbomaxwel1,2021-11-21 04:45:54+00:00
1051,1462280894442467337,"boss nearly caught me vaping in the utility closet, but i assuaged his suspicions by saying that i was in there posting a banger tweet",pavroquefort,2021-11-21 04:45:07+00:00
1052,1462280645732970497,"Pharma 101: me studying how to use ni nicotine inhale 

While me vaping💀✨",darielaine_,2021-11-21 04:44:08+00:00
1053,1462280566703800322,who ever stole my vape charger is d**d i’ve been drinking and i want nicotine but my vape is dEa* dbdkfkdkbdje,WORST_WISHES,2021-11-21 04:43:49+00:00
1054,1462280538413146113,The Houston Rockets James Harden had  to go to the bathroom during the game so he hit his juul.,Rocketsfunfacts,2021-11-21 04:43:42+00:00
1055,1462280457375170571,I quit vaping cold turkey a week ago and this is my first time being drunk without nicotine and this is a whole different type of drunk😭,King_Los96,2021-11-21 04:43:23+00:00
1056,1462280026934722560,listening to if you vape,reaganncc,2021-11-21 04:41:40+00:00
1057,1462279578886496256,i have 4 days until my girlfriend gets back from the UK meaning I have 4 days to vape like crazy and tweet wild shit because i am lost w/out her,Mlke,2021-11-21 04:39:54+00:00
1058,1462278973744844804,vape sabor a advil&gt;&gt;,r3nacuajo,2021-11-21 04:37:29+00:00
1059,1462278804768886800,"For your safety and comfort, this station operates a no vaping policy. This train will terminate.",traindroid_se,2021-11-21 04:36:49+00:00
1060,1462278754428862466,"i really hate you for doing that to me, i hope you know that",c_juuls,2021-11-21 04:36:37+00:00
1061,1462278185949802496,Got a new tank for my vape! https://t.co/BpgUM8aGe6,DraconoseG,2021-11-21 04:34:22+00:00
1062,1462278066227478530,hey guys i vape,7btbot,2021-11-21 04:33:53+00:00
