,TweetID,TweetContent,TweeterUsername,TweetDatetime
603,1462437070501154825,dangers of vaping https://t.co/vunktDvtpT,ksooinglasses,2021-11-21 15:05:43+00:00
604,1462436898878595079,why did i thought sungchan was about to vape 😩😩,fakhrulaimman,2021-11-21 15:05:02+00:00
605,1462436884689285129,OMG!!! SUNGCHAN NAG VAPE!😳,_WayZenNiee,2021-11-21 15:04:58+00:00
606,1462436747300642816,oh god i thought sungchan was vaping😭😭😭 https://t.co/OqjXS1cDrS,chaenoze,2021-11-21 15:04:25+00:00
607,1462436652010323969,why do they have sungchan vaping😵‍💫,seokmns,2021-11-21 15:04:03+00:00
608,1462436649237983236,Why’d I think that whistle thing was a vape 😭,w1thouty0uu,2021-11-21 15:04:02+00:00
609,1462436635958599685,"RELX is your online source for advanced electronic cigarettes and next generation vaping equipment. We use the most modern production techniques, presenting you with innovative devices. https://t.co/ianWTk5C4U",neozoning,2021-11-21 15:03:59+00:00
610,1462436633874157571,did sungchan just hit a vape lmfao,keisukeism,2021-11-21 15:03:58+00:00
611,1462436558129315849,why was sungchan vaping omg,libidaur,2021-11-21 15:03:40+00:00
612,1462436548885065729,why is sungchan vaping,catgirlhyuna,2021-11-21 15:03:38+00:00
613,1462436545235877896,are they vaping lmao,dinocitos,2021-11-21 15:03:37+00:00
614,1462436489669668868,thought sungchan was gonna vape lol,ayongies,2021-11-21 15:03:24+00:00
615,1462436460095750144,not me thinking they were holding a vape 😭😭😭😭😭 https://t.co/q8eQMsFZir,lordlyblessing,2021-11-21 15:03:17+00:00
616,1462436459038732303,WAS THAT A VAPE https://t.co/zNtwbL9DI5,pesowons,2021-11-21 15:03:17+00:00
617,1462436420589703181,is it a vape or a whistle i’m crying https://t.co/hqMfv3XS5s,realitijeno,2021-11-21 15:03:08+00:00
618,1462436417934487563,Why are we vaping https://t.co/8XgHctaxka,WINF0RMATION,2021-11-21 15:03:07+00:00
619,1462436416793755658,I THOUGHT IT WAS A VAPE https://t.co/my2xmiymep,luvsuhtmrxt,2021-11-21 15:03:07+00:00
620,1462436401375444992,Why did sungchan hit a vape https://t.co/akWEvTlRur,nostrilflares20,2021-11-21 15:03:03+00:00
621,1462436388285075459,"There is only one week left to vote in the @EcigClick  Awards ⏰

We have been nominated in the ""BEST VAPE MAGAZINE"" category. 📖

We've been crowned for the past 4 years and we would love to make it for the 5th year in a row. 🏆

Vote now: https://t.co/E90gEtzwOW https://t.co/Hy75SKhTSU",vapouround,2021-11-21 15:03:00+00:00
622,1462436338330845187,sungchan out here with a vape pen https://t.co/wOqnTLppmj,jyansport,2021-11-21 15:02:48+00:00
623,1462436335680212997,are they hitting a vape😭 https://t.co/3O63SgZbpx,lcmist,2021-11-21 15:02:47+00:00
624,1462436329325748229,"not gonna lie, thought they were all holding a vape and sungchan was taking a puff",taeyongnct,2021-11-21 15:02:46+00:00
625,1462436317636308994,THEY GOT SUNGCHAN VAPING??????,swtdreamstn,2021-11-21 15:02:43+00:00
626,1462436308320665603,they vaped and ended up on tatooine https://t.co/0znYl4YuEA,jjyulip,2021-11-21 15:02:41+00:00
627,1462436296475955201,if that’s a whistle i’m sorry but it looks like a vape,realitijeno,2021-11-21 15:02:38+00:00
628,1462436262376132610,Its look like a vape😭,nctztrsr,2021-11-21 15:02:30+00:00
629,1462436257485758474,what is this vape pen https://t.co/chw6Ba30Km,taemtentaeil,2021-11-21 15:02:29+00:00
630,1462436252876095488,not sungchan vaping 😭,jaenolees,2021-11-21 15:02:28+00:00
631,1462436209662341125,did sungchan just hit a vape https://t.co/9bMH7h0RB8,ryujintros,2021-11-21 15:02:17+00:00
632,1462436117681037313,MF IS THAT A VAPE PEN https://t.co/cOeNOVZ5gM,iughkae,2021-11-21 15:01:55+00:00
633,1462436086483865601,"Vaping could be an alternative to smoking, to try and get off it but vaping could lead to more health problems that smoking doesn’t give you",Dont_Vape_Bot,2021-11-21 15:01:48+00:00
634,1462436078862884867,"Time for my own shisha moment, of the vaping kind  💨 @ Charles Row https://t.co/YuzSJVa8Hp",MartynWilliams6,2021-11-21 15:01:46+00:00
635,1462435962953293827,"Vaping 101: How to Enjoy a Proper Inhale. 
By Jeremy Mann 

https://t.co/cK2dLs5yFE",Vaping360,2021-11-21 15:01:18+00:00
636,1462435891599794176,my disposable ran out of juice on a sunday worst day ever 😭 gonna buy a proper vape tomorrow but that's only going to happen tomorrow...,mehrunnez,2021-11-21 15:01:01+00:00
637,1462435497725284354,I love this site! @eightvape has the best deals for our #VapeLife #Vape #VapeFam #Sale https://t.co/ZCXbj0QZWG,LisaCar78937194,2021-11-21 14:59:28+00:00
638,1462435423620321284,".@SenStabenow @SenGaryPeters 650,000+ of your constituents have decided to save our own lives by vaping. For ONCE in your career, stand for your constituents and vote NO on the vape tax in BBB. Quit sucking up to @SenSchumer and the DNC &amp; represent US! This is a tax on the poor!",ShillingBarb,2021-11-21 14:59:10+00:00
639,1462435046602723328,"5 of us are gathered and the gemini and sagittarius are vaping and drinking energy drinks while the aquarius, scorpio, and the other gemini are making chocolate chip pancakes 💀",gemjamthegemini,2021-11-21 14:57:40+00:00
640,1462435001035808768,My toxic trait is that I'm better than everyone cuz I don't smoke/vape nicotine,HellaKnives,2021-11-21 14:57:29+00:00
641,1462434873759739909,"Our Black Friday deals start tomorrow 11/22 and last until 11/28 🎁 everything in all three locations that is 🔴 red tagged will be 50% off, 🟢 green tagged 25% off and 🟡 yellow 15% off. We also will have deals in each store going on for disposable vapes and d8 products. https://t.co/YwDj9c000r",glass_twisted,2021-11-21 14:56:59+00:00
642,1462434869619961857,just ripped the vape of @heartbrokenkin9 because he left it in my room,yungfishlips,2021-11-21 14:56:58+00:00
643,1462433515283398659,Every single Sunday brunch the girl I bartend with and I always bet how many times some mimosa sipping customer is going to ask us where our orange juice is sourced from (for health reasons) while clutching a breeze vape………..,al_martinez92,2021-11-21 14:51:35+00:00
644,1462433349654523912,This is hate speech https://t.co/LI9lrOi48A,Kay_Juulers,2021-11-21 14:50:55+00:00
645,1462433236899229703,Thankyou sa vape💨❤️🥰,RamosJemma,2021-11-21 14:50:29+00:00
646,1462432886871707650,"ok so the vape shop opens at 10, i'm gonna head up there and get my pods and juice, maybe stop by the cbd side to get some delta8 stuff if i'm feeling like it bc we have reward points over there too. i'll try to stop at the grocery store too, to get more lettuce! &lt;3",cottage_cals,2021-11-21 14:49:05+00:00
647,1462432641731473410,onto my third vape pod in less than a week oops my anxiety is running on thin ice,ash_xox97,2021-11-21 14:48:07+00:00
648,1462432147902541835,The more I vape the closer I want to be to my pillow. Why did I do this to myself🥴😡,Sillyjurnee,2021-11-21 14:46:09+00:00
649,1462431889042526208,I’m glad I quit smoking at the right time. Try vaping nic salts in an MTL mod. #QuitSmoking #Vaping #ECigarettes,realshivanandan,2021-11-21 14:45:07+00:00
650,1462431772117856258,The only thing centrists care about is vaping,WeVote2020,2021-11-21 14:44:39+00:00
651,1462431346954063875,"Xmas and New year orders going in 
700ml of eliquids 
150ml of nic shots 
3 packs of coils .

#Ukvaper #vaperuk #vaper #vapefam #vapeon",Vaping40watts,2021-11-21 14:42:58+00:00
652,1462430424161001478,if you dont vape fuck off,saihara_ebot,2021-11-21 14:39:18+00:00
653,1462430085428834310,lrt no cuz the first time i accidentally sniffed strawberry vape i fell in love and thats exactly what xy would feel,papayansdragon,2021-11-21 14:37:57+00:00
654,1462429538147880966,"adhd is running up to the gas station to get a new lighter and coming home with a new bong, grinder, the WRONG type of vape pods and completelyyyy forgetting about the lighter",lmaoheykay,2021-11-21 14:35:47+00:00
655,1462429302566359048,Did u know that Jonah Hill refers to vapes as “mouth fedoras”? Made my god damn day lol,Power_Paige,2021-11-21 14:34:51+00:00
656,1462428559096561666,FDA Revokes Marketing Denial Orders for Humble’s Flavoured E-liquids https://t.co/I1Yx4VvOQw via @vaping_post,FDA_Track,2021-11-21 14:31:53+00:00
657,1462428557016133635,New vape this week pls,_jadaancheta,2021-11-21 14:31:53+00:00
658,1462428356767469575,"If I can't get Itto, I need to at least get Eula on 10 pity or else MHY needs to get me welkins https://t.co/ANlFr5p4HJ",juul_calypso,2021-11-21 14:31:05+00:00
659,1462428004924080130,The problematic urge to try not to cry to it🤩 https://t.co/E2YCHk3T0n,juul_calypso,2021-11-21 14:29:41+00:00
660,1462427833687441417,[watching thomas shelby smoking opium to escape the ptsd he brought back from the war as i lie in bed hitting a 90% thc vape to escape the tummy gurgles i gave myself from eating too many gummi worms]: oh man.... he's just like me,velourialemure,2021-11-21 14:29:00+00:00
661,1462426358601039877,I've been retweeting too much. Need to stop treating this app like its Facebook.,juul_calypso,2021-11-21 14:23:09+00:00
662,1462426134142873604,the zoomer in me really wants to buy a vape and download tik tok 😐🔫,YoungsterStoaks,2021-11-21 14:22:15+00:00
663,1462426089364635649,guys what do i do with my vape now? i dont like it anymore but i feel bad throwing it away 😍,wh0r3x0x,2021-11-21 14:22:04+00:00
664,1462426047442468871,"I never checked the vape battery I bought this morning.
Oh the shame.
#Leatherette https://t.co/oKlD2Y4N2i",Scouse1da,2021-11-21 14:21:54+00:00
665,1462425678280679429,The face he made at the end of chapter 165 says it all https://t.co/XBP9d16c6Q,juul_calypso,2021-11-21 14:20:26+00:00
666,1462425583443333120,if the vaccine was in disposable vapes all of Melbourne would be fully vaccinated by now.,t_guy_swag,2021-11-21 14:20:04+00:00
667,1462425308355870720,What's in vaping products? Stuff kids should know... https://t.co/IPLHPliXfL,kevinhoneycutt,2021-11-21 14:18:58+00:00
668,1462425285173727233,NO CUZ HEAR ME OUT ON THIS MAN #higurumahiromi #JJK https://t.co/1fNCddtzRt,juul_calypso,2021-11-21 14:18:53+00:00
669,1462425239355334657,"It's Disgusting How Hollywood Makes People Think #Vaping Is Bad By Having Slutty Girls And Bully, Douche Bags #Vape . What The Hell??? #VapingSavesLives #SaferNicotine #HarmReduction #Movies #TVShow #DoBetter ⚡#ARIAS🤘🏾",JORDANARIASXGOD,2021-11-21 14:18:42+00:00
670,1462423731406475264,A Railroad Police Ate 11 Gallons Vape Juice. This Is What Happened To His Brain.,MedicalVideoBot,2021-11-21 14:12:42+00:00
671,1462423563974197249,babe ur vapes dead babe~,_vsyana,2021-11-21 14:12:02+00:00
672,1462422977954394114,"So I’m sitting there, vape juice on my titties",cowboikiller,2021-11-21 14:09:43+00:00
673,1462421962521649161,Healthy Home Environment – Preventing Damage From Smoking and Vaping Indoors – The Pinnacle List https://t.co/w6jWqZhocM #thepinnaclelist #solespire,ThePinnacleList,2021-11-21 14:05:41+00:00
674,1462420946996936711,when some of the guys at work #vape lol.. https://t.co/CFmFwez8Lb,novembernoush,2021-11-21 14:01:38+00:00
675,1462420886204600322,"4Front #Ventures Corp., Named in Inc.’s First #Annual Best Led #Company

For more information connect with us on #Youtube https://t.co/aRbWotPPsM #rt

#cannabisnews #vape #cannabis #weed #maryjane #420 #pot #marijuana #710 #indica #sativa #internationalcannabisnews #news https://t.co/C5QdgJpQIS",theCannaStation,2021-11-21 14:01:24+00:00
676,1462420811055255566,"The immersive #VooPoo Argus Pro Pod vape kit has a generous long lasting 3000mAh battery capacity and 80w output, making your days more convenient and full of flavourful #clouds! This #pod kit is ideal for veteran #vapers. 

Find out more: https://t.co/K4hAJc7bMA https://t.co/TnROYRI1Qc",mycigara,2021-11-21 14:01:06+00:00
677,1462420780441128964,"Smoking is a major cause of cancer.

Cancer societies (except the UK) are working hard to turn the public and health professionals against vaping (harm reduction for smokers).

Big business that profit from smoking-related diseases fund cancer societies.

https://t.co/4o5S3YAPin https://t.co/10KGXF41e0",VAEPinfo,2021-11-21 14:00:59+00:00
678,1462420728645660681,Using a juul like one of those flavored chocolate milk straws,DunkMcGunk,2021-11-21 14:00:46+00:00
679,1462420679253504004,"If you prefer vaping fruitier flavours then Fruit Falls would be perfect for you! 🙌
 
This fresh-tasting range is all about the fruit and will quickly become your all-day vape!  
 
Make sure to discover the full range 👇
https://t.co/E7zf69lFqX
 
#888Vapour #Vape https://t.co/n3vKkB7tOT",888vapour,2021-11-21 14:00:35+00:00
680,1462420551897518082,A BLACK-MARKET GATEWAY HIDDEN IN LOS ANGELES VAPE DISTRICT https://t.co/znQpVtTC2c,CNBNEWSNET,2021-11-21 14:00:04+00:00
681,1462420535107674114,"😍 #Magestore is happy to help @jwellvaping thrive in the vape industry. We hope to accompany with more business like this with our most dedicated team 😊 See the ""World's No.1 #Magento POS"" that Jwell Vaping used to achieve their business goals here 👉 https://t.co/dY6AGHJVz8 https://t.co/J6fMzLwdqE",MagestorePOS,2021-11-21 14:00:00+00:00
682,1462420392329547778,"Smoking and vaping are dangerous to your health. Better tell Gov. Lamont to reverse his approval of Phillip Morris moving to Stamford, CT. Two hundred jobs does not make up for millions dying!!! https://t.co/7neNtb1QnH",Marlene_Danko,2021-11-21 13:59:26+00:00
683,1462418714490380296,"These days, we totally see vape products on cars and venues. Notably, on the IndyCar side of things with Vuse.

Just not the days of 555, Marlboro, Lucky Strike, Players and so on. https://t.co/vqSvIB5zvG",TheLTFiles,2021-11-21 13:52:46+00:00
684,1462418406972395520,"⁦@CBCNews⁩ ⁦@globalnews⁩ ⁦@CTVNews⁩ interesting, no coverage of this. Why? 👇

The Youth Vaping “Epidemic” Has Ended; So Should Extreme Youth-Centric Anti-Vaping Measures - Competitive Enterprise Institute https://t.co/JbOMCkYgWd",grayjaynine,2021-11-21 13:51:33+00:00
685,1462417445134684169,I had a dream I accidentally lost my vape in the  stuffed turkey,alexasoules,2021-11-21 13:47:43+00:00
686,1462417231455801349,"pjms keeping up with taehyung's drink preferences, his vape flavors, his friends and the dating rumours... i just know they're all closeted kths 😭",kthvord,2021-11-21 13:46:53+00:00
687,1462416990790901760,"Team members who call plays that aren’t in the play book aren’t really team members at all.  The pharmacy regulators should take a good hard look at this. As well as business models which include selling cigarettes, and vape products. https://t.co/5ibQTV839T",YXEMD,2021-11-21 13:45:55+00:00
688,1462416851158409224,DaVinci Vaporizers | VaporNation #vapes #vapepens #rigs #bongs #dabs #pipes #vaporizers https://t.co/hj2EdsOjxq https://t.co/pp64w65xSa,The_Audio_Pimp,2021-11-21 13:45:22+00:00
689,1462416340720005128,my vape tastes like shit now i think it’s on its last legs,sorryinnerchild,2021-11-21 13:43:20+00:00
690,1462415515477889026,can someone do the “ wake up in the morning brush my teeth- “ wtv trend with vape instead like iw do but i lazy but like u blow ur smoke onto ur cam then next transition is like the smoke slowly disappearing then its u and ur partner 💨,22luvac,2021-11-21 13:40:03+00:00
691,1462415222547927046,Might start vaping,CrumpetTheUh,2021-11-21 13:38:54+00:00
692,1462414595738546179,#vaping memories! I love vaping and I love vapers! #invapewetrust https://t.co/96XpQyRkFn,ohmnisium,2021-11-21 13:36:24+00:00
693,1462413532268539906,i hereby declare i will stop vaping,faithisacowboy,2021-11-21 13:32:11+00:00
694,1462413010224377860,Vaping kills so why do it because instead of dying you can play Minecraft,Dont_Vape_Bot,2021-11-21 13:30:06+00:00
695,1462412995389186048,"Tomorrow marks the beginning our Black Friday week! 

⚫1 day to go! 🔴 https://t.co/ihSVcYfiBa",EDGE_vaping,2021-11-21 13:30:03+00:00
696,1462412679407149057,is boston ok??? we’ve had to ask at least half a dozen people to stop vaping in the store this week,lilybelle_15,2021-11-21 13:28:47+00:00
697,1462412665461121035,I don’t know how I’m ever going to quit vaping by the first of the year. I love this shit too fucking much💀 especially after a big meal,Jennycuti,2021-11-21 13:28:44+00:00
698,1462412451501142020,"VapX Meteor and A1 Tank duo
.
.
Warning: you must be of legal age to vape https://t.co/nXnUFIW4EM",m_poblacion75,2021-11-21 13:27:53+00:00
699,1462411356481765377,I’d absolutely have a job I can rip ass and vape unbothered,joeyculobot,2021-11-21 13:23:32+00:00
700,1462411352350330885,"TIMOKO: @ecurierw @Timoko_ @Timoko3 @YabbyDamFarms 
🔥 GIANTISSIMO🇩🇰🥇 🔥 
JUNIOR🇸🇪🥇 IN THE SPOTLIGHT 🇫🇷 🥇
Congrats to the breeder @ecurierw , trainer Morten Juul and owner Team World Wide Trot 👏👏👏👏 https://t.co/YFW5OngogH",Hingstdepan,2021-11-21 13:23:31+00:00
701,1462411165187903505,Lil nigga went in the run put his grandpa hat on and his own shoes &amp; smoking a damn vape😭😭😭she said he was coughing she look up he gotta vape,AshantiKassana,2021-11-21 13:22:46+00:00
702,1462411146510675979,"I have just been informed that I am passing away , due to second-hand vape",cantstop69ing,2021-11-21 13:22:42+00:00
703,1462410777382596613,"Thoughtful and important 'cast of  @fayeflam interviewing @j_g_allen  about goals and tradeoffs and values vs science viz the pandemic.

Lo if he would be game to apply this approach to nicotine and vaping!

https://t.co/CDM4a9bsjK",jgitchell,2021-11-21 13:21:14+00:00
704,1462410744599875597,Bro I didn’t bring my vape to the Bahamas and I’m already feeling like that was a huge mistake #dependent,heck_ct,2021-11-21 13:21:06+00:00
705,1462410724299489282,"smoking is the people's vice, vape pens are a sign of diseased individualism",voeldebas,2021-11-21 13:21:01+00:00
706,1462410703248277513,"A doorbell that needs help to vape your iPhone's medicine however, it finishes",bot_shitty,2021-11-21 13:20:56+00:00
707,1462410678019538957,it’s either i forget my coffee and remember my vapes or I forget my vapes and remember my coffee but never both at the same time,mollyyy_rose,2021-11-21 13:20:50+00:00
708,1462410479331127302,oomf vapes,sacrificiaIwill,2021-11-21 13:20:03+00:00
709,1462409962336964608,"Bought a hazelnut Cappuccino Grande at a rest stop in Germany. It's disgusting. It tastes like vape juice. 0/10, would not recommend.",IsaacHowlett,2021-11-21 13:17:59+00:00
710,1462409756623077387,"i actually have to stop vaping

my heart is beating so goddamn fast i cant sleep",joon_yeom,2021-11-21 13:17:10+00:00
711,1462409713769926658,"Big mug of tea ☑️
Orange squash (incase I run out
of tea)☑️
Vape☑️
SPF 50 (rays travel through windows)☑️
Specs☑️
Shades (incase it's too bright, I am light sensitive)☑️
Sky Sports Live Renault Super Sunday ☑️☑️☑️☑️☑️",ange_k_radio,2021-11-21 13:17:00+00:00
712,1462409467362885632,When the solar flare happens will my vape still work?,versacetylenol,2021-11-21 13:16:01+00:00
713,1462409438543945730,Put the vaccine in a vape and this whole country will be vaccinated by tommorow😂💯😮‍💨,uxcquotes,2021-11-21 13:15:55+00:00
714,1462408978349056006,"Source #Vaporizers - Source Vapes for #Wax Concentrates | VaporNation  #vapes #vapepens #rigs #bongs #dabs #pipes #vaporizers 
 https://t.co/LRSABVmnbr https://t.co/AiGPACcsSF",The_Audio_Pimp,2021-11-21 13:14:05+00:00
715,1462408589247664129,i washed my vape in my washing machine and now i’m using that as a excuse to quit,__amorr__,2021-11-21 13:12:32+00:00
716,1462408342840782852,#edibles #cbdoil #prerolls #cannabis  #vapejuice #cannabiscommunity 3 Chi Delta 8 Vape Cartridge - Incredible Hulk Get your delta 8 products directly from 3 Chi for the lowest prices and the fastest shipping online. This exact ... https://t.co/kaM8r3mRks #cbdedibles #delta8 https://t.co/gcKA1rGVwn,CBDSmokeShop,2021-11-21 13:11:33+00:00
717,1462407017700917248,Why would you play an MMO if you don't want to trade vape secrets?,monfacbot,2021-11-21 13:06:17+00:00
718,1462406520038395904,hey guys i vape,finley_ebooks,2021-11-21 13:04:19+00:00
719,1462406365306044419,"Open today til 4PM • Stay Classy - Vape Premium 
#Holmfirth #slaithwaite #meltham #honley #marsden #linthwaite #huddersfield #westyorkshire #vapeshop #ukvapeshop #golcar #elland #oldham #saddleworth #bestvapeshop https://t.co/0Ts4iQ6wAX",BigDVapes,2021-11-21 13:03:42+00:00
720,1462406315876171776,I CANT FINDNMY FUCKING VAPE IMMA LOSE MY SHIT I AM A FIEND,claybrickss,2021-11-21 13:03:30+00:00
721,1462406153674047488,NBM I CANT FIND MY VAPE WHERE TF DID THAT LIL FUCKER GO,claybrickss,2021-11-21 13:02:51+00:00
722,1462406080064020480,"Coffee &amp; Smoke 💨 
.
.
.
.
.
.
#vape #coffee #evening #smel #mood #nice #joyetech #obsace #shogeqarsh #frinds #yerevan #armenia #shop #city #life #phtography #mbilephotography #colorful #about1321art https://t.co/R01vDZ9xdc https://t.co/sGfcCRbObY",Hrofire,2021-11-21 13:02:34+00:00
723,1462405475903827971,Don’t hit it be with it,Dont_Vape_Bot,2021-11-21 13:00:10+00:00
724,1462405364750688261,"If you vape in the US and order online, do not order from @Element_Vape #ElementVape

Awful customer service, take your money and ""ship"" an item, refuse to refund you or help you whatsoever.",dialupdong,2021-11-21 12:59:43+00:00
725,1462405058411204609,Kill La Which One Vapes?,MBMBanime,2021-11-21 12:58:30+00:00
726,1462404552024633349,In a VA Beach Walmart at 7am and they segue from a hardcore version of jingle bell rock to a song who’s only chorus is “God is watching from a distance”.  Meanwhile An employee hits his vape in the plumbing aisle. Life imitates art.,YungHeathen,2021-11-21 12:56:30+00:00
727,1462404339029487627,"Spend the time with the thing you love!

#hyppe #hyppemaxx #ilovemaxx #ilovehyppe #disposablevape #vape https://t.co/QsjBXefelJ",hyppeeu,2021-11-21 12:55:39+00:00
728,1462403805451112449,"Why is every vape shop just called ""vape shop""",DialNouns,2021-11-21 12:53:32+00:00
729,1462400908654952451,Check out my broadcast from my PlayStation 4! #PS4live (The Elder Scrolls Online: Tamriel Unlimited)  live at https://t.co/LYJxLvjpYB,Vape_Dave,2021-11-21 12:42:01+00:00
730,1462400774944825346,"I’m just realizing I’ll be sitting there, backwood in one hand, vape in the other like simultaneously 🥴 I need help lol 🤦🏾‍♀️",BrionnRenee,2021-11-21 12:41:29+00:00
731,1462400046440357892,RT @iwcponline: Island business Ape Vapes have partnered with Healthy Lifestyles Isle of Wight. #iwnews #isleofwight #iow… https://t.co/ZNcSryvkIv,IOWinfo,2021-11-21 12:38:35+00:00
732,1462399250524884998,Longing for a a shelf to store your memories of those times when you  vape so hard it's like you're in the middle of a fog bank in Maine? Join us at https://t.co/j6aTlywuhF https://t.co/RBpEB3cLaI,kniiife_Mom,2021-11-21 12:35:26+00:00
733,1462398956580016128,"B|athing in e-juice
A|bsolutely A memer
S|upper into meat
I|ll as the kids say
L|ikes to vape",noknokitsnoskle,2021-11-21 12:34:15+00:00
734,1462398954025656321,"Hey dude, I vape. Yeah you know vaping? I do it. Yeah vaping, it's something I do. I don't smoke, I vape. Vaping dude, it's amazing. You sho",IuIu_ebooks,2021-11-21 12:34:15+00:00
735,1462398728321613827,"Island business Ape Vapes have partnered with Healthy Lifestyles Isle of Wight. #iwnews #isleofwight #iow @HealthyLifeIOW Read:
https://t.co/eQi1Gl1Icl",iwcponline,2021-11-21 12:33:21+00:00
736,1462398542337789958,apparently people vape their own cum ☹️,haremgaysex,2021-11-21 12:32:37+00:00
737,1462398355473002501,My mum came to my House today and picked up my vape and said this is not a USB as soon as she found out what it was she dropped it and give me that you’re a disappointment look I’m nearly laughed to death 😂😂😂😂,UmitsAbyss,2021-11-21 12:31:52+00:00
738,1462398066955550720,you either vape or you die,anasuibot,2021-11-21 12:30:43+00:00
739,1462397809139671042,no I'm not on Adderall. I've been vaping on B.C. Bud all night. I just can't sleep rn bc I'm ever so slightly upset - that's the Jewish part of me. thanks for the dm tho,beckyemoji,2021-11-21 12:29:42+00:00
740,1462396045988663299,I hate that there's no inconspicuous way of vaping. Why that huge  cloud of vapour?? It's so embarrassing,SiphuxoloToYou,2021-11-21 12:22:42+00:00
741,1462395936882278406,took my mums vape she’s gonna know i’ve used it now FUCK,ymircaIs,2021-11-21 12:22:16+00:00
742,1462395677338599432,Gardenia quick bites are the real food versions of vape flavours 👩🏽‍💻,setansspawn,2021-11-21 12:21:14+00:00
743,1462395412153778188,forgot my vape at home this bout to be a long ass day &lt;/3,kaseundercover,2021-11-21 12:20:10+00:00
744,1462394571191570433,Broo I dropped my Juul and someone straight stole that shit wtf 😭😭,JoeybirdJose,2021-11-21 12:16:50+00:00
745,1462394318778515459,While looking for my Juul behind my bed I just found the top off of a thing of Narcan. Real fucking cute Marsh. That's been there since May 24. Almost 6 months. We do recover,1stLadyMorticia,2021-11-21 12:15:50+00:00
746,1462394140528836608,Stop smoking with Ape Vapes and Healthy Lifestyle Isle of Wight https://t.co/yOhiLmrQLp,IOWNews,2021-11-21 12:15:07+00:00
747,1462393900040077314,"Dumb move.
#Vaping helps ppl stop smoking.
Teen vaping is way down the last 2 yrs and is NOT a crisis.
Did San Jose outlaw flavored alcohol &amp; selling of cigarettes? 
No?!
Then all you are doing is pushing smokers back to tobacco (so you can exploit the tobacco taxes.) https://t.co/3P6cnlSDjM",ShantyMinister,2021-11-21 12:14:10+00:00
748,1462393884982452235,wooo sold my vape fr $60 now no vapin fr the next few days until i gt a new devicee,tootsskii,2021-11-21 12:14:06+00:00
