,TweetID,TweetContent,TweeterUsername,TweetDatetime
2799,631719952869756928,Vapes appear to be as addicted as crack smokers. Always holding the hookah.,treehows,2015-08-13 06:52:28+00:00
2800,631719904945815553,Last morning vapes with @officialvgod coming home tomorrow. I have so much #vapemail on the way it's… https://t.co/ttYz7Bn0XF,tommyphilcope,2015-08-13 06:52:16+00:00
2801,631719354372071424,"basically,

vape = smoking = uncool

bye.,#HasifHazemi.,#Senior.,👍 @… https://t.co/lIhZEsFPtU",FarhanPoxceq,2015-08-13 06:50:05+00:00
2802,631719343013892096,"#eJuice #Vapes

#Vapor from liquids #weed #medical  #MMJ

http://t.co/lmRHBsWRYQ

#BuyHere
http://t.co/x9bvsXnnlE
#Bitcoin",VAPEPENstore,2015-08-13 06:50:02+00:00
2803,631719292883460097,Boutta drop $170 on a new vape lmao,Globbuh,2015-08-13 06:49:50+00:00
2804,631719021973520384,"The vaping lambo! !!!!!

#yiannimize #rtuk #reviewthisuk #vape #vaping #cloudchaser #flavourchaser… https://t.co/OdfHrU9zn4",mikeyb6999,2015-08-13 06:48:46+00:00
2805,631718919733121024,"basically,

vape = smoking = uncool

bye.,#HasifHazemi.,#Senior.,👍 @… https://t.co/xwvCVjtO6F",FarhanPoxceq,2015-08-13 06:48:21+00:00
2806,631718902599319552,done vaping,ysengrim,2015-08-13 06:48:17+00:00
2807,631718891278893056,Win a Whiteout Evolv DNA200 Box Mod! #vaporjoes #vapingunderground #vaping http://t.co/EWgDfepCTl,meowmix915,2015-08-13 06:48:15+00:00
2808,631718793144700928,Dude came through with a vape 👌🙌💨💨,_LordAntonio,2015-08-13 06:47:51+00:00
2809,631718518380097536,JUST BECAUSE YOU VAPE DOES NOT MEAN YOURE THE COOLEST PERSON ON THE FUCKING PLANET STOP,ellenraeweavaa,2015-08-13 06:46:46+00:00
2810,631718397311496192,~*.VapiNg is liKe so0o0o0o cool bruh😙💨.*~,RachLear,2015-08-13 06:46:17+00:00
2811,631718381633294336,"""I hate when people take Pics like this ,we get it you vape http://t.co/SoIKbOPAEd""",MyshkinPotap,2015-08-13 06:46:13+00:00
2812,631718324360085504,A few windy clouds have good evening #vapefam #royalhunter 22g #hotwires #kindredv2 #vape… https://t.co/2tQ7pOeoYY,BoneSaw77,2015-08-13 06:45:59+00:00
2813,631718268831690752,I'm at VMS Vape Cafe https://t.co/6LiJo2JNl5,joshmwy,2015-08-13 06:45:46+00:00
2814,631718136492888065,Win a Whiteout Evolv DNA200 Box Mod! #vaporjoes #vapingunderground #vaping http://t.co/MBGyt490OT,kyle_kharris2m,2015-08-13 06:45:15+00:00
2815,631718012110946304,RT DRPHEELGOODTZ: Photo: Come into Marlows Vaporium San Marcos and checkout this sick setup by Limitless!!! #vape … http://t.co/9W0rtUaH6P;,vapemerch,2015-08-13 06:44:45+00:00
2816,631718010001207296,RT RealDonnaDeVane: CULTURE SHOCK RICH BLUEBERRY IN W TRIPLE BERRY &amp; VANILLA EXHALE Mad Ape #Vape Magic! … http://t.co/l3I6HuBgeb,vapemerch,2015-08-13 06:44:44+00:00
2817,631718008235405312,RT DRPHEELGOODTZ: Photo: That’s right folks The Vape Lounge is now going to be carrying Limitless!! Stay tuned……… … http://t.co/YHuzjlDzjZ;,vapemerch,2015-08-13 06:44:44+00:00
2818,631718005647343616,RT Cannacashplan: http://t.co/akOnngv3Jh; can help you finance your #cannabis or #vape business - email contactst… http://t.co/bMh34sTdsu,vapemerch,2015-08-13 06:44:43+00:00
2819,631718001159598080,RT 528vape: Promote UR #vape business in #Europe with http://t.co/NgoB5PqQHw; - we have a huge following - http://t.co/ISQmLTkfvi,vapemerch,2015-08-13 06:44:42+00:00
2820,631717731709132800,"""@Symone_Sekemoto: @lolitanecka 💁🏾😂"" shit cray!! Now I'm about to vape all up in ya face and not share 😂😂😂😂😂😴😴😴",lolitanecka,2015-08-13 06:43:38+00:00
2821,631717634686369792,Win a Joyetech EVIC VT Kit from @cigbuyer and @huffandpuffers: http://t.co/upYEmDJDEz #ecigs #vaping #evicvt #vapecontest #vapegiveaway,DrakisBack,2015-08-13 06:43:15+00:00
2822,631717479262367744,Have u heard of #eCigs? Try #V2Cigs #V2Pro #coupon SOFLA10 #ecigarettes #VAPOR #SMOKE #eCigs #eLiquids #Vaping http://t.co/YZvmlk27z7,Prixxyd,2015-08-13 06:42:38+00:00
2823,631717472043839489,DID SOMEONE SAY A VAPE!?,lance128686,2015-08-13 06:42:36+00:00
2824,631717008678096896,let vape on,apishpeh,2015-08-13 06:40:46+00:00
2825,631716977204166656,August Issue Of Vape Magazine Has Dropped! Pickup A Copy Today And Checkout Our New Full Page Ad.… https://t.co/XAn2PNE7MJ,liquidefxvape,2015-08-13 06:40:38+00:00
2826,631716923525472256,Satisfy Your Sweet Tooth And Vape Cravings In One Fell Swoop! Nothing Quite Compares To The Searing… https://t.co/QlHRn8rzza,liquidefxvape,2015-08-13 06:40:25+00:00
2827,631716860212457472,Live. Laugh. Love &amp; Vape That Liquid EFX!  #ecc #ecc2015 #liquidefxvape #teamliquidefx #vape… https://t.co/tAcThRhR1I,liquidefxvape,2015-08-13 06:40:10+00:00
2828,631716829556273152,ECC Is Here And We Cant Wait To Vape With You! We’ll Be Standing Tall At Booth #2114 At Hall 10. Drop… https://t.co/0vAzl79uHp,liquidefxvape,2015-08-13 06:40:03+00:00
2829,631716792474451969,Lmfao vape tricks  https://t.co/iZUTBabhKP,sincinnn,2015-08-13 06:39:54+00:00
2830,631716786723909632,All your vape are belong to us,LukeJacobmon,2015-08-13 06:39:53+00:00
2831,631716695929782272,Vapes are for kids 💨💨,j_dawgg200,2015-08-13 06:39:31+00:00
2832,631716559656869888,I think I'll just sell my vape 😐,Sierra_Carliese,2015-08-13 06:38:59+00:00
2833,631716329620434944,"Lol do you even vape, bro?",BrunetteJ21,2015-08-13 06:38:04+00:00
2834,631716188523892736,Get all your hookah products at http://t.co/hkl4QGmFet #hookah #shisha #starbuzz #oduman #alfakher #fumari #vape http://t.co/9p08Mp7bI2,hookahjunkiee,2015-08-13 06:37:30+00:00
2835,631716169150525440,Have u heard of #eCigs? Try #V2Cigs #V2Pro #VAPOR #SMOKE #eCigs #eLiquids #Vaping http://t.co/reYeBcxkfc,CarlosChiver,2015-08-13 06:37:26+00:00
2836,631715989751623680,"So while the rest of the house can smell like @richandcreamy and @dtfcats' various vapes, my room can smell like Anthropologie.",eyemusing,2015-08-13 06:36:43+00:00
2837,631715969073811456,Photo: Come into Marlows Vaporium San Marcos and checkout this sick setup by Limitless!!! #vape #vapelove... http://t.co/mD1ar1DgTW,DOCPHEELGOOD,2015-08-13 06:36:38+00:00
2838,631715964892114944,"Come into Marlows Vaporium San Marcos and checkout this sick setup by Limitless!!!
#vape #vapelove… https://t.co/MviMeHQq1n",murdermodsinc,2015-08-13 06:36:37+00:00
2839,631715867626049536,Win a SX Mini M Class mod from http://t.co/uEPuuQFDpN - http://t.co/QK0FhqbVS6 #ecig #Vape,rathmahun,2015-08-13 06:36:14+00:00
2840,631715640454176768,Win a Whiteout Evolv DNA200 Box Mod! #vaporjoes #vapingunderground #vaping http://t.co/NtiIq7j0wd,JBuutes,2015-08-13 06:35:20+00:00
2841,631715588683907072,Vape City http://t.co/nWPJtBm9b6,Brettofreshair,2015-08-13 06:35:07+00:00
2842,631715545910349824,You know what's annoying? That sound when someone is sucking on their vape stick. Have fun sucking a robot's dick #TrueDetective,thevuman,2015-08-13 06:34:57+00:00
2843,631715502541312000,Only had my vape for like a week and I'm already copping a new one 😂,Globbuh,2015-08-13 06:34:47+00:00
2844,631715490247782400,"Wohooo liquid Social Juice @vapesociety_bandung
•Oreo Milk 
•Scotchy Drip 
Video vape trick by… (w/ Rayan) [vid] — https://t.co/nPnajO7DhA",bandarvape,2015-08-13 06:34:44+00:00
2845,631715353467289600,Win a Whiteout Evolv DNA200 Box Mod! #vaporjoes #vapingunderground #vaping http://t.co/Ewi6pkggCq,milowalker2,2015-08-13 06:34:11+00:00
2846,631715252451852288,"New Deals So-Mich Vape *lowered prices!* http://t.co/DMjKNV0ALP: #VapingUnderground, Deals/Promotions",VUClassifieds,2015-08-13 06:33:47+00:00
2847,631715207757205504,Win a Hermetic Steam E-Juice Sampler from @cigbuyer: http://t.co/LzvLwz2oM5 #ecigs #vaping #eliquid #ejuice #vapecontest #vapegiveaway,GlasMarg,2015-08-13 06:33:36+00:00
2848,631715122331848705,Hell yeah bro vape  https://t.co/vAVnRSdnbf,AlmightyMHKJune,2015-08-13 06:33:16+00:00
2849,631715034117238785,On the contrary.. Aerosol is used in vaping,N7_Epsilon,2015-08-13 06:32:55+00:00
2850,631714505467252736,Earthshaking Eliquids ==&gt;&gt; http://t.co/tuRjffIGcY #vape #e-liquids http://t.co/BLrXBhWKtW,Esheeshuk,2015-08-13 06:30:49+00:00
2851,631714497049268224,"Great product, support and potential #vape #vaping #makemoney http://t.co/Jv7pxi6iXF",esheeshecigs,2015-08-13 06:30:47+00:00
2852,631714460479193088,Nicotine no worse than cup of coffee - https://t.co/k2IXbe0tnc - #nicotine #caffeine #smoking #vaping #healthcare http://t.co/uZvXHbgp4d,Bullet_News,2015-08-13 06:30:38+00:00
2853,631714450341523456,Recap of the Club Vape cloud comp. Make sure to come out to the Club Vape Hebron location on the 29th! http://t.co/GZrZKQn3LF,ClubVapeNky,2015-08-13 06:30:36+00:00
2854,631714398441074688,But you left out the part where you stay on your phone ignoring me to look at vape shit 😴,KallieDiane,2015-08-13 06:30:23+00:00
2855,631714333215576064,CULTURE SHOCK RICH BLUEBERRY IN W TRIPLE BERRY &amp; VANILLA EXHALE Mad Ape #Vape Magic! http://t.co/BMqkoci7E6 http://t.co/faSMUYDYDu,RealDonnaDeVane,2015-08-13 06:30:08+00:00
2856,631714308154638336,vape hate,vapeeverything,2015-08-13 06:30:02+00:00
2857,631714271387369472,ppl talking about vaping on my tl,iHpno,2015-08-13 06:29:53+00:00
2858,631714266073157632,Damn girl let's share ur vape,JuicyyQ,2015-08-13 06:29:52+00:00
2859,631714200277118976,Photo: Coming soon to Marlows Vaporium San Marcos….. #vape #vapelove #vapefam #vapestagram #vapestrong... http://t.co/UM3ZeMs9fO,DOCPHEELGOOD,2015-08-13 06:29:36+00:00
2860,631714197047541760,"Coming soon to Marlows Vaporium San Marcos.....
#vape #vapelove #vapefam #vapestagram #vapestrong… https://t.co/fdZfcwNLwJ",murdermodsinc,2015-08-13 06:29:35+00:00
2861,631714151472041984,need to vape,Asspct,2015-08-13 06:29:25+00:00
2862,631714145918959616,Get the crane out of the way we're almost good to go here! #ReadytoVape http://t.co/VghOq9qD42,Atom_Vapes,2015-08-13 06:29:23+00:00
2863,631714134187315201,lmao I'm pretty sure you only vape just to say you vape,_lillianngrace,2015-08-13 06:29:20+00:00
2864,631714107012608000,Get the crane out of the way we're almost good to go here! #ReadytoVape http://t.co/1PwSJsfm9v,Atom_Vapes,2015-08-13 06:29:14+00:00
2865,631714105309667328,Who Vapes?  Did it help you quit smoking???? Curious.,MarkiPI,2015-08-13 06:29:14+00:00
2866,631714020081451009,Gotta make a Vape Playlist on my phone,lolitanecka,2015-08-13 06:28:53+00:00
2867,631713873519706112,In other news vaping lisa has upgraded her vape http://t.co/E4LwmCX14b,partydogge,2015-08-13 06:28:18+00:00
2868,631713820793147392,Never take vape juice flavor advice from a guy who eats tri tip with ranch,AnthonyBonddd,2015-08-13 06:28:06+00:00
2869,631713811620339712,Team Atom hard at work figuring out what goes where :) #VapeLife http://t.co/FNR9SfHIvK,Atom_Vapes,2015-08-13 06:28:04+00:00
2870,631713778518880256,Team Atom hard at work figuring out what goes where :) #VapeLife http://t.co/ouXyAdo74U,Atom_Vapes,2015-08-13 06:27:56+00:00
2871,631713738542813185,Vape life,st_st_b,2015-08-13 06:27:46+00:00
2872,631713667386617857,thevaporboy's photo https://t.co/oTA2Jmkgg5 #vape #vapefam #vapecommunity #driplyfe #dripjuice #cloudchaser #flavachaser #mechlyfe #modlyfe,BoneSaw77,2015-08-13 06:27:29+00:00
2873,631713659543158786,Win a Joyetech EVIC VT Kit from @cigbuyer and @huffandpuffers: http://t.co/pwtttgxY49 #ecigs #vaping #evicvt #vapecontest #vapegiveaway,meowmix915,2015-08-13 06:27:27+00:00
2874,631712832799682560,My vape broke,TempoBot,2015-08-13 06:24:10+00:00
2875,631712786519863296,Naked Under the Vape http://t.co/LmZrS4frIS,HiFiShirts,2015-08-13 06:23:59+00:00
2876,631712769453199360,Sitting in the front porch vaping and drinking a little while waiting for the meteor shower we're… https://t.co/9K9lV6jY1y,No_Ka_Oi_,2015-08-13 06:23:55+00:00
2877,631712657637117955,we get it YOU VAPE http://t.co/jlWUjFkgLT,kiwiscurl,2015-08-13 06:23:28+00:00
2878,631712457132675073,Hotspots when building my rtas http://t.co/VMBGqCPPCl #vape #ecigs #reddit,ukvaper,2015-08-13 06:22:41+00:00
2879,631712454750310401,difference between non nicotine juice and nicotine juice? http://t.co/tdIOZjmjJg #vape #ecigs #reddit,ukvaper,2015-08-13 06:22:40+00:00
2880,631712127053602816,Photo: That’s right folks The Vape Lounge is now going to be carrying Limitless!! Stay tuned……… #vape... http://t.co/o4pFxJdYp4,DOCPHEELGOOD,2015-08-13 06:21:22+00:00
2881,631712123203252224,"That's right folks The Vape Lounge is now going to be carrying Limitless!!
Stay tuned.........
#vape… https://t.co/d6K29xHSxP",murdermodsinc,2015-08-13 06:21:21+00:00
2882,631711908505210880,"Promote vaping if we are serious about ending smoking.   We have the nudge, let's use it. http://t.co/O9M9dZoDvX",danielmabuse,2015-08-13 06:20:30+00:00
2883,631711790481719296,Do I go with the vape pen or the bong before I watch some netflix?,TramainePM,2015-08-13 06:20:02+00:00
2884,631711589322858497,VAPE God,SeilerCameron,2015-08-13 06:19:14+00:00
2885,631711550827401217,there are 2 kinds of Vapers: the jehovah witness' that try to get ya to join their vaping cult &amp; the one who asked if its ok if he vapes,DjPiThePi,2015-08-13 06:19:05+00:00
2886,631711524407513088,"Using new #kandypens herb vape pen, staring out window @ stars. Can't see 1 fucking meteor. It's early &amp; that's ok. Will def sleep tonight.😴",Cori_LA,2015-08-13 06:18:58+00:00
2887,631711445995028480,Christian dads who vape,erin_c_k_s,2015-08-13 06:18:40+00:00
2888,631711423291232256,"Mario at EPR: bro u vape?
Other bro: yeah bro 
Both bros :Bro 💨",tiffsaid_,2015-08-13 06:18:34+00:00
2889,631711411111075840,Lol whoops vape*,lolitanecka,2015-08-13 06:18:31+00:00
2890,631711219678752770,tony just told me a story about how 10 random guys came into zach's house by mistake last week wanting to 'get naked and vape' 😂,kcforvice,2015-08-13 06:17:46+00:00
2891,631711130973421569,"Hey vapors 
Come out to ecc2015 in pamona this weekend to hall7 and find mystic gypsy vapors
#getlikeus #vape #girlthatvape #mysticgypsy",blueeyeddoll818,2015-08-13 06:17:24+00:00
2892,631710944423448576,regrann from whitemanblackarm  -  Truth!! LMAO! #thetruth #Regrann @ The Vape Lounge https://t.co/0G7S4hgvsA,The_Vape_Lounge,2015-08-13 06:16:40+00:00
2893,631710861090926592,"We get it , you vape .",joshladrido,2015-08-13 06:16:20+00:00
2894,631710816274882560,"RT shad0wth3fall3n: http://t.co/DSs5EfyUtp; 
Playing some Hearthstone​ for a bit, come check it out, or chat with me :D #Hearthstone #vape…",vapemerch,2015-08-13 06:16:09+00:00
2895,631710814559432704,RT icigirisliu: The more you VAPE the more DATE... #icig #vape http://t.co/1fY21txWxV,vapemerch,2015-08-13 06:16:09+00:00
2896,631710811283660800,RT esheeshvaping: Something for every taste - Super E-liquids in stock ==&gt;&gt; http://t.co/xGtX41pWen  #vape #e-liqu… http://t.co/hKE7hJWye4,vapemerch,2015-08-13 06:16:08+00:00
2897,631710792992301060,"Atom getting ready to set up booth at the ECC, Booth number 1147 Building Hall 7. http://t.co/TZAZYd7sY3",Atom_Vapes,2015-08-13 06:16:04+00:00
2898,631710788974047232,Oh for the love of Vape,BlakeTalaugon,2015-08-13 06:16:03+00:00
2899,631710754396356608,"Atom getting ready to set up booth at the ECC, Booth number 1147 Building Hall 7. http://t.co/fCjqius6jJ",Atom_Vapes,2015-08-13 06:15:55+00:00
2900,631710741637255169,"We get it, you can do vape tricks #meteorshower http://t.co/vDKOofbrDq",brainchildchris,2015-08-13 06:15:52+00:00
2901,631710647936544768,"❌❌Coming soon❌❌ 
@limitlessmodco  will be available in both shops 

The Vape Lounge 
360 West 9th… https://t.co/v8ffcvwfpW",The_Vape_Lounge,2015-08-13 06:15:29+00:00
2902,631710625102741504,"http://t.co/Q2XdfPJf5j 
Playing some Hearthstone​ for a bit, come check it out, or chat with me :D #Hearthstone #vape #vapeon #vaping",shad0wth3fall3n,2015-08-13 06:15:24+00:00
2903,631710521662795776,S/O to the guy who offered me his vape after seriously a second of meeting him.,BlazingBree,2015-08-13 06:14:59+00:00
2904,631710477685420032,Getting kicked out of Boise Vapers Classifieds &lt; dying,hitthalightz,2015-08-13 06:14:49+00:00
2905,631710367312252928,Deciding what juice to put in your vape is equivalent to girls trying to decide on an outfit.,SuperMcfagbag,2015-08-13 06:14:22+00:00
2906,631710349071286272,Honestly I spend more money in vape than I do anything else.,Drewybroadie,2015-08-13 06:14:18+00:00
2907,631710345606860800,"Money spent on vaping per week is way under what I spend, but aye. 135 days 🎉💥 http://t.co/INHkgHiZNU",Leyuhm,2015-08-13 06:14:17+00:00
2908,631710234994606080,Science proves what we all already knew! Vaping &gt; tobacco http://t.co/wYmM203Ixd,vapelyfe253,2015-08-13 06:13:51+00:00
2909,631710177029320704,Also make sure you start scootering asap so you can do your vape tricks on your sick ride https://t.co/vxdkov2eDP,renea_olivia,2015-08-13 06:13:37+00:00
2910,631710165469786112,Win a Whiteout Evolv DNA200 Box Mod! #vaporjoes #vapingunderground #vaping http://t.co/uKsMBFcERH,Lito_Lavo,2015-08-13 06:13:34+00:00
2911,631710084221964289,Vape On,AkaSkyBlue,2015-08-13 06:13:15+00:00
2912,631709957713448960,we get it you vape http://t.co/ST3dm6gSIC,chooseagoose,2015-08-13 06:12:45+00:00
2913,631709790419292160,#incomingfreshmanadvice buy a vape pen as soon as possible you'll be super cool puffing those vapor o's,michaelaalynnee,2015-08-13 06:12:05+00:00
2914,631709740758728704,"If an SCV kid vapes and nobody sees it, is he really from SCV?",jvckryan,2015-08-13 06:11:53+00:00
2915,631709320636293121,i created the vape era,ebola2k25,2015-08-13 06:10:13+00:00
2916,631709286956032001,Vape juice,JasonSchmidt97,2015-08-13 06:10:05+00:00
2917,631709053643657217,When your vape dies mid Pull :(,HenneyKravitz,2015-08-13 06:09:09+00:00
2918,631708752832561152,Use your #logicecig! Start vaping today and save:http://t.co/p3p2fKmRxp http://t.co/7GAbyMMFlx,LOGICSMOKES,2015-08-13 06:07:57+00:00
2919,631708712776826880,vape or gtfo,WildcatConnor,2015-08-13 06:07:48+00:00
2920,631708651594477568,"If I was in Star Wars, I'd be Darth Vaper",naythaniell,2015-08-13 06:07:33+00:00
2921,631708493079162880,FDA Proposed Regulations On Vaping! http://t.co/UqCjjN1cGr http://t.co/VgiaFBuRIn,PostAdviser,2015-08-13 06:06:55+00:00
2922,631708358060302337,Wtf are those vapes and ciggs????? https://t.co/cZIUZ82ELk,MHaffizJ,2015-08-13 06:06:23+00:00
2923,631708305165975552,Do you even vape bro?,ashlyn_brumley,2015-08-13 06:06:11+00:00
2924,631708221917368320,Berry Blue - eLiquid Flavor http://t.co/Wg3kyu8edu #vape #BerryBlue http://t.co/eKgwfD8gQ2,4_Fox_Sakes,2015-08-13 06:05:51+00:00
2925,631708021530345472,Win a Joyetech EVIC VT Kit from @cigbuyer and @huffandpuffers: http://t.co/KintODoMM1 #ecigs #vaping #evicvt #vapecontest #vapegiveaway,ShortMicheal2,2015-08-13 06:05:03+00:00
2926,631707921160663040,If everyone could please address @GoldGloveTV as OG Vape Lord moving forward it would be much appreciated. Thank you. Have a great night.,VernNotice,2015-08-13 06:04:39+00:00
2927,631707701484109824,"😂😩 Tag your BFF!! Use code ""420"" for 25% off dry herb and wax vape pens at http://t.co/YltBYivdTl… https://t.co/jPq4NwOM2J",noturnikki,2015-08-13 06:03:47+00:00
2928,631707679157653504,"I just hit the vape, I'm so drunk",abstractrodent,2015-08-13 06:03:41+00:00
2929,631707649629786112,#SXK #vape #vapor #vaporshark #bigscreen black/blue color http://t.co/wAzgF9Y63Q,SxkVape,2015-08-13 06:03:34+00:00
2930,631707614913556481,Stop engaging in vaping until results are conclusive: health Ministry  http://t.co/LpDYkL3FAR,MJNeNews,2015-08-13 06:03:26+00:00
2931,631707526443102208,Finna hit up lone star vape soon,gpena9720,2015-08-13 06:03:05+00:00
2932,631707144115482625,N OMFG ITS A SONG JFC I DONT WANT A VAPE PEN http://t.co/LDnyJp7kan,avedanna,2015-08-13 06:01:34+00:00
2933,631707063534485504,They Call Me Vape Genie©,cultpunkhero,2015-08-13 06:01:15+00:00
2934,631707052591595520,"Twitter Poll: Vapers or smokers?

Just counting comments. I don't have time for that RTs or stars bullshit.",nonprophetess,2015-08-13 06:01:12+00:00
2935,631706959587188736,Swansboro should get rid of all the damn vape shops and add chick fil a and cook out,joeyyyyyyyy_,2015-08-13 06:00:50+00:00
2936,631706956370190336,Something for every taste - Super E-liquids in stock ==&gt;&gt; http://t.co/Lse5ZrJ3p0 #vape #e-liquids http://t.co/yDYaR2tnK5,esheeshvaping,2015-08-13 06:00:49+00:00
2937,631706942419767296,Damn idk who stole my phone &amp; vape but homies aint homies i hope i find out tho but they better hope i dont,WyattZink,2015-08-13 06:00:46+00:00
2938,631706937554563073,"RT RealDonnaDeVane: IEKI'S ISLAND POMEGRANATE IN W VIBRANT LEMON EXHALE
Mad Ape #Vape Magic #Vaping
… http://t.co/TtJyPJdByY",vapemerch,2015-08-13 06:00:45+00:00
2939,631706935461552128,RT MiracleCuresYou: TKCLOUDS: RT cannafinancing: http://t.co/akOnngMF7R; can finance UR #cannabis or #vape busine… http://t.co/ZXT6TgzUxM,vapemerch,2015-08-13 06:00:44+00:00
2940,631706930801717249,RT BoneSaw77: worldwidevapers's photo http://t.co/fZVyGiXNyO; #vape #vapecommunity #driplyfe #dripjuice,vapemerch,2015-08-13 06:00:43+00:00
2941,631706928079589376,RT VapeDon: NEW Innokin Disrupter Review! | TiaVapes http://t.co/IJY0wHBag0  #Vape #ecig,vapemerch,2015-08-13 06:00:42+00:00
2942,631706925651111936,RT aymanwhat: This is a nice night #VapeOn #vapelife #vaping #vape http://t.co/TTy4e3sfdn,vapemerch,2015-08-13 06:00:42+00:00
2943,631706884492394496,"Save up to 50% on all Organic #Nicotine Solutions for your #ejuice at #WizardLabs. http://t.co/nqybZbOSTP 
#ecigs #ecigarettes #vape #vaping",nickjroymba,2015-08-13 06:00:32+00:00
2944,631706776178593792,Reason why #vape is not healthy is cause our government will lose alot since ciggys are not selling well &amp; no money from ciggy tax.,extremesh,2015-08-13 06:00:06+00:00
2945,631706758327717888,vape bangle,vapeeverything,2015-08-13 06:00:02+00:00
2946,631706727507890176,fuck i thought my grandpa saw me vape wtf,backwoodprince,2015-08-13 05:59:55+00:00
2947,631706688823889920,"""I smoked a vape the other day. It was so dope"" - Alex MacDonald",paigestampatori,2015-08-13 05:59:45+00:00
2948,631706586294030336,official_vape_memes's photo https://t.co/wnDdtlXjq0,WhoAreTheVapers,2015-08-13 05:59:21+00:00
2949,631706354818789376,alright bro we get it you vape,desaraevalen,2015-08-13 05:58:26+00:00
2950,631706096189616129,I just spilt half of my vape juice on my bed 😡,Autieranevada_,2015-08-13 05:57:24+00:00
2951,631705953046409216,Win a Whiteout Evolv DNA200 Box Mod! #vaporjoes #vapingunderground #vaping http://t.co/5kiJ4dDtUX,plopnl,2015-08-13 05:56:50+00:00
2952,631705784162717696,"There's nothing wrong with the vape culture. Cuma bila dah jadi trend, orang salah guna. Hence, the negative perception. ✌",ShahmiNazir,2015-08-13 05:56:10+00:00
2953,631705721348853764,Aye tyler when you see this s/o to you for legit being the first nigga in copa to vape this. If you disagree #Youdumb http://t.co/nHTr3LHQ2R,slowimpreza_jp,2015-08-13 05:55:55+00:00
2954,631705619188289536,"#colombianpower @andrearincon_ with repostapp.
・・・
I never go out without my new vape and yummy… https://t.co/OHLizL3MQv",hugui_humi,2015-08-13 05:55:30+00:00
2955,631705412325109760,Have u heard of #eCigs? Try #V2Cigs #V2Pro #coupon SOFLA10 #ecigarettes #VAPOR #SMOKE #eCigs #eLiquids #Vaping http://t.co/plZnK2HRAl,Dianafbrantley1,2015-08-13 05:54:41+00:00
2956,631705389361315840,The topic is just supposed to be about vape.... Siallah Zul. Hahahahaha babi,fxrxhdxxlx,2015-08-13 05:54:35+00:00
2957,631705223258501120,Esquare and Epetite DNA40 Box Mod by Lost Vape http://t.co/OgXGKxchDb,lostvapeLinda,2015-08-13 05:53:56+00:00
2958,631705157475172352,RT sfatadoug: On the eve of #ecc2015 I feel very conflicted and dismayed. I feel #vape advocacy has hit a wall and taken the fight out of m…,vapemerch,2015-08-13 05:53:40+00:00
2959,631705156539842560,"RT MrTastyVapor: Read vaper stories, and share your story where it matters the most -&gt; http://t.co/x0RkXgXxwA  #vape #ecigs",vapemerch,2015-08-13 05:53:40+00:00
2960,631705037878652928,Hellz yeah new vape. http://t.co/JvGUj8DMtl,whiteajgreen,2015-08-13 05:53:12+00:00
2961,631704777047478273,VAPE PEN OR DIE https://t.co/fRROh6BtOf,_laurenpham,2015-08-13 05:52:10+00:00
2962,631704700631453696,Everybody's vaping o.o,DavinahM95,2015-08-13 05:51:51+00:00
2963,631704524315586560,I'm at Vape Empire https://t.co/R7WkdRrKAH,HaziqRais,2015-08-13 05:51:09+00:00
2964,631704345155760129,Idk if it's just me but anyone notice that we been getting more tropical depressions since Guam started Vaping?.... #coincidence ? Lol 😂😂,djjpogi,2015-08-13 05:50:27+00:00
2965,631704257230565376,"#ecigaretes http://t.co/AUJJ5Vryt5  Vapor4Life switch to e-cigarettes -e-cig, vaping,  #electroniccigarette #healthalternatives  Latestsales",planetgoldilock,2015-08-13 05:50:06+00:00
2966,631704256446251008,"#ecigaretes http://t.co/VYzoyzp56D  Vapor4Life switch to e-cigarettes -e-cig, vaping,  #electroniccigarette #healthalternatives  Latestsales",GoldilocksNews,2015-08-13 05:50:05+00:00
2967,631704253535420416,If anyone is selling a vape hmu please,hovigbabian,2015-08-13 05:50:05+00:00
2968,631704231079096320,Like vape is the electronic hooka and they both pointless to me,Pepe_FatSack,2015-08-13 05:49:59+00:00
2969,631704211143553025,its some chemical vapor. Not water vapor for sure. Melecur la paru2 kalau vape tu wap air.,ajoyaesthetics,2015-08-13 05:49:55+00:00
2970,631704001655009280,#comingsoon! To this label! No official #releasedate yet though. The cover has vape_that on it. With… https://t.co/c0BnUszwWf,paddtonerecords,2015-08-13 05:49:05+00:00
2971,631703744850190336,"#watermelon #vapejuice Why do you smell SOOO good, but taste so awful? #pleasesendhelp #vape #RDA #yuck http://t.co/9bTkOi3AsO",Brendin_Ross,2015-08-13 05:48:03+00:00
