,TweetID,TweetContent,TweeterUsername,TweetDatetime
0,635602394772967424,"The saying ""we get it, you vape"" is quickly becoming my favorite things",JonVergara,2015-08-23 23:59:54+00:00
1,635602331334127616,Help! Will this damage my mod? http://t.co/NBifP8T5DD #vape #ecigs #reddit,ukvaper,2015-08-23 23:59:39+00:00
2,635602330465910784,Help me pick out a new mod? http://t.co/R12T6k5gTb #vape #ecigs #reddit,ukvaper,2015-08-23 23:59:39+00:00
3,635602329526407168,KickAss Ejuice Flash Sale. SnickerDoodle 120ml $15 2 Hours Only http://t.co/v0bz5HaQNQ #vape #ecigs #reddit,ukvaper,2015-08-23 23:59:38+00:00
4,635602162295304192,I'm so mad. my vape broke and its only been 3 weeks 😭,chelseedv,2015-08-23 23:58:59+00:00
5,635602115616993280,"#freshmanadvice if u boys want to get the attention on of upperclass girl but her bf is cockblocking you, just vape on her. shell see reason",yeoreumsgf,2015-08-23 23:58:47+00:00
6,635602092854345729,.@darrenhill1 real science and facts #vaping http://t.co/NeQa5edBn6,DaveWaffles777,2015-08-23 23:58:42+00:00
7,635602043197980673,PowerVapeNetwork just went LIVE at [ http://t.co/eaogKB8LYi ] on @Vapersdottv - #AutoTweet #Live #Video #Vaping #Vapers #ecig #Vapor,LiveOnVapers,2015-08-23 23:58:30+00:00
8,635602034159407104,the girl next to me at 5sos has a vape pen great!!!1!!!1!1!!!1,anna_nordmann,2015-08-23 23:58:28+00:00
9,635601699885989889,"|￣￣￣￣￣￣|  
|    Will Do      |
|  Vape Tricks |
|    For $$$     |
|＿＿＿＿＿＿| 
(\__/) || 
(•ㅅ•) || 
/ 　 づ",alexalleah,2015-08-23 23:57:08+00:00
10,635601669208834048,According to Campaign for.. http://t.co/OSH1S4SHDe #trustedsolution #lunarroverusa #vape #vaping #vapelife #vapelyfe #eliquid #ecigs,LunarRoverUSA,2015-08-23 23:57:01+00:00
11,635601534345179136,when u vape http://t.co/dokBBHCWpc,RemiiChan,2015-08-23 23:56:29+00:00
12,635601273144782848,"""@FreddyAmazin: how the hell is this vine so well made  https://t.co/E3W0ddi7FB"" we get it. You vape.",DepressyBurrito,2015-08-23 23:55:27+00:00
13,635601257776852992,Win a Whiteout Evolv DNA200 Box Mod! #vaporjoes #vapingunderground #vaping http://t.co/dHuUxMd6ms,stuminelliz,2015-08-23 23:55:23+00:00
14,635601031729049601,You vape? @bellebrooks__  https://t.co/RJ0WN4jvGs,kaylimiller__,2015-08-23 23:54:29+00:00
15,635600898065043456,This nigga broke my vape 😒,IsaiahBartolot1,2015-08-23 23:53:57+00:00
16,635600841315975169,Don't ever vape while you smoking hukkah. #badidea,dkrockzz,2015-08-23 23:53:44+00:00
17,635600477871304705,I got them Hats for your city only $10 We Ship Anywhere.  #djandmcs #effenvodka #drake #power #vape… https://t.co/xDDaEPjMJ5,word2hiphop,2015-08-23 23:52:17+00:00
18,635600430601498625,Taker.  You vape we get it. http://t.co/UViwFT6bed,TubbyEmu,2015-08-23 23:52:06+00:00
19,635600354944552960,Doctor lobbies for legal ‘life-saving’ via e-cigarettes http://t.co/PCGO5UBmhX #ecigs #vaping #australia,markriseley,2015-08-23 23:51:48+00:00
20,635600294475202560,My moms best friend is showing me her new handheld vape and telling me all about how I'm smoking weed wrong,DelaneyJoanne,2015-08-23 23:51:33+00:00
21,635600291388375044,"IM SCREAMING AT ""I VAPE""",lovelinpowerbye,2015-08-23 23:51:33+00:00
22,635600289827975168,FriGiN just went LIVE at [ http://t.co/PDGcdikvEL ] on @Vapersdottv - #AutoTweet #Live #Video #Vaping #Vapers #ecig #Vapor,LiveOnVapers,2015-08-23 23:51:32+00:00
23,635600214779404288,Is undertaker vaping now? #summerslam,Professor_Tenay,2015-08-23 23:51:14+00:00
24,635600165232111616,Anybody have a vape battery I can cop,thp_bleezy,2015-08-23 23:51:02+00:00
25,635600103496138752,LATENIGHT Tonight! 12 Eastern 9 pacific Brought to you by  and     https://t.co/lB5tKXw1h5 #vape #ecig,ecigitesztek,2015-08-23 23:50:48+00:00
26,635600100635635713,it up too https://t.co/XsoXZ3CflI #vape #ecig,ecigitesztek,2015-08-23 23:50:47+00:00
27,635600012316045312,He vapes now. Not into hotboxing anymore. https://t.co/wsppKvSx68,dvewlsh,2015-08-23 23:50:26+00:00
28,635599988215689216,Antiquated Coat of Vaping,krellsbells,2015-08-23 23:50:20+00:00
29,635599978107277312,So Taker is doing Vape backstage?,hXcFuller,2015-08-23 23:50:18+00:00
30,635599949187706880,elly vapes confirmed,ykryzk,2015-08-23 23:50:11+00:00
31,635599875644784640,"i hate it when people dress like this.....we get it, you vape http://t.co/4k5bFoRB4b",krellsbells,2015-08-23 23:49:53+00:00
32,635599842400694272,When you don't vape all day and the nic hits you like a train. 😲,AllxnCook,2015-08-23 23:49:45+00:00
33,635599841087913984,The Undertaker was never a dead man. He invented vaping 25 years ago. #SummerSlam http://t.co/IYPMbBh48Y,411wrestling,2015-08-23 23:49:45+00:00
34,635599782959050754,"""WE GET IT UNDERTAKER, YOU VAPE""--@Jerry_Cola",nickhexum311,2015-08-23 23:49:31+00:00
35,635599780597637120,I only am vaping from now on,jazzknutson,2015-08-23 23:49:31+00:00
36,635599752063766529,Taker &amp; Big Show on the vape pen.,hadbranson,2015-08-23 23:49:24+00:00
37,635599725316575232,the undertaker vapes,starkspawn,2015-08-23 23:49:18+00:00
38,635599705896960000,Undertaker is just a huge vaper guys,Robby322,2015-08-23 23:49:13+00:00
39,635599654772543488,Now is the best time to make the switch to vaping. http://t.co/NVPiJJjUnl,SouthBeachSmoke,2015-08-23 23:49:01+00:00
40,635599651249487872,Undertaker is very much into vaping.,deano_mufc,2015-08-23 23:49:00+00:00
41,635599612259254272,💯 @ Crescent City Vape https://t.co/7cS2UjuCcA,papa6less,2015-08-23 23:48:51+00:00
42,635599609579077632,UNDETAKER IS VAPING SO HARD #SUMMERSLAM,TheeClownPrince,2015-08-23 23:48:50+00:00
43,635599604445257729,Happy Bday fishbowl/whitey/Vape queen💖💖 Have a great day and hope you find a new pole😊18 yeeears 18 yeeears... http://t.co/Y5ltrENugl,ri0tvansarah,2015-08-23 23:48:49+00:00
44,635599596194959360,Undertaker breaks lights and vapes,IYQbd,2015-08-23 23:48:47+00:00
45,635599406616715265,Just spilled 10ml of vape juice in my bed. http://t.co/BXdN6ptF5I,MidsR4Kids,2015-08-23 23:48:02+00:00
46,635599388660899840,"At one end of my street, an Astrological Advisor &amp; at the other, a vape store",JacobDFuller,2015-08-23 23:47:57+00:00
47,635599301385699328,I'ma try this next time u vape @skyler_t3  https://t.co/sVi5A2Hz2y,josh_fail11,2015-08-23 23:47:36+00:00
48,635599153511268352,why do people record them vaping or smoking on their snapchat story?,teannalathum,2015-08-23 23:47:01+00:00
49,635599113984339968,LATENIGHT Tonight! 12 Eastern 9 pacific Brought to you by @FakefunkW and @ParrotVapors http://t.co/P6G6ZvxXe0 #vape http://t.co/hxE5ZK7Vli,FakefunkW,2015-08-23 23:46:52+00:00
50,635599026105241600,My Young God.... #djandmcs #effenvodka #drake #power #vape #selfie #tbt #photo #dubai #picoftheday… https://t.co/9MCL5xJXXa,word2hiphop,2015-08-23 23:46:31+00:00
51,635598956076990464,Vaping noodle steam,ThugDove,2015-08-23 23:46:14+00:00
52,635598876116918272,My parents have accepted the fact I have a vape. I can actually finally do it around them lol,evdayimlittina,2015-08-23 23:45:55+00:00
53,635598628585885696,"Ordered a vape, last attempt to stop smoking",SayHello2Jack,2015-08-23 23:44:56+00:00
54,635598597027930112,RT hdmiblake: Sober_Boyz #vape it up too,vapemerch,2015-08-23 23:44:49+00:00
55,635598595501203456,RT ProVape: Be true to yourself and only #vape the best #VapeProVari http://t.co/8RiQ9qfhj4,vapemerch,2015-08-23 23:44:48+00:00
56,635598594024861696,RT Smokazon: Ever wonder what the optimal temperature for vaping is? We break it down right here for your guidance http://t.co/2KimeYtQ9O …,vapemerch,2015-08-23 23:44:48+00:00
57,635598592074493953,RT davi_glasberg: A fun night! Thank you to everyone that showed up last night MainStageVapes #vape #Vapecommunity… http://t.co/8hq1zYZ1Nz,vapemerch,2015-08-23 23:44:47+00:00
58,635598543932141568,When your mom finds out you vape😅 but thinks it's like smoking a cigarette 😐😂 like its flavoring,ManuelZameza,2015-08-23 23:44:36+00:00
59,635598494422536193,someone should make Vapor Patches to help people quit vaping,ztencil,2015-08-23 23:44:24+00:00
60,635598419520700416,I REFUSE to let an insult get to me if it comes from someone who's vaping in their Twitter avi.,sadsussi,2015-08-23 23:44:06+00:00
61,635598385811222529,My vape is better than @KnobJockeyNiall 's http://t.co/Wd5hRSxnoe,Chrysantheus,2015-08-23 23:43:58+00:00
62,635597949385490432,"The After Math: A robot fights for funding, vaping&amp;#039;s vote of confidence - Engadget http://t.co/8Xp0EQMNdi",math__dp,2015-08-23 23:42:14+00:00
63,635597872155742208,y'all know vaping for 15 minutes is the same as smoking 25 cigarettes right? http://t.co/T9monB7LSm,autumn_box,2015-08-23 23:41:56+00:00
64,635597756443131905,Strawberry Hookah E-Cig Vape Pen Protector Vaping Stand Holder by Vapeitsafe via @Etsy http://t.co/VuOSR9nba2 via @Etsy,VapeItSafe,2015-08-23 23:41:28+00:00
65,635597751179304960,"Boost board, vape stick, hot shorts. Maximum millennial.",Rsquared,2015-08-23 23:41:27+00:00
66,635597692140437505,i have a humidifier in my room so im gonna post a pic of it and pretend i vape,xGiftss,2015-08-23 23:41:13+00:00
67,635597520157188096,"Teen vaping rates are escalating and putting large numbers at risk of escalating to smoking, study finds. http://t.co/ZhN3kpcMRD",SN_Explores,2015-08-23 23:40:32+00:00
68,635597505774944257,That #maxvg life 😮💨 #eastcoastvapers #vape #Vapelife #vapetricks #vapeporn #vapelyfe #vapefam #vapenation #... https://t.co/0pUgIoYZMZ,Daily_Vape_Porn,2015-08-23 23:40:28+00:00
69,635597479505850368,thought i met someone cool today until they told me they set the smoke detector off in their dorm from vaping,collinwisler,2015-08-23 23:40:22+00:00
70,635597453711011840,Tonight 8pm FSRR with @SeanSkull and special Guest! http://t.co/IKlGc9x7sD #vapeshow #capeshow #vape #ecig,VAPENETWORK,2015-08-23 23:40:16+00:00
71,635597419766415360,"Vape on Vape heads @FuzionVapor , wish u would allow wholesale because just opening a store and nothing as good as your ejuice and Prime 😁",comedytragedy10,2015-08-23 23:40:08+00:00
72,635597381367660544,#freshmenadvice don't forget to charge your vapes,Ty_Espada,2015-08-23 23:39:59+00:00
73,635597347943268352,We Sent A SECRET New Penny Stock Pick To Our Platinum Members! Get Exclusive Special Access: http://t.co/sJCFystTVz $VAPE $IPSEY $AFFU,MoneyMarketzz,2015-08-23 23:39:51+00:00
74,635597336920461313,"idea: a vape crew called ""SCV"" or ""Santa Clarita Vapers""",probablytaylor,2015-08-23 23:39:48+00:00
75,635597204191744000,Had a Vape Sesh at the Stub Hub http://t.co/rGSIBVbadU,Gilbert_AyAr,2015-08-23 23:39:16+00:00
76,635597093285924864,VapeOnTV just went LIVE at [ http://t.co/dUE6ovOVOl ] on @Vapersdottv - #AutoTweet #Live #Video #Vaping #Vapers #ecig #Vapor,LiveOnVapers,2015-08-23 23:38:50+00:00
77,635597025044619265,"The villain cocks his weapon.
""VAPE TO MEET YOU, BATMAN""",jondauthor,2015-08-23 23:38:34+00:00
78,635596890927706112,Selling my vape! http://t.co/Y4qeQEPJk3,_PolishedM,2015-08-23 23:38:02+00:00
79,635596829531447296,Got my own vape finally. I know Its nit the best model but i don't like the regtangular ones. The… https://t.co/bsRO4A3pQr,SeritoninTV,2015-08-23 23:37:47+00:00
80,635596751525642240,The more I hit the vape the more hazy I become 💨💨💨,ThecrimsonFuxkr,2015-08-23 23:37:29+00:00
81,635596730449326080,"Liquid List Update: 'August 24th 2015' 
Link: http://t.co/W6VtLlNGVD

#vaping #vape #vapeuk #ukecig #eliquid #VapeOn http://t.co/MwpI4jAb5j",Phoenix_Eliquid,2015-08-23 23:37:24+00:00
82,635596545346269184,u can find me in the cyber slums vaping n listening to vaporwave mixes,AtticusXCX,2015-08-23 23:36:39+00:00
83,635596452442583041,I LOVE CRUSTY'S VAPE JUICE IMPORIUM http://t.co/mqYvlCHOi4 #WIN #GIVEAWAY #FREE,GabbyVapes,2015-08-23 23:36:17+00:00
84,635596416191172608,Strawberry Hookah E-Cig Vape Pen Protector Vaping Stand Holder by Vapeitsafe via @Etsy http://t.co/VuOSR95Aiu via @Etsy,VapeItSafe,2015-08-23 23:36:09+00:00
85,635596377138053121,annie-vape green,iz_obel,2015-08-23 23:35:59+00:00
86,635596180655853568,Ever wonder what the optimal temperature for vaping is? We break it down right here for your guidance    https://t.co/f26Syh6GMt #vape #ec…,ecigitesztek,2015-08-23 23:35:12+00:00
87,635596169129803776,Vape juice and car seats.,NetflixaDDic94,2015-08-23 23:35:10+00:00
88,635596154487468032,E-cigarettes “95 per cent less harmful than smoking”: “The new study does not show that vaping leads to smokin... http://t.co/XAnfzAGdLD,ayskj_store,2015-08-23 23:35:06+00:00
89,635596065006329856,Someone was vaping and set off the fire alarm and the whole building had to be evacuated.,chel_lurz,2015-08-23 23:34:45+00:00
90,635595997461086208,Some guy just pulled out his vape thing in front of me. Oh my.,apricot_lacroix,2015-08-23 23:34:29+00:00
91,635595882809823232,I'm vaping so hard rn,BanzaiTakesAnal,2015-08-23 23:34:01+00:00
92,635595827000381441,The_Asylum just went LIVE at [ http://t.co/1UHcKCKRlp ] on @Vapersdottv - #AutoTweet #Live #Video #Vaping #Vapers #ecig #Vapor,LiveOnVapers,2015-08-23 23:33:48+00:00
93,635595799682936833,Vaping and playing on the one: http://t.co/gohYYthq4e,TheVikingGizmo,2015-08-23 23:33:42+00:00
94,635595707773157376,"I wonder what's more profitable, being a vape salesman or a kendama dealer?",huertalove_,2015-08-23 23:33:20+00:00
95,635595643474436096,We get it you vape.,Eddie_S96,2015-08-23 23:33:04+00:00
96,635595540407840769,Cape nigga Vape,delliso2,2015-08-23 23:32:40+00:00
97,635595266888990721,Hey Vapers this awesome Wick Tonic is available at The Vape Saloon in Stanton De. They are the Cheers of vape... http://t.co/NyPU7UdVdc,Loco_Baker,2015-08-23 23:31:35+00:00
98,635595212463689729,That vape life 😙😙😙 https://t.co/n4e29OuI4M,Miracleshake,2015-08-23 23:31:22+00:00
99,635595052404727809,"Whole house also is Vape and blackberry flavor , GG soon",henry96_,2015-08-23 23:30:43+00:00
100,635594900642398209,Ever wonder what the optimal temperature for vaping is? We break it down right here for your guidance http://t.co/IEsOtQuBuU #vapetemp #vape,Smokazon,2015-08-23 23:30:07+00:00
101,635594876105674752,vape chronometer,vapeeverything,2015-08-23 23:30:01+00:00
102,635594798213255169,I love college vape,SweetTBai,2015-08-23 23:29:43+00:00
103,635594532319444992,Vaping 95% less harmful than smoking! That's according to the public health of England.      http://t.co/iEZ6kgLFuK,SamFares2015,2015-08-23 23:28:39+00:00
104,635594497796083712,Vaped and afraid,guccicookies_,2015-08-23 23:28:31+00:00
105,635594474215772164,TStormsVaper just went LIVE at [ http://t.co/TKWH5mptcd ] on @Vapersdottv - #AutoTweet #Live #Video #Vaping #Vapers #ecig #Vapor,LiveOnVapers,2015-08-23 23:28:26+00:00
106,635594473569951744,when u spill vape juice all over ur bed &lt;&lt;&lt;&lt;&lt; :(,arleenmundi,2015-08-23 23:28:25+00:00
107,635594427847864320,"Yo bra,how big are the coils in your vape bra? Dude bra I got stock coils braa. Pshhhhhhhhhhhhhhhhhh",Esteez11,2015-08-23 23:28:15+00:00
108,635594260830547968,EvolutionVapingOrg just went LIVE at [ http://t.co/qEaEoYbQBH ] on @Vapersdottv - #AutoTweet #Live #Video #Vaping #Vapers #ecig #Vapor,LiveOnVapers,2015-08-23 23:27:35+00:00
109,635594218405146624,NEVER TAKE A VAPE FROM A NIGGA WHO WATCHES NAURTO.,casaxalpha,2015-08-23 23:27:25+00:00
110,635594114914889728,One of the realist moments on Wednesday night was when my mom took a shot w/ us &amp; started vaping too.,zaidnataliee,2015-08-23 23:27:00+00:00
111,635593863000752129,"Yo, it really feels like Brooklyn is trying to fill the entire arena with vape.",JeffGrubb,2015-08-23 23:26:00+00:00
112,635593794797346817,Six Flags is Vape Friendly! #Hulla #hullavapes #vape #vaping #supportvape #vapers #vapefam #vapetime #vapelyfe http://t.co/o4xE6ORblo,Hullavapes,2015-08-23 23:25:44+00:00
113,635593727134711808,Out of vape juice lol!,mrsurgis,2015-08-23 23:25:27+00:00
114,635593549954854912,Vape god,Landon_rich,2015-08-23 23:24:45+00:00
115,635593509026832384,Stopped @ProvPlaceMall today &amp; saw #ecig kiosk. People #vaping inside mall. This is really happening? #gross #nothanks  #providence,Sandy_McGee,2015-08-23 23:24:35+00:00
116,635593503821594624,"Still a lot of smoke in the arena.  Big Show must be vaping backstage.

#WWESummerSlam 
#SummerSlam",BazarComedy,2015-08-23 23:24:34+00:00
117,635593483760308224,as he walked away all I could think about is the wonder and mystery of his vape clouds and how could one man be so irresistible 👅💯💦🍆,its_fuckin_lit,2015-08-23 23:24:29+00:00
118,635593319335219200,"@ballisticvape and Tradition Vapes Coils. One of the better peach flavors iv had. ・・・
#jus… http://t.co/GFjwPQrSVO http://t.co/fuDvZDt229",TraditionVapes,2015-08-23 23:23:50+00:00
119,635593314654384128,Smoke and fly #stressed #vape #vapeon https://t.co/MyGIXVPnSl,suwail18,2015-08-23 23:23:49+00:00
120,635593234857754624,WE GET IT YOU VAPE http://t.co/oodRmFUGNi,Kathalyn1,2015-08-23 23:23:30+00:00
121,635593204876857344,We get it Brooklyn. You vape. #SummerSlam,end_hits,2015-08-23 23:23:23+00:00
122,635593200162480128,Niggas swear that vape smoke is trees,BeachBoyYoni,2015-08-23 23:23:22+00:00
123,635593115659837440,"Things i want for my birthday
-LOZ hoodie 
-LOZ necklace
-New Modded Vape
-internet",wawa12345678,2015-08-23 23:23:02+00:00
124,635593069321129984,"Strong urges to get another tattoo, buy a gun, tickets to shows, and guitar and vape gear I don't need. #betteroffbroke",Captain_Caplan,2015-08-23 23:22:51+00:00
125,635592786339885056,"Why isn't it so smokey in the arena? It looks like they're wrestling in a vape shop. 
#SummerSlam",RealHeelPodcast,2015-08-23 23:21:43+00:00
126,635592719159529472,It annoys the living shit out of me how everyone is so against vaping in the house. It's just water vapor for god sakes.,BrittanyAlbergo,2015-08-23 23:21:27+00:00
127,635592671570980864,All the smoke is from Big Show vaping. #SummerSlam,carnysuccubus,2015-08-23 23:21:16+00:00
128,635592550708047873,Is there a campfire in the Barclay Center or are all the Brooklyn hipsters vaping right now? #SummerSlam #thefog,dredd_garcia,2015-08-23 23:20:47+00:00
129,635592488099692544,Vaping: a hazard to hearing? #audpeeps #vape #hearingloss http://t.co/7vC6m7vS3B http://t.co/mIlvQM4Zkg,WeekinHearing,2015-08-23 23:20:32+00:00
130,635592433380802560,The Pegasus is coming  (use ASPIRE10 code at checkout) £43 delivered to your door    https://t.co/Fs8vDsT7aG #vape #ecig,ecigitesztek,2015-08-23 23:20:19+00:00
131,635592432382554117,A few aerial drone pics I took a while a ago - not  related  https://t.co/1jaGDTIxFf #vape #ecig,ecigitesztek,2015-08-23 23:20:19+00:00
132,635592322512736256,"We get it WWE, you vape #Summerslam",Stephen_R96,2015-08-23 23:19:53+00:00
133,635592300400279552,why is there smoke in the ring? is randy vaping?,starkspawn,2015-08-23 23:19:47+00:00
134,635592180975833088,"Port Orchard is smokey as fuck 

Fucking Vapers, I swear.",CheewawaLover,2015-08-23 23:19:19+00:00
135,635592065506799616,Enter for a chance to win an awesome vape prize package from http://t.co/dDD45DrpjM! https://t.co/trGOBZjIkB,LasqwaFelix,2015-08-23 23:18:51+00:00
136,635592029091856384,"day 7 without cigarettes, the vape doesn't taste like metal anymore",TimidNewWorld,2015-08-23 23:18:43+00:00
137,635592010414452736,Help finding box mod to go with delta 2? http://t.co/IjiuA15Gz6 #vape #ecigs #reddit,ukvaper,2015-08-23 23:18:38+00:00
138,635592008875151360,Help finding batteries http://t.co/EUZggAsbFw #vape #ecigs #reddit,ukvaper,2015-08-23 23:18:38+00:00
139,635592007352586240,PSA: Don't buy really cheap eBay Juices http://t.co/R4Vubs0PE1 #vape #ecigs #reddit,ukvaper,2015-08-23 23:18:37+00:00
140,635591926176051200,Is everyone in the crowd vaping or what?,KickStunner,2015-08-23 23:18:18+00:00
141,635591832194392064,lol hofstra banned vaping in the dorms #2015 #YouCannotStopmefromVapingInThedDorms,dunecup,2015-08-23 23:17:56+00:00
142,635591803023020036,regrann from tvlsquad_ny  -  im_jasonanthony showing how responsive and hard the TVL Colt .45 hits.… https://t.co/gz67Yn67Aa,The_Vape_Lounge,2015-08-23 23:17:49+00:00
143,635591737067442176,I liked a @YouTube video from @lunarretrospect http://t.co/ubf81BqqyE vaping unicorn blood and a test juice from vapesmoker,KennethBivens90,2015-08-23 23:17:33+00:00
144,635591713944309760,"Cousin: ""I smoked once""
Sister: ""really? what did you smoke??""
Cousin: ""vape pen.""",The_holy_oak,2015-08-23 23:17:27+00:00
145,635591575704354816,The ring looks real hazy rn. Is the Barclay Center vaping?,austin_walker,2015-08-23 23:16:55+00:00
146,635591502115303425,"Barclays Center....we get it, you vape.",rjoconnell,2015-08-23 23:16:37+00:00
147,635591499153960960,It is super foggy in the Barclay's Center right now at #Summerslam. Goddamn vaping Brooklyn hipsters.,AdmiralMikey,2015-08-23 23:16:36+00:00
148,635591489498705921,God damn that Barclays Center looks like a vaper convention,tondog,2015-08-23 23:16:34+00:00
149,635591485048532992,red bull and vape 😍😍,joe_younan6,2015-08-23 23:16:33+00:00
150,635591468434853888,Restock Alert:: smy60 box mod  #vapeport #vapfinds #vapedaily #instavape #vaping #vapeporn #vapelyfe #vape #vapeon http://t.co/3LQmU1sajW,VapePort,2015-08-23 23:16:29+00:00
151,635591430287704064,son you can't hit the vape till you eat all your veggies,mikaylaarambulo,2015-08-23 23:16:20+00:00
152,635591359043252224,I liked a @YouTube video from @lunarretrospect http://t.co/jMOrxkCLSR royal vapes review,KennethBivens90,2015-08-23 23:16:03+00:00
153,635591347299295232,I liked a @YouTube video from @xcodeh http://t.co/jMSYHf562r KIDS THAT VAPE,TTylerJH,2015-08-23 23:16:00+00:00
154,635591214235025408,my dad left BC I couldn't blow O's with my vape pen,gabbbytbh,2015-08-23 23:15:28+00:00
155,635591214037864448,"We get it Asuma, you vape http://t.co/wsRp2AIEal",TrillSensei,2015-08-23 23:15:28+00:00
156,635591202297917440,This nigga just told me vaping was worse than cigarettes and I need to quit.... As he opened up his 2nd can of snuff... Of the day.,AustinBreezy31,2015-08-23 23:15:25+00:00
157,635591140889243648,RT VapeDon: Live Show Schedule http://t.co/9vv7Sh0eJF  #Vape #ecig,vapemerch,2015-08-23 23:15:11+00:00
158,635591139798687745,RT VapeDon: REVIEW OF THE KANGER SUBOX MINI KIT http://t.co/Svn8RfQsBk  #Vape #ecig,vapemerch,2015-08-23 23:15:11+00:00
159,635591136090935297,RT irish_queene: robdelaney Local shop stole your #vape name. #ChristianGorillaDadsWhoVape http://t.co/mvO1hlRyen,vapemerch,2015-08-23 23:15:10+00:00
160,635591094634311680,I liked a @YouTube video http://t.co/nne5R3rqFx Tru Life: I'm A Vape Addict,Matty_Vicious,2015-08-23 23:15:00+00:00
161,635590866275536898,Dude I totally need my vape while I game... http://t.co/ga9Iv1grtU,kwELITEOmahaJP,2015-08-23 23:14:05+00:00
162,635590794519388161,When your dad has the dopest vape youve ever seen,connercleve,2015-08-23 23:13:48+00:00
163,635590763120869376,Live Show Schedule http://t.co/sz4NFZab73 #Vape #ecig,VapeDon,2015-08-23 23:13:41+00:00
164,635590761728376832,REVIEW OF THE KANGER SUBOX MINI KIT http://t.co/jioZUK74cc #Vape #ecig,VapeDon,2015-08-23 23:13:40+00:00
165,635590726596714496,I'll be done with society if Drake ever releases a song about vaping,AaronSommerss,2015-08-23 23:13:32+00:00
166,635590638680023040,"""I vape"" -Courtney Weaver",kathleen_bish,2015-08-23 23:13:11+00:00
167,635590366423478272,Restock Alert: cube x II 160w. #vapeport #vape #VapeOn #vapeporn #vapelyfe #vapecommunity  #vaping #vapeshop #mods http://t.co/dQZZjSnoio,VapePort,2015-08-23 23:12:06+00:00
168,635590316129656832,"Are you Walking Vaped? If you are not, you haven't experienced America's Premier E-liquid on the market. Created... http://t.co/2Jd1sdl6Zb",BlackMesaVapors,2015-08-23 23:11:54+00:00
169,635590305987719168,"friends 2015: chandler is a Vape Dad, ross is a meninist, central perk didnt survive the recession and is now a self-serve yogurt shop",huhlayna,2015-08-23 23:11:52+00:00
170,635590267953876992,One our dorms got evacuated because some kid was vaping to hard,James_Brink,2015-08-23 23:11:43+00:00
171,635590059148840960,y'all think you some hot shit with them vape pens 😂,itsPrettyNikki,2015-08-23 23:10:53+00:00
172,635589943763582977,Do you vape? — hahaha nope ☺️☺️ http://t.co/72UqfARlEG,janeeego,2015-08-23 23:10:25+00:00
173,635589937694310401,i was walking to the 700 building and some guy walks past me and blows his vape in my face (-:,thebirthofethe,2015-08-23 23:10:24+00:00
174,635589896082558976,Trying to be cool with @ElvisTrann vape ........... http://t.co/29zJS91xw6,sadies_grEig,2015-08-23 23:10:14+00:00
175,635589870686240768,vaping @ heaven world https://t.co/2YGqGMm3ZE,dhennyardian,2015-08-23 23:10:08+00:00
176,635589693627760640,We get it you vape  https://t.co/q9eNecFsgt,queenree___,2015-08-23 23:09:26+00:00
177,635589587264512000,We Sent A SECRET New Penny Stock Pick To Our Platinum Members! Get Exclusive Special Access: http://t.co/sJCFystTVz $VAPE $PTAH $TAUG,MoneyMarketzz,2015-08-23 23:09:00+00:00
178,635589533602566148,I've seen so many Vape stores in the south so far,tantalizing_irl,2015-08-23 23:08:48+00:00
179,635589209957470208,How do I know which coil to buy? Do I have to buy ones made for my vape? via /r/Vaping101 http://t.co/yI7Zc3j9e0,VapingEnFrance,2015-08-23 23:07:30+00:00
180,635589189703077888,Got my vape back 😍 yes,stephyy1220,2015-08-23 23:07:26+00:00
181,635589111538151424,WHAT DO YOU MEAN DOWNTOWN DISNEY DOESNT HAVE A VAPE STORE,souppreme,2015-08-23 23:07:07+00:00
182,635589053862281216,Can't take people who brag about vaping seriously.😂😂😂,DADDY123098,2015-08-23 23:06:53+00:00
183,635589032706183169,Morgan is sitting and inhaling vape through her nose and exhaling through her mouth. I only know bc she laughs at herself every so often,taylor_moak_13,2015-08-23 23:06:48+00:00
