,TweetID,TweetContent,TweeterUsername,TweetDatetime
2813,635335888604659712,"IEKI'S ISLAND POMEGRANATE IN W VIBRANT LEMON EXHALE
Mad Ape  Magic 
  https://t.co/kR3hz7TSte #vape #ecig",ecigitesztek,2015-08-23 06:20:54+00:00
2814,635335887631597568,Watermelon Bubblegum that will make your mouth water -&gt;      https://t.co/OY7eRBHCOa #vape #ecig,ecigitesztek,2015-08-23 06:20:54+00:00
2815,635335814642204672,Starbucks Coffee &amp; Vaping. Great combination. 😎💨💨💨 https://t.co/mckpp0IKp6,samueldanmusic,2015-08-23 06:20:36+00:00
2816,635335460684890112,Ding dong ditching still? You probably vape too,jonny_olvera,2015-08-23 06:19:12+00:00
2817,635335273103126528,When hitler run out of e-juice 😁 😁 😁 #vapetrick #vape #vaper #vapers #vapeoftheday #dripclouds… https://t.co/FmDmcZbXzs,vape_mall,2015-08-23 06:18:27+00:00
2818,635334845019783169,"Playstation, alcohol, vape = 😏👌🏼 #perfectsaturday #solo",Lovely4Patricia,2015-08-23 06:16:45+00:00
2819,635334789772390400,.@AtchisonDon check facts n use science before u ban vaping https://t.co/WMGlqLWcfY.,DaveWaffles777,2015-08-23 06:16:32+00:00
2820,635334543361359872,I literally kill a bitch if someone in this hall sets the fire alarms off for vaping in their room,megzxzz,2015-08-23 06:15:33+00:00
2821,635334483651133441,Our hookah is electric so it's basically like a giant vape pen... I feel like a nerd,maddygreene,2015-08-23 06:15:19+00:00
2822,635334416777277440,Don't call me with that at 1 in the morning. Im trying to vape and watch netflix.. 😡,big_kolbs_,2015-08-23 06:15:03+00:00
2823,635334237617586176,I liked a @YouTube video from @tmntyler http://t.co/JctvnReGYA Just Vape Things,MehJamison,2015-08-23 06:14:20+00:00
2824,635334141488205826,With the vape gods and ppl downtown don't like it,morrrg23,2015-08-23 06:13:57+00:00
2825,635333864634736640,"When 2 brony lookin dudes walk into ur work, vaping, with a shirt that has a crossed out female sign on it...n u try not to throw up.,..",soft__puppy,2015-08-23 06:12:51+00:00
2826,635333606999785472,Can't sleep so vape,tootoolalvin,2015-08-23 06:11:50+00:00
2827,635333562699415552,I want a vape so bad,baayflower,2015-08-23 06:11:39+00:00
2828,635333505120137216,by kerman.weed #weed#mari#marijuana #marijuanamodels #marijuanaphotosubmission #marijuanababes #cannabis #vape#vape… http://t.co/MrVpFFCDqy,Mbuki123,2015-08-23 06:11:26+00:00
2829,635333478222065664,by kerman.weed #weed#mari#marijuana #marijuanamodels #marijuanaphotosubmission #marijuanababes #cannabis #vape#vape… http://t.co/SlqKGCs7rE,Mbuki123,2015-08-23 06:11:19+00:00
2830,635333428817231872,Win a Whiteout Evolv DNA200 Box Mod! #vaporjoes #vapingunderground #vaping http://t.co/Ewi6pkggCq,milowalker2,2015-08-23 06:11:08+00:00
2831,635333422592888832,did anyone else see the chewable vapes on the Houston snapchat story?😱😂,BrayleyCrowe,2015-08-23 06:11:06+00:00
2832,635333411494752256,Maybe I'll quit photography and open a vape salon called CBDB's.,communistcasino,2015-08-23 06:11:03+00:00
2833,635333405715005440,novabroadcastings just went LIVE at [ http://t.co/mDTTbkVTMU ] on @Vapersdottv - #AutoTweet #Live #Video #Vaping #Vapers #ecig #Vapor,LiveOnVapers,2015-08-23 06:11:02+00:00
2834,635333042383507456,The EU Versus the People http://t.co/N7bcDV3Drw via @wordpressdotcom #ecigs #vape,Hinodeh,2015-08-23 06:09:35+00:00
2835,635332694445043712,Cambodian dudes that vape a lot are seriously faggots,carsonccarter,2015-08-23 06:08:12+00:00
2836,635332515117580288,"Grand Opening 👑 (@ VVIP13 Barbershop X Vape Squad in Subang Jaya, Malaysia w/ @nazemyibrahim) https://t.co/gKGormykKj",fatinamalinaa,2015-08-23 06:07:30+00:00
2837,635332455818399748,So glad I got this vape no more cigs,SouljaReaux,2015-08-23 06:07:16+00:00
2838,635332297340813312,Tak mampu nak vape so lets vick on #vickon http://t.co/OjR4n2Sg7J,faredabdullah,2015-08-23 06:06:38+00:00
2839,635331950694150146,"Such a hard time figuring if it's vape or a fog machine.  It's both! But I think the vape trumps it, witch is good,  smells soo much better!",eatonjb,2015-08-23 06:05:15+00:00
2840,635331877818249216,Imma pack my vape one more time and I'll be officially tweakin,LILPOPE_,2015-08-23 06:04:58+00:00
2841,635331728165498880,vapers of new york,tinydaughter,2015-08-23 06:04:22+00:00
2842,635331685656059905,Everyone is vaping in this bar lmao,alphakayla,2015-08-23 06:04:12+00:00
2843,635331219832442880,varsity vaper sticks mod in drunken crazy teen,natalieeliseee,2015-08-23 06:02:21+00:00
2844,635331210303045632,"Frontage Road Vape

""We got your vaping equipment right here.""

Mention this tweet for 20% off

Sponsored tweet     Dismiss    x",IraParks,2015-08-23 06:02:19+00:00
2845,635331057341083648,Photoset: untitled87121: sixpenceee: A compilation of smoke rings from volcanos OK WE GET IT. U VAPE. http://t.co/WswihfDts3,LatentOtaku,2015-08-23 06:01:42+00:00
2846,635330940903006208,I liked a @YouTube video http://t.co/q7htDd0X0T Vape Shop Spotlight - TruVape in Las Vegas Nevada,djnotmichael,2015-08-23 06:01:14+00:00
2847,635330889703010306,ECC 2015!!!: Hello vaping friends http://t.co/5g5betI1L8,VapersTube,2015-08-23 06:01:02+00:00
2848,635330828684365825,Lets vape ! #vape #vaping #eliquids #ecigs http://t.co/fY23sZs0ok http://t.co/rcKObt8uQG,esheeshvaping,2015-08-23 06:00:48+00:00
2849,635330828067827712,We have over 80 Superb Eliquids in stock ==&gt;&gt; http://t.co/66H5cLWpJz #vape #e-liquids http://t.co/Pc3k4jXTPw,Esheeshuk,2015-08-23 06:00:47+00:00
2850,635330827421941760,Clearance ! Lets Vape ! http://t.co/tdsvfUWpvr http://t.co/xEAKMhR43d,esheeshecigs,2015-08-23 06:00:47+00:00
2851,635330637038252032,vape knee,vapeeverything,2015-08-23 06:00:02+00:00
2852,635330430758076416,"iJOY Asolo 200 Review is now available on my channel.

#vape #vaper #vaping #vapepic #vapeporn… https://t.co/GWaOoZNsXX",DJLsbVapes,2015-08-23 05:59:13+00:00
2853,635330312743055360,SILAS JUST USED HIS PHONE FROM THE BASEMENT TO TURN YOUTUBE ON MY TV AND PLAY VAPE VIDEOS WTF,samra_paige,2015-08-23 05:58:45+00:00
2854,635330289758175232,"I'd rather lay w you, bby",juuls___,2015-08-23 05:58:39+00:00
2855,635330171667517440,"Semenjak i vape ni, bibir i dah jadi semakin pink. So i really need you all to lower your gaze sisturz",fidonasir,2015-08-23 05:58:11+00:00
2856,635330074884050944,I'm at The Vape https://t.co/y8XV4yP80G,dryasfucx,2015-08-23 05:57:48+00:00
2857,635330048350900224,"Spend $30, get 30% off with code 30for30 on http://t.co/XYYP6oy9Np #vape #eliquid #vapeon #vapelyfe #vapefam #cloudchaser #cloud #sale",EXRvape,2015-08-23 05:57:42+00:00
2858,635330019590410244,LIVE on #Periscope: Vaping https://t.co/izkZ72AVCL,Syaki_Arya,2015-08-23 05:57:35+00:00
2859,635329993086644224,now vaping is new selling point.,NormanLit,2015-08-23 05:57:28+00:00
2860,635329949990154241,"""can we go to the vape shop on monday? i need to do some back to school shopping""",sheeeesshb,2015-08-23 05:57:18+00:00
2861,635329846185431040,Awesome editing!!! #vapetrick #vape #vaper #vapers #vapeoftheday #dripclouds #dripsociety… https://t.co/I3IKHt6ZWI,vape_mall,2015-08-23 05:56:53+00:00
2862,635329761795899393,Vape jokes were strong today,misssavvydaddy,2015-08-23 05:56:33+00:00
2863,635329552890335233,Kill your local vape smoker,OfficalBoloTie,2015-08-23 05:55:43+00:00
2864,635329398200213504,"The best thing I saw today was a tip jar that said ""tip me or I'll start vaping""",dumbnoveltymug,2015-08-23 05:55:07+00:00
2865,635329132927303680,Vaping is Better for You Than Smoking http://t.co/5xsBIjUU3M #ejuice,ShoppingMania1,2015-08-23 05:54:03+00:00
2866,635328993630097408,Dam want my vapes back,zeerveza,2015-08-23 05:53:30+00:00
2867,635328895957512192,I need a new vape. http://t.co/owCnZERHxK,reddireposts,2015-08-23 05:53:07+00:00
2868,635328703430574080,I just began a running workout using #Endomondo. Peptalk me now @ http://t.co/rf9aTTjwkz,juul_andres,2015-08-23 05:52:21+00:00
2869,635328701660459009,Whenever someone vapes around me I'm gonna cough obnoxiously,suavemilliz,2015-08-23 05:52:20+00:00
2870,635328611520749568,vape=swag,Jthiemann23,2015-08-23 05:51:59+00:00
2871,635328549973454848,can I vape in there @umana_dj ?,Shmerk1,2015-08-23 05:51:44+00:00
2872,635328480041811968,If I had 8 hours to vape I'd spend 6 hours cleaning my vape pen.,anbrll00,2015-08-23 05:51:28+00:00
2873,635328389411291137,"#ecigaretes http://t.co/VYzoyzp56D  Vapor4Life switch to e-cigarettes -e-cig, vaping,  #electroniccigarette #healthalternatives  Latestsales",GoldilocksNews,2015-08-23 05:51:06+00:00
2874,635328384478765056,"#ecigaretes http://t.co/AUJJ5Vryt5  Vapor4Life switch to e-cigarettes -e-cig, vaping,  #electroniccigarette #healthalternatives  Latestsales",planetgoldilock,2015-08-23 05:51:05+00:00
2875,635328346184810496,"""No vape, no weed, is this what the pilgrims felt like?""",blackshaw206,2015-08-23 05:50:56+00:00
2876,635328320658276352,Zach just threw up from vaping too much 😂😂😂😂😂,maaggieehamlinn,2015-08-23 05:50:50+00:00
2877,635328303243530240,I love that there's anti smoking commercials actually educating people on how bad vaping/hookah is,AsthmaticStoner,2015-08-23 05:50:45+00:00
2878,635328197148721152,. is giving away a state of the art E-cig kit aka Personal Vaporizer Kit from    https://t.co/G0ZUvxelCW #vape #ecig,ecigitesztek,2015-08-23 05:50:20+00:00
2879,635328195181477888,"Get your very own Brand Ambassador for UR Biz Granny helps!
    https://t.co/b3UWWusNoK #vape #ecig",ecigitesztek,2015-08-23 05:50:20+00:00
2880,635328193986228224,"regrann from - Yeah I'm another year older! Come by for some fun!
 …    https://t.co/xkcK87DQl8 #vape #ecig",ecigitesztek,2015-08-23 05:50:19+00:00
2881,635327768897585152,Win a Whiteout Evolv DNA200 Box Mod! #vaporjoes #vapingunderground #vaping http://t.co/Ql1SQQ0AtF,robv_1978,2015-08-23 05:48:38+00:00
2882,635327744696524800,Just wanted to spend a peaceful night on the deck reading my book but here I am at 2am getting interrogated by my cousin and his vape pen,NE_Fbby,2015-08-23 05:48:32+00:00
2883,635327500437073920,"Vaping for only 3 months.  Need to chill 
#vapelife #vaping #vapingcommunity #clouds  #cloudchasing… https://t.co/U811oUpJXh",matt_dvc,2015-08-23 05:47:34+00:00
2884,635327474428043264,PowerVapeNetwork just went LIVE at [ http://t.co/eaogKB8LYi ] on @Vapersdottv - #AutoTweet #Live #Video #Vaping #Vapers #ecig #Vapor,LiveOnVapers,2015-08-23 05:47:28+00:00
2885,635327317678538753,Vapers or not?,JNKJLGN,2015-08-23 05:46:51+00:00
2886,635327253149188096,Unregulated vape shops fear FDA crackdown - Tribune-Review http://t.co/cufeXf9NqH #ecigs #vaping,VapinXsmoker,2015-08-23 05:46:35+00:00
2887,635326993194549248,RTA recommendations http://t.co/1yMuvnO0Sb #vape #ecigs #reddit,ukvaper,2015-08-23 05:45:33+00:00
2888,635326992263450625,Coil Build Suggestions? Greatly Appreciated! http://t.co/8W83zZQuJ6 #vape #ecigs #reddit,ukvaper,2015-08-23 05:45:33+00:00
2889,635326991420428288,Is there any trustable shop in San Francisco that will hand hold me through my first purchase? http://t.co/xpvkF27mUz #vape #ecigs #reddit,ukvaper,2015-08-23 05:45:33+00:00
2890,635326901997858816,Join us tomorrow at 9pm for our soft opening! #vapelife #vapelyfe #vape #vapers #vapefam https://t.co/zuzsIXO1G2 http://t.co/v9TwldPN9O,ECigCityTempe,2015-08-23 05:45:11+00:00
2891,635326866983911424,"IEKI'S ISLAND POMEGRANATE IN W VIBRANT LEMON EXHALE
Mad Ape #Vape Magic #Vaping
http://t.co/CCRtUjsbRo http://t.co/EPv0lS3RD0",RealDonnaDeVane,2015-08-23 05:45:03+00:00
2892,635326829608464384,RT VapeDon: Vape Shop Spotlight – TruVape in Las Vegas Nevada http://t.co/LkIckBLLVq  #Vape #ecig,vapemerch,2015-08-23 05:44:54+00:00
2893,635326828064964609,RT ecigitesztek: . is giving away a state of the art E-cig kit aka Personal Vaporizer Kit from https://t.co/OZTNd4DjFR … #vape #ecig,vapemerch,2015-08-23 05:44:54+00:00
2894,635326762021486592,reminder that big boss canonically vapes,JetGrindFuture,2015-08-23 05:44:38+00:00
2895,635326745529450496,i hate people who take pictures like this..... we get it... you vape http://t.co/146p0trdJN,9Mmerekina,2015-08-23 05:44:34+00:00
2896,635326670560321537,Study on e-cigarette addiction to be completed next year http://t.co/D3R4S8byVZ #ecigs #vaping,VapinXsmoker,2015-08-23 05:44:16+00:00
2897,635326669721485314,Study on e-cigarettes ready next year http://t.co/1GIB9cNm1d #ecigs #vaping,VapinXsmoker,2015-08-23 05:44:16+00:00
2898,635326668685508608,Village officials schedule public hearing on prohibition of tobacco use near village venues http://t.co/6LVJPCtC4x #ecigs #vaping,VapinXsmoker,2015-08-23 05:44:16+00:00
2899,635326667410436096,Vaping'sg rowing market http://t.co/zv7uHmDh1x #ecigs #vaping,VapinXsmoker,2015-08-23 05:44:15+00:00
2900,635326665669787648,Study on e-cigarette addiction out next year http://t.co/Q0HJw8N2WX #ecigs #vaping,VapinXsmoker,2015-08-23 05:44:15+00:00
2901,635326385523937280,Get it? #nirvana #vape #comedy https://t.co/XFpmYi49OQ,GetSlown,2015-08-23 05:43:08+00:00
2902,635326356054671360,Vape Shop Spotlight – TruVape in Las Vegas Nevada http://t.co/avoppda0Up #Vape #ecig,VapeDon,2015-08-23 05:43:01+00:00
2903,635326330763087872,"Swear I'm done with this cough fest. I need to quit smoking completely. No cigs, no vapes...nothing I'm done. I just want to stop coughing.",captainquiet196,2015-08-23 05:42:55+00:00
2904,635326000977604608,"Vaping for only 3 months..  Need to chill.. 
#vaping #cloudchasing #vapelife #vapefam #clouds… https://t.co/AQYNlvt2cK",matt_dvc,2015-08-23 05:41:37+00:00
2905,635325381344518144,smoke and vape...,adekorange,2015-08-23 05:39:09+00:00
2906,635325185248235520,Win a Whiteout Evolv DNA200 Box Mod! #vaporjoes #vapingunderground #vaping http://t.co/EsdHDgDdan,giannasgems,2015-08-23 05:38:22+00:00
2907,635325035301830656,"https://t.co/VocUGs5eTi Chapman still crying ""wont someone think of the cheeeeeldren"", NO, VAPING IS NOT A GATEWAY TO SMOKING.",BigVapingNunga,2015-08-23 05:37:46+00:00
2908,635324883354939393,If I'm vaping and I walk past you and you're vaping too you better give me the bro head nod.,ZabesOffTheWall,2015-08-23 05:37:10+00:00
2909,635324864539160576,Welcome to The Vape Bar https://t.co/D7xkkO0dDW,OSUEntrepreneur,2015-08-23 05:37:06+00:00
2910,635324807618297857,"We get it, you vape. http://t.co/6Azeo9A4a2",Bailey___Ann,2015-08-23 05:36:52+00:00
2911,635324505607434241,jual vape 😭😭😭😭😭,iamALIFFF,2015-08-23 05:35:40+00:00
2912,635324277030580224,. is giving away a state of the art E-cig kit aka Personal Vaporizer Kit from     https://t.co/H3odTFlvJT #vape #ecig,ecigitesztek,2015-08-23 05:34:46+00:00
2913,635324250837024768,Vape on! :3 http://t.co/dA8QdOpaHB,Alph_alp,2015-08-23 05:34:39+00:00
2914,635324104996950016,"British Public Health Officials, Unlike Ours, Tell the Truth About E-Cigarettes http://t.co/EdpZrQo7Hi @roinnslainte @IrishTimes #vaping",Noel_Random,2015-08-23 05:34:05+00:00
2915,635323947093876737,GeeDub just went LIVE at [ http://t.co/7eq0AuzpMK ] on @Vapersdottv - #AutoTweet #Live #Video #Vaping #Vapers #ecig #Vapor,LiveOnVapers,2015-08-23 05:33:27+00:00
2916,635323858203996160,I would say that 99% of @lilnick002 and I's conversations are about vaping and they are hilarious. #truelive #VapeLife,miyaceline,2015-08-23 05:33:06+00:00
2917,635323839971364868,I'm vaping so hard rn,BanzaiTakesAnal,2015-08-23 05:33:01+00:00
2918,635323675974193152,We are vaping photog bros. #photographers #vaping http://t.co/FDSxkrVEQ3,SeikoLiz,2015-08-23 05:32:22+00:00
2919,635323571829624832,How about u? 😂 😂 😂 #vapetrick #vape #vaper #vapers #vapeoftheday #dripclouds #dripsociety… https://t.co/L1agH57pwM,vape_mall,2015-08-23 05:31:57+00:00
2920,635323565743702016,I'm at Vape Invasion https://t.co/sk8xTIBhHq,_KevinChing,2015-08-23 05:31:56+00:00
2921,635323271597170688,"RT ecigitesztek: With Granny as YOUR Brand Ambassador
it's sure Success! DM me or
 https://t.co/v6npjkxLj2 … #vape #ecig",vapemerch,2015-08-23 05:30:46+00:00
2922,635322662198333440,Do you get the munchies from vaping ??????,CassandraCini,2015-08-23 05:28:21+00:00
2923,635322605889695746,COC+vaPE=HEAVEN!! :3,Alph_alp,2015-08-23 05:28:07+00:00
2924,635322566526144512,Still vaping shock treatment,christo2000,2015-08-23 05:27:58+00:00
2925,635322465174994948,"#LeeAaron is rocking out live, near where I am right now. The pic is her after a vape session! LMAO http://t.co/JcumksoD9z",Eliquid420,2015-08-23 05:27:34+00:00
2926,635322426792935424,Hey guess what. Northridge Vapes will be open in 2 days. #bouncebobaloft,justinonymous,2015-08-23 05:27:24+00:00
2927,635322228649951232,This guys vape smoke smells like fuckin cookies.,lolitatweeter,2015-08-23 05:26:37+00:00
2928,635322184320217088,Study on e-cigarettes ready next year http://t.co/sAQQ9nRAkN #ecigs #vaping,VapinXsmoker,2015-08-23 05:26:27+00:00
2929,635322183577792512,Vaping'sg rowing market http://t.co/DMGSDC9FbB #ecigs #vaping,VapinXsmoker,2015-08-23 05:26:26+00:00
2930,635322182168526848,Study on e-cigarettes to be completed next year http://t.co/vl9oOkggW4 #ecigs #vaping,VapinXsmoker,2015-08-23 05:26:26+00:00
2931,635322181333848064,OUR VIEW: FDA needs to regulate e-cigarettes http://t.co/OnASCvzz5f #ecigs #vaping,VapinXsmoker,2015-08-23 05:26:26+00:00
2932,635322180180447233,"Vaping is now haram? Well, so is smoking http://t.co/hYAAWdFLFZ #ecigs #vaping",VapinXsmoker,2015-08-23 05:26:26+00:00
2933,635322167987572737,Win a Whiteout Evolv DNA200 Box Mod! #vaporjoes #vapingunderground #vaping http://t.co/tIPSHsRjGA,rotax670,2015-08-23 05:26:23+00:00
2934,635321977943687172,Maddie and the vape boys is the name of my new indie band,ibuproflynn,2015-08-23 05:25:37+00:00
2935,635321899396890624,"Recently updated post of a vaping picture and preliminary description: http://t.co/zlxOA4KsRk :)
@mharper94 @Spinfuel_Dave @SpinfuelDotCom",jcm3rockstar,2015-08-23 05:25:19+00:00
2936,635321701450936321,I'll be on my deathbed and people will still be making vape jokes at me,hairsplinters,2015-08-23 05:24:31+00:00
2937,635321467958370304,When Will I Escape. Wit The Cape. Flying So High I'd Be Mistaken For Vape Clouds. Maybe It's My Time Now. High Or Low Hear My Sound,FetchMySwaggg,2015-08-23 05:23:36+00:00
2938,635321423586705408,"""Is your house vape friendly?""",Sundaze619,2015-08-23 05:23:25+00:00
2939,635321391324221440,for those of you in Australia - sign away!!  #vape #vaping #vape4life #quit #ejuice http://t.co/hxtJD3qVuR,vapingdelights,2015-08-23 05:23:18+00:00
2940,635321390829166592,Why vape?... When you can grape http://t.co/zP3dyl86kt,robbyguba,2015-08-23 05:23:17+00:00
2941,635321390485360640,You aren't best friends till you smoke Vape for the first time together @kaylayannotti 😜,kylienoce,2015-08-23 05:23:17+00:00
2942,635321369664749568,lol at the people at this party vaping😂,karlilynnn,2015-08-23 05:23:12+00:00
2943,635321304766353408,Nobody vapes harder then Morel. Fact,KinkyKevD,2015-08-23 05:22:57+00:00
2944,635321296985960448,.@RelixMag is giving away a state of the art E-cig kit aka Personal Vaporizer Kit from @HotVapes #vapelife #vape http://t.co/jzA8MQUMj8,kamcb29,2015-08-23 05:22:55+00:00
2945,635320749759295488,Study Explains Why Marijuana Helps With Arthritis Pain http://t.co/sFJUZvZaeJ Gone2vape this! @Go2Vape 4CBD vape Oils http://t.co/RtpFn8uLIl,Go2Vape,2015-08-23 05:20:45+00:00
2946,635320708810305537,did i mention that i  ???  https://t.co/GFVo97Y3fd #vape #ecig,ecigitesztek,2015-08-23 05:20:35+00:00
2947,635320707728187392,"Mad Ape Vape Son of Keoni Raspberry inhale Guava Exhale
 Delicious 
    https://t.co/NTzIi6ZBEv #vape #ecig",ecigitesztek,2015-08-23 05:20:35+00:00
2948,635320706495086592,"With Granny as YOUR Brand Ambassador
it's sure Success! DM me or
    https://t.co/ZHHd6WAJQq #vape #ecig",ecigitesztek,2015-08-23 05:20:34+00:00
2949,635320683963260928,Check out these awesome deals from Vaping Express. http://t.co/AdkbnNVIST,catgirlsnm,2015-08-23 05:20:29+00:00
2950,635320521618423808,I don't get the enjoyment of vape...?,ltsJonah,2015-08-23 05:19:50+00:00
2951,635320392505147392,Win a Whiteout Evolv DNA200 Box Mod! #vaporjoes #vapingunderground #vaping http://t.co/WgUU7aI0iW,mike_peklo,2015-08-23 05:19:19+00:00
2952,635320212926169088,Can Marijuana Help You Quit Cigarettes?StudySaysYes http://t.co/k3STd9UQh2 Gone2vape this!! @Go2Vape 4 CBD vape Oils http://t.co/RtpFn8uLIl,Go2Vape,2015-08-23 05:18:37+00:00
2953,635320048366653440,"Shrine Auditorium and Expo Hall on #Yelp: So, do you want to explain why you don't allow vaping on your smoking pati… http://t.co/r5tyvbDfS1",stephibug,2015-08-23 05:17:57+00:00
2954,635319850676699136,after 24986 years i finally found this clip. truly a historic day for a of us. (Vine by vape wizard) https://t.co/2cHpGHVfnW,PUSHATIFF,2015-08-23 05:17:10+00:00
2955,635319708443504640,"""Yo, can I vape in here?""",Cassdogz,2015-08-23 05:16:36+00:00
2956,635319700994564096,Can You Vaporize CBD?  http://t.co/4xdTDmkcff Gone2vape this!! @Go2Vape for CBD vape Oils http://t.co/RtpFn8uLIl,Go2Vape,2015-08-23 05:16:35+00:00
2957,635319650855751680,if u vape at my funeral im coming back and escorting u out real quicc,83supra,2015-08-23 05:16:23+00:00
2958,635319626243510272,Vaping is so punk rock!,gigglepanic,2015-08-23 05:16:17+00:00
2959,635319481753931776,"ok Washington we get it, u vape http://t.co/rFA279hFOg",bufffy7,2015-08-23 05:15:42+00:00
2960,635319330507395072,Review Smowell Hatrick tank Triple coil Review. http://t.co/GLeqbBTkHD #ecig #vape #POTV,ukvaper,2015-08-23 05:15:06+00:00
2961,635319145949626368,A decent quality vape pen seem like a better investment then a pipe or bong. Seems like imma do Research,OnlySaveAbel,2015-08-23 05:14:22+00:00
2962,635318994220658688,"Ok, we get it, you vape. http://t.co/pfWNqPv2ir",RhettwhiteNblue,2015-08-23 05:13:46+00:00
2963,635318930307985408,Throwback to when gayboy and I thought vaping was cool 😂 those were the days lol #mainnigga #day1 @… https://t.co/DFE0WJCn2W,waba789,2015-08-23 05:13:31+00:00
2964,635318600379801600,5 Must-Know Facts About Cannabidiol (CBD)  http://t.co/vfH5mHXzMQ Gone2vape this!! @Go2Vape for CBD vape Oils http://t.co/RtpFn8uLIl,Go2Vape,2015-08-23 05:12:12+00:00
2965,635318500370722817,I learned how to vape last night faded,NPoyorena,2015-08-23 05:11:48+00:00
2966,635318431198220288,lets vaping,yogiAN_,2015-08-23 05:11:32+00:00
2967,635318318547771392,If anyone's selling a vape hmu ‼️‼️,ErikaGabriella_,2015-08-23 05:11:05+00:00
2968,635318313556529152,"One of my favorite videos to date. Invisible jelly, swirlfish/saturn, and a figure 8 bend! Song: I… https://t.co/fEmzmNPnoU",vape_mall,2015-08-23 05:11:04+00:00
2969,635318235764690944,Time for a naked personal vape bowl after 9 hours of Roche Harbor chaos,jenny_mac_,2015-08-23 05:10:45+00:00
2970,635317995720560640,All we about get familar #djandmcs #effenvodka #drake #power #vape #selfie #tbt #photo #dubai… https://t.co/Bqkt3xpaOD,word2hiphop,2015-08-23 05:09:48+00:00
2971,635317826144890884,"""I'm vaped out of my fartin mind"" 😂😂😂 @chevymulisha219 @Weller31",jennabarker21,2015-08-23 05:09:08+00:00
2972,635317569021440002,#eJuice #Vapes #Vapor from liquids #weed #medical #MMJ http://t.co/lmRHBsWRYQ #BuyHere http://t.co/x9bvsXnnlE #Bitcoin,VAPEPENstore,2015-08-23 05:08:06+00:00
2973,635317548414824449,If you vape you should probably stop bc that's embarrassing,JaredCutts1,2015-08-23 05:08:01+00:00
2974,635317492420751360,first thing my dad says when he gets home is how bad did you vape the house out while I was gone? hahahahaha,stevend07,2015-08-23 05:07:48+00:00
2975,635316960046239744,Back to   https://t.co/URd5P0orOt #vape #ecig,ecigitesztek,2015-08-23 05:05:41+00:00
2976,635316886155038720,TheFaceOfVape just went LIVE at [ http://t.co/9vqrmPamNq ] on @Vapersdottv - #AutoTweet #Live #Video #Vaping #Vapers #ecig #Vapor,LiveOnVapers,2015-08-23 05:05:23+00:00
2977,635316670135865344,LIKE WE GET IT RENO YOU VAPE UGH,RMcDonagh3,2015-08-23 05:04:32+00:00
2978,635316258016247808,Back to #vape https://t.co/rzlbHj1eQD,DhanyIrawanS,2015-08-23 05:02:54+00:00
2979,635316044203098112,"Vaping must be much better than smoking, right?  http://t.co/Ld93WCOhXd",johnkaiser13,2015-08-23 05:02:03+00:00
2980,635316012175351808,Doterra? Nahh man I use vape juice.,Jucuzzi2,2015-08-23 05:01:55+00:00
2981,635315813101101056,"""do you get high from vape?"" 😂😂😂#KierTweets",Lukejames0,2015-08-23 05:01:08+00:00
2982,635315755723137024,Got a new vape! #mivape #Sigelei #150watt #royalhunter https://t.co/OkHUVoflzc,zachitects_93,2015-08-23 05:00:54+00:00
2983,635315609014677504,Coast2CoastVapers just went LIVE at [ http://t.co/1NPpscVhZK ] on @Vapersdottv - #AutoTweet #Live #Video #Vaping #Vapers #ecig #Vapor,LiveOnVapers,2015-08-23 05:00:19+00:00
2984,635315554564358144,"RT RealDonnaDeVane: Get your very own Brand Ambassador for UR #Vape Biz #Vaping Granny helps!
… http://t.co/4pfjHznM1n",vapemerch,2015-08-23 05:00:06+00:00
2985,635315542920818691,I hate that if i smell that smell in the air nowadays idk whether to make a vaping joke or smoking cloves like a highschooler joke.,BagelMom420,2015-08-23 05:00:03+00:00
2986,635315439418146816,"By @sgt_sprinklez ""Finally got some good jellys/inhale bends while practicing swirlfishes (Probably… https://t.co/TCln5riKnK",vape_mall,2015-08-23 04:59:39+00:00
2987,635315412276609024,Feel like buying the vape.could save alot of money since i'm back to 2days a pack.😒,fauziesunny,2015-08-23 04:59:32+00:00
2988,635315350016557056,"*man vapes* ""what the fuck? Who's smoking that Yankee candle?""",_sfay,2015-08-23 04:59:17+00:00
2989,635315321348354052,Can you take shots of Vape juice or nah,cfreshhhhh,2015-08-23 04:59:10+00:00
2990,635314993253220352,"Science this week: Ecigs/vape 95% less harmful than tobacco cigs and 40% less expensive. After 28+ yrs a smoker, I'm 2.5 years smoke-free.",PositiveEnerG,2015-08-23 04:57:52+00:00
