,TweetID,TweetContent,TweeterUsername,TweetDatetime
2025,633277686912172032,"You ↑ You ↗ You ↙ You → You ↓ You ↪ You ↫ You ↲ You ↯ You ↱ You ↶ and You ↴., Are You a Real Friend to Me or Not.,",juuls_juices,2015-08-17 14:02:20+00:00
2026,633277652321849344,"already saw a bunch of ppl I know, like 3 trucks with confederate flags, &amp; somebody vaping. luv community college.",BaileyBreeanna,2015-08-17 14:02:12+00:00
2027,633277608495554560,Yeahh https://t.co/KrDYbxTsXV,yolo_juul,2015-08-17 14:02:02+00:00
2028,633277519345664000,From @Tlrd: Is Vaping Really Healthier Than Smoking? AsapScience Investigates: VIDEO http://t.co/N52usS6Hlx,gayETnews,2015-08-17 14:01:40+00:00
2029,633277308669980676,Lets vape ! #vape #vaping #eliquids #ecigs http://t.co/RnFBwajLtv http://t.co/Uk7neoJV3Q,esheeshforecigs,2015-08-17 14:00:50+00:00
2030,633277219947847681,"RT topecig: Congrats to #HALO, they've received the #DIAMOND award at #TopFiveAwards http://t.co/w99nrevI1t #vape #vapelife",vapemerch,2015-08-17 14:00:29+00:00
2031,633277216118427648,RT ecigitesztek: Keep track of FDA regulations on the market. It can change the way you -&gt; https://t.co/m8iRH1sDCy … #vape #ecig,vapemerch,2015-08-17 14:00:28+00:00
2032,633277154260819972,"Have you got a mix to listen at the moment? #WizKhalifa
#YoungWildAndFree https://t.co/Cojm2ex3rU http://t.co/9Y3I9fcRZa",P_Vaper,2015-08-17 14:00:13+00:00
2033,633277115593584640,"#Vape Biz #Ejuice #Success
#Vaping Granny
Brand Ambassador
http://t.co/6YW1KE6e3r http://t.co/s7s7iBz1d4",RealDonnaDeVane,2015-08-17 14:00:04+00:00
2034,633277106772905984,vape deadline,vapeeverything,2015-08-17 14:00:02+00:00
2035,633277088632578048,#joyetech #evicvt back in stock!  @xsvaporlounge #northmiami #flavorchasing #amazingflavor #vape… https://t.co/iT8XcUbEdN,XSVaporLounge,2015-08-17 13:59:58+00:00
2036,633277041463267328,Is it appropriate to Vape in the state Board test? 💁😂😂😂😂😂😂 #IWish,ashmillionn,2015-08-17 13:59:47+00:00
2037,633276971653443585,Save 20% on the RA Mod clone with code MECH20 - Bundle to save 5% more! #ecigs #vape http://t.co/I8ml6QWSfe http://t.co/3cYxAbtvzA,2vaped,2015-08-17 13:59:30+00:00
2038,633276948857253888,"I get it, you vape, #vapeon and all that shit",azimbkr,2015-08-17 13:59:24+00:00
2039,633276796717260800,"I added a video to a @YouTube playlist http://t.co/7wVQ05tSsM E-cigs - Vaping for Beginners (Part 3 + 4) - Atomizers, Cartridges, and",xtattic,2015-08-17 13:58:48+00:00
2040,633276683878051840,twitter on &amp;vape on,harithfaiz74,2015-08-17 13:58:21+00:00
2041,633276537404563456,"All vapes should be #IoT enabled with bluetooth+ #zigbee
so I can make them explode when a prick is being an ass with them :D",_pronto_,2015-08-17 13:57:46+00:00
2042,633276505095729154,What is life if you don't vape 💨,Bryce_Cardis,2015-08-17 13:57:39+00:00
2043,633276489794891776,go genting Vape 99 hahaha,tbl1998,2015-08-17 13:57:35+00:00
2044,633276320890404864,Took this out for a photo shoot walk. Helping me get over some vape mail lost in the post.… http://t.co/Nfa6eIdnFO http://t.co/cb0wKOmY27,G_G_160,2015-08-17 13:56:55+00:00
2045,633276127729987584,Smoking Vs. Vaping http://t.co/rDhhYT6Hbd http://t.co/muz7xuY3yV,devour,2015-08-17 13:56:09+00:00
2046,633275931704954880,Win a SX Mini M Class mod from http://t.co/FTPf1PhgDM - http://t.co/Uqa6bbLOS9 #ecig #Vape,zakukillerz,2015-08-17 13:55:22+00:00
2047,633275761458221056,Dedeek. . . (with Dimas at AFC Vapes SOC) — https://t.co/bY2i07agIs,anas_musafak,2015-08-17 13:54:41+00:00
2048,633275722262417408,Win a Whiteout Evolv DNA200 Box Mod! #vaporjoes #vapingunderground #vaping http://t.co/KAieVxdDxC,Countrypami,2015-08-17 13:54:32+00:00
2049,633275633741766656,"Second thought ""toast, tea and my Vape""",sophutd,2015-08-17 13:54:11+00:00
2050,633275573368979456,I liked a @YouTube video http://t.co/XtWaRs8xK6 Vape Contest Winners,HeavyMetalVaper,2015-08-17 13:53:57+00:00
2051,633275470805516288,okey guys vape on metar opps vape haram so winston jelah,shahrulaikal,2015-08-17 13:53:32+00:00
2052,633275413863645184,I can't beleive I'm growing up in the Drake&amp;Vape generation,TeejTaylor,2015-08-17 13:53:19+00:00
2053,633275393269698560,Is this the summer returning? Time to get the shorts out again Vapers! #summer #vaping,VolcanoEU,2015-08-17 13:53:14+00:00
2054,633275300500127744,Vaping at work http://t.co/4rsYmqMjZG,JTC_73,2015-08-17 13:52:51+00:00
2055,633275295945129984,Unleash your inner self #vapelyfe #vapelife #vapeporn #vaper #bwnvapers #vapingisnotacrime… https://t.co/UYpEZoOesB,MamatFzsix,2015-08-17 13:52:50+00:00
2056,633275197085347841,"Wake &amp; Vape💨 What kind of portable vape you enjoy Try #KVape #KVape one of the best

Pure #THC Visit… https://t.co/8GkU9nfwUx",doobiemagllc,2015-08-17 13:52:27+00:00
2057,633275164893908992,.Music Transcends the Words. #HowRealFeelingsShouldBe,juuls_juices,2015-08-17 13:52:19+00:00
2058,633274924648538112,Vape on guys!! #vapeon #vapegram #vapelife #vapemalaysia #vapemovement #jgnckpabgxpayung… https://t.co/z4dXdELRft,metalarse,2015-08-17 13:51:22+00:00
2059,633274851818663936,Keep track of FDA regulations on the  market. It can change the way you  -&gt;  https://t.co/NASC4BiX2z #vape #ecig,ecigitesztek,2015-08-17 13:51:05+00:00
2060,633274770784677888,"SEG Vapour Ltd http://t.co/xiOkMYFlwj 
Best Innokin Prices for Coils &amp; Tanks
 #Vape #Vaping #CloudChaser #CloudChasing #Ecig #Vape",segvapour,2015-08-17 13:50:45+00:00
2061,633274613070303232,"Notes Beats as an Emotion., #MusicFeels",juuls_juices,2015-08-17 13:50:08+00:00
2062,633274455322660864,"It is not the size of your heart that matters, but the size of your vape… https://t.co/pa0FvSVl8s",farezosmann,2015-08-17 13:49:30+00:00
2063,633274447768719360,I'm at Vape Empire Aman Suria https://t.co/F1BEMu6m1p,Shuenzer,2015-08-17 13:49:28+00:00
2064,633274267740717056,A new way of enjoying coffee would be if I vaped a mocha latte or something.,vaughnpinpin,2015-08-17 13:48:45+00:00
2065,633274103475097600,We have been testing and vaping the flavors submitted in the Flavor Challenge.  This has taken some time due to... http://t.co/NNmA8lsMi3,DigitalHitsUSA,2015-08-17 13:48:06+00:00
2066,633274046830936064,"talking about vape pens...,,,,",e_xxxtra,2015-08-17 13:47:53+00:00
2067,633273967890014208,#FreshmanAdvice vape as much as you can to get in with the cool kids,JacobMessler08,2015-08-17 13:47:34+00:00
2068,633273965260115968,"One day when the 40 Days Of Fog approaches us, you know where it came from.

Malaysian Vapers.",izzraimy,2015-08-17 13:47:33+00:00
2069,633273851510697984,First day of classes so everyone grab your vapes and seriously start sucking down!,JackMannix00,2015-08-17 13:47:06+00:00
2070,633273847404470272,Is Vaping Really Healthier Than Smoking? AsapScience Investigates: VIDEO http://t.co/QVyGsBvIch #GAY #NEWS #GLBT,gaynews365,2015-08-17 13:47:05+00:00
2071,633273813870866434,Win a SX Mini M Class mod from http://t.co/3Wk1xEMrzW - http://t.co/qScTu2ni9z #ecig #Vape,jakebwright77,2015-08-17 13:46:57+00:00
2072,633273769453158400,Win a Whiteout Evolv DNA200 Box Mod! #vaporjoes #vapingunderground #vaping http://t.co/JvJN0ALOCj,vaporhead87,2015-08-17 13:46:46+00:00
2073,633273725719322624,"Coming soon guys, follow and check for the best flavor that you can VAPE ☺💨💨💨 #vapeboleh #potd… https://t.co/UzMA7z2UhY",abusaadd,2015-08-17 13:46:36+00:00
2074,633273505543360512,Win a Joyetech EVIC VT Kit from @cigbuyer and @huffandpuffers: http://t.co/U91us8K3qt #ecigs #vaping #evicvt #vapecontest #vapegiveaway,jakebwright77,2015-08-17 13:45:44+00:00
2075,633273503593029632,Biggest respect to people who don't vape/smoke.,aziziawang_,2015-08-17 13:45:43+00:00
2076,633273467476013057,RT MrTastyVapor: Keep track of FDA regulations on the #vaping market. It can change the way you #vape -&gt; http://t.co/ZEeRVOrriq,vapemerch,2015-08-17 13:45:34+00:00
2077,633273466532270084,RT vaporshark: The Vapor Flask by Vapor Shark is now only $159.99! Available online and in-store. #Vape #vapelife … http://t.co/81XTckOnmr,vapemerch,2015-08-17 13:45:34+00:00
2078,633273461994094592,RT ZeroNicJuice: Moo Juice 30ml 100% #USA #Eliquid 5.89 Free Shipping #eBay #Deals #Vape #ecigs #VapeLife http://t.co/KyeI204aLW,vapemerch,2015-08-17 13:45:33+00:00
2079,633273386613866496,"Mad Ape Vape Son of Keoni Raspberry inhale Guava Exhale
#Vape Delicious #vapelife
http://t.co/3VdlBFajHj http://t.co/fJSLHsIA5V",AwakenedRadio,2015-08-17 13:45:15+00:00
2080,633273357149016064,Vaping Break Down Tutorial (Part I ) - MyFreedomSmokes: http://t.co/g4YGkFJUsh via @YouTube,MyFreedomSmokes,2015-08-17 13:45:08+00:00
2081,633273342938628096,"Get your very own Brand Ambassador for UR #Vape Biz #Vaping Granny helps!
http://t.co/gzwvSTvJeq http://t.co/yTezeTHEKx",RealDonnaDeVane,2015-08-17 13:45:05+00:00
2082,633273336781520896,Happy Monday from EPUFFER International. Here is the Epuffer Vape lounge that we just manufactured. It's your one... http://t.co/pN97oP54Uf,EPuffer52,2015-08-17 13:45:03+00:00
2083,633273322424283136,"vape club fee is $30, mostly because I'm starting a vape pen collection",Ieeki,2015-08-17 13:45:00+00:00
2084,633273288148520960,Hello to our vaping community! Here is our 3rd part of the multi-post of this amazing article I found. Keep Calm... http://t.co/bQpD9VVwPm,VictoriasVapor,2015-08-17 13:44:52+00:00
2085,633273252987564032,Win a Hermetic Steam E-Juice Sampler from @cigbuyer: http://t.co/Qp5lzGVbXB #ecigs #vaping #eliquid #ejuice #vapecontest #vapegiveaway,jakebwright77,2015-08-17 13:44:43+00:00
2086,633273145714020352,vape w me,Ieeki,2015-08-17 13:44:18+00:00
2087,633273110918119424,I got a new vape pen wbu,Ieeki,2015-08-17 13:44:09+00:00
2088,633273032279068673,let's vape,Ieeki,2015-08-17 13:43:51+00:00
2089,633272998036918272,"RT NOnicNOpgNOsmok: Just Do It!

#vitastik #vitamin #health #natural #exercise #training #fitness #vape #vaping #a… http://t.co/yppa8Pepst",BoCaribbean,2015-08-17 13:43:43+00:00
2090,633272901945298946,vape tastes real good,kimtaehyvng,2015-08-17 13:43:20+00:00
2091,633272900041097217,vape causes air pollution,sya_elzara,2015-08-17 13:43:19+00:00
2092,633272850158362624,THE SHIT BOX (i titled it) - WOOD BOX MOD QUAD 18650 BATTS IN PARALLEL http://t.co/mPFd4fGGku #Vape,CrewJuiceLiquid,2015-08-17 13:43:07+00:00
2093,633272847025082368,Selling this vape for Rm 5 ~~~ http://t.co/TkDuEvH4Wb,RainingFuture,2015-08-17 13:43:07+00:00
2094,633272841803329536,"Just Do It!

#vitastik #vitamin #health #natural #exercise #training #fitness #vape #vaping #amazing #flavor #energy http://t.co/iQFiKXXAJL",faithNhopeNluv,2015-08-17 13:43:05+00:00
2095,633272838561001472,"""Do you do vape tricks?""
""Yes......wait what're those?""
-Jennah Foltz",abbyynormall,2015-08-17 13:43:05+00:00
2096,633272771921862656,join my vape club,Ieeki,2015-08-17 13:42:49+00:00
2097,633272332858073088,"Wake &amp; Vape💨 What kind of portable vape you enjoy Try #KVape #KVape one of the best

Pure #THC Visit… https://t.co/Ke1ApwOn9b",4eva_Precious,2015-08-17 13:41:04+00:00
2098,633272187923755008,"It's not smoke, it's vape.. #VapeOn #vapelife #vape http://t.co/miI0Af99cn",Bobbyrascal_,2015-08-17 13:40:29+00:00
2099,633272167476633601,"We posted our review of the delightful Beard Vape Co. line of juices. To hear our thoughts, head on over to the blog! http://t.co/FwfRFUGusn",RollingPapersEx,2015-08-17 13:40:25+00:00
2100,633272157783523328,Vape isn't cool guys  https://t.co/Qpl6mBYc9G,ArelifAlephant,2015-08-17 13:40:22+00:00
2101,633272104033521664,"Say no to vape , say yes to game",enrewezyaiwa,2015-08-17 13:40:09+00:00
2102,633272075604639744,Early morning vapes https://t.co/kjdJfwA4ft,VapingNikkiB,2015-08-17 13:40:03+00:00
2103,633271921853857796,$VAPE Entendance: Vape Holdings Reports Fiscal Third Quarter 2015 Results: Entendance http://t.co/JYEuJbfadr,mjcharts,2015-08-17 13:39:26+00:00
2104,633271885128568832,"We get it fam, you vape http://t.co/FLMCSos3BB",MattsLPAdventur,2015-08-17 13:39:17+00:00
2105,633271823459749888,"""what r u majoring in?""
""o, vaping""",kindaevan,2015-08-17 13:39:02+00:00
2106,633271670506156032,Vape lords are out in full effect at UTC today. Welcome back.,Real_Cone_Boi,2015-08-17 13:38:26+00:00
2107,633271593209307136,Smoking vs Vaping via Dailymotion http://t.co/Z3o0l0kQA7,mollamcn,2015-08-17 13:38:08+00:00
2108,633271574343323648,Looking for top vape concentrates  for my new  premium  blends with cbd vape on,CBDVAPERELIEF,2015-08-17 13:38:03+00:00
2109,633271424111677440,"Is Vaping Really Healthier Than Smoking? AsapScience Investigates: VIDEO: 
The guys behind AsapScience have fi... http://t.co/IECS7BLI30",gaytourism,2015-08-17 13:37:27+00:00
2110,633271420798169089,"Is Vaping Really Healthier Than Smoking? AsapScience Investigates: VIDEO: 
The guys behind AsapScience have fi... http://t.co/woenCrF1Oq",EdRickers1,2015-08-17 13:37:26+00:00
2111,633271419044888576,"Is Vaping Really Healthier Than Smoking? AsapScience Investigates: VIDEO: 
The guys behind AsapScience have fi... http://t.co/WyesiaSbuz",ArielMalvitz1,2015-08-17 13:37:26+00:00
2112,633271417270702080,Is Vaping Really Healthier Than Smoking? AsapScience Investigates: VIDEO http://t.co/tBcaoRGItE @towelrod,altgaynitelife,2015-08-17 13:37:26+00:00
2113,633271415387516928,"Towleroad: Is Vaping Really Healthier Than Smoking? AsapScience Investigates: VIDEO: 
The guys behi... http://t.co/snI5LCX8tW #gay @tlrd",tlrdfeed,2015-08-17 13:37:25+00:00
2114,633271413550387202,"Towleroad: Is Vaping Really Healthier Than Smoking? AsapScience Investigates: VIDEO: 
The guys behi... http://t.co/OaEkGS5CPT #gay @tlrd",tlrdfeed,2015-08-17 13:37:25+00:00
2115,633271283749404672,"New #cannabis article posted on #ecannabis Pro-Con: Should Port Lavaca ban smoking, vaping indoors? -- http://t.co/hFJ8G7RUNO",eCannabiscom,2015-08-17 13:36:54+00:00
2116,633271276220518400,E-cig Gateway Effect Unfounded http://t.co/AN2mO2JjXf #Spinfuel #Vape #Vaping #ecig #ecigs #vapelife #Vapersnews,Spinfuel_News,2015-08-17 13:36:52+00:00
2117,633271264828878848,"Happy Monday vapers! 
#HandCheck http://t.co/uIjIAKVfhB",ovaleworld,2015-08-17 13:36:49+00:00
2118,633271151209377792,Is Vaping Really Healthier Than Smoking? AsapScience Investigates: VIDEO http://t.co/Vhpa1EaCcD http://t.co/VWLU85IOnw,tlrd,2015-08-17 13:36:22+00:00
2119,633271055205986305,"Vape on brotha!

#starvapers #starvapersthebooth #starvapersfamilia #allvapersarebrothers… https://t.co/gEHkGslfIQ",StarVapers,2015-08-17 13:35:59+00:00
2120,633270987447005189,"Rusty Nails:Vanilla, Butterscotch, Marshmallow &amp; Nuts#ejuice   https://t.co/IOIVEsn9cT #vape #ecig",ecigitesztek,2015-08-17 13:35:43+00:00
2121,633270934321893376,"By johnjohnvapes_dkc via repostwhiz app:
#handcheck for my man @chris_vapes 
Looks like I'm gonna be… https://t.co/GkdWYlJ4G5",iPuffNPlay,2015-08-17 13:35:31+00:00
2122,633270777140244480,Win a SX Mini M Class mod from http://t.co/2fE0jnAzW6 - http://t.co/uwLdNYf40Z #ecig #Vape,khanhyds,2015-08-17 13:34:53+00:00
2123,633270652154150913,FriGiN just went LIVE at [ http://t.co/PDGcdikvEL ] on @Vapersdottv - #AutoTweet #Live #Video #Vaping #Vapers #ecig #Vapor,LiveOnVapers,2015-08-17 13:34:23+00:00
2124,633270526924886017,It doesn't appear to matter how hard you push yourself today b... More for Gemini http://t.co/w23C6YXRIN,vape_loverr,2015-08-17 13:33:53+00:00
2125,633270383299399681,we need to go back there and start vaping - Thomas,maddi3ok,2015-08-17 13:33:19+00:00
2126,633270350667628544,haha did u know ur a douche when ur vaping in an indoor area with a lot of people #stop,s4intlrnt,2015-08-17 13:33:11+00:00
2127,633270194757103616,Driving with vapers 😗💨  (W/ IG:9southvapes) (Vine by @Scumbag66615) https://t.co/OSdB4fPO54,shahiran,2015-08-17 13:32:34+00:00
2128,633270190940164102,I added a video to a @YouTube playlist http://t.co/Od9xMA0xdW E-cigs - Vaping for Beginners (Part 2) - Batteries and Voltages,xtattic,2015-08-17 13:32:33+00:00
2129,633269915554840577,Quit smoking - start vaping. No tobacco and no tar!,vaperzclub,2015-08-17 13:31:28+00:00
2130,633269802123923457,Smoking vs Vaping http://t.co/RsXI5baGNu http://t.co/qPQLit4s93,stkittsthegreat,2015-08-17 13:31:01+00:00
2131,633269727683571712,Looking for premium  concentrates for my new blends  vape on,CBDVAPERELIEF,2015-08-17 13:30:43+00:00
2132,633269656841781248,Vape life http://t.co/9Fk6zHl7Rx,JailynTaylor,2015-08-17 13:30:26+00:00
2133,633269626391121920,Just been and picked my winnings up from @midlands_vape #hemlock hemlockvaporcompany and couldn't be… https://t.co/v9kUi5Yej3,Drew_19_86,2015-08-17 13:30:19+00:00
2134,633269571668062208,"With #Vaping Granny as YOUR #Vape Brand Ambassador
it's sure Success! DM me or
http://t.co/VXp5FrdQc6 http://t.co/WjuzmYE1tI",RealDonnaDeVane,2015-08-17 13:30:06+00:00
2135,633269556690206721,vape malaysia,vapeeverything,2015-08-17 13:30:02+00:00
2136,633269407116951552,Trouble with subtank mini rta http://t.co/8MJggfYBzV #vape #ecigs #reddit,ukvaper,2015-08-17 13:29:26+00:00
2137,633269406223630336,Daily Index Thread (8/17 - 8/23) http://t.co/Qvw7JoHWQ1 #vape #ecigs #reddit,ukvaper,2015-08-17 13:29:26+00:00
2138,633269198421028864,Girls who vape &amp; smoke totally not cool💁,_DoubleMN,2015-08-17 13:28:37+00:00
2139,633269173163003905,Hello hangover. I don't even care.,vaped_crusader,2015-08-17 13:28:31+00:00
2140,633269143811190785,I added a video to a @YouTube playlist http://t.co/4DkDFvkSf5 E-cigs - Vaping for Beginners (Part 1) - E-liquid / E-juice,xtattic,2015-08-17 13:28:24+00:00
2141,633268964114759680,"$Vape Holdings Reports Fiscal Third Quarter 2015 Results via @YahooFinance
http://t.co/ixWeqyJGmc",HD_Coco,2015-08-17 13:27:41+00:00
2142,633268921127301120,"Looking to buy a vape, could use some pointers. via /r/Vaping101 http://t.co/6wNKwCNmPM",VapingEnFrance,2015-08-17 13:27:31+00:00
2143,633268917415243776,Win a SX Mini M Class mod from http://t.co/2hUqg8St2B - http://t.co/ApoxAqm1W6 #ecig #Vape,mike_peklo,2015-08-17 13:27:30+00:00
2144,633268809881661440,Win a Whiteout Evolv DNA200 Box Mod! #vaporjoes #vapingunderground #vaping http://t.co/WgUU7aI0iW,mike_peklo,2015-08-17 13:27:04+00:00
2145,633268369920258049,Watch: Is vaping actually better for you than smoking http://t.co/OanrOBs5Ph http://t.co/BLzJ9CS9bQ,entertainmentIE,2015-08-17 13:25:19+00:00
2146,633268138369417216,40 Japanese 100% Organic Cotton Pads No Adhesives the Best on Amazon Vape Atty by VapeEmpire 129% Sales Rank i... http://t.co/i6ZssV7WFI,HighEnd_Gear,2015-08-17 13:24:24+00:00
2147,633268072539815936,"I'm selling new condition vape mod, tank and flavour, help me #RT this! :) http://t.co/6SQeOnA15b",hazimxzizi,2015-08-17 13:24:08+00:00
2148,633268071218610176,BVC (Bottom Vertical Coil) Technology -- what's that?  http://t.co/NAbKNUnr2w #vaping #ecig,VaporJedi,2015-08-17 13:24:08+00:00
2149,633268042928123904,ok we get it you vape http://t.co/24nXNWRgTb,_colester,2015-08-17 13:24:01+00:00
2150,633267989685497856,Win a SX Mini M Class mod from http://t.co/UuR3Y7prP1 - http://t.co/U293pxxpom #ecig #Vape,marko_zadro,2015-08-17 13:23:48+00:00
2151,633267472381120512,Is vaping actually better for you than smoking? http://t.co/oSLDcToMde,digg,2015-08-17 13:21:45+00:00
2152,633267309088391168,Win a SX Mini M Class mod from http://t.co/cE9vmWrs5R - http://t.co/ih42nJNPSd #ecig #Vape,mekakeisei,2015-08-17 13:21:06+00:00
2153,633267083875213312,Win a Whiteout Evolv DNA200 Box Mod! #vaporjoes #vapingunderground #vaping http://t.co/LXJDRG1xTz,swpsswps,2015-08-17 13:20:12+00:00
2154,633267074672955392,Vape Holdings Reports Fiscal Third Quarter 2015 Results http://t.co/XOYvInaNGM,accesswire,2015-08-17 13:20:10+00:00
2155,633266999985086464,"There must be elves at work here at night. My desk is always covered with #Vape #ejuice bottles, even after I put them away!",RealDonnaDeVane,2015-08-17 13:19:52+00:00
2156,633266771277975552,Second hand smoking is 95% much more harmful than second hand vaping lol if there's such thing. 😗💨☁️☁️ #NotPickingSide,shakmr,2015-08-17 13:18:58+00:00
2157,633266759357722624,Win a Whiteout Evolv DNA200 Box Mod! #vaporjoes #vapingunderground #vaping http://t.co/LAcDwzjaPS,jenntex5,2015-08-17 13:18:55+00:00
2158,633266448438194177,"if among kawan aku (girls) taking vape, aku cuci dia sampai bersih. if not, haha get the hell out of here",amlnsusen_,2015-08-17 13:17:41+00:00
2159,633266311611707392,my 7 year old cousin straight up stole my older cousin's vapes,necropussy666,2015-08-17 13:17:08+00:00
2160,633265792843300864,"Kool Breath have 4 nicotine choices

0 nicotine, 6mg, 12mg or 18mg nicotine

http://t.co/HlgR5RxZA1 #vaping http://t.co/qSVKOPuu82",Kool_Breath,2015-08-17 13:15:05+00:00
2161,633265727433252864,Vape stores using Ontario as part of their Name give the impression that they are supported by the province. This is misleading consumers.,DurhamRTAHL,2015-08-17 13:14:49+00:00
2162,633265711952080896,All these vape gods on this campus it's hard to tell who the true Vape God is #theology #ibelieve,wheelredmond,2015-08-17 13:14:45+00:00
2163,633265687755010051,Constantly sounding like vape when j come to school.,ASAP_ridda,2015-08-17 13:14:40+00:00
2164,633265641525391360,"vape on bro,. ipv2 mini + herakles with the dragon coil awesome .. wait for #vapecon bp.. let me be part of you.. http://t.co/mIMYAeUGLf",ambokfarid,2015-08-17 13:14:29+00:00
2165,633265261920059392,"TV adds for Vape stores, very concerning and misleading.",DurhamRTAHL,2015-08-17 13:12:58+00:00
2166,633265129493266432,We take a comprehensive look at the Aspire Triton for Mist TV. Get to grips with some amazing features: https://t.co/HRnkCGwiFR #Vape,mistEliquid,2015-08-17 13:12:27+00:00
2167,633265066050220032,Fuccckkkkkkk just when I thought my day couldn't get any worse i ran out of cotton candy flavor for my vape pen #vapelife,AlwineAaron,2015-08-17 13:12:11+00:00
2168,633265003664044033,Win a SX Mini M Class mod from http://t.co/SCXkHAKgxg - http://t.co/icYKdofHQa #ecig #Vape,Dwightboy64D,2015-08-17 13:11:57+00:00
2169,633264942536359936,"#ejuice comp will be ending soon, please keep faving our tweets to enter. Winners should be chosen by end of the week #vaping #vapelife",nomnomzeliquid,2015-08-17 13:11:42+00:00
2170,633264878590001152,"Soon to open!

Please like Vàpe Café to see the updates.
Thank you :-) http://t.co/IRPMTZOHPZ",erwingle,2015-08-17 13:11:27+00:00
2171,633264832893034496,Variable voltage or Variable Wattage? Constant voltage? What is the difference? Visit https://t.co/tQ7pVPzARw … #vape http://t.co/A92pSr37KV,vappora,2015-08-17 13:11:16+00:00
2172,633264653049700352,"*** Hand -Check Time! ***

Lets see what you guys are vaping on today!

Winner will receive 3x 30ml bottles of... http://t.co/PKaNXtYZ15",fatpandavapes,2015-08-17 13:10:33+00:00
2173,633264566487642112,my 100 watt vape mod is coming in the mail today,_CubanLinks_,2015-08-17 13:10:12+00:00
2174,633264332076285954,Win a SX Mini M Class mod from http://t.co/tAnsx0N8LX - http://t.co/tOscv10K3K #ecig #Vape,WizsWorld,2015-08-17 13:09:16+00:00
2175,633264297519509504,"Think they meant to say ""vaping, tweeting, and cycling""",PhilthePill,2015-08-17 13:09:08+00:00
2176,633263925564440577,Use your #logicecig! Start vaping today and save:http://t.co/p3p2fKmRxp http://t.co/rRGxhEC7Va,LOGICSMOKES,2015-08-17 13:07:39+00:00
2177,633263875098480640,Vape on! #Tagaytay #Amitie @Minotska @jThaaan @ysrpogi @Aybaaaan @jehemmm http://t.co/YN7fMRHvh4,allanabaloy,2015-08-17 13:07:27+00:00
2178,633263672370970624,Win a SX Mini M Class mod from http://t.co/DnbiKRW2Ks - http://t.co/uOSPXqhFwI #ecig #Vape,DwizzleRice,2015-08-17 13:06:39+00:00
2179,633263540757925892,I feel like mustang owners and people who show off their 'vaping skills' are the same person.,Lord_Galen,2015-08-17 13:06:08+00:00
2180,633263447954882560,"More LIES about #vaping!  Stop the madness!  Get involved!

#vapenews #ejuice #EcigUK#Vape http://t.co/0yGIIncTMu http://t.co/4LSBIFilHi",RastaVapors,2015-08-17 13:05:46+00:00
2181,633263441814228992,Coast2CoastVapers just went LIVE at [ http://t.co/1NPpscVhZK ] on @Vapersdottv - #AutoTweet #Live #Video #Vaping #Vapers #ecig #Vapor,LiveOnVapers,2015-08-17 13:05:44+00:00
2182,633263378048372736,Science explains the difference between smoking and vaping. http://t.co/tLyUAJw59h,981WKDD,2015-08-17 13:05:29+00:00
2183,633263232229212161,bought a nice dark wooden mouthpiece for the  today. feels way better between the lips.  https://t.co/nHj2QkSCIX #vape #ecig,ecigitesztek,2015-08-17 13:04:54+00:00
2184,633263229100273664,"ASH Press Release: ""No evidence  gateway for young smoking"" |  |     https://t.co/uezIQJtKpT #vape #ecig",ecigitesztek,2015-08-17 13:04:53+00:00
2185,633263227862970370,NOW OPEN!!   https://t.co/2eIYknxNCQ #vape #ecig,ecigitesztek,2015-08-17 13:04:53+00:00
2186,633263224851443712,Wonder how to use the Emow Mega Kit?  … Detailed instructions with pictures.  1  https://t.co/bkkb0W6hIC #vape #ecig,ecigitesztek,2015-08-17 13:04:52+00:00
2187,633263223840604162,E-cig Gateway Effect Unfounded: Fears e-cigarettes lead children to smoke tobacco are unfou...    https://t.co/BvtpNjT4ME #vape #ecig,ecigitesztek,2015-08-17 13:04:52+00:00
2188,633262929299812352,#RT Check out Infinite CLT v3 Mini RDA &gt; http://t.co/TNlC7JPDNk &lt; #vape #vapeporn #ecig #eciguk #retweet #dripclub http://t.co/fYWAXr7trY,GreyHazeEcigs,2015-08-17 13:03:42+00:00
2189,633262860840378368,"Pro-Con: Should Port Lavaca ban smoking, vaping indoors? http://t.co/IlMcSZQOsw",Vicadvocate,2015-08-17 13:03:26+00:00
2190,633262857640128512,Kid vaping in the bathroom between classes... Sounds like home already((:,babradeys,2015-08-17 13:03:25+00:00
2191,633262749238226946,Win a SX Mini M Class mod from http://t.co/51wdU6jwSU - http://t.co/Cdx6ZRu8y5 #ecig #Vape,FJoeHart,2015-08-17 13:02:59+00:00
