,TweetID,TweetContent,TweeterUsername,TweetDatetime
0,631978317902671872,If you don't snap 10 million snapchats of you vaping- do you even vape bro????,megxo5,2015-08-13 23:59:07+00:00
1,631978316950474752,Am I missing something behind vaping?????? Because like I just don't understand???,jttaylor92,2015-08-13 23:59:07+00:00
2,631978275686912000,NuclearVandalism just went LIVE at [ http://t.co/l9PoPlTJFQ ] on @Vapersdottv - #AutoTweet #Live #Video #Vaping #Vapers #ecig #Vapor,LiveOnVapers,2015-08-13 23:58:57+00:00
3,631978220498194432,Clouds for days#vape #vapecommunity,PeteyNYYKJ,2015-08-13 23:58:44+00:00
4,631978112478277633,Thanks IE Vapes for the follow! Join Us Also in Our Website http://t.co/XFENjJCLQg If You Do Reviews Contact Us,VapersTube,2015-08-13 23:58:18+00:00
5,631978108103622657,Latest #episode of the #Vapecast #ejuicereview #eliquid #vape #vapelife #vaping #kbox #cherrybomber #mod http://t.co/8rpzDiBjis,AudaciousTitans,2015-08-13 23:58:17+00:00
6,631978105272406017,"omg we get it, you vape",i_bern_em,2015-08-13 23:58:16+00:00
7,631978048729018368,the kid next to me is VAPING PLS PLS PLS HELP,mfalast,2015-08-13 23:58:03+00:00
8,631977858408169472,anyone wanna give me some vape?,phiajoyce_,2015-08-13 23:57:17+00:00
9,631977800010895360,now Ian's buying liquid for his vape pen and I'm over here tearing him a new one,logurra,2015-08-13 23:57:03+00:00
10,631977792331235328,Public Health Focus &gt; Ele... http://t.co/4r0CWHHjE4 #trustedsolution #lunarroverusa #vape #vaping #vapelife #vapelyfe #eliquid #ecigs,LunarRoverUSA,2015-08-13 23:57:01+00:00
11,631977623304802305,Rockobillyvapez just went LIVE at [ http://t.co/F7AQVHqa0C ] on @Vapersdottv - #AutoTweet #Live #Video #Vaping #Vapers #ecig #Vapor,LiveOnVapers,2015-08-13 23:56:21+00:00
12,631977445806206976,Jet fuel can't vape steel beams.,GageMags,2015-08-13 23:55:39+00:00
13,631977313660469248,Best Vaping Apps for iOS #vapelife #ios #vape http://t.co/6Lita8XYbR http://t.co/J7BG5CL3Hv,vapeplace,2015-08-13 23:55:07+00:00
14,631977310778822657,I need a vape...,josegnike,2015-08-13 23:55:07+00:00
15,631977303946473472,"i hate people that dress like this. like we get it, you vape http://t.co/OuNIIX2sD1",pceluv666,2015-08-13 23:55:05+00:00
16,631977206345019393,vape is life man,Kivoh_,2015-08-13 23:54:42+00:00
17,631976940283539456,This Coup D'Etat from @ColonelBoom is some #fire #vape #vapeporn http://t.co/YLlU4vtilr,XperienceVapes,2015-08-13 23:53:38+00:00
18,631976677925588992,how I feel about vaping @RitaWatson_  https://t.co/7YFerKayGE,HaleykygerHaley,2015-08-13 23:52:36+00:00
19,631976676176605184,"Doin it up in Cali with Praxis and Good Ohm Boys! 

#vape #vapelyfe #vapelife #eastcoastvaper… https://t.co/SOYo2bu7P0",kumovapors,2015-08-13 23:52:35+00:00
20,631976644471836673,"VCC aka Vaper's Choice Cotton aka 'The People's Champ""

Available now at http://t.co/rPQmxEkoUV  @csvape… https://t.co/zY3PkjgYJV",VapersChoiceCot,2015-08-13 23:52:28+00:00
21,631976604558884864,Thanks IE Vapes Upload Your Reviews or Vaping Product Videos and Photos in our Website http://t.co/I4M5SZdVpa,VapersTube,2015-08-13 23:52:18+00:00
22,631976301583335424,Cotton Bacon V2 - 10 pc - BadaBing Vape Co.      https://t.co/GI2jq68zqc #vape #ecig,ecigitesztek,2015-08-13 23:51:06+00:00
23,631976152005894144,win FREE E-Liquid from Nocturnal E-Liquid! http://t.co/M0yYIMn2gz Giveaway by Mr. Free Vape http://t.co/ljqiahbNGw https://t.co/bjFTzjEWWW,DailyRandomVlog,2015-08-13 23:50:30+00:00
24,631976105793179648,Locked outta the house without my vape and I have to shit 😂😭😂😭,whitedude97,2015-08-13 23:50:19+00:00
25,631976085748498432,My dad is complaining about my student Amazon prime... ITS $50 A YEAR YOU IDIOT YOU SPENT MORE THAN $50 A WEEK ON VAPE SHIT AND BEER,DiabolicalDunce,2015-08-13 23:50:15+00:00
26,631976056489021440,Steadfast Liquid Co. http://t.co/73Uvw8523q #vape #ecigs #reddit,ukvaper,2015-08-13 23:50:08+00:00
27,631976055784345600,Please help me find my mystery mod. http://t.co/KfQsjJGyaQ #vape #ecigs #reddit,ukvaper,2015-08-13 23:50:07+00:00
28,631976054660272128,Giant Vapor /u/redbic http://t.co/yCb7jMnXmJ #vape #ecigs #reddit,ukvaper,2015-08-13 23:50:07+00:00
29,631976038260584448,furries vaping to dubstep,sadpoopingboys,2015-08-13 23:50:03+00:00
30,631975885491568640,Cotton Bacon V2 - 10 pc - BadaBing Vape Co. http://t.co/lx8MMUwn2v #vapelife #vape #ecig #badabingvapeco,BadaBingVapeCo,2015-08-13 23:49:27+00:00
31,631975881045512192,Vape News at 6! Check out our newest commercial Featuring Matthew Fairman! https://t.co/a8tVkWPRA1 http://t.co/gKZZeddeby,novumvisuals,2015-08-13 23:49:26+00:00
32,631975853014908928,The_Asylum just went LIVE at [ http://t.co/1UHcKCKRlp ] on @Vapersdottv - #AutoTweet #Live #Video #Vaping #Vapers #ecig #Vapor,LiveOnVapers,2015-08-13 23:49:19+00:00
33,631975799374016512,Win a Whiteout Evolv DNA200 Box Mod! #vaporjoes #vapingunderground #vaping http://t.co/t37vdyc8nM,JJEuskal,2015-08-13 23:49:06+00:00
34,631975784198963200,*listens to Blotter while vaping,NERV0USDAD,2015-08-13 23:49:03+00:00
35,631975777207222273,the proper way to vape https://t.co/TPpprNrQuv,berniemacsho,2015-08-13 23:49:01+00:00
36,631975689936367616,wanna hit up the vape club and get hella fogged,cutegirlreal,2015-08-13 23:48:40+00:00
37,631975388542054400,Enter for a chance to win a Snow Wolf 200w TC Mod &amp; 180ml Gift Pack from @DownEastVapes &amp; @Bella_Vapes http://t.co/jnX01lwNSm,missykiss,2015-08-13 23:47:28+00:00
38,631975343218253826,We get it you vape. http://t.co/SWR6p0Rszk,prettylightser,2015-08-13 23:47:18+00:00
39,631975337094610946,Spotted: white male wearing fedora driving Prius through the vape shop drive thru.,AnnaElizabeth03,2015-08-13 23:47:16+00:00
40,631975206454755329,Grace's friends are about to be in my car boutta blast em with the mixtape,juul_lanyards,2015-08-13 23:46:45+00:00
41,631975157775646720,Childish as fuck,vape_peace,2015-08-13 23:46:33+00:00
42,631975078209523712,Coil Master 521 show at #ecc now！Welcome to our booth brothers！#vape #vapefam #vapeexpo #ecc #eccexpo #ecc2015 http://t.co/FKKqJSCiPB,coilmasternet,2015-08-13 23:46:14+00:00
43,631975024304521216,I put my money on 50 vapes getting taken away in sl schools this year,jooeezzyy24,2015-08-13 23:46:01+00:00
44,631975019812294656,GOSH MOM STFU! ILL VAPE IN MY ROOM ALL DAY IF I WANT TOO,PoshPimp_,2015-08-13 23:46:00+00:00
45,631974933237788672,RT cityvaporofri: We have the #sigelei150 #boxmods in stock at both of our locations! #ecig #vape #vapelife #vaping #RhodeIsland #Providence,vapemerch,2015-08-13 23:45:40+00:00
46,631974931027394561,RT quickdrawvapor: Can't reach the rim? QuickDraw takes you higher. #vape #HighSociety http://t.co/HPH1QufcEt,vapemerch,2015-08-13 23:45:39+00:00
47,631974921778786305,💡 AWT 18650 3000MAH 4TH 💡#vapeporn #vapefamily #vapepics #vapehooligans #ejuice  #vapesociety #vapemail #vapelife http://t.co/9VO9ve55sg,ie_vapes,2015-08-13 23:45:37+00:00
48,631974756808421376,New mod and RDA #vape #vapeporn #sigelei #royalhunter #clouds #fatpanda #broke http://t.co/f9OTLPOv5f,69ingBoesche,2015-08-13 23:44:58+00:00
49,631974580668665856,We have the #sigelei150 #boxmods in stock at both of our locations! #ecig #vape #vapelife #vaping #RhodeIsland #Providence,cityvaporofri,2015-08-13 23:44:16+00:00
50,631974514004373504,I Vape Your Milkshake,lomavistaplace,2015-08-13 23:44:00+00:00
51,631974485218889728,#vape #vapelife #vapeporn #subohms #cloudchaser #cloudchasing #premium #ejuice  #whitelightning # unicorncake #yum http://t.co/SGR3RhdaNm,zonianjohnvapes,2015-08-13 23:43:53+00:00
52,631974399533453312,We get it Idaho.  You vape.,hitthalightz,2015-08-13 23:43:33+00:00
53,631974277777068032,"Not all heroes smoke vapes…
but all mine do.",goldestrawberry,2015-08-13 23:43:03+00:00
54,631974254347710464,thank you for vaping,pplesoda,2015-08-13 23:42:58+00:00
55,631974184273448961,Relationship status: pondering whether giant clams vape.,HutchinsonDave,2015-08-13 23:42:41+00:00
56,631974180657995777,Sitting next to a vaper. Please kill me.,carlyTHFC,2015-08-13 23:42:40+00:00
57,631974074311245824,Enter to win a Snow Wolf 200w Mod &amp; 180ml Gift Pack from @DownEastVapes &amp; @Bella_Vapes http://t.co/jnX01lOoJU,missykiss,2015-08-13 23:42:15+00:00
58,631974048902197248,brother bought vape 😕,AmirunSyaaahair,2015-08-13 23:42:09+00:00
59,631974015867965440,"""This is our vape song."" - Justus Shoults.",dailysam97,2015-08-13 23:42:01+00:00
60,631973953607737344,2wavy https://t.co/agSb5XLHHs,juul_lanyards,2015-08-13 23:41:46+00:00
61,631973953024557056,bradford got a vape store yes finally,woozyeddy,2015-08-13 23:41:46+00:00
62,631973936855707648,"""where my vape goons at"" is a sentence I just read with my own two eyes :(",MacaulaySulkin,2015-08-13 23:41:42+00:00
63,631973935106560000,"I hate when people dress like this. we get it, you vape http://t.co/OYLQCbWREi",kbabyy4real,2015-08-13 23:41:42+00:00
64,631973776020770817,actually heaven  https://t.co/4w9DjGuEoG,G_juuls,2015-08-13 23:41:04+00:00
65,631973551575334912,"Now Available @ie_vapes
💡 AWT 18650 3000MAH 4A 💡

#vapeon #vappix #vapefamous #vapehappy #coilporn… https://t.co/OyEseJXJHQ",ie_vapes,2015-08-13 23:40:10+00:00
66,631973183432851456,I came to kick ass and do vape. And the ass tank is on 'e' http://t.co/9eQWmSl9Ux,chumptim,2015-08-13 23:38:43+00:00
67,631973172254937088,Enter to win a Snow Wolf 200w Mod &amp; 180ml Gift Pack from @DownEastVapes &amp; @Bella_Vapes http://t.co/rq2wTeJk2X,pvchip3,2015-08-13 23:38:40+00:00
68,631973094039486464,Win a SX Mini M Class mod from http://t.co/bNVJMwqDmB - http://t.co/eW74zv5RM5 #ecig #Vape,skyenova59,2015-08-13 23:38:21+00:00
69,631973002884829184,Tonight at 8 EST Bitches be drippin at 10 EST Lance from Gorge Vapors at Midnight EST Watcher http://t.co/IKlGc9x7sD #vapeshow #vape,VAPENETWORK,2015-08-13 23:38:00+00:00
70,631972858399453184,"Batteries make the vape, make sure you've got a good one. The LG and MXJO 18650s are great batteries, in stock now. http://t.co/wNw6elCHgP",ecigvault,2015-08-13 23:37:25+00:00
71,631972812513611776,My coworker is hot boxing his car with vape and I can see him from across the parking lot,Casanovuhh,2015-08-13 23:37:14+00:00
72,631972699833700352,OHMYFUCK I just found a sandwich bag full of pot and a container full of wax and a vape pen AT MY GRANDMA'S HOUSE,xoangrosexo,2015-08-13 23:36:47+00:00
73,631972597194981377,messed around after work  https://t.co/XxdTFUmxDl #vape #ecig,ecigitesztek,2015-08-13 23:36:23+00:00
74,631972595332685824,Can't reach the rim? QuickDraw takes you higher.    https://t.co/D7qAkYHsaG #vape #ecig,ecigitesztek,2015-08-13 23:36:22+00:00
75,631972402403147777,Hottest New Vaping Deals for You 08/13/2015: http://t.co/pMOmmwmE37,RockyTopABlaze1,2015-08-13 23:35:36+00:00
76,631972367724507136,"COIC considers tobacco, smoke, vape-free facilities: In addition, preliminary research on the use of electroni... http://t.co/C65X1Pv1ag",myecigvapor,2015-08-13 23:35:28+00:00
77,631972366743015424,"FDA may crack down on e-cigs, regulate vape e-liquid flavors to lose kid appeal: The Food and Drug Administrat... http://t.co/1IpU3hSkYi",myecigvapor,2015-08-13 23:35:28+00:00
78,631972283851010048,"Poof! A Faceless Vaper appears out of thin air. #whoarethevapers, #postfacelessvaperpics. When U Vape, how's ur face? http://t.co/X3o2zipucw",WhoAreTheVapers,2015-08-13 23:35:08+00:00
79,631972277207330816,Loner life = *buys vape* *buys bottle of wine*,coolietings,2015-08-13 23:35:07+00:00
80,631972179261947904,@GFORCEvapor love the festival mod-- can’t wait for the EARTH mod! #ECC2015 #vapefam #ejuice #vapelyfe #mods #vape http://t.co/FQKh1zjb8S,Intrinsic_Eliq,2015-08-13 23:34:43+00:00
81,631972145350971392,I just drove past teenage white boys vaping in a mini van what a time to be alive :),prttygrl888,2015-08-13 23:34:35+00:00
82,631971937447645184,Sorry to break it to you but no one cares that you vape,Rileyy_Ann,2015-08-13 23:33:46+00:00
83,631971911560355840,the sky tells me god vapes,bonnabe11e,2015-08-13 23:33:39+00:00
84,631971670727729152,This 2 wheeled scooter is a trip😜 #ECC #Vape💨 https://t.co/c9eCLbk10d,Sarah3Dipity,2015-08-13 23:32:42+00:00
85,631971500170588161,"if you ain't vaping, you ain't shit",y0mikeycap,2015-08-13 23:32:01+00:00
86,631971477856874496,My dad went to the wackey tobacky shop today and bought a vape I'm dead😂💀,baileymorroww,2015-08-13 23:31:56+00:00
87,631971456449179648,I don't even really vape 😍 ~ but medusa 3mg and in 120ml bottle 🔥 https://t.co/SFk61WSCZd,eclex_360,2015-08-13 23:31:51+00:00
88,631971441920090112,This lady vaping in the panera drive thru,chloerophyll,2015-08-13 23:31:47+00:00
89,631971403667894272,Someone's been vaping. http://t.co/Kbp5SgPFlO,lexilunchick12,2015-08-13 23:31:38+00:00
90,631971373703950336,Vaping: Not a safe alternative to cigarettes--possible hearing loss connection. #audpeeps #smoking #health http://t.co/ppdoSrQKWM,WeekinHearing,2015-08-13 23:31:31+00:00
91,631971354871525376,#vapelyfe #VapeOn #vape #cloudsbruh messed around after work http://t.co/mzYwdPYejL,lmOnMyLeveL,2015-08-13 23:31:27+00:00
92,631971238261432320,RT gnarlyball: Hey robdelaney is this you? His name is #Vape Overlord so I assume yes https://t.co/w2XDdThJSC …,vapemerch,2015-08-13 23:30:59+00:00
93,631971237082853377,RT AmanGupta888: Trying to kick the #cigarets. Wish me luck! #vape,vapemerch,2015-08-13 23:30:59+00:00
94,631971233081503744,RT MiracleCuresYou: MonsterbudAjax: RT cannafinancing: http://t.co/akOnngMF7R; can finance UR #cannabis or #vape … http://t.co/jEwF7q4BRW,vapemerch,2015-08-13 23:30:58+00:00
95,631971231798030340,RT MiracleCuresYou: PotTeez: RT cannafinancing: http://t.co/akOnngMF7R; can finance UR #cannabis or #vape busines… http://t.co/jEwF7q4BRW,vapemerch,2015-08-13 23:30:57+00:00
96,631971230640439296,RT Kool_Breath: Whether you are just dipping your toe in the water or are a serious vaper Kool Breath have somethi… http://t.co/nrbYEKCZqR,vapemerch,2015-08-13 23:30:57+00:00
97,631971229478600704,"RT FlawlessvapesOC: Free juice day
#flawlessvapesandsupplies #VAPELYFE #NOTblowingsmoke #eliquid #ejuice #vape http://t.co/bCCQ0UrLx5;",vapemerch,2015-08-13 23:30:57+00:00
98,631971135454846976,Can't reach the rim? QuickDraw takes you higher. #vape #HighSociety http://t.co/ioFU3WXyMA,quickdrawvapor,2015-08-13 23:30:34+00:00
99,631971117368868864,can i bring a vape pen on a cruise w me,emohouseparty,2015-08-13 23:30:30+00:00
100,631970998586318848,vape birch,vapeeverything,2015-08-13 23:30:02+00:00
101,631970527775727616,"RESTOCK ON YOUR FAVORITE EXOTIC FRUIT MIXES 
#H2oVapors #teamH2o #calivapers #vape #vaping #vapelyfe #vapelife... http://t.co/djASMsJwVq",H2oVapors,2015-08-13 23:28:09+00:00
102,631970517164146688,. is giving away a state of the art E-cig kit aka Personal Vaporizer Kit from     https://t.co/nq3a8Mng4M #vape #ecig,ecigitesztek,2015-08-13 23:28:07+00:00
103,631970515721289728,Trying to kick the . Wish me luck!   https://t.co/9Y2GkWhdRc #vape #ecig,ecigitesztek,2015-08-13 23:28:07+00:00
104,631970514307784704,It's  time! Legendary juice from a company that's been in the game for a long time!   https://t.co/3Rm5AYhHbT #vape #ecig,ecigitesztek,2015-08-13 23:28:06+00:00
105,631970512676233216,Stop by  and see cdeez_cloudnine2five for a free build from 4-7  …  https://t.co/R4FY1XkOul #vape #ecig,ecigitesztek,2015-08-13 23:28:06+00:00
106,631970510927187968,Hope all my  family people are having a wonderful day!   https://t.co/vh4RnTmqLj #vape #ecig,ecigitesztek,2015-08-13 23:28:05+00:00
107,631970508804857856,"They want us to smoke, want us to choke
by paying #ecig taxes

In their hands - a manipulative plan to recoup forgetting the facts.
#vape",Vapingit,2015-08-13 23:28:05+00:00
108,631970503947849729,Whether you are just dipping your toe in the water or are a serious vaper Kool Breath have something for you   https://t.co/YTPtY4tOeN #va…,ecigitesztek,2015-08-13 23:28:04+00:00
109,631970347235971073,VAPER USA Alert: New Review on @Boilermakervapor http://t.co/hxpQph8fZw,VaperUSA,2015-08-13 23:27:26+00:00
110,631970148723748865,Win a Hermetic Steam E-Juice Sampler from @cigbuyer: http://t.co/TeYgzZnLc0 #ecigs #vaping #eliquid #ejuice #vapecontest #vapegiveaway,dbl_dan,2015-08-13 23:26:39+00:00
111,631970115790180352,Idk @Shanley_017 has more Vape game then me  https://t.co/hWUAjJVC1N,brettfinan1,2015-08-13 23:26:31+00:00
112,631969985343156224,Vape pen going ham😍,geej32,2015-08-13 23:26:00+00:00
113,631969985049419776,Win a Joyetech EVIC VT Kit from @cigbuyer and @huffandpuffers: http://t.co/6wGCy5nAT8 #ecigs #vaping #evicvt #vapecontest #vapegiveaway,dbl_dan,2015-08-13 23:26:00+00:00
114,631969843890118657,Win a SX Mini M Class mod from http://t.co/ncwT6RPBuO - http://t.co/XtfMl1o8WH #ecig #Vape,dbl_dan,2015-08-13 23:25:26+00:00
115,631969656258101249,Have u heard of #eCigs? Try #V2Cigs #V2Pro #coupon SOFLA10 #ecigarettes #VAPOR #SMOKE #eCigs #eLiquids #Vaping http://t.co/JjEWqKmDX3,Musa_gussa,2015-08-13 23:24:42+00:00
116,631969630496550912,am bored,G_juuls,2015-08-13 23:24:35+00:00
117,631969626977607680,Hmm after reading about them I kinda want to get a caffeine vape pen,Bhendricksen,2015-08-13 23:24:35+00:00
118,631969524938579968,Big thanks to everyone for following me it's overwhelming peace love and respect to all my vaping brothers and sisters!,Jamesy_Vapes,2015-08-13 23:24:10+00:00
119,631969491518251008,Quick birthday vape sesh👌,briannn21,2015-08-13 23:24:02+00:00
120,631969401907101696,White culture is so exotic and beautiful...😍 (Vine by vape wizard) https://t.co/SinKr99OWF,edahsnad,2015-08-13 23:23:41+00:00
121,631969332474458112,VapeOnTV just went LIVE at [ http://t.co/dUE6ovOVOl ] on @Vapersdottv - #AutoTweet #Live #Video #Vaping #Vapers #ecig #Vapor,LiveOnVapers,2015-08-13 23:23:24+00:00
122,631968992509341696,Vape? Nahh. Its a waste of money,SyazwanZharif,2015-08-13 23:22:03+00:00
123,631968897781137408,.@RelixMag is giving away a state of the art E-cig kit aka Personal Vaporizer Kit from @HotVapes #vapelife #vape http://t.co/IhmOlVvYt4,Jessie7851,2015-08-13 23:21:41+00:00
124,631968747339837440,Well there's a thing. It's a bloody hot vape! #vapingcommunity #vaping #plumesofhazard #grimmarmy… https://t.co/ReMQ4ehu6H,Vaping_Biker,2015-08-13 23:21:05+00:00
125,631968694579671040,General Vape offers 5th Ave a trendy new lounge as an outlet to the e-cig movement #vaping #BayRidge #brooklyn http://t.co/NPLWxTh11S,BayRidgeBeat,2015-08-13 23:20:52+00:00
126,631968604813037568,Enter to win a Snow Wolf 200w Mod &amp; 180ml Gift Pack from @DownEastVapes &amp; @Bella_Vapes http://t.co/tOAyTS0lyp,DigidogThomas,2015-08-13 23:20:31+00:00
127,631968544931082240,"The Erie County Fair in three words:

So. Much. Vape.",HeyyLynds,2015-08-13 23:20:17+00:00
128,631968446935384064,kev got dat vape 💯💯💯 http://t.co/xaufuMpWtP,icanteatalentil,2015-08-13 23:19:53+00:00
129,631968366102749184,THIS BITCH WANNA BUY MY VAPE BUT COME AT ME SIDEWAYS FOR SMOKING IT http://t.co/qnCwmS4bUi,SpookyAshlee,2015-08-13 23:19:34+00:00
130,631968359697944580,His fucking clouds... And I thought I vaped...  https://t.co/HOy0s8sUoH,RainyDncr,2015-08-13 23:19:33+00:00
131,631967998006435840,#myschoolinthreewords you tryna vape?,deannacollazo,2015-08-13 23:18:06+00:00
132,631967943241297920,RuggedNorth just went LIVE at [ http://t.co/mNJ33VzpTt ] on @Vapersdottv - #AutoTweet #Live #Video #Vaping #Vapers #ecig #Vapor,LiveOnVapers,2015-08-13 23:17:53+00:00
133,631967888665022464,Hey @robdelaney is this you? His name is #Vape Overlord so I assume yes https://t.co/s1zC7wIvxG,AMScarr,2015-08-13 23:17:40+00:00
134,631967805328478209,Trying to kick the #cigarets. Wish me luck! #vape http://t.co/ZfNd3X9DPV,AmanGupta888,2015-08-13 23:17:20+00:00
135,631967681487466496,Goodbye Google Ads - #vape #vapelife http://t.co/o5CexUp99U,VapingVapeDog,2015-08-13 23:16:51+00:00
136,631967665456676865,If you're going to smoke something why don't you smoke a cig or a blunt or crack for all I care. Just please don't vape.,gutterbuttx,2015-08-13 23:16:47+00:00
137,631967652370518016,Do you guys vape http://t.co/bbg0CF7lp8,sanchito58,2015-08-13 23:16:44+00:00
138,631967630283403264,Gemini Vapes is coming to Cloud Town Vapors! http://t.co/oGfmVPlRle,Cloudtownvapors,2015-08-13 23:16:39+00:00
139,631967627116548097,Holy mother of god. I'm seriously about to have a heart attack. Packie snapped me back. Jesus he was vaping.,wet_blankets,2015-08-13 23:16:38+00:00
140,631967540298715136,Stop by and order your Time Bomb Maniac TODAY!  love me some cupcakes http://t.co/lY8Fn7exWV #vape #vapon #ejuice #timebombvapors,vapegard,2015-08-13 23:16:17+00:00
141,631967442697191425,Steph we get it you vape😒,SkylarTurner_,2015-08-13 23:15:54+00:00
142,631967424099799040,"I still don't get the vape craze, why bother?",jeremiahSlewis,2015-08-13 23:15:49+00:00
143,631967407666524160,RT MtBakerVapor: I love the truth about #vaping videos! They do a great job with making sense of the issued in the… http://t.co/Nnlkdwp8ZZ,vapemerch,2015-08-13 23:15:46+00:00
144,631967397445042176,New set up with that buster mod with a troll RDA 😤👌🏼☁️ #Vape #VapeDaily #AV #Mods #Clouds #VapeSquad… https://t.co/Q32Kw8yLeU,king_Anthonyxo,2015-08-13 23:15:43+00:00
145,631967397239517184,Vapes are like sucking a robots dick.,chattvillian423,2015-08-13 23:15:43+00:00
146,631967376309923840,#vape #freestyle (Vine by we hate magcon) https://t.co/HI2N1KpZA3,AVOCADHOEHARRYY,2015-08-13 23:15:38+00:00
147,631967364549058560,guy at the vape shop told me I look 14 so it's whatever,itsaubreyyall,2015-08-13 23:15:35+00:00
148,631967164426252288,"I wanna be famous for something so simple and easy. Like vaping, but not vaping. Lmao I just want free shit",miszsharlene,2015-08-13 23:14:48+00:00
149,631967108935643136,Anybody have vaping stickers for my cycling helmet?,Magikinfo2,2015-08-13 23:14:34+00:00
150,631966914873528320,Dude at the vape store tripled my free bottle cause he liked my @warriorlacrosse #coxswain,cac_o_phony,2015-08-13 23:13:48+00:00
151,631966814357090304,"""Are you vaping right now???""
Nah it's a pencil @juliaryan24",mcgeever3_colin,2015-08-13 23:13:24+00:00
152,631966766722211841,Sins http://t.co/IzYqjJb9Dq #ecig #vape #UKV,ukvaper,2015-08-13 23:13:13+00:00
153,631966755150254080,I'm so tired that I vaped my tank empty and burned up my coil. Aghhhhhhhh I need sleep.,TheBigOle_DM,2015-08-13 23:13:10+00:00
154,631966723688808449,Root Beer ZeronicJuice  Mount Baker Vapor       https://t.co/swLmIHbE1e #vape #ecig,ecigitesztek,2015-08-13 23:13:02+00:00
155,631966722677964800,I love the truth about  videos! They do a great job with making sense of the issued in the  community!  https://t.co/L8HJcPVd4k #vape #ecig,ecigitesztek,2015-08-13 23:13:02+00:00
156,631966721209974785,"Honestly have never felt like this big of a ""white kid"" before    https://t.co/rbkz1UoJDK #vape #ecig",ecigitesztek,2015-08-13 23:13:02+00:00
157,631966720027197440,Blue Out - eLiquid Flavor     https://t.co/xHv3obaUDd #vape #ecig,ecigitesztek,2015-08-13 23:13:02+00:00
158,631966716004843520,Shoutout to the guy vaping in the bathrooms at pats game,TomReynolds54,2015-08-13 23:13:01+00:00
159,631966358570336256,Have u heard of #eCigs? Try #V2Cigs #V2Pro #coupon SOFLA10 #ecigarettes #VAPOR #SMOKE #eCigs #eLiquids #Vaping http://t.co/9gRwMrnvpQ,cocomarian2,2015-08-13 23:11:35+00:00
160,631966104953327616,"Hey people who vape, you must get nothing done with all the fucking you're doing, right?",GWOTfighter,2015-08-13 23:10:35+00:00
161,631966057893203968,OSU is vape free fuck this I'm dropping out,localJedi,2015-08-13 23:10:24+00:00
162,631966055456481280,"Get Your FREE Bottle Of E-Juice Today!!

➡ http://t.co/DFrxv4HmQh 

#ecigs #ejuice #quitsmoking #vapour #vaping #vape http://t.co/ZVTbFXdPxa",OnlineFreebies1,2015-08-13 23:10:23+00:00
163,631966050821607424,"What is your favorite way to use #marijuana? 
#Smoke
#vape 
#dabs 
#edibles 
#Tinctures
#concentrates 
Other",DestHwy420,2015-08-13 23:10:22+00:00
164,631966009591775232,Anti-Vaping Myth of Big Tobacco http://t.co/HTxU7mjD8W,twentysth_dp,2015-08-13 23:10:12+00:00
165,631965951299309570,"spotted in the Burg: two musclebound dudes in NBA tanks &amp; backwards caps, vaping. I no longer understand anything about my neighborhood.",eshynes,2015-08-13 23:09:58+00:00
166,631965612982439936,I've seen a lot more vape stores than people actually vaping and I'm more than ok with that,MagnifiTrent,2015-08-13 23:08:38+00:00
167,631965604451225600,"Cool kids don't smoke under the bleachers, they vape there",Slatergoodson,2015-08-13 23:08:36+00:00
168,631965590974935040,"FDA may crack down on e-cigs, regulate vape e-liquid flavors to lose kid appeal: Health advocates say it gives... http://t.co/ZD0u1tLpoL",ayskj_store,2015-08-13 23:08:32+00:00
169,631965504165572608,While I sip on my vape,cfloyd_2,2015-08-13 23:08:12+00:00
170,631965487413334016,People who VAPE and try and sell me on it BOTHER ME SO BAD,IAMAZTN,2015-08-13 23:08:08+00:00
171,631965427946668032,Thanks Constantine Vaper Upload Your Reviews or Vaping Product Videos and Photos in our Website http://t.co/I4M5SZdVpa,VapersTube,2015-08-13 23:07:54+00:00
172,631965427225260034,too much vape smoke in the air,bortdude,2015-08-13 23:07:53+00:00
173,631965424654118913,banana nut bread vape juice,QJoshSumner,2015-08-13 23:07:53+00:00
174,631965391116328962,So they actually did it. http://t.co/KjplIptDvm #vape #ecigs #reddit,ukvaper,2015-08-13 23:07:45+00:00
175,631965390424305670,Has anyone tried NEWhere e-juice? Getting a bad aftertaste...might've been bad judgment o... http://t.co/kiqwLjvRPL #vape #ecigs #reddit,ukvaper,2015-08-13 23:07:45+00:00
176,631965379644932096,My vape clouds be causing this thunder.,WxrldBreaker,2015-08-13 23:07:42+00:00
