,TweetID,TweetContent,TweeterUsername,TweetDatetime
1038,635517449337749505,"The best electronic cigarettes available in the Netherlands are for sale at Vape Depot.
http://t.co/9JeT3rkFbt",data_robert,2015-08-23 18:22:21+00:00
1039,635517217816252420,who needs vape pens when u have g2 pens haha am i right ladies,novicedebaters,2015-08-23 18:21:26+00:00
1040,635517088145252353,The cover of my mixtape is gonna be me riding a hoverboard and taking pics of me vaping with my selfie stick,_jimkay,2015-08-23 18:20:55+00:00
1041,635517024375021568,Last day for 20% savings from PrimeVapor.  Complete line of accessories #eliquid  #vaping #ecig #ecigarette http://t.co/G8IPjKfO86,ecigtimesreview,2015-08-23 18:20:40+00:00
1042,635517023527829504,Last day for 20% savings from PrimeVapor.  Complete line of accessories #eliquid  #vaping #ecig #ecigarette http://t.co/W8GGKaMVkZ,PrimeVaporProds,2015-08-23 18:20:40+00:00
1043,635517023175507968,Sky's vape tastes like a pad,cslack2,2015-08-23 18:20:40+00:00
1044,635516927302049792,When someone tells you they don't   https://t.co/F6rG78Fa8U #vape #ecig,ecigitesztek,2015-08-23 18:20:17+00:00
1045,635516926140227585,"Win a Subox + 100ML Bottle of Twisted Vapors Juice!    
Enter here   https://t.co/VcQg0X8s3H #vape #ecig",ecigitesztek,2015-08-23 18:20:17+00:00
1046,635516889872011264,"welcome @kkitteh @Zakarow @alexicofficial @SirInterview @ZiBezel @vape_mc @HQeventsTube
let's get high! via http://t.co/jCxwZbcttU",stoner420peace,2015-08-23 18:20:08+00:00
1047,635516841482416128,vape faggots lol,chofosho,2015-08-23 18:19:56+00:00
1048,635516507175419904,Up..Up..and Away! #Hulla #hullavapes #vape #clouds #hoookah #vaping #vapefam #vapelife #hookahbar #ballons #hotair http://t.co/mW6dKyVMze,Hullavapes,2015-08-23 18:18:37+00:00
1049,635516423909957632,Vape it away,Fornik8R,2015-08-23 18:18:17+00:00
1050,635516416708374528,VULive just went LIVE at [ http://t.co/44iyqk1KOD ] on @Vapersdottv - #AutoTweet #Live #Video #Vaping #Vapers #ecig #Vapor,LiveOnVapers,2015-08-23 18:18:15+00:00
1051,635516319589273602,iStick 100w Stealth Mode? http://t.co/0rYaz2VW6H #ecig #vape #POTV,ukvaper,2015-08-23 18:17:52+00:00
1052,635516231756349440,*moves to portland* *vapes now*😹,IndiSuicide,2015-08-23 18:17:31+00:00
1053,635516193130962945,"the word ""vape"" cracks me up tbh",jessicauruena1,2015-08-23 18:17:22+00:00
1054,635516155734720513,Should vaping be allowed in the workplace? What do you think? Join me &amp; @NickFerrariLBC on @lbc tomorrow at 8.30am as we discuss this issue,DrDawnHarper,2015-08-23 18:17:13+00:00
1055,635516153071337472,my vape pen broke &amp; it fucking burned my mOuTH FriCK,wicketcity,2015-08-23 18:17:12+00:00
1056,635516143487295490,Hope everyone is having a fun day today! #southcoastvapor #vape #vapefam #vaping #vapors… https://t.co/sWFOplYfjy,southcoastvapor,2015-08-23 18:17:10+00:00
1057,635515907859718144,New mod!! #istick40wtc #istick playing with a #zenith #vape  #vapelife #vapegirls #badmanicure 😹 https://t.co/lNAmWVHGyc,EvilBlyn,2015-08-23 18:16:14+00:00
1058,635515883490689025,Are E-Cigarettes Safe? Here's What We Know http://t.co/QC60yb0HKM #ecigs #vaping,VapinXsmoker,2015-08-23 18:16:08+00:00
1059,635515882505003008,Eastern Indiana sheriff considers e-cigarettes for inmates http://t.co/QShhOWTmrV #ecigs #vaping,VapinXsmoker,2015-08-23 18:16:08+00:00
1060,635515881670316032,Doctors Raise Red Flag About Teens and E-Cigarettes http://t.co/CSFr7gAmSu #ecigs #vaping,VapinXsmoker,2015-08-23 18:16:08+00:00
1061,635515880923754496,"Miners turn to medical marijuana, e-cigarettes to cope with industry slump http://t.co/yvEw8OwsXS #ecigs #vaping",VapinXsmoker,2015-08-23 18:16:07+00:00
1062,635515879954886656,Doctor lobbies for legal ‘life-saving’ via e-cigarettes http://t.co/EGWX87IFOz #ecigs #vaping,VapinXsmoker,2015-08-23 18:16:07+00:00
1063,635515801940832258,We get it. You vape....  But no one really cares 👌🏾,anslayyerin,2015-08-23 18:15:49+00:00
1064,635515634760216577,Glass Tray Hand Made Organizer Tool Ash Dab Nail Wax Vape Pen Jewelry USA Unique Gift 420 SALE http://t.co/quW4MskqSk http://t.co/qqbKC3g2oR,shipityourway,2015-08-23 18:15:09+00:00
1065,635515555584323584,A guy is talking to me about vape and cigs,drew94carter96,2015-08-23 18:14:50+00:00
1066,635515028318351360,"""I hate when people take pics like this, we get it... you vape http://t.co/HwPz6tKhgn""",polichenkovr,2015-08-23 18:12:44+00:00
1067,635514985712648193,When someone tells you they don't #vape https://t.co/Z9vESaBryv,KSoutherland83,2015-08-23 18:12:34+00:00
1068,635514973423177729,I wish for more vape juice.,teenajacks,2015-08-23 18:12:31+00:00
1069,635514805785350144,"The After Math: A robot fights for funding, vaping's vote of confidence: Welcome to the… http://t.co/wuCZYIrVYI",SEOguys_OC,2015-08-23 18:11:51+00:00
1070,635514765666705408,Vaping and playing on the one: http://t.co/G48tczlbcm,TheVikingGizmo,2015-08-23 18:11:42+00:00
1071,635514751653707777,Just ordered some #Arise and #Revel to try out on my #vape,Juni2424,2015-08-23 18:11:38+00:00
1072,635514638424215552,Red Rocks hike. #liveneos #vapeneos #cannabis #marijuana #vape #vapelife #maryjane #ganja #kush #weed… https://t.co/dT7JfTkFEb,LiveNeos,2015-08-23 18:11:11+00:00
1073,635514528336220160,VapinWithVic just went LIVE at [ http://t.co/XeWsxDZv3B ] on @Vapersdottv - #AutoTweet #Live #Video #Vaping #Vapers #ecig #Vapor,LiveOnVapers,2015-08-23 18:10:45+00:00
1074,635514525329002496,austin can i vape.,420sandwich,2015-08-23 18:10:44+00:00
1075,635514450431377408,To get your hands on the first UK stock go to #aspire UK http://t.co/93gVkOsK5c #odyssey #pegasus FREE delivery #vape http://t.co/pk7d1eimsJ,ecigaspire,2015-08-23 18:10:26+00:00
1076,635514432135786497,Vape God Sly?,yourgirlsdms,2015-08-23 18:10:22+00:00
1077,635514315915821056,"#vape Don't risk buying clones, get an authentic Triton tank from Aspire UK http://t.co/tq1uKp5wFN with free delivery http://t.co/ASN1oAuSgd",ecigaspire,2015-08-23 18:09:54+00:00
1078,635514269698760705,Vape and chill,The_Slut_Face,2015-08-23 18:09:43+00:00
1079,635514022960480261,"Win a Subox + 100ML Bottle of Twisted Vapors Juice! #vape #competition #giveaway 
Enter here http://t.co/NjwH0WOTY1 http://t.co/JrJcTPoZXa",VapeComp,2015-08-23 18:08:45+00:00
1080,635514021320486916,We get it. You vape. https://t.co/c7qDOebgZB,henryfaber,2015-08-23 18:08:44+00:00
1081,635513864797470720,Dripaholics E-liquid Review! http://t.co/2CO39ADnG2 #Vape http://t.co/gAVDApkZu4,VaporMax_,2015-08-23 18:08:07+00:00
1082,635513712007360512,"HEY NOW #VapeFam! Any good Vape Shops in or Very Close to Indian Rocks Beach, Florida? #Ecigs #Vape #VapeLife #VapeOn #Help #Vape911",fakehater,2015-08-23 18:07:30+00:00
1083,635513711004884992,My vape suddenly has a very hard draw and loss of flavor via /r/Vaping101 http://t.co/QsCdvfEXUk,VapingEnFrance,2015-08-23 18:07:30+00:00
1084,635513700766584832,UK research finds vaping is 95 percent safer than smoking http://t.co/uXa1MPD9RK via @engadget,sjuelz,2015-08-23 18:07:28+00:00
1085,635513657275781120,Lai vape on at @YahananaV 💨,amerulz18,2015-08-23 18:07:17+00:00
1086,635513544927260672,"Ok let our voices be heard. If you don't want vaping to be classed as tobacco, get to signing only takes seconds.

 http://t.co/zScOTFy63e",pistolwhipvape,2015-08-23 18:06:51+00:00
1087,635513522055741440,"Vaped, iced americano'd, now it's time to Duck Game.",TheBabbyLion,2015-08-23 18:06:45+00:00
1088,635513458033750016,"E-cig Debate Heats Up, Again http://t.co/JV18oAH5v0 #Spinfuel #Vape #Vaping #ecig #ecigs #vapelife #Vapersnews",Spinfuel_News,2015-08-23 18:06:30+00:00
1089,635513379130486784,I had a dream that @_momentaryphase got mad at me because I don't vape.,soybeanslut,2015-08-23 18:06:11+00:00
1090,635513372419600387,Smoke #Vape everyday !! 💨💨💨💨💨💨 #Handcheck #Vapor #Vaper #VapeSwag #Smok http://t.co/A88CRQ7a4a,hunnymoneyy,2015-08-23 18:06:09+00:00
1091,635513235949551616,He looks like a vape or die kind of guy.,pr0bablyfreddy,2015-08-23 18:05:37+00:00
1092,635513198582603778,"#Repost @midlands_vape with repostapp.
・・・
#Repost @midlands_vape with repostapp.
・・・
#Repost… https://t.co/pZ18ngE86c",Drew_19_86,2015-08-23 18:05:28+00:00
1093,635513145528844288,Photoset: untitled87121: sixpenceee: A compilation of smoke rings from volcanos OK WE GET IT. U VAPE. http://t.co/ugREXjHmhd,clayrobinson,2015-08-23 18:05:15+00:00
1094,635513018399391744,Win a Whiteout Evolv DNA200 Box Mod! #vaporjoes #vapingunderground #vaping http://t.co/KgFftelkaO,HawkeyeFLA,2015-08-23 18:04:45+00:00
1095,635512989345562624,Kid vaping on the sidewalk just coughed from too big of a hit lmao,bsimms16,2015-08-23 18:04:38+00:00
1096,635512721639895041,Which one is sexier?😜 #vape #vapepics #vapelife #fuckbigtobacco https://t.co/oClVQ7X3q7,jantony32,2015-08-23 18:03:34+00:00
1097,635512719332872193,Everyone fucking vapes now😂,BryceBunz,2015-08-23 18:03:34+00:00
1098,635512637942550528,How's your #vape #sunday going #vapefam ? 😆,tuxedovapes,2015-08-23 18:03:14+00:00
1099,635512508539895812,Having a #NY #pretzel before seeing #friends for lunch. Had a little too much to #vape - #vapemunchies #munchies http://t.co/7IqzAmQDPW,NYVapeShop,2015-08-23 18:02:43+00:00
1100,635512468991791104,Be sure to follow @primevapor for the latest information about vaping. #eliquid  #vaping #ecig #ecigarette http://t.co/chYJv09pu0,ecigtimesreview,2015-08-23 18:02:34+00:00
1101,635512468601720832,Be sure to follow @primevapor for the latest information about vaping. #eliquid  #vaping #ecig #ecigarette http://t.co/5wcOz7WA8X,PrimeVaporProds,2015-08-23 18:02:34+00:00
1102,635512448896905216,"The After Math: A robot fights for funding, vaping's vote of confidence http://t.co/jBEKVOEsKY",germanlettieri,2015-08-23 18:02:29+00:00
1103,635512448393551872,Touchdown #ESLOneCologne,dabreen_vapes,2015-08-23 18:02:29+00:00
1104,635512443398131713,"RT Snifit: anyone want to go make out and #vape in my timeshare in gary, indiana?
maybe u do, robdelaney",vapemerch,2015-08-23 18:02:28+00:00
1105,635512423131299840,Last day for 20% savings from PrimeVapor.  Complete line of accessories #eliquid  #vaping #ecig #ecigarette http://t.co/fO7zKNBhGw,ecigtimesreview,2015-08-23 18:02:23+00:00
1106,635512422871236609,Last day for 20% savings from PrimeVapor.  Complete line of accessories #eliquid  #vaping #ecig #ecigarette http://t.co/w6ZGWcBjt4,PrimeVaporProds,2015-08-23 18:02:23+00:00
1107,635512381607682049,"If you have questions or comments about your order or anything vape related, please email us at support@mtbakervapor.com!",MtBakerVapor,2015-08-23 18:02:13+00:00
1108,635512373583851521,"Jumpa caprice, berjabat tangan n he said ""vape on guys"" 😏😏",A_a_Sem,2015-08-23 18:02:11+00:00
1109,635512333327052800,"Global Reviews are pouring in! Thanks #Mahafsoun!  
The Viscid Collection Worldwide #ecig #vape  #chickswithwicks

http://t.co/s9cVNkFWp2",RastaVapors,2015-08-23 18:02:02+00:00
1110,635512285818060800,"Our all original album will consist of songs about Jared Fogle, Kony 2012, Vape, Strip Clubs, and many more. #GetHype #LP #DadMetal",JailbirthBand,2015-08-23 18:01:50+00:00
1111,635512244835586048,"Don't forget, http://t.co/A38MuPDVry for all your podcasty lust.
#Podcast #vape #6in60 #subohm #sixinsixty #vapor… https://t.co/UDR7pVJfVd",USComics_COO,2015-08-23 18:01:41+00:00
1112,635512233158643712,Have a relaxing sunday! #jacknjune #vape #relax it's #sunday #vapeon #ecig https://t.co/afK2jD3hnT,jacknjuneliquid,2015-08-23 18:01:38+00:00
1113,635512135976534016,I don't vape crack motherfucker I sell it.,NotRealEric,2015-08-23 18:01:15+00:00
1114,635512083409297408,thehangoutroom just went LIVE at [ http://t.co/N4Zv5Jt3P4 ] on @Vapersdottv - #AutoTweet #Live #Video #Vaping #Vapers #ecig #Vapor,LiveOnVapers,2015-08-23 18:01:02+00:00
1115,635512066673999872,Vape on 😏 http://t.co/fDdwgwBo3P,A_a_Sem,2015-08-23 18:00:58+00:00
1116,635512037536342016,Give us a vaping try http://t.co/Jjxld8feo7 http://t.co/Hl8KxAeOhB,esheeshforecigs,2015-08-23 18:00:51+00:00
1117,635512034084392963,For all your vaping needs http://t.co/o2jrHTG6uv http://t.co/MibB8BmorC,esheeshvaping,2015-08-23 18:00:50+00:00
1118,635512018011881472,Tremendous choice of vaping gear http://t.co/aX1eHJVtYA http://t.co/YIOcWfGf7O,esheeshecigs,2015-08-23 18:00:46+00:00
1119,635511983572393984,I JUST GOT HIT IN THE EYE WITH A VAPE I'M??????¿?,rstprk,2015-08-23 18:00:38+00:00
1120,635511971404771328,Give the gift of nonsmoking only 7.95 for a Starter Kit http://t.co/lE5DQzfnp9  #vapelife #stopsmoking #ecigs #vape http://t.co/qXESrvwNl6,Suckmybox_com,2015-08-23 18:00:35+00:00
1121,635511965511643141,"I'm literally standing in front of the Dairy Queen with vaping fratbroa waiting for it to open, my life is garbage.",hypodronic,2015-08-23 18:00:34+00:00
1122,635511864185585664,This is what happens when the whole town starts vaping...,PelkeyShane,2015-08-23 18:00:10+00:00
1123,635511830484512768,vape plane,vapeeverything,2015-08-23 18:00:02+00:00
1124,635511724808912896,Win a Whiteout Evolv DNA200 Box Mod! #vaporjoes #vapingunderground #vaping http://t.co/sx3OHpLAQY,mtc591,2015-08-23 17:59:37+00:00
1125,635511447838048256,OK I DONT SMOKE I VAPE  https://t.co/rdTsY7zpp6,xavideleted,2015-08-23 17:58:31+00:00
1126,635511271639531520,PixelVape just went LIVE at [ http://t.co/6NC9VQ5ZCK ] on @Vapersdottv - #AutoTweet #Live #Video #Vaping #Vapers #ecig #Vapor,LiveOnVapers,2015-08-23 17:57:49+00:00
1127,635511124981587969,Just cracked up so hard bc I remembered this kid last night bragging about being able to vape on the highest setting of his little rig HAHAH,kitcatpaddywaq,2015-08-23 17:57:14+00:00
1128,635510864251064321,Good morning! :) Today is BUY ONE GET ONE FREE CARTRIDGES ($35 VALUE)! Stop by until 8PM. #azolove #myleaf #vape #mmj http://t.co/F7xd63W9KV,ArizonaOrganix,2015-08-23 17:56:11+00:00
1129,635510824149368832,"U. Smoke &amp; Vape Did you know... ""The noble Meerschaum is unique among pipes. Its mysterious properties make it a... http://t.co/YeAnq1KO7z",MainStTobacco,2015-08-23 17:56:02+00:00
1130,635510761352208384,Just a few of my setups #vape #vapor #vapeit #vapelife #vapelyfe #tootlyfe #vapefam #vapecommunity… https://t.co/3mPu3owD7n,c_kovs,2015-08-23 17:55:47+00:00
1131,635510474117894144,Titan II and the Snoop Dogg G pen #snoopdogg #gpen #vaporpen #vaporizing #vapor #vape #vapepen… https://t.co/sunMQyWUX1,TheDannyBlaze,2015-08-23 17:54:38+00:00
1132,635510367226085376,When old ladies come into your job &amp; vape on the bathroom &gt;&gt;&gt;,nicejewishgirlx,2015-08-23 17:54:13+00:00
1133,635510364323450881,Bro wanna go get vaped,emaaryy,2015-08-23 17:54:12+00:00
1134,635510320581050372,"U. Smoke &amp; Vape Did you know... ""The noble Meerschaum is unique among pipes. Its mysterious properties make it a... http://t.co/KSJCupu20Y",KCSmokeAndVape,2015-08-23 17:54:02+00:00
1135,635510260971741184,South shore plaza should be sponsored by 20 year old white men who rip vape pens,XmarkwilsonX,2015-08-23 17:53:48+00:00
1136,635510233264189441,Just a few of my setups #vape #vapor #vapeit #vapelife #vapelyfe #tootlyfe #vapefam #vapecommunity… https://t.co/3Dn4pEE1us,c_kovs,2015-08-23 17:53:41+00:00
1137,635510172748804097,A few jars to celebrate moving office. Our e-liquid now has a lovely new home! #vapeshoreditch #vaping #vape #eliquid http://t.co/dkZQ4y0vLh,vapeshoreditch,2015-08-23 17:53:27+00:00
1138,635510068251901952,Some Cesar's Palace clouds 😤💨💨and yes... They allow smoking / Vaping in this area. I was next to an… https://t.co/emZazPU3B5,GrimmGreen,2015-08-23 17:53:02+00:00
1139,635509905621917696,Have a great Sunday #VapeCommUNITY don't forget to visit us today and get your vape gears up to date… https://t.co/6BVGY8B36f,hiddenvapeWH,2015-08-23 17:52:23+00:00
1140,635509756455612416,"CON: you can't see the #Boise Foothills from the River.

PRO: I've always wondered what it was like to vape, any flavor, even 'Forest Fire'.",ThomasPaul117,2015-08-23 17:51:47+00:00
1141,635509312924856320,"Just saw a minivan with 3 grown men in it sharing one of them ""vape"" cigarette things. I wanted them I crash sooooo bad.",TRobertsonM,2015-08-23 17:50:02+00:00
1142,635509272474947584,"anyone want to go make out and  in my timeshare in gary, indiana?
maybe u do,  https://t.co/oMDzguV9BK #vape #ecig",ecigitesztek,2015-08-23 17:49:52+00:00
1143,635509271216656384,In a cloud.    https://t.co/w168tTHAjc #vape #ecig,ecigitesztek,2015-08-23 17:49:52+00:00
1144,635509269085986816,"Don't risk buying clones, get an authentic Triton tank from Aspire UK with free delivery    https://t.co/QM6b8XVVcu #vape #ecig",ecigitesztek,2015-08-23 17:49:51+00:00
1145,635509267861270528,"SEVEN-THOUSAND TWO-HUNDRED THIRTY-EIGHT
Participants from
SEVENTY-TWO COUNTRIES.

 https://t.co/23sQCAZlLv #vape #ecig",ecigitesztek,2015-08-23 17:49:51+00:00
1146,635509228505923585,Way too many people vaping at Taylor's show. #1989TourLA http://t.co/kHXo7I1szE,bradmilison,2015-08-23 17:49:41+00:00
1147,635509175787765760,Titanium wire feedback please http://t.co/a89eRWKdE8 #ecig #vape #TVS,ukvaper,2015-08-23 17:49:29+00:00
1148,635508982782783488,Vaping Is 95% Healthier and 40% Cheaper Than Smoking http://t.co/EyD9opBUCK,V91Gaming,2015-08-23 17:48:43+00:00
1149,635508280941412352,"""i wish i vaped i'd get so much pussy"" i'm crying",zoeheiler,2015-08-23 17:45:56+00:00
1150,635508235294900225,#RT SENSE Herakles Sub-Ohm Tank back in stock &gt; http://t.co/GJalsG6u0E &lt; #vape #vapeporn #eciguk #vapelyfe #eciguk http://t.co/Jtq6Xfnbx1,GreyHazeEcigs,2015-08-23 17:45:45+00:00
1151,635508066620981248,"You are ready for #Success
I can help.
Dm 4 private consult 
Grow your #Vape business or
#Book Promotion http://t.co/VOCXsz2XoL",RealDonnaDeVane,2015-08-23 17:45:04+00:00
1152,635508050665807872,"Dreadful habit, wonderful picture! RT @danbarker Vapers. http://t.co/XEkdRWEmCi",MJCarty,2015-08-23 17:45:01+00:00
1153,635508041882976258,Tower of Vape's Perspectives is out! http://t.co/qSmIMfbaHW Stories via @Spinfuel_Julia @vaporjoes @rogergmichael,TowerOfVape,2015-08-23 17:44:59+00:00
1154,635507898379071488,"Vape e-Juices to SLAY you!   EXTREME ICE,     RED BULL type,    Peach Mango.... New SITE LINK coming SOON.  #VapeEJuices #MyVapeBiz",VapeCrack,2015-08-23 17:44:24+00:00
1155,635507857425743874,Ecigarette Outlet http://t.co/gCVqSsjDSQ #ecig #vape #POTV,ukvaper,2015-08-23 17:44:15+00:00
1156,635507855831908352,The new Kennedy 24 RDA http://t.co/BBxqds5s81 #ecig #vape #POTV,ukvaper,2015-08-23 17:44:14+00:00
1157,635507706254589956,Win a Whiteout Evolv DNA200 Box Mod! #vaporjoes #vapingunderground #vaping http://t.co/9PiAh75g2f,hpbotha,2015-08-23 17:43:38+00:00
1158,635507636440449025,Even the police need to hit the vape #cloudz http://t.co/SdMPD6A4ju,JonahEtheredge,2015-08-23 17:43:22+00:00
1159,635507403572678656,Vape on,luckyme1250,2015-08-23 17:42:26+00:00
1160,635507383427563520,"""Weed vaping is the future!"" -@rainesebastian argues.",xosamcore,2015-08-23 17:42:22+00:00
1161,635507364146380800,just got that taco flavored vape,tatmeupLV,2015-08-23 17:42:17+00:00
1162,635507146579316736,Have u heard of #eCigs? Try #V2Cigs #V2Pro #coupon SOFLA10 #ecigarettes #VAPOR #SMOKE #eCigs #eLiquids #Vaping http://t.co/Io8yx3OKv7,fariadoland,2015-08-23 17:41:25+00:00
1163,635507110059634688,The vaping life is real!!! #vapemalitia #vapefam #vapefamily #ohm #mods. #boxmod #ejuice #ecig… https://t.co/qbRRv7UkIg,corpse_inc,2015-08-23 17:41:16+00:00
1164,635507094494531585,"""Vaping is the future."" -@rainesebastian",xosamcore,2015-08-23 17:41:13+00:00
1165,635507065272700928,"San Jose State tobacco, vaping ban takes effect: Effective Aug. 1, all tobacco products and e-cigarettes were… http://t.co/xigC3IhQ7P",eastcoconews,2015-08-23 17:41:06+00:00
1166,635506951187595264,Vaping is not harmful like smoking and it definitely is not a tobacco product!!! https://t.co/ntNmm6MljN,markcaulder,2015-08-23 17:40:38+00:00
1167,635506898733801472,The awesome vaporshark edition Hex Ohm v2.1 &amp; twisted messes rda ☺ #vape #vapeporn #vapelyfe… https://t.co/71SJVaeN9Y,pauly_meatballs,2015-08-23 17:40:26+00:00
1168,635506812570181632,I change my mind this place is terrible there are people vaping at 10:30 in the morning on the way to work?!?!,HangingRabbit,2015-08-23 17:40:05+00:00
1169,635506436131295232,"The After Math: A robot fights for funding, vaping's vote of confidence: 

Welcome to the After Math. This... http://t.co/tpIUPS8D4H",apple24h1,2015-08-23 17:38:36+00:00
1170,635506392720375808,Passed 2 vape shops and @marysaile admitted she's tried it. Deciding if I should run or not.,Niminity,2015-08-23 17:38:25+00:00
1171,635506090071863296,"anyone want to go make out and #vape in my timeshare in gary, indiana?
maybe u do, @robdelaney",Snifit,2015-08-23 17:37:13+00:00
1172,635506010996604928,"The After Math: A robot fights for funding, vaping's vote of confidence http://t.co/9mQatO5OWr #ittwt",papayatop,2015-08-23 17:36:54+00:00
1173,635505872781897728,My Vaping Reviews Vapor Paper is out! http://t.co/ZIpnMT2Ah8 Stories via @VapeCig @banggood @manuvape06,MyVaping,2015-08-23 17:36:21+00:00
1174,635505854792474624,regrann from vapewize  -  With the location #vape #vapemeet #cloudcomp #303 #raffle #boostedejuice… https://t.co/T05F79HBNr,CloudCompMaps,2015-08-23 17:36:17+00:00
1175,635505808885841920,In a cloud.    https://t.co/EVAINUgjqd #vape #ecig,ecigitesztek,2015-08-23 17:36:06+00:00
1176,635505576865218560,"The After Math: A robot fights for funding, vaping's vote of confidence:  http://t.co/U12JPtCGxr http://t.co/rW4dZ57KzJ",suitreport,2015-08-23 17:35:11+00:00
1177,635505564445863936,"The After Math: A robot fights for funding, vaping's vote of confidence:  http://t.co/W9o3C6WXMf",22FOURCOM,2015-08-23 17:35:08+00:00
1178,635505529595498496,#IncomingFreshmanAdvice your vapes aren't allowed in class,theadamalesch,2015-08-23 17:35:00+00:00
1179,635505497517465601,Good morning! #tripletreatsf #baked #mrholms #sfbay #vape #mmj #legalizeit #flavor #highsociety @ Mr.… https://t.co/cNgtDZBpO0,tripletreatsf,2015-08-23 17:34:52+00:00
1180,635505310917001216,Ingat cool la isap vape? Nor girlfriend neither wife material.  https://t.co/UHYMCShGH9,amirul__anuar,2015-08-23 17:34:07+00:00
1181,635505094495236096,"My boi vaping heavy on stage last night, love you son. @yvngmarino http://t.co/ChpzxnWG05",shotbyguap,2015-08-23 17:33:16+00:00
1182,635505033962872832,I'm vaping so hard rn,BanzaiTakesAnal,2015-08-23 17:33:01+00:00
1183,635504966510243840,My vape pen with this oil is life,Segaa_gen,2015-08-23 17:32:45+00:00
1184,635504946943815680,I don't care who you are vape pens are stupid,JJVANCE3,2015-08-23 17:32:41+00:00
1185,635504817419456512,Vapers. http://t.co/Y75x5WHLBL,danbarker,2015-08-23 17:32:10+00:00
1186,635504609885208576,"We get it, you vape. @what_the_heck__ http://t.co/xIxeO1wPS1",potentyan,2015-08-23 17:31:20+00:00
1187,635504587382894592,The debate about cigs vs vape vandalized in my work washroom stall is far more interesting than any political Facebook debate I've read,tprimex,2015-08-23 17:31:15+00:00
1188,635504426053148672,"The After Math: A robot fights for funding, vaping's vote of confidence http://t.co/oIG7w6G8mJ",MediaRings,2015-08-23 17:30:36+00:00
1189,635504371095113728,rokerz56 just went LIVE at [ http://t.co/L1VLN82OI0 ] on @Vapersdottv - #AutoTweet #Live #Video #Vaping #Vapers #ecig #Vapor,LiveOnVapers,2015-08-23 17:30:23+00:00
1190,635504354863280128,Vaping guys! #indonesiavape  #mdnvapor #jktvape  #vaporizer #starvape #jokervape https://t.co/tbldEJF7Nq,Skate_Prayudha,2015-08-23 17:30:19+00:00
1191,635504323925901312,50hmVaperZ just went LIVE at [ http://t.co/OCjqnx7v6t ] on @Vapersdottv - #AutoTweet #Live #Video #Vaping #Vapers #ecig #Vapor,LiveOnVapers,2015-08-23 17:30:12+00:00
1192,635504280577835009,"Stranger:""Do you even lift bro?""
Tyler:""Do you even Vape Broski?""

@TMNTyler",NotTodayCharlie,2015-08-23 17:30:02+00:00
1193,635504250508832768,"The After Math: A robot fights for funding, vaping's vote of confidence:  http://t.co/zoh1TtmqFM",TN4SNews,2015-08-23 17:29:55+00:00
1194,635504199753576448,Vape me out,Zeronni_,2015-08-23 17:29:42+00:00
1195,635504172817711104,Win a Whiteout Evolv DNA200 Box Mod! #vaporjoes #vapingunderground #vaping http://t.co/SPhuhnaED1,SlidingIntoHome,2015-08-23 17:29:36+00:00
1196,635504143373733888,When you are at the bus station &amp; people are asking how much would í charge a hit off of my vape pen,XXXholographic,2015-08-23 17:29:29+00:00
1197,635504128387608576,I was having a bad day until I remembered vapes were invented.,GeorgeTheDog_,2015-08-23 17:29:25+00:00
1198,635504038973313024,"Vaping'sg rowing market: Vaping, or inhaling and exhaling the vapor produced by an electronic cigarette or similar… http://t.co/ipyUjhUjaX",manchesternhnow,2015-08-23 17:29:04+00:00
1199,635503953833123840,"There is a free charter bus that is taking vapers up to Sacramento on Tuesday, August 25th in the morning. http://t.co/WzlHO8kOle",VAPELYFE,2015-08-23 17:28:44+00:00
1200,635503934887620608,"Repost @unitedvapersorg with repostapp.
・・・
🚨 Southern California Vapers! 🚨 There is a free charter… https://t.co/wb0dPkIeJD",KhaliVapors,2015-08-23 17:28:39+00:00
1201,635503882349613058,I don't need anybody except me and my vape 💯,astraiscool,2015-08-23 17:28:27+00:00
1202,635503854885310464,"Im drunk... yup, don't ask, but I need this keyboard, This Chambord and this Vape Imma keep playing till I can't!!!!",Hicxbi,2015-08-23 17:28:20+00:00
1203,635503813756080128,people get a vape and don't know how to act,bittertoejam,2015-08-23 17:28:10+00:00
1204,635503692343459840,In a cloud. #vape #jk #inaplane,apricot_lacroix,2015-08-23 17:27:41+00:00
