,TweetID,TweetContent,TweeterUsername,TweetDatetime
1013,631900998852702210,Anti-Vaping Myth of Big Tobacco: A Convenient Myth: The True Story of Big Tobacco &amp; E-Cigar... http://t.co/tDzM8Yykj5 #Vape #ecigarettes,TxVapingAssn,2015-08-13 18:51:52+00:00
1014,631900840270393346,just waiting on planet of the vapes to come out in theaters,bwd_62,2015-08-13 18:51:15+00:00
1015,631900830845792257,Very impressed. #vape @zamplebox you did good with this one :) https://t.co/5M4Bhtrxqj,7heVandal,2015-08-13 18:51:12+00:00
1016,631900322567487488,"We are lucky to carry 2 of Oregon's finest vape cartridges, The CO2 Company &amp; True North Extracts. All day Thursday get 20% off vape carts.",pdxbestbuds,2015-08-13 18:49:11+00:00
1017,631900270184763392,Come visit us the #ECC Expo at Hall4 Booth 210 and check out the #BambinoEvape  http://t.co/O8BsXkNBEZ #vape #eliquid http://t.co/DFNRVRhJsh,BambinoEvape,2015-08-13 18:48:59+00:00
1018,631900094397157376,"we get it, you can vape with your left hand  #lefthandersday",emiliooooooo,2015-08-13 18:48:17+00:00
1019,631899488802746368,#9: Japanese 100% Organic Cotton No Adhesives the Best in Stock Vape Atty 25 Pads http://t.co/Ip9AXQzwzz,007mikesantos,2015-08-13 18:45:52+00:00
1020,631899398860054528,"RT CigElectric: Promote e-cigarettes over harmful tobacco smoking, say experts http://t.co/RHGbr0CCgV; #ecigs #vape",vapemerch,2015-08-13 18:45:31+00:00
1021,631899396716789760,RT coilmasternet: Coil Master exhibiting now at #ecc !!! #vape #vaper #vapor #vapeon #vaping #vapefam #vapeexpo #e… http://t.co/7tRo8uJ9VL,vapemerch,2015-08-13 18:45:30+00:00
1022,631899293096382464,Rebuilding on Coil Master 521 at #ECC ! #vape #vaping #vapor #coilmaster #eccexpo #ecc2015 #coilmaster521 http://t.co/yhNNXwSXov,coilmasternet,2015-08-13 18:45:06+00:00
1023,631899150007836672,maggie just took a hit of a vape and then blew smoke rings actually ban this,postcpnjazzcore,2015-08-13 18:44:32+00:00
1024,631899145935134720,"NASCHartInc: RT AvirVape: |LIVE NOW| let's talk Vaping! Q&amp;A  #meerkat http://t.co/Vc3mWZTXcA August 13, 2015 at 12:39PM",MeerkatsNow,2015-08-13 18:44:31+00:00
1025,631899144286810113,"AvirVape: |LIVE NOW| let's talk Vaping! Q&amp;A  #meerkat http://t.co/Vc3mWZTXcA August 13, 2015 at 12:38PM",MeerkatsNow,2015-08-13 18:44:30+00:00
1026,631899135709454336,[HHO] Enjoying Hemp Oil Vaping - http://t.co/UuOsYtIdBh,HealthyHempOil,2015-08-13 18:44:28+00:00
1027,631898917177835521,The benefits of vaporizing #medicalcannabis http://t.co/rFxU7XSxzg #VapeOn #VapeCommunity #vape #vapefam #ShouldBeLegal,indicavapor,2015-08-13 18:43:36+00:00
1028,631898881337364480,"me: why do you vape? 
him: the same reason you smoke. 
everything makes sense now",exxtraordinar,2015-08-13 18:43:28+00:00
1029,631898863553630209,PUTTIN IN WORK!!!  That relax off time!  SHINY VAPES AND BIKES  #vapelifn #lifebehindbars http://t.co/hh3WUZ6aVM,FogHouseVapes,2015-08-13 18:43:23+00:00
1030,631898856184266753,PUTTIN IN WORK!!!  That relax off time!  SHINY VAPES AND BIKES  #vapelifn #lifebehindbars https://t.co/Kn3vchn6XE,FogHouseVapes,2015-08-13 18:43:22+00:00
1031,631898657307004928,Win a Joyetech EVIC VT Kit from @cigbuyer and @huffandpuffers: http://t.co/n59E97LNVK #ecigs #vaping #evicvt #vapecontest #vapegiveaway,MetalHead_589,2015-08-13 18:42:34+00:00
1032,631898458257928192,Pitbull parties in all the best cities in the world. Doesn’t even bring a vape. #smh,JadedVape,2015-08-13 18:41:47+00:00
1033,631898276510441472,Will The American Cancer Society Accept Vaping? http://t.co/dOSvuQ2Kyf #quitsmoking #news #health #ecignews #ecigs http://t.co/A5qbO9rnyn,mattlogical,2015-08-13 18:41:03+00:00
1034,631898276128813056,Dad has started vaping and has given Neal a vape pen so he doesn't have to smoke in the rain,c_boydfelton,2015-08-13 18:41:03+00:00
1035,631898265877901312,I liked a @YouTube video from @jpelirrojo http://t.co/k50HlFFov4 QUIETO NIVEL EXPERTO | VAPE 1105,IhsanLacasitos,2015-08-13 18:41:01+00:00
1036,631898234403745792,Win a SX Mini M Class mod from http://t.co/0jgfS7qLDd - http://t.co/87mosRiPVo #ecig #Vape,jsummers71,2015-08-13 18:40:53+00:00
1037,631898124194316290,RT vaporjoes:Vapor Joes - Daily Vaping Deals: CLEARANCE SALE - RBA'S AND MODS AS LOW AS $4.99 - ... http://t.co/E0OVaAb9vd #vaporjoes #Va…,VUClassifieds,2015-08-13 18:40:27+00:00
1038,631898112403992577,"California ""special session"" bills threaten consumer access, choice, and use of smoke-free vapo... http://t.co/QSVxAVXms9 #ecigs #vaping",VapinXsmoker,2015-08-13 18:40:24+00:00
1039,631898032808833024,"Kamry K100 Mechanical MOD

You will definitely stand out from the crowd of vapes currently on the market with... http://t.co/4JQEshbvun",Vaporintelligen,2015-08-13 18:40:05+00:00
1040,631898013552799744,4 more juices at 99% and ready for testing by the #sirvapejuicetesters #awesomness #steammasterssa… https://t.co/TflxJ3MD45,sir_vape,2015-08-13 18:40:01+00:00
1041,631897991410941952,"""If she don't vape we can't date""
-Me (an avid vaper)",isaac_gibson1,2015-08-13 18:39:55+00:00
1042,631897892383539200,Bart is smoking a vape http://t.co/lBLm9L3HxQ,postcpnjazzcore,2015-08-13 18:39:32+00:00
1043,631897861064630272,"True passion is intoxicating and invigorating, we thought we'd share it with you.http://t.co/pwROe2Vdhj #VapeOn #vape http://t.co/6k6A3sa1Sg",vapegard,2015-08-13 18:39:24+00:00
1044,631897722660896773,Let positive vape turn on.,Muhamad_Izz,2015-08-13 18:38:51+00:00
1045,631897674535469056,My vape broke,TempoBot,2015-08-13 18:38:40+00:00
1046,631897536475717632,Let positive vape remains stay.,Muhamad_Izz,2015-08-13 18:38:07+00:00
1047,631897531128127490,All these people vape at work and it sounds like Vader is breathing behind me,WilliamMck3nzie,2015-08-13 18:38:06+00:00
1048,631897480813154304,"smoking is dead, vaping is the future and the future is now ~",aziq176_,2015-08-13 18:37:54+00:00
1049,631897385493356544,Win a SX Mini M Class mod from http://t.co/JeUaPzevL4 - http://t.co/MGRRGrAgg7 #ecig #Vape,jbrandon1974,2015-08-13 18:37:31+00:00
1050,631897246800343040,Everyone I work with are all vape heads,emilayin08,2015-08-13 18:36:58+00:00
1051,631897229649952768,Not sure if my vape is helping me quit smoking or increasing my nicotine addiction. Oh well! VAPE ON,nicholasr0bert,2015-08-13 18:36:54+00:00
1052,631897211907915776,A nice collection of 18650 batteries. Do you know what the yellow one is? #vape #vapelife #vaping http://t.co/ttw1WsK61R,battery_bro,2015-08-13 18:36:50+00:00
1053,631897144132268033,For those who wants to start to convert from smoking to vaping. Starter kit by Vision Spinner and… https://t.co/yoBBg9QyMg,theshowroomvape,2015-08-13 18:36:33+00:00
1054,631897106500964352,Coil Master exhibiting now at  !!!           https://t.co/aeoGHhXY9M #vape #ecig,ecigitesztek,2015-08-13 18:36:24+00:00
1055,631897065031790592,"We are Houston! #Downtownaquariumhouston 
#downtownaquarium #Houston #Texas #Spyglass #vape #vaping http://t.co/06edcMEUwW",SpyglassVapor,2015-08-13 18:36:15+00:00
1056,631897058136473600,I found a new use for my grandfather's hand ashtray... #vaping #vapelife #vapelyfe #boxmod… https://t.co/BMjg9Zk0Gb,Chinoy76,2015-08-13 18:36:13+00:00
1057,631896911918706688,Lol @ this old guy mugging me for vaping rn,KerryNeverReady,2015-08-13 18:35:38+00:00
1058,631896781622669312,Battery Safety Booklets. Retailers Get 50 free! http://t.co/SMSCGeXbAG … #vape #vapelife #vaping #ecigwholesale http://t.co/4tKQ1T9ugT,battery_bro,2015-08-13 18:35:07+00:00
1059,631896771443032064,Vaping is so stupid and it gave me a headache how do you even do tricks nobody would show me  https://t.co/r9m34OtSvt,demonzarrie,2015-08-13 18:35:05+00:00
1060,631896745195114496,When I grow up Imma be a pro vaper 😂😂😂😂😤☁️☁️💨💨💨,xLEXICONx,2015-08-13 18:34:58+00:00
1061,631896667265048576,Photo: Chilling with the fam up at @the_vaping_dragon yesterday! Trying out this @liquidstatevapors!... http://t.co/13L8NJCgB0,Naughty_Goku,2015-08-13 18:34:40+00:00
1062,631896663049773061,Chilling with the fam up at the_vaping_dragon yesterday! Trying out this liquidstatevapors!… https://t.co/6FUKNk3QfV,Naughty_Goku,2015-08-13 18:34:39+00:00
1063,631896626517315584,#ECC begins in less than half an hour. So excited. #vape #vapelife #vapeon #vapeporn,ECSupplyInc,2015-08-13 18:34:30+00:00
1064,631896619110297600,"Interesting look at Nicotine, and what it actually does in the body
#nicotine #ecig #vaping #science http://t.co/rsjcI1TVxt",OffbeatnUnique,2015-08-13 18:34:28+00:00
1065,631896579662827520,New #AbstractClouds e-liquid in from #TheVaporHut for cheaper than directly from the source!#vape… https://t.co/E2B3xiSwO8,SheShaLounge,2015-08-13 18:34:19+00:00
1066,631896542232883200,only thing ppl do on snapchat now is smoke their fucking vape. like wow omg ur so cool can I get one too so I can be like you:):):)?????????,ayannalfooo,2015-08-13 18:34:10+00:00
1067,631896520518864896,Experience your #extracts like never before! http://t.co/xhhLOrJ2zO #ejmix #vape http://t.co/4SZUWAiELV,thebloomsdays,2015-08-13 18:34:05+00:00
1068,631896391342792704,We're here in LA for ECC! #ECC #ecc2015 #flavrjuice #Flavrvapor #flavr #fruitloopdingus #vape #vapeon… https://t.co/9fpaCGBnvq,FlavrVapor,2015-08-13 18:33:34+00:00
1069,631896177693339649,Some new splatter dual 18650 mosfet boxes just came in.  #LibertyVapor #InhaleFreedom #vape http://t.co/KlRaC8OAsZ,Liberty_Vapor,2015-08-13 18:32:43+00:00
1070,631896166100258817,Head over to http://t.co/NgUAstOAjE to find out how to win the COOLFIRE IV from @QueenOfVapes #ecigs #vape #vapelife #vapeon!,VapingUK_app,2015-08-13 18:32:40+00:00
1071,631896100824293377,"Some of the best #vapegear for the best prices,visit our brand new site at http://t.co/5fcZl2W82L. #free vape bands with first 100 orders",smokijoes,2015-08-13 18:32:25+00:00
1072,631896053361569792,White culture is so exotic and beautiful...😍 (Vine by vape wizard) https://t.co/Ig2JSIMaHI,jillianhansen,2015-08-13 18:32:13+00:00
1073,631895996079828992,Vape on... ZzzZzzZzz... http://t.co/ijkzJ1NmAV,wajablack,2015-08-13 18:32:00+00:00
1074,631895963557343232,RT vapegard: Who doesn't like to vape on one of the best e-juices out there? Order yours Today at … http://t.co/8sx8s3S8Qh,vapemerch,2015-08-13 18:31:52+00:00
1075,631895874893926400,"New vape..no more smoking. Plus, it tastes amazing!! 😊❤ https://t.co/Jkyc52l3CR",__MKayy__,2015-08-13 18:31:31+00:00
1076,631895834242752512,"Vape Party &amp; Cloud Chasing Competition Sabado 22 de Agosto en Rivera Red KR 14 No. 82-21 de 6pm-10:30pm 

DJ Set... http://t.co/uHZpTQqeCx",RiveraRedBogota,2015-08-13 18:31:21+00:00
1077,631895653854146560,"Fresh inventory of Carpe Diem has arrived! Including 30mls.....Ready, Set, Go! @ Cleveland Vape https://t.co/qUIAW85i3z",ClevelandVape,2015-08-13 18:30:38+00:00
1078,631895629824983041,https://t.co/vT5eaCHQto it vapes http://t.co/cs98QcHIW7,KINGSH3P,2015-08-13 18:30:32+00:00
1079,631895625416724480,Replacing (not quitting) smoking with Vaping http://t.co/zTGYa01WEb,MermaidGossip,2015-08-13 18:30:31+00:00
1080,631895609184677888,I feel like that level of vaping might change one's perspective on a lot of things,UAelevator,2015-08-13 18:30:27+00:00
1081,631895567115939840,"Hey, that smells amazing. It smells like Amethyst from Vape Gem, the sweet mix of berries with guava.... http://t.co/G6WtZL4whN",VapeGem,2015-08-13 18:30:17+00:00
1082,631895565584990208,Vapor Joes - Daily Vaping Deals: CLEARANCE SALE - RBA'S AND MODS AS LOW AS $4.99 - ... http://t.co/s6uCeaBXCH,vaporjoes,2015-08-13 18:30:17+00:00
1083,631895541715107840,Coil Master exhibiting now at #ecc !!! #vape #vaper #vapor #vapeon #vaping #vapefam #vapeexpo #eccexpo #ecc2015 http://t.co/UpxVqjcTW7,coilmasternet,2015-08-13 18:30:11+00:00
1084,631895537629859840,this vape mengevape starts to annoy me.. it's suffocating..,ninazari_,2015-08-13 18:30:10+00:00
1085,631895516847083520,Relax and look forward to the evening ahead with us here at http://t.co/NYqCTjtuUB for all your e-cigarette products at great prices #vape,vapertech_co,2015-08-13 18:30:05+00:00
1086,631895502100021248,vape melody,vapeeverything,2015-08-13 18:30:02+00:00
1087,631895441534136320,What kind of vape tricks he does  https://t.co/jWUglQS75v,binzisa,2015-08-13 18:29:47+00:00
1088,631895319731695617,My vape is a soul survivor,quentinfetzer_,2015-08-13 18:29:18+00:00
1089,631895284822347776,Our condo has been smoke free for 3 weeks.  I've been trying to transition into only using the electronic vape... http://t.co/5IL3kWaSsi,99_BOBOTW,2015-08-13 18:29:10+00:00
1090,631895064575348736,Flossing in public is the new vaping,BlazeMancillas,2015-08-13 18:28:18+00:00
1091,631894830566797313,"If you live in the UK why haven't you signed this petition yet, it takes 2 minutes! https://t.co/8kwl6Pn0pV #LegalizeMarijuana #LegalizeUK",Lets_Vape,2015-08-13 18:27:22+00:00
1092,631894768591728640,Yes @timebombshop has all Your #oil &amp; #wax #vape needs .. In Now the #cherrypie @vapedvaporizers GR2… https://t.co/uy8kfPjbIM,timebombshop,2015-08-13 18:27:07+00:00
1093,631894748895313920,BBC News - Call for pub garden smoking ban http://t.co/4dlPYkrlcJ,jc_vape,2015-08-13 18:27:02+00:00
1094,631894695036198912,Cloud 9 #cloud #vape #vapeon #vapormalaysian #kepulkepul #fun #brothers #kauhado #igers #uk #avenged… https://t.co/nmcz3Kh984,Thehulkey,2015-08-13 18:26:49+00:00
1095,631894649402101760,"Yaa know, seeing a lot of people using vape an shit makes me feel. I don't know, sad",GGTwinsAsh,2015-08-13 18:26:39+00:00
1096,631894611821219840,I liked a @YouTube video from @jpelirrojo http://t.co/Rssh4oFcYf A HARLEM NO LE GUSTA PATINAR | VAPE 1104,IhsanLacasitos,2015-08-13 18:26:30+00:00
1097,631894387891552256,"Vape free where ever you may be!
#vapersunite #chillin #celebvaping 
http://t.co/UVjUXcb9Nl http://t.co/Qq9s4K0jCn",TwistVapor,2015-08-13 18:25:36+00:00
1098,631894286863331328,Are you a fan of Pantheon E-Liquids? We have 15ML bottle's on sale! Get 2 for $20 at #HappyHabits. #Vape #Newburgh http://t.co/BzZfPoaqij,ShopHappyHabits,2015-08-13 18:25:12+00:00
1099,631894277698777089,Are you a fan of Pantheon E-Liquids? We have 15ML bottle's on sale! Get 2 for $20 at #HappyHabits. #Vape #Newburgh http://t.co/XseLTP81nu,ShopHappyHabits,2015-08-13 18:25:10+00:00
1100,631894246002311169,"i hate people who vape, 
my boyfriend vape, 
thus,  i hate my boyfriend..",ninazari_,2015-08-13 18:25:02+00:00
1101,631894208824115200,"You're sitting there hitting your vape, but next thing you know you're hitting your girlfriend.

Still think it's cool?
#StopVapeAddiction",DustyDylann,2015-08-13 18:24:54+00:00
1102,631894184341860352,i can't help but laugh everytime i see someone vape,kissesforjc,2015-08-13 18:24:48+00:00
1103,631893881802457089,#Vaporization: The Science of Harm Reduction.  http://t.co/YCe1kvLlKO  Understand why #vaping is better than #smoking http://t.co/H4oR31fWkR,RobbinsGroupLLC,2015-08-13 18:23:36+00:00
1104,631893743373709312,"""Luke, I am your great alternative to cigarettes""

-Darth Vaper",PizzaFingaz,2015-08-13 18:23:03+00:00
1105,631893564218216448,This one time me &amp; Eric vaped so hard I passed out &amp; found out I got sexually assaulted I'm way to afraid to admit I probably got pregnant,Caliboi_Smiley,2015-08-13 18:22:20+00:00
1106,631893522489151488,"Do you even vape, bro?",shananaginzzzz,2015-08-13 18:22:10+00:00
1107,631893509759352832,"JUICE OF THE DAY!! Cali Steam Cali girls a delicious hard candy, juicy, watermelon flavor! 🍉#vape #palmsprings http://t.co/LP5Plt0X4n",EVaporEmporium,2015-08-13 18:22:07+00:00
1108,631893484186824704,"How I spend my day: sitting on my bathroom floor vaping, reading shit on Facebook and harassing my exs. Club going up.",EddieJP2,2015-08-13 18:22:01+00:00
1109,631893403396014082,We get it...you vape http://t.co/ggDsBnaJLu,memexgod,2015-08-13 18:21:42+00:00
1110,631893323926650880,"Always wanted to try vaping, but didn't know enough about it? Check out our FAQ page! http://t.co/YhnbUsLYJS #vaping #thevaporpro",thevaporpro,2015-08-13 18:21:23+00:00
1111,631893305127739393,Make sure to use the code VAPE10 for 10% off your purchase in August!    https://t.co/vHFkjKMnWm #vape #ecig,ecigitesztek,2015-08-13 18:21:18+00:00
1112,631893303018057728,Where can I get a decent vape tank or subtank and some decent juice but not crazy prices     https://t.co/uZXnyGaG6M #vape #ecig,ecigitesztek,2015-08-13 18:21:18+00:00
1113,631893298861449216,"Aventurine Heart Feather Good Luck  Charm
by  Granny 
  https://t.co/5eVV90fnrg #vape #ecig",ecigitesztek,2015-08-13 18:21:17+00:00
1114,631893296449757184,Blow vape juice now in stock at mountain vapors! Tastes like strawberry cherry blow pops! …    https://t.co/Wg0kmJWidD #vape #ecig,ecigitesztek,2015-08-13 18:21:16+00:00
1115,631893174777155585,Vape Pens Give Weed Smokers Subtle Cover http://t.co/PuBPLe0t8m,vapelifemag,2015-08-13 18:20:47+00:00
1116,631893055830818816,Make sure to use the code VAPE10 for 10% off your purchase in August! http://t.co/5ZVMu2l4CZ #vape #thevaporpro,thevaporpro,2015-08-13 18:20:19+00:00
1117,631892980794716160,"Vape like a boss- Sincerely, Midwest Vapors. #vapelife #vapor #vapeon #vapefam #vapecommunity #Columbus http://t.co/ruHDuQe1Q4",MidwestVapors,2015-08-13 18:20:01+00:00
1118,631892854445637633,Replacing (not quitting) smoking with Vaping https://t.co/u692IstpwX on @bloglovin,MermaidGossip,2015-08-13 18:19:31+00:00
1119,631892854021955584,My brothers instagram is basically videos of him doing vape tricks,g4yshell,2015-08-13 18:19:31+00:00
1120,631892803790983168,How the cigarette kings bought the #vaping industry http://t.co/8Mqupv7LJy http://t.co/ejnTYg5L2P,VapingInsights,2015-08-13 18:19:19+00:00
1121,631892500584792064,#teebo likes to chase me down for my #vape #smoking #quitsmoking https://t.co/ITAp3k3qkt,BrandLAB_INK,2015-08-13 18:18:06+00:00
1122,631892388785573888,"anyway dont do alcohol kids, vape only, goodnight",lunarcompulsion,2015-08-13 18:17:40+00:00
1123,631892349858156546,"""Vape smoke so thick I can't even see the haters 💨💨💨💨"" ~Christian Mahoney",bigpapaspence,2015-08-13 18:17:30+00:00
1124,631892226105192448,Me except the weed would be Pokemon games and the swishers a vape pen  https://t.co/G7dqNqDkW1,BirdyMRQZ,2015-08-13 18:17:01+00:00
1125,631892199869804544,Have u heard of #eCigs? Try #V2Cigs #V2Pro #coupon SOFLA10 #ecigarettes #VAPOR #SMOKE #eCigs #eLiquids #Vaping http://t.co/wpWrfWJmy2,MohammedErtyui4,2015-08-13 18:16:55+00:00
1126,631891792414183424,Fuhhh here and there all with vape lama2 rokok da tak laku pat kedai hahaaa,harryjane_,2015-08-13 18:15:17+00:00
1127,631891740249579520,"Aventurine Heart Feather Good Luck #Vape Charm
by #Vaping Granny 
http://t.co/KqD92II1wf http://t.co/3Oj7a5regg",RealDonnaDeVane,2015-08-13 18:15:05+00:00
1128,631891703847354368,Everyone is vaping now it's so annoying,__ashash,2015-08-13 18:14:56+00:00
1129,631891682980724737,"When you're sitting at Starbucks and you put your vape down to put your Mac into your North Face bag,but your disc golf discs are in the way",dylangrantclark,2015-08-13 18:14:51+00:00
1130,631891635513729024,Blow your vape in my face one more time and you won't have anything to vape from anymore because I'll break it. #TryMe,TNBoyGent,2015-08-13 18:14:40+00:00
1131,631891369510969344,White culture is so exotic and beautiful...😍 (Vine by vape wizard) https://t.co/JjEZZs3u4I,diannavasquez_,2015-08-13 18:13:37+00:00
1132,631891268222746624,A tornado flew around my room.. 😎💭 #mantapsekali #smoketornado #biase2je #santaiaja #vape… https://t.co/dHte4tvbN6,absbthr,2015-08-13 18:13:12+00:00
1133,631890971630788608,"Girls shouldn't be socially aloud to post snapchat stories of them hitting a Vape, it's simply unacceptable",maxandgeorge69,2015-08-13 18:12:02+00:00
1134,631890933596880896,I swear every time in see someone standing in the corner at a party blowing smoke rings with their vape pen I wanna slap the vape outta them,TheOGKooLAiD,2015-08-13 18:11:53+00:00
1135,631890918233276416,Might start vaping just for fun,PLaZaMaN_ANT,2015-08-13 18:11:49+00:00
1136,631890911945818112,Look at her so vaped out her mind she's doesn't even know she's being made fun of get help!!!  https://t.co/qJrQwZC6pi,Caliboi_Smiley,2015-08-13 18:11:48+00:00
1137,631890785840013312,ECC here we come! #SuicideBunny #KingsCrown #CloudCompany #ECC #vape #eliquid #vapelife #c… http://t.co/wzC9n0Fq6g http://t.co/gSE9zEYXpU,suicidebunny_,2015-08-13 18:11:17+00:00
1138,631890641832689664,Vaping isn't cool,SosaChamberIain,2015-08-13 18:10:43+00:00
1139,631890594655289344,Vape life or die,ndress6661,2015-08-13 18:10:32+00:00
1140,631890245978583040,Of course my ex had to buy a vape like me. Then post 27 pictures with it 😂 wannabe,keilibrooke,2015-08-13 18:09:09+00:00
1141,631890152990703616,"""It's like I vaped her soul and it was flavored like Unicorn Blood""",Donttipme,2015-08-13 18:08:47+00:00
1142,631889924871036928,Is the Royal Institute for Public Health supporting the vaping industry? http://t.co/GPatATSKFX #ecigs #vaping,OKCigs,2015-08-13 18:07:52+00:00
1143,631889699246841856,Who doesn't like to vape on one of the best e-juices out there? Order yours Today at    https://t.co/Rl3dpksEJw #vape #ecig,ecigitesztek,2015-08-13 18:06:58+00:00
1144,631889695870480384,"California ""special session"" bills threaten consumer access, choice, and use of smok...     https://t.co/Z9BXeAT3I6 #vape #ecig",ecigitesztek,2015-08-13 18:06:58+00:00
1145,631889532913381376,"One of my favorite pieces that adorns the walls of my Vape Shop, @Cloud9VaporMI @HackinTimSeeley http://t.co/DCqwSEv3qQ",BigFatPeter23,2015-08-13 18:06:19+00:00
1146,631889504224313345,Who doesn't like to vape on one of the best e-juices out there? Order yours Today at http://t.co/fkhmVsIFB5 #vape http://t.co/pBbaAywdYS,vapegard,2015-08-13 18:06:12+00:00
1147,631889467536633856,When you run out of Vape.,mackasutra,2015-08-13 18:06:03+00:00
1148,631889459819225088,this kid literally has a 300 second my story of just him vaping like wow I wish I was u :/,tinker_belllaa,2015-08-13 18:06:01+00:00
1149,631889414675898368,Tropical Sunset - eLiquid http://t.co/UKtrxoShwq #vape #TropicalSunset http://t.co/uarlYyOqIM,4_Fox_Sakes,2015-08-13 18:05:51+00:00
1150,631889242919206912,Cigarettes are for the birds. http://t.co/lfhPP6E5Lg,Studio_Vape,2015-08-13 18:05:10+00:00
1151,631889164406005760,Another killer piece on the wall of my Vape Shop @Cloud9VaporMI @68Zombie http://t.co/CFiUHuoLza,BigFatPeter23,2015-08-13 18:04:51+00:00
1152,631889011896782851,Sign up for our newsletter The weekend is upon us get your weekend sales in our Joose Mail: http://t.co/guW4iTzzuB  #vape #vapesale #eliquid,vapegard,2015-08-13 18:04:15+00:00
1153,631889005869568000,WE GET IT YOU VAPE 😐,LexxRojas22,2015-08-13 18:04:13+00:00
1154,631888827053948928,From a nonsmoker who started vaping via /r/Vaping101 http://t.co/q3hPitknkA,VapingEnFrance,2015-08-13 18:03:30+00:00
1155,631888718836703232,The Enigma Cloud Range unbeatable @EnigmaVapours http://t.co/Hsu6Sn743O,Jamesy_Vapes,2015-08-13 18:03:05+00:00
1156,631888660623966209,"Build from previous post all juiced up with that #mothersmilk and ready to go 🙌💨💨
#vape #ukvapers… https://t.co/14eqJgCIqf",christomjones,2015-08-13 18:02:51+00:00
1157,631888538498285568,"#CASAA California ""special session"" bills threaten consumer access, choice, and use of smok... http://t.co/9qoD74xMQp #news #vape #ecigs",nicoticket,2015-08-13 18:02:22+00:00
1158,631888536417927168,"#CASAA California ""special session"" bills threaten consumer access, choice, and use of smok... http://t.co/0fPkMFvvtk #news #vape #ecigs",eliquid_central,2015-08-13 18:02:21+00:00
1159,631888534249451521,"#CASAA California ""special session"" bills threaten consumer access, choice, and use of smok... http://t.co/qxRjVt1PbE #news #vape #ecigs",Vape_Strong,2015-08-13 18:02:21+00:00
1160,631888533142114304,"#CASAA California ""special session"" bills threaten consumer access, choice, and use of smok... http://t.co/rb8r61kFrT #news #vape #ecigs",Vape_Superstar,2015-08-13 18:02:20+00:00
1161,631888529971265537,"#CASAA California ""special session"" bills threaten consumer access, choice, and use of smok... http://t.co/ubkrqRUr8E #news #vape #ecigs",Just1MoreMod,2015-08-13 18:02:20+00:00
1162,631888527073017860,"#CASAA California ""special session"" bills threaten consumer access, choice, and use of smok... http://t.co/o33mFDxi2p #news #vape #ecigs",Addicted2Vaping,2015-08-13 18:02:19+00:00
1163,631888525357527040,"#CASAA California ""special session"" bills threaten consumer access, choice, and use of smok... http://t.co/JufIZPvtJl #news #vape #ecigs",ImpulsiveVaper,2015-08-13 18:02:19+00:00
1164,631888523440713728,"#CASAA California ""special session"" bills threaten consumer access, choice, and use of smok... http://t.co/djYJynyV5Z #news #vape #ecigs",Sub_Ohm_Clouds,2015-08-13 18:02:18+00:00
1165,631888519502282752,"#CASAA California ""special session"" bills threaten consumer access, choice, and use of smok... http://t.co/jRZ1oyCe13 #news #vape #ecigs",vaping_my_lunch,2015-08-13 18:02:17+00:00
1166,631888517551943680,"#CASAA California ""special session"" bills threaten consumer access, choice, and use of smok... http://t.co/6AzfWQKoL4 #news #vape #ecigs",KeepCalm_VapeOn,2015-08-13 18:02:17+00:00
1167,631888515689656320,"#CASAA California ""special session"" bills threaten consumer access, choice, and use of smok... http://t.co/iaEicOfoo7 #news #vape #ecigs",Kicking_Butts,2015-08-13 18:02:16+00:00
1168,631888513915424768,"#CASAA California ""special session"" bills threaten consumer access, choice, and use of smok... http://t.co/kCKt6Xhiyx #news #vape #ecigs",wake_up_healthy,2015-08-13 18:02:16+00:00
1169,631888474308771840,"Studies have shown using #ecigarettes to #quitsmoking can significantly improve abstinence from smoking at 1 month in. Don’t smoke, #vape!",vaporstoponline,2015-08-13 18:02:06+00:00
