,TweetID,TweetContent,TweeterUsername,TweetDatetime
1018,633351951032414209,"And here's the outside 

#yiannimize #rtuk #reviewthisuk #youtube #vaping #vape #cloudchaser… https://t.co/9bHtaKikyY",mikeyb6999,2015-08-17 18:57:26+00:00
1019,633351950914994176,"Today is gonna be so boring , specially since my vape broke",Chris_dmndd,2015-08-17 18:57:26+00:00
1020,633351901732556801,Celebrity endorsements fuel #vape branding as shops hit mainstream malls http://t.co/mEnL5wvV4T http://t.co/j0la7ir2cg,brandchannel,2015-08-17 18:57:15+00:00
1021,633351868928815104,"I can only tolerate @NickSancheZzz vaping, the rest of you are gay.",raybanzso,2015-08-17 18:57:07+00:00
1022,633351802214223872,Win a Whiteout Evolv DNA200 Box Mod! #vaporjoes #vapingunderground #vaping http://t.co/hgTrFdHO3j,Muropost,2015-08-17 18:56:51+00:00
1023,633351795050311680,"First Day of college: no dress code, people smokin vapes, people wearing pj's, cute boys, coffee shop,taco stand...I could get used to this😍",alli_yorga_,2015-08-17 18:56:49+00:00
1024,633351773890023424,Win a Whiteout Evolv DNA200 Box Mod! #vaporjoes #vapingunderground #vaping http://t.co/D0RmW792Hv,rainbrodash,2015-08-17 18:56:44+00:00
1025,633351693879615488,squonkers #Vape #Vaping #Vapegram #電子たばこ #ecig #電子タバコ #vapecommunity https://t.co/0Z6nQGRY3w,Promistvapor,2015-08-17 18:56:25+00:00
1026,633351527093174272,Trynna vape out Devans car,beewhole,2015-08-17 18:55:45+00:00
1027,633351486496460800,"Love this jaguar f-type 

#yiannimize #rtuk #reviewthisuk #vape #vaping #cloudchaser #flavourchaser… https://t.co/IEZsmW5TKz",mikeyb6999,2015-08-17 18:55:36+00:00
1028,633351433451106304,1 year ago today my parents found my vape lol,CowboySkiBop,2015-08-17 18:55:23+00:00
1029,633351394188103681,"""Ben. I hear you like to vape.""",ben_deeznutz,2015-08-17 18:55:14+00:00
1030,633351394100125696,"Vaping and kids don't mix!

#vapenews #e-cig #vape #vapingandkids http://t.co/j9JfJ5j3KN http://t.co/cBuarvLACP",RastaVapors,2015-08-17 18:55:14+00:00
1031,633351300256808960,"I stumbled across a world of weird when researching metalwork techniques. The vaping subculture, it's a thing http://t.co/No5WGvESPO",Camerashakes,2015-08-17 18:54:51+00:00
1032,633351096933720064,The iJust2 VS The Matrix... http://t.co/Bah8KakElM #trustedsolution #lunarroverusa #vape #vaping #vapelife #vapelyfe #eliquid #ecigs,LunarRoverUSA,2015-08-17 18:54:03+00:00
1033,633350664744267776,Is it @VapeNVille2015 yet? @DevoAHTD #HaloCigs #VapeNVille #Vape http://t.co/Vo6bcoaEeS,HaloCigs,2015-08-17 18:52:20+00:00
1034,633350637200105472,You know its too bad vaping has such a negative look in our generation because honestly that couldve saved alot of lives,_blackhat_music,2015-08-17 18:52:13+00:00
1035,633350592245669888,i go on instagram and someone's selling a vape pen.. lol wut,nicolecesa15,2015-08-17 18:52:02+00:00
1036,633350581260718081,Elevation Elixers &amp; 10/90 from @5280Vapor @OKCVapes http://t.co/KwSsiOhbI5  #vaping #VapeOn #vapelife #vape http://t.co/byVT3qT6aY,OKCVapes,2015-08-17 18:52:00+00:00
1037,633350434795622400,You'll notice immediate changes when you switch from #smoking to #vaping http://t.co/QROaaE9abh,BayouSwampJuice,2015-08-17 18:51:25+00:00
1038,633350373869137920,Vape On? Or Vape Off?  Topeka making some decisions regarding E-Cigarettes in public places.  http://t.co/3FmaX1zPfN,1440KMAJ,2015-08-17 18:51:10+00:00
1039,633350294462599168,"as soon as I wake up, I vape my life away.",jewthatskates,2015-08-17 18:50:51+00:00
1040,633350290066903040,All white teens do together is vape and call eachother niggers,DevonDude_,2015-08-17 18:50:50+00:00
1041,633350285365084160,When your parents tell you to stop vaping so you show them who's boss http://t.co/cmhPcDZNJe,fultronlane,2015-08-17 18:50:49+00:00
1042,633350251387162629,Variable voltage or Variable Wattage? Constant voltage? What is the difference? Visit https://t.co/tQ7pVPzARw … #vape http://t.co/Rb9DSRrJvb,vappora,2015-08-17 18:50:41+00:00
1043,633350245280292867,Some kid in my 8th period took his vape pen out and started blowing smoke everywhere and the teacher didn't notice😂,williasam81,2015-08-17 18:50:40+00:00
1044,633350187830931458,.@RelixMag is giving away a state of the art E-cig kit aka Personal Vaporizer Kit from @HotVapes #vapelife #vape http://t.co/7MldSCHGaI,bassmusic_filth,2015-08-17 18:50:26+00:00
1045,633350146856628224,Our Penny Stock Picks Have Been Seeing MASSIVE gains! We Have A Big New Pick Coming: http://t.co/kfHwjHRiGg $VAPE $IPSEY $AFFU,Stockenheimer1,2015-08-17 18:50:16+00:00
1046,633350090460143616,"Burdensome vaping regulation about revenue, not health http://t.co/xH8iA5v8Td",VolcanoVaporInc,2015-08-17 18:50:03+00:00
1047,633349853075120128,Vapor Joes - Daily Vaping Deals: USA STILL GOING: SMOKTECH 65 WATT BOX MOD w/ FS - ... http://t.co/1Im7Aosksl,vaporjoes,2015-08-17 18:49:06+00:00
1048,633349828945186816,Win a SX Mini M Class mod from http://t.co/8zQhBZOrXN - http://t.co/f9kKRflbkG #ecig #Vape,KTECH7,2015-08-17 18:49:00+00:00
1049,633349723068477440,#vape @Regrann from @vapemodels -  Happy Friday Everyone! @carolin_vanessa 😘 #Regrann http://t.co/eTIoYiSqKU buyv… http://t.co/mnezegEqZc,BuyVaporPens,2015-08-17 18:48:35+00:00
1050,633349542486933504,"PSA: Frootloops #Vape #ejuice is love, is life right now, can taste the cereal, with a hint of sweet milk... so good.",ninjatoine,2015-08-17 18:47:52+00:00
1051,633349528603770880,Save #vaping. No tank above 10ml!!  http://t.co/QTbxXpESed,MatthewAHancock,2015-08-17 18:47:49+00:00
1052,633349444960972800,"The breezeway is swarmed with kids riding longboards, kids using vapes, and kids riding longboards while using vapes....",TanklinRussell,2015-08-17 18:47:29+00:00
1053,633349307551186944,"Holy Mary, mother of God, vape for us sinners now and at the hour of out death amen",GranddadTheBand,2015-08-17 18:46:56+00:00
1054,633349211698761728,this kid is throwing a fit cause his vape pen got stolen and I'm laughing so hard lmao,sevvage,2015-08-17 18:46:33+00:00
1055,633349163120463872,"Vaping Is Better Than Smoking, But It Will Probably Kill You http://t.co/IOuubK5GG1",MiscellaneousED,2015-08-17 18:46:22+00:00
1056,633349095445258240,I need to go to Mr. Vape😐,domnash0303,2015-08-17 18:46:06+00:00
1057,633349034208559104,"here in my garage, just bought my new vape mod here",halloptik,2015-08-17 18:45:51+00:00
1058,633348930982559744,Rip Sticking in cargos + Vaping = life,Big_Nilla,2015-08-17 18:45:26+00:00
1059,633348874107789312,Check this out! http://t.co/lmFE5Gyum5 UK vapers need to get involved with this,meshbricks,2015-08-17 18:45:13+00:00
1060,633348848086319104,Premiere Vape shop #vape n'Ape https://t.co/GGem3qTadV,DSTEGNER119,2015-08-17 18:45:07+00:00
1061,633348846068699136,Okay Undertaker. We get it. You vape. http://t.co/dQbCPJXYsZ,bafunkadonk,2015-08-17 18:45:06+00:00
1062,633348705999962112,Win a Hermetic Steam E-Juice Sampler from @cigbuyer: http://t.co/J9z3JmS0TK #ecigs #vaping #eliquid #ejuice #vapecontest #vapegiveaway,embem219,2015-08-17 18:44:33+00:00
1063,633348645455171584,mistfits just went LIVE at [ http://t.co/oQ9tqge8b5 ] on @Vapersdottv - #AutoTweet #Live #Video #Vaping #Vapers #ecig #Vapor,LiveOnVapers,2015-08-17 18:44:18+00:00
1064,633348585879310336,Win a Joyetech EVIC VT Kit from @cigbuyer and @huffandpuffers: http://t.co/u15rQyHY3r #ecigs #vaping #evicvt #vapecontest #vapegiveaway,embem219,2015-08-17 18:44:04+00:00
1065,633348334028201984,"All-day vape stuff. 

#vape #vapor #vapors #vapeeveryday #vapelifestyle #ecig #ejuices #vapecommunity… https://t.co/FZmDWGzKuQ",iamjames46,2015-08-17 18:43:04+00:00
1066,633348259260428288,Still vape on,arifffizi,2015-08-17 18:42:46+00:00
1067,633348191350599680,Vape 101 was sick!! Blew my first smoke cloud and didn't even cough #college,KelseyNaddra,2015-08-17 18:42:30+00:00
1068,633348189194731520,"Is it Friday yet? 😴 #HuntingtonBeach #California

#ModLocation #vape #vapers #vapelife #vapelyfe… https://t.co/EnmUEAWXcI",modlocation,2015-08-17 18:42:30+00:00
1069,633348131032137729,Win a SX Mini M Class mod from http://t.co/SjxHYgCLo2 - http://t.co/rVu7uVXrVr #ecig #Vape,embem219,2015-08-17 18:42:16+00:00
1070,633348114863099905,Paradise Vape's Premium Ejuice is now in Russia!!! #RussiaVapes #ParadiseVape #PremiumEjuice https://t.co/PZs1UIbTHn,ParadiseVape,2015-08-17 18:42:12+00:00
1071,633348062660833280,Win a Whiteout Evolv DNA200 Box Mod! #vaporjoes #vapingunderground #vaping http://t.co/lBdLIBIcjo,embem219,2015-08-17 18:41:59+00:00
1072,633348049159520256,American #GlassPipes #Back2SchoolSale&gt; http://t.co/RIudKs7X3k &lt;=30% OFF #Vapes+#RollingPapers @1percent http://t.co/OV4LE42Wzo,1percent,2015-08-17 18:41:56+00:00
1073,633347986421104641,Win $5 To Use On Our Website - 💨💨💨🚀🌒 | #MoonFieldVapor #MFVapor #MFV #Vapor #VapeFam #Vaping #eLiquid… https://t.co/A8XbPyi863,MoonFieldVapor,2015-08-17 18:41:41+00:00
1074,633347978602901504,Mondaze💨 #ommp #pdx #portland #vape #dabs #dailydealpdx #vapelife #goldenxtrx #truenorth #… http://t.co/rJcAQ1l8a3 http://t.co/ZqtbyQinRU,greengoddesspdx,2015-08-17 18:41:39+00:00
1075,633347803050344448,Order your DIG Juice today. http://t.co/C3HRs9t0dA #VapeOn #vapeoftheday #vape #vapelife #ejuice #eliquid #vapeporn http://t.co/A4afhStZRj,JuiceDig,2015-08-17 18:40:57+00:00
1076,633347635663925248,Earning Report – $VAPE http://t.co/AuUqORdiAz,tqequity,2015-08-17 18:40:18+00:00
1077,633347606261968896,"☆☆ATTENTION FELLOW VAPERS☆☆
If you love vaping, please take 2 minutes of your time to sign this petition to save... http://t.co/SMzNjrNVGy",vaping_worx,2015-08-17 18:40:11+00:00
1078,633347584313163777,"Darth Vader: Yo u tryna vape?
Emperor Palpatine: Vape?
Darth Vader: Yeah vaporize Alderaan fam.
Palpatine: Oh shitttt 😎😎😎",yung_has_been,2015-08-17 18:40:05+00:00
1079,633347561311608832,president obama should make vaping legal,aubschrist,2015-08-17 18:40:00+00:00
1080,633347539497021440,RT ModMonth: D'Oh Nuts Ejuice Review http://t.co/rnypUZTYQv  #Vape,vapemerch,2015-08-17 18:39:55+00:00
1081,633347505602850816,If you vape and vape correctly I am confident you will not only love it but you will save crazy amounts of bud,BudOverLife,2015-08-17 18:39:47+00:00
1082,633347205907136512,"This girl is wouldn't stop vaping in class, like please stop!",veganbluntwrap,2015-08-17 18:38:35+00:00
1083,633347150290681856,Cameron is addicted to vape,sammi_s87,2015-08-17 18:38:22+00:00
1084,633347148403204101,my phone autocorrects vaped to VAPED if you want to know if I've yelled about it on the internet recently,lnb,2015-08-17 18:38:21+00:00
1085,633347080338206720,D'Oh Nuts Ejuice Review http://t.co/yHtlWeAWPM #Vape,ModMonth,2015-08-17 18:38:05+00:00
1086,633347077829824512,Snow Wolf 200W Box Mod Review | Guide To Vaping http://t.co/Ci1ZJ4FqXz,GuideToVaping,2015-08-17 18:38:05+00:00
1087,633347074805891072,"☆☆ATTENTION FELLOW VAPERS☆☆
If you love vaping, please take 2 minutes of your time to sign this petition to save... http://t.co/piv2RVC8kY",vaping_worx,2015-08-17 18:38:04+00:00
1088,633347060834635777,Mom needs to quit stopping at every vape store possible daaaamn,jessisafay_,2015-08-17 18:38:00+00:00
1089,633346677714386944,"Latest data shows that ecigs are not a gateway
#ecig #ecigs #vape #vaping #vapedata #vapeon
http://t.co/f4i1yBShBG",OffbeatnUnique,2015-08-17 18:36:29+00:00
1090,633346583619346432,Secrets for Great Vaping!...aqiL,RoxannaEli1,2015-08-17 18:36:07+00:00
1091,633346562949836800,Our Stock Alert On $GEQU Nearly QUADRUPLED In 2 Weeks! Special Update: http://t.co/EYbtsRpShV $VAPE $IPSEY $AFFU,PennyStockingt,2015-08-17 18:36:02+00:00
1092,633346460076109824,Hello Monday.  #vape #vaper #vaping #vapedaily #vapecommunity #vapestagram #vapeon #vapeporn… https://t.co/UQb5xjtPHq,TheVapeU,2015-08-17 18:35:37+00:00
1093,633346447581282304,Ordering a new vape box today,ThatGuyKylolo,2015-08-17 18:35:34+00:00
1094,633346347341598720,"Black IPV D2 75w temp control box mods from pioneer4u are in stock now!
- 💥💥💥
| #vape | #c… http://t.co/Qe1KkQiDeO http://t.co/WtKk7SyDgg",Vapor_42,2015-08-17 18:35:10+00:00
1095,633346296095490048,Win a Joyetech EVIC VT Kit from @cigbuyer and @huffandpuffers: http://t.co/hi86xHizv7 #ecigs #vaping #evicvt #vapecontest #vapegiveaway,GlasMarg,2015-08-17 18:34:58+00:00
1096,633346226583285761,unitedvapersntwrk just went LIVE at [ http://t.co/hXMnynDOFq ] on @Vapersdottv - #AutoTweet #Live #Video #Vaping #Vapers #ecig #Vapor,LiveOnVapers,2015-08-17 18:34:42+00:00
1097,633346098132725760,Win a Hermetic Steam E-Juice Sampler from @cigbuyer: http://t.co/LzvLwz2oM5 #ecigs #vaping #eliquid #ejuice #vapecontest #vapegiveaway,GlasMarg,2015-08-17 18:34:11+00:00
1098,633345898211356672,Dropping out of college bc it isn't vape friendly,fucksamcooper,2015-08-17 18:33:23+00:00
1099,633345848370425856,"Is there such a thing as ""chain vaping""? Coz there's one fucker in here tonight who's yoking the bastard to death! 1/2",RiksRedGuard,2015-08-17 18:33:11+00:00
1100,633345543134162944,528_custom_vapes just got my #monsterV3 today!!!! Time to build that shit @rivermistvapor… https://t.co/q11KrociKU,LgSickboy,2015-08-17 18:31:59+00:00
1101,633345393225506816,Dropsicle! It's like... Perfect Harmony! #vape #vapelyfe #eliquid #chaseit #reverb http://t.co/LxQznsZc2s http://t.co/uv8ZZFJlEm,Blonosmoke,2015-08-17 18:31:23+00:00
1102,633345386187390976,"Hey guys join the Vape Wild club!! :D If you're a vaper, this place is honestly the best place to order e juice... http://t.co/V6GCJ3EhqG",ryoneestryfe,2015-08-17 18:31:21+00:00
1103,633345279400521729,Had fun with the vape god this weekend @jdmesseck,Chase_Dorey,2015-08-17 18:30:56+00:00
1104,633345205593354241,#NowPlaying: The Postal Service #HoldYourFire #Vape #HighSociety http://t.co/cjiK9erdA5,quickdrawvapor,2015-08-17 18:30:38+00:00
1105,633345183485153280,Hype i got this vape maybe now i can quit smoking for once,M_shaps428,2015-08-17 18:30:33+00:00
1106,633345099561234432,CULTURE SHOCK RICH BLUEBERRY IN W TRIPLE BERRY &amp; VANILLA EXHALE Mad Ape #Vape Magic! http://t.co/BMqkoc0wfw http://t.co/2312s1rgUy,RealDonnaDeVane,2015-08-17 18:30:13+00:00
1107,633345095161352192,"With #Vaping Granny as YOUR #Vape Brand Ambassador
it's sure Success! DM me or
http://t.co/VXp5FqWeNw http://t.co/45eN8KRRd2",RealDonnaDeVane,2015-08-17 18:30:12+00:00
1108,633345090300194816,"You are ready for #Success
I can help.
Dm 4 private consult 
Grow your #Vape business or
#Book Promotion http://t.co/OGGJjaDLRW",RealDonnaDeVane,2015-08-17 18:30:11+00:00
1109,633345088718934016,I liked a @YouTube video http://t.co/FdprIwTtKU Smoking vs Vaping,focalz,2015-08-17 18:30:10+00:00
1110,633345084692430848,"Hey vape fam, we've got a present for you. Which one of our Vape Gem E-Juices would you like?... http://t.co/jVlJ0ooLaS",VapeGem,2015-08-17 18:30:09+00:00
1111,633345084210065413,"120w iPV4S Temp Control mod is on sale for $61
http://t.co/zcnk5fftry
#VapeDeals #Vape #ecig http://t.co/GtjKgjuqFv",RealDealVape,2015-08-17 18:30:09+00:00
1112,633345083849314304,Do kids get a kick out of hot boxing the bathroom with vape? lmao,JayMulsanne,2015-08-17 18:30:09+00:00
1113,633345053868576769,vape city,vapeeverything,2015-08-17 18:30:02+00:00
1114,633344861689610240,I liked a @YouTube video http://t.co/77Mj9i36QS Smoking vs Vaping,real_lifepanda,2015-08-17 18:29:16+00:00
1115,633344720526151680,Never thought I'd say it but I think I'm gonna get a vape😂,veronicaarene,2015-08-17 18:28:43+00:00
1116,633344513583521792,We are open at 3pm Today! Show this post and receive 10% Off your purchase. @ Cleveland Vape https://t.co/kAF2h0JFp9,ClevelandVape,2015-08-17 18:27:53+00:00
1117,633344438232715264,Honey I shrunk the vape pens,Ernesto_Jon,2015-08-17 18:27:35+00:00
1118,633344276269654016,"Use My Code 7xpr8j, Save $20 at Vapor4Life, the #ecig way 2 smoke! #ecigzz #ejuice #vape http://t.co/gnGMLpncMk",smace1123,2015-08-17 18:26:57+00:00
1119,633344078508265472,For my birthday I want a vape,xpizzabox,2015-08-17 18:26:09+00:00
1120,633343946228428800,Just saw some 70 year old lady vaping 😂😭,_N_T_L_,2015-08-17 18:25:38+00:00
1121,633343943367917569,"Photo: Bummed that all the excitement is over, but damn I’m vaping like a boss now. @opliquids... http://t.co/cuaPcclkuZ",DjDreameater,2015-08-17 18:25:37+00:00
1122,633343937156108288,"Bummed that all the excitement is over, but damn I'm vaping like a boss now. @opliquids… https://t.co/sC9Zyzt5q6",Dreameaterism,2015-08-17 18:25:36+00:00
1123,633343807686320128,"Ejuice SALE!! Pear Almond by Ripe Vapes (Rich flavor of marzipan with notes of ripe pear, $14.99 30ml #ecig #vape http://t.co/00ijbszlgt",VaporBuyStore,2015-08-17 18:25:05+00:00
1124,633343778368040960,Win a SX Mini M Class mod from http://t.co/AOBCKi6GZc - http://t.co/LZsYxm3wqC #ecig #Vape,1499perry,2015-08-17 18:24:58+00:00
1125,633343760869523456,"RT RealDonnaDeVane: Wrath of Pele World's BEST Strawberry Vanilla Cream #Ejuice #Vape Awesome Flavor! 
… http://t.co/YSFGMMRGGk",vapemerch,2015-08-17 18:24:54+00:00
1126,633343759770591234,RT MtBakerVapor: Don't forget to clean your equipment before you #vape. #JustTheTip http://t.co/RuIFeIdADD,vapemerch,2015-08-17 18:24:53+00:00
1127,633343758227140610,RT VapemateUK: Thinking about buying our Menthol Eliquid? Read the latest review here! #vape … http://t.co/oJ3U6ufyZU,vapemerch,2015-08-17 18:24:53+00:00
1128,633343689780170752,Win a Whiteout Evolv DNA200 Box Mod! #vaporjoes #vapingunderground #vaping http://t.co/EYdSYUBrsn,Dwightboy64D,2015-08-17 18:24:37+00:00
1129,633343667327991810,when ur walking to 4th period and see a vape cloud arise from the masses,nice2_nietzsche,2015-08-17 18:24:31+00:00
1130,633343620918153216,"Please please please sign this petition for me, really appreciate all the support. Vaping means a lot… https://t.co/erkULpWsdt",0xpirateroberts,2015-08-17 18:24:20+00:00
1131,633343325060337664,FYI -- Expect a media storm tomorrow on a U.S. study that tries to show a gateway effect. It's rubbish. #ecigs #vaping,GregTHR,2015-08-17 18:23:10+00:00
1132,633343247956336641,"With this vape stuff,nicks videos and Andrews ""doofenshmirtz"" comment I am done for today😂😭😭😂😂",jay_larra,2015-08-17 18:22:51+00:00
1133,633343181006856192,my boss vapes,forgetbeams,2015-08-17 18:22:35+00:00
1134,633343080012210180,"we get it, you vape http://t.co/GjlrBIiCJ9",chayb562,2015-08-17 18:22:11+00:00
1135,633342922511921152,Monday Updates &amp; Giveaway! | Win a Disrupter 50w Mod | IndoorSmokers http://t.co/GjcjByX9Ij #Vape #ecig,VapeDon,2015-08-17 18:21:34+00:00
1136,633342758057607169,"Arctic temp control coils 

And aspire triton sub tanks!!

   …  https://t.co/kNAFVyNB4k #vape #ecig",ecigitesztek,2015-08-17 18:20:55+00:00
1137,633342757017358337,"Wrath of Pele World's BEST Strawberry Vanilla Cream   Awesome Flavor! 
  https://t.co/wv1m8yWoke #vape #ecig",ecigitesztek,2015-08-17 18:20:54+00:00
1138,633342755666685953,"Celebrate the last weeks of summer with some of  awesome fruit juices! 
 …  https://t.co/8f2lr2HQEv #vape #ecig",ecigitesztek,2015-08-17 18:20:54+00:00
1139,633342754496622593,edits are fun  https://t.co/AkH6A0ggH5 #vape #ecig,ecigitesztek,2015-08-17 18:20:54+00:00
1140,633342753439657984,"Check out my latest review of 

    https://t.co/cQqzXRI7aZ #vape #ecig",ecigitesztek,2015-08-17 18:20:54+00:00
1141,633342742412820481,"Platinum Subscribers Saw Our Stock Picks Gain 4,000% In 10 Months! See Our New Pick: http://t.co/g5i9WatmiT $VAPE $PTAH $TAUG",Stockaholics,2015-08-17 18:20:51+00:00
1142,633342739522932736,MANN JUICE has landed at Southeast Vapes - Wilmington Island!! We currently have 3 flavors in stock:… https://t.co/VCXDw2RTf9,SouthEastVapes,2015-08-17 18:20:50+00:00
1143,633342714726195201,What is vape,niflheimrr,2015-08-17 18:20:44+00:00
1144,633342597998620672,Can someone please tell me why my vape says atomizer low this shit keeps happening and is annoying AF,younghails,2015-08-17 18:20:16+00:00
1145,633342591820505088,"""I can't wait to go home and vape""",CamrynRachel2,2015-08-17 18:20:15+00:00
1146,633342427445784580,In Stock #Hurricane 1.2 #EPhoenix  #VapinArt #vaping #ecigs #ECIGUK #vapeon #vapeporn #vapelyfe #vapefam #rba #attys http://t.co/ZRzK0YcrM7,VapinArt,2015-08-17 18:19:36+00:00
1147,633342419929468928,Starting a new TV series called Vampires Who Vape. It's about a bunch of vampires going around using e-cigs. Hopefully I'll get ad sponsored,SevenPointBuck,2015-08-17 18:19:34+00:00
1148,633342076386705408,Hi if you sell great  vape concentrates  im looking for new flavours  for my new cbd super blend  vape on,CBDVAPERELIEF,2015-08-17 18:18:12+00:00
1149,633341989598052352,True life: my brother started vaping,_ryan_303,2015-08-17 18:17:51+00:00
1150,633341951522172929,Kinda sucks no vaping on campus 😒,moonbby88,2015-08-17 18:17:42+00:00
1151,633341867233558529,Vaping: How to Try New Vaping Flavor http://t.co/txAOykibJB,myhazekraze,2015-08-17 18:17:22+00:00
1152,633341806973976576,"Arctic temp control coils 

And aspire triton sub tanks!!

#vapeon #vapelyfe #vape #vapememes… https://t.co/rNbL6oEKF7",zuvape01,2015-08-17 18:17:08+00:00
1153,633341635091431426,"The customer was very happy with it :)
☆ #eleaf #istick 60w complete with the #Maganus dvc tank plus… https://t.co/DQaVPHPIA5",vaping_worx,2015-08-17 18:16:27+00:00
1154,633341612760936450,I love just sitting here while my brother vapes... Lol okay,i_formanski,2015-08-17 18:16:22+00:00
1155,633341559715561475,#10: 40 Japanese 100% Organic Cotton Pads No Adhesives the Best on Amazon Vape Atty http://t.co/uyIEA9jx2Y,007mikesantos,2015-08-17 18:16:09+00:00
1156,633341547199639556,Today's #ModCrushMonday goes out to the Mozaic Box Mod! What are you vaping on today? #MCM #CRAFTVAPERY #ModCrush http://t.co/NX9OsLXmDV,CraftVapery,2015-08-17 18:16:06+00:00
1157,633341472088170496,Just messing around thought it was a sick edit #vape #vapor #vapeco #vapeon #vapers #vaping #vapefam… https://t.co/wv5SPAYZSE,DJ_YoursTruly,2015-08-17 18:15:48+00:00
1158,633341390773207040,Our Penny Stock Picks Have Been Seeing MASSIVE gains! We Have A Big New Pick Coming: http://t.co/kfHwjHzHOI $VAPE $PTAH $TAUG,Stockenheimer1,2015-08-17 18:15:29+00:00
1159,633341295138840576,Say NO to Harsh Vaping Regulation http://t.co/k2dBPxKrHj,ParagonJuice,2015-08-17 18:15:06+00:00
1160,633341289950507008,"Wrath of Pele World's BEST Strawberry Vanilla Cream #Ejuice #Vape Awesome Flavor! 
http://t.co/qLKUDA8o6r http://t.co/FWvye2mgKw",RealDonnaDeVane,2015-08-17 18:15:05+00:00
1161,633341203841347586,"Vaping Is Better Than Smoking, But It Could Still Kill You http://t.co/lWZvBP57QZ via @PopMech",webelomanzulu,2015-08-17 18:14:44+00:00
1162,633341178495303681,Who needs vape when you can smoke the real thing #shishaovereverything https://t.co/n81GuZlEef,nonadimaria,2015-08-17 18:14:38+00:00
1163,633340971510538240,RelaxInMiami: vapensmokeshop3: Got E-liquid?! Come check out our premium collection of Vape liquid! #Um #coralgabl… http://t.co/3ciX0RpK8P,RelaxInMiami,2015-08-17 18:13:49+00:00
1164,633340968167731201,I swear to fetty wap if I can't vape in school I'm gonna freak the freak out😤,MB3_trey,2015-08-17 18:13:48+00:00
1165,633340957870567425,EDVNetwork just went LIVE at [ http://t.co/YxaDLfBPz1 ] on @Vapersdottv - #AutoTweet #Live #Video #Vaping #Vapers #ecig #Vapor,LiveOnVapers,2015-08-17 18:13:45+00:00
1166,633340849145810947,Strangers at DMV talking about vape and dabbing 😭😭😭,ShitItsSean,2015-08-17 18:13:19+00:00
1167,633340731952754688,"I KISSED A GIRL N I LIKED IT
TASTE OF HER VAPE E-LIQUID",justsonnynow,2015-08-17 18:12:52+00:00
1168,633340704668938241,pool side chillin' as I sip on this henny &amp; vape on this vape..… https://t.co/ngRkNUzRgS,manila_mnl,2015-08-17 18:12:45+00:00
1169,633340690567532544,Win a SX Mini M Class mod from http://t.co/hDlv5B0gDw - http://t.co/y3FXwfdjWz #ecig #Vape,reepard,2015-08-17 18:12:42+00:00
1170,633340673106776065,"This captain crunch juice has steeped for 2 months in my closet.

So thick I'm vaping glue instead",OddGrandpa,2015-08-17 18:12:38+00:00
1171,633340585038876672,How do I make this stop slipping to far into my battery http://t.co/q3pTcIstDW #vape #ecigs #reddit,ukvaper,2015-08-17 18:12:17+00:00
1172,633340584342650882,Mini rant and juice review: Space Jam Solstice http://t.co/rbLCWj5iPD #vape #ecigs #reddit,ukvaper,2015-08-17 18:12:16+00:00
1173,633340583587639296,COIL WRAP GUIDE HELP http://t.co/xRo6couLxf #vape #ecigs #reddit,ukvaper,2015-08-17 18:12:16+00:00
1174,633340387147517952,Help Us Save Vaping &amp; You Get This Uber Cool T-Shirt FREE! http://t.co/4Wb9ucxXNO,Sarah79xSarah,2015-08-17 18:11:29+00:00
1175,633340348174106624,The final stab #Vaping #Spain  #yovapeoporque http://t.co/wg8BmqfgLl http://t.co/kE6A05sEky,alec_tuit,2015-08-17 18:11:20+00:00
1176,633340225641541632,Anyone want to buy vape flavour? Tweet me :) I'm helping my brother  #Vape #malaysia,WanRaudhah,2015-08-17 18:10:51+00:00
1177,633340203260846080,The Vape community will not stand for this kind of shit dude,foompi,2015-08-17 18:10:46+00:00
1178,633340131404062720,Did you know PG in #ejuice makes #vaping smooth and enjoyable? http://t.co/8UNSDFmKhn by @HAUSpv,HAUSpv,2015-08-17 18:10:28+00:00
1179,633340119055998976,idk why i got this vape i dont even use it smh anyone want a vape pen?,StonerSpeedy,2015-08-17 18:10:25+00:00
1180,633340113402109952,15% off store 20% off glass! #Sale til Sunday!  #backtoschool #glass #pipe #waterpipe #dab #nicotine #oilrig #ecig #eliquid #vape #subohm,Highlifesmoke,2015-08-17 18:10:24+00:00
1181,633340049367695360,Monday vape mail! Sigelei 150TC and Smoke Xcube 160 in stock!,Inland_Vapors,2015-08-17 18:10:09+00:00
1182,633339946913398784,"If you're looking for the Five Pawns line, we've got it here at Vape Escape #fivepawns #eliquid #vape #ejuice... http://t.co/pmwJtTXcB1",VapeEscapeMI,2015-08-17 18:09:44+00:00
