,TweetID,TweetContent,TweeterUsername,TweetDatetime
0,633427941804912640,Max VG has never looked so good #liquidstatevapors #eliquid #vape #vapefam #cloudchasing #ejuice http://t.co/CNWPkc28cd,_vape_is_life,2015-08-17 23:59:24+00:00
1,633427929351987201,Vaping on that new-new. Coming soon. || #ejuice #vape #vapelyfe #vapeporn #vapelife #vapor #vaping #ecigs... http://t.co/45ACTIn6bX,BlackAxisJuice,2015-08-17 23:59:21+00:00
2,633427822632157184,I'm gonna start saving since next month because I need to get a vape.,tiffanyvalentne,2015-08-17 23:58:56+00:00
3,633427815912861696,Berry Dew - eLiquid Flavor  Premium E-Liquid from Grand Rapids E-Liquid. #VAPE http://t.co/kOHQHCZd7q,vapingbunny,2015-08-17 23:58:54+00:00
4,633427786959425536,VULive just went LIVE at [ http://t.co/44iyqk1KOD ] on @Vapersdottv - #AutoTweet #Live #Video #Vaping #Vapers #ecig #Vapor,LiveOnVapers,2015-08-17 23:58:47+00:00
5,633427684404670464,About to straight vape out this movie theatre,Deeeeeeeeeeeeev,2015-08-17 23:58:23+00:00
6,633427648107147264,LIVE on #Periscope: Totally Vaping Awesome Podcast https://t.co/aBxJVM9ejN,FreezeIsFunny,2015-08-17 23:58:14+00:00
7,633427614837772288,vape vape vape is life https://t.co/hiMB4qqEx7,iBookerJacobs,2015-08-17 23:58:06+00:00
8,633427568109191168,Me when a bitch ass teacher takes my vape pen #vapegod  https://t.co/lEqKxMb8lW,alexjessep,2015-08-17 23:57:55+00:00
9,633427468100222976,Health chiefs across UK... http://t.co/BqOHLmW71c #trustedsolution #lunarroverusa #vape #vaping #vapelife #vapelyfe #eliquid #ecigs,LunarRoverUSA,2015-08-17 23:57:31+00:00
10,633427386663632897,I'm giving away: BEAUTIFUL GLITZY OIL VAPER CIG. Check it out - http://t.co/uwA6fSKUc5 #listia,twitlovesroy2,2015-08-17 23:57:12+00:00
11,633427365171867648,Win a Joyetech EVIC VT Kit from @cigbuyer and @huffandpuffers: http://t.co/mO3s9tEPOc #ecigs #vaping #evicvt #vapecontest #vapegiveaway,marko_zadro,2015-08-17 23:57:07+00:00
12,633427316010582017,This world will vape you up and make you a massive cloud.,anbrll00,2015-08-17 23:56:55+00:00
13,633427257810268161,"Talking about vape with customer
""Now don't get me wrong, I hate niggers... But these negroes can cook up some juice!""",Suburban__King,2015-08-17 23:56:41+00:00
14,633427190357585920,my mom and sister are having a vape sesh downstairs its fuckin lit,KortexK,2015-08-17 23:56:25+00:00
15,633427119528243201,An introduction to Vapour Melon - Independent Vaping Reviews https://t.co/3VLYLSRzfx via @YouTube,vapourmelon,2015-08-17 23:56:08+00:00
16,633427103908655104,Imagine giving birth to a vape god,Slatums,2015-08-17 23:56:04+00:00
17,633426944533614592,FreakshowINC just went LIVE at [ http://t.co/WDNC4vlcl8 ] on @Vapersdottv - #AutoTweet #Live #Video #Vaping #Vapers #ecig #Vapor,LiveOnVapers,2015-08-17 23:55:26+00:00
18,633426934890803200,"#VapingIsCaring. Quit #Smoking, Start Caring. #LiteUps http://t.co/ippZ3KjITw
#Vaping",iamnoraed,2015-08-17 23:55:24+00:00
19,633426802665353216,Vape sesh at me casa,parker_searss,2015-08-17 23:54:52+00:00
20,633426781274435584,let booker tweet about vaping one more time,breequigs,2015-08-17 23:54:47+00:00
21,633426780221763584,RT vapingbunny: Berry Dew - eLiquid Flavor Premium E-Liquid from Grand Rapids E-Liquid. #VAPE http://t.co/eg27cRUuWs,vapemerch,2015-08-17 23:54:47+00:00
22,633426697078087680,"15 yo sara: shut up zahra im only 1 year younger than you
16 yo sara: omg is simon ONLY 15 what is he doing omg 16 i VAPE",smnpttr,2015-08-17 23:54:27+00:00
23,633426657307664384,In my music studio vaping on the Severance by: #groundzerovaping Nothing better than HipHop music and… https://t.co/Vj45AzQ7fn,greasehiphop,2015-08-17 23:54:18+00:00
24,633426634574397440,Strange_Kloudz just went LIVE at [ http://t.co/CXL95XfymM ] on @Vapersdottv - #AutoTweet #Live #Video #Vaping #Vapers #ecig #Vapor,LiveOnVapers,2015-08-17 23:54:12+00:00
25,633426540991090688,Win a Joyetech EVIC VT Kit from @cigbuyer and @huffandpuffers: http://t.co/TzX0zn6iFo #ecigs #vaping #evicvt #vapecontest #vapegiveaway,jebakoss,2015-08-17 23:53:50+00:00
26,633426524658663424,Vape me like one of your French girls,mike__perles,2015-08-17 23:53:46+00:00
27,633426372749299712,im sorry for that vape tweet,christiandeaths,2015-08-17 23:53:10+00:00
28,633426278507507712,Repost @machiena #coolmods #vape #vaping #vapers #vapor #mechmods #mechanicalmods #stealthvape #stea http://t.co/hP8GwrWJyI,vapingbunny,2015-08-17 23:52:47+00:00
29,633426270462697472,PowerVapeNetwork just went LIVE at [ http://t.co/eaogKB8LYi ] on @Vapersdottv - #AutoTweet #Live #Video #Vaping #Vapers #ecig #Vapor,LiveOnVapers,2015-08-17 23:52:46+00:00
30,633426032956039168,Metal Heads Unite-Vaping: http://t.co/4HpImegU07,Metalrulz,2015-08-17 23:51:49+00:00
31,633425950009638912,Help Us Save Vaping &amp; You Get This Uber Cool T-Shirt FREE! - Help save vaping in the UK! http://t.co/CYHGEyYbaU,marvinptm,2015-08-17 23:51:29+00:00
32,633425883424952320,SFATA Utah Press Secretary Writes to Agent VAPE: Agent Vape has received another press release from Shilo Plat... http://t.co/GFm2vizFUq,CrispVapor,2015-08-17 23:51:13+00:00
33,633425698699505665,Re-buildable Nova 2 Metal Tank 2ml -    https://t.co/9YDDpsRaA4 #vape #ecig,ecigitesztek,2015-08-17 23:50:29+00:00
34,633425601827876864,When you see a hot babe in daisy Dukes pulling from a vape pen leaning against a pick up truck in a myrtle beach parking lot.....,Gasolineheart77,2015-08-17 23:50:06+00:00
35,633425565408604160,Smoking vs Vaping http://t.co/Gk5WJwHnc2,azrulfikkri,2015-08-17 23:49:57+00:00
36,633425488799645696,I rather charge my vape other than my phone 😂,iBookerJacobs,2015-08-17 23:49:39+00:00
37,633425442448535552,New vape waiting at home for me. Much excite. Finally getting serious about kicking a lot of bad habits :D,_ZacheryRodgers,2015-08-17 23:49:28+00:00
38,633425385682681856,You ever think like damn vaping and edm are two reaaaaallllly gay things,mardyballin,2015-08-17 23:49:15+00:00
39,633425304598528000,"So bored, I'm in the country vaping by my lonely.",BrennanDeLoache,2015-08-17 23:48:55+00:00
40,633425262164725760,Chaplin by Vicious Ant Drip Tip – Vapor Workz- Free Vape Spot Giveaways http://t.co/0vIMeUuQ02 http://t.co/yKzZ9JRGmW,vapingbunny,2015-08-17 23:48:45+00:00
41,633425189322248192,Can you not vape on the bus? @NJTRANSIT won't be able to see all the haters over your clouds.,thetransittroll,2015-08-17 23:48:28+00:00
42,633425180988166144,Moody Blues/\ Ride Cap Ride/\@LondonMckuffey @DenizSaymanRock @Vaper_Room @Vape_Boss @vapeladies http://t.co/UPhZA95zRB,1039Dand,2015-08-17 23:48:26+00:00
43,633425088767889408,I need a hookah or vape .😴,Manuel__Acuna,2015-08-17 23:48:04+00:00
44,633424942701395969,VAPE TRICKS BRO http://t.co/Pf5qp7R3jH,tyrantstyra,2015-08-17 23:47:29+00:00
45,633424783988912128,Re-buildable Nova 2 Metal Tank 2ml - #vape #vapelife http://t.co/qzM0tARi2h,VapingVapeDog,2015-08-17 23:46:51+00:00
46,633424608746586112,Anyone tryin to buy a vape? cheap,Peick_67,2015-08-17 23:46:09+00:00
47,633424505382113280,Anybody have somespate vape juice I could keep?,NotEricHinds,2015-08-17 23:45:45+00:00
48,633424176091693056,#Article20 #TPD How it will affect YOU #vapelyfe #vapefam #vapecommunity http://t.co/A5kHzijVxa,Vaper_Room,2015-08-17 23:44:26+00:00
49,633424129262243840,Jimmy//\\Purple Haze//\\Rare\He had it down/\@LondonMckuffey @DenizSaymanRock @Vaper_Room @Vape_Boss http://t.co/fZw9XZdrwC,1039Dand,2015-08-17 23:44:15+00:00
50,633424118235295744,Enter to win a Snow Wolf 200w Mod &amp; 180ml Gift Pack from @DownEastVapes &amp; @Bella_Vapes http://t.co/EAhH8ViIoQ,sheddyvapes,2015-08-17 23:44:12+00:00
51,633423916686540800,Carter smokes vape. Not cigarettes.,Flowreynolds,2015-08-17 23:43:24+00:00
52,633423894402211841,Vape bubbles. @krishughess &amp;@JcChase_ http://t.co/H2yWmnjuKM,thegoldenLex,2015-08-17 23:43:19+00:00
53,633423622883835904,Looking for a new vape? May we suggest the highly rated PAX 2? Do you guys know of any vaporizers we should be... http://t.co/rH77BsYhSs,PuffCanada,2015-08-17 23:42:14+00:00
54,633423622158217218,just got more vape juice 😈✊🏽,iBookerJacobs,2015-08-17 23:42:14+00:00
55,633423461621366784,Theres a vape shop next to my work. I see about 5-10 vapekids each shift walk in and legit hang out in there. Its both funny and tragic.,Mike_Pierri,2015-08-17 23:41:36+00:00
56,633423217051496448,"Hello People!#Weekly #promotion for this week is as following:
#Snozzberry
1 bottle = $17.99 plus… https://t.co/v25Kspx8bz",vape_29,2015-08-17 23:40:38+00:00
57,633423198940323840,i lovvveeee you vape like so much cause is life tess yess? oh...k 😍,oliviaj_2000,2015-08-17 23:40:33+00:00
58,633423174873382912,Come thru to ac if u tryna vape,tonyahardinstan,2015-08-17 23:40:27+00:00
59,633423098851688448,How old is everyone here? http://t.co/xGkKKZINqw #vape #ecig #AAEC,ukvaper,2015-08-17 23:40:09+00:00
60,633423059635077120,Berry Dew - eLiquid Flavor Premium E-Liquid from Grand Rapids E-Liquid.   https://t.co/HSKbVfLDnj #vape #ecig,ecigitesztek,2015-08-17 23:40:00+00:00
61,633422951233138689,GP Heron looks good on....... http://t.co/alNnKpLvLm #ecig #vape #POTV,ukvaper,2015-08-17 23:39:34+00:00
62,633422835705356288,"Bought my dad a vape to stop smoking, best purchase of all time.",chriskaminski__,2015-08-17 23:39:07+00:00
63,633422831984988160,when the vape game is too strong that the fire alarms go off,brookenmiller_,2015-08-17 23:39:06+00:00
64,633422754935533568,I'm gunna join MLV - Major League Vapers,Shmerk1,2015-08-17 23:38:47+00:00
65,633422735150977025,Lol vaping doesn't mean you're cool.😉,fallon_hilliard,2015-08-17 23:38:43+00:00
66,633422688170680320,My mom is afraid of vaping,drewsterrooster,2015-08-17 23:38:31+00:00
67,633422443693125632,This guy was smoking a vape and it smelled like Cotten candy yum,nirvanashxx,2015-08-17 23:37:33+00:00
68,633422427628957697,vaping woman memes - OnlineMemeGenerator http://t.co/rpof9EGn4s,vapingbunny,2015-08-17 23:37:29+00:00
69,633422340374855680,ZOMBIE HUNTER Kayfun Undead rebuildable atomizer from Vipster Vapes on top of a green acrylic box mo http://t.co/bjVHkXyPyU,vapingbunny,2015-08-17 23:37:09+00:00
70,633422239187255300,start loving those vapes baby,JuiceEFruit2015,2015-08-17 23:36:44+00:00
71,633422191325908992,Do you even vape bro http://t.co/htcZKqRxWG,NotCamelio,2015-08-17 23:36:33+00:00
72,633422139526254592,Report: Medical #marijuana use begins to see movement across southern states http://t.co/0AE6RzLaoM #MMJ #cannabis #South #vaporize #vape,weedgeekdotcom,2015-08-17 23:36:21+00:00
73,633422132635172864,Skin Decal Wrap for Kanger Subtank Mini sticker vape Tripping http://t.co/6wOwKAsRXA,vapingbunny,2015-08-17 23:36:19+00:00
74,633422084048297984,The March Hare - by vaping rabbit http://t.co/uLZH49cpQd,vapingbunny,2015-08-17 23:36:07+00:00
75,633422011419742213,Sigelei 150W Temperature Control. #VapeItLoveIt She's a beauty. #Vape #Sigelei #VapeForDays #VapeLife #VapeIsLife http://t.co/v1CJHz9aD2,CountryTobacco,2015-08-17 23:35:50+00:00
76,633421903173021696,Win a SX Mini M Class mod from http://t.co/cL8zaesjYz - http://t.co/hI8YgPmsO5 #ecig #Vape,holyvapes,2015-08-17 23:35:24+00:00
77,633421847015596032,20pcs silicone rubber band vape ring for mechanical mods decorative protection vape rubber vape band http://t.co/QjOhirEhb0,vapingbunny,2015-08-17 23:35:11+00:00
78,633421816334262272,"Vape - e-cig - Vape Mod - Custom hand made drip tips. 510 drip tips, unique drip tips. Molehill Moun http://t.co/DYIfSOPwZj",vapingbunny,2015-08-17 23:35:04+00:00
79,633421765428035584,"I hate volcanoes like this. we get it, you vape http://t.co/hSJQUlZLLO",redpandaparty,2015-08-17 23:34:51+00:00
80,633421713447981056,Vapor Joes - Daily Vaping Deals: CHEAP: THE HELL BOY STYLE RDA - SILVER AND WHITE -... http://t.co/4DDMo1VtIs,vapingbunny,2015-08-17 23:34:39+00:00
81,633421596326240256,Vapor Joes - Daily Vaping Deals: USA - IN STOCK IN WHITE: THE KANGER SUBOX KIT - $5... http://t.co/b4BA6U9MIn,vapingbunny,2015-08-17 23:34:11+00:00
82,633421448607047681,It's nice to see the world of competitive #vaping has really taken off over the past several years.,premiumvapes,2015-08-17 23:33:36+00:00
83,633421318659043328,Win a SX Mini M Class mod from http://t.co/MsqXRpDnse - http://t.co/VAdLko23bn #ecig #Vape,jaybug_1976,2015-08-17 23:33:05+00:00
84,633421281539543041,How will Article 20 of the TPD affect me (YOU)? http://t.co/wg6Tr8I2b2 #Article20 #TPD #NotBlowingSmoke #vapelyfe #vapefam #vapecommunity,Vaper_Room,2015-08-17 23:32:56+00:00
85,633421266989355008,If anyone knows where I can buy horchata flavored vape juice hmu 👀,irislizet11,2015-08-17 23:32:53+00:00
86,633421146847768576,Bitch just cuz we got similar car taste and you come up next to me with a vape in hand trying to send me a signal doesnt mean i wanna race,joeayyyyye,2015-08-17 23:32:24+00:00
87,633421140812283906,When ur mom says u can't vape in the house https://t.co/0xHkAoJF8Y,DemGod_,2015-08-17 23:32:23+00:00
88,633421113800925190,When you find out your friend just started vaping. #VaporHub [ http://t.co/3Gzv4G4CLZ ] http://t.co/Ni3XBABshB,vapingbunny,2015-08-17 23:32:16+00:00
89,633420942291652609,images of custom vape box mods | Custom Duel 26650 box mod http://t.co/lxJjnYQZTk,vapingbunny,2015-08-17 23:31:35+00:00
90,633420888097034244,WHOA! #vaping this awesome juice flavor -- NUTTA BUTTA! It is delicious! #vape #vaping #goodflavors… https://t.co/VX6o0iC8Ao,bklynitemedia,2015-08-17 23:31:22+00:00
91,633420741904498688,TheVapingDen just went LIVE at [ http://t.co/M5vaNzqvPq ] on @Vapersdottv - #AutoTweet #Live #Video #Vaping #Vapers #ecig #Vapor,LiveOnVapers,2015-08-17 23:30:47+00:00
92,633420733541171200,#ecigarette #ecig #vaping #vape #whichecigarette for great reviews on starter kits and discount coup http://t.co/9g2IvfC093,vapingbunny,2015-08-17 23:30:45+00:00
93,633420711051268097,Vapor Joes - Daily Vaping Deals: TRIFECTA: GET 3 TUGBOAT MECHANICAL STYLE MODS FOR ... http://t.co/ZO3XfKAVwL,vapingbunny,2015-08-17 23:30:40+00:00
94,633420671314448385,FACTS #ejuice #eliquid #vapefam #vapeboss #vapegirl #vapeporn #vapecommunity #crazyazz #vaping https://t.co/o9J6eSyNUq,JColbert69,2015-08-17 23:30:31+00:00
95,633420667753508864,"A conversation held in front of me at my job
kid #1: just pay for it with a 20
kid #2: nah man I need that for vape",deannarvssi,2015-08-17 23:30:30+00:00
96,633420576795832320,https://t.co/Ar2AWaFHzM smoking a vape http://t.co/HWgGo8A3DM,vapingbunny,2015-08-17 23:30:08+00:00
97,633420562933657600,RT vapingbunny: Hatrick Triple Coil Sub-Ohm Tank by Smowell #vaping #vape Use Code:DNA10 For 10% OFF http://t.co/ruTcxVdjSX,vapemerch,2015-08-17 23:30:05+00:00
98,633420561415307265,RT vapingbunny: Fishbone Authentic RDA #vaping #vape Use Code:YEAHBABY For 10% OFF http://t.co/6hGakXmhKJ,vapemerch,2015-08-17 23:30:04+00:00
99,633420560370954240,"With #Vaping Granny as YOUR #Vape Brand Ambassador
it's sure Success! DM me or
http://t.co/VXp5FrdQc6 http://t.co/hoBADohx3b",RealDonnaDeVane,2015-08-17 23:30:04+00:00
100,633420559930519552,RT worldTVchamp: seducejuice I only order #blackjack because I loved the label. #vape and they sent me this other … http://t.co/dXqiebDTwW;,vapemerch,2015-08-17 23:30:04+00:00
101,633420544172523521,If you go to kava bars there's a 98% chance you vape and have a neck beard.,AndrewMcGuire_,2015-08-17 23:30:00+00:00
102,633420484659515392,#latenight #video #filming for my youtube intro to #vapourmelon #vaping reviews... #tired link to my… https://t.co/US2X0CQndR,vapourmelon,2015-08-17 23:29:46+00:00
103,633420436802523136,Vapor Joes - Daily Vaping Deals: TRIPLE 18650: THE 12 O'CLOCK BOX MOD http://t.co/YiwYSNsm9K,vapingbunny,2015-08-17 23:29:35+00:00
104,633420419458990080,Clearly a vape pen https://t.co/R2fRYh2mdt,joelaughingmttr,2015-08-17 23:29:31+00:00
105,633420230170124289,when vape is life http://t.co/mBIA1DW1zq,cclivity,2015-08-17 23:28:45+00:00
106,633420120430350338,madmodder #custommods #halloween #monster #monstermods #vape #vapelyfe #vapelife #boxmods http://t.co/4ItuJGy7IV,vapingbunny,2015-08-17 23:28:19+00:00
107,633420030219149312,NEW VAPE ☁️,MNaumu,2015-08-17 23:27:58+00:00
108,633420027740360704,15 yr old vape boys just pulled up next to peyton's car &amp; bianca &amp; i laughed in their faces &amp; now they've been driving next 2 us for 5 miles,RealJennaVEVO,2015-08-17 23:27:57+00:00
109,633420003463811072,"Heck, I do my own vape reviews, I still bow to @tiavapes as Vape Queen! Not to mention she's one of the people that inspired me to start. ♥",DigitalSqueak,2015-08-17 23:27:51+00:00
110,633419996392108032,couples that vape together stay together #goals @sammmk_ @TannerSmith66 http://t.co/5RLTXlw0Lg,sarah__scott22,2015-08-17 23:27:50+00:00
111,633419967275384832,In case you love to make use of e vapes than you ought to be following us http://t.co/2bvkm6Y5ox http://t.co/IX1cx4809L,vapingbunny,2015-08-17 23:27:43+00:00
112,633419695916457984,When I see people vaping and I'm just over here like http://t.co/9UPDnrBpve,XanderUntamed,2015-08-17 23:26:38+00:00
113,633419683337793537,Ben and jerrys vape flavored ice cream,sludglordsunday,2015-08-17 23:26:35+00:00
114,633419651872083968,All of the people that are jealous of @tiavapes and trying to scam people need to step off. Just bow down to your vape queen. :P,DigitalSqueak,2015-08-17 23:26:28+00:00
115,633419506833092608,Hatrick Triple Coil Sub-Ohm Tank by Smowell #vaping #vape Use Code:DNA10 For 10% OFF http://t.co/GhK0tLKl5W,vapingbunny,2015-08-17 23:25:53+00:00
116,633419387907768321,Fishbone Authentic RDA #vaping #vape Use Code:YEAHBABY For 10% OFF http://t.co/dfBpBZzKCu,vapingbunny,2015-08-17 23:25:25+00:00
117,633419271775879169,Cool vape pen bro.... You look like your sucking a robot's dick,MorganCiepluch,2015-08-17 23:24:57+00:00
118,633419217102999552,Check out my broadcast from my PlayStation®4! #PS4live  (Destiny)  live at http://t.co/kRhGjVsjWb,Vape_King24,2015-08-17 23:24:44+00:00
119,633419189651312640,Destiny Lol #Raging : http://t.co/sK3s8u3zSK,Vape_King24,2015-08-17 23:24:37+00:00
120,633419094784512000,"Use My Code 7xpr8j, Save $20 at Vapor4Life, the #ecig way 2 smoke! #ecigzz #ejuice #vape #vaporeon #stopsmoking http://t.co/gnGMLpncMk",smace1123,2015-08-17 23:24:15+00:00
121,633418955256782848,Vapor Joes - Daily Vaping Deals: DROP: THE RAVEN CARTOMIZER TANK - $10.99 - FREE SHIPPING - #vaping  http://t.co/IlrarU0SFu,vapingbunny,2015-08-17 23:23:41+00:00
122,633418894712119296,"""excuse me, my dad's at home so do you think i could get this vape for him? or do i have to be 18?""",maremoneyy,2015-08-17 23:23:27+00:00
123,633418863682711555,"If you don't like me vaping, the nice thing to do is ask me to not vape around you.",bruce_demonrage,2015-08-17 23:23:20+00:00
124,633418777733033984,gonna vape https://t.co/Caqpg75ow5,slugmessed,2015-08-17 23:22:59+00:00
125,633418758644613120,⛽️🅰🆖 is so vaped,moniquexo_,2015-08-17 23:22:55+00:00
126,633418618009702400,Vapor Joes - Daily Vaping Deals: ROLLOUT: THE TUGBOAT STYLED MECHANICAL BOX MOD http://t.co/bAu8cUpCoM,vapingbunny,2015-08-17 23:22:21+00:00
127,633418616696778752,Study finds Vaping is 95% Safer than Smoking http://t.co/6ERFiOSnl7,GrudgeLine,2015-08-17 23:22:21+00:00
128,633418586703400960,Summertime #vaping is like anything else that’s insanely awesome to do when it's this nice and hot out; it’s just more #enjoyable.,nicoticket,2015-08-17 23:22:14+00:00
129,633418537458008064,As my brother said ' we vape with attitude ',MrSeliparkuning,2015-08-17 23:22:02+00:00
130,633418471640928256,"8/17 MON 420 SPECIALS:Free Euphoric OG Pre Roll w/Donations of $25+
Free Vape Pen(Battery &amp; Charger) w/Purchase of Any Vape Cart",VBC420,2015-08-17 23:21:46+00:00
131,633418394063241216,#Justvapeit #vape #vaping #vapebling http://t.co/A5RyE04Gjk Follow us on Instagram- JustVapeIt http://t.co/WdcFC3OSSf,vapingbunny,2015-08-17 23:21:28+00:00
132,633418349481820160,Vape // strawberry milk,superkevintot,2015-08-17 23:21:17+00:00
133,633418281022562307,Berry Dew - eLiquid Flavor  Premium E-Liquid from Grand Rapids E-Liquid. #VAPE http://t.co/7bDQiGCNqc,vapingbunny,2015-08-17 23:21:01+00:00
134,633418185342066692,Most popular VAPE in the store for cannabis flower | The PAX. We are working hard to keep in stock. Priced right. http://t.co/lI9JeNF1fF,CapitolHemp,2015-08-17 23:20:38+00:00
135,633418067465371648,seducejuice I only order  because I loved the label.  and they sent me this other one…  https://t.co/WWRU67ycgb #vape #ecig,ecigitesztek,2015-08-17 23:20:10+00:00
136,633418041833877505,Win a SX Mini M Class mod from http://t.co/u4GyG8RpSe - http://t.co/fw6PxXm2Ho #ecig #Vape,rawcatslyentist,2015-08-17 23:20:04+00:00
137,633417990734790656,with @fyzzzahari big boss ! vape off ! smoke on ! https://t.co/SietNzMlqB,MhdErfan,2015-08-17 23:19:51+00:00
138,633417916201893889,Okay we get it you vape http://t.co/1lotsuTkUQ,GuadalupeAnieva,2015-08-17 23:19:34+00:00
139,633417812615147520,DerpSchnitzel just went LIVE at [ http://t.co/M0dqAMoUJD ] on @Vapersdottv - #AutoTweet #Live #Video #Vaping #Vapers #ecig #Vapor,LiveOnVapers,2015-08-17 23:19:09+00:00
140,633417809637281792,I just got grounded @ the vape shop 🎉,theetrnlgoddess,2015-08-17 23:19:08+00:00
141,633417618767118336,Russian Roulette/\ Fuckin wonders of are world//\\Regrets/\@LondonMckuffey @rockhard @Vaper_Room @Vape_Boss http://t.co/5iJzT7Nv77,1039Dand,2015-08-17 23:18:23+00:00
142,633417540933451776,seducejuice I only order #blackjack because I loved the label. #vape and they sent me this other one… https://t.co/ULoUkCFM78,jeversion1,2015-08-17 23:18:04+00:00
143,633417319314681857,Celebrity Endorsements Fuel Vape Branding as Shops Hit Mainstream Malls http://t.co/fj09iervIY #branding #brand,SVBrandforum,2015-08-17 23:17:11+00:00
144,633417278172717056,I'm selling vape juice again hmu,wesleyjamesflow,2015-08-17 23:17:02+00:00
145,633417043547521024,What it feels like vaping outside in the heat http://t.co/K2PEfxc3rU,kaiokendrew,2015-08-17 23:16:06+00:00
146,633416887385243648,League of Legends crew of Pro Gamers from @TeamGravityLOL Dropped by our Tasting Bar at #ECC http://t.co/MHM9JiYHiw #vape #ecigs #reddit,ukvaper,2015-08-17 23:15:28+00:00
147,633416886651252736,TC Problems? http://t.co/qz3zXrbryc #vape #ecigs #reddit,ukvaper,2015-08-17 23:15:28+00:00
148,633416885917249536,"Just got a mech mod, need some help http://t.co/VyojDDsUjg #vape #ecigs #reddit",ukvaper,2015-08-17 23:15:28+00:00
149,633416755214462976,"RT raphighness: New DGK Vape pen, for Trees!!! #dgk #snoopdogg #gpen #vapor #strongpack #vape #errlsquad #weed… http://t.co/K3KsmAMHaz;",vapemerch,2015-08-17 23:14:57+00:00
150,633416753599631361,"RT VapeGuysUK: Hey Guys, check out our experience of #VapeFest 2015! We hope you enjoy it :D #vape http://t.co/NFv5OmA5kb",vapemerch,2015-08-17 23:14:57+00:00
151,633416752639176704,RT Vaporferver: Loving the Kanger Subtank! Lots and lots of vapor and pure tasting vapor! Check it out! http://t.co/DONSMn3PMV #vape #vap…,vapemerch,2015-08-17 23:14:56+00:00
152,633416749115965441,Tonight On #VapeTV @8pm est #TunesHour @9 RoarVapor @10 Ofortuna #GeekVaping @11 Vaping With The Deeds @12 CrashVapes #VapeTastic #VapeChat,BlacksmithPro,2015-08-17 23:14:55+00:00
153,633416705444814848,The Synapse RDA by Aethertech is now available here at Vape Street! This 22mm atty has a four post… https://t.co/6bFg98t3zZ,vapestreet,2015-08-17 23:14:45+00:00
154,633416626252156933,We all have different levels of stress in our lives. That's still no excuse to start #smoking or not make the attempt to #swtich to #vaping!,Rad_Vapor,2015-08-17 23:14:26+00:00
155,633416503140810752,Come See Me Rage lolCheck out my broadcast from my PlayStation®4! #PS4live  (Destiny)  live at http://t.co/kRhGjVsjWb,Vape_King24,2015-08-17 23:13:57+00:00
156,633416464280633344,Most annoying posts on ig are the vape coils shit. I don't understand.,flufaholic,2015-08-17 23:13:48+00:00
157,633416450242273281,Destiny Lol #Raging : http://t.co/I8HwATB89U,Vape_King24,2015-08-17 23:13:44+00:00
158,633416384718880768,Buy 5 vapes get the 6th one free $7 or 5 for $30,aj_vapor,2015-08-17 23:13:29+00:00
159,633416224895049728,"New DGK Vape pen, for Trees!!! #dgk #snoopdogg #gpen #vapor #strongpack #vape #errlsquad #weed… https://t.co/4kLzLvhCcg",raphighness,2015-08-17 23:12:50+00:00
160,633416099971891201,there were a bunch of motorcycle guys at speedway and they asked if we vaped lmao,maiyafiger,2015-08-17 23:12:21+00:00
161,633416064823656448,with @fyzzzahari vape off ! smoke on ! https://t.co/2WIVp6m1Sh,MhdErfan,2015-08-17 23:12:12+00:00
162,633416058964045824,Don't talk to me if u don't vape,GFPM13,2015-08-17 23:12:11+00:00
163,633416055088619520,Just think of your vape fam. http://t.co/RSSJ7qeJnU,IslandVaporKihe,2015-08-17 23:12:10+00:00
164,633415962440691713,"""Trees CEO and co-founder Marshall Hayner, beer and vape pen in hand, briefly flew a drone rigged with a... http://t.co/nlxdb62Il7",CBDCalifornia,2015-08-17 23:11:48+00:00
165,633415950918905856,Win a SX Mini M Class mod from http://t.co/aggtMJn2G8 -  http://t.co/cUhQNd36ph #ecig #Vape,jrick53,2015-08-17 23:11:45+00:00
166,633415758802882561,Broke one of my vape tanks....kinda mad.,MerrmaidAriel,2015-08-17 23:10:59+00:00
167,633415739337244672,"Get Your #ipv4d2 #75w
from http://t.co/cjTvUBtRJL 
---------------------------------------
#vape #vapes… https://t.co/TeSFedUznh",GypsyVapes,2015-08-17 23:10:55+00:00
168,633415606264569856,"""Trees CEO and co-founder Marshall Hayner, beer and vape pen in hand, briefly flew a drone rigged with a... http://t.co/pP6VgriCDl",CBDCalifornia,2015-08-17 23:10:23+00:00
169,633415578116603904,"Cool Runnings:  Orange and Yellow Popsicle Flavors!  Yum!

#ejuice #EcigUK #Vape #eliquid http://t.co/CNSQcItMyy http://t.co/7CoascEGRY",RastaVapors,2015-08-17 23:10:16+00:00
