,TweetID,TweetContent,TweeterUsername,TweetDatetime
0,1418359958333165571,went in the vape store &amp; wanted new hookahs. i already have 2 though.,kygency,2021-07-22 23:59:00+00:00
1,1418359952654090242,This dog really wants to tell me about his new poetry chapbook over some cherry kombucha and a vape. https://t.co/BE9VSsW9oM,amaditalks,2021-07-22 23:58:59+00:00
2,1418359787604086793,Vaping and updating my voter registration status….,trevorEbooks,2021-07-22 23:58:19+00:00
3,1418359407675576324,I wish people had been this skeptical about vaping,The_MPire_,2021-07-22 23:56:49+00:00
4,1418358655452393480,my younger brother: *takes my vape* it’s okay cause i don’t inhale right mom,sillysuunflower,2021-07-22 23:53:49+00:00
5,1418358358499762176,"me: i'll stop smoking n vaping n not sh
my brain: how about u smoke n vape until ur lungs rot n sh it doesn't matter",vomitpain,2021-07-22 23:52:39+00:00
6,1418358007977680900,"i think we should bring back the war on drugs from the 70s and 80s. i mean come on, america. we have kids doin drugs all around us right under our noses. these juuls, vape devices, percs, weed. all of it. its ruining the kids that are supposed to be miracles.",dababydabot,2021-07-22 23:51:15+00:00
7,1418357704377225227,"just as I was reflecting on how my flight from LA—&gt;NY had an impressive variety of assholes on board, the flight attendants announced that they caught not one but TWO separate ppl vaping in the bathrooms",burratababe,2021-07-22 23:50:03+00:00
8,1418357561644834817,"Today, one of my 7 year old students comes up to me and says “can you iron my vape?” He made a fuse bead vape 🙄 I was like no dude absolutely not",tylervalente,2021-07-22 23:49:29+00:00
9,1418357406736650240,Gonna run outta juul pods in mexico so it might have to buy a pack ov cigs 😭😭😭,RaiPedersen,2021-07-22 23:48:52+00:00
10,1418357202126004227,vape nayshhh yaaaaaaaall https://t.co/KrDRU8mZl7,brookiebizzleee,2021-07-22 23:48:03+00:00
11,1418357093128720384,wild to me imagining getting hooked on nicotine for the first time via a vape such as the juul cause the first time I picked up a vape it was to “quit smoking” and ween myself off of nic but here I am 6 years later smoking cigs and a vape 24/7 🤡🤡🤡🤡,lilfamilyvan,2021-07-22 23:47:37+00:00
12,1418357060891254785,Live again come vibe with the boys https://t.co/fY76KqWxzZ,casper_vapes,2021-07-22 23:47:29+00:00
13,1418356761229070338,Dad on my ass for “vaping tobacco”,mynamejeff_9,2021-07-22 23:46:18+00:00
14,1418356669822742534,Vaping_Whovian is blowing fat clouds. Come say hello!! htts;//twitch.tv/vaping_whovian,Vaping_Whovian,2021-07-22 23:45:56+00:00
15,1418356533486886912,I am selibrating mango day by having a mango and lime #vape juice.,JichaMan1974,2021-07-22 23:45:24+00:00
16,1418356529028222977,The true intergenerational behavior that connects millennials and gen z is going to the bathroom to hit the vape.,la_croix_,2021-07-22 23:45:22+00:00
17,1418356433842802688,"For additional resources to #OvercomeAwkward conversations with your teen around underage drinking, smoking marijuana, and vaping, download the Parent Talk Kit today 👇
https://t.co/6WckLYjjwg https://t.co/c2rq2aBodd",AZGOYFF,2021-07-22 23:45:00+00:00
18,1418356244633509889,"guys that vape is so cringe, mejor saca un pinche Marlboro🤣",_johanaruiz,2021-07-22 23:44:15+00:00
19,1418355984238534661,I’d be a stay at home wife in the 60s if i could vape,rava,2021-07-22 23:43:13+00:00
20,1418355869503434770,Look at me being cool vaping and boba tea'ing 😎,devilsreject,2021-07-22 23:42:45+00:00
21,1418355041929289729,mister dio would ya kindly remove my vape pen from yer anus? much obliged,holhorsebot,2021-07-22 23:39:28+00:00
22,1418354402176479232,there is no reason for juul pods to be that expensive i’ll refill them myself thankyew 😤,ILYSBARl,2021-07-22 23:36:55+00:00
23,1418354171271651329,"""This study confirms what was already suspected"" - Our colleague and @MotherToBabyNE expert Beth Conover, APRN, weighs in on new vaping in pregnancy findings ➡️ https://t.co/YswGmQP34O. 
Visit our fact sheet for more info: https://t.co/Jy0P1jN6s3. 
#MotherToBaby #AskTheExperts",MotherToBabyCA,2021-07-22 23:36:00+00:00
24,1418354129370591235,"my friend gave me a shit ton of vape liquid today, i’m sorted for the next week while https://t.co/AS8KHQZHjW",THEANTIH3R0,2021-07-22 23:35:50+00:00
25,1418354022684274688,"#edibles #cbdoil #prerolls #cannabis  #vapejuice #cannabiscommunity Grape Krush CBD Vape Oil E-Juice – 30ML - 250mg

A fantastic grape soda flavored CBD vape juice is infused with our custom blend proprietary cbd formula to deliver https://t.co/rggv3YgCHd #cbdedibles #delta8 https://t.co/zsrs4tDhes",CBDSmokeShop,2021-07-22 23:35:25+00:00
26,1418354007484030980,"#edibles #cbdoil #prerolls #cannabis  #vapejuice #cannabiscommunity This Spearmint CBD vape juice liquid blend comes in various strengths of 250mg, 500mg, 1000mg and 2000mg, and features a refreshing spearmint flavor profile. Delicious https://t.co/JEgvjBCCAB #cbdedibles #delta8 https://t.co/IPoG6nRMuw",CBDSmokeShop,2021-07-22 23:35:21+00:00
27,1418353744840888322,sometimes the juul b hittin too smooth,kneekcoal,2021-07-22 23:34:19+00:00
28,1418353207110258690,Pray for me 🖤💙 https://t.co/DQasWgrpRF,vn_juul,2021-07-22 23:32:10+00:00
29,1418352737796956163,"Beauty, power, and performance are all at their peak with the new kit from Vaporesso.

Get your Luxe 2 kit here: https://t.co/9LcnI7nXl4

#vaporauthority #vaporesso #vaporessoluxe2 #luxe2kit #vape #vaping https://t.co/qJbx2psS7c",VaporAuthority,2021-07-22 23:30:19+00:00
30,1418352451061645312,"It's a Blue Dream kind of day💙
STNDRD Vape in Blue Dream, Beyond Ultra Blue Dream flower, and a Dr. Zodiak Moonrock rolling tray.  #weedlovers #weedsmokers #cannabis #cannabiscommunity #weed https://t.co/d9k7A7us8r",BudManOC,2021-07-22 23:29:10+00:00
31,1418352077051400194,About to venmo this random girl hitting a vape in Disney for a hit,marie_smileyy,2021-07-22 23:27:41+00:00
32,1418351390137663491,They are getting rid of 5% vapes tomorrow … got all this for $14 stripe were only $0.99 https://t.co/pMFhsotv4r,CoholicJoshua,2021-07-22 23:24:57+00:00
33,1418350657015275522,"When I google #vaping is safe, google suggests: vaping is not safe! 🤦🏻‍♂️🤦🏻‍♂️🤦🏻‍♂️🤦🏻‍♂️🤦🏻‍♂️ https://t.co/KotQyPNPnV",MinisterOfVape,2021-07-22 23:22:02+00:00
34,1418350437279977473,Luna is trying to suck up to me rn because she got in the trash earlier while we were at the vape store. 🙄😂,StarlessEyesWay,2021-07-22 23:21:10+00:00
35,1418350117799796738,Just bought a Juul but it didn’t come charged wtf,mcjacobnair,2021-07-22 23:19:54+00:00
36,1418350023172149249,Blowing into my juul like it’s a Nintendo 64,Pollyspockett,2021-07-22 23:19:31+00:00
37,1418349965282209793,just remembered that Taehyung vapes and now Life is Great again,zzombiepop,2021-07-22 23:19:18+00:00
38,1418349624377626625,"lose my juul 500,000 times a day",iliphbeats,2021-07-22 23:17:56+00:00
39,1418347184571879432,Another study adds to the overwhelming evidence base that #vaping is completely #harmless https://t.co/duRIp3f238,mihotep,2021-07-22 23:08:15+00:00
40,1418346983694155777,Just splurged on  a new vape setup I have to kick the smoking it’s been a goal of mine for a long time.but fucking with the people I been fucking with made it hard to kick the habit.I stayed stressed out and broke.,SupaFlyOne,2021-07-22 23:07:27+00:00
41,1418346390124564480,Why does my vape taste like pussy,Cutestoce,2021-07-22 23:05:05+00:00
42,1418346352837369860,"Y’all, I been trying to smoke a vape for over a week. I thought it was broke, so I bought another one 😑 just to find out the MUDDAPHUCKAAAA was never turned on. You have to press it five times!",bankrollbecky,2021-07-22 23:04:56+00:00
43,1418345857334878212,kayleigh really just said “auntie kiley can u pass me my vape” like bro i hate u🤣,ki_sto,2021-07-22 23:02:58+00:00
44,1418345821196537856,got my first pack of smokes in a while (i've been just vaping in the interim) and it took me over 48 hours to get thru!! look at me go!,mgkupdatez,2021-07-22 23:02:50+00:00
45,1418345508976873472,what’s the best disposable vape out there? had my juul for minute and mint pods are getting too expensive so what’s a good mint disposie??,bellamarie1738,2021-07-22 23:01:35+00:00
46,1418345362889322499,I got rude of my vape by through it into the river I regret,EmmettCutts,2021-07-22 23:01:00+00:00
47,1418345187324092417,"More clips ! 🔥

•
•
ZenBlendz Smokez
📍2814 S. Shepherd Dr. Suite D
Houston,Tx 77098
:
#ZenblendzSmokez #Houston #Smokeshop #Vapeshop #cbdshop #waterpipes #montrosehouston #kratom #vapes #htx #vintageshop https://t.co/3aZp3ljVim",ZenBlendz,2021-07-22 23:00:18+00:00
48,1418344965298589699,I lost my vape and my will to keep going. Coincidence? I THINK NOT!,DvaughnII,2021-07-22 22:59:25+00:00
49,1418344750671859715,The Houston Rockets Trevor Ariza had  to go to the bathroom during the game so he hit his juul.,Rocketsfunfacts,2021-07-22 22:58:34+00:00
50,1418344538762973185,"Due to the #sale of #HighPotency #vapes, retailers will be banned from selling these effective #July23, #2021. According to @PEI_Lung, 75% of #youth from #PrinceEdwardIsland used #VapingProducts containing more than 50 mg/ml of #nicotine. #EndTheTrend
https://t.co/E47K4SGYyg https://t.co/lL6J7zzJ7U",CalNcpc,2021-07-22 22:57:44+00:00
51,1418344349524324359,"Relaxing day.
.
#420 #marajuana #vape #weed https://t.co/6Y3ubzWQtl",FriendlessW,2021-07-22 22:56:59+00:00
52,1418344291416559618,"thinking of life's little moments of joy: tonight looking out a window at some kids walking their unslaughtered gayen, sharing vape with cousin while another shares his newly discovered favourite jazz pieces, and the sound of maa's &amp; anis' laughter coming in from the other room.",garamkitabein,2021-07-22 22:56:45+00:00
53,1418343768999309313,why my vapes always gotta die while i’m at work,maddiegurl00,2021-07-22 22:54:40+00:00
54,1418343639948824577,THC Vapes 1g going for the 40$ #TXSU25 #txsu24 #txsu23 #txsu22 #uh25 #uh24 #uh23 #uh22 #hbu #pvamu   #uhd,AvionDG,2021-07-22 22:54:09+00:00
55,1418343357449920517,my mom found one of the vapes i stole from my sis but i still have the other one 😎,meowzra,2021-07-22 22:53:02+00:00
56,1418343175182290951,Vape Company BUYS a Science Journal https://t.co/uG66GVX3uW via @YouTube,JulieStahlbaum,2021-07-22 22:52:19+00:00
57,1418343035813961734,so why’d my vape die right before my flight 😐 cruel sick world we live in,bacardimami69,2021-07-22 22:51:45+00:00
58,1418342872768778244,hiding in the bathroom on my work break not because i need a good cry but because an outdoor wedding is rehearsing in my favorite vape spot ™️,azolotls,2021-07-22 22:51:07+00:00
59,1418342377765416966,now why the fuck am i just now finding out that niall horan juuls💀 babes i threw mine out in 2018 i think its time u joinme,silverstreetvic,2021-07-22 22:49:09+00:00
60,1418342223930793984,juuling and drinking a NA beer in alabama,astrogirl_420,2021-07-22 22:48:32+00:00
61,1418342070499123201,"Rambo disposable 

Vape Home delivery 24h:
📲60035684
📲60097980
📲55805288

-
Shop online:
https://t.co/QgVn0kthos

 #جامعه_الكويت https://t.co/jzFLigbrqn",Vapegate3,2021-07-22 22:47:55+00:00
62,1418342019286532097,i’d sell my soul to satan to have mango juul pods again. Like i’ve had juice that’s tasted just like it but it’s not the same i specifically need mango juul pod. oh and creme brûlée too,fermentedjam,2021-07-22 22:47:43+00:00
63,1418341745100611586,My father Kim Gould just bought me a juul and 3% menthol pods yep,marika49613998,2021-07-22 22:46:38+00:00
64,1418341654621212676,First thing I do when I wake up is rip my vape 💨,Big_Sexy522,2021-07-22 22:46:16+00:00
65,1418341511654035457,Time to tape down the vaping,xbubblepopx,2021-07-22 22:45:42+00:00
66,1418341161266073600,i will quit vaping i will quit vaping i will quit vaping i will quit vaping i will quit vaping i will quit vaping i will quit vaping i will quit vaping i will quit vaping i will quit vaping i will quit vaping i will quit vaping i will quit vaping i will quit vaping,raecharu,2021-07-22 22:44:19+00:00
67,1418340200820875270,Why is it so hot when a guy lets you hit his vape,lets_katchup,2021-07-22 22:40:30+00:00
68,1418340015512473610,Picked a good time to stop vaping,4LTony,2021-07-22 22:39:45+00:00
69,1418339922071625730,Lets call EVALI what it is: THC VALI. Nothing to do with e-cigs or nicotine vaping. https://t.co/GRNbRmyzRf,tobacco21ca,2021-07-22 22:39:23+00:00
70,1418339690726391813,"“The vaccine isn’t FDA approved!”

Neither is that molly you took, and neither is that vape you hit everyday. Just get the vaccine",GOD_SPEEDXVII,2021-07-22 22:38:28+00:00
71,1418339469774581766,"Interesting that Andy at Heart Health NSW has a very different view on #vaping than the far more experienced British Heart Foundation. 
Mark has a Bachelor of Exercise &amp; should know the cardiovascular improvements of switching to #vaping from🚬, right?    
https://t.co/aY7zo74SyZ https://t.co/lhHhbbtC1X",LivePippas,2021-07-22 22:37:35+00:00
72,1418339423238774788,"Got called tf out in my recovery meeting last night. One of the facilitators was like ""everyone at the meetings always has some sort of caffeinated beverage and a vape"" and I'm like WOOOOOW we really are all out here walking the same journey. 🤣",MustacheTom,2021-07-22 22:37:24+00:00
73,1418339314627350531,I’ve made vaping my entire personality,ItsthegIue,2021-07-22 22:36:58+00:00
74,1418339082699223043,Fuck I gotta buy another vape,darkshark1992,2021-07-22 22:36:03+00:00
75,1418339036603682817,A man's ideal woman is one who vapes while brushing her teeth,7_elevan_,2021-07-22 22:35:52+00:00
76,1418338873373958144,"[Weed]

People with #insomnia, have you had any luck treating it with CBD and/or THC? (I can't smoke or vape but can do edibles and tinctures.)

#NEISvoid",dreamsofskies,2021-07-22 22:35:13+00:00
77,1418338652195745795,"#edibles #cbdoil #prerolls #cannabis  #vapejuice #cannabiscommunity Gold Juice CBD Vaping Pen 0.5ml – Royal Sweets

This is one of a kind! This vaping additive is made with premium CBD oil from 100% organic industrial hemp plants, https://t.co/0K3Qmksyzj #cbdedibles #delta8 https://t.co/U5C5xVl1PV",CBDSmokeShop,2021-07-22 22:34:20+00:00
78,1418338529332006912,What does everyone do for a living? Tell me without telling me lol. I manage Ouid in retail 😂😂😂#JobKeeper #twitchstreamer #AMC #pc #DELTA8 #Hemp #vape #BATTLEFIELD2042,OG_SwiffT,2021-07-22 22:33:51+00:00
79,1418338070668087296,"Nicola Yeager's Amazon Author Page.

High quality chick lit since 1789. Closed on Sundays. No pets, messy sandwiches or vaping, please.

https://t.co/JhUYQpeZYK https://t.co/mgXXzcvNwZ",NicolaYeager,2021-07-22 22:32:02+00:00
80,1418337998819627010,i can't believe you want me to vape your cheek~,slime_sext,2021-07-22 22:31:45+00:00
81,1418337121761259523,"wanna get out of isolation so i can hug my friends, vape, kiss her again, sesh and just not be fucking lonely anymore bruvvvvv give me a negative test i feel better",LTZERK94,2021-07-22 22:28:15+00:00
82,1418337074789289986,I vape and tell my cats that I create the clouds in the sky 💨🌥,thghts4urpennys,2021-07-22 22:28:04+00:00
83,1418336858640052224,Just posted a photo @ All Day Vape https://t.co/awr6fL3rpM,alldayvapejax,2021-07-22 22:27:13+00:00
84,1418336730575368192,"At this point of the night i xan say that FL3 from laroi is mid ash 
He just made 6 new songs and added old songs to it 
It wouldn't be mid if he made an ep tbh stay could keep being a single til he made sum more songs to made a proper album",Vaper_999,2021-07-22 22:26:42+00:00
85,1418336492884152321,Wait why am I just learning that Niall vapes.,ihrtdunkirkrry,2021-07-22 22:25:45+00:00
86,1418336256434479105,"Gotta mf headache from hell, and I can’t find my vape 🙃",BigFiyahhh,2021-07-22 22:24:49+00:00
87,1418335626475319299,cigarettes are acoustic vaping,goodbyefruit,2021-07-22 22:22:19+00:00
88,1418335611052695553,"i haven’t had a vape all day (,:",brittvnytay,2021-07-22 22:22:15+00:00
89,1418334893025628162,Great use of a vape cloud. https://t.co/mmOsq0rJCe,aubreyshusband,2021-07-22 22:19:24+00:00
90,1418334880761479168,"We really enjoyed using the Compass vape and the vapor produced.

Read more 👉 https://t.co/S6VstbQslt

#VesselCompass #VesselCompassVape #VesselCompassVaporizer https://t.co/VqPK3oS3Py",vapefuse,2021-07-22 22:19:21+00:00
91,1418334865959784449,the guys at fat panda ANNNND vape haven know me by name. oops,tougas_maggie,2021-07-22 22:19:18+00:00
92,1418334848586960897,"Just posted a photo @ New York City, N.Y. https://t.co/wgrhDdycAF",vape_nation411,2021-07-22 22:19:13+00:00
93,1418334822259314688,My mom tells me everyday to stop juuling/vaping and tells me how bad it is everyday. How do you think she’d feel if i said “why don’t you not eat that 2nd bowl of ice cream before you become fat and obese” and see how she likes it,bdon412,2021-07-22 22:19:07+00:00
94,1418334759420252162,I hit my vape anywhere I forgot I was in the nail shop 😂😩,kartermuvaa,2021-07-22 22:18:52+00:00
95,1418334607338926083,That time I forgot to clean the alcohol out of my vape and ended up drunk for a half hour,RoseGoldNairad,2021-07-22 22:18:16+00:00
96,1418334017548587013,Backwood ion smoke no vape,Paclongway,2021-07-22 22:15:55+00:00
97,1418334005494091776,there’s a law firm in my town that literally used to be a vape shop and it’s so funny,youngbloodslut,2021-07-22 22:15:52+00:00
98,1418333955208540161,almost grabbed my open sharpie and put it in my mouth at my desk bc i thought it was a vape,gabbybooger,2021-07-22 22:15:40+00:00
99,1418333751420071936,"Bruh ppl vape nic &gt; 6 mg?! I had a 12mg tobacco blend once and that was so intense.

Who the hell is vaping 20 - 66mg of NIC?!
🤢 https://t.co/HeMMm6BOWd",mynus_jp,2021-07-22 22:14:52+00:00
100,1418333456858116098,Recent scientific studies have shown that several JUUL vaping devices cause large amounts of nicotine to be delivered. These high concentrations of nicotine can cause nicotine poisoning resulting in severe health problems and even…https://t.co/EffdInxXap https://t.co/Fr7fTn1mXa,TexasLawyerscom,2021-07-22 22:13:42+00:00
101,1418333112480772096,just found a full bottle of my favorite vape juice and a quarter. thanks past maddy for being THAT dumb bitch,cocainemommie,2021-07-22 22:12:20+00:00
102,1418332422031216649,"Forcing 500,000 vapers to get prescriptions before 1 October just won't work. It's hard enough to get a GP appointment as it is! 

Listen to what people living in the real world have to say about this issue. https://t.co/Ua2hJXGIip",LegaliseVaping,2021-07-22 22:09:35+00:00
103,1418332411516030979,"I’ve moved over to vaping, but I’ve considered buying some smokes just to light them as incense to keep people away. 

1 ft is not 6 ft.  🙄 https://t.co/DrUTTZmt1I",Dontforgetyour9,2021-07-22 22:09:32+00:00
104,1418331340198584325,"Patrick is from Michigan. He's 54 years old, smoke-free and is vaping ""Rainbow Crash"" flavored e-cigarettes!

#michigan #mileg #migov #vapingsaveslives #flavorshooksmkers #smokefree https://t.co/fbJF1hezEL",OldiesTours,2021-07-22 22:05:17+00:00
105,1418330994206285828,oh u guys saw the juul? u guys actually look at the photos he posts where he’s not in them?😵‍💫,niallsmitski,2021-07-22 22:03:54+00:00
106,1418330728065028101,"#edibles #cbdoil #prerolls #cannabis  #vapejuice #cannabiscommunity This Spearmint CBD vape juice liquid blend comes in various strengths of 250mg, 500mg, 1000mg and 2000mg, and features a refreshing spearmint flavor profile. Delicious https://t.co/JEgvjBCCAB #cbdedibles #delta8 https://t.co/eldylvfGar",CBDSmokeShop,2021-07-22 22:02:51+00:00
107,1418330401886674945,no thoughts just niall’s juul,pearIyhrry,2021-07-22 22:01:33+00:00
108,1418330320600981508,watching people hit there nic vapes on my snap be giving me a head ache 😵‍💫,trvisbird,2021-07-22 22:01:14+00:00
109,1418330260060389380,consuming redbull &amp; vape together now all I have to do is not shower for 3 days &amp; I'm fully a man. privilege is just that easy y'all not trying hard enough,dezgostang,2021-07-22 22:00:59+00:00
110,1418330166087102469,"Opening by my house where the vape shop was…. @ Chandler, Arizona https://t.co/XLwQJCiSW8",shadowofdark_az,2021-07-22 22:00:37+00:00
111,1418330093433233409,TEENAGERS VAPE which is a big problem because unlike adults teenagers have undeveloped brains which can lead to more problems!,Dont_Vape_Bot,2021-07-22 22:00:20+00:00
112,1418330061313302528,Register for Vape 101 - Know the Risks today! A free virtual training about e-cigarette risks and prevention. Choose the date &amp; time that works for you when registering. https://t.co/s0Wc5KdbTd https://t.co/UZMo6rhZfV,publichealthOC,2021-07-22 22:00:12+00:00
113,1418330037531693056,"If you want our 90s OG Kush 1g vape, you gotta go to Saskatchewan or Manitoba. We can't chip in for gas but it’s 1000% worth the trip.",tabletop_social,2021-07-22 22:00:06+00:00
114,1418330012994834434,"Vape Heads 50ml - £1.00

That's right, just £1.00 per bottle!

10 flavours now available on our website below:

https://t.co/0pSIqgxIUA https://t.co/83D43Q9nsM",Washington_vape,2021-07-22 22:00:01+00:00
115,1418329680554438658,"Do people sell mini stickers? Like one that would fit on my vape?
#Stickers https://t.co/TbuJ0TSRWD",catsquirrelgurl,2021-07-22 21:58:41+00:00
116,1418329545908887554,"Just had a monster and my coworker's vape, now feels like I'm having a heart attack wow shit is crazy",AllLoveForMyFam,2021-07-22 21:58:09+00:00
117,1418329352870273024,"got this dab pen that looks like a juul, pretty rad",roburritokys,2021-07-22 21:57:23+00:00
118,1418329330598354947,243 cases. Like braaaah. I’m not saying to stop living your life but fuck at least stop sharing vapes and baby daddies u sick fakas,junkoballz,2021-07-22 21:57:18+00:00
119,1418329076885037062,I can’t believe this man was actually about to throw away his vape pen cuz he thought it was a disposable one🤦🏽‍♀️,ChantelA_,2021-07-22 21:56:17+00:00
120,1418328130146689025,"Need to get up and get my vape to deal with the back pain, but also in so much pain I don't want to move.",roguewerm,2021-07-22 21:52:32+00:00
121,1418328009493434378,i gotta stop hitting my vape. my little sister is kicking my ass at playing mermaids in the pool,g_dieego,2021-07-22 21:52:03+00:00
122,1418327343358152704,Thinkin bout Angus &amp; Gregg https://t.co/xqcbMGRH8u,Vape_Dawg,2021-07-22 21:49:24+00:00
123,1418327004810711047,bought vape alone for the first time today :D and found a pretty convenient way to do it too so hell yeah,emptyykd,2021-07-22 21:48:03+00:00
124,1418326538815213571,Vaping Level 999 https://t.co/ZQgvqo1K9e https://t.co/JGRq2HGjZi,itserikjohnson,2021-07-22 21:46:12+00:00
125,1418326391142166539,Just Macgyver'ed a charger for my disposable vape lolllll,NILLY___,2021-07-22 21:45:37+00:00
126,1418325782544461825,just got a real vape let's go it's officially chad boy summer baby,dezgostang,2021-07-22 21:43:12+00:00
127,1418325711530696711,why cant u vape the vaccine,paddytoolbox,2021-07-22 21:42:55+00:00
128,1418325662440452096,"#Vaping is safer than electric cars
https://t.co/2TPy8HbKGv",mihotep,2021-07-22 21:42:43+00:00
129,1418325521004474370,Haven’t hit the juul since Saturday and I caved and bought pods :/,caitlinnord28,2021-07-22 21:42:10+00:00
130,1418325407594684424,"The groundskeeper where my mom lives just told me he lost his 29yo son to #vaping. It’s not just water in that vapor. It’s chemicals too. How this is not yet regulated is beyond me because that’s a horrific way to lose a loved one, much less a child who just started his life",matty_angles,2021-07-22 21:41:43+00:00
131,1418325152123719681,NIALL HAS A JUUL?? WTF WHY DID I JUST NOTICE THIS😭,copyofhbw28,2021-07-22 21:40:42+00:00
132,1418325127394177028,"The outbreak of lung injuries often known as ""EVALI"" was nothing to do with nicotine vaping

by Clive Bates

https://t.co/CPcr3hJNk8",phil_w888,2021-07-22 21:40:36+00:00
133,1418325055298277378,One thing about it ..I lose my vape and remote 20 times a day in my bed 🥴,jadabstylin,2021-07-22 21:40:19+00:00
134,1418325022955933698,shes charging disposable vape batteries,kelsicat,2021-07-22 21:40:11+00:00
135,1418324897244254213,my mom changed the vape game,kelsicat,2021-07-22 21:39:41+00:00
136,1418324694181158915,"LMFAOOO they sell one vape pen and put ""Hustler💰💯"" on their bio https://t.co/p35axNj5Je",ochoaxxjo,2021-07-22 21:38:52+00:00
137,1418324238335885322,"my nightly routine is watching survivor while i suck on my little vape and do some weird activity (e.g. last night i assembled a bed frame, tonight i’m tearing apart the fucking enormous box my bed frame came in so i can stuff it in the overflowing recycling bin)",lalloriemist,2021-07-22 21:37:04+00:00
138,1418324134761680896,[ 2021 ] MARK TUAN VAPING IN BEIJING https://t.co/A7PwZDp3jD ผ่าน @YouTube,becausiamme,2021-07-22 21:36:39+00:00
139,1418323871661494276,this is from my old pipe https://t.co/7ZGb0RiiJA,juul_survivor,2021-07-22 21:35:36+00:00
140,1418323751326912524,The devil guyshe did my bed sheets when I washed them yesterday and she put my vape in the washer,bella_skywalker,2021-07-22 21:35:08+00:00
141,1418323204196782080,Mango beer and blueberry lemon vape tonight… https://t.co/eE1HIXp8YD,TexasEDMFamily,2021-07-22 21:32:57+00:00
142,1418322950978109441,hey guys check out this cool vape trick,franbot666,2021-07-22 21:31:57+00:00
