,TweetID,TweetContent,TweeterUsername,TweetDatetime
1051,1418104450007265281,"Single 18650/21700 battery compatible, max power 100W. Which color do you prefer?

More details: https://t.co/nik3IkH1q1

* You must be a legal vaping age 21+

#vaping #ecig #vapelife #vapers #vapeshop #vapeuk https://t.co/C5LOezZ5dW",ElegoMall,2021-07-22 07:03:42+00:00
1052,1418104199636729858,May have gone a little overboard on Vapemail this week.... via /r/Vaping https://t.co/ziQqYKOwKg,specialvalley00,2021-07-22 07:02:42+00:00
1053,1418104187162873858,This tank is simply ridiculous… works well on this mod but still a chonker of an RTA via /r/Vaping https://t.co/KWkMNizTZG,specialvalley00,2021-07-22 07:02:39+00:00
1054,1418103836045021184,"People smoke for the nicotine but they die from the tar.  - Prof Michael Russell
So ban tar free vaping??? https://t.co/7m8l9xpksp",JohnCoo51013646,2021-07-22 07:01:16+00:00
1055,1418103783159222273,"Arigatou Gozaimasu @GramdriptipsO @3pcs_vape 

The duck and CO-Duck is perfect...

Love you loads 😘😘 https://t.co/RshISDylYq",AugustinBourdin,2021-07-22 07:01:03+00:00
1056,1418103722027085825,MEMANG I TOOK MY TABLET PEN AND PUT IT TO MY LIPS TO SUCK INSTEAD OF MY VAPE BRAIN EMPTY I TELL U,g3ckoli,2021-07-22 07:00:49+00:00
1057,1418103639105839104,The stars my destination🚀More info: https://t.co/QoudMkzmd7#purlava #ceramic #ceramictechnology #pod #startkits #vaping #firstunion #ecig #Vaporizer #vape #ElectronicCigarette #Eliquid #vapepen  #OEM #ODM #eliquid https://t.co/Opm9tOL9ef,firstuniontech,2021-07-22 07:00:29+00:00
1058,1418103603617730564,"Enrique lglesias has been committed
to the same woman for 17 years and
Azooz in the silverado thats 29 and
still vapes thinks hes too good for
settling down, الله يالدنيا",FENZI_,2021-07-22 07:00:20+00:00
1059,1418102825721155589,I am so angry I bit through the plastic of a Juul pod. 5 FLAT TIRES!!!!!!!,bleakboss,2021-07-22 06:57:15+00:00
1060,1418102363517333504,i just watched a tik tok abt someone getting caught with their vape thank god for that cause i left mine in my moms room lmao she ain’t home,PatriciaaStarrr,2021-07-22 06:55:25+00:00
1061,1418100961113935873,how tf do i quit vaping holy shit,jj0nggg,2021-07-22 06:49:50+00:00
1062,1418100815756210177,All people who love vapes are my groovy mates 🐍 🤠 🔥,Coolest_bot,2021-07-22 06:49:16+00:00
1063,1418100341854269443,I wish my vape got a find me button cause dam I be losing that shit on my bed ertime😫,vanne0fficial,2021-07-22 06:47:23+00:00
1064,1418100160157167618,mortilus and primus are vaping inside me,prowl_ebooks,2021-07-22 06:46:39+00:00
1065,1418099941608771588,STOP I JUST SAW THIS ON TIKTOK IS THAT A JUUL NIALL https://t.co/jgs5ftSByf,lhlouisloml,2021-07-22 06:45:47+00:00
1066,1418099673592696833,"PARKER, GET ME SOME PICTURES OF SPIDER-MAN'S VAPE",jonahjamesonbot,2021-07-22 06:44:43+00:00
1067,1418099631821508609,Oh yes the world is crumbling with disease and disaster but we really must stop vaping. Thank goodness the scientists are keeping us in check https://t.co/LDROsK3UmA,beatandtweet,2021-07-22 06:44:33+00:00
1068,1418099030878523393,I need an Air tag for my vape,ellamari031,2021-07-22 06:42:10+00:00
1069,1418098806340603911,brandon just asked for my vape to light his cigarette,SEXYVlLLAlN,2021-07-22 06:41:17+00:00
1070,1418098193380909058,After this vape I’m done !,kevaceaaa,2021-07-22 06:38:50+00:00
1071,1418097652152078337,"3500 puffs Dispsoable Vaping Kit with 8.5ml Eliquid and 1400mah Battery， Featuring with Soft Silicone Mouthpiece as Pacifier,and Ceramic Coil，OEM order is Welcomed... https://t.co/iRT5x9nN62",JamesBondQiu,2021-07-22 06:36:41+00:00
1072,1418097236530110465,Pinkberry Nicotine Salts by MoMo. Momo eliquid have taken the fruity flavours of raspberry and strawberry and paired them with zesty lemon to create a pink soda to refresh your taste buds. Any 3 for £12.99.👉🏻https://t.co/pFz0qNU4pG #MomoSalt #eliquid #vaping https://t.co/6V7D4VR72I,uk_vapour,2021-07-22 06:35:02+00:00
1073,1418096658919960576,"Can't wait to tell you the good news. New members are about to join the Profile Family, guess what products they will be ?👐

https://t.co/bOpKVdxiXb

#Wotofo #WotofoOfficial #vape #vaping #vapelifestyle https://t.co/NfiwcGS7UI",wotofoofficial,2021-07-22 06:32:45+00:00
1074,1418095995263492098,Don’t Juul Be Cool,Dont_Vape_Bot,2021-07-22 06:30:06+00:00
1075,1418095405338873859,🥺 when your vape bout to die and the charger in the other room,CosmicxVirgo,2021-07-22 06:27:46+00:00
1076,1418095178225643521,"gippro GP6 SE , color are inspired by the nature.

- more portable, lighter, and smaller size
- more colorful
- low battery warnings

Warning: this product contains nicotine, an addictive chemical, and is only for smokers above the age of 21.
.
.
.
.
.
.
.
#gippro #vape #vapeshop https://t.co/D1CIxnoIEe",gipproindonesia,2021-07-22 06:26:52+00:00
1077,1418095101440573440,niall juuls?????? he’s a grown ass man and can do whatever he pleases but he does not seem like the man to juul,iamshannonkate,2021-07-22 06:26:33+00:00
1078,1418095079261188096,Man I wish this guy just vaped like touma got in trouble for,SocJusTrshMouth,2021-07-22 06:26:28+00:00
1079,1418094304409444355,Vape x coffee,alobatac,2021-07-22 06:23:23+00:00
1080,1418094161807380482,sarap siguro mag vape today,LaysonWarren,2021-07-22 06:22:49+00:00
1081,1418094000603484171,Sarap chill vaping 😤,manliest019,2021-07-22 06:22:11+00:00
1082,1418093744767832065,i know my vape ain go out on me right before my break 😭😭,lofrom1k,2021-07-22 06:21:10+00:00
1083,1418092363264704516,hold on….the vape my stepdad got me actually fucks… like wow how did he know,mosquitoboy93,2021-07-22 06:15:40+00:00
1084,1418092145013968900,"DM Me To Send Inquiry 
Visit https://t.co/hj6ApL37kT  To Learn More about Focol
The Professional Vape Device Manufacturer In China https://t.co/CnKeACEPrQ",hong85583834,2021-07-22 06:14:48+00:00
1085,1418091787093102601,Shades of Big Tobacco: How (and why) Juul bought an entire issue of a scientific journal | #parents | #teensvaping https://t.co/Q4nljafhjP,ParentSecurity,2021-07-22 06:13:23+00:00
1086,1418091580016181259,when this vape dies so do i,tpwksaracha,2021-07-22 06:12:34+00:00
1087,1418091298213437444,if u got a bm literally stay the fuck away from me. like the furthest coordinate away. out of my phone,gi_juul,2021-07-22 06:11:27+00:00
1088,1418091188620464128,What is phytol and is it safe to vape? https://t.co/unE8G2H1oh,0pus,2021-07-22 06:11:00+00:00
1089,1418090693029994500,"This vaping ban guns, then they had",nekcs_ebooks,2021-07-22 06:09:02+00:00
1090,1418090594115665920,should i call the cops on these white women being loud outside of my apartment at 1 am.,kingk_juul,2021-07-22 06:08:39+00:00
1091,1418089126528684032,"#edibles #cbdoil #prerolls #cannabis  #vapejuice #cannabiscommunity Blueberry Vape Juice - This CBD vape juice liquid blend comes in various strengths of 250mg, 500mg, 1000mg and 2000mg, and features a blueberry flavor. https://t.co/J88W0ikwsT #cbdedibles #delta8 https://t.co/qqVfVK3ope",CBDSmokeShop,2021-07-22 06:02:49+00:00
1092,1418089122300899328,#edibles #cbdoil #prerolls #cannabis  #vapejuice #cannabiscommunity Delta-8 Vape Pen Train Wreck. It’s a smooth and subtle vaping experience infused with Delta-8 that has everyone buzzing! Now you can enjoy the world-class cannabinoid https://t.co/YwnxIyJ6Xi #cbdedibles #delta8 https://t.co/sQ6vF75fil,CBDSmokeShop,2021-07-22 06:02:48+00:00
1093,1418089098972069889,you’ve heard of nipple piercings but hear me out what ab a tattoo,gi_juul,2021-07-22 06:02:42+00:00
1094,1418088738828156932,pour one out for my bts vape we had a good 14 months 💜 https://t.co/4l3XfFDKjv,allurnames,2021-07-22 06:01:16+00:00
1095,1418088529230450692,bitches look at me like i am a juul /ly,bmitoohigh,2021-07-22 06:00:26+00:00
1096,1418088508594348034,Vaping kills dumbass so don’t do it,Dont_Vape_Bot,2021-07-22 06:00:21+00:00
1097,1418088483730591745,The homie got a weed volcano vape shit . We high as eagle feet rn,lilpapifresh,2021-07-22 06:00:15+00:00
1098,1418088336925892608,Man fuck where the fuck is my vape,_FatNick,2021-07-22 05:59:40+00:00
1099,1418087975531933698,People who smoke juul’s… why do you guys always have them on your chest in all your stories? Does the nicotine go straight to your heart that way? I don’t get it,elbowpenguin,2021-07-22 05:58:14+00:00
1100,1418087957827768323,"stop vaping, we love you.
stop vaping we love you..
and we don’t want you to die",propagandawg,2021-07-22 05:58:10+00:00
1101,1418087038272909312,Don’t like these Vape pens at all,jaybofully,2021-07-22 05:54:31+00:00
1102,1418086912271687689,"Blueberry Treats shortfill e-liquid by Big Bold Creamy is a rich dessert vape with a fruity note.

Buy Now: https://t.co/YMXmbyVajp

Our Price: £10.99

#ukvapers #eliquid #vape #vapelife #vapetricks #vapeshop #vaper #vapenation #instavape #vapelove #cloud #vaping #eliquids https://t.co/n63dRcIIb3",ukvaporwaves,2021-07-22 05:54:01+00:00
1103,1418085568076947461,bitch i will twist ur ass up like a noodle,gi_juul,2021-07-22 05:48:40+00:00
1104,1418085481988857856,i will never forgive the banning of mango juul pods,kaileyrenaee,2021-07-22 05:48:20+00:00
1105,1418084583032061957,Vapes trolling so diego trolled them too lol 😂🤣 https://t.co/OkC79c9uJZ,AFer_JenTOP,2021-07-22 05:44:45+00:00
1106,1418084541680414720,"/dsmp /rp

c!Tommy keeps asking c!Wilbur if he can smoke a cigarette but he says no, keeps asking so c!Wilbur gives c!Tommy a melatonin diffuser and lies that it's a vape pen",Dezydotexe,2021-07-22 05:44:36+00:00
1107,1418084248259600390,Why are high school reunions a thing? Why would I want to see the guy in history who wouldn’t stop vaping or the girl who would call me moody,ratv1ntage,2021-07-22 05:43:26+00:00
1108,1418083831282900994,"My Vape just ran out. I ain’t done any ecstasy in some time. I haven’t drank any alcohol in 2 days. 

Going to count today as the day I quit all 3. Let’s see how this goes.",L0rdMincy,2021-07-22 05:41:46+00:00
1109,1418083676840210443,no way did my sil just taste my vape and say it tastes like a spicy hospital LMFAO????? ITS WATERMELON,pepperprettyy,2021-07-22 05:41:09+00:00
1110,1418081979413803008,my vape just died its gonna be a LONG 2 days,krysviry,2021-07-22 05:34:25+00:00
1111,1418081650253127681,"#edibles #cbdoil #prerolls #cannabis  #vapejuice #cannabiscommunity Blood Orange Pineapple Vape Juice 30ml

Blood Orange Pineapple Iced: Fresh blood oranges and exotic pineapples complimented by an icy blast of menthol deliver a https://t.co/14PenMF6Bb #cbdedibles #delta8 https://t.co/CFspayLrAJ",CBDSmokeShop,2021-07-22 05:33:06+00:00
1112,1418081597241405440,me on mon night walking back into the bar after taking 2 hits off a random nice lady’s bougie disposable vape  https://t.co/clTOXv6Vps,querelleofbros,2021-07-22 05:32:54+00:00
1113,1418081225911246850,Just drank a twisted tea and took a hit from the juul i think im bad tripping duuuude,ayo_toine420,2021-07-22 05:31:25+00:00
1114,1418081189416644611,"Just realized… the 2nd Song for the God Breathed On Me clip and the commercial was for whatever @therealmikedean’s vape brand is. 

We good folks.",didjesusdrop,2021-07-22 05:31:16+00:00
1115,1418080941000388609,"No headphones, no vape, mind racing. Tonight really about to be hell",DodsInTheHouse,2021-07-22 05:30:17+00:00
1116,1418080913607430145,Vaping kills so why do it because instead of dying you can play Minecraft,Dont_Vape_Bot,2021-07-22 05:30:11+00:00
1117,1418080636200488969,We’ve been hitting the juuls too hard https://t.co/ZqT60pmvRX,livvvO_o,2021-07-22 05:29:04+00:00
1118,1418080537047035906,why is everyone on my tiktok fyp so fine,gi_juul,2021-07-22 05:28:41+00:00
1119,1418079417230761987,Bitch just really blowing strawberry vanilla swirl vape shit In my face,Sayyitlikedatt,2021-07-22 05:24:14+00:00
1120,1418078494454468613,"We’re glad to be introducing a new line of #gummies and #vape cartridges for Tommy Chong’s Cannabis to the state of #oklahoma 

#cannabis #tommychong https://t.co/uCJsOpOBk1",HMPtrading,2021-07-22 05:20:34+00:00
1121,1418078268666830848,What is phytol and is it safe to vape? https://t.co/xklKAncvJb via @leafly,mellian1,2021-07-22 05:19:40+00:00
1122,1418078168691351555,ive nvr felt more like a zoomer lying in bed at 3pm watching tiktoks and sipping on my silly little vape pen,gaybabybrain,2021-07-22 05:19:16+00:00
1123,1418077948347752452,"BIG MEDICINE
BIG VAPING
BIG COFFEE
ALL DESPISE ME
C19 SHILLS
WHY?

Because YOU keep pulling 
away from them, 
healing yourself with
diet &amp; habit change!!!

When we crush giants
they get so angry!

They're pushing harder...
#rawfoodhealing
#rogerbezanis
#nomoremeds
#covid19 https://t.co/7QMqVJrSJO",RogerBezanis,2021-07-22 05:18:24+00:00
1124,1418077935735656450,"I am not your usual racist, the only group I openly discriminate against are smokers, I would like to put them on in a box sans air holes.
Vaping I don't mind as much, their box can have air holes.",2SC_Agent0037,2021-07-22 05:18:21+00:00
1125,1418077860498067457,when is my vape stuff arriving i can’t smoke this cartridge anymore 😭,mayoluvrr,2021-07-22 05:18:03+00:00
1126,1418077753383981059,Vape wisdom https://t.co/w7sEqWau4h,Storme_Music,2021-07-22 05:17:37+00:00
1127,1418077559602958338,"The ZenithII offers an impressive flavor and combined with F0 it offers the ability to discover all nuances of the liquid you're vaping. It's really well done, @Innokintech https://t.co/6a3V5FXUZa",SSechtin,2021-07-22 05:16:51+00:00
1128,1418077182488838150,YO DOCTOR STRANGE JUST USED SHADOW CLONE JUTSU,omg_juuls,2021-07-22 05:15:21+00:00
1129,1418077180152717312,"Me putting in MyFitnessPal today 
White monster, doritos, 4 espresso shots, espresso martini &amp; my JUUL life of a hairdresser / server",isabellaedithh,2021-07-22 05:15:21+00:00
1130,1418076843824099328,Bitches knowingly 6 weeks pregnant and knowingly still vape and smoke… bitch are you dumb?,SincerelyJaade,2021-07-22 05:14:00+00:00
1131,1418076727041880065,"I swear, my vape has legs.",indybobindy,2021-07-22 05:13:32+00:00
1132,1418076405498322946,Explaining to my 15 year old brother the technique to do vape tricks,_Hushh_1,2021-07-22 05:12:16+00:00
1133,1418076152611151877,"i think we should bring back the war on drugs from the 70s and 80s. i mean come on, america. we have kids doin drugs all around us right under our noses. these juuls, vape devices, percs, weed. all of it. its ruining the kids that are supposed to be miracles.",dababydabot,2021-07-22 05:11:16+00:00
1134,1418075775127855105,Hitting your vape just to go 💩 &gt;&gt;&gt;,saturnluxe,2021-07-22 05:09:46+00:00
1135,1418075201368113152,niall having a juul is you’d think out of character but i can totally see it https://t.co/dOTeY2FS2t,icarusscripted,2021-07-22 05:07:29+00:00
1136,1418075187283648513,My Juul spits in my mouth like I wish a woman would do to me,sadtrickmcawful,2021-07-22 05:07:25+00:00
1137,1418074362452746243,"Hey dude, I vape. Yeah you know vaping? I do it. Yeah vaping, it's something I do. I don't smoke, I vape. Vaping dude, it's amazing. You sho",IuIu_ebooks,2021-07-22 05:04:09+00:00
1138,1418074197473914887,A health statement in Gisborne that backs vaping as a means to quit smoking has been called out for not first denouncing the practice. https://t.co/X8WQFFHCpz,radionz,2021-07-22 05:03:29+00:00
1139,1418073662159147011,"“e-cigarettes can be a very effective tool for people who want to stop smoking .. vaping is far less harmful than smoking .. But [isn’t] risk-free .. we don’t yet know their long-term effects, so people who have never smoked shouldn’t use them” 
Michelle Mitchell @CRUKresearch https://t.co/UjTdMk9xGY",AlexWodak,2021-07-22 05:01:22+00:00
1140,1418073305718960133,"Coffee, vape &amp; hot Cheetos for dinner *chef kisses*",_tramirez,2021-07-22 04:59:57+00:00
1141,1418071783622647812,Why this bitches vape taste like baby food,xxchantee,2021-07-22 04:53:54+00:00
1142,1418071764589072387,And this is why I can’t wait until my melatonin vapes get here,Beingshahad_,2021-07-22 04:53:49+00:00
1143,1418071426356051972,"tadashi, a barista just desperately wanting to make his ends meet and adam, a rich college brat asking why his milk isnt non fat when it actually is... in a world where they werent affected by stupid classism... meet ugly but bond over skateboards... and adam VAPES",karanoidandroid,2021-07-22 04:52:29+00:00
1144,1418071097531002889,my bfs vape taste like shampoo,CH4ERYS,2021-07-22 04:51:10+00:00
1145,1418071044187774981,... so when are we getting a video of niall vaping,babyhoneymonika,2021-07-22 04:50:58+00:00
1146,1418070834443284482,"Article writing homework help 

Write a paper on Youth Vaping
Include the following topics:
- Generation Z (who they are, what do they believe, technology generation)
- https://t.co/cmKGrQpQTq",Homeworkgenius3,2021-07-22 04:50:08+00:00
1147,1418069636738859011,"i love the discourse ""coffee and cigs or energy drink and vape"" bc in the mornings i finish my coffee with cigs and pull out an energy drink with a vape. duality of a man",littleprick_,2021-07-22 04:45:22+00:00
1148,1418069440592109578,one time cate said that vaping feels the best when you’re eating and now i think about that all the time because she was literally so right,queer_edge,2021-07-22 04:44:35+00:00
1149,1418069112723582982,I think these vape pens makin my stomach sick now smh,MsHeatherRoseee,2021-07-22 04:43:17+00:00
1150,1418068750255935489,idk wtf they be putting in that vape shit but it’s good,lizglosss,2021-07-22 04:41:51+00:00
1151,1418068630349115399,someone blew the smoke from their vape in my face (unintentionally) and that shit was burnt as hell 😭😭😭,bitetheehand,2021-07-22 04:41:22+00:00
1152,1418067730100588548,…I set my black vape down on my black comforter…send help,mariawhinney,2021-07-22 04:37:47+00:00
1153,1418067410616213507,"Wine, lactaid and vaping nicotine got me through quarantine",itsnipzbxtch,2021-07-22 04:36:31+00:00
1154,1418066926933315584,"Remake of Harold &amp; Kumar but it's me trying to buy Juul pods during this ""lAbOr sHoRtAge"" where gas station managers refuse to pay ppl $2 more to do the midnight shift",CraigRedux,2021-07-22 04:34:36+00:00
1155,1418066897556238337,clouds are actually the product of god doing vape tricks,megumibot_en,2021-07-22 04:34:29+00:00
1156,1418066821207318528,Watching older woman tryna vape is funny,gnykohl_,2021-07-22 04:34:11+00:00
1157,1418066226366992384,hey guys check out this cool vape trick,franbot666,2021-07-22 04:31:49+00:00
1158,1418066175376953345,If you die from vaping related causes you was not destined to make it out here. Life gets way harder than a mint juul pod,BrandosDead,2021-07-22 04:31:37+00:00
1159,1418065802524168200,Don’t Vape have a Cape,Dont_Vape_Bot,2021-07-22 04:30:08+00:00
1160,1418065753237041152,*smokes cigs* “well i quit vaping so…”,parisgellerstan,2021-07-22 04:29:56+00:00
1161,1418064362351202304,Okie guys I got a vape pen! &amp;&amp; another wax but the wax is 🔥🔥🔥 but I promise y’all it’s less than half a gram 😂😂💀💀🥺🥺😩😩😭😭😭😭,toe_slanger,2021-07-22 04:24:25+00:00
1162,1418064264619864072,I kept losing vape juice bottles and buying new ones. Well guess who had 3 half empty bottles of the exact same vape juice now. #finance #moneymoves #imgonnakms,holesomebitch,2021-07-22 04:24:01+00:00
1163,1418063977700073473,It’s not a vape and skrillex kind of night :(,lembogu,2021-07-22 04:22:53+00:00
1164,1418063851908599809,haha this manager gave some freshman girl a hit of her vape and threatened me not to tell when i saw https://t.co/Hts8HUwTUl,bicteir,2021-07-22 04:22:23+00:00
1165,1418063256997044227,"can of red bull by the bed
vape is charged and snapchat's read",bot_wilbur,2021-07-22 04:20:01+00:00
1166,1418063239766700036,"Just saw a man at the bus stop take a ~5 second hit from his vape, start coughing a ton, and pull out his inhaler and take a quick puff from it.

Never change PNW",BunnyJoBurton,2021-07-22 04:19:57+00:00
1167,1418063152361660417,"Hitting that horse tranq vape tonight, shabat shalom pray the gay away 🙏🙏🙏💦💦💦💦🗿🗿🗿🗿🗿🗿🗿😈😈",CluBurnerAcct,2021-07-22 04:19:36+00:00
1168,1418063099349803008,monster flavor disposable vape ama,worstcanesacct,2021-07-22 04:19:23+00:00
1169,1418063064671215620,"just checked her likes &amp; following, not gonna eat for a while, lol",c_juuls,2021-07-22 04:19:15+00:00
1170,1418062704506458113,I just saw an Rick &amp; Morty anti-vaping campaign and I’m 80 percent sure Rick would hit the digital boof with me so yea.,HollowxBody,2021-07-22 04:17:49+00:00
1171,1418062507823050756,the only roast ppl use against me is that I smoke or vape like bitch and? what do u do? go on runs 4 hours a day??,TheNun12594468,2021-07-22 04:17:02+00:00
1172,1418062427820892164,I need to quit vaping 🤨,RastaMira,2021-07-22 04:16:43+00:00
1173,1418062400008433666,"I can have little a vaping, as a treat die",bbbbbbbbbbbaka,2021-07-22 04:16:37+00:00
1174,1418062164741525510,banana runts tasting vape. inlove.,btch_salad,2021-07-22 04:15:41+00:00
1175,1418061804304052232,"sha’carri richardson failed a drug test so she got a 250,000 dollar vaping sponsorship and a kanye commercial i gotta start smoking again",calebglorenzo,2021-07-22 04:14:15+00:00
1176,1418061566168031234,the first guy to get throat cancer from vaping will be blowing fat clouds out of his stoma,ronpaulgaultier,2021-07-22 04:13:18+00:00
1177,1418061509742235648,A Vocational Counselor Put Vape Juice In Their Fist. This Is What Happened To His Shoulder.,MedicalVideoBot,2021-07-22 04:13:04+00:00
1178,1418061480503676934,ash tray flavored vape juice,cemeteryygf,2021-07-22 04:12:57+00:00
1179,1418060991384932352,Okay so i’m starting to think the sketchy vape website wasn’t worth it,iGnarIy,2021-07-22 04:11:01+00:00
1180,1418060882358292481,It’s really quiet other than the sound of my brothers vape,sydtheshortone,2021-07-22 04:10:35+00:00
1181,1418060767258025984,Lockdown got me back to vaping again fuck this 🤦🏻‍♀️,LactoseGirl69,2021-07-22 04:10:07+00:00
1182,1418060640984322049,vape on,_carmatcha,2021-07-22 04:09:37+00:00
1183,1418060552895700992,"tw/ cigarettes and vaping

me: has a wholeass long cigarette 
me immediately after: vapes",ethansespresso,2021-07-22 04:09:16+00:00
1184,1418060173340459012,They discontinued my vape and I had to get a new one and the dollar store didn't have the banana car so I'm watching Twilight to recover. https://t.co/Uhj9w5HyaV,PapaverP,2021-07-22 04:07:46+00:00
1185,1418059972106022912,I Stan with all the Marrickville eshays in balaclavas working out while vaping,madlean69,2021-07-22 04:06:58+00:00
1186,1418059957786877959,"Cousin been vaping the last 2 hours, hotel room foggy af and smells like strawberry cheesecake rn",raul4v,2021-07-22 04:06:54+00:00
1187,1418059506982981646,Do certain vape flavors bring you back to a specific time or memory.. or is it just me,malvarezmakeup,2021-07-22 04:05:07+00:00
1188,1418059228049256449,"Sean requested that I talk about this since he and  @kayliesullivan3 have been talking about smoking and vaping being bad. Here's an old School Talk episode where Sean and I talk about it.
 https://t.co/cPuNAd9Jjh",Horsey39140343,2021-07-22 04:04:00+00:00
1189,1418059201402839041,am i the only one that just can’t imagine n!all vaping? like huh,hslotrrylvr,2021-07-22 04:03:54+00:00
1190,1418059162693558272,https://t.co/8rzTK88J8E #cbd #vapes and products ---- #vapor #ejuice #vape #bongs #pipes #thc #cbdvapes,vapor_dot_com,2021-07-22 04:03:45+00:00
1191,1418059105483304961,"#edibles #cbdoil #prerolls #cannabis  #vapejuice #cannabiscommunity Vape Pod Device Kit

Introducing the latest in pod vaping technology, the Moti delivers one of the best vaping experiences directly to the palm of your hand. https://t.co/kv8pVUrlC5 #cbdedibles #delta8 https://t.co/XU05uzZ5mA",CBDSmokeShop,2021-07-22 04:03:31+00:00
1192,1418058929204961281,“i deserve the irl role on ur server bc we’ve breathed the same air in the vape shop that we both used to go to”,er3ina,2021-07-22 04:02:49+00:00
1193,1418058808417341450,found my vape charger,roblovesbeard,2021-07-22 04:02:20+00:00
1194,1418058397405044736,Philippines Senate To Lead Region With Progressive Vaping Laws https://t.co/V5OC7lx9m2,EINTobaccoNews,2021-07-22 04:00:42+00:00
1195,1418058301246304260,"Their are many things that kill you. Like vaping, so why do it when you can do less deadly things, like playing minecraft, or even FORTNITE!",Dont_Vape_Bot,2021-07-22 04:00:19+00:00
1196,1418058279717060609,"Now this little train will bring you our #Aeglos P1.

Oh little blue, you are here too.

Which color do you prefer, blue or saddle tan?

#uwell #uwelltech #vape #vaping #vaper #follow #vapelife #vapeon #UwellAeglos #Thursday #thursdaymotivation #thursdaythoughts #metal #train https://t.co/hHV2ERWkad",Uwelltech,2021-07-22 04:00:14+00:00
1197,1418058243235061761,"OBS Engine S Sub Ohm Tank Clearomizer Vape Atomize
Buy it on:
https://t.co/TaFDlxLtId https://t.co/XQTemxg95w",3FVape,2021-07-22 04:00:06+00:00
1198,1418057850794897408,"""Vapers don't vape once an hour but 5 times an hour and it's bad because it causes HOLES IN YOUR LUNGS"" -- a councilmember in Windsor CA.",StefanDidak,2021-07-22 03:58:32+00:00
1199,1418057657097887744,We Vape Mods Is Closing Down 😢 - https://t.co/T5ZGNVAA7L,wevapemods,2021-07-22 03:57:46+00:00
1200,1418057327417167874,idgaf that u lost ur juul,drunkgrover,2021-07-22 03:56:27+00:00
1201,1418057303098540033,"Also been thinking of buying a vape with a 0% nicotine juice. Just to use out of habit. (haven't had nicotine since February) so as one can imagine, I am feening.",TacoxTakuso,2021-07-22 03:56:21+00:00
