,TweetID,TweetContent,TweeterUsername,TweetDatetime
271,1418293380304547845,Nobody is watching the 30 second video of you vaping you post everyday.   Respectfully,beyond_emma_,2021-07-22 19:34:27+00:00
272,1418293282472345608,God bless new york for still having mint juul pods,kaokana_,2021-07-22 19:34:03+00:00
273,1418293121453105156,"if i ever quit vaping i will not be tweeting that shit i dont wanna be one of those ""the truth"" commercials on youtube where some annoying person says some cringey shit over it",teruimu,2021-07-22 19:33:25+00:00
274,1418292927898468356,new law at midnight for canada that will ban flavours for vape and I HAVE NO MONEY TO BUY PACKS I NEED HELP,alyjadej,2021-07-22 19:32:39+00:00
275,1418292618744635397,"Dr Zeki is confident that by rehashing this list of stale #vaping myths, which have all been thoroughly dispelled, he can appeal to people's doubts and fears (any of this routine sound familiar vaccines?), but he makes no mention of cigarettes which kill 8 million people a year. https://t.co/Iz0JRSp4nT",RushmoreExt23,2021-07-22 19:31:25+00:00
276,1418292334639390726,HPD searching for 2 suspects caught on video robbing NW Houston vape shop at gunpoint https://t.co/8tQTdFat3U https://t.co/SIBb4rmEN4,DonnaCrumley,2021-07-22 19:30:17+00:00
277,1418292291060473856,Don’t Vape have a Cape,Dont_Vape_Bot,2021-07-22 19:30:07+00:00
278,1418292279949811712,HPD searching for 2 suspects caught on video robbing NW Houston vape shop at gunpoint https://t.co/BunRpBCaqU https://t.co/Ni0NbTT7py,SetronicsCorp,2021-07-22 19:30:04+00:00
279,1418292018145546244,When are they going to invent a vape marijuana because I’d rather smell artificial vanilla over skunk from next door,blossom_kaoru,2021-07-22 19:29:02+00:00
280,1418291766768381952,I just belched whilst inhaling a vape and caused some kind of a fruit flavoured vortex in my throat,nutsaremixed,2021-07-22 19:28:02+00:00
281,1418291505869983750,this is first film in the 'bicycle thieves' franchise to featuring vaping #BTPU #FilmFleadh #CovideoParty @BikeThievesPU,ConorOToole,2021-07-22 19:27:00+00:00
282,1418291323648491528,zyn is the vaping of dipping it rules,eatingshrimps,2021-07-22 19:26:16+00:00
283,1418290349760462853,Three men and a vape show #99 and 1/2 UPDATE SHOW https://t.co/gbh8M7Tlyk via @YouTube,Ladydarksky,2021-07-22 19:22:24+00:00
284,1418289856690606086,Still my favourite flavour vape atm #strawberrycreamdonut #eliquid #ejuice #vapelove #vaporizer #vapeproducts #eliquiduk #eliquid #vaperuk #Ukvaper #vapefog #eliquids #puzzledvapes #vapehacks #vapeon #vapefa @PuzzledVapes #vaper #vapelife #ejuiceuk https://t.co/f7rc9Q77vZ,Vaping40watts,2021-07-22 19:20:27+00:00
285,1418289313356333058,"newsflash kid in my math class who hits his juul in the middle of class, think about what you’ve done and how it affects others around you",insultfish,2021-07-22 19:18:17+00:00
286,1418289224193757191,"I thought I had bad habits but I really just weed smoke with a dib and Dab in some 💊 when around. But man that vape stuff, outtttt",sktomuch,2021-07-22 19:17:56+00:00
287,1418288963475886081,"Had a few dramatic obstacles today. Luckily a guy in a vape store helped me out, saw kindness from a coffee shop owner and also had encouraging words from a sound engineer. #KeepGoing",CathyySings,2021-07-22 19:16:54+00:00
288,1418288771297124352,Those anti-vape commercials crack me up,NotRabbitRoger,2021-07-22 19:16:08+00:00
289,1418288118801870856,"Enjoying a well-earned drink in the sun just round the corner @NorthBarHG after a busy day!

#shoplocal #wine #afterwork #independent #Harrogate #towncentre #sun #harrogatebusiness #barbers #cheese #coffee #fish #jewellery #beauty #curry #vape #hardware #electricals #antiques https://t.co/gTW3oHbfHa",Commercial_St,2021-07-22 19:13:32+00:00
290,1418287865608511489,"When you just blew an hour absentmindedly playing candy crush on your phone (and tweeting a couple of times) until your phone goes dead and then realize you left your charging cord at work this morning. Hmmm which one of my vapes has the right kind of cord?
#ADHD",imaracingmom,2021-07-22 19:12:32+00:00
291,1418287864312336391,My mom really threw out my expensive ass vape while I was gone 💀 yet she left the shit that came with it,theycallmeari,2021-07-22 19:12:32+00:00
292,1418287744783060992,help im laughing at the tom scott vape video for 4mins,beamny__,2021-07-22 19:12:03+00:00
293,1418287673589051398,whereabouts my juul,sickberd,2021-07-22 19:11:46+00:00
294,1418287482400018437,Which network has the most tobacco/vape/nicotine related products? #affiliate #opportunity https://t.co/q69NJhZLVL,OpportunityRus,2021-07-22 19:11:00+00:00
295,1418287228858556424,Dirty deep fryer grease flavored vape,suprduprdudr,2021-07-22 19:10:00+00:00
296,1418287025757716484,Great article with a convincing vape demonstration thrown in for good measure…. https://t.co/n40WzD7P2B,GlockyTop,2021-07-22 19:09:12+00:00
297,1418286960142176258,Any time someone assumes they can vape inside without asking me https://t.co/eXlJrXpmi1,iamwaleed,2021-07-22 19:08:56+00:00
298,1418286554624106497,The reason it's vexxing me is apparently ALLLLL this shit went down this morning and I can't just go outside and scope the people vaping and figure out who has the gossip and the Circle of Trust! https://t.co/GQHENSVPnl,LadyMenopause,2021-07-22 19:07:19+00:00
299,1418286460768301059,Read the new post: The F.D.A. Must Reject Juul’s Application to Continue Selling its Products in the U.S. https://t.co/8PJoSv2nDY https://t.co/Qq75dH9P6b,CenterEnvHealth,2021-07-22 19:06:57+00:00
300,1418286211811225607,you’re telling me that i missed quackity opening his priv bc i was hitting my vape.... i literally put my phone down for 2 seconds what the fuck.,ihatednf_,2021-07-22 19:05:58+00:00
301,1418286176104980481,"So the dog I’m dog sitting has chewed through my phone charging cable, ate my hair band, and chewed the fuck out of my vape, all last night while I was asleep. 🙃",JanTrolo_,2021-07-22 19:05:49+00:00
302,1418285439153315840,LAST Day to Order High Nicotine Vape Products - https://t.co/bBqsoFZIlZ,Smokevape_ca,2021-07-22 19:02:53+00:00
303,1418285395511451650,I’m still tryna process in my head the fact that some pregnant lady was vaping at 10 am brooooo wtffff,stephuniie_,2021-07-22 19:02:43+00:00
304,1418285373533429762,"The Black🖤 EVIO Sries collection!
Which one is your favourite? Comment Below.

⚠️WARNING: This product is intended to be used with e-liquid products containing nicotine. Nicotine is an addictive chemical. For adult(21+) use only.⁠ ⁠
⁠
#vape #pod #Joyetech #innovation https://t.co/8WCqTFBNiJ",JoyetechClub,2021-07-22 19:02:38+00:00
305,1418285283997622275,Our catalogue of Item 9 Labs products includes 75 cannabis strains and 150-+ cannabis vape products and premium concentrates. Our products have earned 8 first place awards and 14 total in Arizona's top cannabis competitions. Pick up your favorites today: https://t.co/1z5RAdpT1Y https://t.co/9qUJ5DwEwY,INLBCorp,2021-07-22 19:02:16+00:00
306,1418285164426366988,"Here are some facts about disposable vapes, often referred to as “puff bars”, that parents and guardians should be aware of:

🔅No laws banning flavored products
🔅Cost significantly less than a regular vape
🔅Easy to buy new ones
🔅Just as harmful as real vapes

#disposablevapes https://t.co/MTelS8frWB",OD_Prevention,2021-07-22 19:01:48+00:00
307,1418285149133975554,"Aspire Will Become the Next Publicly Traded Chinese Vape Company.
By Jim McDonald @whycherrywhy 

https://t.co/OULLdqcWyt",Vaping360,2021-07-22 19:01:44+00:00
308,1418285029600464901,"Here are some facts about disposable vapes, often referred to as “puff bars”, that parents and guardians should be aware of:

🔅No laws banning flavored products
🔅Cost significantly less than a regular vape
🔅Easy to buy new ones
🔅Just as harmful as real vapes

#disposablevapes https://t.co/uuOApW2O9O",whwillpower,2021-07-22 19:01:16+00:00
309,1418284986608783377,"It's Thrifty Thursday! We feature vape pens and batteries today. Stop in and and check out our Medication Station brand! Which color will you choose?
.
.
#vapecbd #vapestagram  #vapeshop #vapesociety #themedicationstation https://t.co/NoCTN5zpAB",MedStations,2021-07-22 19:01:05+00:00
310,1418284916727558149,"WIN the entire Jinx Eliquid Range + Cash Prizes!

https://t.co/0CvdLqMmdz
 @jinxeliquid #vape #vapegiveaway #competition #InItToWinIt #eliquid https://t.co/Dd1ZHlVi56",PVapes,2021-07-22 19:00:49+00:00
311,1418284712154517508,"Need help visualizing and analyzing #survey #data? Check out our case study on #vaping behavior among youths in the United States! #Rstats #datascience 

@JHUDataScience @jhubiostat @stephaniehicks @JagerLeah @StrictlyStat @mirnas22

https://t.co/uqd8oNGEwx",OpenCaseStudies,2021-07-22 19:00:00+00:00
312,1418284627911868417,My vape has been such a good girl today looking for suggestions on how to reward her,YearnOoS,2021-07-22 18:59:40+00:00
313,1418284027740569604,"Also, Day 3 of no vaping… I want to pull my GD hair out. 

But yaaay. Go me.",SaamanthaCheyne,2021-07-22 18:57:17+00:00
314,1418283992751689738,".@MassDPH has recently launched its public campaign to educate youth and teenagers about the dangers of vaping, tips to help them talk to friends and ways to quit. 

More information regarding the campaign can be found here: https://t.co/5hFu7qN54j",RepArciero,2021-07-22 18:57:08+00:00
315,1418283815609438215,"“This needs to get passed to ensure millions of Filipino smokers continue to have access to safer nicotine products""

Right on! (It's ok to change your mind and policies when you learn the truth about vaping)

https://t.co/04NefBlboE",eJuiceMonkeys,2021-07-22 18:56:26+00:00
316,1418283752590086149,"So fluffy fluff fluff trigger warning for smoking ig? 

Izuku has been trying to give up smoking for years. He's tried gum, lozenges, patches, medication, vapes. Everything. But nothing worked. He's just go right back to smoking those expensive, dangerous little tobacco sticks.",haylesley1,2021-07-22 18:56:11+00:00
317,1418283468379750402,bein only girl my age in the airport rlly does somethin to my confidence,gi_juul,2021-07-22 18:55:03+00:00
318,1418283156839428098,Im blessed to have my vape device now😭,Thirst4DFather,2021-07-22 18:53:49+00:00
319,1418283004720340995,Just lost my vape I could cry 😭,_ItsCookie,2021-07-22 18:53:13+00:00
320,1418282961665941506,I’d give my left nut to get to hit a cucumber juul pod again.,mattsullie9,2021-07-22 18:53:03+00:00
321,1418282710531981313,"""It’s up to everyone to work together as a community to stop the youngest members of our population from starting or continually using vaping products""
https://t.co/Wej9JpJxoX",ThePrevCouncil,2021-07-22 18:52:03+00:00
322,1418282663824199682,"tw drug use / underage drug use
the gloomy bear vape ..... https://t.co/8JQEoggeap",kandipaws,2021-07-22 18:51:52+00:00
323,1418282180250279938,the only thing stopping me from vaping at work is that i left it at home today,jerseymikestuna,2021-07-22 18:49:56+00:00
324,1418281864637341696,"can of red bull by the bed
vape is charged and snapchat's read",bot_wilbur,2021-07-22 18:48:41+00:00
325,1418281719648727040,Guess im making tomato pie today 😋,vape_nap,2021-07-22 18:48:07+00:00
326,1418281434372997123,mans said “you can only vape with me so when you don’t see me you’ll have withdrawals”😭,misosoupshi,2021-07-22 18:46:59+00:00
327,1418280963772014592,"Petition for Momota-chan to stop fucking vaping at breakfast, I'm trying to eat eggs but I'm trapped in a Berry Blast Vape Cloud",botkichiouma,2021-07-22 18:45:06+00:00
328,1418280718963257347,I need a juul. Can anyone help?,Penny03336931,2021-07-22 18:44:08+00:00
329,1418280554588483584,(ASMR) Vape Unboxing AND Surgery RP,TitlesASMR,2021-07-22 18:43:29+00:00
330,1418280402695905280,"VapeOnly Aura AIO Starter Kit 2000mAh Clearance
Powered by 2000mAh inbuilt battery and 2ml e-juice tank, the Aura is a pen-style starter kit. It brings powerful and easy vaping for you! 
#auraaio #ecigs #naijavapers https://t.co/Yb3MgOhGrl",420cultureng,2021-07-22 18:42:53+00:00
331,1418279904416870409,Here’s an idea. Caffeine vape pen. If they exist I need one,bigdaddyAshley,2021-07-22 18:40:54+00:00
332,1418279902684536834,Stop smoking em damn vapes yal gon be slapped in 20 years,Family5EVER,2021-07-22 18:40:53+00:00
333,1418279794215641093,"Reply to be added on a gc
Rt",Vaper_999,2021-07-22 18:40:27+00:00
334,1418279750964072450,remembering how i vaped with my friend inside our classroom and we used a blanket to blow away the smoke. never got caught omg,appIecidxr,2021-07-22 18:40:17+00:00
335,1418279656004874243,i miss when ppl would vape around me... now i never get to smell artificial melon or cotton candy scent breathed out of someone's mouth,trashcar2,2021-07-22 18:39:55+00:00
336,1418279037131231233,"Lol, auto correct, why do you try and change vapes to Vanessa? This makes no sense",haylesley1,2021-07-22 18:37:27+00:00
337,1418279000372305920,"All I do is lose my vape, listen to true crime, and lie",deadlyfxn,2021-07-22 18:37:18+00:00
338,1418278670142148610,"Burn Vapes are leading brand of E Cigarette Supplies such as E-liquid, E-Cigarettes, E-cig Mods, Micro-USB Chargers, RBA, E-cig Accessories, Oil, CBD Oil, CBD Oil Cartridges, Loose Leaf Vapor, Vaping Accessories, and more. We are looking forward to being partner with them in this https://t.co/wruikhmosO",teamgirgit,2021-07-22 18:35:59+00:00
339,1418278433117847553,"Healthy youth is our goal, but that does not mean curiosity stops. Curious about smoking and vaping?🤔 Did you know there is a first person game all about this topic and healthy teen choices?👀👐 Check it out here: Google https://t.co/IeylEv4OLd or Apple https://t.co/Rqamd6EJ2F https://t.co/JYEpMuiBko",WahlukeCC,2021-07-22 18:35:03+00:00
340,1418278085913309187,dragons vape,lilith_en,2021-07-22 18:33:40+00:00
341,1418277826235539464,hey guys i vape,finley_ebooks,2021-07-22 18:32:38+00:00
342,1418277483397271556,My latest from @standardex as  Ogden and Provo school districts join a class action lawsuit against Juul https://t.co/CqrmWbuouC,harrisonepstein,2021-07-22 18:31:17+00:00
343,1418277169101369344,Dreamt a ghost was haunting me by my every exhale was a full vape cloud,minkmarble,2021-07-22 18:30:02+00:00
344,1418277162335936512,The #nicotine in #vapes is dangerous for young people. Our latest education campaign “Facts. No Filters.” shares the real dangers of #vaping and connects youth with the resources to #quit. Learn more at https://t.co/x4OJN4BECG https://t.co/K2kZZIhlyG,MassDPH,2021-07-22 18:30:00+00:00
345,1418276796752011264,Yesterday was the 3 weeks mark of me quitting vaping! I’ve gotten past the hardest part and I know I can keep going. I have people around me that encourage me and are happy to see me better myself. I tried to quit a while ago but I couldn’t do it but I’m here now pushing forward!,KingNuggV,2021-07-22 18:28:33+00:00
346,1418276694469787648,Fuck it haha let's call it vape nine eleven. I don't even fucking care haha. Vape nine eleven that's objectively funny https://t.co/RYs8zdT44E,Brandochard,2021-07-22 18:28:08+00:00
347,1418276692938919940,Legacy Cannabis Vape Brand The Clear™ Rises Above the Competition With Five First-Place Wins in Different States https://t.co/eoaCesvbm7,cannabislawrpt1,2021-07-22 18:28:08+00:00
348,1418276534251577355,Approaching 24 hours without caffeine i vaped a helluva Lotta indica so im on another planet atm,AndreaRovenski,2021-07-22 18:27:30+00:00
349,1418276518564966404,I have a smoll lil cold and the way my heart DROPPED bc I couldn’t taste my juul .. then I realized it’s just dead lahdmakfjskdjdjs,enby_hoops,2021-07-22 18:27:26+00:00
350,1418276487858475008,Just posted a photo @ Vapetek https://t.co/7ObsFpigbZ,Vape_Tek,2021-07-22 18:27:19+00:00
351,1418276418602024966,Give Battery Mooch a sub on YouTube - he regularly tests Vape batteries whilst also diving into more complex power technology - view his blogs for battery recommendations to keep you safe!  https://t.co/J8tA8z21rz #BatteryMooch #Vaping #Mooch #BatterySafety #Ecigclick https://t.co/jiICwKIYrG,EcigClick,2021-07-22 18:27:03+00:00
352,1418276175546249216,sometimes i wonder why i felt like i didn’t learn anything in school then i find pics i took of my teachers sleeping in class and vaping w the students and i think i get it,hemloxk,2021-07-22 18:26:05+00:00
353,1418275837263163392,sometimes i remember that niall horan juuls. stars…they’re just like us.,LexiSpera,2021-07-22 18:24:44+00:00
354,1418275726407524352,Vape nation reading the news that nicotine might fight corona https://t.co/Eu9ZHxnD89 https://t.co/5e6b0kgrZ9,TroyHermo,2021-07-22 18:24:18+00:00
355,1418275667280531459,Omfg pls 🙏 https://t.co/nse8bFiaOb,Juuls_WRLD,2021-07-22 18:24:04+00:00
356,1418275439945162753,"Thx to @nysscpa for honoring @Hearst TV National Investigative Unit’s 3-part series, “Sucked In: America’s Vaping Epidemic,” with its 2021 Excellence in Financial Journalism Award:
•Pt 1: https://t.co/MMYJ9yvrFv
•Pt 2: https://t.co/AQlSnPRt9o
•Pt 3: https://t.co/YkFEcR1YdK https://t.co/yxAN2E2QyK",malbertnews,2021-07-22 18:23:09+00:00
357,1418275432714014720,Is it just me or like... don’t you guys think all the ads and programs for people to quit smoking and vaping just make it psychologically harder for people to quit bc it’s shoved in their faces how hard it’s going to be to quit????,GabrielaaaRose,2021-07-22 18:23:08+00:00
358,1418275313155461120,Just posted a photo @ Vapetek https://t.co/RJbgsKfE80,Vape_Tek,2021-07-22 18:22:39+00:00
359,1418275216900247554,"Banning flavored tobacco, huge win. I’m sorry, I love Backwoods/Newport’s/Juul as much as the next man but take that shit off the shelves or at least take it out of my neighborhood.",StevenAskme,2021-07-22 18:22:16+00:00
360,1418275106741178370,Day 8 no nicotine/no vaping.,vapingwaifus1,2021-07-22 18:21:50+00:00
361,1418275032279789575,I’m Tryna get a gweneth Paltrow flavour vape,NeoPelagianLuca,2021-07-22 18:21:32+00:00
362,1418274885315538950,"Remember when less than 100 deaths sounded the alarm over vaping products in 2019? 
Where TF was the CDC in the early 2000s raising the alarm on FDA-approved prescription opioid deaths. 
These are persons aged 15 to 24. https://t.co/5k1l2d1I0M",lmstroud89,2021-07-22 18:20:57+00:00
363,1418274831339081734,"Classic cola taste? ✅
Luscious ice cream made from deluxe vanilla beans?✅
A hint of fresh mint?✅
Try our delicious Bamboo Cola Float and find out what everyone is raving about!

Get yours by going to https://t.co/4aBCXdhrDn

#KingKongVapeJuice #Vape #VapeUK #VapeJuice #Eliquid https://t.co/epTmRJTitO",Kingkongvapeuk,2021-07-22 18:20:44+00:00
364,1418274804445102088,I think there’s something interesting about the rebranding of tobacco from cigarettes to hookah and vapes. Most people hate cigarettes while the latter are more socially accepted.,brandonlyfe_,2021-07-22 18:20:38+00:00
365,1418274763747774466,I literally *just* had my vape where the FUCK did it go????,lexxvapor,2021-07-22 18:20:28+00:00
366,1418274321726808065,"Some generations will loose their rights to #vape 💨

#vapenews #vaping #nicotine 
https://t.co/YkgMnmiXh6",O2vape,2021-07-22 18:18:43+00:00
367,1418274299870330888,i wanna get a juul just to match nialls,mlbrrrrr,2021-07-22 18:18:38+00:00
368,1418274179783213061,Finally invested in a cbd vape pen. Highly recommend.,dominicanyellow,2021-07-22 18:18:09+00:00
369,1418273811711946753,"I remember when flavored vape hurt some kids and they got rid of them in a minute!!!

Yet TFG thought this virus was not as bad as flavored vape juice? 

Think about that.",aconcdamerican,2021-07-22 18:16:41+00:00
370,1418273367161978882,Is Vaping Without Nicotine Good for Anxiety? https://t.co/ZemJ19F7eM,KellyClanton3,2021-07-22 18:14:55+00:00
371,1418273224433954816,Is Vaping Without Nicotine Good for Anxiety? https://t.co/LjwOK9duof,wholesomealive,2021-07-22 18:14:21+00:00
372,1418273224098385920,I have customers that drive from Pasadena to buy vapes off me 😤😤 my service and prices are unmatched ! I’ll fuck up the game before I lose a sale,shefmayo,2021-07-22 18:14:21+00:00
373,1418273134831050753,"We just click 😉 EVRI’s magnetic battery makes it a breeze to change up your vaping vibe 🔥

https://t.co/HLpDkaHX3h

📸 @okokcreative x @ladiesoparadise https://t.co/ucfgrKR79z",dipdevices,2021-07-22 18:14:00+00:00
374,1418272713236369413,"You walk around with a Juul in your hand, I walk around with a chapstick in mine. We are not the same",audreyyy24,2021-07-22 18:12:19+00:00
375,1418272246460600325,Yawa I didn't realize I ran out of cigarette and vape juice and now i can't destress from work haha.,delacruz_denmer,2021-07-22 18:10:28+00:00
376,1418272081427505158,#vaping my fav wire 32ga over 26 stainless steel https://t.co/LuA519thWD,MinisterOfVape,2021-07-22 18:09:49+00:00
377,1418271875235463174,"For your safety and comfort, this station operates a no vaping policy. Be vigilant, citizens.",traindroid_se,2021-07-22 18:08:59+00:00
378,1418271862027694087,"If I had a nickel for how many doctors and normal people tried to get me to take this medication because 'it's healthier than smoking or vaping', I'd have at least a dollar, and cancer

Ask me why I don't trust the COVID19 Vaccine https://t.co/TbUfoY7yQD",beccaleeeeeee,2021-07-22 18:08:56+00:00
379,1418271638680911872,"that juul light is bright, but you don't complain when you can check the battery under bright conditions",ZoloftBIob,2021-07-22 18:08:03+00:00
380,1418271591297921025,McDonald's fries flavored vape wya,BABIP_God,2021-07-22 18:07:52+00:00
381,1418271373487525890,"Bruh, these women be holding up our meeting to talk about their vaping problems. &gt;_&gt;",_JojoStar,2021-07-22 18:07:00+00:00
382,1418271047338577928,"Little 👀 at Purple Punch Mints #11 from @JoiBotanicals off @Shelter_Market 

Nice nose. Super fresh. Looks outstanding. Came with a boost (🙌🏻👏🏻) even if it wasn’t needed. I get lots of vanilla nose on this. Almost reminds me of a McDonald’s milk shake 🤤. Shall vape some now https://t.co/7I2ObFozAq",420investing,2021-07-22 18:05:42+00:00
383,1418271011477368835,The fact that THE Niall Horan hits a JUUL is astounding and so funny,livistireddd,2021-07-22 18:05:33+00:00
384,1418269949634678792,"Quick facts to help everyone enjoy our parks, beaches and boat launches!
🚗 Please follow posted signage for parking 
🚭 No smoking/vaping
🗑️ Garbage cans for park patrons only 
🍔 Dispose of cooking ashes in containers provided 
Questions or concerns: https://t.co/3F8WZ5bmCT https://t.co/mVeRGX5IAV",LakeofBaysTwp,2021-07-22 18:01:20+00:00
385,1418269932396195841,"EFJ Awards has recognized the best business and financial reporting. Today we celebrate the Best Video: “Sucked In: America’s Vaping Epidemic” by @malbertnews, April C., @hyojungpink, Travis Sherwin, and Tyler Robinson of @HearstTV. Watch the video:
 https://t.co/wXvX2OVNWY https://t.co/BSUixPaPJm",nysscpa,2021-07-22 18:01:16+00:00
386,1418269807808552961,"Parliament have discussed the benefits of #Vaping 🙌

Vaping took centre stage on the 10th of June as MP's discussed the upcoming Tobacco Control Plan.

🗞️ Read and find out more: https://t.co/xxBWOhDpdj

#VapeNews #Ecigarettes https://t.co/J4Z1PDbvrw",EvapoHub,2021-07-22 18:00:47+00:00
387,1418269774715383809,No YOU did Pilates with your vape snuggling your titty and then bought the matching camo Lulu bra as a treat,airheadjessi,2021-07-22 18:00:39+00:00
388,1418269769560731648,"We got to try the awesome new shortfill range from #Jinx and also got to find out if we are Blessed or Cursed along the way!

https://t.co/iQHUMaf45B #vape #vapereview #eliquid #shortfills #flavour #vapefam #vapelife #alldayvape https://t.co/eko5qXP2KS",PVapes,2021-07-22 18:00:37+00:00
389,1418269522121789442,I stopped vaping and i crave it 😩,itsdizzlebitch,2021-07-22 17:59:38+00:00
390,1418269262494511104,they should have made the vaccine in vape form,germdanny,2021-07-22 17:58:37+00:00
391,1418269167812186114,Damn I really forgot my vape and wax pen at home,OffMescaline,2021-07-22 17:58:14+00:00
392,1418268832569954308,Want to quit smoking without commiting to a mod or nic salt device? Try our various disposables! They are a great introduction to the world of vaping! https://t.co/nn7tzv3efH,VaporCabin,2021-07-22 17:56:54+00:00
393,1418268802404474880,"Wonder if we might get @Boris_Jordan @Bkov9 @rivers_kim @CharlesBachtell to provide some thoughts or guidance on this topic. Do their vape carts contain phytol? If so, what amount? Do they anticipate scrutiny from @US_FDA? Transparency would be fantastic on this from any/all. 👊 https://t.co/HdiRYPk0mL",vision_cannabis,2021-07-22 17:56:47+00:00
394,1418268322957697024,"All Platinum cartridges contain only pure distilled cannabis oil (THC and CBD extracts) and terpenes from all-natural plant material. They do not contain any cutting or thickening agents.

When FDA comes after phytol, who will be the winner?

Platinum Vapes!

Go Team $RWBYF",BuuugJooon,2021-07-22 17:54:53+00:00
395,1418268278108135427,"CBD Oil UK Although CBD Oil itself, may not be used for vaping due to the very small potential risk of lipoid pneumonia it poses, customers still use them as a food additive or on its own in pure form.
https://t.co/qJucIuccNk
#cbdoil #uk #UnitedKingdom",vapesandcbd,2021-07-22 17:54:42+00:00
396,1418268086688387082,"Quitting #vapes can be hard. You don’t have to go it alone. My Life, My Quit has youth coach specialists trained to help. Call 855-891-9989 or text “Start My Quit” to 36072 for free and confidential help. Check out our campaign “Facts. No Filters.” at https://t.co/4TbiuTHS6K https://t.co/Sslo5miRuF",Mass_Consumer,2021-07-22 17:53:56+00:00
