,TweetID,TweetContent,TweeterUsername,TweetDatetime
1650,623134492279074817,Hey guys Cuttwoods is in da house #cuttwoodculture #vapers #vaping #vape #ejuice #eliquid #mod… https://t.co/c61TnsmDqN,SmokelessP,2015-07-20 14:16:54+00:00
1651,623134450931658752,Vape Jazz Saturday http://t.co/f7KiJA7G81,annamaejuice,2015-07-20 14:16:45+00:00
1652,623134434791923713,It's a vape and Netflix kind of day,GGlenford,2015-07-20 14:16:41+00:00
1653,623134284874805251,Kool Breath is an Irish company offering 40/60 blended Premium E Liquids http://t.co/HlgR5RxZA1 #eliquid #vaping http://t.co/7y08ufGfA9,Kool_Breath,2015-07-20 14:16:05+00:00
1654,623134282664513540,"Cuttwood Sauce
Now available only through the Juice Club
Looking for a reason to sign up?
Come try in store &amp;... http://t.co/b44V8i65RM",jc_vape,2015-07-20 14:16:04+00:00
1655,623134255841955840,"RT @LS_Health: Remember this July: tobacco is tobacco, no matter if it's smoked, chewed or vaped. It still injures and kills.",LS_Parenting,2015-07-20 14:15:58+00:00
1656,623134213714243586,vaping is a hobby,aripfredo,2015-07-20 14:15:48+00:00
1657,623134184471527424,vape tetap vape . we cant stop,denesour,2015-07-20 14:15:41+00:00
1658,623134081937620994,Win a Whiteout Evolv DNA200 Box Mod! #vaporjoes #vapingunderground #vaping http://t.co/KmjEK58MNI,Gotti_jo,2015-07-20 14:15:17+00:00
1659,623134042175709184,"#Vaping Granny has created some
#Vape Charms for you to #Vape Happy
http://t.co/tycm84dcI9 http://t.co/6Sf5xkvDQj",RealDonnaDeVane,2015-07-20 14:15:07+00:00
1660,623134037679439872,"#VAping Granny can help U Grow UR #Vape Biz as Ur Brand Ambassador!

http://t.co/gzwvSTNkD0 http://t.co/9xjSTMlEce",RealDonnaDeVane,2015-07-20 14:15:06+00:00
1661,623133826030567425,Most of my friends in puchong vape. While i just smoke haha there's pros and cons for both.,AliMan38,2015-07-20 14:14:16+00:00
1662,623133755704606720,Vape shops’ future is hazy.... http://t.co/3Gnzzysqpq,motac,2015-07-20 14:13:59+00:00
1663,623133358348898306,Win a Whiteout Evolv DNA200 Box Mod! #vaporjoes #vapingunderground #vaping http://t.co/64azxpUEn0,embem219,2015-07-20 14:12:24+00:00
1664,623133224613609472,"Guy who has given up the ""vape life"" can't resist his urges (Vine by Justin J Russo) https://t.co/hFZQMd5UWO",_____1225m,2015-07-20 14:11:52+00:00
1665,623133129855893508,Lovin' my new vape set up. Cloupor Mini 30watts with a matching Kanger Subtank Mini sitting on top of… https://t.co/96oHbLPJ4z,micococrunch18,2015-07-20 14:11:30+00:00
1666,623132979712368641,Vapongkoq hang (@ Bundle Vape Cafe) https://t.co/nCJDvhIYHP,ila_cokobies,2015-07-20 14:10:54+00:00
1667,623132956912168960,"#cdnpoli Vapers deserve to be angry, they are under attack.  http://t.co/7X3nYet6Cl",OhCanadaLady,2015-07-20 14:10:48+00:00
1668,623132830592319488,Advanced Vape Tricks: Force field &amp; Atomic bomb http://t.co/xIe803MQVd via YouTube http://t.co/cthKPLZWaT,VaporMax_,2015-07-20 14:10:18+00:00
1669,623132663738671104,RT RFKidFella: #Vape Like A BOSS http://t.co/zbcnJl2xJa; #Atmos,vapemerch,2015-07-20 14:09:38+00:00
1670,623132452299517953,Win a SX Mini M Class mod from http://t.co/SjxHYgCLo2 - http://t.co/rVu7uVXrVr #ecig #Vape,embem219,2015-07-20 14:08:48+00:00
1671,623132221579395076,So many damn vape heads now😂😂,ImDebo7,2015-07-20 14:07:53+00:00
1672,623132212171571200,that relatable moment when you decide you want to grab your friend's vape cloud 😊... (Vine by @chrismelberger) https://t.co/S1esChakbe,eightlove1225,2015-07-20 14:07:51+00:00
1673,623131878191702016,i wonder if i can vape in here,BenTweetsShit,2015-07-20 14:06:31+00:00
1674,623131826324963328,me and my dad saw some guys car smoking uncontrollably and we thought it was gonna explode but turns out he was just vaping out the window,ineedsommilk,2015-07-20 14:06:19+00:00
1675,623131616848793600,Love it when your parents vape. Cause then you can just mooch of their shit 😂😂,UzeaXBL,2015-07-20 14:05:29+00:00
1676,623131611702296577,There was some asshole dude vaping around the dogs yesterday,sraymonds,2015-07-20 14:05:28+00:00
1677,623131593645948928,"""Vape shops’ future is hazy: Owners fear there could be new federal regulations coming down the pipe - Health &amp; Me… http://t.co/VAG2J0tct6",nebtobaccofree,2015-07-20 14:05:23+00:00
1678,623131579020238848,My beloved laptop and vape I missed you guys but mostly dota,undergroundwxlf,2015-07-20 14:05:20+00:00
1679,623131486712152064,I'm at Awan Vape https://t.co/2MnyfLGah5,PeroduabyHasif,2015-07-20 14:04:58+00:00
1680,623131423826923520,I'm at Vape Colony https://t.co/aB2TvDwBjE,ZechSD,2015-07-20 14:04:43+00:00
1681,623131379891449856,Win a SX Mini M Class mod from http://t.co/dbRtlKIPVJ - http://t.co/8dWGfOLyCB #ecig #Vape,Alexh75,2015-07-20 14:04:32+00:00
1682,623131188815896576,Found a bottle of some kind of vaping liquid,TwistedRose_xo,2015-07-20 14:03:47+00:00
1683,623131130552692736,Win a SX Mini M Class mod from http://t.co/4fLrYbzWIy - http://t.co/TqXB6BJLHI #ecig #Vape,liamsvapes,2015-07-20 14:03:33+00:00
1684,623131008372707328,"Get Your FREE Bottle Of E-Juice Today!!

➡ http://t.co/NUAlEnzTUW  

#ecigs #ejuice #quitsmoking #vapour #vaping #vape",OurTravelTweet,2015-07-20 14:03:04+00:00
1685,623131002857074688,That Swoop Mod from @AllAboutVapor is on point. #vaping #ecig #vapelife #boxmod #swoop http://t.co/m4GVWsVtc3,AllAboutVapor,2015-07-20 14:03:02+00:00
1686,623130991851372544,I'm at Pontian Vape House https://t.co/Jxc7PsyBGi,AzmanIbrahim_,2015-07-20 14:03:00+00:00
1687,623130842601275392,"Our new flavour of the week is: Britania by fuu.
A classic combination of chocolate and mint. #Vape #Theevapeorium http://t.co/36lIQ0ybG5",Theevapeorium,2015-07-20 14:02:24+00:00
1688,623130685881061376,"RT @LS_Health: Remember this July: tobacco is tobacco, no matter if it's smoked, chewed or vaped. It still injures and kills.",ContactCard,2015-07-20 14:01:47+00:00
1689,623130665484177408,V-Style Vaporizer - 10 E-Liquids Spare Battery &amp; Tank = 4 E-Liquids Free!! http://t.co/PWNYuugsBL #ecig #vape http://t.co/XfXoypVWZP,SMOKO_E_CIG,2015-07-20 14:01:42+00:00
1690,623130646299303936,New on SKVW: Vape Store Survey Results [Infographic] http://t.co/KWJ4JNplbo #vapecommunity,SteveVape,2015-07-20 14:01:37+00:00
1691,623130451650191360,Start earning #vape #vaping #makemoney http://t.co/dFMQG4Hwl0,esheeshecigs,2015-07-20 14:00:51+00:00
1692,623130450626768896,"Great product, support and potential #vape #vaping #makemoney http://t.co/iDXajtalGk",Esheeshuk,2015-07-20 14:00:51+00:00
1693,623130448928075776,Join hundreds of others #vape #vaping #makemoney http://t.co/QOqVHEaK23,esheeshvaping,2015-07-20 14:00:50+00:00
1694,623130381705809920,"RT @LS_Health: Remind patients this July: tobacco is tobacco, no matter if it's smoked, chewed or vaped. It still injures and kills.",LS_Medical,2015-07-20 14:00:34+00:00
1695,623130302848761856,Vape on,zieraaLee,2015-07-20 14:00:16+00:00
1696,623130279679520768,I don't give a frick if vaping is taking over my life !. I need to get out of this house ASAP,coolgurl666,2015-07-20 14:00:10+00:00
1697,623130273526489088,Who have you helped make the switch? #vaping,vapingproducts,2015-07-20 14:00:09+00:00
1698,623130249715392512,How do you make your Monday magic? http://t.co/q85BhfFFzH,P_Vaper,2015-07-20 14:00:03+00:00
1699,623130246011875329,"#Vape Biz #Ejuice #Success
#Vaping Granny
Brand Ambassador
http://t.co/6YW1KE6e3r http://t.co/zOPvFmlu2Y",RealDonnaDeVane,2015-07-20 14:00:02+00:00
1700,623130143947661313,Navi's Vape Lounge- The Long Dark (PC) (!vapelounge !vapeinfo !vapelist for FAQ) #TeamDreams2Reality: http://t.co/qP56yGcAy2,navithesquirrel,2015-07-20 13:59:38+00:00
1701,623129835624337409,"GOD WILL TAKE CARE OF YOU, -
EVEN IF YOU DIE.
              FOR GOD IS LOVE

http://t.co/bTkMlxcwLf",j_juul,2015-07-20 13:58:24+00:00
1702,623129769794740224,Reserve a #eVicVT or #SnowWolf200W  now at http://t.co/7dzhKmmRc8 &amp; use code TC720 to save $15 EXP 7/20 #vape #sale http://t.co/dh3FTx9OlU,VapeStreetSC,2015-07-20 13:58:08+00:00
1703,623129581516537857,Why do we keep the connection of vaping and tobacco alive by referring to vapes as e-cigarettes? http://t.co/F0LvI72wgz #vape #ecigs #reddit,ukvaper,2015-07-20 13:57:24+00:00
1704,623129580589559808,The Daily Vape Pics Thread [2015-07-20] http://t.co/WcoIZxd6mV #vape #ecigs #reddit,ukvaper,2015-07-20 13:57:23+00:00
1705,623129579444506624,Has anyone flown with a kayfun 4? http://t.co/VAzaP9chV5 #vape #ecigs #reddit,ukvaper,2015-07-20 13:57:23+00:00
1706,623129538705391616,"SMKD 620 Tank £9.99
Dual Vertical Organic Cotton coils
Adj. Airflow, wide bore tip
#New #Vape #ecig #vapelife #vapeon http://t.co/prazB3VHKZ",SMKD_Official,2015-07-20 13:57:13+00:00
1707,623129389530775552,that relatable moment when you decide you want to grab your friend's vape cloud http://t.co/UD8RVKGlPv,DiffStrokesKW,2015-07-20 13:56:38+00:00
1708,623129361584029700,Win a SX Mini M Class mod from http://t.co/1G38lL0fnE - http://t.co/MHTZadx19o #ecig #Vape,DustinBurns9,2015-07-20 13:56:31+00:00
1709,623129312103788544,My first coil http://t.co/Hzh4RyMP90 #ecig #vape #POTV,ukvaper,2015-07-20 13:56:19+00:00
1710,623129311122337792,TODD signs out... No more reviews... http://t.co/onCjLILVkf #ecig #vape #POTV,ukvaper,2015-07-20 13:56:19+00:00
1711,623129152284151808,There's a 10 year old vaping at the metro,rancecar,2015-07-20 13:55:41+00:00
1712,623128920628441088,Win a Whiteout Evolv DNA200 Box Mod! #vaporjoes #vapingunderground #vaping http://t.co/PmeqeivNrW,Alexh75,2015-07-20 13:54:46+00:00
1713,623128872779939841,What is your Monday vape?    https://t.co/D9RLSXXqqd #ecig,ecigitesztek,2015-07-20 13:54:35+00:00
1714,623128661172973569,Vape Boss Deals: $42.90 Original Cloupor GT 80W Temperature Control... http://t.co/Qt3k0epoYE,InfusionEjuice,2015-07-20 13:53:44+00:00
1715,623128655850549248,RT Spinfuel_News: E-cigarettes As A Quitting Tool http://t.co/sMAbXzKMmf #Spinfuel #Vape #Vaping #ecig #ecigs #vapelife #Vapersnews,vapemerch,2015-07-20 13:53:43+00:00
1716,623128654395109376,"RT Vape_Vacations: Vaping Convention: Its October 23rd and 24th At the Joplin Convention and Trade Center in Joplin, MO. Check it out midco…",vapemerch,2015-07-20 13:53:43+00:00
1717,623128421107810304,Vape on http://t.co/m36esH7t5v,dhausazhan,2015-07-20 13:52:47+00:00
1718,623128383354859520,Win a Whiteout Evolv DNA200 Box Mod! #vaporjoes #vapingunderground #vaping http://t.co/zqeYIpUiOW,bradandbradley,2015-07-20 13:52:38+00:00
1719,623128250643009536,The New Stratus Dry Herb Vaporizer!  Dial it to 430°F!!  http://t.co/F6vdGQOS5z #ecig #ecigs #vape #vapeporn http://t.co/2ivDEpBxjd,Spacedit29,2015-07-20 13:52:06+00:00
1720,623128058355036160,Wake up &amp; vape some shatter cause it's Monday,TrueHoopersHoop,2015-07-20 13:51:20+00:00
1721,623128052453617665,Win a SX Mini M Class mod from http://t.co/METNquxjRx - http://t.co/w259yyutOe #ecig #Vape,DLyonsRoar,2015-07-20 13:51:19+00:00
1722,623127991795630080,The vampire #vaper http://t.co/Fyxr3sgvO6 has got the #vaping style! Good on you :) http://t.co/sUsz5fSbLi,vapingproducts,2015-07-20 13:51:05+00:00
1723,623127916444954624,What is your Monday vape? #vaping #ecig #whatareyouvapingon,AllAboutVapor,2015-07-20 13:50:47+00:00
1724,623127774400782336,"that relatable moment when you decide you want to grab your friend's vape cloud :D
By: Chris Melberger http://t.co/9MH9WF9ABX",CleverVines,2015-07-20 13:50:13+00:00
1725,623127486814031872,E-cigarettes As A Quitting Tool http://t.co/Vo8cuy6XzC #Spinfuel #Vape #Vaping #ecig #ecigs #vapelife #Vapersnews,Spinfuel_News,2015-07-20 13:49:04+00:00
1726,623127478769311744,"Vaping Convention: Its October 23rd and 24th At the Joplin Convention and Trade Center in Joplin, MO. Check it out @midconvapecon #vape",Soruze_,2015-07-20 13:49:02+00:00
1727,623127337790517248,Actual study (very long read) on Toxicity of Vape (Electronic Cigarette) smoke. Actual tit… http://t.co/Q9t3hiJNHf http://t.co/XcmELsCzdp,levoneW1,2015-07-20 13:48:29+00:00
1728,623127159218024448,"Actual study (very long read) on Toxicity of Vape (Electronic Cigarette) smoke. Actual title ""Development of an in… http://t.co/nj7AdONBHk",matteorossini,2015-07-20 13:47:46+00:00
1729,623127114414342144,"Coil Master Social Team building
#vape #vaping #vapor #vapeon #vapefam #coilmaster http://t.co/yBYRMbF8j0",coilmasternet,2015-07-20 13:47:35+00:00
1730,623126888920313856,Vape on 👴🏻 @ 🔫🔫🚭 https://t.co/hRUCViFgpN,ridzuan___,2015-07-20 13:46:42+00:00
1731,623126471981297664,#Vaping Granny wants to help You See The Future Successful 4 YOUR #Vape Biz! DM me for private Consult! http://t.co/ZW3hJrKd5a,RealDonnaDeVane,2015-07-20 13:45:02+00:00
1732,623126333162295296,Vape Boss Deals: Boss Price Update !! $51.99 In Stock SMOK SMOKTECH... http://t.co/Eyy7I1YRwH,InfusionEjuice,2015-07-20 13:44:29+00:00
1733,623126150324297728,"I only vape the best! 
@phat_clouds 
💨💨💨💨💨

#dopevape #vapeshop #phatclouds #pg #vg #lovetovape… https://t.co/yNeHILWJ4a",tyeknoxmusic,2015-07-20 13:43:46+00:00
1734,623126111216664578,Tell us your quitting stories! #StoryForChange #Vape #ViperCig,ViperCig,2015-07-20 13:43:36+00:00
1735,623125983009329153,Reflecting on the Vaping Voyage http://t.co/2DG1j6KMiF #Vape http://t.co/eVv81wRpTy,CrewJuiceLiquid,2015-07-20 13:43:06+00:00
1736,623125443231637504,Let's vape and stop smoking #vapelife #VapeOn #vapecommunity,GasStationVapes,2015-07-20 13:40:57+00:00
1737,623125384666710017,Join Dawn and @CelticFury2 for Soulful Monday on Coffee and Clouds 10AM EST http://t.co/IKlGc9x7sD #vapenet #vapetv #vapeshow #vape,VAPENETWORK,2015-07-20 13:40:43+00:00
1738,623124854426963968,"Sign a #vaping petition, pat yourself on the back, accomplish nothing.  https://t.co/ZPZDMcUQjn",JackLebeau,2015-07-20 13:38:37+00:00
1739,623124787297153024,Who have you helped make the switch? #vaping #love http://t.co/oawzVR8qJW,vapingproducts,2015-07-20 13:38:21+00:00
1740,623124688525524992,RT VapeGirl2: Herakles V2 -Hydra Tank in stock ! http://t.co/tpS7n9sWQe; #vape #ecigs #vapor #vapers #smoke #sens… http://t.co/aH3kxdtUaL,vapemerch,2015-07-20 13:37:57+00:00
1741,623124658259275777,Smok XCUBE II 160W in stock !  http://t.co/L9vOlTkoKa  #ecigs #vaporizer #vaping #vapeon #gpen #TC #MOD http://t.co/Pd2e13lSPZ,VapeGirl2,2015-07-20 13:37:50+00:00
1742,623124581792874496,Vape On 😀,AmzarAnaqye,2015-07-20 13:37:32+00:00
1743,623124448976080897,"Vape Boss Deals: $12.54  Aspire Triton Tank Coil ( 5pcs ) .3 ohm, .... http://t.co/afGPGxoyP7",InfusionEjuice,2015-07-20 13:37:00+00:00
1744,623124354910547969,#win with @multicig quit #smoking and start #vaping via @AgataPokutycka Full #giveaway T&amp;C at http://t.co/gdfs9grleb #goodluck,Blulu25,2015-07-20 13:36:37+00:00
1745,623123479647399937,Laying in bed hungover hitting the Vape pen and watching the Open #monday,bhunt757,2015-07-20 13:33:09+00:00
1746,623123446650785792,edibles &gt; vape &gt; blunts,shereiqns,2015-07-20 13:33:01+00:00
1747,623123065032056832,"Good morning to all from Dusty ^__^ 

Considering trying vaping as an alternative to smoking, but not crazy about... http://t.co/DgQnb47a6a",CigaretShopper,2015-07-20 13:31:30+00:00
1748,623123030584238080,"Currently vaping on @thehatchery_eu Fire Opal.  It's bloody delicious, not sure how long this 15ml will last me. http://t.co/SyWwLiwI6G",Junior_Amazon,2015-07-20 13:31:22+00:00
1749,623123002297745409,why tf ms ida asking about vape and all😂,_amirul08,2015-07-20 13:31:15+00:00
1750,623122776371654656,"I liked a @YouTube video http://t.co/k88tFV8Wbv Vape Trick Tutorial with Kanakis (Os, Cheerios, Ghosts, and Dragons)",morriscodemedia,2015-07-20 13:30:21+00:00
1751,623122697128685568,vape bicycle,vapeeverything,2015-07-20 13:30:02+00:00
1752,623122307964370944,Almost out of my big jug of thick vanilla custard from @steamjuice  #TheStruggleIsReal #GirlsWhoVape #vape  #VapeOn http://t.co/i1PLtob58E,CuteChickenChic,2015-07-20 13:28:29+00:00
1753,623122132910747652,vaping is very cool and fun,_fethers,2015-07-20 13:27:48+00:00
1754,623122035611430912,Who has a battery charger for a vape,philpot_brandon,2015-07-20 13:27:24+00:00
1755,623121792526368768,Firebox 50W Squonker from http://t.co/vrHSdyQyHA 😎 💨 ☁ #vape #vapeporn #vapelyfe #vapefam #subohm… https://t.co/0oSnrijyiC,pauly_meatballs,2015-07-20 13:26:27+00:00
1756,623121719612547072,"S/O @VAPEMONOPOLY 4DA FOLLOW! WHILE YOU VAPE CHK ‘remix DRAKE EDITION https://t.co/0KWJZ3oTb6 ALSO DA EXCLUSIVE ""GET UP"" FT #KOKANE #11",atherican,2015-07-20 13:26:09+00:00
1757,623121532043296769,Why We Need To Say Goodbye To Vaping http://t.co/l2EUX2oci2,LeLee_Marie,2015-07-20 13:25:24+00:00
1758,623121359607046144,Gotta love the #ribbon wrapped #fusedclapton #vapefam #nofuckwits #knuckleheadvapes #vapelife #vape… https://t.co/YjZB44LS9o,RalfysReviews,2015-07-20 13:24:43+00:00
1759,623121247317000192,"Tina: brooke have a cigarette with me.
Me: im low ill just vape.
(I now see where I went wrong)",brookebreakdown,2015-07-20 13:24:17+00:00
1760,623121061069107200,"FLASH SALE 15% OFF Ruthless &amp; Element Eliquids

http://t.co/XZH7pbYpwF

#ecig #ejuice #vape #vapers #vapeporn http://t.co/mePASI2xKb",esauceuk,2015-07-20 13:23:32+00:00
1761,623121043398328321,"FLASH SALE 15% OFF Ruthless &amp; Element Eliquids

http://t.co/XZH7pbGO85

#ecig #ejuice #vape #va http://t.co/lqLy9fglNp",esauceuk,2015-07-20 13:23:28+00:00
1762,623121037799108608,I'm not a trendsetter nor a trend follower.. i just do what i feel i want to do.. i vape since 2012… https://t.co/0nv1tURcx7,zulwaya,2015-07-20 13:23:27+00:00
1763,623121021231611904,"Here is a chance to win s free  disrupter box mod. 
#vape #vaping #boxmod #vapeon #innokin... http://t.co/qjC3FTWBwk",CbdVapers,2015-07-20 13:23:23+00:00
1764,623120993716936704,"Coil, Wick, Drip, Vape, Smile! #VapeLife #mondaymotivation http://t.co/kFhp2EcaPL",walkingvaped,2015-07-20 13:23:16+00:00
1765,623120972141457408,Huge welcome to all our new followers! Hope you guys are all vaping hard today! #vapelife #juice #clouds #vapelife #doyouvapethough,thehouseofcloud,2015-07-20 13:23:11+00:00
1766,623120952574918656,"“Cherry berry, light and heady, every hour blooming” #tgib #vape #bloomsdays http://t.co/vFy3ytgN2M",thebloomsdays,2015-07-20 13:23:06+00:00
1767,623120949764722689,New V-Revolution website launching soon! #jointherevolution #vrevolution #vaping #vapelife #ukvapers #vapeshop http://t.co/21FtoppyNq,VRevolution1,2015-07-20 13:23:06+00:00
1768,623120834106933248,"RT LizzyFalls: COILCHECK!! Dual coil, Hellboy RDA, native wicks cotton, .2 ohms. HELL YEA!! #vape #vapeladies… http://t.co/ToGspq1kBf;",vapemerch,2015-07-20 13:22:38+00:00
1769,623120510499602432,"And what?
#nofuckwits #knuckleheadvapes #vapelife #vape #eliquid #becausehandmademeanshandmade… https://t.co/lbUj6GTG9w",RalfysReviews,2015-07-20 13:21:21+00:00
1770,623120455428222976,Win a SX Mini M Class mod from http://t.co/8vNXzH5Lzr - http://t.co/gpD7KDhIrU #ecig #Vape,A_TwiztedDragon,2015-07-20 13:21:08+00:00
1771,623120401007267840,Vape life,eBuuki,2015-07-20 13:20:55+00:00
1772,623120377103912960,http://t.co/1Ki5fy1M3y Get updates from my @tictail: http://t.co/4B6rkqazIW,e_vapers,2015-07-20 13:20:49+00:00
1773,623120319918673921,This article will help you all find your first Vape! #Vape #HappyHabits #GigglesGlass #VapeCraze #VapeTricks... http://t.co/XB9FBkVd7x,GigglesGlass,2015-07-20 13:20:35+00:00
1774,623120305498779648,This article will help you all find your first Vape! #Vape #HappyHabits #GigglesGlass #VapeCraze #VapeTricks  http://t.co/V4Q7gtinsN,ShopHappyHabits,2015-07-20 13:20:32+00:00
1775,623120285114462208,that relatable moment when you decide you want to grab your friend's vape cloud 😊... (Vine by @chrismelberger) https://t.co/nj07BggfpI,DanishBrown,2015-07-20 13:20:27+00:00
1776,623120071255158785,"KILL　YOU…
#短い文章で怖がらせたら勝ち選手権",vaper_trail_,2015-07-20 13:19:36+00:00
1777,623119942351781888,The new vape juice is amazing 😍,adrianaG313,2015-07-20 13:19:05+00:00
1778,623119910026113024,Win a SX Mini M Class mod from http://t.co/cE9vmWrs5R - http://t.co/ih42nJNPSd #ecig #Vape,mekakeisei,2015-07-20 13:18:58+00:00
1779,623119867684777984,"Element Eliquids in Stock! £9.99

http://t.co/XZH7pbYpwF

#ecig #ejuice #vape #vapers #vapeporn  #esauceuk http://t.co/y0wubLq4EY",esauceuk,2015-07-20 13:18:48+00:00
1780,623119857114976256,"Element Eliquids in Stock! £9.99

http://t.co/XZH7pbGO85

#ecig #ejuice #vape #vapers #� http://t.co/Q6J3iSgG7f",esauceuk,2015-07-20 13:18:45+00:00
1781,623119589010997248,#3769 Someone got One Hit Wonder @eJuiceDirectCo &amp; saved a ton! http://t.co/zdpu8e9YeY #vape #ejuice,eJuiceDirectCo,2015-07-20 13:17:41+00:00
1782,623119535378292737,"I be like ""vape vape vape. Vape tu macam mana?""

Uncle asye ; nahh ni vape

FIRST TIME PEGANG VAPE 😂😂😂😂 http://t.co/gMilPWaH7c",wtvbelle,2015-07-20 13:17:28+00:00
1783,623119479623450624,Vaping 😚💨💨 (with priyo at @kayumanis_8) [pic] — https://t.co/GaSfyo2VWI,iqbaalFaytz,2015-07-20 13:17:15+00:00
1784,623119294453276673,NEON SUNS available now from https://t.co/Z5rkxFdjGE. FREE SHIPPING ALWAYS #vapelife #vape http://t.co/oewkASXq3k,NeonSuns,2015-07-20 13:16:31+00:00
1785,623119280142331904,Vape on now :),_ayepiskandar,2015-07-20 13:16:28+00:00
1786,623119153109561344,"#Repost @djk_dubb
・・・
Look at that vape industry/Jersey girl love ... Some sunglass swap and support… https://t.co/6HOgLBWj1K",PhatPandaVapor,2015-07-20 13:15:57+00:00
1787,623119004161470465,http://t.co/Gr42RnBFnF Get updates from my @tictail: http://t.co/4B6rkqazIW,e_vapers,2015-07-20 13:15:22+00:00
1788,623118988780793857,Win a SX Mini M Class mod from http://t.co/BU7K0S8yfw - http://t.co/F3kx3XKK3Y #ecig #Vape,trymtherogue,2015-07-20 13:15:18+00:00
1789,623118872800051200,Check out the new products on my @tictail: http://t.co/Zvng3DxNCH,e_vapers,2015-07-20 13:14:50+00:00
1790,623118852390424580,Coast2CoastVapers just went LIVE at [ http://t.co/1NPpscVhZK ] on @Vapersdottv - #AutoTweet #Live #Video #Vaping #Vapers #ecig #Vapor,LiveOnVapers,2015-07-20 13:14:46+00:00
1791,623118744366088194,that relatable moment when you decide you want to grab your friend's vape cloud 😊😜 (w/ Julien Solomita) https://t.co/xpXkSRbOuh,BoredinDammam,2015-07-20 13:14:20+00:00
1792,623118422768001024,Debating on getting a vape pen today,Sill_CL9,2015-07-20 13:13:03+00:00
1793,623117602072604672,Win a Whiteout Evolv DNA200 Box Mod! #vaporjoes #vapingunderground #vaping http://t.co/fmiGQQ6e66,dublinmicki,2015-07-20 13:09:47+00:00
1794,623117543063056384,35 days away from vape daditude,clairecore_,2015-07-20 13:09:33+00:00
1795,623117469339660288,Temperature Control Builds http://t.co/zS4HucEue8 #ecig #vape #POTV,ukvaper,2015-07-20 13:09:16+00:00
1796,623117158034247680,Fuck vape lets smoke,emirulluqman,2015-07-20 13:08:02+00:00
1797,623116839409684482,Vape off,NotAzri,2015-07-20 13:06:46+00:00
1798,623116586761719809,"#goBoof #alfaVape is one of the #topRatedVapes around!
#vape Smart
The only #WayToVape
 http://t.co/dC5QFhOBqr http://t.co/EkKQIaUIP3",iVapeSmart,2015-07-20 13:05:45+00:00
1799,623116249527111680,The dream when me and hayes were smoking vape was the same one as me and Gilinsky and Gilinsky was so cute in it AND THEN CASPAR LEE JUST,nasaaaagrande,2015-07-20 13:04:25+00:00
1800,623116248960909313,NJ vapers be like ... #Vape2015 #Vape2015 http://t.co/e9JWJORep6,BrisyCoe,2015-07-20 13:04:25+00:00
1801,623116110443843584,When you grab your friend's vape cloud http://t.co/GZ0MhFDl9d via @9GAG,justineshady,2015-07-20 13:03:52+00:00
1802,623116104127393792,I had another dream that me and Gilinsky were like getting it on and then me and hayes started smoking vape and like omfg it was amazing,nasaaaagrande,2015-07-20 13:03:50+00:00
1803,623116075081732096,Today's project from The Daily Advocate by Momma Vape http://t.co/9BaYlWbvTS #vapingsavedmylife,imaracingmom,2015-07-20 13:03:43+00:00
1804,623115902901293056,I'm vaping so hard rn,BanzaiTakesAnal,2015-07-20 13:03:02+00:00
1805,623115846748106752,VapRwear Brings Vape Function to Fashion http://t.co/Ci80LWtE6s,The_hemp_ChefAZ,2015-07-20 13:02:49+00:00
1806,623115395692634112,Gripe 010 has Brian Power teaching us to vape!  And we teach Brian to gripe! http://t.co/NAY6Z0STD4,OpenMicGripe,2015-07-20 13:01:01+00:00
1807,623115113239871488,"RT RealDonnaDeVane: #Vapefam try some Angry Apple Angry Orchard hard cider #Vape Juice
SandSMods
… http://t.co/LyVNNGCpJn",vapemerch,2015-07-20 12:59:54+00:00
1808,623115110362533888,RT CIGGY_E: Pick up the complete NJOY Artist Collection for a reduced price of £59.99 and save £30 over at http://t.co/xqKrP1N4Hx; #vape #…,vapemerch,2015-07-20 12:59:53+00:00
1809,623114996843569152,"i really dont like people who smoke or vape, not my type tho",NurAqilahAthira,2015-07-20 12:59:26+00:00
1810,623114831449620480,"If you're interested, I did a review of Charlie Noble's Chocolate Mousse from their new Y... http://t.co/TabwVbJTlf #vape #ecigs #reddit",ukvaper,2015-07-20 12:58:47+00:00
1811,623114830342258690,Anyone here ever order from GVapers? Are they legit? http://t.co/FxOsXgMjFp #vape #ecigs #reddit,ukvaper,2015-07-20 12:58:47+00:00
1812,623114829469847552,Can you lock the wattage buttons on the ipv3? I know about the locking of the whole mod b... http://t.co/j7Vo4SQtTM #vape #ecigs #reddit,ukvaper,2015-07-20 12:58:46+00:00
1813,623114766148595712,Vape pen was a very good investment 😍😍,MalachiSlick,2015-07-20 12:58:31+00:00
1814,623114627157762048,There's a vape lounge in Maidstone 😅😅😅,furbywoollett,2015-07-20 12:57:58+00:00
1815,623114581884407808,No more drugs spend all my money on good ass food and my vape,gcollins213,2015-07-20 12:57:47+00:00
1816,623114514943377408,Think I have only had 2 or 3 smokes today - switching to vaping pen whatever it's called seems to be working,Toasty83,2015-07-20 12:57:31+00:00
