,TweetID,TweetContent,TweeterUsername,TweetDatetime
2442,619044591937921024,10 SSS join the revolution http://t.co/e6eCoMXQmq #vaping2015 #eciguk,vapers,2015-07-09 07:25:06+00:00
2443,619043982371364864,Please note you must be a minimum of 18 years old to vape. #vapefam http://t.co/qO0FtcSfPD,TheLondonVapeCo,2015-07-09 07:22:41+00:00
2444,619043965883543553,"Anyone that calls themselves  a ""Vapor"" or even uses the term vape need to go play with scissors in an ice rink",Devin_sabella,2015-07-09 07:22:37+00:00
2445,619043750698975233,YES! :D #dampfen #steam  #vape #vaper http://t.co/unbxLUYZx8,phiomet,2015-07-09 07:21:46+00:00
2446,619043440966373376,pretty sure @DanGhafouri really vapes he's obsessed he's on that vape life shit,beatricecapili,2015-07-09 07:20:32+00:00
2447,619043035142230016,I'm so fucken chillaxed bro I'm going to listen to vape and listen to Powerman 5K 2nite,tweetwillow,2015-07-09 07:18:55+00:00
2448,619043005282955264,Win a SX Mini M Class mod from http://t.co/z77YlVTFuG - http://t.co/S053QFmDHd #ecig #Vape,demon1102,2015-07-09 07:18:48+00:00
2449,619042564205842432,Vape and coffee! #vapelife,v_a_p_e,2015-07-09 07:17:03+00:00
2450,619042095500787712,"RT DayTraders1: NADT Affiliate: Get the Bluetooth enabled E-Cigarette, SMOKiO! and the FREE APP http://t.co/886RjcpVVY  #vape",vapemerch,2015-07-09 07:15:11+00:00
2451,619042063393378304,#vapingflavorsforsale 4 Myths About Vaping Debunked http://t.co/PnfbBceJMc,ShoppingWeekly,2015-07-09 07:15:03+00:00
2452,619042017272672256,I don't vape though,tinkemek,2015-07-09 07:14:52+00:00
2453,619042001841860608,just grab ur vapes and leave,delete__4ever,2015-07-09 07:14:49+00:00
2454,619041749739044864,Do you even vape bro ?,FONZILLAH,2015-07-09 07:13:49+00:00
2455,619041746895241216,I LOVE YOU SO MUCH MERCY CAN U SNATCH ME SOME BERRY VAPE DROPS FOR ME  https://t.co/BxpjjNyycc,jessconv,2015-07-09 07:13:48+00:00
2456,619041270980214784,Win a Whiteout Evolv DNA200 Box Mod! #vaporjoes #vapingunderground #vaping http://t.co/i4HXOOcAEb,xxbabygirlxx79,2015-07-09 07:11:54+00:00
2457,619041246405791744,"My Moto : ""The only side-effect of vaping is community.""

Please share &lt;3 http://t.co/hgM1HZzrSR",DarkenDuchess,2015-07-09 07:11:49+00:00
2458,619040918549712896,The American Lung Association: Reducing Tobacco. The Litmus Test &amp; Ulterior Motives http://t.co/NsS8gpKLjB via @Vapingit #vaping2015,vapers,2015-07-09 07:10:30+00:00
2459,619040824576339968,"Best match------Honeycomb tank with Snowwolf, how do you think?#vape#vapor#vaporlifestyle#vapecommunity#vapor gaint — 觉得很美好",Jennyclouvapor1,2015-07-09 07:10:08+00:00
2460,619040563183099904,"Tax for salt, sugar, fatty foods.. Simply: Tax live! So wrong! Tax isn't the answer to anything. https://t.co/ERPysjlsxI",Vaping_Rursus,2015-07-09 07:09:06+00:00
2461,619040506438414336,Many thanks to Greg Conley for putting up a great argument for Vapers today AGAINST SB140! #noonsb140… https://t.co/nUPcE9EnyS,eloquentjuice,2015-07-09 07:08:52+00:00
2462,619040334996197376,No! Put that vape down! People expect more from you!,LeyshaSenyum,2015-07-09 07:08:11+00:00
2463,619040162463416320,#ABillionLives can be saved when policy makers stop comparing this with #vaping http://t.co/88J8eU5VtY,HeavenGiftsCom,2015-07-09 07:07:30+00:00
2464,619039809449799680,Win a SX Mini M Class mod from http://t.co/3OJW39ma3j - http://t.co/csYgeY5jfc #ecig #Vape,Bootyclapthundr,2015-07-09 07:06:06+00:00
2465,619039617602482176,"Syd is on my skype and is just giggling and saying ""vape tormado chaser"" over and over",Firr,2015-07-09 07:05:20+00:00
2466,619039595649454080,Scientists Shocked After E Cig Test Results!!! Vaping Indoors OK? http://t.co/G97GOOlazH via @@VaporFinder,PRDR123,2015-07-09 07:05:15+00:00
2467,619039542423609344,Drake and vape?,slickstephan,2015-07-09 07:05:02+00:00
2468,619039527395557376,Hand check! Puffbox on loadout with tres evo mod on secondary!  #vapeph #vapelife #vape… https://t.co/Iz1orlhMvV,winslowmanila,2015-07-09 07:04:59+00:00
2469,619039425331224576,Vapors on #Yelp: I liked my Vape &amp; the staff so much.......  I now work at Vapors!   Come in &amp; ask for Mike. http://t.co/hj2bpT3fGv,Michaelpuglisi,2015-07-09 07:04:34+00:00
2470,619039323699032064,Win a SX Mini M Class mod from http://t.co/0YdAGmAIoX - http://t.co/meMZfjMYHH #ecig #Vape,TaviZahiu,2015-07-09 07:04:10+00:00
2471,619039264509165568,Free bottle of juice with every order @MtBakerVapor http://t.co/stvt94uR9k  #vapelife #vapor #vaping #vape #coupons http://t.co/FcnJOWX9ux,Suckmybox_com,2015-07-09 07:03:56+00:00
2472,619039059277578240,Sis just sent a snap of her trying to vape😂😂😂,W0rld_Wide_Web,2015-07-09 07:03:07+00:00
2473,619039033943945216,I smoke a vape #VapeLife,trashnyowl,2015-07-09 07:03:01+00:00
2474,619038979992723456,finally get to smoke at home with this vape.,BarmyBEEZY,2015-07-09 07:02:48+00:00
2475,619038933133848576,Why do girls take selfies of themselves blowing vape smoke to cover their face. So annoying,Manayeedaww,2015-07-09 07:02:37+00:00
2476,619038802477236224,"Colorful nookie box mod from kingtu
Dual 18650 battery
#VapeLife #vape #VapeOn #ecigs #ecigshop #ecigstore #VapeFam http://t.co/LTrL41q06k",alicexiao1992,2015-07-09 07:02:06+00:00
2477,619038703613140992,The Valyrian Box Mod | Full Review and Details: http://t.co/AexhoA0SSA via @YouTube,robbie_vapes,2015-07-09 07:01:42+00:00
2478,619038664413220864,The Valyrian Box Mod | Full Review and Details https://t.co/Bdidc0E0TN via @YouTube,robbie_vapes,2015-07-09 07:01:33+00:00
2479,619038533865463808,Lets vape ! #vape #vaping #eliquids #ecigs http://t.co/NoxwBmi0lO http://t.co/1mlI7vku9E,Esheeshuk,2015-07-09 07:01:02+00:00
2480,619038531902504961,Lets vape ! #vape #vaping #eliquids #ecigs http://t.co/DQuzlRUV0c http://t.co/gMxuDHuZ9H,esheeshforecigs,2015-07-09 07:01:01+00:00
2481,619038529885057024,Lets vape ! #vape #vaping #eliquids #ecigs http://t.co/O9hKluugOo http://t.co/Veo8WKPyWy,esheeshecigs,2015-07-09 07:01:01+00:00
2482,619038517084053504,Lets vape ! #vape #vaping #eliquids #ecigs http://t.co/c1mfqXjUUo http://t.co/JlL4JKVqjQ,esheeshvaping,2015-07-09 07:00:58+00:00
2483,619038482397147136,you know what! fuck it lol i'ma take my vape and go to the globe!😊👌,playboiimartyy,2015-07-09 07:00:50+00:00
2484,619038244706107392,RT jonah_german: Can't hear it's too cLOUD ##vape,vapemerch,2015-07-09 06:59:53+00:00
2485,619038105400672256,saw a lot of vapers,brutha_brenden,2015-07-09 06:59:20+00:00
2486,619038076443033601,Vape pens look enough like Sonic Screwdrivers that I get excited and then immediately disappointed when someone posts a picture of one,OhAxi,2015-07-09 06:59:13+00:00
2487,619038068238999552,"If you don't fuck with vape, I don't fuck with you. #VapeLife",jpeer1808,2015-07-09 06:59:11+00:00
2488,619037803519848448,"ELIQUID REVIEW ONE HIT WONDER MUFFIN MAN, MILK MAN PLUS GIVEAWAY****** #eliquid #vaping https://t.co/KGFtARWCqs",mazpinkpink,2015-07-09 06:58:08+00:00
2489,619037690089086976,SCOOPS ELIQUID REVIEW #eliquid #vaping  https://t.co/XY0Fx0cRUq,mazpinkpink,2015-07-09 06:57:41+00:00
2490,619037593561382913,ELIQUID REVIEW GLAS VAPOR  POUND CAKE #vaping #eliquid  https://t.co/e2luQ56I7l,mazpinkpink,2015-07-09 06:57:18+00:00
2491,619037383233703936,we always always vape on tuesdays,rachftp,2015-07-09 06:56:27+00:00
2492,619037248462323712,I have a feeling I'm going to need to stock up on #vapewild juice . Right now I'm just waiting for my # sample pack to arrive from vape wild,cemeterymoon,2015-07-09 06:55:55+00:00
2493,619037226891018240,"haley was vaping and it sounded like a whipped cream can and i was like ""YO WHO BROUGHT THE WHIPPED CREAM",MAGICBABBEE,2015-07-09 06:55:50+00:00
2494,619037074705002496,When Jorge leaves the vape in the car 😊😊😊😊😊😊😊😊😊😊😊😊😊😊😊😊😊😊😊😊😊😊😊😊😊😊😊😊 http://t.co/ZzeP8bba5V,TheKillahMental,2015-07-09 06:55:14+00:00
2495,619036867170689024,My husband just fully switched to #vaping now the pressure is on for me lol I plan on switching fully this Saturday at 1 am .,cemeterymoon,2015-07-09 06:54:24+00:00
2496,619036814330834944,"Genuine Starbuzz E-Hose + 2 FREE Flavors + Warranty HALF PRICE!
Link: http://t.co/wIlvLrSjOV 
#starbuzz #ehose #eshisha #hookah #vape #free",adjhgasdysadgy2,2015-07-09 06:54:12+00:00
2497,619036616330510336,"I guess it's just me my vape, this Bud Light Lime and my music till I pass out",DuceAlmighty,2015-07-09 06:53:25+00:00
2498,619036394598604800,"Last night at Vape Wednesday 😊
#friends #drinks #catchup #music @ Big Bad Wolf PH https://t.co/fQRETr5tAi",missayanna13,2015-07-09 06:52:32+00:00
2499,619036257360941056,Enter to win a Kanger Subox and 3 bottles of Cuttwood ejuice at http://t.co/FGsQy3365n https://t.co/IU65YiEaAC #vape,RodzChavez,2015-07-09 06:51:59+00:00
2500,619035996579991554,🍁🍁🍁 of course u would use these emojis lol. Stay safe and have a koo summer. That vape pen ur mom has really had me on cloud 9 lol.,neeko_keanu,2015-07-09 06:50:57+00:00
2501,619035942947581952,"Nice!! Repost from princess_vapes via igrepost_app, my lovely box by speedybuilt2 👊🙌 we still have… https://t.co/cqAXbHNCRG",OutlawsVapeCrew,2015-07-09 06:50:44+00:00
2502,619035926799478784,RT BlakeVapes: #SATURDAY NITE STRIT #CHILLIN #KILLINIT!!! 💯💯💯 SHOWIN U #HOWTO #WARM UR #VAPE!!! ✊✊✊🙌🙌🙌🔝🔝😗💨💨💨 … http://t.co/9FC1iwpabQ,Naijaknowhow,2015-07-09 06:50:40+00:00
2503,619035716731797504,Zephyurs tank #ecig sub ohm tank #vapor #vape #vaping #ecigarette http://t.co/YLCfHZzfl4,CigSunmoon,2015-07-09 06:49:50+00:00
2504,619035467246206976,Just wanna vape my life away with someone I kinda love 😍,lilniggararity,2015-07-09 06:48:51+00:00
2505,619035459671318528,Good god y does @gayformoleman_ text me everything about Canada &amp; vaping #furrieswhovape Jesus I hate her sooo effing much,Killing_theory,2015-07-09 06:48:49+00:00
2506,619035275092754433,by wehatepopo #stoner #medicated #cones #cute#vape #marijuana #staylifted#glassy #cannabiscommunity#stoned #nug #FT… http://t.co/dFtbakatJN,Mbuki123,2015-07-09 06:48:05+00:00
2507,619035203462414336,Sometimes I wonder if I'd be cooler if I started vaping,SplendaDadd,2015-07-09 06:47:48+00:00
2508,619034818127466498,You know you're true friends when you send each other vape videos @LuckyMorris11 😂,auxier1428,2015-07-09 06:46:16+00:00
2509,619034467039055872,RT mowxskeet: I'm just trynna vape my life away ##vape,vapemerch,2015-07-09 06:44:52+00:00
2510,619034465860456448,RT Its_Barry22: We both looked into each others eyes #Vape #dontjudgechallange http://t.co/zh0hzHiQzI,vapemerch,2015-07-09 06:44:52+00:00
2511,619034464832876544,RT esheeshecigs: Excellent Eliquids ==&gt;&gt; http://t.co/w4eWo7XarS  #vape #e-liquids http://t.co/teAcLJUvxV,vapemerch,2015-07-09 06:44:52+00:00
2512,619034463750758400,RT Esheeshuk: Awesome Eliquids ==&gt;&gt; http://t.co/HruE0K2IsH  #vape #e-liquids http://t.co/ssn31PxMOh,vapemerch,2015-07-09 06:44:51+00:00
2513,619034462567952384,RT esheeshforecigs: Terrific Eliquids ==&gt;&gt; http://t.co/w4eWo7XarS  #vape #e-liquids http://t.co/12FedSbAN3,vapemerch,2015-07-09 06:44:51+00:00
2514,619034461431275520,RT esheeshvaping: Premier Eliquids ==&gt;&gt; http://t.co/w4eWo7XarS  #vape #e-liquids http://t.co/0R9PRBGoeC,vapemerch,2015-07-09 06:44:51+00:00
2515,619034460244324353,RT ChandraReztu: It's all about rasa #part2 #vape (at Exito vapor) — http://t.co/lNOm7dh77r;,vapemerch,2015-07-09 06:44:51+00:00
2516,619034160062005248,"No, bro, I do not want to vape",BlaitDubsheesh,2015-07-09 06:43:39+00:00
2517,619034155414851584,when ur twin messes up your vape tornado (Vine by @packieperkins) https://t.co/ZqHg25nRzW,BasicBrando,2015-07-09 06:43:38+00:00
2518,619034033574551552,this vape got me high af,wavyy973,2015-07-09 06:43:09+00:00
2519,619033781756932096,silent hill but all the fog is actually from people vaping,KeaganOfficial,2015-07-09 06:42:09+00:00
2520,619033478336770050,Photo: Love being a part of this thing called vapelife💨😤🙌👍🇺🇸💯@Regrann from @jbbphoto - Vapers and Vape... http://t.co/SoHMwljelz,MzLimitless,2015-07-09 06:40:56+00:00
2521,619033471256797185,Love being a part of this thing called vapelife💨😤🙌👍🇺🇸💯regrann from @eloquentjuice  -  Vapers… https://t.co/pi3DeXwMcC,CloudCompMaps,2015-07-09 06:40:55+00:00
2522,619033302364598272,Win a Whiteout Evolv DNA200 Box Mod! #vaporjoes #vapingunderground #vaping http://t.co/JCX7fNhE6S,TaviZahiu,2015-07-09 06:40:15+00:00
2523,619033155190812672,will u vape or smoke — what do you think? http://t.co/pIQxm3nm50,iamdavidchong,2015-07-09 06:39:39+00:00
2524,619033146625933313,"The vape shop- SoloQQ At the mountain of madness! http://t.co/3OUsG0RzrH
@collectiongamin @StreamerNetwork @GameStreamTeam @PoorUglyDwarf",FlameFamiliar,2015-07-09 06:39:37+00:00
2525,619033068368596992,My vaping story http://t.co/KA5pFvbHwI,DarkenDuchess,2015-07-09 06:39:19+00:00
2526,619032913842077697,Because @itsbobatime is next to The Vape Shop,Takiboris_,2015-07-09 06:38:42+00:00
2527,619032791938912256,Enter to win a Kanger Subox and 3 bottles of Cuttwood ejuice at http://t.co/vmJclMdTeJ http://t.co/7oMz0Si4Sk #vape,eddings_john,2015-07-09 06:38:13+00:00
2528,619032335577706497,Video: Thank you for being there and being a voice for those without one 💨😤💨 VAPERS ROCK!!! 🇺🇸💨😤👍🙌@Regrann... http://t.co/7HX3QyrXPB,MzLimitless,2015-07-09 06:36:24+00:00
2529,619032333530865664,Thank you for being there and being a voice for those without one 💨😤💨 VAPERS ROCK!!!… https://t.co/OoGCJs4eB5,CloudCompMaps,2015-07-09 06:36:24+00:00
2530,619031933419438080,CBD Vape pen #azmmj #absolutextracts #cbdoil #co2oil #cannabis #cartridges #co2extract #concentrates… https://t.co/eIXfXfV6Z6,sales064,2015-07-09 06:34:48+00:00
2531,619031929573220352,u must not vape. on the reg :-/ https://t.co/t6hLB2wGEC,myoldaccs,2015-07-09 06:34:47+00:00
2532,619031700220325888,"Wow! I just won this for free, vape sticker http://t.co/VqrnawTzQK #listia",rebeccac_7,2015-07-09 06:33:53+00:00
2533,619031538257293312,V2 eCigarette Promo First cigarette after a month of vaping... To anyone else who misses cigarettes... http://t.co/M3aXGhsw5t,V2eCigPromoCode,2015-07-09 06:33:14+00:00
2534,619031368819941376,Cause vape pens are cool,whoistot,2015-07-09 06:32:34+00:00
2535,619030980364361728,Excellent Eliquids ==&gt;&gt; http://t.co/v2C396hjMc #vape #e-liquids http://t.co/oM1qgjFg49,esheeshecigs,2015-07-09 06:31:01+00:00
2536,619030970310619136,Awesome Eliquids ==&gt;&gt; http://t.co/tuRjffr4Oo #vape #e-liquids http://t.co/0RbQ2VEm0a,Esheeshuk,2015-07-09 06:30:59+00:00
2537,619030968272224256,Terrific Eliquids ==&gt;&gt; http://t.co/jMeQAkR2dC #vape #e-liquids http://t.co/S0Ht8tIoCW,esheeshforecigs,2015-07-09 06:30:58+00:00
2538,619030967081046016,Premier Eliquids ==&gt;&gt; http://t.co/rqs5AaalUC #vape #e-liquids http://t.co/6rz6kDLxEt,esheeshvaping,2015-07-09 06:30:58+00:00
2539,619030848105484288,Fall in love with Clockwork Smurfette! Build her hut on your #SmurfsVillage Island. http://t.co/NAYFkDHpvw @BeelineGames,Irish_Vaper,2015-07-09 06:30:29+00:00
2540,619030799103361024,"Insta feed contains : cars, girls, vape, cars",SBerbower,2015-07-09 06:30:18+00:00
2541,619030776659603456,Dat vape dope,CraazyChris,2015-07-09 06:30:12+00:00
2542,619030754064998400,"Get the #Vaping Granny #SealOfVaproval for UR #Vape Business!
Let me Tweet YOU!
Message me for consult http://t.co/UiOIWcjzJw",RealDonnaDeVane,2015-07-09 06:30:07+00:00
2543,619030733491994624,RT sarahmahmoud95: I can finally #Vape after Ramadan,vapemerch,2015-07-09 06:30:02+00:00
2544,619030673404334080,"i coulda gone my whole life without seeing ""u vape on the reg"" https://t.co/QR0setVkQJ",VintageGinger,2015-07-09 06:29:48+00:00
2545,619030494060093440,u vape on the reg? thats cool. i paid my phone bill today.,myoldaccs,2015-07-09 06:29:05+00:00
2546,619030400833339393,Help finding readings for new vaper via /r/Vaping101 http://t.co/lxi1B5HEVv,VapingEnFrance,2015-07-09 06:28:43+00:00
2547,619030339332108288,I want a VAPE I'll love you forever if you get me one😍,Kiersstttt,2015-07-09 06:28:28+00:00
2548,619030277436887040,Daily Vaping News http://t.co/fkPIfoJrtf,ExclusiveVapes,2015-07-09 06:28:13+00:00
2549,619030209581289472,why are girls so interested in vapes,OddAntxn,2015-07-09 06:27:57+00:00
2550,619030068682031104,Win a SX Mini M Class mod from http://t.co/B6sqGuiTJy - http://t.co/HQAPEPWYNe #ecig #Vape,Wablooboar,2015-07-09 06:27:24+00:00
2551,619030050072043520,Vape time http://t.co/IpUeIeW5CK,djiceman_73,2015-07-09 06:27:19+00:00
2552,619029952252358657,"Do u sake?
No. 
Ok well do you at least VAPE?
No...",paxtonshive,2015-07-09 06:26:56+00:00
2553,619029732915482624,"go ahead talk crap on me all you want, but I'm not the one at a party showing off my sick vape tricks 😂👑",ashbash45287,2015-07-09 06:26:04+00:00
2554,619029709280538624,kantoi vape game strong,Ginger_cher,2015-07-09 06:25:58+00:00
2555,619029607182921728,Video: So AWESOME 💨😤🙌🇺🇸@Regrann from @unitedvapers - UNITED VAPERS! Tag yourself and tag who you know.... http://t.co/aBm0LNDJ3O,MzLimitless,2015-07-09 06:25:34+00:00
2556,619029604846714880,"So AWESOME 💨😤🙌🇺🇸regrann from @unitedvapersorg  -  UNITED VAPERS!

Tag yourself and tag who you… https://t.co/Q6CIWiOQPY",CloudCompMaps,2015-07-09 06:25:33+00:00
2557,619029446918598656,This guy a vape God  https://t.co/MZyxp5v9rN,Aubrina1,2015-07-09 06:24:55+00:00
2558,619029180081008640,Dragon fruit vape 😋,woaaahnelly,2015-07-09 06:23:52+00:00
2559,619029174162829312,Is Vaping a New Lease on Life? http://t.co/WZulV5b1Sp,vapemagazinecom,2015-07-09 06:23:50+00:00
2560,619029130458206208,Advanced Vaping Hardware becoming Less Advanced http://t.co/NVMDb2Xs8j,vapemagazinecom,2015-07-09 06:23:40+00:00
2561,619029013827207168,Every Year Gained from Vaping is Precious http://t.co/A8NfiDmlMi,vapemagazinecom,2015-07-09 06:23:12+00:00
2562,619028973570232321,Vaping without the same social stigma of smoking http://t.co/zKToruREW5,vapemagazinecom,2015-07-09 06:23:02+00:00
2563,619028932558336000,Vaping doesn’t bother the dog http://t.co/Pcsi2KWEo5,vapemagazinecom,2015-07-09 06:22:53+00:00
2564,619028900501393408,Chef’s Skills Improve from Quitting Cigarettes and Vaping http://t.co/abdDPW733o,vapemagazinecom,2015-07-09 06:22:45+00:00
2565,619028634318155776,Pretty little liars and a vape #sleeplessnight,KGlover1,2015-07-09 06:21:42+00:00
2566,619028539904389121,Remember those Initial Freedoms of Vaping http://t.co/bYiGk43L2q,vapemagazinecom,2015-07-09 06:21:19+00:00
2567,619028498812768256,3 Year Seasoned Vapers now call themselves Old School Vapers http://t.co/0jiVTuO318,vapemagazinecom,2015-07-09 06:21:09+00:00
2568,619028475488268288,Vaping a Mass Cross Cultural Following http://t.co/cbi7huPUeg,vapemagazinecom,2015-07-09 06:21:04+00:00
2569,619028428881182720,Vaping Restrictions Ever Tightening http://t.co/Q1KSDutNfp,vapemagazinecom,2015-07-09 06:20:53+00:00
2570,619028401903382528,Vapers Believe they gain years on their life. http://t.co/bXULaDlppm,vapemagazinecom,2015-07-09 06:20:46+00:00
2571,619028322895294464,"Perfect solution to fall asleep real quick:
Have a vaping sesh with all ur bros",EminemKing4Life,2015-07-09 06:20:27+00:00
2572,619027880815636480,they hella vaping it outside chilling. 💨💨,issamad_hi,2015-07-09 06:18:42+00:00
2573,619027584953786369,Read The Vaping Giraffe Daily ▸  today's top stories via @NYVapeShop @EDIT_Tweets @lancelands http://t.co/sFQzXpXfv6,vapingiraffe,2015-07-09 06:17:31+00:00
2574,619027530574512128,Vaping weed out my door cause Lars doesn't like me doing it inside my apartment. Hopefully no one complains.,Misty_Lake,2015-07-09 06:17:18+00:00
2575,619027370410819584,#Vaping #Giveaway Win a whole line of #brandnewejuice from #MotleyBrew @vapingquestions! http://t.co/MYvGnE0vNI,demon1102,2015-07-09 06:16:40+00:00
2576,619027351599513600,"""do you hate yourself and want other people to hate you too? well, try out vaping""",defytheAUDS,2015-07-09 06:16:36+00:00
2577,619027350232043524,thevapintech just went LIVE at [ http://t.co/Za3ZLmpHWY ] on @Vapersdottv - #AutoTweet #Live #Video #Vaping #Vapers #ecig #Vapor,LiveOnVapers,2015-07-09 06:16:35+00:00
2578,619027120291975168,Sad Boys And Vape Pens • 8/24/15,lingering__will,2015-07-09 06:15:41+00:00
2579,619026969334779904,"#Vape Southern Tea peach 300mg #CBD #ejuice
#VapeFam Pain relief, stress, sleep.
http://t.co/s4jq06DUvY http://t.co/JGMyIQsWu0",RealDonnaDeVane,2015-07-09 06:15:05+00:00
2580,619026916796796928,Having withdrawals from my vape smh,_lmaoayy,2015-07-09 06:14:52+00:00
2581,619026788681846785,idk u v well but u seem pretty kewl we should totes vape sometime happy birthday gay boi hope ur day is as shitty as u ☎️ @mckennarreese14,keira_dawn_,2015-07-09 06:14:22+00:00
2582,619026734629920768,In love with my vape!!! ✌🏻️💨 #VapeLife,michaelakayrent,2015-07-09 06:14:09+00:00
2583,619026721325629441,Anyone knows where i can get a reasonable price for a vape?,flpdrd,2015-07-09 06:14:05+00:00
2584,619026678774411264,STOP!! LOST MY VAPE!,marlo_5670,2015-07-09 06:13:55+00:00
2585,619026482850078720,Strongly feel vaping is the same as smoking a cig .. You do it when you're stressed and you get this crazy head rush..... Mmm,KiAnaJacklyn,2015-07-09 06:13:09+00:00
2586,619026374745960448,What's up with this vape shit ?,isaznl,2015-07-09 06:12:43+00:00
2587,619026275961839616,"Gotta heat the vape up, let's get fadedddddd",mmooorgggannn,2015-07-09 06:12:19+00:00
2588,619026011699593216,Update Emma Scott is vaping,mac__98,2015-07-09 06:11:16+00:00
2589,619025520445882368,Just hit the vape.,Tulips2sweet,2015-07-09 06:09:19+00:00
2590,619025433586085888,"Genuine Starbuzz E-Hose + 2 FREE Flavors + Warranty HALF PRICE!
Link: http://t.co/AwkEBBh6OQ 
#starbuzz #ehose #eshisha #hookah #vape #free",adjashdgasudfy2,2015-07-09 06:08:58+00:00
2591,619025432755703808,If one more person asks me if I vape I'll throw your mod out the window 😂,emilynester98,2015-07-09 06:08:58+00:00
2592,619025382218563584,"""When u think u see da pizza rolls steam but it's realLy just ur vape clouds :/"" 👽",lilgoobi,2015-07-09 06:08:46+00:00
2593,619025297766260736,"#Repost @captainvapes
・・・
No Senator Leno - vape products are not tobacco products. We won this… https://t.co/TdxO9XukW7",VaporDeluxNoho,2015-07-09 06:08:26+00:00
2594,619025252266307584,Vape killed Santa Claus http://t.co/qQjr8loi1M,_BigSoch,2015-07-09 06:08:15+00:00
2595,619025187586088960,"Thanks, coloring ma day 💨
#vapemeet #vaper #vape #vaping #vapor #vapeindo #vaporlife #vapegirls @… https://t.co/RmjVzxApCM",bukanmantaanmu,2015-07-09 06:08:00+00:00
2596,619025097530150912,"Second day of operation at Dragon Cloud Vape Shop, Subang Jaya. Thank you all for coming and showing… https://t.co/Plc4EOny7s",dragoncloudvape,2015-07-09 06:07:38+00:00
2597,619025055087898624,did this chick just vape with her pussy...,susheboy,2015-07-09 06:07:28+00:00
2598,619024871381671936,"""I miss my Vape and Vape life"" -@NickDailey1",jackstephansong,2015-07-09 06:06:44+00:00
2599,619024779627098112,vape &amp; chill,cenedraxoxo,2015-07-09 06:06:23+00:00
2600,619024738002677760,"If you ""vape"" you're a fag &amp; we can't be friends.",ricerssssss_,2015-07-09 06:06:13+00:00
2601,619024737373564928,I'm new to vaping. This whole smoking now tastes like drinking the milk after fruit loops thing is throwing me through a loop. A fruit loop.,Tom_Cruzies,2015-07-09 06:06:12+00:00
2602,619024686605828096,#modporn #vape #igers #instagood #instadaily#webstagram #vapor #ecig #eliquid #vapeporn#improof #vapel… https://t.co/Iei29GgOoQ,parkemx,2015-07-09 06:06:00+00:00
2603,619024559040299008,"Knife Party's Rob Swire Recovers Hearing, Blames Vaping for the Scare http://t.co/4IsH4eeD7k",DJiaomaib,2015-07-09 06:05:30+00:00
2604,619024431587962880,do u even vape bro? https://t.co/HwFxdz3ieB,stevend07,2015-07-09 06:05:00+00:00
2605,619024236254994432,experienced vaper talks down to new vaper in vape club (Vine by @packieperkins) https://t.co/Sf2jLBnnAO,itsUGLYGOD,2015-07-09 06:04:13+00:00
2606,619024041479962624,"My morning. Don't worry, it's after a night shift..
#vaping #vapelife http://t.co/Nf5I0bsULV",VonVandervaughn,2015-07-09 06:03:27+00:00
2607,619024022022434817,The fact that natali thought vape was drugs 😂😂,JonnyEspinoza,2015-07-09 06:03:22+00:00
2608,619024000308527104,Vape pens and Mountain Dew,er1kyoung,2015-07-09 06:03:17+00:00
2609,619023611748155392,Vaping furries is a thing,aishcube_,2015-07-09 06:01:44+00:00
2610,619023509801578496,"Just let me vape mom Chill 😒😒

http://t.co/7IQmbcVsiZ",DontFavMyTweets,2015-07-09 06:01:20+00:00
2611,619023413454204928,Join us and save 20% on your next order subscribe with Facebook ==&gt;&gt; https://t.co/a4FJRaF6Wu #vape #vaping http://t.co/C6f0HxobS4,esheeshecigs,2015-07-09 06:00:57+00:00
2612,619023410270760960,Join our VIP club and save 20% on your next order subscribe with Facebook ==&gt;&gt; http://t.co/FVKhYZB5X6 #vape #vaping http://t.co/EzbYuQZSDG,Esheeshuk,2015-07-09 06:00:56+00:00
2613,619023407296958464,Join our VIP club and save 20% on your next order subscribe with Facebook ==&gt;&gt; https://t.co/GFj2Vb3hpk #vape #vaping http://t.co/iweK8LC9fh,esheeshforecigs,2015-07-09 06:00:55+00:00
2614,619023398006620160,Join us and save 20% on your next order subscribe with Facebook ==&gt;&gt; https://t.co/nLLupW1Sh4 #vape #vaping http://t.co/4QRfAr4HzI,esheeshvaping,2015-07-09 06:00:53+00:00
2615,619023318297899008,#Colorado county seeks to block #bong-a-thon #party. http://t.co/T91SYBjVrK  via @NoCoNoW #Pot #Marijuana #Weed #Vape http://t.co/87QIER0wIP,HydroponicLife1,2015-07-09 06:00:34+00:00
2616,619023303974367232,I'm about to be lit af with my vape,Estefaniaaa_c,2015-07-09 06:00:31+00:00
