,TweetID,TweetContent,TweeterUsername,TweetDatetime
0,623281203169263616,VULive just went LIVE at [ http://t.co/44iyqk1KOD ] on @Vapersdottv - #AutoTweet #Live #Video #Vaping #Vapers #ecig #Vapor,LiveOnVapers,2015-07-20 23:59:53+00:00
1,623281175528898560,RT egcthree: SOURCEvapes this will be the last order i ever place with your comany #sourcevapes do dont buy #vape,vapemerch,2015-07-20 23:59:46+00:00
2,623280991239434240,NoSpoons just went LIVE at [ http://t.co/bcu3P04Eyz ] on @Vapersdottv - #AutoTweet #Live #Video #Vaping #Vapers #ecig #Vapor,LiveOnVapers,2015-07-20 23:59:02+00:00
3,623280612313399296,"let's watch a movie and take pictures together, then play around with the vape @sammywilk",imactuallyanna,2015-07-20 23:57:32+00:00
4,623280422328381440,"An interesting look at why #vaping is important
#notblowingsmoke The Smoker’s Mentality: Why We Need E-Cigarettes http://t.co/13HQ20K8T3",OffbeatnUnique,2015-07-20 23:56:47+00:00
5,623280349330677760,Yo yo u in the VA. Check out this shop krazyvaporsva great vape shop if u in the hood check thm out… https://t.co/BAJdsdSrkc,mayco420,2015-07-20 23:56:29+00:00
6,623280343177687040,"When I see people vaping, I feel like I'm in a 50's sci-fi movie that does a hilariously poor job of predicting the future.",TheAuburner,2015-07-20 23:56:28+00:00
7,623280204006293504,TroveLive just went LIVE at [ http://t.co/ErReoUDM19 ] on @Vapersdottv - #AutoTweet #Live #Video #Vaping #Vapers #ecig #Vapor,LiveOnVapers,2015-07-20 23:55:55+00:00
8,623280105440186368,Today I learn about for loops and replace my vape coil. Truly I am on the road to euphoria.,Tipsycaek,2015-07-20 23:55:31+00:00
9,623279892642287616,http://t.co/8FfWVufv5m - Vape Mods http://t.co/hhdoJqL6Eg,Info_Domains,2015-07-20 23:54:41+00:00
10,623279850283896832,What is up with Arab people and vape pens,lordsbg,2015-07-20 23:54:30+00:00
11,623279762367234048,Vape Tricks That Will Absolutely Stun You http://t.co/czlKhiewlQ,vapestricks,2015-07-20 23:54:09+00:00
12,623279733497856001,when mom takes your vape pen https://t.co/tm2gqyowxm,emleig,2015-07-20 23:54:03+00:00
13,623279647170531328,RuggedNorth just went LIVE at [ http://t.co/mNJ33VzpTt ] on @Vapersdottv - #AutoTweet #Live #Video #Vaping #Vapers #ecig #Vapor,LiveOnVapers,2015-07-20 23:53:42+00:00
14,623279520557084673,#CASAA's 14 most recent Call-to-Actions #ecigs #vape #IfYouVapeAdvocate #vaping #clouds #ecig #ecigarettes  http://t.co/lb5SwzGqno,Addicted2Vapor,2015-07-20 23:53:12+00:00
15,623279361483915264,"ScrubForce, I'm home &lt;3  |  League, weird eyeliner &amp; I got a vape :D: http://t.co/qbgk7dnudD",veepaii,2015-07-20 23:52:34+00:00
16,623279334074241024,The vape I ordered from vinny didn't come yet I'm cutting myself http://t.co/X8wKraX1GR,werewolf_bride,2015-07-20 23:52:27+00:00
17,623279318555361281,Vape life http://t.co/70Cn5UvjBT,babyyygurl13_,2015-07-20 23:52:24+00:00
18,623279278541570048,****NEW VAPE ALERT****,SexNsushi,2015-07-20 23:52:14+00:00
19,623279114758156288,Lk don't want to buy the homies vape cause I feel like I'll get addicted 😾,A1Lucciano,2015-07-20 23:51:35+00:00
20,623278930607362048,"""we get it you vape"" http://t.co/YkL6QW98Bs",crxssman,2015-07-20 23:50:51+00:00
21,623278924093505536,FreakshowINC just went LIVE at [ http://t.co/WDNC4vCNcG ] on @Vapersdottv - #AutoTweet #Live #Video #Vaping #Vapers #ecig #Vapor,LiveOnVapers,2015-07-20 23:50:50+00:00
22,623278844506673153,Ashley and I are now going to be known as vape queens.,mirandalouisss,2015-07-20 23:50:31+00:00
23,623278816002224129,Love to #vape? Love to ride? Have a girl? Bring it all tomorrow &amp; get 25% off all hardware/accessories! #motorcycle http://t.co/yjygAETp7Q,MainStageVapes,2015-07-20 23:50:24+00:00
24,623278809115066368,#CASAA Research Fund Launches Fundraising for Study of Gateway Claims #IfYouVapeAdvocate #ecig #Vape #clouds #ecigs  http://t.co/NiDIVRLudn,Addicted2Vapor,2015-07-20 23:50:22+00:00
25,623278747718950913,"dream boy: must be from the 6ix, smokes vape and claims he listens to alot of authentic rap but only knows runnin thru the 6ix with my woes",ccumila,2015-07-20 23:50:08+00:00
26,623278511986323456,Our Stock Pick On $PPCH Is Up Over 300% Since Our Original Release At .02! Huge News: http://t.co/Ab9x71OZD9 $VAPE $IPSEY $AFFU,Stockenheimer1,2015-07-20 23:49:11+00:00
27,623278492919197696,"We love to vape. 👍💨👊☝👌
#np #vapelife #dope #lifestyle #vapemasters #vapememes #vapemodel… https://t.co/5umbbloCIR",tyeknoxmusic,2015-07-20 23:49:07+00:00
28,623278432881786881,Dumbledore trying to teach Harry a new vape trick http://t.co/Vzb3lUP5TU,ayyydaniela,2015-07-20 23:48:53+00:00
29,623278292574056448,The Greatest #tupac #2pac #hiphop #rap #undergroundhiphop #undergroundrap #music #vape https://t.co/qyI5jIzg2y,ReelLiveFilms,2015-07-20 23:48:19+00:00
30,623278236206825472,good morning and no smoking! 👊🔞 #vaping https://t.co/3YagMI5poy,chaakson,2015-07-20 23:48:06+00:00
31,623278219265847297,Vape life https://t.co/yhtrQyjVxh,michaelstewar,2015-07-20 23:48:02+00:00
32,623278044099309568,saw a mom bust out a vape pen today at the public pool and all I could think is how unfortunate it would be to be her children,kyle_hulll,2015-07-20 23:47:20+00:00
33,623278008992858112,Win a SX Mini M Class mod from http://t.co/HPuS6IRx1L - http://t.co/cArFudYCsY #ecig #Vape,Hooper1331,2015-07-20 23:47:11+00:00
34,623277788091408384,A customer asked if the the Flower Mate mini power bank can charge the crafty... Charging a Vape with a Vape.. That's deep. #vapelife,PuffItUp,2015-07-20 23:46:19+00:00
35,623277753161416704,Health fears stoke regulations on 'vaping' http://t.co/ooNMxao9Ml,stanlynewspress,2015-07-20 23:46:10+00:00
36,623277550136127488,RT xboxexpert: Gotta hand it to supremacyvapors and dose.of.farrah my mailbox smelled great today ;) #vape… http://t.co/3RtrvEvjby;,vapemerch,2015-07-20 23:45:22+00:00
37,623277548764561408,RT CleverMonkay: Vape Wild Strawberry Cream (S+C)2 E Juice Full Review with Vape Session https://t.co/h9xUB65cYL  via YouTube #vape #vapor,vapemerch,2015-07-20 23:45:22+00:00
38,623277519706259457,i cant believe vapers are the main antagonists of crowds,brokiewinnie,2015-07-20 23:45:15+00:00
39,623277446578606080,EvolutionVapingOrg just went LIVE at [ http://t.co/qEaEoYbQBH ] on @Vapersdottv - #AutoTweet #Live #Video #Vaping #Vapers #ecig #Vapor,LiveOnVapers,2015-07-20 23:44:57+00:00
40,623277412734730240,True Life: I'm Married to the Vape Life,KyleMcL9,2015-07-20 23:44:49+00:00
41,623277357277679616,Tips on coil built with pic http://t.co/zQi68H4SD1 #ecig #vape #POTV,ukvaper,2015-07-20 23:44:36+00:00
42,623277216093335553,When @xo0xlovehim1 brings me into a vape store 😑,lovebrittanyoox,2015-07-20 23:44:02+00:00
43,623277110417866752,"We have ##crumble in half grams and full grams! 😧 Have a #vape pen?💨
Just pop a piece right on your… https://t.co/fHHBd0qIbp",vernonwellness,2015-07-20 23:43:37+00:00
44,623277026552737792,When is vaping gonna go out of style,queenmemezz,2015-07-20 23:43:17+00:00
45,623276900299984896,after 24986 years i finally found this clip. truly a historic day for a of us. (Vine by vape wizard) https://t.co/k0P1WdBbhK,adrianarashid,2015-07-20 23:42:47+00:00
46,623276809799495680,2 people followed me // automatically checked by http://t.co/d9TUcKENaY,juul_vl,2015-07-20 23:42:26+00:00
47,623276650168512512,Win a SX Mini M Class mod from http://t.co/70IJ08iCtY -  https://t.co/L93Y3PFLD9 #ecig #Vape,ListsFreak,2015-07-20 23:41:47+00:00
48,623276609076899841,There is a huge difference between smoking and vaping,olivia_weaver77,2015-07-20 23:41:38+00:00
49,623276471977508864,Win a SX Mini M Class mod from http://t.co/tAnsx0N8LX - http://t.co/tOscv10K3K #ecig #Vape,WizsWorld,2015-07-20 23:41:05+00:00
50,623276456311959552,Gotta hand it to @supremacyvapors and dose.of.farrah my mailbox smelled great today ;)  #vape… https://t.co/ORcAqplomW,xboxexpert,2015-07-20 23:41:01+00:00
51,623276392268959744,"Awe shit, I can't vape on planes???",AlyyyJavier,2015-07-20 23:40:46+00:00
52,623276178221174784,Got me a new vape today ☺️😚💨,So_Speciale,2015-07-20 23:39:55+00:00
53,623276107299745792,Morandir has written up a reply to some user feedback on the site. http://t.co/LuckWkEIbu #Vaping #Aspire #TritonTank,VaporReporter,2015-07-20 23:39:38+00:00
54,623276038529773568,Win a SX Mini M Class mod from http://t.co/w4jDNSf8CV - http://t.co/JHSG87XNj5 #ecig #Vape,rexdink,2015-07-20 23:39:22+00:00
55,623275948872314880,let_it_go just went LIVE at [ http://t.co/ihWzsVf8aw ] on @Vapersdottv - #AutoTweet #Live #Video #Vaping #Vapers #ecig #Vapor,LiveOnVapers,2015-07-20 23:39:00+00:00
56,623275940445949952,my moms smoking a cigarette in the car so I'm just vaping nonstop,BobbieJeannnn,2015-07-20 23:38:58+00:00
57,623275844635496449,Wait I just realized something.... I don't vape what the fuck bye https://t.co/mmwCCMYBOn,omariospizza,2015-07-20 23:38:35+00:00
58,623275831624773632,Local vape place is hiring. Tempted to drop an application in x3,TaurusSnowFox,2015-07-20 23:38:32+00:00
59,623275704986173444,my parents are always telling me to do something with my life.. little do they know I am a level 4 vape apprentice,noahdewaal,2015-07-20 23:38:02+00:00
60,623275635734151168,#mcm #vape #vapor #tornado #inappropriate commentary lol. #vapenado which reminds me I gotta get mine… https://t.co/94OyxANITu,lechaflan,2015-07-20 23:37:46+00:00
61,623275586668990465,"""I fought for your freedom!""
Yeah but do you vape bro?",Fratchett,2015-07-20 23:37:34+00:00
62,623275545686507522,Our best value yet! 40% off 120ml by using coupon code SV40 at http://t.co/ZNSCDbY3sK #eliquid #vape #discounts http://t.co/Shk7ekgrvh,sierra_vape_usa,2015-07-20 23:37:24+00:00
63,623275479320141826,this city and maybe even the WORLD are becoming positively LOUSY with vape lounges,lil_mermaid,2015-07-20 23:37:08+00:00
64,623275346331353088,who knew that there are so many ska songs about trains,vape_dad,2015-07-20 23:36:37+00:00
65,623275252907274242,Hell ya.. Going to rock vaping this line.. The juices are AMAZING.. https://t.co/ctMpKxQ2bd,SteamPoweredHRT,2015-07-20 23:36:14+00:00
66,623275167314132992,shoutout to the dad vaping poolside,adambacondavis,2015-07-20 23:35:54+00:00
67,623275123877908480,Win an Alchemyst E-Juice Sampler from @cigbuyer and @alchemystejuice: http://t.co/4DC5Z8QSFd #ecigs #vaping #eliquid #ejuice #vapegiveaway,swtrpeter1,2015-07-20 23:35:44+00:00
68,623274948312887297,I vaped like ten beers and injected three vicodins then snorted some w33d. Now im having a tea party with satan and harry styles,attackofme,2015-07-20 23:35:02+00:00
69,623274897293193216,"Our Platinum Subscribers Saw Their Stock Alerts Gain 4,000% In 10 Months! Subscribe Today: http://t.co/E82QmOJFrc $VAPE $IPSEY $AFFU",Stockaholics,2015-07-20 23:34:50+00:00
70,623274885628825600,Dose this look right 😂😂 #vape #mods #vapeshops #notblowingsmoke http://t.co/kg4zCr69jZ,naptownmodders,2015-07-20 23:34:47+00:00
71,623274865336954884,Don't vape. Stay in school,HeartFPS,2015-07-20 23:34:42+00:00
72,623274724601106432,"sleep all day

vape all nite",ADMRL_555tar,2015-07-20 23:34:08+00:00
73,623274708692271104,10 Facts That Everyone Gets Wrong About Vaping http://t.co/zFN3RH3yDi #Vape http://t.co/PXm656522j,CrewJuiceLiquid,2015-07-20 23:34:05+00:00
74,623274674659553280,#Vaping #Giveaway Win a whole line of #brandnewejuice from #MotleyBrew @vapingquestions! http://t.co/6cDkP4dxlK,tclahadow,2015-07-20 23:33:56+00:00
75,623274489229541376,hot_mess19 #vapevixens #vape #vapefam #vapelife #coillife #coilporn #coil #cloudporn #vapeon… https://t.co/Ao9elLNFHK,RockDrummerVape,2015-07-20 23:33:12+00:00
76,623274481566396416,Win a SX Mini M Class mod from http://t.co/us9wQQot3P - http://t.co/iB50gGHtpj #ecig #Vape,tclahadow,2015-07-20 23:33:10+00:00
77,623274367946850304,ATTENTION! Vape Shops &amp; Online Vape Store Owners We are having a 4U2VAPE TANK SPECIALS! E-mail us at info@4u2vape.net http://t.co/S2Mbp90X19,4U2VAPE,2015-07-20 23:32:43+00:00
78,623274146546479104,"Kangertech k-box mini in white😍 I love it, produces so much vape☺",Vxpourr_EU,2015-07-20 23:31:51+00:00
79,623273989247373314,Any Vape Ape USA lovers who volunteer let us know and we'll provide you a Vape Ape USA T-shirt to wear at the cup!  https://t.co/tNwERslly4,EvolVape,2015-07-20 23:31:13+00:00
80,623273953570766848,Quick vape before bed xD,Smalseyy,2015-07-20 23:31:05+00:00
81,623273837115736064,#win with @multicig quit #smoking and start #vaping via @AgataPokutycka Full #giveaway T&amp;C at http://t.co/OtARmVv4oN #goodluck,AllyBongoJ,2015-07-20 23:30:37+00:00
82,623273746791428096,"Back to vaping, I'm gonna miss smoking 😞😞",reefer_rose,2015-07-20 23:30:15+00:00
83,623273536333856768,If you record yourself vaping i hope you catch leukemia,inwardsinparis,2015-07-20 23:29:25+00:00
84,623273465324404737,"😎👍🏼Repost from @bella_izusia via igrepost_app, #vape #vapedaily #outlawsvapecrew #cloudandcoilgirl… https://t.co/yIZ6DQihSs",OutlawsVapeCrew,2015-07-20 23:29:08+00:00
85,623273280628224000,It's a Pirate thing. #vaping #thevaporbar http://t.co/8PeC8pXdT4,VaporBar,2015-07-20 23:28:24+00:00
86,623273275301478400,It's a Pirate thing. #vaping #thevaporbar https://t.co/dlm4gjeX0Y,VaporBar,2015-07-20 23:28:23+00:00
87,623273246742294528,Our Stock Pick On $GEQU Nearly QUADRUPLED In Value In Less Than 2 Weeks! Major News: http://t.co/Ar3yIMePCp $VAPE $IPSEY $AFFU,PennyStockingt,2015-07-20 23:28:16+00:00
88,623272869502550016,"""Vaping is cool and helps you fit in""- @conorvaracalli",andymcwilliams6,2015-07-20 23:26:46+00:00
89,623272672819040256,#ModCrushMondays X #MechModMondays | Seen From @big_q_numero_uno @thevapesnob | #modporn #MCM #vape http://t.co/APOiQwjqlH,DripClub,2015-07-20 23:25:59+00:00
90,623272670663045122,"Vaping devices now used with liquid marijuana and other narcotics?: KUALA LUMPUR, July 21, 2015:... http://t.co/UH9AgnPsBK #malaysianews",_ATOMbot,2015-07-20 23:25:59+00:00
91,623272668532310016,"Rakyat Post Vaping devices now used with liquid marijuana and other narcotics?: KUALA LUMPUR, July 21, 2... http://t.co/o0DCcY19x4 #news",sabahmajujaya,2015-07-20 23:25:58+00:00
92,623272509442551810,I've been in jersey for a half hour and I've seen 7 people with vape pens send help pls this is an epidemic,alexaggonzalezz,2015-07-20 23:25:20+00:00
93,623272189840728064,"allie decided this weekend that dudes who vape are called ""vapists"" spread the word",lil_mermaid,2015-07-20 23:24:04+00:00
94,623272132827451392,Win a SX Mini M Class mod from http://t.co/stVKlF4KNa - http://t.co/0AKrnAPZys #ecig #Vape,thehitmanlild,2015-07-20 23:23:50+00:00
95,623272049847468032,Bird Brains has been restocked in 3mg and 6mg after selling out the first 5days! Come try this spot… https://t.co/X2AcEcOCWS,U_Vape,2015-07-20 23:23:31+00:00
96,623272008000798720,Vaping is so fucking gay,PatAdcock1,2015-07-20 23:23:21+00:00
97,623272007308836869,"""I just wanna swim in her pool, not smoke vape""",delaneyymccannn,2015-07-20 23:23:21+00:00
98,623272001868673027,This is what I'm vaping on http://t.co/bKIC0Hyb1U,Souljah520,2015-07-20 23:23:19+00:00
99,623271904829403136,"Beach Vapes shirts coming soon!

#beachvapes #beachvapesventura #beachvapesporthueneme #8ohm5… https://t.co/vPqSzuPmSR",beachvapes,2015-07-20 23:22:56+00:00
100,623271897661206528,Dirty chuck chicks with vapes do love Jhene tho,Ron_XXI,2015-07-20 23:22:54+00:00
101,623271845446311937,Win a SX Mini M Class mod from http://t.co/ShhGJqOIEZ - http://t.co/52u9g337Se #ecig #Vape,PatricklerohlMe,2015-07-20 23:22:42+00:00
102,623271746729160705,Gonna start sending @aarnc311 all my vape snaps cause he's the biggest complainer 😂🌚,Markie___mark,2015-07-20 23:22:18+00:00
103,623271649966567428,In need of some delicious Diacetyl-free E-liquid? Intrinsic has got you covered! Check out website on our page for the link! #vapeon #vape,Intrinsic_Eliq,2015-07-20 23:21:55+00:00
104,623271585403637760,Vape life 😂😭  https://t.co/UD3MbDpgHV,subadruuu,2015-07-20 23:21:40+00:00
105,623271491556253696,I'm in such a happy place. I love my best friend. Missed him so much. &lt;3,vaped_crusader,2015-07-20 23:21:18+00:00
106,623271481070333952,4:20 grab your vape,phillanttt,2015-07-20 23:21:15+00:00
107,623271399927328768,When you see a hot guy and then he pulls out his vape and turns into a sexy guy,kaitlynthomass,2015-07-20 23:20:56+00:00
108,623271364812615680,Our Stock Pick On $PPCH Is Up Over 300% Since Our Original Release At .02! Huge News: http://t.co/Ab9x71OZD9 $VAPE $PTAH $TAUG,Stockenheimer1,2015-07-20 23:20:47+00:00
109,623271297951367168,#3787 Someone got Breakfast Club by Ruthless @eJuiceDirectCo &amp; saved a ton! http://t.co/0KoDBFUcTc #vape #ejuice,eJuiceDirectCo,2015-07-20 23:20:31+00:00
110,623271191554433025,Happy Bday to me!! xD hahaha Big thanks goes to vaping_oasis29_cal for everything and @vapestreetlv… https://t.co/uav5NPMisK,No_Ka_Oi_,2015-07-20 23:20:06+00:00
111,623271107773247488,my friend just bought a vape penn i am so disappointed,peasizedme,2015-07-20 23:19:46+00:00
112,623270888490856452,"At the pool without me... Smh! Repost from @bella_izusia via igrepost_app, #vape #vapedaily… https://t.co/OiQyIW0OTQ",OutlawsVapeCrew,2015-07-20 23:18:54+00:00
113,623270882132275201,"200,000 Subscriber Giveaway! | IndoorSmokers http://t.co/twFi8FYsvJ #Vape #ecig",VapeDon,2015-07-20 23:18:52+00:00
114,623270850859433984,Vaping for days,TAYLORxNATION,2015-07-20 23:18:45+00:00
115,623270770110808064,dad found my vape so that's cool.,ashh_reagan,2015-07-20 23:18:26+00:00
116,623270692579110912,"I need to get a vape, these blacks and cigs ain't good for me at all son",The_Chavez,2015-07-20 23:18:07+00:00
117,623270557992255488,"I know you want a cookie. Who wouldn't want a cookie? Here, vape a cookie. http://t.co/QveRtWu8Fs",ZeusEJuice,2015-07-20 23:17:35+00:00
118,623270445576519682,"Review | Twisted Sauce | Ebeneezer | 2 Can https://t.co/zs56iP1LLp
#vape #vapor #twistedsuace #ejuice #ecig #vapelife #subohm",HopeInChristTW,2015-07-20 23:17:08+00:00
119,623270432389513216,I woulda watched Mad Men if they vaped.,tomberlin,2015-07-20 23:17:05+00:00
120,623270187752488960,Vape Wild Strawberry Cream (S+C)2 E Juice Full Review with Vape Session https://t.co/D3vCAGrVk0 via @YouTube #vape #vapor,theRAWorange,2015-07-20 23:16:07+00:00
121,623270000829329409,Win a SX Mini M Class mod from http://t.co/Pe6WuZBpiv -  https://t.co/vT8sQIDdyc #ecig #Vape,dickenscindy2,2015-07-20 23:15:22+00:00
122,623269991186477060,Convinced I'm the only Asian that doesn't own a vape,adotvillablanca,2015-07-20 23:15:20+00:00
123,623269970995204096,"#Istick30w #Aspire #Nautilus mini with a super cool mod wrap, sold it today 2 a #smoker as his first setup £55 #ecigs http://t.co/yP4J5VCubc",vaping_worx,2015-07-20 23:15:15+00:00
124,623269862589206532,RT ZeroNicJuice: Freckled Lemonade ZeroNicJuice #Eliquid #Vape #ecig #VapeOn #Vapefam #VapeLife http://t.co/M0d2l3O7kK,vapemerch,2015-07-20 23:14:49+00:00
125,623269861163147264,RT TracewellsCo: The kuLi Euro trip continues in #Paris... http://t.co/PXRWgXAwVL; #vape #vaping #VapeOn #vapelife http://t.co/uULWjSfVDw,vapemerch,2015-07-20 23:14:49+00:00
126,623269684893360128,I liked a @YouTube video from @smoke2vape http://t.co/ywloP8BE79 Smoking vs Vaping - The Science,RalfysReviews,2015-07-20 23:14:07+00:00
127,623269609534308352,"RT imtheweatherguy: IG: http://t.co/1m9002TPfE  ""#green #friends #training #vape #michaelkors #flowers #enjoy #ha… http://t.co/yppa8Pepst",BoCaribbean,2015-07-20 23:13:49+00:00
128,623269534032527360,vapers b walkin around lookin like jedi n shit,lousyhex,2015-07-20 23:13:31+00:00
129,623269491527385088,I'm calling it Vape Jizz from now on.,rollmottle,2015-07-20 23:13:21+00:00
130,623269438159200256,Make your vaping experience unique with the Royal Hunter RDA! http://t.co/0A93y2nOzo http://t.co/iS5jSD5BLi,GFVaporShop,2015-07-20 23:13:08+00:00
131,623269320009850880,"gotta heat the vape up, let's get faded",arelle_xox,2015-07-20 23:12:40+00:00
132,623269212547473408,"It's like I'm Clark Kent, and my vape is my costume, #whenivapeifeellikesuperman",LaschExtensions,2015-07-20 23:12:14+00:00
133,623269150551486464,Why smoke the devils lettuce when there's vape and black tar!?,vapeluver666,2015-07-20 23:11:59+00:00
134,623268995857281024,When your mom hangs out @the vape shop with all your friends😂 @KelseyRaee11 @jackdono18 @MahoodGlyn @Jake_Morgan1996 http://t.co/6961YGJbob,makennadrayer,2015-07-20 23:11:23+00:00
135,623268846879776768,We get it u vape http://t.co/oP6BAQfpHe,z_nuhh,2015-07-20 23:10:47+00:00
136,623268573771886593,"Our Platinum Subscribers Saw Their Stock Alerts Gain 4,000% In 10 Months! Subscribe Today: http://t.co/E82QmP1gPM $VAPE $PTAH $TAUG",Stockaholics,2015-07-20 23:09:42+00:00
137,623268199761481728,unicronshole just went LIVE at [ http://t.co/eGZBNdhPCa ] on @Vapersdottv - #AutoTweet #Live #Video #Vaping #Vapers #ecig #Vapor,LiveOnVapers,2015-07-20 23:08:13+00:00
138,623268021063274497,William is vaping and I am laying here drunk and disappointed,jordanpeklo,2015-07-20 23:07:30+00:00
139,623268012154572800,Oh boy and there's a vape shop down the road,spida2Ybanana,2015-07-20 23:07:28+00:00
140,623267933515591680,Vape on ✊🏻💨 @ Mcdonald's Eco Tropics https://t.co/gE0lHJmVPw,AyepAnuar,2015-07-20 23:07:09+00:00
141,623267787327295489,"vape, vaping is really hot #howtokeepyourgirlhappy",HowToKeepAGf,2015-07-20 23:06:34+00:00
142,623267740846002176,"Don't miss out on today's 15% off VV/VW devices, Mods and Imren Batteries. #NOTblowingsmoke #vape… https://t.co/Xd8rcfuqmh",FlawlessvapesOC,2015-07-20 23:06:23+00:00
143,623267719945822208,The Evic Vt has been restocked in white and orange after selling out in a week! Grab one before they… https://t.co/Np475k5VOY,U_Vape,2015-07-20 23:06:18+00:00
144,623267512696766464,"Naturally infused with caffeine, taurine &amp; b-12. NO NICOTINE. #zip #zipenergyvapor #vapelife #energy #caffeine #vape http://t.co/e8sziwccHj",ZipVapor,2015-07-20 23:05:29+00:00
145,623267511635578881,Buy any starter kit or battery at 23.99 &amp; enjoy 15% OFF an additional battery! More time to for outside #vapeon #vape http://t.co/hVt7wP6osw,VaporwizeSTL,2015-07-20 23:05:29+00:00
146,623267446749831168,"Someone just followed me on Instagram with a bio that says ""Vape Specialist"" ?????",TaylorCarleyy,2015-07-20 23:05:13+00:00
147,623267349769142272,LIVE on #Periscope: Wats good jus got my #flavors for my #vape 💨💨💨💨💨 #nyc #laughfactory #heartgang #pumphearts… https://t.co/NtfC4I9Nm9,DaReAlArAbMoNeY,2015-07-20 23:04:50+00:00
148,623267080696131584,#3786 Someone got One Hit Wonder @eJuiceDirectCo &amp; saved a ton! http://t.co/zdpu8e9YeY #vape #ejuice,eJuiceDirectCo,2015-07-20 23:03:46+00:00
149,623267027814383616,Hey man you look really cool walking around an amusement park with your vape pen,yellamoekaj30,2015-07-20 23:03:33+00:00
150,623266983140659200,Our Stock Pick On $GEQU Nearly QUADRUPLED In Value In Less Than 2 Weeks! Major News: http://t.co/Ar3yIMePCp $VAPE $PTAH $TAUG,PennyStockingt,2015-07-20 23:03:23+00:00
151,623266980636667904,Shoutout to eciggity! http://t.co/rFsMOcBWDO #vape #ecigs #reddit,ukvaper,2015-07-20 23:03:22+00:00
152,623266979776860160,"Just started vaping a couple days ago, does everyone go through a ton of liquid?? http://t.co/UxV8r9axfN #vape #ecigs #reddit",ukvaper,2015-07-20 23:03:22+00:00
153,623266978916990976,Can I use 100% VG with an Aspire BDC? http://t.co/9h4Uxqvq7X #vape #ecigs #reddit,ukvaper,2015-07-20 23:03:22+00:00
154,623266663811710976,Vape pens are fedoras for your mouth.,WARHURYEAH,2015-07-20 23:02:07+00:00
155,623266614830608384,0.31 ohm NI200 build on a Vivi Nova using 11 wraps of 0.2mm. Vapes quite nicely :) http://t.co/DsPB6yEMVn,Entropy72,2015-07-20 23:01:55+00:00
156,623266577832669184,.@PikePlaceMarket are you guys #vapefriendly? I was #vaping and eating mac n cheese from Beechers and nobody said anything.#wecool?,MBV_Wholesale,2015-07-20 23:01:46+00:00
157,623266541019267072,#win with @multicig quit #smoking and start #vaping via @AgataPokutycka Full #giveaway T&amp;C at http://t.co/djXZMLxFdH #goodluck,Alica73,2015-07-20 23:01:37+00:00
158,623266479622983680,#3785 Someone got Flave Lab @eJuiceDirectCo &amp; saved a ton! http://t.co/SWHXrmkzbf #vape #ejuice,eJuiceDirectCo,2015-07-20 23:01:23+00:00
159,623266407564886017,Grandmas a model for a vape magazine no bullshit http://t.co/zoKGu7dxjS,goawaymom,2015-07-20 23:01:05+00:00
160,623266373863510016,"Have you been searching for CBD oil? We have it, it's called Frog Tonic. Come check it out! #cbd #frogtonic #cbdoil #ecigexpress #vape #ecig",eciglynnwood,2015-07-20 23:00:57+00:00
161,623266210566807552,Our awesome best selling widget of last day: G Pro Vaporizer http://t.co/ijBhRiYnII http://t.co/0A8ih7J7yP,vape_mc,2015-07-20 23:00:18+00:00
162,623266203100909568,Minneapolis visitors and residents may now Stop &amp; Shop Dicks Vape Shop for a variety of #MBinc fashions @ChixLoveDic… http://t.co/aqNVpSXlDr,Monkey_Bunny,2015-07-20 23:00:17+00:00
163,623266154660896768,Find us at the Vape China Vape Expo on the 23rd to the 25th of July! We'll be exhibiting the @gq_vape style to... http://t.co/oqut2c9fWO,GQVape,2015-07-20 23:00:05+00:00
164,623266121420926976,"ive been looking for my vape for the past couple days ,and i find it in my dads office with no juice... BRUHHH",Brianhoangho,2015-07-20 22:59:57+00:00
165,623266066504945664,SouthernVaperz just went LIVE at [ http://t.co/0WlhTy18cj ] on @Vapersdottv - #AutoTweet #Live #Video #Vaping #Vapers #ecig #Vapor,LiveOnVapers,2015-07-20 22:59:44+00:00
166,623265965485236224,Vape Store Survey Results [Infographic] http://t.co/po65LTFmSn,SteveVape,2015-07-20 22:59:20+00:00
167,623265849843978240,i feel really blessed that i get to watch people vape in the dreamworks parking lot from my office window,Cuppatan,2015-07-20 22:58:52+00:00
