,TweetID,TweetContent,TweeterUsername,TweetDatetime
0,619294924865810432,Win a Whiteout Evolv DNA200 Box Mod! #vaporjoes #vapingunderground #vaping http://t.co/tkKV8Md9Fb,dennyd75,2015-07-09 23:59:50+00:00
1,619294921107730432,VULive just went LIVE at [ http://t.co/44iyqk1KOD ] on @Vapersdottv - #AutoTweet #Live #Video #Vaping #Vapers #ecig #Vapor,LiveOnVapers,2015-07-09 23:59:49+00:00
2,619294890598379520,Guardwolf21 just went LIVE at [ http://t.co/uY24sffxsz ] on @Vapersdottv - #AutoTweet #Live #Video #Vaping #Vapers #ecig #Vapor,LiveOnVapers,2015-07-09 23:59:42+00:00
3,619294857522216960,"Vaping makes me happy! 😎
💨 Vape On My Friends! 💨 
#Vapegard #ecig #ejuice #ejuices #eliquid… https://t.co/kR8LFFGpcB",vapegard,2015-07-09 23:59:34+00:00
4,619294709744291840,"@ Elix Vapor

http://t.co/OocaIQFyyN
9750 Walnut Street #158 
@ Walnut Mall

#Vape @ Elix Vapor https://t.co/drqqOQ9GS4",ejuicely,2015-07-09 23:58:59+00:00
5,619294647551152128,Finally got our flag in today!! #vapelife @ Mountain View Vapes https://t.co/b8aiwpE2yN,MountainViewVap,2015-07-09 23:58:44+00:00
6,619294482924748800,Fresh build 24g Kanthal 0.35ohms  #vape #istick #50watts #eleaf #Derringer https://t.co/qytzIZJDyQ,joe61277,2015-07-09 23:58:05+00:00
7,619294390830407680,"ok i just walked past a vape place at the mall and there was a guy with a mullet and a shirt that said ""red white &amp; barbecue"" why is that me",whodatfink,2015-07-09 23:57:43+00:00
8,619294240644927488,Win a Whiteout Evolv DNA200 Box Mod! http://t.co/tkKV8LVyND #vaporjoes #vapingunderground #vaping,dennyd75,2015-07-09 23:57:07+00:00
9,619293967528656897,"So I knew vaping was probably bad for you, but here's why I'm putting it down once and for all: http://t.co/oDmFS57luO",Sonic_geometry,2015-07-09 23:56:02+00:00
10,619293893843120128,"@ the Shop!

http://t.co/HK3z03hDIH

Fizzle is live @ http://t.co/IpHQX8wFIJ!
Juice Check!

Vape some eLix™ Premium… https://t.co/YRvf9wWOOt",ejuicely,2015-07-09 23:55:44+00:00
11,619293777363120129,Tickets On Sale now and check out our last post to enter to Win FREE VAPE PEN from  dab_stix… https://t.co/dKKVTVx0ZG,FortunateYouth,2015-07-09 23:55:17+00:00
12,619293712741478400,Vaping is the new Axe body spray.,dakotafloyd,2015-07-09 23:55:01+00:00
13,619293627051823107,"Fizzle is live @ http://t.co/IpHQX8wFIJ!
Juice Check!

Vape some eLix™ Premium e-Liquid. A premium blend… https://t.co/F8Jx3I8YaV",ejuicely,2015-07-09 23:54:41+00:00
14,619293623256002560,The struggle is real -- rebuild day for reviews -- #handcheck #vape #vapedeals #vapesales #pananal… https://t.co/1X5CqMMbcx,NitroBexReview,2015-07-09 23:54:40+00:00
15,619293567614324736,Dude I want a vape box,TheTreeKeeper,2015-07-09 23:54:27+00:00
16,619293479949234177,"shop was out of unicorn milk &amp; drunk monkey. vaping cuttwood's boss reserve. me likey, just have to find the sweet spot.",Starzeh,2015-07-09 23:54:06+00:00
17,619293479492059137,Mornig vaper #vape #vapeholic #vapefamily #vapelife #x-6 #vaporindonesia #vapeporn #lovevape https://t.co/VAiye3CVVi,Swanditha_,2015-07-09 23:54:06+00:00
18,619293474672799744,Electronic cigarettes have a... http://t.co/lckhD6CpAE #trustedsolution #lunarroverusa #vape #vaping #vapelife #vapelyfe #ecigs,LunarRoverUSA,2015-07-09 23:54:04+00:00
19,619293408973189120,#3350 Someone got One Hit Wonder @eJuiceDirectCo &amp; saved a ton! http://t.co/zdpu8e9YeY #vape #ejuice,eJuiceDirectCo,2015-07-09 23:53:49+00:00
20,619293244136886272,Rebelwithacause just went LIVE at [ http://t.co/PAf6Cu7tbW ] on @Vapersdottv - #AutoTweet #Live #Video #Vaping #Vapers #ecig #Vapor,LiveOnVapers,2015-07-09 23:53:09+00:00
21,619292965001826304,my mom just told me people die from vaping. goodnight😂😂😂,kyleigh_e,2015-07-09 23:52:03+00:00
22,619292927110553600,"I'm sitting on my porch, Vaping nicely, admiring a massive thunderstorm rolling through. Nature is Awesome!",mckinley_mike,2015-07-09 23:51:54+00:00
23,619292778829357056,"this tweet screams ""I vape and I'm not afraid to steal a monster energy from the store"" https://t.co/ubZjmLRakY",coochiewitch,2015-07-09 23:51:19+00:00
24,619292712534192128,I need to get a vape,conconmcleod,2015-07-09 23:51:03+00:00
25,619292606258745344,I need a vape 😙💨,daisyarellanoo,2015-07-09 23:50:37+00:00
26,619292557789556736,Go check out the review of the @coilmasternet K-BAG on Instagram: @_vape_is_life #vape #vapefam #vapeon #CloudChasing http://t.co/telUOrX73U,_vape_is_life,2015-07-09 23:50:26+00:00
27,619292390759776256,RT BreatheCig: Hot963 BreatheCig #loosescrees #breathe TWEET THAT ISH. LooseScrews_ BreatheCig #Vape #Smart http://t.co/8qwofLkPYh,vapemerch,2015-07-09 23:49:46+00:00
28,619292268093026304,Why do I need an ultrasonic cleaner? http://t.co/VvkbcW1s4h #vape #ecigs #reddit,ukvaper,2015-07-09 23:49:17+00:00
29,619292265232465920,Best VW/VV Mod for low cash? http://t.co/hrKu5eERbO #vape #ecigs #reddit,ukvaper,2015-07-09 23:49:16+00:00
30,619292228020797443,"Join us this weekend with a bottle of Tuxedo Vapes, refreshing, sweet, affordable. What are you… https://t.co/OYTr3fErAu",tuxedovapes,2015-07-09 23:49:07+00:00
31,619292181937795072,"This is great news - focusing in on safety and efficacy as a cessation product. In the end,   vaping=harm reduction  https://t.co/UdVwtOqzHM",freedomsmokeles,2015-07-09 23:48:56+00:00
32,619292052862283776,The_Asylum just went LIVE at [ http://t.co/1UHcKCKRlp ] on @Vapersdottv - #AutoTweet #Live #Video #Vaping #Vapers #ecig #Vapor,LiveOnVapers,2015-07-09 23:48:25+00:00
33,619292007760924672,VapeTrixNetwork just went LIVE at [ http://t.co/hX1UhEln4d ] on @Vapersdottv - #AutoTweet #Live #Video #Vaping #Vapers #ecig #Vapor,LiveOnVapers,2015-07-09 23:48:15+00:00
34,619291844275511298,Anyone wanna buy a vape? 👀,iThump_,2015-07-09 23:47:36+00:00
35,619291777435049988,Vape pens and dry herb pens for sale just link me 7224315 https://t.co/PUtJgTyODD,chasogawd,2015-07-09 23:47:20+00:00
36,619291690826866688,Vaping is slowly destroying America,JbFarmz,2015-07-09 23:46:59+00:00
37,619291670186602496,Lmao once I posted my last tweet a Vape account followed me wtf no I don't actually Vape smh,AkimboDuck,2015-07-09 23:46:54+00:00
38,619291597650444288,"top 3 things in life
dogs
kids
vape",zackbryantt,2015-07-09 23:46:37+00:00
39,619291498878795776,#3349 Someone got One Hit Wonder @eJuiceDirectCo &amp; saved a ton! http://t.co/zdpu8e9YeY #vape #ejuice,eJuiceDirectCo,2015-07-09 23:46:13+00:00
40,619291373989179393,my mom took my vape 😩😩😩 does that bitch know how much money i stole from her to buy it?? that was hard work! i earned it!,fihs2018,2015-07-09 23:45:44+00:00
41,619291346617139201,YOUR VAPE SMELLS DISGUSTING DOUCHE #roccity #pitp,la_dame_vert,2015-07-09 23:45:37+00:00
42,619290932949721088,my goal in life is to become a vape god,zackbryantt,2015-07-09 23:43:58+00:00
43,619290906986844160,Okay.. My Topoo vape box still works really good. I don't think I've used it in the 2+ yrs that I've been back in Hollywood.,MentalRiot,2015-07-09 23:43:52+00:00
44,619290633749037056,so turns out toni can't handle the vape lifestyle,juliannaDEL_REY,2015-07-09 23:42:47+00:00
45,619290466954031104,Thanks to @TheTVAShow and @Thevaporgirl for this week's giveaway. Excited! #organic #vaping https://t.co/EsCrfo2qLi,Simer333,2015-07-09 23:42:07+00:00
46,619290432569245697,Stressing needed that #vapelyfe #vape #vapelife https://t.co/Mb2ivZjK6w,bigjo11411,2015-07-09 23:41:59+00:00
47,619290144596570112,I've just got my Topoo vape box out. I forgot I had it. I will give it a spin ad see how it still works.,MentalRiot,2015-07-09 23:40:50+00:00
48,619290135562031104,"Confused with Online pricing with Vape Products this might help #vape #vapeon #VapeLife #vapefam 
http://t.co/ou7m6eLVjJ",sovereignvg,2015-07-09 23:40:48+00:00
49,619290062358978560,"Cold iced tea, my favorite vape set up, music, and the evening sky. Life's good 👌",KyleJuhasz,2015-07-09 23:40:31+00:00
50,619290052938432512,"Why is there a cafe in vape division, then I questioned why there's a drive thru, but the real question is why is the lady wearing a bikini❔",cj_senpaii,2015-07-09 23:40:29+00:00
51,619290015147790336,If I see another 40 year old dad with a vape imma fuck his wife since he wanna be childish,patpatbushi,2015-07-09 23:40:20+00:00
52,619289958239612928,Health Canada needs to consider benefits of electronic cigarettes http://t.co/vZ93c1kJdu via @north_news #vaping,dave_lcsog,2015-07-09 23:40:06+00:00
53,619289862219411456,"$20 off series 3 Vaporizer! E-Liquid, wax or tobacco!  http://t.co/1ZBdhs1T68 #ecigs #vape #vapeporn #pricetosell http://t.co/1A1yUCZD6F",Spacedit29,2015-07-09 23:39:43+00:00
54,619289840740380672,This cop is literally sitting in his cop car vaping in front of me. What is life?,WanjikoIAm,2015-07-09 23:39:38+00:00
55,619289568555237377,i vape in the shower,zackbryantt,2015-07-09 23:38:33+00:00
56,619289547042467840,TNT 80 Available at EC Supply Inc! Contact us for more information at http://t.co/Fw7wBECLdu #vape #vapers #ecig http://t.co/qXH7MjGayJ,ECSupplyInc,2015-07-09 23:38:28+00:00
57,619289310047674368,Cobourg’s Nancy Hendsbee kicks 34-year smoking addiction with electronic vaping http://t.co/GHj3y4o9YG via @north_news,dave_lcsog,2015-07-09 23:37:32+00:00
58,619289287985623040,I invented the Vape snapchat,CHINNGLAND,2015-07-09 23:37:26+00:00
59,619289196453216256,Yes Please @1percent! Giveaway&gt; http://t.co/YFlqcp5Q1C @MagicFlight Monocle #Vape+#DannyCamp+@ChakaGlass #AmericanMade420,brmetcalf,2015-07-09 23:37:04+00:00
60,619289090152861696,Tap the link in my bio to get them instantly! #clashofclans #snapchat #tumblr #fashion #vape #gta5 #grandtheftauto … http://t.co/UoEqwZ4y0x,NoobworxTV,2015-07-09 23:36:39+00:00
61,619289024386203648,guy with a giant vape http://t.co/XiKsWFCLko,yusurf2019,2015-07-09 23:36:23+00:00
62,619288933332045824,"More #vappix30k Swag 

#Repost dub_g_aka_moscato
・・・
Got my awesome vape treasures from @vappix!… https://t.co/azIBPJnQC6",Vappix,2015-07-09 23:36:02+00:00
63,619288807574212608,A vape tornado destroyed my house,Gretchen_Villar,2015-07-09 23:35:32+00:00
64,619288752742100992,Press pass granted for SWOF at vaper expo.  See you all there.,smoke2vape,2015-07-09 23:35:19+00:00
65,619288678024785925,"""Excuse me. Can I vape in here?""",SpookyJoelder,2015-07-09 23:35:01+00:00
66,619288568222097410,vape is love vape is life,zackbryantt,2015-07-09 23:34:35+00:00
67,619288484088418305,Ladies when dudes hit on you how often are they bragging about their vapes,Joowan,2015-07-09 23:34:15+00:00
68,619288305595772928,#Vape #Vaping Nitecore Digicharger D4 &amp; 4 Sony VTC5 Batteries #Giveaway #Sweepstakes enter here #Free http://t.co/s4ZuXRJsom,exotic1,2015-07-09 23:33:32+00:00
69,619288258422415361,"Aiduce, on behalf of French vapers, invited to present their cause to the French Senate! http://t.co/WlWDBDtX89",Schildersstraat,2015-07-09 23:33:21+00:00
70,619287882507751424,he only vapes on the weekends https://t.co/Ruf6BJr1CL,yoonschwe,2015-07-09 23:31:51+00:00
71,619287567049949184,Metal Heads Unite-Vaping: http://t.co/fmy4705Uui,Metalrulz,2015-07-09 23:30:36+00:00
72,619287530152833024,SB140 Defeated http://t.co/LGoMcM9ZFn #trustedsolution #lunarroverusa #vape #vaping #vapelife #vapelyfe #ecigs,LunarRoverUSA,2015-07-09 23:30:27+00:00
73,619287494954123264,TroveLive just went LIVE at [ http://t.co/ErReoUDM19 ] on @Vapersdottv - #AutoTweet #Live #Video #Vaping #Vapers #ecig #Vapor,LiveOnVapers,2015-07-09 23:30:19+00:00
74,619287467980623872,Do you cough when you vape? @thesmokersangel explains the problem and offers some useful tips to rectify it: http://t.co/7kFp7YevLp,ecigreviewed,2015-07-09 23:30:12+00:00
75,619287424989011968,vape tire,vapeeverything,2015-07-09 23:30:02+00:00
76,619287383058419712,"""Thanks for #vaping."" - Your Lungs

#Mmj #cannabis #vape #wellness #vapir #vapirrise2 #science http://t.co/fW8ZoNm0A8",VapirVaporizers,2015-07-09 23:29:52+00:00
77,619287379069636608,I just seen some old lady like in her 60's vaping wtf 😂😂,gumarohjr,2015-07-09 23:29:51+00:00
78,619287378352558080,"RT Melinda_io: Pissed im out of key lime pie juice, will need to buy more before going to Florida. Gotta find a local #vape shop.",vapemerch,2015-07-09 23:29:51+00:00
79,619287319443570689,Just saw a dude vaping in a smart car and I do not like where America is heading,TheJackMolito,2015-07-09 23:29:37+00:00
80,619287297368961024,hold on. does seungchul even vape? on the reg?,myoldaccs,2015-07-09 23:29:32+00:00
81,619287283699728384,Vaping on the deck with the neighbour kids outside running around like chickens with no heads. #slowdownchamps,CaseyFitch93,2015-07-09 23:29:28+00:00
82,619287262879162368,puff puff pass with the vape,zackbryantt,2015-07-09 23:29:23+00:00
83,619287115361206272,Enter to win a Kanger Subox and 3 bottles of Cuttwood ejuice at http://t.co/u0Ql2G29dG #vape https://t.co/gBiypQEXTi,kartoons1979,2015-07-09 23:28:48+00:00
84,619287095476142080,Scientists Shocked After E Cig Test Results!!! Vaping Indoors OK? http://t.co/BQVbn0F2iL,whitewolf1977,2015-07-09 23:28:44+00:00
85,619287056641036288,experienced vaper talks down to new vaper in vape club (Vine by @packieperkins) https://t.co/IOiig8jQq3,BrandonLee06,2015-07-09 23:28:34+00:00
86,619286948356603908,"Come on out guys, if you were there for last years VapeMeet then you know how much awesome Vape stuff we give away! http://t.co/gdv2GAVOYl",OrionsVapor,2015-07-09 23:28:08+00:00
87,619286685910593536,#Vaping #Giveaway Win a whole line of #brandnewejuice from #MotleyBrew @vapingquestions! http://t.co/7M7BlzaSkd,audyroo,2015-07-09 23:27:06+00:00
88,619286484991012865,"Restock!

SS Ego one 
Kanger Subtank mini
Matrix
&amp; all coils restocked !

#H2oVapors #teamH2o #calivapers #vape... http://t.co/bVOmeZ2h2Z",H2oVapors,2015-07-09 23:26:18+00:00
89,619286433711398913,You haven't seen anything until you've seen people vaping on the Metro Rail train. #Buffalo,rjflesher,2015-07-09 23:26:06+00:00
90,619286433325563904,WHEN HE COLLECTS VAPE FLAVORS😫😫😫😫😫😫😍😍😍😍👌🏼👌🏼👅👅👅🔥🔥🔥,imfaithdanielle,2015-07-09 23:26:06+00:00
91,619286206283673600,I added a video to a @YouTube playlist http://t.co/DhNlg4AkGf Vape VLOG #16 - 30/06/15 - iStick TC 40 &amp; Lipo Batteries,QuitSmokingtr,2015-07-09 23:25:12+00:00
92,619286188311080960,Needed this here for personal use.... (Vine by vape wizard) https://t.co/sSRwDt9mKE,tobiii_b,2015-07-09 23:25:07+00:00
93,619286176730644480,"Hope this is how you spent your #daily420, #medicated of course!
#liquidgold #vape pens work with… https://t.co/qF6FaY1I0e",GFarmaLabs,2015-07-09 23:25:04+00:00
94,619285941706956800,I added a video to a @YouTube playlist http://t.co/nOXNRn4raa Vaping Temp Control Mods SMY 50 watt TC and IPV3 Li 165 watt TC Review,QuitSmokingtr,2015-07-09 23:24:08+00:00
95,619285581952978945,"LMAO im just goin2pick my Chinese up&amp;I see this old chick wearing this ""vape like a boss"" shirt RT 2 spread awareness http://t.co/4D4FYp7Nfb",JoeySacco9,2015-07-09 23:22:43+00:00
96,619285549220806656,Leave the haters behind in combination of dust and dank vape smoke,StupidNeel,2015-07-09 23:22:35+00:00
97,619285519181090816,"Why you cough when you start vaping, and how to stop it. http://t.co/ATG56m4eYz",blueangelvapes,2015-07-09 23:22:28+00:00
98,619285466781650945,Win a SX Mini M Class mod from http://t.co/u0Ql2G29dG - http://t.co/y8juLAT6Hj #ecig #Vape,kartoons1979,2015-07-09 23:22:15+00:00
99,619285422234038272,take one hit of the vape and all ur problems go away,zackbryantt,2015-07-09 23:22:05+00:00
100,619285169577545728,Vaping around  ☁ https://t.co/NCK5IcgWSX,ferr555,2015-07-09 23:21:04+00:00
101,619284927171825664,Enter to win a Kanger Subox and 3 bottles of Cuttwood ejuice at http://t.co/d5eYnUJ9nQ #vape https://t.co/Kr8EglMyDW,manier2013,2015-07-09 23:20:07+00:00
102,619284840500854784,"Saw a guy vaping while wearing a fedora.
I thought these people only lived in myth and meme.",PShewBirdGod,2015-07-09 23:19:46+00:00
103,619284774893580289,"Repost from @blvdeliquid #StreetTeamMember dingus_vapes 
#HandCheck #BlvdEliquid #PremiumEliquid… https://t.co/OuwkKtDwkP",BlvdEliquid,2015-07-09 23:19:30+00:00
104,619284732690345984,how to vape: don't,kayleewhalee,2015-07-09 23:19:20+00:00
105,619284640415637504,#win with @multicig quit #smoking and start #vaping via @AgataPokutycka Full #giveaway T&amp;C at http://t.co/OtARmVv4oN #goodluck,AllyBongoJ,2015-07-09 23:18:58+00:00
106,619284507108245504,"Posted by: knives_and_vapes
Tags: #Striderknives #EDC #EveryDayCarry
Link: http://t.co/BVQFgWMYDr http://t.co/bcIy9DvZ1E",Lets_Talk_Steel,2015-07-09 23:18:26+00:00
107,619284505673748480,"Yo guys can u pass the vape my way, I haven't tried that flavor http://t.co/lO2XxLCQVb",sadskateboy,2015-07-09 23:18:26+00:00
108,619284396848357377,Vape and bad b!+ches,Coldwaypro,2015-07-09 23:18:00+00:00
109,619284111451009024,Random guy at boogie burger just asked me if and how much I vaped. What is America coming to?,_benthompson123,2015-07-09 23:16:52+00:00
110,619283903535120384,Vaping safety prompts call for smoking policy rethink http://t.co/Z1RWPrU4Uo,waateanews,2015-07-09 23:16:02+00:00
111,619283659917389824,😭😭😭 @ my dad getting mad at my 25 year old brother for vaping. VAPING.,Stardusth2o,2015-07-09 23:15:04+00:00
112,619283638023266304,RT BreatheCig: Hot963Blazin #loosescrees #breathe TWEET THAT ISH. LooseScrews_ BreatheCig #Vape #Smart http://t.co/2bjcSyeXdd,vapemerch,2015-07-09 23:14:59+00:00
113,619283614778458112,If you don't listen to we dem boys while you vape then what are you really doing?,JonT8991,2015-07-09 23:14:54+00:00
114,619283586328297472,Win a SX Mini M Class mod from http://t.co/d5eYnUJ9nQ - http://t.co/fsqyI4mMdZ #ecig #Vape,manier2013,2015-07-09 23:14:47+00:00
115,619283571405115393,Made it to the welcome center with 5 min to spare. Got our tiny orange juice! http://t.co/nLZM2Rc9yn,Vape_Texas,2015-07-09 23:14:43+00:00
116,619283438424752132,the temptation to get the Absinthe E-Liquid that advised not to drive soon after vaping was strong!,laurie810,2015-07-09 23:14:12+00:00
117,619283406405402624,"Wow! I just won this for free, VAPE VAPING 2 NEW 6ML AES CHROME &amp; GLASS CARTOMIZER TANKS WITH  http://t.co/OQkR83JsKS #listia",DantinDoras,2015-07-09 23:14:04+00:00
118,619283359991250945,14w on an 80w device theangstfulvaper would be so proud ;-) #vapingcommunity #vaping #plumesofhazard… https://t.co/Q4peaAlSCW,Vaping_Biker,2015-07-09 23:13:53+00:00
119,619283068122038272,"*Douche lounging in a chair* ""do you know what the weather will be like?"" *friend isn't sure* *douche hits vape pen* ""chance of clouds""",Kulprit_34,2015-07-09 23:12:43+00:00
120,619282844431577088,Another one of the @autofashion_usa x @trendy_vape cars that will be on deck at @spocom Super show Anaheim  This... http://t.co/qXC09BzK3I,AutoFashionUSA,2015-07-09 23:11:50+00:00
121,619282829906739200,#3348 Someone got Flave Lab @eJuiceDirectCo &amp; saved a ton! http://t.co/SWHXrmkzbf #vape #ejuice,eJuiceDirectCo,2015-07-09 23:11:47+00:00
122,619282774168449024,YOU HAVE UPSET THE VAPE GODS,JDPanzica,2015-07-09 23:11:33+00:00
123,619282731202035712,"This thunderstorm started as soon as that bitch said that stupid shit about vaping. 
HEY, THE CLOUDS HEARD YOU AND NOW THEY'RE ANGRY.",JDPanzica,2015-07-09 23:11:23+00:00
124,619282498388758528,#Vaping #Giveaway Win a whole line of #brandnewejuice from #MotleyBrew @vapingquestions! http://t.co/eXYqPfmxeZ,TerryPatton16,2015-07-09 23:10:27+00:00
125,619282386853871616,When I vape I feel like God spitting out little vape clouds SCIENTIFIC FACT💯💯💨💨,vapeluver666,2015-07-09 23:10:01+00:00
126,619282346026643456,step son vaping hahahahahahahahahahahahaha https://t.co/vPniEwS7HH,xjakeherbertx,2015-07-09 23:09:51+00:00
127,619282258084691968,"2 vape related tweets in a row gets me noticed, #vapelife #ItsNotaCultureItsMyReligion #VapeWorldwide http://t.co/MQo3STDhRS",Matty_abc123,2015-07-09 23:09:30+00:00
128,619282229009756161,Vaping at work like https://t.co/4lOxVnbdzn,needypinvag,2015-07-09 23:09:23+00:00
129,619282212135899136,Good builds for more vapor less flavor http://t.co/lQxAwKWCHf #vape #ecigs #reddit,ukvaper,2015-07-09 23:09:19+00:00
130,619282211418693632,Castigador box clone and Dotmod Petri clone http://t.co/ZDK8wpppOp #vape #ecigs #reddit,ukvaper,2015-07-09 23:09:19+00:00
131,619282210508574720,Cutting for flavor http://t.co/fJ4Jy5gosK #vape #ecigs #reddit,ukvaper,2015-07-09 23:09:19+00:00
132,619282204183691264,LIVE on #Periscope: Vape - BCC Mega - SS6 https://t.co/OSoRYovEe9,3markey_mark,2015-07-09 23:09:17+00:00
133,619282130649137152,MY MOM JUST TOLD ME SHE TRIED VAPE 😂😂😂,Mikyleigh_1997,2015-07-09 23:09:00+00:00
134,619282051917828096,The sound guy at this show is vaping.,BalthaazarStars,2015-07-09 23:08:41+00:00
135,619282018191302656,Happy Vaping friends! (:,PureVaporWalnut,2015-07-09 23:08:33+00:00
136,619281941817221120,That's pretty cool that all of you e-cig vapers can get married now.,goatwhore666,2015-07-09 23:08:15+00:00
137,619281856316338176,I'm so happy I got my vape fixed,_DrPayne,2015-07-09 23:07:54+00:00
138,619281816864866304,SHERLOCK VAPING SUSGSJSGSSUDGD,hommefataIe,2015-07-09 23:07:45+00:00
139,619281744445984768,"but I love vaping bruh, I've just gotta chase those clouds... https://t.co/0mWc6byggN",_with0utsight,2015-07-09 23:07:28+00:00
140,619281705262796800,I added a video to a @YouTube playlist http://t.co/KMuJvmOYhL Dual Review! Zephyr Buddha V2 Review- VapingwithTwisted420 &amp; Vaping,QuitSmokingtr,2015-07-09 23:07:18+00:00
141,619281694957416448,Topical evilmonk surrounded by #suicidebunny angels #vape #vapeuk #vapejamuk #vapeusa #subohm #vaper #vapeporn http://t.co/9MU7EgxtC2,Gourmeteliquids,2015-07-09 23:07:16+00:00
142,619281640972357632,"Let's rewrite the Bill of Rights, 
Because honestly what we really need is...
FREEDOM OF VAPE.",JDPanzica,2015-07-09 23:07:03+00:00
143,619281623201112064,"Inconsequential spoiler: Benedict Cumberbatch's Victorian era #Sherlock smokes a curved pipe. That's right, no vaping. #SDCC",empiremagazine,2015-07-09 23:06:59+00:00
144,619281618461528064,"Totally Vaped Out back in stock!!: We have got some of the clear juices from Totally Vaped Out in stock, with ... http://t.co/upVZ5dXNTz",AtmosUSA,2015-07-09 23:06:58+00:00
145,619281569438670850,The #vapemail that's had me excited all week. The @coilmasternet K-BAG! This thing is so cool can't wait to try it http://t.co/EgxZ9bxIUy,_vape_is_life,2015-07-09 23:06:46+00:00
146,619281568100675585,Vapes are so addicting,_xxsmokexx_,2015-07-09 23:06:46+00:00
147,619281419601346560,"What a weirdo""",vaper_Tino,2015-07-09 23:06:10+00:00
148,619281325787336704,i Vape so get OVER it lol,bossysaucy,2015-07-09 23:05:48+00:00
149,619281310629134337,We're feeling wonky today.. #vaping #vapers #ohms http://t.co/Qi8iAssFgG,joyflavors,2015-07-09 23:05:44+00:00
150,619281305943937024,Vape is my only escape 💖,BlakeHogan10,2015-07-09 23:05:43+00:00
151,619281256610680832,Stop by @oceangrown831 for your free build!!!! #letmevapethat #vape #uevendrip #ecig #cloudgang… https://t.co/5ATiliyxHi,cloudnine2five,2015-07-09 23:05:31+00:00
152,619281251300732928,"RT @_deligma ""I love dulles #vapefriendly 

#vape #vapestagram #sickclouds #teamnoohms #teamrugged #forteuphoria…  "" http://t.co/OSTCNiGV4g",MBV_Wholesale,2015-07-09 23:05:30+00:00
153,619281203225477120,Im bout to start vaping again. These cigs gettin to me.,jpink_55,2015-07-09 23:05:19+00:00
154,619281148087246848,"Dear lesbian in flannel vaping at the train station, it's 80 and 100% humidity. Inappropriate garb.",L4RGGE,2015-07-09 23:05:06+00:00
155,619280936891383808,"#Texas study: vaping increased arterial pressure--longer term implics unknown, no comparison 2 effects of tobac cigs: http://t.co/ree9EKjErU",MaloneRuth,2015-07-09 23:04:15+00:00
156,619280818591113216,#3347 Someone got Rolly @eJuiceDirectCo &amp; saved a ton! http://t.co/RRXJk9R8ec #vape #ejuice,eJuiceDirectCo,2015-07-09 23:03:47+00:00
157,619280760969801728,"vape is love, vape is life",_with0utsight,2015-07-09 23:03:33+00:00
158,619280694594957312,"Vaping, other smoking alternatives are gaining popularity and helping some kick the habit http://t.co/77EunKo9u1",ecigtimesreview,2015-07-09 23:03:17+00:00
159,619280623803371520,I'm vaping so hard rn,BanzaiTakesAnal,2015-07-09 23:03:01+00:00
160,619280597668638720,"Bro, I wake and vape every day, get on my level.",JDPanzica,2015-07-09 23:02:54+00:00
161,619280461119004672,I'm gonna start a gofundme to make it illegal to make it illegal to ban vape jokes,_with0utsight,2015-07-09 23:02:22+00:00
162,619280398812618752,seriously guys i love vaping,DEADXP00L,2015-07-09 23:02:07+00:00
163,619280330936217600,"2 people talking ""were from West Virginia""
Other dude with fedora and vape ""no way you guys are from Wv you dont look like inbreds""",SaintMaxwell__,2015-07-09 23:01:51+00:00
164,619280256302714880,today is the day I quit smoking cigarettes unless its a spliff but a whole cig? nah 190 on a vape is about 100 packs of cigs so until then..,woodwurks222,2015-07-09 23:01:33+00:00
165,619280207946588160,"in other news, vape jokes are great",_with0utsight,2015-07-09 23:01:21+00:00
166,619280138799157252,MR ROBERTS IS IN A VAPE SHOP RN HOLY SHIT HAHAHAHAHHAA,madisonguindon_,2015-07-09 23:01:05+00:00
167,619280082734088192,A vape tornado destroyed my house,CaitlanWatson,2015-07-09 23:00:52+00:00
168,619280009744658432,Nate_The_Great just went LIVE at [ http://t.co/R63BEGlJmE ] on @Vapersdottv - #AutoTweet #Live #Video #Vaping #Vapers #ecig #Vapor,LiveOnVapers,2015-07-09 23:00:34+00:00
169,619279971631042560,Sitting outside the vape store having a dart like 💁,johnyp77,2015-07-09 23:00:25+00:00
170,619279875086675969,vape reason,vapeeverything,2015-07-09 23:00:02+00:00
