,TweetID,TweetContent,TweeterUsername,TweetDatetime
831,619226047234576384,How's the weather for #vaping today?,CignatureVape,2015-07-09 19:26:08+00:00
832,619226033871552512,The #HalonLife meets the #SaltLife!  (Photo Credit: Online Vape Lounge). #Vape #Ejuice http://t.co/V2uW0VSvxt,HaloCigs,2015-07-09 19:26:05+00:00
833,619225975663034370,#3337 Someone got One Hit Wonder @eJuiceDirectCo &amp; saved a ton! http://t.co/zdpu8e9YeY #vape #ejuice,eJuiceDirectCo,2015-07-09 19:25:51+00:00
834,619225758867845121,Cleanin the car with my #vape dog...   Thats Gracie.   Bout time for some #cloudchasing though.... https://t.co/J7MtHDug40,OnlineVapeLoung,2015-07-09 19:25:00+00:00
835,619225751993368580,TONIGHT! #29 @marcobenevento @knitfactorybk #hunkydory #vape #williamsburg @ High Times magazine https://t.co/f2v0xpSQFo,corilynnkidney,2015-07-09 19:24:58+00:00
836,619225590189686784,Yes Please @1percent! Giveaway&gt; http://t.co/LJ68oRd3Im @MagicFlight Monocle #Vape+#DannyCamp+@ChakaGlass #AmericanMade420,atlgapeach419,2015-07-09 19:24:20+00:00
837,619225499601137665,Vaping and listening to Amy Winehouse👌🏼,liamvapes,2015-07-09 19:23:58+00:00
838,619225216494010370,Omg such times with Tav. When I'm in this moment. No capes. Vape,Ellery_Janey,2015-07-09 19:22:50+00:00
839,619225018556354561,"Ordered my new vape with 24 hour shipping.... That was 3 days ago
-________-",BrookiesNCream,2015-07-09 19:22:03+00:00
840,619224885466898432,Fresh out the oven! Our eJuice deal of the day is Peaches and Cream and Blueberry Breakfast by Baked Vapes. Get... http://t.co/Ok6EjGVtsT,csvape,2015-07-09 19:21:31+00:00
841,619224804311310336,#3336 Someone got One Hit Wonder @eJuiceDirectCo &amp; saved a ton! http://t.co/zdpu8e9YeY #vape #ejuice,eJuiceDirectCo,2015-07-09 19:21:12+00:00
842,619224786808479745,It's so funny looking to see old people Vape,HotelMikeDelta1,2015-07-09 19:21:08+00:00
843,619224660551581696,#Vape a lot longer with the #Lemo #atomizer because it has a large tank capacity of 5ml. Check it out @iSmokeShopNJ http://t.co/eRgWxkBBHy,iSmokeShopNJ,2015-07-09 19:20:38+00:00
844,619224656634097667,vaping. just chillin.,Rageboiiiiii,2015-07-09 19:20:37+00:00
845,619224619464138753,"☁️ In addition to our #ECF giveaway, Win some more free #eliquid on our Facebook Contest 💨
#ejuice #vapelife #vapecommunity #vape #vaping",Clearette_ECig,2015-07-09 19:20:28+00:00
846,619224067112046593,Going to my thinking place aka the vape shop 😂,_DJREAL,2015-07-09 19:18:16+00:00
847,619224059855925249,The vape is Spicy,burtdillard,2015-07-09 19:18:15+00:00
848,619224018550419459,"It's official, I scheduled 3 models for this weekend. Project: Vape is under way 😝",juniortobias525,2015-07-09 19:18:05+00:00
849,619224007695560705,Petition to rename Bay Port to Vape Port,715saucedupclub,2015-07-09 19:18:02+00:00
850,619223809409859584,Dear people. Please stop sending me snapchats of you Vaping.,catfishcatfish,2015-07-09 19:17:15+00:00
851,619223477661396992,do u even #vape bro?,HeretikDubstep,2015-07-09 19:15:56+00:00
852,619223469859958784,About time someone stands up and says NO! to the bureaucrats who want to destroy an industry! #VapeOn #VapeLife #vape http://t.co/j7tXqCrGuv,jtandb,2015-07-09 19:15:54+00:00
853,619223432128032772,People who vape honestly anger me.,Mrbacon34,2015-07-09 19:15:45+00:00
854,619223420702728192,seems like only the coolest dudes vape,aasu_11,2015-07-09 19:15:42+00:00
855,619223334958596096,"RT Vapeundbake: The Benefits of Vaporizing Cannabis
http://t.co/B0adgFQyBR 
#vape #vaporizer #ecigs #hemp #cbd #t… http://t.co/RZgP0O0F6m",vapemerch,2015-07-09 19:15:22+00:00
856,619223333092106240,"RT AD_Dysfunction: New setup, Sir Lancelot mech mod and a Cartel Cascata RDA. Like this baby already! #vape #vapel… http://t.co/on7gTT61hv;",vapemerch,2015-07-09 19:15:21+00:00
857,619223236941869056,Free builds from 4-7 @oceangrown831 #letmevapethat #vape #uevendrip #ecig #cloudgang #vapor #builds… https://t.co/FSy9KS0nFW,cloudnine2five,2015-07-09 19:14:58+00:00
858,619223190468984834,Yes Please @1percent! Giveaway&gt; http://t.co/6uNBsXnfVZ @MagicFlight Monocle #Vape+#DannyCamp+@ChakaGlass #AmericanMade420,kream1906,2015-07-09 19:14:47+00:00
859,619223177122721793,Vapor Joes - Daily Vaping Deals: ROLLOUT: THE IPV D2 SUPER MINI 75 WATT / TC - $49.... http://t.co/VzbEBvnrta,vaporjoes,2015-07-09 19:14:44+00:00
860,619223110882074624,#3335 Someone got Sony VTC4 18650 2100mAh ... @eJuiceDirectCo &amp; saved a ton! http://t.co/VJSlB3ZDOw #vape #ejuice,eJuiceDirectCo,2015-07-09 19:14:28+00:00
861,619223091688927232,Our Vapers Industry Snapback Collection is NOW AVAILABLE for purchase at http://t.co/kxQANTva8T! http://t.co/eGlex1P5K1,vapersindustry,2015-07-09 19:14:24+00:00
862,619222983706570752,#vapemail from @LightningVapes !!!! #vape #vapefam #wire #unicornbottles #cottonbacon #cloudchasing http://t.co/cHP4xYbQ91,_vape_is_life,2015-07-09 19:13:58+00:00
863,619222733969321984,"Just saw an old man at Lowe’s smoking not one, but TWO #vapes at once. Might have been @robdelaney. #christiangrandadswhovape",downesphoto,2015-07-09 19:12:59+00:00
864,619222578775871489,Win a SX Mini M Class mod from http://t.co/MMmGLJzUKh - http://t.co/O7QVjDRZz5 #ecig #Vape,gerald32928030,2015-07-09 19:12:22+00:00
865,619222417332903936,I don't vape cause I think vape is cool I do it cause I like to see what I can do with the smoke with out smoking,Tauries_Boy_,2015-07-09 19:11:43+00:00
866,619222386328649730,VAPING IS NOT A FUCKING CRIME,_jackthekid,2015-07-09 19:11:36+00:00
867,619222311514832896,Yes Please @1percent! Giveaway&gt; http://t.co/mYTos1ujYi @MagicFlight Monocle #Vape+#DannyCamp+@ChakaGlass #AmericanMade420,greeeneyedwhwom,2015-07-09 19:11:18+00:00
868,619222234075373569,"Why You Cough When You Vape, and How to Stop It! https://t.co/WtKdHIAJAK via @thesmokersangel http://t.co/48k4i4Fhwu",naturacig,2015-07-09 19:10:59+00:00
869,619222226374627328,"Check out @SmokersC for your e-liquids, various flavours http://t.co/iWzQoZ7hwA

#vaping http://t.co/tmkZbZXQKH",Biz_Hype,2015-07-09 19:10:58+00:00
870,619222165477556224,Our official #GrandOpening Celebration is this Saturday. Get ready for the biggest #Vape Party in #Chicago history.  http://t.co/lKEJOJaJlM,MainStageVapes,2015-07-09 19:10:43+00:00
871,619222116316090368,"""Top o the world ma"" #VapeFam #VapeArtist #Vape #VapePorn #VapeLife https://t.co/UPx92KzMOS",JohnnyUgly72,2015-07-09 19:10:31+00:00
872,619222053976154112,When you watch Ryan vape for over an hour on face time,happyjilllmoore,2015-07-09 19:10:16+00:00
873,619221985470582785,"I hate vape culture, if that wasn't clear enough xD",El_Wray80,2015-07-09 19:10:00+00:00
874,619221888414388224,Stop Big Tobacco and the FDA from Outlawing Vaping! http://t.co/ENqBIG1PES,tadmura,2015-07-09 19:09:37+00:00
875,619221855984029700,"New setup, Sir Lancelot mech mod and a Cartel Cascata RDA. Like this baby already! #vape #vapelife… https://t.co/bwHzIlKQrT",justaduderhere,2015-07-09 19:09:29+00:00
876,619221768339898369,"So the new season of Gatchaman started and the only thing we know about the new enemy is the word ""Vape"". Finally, the true enemy revealed!",El_Wray80,2015-07-09 19:09:08+00:00
877,619221679416451072,Tonight at the Otters Den!!! Come grab a drink and Vape with us!,SMOKESTACKS831,2015-07-09 19:08:47+00:00
878,619221636668112899,Another dude walked in with a vape pen in one hand and cigarette behind his ear. Then asked what cable company we used. This is a weird room,drewbryant,2015-07-09 19:08:37+00:00
879,619221624798228480,10% Off your order @vaporcool Use code VAPENOW http://t.co/Fc6CcnuUJL  30ml 16.00 FREE SAME DAY SHIP. #vape #ejuice http://t.co/dh1oPxrPKs,Suckmybox_com,2015-07-09 19:08:34+00:00
880,619221495311671297,Use your #logicecig! Start vaping today and save:http://t.co/p3p2fKmRxp http://t.co/CFBayakCWT,LOGICSMOKES,2015-07-09 19:08:03+00:00
881,619221359894396928,REMEMBER WHEN GERARD VAPED,deannalorena,2015-07-09 19:07:31+00:00
882,619221264352342017,"Does anyone have the furry convention bingo card? I need to check off ""furries vaping indoors"" off the list",ZulasTehHusky,2015-07-09 19:07:08+00:00
883,619221227039772673,The iStick TC40W is now #instock Never before has Temp Controlled vaping been so affordable https://t.co/1muqfXG2fH http://t.co/NYIK4QrOJj,MistHub,2015-07-09 19:06:59+00:00
884,619221091282763776,Win a Kanger Subox Mini Kit from @cigbuyer and @huffandpuffers: http://t.co/lNd3vZVxwZ #ecigs #vaping #subox #vapecontest #vapegiveaway,Shane_Hardgrave,2015-07-09 19:06:27+00:00
885,619220787845836800,Should Vaping Products be Banned from Convenience Stores? http://t.co/cJL54PeUy2,DIYEliqSupplies,2015-07-09 19:05:15+00:00
886,619220701371887616,"Are people bumming vape drops yet?

#Regrann from @svrpodcast  -  ""Hey man, can you spare some drops… https://t.co/u0NN4lArO3",EndGameJordane,2015-07-09 19:04:54+00:00
887,619220689489408001,"Guys it's okay, I can vape now😅😃😃😃😃😃😃😃 #happyAF",Atomic_JD_,2015-07-09 19:04:51+00:00
888,619220586728980481,Today@Vapor Blade! #Vape #Vaping #Vapor #vaper #allvapors #vapelife #vapelyfe #vapeStrong #Ecigs #vapefam #vapeporn http://t.co/SsYFPlIyHM,VaporBladeTM,2015-07-09 19:04:27+00:00
889,619220555699486720,Have you hugged your vape today? http://t.co/7sIAvNYJLg,vapormaniautah,2015-07-09 19:04:19+00:00
890,619220540889432064,Have you hugged your vape today? http://t.co/DxCi42QLh3,AmericanVapes,2015-07-09 19:04:16+00:00
891,619220536963526656,"if you #vape, you look like an idiot. Seriously, you look stupid. It's like the 2015 version of this: http://t.co/uYAkwnKqyB",james,2015-07-09 19:04:15+00:00
892,619220536602849280,Have you hugged your vape today? http://t.co/E6IJ5UUr1W,XclusiveVaporHI,2015-07-09 19:04:15+00:00
893,619220485432283136,Lots going on at Blonosmoke! NEW flavor release tomorrow! #vape #vapelyfe #eliquid #ecig http://t.co/RGNiY7KLZW http://t.co/77tpDvdsas,Blonosmoke,2015-07-09 19:04:02+00:00
894,619220461629652992,Delaware bans indoor smoking of e-cigarettes and vape pens. Law to take effect in 90 days -- Thoughts on this? #netde http://t.co/7ILfF0fVrd,KentCountyYR,2015-07-09 19:03:57+00:00
895,619220454302195712,Vaper yosen will be mine...hahahaha..wohoo,AidiRahman_,2015-07-09 19:03:55+00:00
896,619220386543206400,RTS Vapes' Deals of the Day are offered all week long! Cool off with a refreshing Sweet Tea concentrate for 20% off. http://t.co/MFGP6vV7vW,RTSvapes,2015-07-09 19:03:39+00:00
897,619220385641459714,New dating website created by a vaper for the vaping community....visit the website and sign up today!!! http://t.co/iLFt1VO9du,vaperdating,2015-07-09 19:03:39+00:00
898,619220209153536001,It's #vape o'clock.,ZeusEJuice_TBA,2015-07-09 19:02:57+00:00
899,619220152408780801,"Sign up for our monthly newsletter. You will get updates on new products, vaping news, and incredible offers.
http://t.co/3PtkWfReHS",VaporificsTX,2015-07-09 19:02:43+00:00
900,619220086340108288,"When in doubt, Blow all out! #EZPen #Blow #BlowEzPen #vape #tanks http://t.co/QLN0LhMLqE",BlowHookah,2015-07-09 19:02:27+00:00
901,619219824573607936,"""Take me home
country bros
To the vape
That I love"" - ryan",_windowshopper,2015-07-09 19:01:25+00:00
902,619219788464844805,Imve beem tryin to quit smoking kush cuz my baby is on the way amd that is most importnta to me so I strted to vape n http://t.co/hepyGApGrm,returntothev0id,2015-07-09 19:01:16+00:00
903,619219753362681857,Mom shut up and let me vape,_lmaoayy,2015-07-09 19:01:08+00:00
904,619219650233135104,"Bag packed, money stacked, #vape is full, ready to attack!

TAG A #STONER WHO IS GONNA #BLAZE AT… https://t.co/wDksqUpFX8",GFarmaLabs,2015-07-09 19:00:43+00:00
905,619219605408641025,#tangie #favorite #flavor #vape #extract #710 #dabs #clear golddropco https://t.co/sgukjsPQuu,thesfhighs,2015-07-09 19:00:33+00:00
906,619219525884624896,The whole Dripbeats line are here at Drip City. Get all of your favorite Dripbeats flavors and start vaping on... http://t.co/CU6nIaIusB,Drip_City,2015-07-09 19:00:14+00:00
907,619219520046108672,The first and last thing on your mind should be when you'll be vaping on Penguin E-juice next!... http://t.co/eOydrfbGrR,penguinejuice,2015-07-09 19:00:12+00:00
908,619219496583200770,Pax Juul: a Former Smoker's Perspective [Review] http://t.co/u9CycdVK0r,SteveVape,2015-07-09 19:00:07+00:00
909,619219392430219264,Possibly getting my new vape today :'),baldobarragan_,2015-07-09 18:59:42+00:00
910,619219384075202562,I was leaving work today and a guy almost hit me because he was vaping and driving,lvwlry,2015-07-09 18:59:40+00:00
911,619219383408271360,Doing Vape tricks wit @GwidT right now.,MittRcmney,2015-07-09 18:59:40+00:00
912,619219314978197504,*Unfollows anyone posting vape videos on @instagram*,atisaacmartinez,2015-07-09 18:59:23+00:00
913,619219273953738753,Come get some GQ E-Liquid for Shark Week use sharkweek20 and get 20% off your order  http://t.co/ebJQzrMzEu #vape #vaping #ejuice #eliquid,vapegard,2015-07-09 18:59:14+00:00
914,619219191929958401,You destroyed my vape tornado! the ONLY thing in life I ever cared about!,Colino_Davis,2015-07-09 18:58:54+00:00
915,619219179145723904,Great Steals and Deals on Quality Vaping Gear @vaping_mall ! #ecigdeals #vapesale #ecig #vape #mod #vapelife #vapeon #vapingmall #drip #RDA,vaping_mall,2015-07-09 18:58:51+00:00
916,619219171625291776,"me and my friend vape to much. lol
 @EVWilmington @getstealz http://t.co/Cjb0yRNIzL",skettimothy,2015-07-09 18:58:49+00:00
917,619218853562830848,"Some people just shouldn't be parents, having ur child run around the outlets like an idiot while ur just sitting there w/ your vape pen 😒",MaddieParkhurst,2015-07-09 18:57:33+00:00
918,619218784981786625,I love to #vape #pineapplejuice for #breakfast #VapeLife #VapeOn,Inspectah_Peck,2015-07-09 18:57:17+00:00
919,619218615766794240,"And we're back!!! A giveaway, and the Winner of the High Stakes Vapor Grand Prize from ou... http://t.co/Yj5Vvm2h06 #vape #ecigs #reddit",ukvaper,2015-07-09 18:56:37+00:00
920,619218614584016897,Any good vape meets coming up in Florida or Georgia? http://t.co/3liGx2Lig6 #vape #ecigs #reddit,ukvaper,2015-07-09 18:56:36+00:00
921,619218613279526912,Quick Review of High Stakes Vapor http://t.co/qOqNQay9bZ #vape #ecigs #reddit,ukvaper,2015-07-09 18:56:36+00:00
922,619218606329589761,I'm in a vape store and they're playing eminem I'm fucking screaming,epicswagangel,2015-07-09 18:56:34+00:00
923,619218572934545408,Win a Whiteout Evolv DNA200 Box Mod! #vaporjoes #vapingunderground #vaping http://t.co/Li3c6XY8LV,ameritaz,2015-07-09 18:56:26+00:00
924,619218446040072192,Thanks for the love kaitlindraper90 #vgod #vapeon #vapeporn #vape #vapenazi #vapornazi #vapebreak… https://t.co/se6PS0WfVr,No_Ka_Oi_,2015-07-09 18:55:56+00:00
925,619218366784536577,We're now selling these awesome super absorbent Vape Towels!! You can come into the shop now and grab one for $5.00! http://t.co/hwFUKbCeGI,krazyvaporsva,2015-07-09 18:55:37+00:00
926,619218326141693952,Why are they following me..I make fun of vapers oops http://t.co/hE3GEyjHdx,Aricado99,2015-07-09 18:55:28+00:00
927,619218308882108416,The good stuff! #vapefam #vape #subohm #VapeOn #vapelife #vapegame #vapor #vapeallday #vapestagram… https://t.co/WcWjARMaiq,nimbuscloudvape,2015-07-09 18:55:24+00:00
928,619218277336793088,I have one question for you. Why do you vape in public? You hypebeast fuckboy.,MichaelGTecson,2015-07-09 18:55:16+00:00
929,619218206343974912,"#juicecheck
Fizzle is live @ http://t.co/IpHQX8wFIJ!
Juice Check!

Vape some eLix™ Premium e-Liquid. A premium… https://t.co/gXCgCG9xLL",ejuicely,2015-07-09 18:54:59+00:00
930,619218179806642176,We are a family owned company and our passion is to help you find the best suit for your vaping needs  http://t.co/xCkx5ylgtW #vaping #vape,vapegard,2015-07-09 18:54:53+00:00
931,619218154921848832,Ok it's me again http://t.co/eMx28bTHvK #vape #ecig #AAEC,ukvaper,2015-07-09 18:54:47+00:00
932,619218131609907200,wow cool vape dude,cptpatmurphy,2015-07-09 18:54:41+00:00
933,619218075561369601,"Fizzle is live @ http://t.co/IpHQX8wFIJ!
Juice Check!

Vape some eLix™ Premium e-Liquid. A premium blend… https://t.co/7ZmC7ndNYf",ejuicely,2015-07-09 18:54:28+00:00
934,619218011631828997,This dude is just smoking a vape pin in Wendy's but whatever😂,ShanHott27,2015-07-09 18:54:13+00:00
935,619217893155295232,Visit them today for business Financing! http://t.co/w3aqnjA4Am @BehalfInc #vape #vapor #vapelife #vaping #finance http://t.co/0EsqAlSdRJ,perfectvapeusa,2015-07-09 18:53:44+00:00
936,619217888474451968,Win a Whiteout Evolv DNA200 Box Mod! #vaporjoes #vapingunderground #vaping http://t.co/sw5bq4kZ2E,140_anthony,2015-07-09 18:53:43+00:00
937,619217762745982976,"""The sisterhood of the traveling vape pen""",jakereiff,2015-07-09 18:53:13+00:00
938,619217716541583360,ThruTheFog just went LIVE at [ http://t.co/a9dgnjpfpm ] on @Vapersdottv - #AutoTweet #Live #Video #Vaping #Vapers #ecig #Vapor,LiveOnVapers,2015-07-09 18:53:02+00:00
939,619217715694321666,For all your artisan vape needs http://t.co/bJ1cNzcFFu,Atonement666,2015-07-09 18:53:02+00:00
940,619217709977468928,"#Repost rolltide_countrygirl
・・・
|#NERDVAPE | #vape | #vapelyfe | #vapecommunity | #vapefam |… https://t.co/jzCLop4QAm",That1DudeRyan,2015-07-09 18:53:01+00:00
941,619217540804386816,"RT &amp; quote ""Tune into today's episode of the eSports Report to enter to win an @Xbox One at http://t.co/RFVHF8weCn "" https://t.co/Er9Oe2Tdx3",MLG_VAPE,2015-07-09 18:52:20+00:00
942,619217245571579904,Vape on first,hazimhariri,2015-07-09 18:51:10+00:00
943,619217221609488384,"Vapejoose Premium E-Liquid
Shipping Available World Wide
Made in Grand Rapids, MI
#Vapejoose #VapejooseVIP #Vape http://t.co/iddHrLnco9",Vapejoosecom,2015-07-09 18:51:04+00:00
944,619217163434504192,I sat through a preroll ad about vaping to read a story about stoop shrimp so just a very chill experience all around http://t.co/P9lmJqrWuy,robertkessler,2015-07-09 18:50:50+00:00
945,619217149253545988,Angry Vapers - Guest Post by Luc Van Daele http://t.co/Tbo8bJ9Cr0 via @vapemestoopid #ecigs #vape,Hinodeh,2015-07-09 18:50:47+00:00
946,619217099995672576,Yes Please @1percent! Giveaway&gt; http://t.co/SCEEE9e2dE @MagicFlight Monocle #Vape+#DannyCamp+@ChakaGlass #AmericanMade420,hunterws,2015-07-09 18:50:35+00:00
947,619216866591023104,http://t.co/8FfWVufv5m - Vape Mods http://t.co/hhdoJqL6Eg,Info_Domains,2015-07-09 18:49:40+00:00
948,619216857002835968,Now would be a hell of a time to buy @wondereliquid at http://t.co/WTpXgGYpQf #vape #ejuice #muffinman #milkman http://t.co/ZdPoWIxoFK,_vape_is_life,2015-07-09 18:49:37+00:00
949,619216767123091456,#Marijuana ‘#Clubs’ Are Now Illegal In #WashingtonState. http://t.co/Zqea97SjAK via @theweedblog #Pot #Weed #Vape #WA,HydroponicLife1,2015-07-09 18:49:16+00:00
950,619216500969353216,billy was just singing into the vape like a microphone omg,usagii97,2015-07-09 18:48:12+00:00
951,619216454265761794,"Check out this awesome review from our friends at @Hail_Mary_Jane! Thanks guys! #vape
#vapeon #vaporizer #VapeLife  https://t.co/b0QTPOhzv6",indicavapor,2015-07-09 18:48:01+00:00
952,619216252473638912,#3334 Someone got One Hit Wonder @eJuiceDirectCo &amp; saved a ton! http://t.co/zdpu8e9YeY #vape #ejuice,eJuiceDirectCo,2015-07-09 18:47:13+00:00
953,619216192050470912,In vaping we trust.,Ampsx,2015-07-09 18:46:59+00:00
954,619216146965876736,I've seen someone vaping in public now. This is true adulthood.,catherinetinker,2015-07-09 18:46:48+00:00
955,619216081031438337,vape on http://t.co/CaEDFYAlH4,afiqdanialhasan,2015-07-09 18:46:32+00:00
956,619215987813036032,#3333 Someone got One Hit Wonder @eJuiceDirectCo &amp; saved a ton! http://t.co/zdpu8e9YeY #vape #ejuice,eJuiceDirectCo,2015-07-09 18:46:10+00:00
957,619215839879950336,"Vape city, almost 60 Ast!: http://t.co/m0EJX1FURV",Amai_the_fox,2015-07-09 18:45:35+00:00
958,619215818686078976,"Restocked! New sizes! Now available in 2mg!  

#wtf

 #instavape #ecig #vapestagram #vapecommunity #vape... http://t.co/XJflQcZDvs",vape3one,2015-07-09 18:45:30+00:00
959,619215791465066496,Euromonitor Forecasts Vaping Sales Will Hit $50 Billion by 2030 http://t.co/PHY4djz4Wp,CheapTobaccoINC,2015-07-09 18:45:23+00:00
960,619215704974340097,"Vanilla Blackberry #Vape 300mg #CBD #vaping #healthy Pain relief, sleep, stress 
http://t.co/s4jq06DUvY http://t.co/qERVDItDk3",RealDonnaDeVane,2015-07-09 18:45:03+00:00
961,619215619372789760,I'm in a vape lounge. please kill me,The_Meech,2015-07-09 18:44:42+00:00
962,619215395795435520,Win a Whiteout Evolv DNA200 Box Mod! #vaporjoes #vapingunderground #vaping http://t.co/KmjEK5qoci,Gotti_jo,2015-07-09 18:43:49+00:00
963,619215275511152641,what does vaping mean,Iikedaylight,2015-07-09 18:43:20+00:00
964,619215118535102464,Thanks Frostburn Vaping Upload Your Reviews or Vaping Product Videos and Photos in our Website http://t.co/I4M5SZdVpa,VapersTube,2015-07-09 18:42:43+00:00
965,619214825768488964,#leonesp VAPE AND BE HAPPY!  =) @fumarellion https://t.co/f3zpOSBE6W,eumorgar,2015-07-09 18:41:33+00:00
966,619214708986544128,Vaping Craze a Booming Business http://t.co/MqjonMGVqp http://t.co/Ufe7OCDeAd,CrewJuiceLiquid,2015-07-09 18:41:05+00:00
967,619214569286840320,Win a SX Mini M Class mod from http://t.co/sKqvFpmrpG - http://t.co/3Ntx1tEZHC #ecig #Vape,Tactical_Copper,2015-07-09 18:40:32+00:00
968,619214521018765312,"Vaping Wars Hot Up in Italy
uk news 6.7.15
The Agivape online Italian vaping magazine is supporting a street... http://t.co/nKeKPzhiwh",CelticVapours,2015-07-09 18:40:20+00:00
969,619214512005234693,If I wanna frikkin vape I'm gonna freaking vape mom. FRICK THE FDA http://t.co/Bs0z09WJhC,nipsofanangel,2015-07-09 18:40:18+00:00
970,619214506540056576,Cool sgt ke isap vape? Especially perempuan?,hatfinaizni,2015-07-09 18:40:17+00:00
971,619214442732109824,♫ Rocking at Volunteer Vape Shoppe : https://t.co/ffC6i7VQI2 @GetRockbot,CaleMckenzie,2015-07-09 18:40:02+00:00
972,619214066184257537,"Why You Cough When You #Vape, and How to Stop It! #InterestingArticle #MustRead http://t.co/z1R5peBYXz http://t.co/hwh0CLVTUJ",VaporSearchUSA,2015-07-09 18:38:32+00:00
973,619214055203577856,"??? for my young(er), hip(per) Twitter friends: are vape and hookah shops actually making $$$, or simply holding out for pot legalization?",Crass_Feral,2015-07-09 18:38:29+00:00
974,619214047041441792,"Check out Kanthal A1 20, 22, 24, 26 Gage round Resistance wire RDA RBA Vapor vape wire   http://t.co/AWnNNs6uVS via @eBay",VapeNPerfection,2015-07-09 18:38:27+00:00
975,619213989789216770,''I just like blowing clouds'' kids in orbit vape... jfc http://t.co/sgZnPNOlRT,fuckSHEM,2015-07-09 18:38:14+00:00
976,619213674041995264,"#RP: febreezethesenuts #Beach #Rota #Spain

#ModLocation #vape #vapers #vapelife #vapelyfe… https://t.co/yQcisvtULW",modlocation,2015-07-09 18:36:58+00:00
977,619213595684007936,this guy walks into my work w/ a vape pen every time and I just 😕😕😕,myakumaa,2015-07-09 18:36:40+00:00
978,619213480667840512,"New Glass and Vape products available in our shop!! 

http://t.co/XaOyRMYmr1 http://t.co/oM0gX6bRDA",LegalGreenNY,2015-07-09 18:36:12+00:00
979,619213459264249856,Joined the Vape Life 😎 http://t.co/u1rcKApnTa,theMILFFF,2015-07-09 18:36:07+00:00
980,619213433452539904,"You Heard It Here First Folks
#rickross cleaning up his act.
Starting w/ #vaping his vitamins  w/ #vitastik #hiphop http://t.co/sO5vBtNokO",faithNhopeNluv,2015-07-09 18:36:01+00:00
981,619213373641764864,NEED SPECIAL FINANCING FOR YOUR BUSINESS? CHECK OUT BEHALF! THEY'LL GIVE YOU CREDIT TO GET YOU STARTED! @BehalfInc #Vape #vapor #vapelife,perfectvapeusa,2015-07-09 18:35:47+00:00
982,619213339135229952,Check this out! http://t.co/3OsCUISXhT found a descent vape,samthfc87,2015-07-09 18:35:39+00:00
983,619213240283885568,More gutted when my vape dies than when my phone does,benlfc,2015-07-09 18:35:15+00:00
984,619213100940660737,#3332 Someone got Jimmy The Juice Man @eJuiceDirectCo &amp; saved a ton! http://t.co/4pDiUnQQCO #vape #ejuice,eJuiceDirectCo,2015-07-09 18:34:42+00:00
985,619213014127013888,Might as well call vape pens 'robot dicks' cuz they're so fucking gay,jeremy8cookies,2015-07-09 18:34:21+00:00
986,619212934443610113,Thanks Frostburn Vaping for the follow! Join Us Also in Our Website http://t.co/XFENjJCLQg If You Do Reviews Contact Us,VapersTube,2015-07-09 18:34:02+00:00
987,619212721385537537,Got my guitar teacher to switch from cigs to a vape #VapeNation,_byronius,2015-07-09 18:33:11+00:00
988,619212457949679616,Enter our Vape A Day Giveaway! Enter now! http://t.co/DRE2pfK7wo #contest #giveaway #20YearsOfPuff,PuffCanada,2015-07-09 18:32:09+00:00
989,619212385044271104,😁Stop in and get setup with something you will enjoy today vapehouseblends #baltimore 💨 @ Vape… https://t.co/jI5NAG9Ayo,IceyMannn,2015-07-09 18:31:51+00:00
990,619212358599241728,there is an adult with a vape wowow,hollandsmarano,2015-07-09 18:31:45+00:00
991,619212352873984004,#royal hunter #cloudchaser #vapeporn #vaper #clouds #sigelei #sigelei150 #1stroyalbuild #lungcandy http://t.co/D4fEKuEkl6,CloudKing4,2015-07-09 18:31:43+00:00
992,619212307579715586,#3331 Someone got One Hit Wonder @eJuiceDirectCo &amp; saved a ton! http://t.co/zdpu8e9YeY #vape #ejuice,eJuiceDirectCo,2015-07-09 18:31:33+00:00
993,619212256744734720,she's my vape queen 😍😩🙌😜💯,NickBonley,2015-07-09 18:31:21+00:00
994,619212182081929216,#Dallas #Jobs Vapor store sales associate. (carrollton): One of the leading franchises in the vaping industry ... http://t.co/HUwdk2YN3D,_Dallas_Jobs_,2015-07-09 18:31:03+00:00
995,619212170174308352,#Job #Dallas Vapor store sales associate. (carrollton): One of the leading franchises in the vaping industry i... http://t.co/VToPz7gsk6,JobsinDallas1,2015-07-09 18:31:00+00:00
