,TweetID,TweetContent,TweeterUsername,TweetDatetime
2486,623009123144204288,Our Stock Pick On $GEQU Nearly QUADRUPLED In Value In Less Than 2 Weeks! Major News: http://t.co/Ar3yILXeKR $VAPE $PTAH $TAUG,PennyStockingt,2015-07-20 05:58:44+00:00
2487,623009053271195649,#TweetLikeFuckboy who's trying to vape?,c_mendez9,2015-07-20 05:58:27+00:00
2488,623008945632751616,Vape on... syawal break refreshing and family gathering... http://t.co/Qo9hfbClgk,EddyVanMastez,2015-07-20 05:58:02+00:00
2489,623008772747726848,"New regulations on e-cigs trigger concern, lobbying http://t.co/WZDBJXBf8f #ecigs #vaping",VapinXsmoker,2015-07-20 05:57:21+00:00
2490,623008771766288384,"It’s happy vaping in Malaysia, so far http://t.co/bssOQvu5o2 #ecigs #vaping",VapinXsmoker,2015-07-20 05:57:20+00:00
2491,623008770898014208,Letter: Follow the money on tobacco legislation http://t.co/ks428LPmPN #ecigs #vaping,VapinXsmoker,2015-07-20 05:57:20+00:00
2492,623008517029363712,A Vape Blog for Vapers Who Vape,grlmyth,2015-07-20 05:56:20+00:00
2493,623008490672357376,decided that i'm gonna throw a vape party for my 16th this year come through it's byov!!! 😋😋,Kiara_Moton,2015-07-20 05:56:13+00:00
2494,623007628596264960,My new baby #vape #ipv # troll http://t.co/Vdsu9K5XRK,Carlous8,2015-07-20 05:52:48+00:00
2495,623007555757965312,"I hit the Vape earlier and have been stuck ever since... Even after I woke up, I still was just stuck !",ItsKeyzFoo,2015-07-20 05:52:30+00:00
2496,623007401961099265,"Even though I quit vaping, it's always good to help your friends to stop smoking. Helped a good friend get into to vape #littlebithelps",kautrigs,2015-07-20 05:51:54+00:00
2497,623007295207665664,"bitch I'ma choose the vape over you, you know I ain't scared to lose you",SlumpedMan,2015-07-20 05:51:28+00:00
2498,623007224005169152,#win with @multicig quit #smoking and start #vaping via @AgataPokutycka Full #giveaway T&amp;C at http://t.co/4oJr7OoS0N #goodluck,ollieamelia,2015-07-20 05:51:11+00:00
2499,623007105037918208,"#growingupwithmyname hey what's up I'm Mason! ""that's a sick ass name wanna vape some time bro?""",collagedrop_out,2015-07-20 05:50:43+00:00
2500,623006923881902080,Soul just pulled up next to this kid's car to get some of his vape pen,a_nicole38,2015-07-20 05:50:00+00:00
2501,623006779987894272,"""do you vape"" ew stop talking",sunnimwah,2015-07-20 05:49:25+00:00
2502,623006622806204416,"Me: Jose guess what I got a vape
Jose: no you didn't let me see
*pulls out inhaler*",bre_rad,2015-07-20 05:48:48+00:00
2503,623006575486238720,"FACTORY UNLOCKING iPhone4s(verizon USA), iPhone4(at&amp;t USA) and iPhone5(sprint USA) while #vaping #vape #alfox... http://t.co/q3t8org2Wn",iUseDitoShop,2015-07-20 05:48:37+00:00
2504,623006503004450816,"I am lucky to get a testing sample of Asolo.😊

#Asolo #Vape #VapeLife #Vaping… https://t.co/o49hp0EOGS",ijoyglobal,2015-07-20 05:48:19+00:00
2505,623006452513312769,Win a Whiteout Evolv DNA200 Box Mod! #vaporjoes #vapingunderground #vaping http://t.co/0uQTVypayz,Brugmanncues,2015-07-20 05:48:07+00:00
2506,623006177585033216,when your mom takes your vape and fedora away,ShitOnMyDickPls,2015-07-20 05:47:02+00:00
2507,623006159117553664,over the past few days I saw more vape pens than I've seen in the entire rest of my life what the FUCK is up with washington,thebigleboobski,2015-07-20 05:46:57+00:00
2508,623006096228089856,"Though vape is not 100% like smoking, it still gives ppl the impression dat u are",KenkenLegada,2015-07-20 05:46:42+00:00
2509,623005956457168896,There is honestly no one cooler than the guy with a 120 second snapchat story of him vaping,ARubenono,2015-07-20 05:46:09+00:00
2510,623005842661507072,Some guy offered me 30 for the vape but wants me to deliver :/,DannieBlitz,2015-07-20 05:45:42+00:00
2511,623005684452458496,"Its a happy Monday morning, time to get your orders in for all your vaping essentials, remember we have over 40... http://t.co/nNgJFDVoQA",nomatchecig,2015-07-20 05:45:04+00:00
2512,623005654819717120,RT MrTastyVapor: Cherry Cola on a warm summer day -&gt; http://t.co/n7rD9y5c5t  #vape #bestejuice http://t.co/4I4fnQ4oWN,vapemerch,2015-07-20 05:44:57+00:00
2513,623005653418815488,RT ukvaper: Can I buy Clapton wire off a redditor? http://t.co/CCnbwM1o6U  #vape #ecigs #reddit,vapemerch,2015-07-20 05:44:57+00:00
2514,623005647966183424,"RT lexinerus: ReTw BoneSaw77: E-cigarette vapour has NO toxic effect and is as safe as AIR, shock study #vape #vap… http://t.co/gWJwD3oLGz",vapemerch,2015-07-20 05:44:56+00:00
2515,623005646556950528,RT ZeroNicJuice: Caramel Coffee ZeroNicJuice #Ejuice #Vape #ecigs #VapeOn #Vapefam #VapeLife http://t.co/M0d2l3O7kK,vapemerch,2015-07-20 05:44:55+00:00
2516,623005645487280129,the vape life isn't for everybody,_karlitaas,2015-07-20 05:44:55+00:00
2517,623005230054047745,"selfies and vape tricks
asking for tit pics
FUCKBOYSSSS
@ 5sos",actualy5sos,2015-07-20 05:43:16+00:00
2518,623005196398915584,Win a SX Mini M Class mod from http://t.co/t6FDnis88J - http://t.co/udy43phbIZ #ecig #Vape,iluvpoppies,2015-07-20 05:43:08+00:00
2519,623005093009305600,"You don't choose the vape, the vape chooses you",IAMSLAYAH,2015-07-20 05:42:43+00:00
2520,623004954232516608,"""Vaping is my life"" -@seasawn",kaylala1441,2015-07-20 05:42:10+00:00
2521,623004728335581184,Can I buy Clapton wire off a redditor? http://t.co/jWJXpzc5HN #vape #ecigs #reddit,ukvaper,2015-07-20 05:41:16+00:00
2522,623004725634404352,velocity rda authentic http://t.co/tn68mdN8kI #vape #ecigs #reddit,ukvaper,2015-07-20 05:41:16+00:00
2523,623004701592788992,ive been trying to get joey to see that vapers of new york vine for so long can he look at it,wowkallie,2015-07-20 05:41:10+00:00
2524,623004552506249216,My caught a pic of me waiting for her to finish getting ready. #summerfun #lasvegas #vegas #vaping… https://t.co/wk4kS3hzSF,bgvboy,2015-07-20 05:40:34+00:00
2525,623004301959393280,DollarsOnPennies: $VAPE Weekly http://t.co/d4ybxenXGY,DollarsPennies,2015-07-20 05:39:35+00:00
2526,623004256761741312,Deez Nuts by Vape Girl Vixens (E-Juice Review): http://t.co/Tph98mmNwa via @YouTube,OverDoseVapes,2015-07-20 05:39:24+00:00
2527,623004245013495808,"vapingjezus Just comes out of nowhere with the #zebrajacket! 📱

#vaping #kuyaprotection #summer… https://t.co/EsosmUivYp",StReEtWLkRpNoY,2015-07-20 05:39:21+00:00
2528,623004231675572224,The vape God with his vape goddess #yeew http://t.co/DH5yw4jDOO,garettallred,2015-07-20 05:39:18+00:00
2529,623004172774871040,DollarsOnPennies: $VAPE Daily http://t.co/8oIOHmoPQr,DollarsPennies,2015-07-20 05:39:04+00:00
2530,623004032370655232,"#Repost nick_vape
・・・
Now that's a setup  #vapelifestyle #vapeporn #coastal_vapor_florence… https://t.co/C3V2GrBD0p",coastal_vapor,2015-07-20 05:38:30+00:00
2531,623004020546891776,"Just put hot sauce in Rieder's vape

Start claiming his belongings in the replies",BearDoesntCare,2015-07-20 05:38:28+00:00
2532,623003881572687873,Win a SX Mini M Class mod from http://t.co/txNDk1XwXO - http://t.co/zxFTOGa2S2 #ecig #Vape,SREPersonalized,2015-07-20 05:37:54+00:00
2533,623003843622793216,I added a video to a @YouTube playlist http://t.co/Tph98mmNwa Deez Nuts by Vape Girl Vixens (E-Juice Review),OverDoseVapes,2015-07-20 05:37:45+00:00
2534,623003827352961025,Win a Whiteout Evolv DNA200 Box Mod! #vaporjoes #vapingunderground #vaping http://t.co/ZqHdKDrREo,D_Kinger,2015-07-20 05:37:41+00:00
2535,623003810386972672,I added a video to a @YouTube playlist http://t.co/kdRP8lewwn Chinstrap by Penguin Ejuice From Vape Club,FrostburnVaping,2015-07-20 05:37:37+00:00
2536,623003568849727488,Review: PUFFiT-X Portable Pocket Vaporizer - Smallest Forced Air Vape http://t.co/GkAinJX7V4,patypyhuvabe,2015-07-20 05:36:40+00:00
2537,623003448364023809,"""do you vape in your free time or free your time to vape?""  ok kath",meganjannusch,2015-07-20 05:36:11+00:00
2538,623003396199444480,Texas Tuff Raw Sub Ohm Vape Wick open flame test VS most popular cotton wicks https://t.co/KelDLcfr5k,LeodTexastuff,2015-07-20 05:35:59+00:00
2539,623003368471011328,"Check out my instagram 
#vape #vapelyfe #vapelife #clouds #florida #sigelei150watt #mutationrda #vapingkicksash http://t.co/rjI9diDukj",Iden98My,2015-07-20 05:35:52+00:00
2540,623003126761697280,That #vapelife Bro!!! #vape #vapor #vapeon #vapers #vapefam #vape4you #vapeboss #vapelove #vapeporn… https://t.co/X5tjkypFp6,FIRE_GAME_ON,2015-07-20 05:34:54+00:00
2541,623002960105226240,I'm at The Vape https://t.co/cu3pFw6TrR,DaniaalAimaan,2015-07-20 05:34:15+00:00
2542,623002724188073985,Then you guys go on and on and on about vape equipment and accesories....,IzzyOzzyYaw,2015-07-20 05:33:18+00:00
2543,623002686686908416,@trisasdifor posted #dedication #beer #running #vape #bahrain #princess #norway #moscow #sepatumurah #view #detroit… http://t.co/McusKLhhb6,FitCalENGLISH,2015-07-20 05:33:09+00:00
2544,623002634849492992,Photo: TVL/Kennedy can’t be beat! #vape #vapeshop #vapestagram #vapestrong #vapefam #tvlsquad #colt45 #tvl... http://t.co/9Y1VsQdXen,DOCPHEELGOOD,2015-07-20 05:32:57+00:00
2545,623002631124946945,"TVL/Kennedy can't be beat!
#vape #vapeshop #vapestagram #vapestrong #vapefam #tvlsquad #colt45 #tvl… https://t.co/1PbMe6uGEj",murdermodsinc,2015-07-20 05:32:56+00:00
2546,623002457384333315,Yes kinda late but check out my instagram. #vape #vapelyfe #vapelife #clouds #florida #vapefam #handcheck #mech http://t.co/Si4ybK7ccE,Iden98My,2015-07-20 05:32:15+00:00
2547,623002404607369216,Converting those to the church of vape. Amen.,sorryforthen8,2015-07-20 05:32:02+00:00
2548,623002382021095424,Just posted a photo @ The Vape Lounge https://t.co/mi380HYzh4,The_Vape_Lounge,2015-07-20 05:31:57+00:00
2549,623002357995966464,"It’s happy vaping in Malaysia, so far

http://t.co/RdDLxkb0Z9

Thanks to our superb enforcement what is banned is available openly!",twt_stupid,2015-07-20 05:31:51+00:00
2550,623002354682605568,I can listen to Vape Tv on my iphone - how did I not know this?,Dbl_Gee1,2015-07-20 05:31:50+00:00
2551,623002237011402753,I just began a mountain biking workout using #Endomondo. Peptalk me now @ http://t.co/sUUO4ajbvZ,juul_andres,2015-07-20 05:31:22+00:00
2552,623002043372994561,RT DRPHEELGOODTZ: Photo: Things are looking great at TVL #vape #vapeshop #vapestagram #vapestrong #vapefam #710 #4… http://t.co/e8AX3K9C9g;,vapemerch,2015-07-20 05:30:36+00:00
2553,623002039962988544,RT DPMVP: #VapeLife #Vape #Smoke #trill #hookah http://t.co/P9C8wQ9fsU,vapemerch,2015-07-20 05:30:35+00:00
2554,623002037261893632,"RT shahrilsham: And here we have it,#vape smokers claiming their rights to smoke when and wherever they like. Clap clap.",vapemerch,2015-07-20 05:30:35+00:00
2555,623002035655471104,"RT VaporRoomECig: Flavors of the Week!
#thevaporroom #tvr #juicedeals #vape #vaping #vapelife #subohm #cloudchaser… http://t.co/ryS0APhLLF",vapemerch,2015-07-20 05:30:34+00:00
2556,623002022179151872,I have a hard life so I vape to forget,amantoan35,2015-07-20 05:30:31+00:00
2557,623001996778323968,Really should have brought my vape..,isaaccoria22,2015-07-20 05:30:25+00:00
2558,623001930885918721,"#Vaping Granny loving some SandSMods #Ejuice Great prices too!!! #Vapefam 
http://t.co/8Z2yeqsTVw http://t.co/IGUIS6JaAZ",RealDonnaDeVane,2015-07-20 05:30:09+00:00
2559,623001917921304576,"CannaElixirs™ CBD Rich hemp great tasting tinctures, sodas, chew &amp; lotion  #Vape Healthy #Vapefam
http://t.co/QYh9PwrMxV",RealDonnaDeVane,2015-07-20 05:30:06+00:00
2560,623001917241839616,University study on #ecigs. Take part if you #vape. Will only take 10 min of your time. http://t.co/cynRCoyJW5 #notblowingsmoke #vapestudy,HazeworksZA,2015-07-20 05:30:06+00:00
2561,623001916105166848,"With #Vaping Granny as YOUR #Vape Brand Ambassador
it's sure Success! DM me or
http://t.co/VXp5FrdQc6 http://t.co/43QWRC3TSv",RealDonnaDeVane,2015-07-20 05:30:06+00:00
2562,623001793803501568,Bo2 No maps TDM and vaping. No way this could get any better &lt;3,xWumby,2015-07-20 05:29:37+00:00
2563,623001729546776576,"Happy Monday UK Vapers! This Morning we are featuring @th3riac Saccharon, a creme brulee flavoured E-Juice. The tas… http://t.co/XmhB7lsJ7S",CloudzVapourUK,2015-07-20 05:29:21+00:00
2564,623001670482558976,I swear bro sometimes I just wanna go into the clouds and vape for the rest of my life,amantoan35,2015-07-20 05:29:07+00:00
2565,623001427078680578,Vape is love. Vape is life.,trent_i_am,2015-07-20 05:28:09+00:00
2566,623001379678781440,Ayy shit im sick and i followed josh to grt a vape haha,KidsGioo,2015-07-20 05:27:58+00:00
2567,623001325941428224,"Streaming some Hearthstone​ tonight! #Vaping as always! Come check out the stream, talk in chat and have fun! http://t.co/WfoOhCxBwd #vapeon",shad0wth3fall3n,2015-07-20 05:27:45+00:00
2568,623001309847883776,"""@probablylame: hey bro do you vape

""yeah bro i fucking vape"" http://t.co/JXfr2uBk4N""",jmsnrvrs,2015-07-20 05:27:41+00:00
2569,623001037067157504,Photo: Things are looking great at TVL #vape #vapeshop #vapestagram #vapestrong #vapefam #710 #420... http://t.co/PIkEUY5DeU,DOCPHEELGOOD,2015-07-20 05:26:36+00:00
2570,623001033179033600,"Things are looking great at TVL
#vape #vapeshop #vapestagram #vapestrong #vapefam #710 #420 #avidlyfe… https://t.co/uy6qnJjlpp",murdermodsinc,2015-07-20 05:26:35+00:00
2571,623001028955389953,❌Restock alert ❌Aspire Atlantis❌ Kanger  Subtanks ❌Orchids❌ Matrix Tanks❌Arctic Sub tanks ❌Black… https://t.co/A5K2TUMaaM,The_Vape_Lounge,2015-07-20 05:26:34+00:00
2572,623001004498235392,Braxton_Cool_Vapor just went LIVE at [ http://t.co/8TR9cVJBqd ] on @Vapersdottv - #AutoTweet #Live #Video #Vaping #Vapers #ecig #Vapor,LiveOnVapers,2015-07-20 05:26:28+00:00
2573,623000962630692865,Vape and chill,yahmsss,2015-07-20 05:26:18+00:00
2574,623000961620049920,vape jokes are my absolute favorite,maybecourt,2015-07-20 05:26:18+00:00
2575,623000926878609412,Vape and Netflix,EAChevy91,2015-07-20 05:26:10+00:00
2576,623000736956346369,"Remember @xCodeh Before he vaped? Well this is him now, Feel old yet? 

Kappa http://t.co/tuffuJJf4M",xOraham,2015-07-20 05:25:25+00:00
2577,623000226291412992,that relatable moment when you decide you want to grab your friend's vape cloud 😊... (Vine by @chrismelberger) https://t.co/RT6jFbYWto,ambearface,2015-07-20 05:23:23+00:00
2578,623000079402684417,"when people eat whole carrots like, omg stop showcasing your vape bruh we get it",MayztaM8,2015-07-20 05:22:48+00:00
2579,623000002126835712,"Yooo, my next purchases are gonna be to get my vape back &amp; fucking operational man. It chucks &amp; I miss my baby 😩😩😢",AllFucksGiven_,2015-07-20 05:22:29+00:00
2580,622999754109267972,"Truth About Vaping - Episode 1 ""Why They Hate Us"" http://t.co/1qLQtyT1Ru",weggesser,2015-07-20 05:21:30+00:00
2581,622999705455316992,REACTION VAPE REACTION VAPE PREMIUM E-LIQUID PREMIUM E-LIQUID  CINNAMON ROLL #whatitvapelike http://t.co/aqWtTWulvG,Vaping_Viking,2015-07-20 05:21:19+00:00
2582,622999609636302848,WE GET IT YOU VAPE FISMALDJSMAK,maybecourt,2015-07-20 05:20:56+00:00
2583,622999584013467649,Flight Vapes presents: Skipper http://t.co/VGUMyCM1MC,foglightvapes,2015-07-20 05:20:50+00:00
2584,622999540292026368,Check out these awesome deals from Vaping Express. http://t.co/HOlnSkVPMT,catgirlsnm,2015-07-20 05:20:39+00:00
2585,622999445702082561,but like....do u vape tho????,saratam02,2015-07-20 05:20:17+00:00
2586,622999423610519552,vape bruh http://t.co/FEpgWkr4XF,__juliee2,2015-07-20 05:20:12+00:00
2587,622999287253835776,Legal marijuana possession and use is tempting me. I'm on a precipitous decline since vaping for the first time Friday.,camaswaguy,2015-07-20 05:19:39+00:00
2588,622999285202857984,Sitting in my car vaping to lazy to get out maybe I'll just sleep in here 😂,Brit_Judd,2015-07-20 05:19:39+00:00
2589,622999243624738816,If you vape just stahp. ✋😑,wlftownmusic,2015-07-20 05:19:29+00:00
2590,622998603297128448,I wanna be the guy that names vape flavors,pattytwice,2015-07-20 05:16:56+00:00
2591,622998568908013568,back to vaping na :),EJsanity09,2015-07-20 05:16:48+00:00
2592,622998248870014976,Daily Vapes Ep 8 Mutation X v4 RDA!!!!!: http://t.co/CErMsCiVuy via @YouTube,VillainFNYT,2015-07-20 05:15:31+00:00
2593,622998238250041345,My iPad wanted to change it from vaping addiction to gaping addiction. Pervert.,chanelestcst,2015-07-20 05:15:29+00:00
2594,622998208881553409,Oh dang. Vape life so sick,RNels_3,2015-07-20 05:15:22+00:00
2595,622998135472848896,"Liters and Gallons PACKED full of #CBD! Cheapest prices out there! Test results available!
http://t.co/l0sZTRnF4o
#vapeshop #vape #vaping",YourCBDSource,2015-07-20 05:15:04+00:00
2596,622998131068792832,Just got back from teaching kids vape tricks at Walmart,ohhClown,2015-07-20 05:15:03+00:00
2597,622998114903961600,"RT BoneSaw77: E-cigarette vapour has NO toxic effect and is as safe as AIR, shock study #vape #vapefam #ukvapefam … http://t.co/gWJwD3oLGz",vapemerch,2015-07-20 05:14:59+00:00
2598,622998089616519168,I'm starting my vaping addiction.....tomorrow.,chanelestcst,2015-07-20 05:14:53+00:00
2599,622998065868312576,More #vaping tricks as I listen to that #Highlife by @willyjpeso https://t.co/2HVuj5Fi8X,Tru_Inferno,2015-07-20 05:14:48+00:00
2600,622997959500808192,#3760 Someone got One Hit Wonder @eJuiceDirectCo &amp; saved a ton! http://t.co/zdpu8e9YeY #vape #ejuice,eJuiceDirectCo,2015-07-20 05:14:22+00:00
2601,622997917842952193,Guess who's getting a vape Tuesday 😛😛,sntixgod,2015-07-20 05:14:13+00:00
2602,622997913992605696,Using my vape a lot today. It's dying before I'm ready for bed 😑,simply_kerrii,2015-07-20 05:14:12+00:00
2603,622997813228666880,Will and Steven have been spending an excessive amount of time at my house and now my room smells like dirty boy and vape,magsster,2015-07-20 05:13:48+00:00
2604,622997810997145600,Vape on!,izattrazali,2015-07-20 05:13:47+00:00
2605,622997793431420928,Boys who vape http://t.co/3EYpBDcxhs,basicgirltwtz,2015-07-20 05:13:43+00:00
2606,622997625806172160,vape on bruuuuhhhh...#eidmubarak #baraan #Realborn #selangorian #Malaysia https://t.co/F0gOKhIFnF,reiz_wan,2015-07-20 05:13:03+00:00
2607,622997622165512193,wish I could be vaping with my bros rn,KailaDibs,2015-07-20 05:13:02+00:00
2608,622997444264001536,"*wins best vape tricks at 2016 kids choice awards*

I'd like to thank my mod",KalieRaeL,2015-07-20 05:12:20+00:00
2609,622997385287962624,Why do people vape,migsilva13,2015-07-20 05:12:06+00:00
2610,622997292564512768,vape god,SkyeDempsey,2015-07-20 05:11:43+00:00
2611,622997206249938949,"RT: @Videos0nly ""that relatable moment when you decide you want to grab your friend's vape cloud"" http://t.co/2Fic0YCbN6 #videos",Videos0nly,2015-07-20 05:11:23+00:00
2612,622997093393825794,"E-cigarette vapour has NO toxic effect and is as safe as AIR, shock study #vape #vapefam #ukvapefam #vapecommunity  http://t.co/O1nlCHO2xl",BoneSaw77,2015-07-20 05:10:56+00:00
2613,622997042714013696,Dang I'm out of vape juice again... Cali where you at bro,trent_i_am,2015-07-20 05:10:44+00:00
2614,622996862589640704,Coming soon to Cle Vape....Carpe Diem Artisan e- Lixirs! http://t.co/38kvsKLcuT,ClevelandVape,2015-07-20 05:10:01+00:00
2615,622996785628336130,"RT 24_kake: Check out this amazing new trick called ""the tsunami"" created by-Bstackslove #vape... (Vine by mattqualman29)",vapemerch,2015-07-20 05:09:43+00:00
2616,622996772466651136,Fifty shades of grey can't end like that😡😡😡😡,juul_lie8181,2015-07-20 05:09:39+00:00
2617,622996691931803649,"Also,  my autocorrect tries to change ""vaping"" to ""vagina"" #TheMoreYouKnow",MysteryCr8tve,2015-07-20 05:09:20+00:00
2618,622996641268781057,Sunning myself the other day in #crouchend with the cold #beer and the #vape #vaporshark #london… https://t.co/jAmPwY9oa8,edmoss81,2015-07-20 05:09:08+00:00
2619,622996576575721472,I reflect on the journey as I chill and hit the Vape,marv1095,2015-07-20 05:08:53+00:00
2620,622996550394998785,"""Oh no way, I don't smoke weed, and I don't condone it.  I Vape.""    I just really didn't know those things were comparable... :/",AuntieChiCha,2015-07-20 05:08:46+00:00
2621,622996548100583424,Ledbetter17p just went LIVE at [ http://t.co/IgzB4jhGXW ] on @Vapersdottv - #AutoTweet #Live #Video #Vaping #Vapers #ecig #Vapor,LiveOnVapers,2015-07-20 05:08:46+00:00
2622,622996519982120960,"I quite smoking after 30 years by switching to vaping... 

... And *I* don't put vaping in scripts because I think it would be stupid.",MysteryCr8tve,2015-07-20 05:08:39+00:00
2623,622996458556497920,Coming soon to Cle Vape....Carpe Diem Artisan e- Lixirs! @ Cleveland Vape https://t.co/zsrFi3Xz8f,ClevelandVape,2015-07-20 05:08:25+00:00
2624,622996449857568768,Cool vape tricks tonight,blurredJK,2015-07-20 05:08:23+00:00
2625,622996374460739584,forgive me father for i have hit the vape pen,garyfromteenmom,2015-07-20 05:08:05+00:00
2626,622996301907673088,"So working at Vape shops for the past seven months, I have been around my fare share of men of all ages and yall have something in common",wmec17,2015-07-20 05:07:47+00:00
2627,622996208609570816,"Stingray + Plume Veil | 26 gauge | 6 wraps
#indovapor #vaperism #vapeporn #vape #batamvapor #vapelife… https://t.co/UBgoMJbPpu",ilhamfathonibtm,2015-07-20 05:07:25+00:00
2628,622995978036056064,I can't vape 😓⛽️🅰🆖,FultonBella,2015-07-20 05:06:30+00:00
2629,622995926068666369,I need my own vape pen :(,Alexzzsandra_x3,2015-07-20 05:06:18+00:00
2630,622995894670110720,"Exploring vape shops! Found this gem in Ada, OH! 
#ltdvapebaur #cloudchasers #coilporn #vapeporn… https://t.co/r1D2ibfGbx",DevinRockellRay,2015-07-20 05:06:10+00:00
2631,622995472525955072,Gave one of the homies my vape yesterday to chief on &amp; now idk where that shit is,davidrvvxx__,2015-07-20 05:04:30+00:00
2632,622995331077283840,Vaping is such a joke now,boojosy,2015-07-20 05:03:56+00:00
2633,622995252597641219,Lots of vaping @ wiz tonight!!!,julia_migge,2015-07-20 05:03:37+00:00
2634,622995122389680128,When you vape too hard #vape https://t.co/JB7dLbP5c6,screaminhersh,2015-07-20 05:03:06+00:00
2635,622995100054999040,"party tomorrow, bring your own vapes",alois3m,2015-07-20 05:03:01+00:00
2636,622994946098860033,RT vaporjoes:Vapor Joes - Daily Vaping Deals: AUTHENTIC BLACK HERAKLES SUBTANK - $25.99 + FS http://t.co/D4IniN4XRB #vaporjoes #Vapedeals,VUClassifieds,2015-07-20 05:02:24+00:00
2637,622994854692409344,Andrew got me hooked on his vape I need one of them bad boys @yaitsdrew,b_carey13,2015-07-20 05:02:02+00:00
2638,622994853207609344,Just an absolute hell of a deal on tugboat v1's from @FlawlessVapes . 👌🏼👌🏼👌🏼 #vape #vapefam #tuglyfe #vapeon http://t.co/djYAlFD3e5,_vape_is_life,2015-07-20 05:02:02+00:00
2639,622994811528835072,are boys who snapchat themselves vaping even real,heycaeleigh,2015-07-20 05:01:52+00:00
2640,622994671975985153,Daicetyl/Acetyl Propionyl: Who Knew What We Were Looking For Was Already There? | Guide To Vaping http://t.co/uIueEH8qXE,bigdogg8u2,2015-07-20 05:01:19+00:00
2641,622994560680095745,the new vape couple @emmalynn318 @baileypaugh http://t.co/3LNSpmBxDe,rachel_bv12,2015-07-20 05:00:52+00:00
2642,622994349148782592,vape caterpillar,vapeeverything,2015-07-20 05:00:02+00:00
2643,622994167170469888,"A little thing i did 
#vaporlife #vaporfamily #clouds #vyfo #cloudporn #vapeyourfaceoff #vapelife… https://t.co/6RNEgJLnl0",Gday_Vaper,2015-07-20 04:59:18+00:00
2644,622994145796358145,I have been free all my life. (takes a long despair filled drag of my cherry cola vape),behaveys,2015-07-20 04:59:13+00:00
2645,622993982600167425,I liked a @YouTube video from @abbyvapes http://t.co/a1Xed33bJx Vaping Gear Review - Wotofo ATTY3 RDA,perkman2009,2015-07-20 04:58:34+00:00
2646,622993858541043712,Cloud and O's need to work on my O's #vape #Vapelife #vapeporn #TOVC #vapefam #epicclouds https://t.co/qu99fccotM,squad_vapes,2015-07-20 04:58:05+00:00
2647,622993756162293760,Wish I was cool enough to hangout in front of Dutch. But I don't even have a vape pen 🙇🏻,Jooooooooooe27,2015-07-20 04:57:40+00:00
2648,622993665884094464,that relatable moment when you decide you want to grab your friend's vape cloud 😊... (Vine by @chrismelberger) https://t.co/20BT4Egvfw,MountAndDoMe2,2015-07-20 04:57:19+00:00
2649,622993662725779457,Vapor Joes - Daily Vaping Deals: AUTHENTIC BLACK HERAKLES SUBTANK - $25.99 + FS http://t.co/BMeNo4YVjo,vaporjoes,2015-07-20 04:57:18+00:00
2650,622993508274675712,GUYS! No need for magcon drama! Let's all just chill and do vape tricks!!!! 😄😄,arya_khorsand,2015-07-20 04:56:41+00:00
2651,622993364410048512,#3759 Someone got Unicorn Bottles - 30ml @eJuiceDirectCo &amp; saved a ton! http://t.co/fLlLqBLjkg #vape #ejuice,eJuiceDirectCo,2015-07-20 04:56:07+00:00
2652,622993085245558785,LIVE on #Periscope: Vape Session KC https://t.co/Yx2IrDHnzB,tnowicki,2015-07-20 04:55:00+00:00
2653,622992919478280193,Jet fuel can't melt Vape beams #bush #jetfuel http://t.co/4gbSDXHzW0,EasyVapeOven,2015-07-20 04:54:21+00:00
2654,622992847030108161,"UPDATED: Health officials bust vendors, promoters at N.J. e-cigarette convention for indoor vaping http://t.co/PEMPBJnG6h",CNBNEWSNET,2015-07-20 04:54:04+00:00
2655,622992732278157312,Win a Whiteout Evolv DNA200 Box Mod! #vaporjoes #vapingunderground #vaping http://t.co/9WVDYwyFI7,BrittnAngie,2015-07-20 04:53:36+00:00
2656,622992538002169857,Fireball vape juice whaaaaat,169JR,2015-07-20 04:52:50+00:00
2657,622992509875171329,Who needs to vape when you can hit the whip #whipgod ✊✊😤😤👌👌💯💯,GilgBen,2015-07-20 04:52:43+00:00
2658,622992131502788608,Vendors &amp; Promoters Fined at Vape Expo - http://t.co/S62HvgWqXs,Luv_2vape,2015-07-20 04:51:13+00:00
2659,622991903299125249,"Relaxing with Maggie tonight.

#dogs #ruthlessejuice #vape #vapor #vapelife #vapelyfe #ecig… https://t.co/kaMdkIPg8S",ejuicewholesale,2015-07-20 04:50:19+00:00
