,TweetID,TweetContent,TweeterUsername,TweetDatetime
831,623203555827019776,BEYOND VAPE FREE MODS and BV LIQUIDS GIVEAWAYS CONTEST #6 | Page 51: 7/20 Also waiting on vapemail........and ... http://t.co/FgDvbAHXg5,flipkartofferz,2015-07-20 18:51:20+00:00
832,623203515159179264,Who gave the volcano a vape pen dammit https://t.co/pXrDsNSlVr,CTheMoney,2015-07-20 18:51:11+00:00
833,623203505176612865,Win a Whiteout Evolv DNA200 Box Mod! #vaporjoes #vapingunderground #vaping http://t.co/Ug5RHbOPMx,kream1906,2015-07-20 18:51:08+00:00
834,623203403200507904,Our own Ben Cox has been known to be able to nap anywhere! Having a little fun at Vape Expo NJ with the guys this... http://t.co/f2KUJDe6FC,BenJonsons,2015-07-20 18:50:44+00:00
835,623203382845669376,CBD Vape Pens &amp; Cartridges and the Freedom to Medicate Where We Please http://t.co/56dxMku7F7,WizardVapor,2015-07-20 18:50:39+00:00
836,623203345570906112,#vapeyaTailfeather Now available at http://t.co/CU4VEqd4Qw #Vaping #vapelife https://t.co/3KOY6YdYvl,iRocDBes,2015-07-20 18:50:30+00:00
837,623203331188457472,Wake and vape,iLYxMikeG,2015-07-20 18:50:27+00:00
838,623203284006744064,"Hey, where's the best place to get a deal on a vape pen in #pdx or #thecouv? Asking for a friend. #noreally",fat_anarchy,2015-07-20 18:50:16+00:00
839,623203184266231808,Gym kicked my ass,juul_wrld,2015-07-20 18:49:52+00:00
840,623203084232204288,lot 77 vape 💨 @ Sg. Buluh https://t.co/2yfhdROx2C,KimmSeven,2015-07-20 18:49:28+00:00
841,623202995212263424,#vapeyaTailfeather now available at http://t.co/CU4VEqd4Qw #vapelife #Vaping https://t.co/XAFQcclPT7,iRocDBes,2015-07-20 18:49:07+00:00
842,623202974211395585,"""Darth Vaper"" should be a thing in the new #StarWars",JonnyJonJon1,2015-07-20 18:49:02+00:00
843,623202955643105280,The only place you can get Big Bermuda Bubble is at http://t.co/S25FBAGyzJ #ecig #vape,Soruze_,2015-07-20 18:48:57+00:00
844,623202954036666369,The only place you can get Big Bermuda Bubble is at http://t.co/S25FBAGyzJ #vape,Soruze_,2015-07-20 18:48:57+00:00
845,623202712528687104,Vaping 36 mg 50/50 and I go through coils like mad. I get all my juice custom made becaus... http://t.co/l0t9IewemU #vape #ecigs #reddit,ukvaper,2015-07-20 18:47:59+00:00
846,623202711308140545,"Just picked up my first RDA, THE ALLIANCE http://t.co/ycuLob4GTD #vape #ecigs #reddit",ukvaper,2015-07-20 18:47:59+00:00
847,623202710418886656,"Critics warn Bentley's proposed tobacco and e-cig tax hike could cost 2,000 jobs. http://t.co/Ep1dvLhKvJ #vape #ecigs #reddit",ukvaper,2015-07-20 18:47:59+00:00
848,623202560413794304,3 Crucial Tips How to Quit Smoking With Vaping - Ecigclopedia - http://t.co/Y1U6r99a7Y,DaVinciVape,2015-07-20 18:47:23+00:00
849,623202488380993536,"*Middle of a civil conversation about money* *dad to mom* ""do you even vape?""",AshleyWeedon1,2015-07-20 18:47:06+00:00
850,623202451055878145,Boom @limitlessmodco elementeliquids #vapefam #nofuckwits #knuckleheadvapes #vapelife #vape #eliquid https://t.co/7wJm5Wv2er,RalfysReviews,2015-07-20 18:46:57+00:00
851,623202230288711680,"Standing outside pub vaping nicotine-free vapour, guy zooms by on hands-free segway. What tossers we are here in the future.",JemRoberts,2015-07-20 18:46:04+00:00
852,623202167856324608,Our tow truck driver vapes,xX_Nice_Guy_Xx,2015-07-20 18:45:50+00:00
853,623202042522284032,"At my home town vape shop""Vape Social Maryland"" chilling @ Vape Social MD https://t.co/cx42Gt0N8m",pipeline101rg,2015-07-20 18:45:20+00:00
854,623201974536773632,"Selling all my shit I got jars, ashtrays, rollers, vapes, dabbers, pipes you name it",SurfSak,2015-07-20 18:45:03+00:00
855,623201960431370240,ALL VAPE PRODUCTS 40% OFF this month only !!!! We have something everyone come on by and get yourself… https://t.co/HqY1cmBimB,OGGlassTattoo,2015-07-20 18:45:00+00:00
856,623201953485594624,Beautiful morning my dear friends and family vape on! #vapeinstyle #proudvapers https://t.co/lAPedVt3Io,maffipapin,2015-07-20 18:44:58+00:00
857,623201936670486528,daniel keeps taking my vape 😓 when he has his own!!,jennnicaaa,2015-07-20 18:44:54+00:00
858,623201906471645185,"Lovely home made chicken curry, rice and salad for dinner #curry #currychicken #rice #vaping #vapers… https://t.co/saIzvHn0ex",SmokelessP,2015-07-20 18:44:47+00:00
859,623201659733176320,We get it. You vape.  https://t.co/aJe4fW2QsP,devon_beach,2015-07-20 18:43:48+00:00
860,623201628020178944,Going to buy this 180w vape with Poseidon tank and rent myself out at clubs as a fog machine to pay for it,DjGenki,2015-07-20 18:43:41+00:00
861,623201610869641216,Any Hotwires purchase will receive a FREE micro coil stick to help you build your coils with ease!… https://t.co/WwuuZ9WnTD,U_Vape,2015-07-20 18:43:37+00:00
862,623201610647384064,Is it possible to vape without telling everyone ever that you vape,Sidpartridge,2015-07-20 18:43:37+00:00
863,623201482851110912,Eat Pray Vape,JKf0rtyse7en,2015-07-20 18:43:06+00:00
864,623201460432470016,anyone on here vape? been thinkin abt getting into it,UNLStoners,2015-07-20 18:43:01+00:00
865,623201223420833792,alright we get it.... you vape https://t.co/UlrPkCZX0S,xenirehtac,2015-07-20 18:42:04+00:00
866,623201018319372288,Minions who vape&gt;&gt;&gt;&gt;&gt;&gt;&gt;,Yung_Drugs,2015-07-20 18:41:15+00:00
867,623200990892847106,Opinion: New 'tobacco' control bill is ill-conceived     http://t.co/Gv2wFpMcIC #vaping #notblowingsmoke,dave_lcsog,2015-07-20 18:41:09+00:00
868,623200926283776001,The woman on this train holding her Popsicle like a vape pen has inspired me to live yet another day on this awful planet,sippinwater,2015-07-20 18:40:53+00:00
869,623200883766087680,I'm at krai vaper station https://t.co/QAlsfOpR5t,EryNazrii,2015-07-20 18:40:43+00:00
870,623200682191949824,Win a SX Mini M Class mod from http://t.co/NQOwbR0VfB - http://t.co/uPsmdqn8fY #ecig #Vape,DuWayneBrayton,2015-07-20 18:39:55+00:00
871,623200563023486976,"Health officials bust vendors, promoters at N.J. e-cigarette convention for indoor vaping http://t.co/JmYewB2ZII",GL_FLOW,2015-07-20 18:39:27+00:00
872,623200553158475776,"Health officials bust vendors, promoters at N.J. e-cigarette convention for indoor vaping http://t.co/nB2YhcdRQl",GL_FLOW,2015-07-20 18:39:25+00:00
873,623200420056403968,Handcheck #reserved #risingsun #aspire #istick #eleaf #atlantis #vape #vaper #vapeuk #vaping #vapeguy… https://t.co/ohK8bXtMVi,b_h_designs,2015-07-20 18:38:53+00:00
874,623200292855746560,Yall come the the vape shop ! http://t.co/oQSTRtigIK,Treylorhood97,2015-07-20 18:38:22+00:00
875,623200212748750852,A channel dedicated to #Vape Check it out here. http://t.co/acvqmNVAyv,ModMonth,2015-07-20 18:38:03+00:00
876,623199936969068544,"RT SmettiDeca: Thank for visti! Rewiv porko kill

#vape #vaper #vaping #vapepic #vapepics #instavape #vapegram… http://t.co/CLJntWhSB7;",vapemerch,2015-07-20 18:36:58+00:00
877,623199699391115264,"I have not had a minute to thank my friends in the vape world for everything this weekend.

First I… https://t.co/vupCZwVXGP",tjbowmanmadeit,2015-07-20 18:36:01+00:00
878,623199697285578752,RT jimmibean: http://t.co/cmZoJBg4gZ; #vapelife #Vape #585 #roc,vapemerch,2015-07-20 18:36:00+00:00
879,623199695792435200,RT VapeDon: FOAD 07 19 15 Replay http://t.co/FtiyBiAFCn  #Vape #ecig,vapemerch,2015-07-20 18:36:00+00:00
880,623199693946929152,RT VapeDon: FOAD 07 19 15 Replay http://t.co/HBA5PCTFUw  #Vape #ecig,vapemerch,2015-07-20 18:36:00+00:00
881,623199683003990016,Vape and scooters are life 😍😍😂,bbriannaboydd,2015-07-20 18:35:57+00:00
882,623199634299686913,"Hahahaha this is how we so it!

#Vape #Vaping #Vaper #Vapers #VapeCommunity #eCig #eLiquid http://t.co/Z1aJHc4jro",VaperSoul,2015-07-20 18:35:45+00:00
883,623198808600543232,I'm finna get a vape just to find an horchata flavor,ADR1ANPETER,2015-07-20 18:32:29+00:00
884,623198756062638080,Who's heading to our listening session on vaping tomorrow? Check out the website for a parking pass and the... http://t.co/x6hq7wIujA,SnoHD,2015-07-20 18:32:16+00:00
885,623198733195472896,"40% OFF all vaporizers!

This month only - save 40% on all vaporizers and vape accessories. Please… https://t.co/vuJ5QePJXI",OGGlassTattoo,2015-07-20 18:32:11+00:00
886,623198707404681217,"Thank for visti! Rewiv porko kill

#vape #vaper #vaping #vapepic #vapepics #instavape #vapegram… https://t.co/4tlRdOwAMQ",SmettiDeca,2015-07-20 18:32:04+00:00
887,623198685443129344,What's the running conversion rate of Doc Martens to Vape Pens?,chris_txt,2015-07-20 18:31:59+00:00
888,623198581000810496,When Tyler pulled out the marker I thought it was a vape pen tbh,joanabananaaa,2015-07-20 18:31:34+00:00
889,623198549883248640,Summertime Vaping - The Vape Channel: http://t.co/zZYf9VSHG7 via @YouTube,TheVapeChannel,2015-07-20 18:31:27+00:00
890,623198543872831488,"HAVE YOU HEARD: TOWN sponsors swanky Hamptons food fest, Assemblymember introduces bill that wo... http://t.co/c5mLQSrQBu #ecigs #vaping",VapinXsmoker,2015-07-20 18:31:25+00:00
891,623198542945849344,Congresswoman working to stop online tobacco sales to minors http://t.co/CrAaoaSrmi #ecigs #vaping,VapinXsmoker,2015-07-20 18:31:25+00:00
892,623198542228623360,City of Saskatoon considering e-cigarette ban http://t.co/Stq7JTj8eD #ecigs #vaping,VapinXsmoker,2015-07-20 18:31:25+00:00
893,623198541406564352,New Study Claims E-Cigarette Vapor No More Dangerous Than Air http://t.co/cbxGHpZLgs #ecigs #vaping,VapinXsmoker,2015-07-20 18:31:25+00:00
894,623198522511372288,VariVape Glass Tanks #vapers #vaping #vape #vapor - http://t.co/7w0bmhAEV9 smart as,Scottaeon,2015-07-20 18:31:20+00:00
895,623198417217585152,New #vapegear came today! And the Muffin Man is back in stock in all levels! #Vape #vapeporn #MondayMotivation http://t.co/eHVemrO57K,XperienceVapes,2015-07-20 18:30:55+00:00
896,623198408002662400,The NJVRC and vape community in NJ want to thank every vendor at Vape Expo NJ who donated to help us… https://t.co/yg9J56qhEp,NJVRC,2015-07-20 18:30:53+00:00
897,623198351203409920,just saw a middle aged woman vaping @ the mini golf course i work at. i now love wisconsin,animegirrl666,2015-07-20 18:30:40+00:00
898,623198304352931840,A vape is a fedora for the mouth,imthebestcyat,2015-07-20 18:30:28+00:00
899,623198255841579008,You just love me for my vape,TBurdian,2015-07-20 18:30:17+00:00
900,623198253941698560,FOAD 07 19 15 Replay http://t.co/cLAk9GwQLb #Vape #ecig,VapeDon,2015-07-20 18:30:16+00:00
901,623198251815206912,FOAD 07 19 15 Replay http://t.co/yJZHwayMvM #Vape #ecig,VapeDon,2015-07-20 18:30:16+00:00
902,623198215173709824,"Get the #Vaping Granny #SealOfVaproval for UR #Vape Business!
Let me Tweet YOU!
Message me for consult http://t.co/8ZGOxtAgT6",RealDonnaDeVane,2015-07-20 18:30:07+00:00
903,623198206294401024,"We're all dessert lovers, and the guys at Vape Gem know that. We love our dessert juices, and we want to share... http://t.co/ibGILPSjbI",VapeGem,2015-07-20 18:30:05+00:00
904,623198192490971136,vape grain,vapeeverything,2015-07-20 18:30:02+00:00
905,623198124991905797,We have IPV4 Silver on sell for $69.95  $vape #boxmod #ipv4 #vapenation.com http://t.co/9GlbkFFj3O,VapeNationLLC,2015-07-20 18:29:46+00:00
906,623198091886391297,Dual parallel twisted wire .1ohm vapes great #twistedwire #vape #clouds #plume #vapor #mods #vaping http://t.co/JPXkbI0X7w,MasoncaAdams,2015-07-20 18:29:38+00:00
907,623197863279865856,when tyler took out the marker in the lane boy video I thought it was a vape pen not gonna lie,puzlluvr,2015-07-20 18:28:43+00:00
908,623197849560424449,Visiting #london tomorrow. Where's the #vape action at? Anywhere I need to go? #vapetips #vaping #vapefam,BigglesVapes,2015-07-20 18:28:40+00:00
909,623197840358146049,"Another happy customer! @switchboxvapes @turncoatindustries
#carolinavaporlounge #tugboat #vape #vapor #vaping... http://t.co/qDeWMYQMDo",NCVaporLounge,2015-07-20 18:28:38+00:00
910,623197829415219200,"Another happy customer! @switchboxvapes @turncoatindustries
#carolinavaporlounge #tugboat #vape… https://t.co/mLhXm1af0g",NCVaporLounge,2015-07-20 18:28:35+00:00
911,623197439797907456,Review coming up on these new #ejuices suicidebunny #thecloudcompany #revel #sky #billow #arise #vape… https://t.co/KcLvT70ZeD,AmbitionZVapeR,2015-07-20 18:27:02+00:00
912,623197341219053568,I liked a @YouTube video http://t.co/zAm1bzHZWg ESquare DNA 40 By Lost Vape!,CDJBeatz,2015-07-20 18:26:39+00:00
913,623197298651213824,"Soooo, just making sure.  You're saying I can't use my vanilla vape juice in my cake mix?",magicraisin,2015-07-20 18:26:29+00:00
914,623197175271415808,Win a Whiteout Evolv DNA200 Box Mod! #vaporjoes #vapingunderground #vaping http://t.co/dbbhoALEue,TangerineShay,2015-07-20 18:25:59+00:00
915,623196743233085440,"Vaping on metro listening to Kendrick 
#kendricklamar
#mortalman #GeminiNation #poet #vapelifestyle… https://t.co/4zaEr2uJ58",Mickey_MikeMike,2015-07-20 18:24:16+00:00
916,623196720940187648,Who #HACKED my twitter and followed all these vape shops? I don't even vape.The vape that fell outta my purse was my DAD's.,violentlyshy,2015-07-20 18:24:11+00:00
917,623196610294587393,Holy grail vapes ;) https://t.co/UL7EL2yiro,holygrailhookah,2015-07-20 18:23:44+00:00
918,623196197306511360,That relatable moment when you decide you want to grab your friend's vape cloud! https://t.co/lcyEiOdBTj,ADHD_BadBoy,2015-07-20 18:22:06+00:00
919,623196175772979200,My co-worker brought in a vape today that looks like an iPod with a tube on top?,Faizfriend_,2015-07-20 18:22:01+00:00
920,623196109649764352,Win a SX Mini M Class mod from http://t.co/umt2v1j8T9 - http://t.co/Q5ZY6DEB12 #ecig #Vape,h2odragin,2015-07-20 18:21:45+00:00
921,623196049142882304,there are like three vape kiosks at this mall omg,rockywhores,2015-07-20 18:21:31+00:00
922,623195944243216385,my car smells like vape smh,GabiKuraitis,2015-07-20 18:21:06+00:00
923,623195665347280896,European Council the Principal Private Secretary is a vaper. #ecig #vape #vapelife http://t.co/SNf4GraTbF,naturacig,2015-07-20 18:19:59+00:00
924,623195625107034112,Interested in vaping? Check out FAQ page! http://t.co/YhnbUsunli #vapelife #thevaporpro,thevaporpro,2015-07-20 18:19:50+00:00
925,623195423323328512,Good morning from HOLY GRAIL VAPES 😀 check out our 3 new summer flavors! http://t.co/HloVtqCbpM https://t.co/yUr5qB0uTs,holygrailhookah,2015-07-20 18:19:01+00:00
926,623195152916549632,6mg l paddle pop flavour l creamy (@ Apple Pai Vape Store) https://t.co/DukM27N2po,amirulnazmee,2015-07-20 18:17:57+00:00
927,623195130078474240,July coupon code for 10% off: USA10 http://t.co/5ZVMu2l4CZ #vape #thevaporpro,thevaporpro,2015-07-20 18:17:52+00:00
928,623195122054725632,ugh guys that vape 😍😩🙏🏽🙌🏽 http://t.co/S5vxLFgaEM,meanutbutter,2015-07-20 18:17:50+00:00
929,623195075917533184,Damn my forehead big 😬😂😂 #HappyMonday headed to the vape store! With breath_of_the_gods… https://t.co/frZbaPonay,MollysWorldAtl,2015-07-20 18:17:39+00:00
930,623195048667127808,#nikita #fruitatthebottom #charlienoble  charlienoblejuice #mutation #v4 #Vape #clouds #authentic… https://t.co/tXdql1uCZY,Slender_Cain,2015-07-20 18:17:32+00:00
931,623194874263773184,Stats for the day have arrived. 1 new follower and NO unfollowers :) via http://t.co/TrUFOgOhUK.,Vapes_Leeds,2015-07-20 18:16:51+00:00
932,623194835189547009,totally buying a vape today been craving a cig so bad I CANNOT TURN BACK TO SMOKING AGAIN,retiredhoodratt,2015-07-20 18:16:41+00:00
933,623194825869778944,Yeah boy go ahead and fill that Honda up with smoke from your vape pen ya hardass!,chadwoods24,2015-07-20 18:16:39+00:00
934,623194612711043072,"I got a horrible vape flavor, it's called nude port, if u see the flavor DO NOT BUY IT, it tastes like honey, mint and buttered popcorn",lameasssarahh,2015-07-20 18:15:48+00:00
935,623194598718971905,Lmao some dumbass kid got caught hitting a vape on the bus (ft. The dude that looks like silent bob) http://t.co/8phhxjb6gq,Trashcat420,2015-07-20 18:15:45+00:00
936,623194465449213953,RT VapeAirLounge: Kanger SUBTANK mini's now in stock at VAPE AIR LOUNGE! Available at both San Antonio locations. … http://t.co/no1NilqWoW;,vapemerch,2015-07-20 18:15:13+00:00
937,623194442640531456,After #workout at #planetfitness my #starbucks #coffee and #vape .. #americano #vapeporn #vape4you… https://t.co/ee2OgSgIQr,redmnm88,2015-07-20 18:15:08+00:00
938,623194294120116224,i love vaping 😍💨👌🏼 http://t.co/owAawgT4fm,biimbofairy,2015-07-20 18:14:32+00:00
939,623194287291932672,Is e-liquid tobacco if so Atropine is deadly nightshade not a life saving drug. Contortostatin a cancer killing drug or snake venom #vape,SubvaperJim,2015-07-20 18:14:31+00:00
940,623194271122743296,Flavour rda's http://t.co/AxFb9yrBad #ecig #vape #TVS,ukvaper,2015-07-20 18:14:27+00:00
941,623194232342376449,"Sorry for the short notice but there will be no show tonight, tune in tomorrow at 9pm for Vaper Scene with @MarcoVanB_UK",VapourtrailsTV,2015-07-20 18:14:18+00:00
942,623194194497171457,Hot day handheck.  Big thank you to @fragilefyre for my dream rta from 528_custom_vapes the monster… https://t.co/r2m65eSNx1,musacchiophoto,2015-07-20 18:14:09+00:00
943,623194179527520256,Video shows man grabbing cloud of e-cigarette vaper SMOKE exhaled by friend ... http://t.co/nrTUF5pYoB,MyFreedomNews,2015-07-20 18:14:05+00:00
944,623193970164654080,#win with @multicig quit #smoking and start #vaping via @AgataPokutycka Full #giveaway T&amp;C at http://t.co/a72S3DKI1x #goodluck,teetee63,2015-07-20 18:13:15+00:00
945,623193876438712320,I remember that one time my cousins roasted one of our cousins for owning a vape,RexxRayy,2015-07-20 18:12:53+00:00
946,623193840787193856,Hope everyone is having a good day!   #tikihutvapes #Ejuices #eliquid #vaper #vapor #vaping #quitsmoking #VapeOn http://t.co/bNDTDqjYUi,TheTikiHutVapes,2015-07-20 18:12:44+00:00
947,623193433876905984,"Been loving the new flavor from slstce_eliquids! A nice tastes vape.
Thumper is a carrot cake with… https://t.co/8ydL3q4JJi",_RRMedia,2015-07-20 18:11:07+00:00
948,623193296538501120,High Line Hugger: A Look Inside Thomas Juul-Hansen’s 505 W. 19th Street: An exclusive look at Thomas Juul-Hansen's… http://t.co/9nnciWZUP5,RENewsNYC,2015-07-20 18:10:34+00:00
949,623193193832652800,"""I can't find my lighter."" ""OHHH, I don't have that problem!"" *waves expensive vape around* NO ONE ASKED YA FUCKIN TOOL.",pnkrcktherapist,2015-07-20 18:10:10+00:00
950,623193127289925632,The @blackhatcigs beach crew is giving you vapers a 4 gun salute! #vapelife #BlackhatVapor #cloudchasing http://t.co/yhiAGHLbzd,blackhatcigs,2015-07-20 18:09:54+00:00
951,623192879591100417,"In my opinion, it's SO stupid for people to have vapes if they aren't trying to quit smoking. Since that is the whole purpose of a  vape.",ali_payton,2015-07-20 18:08:55+00:00
952,623192830979104768,sort of disappointed in myself for trying vape when i vowed to never smoke throughout my entire life 😟😟,haeykceb,2015-07-20 18:08:43+00:00
953,623192697461866496,Thinking of quitting cigs? Read these personal quitting stories http://t.co/WDAWQeMZWi #Vape http://t.co/6rt2CtnIdJ,VaporMax_,2015-07-20 18:08:12+00:00
954,623192578440228864,Use your #logicecig! Start vaping today and save:http://t.co/p3p2fKmRxp http://t.co/i5EWIUwKbB,LOGICSMOKES,2015-07-20 18:07:43+00:00
955,623192464879292416,"Concentrates 101: How to consume them — dabbing, vaping &amp; more: http://t.co/7qkUn1UbpP by @CannabisEncyclo #pot http://t.co/WJdTqKWxWg",cannabist,2015-07-20 18:07:16+00:00
956,623192380259348481,Castle #driptip #chesspiece #vape #vapor #vaporizer #vaporiser #vaping #stopsmoking #startvaping https://t.co/yrVJc5gRTD,gramscinobbie,2015-07-20 18:06:56+00:00
957,623192056739926016,#HoustonArt located at #spyglassvapor #spyglass #spyglasselixir #cloudcouch #art #Houstonartists #vape #vaping http://t.co/ithGi3RfCW,SpyglassVapor,2015-07-20 18:05:39+00:00
958,623192022116118528,"New #CBD #eLiquid: Sugar Plum Fairy! Super sweet Cherry will make you say YUM!  $54.99!
http://t.co/VnyXDgtCgO
#vape http://t.co/XiJ9cyMxzU",YourCBDSource,2015-07-20 18:05:31+00:00
959,623191887588028416,#3780 Someone got ANML @eJuiceDirectCo &amp; saved a ton! http://t.co/0hh88lasB2 #vape #ejuice,eJuiceDirectCo,2015-07-20 18:04:59+00:00
960,623191874510172160,#3779 Someone got Jazzy Boba @eJuiceDirectCo &amp; saved a ton! http://t.co/nBpnEIn9pP #vape #ejuice,eJuiceDirectCo,2015-07-20 18:04:55+00:00
961,623191855308611584,On My Vaping Shit Today...,CornellM504,2015-07-20 18:04:51+00:00
962,623191783544111105,There is a group called vapers omfg I've lost hope,TomSimpson2019,2015-07-20 18:04:34+00:00
963,623191349270024193,#3778 Someone got Flave Lab @eJuiceDirectCo &amp; saved a ton! http://t.co/SWHXrmkzbf #vape #ejuice,eJuiceDirectCo,2015-07-20 18:02:50+00:00
964,623191333771939841,Vape + albens (at @beergarden_jkt) [pic] — https://t.co/5D1Y1h3xvt,RayanWardoyo,2015-07-20 18:02:46+00:00
965,623191314268602368,New vape hype! https://t.co/XYmRkgrtM3,PrestonalityC,2015-07-20 18:02:42+00:00
966,623191231020027904,When you decide to grab your friends vape cloud via(@chrismelberger @JulienSolomita): http://t.co/lO46wBc51x http://t.co/ZCV0zrAdxb,theFlama,2015-07-20 18:02:22+00:00
967,623191037326962689,Win a Whiteout Evolv DNA200 Box Mod! #vaporjoes #vapingunderground #vaping http://t.co/rIVsFdYJ9G,DesiWN,2015-07-20 18:01:36+00:00
968,623190793134702592,Start your week off right by coming into @vape_it_easy!  Save 10% off when you pick up the Ego One to celebrate... http://t.co/eBer4Y39cv,VapeItEasy,2015-07-20 18:00:38+00:00
969,623190751371878400,thehangoutroom just went LIVE at [ http://t.co/N4Zv5Jt3P4 ] on @Vapersdottv - #AutoTweet #Live #Video #Vaping #Vapers #ecig #Vapor,LiveOnVapers,2015-07-20 18:00:28+00:00
970,623190664289759232,HAPPY BIRTHDAY @RUSIN_Of_abitch!!! Hope you have a crazy fun day!!! #i'mshaking #mylegsarelonger #vape? 🎈🎉💕,sagiSImerolling,2015-07-20 18:00:07+00:00
971,623190642613723136,vape writer,vapeeverything,2015-07-20 18:00:02+00:00
972,623190638045954048,I still get so light headed from vaping,whatevertorreyb,2015-07-20 18:00:01+00:00
973,623190598049140736,I've sold $74k of vapes since january,Drankenstein_,2015-07-20 17:59:51+00:00
974,623190549843963904,I vape http://t.co/IEqzHrrqpt,jvckski,2015-07-20 17:59:40+00:00
975,623190473717493760,wow I just love boys who think there cool cause they vape,paigeann25,2015-07-20 17:59:21+00:00
976,623190470152331264,Its never too late to quit smoking. Take your freedom back from tobacco and switch to vape!!!,CycloneVapor,2015-07-20 17:59:21+00:00
977,623190454671155200,; got a new vape in my life. yassss. 😚💨,nikkiann234,2015-07-20 17:59:17+00:00
978,623190452615966720,Home grown fruit and veggies #pumpkin #blueberry #apples #vaping #vapers #smokelesspleasure https://t.co/jqctsrgnJq,SmokelessP,2015-07-20 17:59:16+00:00
979,623190195798700032,#mod#vapelife#vape#vapor#rda#dripclub#cloudchaser#chasingclouds#driper#coilporn#coil#juice#vapenj#vape… https://t.co/KSb68NA2hy,bigbanginbuds,2015-07-20 17:58:15+00:00
980,623190134553350144,mikra08 just went LIVE at [ http://t.co/4BngH5BmXH ] on @Vapersdottv - #AutoTweet #Live #Video #Vaping #Vapers #ecig #Vapor,LiveOnVapers,2015-07-20 17:58:01+00:00
981,623190130711506944,LIVE on #Periscope: Vape is life  https://t.co/tjkCRRJCqa,Gino_Gino_Gish,2015-07-20 17:58:00+00:00
982,623190090119032832,Lovely home grown vegetable doing well in the greenhouse #homegrown #vegtable #vaping #vapers… https://t.co/rbe4tpEG4O,SmokelessP,2015-07-20 17:57:50+00:00
983,623190071253028864,High Line Hugger: A Look Inside Thomas Juul-Hansen’s 505 W. 19th Street http://t.co/0WN35aMsNE,Eva_Kolbinsky,2015-07-20 17:57:45+00:00
984,623189950792663040,"Smoking this hot ass vape, in this hot ass car.",trapmomKAKE,2015-07-20 17:57:17+00:00
985,623189753869905920,LIVE on #Periscope: #vapemeet #vaporizer #vapers #surabayavaperscommunity https://t.co/jQXEwfiXw2,afimotik,2015-07-20 17:56:30+00:00
986,623189701483196417,"I Have that #fridayfeeling @JoyetechUK 
My 2 days off work start now.#VapeOn 
#Vapefam I can #vape wherever I like ☺",BeethamPaul,2015-07-20 17:56:17+00:00
987,623189689013415936,E-cig ban proposed for public spaces - Saskatoon StarPhoenix http://t.co/HSWzs1s49V #ecigs #vaping,VapinXsmoker,2015-07-20 17:56:14+00:00
988,623189686350139392,I need coffee and my vape... Vape and my coffee,missbailey86,2015-07-20 17:56:14+00:00
989,623189638375718912,"My new vape pen! 
I wanted to do a blog post {still working on it} but YouTube is taking lifetimes to process my... http://t.co/WZolyZtzFj",VintageModMom,2015-07-20 17:56:02+00:00
990,623189548269441024,LIVE on #Periscope: Vape is life . Wrist brakes  https://t.co/ADj8A4AJSN,Gino_Gino_Gish,2015-07-20 17:55:41+00:00
991,623189487527587840,"The effects of cigarettes and e-cigs on white blood cells.
#vapescience #vaping E-CIG: No Adverse Effects on Blood http://t.co/TzLuEVHsXt",OffbeatnUnique,2015-07-20 17:55:26+00:00
992,623189445718736897,after 24986 years i finally found this clip. truly a historic day for a of us. (Vine by vape wizard) https://t.co/MIW0h85flT,httpgrayham,2015-07-20 17:55:16+00:00
993,623189405423931392,Every single person who vapes http://t.co/SiePFSwwXo,Rynosaur16,2015-07-20 17:55:07+00:00
994,623189387111600130,Vendors Fined HOW MUCH for Allowing Vaping at the New Jersey Vape Expo!? - http://t.co/n8jRHFnr5A http://t.co/NzKENoUTSf,vaporvanity,2015-07-20 17:55:02+00:00
995,623189261680967680,High Line Hugger: A Look Inside Thomas Juul-Hansen’s 505 W. 19th Street http://t.co/PiBGBkl3DD,nyomedia,2015-07-20 17:54:32+00:00
996,623189021955649540,When he sets up ur weed vape to ur regular vape so u can have a nice relaxing day off in bed. 👌,ShesCrazySee,2015-07-20 17:53:35+00:00
