,TweetID,TweetContent,TweeterUsername,TweetDatetime
666,767433645468610561,Vaping IS better than smoking and 'is improving the world's health' | Daily Mail Online https://t.co/bR6HrWUhR5,JeanLucSmokhard,2016-08-21 18:50:13+00:00
667,767433629488119808,"""It's cloudy because God is vaping""",Lee_Bechor7,2016-08-21 18:50:10+00:00
668,767433620990590976,No I will not vape that shit bap,_ApolloB,2016-08-21 18:50:08+00:00
669,767433504456073216,"Nov., 2016 elections are right around the corner! Take action now w/ one simple question.
#vape #vapeshop #vapefam  https://t.co/JaTYArENnY",VapingAirGunner,2016-08-21 18:49:40+00:00
670,767433437796003840,"Vape Store Owner: ""Obvious you don't know about business killing regulations about to destroy my life.""
Me: ""Do you have something fruity?""",JoshKrugerPHL,2016-08-21 18:49:24+00:00
671,767433323757133824,"IJoy Solo Plus &amp; IJoy ACME-Vape Tank Bundle $23.99 https://t.co/u7523EoKTt, #VapingCheap",VUClassifieds,2016-08-21 18:48:57+00:00
672,767433322138042368,"Spend $35 Get 60ml of Weirdo Vape E-Liquid For Only $0.99! https://t.co/hQVZK8cOjX, #VapingCheap",VUClassifieds,2016-08-21 18:48:56+00:00
673,767433320057610240,Thanks for the recent follow @GeniusPothead @JohannesDreijer @Vaper_Room Happy to connect :) have a great Sunday.,DaVinciVape,2016-08-21 18:48:56+00:00
674,767433248947499008,Jordan only talks about magic cards and vaping,Kayleigh_Stine,2016-08-21 18:48:39+00:00
675,767433034727579650,RiP Trippers: Last Chance To Save Vaping! https://t.co/sO0YQQVP7I via @YouTube,Santista211,2016-08-21 18:47:48+00:00
676,767433026955415552,Nate diaz is g for vaping his cbd pen in his post fight interview.,Man_Gorilla,2016-08-21 18:47:46+00:00
677,767433003782008832,I liked a @YouTube video from @pixel_vape https://t.co/yfpRArY3rO #RIADs Rundown 4,jayvapereviews,2016-08-21 18:47:40+00:00
678,767432986665029632,Director Aaron @Biebert Talks About @ABillionLives Documentary https://t.co/5ATYbNIen8 via @Vaping360 #Vaping #Ecigs https://t.co/gfW6peAj9M,Vaper_Room,2016-08-21 18:47:36+00:00
679,767432984630812676,"I recently had to leave a vape shop hastily after the owner cornered me demanding to know what I did for ""freedom advocacy.""",JoshKrugerPHL,2016-08-21 18:47:36+00:00
680,767432820658667520,#health Smokers who turn to vaping with e-cigarettes 'have fewer lung infections' https://t.co/ZCrfh8lrNE,smilecentreleic,2016-08-21 18:46:57+00:00
681,767432770222161920,"Dirt bikes
Peach iced tea
Acoustic guitar
Full Sleeve tattoo
Shaved undercut
Vaping",0hshin,2016-08-21 18:46:45+00:00
682,767432494790676480,"nytimes: In North Carolina, a vape shop reveals America's economic and social anxieties https://t.co/a8G2UJBe3x https://t.co/lMH8lwvjvH #…",Mosharraf0129,2016-08-21 18:45:39+00:00
683,767432419741872128,"A most happy birthday to @ben_bg3 thank you for the years of laughs, tears, and philosophical questions about vape https://t.co/JsumOmWZ08",Mchotalla,2016-08-21 18:45:21+00:00
684,767432256117993472,"nytimes: In North Carolina, a vape shop reveals America's economic and social anxieties https://t.co/zOqTjzc5Wr https://t.co/bPP34l2U6b",michael_voolaid,2016-08-21 18:44:42+00:00
685,767432234223697921,Video: Diaz smokes CBD vape pen in press conference https://t.co/5uOV0xONoa,602PCC,2016-08-21 18:44:37+00:00
686,767432186404474881,"#vapeshop 's Plz feel free to utilize this sign @ your P.O.S. areas.

#vape #vapenews #vapefam  https://t.co/XJFPzCaq2m",VapingAirGunner,2016-08-21 18:44:26+00:00
687,767432133132611585,The vape life chose @NellSalvoni https://t.co/mySxknqLV2,aifbarry,2016-08-21 18:44:13+00:00
688,767432067902607360,Apparently I vape @ karaoke bars now https://t.co/uw40g4gGfn,Kaytrots,2016-08-21 18:43:57+00:00
689,767431995412586496,I liked a @YouTube video from @kuledud3 https://t.co/FOab4vtYIC THE VAPE SHOP,Coreycool99,2016-08-21 18:43:40+00:00
690,767431990874255360,"209 hero @NateDiaz209 talks to media after loss to McGregor, vapes on stage + considers trilogy 💰 https://t.co/Ib265b7CfD #UFC202 #UFC",KarynBryant,2016-08-21 18:43:39+00:00
691,767431899845267456,Nate Diaz Showed Up To The UFC 202 Presser Smoking A Weed Vape Pen - UPROXX https://t.co/4JPNRblC6l,notobacco55,2016-08-21 18:43:17+00:00
692,767431844836937728,"Post Edited: With vape pen in hand, UFC 202’s Nate Diaz explains the benefits of cannabidiol oil https://t.co/B2qo5QhN2U",mmafightbiz,2016-08-21 18:43:04+00:00
693,767431824784056321,"#TownerSaysReadThis Vape shops are the litmus paper of modern America. As goes the vape, so goes the nation. https://t.co/56tczqntsR",mrtowner,2016-08-21 18:42:59+00:00
694,767431757389963264,*sees dojima vaping* wrow,adachibot69,2016-08-21 18:42:43+00:00
695,767431590062325760,"With vape pen in hand, UFC 202's Nate Diaz explains the benefits of cannabidiol oil https://t.co/5VteH9fYVD",MWA_AIP,2016-08-21 18:42:03+00:00
696,767431324307042304,Video: UFC 202 headliner Nate Diaz nonchalantly vapes CBD oil during press conference https://t.co/HdBzvbMIAF,MMAtoast,2016-08-21 18:41:00+00:00
697,767431319575859200,Video: UFC 202 headliner Nate Diaz nonchalantly vapes CBD oil during press conference https://t.co/RipytNpTkf,dream_fc,2016-08-21 18:40:59+00:00
698,767431316430217217,Video: UFC 202 headliner Nate Diaz nonchalantly vapes CBD oil during press conference https://t.co/0ENJtl0A1C,MMAtours,2016-08-21 18:40:58+00:00
699,767431314333061120,Video: UFC 202 headliner Nate Diaz nonchalantly vapes CBD oil during press conference: Nate Diaz has always b... https://t.co/Tum4MK1Yya,MMArtsy,2016-08-21 18:40:58+00:00
700,767431312156217344,Video: UFC 202 headliner Nate Diaz nonchalantly vapes CBD oil during press conference: Nate Diaz has alw... https://t.co/0KLGQFwffK #mma,BreakYoShit,2016-08-21 18:40:57+00:00
701,767431310625222657,Video: UFC 202 headliner Nate Diaz nonchalantly vapes CBD oil during press conference: Nate Diaz has always b... https://t.co/BuwoBczO3y,fantasyfighting,2016-08-21 18:40:57+00:00
702,767431295844704256,"Happy Birthday to @Dickmann23 my Uzi loving, vape God 🎂💨",dyoules12,2016-08-21 18:40:53+00:00
703,767431198251503616,no rules.. just freehand neon colors. #vape #modbox #vapemod #vaping #vapelife #vapeon  #vapenation #vapefam https://t.co/bWV9vh0qy9,StompyPedals,2016-08-21 18:40:30+00:00
704,767431160053964800,"British Invade USA and Win the Vape War! https://t.co/vZYMGvqsp4
Now available at LanMark Wholesale or https://t.co/51xLYjEYHT",LanmarkW,2016-08-21 18:40:21+00:00
705,767431136712728577,"In North Carolina, a vape shop reveals America's economic and social anxieties https://t.co/FE7tH2OaFt https://t.co/1Py7zItktf via nytimes",GetUrSolution,2016-08-21 18:40:15+00:00
706,767431101094633472,"yes, I didn't think it was a tobacco vape... https://t.co/LPqplpvHns",PeacePiper,2016-08-21 18:40:07+00:00
707,767431029497925633,Oink oink *vapes*,shizulita,2016-08-21 18:39:50+00:00
708,767430784382754816,so many vape shops and lounges here in Newport Beach 😂,YaaBoiiRobert,2016-08-21 18:38:51+00:00
709,767430742548721664,more details for this 1590BB.. but kinda liking it this clean..😎 #vape #modbox #vapemod #guitarpedal #enclosure https://t.co/lRmEfEkE3H,StompyPedals,2016-08-21 18:38:41+00:00
710,767430742175387648,"Just #musing
Whilst looking at names of phobias
A thought entered my mind
Has anyone coined a name 4 the fear of #vape technology?
glANTZian",IamBroony,2016-08-21 18:38:41+00:00
711,767430621136248832,Video: UFC 202 headliner Nate Diaz nonchalantly vapes CBD oil during press conference https://t.co/YuFYnC5DlT #ufc #mma,mmajabberjaw,2016-08-21 18:38:12+00:00
712,767430592870821888,"If you go to the gym and then vape right after in the parking lot, your workout didn't count....",stefaniemtnz,2016-08-21 18:38:06+00:00
713,767430521978626048,The different flavors of vape juice is insane,zakashybparks,2016-08-21 18:37:49+00:00
714,767430429523714048,Nate Diaz vaping weed during the press conference last night should've won a performance of the night bonus,H_Six_,2016-08-21 18:37:27+00:00
715,767430211801456640,Nate Diaz Hitting A Vape Pen / Dab Pen During UFC 202 Post Fight Intervi... https://t.co/4TeJcrv60n via @YouTube #Vape,ChristopherRude,2016-08-21 18:36:35+00:00
716,767430170315722753,"RT In North Carolina, a vape shop reveals America's economic and social anxieties https://t.co/eNGdKpDKXD https://t.co/JqvRYJEhlZ",lucy_trendwatch,2016-08-21 18:36:25+00:00
717,767430103173255170,"A friend suggested smoked garlic. It's great, but I've smoked it in the pipe, the bong, and the vape and I'm still not high.",rick_taylor,2016-08-21 18:36:09+00:00
718,767430054330507264,Are Michael Douglas and Martin Sheen the same person?,vaper_dads,2016-08-21 18:35:57+00:00
719,767429834028920832,US FDA’s response to the Court in consolidated lawsui... https://t.co/0op0gSPxhs #vape vaping https://t.co/PQ9MPIYil6,maryall33220748,2016-08-21 18:35:05+00:00
720,767429784188116992,HealtHnews: Smokers who turn to vaping with e-cigarettes 'have fewer lung infections' https://t.co/CoxiU8VhSH,DrAlexConcorde,2016-08-21 18:34:53+00:00
721,767429781163954176,"We get it bro, you vape. https://t.co/cHNFGuxaup",AdamSinger,2016-08-21 18:34:52+00:00
722,767429488648925184,If I vape maryjowanda will I still get a hole in my neck🤔,tu1ipbay,2016-08-21 18:33:42+00:00
723,767429430482464769,Or if you want a vape for the low hmu https://t.co/Sg6ropIDHg,DarKo_Muzik,2016-08-21 18:33:29+00:00
724,767429286399647744,Allright guys just started working in a cigar shop. I have convinced the owner to stock mods. https://t.co/zJVjoTZGuj #vape #ecigs #reddit,ukvaper,2016-08-21 18:32:54+00:00
725,767429285686616064,Shots fired! Old skool! https://t.co/M5vClYvEc1 #vape #ecigs #reddit,ukvaper,2016-08-21 18:32:54+00:00
726,767429218573623296,Great #vaping deals at https://t.co/EkGNG3iSnx and here's 10% off those deals with exclusive coupon code vapingtruth. #vapingtruth,thevapegoods,2016-08-21 18:32:38+00:00
727,767429164681031680,Secondhand vape #buzzed,josh5297,2016-08-21 18:32:25+00:00
728,767429037790793729,"""Should I buy a vape or a fake ID""",carbocationmode,2016-08-21 18:31:55+00:00
729,767428842483048448,Smokers who turn to vaping with e-cigarettes 'have fewer lung infections' - https://t.co/vgP01U5QzB https://t.co/la8jBv6jgX,ElenaMoarse,2016-08-21 18:31:08+00:00
730,767428810274996224,"CASAA needs a million vapers! Tell your friends - it's free and more members = more power. Please donate too!
https://t.co/1YHtajl4xb",Vaping360,2016-08-21 18:31:01+00:00
731,767428763013480448,I liked a @YouTube video https://t.co/Wsoen5oLQs RiP Trippers: Last Chance To Save Vaping!,perokokberat15,2016-08-21 18:30:49+00:00
732,767428619102785537,Thank you to everyone who follows. Please spread the word by telling your friends #vapingtruth #vapelife #vape,vapingtruth,2016-08-21 18:30:15+00:00
733,767428612173684737,"#EJuice, #Mods, #Ecigs? Stop by https://t.co/f8hk0PfUdR #Vape #Vapelife #Vaporon #  Key West Paradise https://t.co/ZO8837wZf7",VaporonVapor,2016-08-21 18:30:13+00:00
734,767428611468996608,"Add our snapchat SpinfuelTV 
All of your favorite vape models!

spinfueltv 
#spinfuel #vapemodel… https://t.co/j9yuiTyZZR",NickCVapes,2016-08-21 18:30:13+00:00
735,767428581689524224,Honeycomb Tank Video-&gt; https://t.co/2WkdO6WKub https://t.co/ZNHXUNKGEX &lt;- #PA #PHI #PGH #Vape #VapeCloud #AshFree #Medicine #Smile #Bitpay,VAPEPENstore,2016-08-21 18:30:06+00:00
736,767428579156172806,.@NateDiaz209 nonchalantly vapes CBD oil during press conference after #UFC202 #UFC #MMA https://t.co/O6HfXbjaf2,mmamania,2016-08-21 18:30:06+00:00
737,767428335857127425,Smokers who turn to vaping with e-cigarettes 'have fewer lung infections' - https://t.co/7HjjIx9UCH https://t.co/oQwKIpq8Im,BrenneMorales25,2016-08-21 18:29:08+00:00
738,767428236557033472,These summer nights! #vape #vapeing #clouds #mökkilaiffii #akikuvaa #activewithsony… https://t.co/NvSwOzEcSp,Akikuvaa,2016-08-21 18:28:44+00:00
739,767428102549045250,Middle aged glasses just asked me to charge his vape behind the bar,hotline_quinn,2016-08-21 18:28:12+00:00
740,767427693054795776,"With vape pen in hand, UFC 202's Nate Diaz explains the benefits of cannabidiol… https://t.co/uE4bCUMMso #MMA #UFC https://t.co/PMoMqdu639",EpicFighting,2016-08-21 18:26:34+00:00
741,767427671512879104,"With vape pen in hand, UFC 202's Nate Diaz explains the benefits of… https://t.co/QjVX08Gr9t #Road2War5 Tix: https://t.co/FYnC0PvxOu #MMA",ArchangelMMA,2016-08-21 18:26:29+00:00
742,767427542810755072,"With vape pen in hand, UFC 202's Nate Diaz explains the benefits of cannabidiol oil https://t.co/zIuvowTgMF",scottsoulak,2016-08-21 18:25:58+00:00
743,767427471058677760,"I posted 12 photos on Facebook in the album ""Smokees Vape Store"" https://t.co/76QtcZYzFf",smokees78,2016-08-21 18:25:41+00:00
744,767427410421768193,Enter to win one of these ultimate vape prizes in this giveaway! https://t.co/ozLrPDS8dl,ROPname,2016-08-21 18:25:27+00:00
745,767427410409164800,"Oh, @jbcoleman13 :

Aug 19th, 2016.

---&gt;&gt;&gt;https://t.co/O9nI3xgwPg&lt;&lt;&lt;---

Keep ON #Vaping On. https://t.co/ecg606Wtbf",Vapingit,2016-08-21 18:25:27+00:00
746,767427400720379904,Must be what I'm vaping. https://t.co/AIx1lb8O9Z https://t.co/H0uGDEs2nw,peoplecentred,2016-08-21 18:25:25+00:00
747,767427355572858881,"#vape Happiness! 
I am so excited by this and can't wait to see the new place
https://t.co/oIleEwFdZf - Great… https://t.co/aIZaZdFmza",RavenMRidley,2016-08-21 18:25:14+00:00
748,767427352351633408,"⭐️ Get your hands on an Infinite Ela #mod, Cigreen Gear 22 #tank &amp; Wire! ⭐️ MUST RT &amp; CLICK THE IMAGE TO ENTER! https://t.co/zd7FrPznEl",Vape_Store_UK,2016-08-21 18:25:13+00:00
749,767427097975369728,Although I don't cigarette &amp; vape but I can accept you smoke in front of me But but but Don't fucking Shisha infront of me !!! I will kill u,SpaceboyTF69,2016-08-21 18:24:12+00:00
750,767426878630137856,Enter to win one of these ultimate vape prizes in this giveaway! https://t.co/AEDOfzEeZO,madakish1968,2016-08-21 18:23:20+00:00
751,767426708085547008,Dont contact me for a dark track for the comp and boy im about to send him the most depressive of vapes,quartz_ebooks,2016-08-21 18:22:39+00:00
752,767426637461716992,VAPING UNDERGROUND XBOX ONE S GIVEAWAY https://t.co/aY62DmZO3y,Phoenixx138,2016-08-21 18:22:23+00:00
753,767426565982425089,BREAKING: Nate Diaz Smokes a Cannabis CBD Vape Pen in UFC 202 Post Fight Interview (Video) https://t.co/fPswErR3LR,MBPhysicians,2016-08-21 18:22:06+00:00
754,767426532943929344,"Retweeted Vape Lord Nord ☁️ (@FaZe_Rain):

IF YOURE READING THIS I LOVE UUIUUU",TRU_wAgG,2016-08-21 18:21:58+00:00
755,767426519836741636,Selling Fast: Eleaf iCare All In One Portable System $15.99 - https://t.co/148P0OImX5 #vapingdiscounts #vape,411Vapes,2016-08-21 18:21:55+00:00
756,767426502895992834,yall fucking hate me dont you where are the fucking numbers https://t.co/uaUS2tIyLg,Phi_Vape,2016-08-21 18:21:51+00:00
757,767426484252180480,Selling Fast: Eleaf iCare All In One Portable System $15.99 - https://t.co/8y1onJ6XT5 #vapingdiscounts #vape,411vapesReviews,2016-08-21 18:21:46+00:00
758,767426439926820864,Selling Fast: Eleaf iCare All In One Portable System $15.99 - https://t.co/eVRVMgZOc8 #vapingdiscounts #vape,vapingdiscounts,2016-08-21 18:21:36+00:00
759,767426317876879360,RT @MassRoots #BREAKING: Nate Diaz Smokes a Cannabis CBD Vape Pen in UFC 202 Post Fight Interview (Video) https://t.co/jGX4o2Ue5h,news_cannabis,2016-08-21 18:21:06+00:00
760,767426275107450880,"Happy Birthday!
Gives present*
Opens*
It's a vape pen!!!!,;/6:)2;)
😭😂😂😂😂😂😂😂😂😂",SleepingSkips,2016-08-21 18:20:56+00:00
761,767426136137666560,Enter to win one of these ultimate vape prizes in this giveaway! https://t.co/teJbiLzdAo,madakish1968,2016-08-21 18:20:23+00:00
762,767426117997170688,Fuck I lost my vape. You don't have to hide your bitches I'm going home. Fuck this,BroJTFM,2016-08-21 18:20:19+00:00
763,767425985272688640,Electronic ciggarettes are not what you think: (3) At every doctor's check-up since I've started vaping and q... https://t.co/lHpEdsFc7w,SkylarGordon202,2016-08-21 18:19:47+00:00
764,767425912921030656,"UPDATED: With vape pen in hand, UFC 202’s Nate Diaz explains the benefits of cannabidiol oil https://t.co/COuPB9wg5B",LUBMMA,2016-08-21 18:19:30+00:00
765,767425815042723840,I need a social support group of folks to help me quit smoking cigarettes w out vape. Any success stories?,MrMcBride121,2016-08-21 18:19:07+00:00
766,767425587585482752,Enter to win one of these ultimate vape prizes in this giveaway! https://t.co/sOx6JlrREW,clamityy,2016-08-21 18:18:12+00:00
767,767425579696160768,After I sign this recored deal I'm gonna make my own thc vape shop in cail,josephcarldavis,2016-08-21 18:18:10+00:00
768,767425566198857728,Paying Homage to the Pioneers of #Vaping https://t.co/nZw54IJqYL @HaloCigs https://t.co/EzGyW4CfNN,BigJugVape,2016-08-21 18:18:07+00:00
769,767425477594218498,"Your right to #vape is under attack, don't let that happen. Fight for it. https://t.co/MFyLoG6ejt #vaping https://t.co/EPv0XvFuvA",vaporbattalion,2016-08-21 18:17:46+00:00
770,767425418559385601,"With vape pen in hand, UFC 202's Nate Diaz explains the benefits of cannabidiol oil https://t.co/HCaIj1TBuA",Ccasillas940,2016-08-21 18:17:32+00:00
771,767425416604819457,"With vape pen in hand, UFC 202's Nate Diaz explains the benefits of cannabidiol oil 😎 https://t.co/PGnUtrHekk",LondonCannabis,2016-08-21 18:17:32+00:00
772,767425302561755137,This original painting is available to buy... Just follow the link in my bio! #vape #vapelyfe… https://t.co/OroflauIsE,artydianne,2016-08-21 18:17:04+00:00
773,767425202208858112,I gained 1 follower in the last day. You? Know your stats and grow with https://t.co/TrUFOgOhUK,Vapes_Leeds,2016-08-21 18:16:40+00:00
774,767425159204630529,I liked a @YouTube video from @pixel_vape https://t.co/G9409xE2zi #RIADs Rundown 4,DonkeyZSP,2016-08-21 18:16:30+00:00
775,767425138136449024,Enter to win a brand new Smok Guardian Sub Kit ! #vape #vapefam #vapenation #ejuice #giveaway https://t.co/13xSJ55cNI,clamityy,2016-08-21 18:16:25+00:00
776,767425130440060928,#Vaping is the New #Drinking #Tea : https://t.co/MJgj6ZOSzR https://t.co/AgXtTD8Emt,dietadelgazar,2016-08-21 18:16:23+00:00
777,767425043727015937,Vape Pen Review - XVX Apex Vs E-Shisha Core - YouTube : https://t.co/IppXRuAzgl https://t.co/Kk5noILKoM,whatgearreviews,2016-08-21 18:16:03+00:00
778,767425041097224193,HOLY SHIT YES!!!!!!! https://t.co/GqkGQABnVe,Phi_Vape,2016-08-21 18:16:02+00:00
779,767424917050494978,Nate Diaz sitting vaping cannabis oil at the post fight pressed is quality,JackMoylan,2016-08-21 18:15:32+00:00
780,767424649428893696,malcolm graves vapes,zunshtral,2016-08-21 18:14:29+00:00
781,767424424744103937,A Billion Lives Coming to Oklahoma Vape Jam https://t.co/o5DyGiReNU https://t.co/V8BHo5ZLnC,Kenny_Clouds,2016-08-21 18:13:35+00:00
782,767424336328286208,I vape in public because I know guys won't bother a girl that vapes,jazmaniandevl,2016-08-21 18:13:14+00:00
783,767424301607813120,Asthmatics can use the electronic cigarette #safely https://t.co/HZmizxv0Ac #vape https://t.co/GFwgHiQ89A,VaporessoEcig,2016-08-21 18:13:06+00:00
784,767424095050948608,Nate Diaz Vapes During His Post-UFC 202 Media Scrum https://t.co/9s54ND5MZU https://t.co/2fZiG5qfDr,MMA_Norway_,2016-08-21 18:12:16+00:00
785,767424032018882560,In need of some summer reading? May we suggest our blog - it's full of vaping tips &amp; advice https://t.co/C4f3O78p2e https://t.co/9r2HUfkIrh,Jacvapour,2016-08-21 18:12:01+00:00
786,767423833045241856,"One day when I fuck a hoe right when I'm gonna nut I'm gonna scream ""VAPE NAYYYYYYYSHAWWWWWWWW!!!!""",BDJ_Mauri,2016-08-21 18:11:14+00:00
787,767423622491148289,hey guys i vape,finley_ebooks,2016-08-21 18:10:24+00:00
788,767423611808444420,I liked a @YouTube video https://t.co/QtG015YqzW Vape Pastry | Time To Vape The Donuts | E juice Review,Vile_Byte,2016-08-21 18:10:21+00:00
789,767423541125926914,"Goodbye cigarettes, move on for vape vaping apalah itu namanya #Tolakhargarokok50ribu",hantonkusnia,2016-08-21 18:10:04+00:00
790,767423529109315584,Aeronauts for sale at #Vape Emporium - Visit our #London stores or order online: https://t.co/ja2mmlY1We 😗💨 https://t.co/RmfqXKdocK,VapeEmporium,2016-08-21 18:10:02+00:00
791,767423337643376640,Enter to win a brand new Smok Guardian Sub Kit ! #vape #vapefam #vapenation #ejuice #giveaway https://t.co/CHiXMU0wxA,pasca1974,2016-08-21 18:09:16+00:00
792,767423155040350208,Nate Diaz Puffs a Vape Pen in Post-Fight Interview - The sports world just got its first post-game pot product ... https://t.co/LvP1SHgPqC,TheBrainBoxxx,2016-08-21 18:08:32+00:00
793,767422968674840577,Picked up a DNA40 Vaporflask. No idea why but this set up with my Rose 3 is astonishingly good! #vape #ecigs https://t.co/MFyN4TMqwF,FotoGeekery,2016-08-21 18:07:48+00:00
794,767422911988637696,"With vape pen in hand, UFC 202's Nate Diaz explains the benefits of cannabidiol oil https://t.co/yvtOKB8FMx",PITBOY,2016-08-21 18:07:34+00:00
795,767422806942330880,karamatsu could you just stop vaping for just one second and listen to me,ichimatsu_eng,2016-08-21 18:07:09+00:00
796,767422782871306240,#RAIDs Rundown is here. Huzzahhh https://t.co/jFQJdz4XGi,Pixel_Vape,2016-08-21 18:07:04+00:00
797,767422625257783296,#CLOUDTHEFOKOUT Birthday Recovery Edition W/ Vaping Anthrax! https://t.co/Ww2UmFecpv via @YouTube,cckitchen1978,2016-08-21 18:06:26+00:00
798,767422568966000640,But I'm addicted to nicotine. And cigarettes are the cheapest way of nicotine inhalation... It's the same as vaping. Only vaping is safer,HabaNeroPanda,2016-08-21 18:06:13+00:00
799,767422544735375360,I wissh i was 21 already 😭,Jeff_Vapes,2016-08-21 18:06:07+00:00
800,767422511931723776,Some poor hipster lost their vape,maxcaulbot,2016-08-21 18:05:59+00:00
801,767422353504661504,Bought a new vape tank the other day &amp; hate it..they won't take it back😑 I used it less than 24hrs 😡,Lunchableskid,2016-08-21 18:05:21+00:00
802,767422253361496064,"DOJO NEWS: With vape pen in hand, UFC 202’s Nate Diaz explains the benefits of cannabidiol oil https://t.co/COuPB9wg5B",LUBMMA,2016-08-21 18:04:57+00:00
803,767422137774837760,"Every time another junk anti vaping study is published, a BigT executive gets his bonus",stuartf100,2016-08-21 18:04:30+00:00
804,767422035668512768,11:02am Greenpoint - Soren Juul - This Moment(4AD),kalxplaylist,2016-08-21 18:04:05+00:00
805,767421985559236608,RT and Share #Vape #Vapesexy #Models #Hot #Dude #babe #Womenwarrior https://t.co/PFn0y2pbwW,Vape_Sexy,2016-08-21 18:03:54+00:00
806,767421835239645185,"Jumping into the car with Bonnie the dog, hitting Colossal Vape Vernon Hills gonna do some rearranging, then to... https://t.co/umaDgnLPpt",misteries,2016-08-21 18:03:18+00:00
807,767421774141284352,Want to Vape on something awesome? Check out this awesome review by Heather E..   https://t.co/hCMTVlGm2g via @yotpo,CyberLiquids,2016-08-21 18:03:03+00:00
808,767421670533558272,"Check out Zodist, my favorite vape subscription! Use ""LOVEZODIST"" to get $5 off your first box! https://t.co/M5B5Eb7jJE",bje2525,2016-08-21 18:02:38+00:00
809,767421481768878080,Gotta vape the holy water,msadvntrso007,2016-08-21 18:01:53+00:00
810,767421430879424513,"Cherry Lemonade
#vape #vapeporn #vapelife #vapelyfe #calivapers #vapehooligans #ejuice #eliquid https://t.co/d7AC8DcHyt",yougotejuice,2016-08-21 18:01:41+00:00
811,767421417608675329,Nate Diaz is a real ass mf.. Vaping CBD at the press conference 😂,tuneontesla,2016-08-21 18:01:38+00:00
812,767421393847848960,Save on great #vape deals at https://t.co/EkGNG3iSnx +another 10% off those deals with group coupon code vapingtruth. #vapingtruth,thevapegoods,2016-08-21 18:01:32+00:00
813,767421363640557568,Want @mtbakervapor in your local #vape shop and a possible $50 credit to @mtbakervapor? https://t.co/c2PClcvkKq,MtBakerVapor,2016-08-21 18:01:25+00:00
814,767421180622082049,This week's #flavoroftheweek deal is Bananas. Get this tasty #eliquid for 20% off. Link in bio! #veppo #vape #ejuice https://t.co/4eRLeH0xxA,veppocig,2016-08-21 18:00:42+00:00
815,767421086006906882,"100% Original Smok X Cube II ...:  https://t.co/zCab27emJ4
#Vaping https://t.co/QAnuEyeZlT",VapOrgasme,2016-08-21 18:00:19+00:00
816,767421079400747008,Teens vaping at record levels https://t.co/XvVWeuTCvf #ecigs #vaping,VapinXsmoker,2016-08-21 18:00:17+00:00
817,767421078842937344,"With vape pen in hand, UFC 202's Nate Diaz explains the benefits of cannabidiol oil - https://t.co/q0AWNutIkx #MMANews #UFCNews",themmaway,2016-08-21 18:00:17+00:00
818,767421078641651713,"Evidence, Policy, and E-Cigarettes. https://t.co/doSvuP4S1A #ecigs #vaping",VapinXsmoker,2016-08-21 18:00:17+00:00
819,767421078280941568,"BREAKING: Nate Diaz Smokes a Cannabis CBD Vape Pen in UFC 202 Post Fight Interview https://t.co/fcHc4dNERm 

Gotta love that kind of plug!",AmeriCanadians,2016-08-21 18:00:17+00:00
820,767421077861523456,Gateway Effect https://t.co/RlOy7jZt3O #ecigs #vaping,VapinXsmoker,2016-08-21 18:00:17+00:00
821,767421076972314625,how to make money on tobacco ashes https://t.co/FOJxHQA9WA #ecigs #vaping,VapinXsmoker,2016-08-21 18:00:17+00:00
822,767420843655852035,"When you don't like a new price of ciggarete let's use a vape, we are vaporizer 

#vapeindo… https://t.co/G4lhP47SoW",miraclechandra,2016-08-21 17:59:21+00:00
823,767420773963300869,LIVE on #Periscope: Bored gta n Vaping  https://t.co/wRG6yaQz2K,IndoorVape,2016-08-21 17:59:05+00:00
824,767420752752578560,8/21 SUN: All Meds= BOGO 1/2 Off (=&lt;); Free Vape Pen w/Purchase of  Any Vape  Cart; Free Blue Haze P/R or Choc Chip Cookie w/Any Purch; 1pp,VBC420,2016-08-21 17:59:00+00:00
825,767420675065647104,Strawberry Cake Vape Juice https://t.co/0Q0iRfk2cO #MyNewTag #shopping #eliquid https://t.co/FRXZalOCrp,4_Fox_Sakes,2016-08-21 17:58:41+00:00
