,TweetID,TweetContent,TweeterUsername,TweetDatetime
1978,767256084289499136,Vape on 💨 @PauloRivero1 https://t.co/0QYuG5YQfy,rwynbl,2016-08-21 07:04:40+00:00
1979,767255695364284417,"RE STOCKK!
Kill Chill
its mango tango
Price idr 130K/55ml

Grab it fast at
The Showroom - Vape… https://t.co/fGwReDAAz3",theshowroomvape,2016-08-21 07:03:07+00:00
1980,767255618767900672,I liked a @YouTube video from @kenpishna https://t.co/eXKmtgxosW Nate Diaz Vapes Marijuana (CBD) at UFC 202 Press Conference,roastedweiners,2016-08-21 07:02:49+00:00
1981,767255594457829377,Nate Diaz Vapes Marijuana (CBD) at UFC 202 Press Conference https://t.co/iHmovaYvZw,mmadailyinsider,2016-08-21 07:02:43+00:00
1982,767255064159354880,Give the gift of nonsmoking only 7.95 for a Starter Kit https://t.co/lE5DQzfnp9  #vapelife #stopsmoking #ecigs #vape https://t.co/BDQFgymXzA,Suckmybox_com,2016-08-21 07:00:36+00:00
1983,767254912472199168,Updated Article -Nate Diaz's post bout Vaping may be OK with NSAC but arguably not USADA https://t.co/Lz5lBOe3JB,erikmagraken,2016-08-21 07:00:00+00:00
1984,767254761250914305,Dude I'm just riding around Steubenville sober as fuck with my brother cousin and their friend while they catch Pokemon and fucking vape omg,__youngbaby,2016-08-21 06:59:24+00:00
1985,767254586973229057,Gummy Candy Vape Juice https://t.co/CPoqYGU5PM #shopping #vape #ecig #vaping https://t.co/1e9VMHil0X,4_Fox_Sakes,2016-08-21 06:58:43+00:00
1986,767254206658977792,No vaping. No pokemon go. No pineapple pizza.,CrystalProphets,2016-08-21 06:57:12+00:00
1987,767254183296634880,"Save every time you buy Vape gear, Wax, Leaf, CBD, or E Liquid Vaporizers! https://t.co/8FebYzHqke",papiyaakter041,2016-08-21 06:57:06+00:00
1988,767254140317601792,"Save every time you buy Vape gear, Wax, Leaf, CBD, or E Liquid Vaporizers! https://t.co/kX2y33sMrU",fmobaschowdhury,2016-08-21 06:56:56+00:00
1989,767254097070129152,From The Mountains Of Scotland To The Lips Of Vapers #XquisiteBru Indulges Three Secret Flavours… https://t.co/LxUaaa9oY8,XJVape,2016-08-21 06:56:46+00:00
1990,767253787530686464,VAPING UNDERGROUND XBOX ONE S GIVEAWAY https://t.co/gjIDlRGVvG,zoranl1,2016-08-21 06:55:32+00:00
1991,767253669276299264,"Join us Monday 8/22 
$5 grams select strains - up to 50% off all O.pen Vape Products  -  O.penVape Giveaways (while supplies last)",GREENPHARMSaz,2016-08-21 06:55:04+00:00
1992,767253537281675264,UFC 202 Video: Nate Diaz smokes CBD vape pen during press conference https://t.co/FEyEjcliEy,BloodyElbow,2016-08-21 06:54:32+00:00
1993,767253536291848192,UFC 202 Video: Nate Diaz smokes CBD vape pen during press conference https://t.co/wCeHHfWupy,antontabuena,2016-08-21 06:54:32+00:00
1994,767253174218436608,"https://t.co/2I34RAxpxK  Any Pro- Vapers, If you haven't yet, you need to hear this and pass it on. I think Nancy Pelosi will be my 1st!📢👊",TheThoughtPot,2016-08-21 06:53:06+00:00
1995,767252644586934272,"Join us Monday 8/22 
$5 grams (select strains) , up to 50% off all O.pen Vape Products all Day long.  O.penVape Giveaways &amp; More.",GREENPHARMSaz,2016-08-21 06:50:59+00:00
1996,767252234807771136,"For your safety and comfort, this station operates a no vaping policy. Please have your birth certificate ready for inspection.",traindroid_se,2016-08-21 06:49:22+00:00
1997,767252143656964096,#Entomophagy You Docs: Don't let your teens vape - Houston Chronicle https://t.co/xMZjOZMKlR https://t.co/5HduHttROC,ohittastesgood,2016-08-21 06:49:00+00:00
1998,767252043652227072,Nate Diaz vaping has to be one of the most predictable things of 2016 that no one could have predicted.,JakeRunyon,2016-08-21 06:48:36+00:00
1999,767251894368468992,"One of my first longforms was about vaping, I just remembered that lol",ZiaKelly1,2016-08-21 06:48:01+00:00
2000,767251877809401856,That better not be vape!!! https://t.co/xlYAwtYiU3,BigpoppaNatalie,2016-08-21 06:47:57+00:00
2001,767251704735817728,Nate vaping in the interviews #thug,juanky_MMA,2016-08-21 06:47:15+00:00
2002,767251449864749056,Would you stoP VAPING you shit ass bitch,bestofrebeccap,2016-08-21 06:46:15+00:00
2003,767251404738015232,And my Mini Vape mod,yozeze_,2016-08-21 06:46:04+00:00
2004,767251190832697344,Enter to win a brand new Smok Guardian Sub Kit ! #vape #vapefam #vapenation #ejuice #giveaway https://t.co/hQp6UaTkHY,sunshyne524,2016-08-21 06:45:13+00:00
2005,767251113917632512,With Bad at Vape Department — https://t.co/C7x2m146Mo,indaindaayulia,2016-08-21 06:44:55+00:00
2006,767250905041342464,Great vape Giveaway Enter to win a brand Smok Guardian sub kit! vaping giveaway eicgvape vapelife vapefam vapenation https://t.co/hQp6UbaW6y,sunshyne524,2016-08-21 06:44:05+00:00
2007,767250430057381889,What would happen if you competed in the Olympics? — competitive vaping https://t.co/fYKrVASsPI,nathufff,2016-08-21 06:42:12+00:00
2008,767250420863414272,4 Rules To Prevent Your Vape Tank From Leaking https://t.co/vaOHLc3dbT https://t.co/BsKc1oWBX8,mrlongdrag,2016-08-21 06:42:09+00:00
2009,767250169951772672,Vaping may lead to fewer respiratory infections for ex-smokers https://t.co/v3FqqPbGQO,rioconsulado,2016-08-21 06:41:09+00:00
2010,767250161844183041,Vaping may lead to fewer respiratory infections for ex-smokers https://t.co/s5GAg1QPBN,sidanews,2016-08-21 06:41:08+00:00
2011,767250134220566528,Just wait til Roy Nelson is hitting that baconator fries vape pen after his next fight though,brentbrookhouse,2016-08-21 06:41:01+00:00
2012,767250067333914624,Before anyone freaks out about Nate Diaz's post UFC 202 vaping read this https://t.co/Lz5lBOe3JB,erikmagraken,2016-08-21 06:40:45+00:00
2013,767250001034551296,All these white peoples hanging outside Dutch and vaping... What a disgrace,ADsmooth6,2016-08-21 06:40:29+00:00
2014,767249960471556097,Cigs gross me out 80% of the time... Vaping tastes good &amp; smells good but hurts my lungs &amp; I'm sketchy about it... Best to just not smoke 💁🏻,graceelizaaa,2016-08-21 06:40:20+00:00
2015,767249718590275584,"Diaz is vaping at the press conference. He couldve ran from McGregor all 25min and I wouldn't be this offended. Who even vapes, bro?",TroyMachir,2016-08-21 06:39:22+00:00
2016,767249651569426434,Enter to win one of these ultimate vape prizes in this giveaway! https://t.co/4magebokpH,sunshyne524,2016-08-21 06:39:06+00:00
2017,767249607730401280,I liked a @YouTube video https://t.co/Hp0GcMuzpP Vaping Some Herb Ejuice | EpicHerbReviews,zestybytes,2016-08-21 06:38:55+00:00
2018,767249567096111104,Why Nate Diaz’s Post UFC Vaping May Be A-OK https://t.co/jyqkvyQt1E https://t.co/plnpjRFz8y,erikmagraken,2016-08-21 06:38:46+00:00
2019,767249556257906688,"#celebs Nate Diaz Just Showed Up To The UFC 202 Presser Smoking A Weed Vape Pen: 
Nate Diaz ca... https://t.co/FQEYasXWVx #derangedradio",DerangedRadio,2016-08-21 06:38:43+00:00
2020,767249551505907713,I have vaped only rarely. I like the ones that taste like fruit or candy because I’m not a big tough guy. I like candy.,brentbrookhouse,2016-08-21 06:38:42+00:00
2021,767249548519444480,Vaping may lead to fewer respiratory infections for ex-smokers: The majority of smokers who successfully swit... https://t.co/dsgOHSPIOf,HIFUJohn,2016-08-21 06:38:41+00:00
2022,767249302628536320,"whenever im sad i always remember the wise words of lucy
""vape it out hoe""",lucidarii,2016-08-21 06:37:43+00:00
2023,767249148965814272,Vaping Around Police Officers https://t.co/svm7IHAoEY #vape #ecigs #reddit,ukvaper,2016-08-21 06:37:06+00:00
2024,767249148122849280,I can't taste strawberries https://t.co/fmTre45TxB #vape #ecigs #reddit,ukvaper,2016-08-21 06:37:06+00:00
2025,767249146776391680,I need help picking a rebuildable tank https://t.co/b99uJL5ilf #vape #ecigs #reddit,ukvaper,2016-08-21 06:37:06+00:00
2026,767248942723510272,I liked a @YouTube video from @faze_rain https://t.co/UXc9l3UE2j THEY BANNED VAPE LORD NORD...,ExoticGs,2016-08-21 06:36:17+00:00
2027,767248873538490369,"Save every time you buy Vape gear, Wax, Leaf, CBD, or E Liquid Vaporizers! https://t.co/DzevJ44YOm",mahamudsn,2016-08-21 06:36:00+00:00
2028,767248252693581824,Check out @anezbitt of @FOXSports right behind Diaz as he smokes a vape pen&amp;got pretty lit/stoned (looked like oil). https://t.co/3plaEgsWq0,SportsDailyBlog,2016-08-21 06:33:32+00:00
2029,767248242509840384,I have a serious question for you...can we vape together in ct next weekend...? @imactuallywes 😈,bri_jeanettee,2016-08-21 06:33:30+00:00
2030,767248130068844544,"Get on my level, son! #funrun2 #Ku #thebest #Partypig1527 https://t.co/hxzIcTYGgi",Vape_Luke,2016-08-21 06:33:03+00:00
2031,767248121613148161,Nate Diaz Hitting A Vape Pen During UFC 202 Post Fight Interview Talks T... https://t.co/5a9JLnvRqO,JarvesMike,2016-08-21 06:33:01+00:00
2032,767248119868207104,ATTN Cannabis vapers- $10 OFF all sales today only at https://t.co/iJ7jKQJdvc https://t.co/P9LjjSdsA9  #vaping #cannabis #vapesale #vapeshop,greendorphin,2016-08-21 06:33:01+00:00
2033,767247903018536960,Diaz was vaping CBD oil during the press conference because Fuck You! https://t.co/SJx0Vy1Nxy,_MMAFNL,2016-08-21 06:32:09+00:00
2034,767247856335921152,u look exactly the same only u vape.  https://t.co/AYc7KEqZWD,MiLODiDTHAT,2016-08-21 06:31:58+00:00
2035,767247814724349952,Nate Diaz just showed up at the UFC 202 presser smoking a #weed #vape pen #MMA https://t.co/V6C5ZG2ZGL https://t.co/n0eJ0qWOOk,UPROXXSports,2016-08-21 06:31:48+00:00
2036,767247497504890880,"Get on my level, son! #funrun2 #PeZxH4 #tonylove915 #Theprince2 https://t.co/XXhATAzJjM",Vape_Luke,2016-08-21 06:30:32+00:00
2037,767247491708383233,"Vaping Tricks 101 – A Guide on 13 Popular Vapor Tricks
by Ian Jones @IanCliquex
https://t.co/TTxLaJq2NN",Vaping360,2016-08-21 06:30:31+00:00
2038,767247436427386880,Join my LIVE &gt; vape lunch @surabaya on #BIGOLIVE. https://t.co/Jq5sLZFWCS https://t.co/Sw4jxTjc6Z,de3kay,2016-08-21 06:30:18+00:00
2039,767247246048059392,Traveling light today #edc #leathermanOHT #cooperbiotherm #vape #avocado #cuboid #stage21carbonclip https://t.co/YYnuJS6xLW,lurker_anjo,2016-08-21 06:29:32+00:00
2040,767247222555631621,"VAPING NEWS: Give E-Cigarette Smokers more Breaks and Separate Vaping Rooms at Work: At the same time, it's a... https://t.co/UIPCmRsabu",SkylarGordon202,2016-08-21 06:29:27+00:00
2041,767246998168678400,One Hit Wonder Spins off 2 Flavors in the wake of FDA Vaping ... - PR Newswire (press ... - https://t.co/9VBrHOMI7C https://t.co/Z0MIHs1xwl,VapeScoop,2016-08-21 06:28:33+00:00
2042,767246835194875904,But vaping is fun 😿 https://t.co/Riej6RsnNH,lexaagisselle,2016-08-21 06:27:54+00:00
2043,767246820183511040,now watch me vape!😤💨 now watch me nae nae👋🏼🤗😵 https://t.co/iqDrS6guzh,drewsd_ck,2016-08-21 06:27:51+00:00
2044,767246811799097344,"#pvf6 #juice #vape #pvf @ Megatent Event Area, Libis QC https://t.co/OgJsSAG6s9",jhen_latorre,2016-08-21 06:27:49+00:00
2045,767246575378788352,I'm at Mojo Vapes https://t.co/b94LHRotKs,Hhaaffiz,2016-08-21 06:26:52+00:00
2046,767246458747707392,Nate Diaz hitting a vape pen during the post fight presser😂,YoungFraidy,2016-08-21 06:26:25+00:00
2047,767246296923144192,Nate Diaz just showed up at the UFC 202 presser smoking a #weed #vape pen #MMA https://t.co/fyKG3fIM0e https://t.co/ebjognuzK3,UPROXXSports,2016-08-21 06:25:46+00:00
2048,767246271723679744,no yeah you're right I want a vape cloud in my face...,hblake9,2016-08-21 06:25:40+00:00
2049,767246256724844545,brad vaped into my slurpee......n then vaped into my face the vape that was in the slurpee............. 😐,necrologies,2016-08-21 06:25:37+00:00
2050,767246232771186689,Samo is a school full of juuls,romeyopatterson,2016-08-21 06:25:31+00:00
2051,767246223115898880,"Broscience Now in STOCK!
Buy Here &gt; https://t.co/RugFznMphv
#Skyvape #vapenation #vapeporn #vapelife #vapefam #vape https://t.co/2pF39OBlHf",SkyVape_AZ,2016-08-21 06:25:28+00:00
2052,767246210432458752,I just thought about the amount of vaping that probably goes on in Stockton and blood started coming out of my ears,BLeez17,2016-08-21 06:25:25+00:00
2053,767246052139216896,Vaping may lead to fewer respiratory infections for ex-smokers,Emma_Gaby18,2016-08-21 06:24:48+00:00
2054,767246051719864320,Vaping may lead to fewer respiratory infections for ex-smokers https://t.co/7GSpTQdVKe,newswise,2016-08-21 06:24:48+00:00
2055,767245687893426176,You may think Nate Diaz was vaping but dollars to donuts that was a g-pen,BLeez17,2016-08-21 06:23:21+00:00
2056,767245575414648832,I think i lost my vape 😭,ruthnclss,2016-08-21 06:22:54+00:00
2057,767245555068235776,"""get your own house and fill it with your own smells""

- my aunt on her 50th birthday after my cousin blew vape smoke in her face",ericjnegron,2016-08-21 06:22:49+00:00
2058,767245530456096769,"Guys, Sino may alam na VAPE SHOP (Makati or Taguig) Area.
Please Pm me :)",Rogelio083,2016-08-21 06:22:43+00:00
2059,767245515926876160,"Save every time you buy Vape gear, Wax, Leaf, CBD, or E Liquid Vaporizers! https://t.co/U1dCsu2VAD",SamiZaber,2016-08-21 06:22:40+00:00
2060,767245431294222338,"Idc what anyone says , FUCK VAPE LMAO",BigpoppaNatalie,2016-08-21 06:22:20+00:00
2061,767245368748670976,"Yeah Nate Diaz obviously lost, he's either holding a dildo or vaping at the press conference",JAbundiz17,2016-08-21 06:22:05+00:00
2062,767245341020135425,"Save every time you buy Vape gear, Wax, Leaf, CBD, or E Liquid Vaporizers! https://t.co/M2aIotjgGI",snehasorma,2016-08-21 06:21:58+00:00
2063,767245314948534272,Is he vaping or actually burning trees? https://t.co/ZLNQuNThhj,alimokdaddy,2016-08-21 06:21:52+00:00
2064,767245211172954114,Regarding Nate Diaz using CBD vape pen at #UFC202 media scrum  https://t.co/jbbRE3BJwN,ZidanSports,2016-08-21 06:21:27+00:00
2065,767245095473078272,"Diaz says he is smoking a CBD Vape Pen on the dais......then he goes, im going to the after party and he's going to the hospital. lol",geezus116,2016-08-21 06:21:00+00:00
2066,767244976753344513,"Yo where's your vape??
On me at all times.    

This man a savage",Tlock69,2016-08-21 06:20:31+00:00
2067,767244805516632064,Nate vaping weed at the post fight presser https://t.co/Tx5ggpJXMj,Cheddarbear16,2016-08-21 06:19:51+00:00
2068,767244771333111808,Balik Vape! Them sexy driptips. #stab 😆😆😆 https://t.co/nJKWNee5L1,Rohelyow,2016-08-21 06:19:42+00:00
2069,767244758225866752,Naturally their headed to a club so we all go together and vape it up at the club talk about the world wanting you to know people,CiSum_4,2016-08-21 06:19:39+00:00
2070,767244755512201220,The motherfucker vapes. https://t.co/Epj1n0FM5N,Zee_Violator,2016-08-21 06:19:39+00:00
2071,767244688772374529,Is vaping against the USADA rules?,BradWardFight,2016-08-21 06:19:23+00:00
2072,767244655461138432,The smoker's dilemma: cancer or obesity-related diseases. 🚬🚭 But will vaping change the landscape? https://t.co/FJhPqlNVKX,markmtay,2016-08-21 06:19:15+00:00
2073,767244636414943233,"5pcs/lot Original Smoktech ...:  https://t.co/i77fvLxY1t
#Vaping https://t.co/h7qeqXb2lA",VapOrgasme,2016-08-21 06:19:10+00:00
2074,767244610972246017,I need a vape so I can stay off cigarettes,OfficialIvan_,2016-08-21 06:19:04+00:00
2075,767244578114134016,Here's Nate Diaz smoking a vape pen immediately following #UFC202. Says it's CBD oil. (vid by @bokamotoESPN) https://t.co/zf113ej9Gy,MikeyJ_MMA,2016-08-21 06:18:56+00:00
2076,767244565535305728,The Great Vape Debate - Free Times - https://t.co/A3IGF2iRzQ https://t.co/QJFrhjotQZ,VapeScoop,2016-08-21 06:18:53+00:00
2077,767244250534653952,"You guys are out here trying to snitch on this man. Do you even vape, bro? #UFC202 #NateDiaz https://t.co/A5XAuZHn8K",Oh_TheHorror,2016-08-21 06:17:38+00:00
2078,767244213192884224,More edits for the masses #vapetillidie #vapeVideo #vapeporn #vape #vapenation #vapelife… https://t.co/oILYyV5iqu,NyckVapes,2016-08-21 06:17:29+00:00
2079,767244184533209088,This nigga Nate Diaz smoking a vape in front of everybody 😂😂😂😂,Snr_BoatsNHoes,2016-08-21 06:17:22+00:00
2080,767244091054694400,"Save every time you buy Vape gear, Wax, Leaf, CBD, or E Liquid Vaporizers! https://t.co/j5dgW6dWYZ",mdmonir2002,2016-08-21 06:17:00+00:00
2081,767244022918152192,"Vape Organics (full line) E-Liquid REVIEW with RLVT VAPING https://t.co/6ivPqNIqsP via @YouTube Great review, 100%. VG ! Spiced Apple is yum",elaine5100,2016-08-21 06:16:44+00:00
2082,767243987656830976,VAPING UNDERGROUND XBOX ONE S GIVEAWAY https://t.co/tXMKGPJ4DP,zloyel1978,2016-08-21 06:16:36+00:00
2083,767243966626529280,Why #Smoke When You Can #Vape? : https://t.co/3hP48ULuPC https://t.co/WIm4bItrsS,dietadelgazar,2016-08-21 06:16:31+00:00
2084,767243966462865408,"Save every time you buy Vape gear, Wax, Leaf, CBD, or E Liquid Vaporizers! https://t.co/WlNobrmH4n",nhossain17,2016-08-21 06:16:30+00:00
2085,767243915799834624,"Save every time you buy Vape gear, Wax, Leaf, CBD, or E Liquid Vaporizers! https://t.co/UNR1CS8GkX",ashik1997bd1234,2016-08-21 06:16:18+00:00
2086,767243908485001216,"Save every time you buy Vape gear, Wax, Leaf, CBD, or E Liquid Vaporizers! https://t.co/p5kcG6Je50",ashik1997bd,2016-08-21 06:16:17+00:00
2087,767243708525797376,"CBD vape pens is not technically smoking weed, though I am not sure that will make a difference to USADA  https://t.co/0iiAbczNjs",ZidanSports,2016-08-21 06:15:29+00:00
2088,767243587612401664,"Smokers who switch to vaping may have fewer respiratory infections, study reveals - News-Medic https://t.co/pXepjMLKZI #vaping #ejuice",OILRagz,2016-08-21 06:15:00+00:00
2089,767243539734523904,"Apparently Diaz is vaping, I'm now cheering for McGregor in a rematch hahaha",Pablo_el_Diablo,2016-08-21 06:14:49+00:00
2090,767243456972333056,"Homie passed me the vape pen, I tried to hold it in but damn shit burnt my nose lol",Lostinarchives,2016-08-21 06:14:29+00:00
2091,767243414651936768,"Gay, vape, weed, famous https://t.co/E7EJaisK4I",butane0nmyskin,2016-08-21 06:14:19+00:00
2092,767243402152992768,"Enjoying today 💨💨💨
.
#vapelife 
#cloud 
#vapeon 
#vapedaily 
#vape https://t.co/RIMx09BXTx",mhmmdbash,2016-08-21 06:14:16+00:00
2093,767243317192986624,Diaz says he is smoking a CBD Vape Pen on the dais.,arielhelwani,2016-08-21 06:13:56+00:00
2094,767243184799821824,"Hahaha Diaz smoking a vape pen at the post presser.  Some are saying it's weed...  Isn't he still ""in competition""? Hahaha crazy dude.",powersimagery,2016-08-21 06:13:24+00:00
2095,767243075156451328,Dis foo vaping lmaooo he don't give a fuuuuuk https://t.co/NXEb0MFkIF,King_GeorgeFC,2016-08-21 06:12:58+00:00
2096,767242920504066048,"""  RT Nate Diaz is smoking a CBD Vape pen at the UFC 202 press conference "" #SportsRoadhouse",SportsRoadhouse,2016-08-21 06:12:21+00:00
2097,767242836341198848,"Save every time you buy Vape gear, Wax, Leaf, CBD, or E Liquid Vaporizers! https://t.co/q9EuRSJT04",lmdkaka,2016-08-21 06:12:01+00:00
2098,767242829747716096,"Save every time you buy Vape gear, Wax, Leaf, CBD, or E Liquid Vaporizers! https://t.co/E2obTyLl8t",kaka2virus,2016-08-21 06:11:59+00:00
2099,767242793253081088,#NateDiaz says it's CBD oil in his vape. #UFC202,KarynBryant,2016-08-21 06:11:51+00:00
2100,767242777323196416,"Nate Diaz is vaping CBD oil.

#UFC202",AllThatMMA,2016-08-21 06:11:47+00:00
2101,767242775880470528,"LOL he vapes, too!? Haha kill yourself, Nate. https://t.co/eJ8pOHN6I7",crippler4real,2016-08-21 06:11:47+00:00
2102,767242572519514112,"Nate Diaz is vaping CBD oil on stage
#UFC202",DamonMartin,2016-08-21 06:10:58+00:00
2103,767242562474094592,Nate Diaz is smoking a CBD Vape pen at the UFC 202 press conference,UFCONFOX,2016-08-21 06:10:56+00:00
2104,767242407725436928,Nate Diaz is vaping it up during his post fight media scrum and says 'change is happening right now'. Wow.,SandhuMMA,2016-08-21 06:10:19+00:00
2105,767242091327926273,Ok this is seriously me. I don't fuck with vape 😭😂 #vapeisnotlife  https://t.co/JvTaiPazao,danivierra_,2016-08-21 06:09:03+00:00
2106,767242088115154945,"""Change is happening right now"" remarked Nate Diaz. Seconds after taking a hit from his Vape.",andrewmcgahon_,2016-08-21 06:09:03+00:00
2107,767242024579960832,Diaz gives no f*cks. He’s vaping and cracking jokes. Gotta love him,AndreasHale,2016-08-21 06:08:47+00:00
2108,767242008679231488,"me: my head feels like dan stood on it
lucy: vape it out hoe",lucidarii,2016-08-21 06:08:44+00:00
2109,767241900059492356,"Nate Diaz is definitely vaping on stage right now
#UFC202",DamonMartin,2016-08-21 06:08:18+00:00
2110,767241821239914497,My dad is THE Vape God,sarahthegreat,2016-08-21 06:07:59+00:00
2111,767241634106970112,I think this is the third character I've played who vapes. Someone stop me.,NeitherNora,2016-08-21 06:07:14+00:00
2112,767241580633731073,hey guys check out this cool vape trick,franbot666,2016-08-21 06:07:02+00:00
2113,767241408260534273,Smokers who turn to vaping with e-cigarettes 'have fewer lung infections' - https://t.co/uYS0VyNDCD https://t.co/naRWyMtt1q,douglosbridggs,2016-08-21 06:06:21+00:00
2114,767241274621566976,I need anyone who's got a battery charger for a Vape pen so we can smoke oil from Colorado!!!!!!!!!!,C_mewalkin,2016-08-21 06:05:49+00:00
2115,767241252823719936,Uncle really tried to have a cloud comp with me and my vape,G8MOBBIN,2016-08-21 06:05:43+00:00
2116,767241207139344384,Holy lord of vape,Josh_A_83,2016-08-21 06:05:33+00:00
2117,767241123907588096,I Vape To Forget,anasuibot,2016-08-21 06:05:13+00:00
2118,767241090516733952,"""since my juice tastes like ass this is my main vape now, my commander in chief""",jadebridges_,2016-08-21 06:05:05+00:00
2119,767241026444681216,new paint 😊 #vape #vapor #evicvtcmini #tsunamirda #vapelife #vapeporn #bandung #semarang… https://t.co/nuTIOhTyf7,aadrinew,2016-08-21 06:04:50+00:00
2120,767240531126657024,noah is vape god comfirmed,TheSykorax,2016-08-21 06:02:51+00:00
2121,767240522704400384,Vape Nation,Kevin_Bot___,2016-08-21 06:02:49+00:00
2122,767240485819658240,If not for @TimBertola I'd be very disparaging to #vape guy right now,Rhino44d,2016-08-21 06:02:41+00:00
2123,767240461043937280,come back is real.😍 #Vape,SimbulanPaolo,2016-08-21 06:02:35+00:00
2124,767240191295774720,Smokers who turn to vaping with e-cigarettes 'have fewer lung infections' - https://t.co/ZOQOE1gXNO https://t.co/WRRRD7sn0I,Coquine_Clo,2016-08-21 06:01:30+00:00
2125,767240181497802753,Yankee Candle Blueberry Pie Vape Juice.,keifstwocents,2016-08-21 06:01:28+00:00
2126,767239943244488704,god do you even vape???,StellarxKid,2016-08-21 06:00:31+00:00
2127,767239785266106368,I smoke cigs cause I'm addicted to the vape,_Peaches916,2016-08-21 05:59:54+00:00
2128,767239694312759296,Nate Diaz vapes. I'm done 😭😂 https://t.co/cvnEvgwiK3,SuperDuperGregg,2016-08-21 05:59:32+00:00
2129,767239674884595712,New York Court Rules that Vaping Is Not Smoking - ChurnMag https://t.co/6rz1hMkDfm,justinnewmanx,2016-08-21 05:59:27+00:00
2130,767239636997419008,Me vaping. 😂 https://t.co/T0HPNXtxGz,PrincessssAl,2016-08-21 05:59:18+00:00
2131,767239613844955136,Enter to win one of these ultimate vape prizes in this giveaway! https://t.co/EommOwX266,Vimmlus,2016-08-21 05:59:13+00:00
2132,767239538729037826,Vaped 4 the first time today! (:,alyssaaacuriel,2016-08-21 05:58:55+00:00
2133,767239483913740288,Root Beer Vape Juice https://t.co/aGOmXmq424 #vapefam #ecig #vaping #vapelife https://t.co/TLTMvxf2iX,4_Fox_Sakes,2016-08-21 05:58:42+00:00
2134,767239250672689152,"""Im a social vaper"" you are the worst kind of person there is",40ozAustin,2016-08-21 05:57:46+00:00
2135,767239080862027777,Smokers who turn to vaping with e-cigarettes 'have fewer lung infections' - https://t.co/uYS0VyNDCD https://t.co/naRWyMtt1q,douglosbridggs,2016-08-21 05:57:06+00:00
2136,767238806105763840,Help me win some amazing Artery Vapor #vape gear from @v_a_p_e and @arteryvapor. https://t.co/cf5UURDPw3,chevyguy4life68,2016-08-21 05:56:00+00:00
2137,767238664103440384,When you want to sleep but damn vapers smoke is all up in your personal space.,wildmarie_5,2016-08-21 05:55:26+00:00
2138,767238182148513792,"Evidence, Policy, and E-Cigarettes. https://t.co/iQLEJ3TESv #ecigs #vaping",VapinXsmoker,2016-08-21 05:53:31+00:00
2139,767238180181381120,Teens vaping at record levels https://t.co/FJEZXQh3Iw #ecigs #vaping,VapinXsmoker,2016-08-21 05:53:31+00:00
2140,767238179460030464,Vaping is the way to rejuvenate smokers’ respiration suffering from asthma https://t.co/3Q0CPQgSvQ #ecigs #vaping,VapinXsmoker,2016-08-21 05:53:31+00:00
2141,767238178692399104,Cigarette Tax initiated to bypass obstinate Legislature https://t.co/TXwjshYKSP #ecigs #vaping,VapinXsmoker,2016-08-21 05:53:31+00:00
2142,767238154030112768,Win $160 Vape Pack! Enter Our Sweepstakes! #TastyVapor #Vaping https://t.co/1hKzaBLcNi,Vimmlus,2016-08-21 05:53:25+00:00
2143,767238021548691456,"Katy Perry and Orlando Bloom Share a Vape Pen at Golden Globes,... https://t.co/xGuKUFQ1GW #katyperry",amandsst,2016-08-21 05:52:53+00:00
2144,767237875184304128,"Every saturday late night, I come here and vape a bowl. via /r/vaporents @TheWarOnMary https://t.co/TuR9TXqGDo https://t.co/otGmjBusoC",MrTHPQC,2016-08-21 05:52:18+00:00
2145,767237550641590273,do you believe in love at first sight or do i need to walk by again and blow another sick vape cloud?,JakeSchirle,2016-08-21 05:51:01+00:00
2146,767237499219357696,"#NateDiaz is vaping during his media scrum.
Because, Nate Diaz
#UFC202",philbattersby,2016-08-21 05:50:49+00:00
2147,767237158755143680,https://t.co/Nusn2wdMQV I  doubt most Dem. CA Gov. officials will be on a list in support of Vaping! $$$ has more value than our lives!,TheThoughtPot,2016-08-21 05:49:27+00:00
2148,767237140157693957,“I'll share the vape then.”,PiratousRecluse,2016-08-21 05:49:23+00:00
2149,767236700753965056,.@vapeanchill on #Periscope: Vape an chill #vinyl #music #vape #beer #talk #garthbrooks https://t.co/sbMWKGrLJV,Wingz90,2016-08-21 05:47:38+00:00
