,TweetID,TweetContent,TweeterUsername,TweetDatetime
0,767511599380914176,This vape is basically an air freshener my room smells like pineapples,dongvvoos,2016-08-21 23:59:59+00:00
1,767511286871527424,"just had a customer looking for ""a retractable micro SD card to USB for my vaper"" the fuck do I do? does that ever exist??!!",NelCelestine,2016-08-21 23:58:45+00:00
2,767511270429822977,Walk A Peach Vape Juice https://t.co/og9FqsCAxC #eliquid #ecig #vape #MyNewTag https://t.co/LV745mmVJ6,4_Fox_Sakes,2016-08-21 23:58:41+00:00
3,767511091702222848,Nate Diaz Smokes Weed Vape Pen At UFC 202 Post-Fight Press Conference (Video) https://t.co/v8OcnsXgOK,PBSwaggy,2016-08-21 23:57:58+00:00
4,767511029228134401,The girl sitting next to me just whipped out her vape pen,abby_peace,2016-08-21 23:57:43+00:00
5,767510783420928000,Milk&amp;honey vape,mostafaattiya7,2016-08-21 23:56:45+00:00
6,767510666475294720,Dropping your vape is one of the loudest sounds like vault doors opening and closing in fallout 3.,Intrinsic_BME,2016-08-21 23:56:17+00:00
7,767510608975630337,My Dad vapes...,720degreez,2016-08-21 23:56:03+00:00
8,767509911215431681,Tonight On #VapeTV @9pm est BSP @10 Skruff #ShotFirst @11 VapeHound #HoundPound @12 Tunes n Chat #VapeTVLive #vaping #VapeChat #ecigs,BlacksmithPro,2016-08-21 23:53:17+00:00
9,767509906714927104,I liked a @YouTube video from @luvsvapor https://t.co/M81J19iwzH SAVE VAPING! | Right to Vape: Advocacy &amp; Fundraiser! | IndoorSmokers,ilovemanbankhom,2016-08-21 23:53:16+00:00
10,767509135655075840,Morning setup 😊 #evicvtcmini #smok #tsunamirda #kennedyrda #liquid #coffee #gehu #gorengan #vape… https://t.co/3vt6ipH5Di,aadrinew,2016-08-21 23:50:12+00:00
11,767508989424926721,When you smell weed in @Primark and you also see a vape pen sticking out of an employee’s back pocket #subtle,FrankRamblings,2016-08-21 23:49:37+00:00
12,767508872881852416,Grill time #grilling #grill #podcast #ShotsFromTheBalcony #BadHabitsNetwork #vapor #vape… https://t.co/IHSrsscIfB,Gary_The_Hammer,2016-08-21 23:49:09+00:00
13,767508538021253120,AND WHEN SOME VAPE TWITTER FAVORITED MY STREAM TWEET,nijiloop,2016-08-21 23:47:49+00:00
14,767508529930498048,SAVE VAPING! | Right to Vape Advocacy &amp; Fundraiser! | IndoorSmokers: https://t.co/wq1wpMO7Il via @YouTube,IndoorSmokers,2016-08-21 23:47:47+00:00
15,767508273599614977,Diaz with the CBD vape pen in post fight interview awesome.,hopper602,2016-08-21 23:46:46+00:00
16,767508258453983232,Did you see the dudes face? Who cares!! Let him do whatever! Nate Diaz Vapes CBD Oil During His Post-UFC 202 https://t.co/BIquS8wOr9,blindedbychoice,2016-08-21 23:46:43+00:00
17,767508076165332992,dont tell anybody i told you this but i saw junpei vape once,p3botagonist,2016-08-21 23:45:59+00:00
18,767507954031407104,i  broke my vape pen so not i hav to smoke cigarettes until my dad can afford to buy me a new one i kms,BlightTiger,2016-08-21 23:45:30+00:00
19,767507854068682757,"Ok we get it, you vape 😂😂😂",M0JICHIMA,2016-08-21 23:45:06+00:00
20,767507718806450177,Vape Talks Shop – The Cheshire Club Vapor Boutique: By PEDROH H. There is a lot to be said about... https://t.co/vjxic6rKTY #vapor #news,VaporInformer,2016-08-21 23:44:34+00:00
21,767507717321875456,Vape Talks Shop – The Cheshire Club Vapor Boutique https://t.co/CdylqNzVbU #ecig https://t.co/rg4Ffh36UV,VaponewsUS,2016-08-21 23:44:34+00:00
22,767507643476938752,"The Late Late UK Vape Show... Sunday Edition, starts at 8pm EST only at...
https://t.co/ayYjnWLh9W
#vapefam #vapelife #vapeon",VapingWithVic,2016-08-21 23:44:16+00:00
23,767507621720961025,"A win for #vaping. Help out! Call your State politicians. Tell them to stand up and do their job, to be your voice https://t.co/4lfckoKBsM",WeezyVapes,2016-08-21 23:44:11+00:00
24,767507604369051648,Really love how everytime someone vapes the feel the need to show/ tell me about it like I'm some vape King or sum😎,theriot26_,2016-08-21 23:44:07+00:00
25,767507253033402368,I just bought a vape.,gabbyfbear,2016-08-21 23:42:43+00:00
26,767507251955376128,When your vape almost sets your car on fire #vapegodproblems,sammyderienzo,2016-08-21 23:42:43+00:00
27,767507244397256704,yea i fukkin vape so what,groggerygorg,2016-08-21 23:42:41+00:00
28,767507144472158208,why vape when you can ~pray~,jakuzuree,2016-08-21 23:42:17+00:00
29,767506520233873408,So there's a place on central avenue in Toledo and it turns out that it's a vape shop,Justinfowler21,2016-08-21 23:39:48+00:00
30,767506401551851520,"Wow, that's a nice cigar. I didn't know you vaped.",khonjinhouse,2016-08-21 23:39:20+00:00
31,767506294253064192,Cronicle Asher voted as Most Likely to Vape,vgundam_ebooks,2016-08-21 23:38:54+00:00
32,767506068553338880,yeah i vape,alexs_ebooks,2016-08-21 23:38:00+00:00
33,767506004452016128,"Taste the past with Deadwood. 

#detroitspremiervaporco #dpvco #vape #eliquid https://t.co/NUXHYSYXZ6",PremierVapor_Co,2016-08-21 23:37:45+00:00
34,767505986231803904,Check out Red Dot Vapour Co. Shirts! Available for the next 7 days  @Teespring: https://t.co/49jYujsQQi #vape #ecig https://t.co/dyTXdP58Bd,UpinthecloudsV1,2016-08-21 23:37:41+00:00
35,767505803460960257,"No it's not cloudy out, Pensacola just recently increased it's vape population",jayrmcg,2016-08-21 23:36:57+00:00
36,767505567694852096,"#SaveTheVapes
24 hour charity stream To benefit CASAA &amp; OAR 9/3-9/4
Lets tell the GOVT to leave our Vapes alone https://t.co/V5SQQwsNeL",Mr_Mangles,2016-08-21 23:36:01+00:00
37,767505341323935744,US FDA’s response to the Court in consolidated lawsuit with vaping industry... https://t.co/gaM92D0iME https://t.co/IJ2j6v5w6b,maryall33220748,2016-08-21 23:35:07+00:00
38,767505201632800768,When vape is life https://t.co/5fmYcudiYF,chr1sj0hnson,2016-08-21 23:34:34+00:00
39,767505129285246977,Make Your Own Vape Pen Cannabis Oil https://t.co/FmAR9RJ5WX #cannabis #420life #pot,weedgangster,2016-08-21 23:34:17+00:00
40,767504983189168128,Vape Talks Shop – The Cheshire Club Vapor Boutique https://t.co/WrEzLzXNnR #August2016 #departments https://t.co/H0n7xb7d7N,twistedmistvape,2016-08-21 23:33:42+00:00
41,767504958434512896,Samsung Galaxy Note 7 International Giveaway! https://t.co/yozQLuAlxn,Pegaso_Vape_Fly,2016-08-21 23:33:36+00:00
42,767504929837682689,Back to the weekly grind at work? Make sure you get your vapes from us to battle any stresses from the boss! #vapemalaysia #vapersmalaysia …,brewmastermys,2016-08-21 23:33:29+00:00
43,767504692758908928,I'm not sure I'd date someone who vapes. It would be like dating someone who looks like they're constantly on Stars In Their Eyes,_its_jeff,2016-08-21 23:32:32+00:00
44,767504582930870272,Watch Nate Diaz Vape Weed Oil at the UFC 202 Post-Match Press Conference https://t.co/xTZEcdqplu,kaliboAFMR,2016-08-21 23:32:06+00:00
45,767504235365863428,When my vape hits harder than you 😂,TheRealOGHitler,2016-08-21 23:30:43+00:00
46,767504114414518273,Watch Nate Diaz Vape Weed Oil at the UFC 202 Post-Match Press Conference https://t.co/UQJj66uYdm,absolutenonstop,2016-08-21 23:30:15+00:00
47,767503734096134149,Federal Judge Finds Indiana Vaping Law Unconstitutional https://t.co/GkIHoo5FHv,VAPOLOCITY,2016-08-21 23:28:44+00:00
48,767503600176230400,I liked a @YouTube video https://t.co/qVRBektVOe Can a Vape Device Set Off a Fire Alarm? Let's find out!,MLGXxWOLFBLOODG,2016-08-21 23:28:12+00:00
49,767503458056318977,a guy vaping walked in front of my car downtown when i had a green light and i didnt purposefully hit him... @god @BarackObama what do i get,charlie2136,2016-08-21 23:27:38+00:00
50,767503358059950080,I just had the most interesting astrology reading...,juuls___,2016-08-21 23:27:14+00:00
51,767503197304827904,So precious and so vape and kawaii https://t.co/L5GmIdi6rE,JanaAmariChan,2016-08-21 23:26:36+00:00
52,767503171874803713,"#juicing Stage 1 coils wicking, juicing and vaping - https://t.co/Q4L5RbgDgE #RT #Retweet https://t.co/d2dhDeVDdE",JuicingCentral,2016-08-21 23:26:30+00:00
53,767502731837902850,"Some more great #names will be posted soon! Hints: A #CEO name, #keyword name, #Vape name and a #prepaid #name. Stay tuned! #naming #domains",NameSelling,2016-08-21 23:24:45+00:00
54,767502690431696896,spent $100 on a vape that doesn't work,jigglydude,2016-08-21 23:24:35+00:00
55,767502665584631808,Federal Judge Finds Indiana Vaping Law Unconstitutional https://t.co/gYY9BL5Wgc,LeahDiProsperi,2016-08-21 23:24:29+00:00
56,767502462773260288,"‘look at me vape’ by Chuck Sutton
https://t.co/sbMQnfncSd",emhopam,2016-08-21 23:23:41+00:00
57,767502327796248576,Remember she still young man take your time because your Vape pen money might be Pampers money https://t.co/hbqPURddkm,_brian_hd,2016-08-21 23:23:09+00:00
58,767502321035059201,Only real men vape,TwitchObama,2016-08-21 23:23:07+00:00
59,767502159327952896,I've just been informed that there's mountain dew flavored vape juice. I don't know why I was surprised.,BRSomebody,2016-08-21 23:22:28+00:00
60,767501899922825216,Do they really vape if they don't post snaps of them doing the vape every day? 🤔,wtfchance_,2016-08-21 23:21:27+00:00
61,767501843572326401,What if the FDA/GOV banned access to vaping sites? https://t.co/Bael1c2vRx  #vaping #vape #vapefam #vapelife https://t.co/ct1Cu1gc7w,dude_vape,2016-08-21 23:21:13+00:00
62,767501557986238464,Nate Diaz Vapes CBD Oil During His Post-UFC 202 Media Scrum | Bleacher Report https://t.co/X8hEX7vosL,luvdigifeelin,2016-08-21 23:20:05+00:00
63,767501371608367104,Vape Talks Shop – The Cheshire Club Vapor Boutique https://t.co/3WHo6SP3IG,topvapenews,2016-08-21 23:19:21+00:00
64,767501364687667201,I thought about buying a Fedora but instead chose to peruse yelp reviews of local vape shops instead.,AitFetterolf,2016-08-21 23:19:19+00:00
65,767500690541293568,"Tanning industry blames 10,000 salon closings on ObamaCare https://t.co/nMm4RDIXJW  the FDA wants to beat this record  closing vape shops",markhweiss,2016-08-21 23:16:38+00:00
66,767500594496012290,How Vape Pens Have Changed the Weed Smoker's Stigma https://t.co/hQYQHAsFvx https://t.co/yqg4DvvnZ2,CannaFactsByNMJ,2016-08-21 23:16:15+00:00
67,767500500686123008,Win $160 Vape Pack! Enter Our Sweepstakes! #TastyVapor #Vaping https://t.co/xHr1ArqXrv,billy_unruh,2016-08-21 23:15:53+00:00
68,767500452581736449,Vape Talks Shop – The Cheshire Club Vapor Boutique https://t.co/4x6flpGodZ #Vaping,ISpotVapes,2016-08-21 23:15:42+00:00
69,767499832726478849,Vape Lord! 󾌴󾌴,VjayIlano,2016-08-21 23:13:14+00:00
70,767499678875160580,I go through vape juice so fast for someone who sleeps so much,hanna_hohl,2016-08-21 23:12:37+00:00
71,767499293435518976,Anyone know any vape shops in NJ that I can get a rebuild?,ClaudKill,2016-08-21 23:11:05+00:00
72,767499201471098882,the hardest part about vaping is telling your parents that youre gay,maplewavebot,2016-08-21 23:10:43+00:00
73,767499003386789888,this vape juice does not taste very good,MYSTERIONRlSES,2016-08-21 23:09:56+00:00
74,767498871282933761,Federal Judge Finds Indiana Vaping Law Unconstitutional https://t.co/Zq0I3e9Zgc,billjlevin,2016-08-21 23:09:25+00:00
75,767498821324636160,Nate Diaz Vapes Marijuana (CBD) at UFC 202 Press Conference https://t.co/vnsab1ijjG via @YouTube,SwingDeeDiablo,2016-08-21 23:09:13+00:00
76,767498773991940096,I love Spinfuel VAPE Giveaways! https://t.co/79o09u11DK,VapingKaren,2016-08-21 23:09:01+00:00
77,767498572585721858,The only thing I want right now is my new vape and my bed,iOrbitHD,2016-08-21 23:08:13+00:00
78,767498443157745664,"With vape pen in hand, #UFC202's Nate Diaz explains the benefits of #cannabidiol oil in Las Vegas https://t.co/IhWefvKJ3H #CBD #marijuana",LasVegasLocally,2016-08-21 23:07:42+00:00
79,767498394193498112,Iraq hangs 36 people sentenced to death for killing of troops in 2014 https://t.co/t628wikcO0 #vape #vaping #ecigs,vapedotto,2016-08-21 23:07:31+00:00
80,767498392922624001,"Gaza militant rocket hits Israel, Israel responds with air strikes, shells https://t.co/Y37Y1s1SN4 #vape #vaping #ecigs",vapedotto,2016-08-21 23:07:30+00:00
81,767498391534338049,Syrian rebels prepare to attack Islamic State town from Turkey https://t.co/HzR8SaRqUv #vape #vaping #ecigs,vapedotto,2016-08-21 23:07:30+00:00
82,767498390322212864,"Libyan forces say they capture mosque, prison from Islamic State in Sirte https://t.co/DmuVTR1F7z #vape #vaping #ecigs",vapedotto,2016-08-21 23:07:30+00:00
83,767498389030395904,Yemen's ex-president says could work with Russia to 'fight terrorism' https://t.co/HmvnTANvma #vape #vaping #ecigs,vapedotto,2016-08-21 23:07:30+00:00
84,767498311934672898,yeah i vape so what?,wildcrow_ebooks,2016-08-21 23:07:11+00:00
85,767498302010957824,"""Vape Sesh Take 2"" - https://t.co/gayLUQ2RnS",Apdokoko6,2016-08-21 23:07:09+00:00
86,767498260739162112,"I liked a @YouTube video from @mrrizingstarz https://t.co/5gzOp3Gs3p BLACK OPS 3 KILLCAMS &amp; FUNNY MOMENTS! (Vape Crate, Fake",PsycharioYT,2016-08-21 23:06:59+00:00
87,767498147991912448,"Instagram photo by Greta • Aug 21, 2016 at 7:33am UTC https://t.co/Zy4R3LgHhA",hart_vapes,2016-08-21 23:06:32+00:00
88,767498056577056768,A few months ago I literally experienced eat sleep rave repeat.. Now that Genki shut down all I been doing was eat sleep vape repeat 😂,MERIfcknCEL,2016-08-21 23:06:10+00:00
89,767497964524806144,🌬💨💨Hey vape fam Check out @house_clouds  Give them a follow! 🌬💨💨💨😤 #vape #vapelife #vapeporn… https://t.co/rfxEJjegdS,KoalaRooinfo,2016-08-21 23:05:48+00:00
90,767497930424979456,VAPE TRICKS AHSKAG https://t.co/h1HO9qfphP,ryleebrenna,2016-08-21 23:05:40+00:00
91,767497923345129472,Like to vape #cannabis? Want to check #CBD? Try this https://t.co/4XhHxBEMtY eLiquid 500mg full plant for $30 #MMJ https://t.co/wprn7XhiKR,ermphd,2016-08-21 23:05:39+00:00
92,767497653382844416,"""Eminem Juice"" https://t.co/0RdY4yPoNE #vape #ecigs #reddit",ukvaper,2016-08-21 23:04:34+00:00
93,767497652493701121,im looking for a 100ml plus of eliquid in the uk any suggestions? https://t.co/wTlUuFr3aF #vape #ecigs #reddit,ukvaper,2016-08-21 23:04:34+00:00
94,767497442614915072,Someone deadass called the cops on us for vaping in public,YaboyLiban,2016-08-21 23:03:44+00:00
95,767497008852701184,"Get on my level, son! #funrun2 #BabyGirl #E4GTwin #Jules422 https://t.co/wHCuaV4koh",Vape_Luke,2016-08-21 23:02:00+00:00
96,767496955203358720,I liked a @YouTube video from @h3h3productions https://t.co/RP8JffdM8o VAPE NAYSH YALL,chaffXgrenade,2016-08-21 23:01:48+00:00
97,767496790543327232,i think my mum is accidentally vaping,woIfbitch,2016-08-21 23:01:08+00:00
98,767496782909702145,"Pod Mod Roundup: The Next-Generation of Vaping - These all-in-one vapes will be huge
by Raymond Padilla @RPadTV
https://t.co/sFWsEXThxI",Vaping360,2016-08-21 23:01:07+00:00
99,767496765327020032,"Sundayfunday👍👟....Be Unique!!! REPOST: 📷: @edwin_luvko1121
#vape #vapeporn #vapelife #vapelyfe #calivapers #ejuice https://t.co/GSKfAGF54S",yougotejuice,2016-08-21 23:01:02+00:00
100,767496756569538560,Give my fucking vape (Vine by @Rybeckford) https://t.co/S8urPsZyYv,sebasthebeast12,2016-08-21 23:01:00+00:00
101,767496738156515328,i keep my vape pen in one of Kenny G's old alto sax cases,Jheri_Seinfeld,2016-08-21 23:00:56+00:00
102,767496646775173120,There's a shop in downtown Martinsburg called 'vape boiz'. I shit you not.,to_claire_ify,2016-08-21 23:00:34+00:00
103,767496560141828096,im so tired i just tried to vape n wondered why nothing was coming out..it was my phone in my mouth not my acc vape,SophieeHirst,2016-08-21 23:00:13+00:00
104,767496412842037248,Ryan has popcorn lung nd can't vape,calicopoison,2016-08-21 22:59:38+00:00
105,767496351093366784,Watch Vape Lord Nord stream! https://t.co/mcQTf84oWC,Trjzo,2016-08-21 22:59:24+00:00
106,767496172923523073,Fire Baller Vape Juice https://t.co/JrGgvm1Z9K #vape #vapefam #vapelife #ejuice https://t.co/SSWqi4gYio,4_Fox_Sakes,2016-08-21 22:58:41+00:00
107,767496051427127296,@gep_collective have our #GoldCarts available! Perfect for patients that vape and enjoy #highquality #products. https://t.co/5iYngSvWUJ,TetraLabs,2016-08-21 22:58:12+00:00
108,767495977703870464,Will people still like me if my vape game was strong af again?,sal_flores44,2016-08-21 22:57:55+00:00
109,767495943843381248,"#nemesis with the #mutationxv2 #handcheck 

#vapestars #vapefamous #vapejunkies #vapelife #vape… https://t.co/G6tKLUboMm",MTG_VooDoo,2016-08-21 22:57:47+00:00
110,767495907034017793,Time for a vape 🔥🔥 #weed #marijuana #cannabis #stonerfam #stonercircle #staylifted 💨💨💨💨 #vape https://t.co/8M596qWlAA,IAmCannabis420,2016-08-21 22:57:38+00:00
111,767495727513690112,"My mom said my brother smells like bud... You know this niggas answer was... ""I just hit verro's (his girl) vape""😂😂😭 my mom just walked away",CHRISpyWizrd,2016-08-21 22:56:55+00:00
112,767495447258669056,"Vape Giveaway! Win 5 Joose On Tap boxes, a Minikin 1.5 box mod, Smok TVF8, plus more! https://t.co/1bHp04UfC4",snowsparks40,2016-08-21 22:55:48+00:00
113,767495294435090433,Science + vodka = Vaportini. The origins here: https://t.co/KoNwh9aE9Z #alcohol #vape https://t.co/mqTM4vY66T,Vaportini,2016-08-21 22:55:12+00:00
114,767495169209839616,Enter to win one of these ultimate vape prizes in this giveaway! https://t.co/Zb9pLgXSPY,snowsparks40,2016-08-21 22:54:42+00:00
115,767495052192993280,theres an old man vaping 7 ft away from me,riinpana,2016-08-21 22:54:14+00:00
116,767494959926738948,"yall: *are vape gods* 
me: https://t.co/cMXIAiNMcB",YUKWON2DANK,2016-08-21 22:53:52+00:00
117,767494916733857796,Win $160 Vape Pack! Enter Our Sweepstakes!  #TastyVapor #Vaping https://t.co/efU7ChzJRo,Bibers021,2016-08-21 22:53:42+00:00
118,767494887369502720,Limitless RDTA plus from @ijoy_official @limitlessmodco 😎 💨  #vape #vapeporn #vapelyfe #vapefam… https://t.co/Lfn0CHZ8TS,pauly_meatballs,2016-08-21 22:53:35+00:00
119,767494776484540417,Smokers who turn to vaping with e-cigarettes 'have … https://t.co/RwNAG4E3jq,playnewstoday,2016-08-21 22:53:08+00:00
120,767494089084379136,Vape Naysh couple. We vaped so hard it is backwards. https://t.co/wPgjwDisq3,SexyFlexy96,2016-08-21 22:50:24+00:00
121,767494055903240192,Federal Judge Finds Indiana Vaping Law Unconstitutional | https://t.co/rFwY6HXnKd https://t.co/E3GpAAnuoe,PositiveEnerG,2016-08-21 22:50:16+00:00
122,767493827846299652,Check out #DistrictVapors local #smallbusiness #blackowned great customer service #vape @DMVFollowers @smallbusiness @BlackOwnedBiz1 #rt,LanaChantale,2016-08-21 22:49:22+00:00
123,767493795747209216,#PureGold #plus is a great choice for #dabbers and patients who #vape. #Thechoiceisclear #pure #quality #tetralabs https://t.co/ss6hkvZAcP,TetraLabs,2016-08-21 22:49:14+00:00
124,767493780857651200,I liked a @YouTube video from @quest4vape https://t.co/hbUXlp63Dh Vapergate 30mm Mason Build and gear haul from VPX Vape Expo,Mitch_846,2016-08-21 22:49:11+00:00
125,767493462635806720,I liked a @YouTube video from @mike_vapes https://t.co/v9dJwK9Nms Windforce RTA By Fumy-Tech - Mike Vapes,JeffBarrick12,2016-08-21 22:47:55+00:00
126,767493443304222720,"Original Aspire Atlantis ...: As ... https://t.co/QJDYCwhPtO
#Vape https://t.co/04J6GVfLAM",VapOrgasme,2016-08-21 22:47:50+00:00
127,767493419233148928,"#RX23 logo #Punisher Skull download from https://t.co/nED9HBeHrg
#marvel #rx23logo #vape #mod https://t.co/S7upND54BN",01Shadey,2016-08-21 22:47:45+00:00
128,767493387981299712,We vaped outside 🌪 https://t.co/jENSklBVEw,itsmecaleesi,2016-08-21 22:47:37+00:00
129,767493370331602944,yo dude have you seen my vape?,MFsteamboat,2016-08-21 22:47:33+00:00
130,767493252983296000,😘 love you https://t.co/VPb6QBQ5I4,kingk_juul,2016-08-21 22:47:05+00:00
131,767492968622202881,"Check out yer mans vape, it made the main stage 😂😂😂 @AllSaintsOffic @vfestival https://t.co/iAMJRcHUPJ",luke__tommo,2016-08-21 22:45:57+00:00
132,767492822291324929,"#RX23 logo #FooFighters download from https://t.co/yfg7fW3BlQ
#FF #rx23logo #vape #mod https://t.co/GHsBOAkfjF",01Shadey,2016-08-21 22:45:22+00:00
133,767492795053506560,"Good morning vapours, have a fantastic vape week! #vaping #vapethebarton #vape4life https://t.co/GwnZ38YQQM",vapingdelights,2016-08-21 22:45:16+00:00
134,767492578337959936,"vape gape

@oshimakesmusic @voiamusic https://t.co/iSnSxvZlUn",singtoconley,2016-08-21 22:44:24+00:00
135,767492360016007168,"*guy on a hoverboard wearing LED gloves slides by, exhaling Crystal Pepsi flavored vape* ""Welcome to our nightmare future, I'm a CEO!""",PithyOrNot,2016-08-21 22:43:32+00:00
136,767492312016519172,Vape natiooooon,BestiaSurreal,2016-08-21 22:43:21+00:00
137,767492189723226112,Celina's mom just offered the dog a hit off her vape,k_merrrr,2016-08-21 22:42:52+00:00
138,767492095976308736,What happened to the old Vape tho  https://t.co/EsglwbAVjV,MeezyOffSafety,2016-08-21 22:42:29+00:00
139,767492049809661952,Actually ordered vape pen last night when I was steaming 😂,MarkCoates,2016-08-21 22:42:18+00:00
140,767491974735724544,"Throw your vapes in the air, if youse a true player",Chris_Whetten,2016-08-21 22:42:00+00:00
141,767491945816002560,"New vape, who's this ?",DJBLAZEORLANDO,2016-08-21 22:41:53+00:00
142,767491860382224384,""".. one nation, under harambe, indivisible, with vape tricks and goth bitches for all."" https://t.co/RalLy4t2e6",haileybettsk,2016-08-21 22:41:33+00:00
143,767491754601906176,I love Spinfuel VAPE Giveaways! https://t.co/5JgfBz5lLv,kevdt67,2016-08-21 22:41:08+00:00
144,767491753083494400,dragons vape,lilith_en,2016-08-21 22:41:07+00:00
145,767491527748775936,I love Spinfuel VAPE Giveaways! https://t.co/qB86Cq5gG3,twisted_vape3,2016-08-21 22:40:14+00:00
146,767491421200871428,One last vape session in my room before I leave to head home to Queensland. Sydney is always… https://t.co/ggYPjy53pR,Millmantv,2016-08-21 22:39:48+00:00
147,767491412527091714,"#RX23 logo #FaithNoMore download from https://t.co/SBmysFsMem
#FNM #rx23logo #vape #mod https://t.co/FUicxwupKm",01Shadey,2016-08-21 22:39:46+00:00
148,767491360026923009,"A leaf: hand me the vape 
Me: *puts my hand in hers instead* this is what you really need",bigtruckjace,2016-08-21 22:39:34+00:00
149,767491187594956800,The best way to help keep #vaping the way we know and love is to #voice your #opinions.,MyFreedomSmokes,2016-08-21 22:38:53+00:00
150,767490947164860416,Nate Diaz Showed Up At The UFC 202 Presser Smoking A Weed Vape Pen https://t.co/K6vRg7gb9a,Marquee_Mark5,2016-08-21 22:37:55+00:00
151,767490851257790465,"#RX23 logo #SuperSmashBros download from https://t.co/5OUuFvlAH1
#nintendo #SSB #rx23logo #vape #mod https://t.co/QIaP8UykF8",01Shadey,2016-08-21 22:37:32+00:00
152,767490537448312832,"FDA: ""vaping is bad for you and there's horrible chemicals. But here's some OxyContin for your 11 year old.""",guccibvse,2016-08-21 22:36:18+00:00
153,767490409077420032,"Derek, 22, doesn't text back, makes vaping look cool, likes to sniff ass, goes to SoulCycle because ass, fake vegan https://t.co/6MVqMfTmeH",TheJeffGoldberg,2016-08-21 22:35:47+00:00
154,767490353175887872,It's very foggy on this nature trail today oh wait that's just the guy in front of me VAPING !!!!!,caseyblanco,2016-08-21 22:35:34+00:00
155,767490336532955136,Things you see at the ACF... One of your former students vaping. Awesome.,lacymae10,2016-08-21 22:35:30+00:00
156,767490304169512964,"I now carry a powerbank everywhere I go. Pokemon Go, what have you done to me?! Jk, it's for my vape",imsolaud,2016-08-21 22:35:22+00:00
157,767490285005840384,"#RX23 logo #BlackMesa download from https://t.co/RVv7qgz6rE
#HalfLife #rx23logo #vape #mod https://t.co/aRa1VhA2FI",01Shadey,2016-08-21 22:35:17+00:00
158,767490279205171203,"Tech-Savvy Tokers: Check out this sweet new vape by @GrencoScience!
https://t.co/uDG7VtgAfm",TokeTank,2016-08-21 22:35:16+00:00
159,767490222225403904,"has just added ""Witch&amp;#39;s Apple E Juice"" to https://t.co/WciBugmQpC #vaping #ecigarette #ecigs #vape",vaporfox,2016-08-21 22:35:02+00:00
160,767490134765744128,Excited to see @joerogan s take on Diaz vaping CBD oil during his post fight media session. #savage,krowlz,2016-08-21 22:34:42+00:00
161,767490089194692608,Watch Nate Diaz Vape Weed Oil at the UFC 202 Post-Match Press Conference https://t.co/CzeC9wh9LY,oneandonlyr2dj,2016-08-21 22:34:31+00:00
162,767490036119941120,"Vape the Block Carnival Event in Denver, CO: An Interview with Organizer Inno-Vapor Digital https://t.co/TyRqCSIb6y #vapecommunity #vaping",WhoAreTheVapers,2016-08-21 22:34:18+00:00
163,767490013474979840,Watch Nate Diaz Vape Weed Oil at the UFC 202 Post-Match Press Conference https://t.co/pb1VZI8RIe,ohm_god,2016-08-21 22:34:13+00:00
164,767489987575185408,https://t.co/fUVur4oMAq just started vaping again feeling great.,mymomisntproud,2016-08-21 22:34:06+00:00
165,767489981405274112,If u vape in crowds you should be shot,jellybackturtle,2016-08-21 22:34:05+00:00
166,767489948022779905,"Team Five-One Vape.

https://t.co/Uu00WGEW9u",yungbobkennedy,2016-08-21 22:33:57+00:00
167,767489945879666688,Had to get a new vape tank this evening because apparently it cracked while in my apron today.. Oh well. #vapelife https://t.co/M0gDQYrB7R,breakingheather,2016-08-21 22:33:57+00:00
168,767489800744165380,I liked a @YouTube video from @luvsvapor https://t.co/MIhz28Y6hR The Real Negative Side Effects of Vaping -IndoorSmokers,KidZippy,2016-08-21 22:33:22+00:00
169,767489676143755264,Post Edited: Video: UFC 202 headliner Nate Diaz nonchalantly vapes CBD oil during press conference https://t.co/nDsemve5V5,mmafightbiz,2016-08-21 22:32:52+00:00
170,767489671798542337,ommio 3 goes hard Idc I love rj,juuls___,2016-08-21 22:32:51+00:00
171,767489653909749761,"With vape pen in hand, UFC 202's Nate Diaz explains the benefits of cannabidiol oil #209  https://t.co/Mc0qcuEmXv https://t.co/SD87DdVbPS",FHF4L,2016-08-21 22:32:47+00:00
