,TweetID,TweetContent,TweeterUsername,TweetDatetime
0,590303930447454208,"RT heathdeloach: Look, I'm glad you quit smoking. Well done! It's tough! But, good lord you look like a douche when you vape. Such a gigant…",vapemerch,2015-04-20 23:59:58+00:00
1,590303928996257792,RT Juany3117: Selling vape juice over 40 flavors and different amounts of nicotine #vape #vapelife dm if intrested! http://t.co/xkFydpKFJy,vapemerch,2015-04-20 23:59:58+00:00
2,590303927507255296,"RT MissDany85: Cause if you liked it, then you should have put a #vape ring on it,
oh oh oh oh oh oh oh oh...
#vapetime",vapemerch,2015-04-20 23:59:58+00:00
3,590303926022438913,RT SadieFKatz: .WBCSaysRepent so are u guys celebrating 4/20 or are u more into #vape,vapemerch,2015-04-20 23:59:57+00:00
4,590303743511375873,Sorry about me slacking in posts yall! I git a new phone so expect more photos!,Vape_Porn1,2015-04-20 23:59:14+00:00
5,590303631863230465,"don't really feel like smoking , just bout to hit the wax vape a couple of times &amp; go ball .",Tee_Kayy_,2015-04-20 23:58:47+00:00
6,590303437633392641,I liked a @YouTube video from @abbyvapes http://t.co/WBM9601OYF Answering Your Vaping Questions - #DearAbbyVapes,anointedqueen__,2015-04-20 23:58:01+00:00
7,590303037866016768,"Cause if you liked it, then you should have put a #vape ring on it,
oh oh oh oh oh oh oh oh...
#vapetime",MissDany85,2015-04-20 23:56:26+00:00
8,590302999458799616,You May Be Using the Wrong Type of E-Cigarette to Quit Smoking http://t.co/LYvAMCZgLn #ecigs #vaping h/t @maki_kitamura,GregTHR,2015-04-20 23:56:17+00:00
9,590302774430044160,TroveLive just went LIVE at [ http://t.co/ErReoUDM19 ] on @Vapersdottv - #AutoTweet #Live #Video #Vaping #Vapers #ecig #Vapor,LiveOnVapers,2015-04-20 23:55:23+00:00
10,590302735356055552,Who else is hooked on snapliquids? 🙋 #billetbox #vape #vaping #vapelife #vapelyfe #vapeporn… https://t.co/obdNFiDlpZ,CaliVapers,2015-04-20 23:55:14+00:00
11,590302717429555200,"Fight for your right to Vape, email Governor @GovPenceIN and let him know how this bill HB 1432 will affect you and it is unconstitutional",vaperatvapeSt,2015-04-20 23:55:09+00:00
12,590302675293630465,Pint and a vape at my local. It's good to hear happy people out and enjoying themselves. Screw you puritan's! http://t.co/nqLDQDHlAu,mantiz01,2015-04-20 23:54:59+00:00
13,590302632151015425,*lights vape* happy 421 B)))))),vxlturefood,2015-04-20 23:54:49+00:00
14,590302602228793344,Why smoke weed on 4/20 when you can vape #vapeislife #vapebro #blowclouds,stefschweikert,2015-04-20 23:54:42+00:00
15,590302601910050816,Photo: Haha. #vape #vaping #vapor #vaporizer #vapen http://t.co/ypkDPnx3ie,BaSs_HaXoR,2015-04-20 23:54:42+00:00
16,590302599523475456,Members Saw Our Penny Stock Picks Gain 1600% In 4 Months! Subscribe Here For New Picks: http://t.co/2dBXHWiAWG $VAPE $PTAH $TAUG,PennyStockingt,2015-04-20 23:54:41+00:00
17,590302419961008128,"Lol girls smokin their vape asking ""how high are YOU?"" Girl bye lmao",_sharsin,2015-04-20 23:53:58+00:00
18,590302290734612482,4/20 man! *hits vape*,starboyjohnnyx,2015-04-20 23:53:28+00:00
19,590302276763439104,I didn't know Tyler Oakley vaped https://t.co/y1MGrQ8vHh,_harley97,2015-04-20 23:53:24+00:00
20,590302270803337216,Perfect way to start the evening.... A vape set as 420 degrees #MGFTS #StonerCouple #StonerNation #Happy420 http://t.co/Or3pfAM477,MyGfStoner,2015-04-20 23:53:23+00:00
21,590302092256010240,I thought someone was vaping but they were actually having an asthma attack and using their inhaler,tinieyongie,2015-04-20 23:52:40+00:00
22,590302069732474880,How I Learned To Stop Worrying And #Love #Medical #Marijuana. http://t.co/KNh5sdoFZA via @BoingBoing #Pot #Weed #Vape http://t.co/TRUlXLOH4Z,HydroponicLife1,2015-04-20 23:52:35+00:00
23,590302010697646080,This kid brought a vape to work and is just smoking everyone out in the back😂🙌 #realmvp,DsrtWildflowr,2015-04-20 23:52:21+00:00
24,590301677154086914,"Hi Vaping Communiy. I need your help with bill 45.

Today I had the pleasure of speaking in front of the standing... http://t.co/QCh1Fw18TG",180Smoke,2015-04-20 23:51:01+00:00
25,590301584698912768,"If she has a vape pen, she's too young for you son 😶",haleybrowntown,2015-04-20 23:50:39+00:00
26,590301522136805377,The first 10 vapers between 9pm - 10pm will receive a Free Starter Kit with ANY Purchase!! Now Open until 10pm 7 Days per week!,GloryvapesEcig,2015-04-20 23:50:24+00:00
27,590301512535969792,"TTW Today's News: E-cigarette users trying to quit smoking should vape every day, studies suggest  http://t.co/BUMzvmeZnt",TypewriterIntl,2015-04-20 23:50:22+00:00
28,590301502226333697,i want a vape pen,hennajacob,2015-04-20 23:50:20+00:00
29,590301464117018626,"CBD A DAY KEEPS THE DOCTOR AWAY!! SKY VAPED 
730 STORY RD SUITE 6 
SAN JOSÉ  CA

#happy420  #sjvapers… https://t.co/DYgkKYDDsC",SkyVaped,2015-04-20 23:50:10+00:00
30,590301381547806720,EvolutionVapingOrg just went LIVE at [ http://t.co/qEaEoYbQBH ] on @Vapersdottv - #AutoTweet #Live #Video #Vaping #Vapers #ecig #Vapor,LiveOnVapers,2015-04-20 23:49:51+00:00
31,590301228778807296,420 vape it,robot_princess,2015-04-20 23:49:14+00:00
32,590301082691047424,Omfg the vape pen is not fulfilling my needs lbvs,Astro726,2015-04-20 23:48:40+00:00
33,590301069164548097,New UK study finds a 28% quit rate among daily users of refillable tank systems. #ecigs #vaping cc: @FDATobacco http://t.co/w9IW0MNOJH,AVABoard,2015-04-20 23:48:36+00:00
34,590301060339736576,"A cool thing about working at a university: bro scream convos on the shuttle re:vaping, needles, not having TB shots #bathemeinhandsanitizer",emilylauracosta,2015-04-20 23:48:34+00:00
35,590300971521171456,Daily vaping best for trying to quit smoking http://t.co/JGtEYb1qyc #News,madman_42,2015-04-20 23:48:13+00:00
36,590300870392336384,Photo: Happy 420 rvelers at Off the Hookah #vape #vapelove #vapefam #vapestagram #vapestrong #ecig... http://t.co/BSCRZKGypn,DOCPHEELGOOD,2015-04-20 23:47:49+00:00
37,590300864893607937,"Happy 420 rvelers at
Off the Hookah
#vape #vapelove #vapefam #vapestagram #vapestrong #ecig… https://t.co/ya3BsWuvLQ",DOCPHEELGOOD,2015-04-20 23:47:48+00:00
38,590300833843171328,vapes_tt #Vapes_TT 4/20 on 4/20 Day 😏 https://t.co/aUcQkNR3B5,siriandavis_,2015-04-20 23:47:40+00:00
39,590300561733476352,Bae came in 😍😍 #vaping #vape #vapor #coilporn #coils #flyshitonly #ejuice #gear #eastcostvapors #vaporking #steadyd… http://t.co/ymtXRKghPO,TheStreetCircus,2015-04-20 23:46:35+00:00
40,590300504887951363,When u see little boys vaping in a middle school parking lot for 4:20 &gt;&gt; #vapelife #vapegangordie,alexmeyerrr,2015-04-20 23:46:22+00:00
41,590300185248604161,"Time is Running out For My Promotion Special #Authors #Coaches #Vape Biz
Discover the Power of Twitter! DM me http://t.co/RJopgsNo3p",AwakenedRadio,2015-04-20 23:45:06+00:00
42,590300183260319745,Still trying to fight this cold even after a 3 hour softball game 💪🏾drank 2 cups of theraflu w/ a handful of cough drops &amp; vaped my room 😞,zariaaik,2015-04-20 23:45:05+00:00
43,590300007552528384,I BOUGHT A FUCKING VAPE,Alpacanator,2015-04-20 23:44:23+00:00
44,590299910957883392,Win a Coffee And 15 Minute Vape at The Vape Lab-Closes 27/04 http://t.co/p3vrVYa6MA,nataliegillham,2015-04-20 23:44:00+00:00
45,590299825263882240,emeraldcoastvaping just went LIVE at [ http://t.co/8Awrzxd9vF ] on @Vapersdottv - #AutoTweet #Live #Video #Vaping #Vapers #ecig #Vapor,LiveOnVapers,2015-04-20 23:43:40+00:00
46,590299739704299522,"Spread the truth about e-cigs.  http://t.co/1Tjci5g1wh
#notblowingsmoke #vape #ecig #vapelife #vapecommunity",OffbeatnUnique,2015-04-20 23:43:19+00:00
47,590299587933442049,\o/ 420 vape it \o/ http://t.co/jPt03bHc9z random games and things,hexytv,2015-04-20 23:42:43+00:00
48,590299539279519744,"Realistic-looking E-cigarettes less likely to help smokers quit, study claims http://t.co/jTOfE2W160 #ecigs #vaping",VapinXsmoker,2015-04-20 23:42:32+00:00
49,590299538398707713,Firefighters say e-cigarette charger caused house fire in Runcorn http://t.co/2ds7yA9NPf #ecigs #vaping,VapinXsmoker,2015-04-20 23:42:31+00:00
50,590299537538813953,You May Be Using the Wrong Type of E-Cigarette to Quit Smoking http://t.co/9gsRkmGahi #ecigs #vaping,VapinXsmoker,2015-04-20 23:42:31+00:00
51,590299536720986113,Local school liaison officers can confiscate up to 15 e-cigs a week http://t.co/8h2D269gke #ecigs #vaping,VapinXsmoker,2015-04-20 23:42:31+00:00
52,590299535978598400,Learning about the e-cigarette: Is vaping as harmful as smoking 'traditional' cigs? http://t.co/VxgkHdIFoM #ecigs #vaping,VapinXsmoker,2015-04-20 23:42:31+00:00
53,590299473185640448,when u sit down and ur vape goes somewhere its not supposed to :) :) :) :) :) :) :) :) :) :) :) :) :) :),CAPSLOCKBROKEN,2015-04-20 23:42:16+00:00
54,590299459864633344,"""What kind of guys are you into?""
Christian dads who vape",notuhmanduh,2015-04-20 23:42:13+00:00
55,590299428939894785,"""if it's not about vape, I don't wanna hear it""",souljaMF,2015-04-20 23:42:05+00:00
56,590299383788240896,i dont vape just to vape... i do it cuz i like having that long rod in my mouth &lt;3,CAPSLOCKBROKEN,2015-04-20 23:41:54+00:00
57,590299106116898818,whenever i see u vaping. http://t.co/nWMJjYdfqo,iamkory,2015-04-20 23:40:48+00:00
58,590298978798940160,#420 #LifeLessons from @madflavor http://t.co/r0N3zCnbDC,DTOM_Vape,2015-04-20 23:40:18+00:00
59,590298971018436608,"""Vape Tricks On Youree... that's gonna be the title of my new mix tape"" - Chelsea Glaspie #ThatShitFireFam",sjay61,2015-04-20 23:40:16+00:00
60,590298882267074561,Kids outside school blazing mad vape today #420vape #MadMan,Neilthediabetic,2015-04-20 23:39:55+00:00
61,590298677194915840,http://t.co/7s47Lm0FIC Winning ticket for the vape pen and cartridge!,GreenLeafSea,2015-04-20 23:39:06+00:00
62,590298537801424897,"Just had a dude yell ""it's the best day of the year"" at me and high five me #420",vape_wizard_311,2015-04-20 23:38:33+00:00
63,590298533951053825,New: Looking for a Vape shop in Conder Green?  Great Lancashire E Cigarette Alternative http://t.co/XJ0PtRJGhn,softsmoke1,2015-04-20 23:38:32+00:00
64,590298395350147072,Blunts papers bongs vapes there's options here,ezwiderxile,2015-04-20 23:37:59+00:00
65,590298281164611584,JUST GOT A NEW VAPE IN HONOR OF 420000000 yolo http://t.co/aHJZjJ20o5,not_adamL,2015-04-20 23:37:32+00:00
66,590298256757764097,Why is Riley looking up vape tricks right now lol,loggvn,2015-04-20 23:37:26+00:00
67,590297795103436800,Winner Announcements &amp; VapeBash 2015 photos – VapnFagan    http://t.co/Vv7C15YVhw #vape #ecig,ecigitesztek,2015-04-20 23:35:36+00:00
68,590297536511913984,And I ain't ever felt no type of way about this living..,juuls___,2015-04-20 23:34:34+00:00
69,590297390688575488,It's 4/20 and I'm still not 100% certain what vaping is.,jonwurster,2015-04-20 23:33:59+00:00
70,590297274229522432,"E-cigarette users trying to quit smoking should vape every day, studies suggest http://t.co/NEbGJxmzAL",OlmecEmpComm,2015-04-20 23:33:32+00:00
71,590297246450737152,a day of hellos (Vape The Grape) &amp; goodbye (Mr Poopy ),LakeOfVape,2015-04-20 23:33:25+00:00
72,590297243204227072,"E-cigarette users trying to quit smoking should vape every day, studies suggest http://t.co/IYQrepd4mo",SocietyGuardian,2015-04-20 23:33:24+00:00
73,590297186518245376,Bro lets go vape its 420,johnsfilmroll,2015-04-20 23:33:11+00:00
74,590297107065491456,4/20 vape it,Chris_dmndd,2015-04-20 23:32:52+00:00
75,590297086500810752,Muffin Man by OneHitWonder Eliquid Review http://t.co/WN2O9X6pCN #vape #ecigs #reddit,ukvaper,2015-04-20 23:32:47+00:00
76,590297085636816896,"N00b here, questions about a recent box mod purchase http://t.co/usx9aIeme2 #vape #ecigs #reddit",ukvaper,2015-04-20 23:32:47+00:00
77,590297084823142401,VAPEDAY LA - Weekly Specials!!!!!!!! http://t.co/FdT2BjCFFp #vape #ecigs #reddit,ukvaper,2015-04-20 23:32:46+00:00
78,590296912873394176,"If I don't #smoke a #blunt, a #joint, a #splif, #vape or rip a #bong hit today then #Hitler wins. Hitler must not win. #Happy420",Spider_Dude,2015-04-20 23:32:05+00:00
79,590296734934380545,Happy 420 EVERYONE 😎 perfect time for that Apple dabs #mmm ✌️ #celebrate #happy420 #vape #vapes… https://t.co/2ZvLJe4TlP,CLDYDazeLiquid,2015-04-20 23:31:23+00:00
80,590296663987621888,PowerVapeNetwork just went LIVE at [ http://t.co/eaogKB8LYi ] on @Vapersdottv - #AutoTweet #Live #Video #Vaping #Vapers #ecig #Vapor,LiveOnVapers,2015-04-20 23:31:06+00:00
81,590296493883527168,"RT @Biguncleshirley ""Started smoking at age 13. Stop smoking &amp; start vaping at age 43. Vaping only thing that worked. #vapingsavedmylife""",MtBakerVapor,2015-04-20 23:30:25+00:00
82,590296401055211520,RT VapeDon: Winner Announcements &amp; VapeBash 2015 photos – VapnFagan http://t.co/CPIaU0f5DN  #Vape #ecig,vapemerch,2015-04-20 23:30:03+00:00
83,590296399880839169,RT ricorick: My First Billet Box! I finally got my Unicorn. #billetbox #billetboxvapor #vape #vapehouston #ratblack http://t.co/vPbkDsXQJn;,vapemerch,2015-04-20 23:30:03+00:00
84,590296397116768256,RT ecr_vape: Bye bye cigarettes : via /r/ecr #vape &gt; http://t.co/nrLBKwKkrI,vapemerch,2015-04-20 23:30:02+00:00
85,590296356641579008,Vaping in the car with the windows up? How dumb are u man,ww97pp,2015-04-20 23:29:53+00:00
86,590296254464315393,"Dry Herb Vape Pen for sale! Comes with case, charger, cleaner and extra mouthpiece! Let me know if interested! http://t.co/OEG7wUdvko",OG_SwaggChamp,2015-04-20 23:29:28+00:00
87,590296245207465984,Check out my @Ookla Speedtest result! What's your speed? http://t.co/yYhWcWyoDq #speedtest,dabreen_vapes,2015-04-20 23:29:26+00:00
88,590295918458449921,Weird mashup vape shop art http://t.co/8J37N82M1T,CyberBrandogg,2015-04-20 23:28:08+00:00
89,590295801026453505,"he's using a vape pen quoting ""4/20""",ddawgg_,2015-04-20 23:27:40+00:00
90,590295726854262784,Shout to @darkinc00 @teddygrams18 @bradley_travis and everyone else who came to my stream today thanks for the help today,Vape_King24,2015-04-20 23:27:23+00:00
91,590295717178126336,Vape gods thinkin theyre apart of 4/20,TammerBaron,2015-04-20 23:27:20+00:00
92,590295640359460866,I finally sit down to answer your questions! #dearabbyvapes #vaping #specialguest http://t.co/ck0RIufLJ1,AbbyHour,2015-04-20 23:27:02+00:00
93,590295635812683776,"Promotion Special is coming to an end soon! Don't miss out #Authors #coaching #Vape Biz
DM me today! http://t.co/eOBNavW33i",RealDonnaDeVane,2015-04-20 23:27:01+00:00
94,590295615562723329,Double Tap $ Tag a friend !!! #vape #vapes #vaping #vapemod  #vapesale #vaporizer  #Vapeoftheday… https://t.co/Ryo6Tk3E5b,GypsyVapes,2015-04-20 23:26:56+00:00
95,590295593647546369,"E-cigarette users trying to quit smoking should vape every day, studies suggest - The Guardian http://t.co/VcXARcq0tu",NewsdeskHEALTH,2015-04-20 23:26:51+00:00
96,590295568422961152,"Your E-Cig, isn't a vape.",WoahIsBree,2015-04-20 23:26:45+00:00
97,590295470578085888,so many vapers at this Kevin Hart show,furbybridgers,2015-04-20 23:26:22+00:00
98,590295369398923265,"seeing so, so many Sponsored Tweets™ advertising 4/20 sales on vapes; i declare that Weed Is Dead . . . Drugs Have Sold Out; everybody",108,2015-04-20 23:25:57+00:00
99,590295353645236224,Teenager taking huge vape rips in honor of 4/20 #Vapelife #vapetricks #420blazeit https://t.co/sE0xtgXm8R,NotBigDmo,2015-04-20 23:25:54+00:00
100,590295265132740608,Wish my rents would let.me vape in my room lol,hayden_doggett,2015-04-20 23:25:33+00:00
101,590295210984275968,Hello anxiety attack. Would you please fuck off? I've got work to do and by work I mean sit around and get paid to Vape.,Mikeman380,2015-04-20 23:25:20+00:00
102,590295209470210048,"*Vapes some PURPLE KUSH and makes a #CLOUD

Its 4/20 2015 and hear is DEEP PURPLE 

#PERFECT  #WORDS for STRANGERS

https://t.co/t0QOQVoovH",The420Eyebaal,2015-04-20 23:25:19+00:00
103,590295110698541056,Winner Announcements &amp; VapeBash 2015 photos – VapnFagan http://t.co/k8YPp2CY3y #Vape #ecig,VapeDon,2015-04-20 23:24:56+00:00
104,590295102834114560,who's tryna get VAPED out???,gllllooww,2015-04-20 23:24:54+00:00
105,590294987562180608,We are excited to announce that Beyond Vape Davis Sq is now carrying Stash E-liquids. Seven amazing… https://t.co/o1RcgtLtRv,beyondvapebos,2015-04-20 23:24:26+00:00
106,590294968545239040,Temp control is my SHIT. #VAPELIFE #VAPE #PORN #THANKSSMOK,VapingPorn,2015-04-20 23:24:22+00:00
107,590294885539848192,Vapin for life! #vaping #vapelife #vapingsavedmylife #vap# http://t.co/iL0kkqTRJt,kilgore_cody,2015-04-20 23:24:02+00:00
108,590294883287597056,Pefect day to be at the tidepools and vape on Looper. #vaping #calivapers #beachvapes #anml #looper… https://t.co/jX3KxSPonm,VapeTales,2015-04-20 23:24:01+00:00
109,590294882448756736,Dry Herb Vape Pen for sale! Hit me up!!!!! #420 where my stoners at??! http://t.co/Jg1q4jxYb4,OG_SwaggChamp,2015-04-20 23:24:01+00:00
110,590294828996427776,I'm just gonna go VAPE,gllllooww,2015-04-20 23:23:49+00:00
111,590294510250274816,Morning selfies be like... #vape #vapelife #vapers #vaping2015 #vapingsavedmylife #vaping http://t.co/To96hGeiVg,UnlimitedVaper,2015-04-20 23:22:33+00:00
112,590294152593731584,"joe_beast_vape show Instagram some great Treasure Coast scenery

""Dat get it, and box mod though""… https://t.co/oB0MTPZLuB",runthevape,2015-04-20 23:21:07+00:00
113,590294065125654528,"New post: ""E-cigarette users trying to quit smoking should vape every day, studies suggest"" http://t.co/La8Ep4O8oa",AsianSexyMassag,2015-04-20 23:20:46+00:00
114,590294021723070464,A little coilporn thanks to vaping_librarian  made me a little helix wire to throw in the nectar 9… https://t.co/j2PklLpPEP,ftviruet,2015-04-20 23:20:36+00:00
115,590293946670125056,"Looking for a good place to #vape? try out Spud's Pizza Parlor in Tacoma, #WA! #vapefriendly",MBV_Wholesale,2015-04-20 23:20:18+00:00
116,590293909995139072,"Dry Herb Vape Pen For Sale! Comes with charger, cleaner, extra mouthpiece, and case! Hmu if… https://t.co/9FzCONmZpG",OG_SwaggChamp,2015-04-20 23:20:09+00:00
117,590293717140905984,"Vaping THC fused juices, so much better than smoking, i still do both tho.",LilBitOnTuesday,2015-04-20 23:19:23+00:00
118,590293713416376320,"""I'm literally drinking vape""",falloooon,2015-04-20 23:19:23+00:00
119,590293706508525569,Tonight On #VapeTV @8pm est Terraphon #JungleRulesVaping @9 RoarVapor @10 Ofortuna #GeekVaping @11 Vaping With The Deeds @12 CrashVapes,BlacksmithPro,2015-04-20 23:19:21+00:00
120,590293676485713920,New: Looking for a Vape shop in Whitmore?  Great Dorset E Cigarette Alternative http://t.co/F8OtpAiqM8,softsmoke1,2015-04-20 23:19:14+00:00
121,590293652263440384,Bet he can't do cool vape tricks smh,ToothShaman,2015-04-20 23:19:08+00:00
122,590293543131873280,#focusgroup : Focus Group for e-Cigarette users/vapers - $100 (60 minutes) (denver) http://t.co/YFfyckGS9a,NewFocusgroups,2015-04-20 23:18:42+00:00
123,590293509325791232,My 67 year old boss started vaping wax out of his e-cig today.,Cam_Is_Like,2015-04-20 23:18:34+00:00
124,590293505974513664,#focusgroup : Focus Group for e-Cigarette users/vapers - $100 (60 minutes) http://t.co/ScSmwWKQ7f,NewFocusgroups,2015-04-20 23:18:33+00:00
125,590293485632249857,"I've been vaping for 2 hours and I haven't executed anyone yet so I might give this a proper good shove tomorrow. 

Goodnight.",Socially_Rich_,2015-04-20 23:18:28+00:00
126,590293479298699264,#focusgroup : Focus Group for e-Cigarette users/vapers - $100 (60 minutes) http://t.co/kLXSnjPM66,NewFocusgroups,2015-04-20 23:18:27+00:00
127,590293411955023872,"The Guardian E-cigarette users trying to quit smoking should vape every day, studies suggest The Guardian Many… http://t.co/NeuEXtCaR3",ShannaIDK,2015-04-20 23:18:11+00:00
128,590293293147168768,"E-cigarette users trying to quit smoking should vape every day, studies suggest: Researchers find... http://t.co/dnclaigFTv -sanjayator.",krinkzco,2015-04-20 23:17:42+00:00
129,590293200402788353,"If you're new to #vaping, it can be easy to get lost in all the jargon, so we've created this handy glossery for ya. http://t.co/R3ZZHQmUXt",ZeusEJuice,2015-04-20 23:17:20+00:00
130,590293046178160640,ThruTheFog just went LIVE at [ http://t.co/a9dgnj7E0M ] on @Vapersdottv - #AutoTweet #Live #Video #Vaping #Vapers #ecig #Vapor,LiveOnVapers,2015-04-20 23:16:43+00:00
131,590292881610420226,Cool vape pen kid,ToothShaman,2015-04-20 23:16:04+00:00
132,590292881509867520,off to bed i go with m’ #milkandhoney… Need to try me some more of t’ @CosmicFogVapors range… 💞✌🏼️💨 #vape #vapeaddict #vapegirl,ionwen,2015-04-20 23:16:04+00:00
133,590292803067912195,4/20 VAPE IT!,KID_SWAG_KILLA,2015-04-20 23:15:46+00:00
134,590292762009980928,RT @ecigitesztek: Explosion In Teen #Ecig Use A Good Thing        http://t.co/BmYjkgazx1 #vaping http://t.co/KiY252zyMb,Vaporpos,2015-04-20 23:15:36+00:00
135,590292739486572544,New York Times gets trolled in article on vaping teens http://t.co/sFuAbM12R6,ecigtimesreview,2015-04-20 23:15:30+00:00
136,590292664614002688,IM SO PISSED I BROKE MY VAPE 😩😡,xCourtney13,2015-04-20 23:15:13+00:00
137,590292570695028736,"To vaping, still mad about you hacking my youtube 3 years ago, and #SavagedBuddy Savaged 2 maybe",xCzarr,2015-04-20 23:14:50+00:00
138,590292521420464128,Study - Should Vapers Worry About the Flavorings in E-Liquid? http://t.co/RgdRr94sXZ #ecigs #vaping,markriseley,2015-04-20 23:14:38+00:00
139,590292292319121408,VapeOnTV just went LIVE at [ http://t.co/dUE6ovOVOl ] on @Vapersdottv - #AutoTweet #Live #Video #Vaping #Vapers #ecig #Vapor,LiveOnVapers,2015-04-20 23:13:44+00:00
140,590292256206237696,"Shout out to all the kids who don't smoke weed, but faked on social media with vapes instead lol",Airman_Gymrat,2015-04-20 23:13:35+00:00
141,590292165902741505,Getting a new tank finally so I can go back to vaping. Hooray.,ChaoticTimelord,2015-04-20 23:13:14+00:00
142,590292064597741570,My teacher was vaping in my 5th period😂,kristajsmart,2015-04-20 23:12:49+00:00
143,590291699936710656,How I feel vaping Drip e-liquid candy apple. #Vape http://t.co/JdDtasUa2w,IshaBoiiMatt,2015-04-20 23:11:23+00:00
144,590291686586126337,And make sure to share on Facebook! #tikihutvapes #VapeLife #Vape #Vaper #vapor #Ejuices #Eliquids http://t.co/SmaJGL8KAO,TheTikiHutVapes,2015-04-20 23:11:19+00:00
145,590291660636102656,Do any of my followers have vape pens?,_SouthernAnon_,2015-04-20 23:11:13+00:00
146,590291462258036737,Don't know why they wouldn't just come in lol #creepers @ Exclusive Vapes https://t.co/Xyh4Q6DHxw,ExclusiveVapes,2015-04-20 23:10:26+00:00
147,590291423112474625,"Picked up a Vape today, officially smoking my last cigarette on Wednesday. #WishmeLuck #VapeHype #GoatRodeo",TheGameCase,2015-04-20 23:10:17+00:00
148,590291377990184961,"Don't Forget that this Wednesday is our Vape &amp; Vino Event!! 
 Come on down and enjoy our vaporizers &amp; accessories with your Choice of Wine!",MDCigars,2015-04-20 23:10:06+00:00
149,590291237963370496,"Type, frequency of e-cigarette use linked to quitting smoking http://t.co/TrfjSFvQcX #ecigs #vaping",VapinXsmoker,2015-04-20 23:09:32+00:00
150,590291237061591040,"Realistic-looking E-cigarettes less likely to help smokers quit, study claims http://t.co/WULSdzen4g #ecigs #vaping",VapinXsmoker,2015-04-20 23:09:32+00:00
151,590291236218482688,"E-cigarette users trying to quit smoking should vape every day, studies suggest http://t.co/LDyAyE42Bz #ecigs #vaping",VapinXsmoker,2015-04-20 23:09:32+00:00
152,590291235216068608,Learning about the e-cigarette: Is vaping as harmful as smoking 'traditional' cigs? http://t.co/V4ifblfQ2y #ecigs #vaping,VapinXsmoker,2015-04-20 23:09:32+00:00
153,590291234494681088,Clark Co. Board of Health eyes e-cig ban in some public places http://t.co/PH41eAw8SI #ecigs #vaping,VapinXsmoker,2015-04-20 23:09:32+00:00
154,590291077598351360,#focusgroup : Focus Group for e-Cigarette users/vapers - $100 (60 minutes) http://t.co/pRSLubDJHh,NewFocusgroups,2015-04-20 23:08:54+00:00
155,590291077535371264,#focusgroup : Focus Group for e-Cigarette users/vapers - $100 (60 minutes) http://t.co/p3VBBLP4yj,NewFocusgroups,2015-04-20 23:08:54+00:00
156,590290883871813632,"TTW Today's News: E-cigarette users trying to quit smoking should vape every day, studies suggest  http://t.co/BUMzvmeZnt",TypewriterIntl,2015-04-20 23:08:08+00:00
157,590290767987527680,Checking out @KellerMusician Vape with @joeharris818 &amp; @KOly1014 bc it seems appropriate,iBegUcallAtune,2015-04-20 23:07:40+00:00
158,590290765118443520,"Even with a bit of leftover bday money, two new vapes just this month basically means I've already dipped into next year's 'vape budget'  ;)",Maya_Mayhem,2015-04-20 23:07:40+00:00
159,590290709778862081,I honestly think vape pens are dumb 😅,justcallmeLib,2015-04-20 23:07:26+00:00
160,590290676228599808,my mom just tried to get me to vape,ursifors,2015-04-20 23:07:18+00:00
161,590290485333200896,"Happy 4/20 friends!
Get over to RCP today to get your hands on our new line of vape cartridges, Dark Heart Alchemy! @DHAVapes @rcp420",DHAVapes,2015-04-20 23:06:33+00:00
162,590290485312270338,"Happy 4/20 friends!
Get over to RCP today to get your hands on our new line of vape cartridges, Dark Heart Alchemy! @DHAVapes @rcp420",DHNClones,2015-04-20 23:06:33+00:00
163,590290449157394432,"Am I really going to the vape shop 
Am I really gonna buy a mod
What am I doing with my life",JustACountryMan,2015-04-20 23:06:24+00:00
164,590290392005758977,I'm done with cheap vapes. They suck man. lol,Felocious_Mario,2015-04-20 23:06:11+00:00
165,590290325530218496,there are two COPS sitting in purple onion while people are VAPING MARIJUANA a block away ..... @BarackObama look what u've done,ejw3athers,2015-04-20 23:05:55+00:00
