,TweetID,TweetContent,TweeterUsername,TweetDatetime
0,753016064783491072,I feel like I'm at a vape convention rn.,sunwlrse,2016-07-12 23:59:54+00:00
1,753015935720566784,IPV400 In Stock Now at https://t.co/TRNrrw6SYE via /r/vape_deals https://t.co/ccsleWC1M5 https://t.co/6u5YbfwSjb,VapingLove,2016-07-12 23:59:24+00:00
2,753015904292569088,Snoop Dogg... https://t.co/668wKJ3k8c #Dogg #Review #Snoop #Unboxing #Vape #vaporizer,TheCannabisWiki,2016-07-12 23:59:16+00:00
3,753015824802123776,Tic or Tac Vape Juice https://t.co/iWDEZ4MAhD #shopping #eliquid #vaping #vape https://t.co/A7se2ThAMn,4_Fox_Sakes,2016-07-12 23:58:57+00:00
4,753015764685381632,You'll never be as cool as the kid sitting in the back of my class with a vape pen doing smoke tricks,Wainscott9,2016-07-12 23:58:43+00:00
5,753015399558643712,Is It really weed or just someone vaping. #IHateTheKids,skot1107,2016-07-12 23:57:16+00:00
6,753015397285302272,I liked a @YouTube video from @faze_rain https://t.co/u5rJDwLYOW INTRODUCING DARTH VAPER ft. Vape Lord Nord,BinggTheBitxh,2016-07-12 23:57:15+00:00
7,753015303848755201,There's another €170 gone a new vape machine and I barely use the one I have that is just ridiculous someone take my bank card please,Martini_Walsh,2016-07-12 23:56:53+00:00
8,753015244197421060,I love to vape,matthewlake95,2016-07-12 23:56:39+00:00
9,753015175305760768,"Crown 2 tank by myuwell! 
Top fill, quartz glass, high wattage, what more could you ask for?! @… https://t.co/gmdV9KlTm7",STOP_N_VAPE,2016-07-12 23:56:22+00:00
10,753015131081105408,circuscookie is here and its amazing! Animal Cookies covered in frosting and sprinkles! @ StopNvape https://t.co/KW0CUPHbFm,STOP_N_VAPE,2016-07-12 23:56:12+00:00
11,753015092824768512,"Strawberry Wafers by @stixeliquid is here, definitely becoming a shop favorite fast! @ StopNvape https://t.co/181v1QCR0e",STOP_N_VAPE,2016-07-12 23:56:03+00:00
12,753014883512356864,"CASAA needs a million vapers! Tell your friends - it's free and more members = more power. Please donate too!
https://t.co/1YHtajl4xb",Vaping360,2016-07-12 23:55:13+00:00
13,753014686145138688,Hulk Tears by mightyvapors is inStock!! Sour Watermelon apple candy with a dash of berries🔥🔥 @… https://t.co/tsYzivMY6C,STOP_N_VAPE,2016-07-12 23:54:26+00:00
14,753014549876310016,"People are talking about Pokémon Go in my local vape shop, trying not to cave",NataTheScribe,2016-07-12 23:53:53+00:00
15,753014503718068224,My eyes always get so red when I medicate. What about yours?👀🍁🔥 #BndlsVapes #HigherLVL #Vape #Cannabis #Weed #THC https://t.co/enyVL55KAq,BNDLSTECH,2016-07-12 23:53:42+00:00
16,753013994365988864,Thanks for #vape and #vaping https://t.co/CxJxPxuKXN,Sul6anALrasheed,2016-07-12 23:51:41+00:00
17,753013833069887489,I liked a @YouTube video from @faze_rain https://t.co/DcKoyxhF9F INTRODUCING DARTH VAPER ft. Vape Lord Nord,cancerytcontent,2016-07-12 23:51:02+00:00
18,753013632808681476,if she wants me to kill myself..... my vape https://t.co/1KzNdBik4X,amcgmt,2016-07-12 23:50:15+00:00
19,753013617478467585,X Tank 4.0 https://t.co/wBAL45xyzN https://t.co/ZNHXUNKGEX &lt;- #DC #dcgram #DC #Vaping #eJuice #VapePen #Asthma #HomeDecor #Bitstamp,VAPEPENstore,2016-07-12 23:50:11+00:00
20,753013590089695232,Palmer just tried to tornado some girls vape at this concert I'm done 😂😂😂,mallorystapler,2016-07-12 23:50:04+00:00
21,753013584595152897,"Suggested dry herbs to vape out of your dry herb vape, peppermint, damiana, thyme, lavender, green tea, chamomile, it's not for weed , fucks",ABITMUCHINNIT,2016-07-12 23:50:03+00:00
22,753013331825352704,So much vaping going on at the pool rn. #coolkidsofalisoviejo,manda_smith7,2016-07-12 23:49:03+00:00
23,753013317870891009,"""Cloudy with a chance of vape?"" -@kylethebasedgod",allysonbrooke_,2016-07-12 23:48:59+00:00
24,753013295607451648,Buck-a-pack cigarette tax hike eyed to fund Pennsylvania budget https://t.co/J1b1zZlox2 #ecigs #vaping,VapinXsmoker,2016-07-12 23:48:54+00:00
25,753013293766156288,West Allis bans e-cigarette smoking where tobacco smoking is banned https://t.co/qsNpInpb0y #ecigs #vaping,VapinXsmoker,2016-07-12 23:48:54+00:00
26,753013223243341824,I wonder if the narcs that hide in the crowd at The Jake to bust millennials vaping wax are going to walk out too.,WayneEmbrysKids,2016-07-12 23:48:37+00:00
27,753013082344026112,I liked a @YouTube video from @faze_rain https://t.co/FEAukaV5E9 INTRODUCING DARTH VAPER ft. Vape Lord Nord,MambaDoesntMiss,2016-07-12 23:48:03+00:00
28,753012964349870080,French Dude par Vape Breakfast Classics https://t.co/F21YttZsTh #ecig https://t.co/GIi39Fh47q,VaponewsFR,2016-07-12 23:47:35+00:00
29,753012925019717633,"dad: ""stay away from the Pokemon around the vape store""",elainiegrace,2016-07-12 23:47:26+00:00
30,753012923081961472,Epic #vape giveaway! Enter to win a Wotofo #TrollV2 RDA or #Conqueror RTA from @v_a_p_e &amp; @wotofoofficial. #VapeLife https://t.co/23QGIUomj0,LK_Coconut,2016-07-12 23:47:25+00:00
31,753012814659350529,I liked a @YouTube video from @faze_rain https://t.co/p4hielxHCX INTRODUCING DARTH VAPER ft. Vape Lord Nord,tannermayess,2016-07-12 23:46:59+00:00
32,753012775950123008,I liked a @YouTube video from @faze_rain https://t.co/vgSCyjKhAv INTRODUCING DARTH VAPER ft. Vape Lord Nord,aT_TooL,2016-07-12 23:46:50+00:00
33,753012640042057728,"Right Here: https://t.co/qnCI9p5IDC
#vaping #vape #vapefam #vapelife https://t.co/dyn2F4SYUF",dude_vape,2016-07-12 23:46:18+00:00
34,753012637382938625,7 hours to enter! Oumier Gragas #RDTA #Giveaway https://t.co/BlbVhp0Hug #vapestuff #vape #DIY #win,LK_Coconut,2016-07-12 23:46:17+00:00
35,753012567728087040,Very #goodvaping #goodvapes #vape #e_cigarette #vapebabe #vapebabes #ladyvapers #vapegirls… https://t.co/QVXhfo5waR,alvaro2carvalh1,2016-07-12 23:46:01+00:00
36,753012554016907264,"We can print vape style cards in the shape of mods, tanks, battery's,  metal cards for VIPs, air fresheners that smells of your juice",digitalNotts,2016-07-12 23:45:57+00:00
37,753012481098936320,Might make a more official bandcamp too,juul_lanyards,2016-07-12 23:45:40+00:00
38,753012472039079936,My bus driver is vaping I'm so done,OnlyYasMid,2016-07-12 23:45:38+00:00
39,753012314396364801,"❤️💛💚💙💜 Vape Bands are awesome!! They protect your tanks and mods, add extra grip and a little… https://t.co/EFCrxMjuQS",sdvapordolls,2016-07-12 23:45:00+00:00
40,753012160519770112,Chinese Pharmacist's E-Cigarette Drags Reynolds Into Vaping War – Bloomberg https://t.co/u7ccPIyZEs https://t.co/XKcMrHlOjt,neo_vape,2016-07-12 23:44:24+00:00
41,753011950557143041,Vaping Watch 5000 Like Giveaway - 3 Winners - Enter NOW!! #vapingwatch #vape #vapelife  https://t.co/CDkgpiWBMa,LK_Coconut,2016-07-12 23:43:33+00:00
42,753011737117519872,I liked a @YouTube video from @faze_rain https://t.co/JJUVY3oNGv INTRODUCING DARTH VAPER ft. Vape Lord Nord,The_MU_,2016-07-12 23:42:43+00:00
43,753011703655182336,LIVE on #Periscope: Random #talk #vape #bored https://t.co/ZNucJMpCu2,Alex_mua_makeup,2016-07-12 23:42:35+00:00
44,753011656628793344,"What is your favorite flavor for the VG high line? 
Let us know! https://t.co/gGFrpIYUKf  #vapeon #vapelife #vape https://t.co/omG4PAZZKt",USVAPECO,2016-07-12 23:42:23+00:00
45,753011630980620288,Tonight On #VapeTV @8pm est Flitzanu #FlitxFix XL @10 Skruff #ShotFirst @11 Vaping With The Deeds @12 Tunes n Chat #vaping #ecigs #VapeChat,BlacksmithPro,2016-07-12 23:42:17+00:00
46,753011593160654848,Silver screens is dead finna just upload a batch of songs tomorrow w album art by @sylvia_atwood,juul_lanyards,2016-07-12 23:42:08+00:00
47,753011527397969920,LIVE on #Periscope: Random #talk #vape #bored https://t.co/FBvb4QFse0,Alex_mua_makeup,2016-07-12 23:41:53+00:00
48,753011412218163201,"when me and macko are out catching Pokemon and someone in a car filled with vape screams ""POKEMON""",paige__cooper,2016-07-12 23:41:25+00:00
49,753011381864062976,All you see in traffic on highway one is vape clouds 🌪🌪,Cpets_97,2016-07-12 23:41:18+00:00
50,753011247952515072,for the last time kanade I'm not gonna vape with you,jougasak_ebooks,2016-07-12 23:40:46+00:00
51,753011103572103172,"#VapeMail Status: On time! All orders from 7/11 are in transit!
25% off with code CCV25

https://t.co/C7oQbWY0bW

#ecig #ejuice #vaping",CCVapes,2016-07-12 23:40:12+00:00
52,753011072433401856,The Boy in the Striped Pajamas  https://t.co/Ldn7iwwwO9  @joangueruela2 #vape #myFirstTweet,IdjhonRasy,2016-07-12 23:40:04+00:00
53,753010717113085960,"More Nonsmoking Teens Inhaling Flavored Nicotine Through Vaping, via @nytimes https://t.co/ATCpU2AprP",jyeh29,2016-07-12 23:38:39+00:00
54,753010595654500352,I liked a @YouTube video from @faze_rain https://t.co/WZGlMfLrCa INTRODUCING DARTH VAPER ft. Vape Lord Nord,JaydenMorrison7,2016-07-12 23:38:10+00:00
55,753010269723459584,The RA just had to tell Joe Gaeta he can't vape in the room. My life is complete.,_magnant_,2016-07-12 23:36:53+00:00
56,753010168191934464,So @mikaylax is literally hilarious and she called my vape a mouth fedora. Ive almost peed twice from laughing,_TakedownTV,2016-07-12 23:36:29+00:00
57,753009991351607296,If I start vaping will I get all the bad bitches?,bb0ychun,2016-07-12 23:35:46+00:00
58,753009970216566784,"Tastes like strawberries? Yes, tastes ice cold? This refreshingly Icy cool strawberry #vape wont disappoint you! https://t.co/jC71H2DDpW",CentralVapors,2016-07-12 23:35:41+00:00
59,753009859230965760,Visit https://t.co/cE0KRIXzzJ today and try some of our awesome flavors! #vape #alldayvape #vapemichigan #handcheck https://t.co/BU9VBz1DQo,Michmoonshine,2016-07-12 23:35:15+00:00
60,753009811835457536,I'll tell you how tired I am tonight... I just tried to go to the toilet sitting on a child seat #tightsqueeze 😴🦁💨💨,peterm81_vape,2016-07-12 23:35:04+00:00
61,753009796257812480,I liked a @YouTube video from @faze_rain https://t.co/AOWM06pyLj INTRODUCING DARTH VAPER ft. Vape Lord Nord,juicyman22,2016-07-12 23:35:00+00:00
62,753009759444426752,This nigga got my whole car smelling like green tea by vaping in here smh.,RAF_JAP,2016-07-12 23:34:51+00:00
63,753009425007448064,fedora? more like vape helmet,mel0dypalmer,2016-07-12 23:33:31+00:00
64,753009159445049345,I could be doing hard drugs but instead I vape. TELL THE AUTHORITIES,GodBlessMurrrka,2016-07-12 23:32:28+00:00
65,753009159109435392,We get it you vape,BrettLaBelle,2016-07-12 23:32:28+00:00
66,753009087554719744,My heart as soon as I opened the door a man was outside an snow he's at the top of the road just standing vaping JUST LEAVE,orlaithplunkett,2016-07-12 23:32:11+00:00
67,753009057045241856,Epic #vape giveaway! Enter to win a Wotofo #TrollV2 RDA or #Conqueror RTA from @v_a_p_e &amp; @wotofoofficial. #VapeLife https://t.co/OYgjVnnVcK,kalss67,2016-07-12 23:32:04+00:00
68,753008972580302848,"Admit it, you're either vaping or playing Pokémon GO right now",TemeculaBS,2016-07-12 23:31:43+00:00
69,753008900723519488,Teenage Smoking: Teens Who Supposedly Would Not Have Not Considered Smoking Are Now Vaping - Parent Herald https://t.co/6qWlSx2CyF,notobacco55,2016-07-12 23:31:26+00:00
70,753008782423183360,"I used to specify ratio of ejuice as PG/VG but since the 2 numbers add up to 100, I just use VG percentage. #vaping #ecigs",DyNama,2016-07-12 23:30:58+00:00
71,753008675753787392,"A new Evic VT, Tesla stealth and finally an SX mini Q class in the house.

Look  - https://t.co/QqtKF9D5yk
#vaping https://t.co/KFacw80rId",VaporAuthority,2016-07-12 23:30:33+00:00
72,753008559722524673,What kind of #Ecigs do you vape?,EcigCaddy,2016-07-12 23:30:05+00:00
73,753008461575630848,"Which of the Vaping Birdy line is your favorite?
Join the flock and stock your shop with Vaping Birdy now, email... https://t.co/4Hu7aLfTdi",vapingbirdy,2016-07-12 23:29:42+00:00
74,753008410799505410,win some amazing Wotofo #vape gear from @v_a_p_e &amp; @wotofoofficial. #TrollV2 #Giveaway https://t.co/Nc4aJzPlqh,DonovaneLiz,2016-07-12 23:29:30+00:00
75,753008351387193345,I liked a @YouTube video from @faze_rain https://t.co/3eE1vwAwLd INTRODUCING DARTH VAPER ft. Vape Lord Nord,orzoeatswilly,2016-07-12 23:29:15+00:00
76,753008204934623232,"Check out @FreeMyApps, a quick and easy way to earn free gift cards. https://t.co/yq9AqH5lWU",Andre_VaPe,2016-07-12 23:28:40+00:00
77,753008197733085184,just found out there's a fuckin lasagna flavored vape,hellmanns666,2016-07-12 23:28:39+00:00
78,753008071463604225,I liked a @YouTube video from @faze_rain https://t.co/tcTfxsWs1Q INTRODUCING DARTH VAPER ft. Vape Lord Nord,_cool6b_,2016-07-12 23:28:09+00:00
79,753007997165637632,Odesza makes my heart hurt omfggggg 😩💘,G_juuls,2016-07-12 23:27:51+00:00
80,753007877191766016,just saw a man vaping into his girlfriend's face smh have some respect,heyitsallcool,2016-07-12 23:27:22+00:00
81,753007820405035009,SD VAPERS ----- THE BOYS ARE TAKING OVERRRRRRTDT #KOLABOTakeoverTour with @djneato @lesteezy @khosmo831... https://t.co/sUaEkeGrbZ,vape3one,2016-07-12 23:27:09+00:00
82,753007804139528193,SD VAPERS ----- THE BOYS ARE TAKING OVERRRRRRTDT #KOLABOTakeoverTour with @djneato lesteezy… https://t.co/AUXxmufira,vape3one,2016-07-12 23:27:05+00:00
83,753007700045287424,"just sitting here, vaping, pretending like I'm a bruh",303snowflake_,2016-07-12 23:26:40+00:00
84,753007356670251008,Tired of the tedious process of cleaning your vape gear then @coilmasternet's CM-800 Ultra Sonic Cleaner is for you https://t.co/q9wkMwjfuA,BadAssVapor,2016-07-12 23:25:18+00:00
85,753007218954338304,I think im going to Vape stop today I need to get my batteries wrapped 🙄,_servnstaxx,2016-07-12 23:24:45+00:00
86,753006965287165952,When you forget to fill your juice tank to your vape and your at a concert 😓,yhglowe,2016-07-12 23:23:45+00:00
87,753006859720724480,We get it u vape  https://t.co/2zxR8hPzoU,__zxnna,2016-07-12 23:23:20+00:00
88,753006797946957824,Blue Label Elixirs fully stocked at our Rowland Heights/Industry location. And its on sale this… https://t.co/CjoMRiTTyi,U_Vape,2016-07-12 23:23:05+00:00
89,753006787629027328,Plasa vape amaaaaan,erikaisml,2016-07-12 23:23:03+00:00
90,753006738102558720,"We get it, you vape https://t.co/8YIHwuiEPQ",lugubriousjuan,2016-07-12 23:22:51+00:00
91,753006624449658881,Why vaping can't survive. https://t.co/QKBIFKFfHV via @TheMITBrickman,TStalung,2016-07-12 23:22:24+00:00
92,753006583316094977,i found his vape stash,ekubo_en,2016-07-12 23:22:14+00:00
93,753006413362917376,"To many of my family have lost their lives from cigarettes Thank heaven's I found vaping before I became a statistic

 #vapingsaveslives",rdc4800,2016-07-12 23:21:33+00:00
94,753006303782600704,For every vaper don't use cosmicvapecloud cause this is the kind of guy that runs it @ecigaspire https://t.co/mtHAsMBHYw,GlennPearson11,2016-07-12 23:21:07+00:00
95,753006254210113536,I liked a @YouTube video from @faze_rain https://t.co/8CJ6HTqwj6 INTRODUCING DARTH VAPER ft. Vape Lord Nord,oChuyyy,2016-07-12 23:20:55+00:00
96,753006146647121920,When VAPE is life but so is Pokemon Go https://t.co/qSbxRzVDpS,kelbey_e,2016-07-12 23:20:30+00:00
97,753005992263245824,Enter our #Contest by posting a picture with your current #vape (whatever it is) and tell … https://t.co/COvonC8DTD https://t.co/aoawTjpWv5,DaVinciVape,2016-07-12 23:19:53+00:00
98,753005965142855681,Enter our #Contest by posting a picture with your current #vape (whatever it is) and tell us why… https://t.co/6Lgk4GKpn0,DaVinciVape,2016-07-12 23:19:46+00:00
99,753005915981254656,Enter to win a brand new Smok TFV8 ! #vape #vapefam #vapenation #ejuice #giveaway #vapegiveaway #vaping #ecig #TFV8 https://t.co/81SZuc8sO1,LK_Coconut,2016-07-12 23:19:35+00:00
100,753005874499780608,No one gets it. Vaping @ the dog park is sensational https://t.co/U9S9edhR9j,changethegreat,2016-07-12 23:19:25+00:00
101,753005694383783941,New #vapegear @ #acevaper #vapeshop #toronto RX200S in 5 colours! https://t.co/Pueln1DcuZ #vape #vapeon #vapefam https://t.co/au3dNerA1X,AceVaper,2016-07-12 23:18:42+00:00
102,753005559352176640,What the shit!? Level 601? Vape Naysh y'all https://t.co/eSXRMYunDV,RoadTo9K,2016-07-12 23:18:10+00:00
103,753005171387445248,Epic #vape giveaway! Enter to win a Wotofo #TrollV2 RDA or #Conqueror RTA from @v_a_p_e &amp; @wotofoofficial. #VapeLife https://t.co/xwaz1tXMBm,VladGive,2016-07-12 23:16:37+00:00
104,753005147731755009,"Alert - #Vaping Banned in All Alpine, Utah Parks - https://t.co/0fzRwoYrYd
#vapenews",ecig,2016-07-12 23:16:32+00:00
105,753005089879691264,"CBD HEMP E-Liquid Clearance
--FREE VAPE PENS----FREE CBD HONEY STIX--
Nature's Emporium https://t.co/hJXKgedonR via #deals #ebay #freevape",medmindedlabs,2016-07-12 23:16:18+00:00
106,753004778096103424,A new study in teens suggests vaping appeals more to new users than people trying to kick the habit. https://t.co/xWVHO97WEj,ConsumerReports,2016-07-12 23:15:03+00:00
107,753004625486229504,head on over to Tha Bong Shop instagram page to win a free Magic-Flight portable vape link in in comments https://t.co/CzJEdQV3gZ,ThaBongSHop,2016-07-12 23:14:27+00:00
108,753004524046983169,Vape shop or video game... https://t.co/BOwOdeUd7t,sunchbunny,2016-07-12 23:14:03+00:00
109,753004464462700544,"watching nerds vape and play pokemon outside the rec, i'm going to buy some eggs.",tomking793,2016-07-12 23:13:49+00:00
110,753004290751422464,The government wants the public to rat on vapers. Their greed is disheartening! #nomorecasualties #notblowingsmoke https://t.co/dbU5Qb3iFa,CloudCompMaps,2016-07-12 23:13:07+00:00
111,753004233792815106,I liked a @YouTube video from @faze_rain https://t.co/xMHJ4IP6Qi INTRODUCING DARTH VAPER ft. Vape Lord Nord,PixiStiickz,2016-07-12 23:12:54+00:00
112,753004196262125568,"Lost Vape DNA200, SMY SDNA75 and SX Q Giveaway, and multiple Winners!  https://t.co/5fYEQjBOyp",binoyalvarez26,2016-07-12 23:12:45+00:00
113,753004104952057856,I was dripping and driving and then dropped my vape right on my nuts.,jasonaloria,2016-07-12 23:12:23+00:00
114,753004053714628609,Getting away for me is Vaping @ the Dog Park,changethegreat,2016-07-12 23:12:11+00:00
115,753004002481090560,Witnessed: vaping obese highschool zombie j-walker on #PokemonGO almost killed by Ford F250 adorning confederate flag. The end is nigh.,b3nmo,2016-07-12 23:11:58+00:00
116,753003775745556480,vape me up (vape 👏 me 👏 up 👏inside),rakel_____,2016-07-12 23:11:04+00:00
117,753003694698790913,"We get it, you vape https://t.co/QN2V9gobal",J_as_in_jaycup,2016-07-12 23:10:45+00:00
118,753003690731139073,"Being with Tyler means having to compliment his vape clouds 10 times a day, every day.",kelseyyball,2016-07-12 23:10:44+00:00
119,753003617657974784,Need a charger for my vape 😫,YaBoySP_5,2016-07-12 23:10:27+00:00
120,753003607138721792,"There' nothing like a good late night vape! 

#Vaping #Vapelife #SmokeFree #VapingSavesLifes #VapeFoward #Stout... https://t.co/K5F0lFInyb",pjfonseca,2016-07-12 23:10:24+00:00
121,753003601308508160,WE ALWAYS VAPE ON TUESDAYS,sorryimnita,2016-07-12 23:10:23+00:00
122,753003577426186241,shame I gated aqeeb when he started his vape life but now I'm actually smoking this vape kak more than him 🔫,thaniyahh,2016-07-12 23:10:17+00:00
123,753003244914249728,these 15 year olds are trying to talk to me and Kassie rn and asked to hit her vape omg 💀,brithompsonn,2016-07-12 23:08:58+00:00
124,753003059685588993,#metropolis Tank that brings flavor to life  #atomvapes #vapefam #vapenation #vapelyfe #vapeporn #vape #life #flavor https://t.co/0IV5aWM8Iu,Atom_Vapes,2016-07-12 23:08:14+00:00
125,753002972536274944,Is Vaping Introducing a Whole New Generation to Nicotine? - Consumer Reports https://t.co/xdq95tTdGC,BethDeRicco,2016-07-12 23:07:53+00:00
126,753002954601431045,People that post snapchat stories of them vaping really irritates me for some reason,jvck217,2016-07-12 23:07:49+00:00
127,753002768735019008,getting catcalled by vaping rednecks makes me feel so alive,sophcolette,2016-07-12 23:07:04+00:00
128,753002651827265537,I liked a @YouTube video from @faze_rain https://t.co/Zoek0GMhIC INTRODUCING DARTH VAPER ft. Vape Lord Nord,itzHarzo,2016-07-12 23:06:36+00:00
129,753002630222385154,E-JUICE REVIEW - VAPE GOO (3 FLAVORS) https://t.co/ohRTKKskMx via @YouTube,NOERRAS,2016-07-12 23:06:31+00:00
130,753002610332807169,Enter to win a brand new Smok TFV8 ! #vape #vapefam #vapenation #ejuice #giveaway #vapegiveaway #vaping #ecig #TFV8 https://t.co/wLFVqr8PpI,patrix242,2016-07-12 23:06:27+00:00
131,753002169318666240,*exhales* oh wait there's no vape,juliqnnq,2016-07-12 23:04:41+00:00
132,753002159432732672,E-JUICE REVIEW - ATTITUDE VAPE (5 FLAVORS) https://t.co/DwMvgKfsF4 via @YouTube,NOERRAS,2016-07-12 23:04:39+00:00
133,753001966402285569,"Tell me you wouldn't Vape this!! Sticky, buttery honey bunz from coilglaze !! Hopefully I'll… https://t.co/uahJf7cOVY",joeofallvapes,2016-07-12 23:03:53+00:00
134,753001898479915008,Vape Bartender Mohitto E-Liquid https://t.co/aiu80J1HEG via @pinterest #Vape #Vaping #ejuice #vapeLiquid #eliquid,VaporElectrico,2016-07-12 23:03:37+00:00
135,753001805882265600,Help me win some amazing Wotofo #vape gear from @v_a_p_e &amp; @wotofoofficial. #TrollV2 #Giveaway https://t.co/OPjsNgo6Cd,chevyguy4life68,2016-07-12 23:03:15+00:00
136,753001774898970624,also i just saw a drive thru vape store,cjisntcoming,2016-07-12 23:03:07+00:00
137,753001490915160068,Vape Bartender Mohitto E-Liquid https://t.co/gTAK7Ffwjf,VaporElectrico,2016-07-12 23:02:00+00:00
138,753001456517521408,"Mic check👌
Vape next 😁",JustBeingRhedge,2016-07-12 23:01:51+00:00
139,753001146034360320,"Vape Gravy's Atoms Fall flavor is a delicious and creamy lemon pound cake!
https://t.co/przqkcE9f8 https://t.co/EYuKVg3CN1",MtBakerVapor,2016-07-12 23:00:37+00:00
140,753001122319785984,"Raspberry Hard Candy
#vape #vapeporn #vapelife #vapelyfe #calivapers #vapehooligans #ejuice #eliquid https://t.co/vayRTPZUWK",yougotejuice,2016-07-12 23:00:32+00:00
141,753001049770725376,I wonder how many times I'll think a car is on fire before I get used to vaping...,brontewhore,2016-07-12 23:00:15+00:00
142,753001019626426368,"If vaping is so healthy, why is the life insurance premium higher??",e21_2007,2016-07-12 23:00:07+00:00
143,753000996729659392,"When it comes to the future of #vaping, we believe.... https://t.co/AgB0LHkkzs",LighterUSA,2016-07-12 23:00:02+00:00
144,753000721184718848,Grape Kush Vape Juice https://t.co/8RU7g8GuDR #ecigs #vape #vaping #vapefam https://t.co/oxcUKpzLK9,4_Fox_Sakes,2016-07-12 22:58:56+00:00
145,753000677396316160,I liked a @YouTube video from @faze_rain https://t.co/3hidgtkwP7 INTRODUCING DARTH VAPER ft. Vape Lord Nord,cubanforlifee_,2016-07-12 22:58:46+00:00
146,753000586249801728,Day 6 and I finally saw a kid vaping. Time to go home. Gn.,coldcut_combo,2016-07-12 22:58:24+00:00
147,753000581762023424,Pokemon go is possibly the saddest new bit of technology since vaping.,Nelle_Kingston,2016-07-12 22:58:23+00:00
148,753000271526191105,I liked a @YouTube video from @faze_rain https://t.co/k0btBxx91Y INTRODUCING DARTH VAPER ft. Vape Lord Nord,imZedah,2016-07-12 22:57:09+00:00
149,753000261241540608,"Vapers be like.... 

#vapelife #vapeporn #fatclouds #danknationstore #followus #follow4follow… https://t.co/jRDuAvFoXt",Danknationstore,2016-07-12 22:57:07+00:00
150,753000134640664576,Despite Releasing “Cog One” Vape eLiquid -  https://t.co/DiRvl4hAsC https://t.co/0iFYI08dBm,DMNdotcom,2016-07-12 22:56:36+00:00
151,753000006848765952,It's time it's time it's VAPER TIME #pokemongo (p.s if you're too old to have fun you're too… https://t.co/CLlLcgyDUg,_blacksabrejr,2016-07-12 22:56:06+00:00
152,752999847989383168,Vape is King https://t.co/46iYyXrPE3,cryingbudge,2016-07-12 22:55:28+00:00
153,752999839659458560,https://t.co/N1YJEh5dxP Our website is live.  Come and get it! #vapor #vape #vaper #vapejuice… https://t.co/5VFotfMbiO,CultivatedVapor,2016-07-12 22:55:26+00:00
154,752999798039580677,"Screaming ""VAPE NATION"" when going down the first drop of every ride at Wonderland #vapenation",peterek_c,2016-07-12 22:55:16+00:00
155,752999692976414721,"Look what's in stock at #EpicVapes! Purchase yours while supplies last! Only $39.99!
#TFV8 #CloudBeast @SMOKTECHLOGY https://t.co/JAAYLRl6nt",epic_vapes,2016-07-12 22:54:51+00:00
156,752999489497989120,"Top Quality products &amp; Customer Service backed by a Lifetime Warranty #O2vape 
https://t.co/mbFhSS1obE 
#vape https://t.co/L8FWgZqJJE",O2vape,2016-07-12 22:54:03+00:00
157,752999441192325120,LF Eleaf ECR rebuildable coil heads for mini melo 3 #vapecommunity #cloudchaser #vaping https://t.co/nW1lDTjOOL,vapekarmashop,2016-07-12 22:53:51+00:00
158,752999305523245056,Just saw a man on the street smoking from a sonic screwdriver shaped vape and now I'm depressed.,tomoxnam,2016-07-12 22:53:19+00:00
159,752999192784691200,I liked a @YouTube video from @faze_rain https://t.co/xpGVeEW2CI INTRODUCING DARTH VAPER ft. Vape Lord Nord,martinstokes125,2016-07-12 22:52:52+00:00
160,752999113294278660,Fugginvapor 20% off All Premium E-Juice Deal! - https://t.co/VhxLY65m0Y - #Vape #ecig https://t.co/MyF8A1PPQF,VapingCheap,2016-07-12 22:52:33+00:00
161,752999102405804033,vape me hard before you go,fairysfloss,2016-07-12 22:52:30+00:00
162,752999074073149440,"Lost Vape DNA200, SMY SDNA75 and SX Q Giveaway, and multiple Winners!  https://t.co/gdZ6FsBGot",legendeld,2016-07-12 22:52:23+00:00
163,752999058923544581,I liked a @YouTube video from @faze_rain https://t.co/d2vK84Ssw1 INTRODUCING DARTH VAPER ft. Vape Lord Nord,vPernet_,2016-07-12 22:52:20+00:00
164,752999041034756096,Hell boy V2 Winner HD - Approved Vapers: https://t.co/4aYSABpPwR via @YouTube,BoldVape,2016-07-12 22:52:16+00:00
165,752998975645462528,Getting more pissed because I can't find my damn vape glass I was attempting to fix just so I could de-stress myself 😤,ROGUESPlDER,2016-07-12 22:52:00+00:00
