,TweetID,TweetContent,TweeterUsername,TweetDatetime
1922,752852443625652224,Just vaping a the butt crack of dawn🌥 https://t.co/awbiCr7DDx,zac_chong,2016-07-12 13:09:44+00:00
1923,752852384821284864,"Check out  6 PRE-MADE FLATTENED FUSED CLAPTON COILS, 26X2, 32 316L STAINLESS 6 PACK https://t.co/gqGF1YTz7d @eBay #vapenation #vapefam#vape",KenHarlander,2016-07-12 13:09:30+00:00
1924,752852259277537280,Vaping Watch 5000 Like Giveaway - 3 Winners - Enter NOW!! #vapingwatch #vape #vapelife  https://t.co/tH8ZwLGNSE,kevdt67,2016-07-12 13:09:00+00:00
1925,752852122513776640,Shop for Aspire Nautilus X Tank! Available at https://t.co/03GLB8GFoD #4u2vape #vaping #vapor #vape #ecig #ecigs https://t.co/kIEa6Zi94v,4U2VAPE,2016-07-12 13:08:27+00:00
1926,752851870826147840,hey guys check out this cool vape trick,franbot666,2016-07-12 13:07:27+00:00
1927,752851717029498880,I liked a @YouTube video from @faze_rain https://t.co/V0ysRUTA2k INTRODUCING DARTH VAPER ft. Vape Lord Nord,ZurioXz,2016-07-12 13:06:51+00:00
1928,752851666098159622,A Quick review of the Vape 02 #kikecigs #vape #vapestarterkits https://t.co/06ZwAAlWEF,KiKEliquids,2016-07-12 13:06:39+00:00
1929,752851558358855680,Epic #vape giveaway! Enter to win a Wotofo #TrollV2 RDA or #Conqueror RTA from @v_a_p_e &amp; @wotofoofficial. #VapeLife https://t.co/Y0DRj0hucl,RasmusSixhoej,2016-07-12 13:06:13+00:00
1930,752851422056710144,jr_vapes  -  Still shot of my big O i got on my recent video 👌🏼 Check out the fam:… https://t.co/XLtTQedpLi,OvertonPeter,2016-07-12 13:05:40+00:00
1931,752851218934829056,"Lost Vape DNA200, SMY SDNA75 and SX Q Giveaway, and multiple Winners!  https://t.co/ZIqO2ZbYrz",blacknoy_,2016-07-12 13:04:52+00:00
1932,752851139427766272,I wonder why this survey on #vaping didn't get much media.  Why are the variety flavors such a concern again? https://t.co/IOVBWTTrNj,skrymir42,2016-07-12 13:04:33+00:00
1933,752850915888025601,"Lost Vape DNA200, SMY SDNA75 and SX Q Giveaway, and multiple Winners!  https://t.co/lxanDI8Y75",bigcee1976,2016-07-12 13:03:40+00:00
1934,752850865094918144,Vaping and how it affects oral health. https://t.co/gRRyvgjjAu,TLCDentalLodi,2016-07-12 13:03:28+00:00
1935,752850855641030656,"Lost Vape DNA200, SMY SDNA75 and SX Q Giveaway, and multiple Winners!  https://t.co/EDX6N74lLn",toyosup88,2016-07-12 13:03:25+00:00
1936,752850786804113409,"Quit Smoking Vape Mini Electronic Cigarette Atomizer Blister kit with 7 Refills Recharge https://t.co/niwBxQ6pDi #Ecigs,#BuySmokes,#Smoking",PickleballS,2016-07-12 13:03:09+00:00
1937,752850766793179137,"moonshot&amp;tubemod!!

cool!!

#vape#moonshot#vapelife#smokyshot#vapelove#vapeon#vapestagram#vapesho… https://t.co/kbMfePTicS",NLC_KAZKI,2016-07-12 13:03:04+00:00
1938,752850634907459585,Vapes should be banned as they are increasing teen smoking! They also do not allow adults to break the habit. https://t.co/4YsD2lUdlk,lacey9020,2016-07-12 13:02:33+00:00
1939,752850600082051072,Anyone up to a nice morning vape❓🔥🔥 #weed #marijuana #cannabis #stonerfam #stonercircle #staylifted 💨💨 https://t.co/MHtyDOFF81,IAmCannabis420,2016-07-12 13:02:25+00:00
1940,752850190789468160,TGIZ! https://t.co/hrz20HYgwM #vapelife #ecigs #ejuice #eliquids #vapeon #rba #vapeon #ejuice #vape https://t.co/pQjrBGcPRy,Suckmybox_com,2016-07-12 13:00:47+00:00
1941,752850054793289728,"Check out our brand new #kits!!!
#VAPESTICK #New #Device #Vaping #Ecig #SubOhm #Vapour
https://t.co/6BICqobIVf https://t.co/2Hu9CdT1sf",VAPESTICK,2016-07-12 13:00:14+00:00
1942,752850037005127680,"Reynolds, Imperial Fight Over Chinese Inventor's Vape Patents - Bloomberg https://t.co/Oj8GfzT4AE",Tax4Business,2016-07-12 13:00:10+00:00
1943,752850027094081536,"Eating Corn Flakes is Half as Dangerous as Smoking, According to Reasoning of Anti-Vaping Researchers  #vape https://t.co/9GLnRqIuFz",vapingtruth,2016-07-12 13:00:08+00:00
1944,752849840363548672,"Lost Vape DNA200, SMY SDNA75 and SX Q Giveaway, and multiple Winners!  https://t.co/xb7AYPU5ox",philbh77,2016-07-12 12:59:23+00:00
1945,752849798378692609,"So there I was on my commute, wondering if I could hate the brake tapper in front of me any more, when a vape cloud came out of his window",MorganChandlerH,2016-07-12 12:59:13+00:00
1946,752849741801672704,New research on #ecigs and #vaping https://t.co/dOfW5qPEq6,BigDVapor,2016-07-12 12:59:00+00:00
1947,752849721933246464,Just Gibbled Vape Juice https://t.co/UIUXnY2zHx #vapelife #shopping #ecig #vape https://t.co/uaOcSNeAUB,4_Fox_Sakes,2016-07-12 12:58:55+00:00
1948,752849601728741376,We caught up with a full-time #vaping #vlogger and got inside her head! Check it out here- https://t.co/HDo1nnqNFn https://t.co/WOn3zUHgUI,ecig,2016-07-12 12:58:26+00:00
1949,752849416009097217,Epic #vape giveaway! Enter to win a Wotofo #TrollV2 RDA or #Conqueror RTA from @v_a_p_e &amp; @wotofoofficial. #VapeLife https://t.co/R1IdnFRZbp,JavaHard,2016-07-12 12:57:42+00:00
1950,752849242364923904,Burned my tongue somehow on a vape last night and now I'm talking weird great 😐😐😐,jordyn_mayfield,2016-07-12 12:57:01+00:00
1951,752849160676794368,MaCoca Gold Hemp Vape Additive #Wholesale case of 24 Glass tanks #vape #hemp https://t.co/uVlvy41pUm @eBay,MaCocaGoldHemp,2016-07-12 12:56:41+00:00
1952,752849106377277440,New label and rebrand. #vapelabels #graphicdesign #primepixeldesigns #vape https://t.co/6jMv4MISYo,primepixeldsign,2016-07-12 12:56:28+00:00
1953,752849036839821313,Enter to win a brand new Smok TFV8 ! #vape #vapefam #vapenation #ejuice #giveaway #vapegiveaway #vaping #ecig #TFV8 https://t.co/YtS9gtta0I,axelbeam,2016-07-12 12:56:12+00:00
1954,752848871806513156,50% off all juice purchases @ VapeFTW! Use coupon code: vapeftw50 via /r/vape_deals https://t.co/hjZOlxspgc,VapingLove,2016-07-12 12:55:32+00:00
1955,752848814164156417,Vape pa more kingina,verokrshle,2016-07-12 12:55:19+00:00
1956,752848573281214468,"I'm just ready to be back in the duck pond with my #shotgun , my #vape , and my #goldenretriever all by my side 😍",ChristVapingDad,2016-07-12 12:54:21+00:00
1957,752848170791477249,Vape in the city,sweetygelo_,2016-07-12 12:52:45+00:00
1958,752848128110231552,Sssniperwolf contact Vape lord Nord and ask him if u can go to vapecon with him https://t.co/1YqPnnulAW,Issa_Hoblos123,2016-07-12 12:52:35+00:00
1959,752848063216160769,E-cigarette risk assessment based on biomarkers:good approach but important problems in the analysis https://t.co/tcgIlFSXXx #eliquid#Vaping,ConceptLiquids,2016-07-12 12:52:20+00:00
1960,752847972979867648,"I'm at United Vapers in Kepong, Kuala Lumpur https://t.co/Kj2NsqR7B9",Tangqian__,2016-07-12 12:51:58+00:00
1961,752847824862212097,I liked a @YouTube video from @faze_rain https://t.co/d4uRjKQunL INTRODUCING DARTH VAPER ft. Vape Lord Nord,Claw_Lucky,2016-07-12 12:51:23+00:00
1962,752847710546456576,"Restock !
Moradin 25 

Come &amp; visit us at
Vape Empire Klang

Location : ... #vapeon #vapecommunity #vapedaily https://t.co/PJqbO9ToG8",vapekarmashop,2016-07-12 12:50:56+00:00
1963,752847488315494400,Just got this offer from @VapeWorld - 710/OIL Vape &amp; Game Giveaway! https://t.co/DdN7uqa6AW,giorgos_kailas,2016-07-12 12:50:03+00:00
1964,752847430811549696,"https://t.co/Ewiy9eSN9n For all your vaping needs come &amp; see us &amp; join in the Vaping revolution. kits, liquids, mods https://t.co/IaXwNoNrDO",HAYABUSA12311,2016-07-12 12:49:49+00:00
1965,752847247264456704,"Eating Corn Flakes is Half as Dangerous as Smoking, According to Reasoning of Anti-Vaping Researchers https://t.co/dC1r9RIhUx #ecigs #vaping",VapinXsmoker,2016-07-12 12:49:05+00:00
1966,752847187483197440,"https://t.co/Ewiy9eSN9n For all your vaping needs come &amp; see us &amp; join in the Vaping revolution. kits, liquids, mods https://t.co/73XGuzxu6u",HAYABUSA12311,2016-07-12 12:48:51+00:00
1967,752847184689827840,Teen vaping could reverse progress in the control of tobacco #reversedisease https://t.co/mU41tvNgwg,CureExchange,2016-07-12 12:48:50+00:00
1968,752847148887126016,Raspberry Vape Juice pls! I want m3h3,naysnyza,2016-07-12 12:48:42+00:00
1969,752847104540831744,"https://t.co/Ewiy9eSN9n For all your vaping needs come &amp; see us &amp; join in the Vaping revolution. kits, liquids, mods https://t.co/JENSiqD92N",HAYABUSA12311,2016-07-12 12:48:31+00:00
1970,752846818044682240,"https://t.co/Ewiy9eSN9n For all your vaping needs come &amp; see us &amp; join in the Vaping revolution, more people quit when vaping.",HAYABUSA12311,2016-07-12 12:47:23+00:00
1971,752846741976875008,chek out my sick vape trix!! https://t.co/EflZqDMTLn,elliepsd,2016-07-12 12:47:05+00:00
1972,752846450380255232,Epic #vape giveaway! Enter to win a Wotofo #TrollV2 RDA or #Conqueror RTA from @v_a_p_e &amp; @wotofoofficial. #VapeLife https://t.co/0vUCAnRCZW,goran_flego,2016-07-12 12:45:55+00:00
1973,752846444403552257,Vape lord Nord Edited by Intensity his link is below: https://t.co/4AwbMTBXrY via @YouTube,Mrsolowest1,2016-07-12 12:45:54+00:00
1974,752846264597880832,Vape is on,markimDC,2016-07-12 12:45:11+00:00
1975,752846079113125888,Introducing the VPB Box (Vaping Princess Ballymena Box 😉) still some personalisation to finish… https://t.co/OmsmFhRap8,Vaping_Princess,2016-07-12 12:44:27+00:00
1976,752846033143541760,New phone? or New Vape? What to buy first?,naysnyza,2016-07-12 12:44:16+00:00
1977,752845809805320192,"V for Vaping: E-cigarettes and the new smoking culture,,,,https://t.co/CY7Ee7AlH9 https://t.co/b20BDL5Bb8",smartsmokeindia,2016-07-12 12:43:22+00:00
1978,752845690921889792,"Smoking still comes cheaper than vaping e-cigarettes,,,,   https://t.co/CY7Ee7RWyH https://t.co/89U1AfTVq5",smartsmokeindia,2016-07-12 12:42:54+00:00
1979,752845689185591296,"Product update, check it out! #ecig #vape #vapo #sähkötupakka #vaping #esavuke #e-liquid Wotofo - TROLL v2 RDA - https://t.co/LsOvx4FqJm",HappyJuiceEU,2016-07-12 12:42:54+00:00
1980,752845538744119297,"A nice discussion about research surrounding kids, vaping and cigarettes https://t.co/EeQE0UrlJX",caspy7,2016-07-12 12:42:18+00:00
1981,752845334297059328,Vape lord Nord Edited by Intensity his link is in the description: https://t.co/RWJPGoD5mH via @YouTube,Mrsolowest1,2016-07-12 12:41:29+00:00
1982,752845330245357569,I love vaping it became my most favourite thing  #vapenation #vapelife,Hagezy1998,2016-07-12 12:41:28+00:00
1983,752845328924172288,I liked a @YouTube video from @faze_rain https://t.co/J2AyqpHnCH INTRODUCING DARTH VAPER ft. Vape Lord Nord,Dicedify,2016-07-12 12:41:28+00:00
1984,752845258409463808,DUNDEE NEWS: NHS Tayside backs case of the vapers on hospital grounds https://t.co/5ymMT4kOzf (via @thecourieruk),courier_dundee,2016-07-12 12:41:11+00:00
1985,752845155095502848,No changes to rights &amp; status of EU nationals in the UK - also applies to Norwegian nationals tks to EEA agreement: https://t.co/7MxZiBnWb2,mona_juul,2016-07-12 12:40:46+00:00
1986,752844979580448768,Vape on! 👌🏼 https://t.co/mXtTLDVRQe,VladimirVaughn,2016-07-12 12:40:04+00:00
1987,752844949759025152,"Lost Vape DNA200, SMY SDNA75 and SX Q Giveaway, and multiple Winners!  https://t.co/XhGOWmy2Cr",chevyguy4life68,2016-07-12 12:39:57+00:00
1988,752844904758386689,I liked a @YouTube video from @faze_rain https://t.co/bEJW6miLhf INTRODUCING DARTH VAPER ft. Vape Lord Nord,vmpys,2016-07-12 12:39:47+00:00
1989,752844831903346688,INTRODUCING DARTH VAPER  ft. Vape Lord Nord https://t.co/I0DUWTO0Kz via @FaZe_Rain,TheMainBossOz,2016-07-12 12:39:29+00:00
1990,752844410644230144,#vapingtruth Take action. CASAA fights for vapers. Join now. Don't lose the right to Vape. https://t.co/DHqxPD2w1K,thevapegoods,2016-07-12 12:37:49+00:00
1991,752844374900285441,Would I be cooler if I started vaping? #VL,Zhorn12,2016-07-12 12:37:40+00:00
1992,752844223326588928,#IfSelfiesNeverExisted Vapers wouldn't have such amazing pics! 😂 #vapefam #vapecommunity https://t.co/xYQFIDNrqy,Atmosrx_1,2016-07-12 12:37:04+00:00
1993,752844208789155841,"END OF THE LINE E-LIQUIDS

YORKSHIRE VAPER- JAM DOUGHNUTS
YORKSHIRE VAPER-RASPBERRY CUSTARD
BLACK FOREST GATEAU... https://t.co/B77uXSqYQc",BitnPiecesVape,2016-07-12 12:37:01+00:00
1994,752844147158085634,LOST VAPE THERION DUAL 18650 DNA 75 BOX MOD VIDEO REVIEW https://t.co/BHey2IZB97,Ecigarin,2016-07-12 12:36:46+00:00
1995,752843826503544832,Kendo Vaping Cotton https://t.co/eNzTJSuRZZ via @fancy,vapekaki,2016-07-12 12:35:30+00:00
1996,752843723273216001,Kendo Vaping Cotton https://t.co/z0Dgn6azi2,vapekaki,2016-07-12 12:35:05+00:00
1997,752843711202021377,has just updated 194 products in the #ecig search engine: https://t.co/WciBugmQpC #vaping #ecigarette #ecigs #cigarette,vaporfox,2016-07-12 12:35:02+00:00
1998,752843669720403969,I liked a @YouTube video from @faze_rain https://t.co/HskNFw8OsF INTRODUCING DARTH VAPER ft. Vape Lord Nord,sigis10098,2016-07-12 12:34:52+00:00
1999,752843560110678016,Is it still the best??.... The Geek Vape Griffin 22: https://t.co/jGOPzBqBmr via @YouTube,NSJCVAPING,2016-07-12 12:34:26+00:00
2000,752843559326351362,I added a video to a @YouTube playlist https://t.co/jGOPzBqBmr Is it still the best??.... The Geek Vape Griffin 22,NSJCVAPING,2016-07-12 12:34:26+00:00
2001,752843342401200128,"You saw it first here,  Spread this bad boy!
#vapelyfe #vape #vapingisnotacrime #fuckthefda #vapefam #vapecommunity https://t.co/HCRFTfhaoq",NickCVapes,2016-07-12 12:33:34+00:00
2002,752843219487055872,Vape Bird Big Deal - Get 25% off everything in store except items already on sale! AND Buy one get one for equal... https://t.co/BxetsFJ6zm,kionline,2016-07-12 12:33:05+00:00
2003,752843203712126976,Enter to win a brand new Smok TFV8 ! #vape #vapefam #vapenation #ejuice #giveaway #vapegiveaway #vaping #ecig #TFV8 https://t.co/pweQnKu95K,JezakN,2016-07-12 12:33:01+00:00
2004,752843143695917058,STOP! LOOK! VAPE!,trap_queen548,2016-07-12 12:32:47+00:00
2005,752843106228248576,I liked a @YouTube video from @faze_rain https://t.co/XB8ByQk1Ft INTRODUCING DARTH VAPER ft. Vape Lord Nord,Mikeymon16,2016-07-12 12:32:38+00:00
2006,752842911943888896,ghost type pokemon hang out at vape shops,crapulentfather,2016-07-12 12:31:52+00:00
2007,752842677595566084,"Reynolds, Imperial Fight Over Chinese Inventor's Vape Patents https://t.co/8ryU6XCCDu",ohm_god,2016-07-12 12:30:56+00:00
2008,752842663955750912,IMECIG® E-liquid Blueberry 10ml | Vaping Kit Liquid Juice | Top Grade ingredients |  ... - https://t.co/iLkDSR1jn0 https://t.co/J2GHS9A3sX,IGvaleting,2016-07-12 12:30:52+00:00
2009,752842521626025984,An Ohm's law question (sorry) Specific to Hexohm https://t.co/4o2e5YBjRs #vape #ecigs #reddit,ukvaper,2016-07-12 12:30:18+00:00
2010,752842520896282629,Problems with temp control on h-priv https://t.co/IN1cx1aYbE #vape #ecigs #reddit,ukvaper,2016-07-12 12:30:18+00:00
2011,752842519805775877,I'm a little proud of myself and wanted to share. https://t.co/0DtQKfeXGc #vape #ecigs #reddit,ukvaper,2016-07-12 12:30:18+00:00
2012,752842514210496512,"Research finds teens who never would've smoked cigarettes now ""vape."" Here's how e-cigs compare to the real deal https://t.co/mwJOCFflCl",ClevelandClinic,2016-07-12 12:30:17+00:00
2013,752842480119263232,Not sure where to start when it comes to #ecig flavours? Try before you buy with our taste bar in each store! #vape https://t.co/05L6i1oDfT,RefillStationUK,2016-07-12 12:30:09+00:00
2014,752842204167696384,Along with the FDA that they already know that the Vaping it's 600 times safer than cigarettes but no ! Because the tobacco companies,martin24hrs,2016-07-12 12:29:03+00:00
2015,752841776654905344,"*NEW VIDEO*
This a passion project we been working on for a while! VAPE NATION!
RT TO WIN... https://t.co/wkjkHqc2MQ via @Annie_1Brown",Julialovesgary,2016-07-12 12:27:21+00:00
2016,752841738377539585,Epic #vape giveaway! Enter to win a Wotofo #TrollV2 RDA or #Conqueror RTA from @v_a_p_e &amp; @wotofoofficial. #VapeLife https://t.co/hUe9s5fJEX,ranurq,2016-07-12 12:27:12+00:00
2017,752841656416739328,"COMPETITION TIME!!
1. Like this post
2. Share this post
3. Tag 3 vaping friends
4. Like our page

Will be drawn... https://t.co/nf2zVxewHR",Frumist,2016-07-12 12:26:52+00:00
2018,752841590964649984,15% Off #Atmos #Jump Herbal #Vaporizer @ https://t.co/1Cdt6rsPyG  #Vapeporn #Vapelife #Vape #mmj #vaporize https://t.co/XwZtObhHsM,VapePenUs,2016-07-12 12:26:37+00:00
2019,752841421539774464,The vape industry needs unbiased recognition frm every nook &amp; corner https://t.co/wDl0m1Novw #ecigarette #vape #quit https://t.co/2vwa78lRpi,TygrTygrVape,2016-07-12 12:25:56+00:00
2020,752841025387843588,LIVE on #Periscope: vet alone come talk  https://t.co/RbylIL1JYB,vape_4_life,2016-07-12 12:24:22+00:00
2021,752840997353259008,"M-Type Premium Tobacco
10ml $3.35 or 30ml $6.95
https://t.co/rheQWPCht1
#ejuice #eliquid #vape #vapor #vapers #vapedeal #vapelife #vapeon",vecigs,2016-07-12 12:24:15+00:00
2022,752840609753366529,"Spend over £100 online and we'll add 120ml, 3mg, Red Cluster to your cart. https://t.co/rqQEfOe5C2 https://t.co/TKPIRoNJ22",Pixel_Vape,2016-07-12 12:22:43+00:00
2023,752840396330242049,Cuddles with vape...,FAIRLADY_SAM,2016-07-12 12:21:52+00:00
2024,752840237819322369,thevapinglyfe  -  extremevapingpower awesome setup!! #vape #vaping #vapeon #vapejuice #ejuice… https://t.co/0bYfrSa2tR,OvertonPeter,2016-07-12 12:21:14+00:00
2025,752840139294978048,"Lost Vape DNA200, SMY SDNA75 and SX Q Giveaway, and multiple Winners!  https://t.co/b3iylBqtzd",RasmusSixhoej,2016-07-12 12:20:50+00:00
2026,752840097905512449,LIVE on #Periscope: let's talk don't be scared  https://t.co/XHZjalkDKB,vape_4_life,2016-07-12 12:20:41+00:00
2027,752840039869087748,I'm at Dallaz Vape and Hs_barber shop https://t.co/DyCEiNji9p,bro_aih,2016-07-12 12:20:27+00:00
2028,752839922180947968,Daisy Chain Vapes - Review - #VaporKings ( 8 ) Premium #Juice's - #Eliquid's... https://t.co/qjna2fsGam via @YouTube,billschris081,2016-07-12 12:19:59+00:00
2029,752839840933122048,"So apparently! There is someone who bring vape talents to America's Got Talents.......

ok then....

Next... pokemon go talents",aditcash,2016-07-12 12:19:39+00:00
2030,752839754945888256,"Wanting to aid your hunt in the Starter Kit Market!  This Eleaf Istick Pico Review Wont let down!  #vape #vapereview
https://t.co/B5bSquJ3c5",NickCVapes,2016-07-12 12:19:19+00:00
2031,752839735417171968,Teen vaping could reverse progress in tobacco control: https://t.co/GpJfZWElI6. Also see our webinar on this topic: https://t.co/WApYMx5BNV,PAD_Ontario,2016-07-12 12:19:14+00:00
2032,752839662650159104,"New 100% Original Kanger ...: Ge ... https://t.co/oNZQwfcdGW
#Vape https://t.co/W3nQESv2ss",VapOrgasme,2016-07-12 12:18:57+00:00
2033,752839602944237568,"Really don't get those people that don't smoke but then go on vapes, bit pointless if you ask me",evalewissmythes,2016-07-12 12:18:43+00:00
2034,752839576364933120,"Spotted this earlier at a business I deliver to, next to the smoking area they had a vaping area, I'm so done 😂 https://t.co/qQ8YR3QcyH",ElliotsTweets,2016-07-12 12:18:36+00:00
2035,752839513697902592,I liked a @YouTube video from @hctriage https://t.co/qoPiTJLoRJ E-Cigarette Update: What to Do about Kids and Vaping?,TitaniaBird,2016-07-12 12:18:21+00:00
2036,752839469406031872,"ELEMENTS NOW BUY 2 GET 1 FREE COME DOWN AND GET THAT FAB DEAL!!!!
#VAPE #VAPOUROHM",VapourOhm,2016-07-12 12:18:11+00:00
2037,752839348211580929,Help me win some amazing Wotofo #vape gear from @v_a_p_e &amp; @wotofoofficial. #TrollV2 #Giveaway https://t.co/hrsmKPVWyr,HateCheaterScum,2016-07-12 12:17:42+00:00
2038,752839269685661697,"Teens who vape are 6 times more likely to smoke cigarettes, USC study says #teens #vape #smoking  https://t.co/3ZvNcxofPR",LifeCoachMarcyL,2016-07-12 12:17:23+00:00
2039,752839121551368193,"The jersey devil could have vaped it all, shoveling in the white house.",whoisitAdele,2016-07-12 12:16:48+00:00
2040,752839083278336000,I liked a @YouTube video from @faze_rain https://t.co/t4qmjeHMsa INTRODUCING DARTH VAPER ft. Vape Lord Nord,Matthewbeltre,2016-07-12 12:16:39+00:00
2041,752838789601439744,CogOne #vaping eliquid by @despiteofficial and @vapemateuk details at - https://t.co/yqgHJSy72G,Schizodeluxe1,2016-07-12 12:15:29+00:00
2042,752838785134632960,The #vaping movie #ABillionLives has a date for its US premiere! Will you be there? https://t.co/oGwCZmMbBl https://t.co/V2Knk7MWnT,V2CigsUK,2016-07-12 12:15:28+00:00
2043,752838672823652352,#vape#vapelife# Enjoy your vape https://t.co/kGifnL3gp0 https://t.co/m3VRHitv4o,Joanna001_Xu,2016-07-12 12:15:01+00:00
2044,752838610605355011,is there a vape break? cause COUNT ME IN LOL 😂 https://t.co/W8nOCYhGOy,flappyjoon,2016-07-12 12:14:46+00:00
2045,752838532268486656,I liked a @YouTube video from @hctriage https://t.co/wmMXVSu4iv E-Cigarette Update: What to Do about Kids and Vaping?,ryan_wiancko,2016-07-12 12:14:27+00:00
2046,752837936555630592,I liked a @YouTube video from @faze_rain https://t.co/fs4RjolBxe INTRODUCING DARTH VAPER ft. Vape Lord Nord,ethanwakeful,2016-07-12 12:12:05+00:00
2047,752837815306715136,I liked a @YouTube video from @faze_rain https://t.co/VSk5rYTarl INTRODUCING DARTH VAPER ft. Vape Lord Nord,Neon_PWA,2016-07-12 12:11:36+00:00
2048,752837661946179585,Kids who might have avoided tobacco products are vaping with e-cigarettes via @FortuneMagazine https://t.co/MpqLhN2C0w,ONSAlec,2016-07-12 12:11:00+00:00
2049,752837596422795264,France: The AIDUCE applies to the Minister of Health for reconsideration of Ecig law https://t.co/wpgxORtbfA #Ecigs https://t.co/3QYf8VeyAS,vaping_post,2016-07-12 12:10:44+00:00
2050,752837506455011328,"Reynolds, Imperial Fight Over Chinese Inventor’s Vape Patents 2016-07-12 Bloomberg A global battle for supremacy i… https://t.co/Yc46vaPXfa",NTKRNow,2016-07-12 12:10:23+00:00
2051,752837408731779073,i vape,ocebot_,2016-07-12 12:09:59+00:00
2052,752837377987665920,Happy Tuesday everyone!  Anyone else already ready for the weekend?!?!? #vape #vapefam #vapenation,thebarat805,2016-07-12 12:09:52+00:00
2053,752836999099199488,Teen vaping could reverse progress in the control of tobacco. https://t.co/ST1MVDHSG4,monicaolitheot,2016-07-12 12:08:22+00:00
2054,752836963720245249,Win amazing #vape gear from @v_a_p_e &amp; @wotofoofficial. #TrollV2 #Giveaway https://t.co/1RIAZ2Vawz,nKwoel,2016-07-12 12:08:13+00:00
2055,752836925090766848,"#vape Eating Corn Flakes is Half as Dangerous as Smoking, According to Reasoning of Anti-Va... https://t.co/UAVjCXaEqZ #ecigarette #ecig",eliquid_central,2016-07-12 12:08:04+00:00
2056,752836923261980672,"#vape Eating Corn Flakes is Half as Dangerous as Smoking, According to Reasoning of Anti-Va... https://t.co/MTAb4SKs3E #ecigarette #ecig",Vape_Strong,2016-07-12 12:08:04+00:00
2057,752836920963497984,"#vape Eating Corn Flakes is Half as Dangerous as Smoking, According to Reasoning of Anti-Va... https://t.co/Ej7sZ6Ir18 #ecigarette #ecig",Vape_Superstar,2016-07-12 12:08:03+00:00
2058,752836916794445825,"#vape Eating Corn Flakes is Half as Dangerous as Smoking, According to Reasoning of Anti-Va... https://t.co/mA3F38Aao8 #ecigarette #ecig",Just1MoreMod,2016-07-12 12:08:02+00:00
2059,752836914193977345,"#vape Eating Corn Flakes is Half as Dangerous as Smoking, According to Reasoning of Anti-Va... https://t.co/Itl1moE3dC #ecigarette #ecig",Addicted2Vaping,2016-07-12 12:08:02+00:00
2060,752836911018848256,"#vape Eating Corn Flakes is Half as Dangerous as Smoking, According to Reasoning of Anti-Va... https://t.co/JxNLlm8UoZ #ecigarette #ecig",ImpulsiveVaper,2016-07-12 12:08:01+00:00
2061,752836908560949248,"#vape Eating Corn Flakes is Half as Dangerous as Smoking, According to Reasoning of Anti-Va... https://t.co/syP8klH84p #ecigarette #ecig",Sub_Ohm_Clouds,2016-07-12 12:08:00+00:00
2062,752836906220527617,"#vape Eating Corn Flakes is Half as Dangerous as Smoking, According to Reasoning of Anti-Va... https://t.co/SJjmVLXkxV #ecigarette #ecig",Happy_Vaper,2016-07-12 12:08:00+00:00
2063,752836903796297728,"#vape Eating Corn Flakes is Half as Dangerous as Smoking, According to Reasoning of Anti-Va... https://t.co/M3zQG3597T #ecigarette #ecig",vaping_my_lunch,2016-07-12 12:07:59+00:00
2064,752836902827339776,"#vape Eating Corn Flakes is Half as Dangerous as Smoking, According to Reasoning of Anti-Va... https://t.co/M2oagyTjBD #ecigarette #ecig",KeepCalm_VapeOn,2016-07-12 12:07:59+00:00
2065,752836900096921603,"#vape Eating Corn Flakes is Half as Dangerous as Smoking, According to Reasoning of Anti-Va... https://t.co/opYCwxd1JM #ecigarette #ecig",Kicking_Butts,2016-07-12 12:07:58+00:00
2066,752836899606257664,"Kid I work with listens to the most trash music, wears flip flops.... &amp; he vapes 🙄",IGetGullyy,2016-07-12 12:07:58+00:00
2067,752836897840386048,"#vape Eating Corn Flakes is Half as Dangerous as Smoking, According to Reasoning of Anti-Va... https://t.co/5N9jLmUFPn #ecigarette #ecig",wake_up_healthy,2016-07-12 12:07:58+00:00
2068,752836801866465280,"What you vaping, hand check Tuesday! Check out FB Inhale Heaven for weekly giveaways #cloudlife… https://t.co/WgkwJsy9wD",InhaleHeaven,2016-07-12 12:07:35+00:00
2069,752836797743235073,Epic #vape giveaway! Enter to win a Wotofo #TrollV2 RDA or #Conqueror RTA from @v_a_p_e &amp; @wotofoofficial. #VapeLife https://t.co/1RIAZ2Vawz,nKwoel,2016-07-12 12:07:34+00:00
2070,752836606046900224,"Good thing I got this Segway hover board, wouldn't make it to the vape store in time with all these Pokemons I gotta pick up.",justinpoulter,2016-07-12 12:06:48+00:00
2071,752836514048987136,"Retweeted RhydoBaggins (@RhydoBaggins):

Use Brexit to save smokers' lives and plug vaping, say peers... https://t.co/FeuTaGSoNa",Limitless_VR_,2016-07-12 12:06:26+00:00
2072,752836372357124096,We sell everything from starter kits for the new vaper to advance mechanical kits for the advanced vaper. We are... https://t.co/CgxKrPkOch,sevaping,2016-07-12 12:05:52+00:00
