,TweetID,TweetContent,TweeterUsername,TweetDatetime
2875,752732314942210052,"Teens who vape are 6 times more likely to smoke cigarettes, USC study says - KABC-TV https://t.co/3gjqX2yrZT",biotechstock,2016-07-12 05:12:23+00:00
2876,752732106665521152,Almost 100 entries just from my TWITTER followers! Awesome job guys - good luck :) can't wait to make a video about it soon #Vape,PhazeKlan,2016-07-12 05:11:33+00:00
2877,752732099334008832,"2015 Hotest Kanger Subtank v2 ...:  https://t.co/GVZmwjlt9O
#Vaping https://t.co/HgsL6DxVEt",VapOrgasme,2016-07-12 05:11:32+00:00
2878,752732063233638400,I'm at Famous Vape https://t.co/26hj74kQbj,khairulnuar,2016-07-12 05:11:23+00:00
2879,752731979490004993,Vape Lord Nord,darkslides,2016-07-12 05:11:03+00:00
2880,752731950507581440,I liked a @YouTube video from @faze_rain https://t.co/wouehnnBYg INTRODUCING DARTH VAPER ft. Vape Lord Nord,kcjcool,2016-07-12 05:10:56+00:00
2881,752731668860076032,VapeTVLive Continues https://t.co/LVkv29VlGe Tunes n Chat on #VapeTV https://t.co/wvjGPieeQy for mobile #VapeChat #VapeTVViral #Vaping,BlacksmithPro,2016-07-12 05:09:49+00:00
2882,752731612731891712,"#EnigmaCMwin

Reposted on behalf of

 👉@enigma_vapes👈 

* EXCLUSIVE UK GIVEAWAY *
.
I have… https://t.co/xrpON5O3fq",johnMckeown0102,2016-07-12 05:09:36+00:00
2883,752731587767365632,I liked a @YouTube video from @faze_rain https://t.co/ULRxdZ2JJj INTRODUCING DARTH VAPER ft. Vape Lord Nord,vMouu,2016-07-12 05:09:30+00:00
2884,752731568263667712,VAPE KIDS,LEAFYSVIDTITLES,2016-07-12 05:09:25+00:00
2885,752731482725113856,sext: lets go to a vape convention,04hondacivic,2016-07-12 05:09:05+00:00
2886,752731468846116864,What's vaping is it just inhaling steam,jordanbot1,2016-07-12 05:09:01+00:00
2887,752731348998037505,Afraid for the day I go full adult and quit weed because I know I'll turn into such an obnoxious vape mami,bb_hay,2016-07-12 05:08:33+00:00
2888,752731269272776704,Throwback! HAHAHA #vape 😂 https://t.co/ZsNhUjesKg,paula_marice,2016-07-12 05:08:14+00:00
2889,752731245381955585,When Pokemon Go knows that you vape https://t.co/YOmbjutTi7,punchkicker3,2016-07-12 05:08:08+00:00
2890,752731217506672640,"What people in Wichita do: Go to keeper of the plains, play Pokemon go while vaping and longboard",_renerivera,2016-07-12 05:08:01+00:00
2891,752731148841869316,does souda vape,shslkamukura,2016-07-12 05:07:45+00:00
2892,752731078020915200,"I think we can all agree that if we saw a video of a cop shooting someone vaping we'd all be like-

""I'm sure he deserved it""",asapchristoferg,2016-07-12 05:07:28+00:00
2893,752731069007458304,"#vape #vapegiveaway #vapenation vape stand Holds 3 box mods, 10 tube mods, juice, batteries  https://t.co/OgNaadmKjm https://t.co/ckXwXMhyRs",mouthfulofjuice,2016-07-12 05:07:26+00:00
2894,752730961398423552,We get it you vape https://t.co/C0OPu0XNM2,kawaharaboxing,2016-07-12 05:07:00+00:00
2895,752730946521079808,Y'all can talk shit about vaping but it has helped me stay clean for 6months before,Toostokelupe,2016-07-12 05:06:57+00:00
2896,752730655201656832,Authentic Lost Vape Efusion DNA200 Silver 200W Box Mod   Free Sample https://t.co/NVzNEf5dwa,mouthfulofjuice,2016-07-12 05:05:47+00:00
2897,752730609395654656,10 rts and i will personally fucking Vape on thursday,kamukuras,2016-07-12 05:05:36+00:00
2898,752730387504173056,Vapeon! #vape https://t.co/gGLqVnVL0O,hanizelAnne,2016-07-12 05:04:44+00:00
2899,752730384262201344,throwback to when @Drewphillips__ and I held feet and supported the naysh !!! #vape #goals 💅🏼 https://t.co/DXXFbMUiLG,lilyroza33,2016-07-12 05:04:43+00:00
2900,752729946758537216,just watched a youtube video of a guy vaping soy sauce and mustard!!! im fucking bored,kissmyASSeo,2016-07-12 05:02:59+00:00
2901,752729835156504576,I liked a @YouTube video from @faze_rain https://t.co/1GV7csOA2N INTRODUCING DARTH VAPER ft. Vape Lord Nord,Papa_Bleach_,2016-07-12 05:02:32+00:00
2902,752729828567183360,"Teens who vape are 6 times more likely to smoke cigarettes, USC study says – KABC-TV

LOS ANGELES (KABC) —

Many t… https://t.co/5hW1NarICn",topnewsxyz,2016-07-12 05:02:30+00:00
2903,752729745666695168,"Lost Vape DNA200, SMY SDNA75 and SX Q Giveaway, and multiple Winners!  https://t.co/v0nnwCTXkL",Roboapro,2016-07-12 05:02:11+00:00
2904,752729700884107264,The Berkshire Eagle - Berkshire Eagle (subscription) https://t.co/zewnsorrsq #ecigs #vaping,VapinXsmoker,2016-07-12 05:02:00+00:00
2905,752729699520884737,New vaping law makes it hard for local shops to operate - 21Alive https://t.co/lFQlOvYPfI #ecigs #vaping,VapinXsmoker,2016-07-12 05:02:00+00:00
2906,752729677958090752,I liked a @YouTube video from @faze_rain https://t.co/ggcODt10Jv INTRODUCING DARTH VAPER ft. Vape Lord Nord,CJay_m8,2016-07-12 05:01:54+00:00
2907,752729594160115712,I liked a @YouTube video from @faze_rain https://t.co/tj1RCDLsMx INTRODUCING DARTH VAPER ft. Vape Lord Nord,KingIMPL,2016-07-12 05:01:34+00:00
2908,752729528657702913,I liked a @YouTube video from @faze_rain https://t.co/WTVBbWfjRs INTRODUCING DARTH VAPER ft. Vape Lord Nord,Spikey_03,2016-07-12 05:01:19+00:00
2909,752729509850480640,"""where'd my weed go??? I mean my vape""",lyingisthmostfn,2016-07-12 05:01:14+00:00
2910,752729367239921665,"Have you tried @electricdew yet? Go give them a follow!
#vape #vapelife #vapeporn #vapelyfe… https://t.co/snnpiuNdyu",VapeGirlReview,2016-07-12 05:00:40+00:00
2911,752729285891350528,I liked a @YouTube video from @faze_rain https://t.co/75EMnzM6Ga INTRODUCING DARTH VAPER ft. Vape Lord Nord,_prav__,2016-07-12 05:00:21+00:00
2912,752729245764419584,Thank you to everyone who follows. Please spread the word by visiting our web site  #vapingtruth #vapelife #vape,vapingtruth,2016-07-12 05:00:11+00:00
2913,752728973277179904,I'll vape to that,NFaudale,2016-07-12 04:59:06+00:00
2914,752728927760637952,Gummy Candy Vape Juice https://t.co/CPoqYGU5PM #vape #vapelife #eliquid #vapefam https://t.co/w6EQcrEmLD,4_Fox_Sakes,2016-07-12 04:58:56+00:00
2915,752728778976165888,We are in St Johns Newfoundland launching our Canadian Vape Tour with Wesley Gould of Ejuice Wholesale Canada.... https://t.co/GrTb0KfJWW,sovereignejuice,2016-07-12 04:58:20+00:00
2916,752728752732434434,"I don't een smoke anymore, I vape b",_ENasty,2016-07-12 04:58:14+00:00
2917,752728733681872897,I liked a @YouTube video from @faze_rain https://t.co/kACuF14dUt INTRODUCING DARTH VAPER ft. Vape Lord Nord,Romeo__713,2016-07-12 04:58:09+00:00
2918,752728639289040896,Snoop Dogg MICRO G PEN Vaporizer Starter Kit Vape Box Vaporizer 510 thread  via eBay https://t.co/rD4GQZBJRh,akdubz53,2016-07-12 04:57:47+00:00
2919,752728541138079744,Supersmoker Bluetooth Summer Sale on now! @SuperSmokernl #vapenation #vaping #vape #ecigs #summer #sales https://t.co/A7odnzh3aT,canadaecigs,2016-07-12 04:57:23+00:00
2920,752728292587864064,"The truth 2016
#vape #vapelife #vapefam #vapecommunity #vapestagram #Lasvegas #nikon #vapor… https://t.co/jS64xqePVi",freshskaterjay,2016-07-12 04:56:24+00:00
2921,752728171955515392,"Teens who vape are 6 times more likely to smoke cigarettes, USC study says - KABC-TV https://t.co/dHrcei6ZGk",pharma_global,2016-07-12 04:55:55+00:00
2922,752728136433881088,"Lost Vape DNA200, SMY SDNA75 and SX Q Giveaway, and multiple Winners!  https://t.co/Ujqxe1xheM",ryleeb11,2016-07-12 04:55:47+00:00
2923,752727962835783680,Epic #vape giveaway! Enter to win a Wotofo #TrollV2 RDA or #Conqueror RTA from @v_a_p_e &amp; @wotofoofficial. #VapeLife https://t.co/ftseCp5dqv,paskal,2016-07-12 04:55:06+00:00
2924,752727847123324929,Can her jocks consider vaping with buttholes?,bot_cuck,2016-07-12 04:54:38+00:00
2925,752727812608364544,#NITECORE i4 New2014 CLK https://t.co/2cbcDe2WxH #batteryCharger #vape #flashlight #nba #vapelife #vapemz #ny #ca #co #ucla #usc #losangeles,rawvibes,2016-07-12 04:54:30+00:00
2926,752727532282253312,i honestly think im just gonna pack my massive vape collection for college,grocfromthebloc,2016-07-12 04:53:23+00:00
2927,752727497092005891,So now my man wears a grill and vapes smh,llucianoo1,2016-07-12 04:53:14+00:00
2928,752727490368385025,We Get It You Vape https://t.co/6VjtF3CTNP,KVLTPOP,2016-07-12 04:53:13+00:00
2929,752727247291707392,MK Vape Enigma Sub Ohm Tank Black via /r/vape_deals https://t.co/4OrSSVakIB,VapingLove,2016-07-12 04:52:15+00:00
2930,752726954256859136,now i don't have to buy your vape for you!! hbd riley ❤️🎉 https://t.co/g7F1YDZpnU,chouetterin,2016-07-12 04:51:05+00:00
2931,752726710114775040,I liked a @YouTube video from @faze_rain https://t.co/Trr2uEIwdy INTRODUCING DARTH VAPER ft. Vape Lord Nord,WillSmithShreky,2016-07-12 04:50:07+00:00
2932,752726507382910976,Some guy just drove by us blasting   G-Eazy and vaping,giannarenee3,2016-07-12 04:49:18+00:00
2933,752726421735301120,Missing flavor. What am I doing wrong? https://t.co/FHL5sbzls8 #vape #ecigs #reddit,ukvaper,2016-07-12 04:48:58+00:00
2934,752726420984442880,What is your favorite Banana ejuice? https://t.co/tP84M9IKSB #vape #ecigs #reddit,ukvaper,2016-07-12 04:48:58+00:00
2935,752726420154122240,510 drill for wrapping claptions. Genius idea https://t.co/gvjmbOPC74 #vape #ecigs #reddit,ukvaper,2016-07-12 04:48:58+00:00
2936,752726399841021952,"Teens who vape are 6 times more likely to smoke cigarettes, USC study says - KABC-TV https://t.co/zsYihHGeDp",NewUnitedStates,2016-07-12 04:48:53+00:00
2937,752726393541103616,"Teens who vape are 6 times more likely to smoke cigarettes, USC study says - KABC-TV: KABC-TVTeens who vape a... https://t.co/5XcYJKRSpH",EzHomeCare,2016-07-12 04:48:51+00:00
2938,752726389862731776,"Teens who vape are 6 times more likely to smoke cigarettes, USC study says - KABC-TV: KABC-TVTeens who vape a... https://t.co/PNirT5Rr1u",Naturalmedicin,2016-07-12 04:48:50+00:00
2939,752726384133279744,"Lost Vape DNA200, SMY SDNA75 and SX Q Giveaway, and multiple Winners!  https://t.co/w0kLgKPkH7",stetsura83,2016-07-12 04:48:49+00:00
2940,752726247629852672,Walk outside to take the trash out... 3 neighbors out there vaping and playing Pokemon Smfh it's 1am,RealEase757,2016-07-12 04:48:17+00:00
2941,752726160929325056,The Deeming Ban: What Should Vapers Be Doing Now? https://t.co/4x4w4oAv6y #ecig https://t.co/q1vd7VLFIu,VaponewsUS,2016-07-12 04:47:56+00:00
2942,752726008000897024,Fucking vape bitch,swagydick,2016-07-12 04:47:19+00:00
2943,752725929722408960,"Lost Vape DNA200, SMY SDNA75 and SX Q Giveaway, and multiple Winners!  https://t.co/pxCChpdw7K",Bobbyhector1,2016-07-12 04:47:01+00:00
2944,752725721227943936,"I liked a @YouTube video https://t.co/3xyGuDCrq9 Limitless RDTA Plus from IJOY Review! Quit Smoking, Start Vaping! Kicking Butts!!",TheThoughtPot,2016-07-12 04:46:11+00:00
2945,752725522556170240,"For everyone out there that vapes and calls themself a ""vapist"" That is worst thing to call yourself. Bye.",Losttaxi,2016-07-12 04:45:24+00:00
2946,752725382302822400,"Silverdale Waterfront Park-
Home of Longboarders, Vapers, and Pokemon GOers",Spannaway,2016-07-12 04:44:50+00:00
2947,752725216996888576,[Prt.2] Easy Vape digital vaporizer Unboxing... https://t.co/vkdlEllpkO #digital #Easy #Etc #Prt2 #Review #Smoke #Unboxing #Vape #vaporizer,TheCannabisWiki,2016-07-12 04:44:11+00:00
2948,752725082011754500,My name is Dylan and I also love but stuff and god do I love vape https://t.co/P64hOFb4eI,Espositojake,2016-07-12 04:43:39+00:00
2949,752725064655769600,I liked a @YouTube video from @faze_rain https://t.co/QHloLPKkuX INTRODUCING DARTH VAPER ft. Vape Lord Nord,BeAshaymed,2016-07-12 04:43:35+00:00
2950,752724964487421952,Massive shoutout to the guys at @ozbongs who are now stocking the range of my custom SSV x TROG vapes!!! Featured... https://t.co/LwZXK4uWIP,TROGwastedart,2016-07-12 04:43:11+00:00
2951,752724754503602176,Behind the scenes photoshoot #fam #bae #music #vape #beach 🌍😁👌 @burnettebabezzz @AyyeitsAlissa https://t.co/I8HEuuXy3T,FAIRLADY_SAM,2016-07-12 04:42:21+00:00
2952,752724721876209664,"Lost Vape DNA200, SMY SDNA75 and SX Q Giveaway, and multiple Winners! https://t.co/THblCB6iL3",NikolaMalovi1,2016-07-12 04:42:13+00:00
2953,752724646143799297,"Teens who vape are 6 times more likely to smoke cigarettes, USC study says - KABC-TV https://t.co/XRw6YQNPVu",USHealthNews,2016-07-12 04:41:55+00:00
2954,752724591454351360,"I added a video to a @YouTube playlist https://t.co/3xyGuDCrq9 Limitless RDTA Plus from IJOY Review! Quit Smoking, Start Vaping!",TheThoughtPot,2016-07-12 04:41:42+00:00
2955,752724517911420928,"Coming soon, jl. Lombok no.24 (Rockepo Food Station) come and join us 
vape_project
#vapestagram… https://t.co/B9ysYDkGRG",mhmdindrfz,2016-07-12 04:41:24+00:00
2956,752724508629344257,"Lost Vape DNA200, SMY SDNA75 and SX Q Giveaway, and multiple Winners!  https://t.co/2x0lh3AHKD",jsummers71,2016-07-12 04:41:22+00:00
2957,752724502002429952,The Why and How of Vaping Advocacy https://t.co/4n0MlTD6G5,LakeOfVape,2016-07-12 04:41:20+00:00
2958,752724123348922368,Remember when people were putting sharpies in their assholes for free vape pens for hunter moore😂,NavarrHoe,2016-07-12 04:39:50+00:00
2959,752724043955105792,Continue your 710 Celebrations with 15% off all wax products through the 17th of Jul ... #ecig #vaping #vaping https://t.co/G9xmY61295,vapekarmashop,2016-07-12 04:39:31+00:00
2960,752723937616797696,If you vape like this tweet #vapenation,AyeDueces,2016-07-12 04:39:06+00:00
2961,752723889038323712,It's a sad night when you empty your only all-day Vape Juice. charlieschalkdust Head Banging… https://t.co/A9mpn3XVil,MJW1992,2016-07-12 04:38:54+00:00
2962,752723634834202624,"Teens who vape are 6 times more likely to smoke cigarettes, USC study says - KABC-TV: KABC-TVTeens who vape a... https://t.co/eooiII3foB",silvervalleydoc,2016-07-12 04:37:54+00:00
2963,752723605100736512,"""you know he is a loser if he vapes"" -mom",kkaattharina,2016-07-12 04:37:47+00:00
2964,752723571827355648,we get it. you vape. 😒😒😒😒 https://t.co/WKY2iuxoTJ,carl_jung_thug,2016-07-12 04:37:39+00:00
2965,752723468974632960,"Stan Astro for this ray of sunshine , a dork who loves science n has abs?? lifts n probably vapes to be cool https://t.co/zLp4AfekMw",SFACCIAT0,2016-07-12 04:37:14+00:00
2966,752723437597159424,Vaping Watch 5000 Like Giveaway - 3 Winners - Enter NOW!! #vapingwatch #vape #vapelife  https://t.co/FszC8M3KQA,AllenKiyokane,2016-07-12 04:37:07+00:00
2967,752723377937276928,Teens who would never smoke cigarettes now getting taste for vaping – study: “E-cigarettes are not merely sub... https://t.co/FHs7IcTxlw,SkylarGordon202,2016-07-12 04:36:52+00:00
2968,752723124097937408,"Atmos Orbit Vaporizer for $69: Style Up Your Vaping Game with This Sleek, Efficient Vaporizer... https://t.co/sY43blcJHQ #sale #discount",dealdos,2016-07-12 04:35:52+00:00
2969,752722925829099520,I added a video to a @YouTube playlist https://t.co/ZcMcbfhTDS Prymyum 2 new Flavors | Watermelon &amp; Blueberry Melt | vaping e juice,D8oy,2016-07-12 04:35:05+00:00
2970,752722632366186496,'i dont smoke i vape',SOAPBARRRR,2016-07-12 04:33:55+00:00
2971,752722607456198656,"Lost Vape DNA200, SMY SDNA75 and SX Q Giveaway, and multiple Winners!  https://t.co/3EfIndmYHR",Lolothatisme,2016-07-12 04:33:49+00:00
2972,752722549243600896,DEANNA IS LOOKING FOR POKÉMON AND SHE FOUND PEOPLE VAPING WHILE PLAYING IT,vapeIord,2016-07-12 04:33:35+00:00
2973,752722528523554816,Have you heard about our new CF update? You can now purchase the updated CFs on https://t.co/uQWBDUNWKZ!🙌🏻 #Vape https://t.co/qOFstd0lWl,BNDLSTECH,2016-07-12 04:33:30+00:00
2974,752722443760918528,New smok box I got from @goodcleanvapes. #subohmclub #vape #boxmod #ipv4s #dripclub #vapesociety… https://t.co/C2PODWhm61,CigarKid91,2016-07-12 04:33:10+00:00
2975,752722405613764608,"Touch my vape, we gone turn this shit to Columbine @Four_Pins https://t.co/TNTQEK6oAB",dab56k,2016-07-12 04:33:01+00:00
2976,752722212675784704,I'm at Vape Century in Selangor https://t.co/h4gI8POCq1,ivan_yap88,2016-07-12 04:32:15+00:00
2977,752722191611858944,Found this lil guy vaping in my room https://t.co/Z5H0sDx8Ln,JosephOrtiz__,2016-07-12 04:32:10+00:00
2978,752722091326275584,Non nauset parties don't have kids that vape????,paigekgem,2016-07-12 04:31:46+00:00
2979,752722043104137216,does koda vape,sharkEnabler,2016-07-12 04:31:34+00:00
2980,752721821447753728,INTRODUCING DARTH VAPER  ft. Vape Lord Nord https://t.co/vRP7rusIxS via @YouTube lol,FrakinGamePlay,2016-07-12 04:30:41+00:00
2981,752721779307732992,I liked a @YouTube video from @faze_rain https://t.co/27idYSPb3o INTRODUCING DARTH VAPER ft. Vape Lord Nord,i_snort_gamma,2016-07-12 04:30:31+00:00
2982,752721723724697600,"Vaping Is Up Among Teens, According to USC Study https://t.co/SZJ8iKAw1s https://t.co/fa8TvgkRFI",_VOGUEVOL_,2016-07-12 04:30:18+00:00
2983,752721721921265664,The Deeming Ban: What Should Vapers Be Doing Now? https://t.co/BIZi5DjcLM,LunarRoverUSA,2016-07-12 04:30:18+00:00
2984,752721656532140033,Unbelievable #vape deals Thanks @vapediscounts #vapelife,sovapeone,2016-07-12 04:30:02+00:00
2985,752721654619443200,Skyrocketing teen vaping could reverse progress in tobacco reduction https://t.co/09tuLo7gB5,ohm_god,2016-07-12 04:30:02+00:00
2986,752721576613654528,It's whatever. Haters still can't see me behind my dank ass vape clouds. ✌🏼️👀,SeaFeeds,2016-07-12 04:29:43+00:00
2987,752721565700284416,I liked a @YouTube video from @faze_rain https://t.co/OyHIUGwNsM INTRODUCING DARTH VAPER ft. Vape Lord Nord,SheheryarSk,2016-07-12 04:29:40+00:00
2988,752721436549185536,I liked a @YouTube video from @faze_rain https://t.co/8F98t9jZNc INTRODUCING DARTH VAPER ft. Vape Lord Nord,FKNDuke,2016-07-12 04:29:10+00:00
2989,752721394387988480,"Is Pokemon Go going to be the next vape?

We get it, dude, you Pokemon Go.",OsakaJack,2016-07-12 04:28:59+00:00
2990,752721276779712512,"Lost Vape DNA200, SMY SDNA75 and SX Q Giveaway, and multiple Winners!  https://t.co/EQznq4zPz7",pizza_craver,2016-07-12 04:28:31+00:00
2991,752721127219363840,"Teens who vape are 6 times more likely to smoke cigarettes, USC study says - KABC-TV: KABC… https://t.co/BdE6Vowo4Y",GobCity,2016-07-12 04:27:56+00:00
2992,752720918565257216,Frisco Vape Trouble Mint 2 Flavors https://t.co/jmt0GCYwnq #Vape,ModMonth,2016-07-12 04:27:06+00:00
2993,752720789594443776,Just got this offer from @VapeWorld - 710/OIL Vape &amp; Game Giveaway! https://t.co/szys0I3Quh,SquatchLover,2016-07-12 04:26:35+00:00
2994,752720693469536256,this kid legit did a photo shoot of him vaping downtown I'm https://t.co/27hcxbasgR,ocuIarpatdown,2016-07-12 04:26:12+00:00
2995,752720558878588928,I liked a @YouTube video from @faze_rain https://t.co/Xg63ov5QbZ INTRODUCING DARTH VAPER ft. Vape Lord Nord,Mayhem_IA,2016-07-12 04:25:40+00:00
2996,752720410307731456,what if mccree's cigar is actually a vaping cigar,cors1ca,2016-07-12 04:25:05+00:00
2997,752720265277280256,I liked a @YouTube video from @faze_rain https://t.co/pc0EhZzBDC INTRODUCING DARTH VAPER ft. Vape Lord Nord,jenkinsmitch123,2016-07-12 04:24:30+00:00
2998,752720249036746752,I wonder how well a Make America Vape Again hat would sell,spencer429,2016-07-12 04:24:26+00:00
2999,752720133282553857,More on #ecigs Teens who would never smoke cigarettes now getting taste for vaping – study — RT America https://t.co/W0T6cVM3ZX,ausfoodexport,2016-07-12 04:23:59+00:00
3000,752720028777209856,"I decided, when I turn 18 I am going to buy and sell vapes and vape juice to the underage vape gods of Germantown",aleighaaa_r,2016-07-12 04:23:34+00:00
3001,752720001879011328,Vape and Spook Ghost Client giveaway! Thank you @PhazeKlan https://t.co/ZcW1Jpfnuc https://t.co/itqCAdfHpE,MalachiAnderso7,2016-07-12 04:23:27+00:00
3002,752719892076335105,austins vaping with my dad.........,its_ya_girl_d,2016-07-12 04:23:01+00:00
3003,752719796261621760,"jus saw a dude long-boarding, texting and vaping but ur man can't lick u and finger u on-beat .. Sad.",shaundre3000,2016-07-12 04:22:38+00:00
3004,752719738711711745,Yeah I vape https://t.co/nSeH3XIY63,emrofort,2016-07-12 04:22:25+00:00
3005,752719370963525632,"RE-STOCKING pro_art_sydney ‼️ 

stop in for all your #vape… https://t.co/yuH8Bzh1qB",PureHazeVapes,2016-07-12 04:20:57+00:00
3006,752719026069991425,Vaping Watch 5000 Like Giveaway - 3 Winners - Enter NOW!! #vapingwatch #vape #vapelife  https://t.co/FqCvKkrlq3,M_Champion826,2016-07-12 04:19:35+00:00
3007,752718844519706625,"2015 Genuine Cloupor Mini 30W ...:  https://t.co/qLssfxMiCj
#Vape https://t.co/xu8pvXDEpy",VapOrgasme,2016-07-12 04:18:52+00:00
3008,752718759887011841,me when hampton does vape tricks https://t.co/PRghOaaU5Q,covenbye,2016-07-12 04:18:31+00:00
3009,752718753758998528,"Lost Vape DNA200, SMY SDNA75 and SX Q Giveaway, and multiple Winners!  https://t.co/CHl52NGyP8",XxMoBsTaRxX,2016-07-12 04:18:30+00:00
3010,752718455867146240,"Teens who vape are 6 times more likely to smoke cigarettes, USC study says - KABC-TV https://t.co/rNAWDSmHsU",biotechstock,2016-07-12 04:17:19+00:00
3011,752718446920605696,"'We The Vapers' know 8/8/2016 is unavoidable. 'We The People' must hold @US_FDA &amp; @CDC accountable
#vape #vapenation https://t.co/gpGjGkMclU",VapingAirGunner,2016-07-12 04:17:17+00:00
3012,752718431535915012,"007 tries to stop the Doovu Collective, making good use of his new Waterproof Vape Pen.",MI6Archives,2016-07-12 04:17:13+00:00
3013,752718185024159744,"""Vapes are like mouth fadoras"" @TSterlingM",BJI_Fridays,2016-07-12 04:16:14+00:00
3014,752718107920232448,I liked a @YouTube video from @faze_rain https://t.co/JOFVC5ykxC INTRODUCING DARTH VAPER ft. Vape Lord Nord,Teezie_24,2016-07-12 04:15:56+00:00
3015,752717527747268608,"What do 21 yr olds do when they're not vaping? ""Modding"" their vaped.

I NEED NEW FRIENDS PLZ..",KelliSPumpkins,2016-07-12 04:13:38+00:00
3016,752717491714097152,Scoundrel Purple Hybrid 18650 Clone Vape FROM WHOLESALER - FAST FREE SHIPPING $28.95 via eBay https://t.co/N6AUnUWVtA,akdubz53,2016-07-12 04:13:29+00:00
3017,752717424152096768,Epic #vape giveaway! Enter to win a Wotofo #TrollV2 RDA or #Conqueror RTA from @v_a_p_e &amp; @wotofoofficial. #VapeLife https://t.co/L5QJTTZLGz,M_Champion826,2016-07-12 04:13:13+00:00
3018,752717369273909248,I liked a @YouTube video from @faze_rain https://t.co/XtGB3pEVZs INTRODUCING DARTH VAPER ft. Vape Lord Nord,rileyyartz,2016-07-12 04:13:00+00:00
3019,752717269013262336,I liked a @YouTube video from @faze_rain https://t.co/JFSCtuCLaW INTRODUCING DARTH VAPER ft. Vape Lord Nord,oSykOh,2016-07-12 04:12:36+00:00
3020,752717196904763392,INTRODUCING DARTH VAPER  ft. Vape Lord Nord @fazerain funniest shit https://t.co/GL40E766U0,ITC64592889,2016-07-12 04:12:19+00:00
3021,752717104965513217,"Lost Vape DNA200, SMY SDNA75 and SX Q Giveaway, and multiple Winners!  https://t.co/kFef5ALn47",vickieleitch23,2016-07-12 04:11:57+00:00
3022,752716993254465536,"""Ey vape god!"" 😂😂 @notreallybeto",juandantheman,2016-07-12 04:11:30+00:00
3023,752716911293583360,papa smurf is THE best vape juice in the world swear,aly44a,2016-07-12 04:11:11+00:00
3024,752716815151747072,Vaping Contests &amp; Giveaways https://t.co/2vjh1dB9eo,danzzpc_danny,2016-07-12 04:10:48+00:00
3025,752716739637448704,Gently Vapes In My Own Ass,GentlyBotz,2016-07-12 04:10:30+00:00
3026,752716524817899520,I liked a @YouTube video from @faze_rain https://t.co/BAQXApNNGW INTRODUCING DARTH VAPER ft. Vape Lord Nord,PiccolosDende,2016-07-12 04:09:38+00:00
3027,752716502151925760,I liked a @YouTube video from @faze_rain https://t.co/md6yO1wGx1 INTRODUCING DARTH VAPER ft. Vape Lord Nord,nickbennett475,2016-07-12 04:09:33+00:00
3028,752716483243806720,Just got this offer from @VapeWorld - 710/OIL Vape &amp; Game Giveaway! https://t.co/PVH0yiHEm4,vickieleitch23,2016-07-12 04:09:29+00:00
3029,752716458640175104,Vaping or smoking ? - None  https://t.co/JyiW6ABco9,saidaavila11,2016-07-12 04:09:23+00:00
3030,752716232856592384,"Shh ~~~~~~~~~~~~~   Stealth vape!
#style | #tmc | #torontovapes | #gotone | #vaper |  #stealthvape https://t.co/eMMZkWIo1p",Marshalls_best,2016-07-12 04:08:29+00:00
3031,752716182533267457,GOOD LUCK TO ALL! The giveaway has started! Spook and Vape giveaway! https://t.co/me0GpNat4h,PhazeKlan,2016-07-12 04:08:17+00:00
3032,752716151675772928,"Lost Vape DNA200, SMY SDNA75 and SX Q Giveaway, and multiple Winners!  https://t.co/pxYocJpx0O",amanda031599,2016-07-12 04:08:10+00:00
3033,752716079189913601,I liked a @YouTube video from @faze_rain https://t.co/qi7cZ5zTAX INTRODUCING DARTH VAPER ft. Vape Lord Nord,KevnBurrows,2016-07-12 04:07:52+00:00
3034,752716038291136513,"Lost Vape DNA200, SMY SDNA75 and SX Q Giveaway, and multiple Winners!  https://t.co/2vjh1dB9eo",danzzpc_danny,2016-07-12 04:07:42+00:00
3035,752715954455351297,#neverforget when @MjAprahamian took the plastic off his vape batteries &amp; they burst into flames in his room and the dorm had to evacuate,MackenzieKLH,2016-07-12 04:07:22+00:00
3036,752715786666385408,"Lost Vape DNA200, SMY SDNA75 and SX Q Giveaway, and multiple Winners!  https://t.co/WmU3gMPw7T",JKourelis,2016-07-12 04:06:42+00:00
3037,752715671738417152,"Our raffle is now live! Come try your luck and win a $40 vape!
https://t.co/uxbju6PXWp
#evoxelabs #cca #ccaraffle #wearecannabisculture",CannaCULTURAL,2016-07-12 04:06:15+00:00
3038,752715523985543168,I love vape life :(,redtaiI,2016-07-12 04:05:40+00:00
3039,752715480813735940,"Study suggests vaping can harm the heart, but it's far from proven https://t.co/9P6FDJPrx4",ABQJournal,2016-07-12 04:05:30+00:00
3040,752715451877171201,I liked a @YouTube video from @faze_rain https://t.co/c3TBFqKGti INTRODUCING DARTH VAPER ft. Vape Lord Nord,johnnydelta03,2016-07-12 04:05:23+00:00
3041,752715240274554880,Just busted my fuckin dome on the vape pen.. gotta getta new one tmrw lol need the wax on the go,realtbreezy,2016-07-12 04:04:32+00:00
3042,752715053036625920,"""Is that a vape"" 👀 @kendaaalllxoxo_",alkamide,2016-07-12 04:03:48+00:00
