,TweetID,TweetContent,TweeterUsername,TweetDatetime,TweetLongitude,TweetLatitude,TweetPlace
597,1505575243770998784,Gotta stop smoking these disposable vapes,FormulaFlea,2022-03-20 16:01:25+00:00,,,
598,1505575051730505729,It's the official first day of spring when flowers begin to bloom! The perfect time to remind you of Dr. Dan's recommended way to dose #medicalcannabis: 5 milligrams of flower product using a dry herb vape. https://t.co/u60ydNjJ8L,OzarkMMJCards,2022-03-20 16:00:39+00:00,,,
599,1505574986865692676,I thought vapes were just like replacement for people that smoke I’m confused why every single human uses one now,stephaniepower_,2022-03-20 16:00:23+00:00,,,
600,1505574969270542345,"Vandy Vape Pulse 80W VW AIO Kit
Buy it on:
https://t.co/2hVbCWAHkv https://t.co/ccv9zljmbV",3FVape,2022-03-20 16:00:19+00:00,,,
601,1505574965386805248,Vape Bad,Dont_Vape_Bot,2022-03-20 16:00:18+00:00,,,
602,1505574940149485571,Wanting to die and vaping in the school bathroom 😩,linosmexiwife,2022-03-20 16:00:12+00:00,,,
603,1505574455472492549,if you tell someone to stop vaping enough i promise they’ll hear you.,maduhlenn,2022-03-20 15:58:17+00:00,-95.823268,29.522325,"Houston, TX"
604,1505574443359215626,I’m thinkin abt how dangerous it is that there’s an auto press on my new vape battery cos like what if I accidentally leave it on!!! What then!,clownerooni,2022-03-20 15:58:14+00:00,,,
605,1505574196755238913,Teenagers are so terrifying but so embarrassing?? Why are you all wearing the same outfit and vaping the same vape and how are you doing it intimidatingly,kirk396,2022-03-20 15:57:15+00:00,,,
606,1505573322335084549,listening to someone tell me sunscreen isn’t natural or good for you as they hit a vape,duncanreavis5,2022-03-20 15:53:46+00:00,,,
607,1505573087772823553,Y'all still out here vaping ? 😭💀💀,stephanie_wins,2022-03-20 15:52:50+00:00,-98.778559,29.141956,"San Antonio, TX"
608,1505573086447480836,Day 1 down no vaping. 🙏🏼,_samanthamarie8,2022-03-20 15:52:50+00:00,,,
609,1505572383419080704,Op-Ed: Summoning vaping is dangerous. Here's why.,timesopinionbot,2022-03-20 15:50:03+00:00,,,
610,1505572186702163968,"Some of the hired security were vaping whilst enforcing rules and stewards could only say “we can’t do anything.” Not a great look at all, is it? The rules apply to all… or at least they’re meant to.",TaylorBAFC,2022-03-20 15:49:16+00:00,,,
611,1505572083442630660,"Bruh nothing gives me anxiety like people talking after hitting a vape without exhaling

Like fucking S T O P",bab_itch,2022-03-20 15:48:51+00:00,,,
612,1505572058247593990,i vaped yesterday and ngl i kinda liked it,pjmscal,2022-03-20 15:48:45+00:00,,,
613,1505572011694866436,I did my makeup so I could sit in my bed and vape all day https://t.co/sghfTQjS48,SgtCygnus,2022-03-20 15:48:34+00:00,,,
614,1505571604654350338,"Not a bitch that malfunctions without her vape pen tryna tell me smoking cigs is bad…. Baby … honey you were clearly dropped as a child and hit every step of the stairs on the way down 

Mind your business",sugargiv3r,2022-03-20 15:46:57+00:00,,,
615,1505571583791931395,"no breakfast, just iced coffee and vape",hexgloomy,2022-03-20 15:46:52+00:00,,,
616,1505571196930297866,Doja stay with a vape pen,_hennycram,2022-03-20 15:45:20+00:00,,,
617,1505571174633422860,hits vape,prettybrvnette,2022-03-20 15:45:14+00:00,,,
618,1505570749985165314,All our trains and stations are no vaping areas. Please do not vape.,traindroid_se,2022-03-20 15:43:33+00:00,,,
619,1505570673636540416,vape usto ko,PerezMarnel,2022-03-20 15:43:15+00:00,,,
620,1505570018855165952,No way this 15 years old wh*te guy showed some sunil kumars id to buy the juul tobacco I AM CRYINGGG🤣🤣🤣,mominaaxx,2022-03-20 15:40:39+00:00,,,
621,1505569694463324160,"wow so vapes know how to tweet. lol

BIGBANG IS BACK 
#WelcomeBackBIGBANG",yamesor_a,2022-03-20 15:39:21+00:00,,,
622,1505569131998892032,Vapes we’re famous! https://t.co/8b5pgXM7rE,nazsneak,2022-03-20 15:37:07+00:00,,,
623,1505568985810620429,"joint in one hand, vape bag in the other 😌",poooosiekat,2022-03-20 15:36:32+00:00,,,
624,1505568343914254341,where has vaping been my whole life,thinkplank,2022-03-20 15:33:59+00:00,,,
625,1505568285932326919,"as i get ready to leave my home, i want you all to know that i did get frank’s bud and vape👑 thanks king",gigipop724,2022-03-20 15:33:46+00:00,,,
626,1505567859577180162,Vape pen cured 2 out of 95 PMDD symptoms let’s gO,j_killasmooth,2022-03-20 15:32:04+00:00,,,
627,1505567396068737024,"Today is the start of spring 🙌🌞

What better way to start enjoying the (hopefully) warmer weather than with a bottle of #Eliquid from Rachael Rabbit.

🔍 Get yours in store or online: https://t.co/MewXlFnAj0

#Vaping #Eliquids https://t.co/JWAdKCtylP",EvapoHub,2022-03-20 15:30:13+00:00,,,
628,1505567135363330051,NO VAPING! I just threw out the third pen this week! WHERE ARE YOU GUYS EVEN GETTING THESE!?,darius_txt,2022-03-20 15:29:11+00:00,,,
629,1505566885936476160,going back to my dirt bag roots (hitting the vape and drinking a monster with my shoes on the furniture),cerulean_tear,2022-03-20 15:28:12+00:00,,,
630,1505566833025470470,ive got a vape rn cos i cant afford cigs rn and its the worst experience of my life i cant believe i used to do this regularly,whor3bit,2022-03-20 15:27:59+00:00,,,
631,1505565704971591684,Is vaping ok for pregnant women?,mukumoya,2022-03-20 15:23:30+00:00,,,
632,1505565621454577676,"Tonsillectomy recovery day 3, seriously thought about sticking a juul up my nose to get a nic buzz for a minute.",guccifer_x,2022-03-20 15:23:10+00:00,,,
633,1505565479640915968,"Them anti vape ads annoying af. i get it I’m not dumb, Ik vapes are bad just shut up so I can listen to my Spotify or watch a video",StanSkittles,2022-03-20 15:22:37+00:00,,,
634,1505565381783859201,"Low minimums available for wholesale. From your #1 trusted safe source for innovative vape products @o2vape

https://t.co/mbFhSSjxpM

#customvape #customvapes #vapepen #vaping #vape #glassvegas #champstradeshow #wholesalevape #vapecarts #cannabiscup #mjbizcon https://t.co/fMUlgb5jTE",O2vape,2022-03-20 15:22:13+00:00,,,
635,1505565176980021249,Raw Garden concentrate and vape goodies are now on the webshop! Get yours delivered today!! #iheartcannabis https://t.co/26Yu9ol5LA https://t.co/tpVCJddzpy,CannabisIheart,2022-03-20 15:21:24+00:00,,,
636,1505564239452381184,the vape hit different in the mornings 🥴😌,zyneshiaai,2022-03-20 15:17:41+00:00,,,
637,1505564056194887683,Just posted a photo https://t.co/VTgk24Ysjj,vape_z0ne_uk,2022-03-20 15:16:57+00:00,,,
638,1505564047625920515,I'm Ross Kemp and I'm at the Vape Shop to meet a topless Boris Johnson,botskemp,2022-03-20 15:16:55+00:00,,,
639,1505563735615803394,"The hun who got herpes from her vape, is she okay now? And what type of herpes are those? ""Flu herpes"" or sex herpes?",uNomafu_,2022-03-20 15:15:41+00:00,,,
640,1505563133254901761,You Will Dream In Under 20 Minutes To ASMR Dubstep (Vape Unboxing!!),TitlesASMR,2022-03-20 15:13:17+00:00,,,
641,1505562724515909636,"Grey, I must inform you that Eddie has started vaping.",peepers_bot,2022-03-20 15:11:40+00:00,,,
642,1505562654684893184,don’t come round me blowing no fucking vape smoke in my face bitch,kaeelak,2022-03-20 15:11:23+00:00,,,
643,1505561570809634822,"♣️ Kingpen ♣️ 
{{ SUNDAY’S ONLY until 04/10 }}

Buy ANY ✨Kingpen✨ 1G Vape and receive a 1.3g Kingroll for $1!! (Pretax) 
@LemonnadeAnti #lemonnadeantioch #vapes #smoke https://t.co/HPVXV2qmMq",LemonnadeAnti,2022-03-20 15:07:05+00:00,,,
644,1505561481508958210,Is vape vegan,ramona_ebooks,2022-03-20 15:06:43+00:00,,,
645,1505561445798400010,Watermelon lollipop + blackcurrant vape = heaven,cateaternova,2022-03-20 15:06:35+00:00,,,
646,1505561212649885698,VAPES HOW ARE WE FEELING 🎤🎤🎤,kwonjippyong,2022-03-20 15:05:39+00:00,,,
647,1505561170568257537,i havent had a vape in a week STRUGGLING,d4intydiary,2022-03-20 15:05:29+00:00,,,
648,1505561038728663040,The health effects of the chemicals in vaping devices can be debilitating – including on the spine. https://t.co/lfCUU57jBx,USNewsHealth,2022-03-20 15:04:58+00:00,,,
649,1505561006382399490,COMEBACK IS RIGHT AT OUR DOORS VAPES NATION REJOICE  https://t.co/mGli7BF9E9,jszydnwm,2022-03-20 15:04:50+00:00,,,
650,1505560980029325316,Yesterday I saw this group of 11 year olds smoking vapes &amp; fornicating in the bus stop. I mean the youngest girl probably didn't even have tits yet.. The youth is so fucked.,joannadetricci,2022-03-20 15:04:44+00:00,,,
651,1505560826664603656,Just saw three teenagers vaping in a Tesla. Sometimes I hate this timeline we’re living in,AHamSanwich,2022-03-20 15:04:07+00:00,,,
652,1505560727347609603,"WE GET IT, YOU VAPE!",Laslow_Bot,2022-03-20 15:03:44+00:00,,,
653,1505560682200244226,Posts from Vaping Daily for 03/20/2022 - https://t.co/rBrWb1Jb4F,vaping_daily,2022-03-20 15:03:33+00:00,,,
654,1505560531075141633,"Calvin Castiel Reaction Video 
https://t.co/lKco5RH6n1

""DIP IN THE SAUCE"" music video 
https://t.co/wZTbdBQrcS

M $ T R Y O DJ Loonyo SV3 (Sam Versoza III)
Nik Makino Jse Morningstar Jake Piedad🔥
SV Merch SV Squad Spade Vapes

#DJLoonyo | @DJLOONYO2 https://t.co/PEFqnecBp8",LOONYOSWORLDOFC,2022-03-20 15:02:57+00:00,,,
655,1505560485286060037,I wish they made cigarettes or vapes that were extremely healthy for you.,nikkijvandy,2022-03-20 15:02:46+00:00,,,
656,1505560400867123208,"BIG MEDICINE
BIG VAPING
BIG COFFEE
VAXX PUSHERS
C19 SHILLS
ALL DESPISE ME

WHY?

Because I preach pulling 
away from them &amp; 
healing yourself with
diet &amp; habit change!!

When we crush giants
they get so angry!

We must push harder...
#rogerbezanis
#LetsGoBrandon
#fkcovid19 https://t.co/hQAkuAl2Dc",RogerBezanis,2022-03-20 15:02:26+00:00,,,
657,1505560272060174338,"Mom &amp; Pop vape shops ALL OVER THE USA stepped up to help…we bought masks for cops, made hand sanitizer, etc. You don’t hear about that..doesn’t fit the Bloomberg narrative. @SenJonBumstead @SenAricNesbitt @SenMikeShirkey @SenKimLaSata @SenRogerVictory @SenLTheis @SenEdMcBroom https://t.co/N9ROme8bEa",shilling_kimber,2022-03-20 15:01:55+00:00,,,
658,1505560147908874240,Vaping: An Unnecessarily Dangerous Lifestyle Choice | Nature's Real Health https://t.co/ElDpVwo5nX,nicktompan,2022-03-20 15:01:25+00:00,,,
659,1505560126832455683,This kid vapes.,ontologggy,2022-03-20 15:01:20+00:00,,,
660,1505559952265469958,Welcome to The Northern Union Vape Show EP.112 it doesn't make a differe... https://t.co/2iIVIPiK1U via @YouTube,ATCVapereviews,2022-03-20 15:00:39+00:00,,,
661,1505559856597581824,Welcome to The Northern Union Vape Show EP.112 it doesn't make a differe... https://t.co/5JPNXAE0iM via @YouTube,LaidShow,2022-03-20 15:00:16+00:00,,,
662,1505559691635695616,Every time I use my vape I’m reminded of how much I like it. It just rolls me up so nicely and then all of a sudden I am high as shit. https://t.co/3e9humfHUS,BeeNasty_,2022-03-20 14:59:37+00:00,,,
663,1505559686015516677,Im not the one crying about a sex shop being built. But you are silent about the vape shops and the weed stores being built.,Chrislejohnyc,2022-03-20 14:59:35+00:00,,,
664,1505559552426663936,new vape💃🏻,pillowrrygf,2022-03-20 14:59:03+00:00,,,
665,1505559299744960514,I’m seeing too many boys put down the ball to pick up a vape,mikeyy_quotes,2022-03-20 14:58:03+00:00,,,
666,1505559287762132993,a puff of vape + a sip of coffee hits different fuck,bosskloy,2022-03-20 14:58:00+00:00,,,
667,1505558586356903943,Dropped my vape in the toilet...goodnight/ good morning,NovaTheGOD95,2022-03-20 14:55:13+00:00,,,
668,1505558303790833668,my pastor is like “ever lose something that had real value to you and you were relentless in the search to find it??” yeah bitch my vape,astroedn,2022-03-20 14:54:06+00:00,,,
669,1505557709348872195,"It’s so impossible for me to eat in front of people, that instead of just simply making a bowl of cereal I decided to eat 4 fries from the road trip (yuck ikikik) and go hard on my vape",bimbobritt420,2022-03-20 14:51:44+00:00,,,
670,1505557172377341959,Living in nyc is crazy cuz why did the plug add estrogen for trans women to his menu lmfao?????? I just wanted a vape! https://t.co/h06W0aPfJE,Ariellex1_,2022-03-20 14:49:36+00:00,,,
671,1505556994991734785,i stay losing this li thc vape☠️,jakyrafisher1,2022-03-20 14:48:54+00:00,,,
672,1505556486012948491,I think I had a dream where I started vaping last night...,pseudo_csz,2022-03-20 14:46:52+00:00,,,
673,1505555724071546881,"I saw that vaping increases stress. I'm willing to make a well educated guess about what else does:
Being stalked
Being lied to
Being manipulated
Being hacked
Those will increase your stress way fucking more than vaping.",Kelseyneutralwi,2022-03-20 14:43:51+00:00,,,
674,1505555454906277898,Hear me out: Juul but for methamphetamine,hank_trilliams,2022-03-20 14:42:46+00:00,,,
675,1505554948653735937,An employee vaping while behind the counter? Smh,armybrat1976,2022-03-20 14:40:46+00:00,,,
676,1505554900985556994,The most important part of my job is pretending to be my favorite coworkers secretary ❣️ I love to tell people he’s busy so he can vape in the bathroom,grizzfang,2022-03-20 14:40:34+00:00,,,
677,1505554825798459393,"You’re in his dm’s,

 I suck the wrong end of a juul. 

We are not the same.",hooleyhoopla,2022-03-20 14:40:16+00:00,,,
678,1505554635750195205,vape or die,kiawe_bot,2022-03-20 14:39:31+00:00,,,
679,1505554516753719301,HEXO vapes now available across Canada https://t.co/1Yeg6ddE4D #cannabis #culture,PuffinStyle420,2022-03-20 14:39:03+00:00,,,
680,1505553771753091072,I can reasonably keep a pack a day cigarette smoker vaping for $20 a week.  A pack of cigarettes is 12ish in Chicago.  That is a 65$ a week savings. $3380 a year.  More then half of cigarette smokers make less the 25k a year.  What are we doing here?,vapemayor,2022-03-20 14:36:05+00:00,,,
681,1505553762437537795,Do  you fancy a re-usable #DisposableVape ? How is that possible? Our Shell @Shellyboms previews the new @EleafGlobal IORE Vino and tells you all about it here https://t.co/6tQYhh6va9 @EleafUK #Eleaf #IOREVino #Vape #Ecigclick https://t.co/PdPcfFRpOy,EcigClick,2022-03-20 14:36:03+00:00,,,
682,1505553300036501505,"Thank you Mrs. Ramirez, FTPS SAC &amp; Ms. Roseanne Cervelli from the Central Jersey Family Health Consortium for your informative presentation on the dangers and use of Vaping &amp; Marijuana to our RTS students on 3/18/22! @StudentAdv_FTPS @WNews_FTPS @FTPSchools https://t.co/4HRpeYU9tm",NAT_FTPSchools,2022-03-20 14:34:13+00:00,,,
683,1505553016522678273,wow i haven’t vaped in weeks !! 🤩,shaniasandhu,2022-03-20 14:33:05+00:00,,,
684,1505552535423447043,I vape,liquidsnakebot,2022-03-20 14:31:10+00:00,,,
685,1505552454573858817,Just posted a photo @ SHIFT Vape Cainta https://t.co/XCXdUKaqBI,ShiftVapeCainta,2022-03-20 14:30:51+00:00,121.12154,14.57603722,"Cainta, Calabarzon"
686,1505552285530787847,"Did you know that there is an optimal vaping temperature?

https://t.co/jHvxNE2Tz3

#vaping #vape #cannascience #weedlovers #vapingweed https://t.co/Stf66csbFx",TheCannigma,2022-03-20 14:30:11+00:00,,,
687,1505552265276719108,"Vaping could be an alternative to smoking, to try and get off it but vaping could lead to more health problems that smoking doesn’t give you",Dont_Vape_Bot,2022-03-20 14:30:06+00:00,,,
688,1505552194640424964,"Ran out of baccy
Vape died
To skint to buy more, bouta raw dog this day",Shoon_C,2022-03-20 14:29:49+00:00,,,
689,1505551841198673920,"My lungs feel so much better after quitting vape. 

I’ve been a year free of it.",HunterFrench23,2022-03-20 14:28:25+00:00,,,
690,1505551707287207942,"To all my weed vaping friends here, I have a question: Mighty+ or Pax3? Out shopping for a vape",itscharliecrown,2022-03-20 14:27:53+00:00,,,
691,1505551131602300931,Haha Johnathan you are vaping in my Subaru,TheSubaruBot,2022-03-20 14:25:36+00:00,,,
692,1505550540570255364,thinking about the time a drunk college kid paid me $50 for one mango juul pod,yngjcb,2022-03-20 14:23:15+00:00,,,
693,1505550144401551362,"The last 2 days all I've done is vape, drink bang, and and eat junk food. Feels good to be home.",tEdBuNdYsImP,2022-03-20 14:21:40+00:00,,,
694,1505550026898128896,"I quit Vaping yesterday, how do I function now?",RussellCooper42,2022-03-20 14:21:12+00:00,,,
695,1505549858928795651,Vape shops are just as bad. Try and sell you 10 different hings before finally geeing you what you asked for.  A dinny care about pg/vg or coils or nicsalts just gee me what a asked for ya vape dick,darryl_brockie,2022-03-20 14:20:32+00:00,,,
696,1505549804360896519,"I’m glad I’m banned from competitive. Every tourney just goes from A to B

A: Tournament announces and everyone’s excited and scrambling for a teammate

B: Everyone complains about the gamemasters and shit anticheat and all the edgy Hypixel SS kids using Vape

come full circle 💩",wheaseee,2022-03-20 14:20:19+00:00,,,
697,1505548616563400704,Honestly can’t tell if it’s vape clouds or ringland failure,TheSubaruBot,2022-03-20 14:15:36+00:00,,,
698,1505547883835232261,Chill on the vapes,swooopppp,2022-03-20 14:12:41+00:00,,,
699,1505547780172894215,"HAPPY BIRTHDAY @seebeentaar dan hyunjin wink wonk, selamat hit the juul dan smoking secara legal. Don't forget to always use protection &lt;3",transeatory,2022-03-20 14:12:17+00:00,,,
700,1505547747880960000,If he looks for his vape before you in the morning 🚩🚩🚩🚩🚩🚩,SpaceAlienBae,2022-03-20 14:12:09+00:00,,,
701,1505547733741965314,Did vaping take off in ireland with young people dyu think (okay like 23 to 30 specifically) or do I just have scaldy mates who crave the acoustic fag. the wee gays here are mad into their bootleg vapes you buy from a deli like diet yanks or something smells quare nice tho ngl,punchedmonet_,2022-03-20 14:12:06+00:00,,,
702,1505547532193124354,"💰 Looking for a steal? VC2 Twin 18650 Charger by Xtar is now selling at £12.99 💰
👉 Product by Xtar 👈
 Grab it ASAP https://t.co/XYnKjEpyDF https://t.co/vxM5M0xgf9",home_vapers,2022-03-20 14:11:18+00:00,,,
703,1505547186368565252,I flew to work 80+mph blasting Sunday gospel music while vaping tf out of my weed pen &amp; eating my breakfast wrap,ZaddieVee,2022-03-20 14:09:55+00:00,,,
704,1505546527519162368,"Still very much hurting tbh, but I found my vape pen I thought was lost forever. 😌",buhhritanee,2022-03-20 14:07:18+00:00,,,
705,1505546223650054150,"$COTI -vs- $DANA stable coin thoughts?
#CardanoADA #Cardano",Ranger_Vapes,2022-03-20 14:06:06+00:00,,,
706,1505546065235234818,"story time: i tried vaping sometime last week just for the fun of it HAHAHA as soon as i inhaled the smoke, my asthmatic lungs instantly gave up and i ended up wheezing HAHAJALSLDHSHSHSHSHS it was a cool experience doe 😂 but will i try it again??? hmmm we’ll see aw 😉",mercrupok,2022-03-20 14:05:28+00:00,,,
707,1505545945463013383,yes may couple vape na kami🖐️😭,stcy_bb,2022-03-20 14:04:59+00:00,,,
708,1505545835274452993,Want to try vape or the real rokok sumpah 😐,lalaiswatching,2022-03-20 14:04:33+00:00,,,
709,1505545787396468736,"🔞 hi @ultsyubji @sujimsbf because of my attachment to rujo and yohan, i painted my snowplus with daisies just like what seb did to rujo's juul 😔 miss ko na sila so much https://t.co/783hi3ZF66",J00NCUERV0,2022-03-20 14:04:22+00:00,,,
710,1505545782941741057,"lost and found my tote bag and phone, thankfully my phone and deems and vape are all still there, minus my whisky Zojirushi",edwardiswong,2022-03-20 14:04:20+00:00,-123.224215,49.19854,"Vancouver, British Columbia"
711,1505545555870728194,Dear Crank Parents ;) - It's water 💧 fluidified that will be used to power the vaping factories!  Since it is compatible with the atmosphere to create holy rain as it dissipates into the atmosphere https://t.co/ktoyNzH1X6,michel_bengo,2022-03-20 14:03:26+00:00,,,
712,1505545359443083267,Serious question. Do y’all not know that vape pens can hold charges damn near everywhere?,badmuva_,2022-03-20 14:02:40+00:00,,,
713,1505545187652771845,just a fun lil update im 27 hours in and still throwing up and if someone could bring me a vape that'd be sick &lt;3,raisinbransam,2022-03-20 14:01:59+00:00,,,
714,1505544947323346945,"Smokers get smoking-related diseases that are treated with drugs.

Future smokers are future revenue for BigPharma.

Youth are experimenting with vaping instead of smoking which means they won't become smokers and get those smoking-related diseases.

https://t.co/4o5S3YAPin https://t.co/rZJj5wHL22",VAEPinfo,2022-03-20 14:01:01+00:00,,,
715,1505544582964166657,When you vape with nicotin its really important that you got a vaporhead extra for nicotin...,endorian89,2022-03-20 13:59:34+00:00,,,
716,1505544447270047751,I just broke my new vape pen Cart 🥲😂😐,DELAJUKEE,2022-03-20 13:59:02+00:00,,,
717,1505544369092415488,Can DIY eLiquid Save Vaping? https://t.co/Kg559SUdM1 via @YouTube,TheMateese,2022-03-20 13:58:43+00:00,,,
718,1505544331846991881,"Sunday selfie 🤳 🙌🏻

I hope you have all had a brilliant weekend! 

#qouteoftheday always stay ontop. Don’t let anyone or anything bring you down! 

#MentalHealthMatters #MentalHealthAwareness #mentalhealth #vape #vapelife #vaporwave https://t.co/JdizL9tMXx",thevapeking93,2022-03-20 13:58:35+00:00,,,
719,1505543743927169025,Quitting vaping again,kcalkata,2022-03-20 13:56:14+00:00,,,
720,1505542280765132800,There is absolutely no way I’m going to work without my vape charged today. Absolutely no way.,hippiedippielex,2022-03-20 13:50:26+00:00,,,
721,1505541962853715968,A week in to a month of no drinking.. now I know how the smokers feel puffinging the fu*k out of those vape machines https://t.co/WObLpxhFmZ,Riddy81,2022-03-20 13:49:10+00:00,-3.207316,51.41538,"Penarth, Wales"
722,1505541310949822470,gonna be live tweeting my sisters bridal shower today while i inevitably hide in the bathroom with my vape pen (and this is why i’m the least fave in my family sksksksksj),userthvsangel,2022-03-20 13:46:34+00:00,,,
723,1505540987757727750,DaVinci Vaporizers | VaporNation #vapes #vapepens #rigs #bongs #dabs #pipes #vaporizers https://t.co/hj2EdsOjxq https://t.co/h8y89VKvp5,The_Audio_Pimp,2022-03-20 13:45:17+00:00,,,
724,1505540948406992896,they need a water flavoured vape,nuatalinelmes,2022-03-20 13:45:08+00:00,,,
725,1505540668566945793,"It’s the last day of spring break💀, time to deal with girls fighting at 7 am and dudes doin drugs or vaping at 7 am🤮",beknowndavid1,2022-03-20 13:44:01+00:00,,,
726,1505540378178453507,How to Make a Branded Business Out of Custom Vape Boxes? https://t.co/AwlRdVK8rP,Rajublogmedi,2022-03-20 13:42:52+00:00,,,
727,1505538903100510209,Let me tell y’all how life works I been looking for my thc vape everywhere the day I go buy a new one I fine it been looking for almost a month now smh . I really like my new one tho it’s so cute .,Feisty_lilSky92,2022-03-20 13:37:00+00:00,,,
728,1505538355324665862,VAPE KIDS,LEAFYSVIDTITLES,2022-03-20 13:34:50+00:00,,,
729,1505537725403115520,vape nation https://t.co/z9o25ylQ12,WeHateLuca,2022-03-20 13:32:19+00:00,,,
730,1505537523648507929,Idk i really dont feel like smoking anymore 🤔 i feel like vaping and like snus...,endorian89,2022-03-20 13:31:31+00:00,,,
731,1505537189714829321,"firefly 2 #vapes #vapepens #rigs #bongs #dabs #pipes #vaporizers 
 https://t.co/PC4fwhS0kJ https://t.co/8305T7I1EI",The_Audio_Pimp,2022-03-20 13:30:12+00:00,,,
732,1505537164196474881,Don’t Vape have a Cape,Dont_Vape_Bot,2022-03-20 13:30:06+00:00,,,
733,1505537149453713409,"Did you know that Action on Smoking and Health have released their latest economic analysis of national data to identify the cost of smoking to society in England? 🤔

🗞️ Find out more here: https://t.co/ipB9ShUIPU

#VapeNews #VapingNews #Vaping https://t.co/gu31syZMnL",EvapoHub,2022-03-20 13:30:02+00:00,,,
734,1505536669969125380,freddy fazbear is vaping,L4CGCbot,2022-03-20 13:28:08+00:00,,,
735,1505535944308396032,Tbh i can't wait to see mah KAT and smoke a bowl of flower. Been using vapes all week and some fresh green sounds so delicious,WellTeeks,2022-03-20 13:25:15+00:00,,,
736,1505535784434212876,"I don’t smoke, I don’t vape, I don’t drink, and I don’t do drugs not even caffeine 🤷‍♂️ #imboringasl",TrappyMcFlyy,2022-03-20 13:24:37+00:00,-80.321683,25.7090404,"Miami, FL"
737,1505535635762806784,"For your safety and comfort, this station operates a no vaping policy. Have a nice day.",traindroid_se,2022-03-20 13:24:01+00:00,,,
738,1505534234202718214,i might just buy a vape man,ballsinurjawa,2022-03-20 13:18:27+00:00,,,
739,1505534026605637644,https://t.co/z5BsjrMtUy #cbdedibles  The Breeze Model evaluation -Hemp CBD gummies &amp; vapes https://t.co/hjcZqJJO3x,hempnewsonline,2022-03-20 13:17:38+00:00,,,
740,1505533644101804038,"#edibles #cbdoil #prerolls #cannabis  #vapejuice #cannabiscommunity Let your vaping experience take you flying with 10X Delta-8 THC Grape Ape Vape Cartridge. It’s a quick, easy, on-the-go way to enjoy your favorite buzz-worthy https://t.co/6wZgTyZ3eq #cbdedibles #delta8 https://t.co/OgpBHPEH1d",CBDSmokeShop,2022-03-20 13:16:06+00:00,,,
741,1505533335250083840,"Milk-flavored vape juice

Not chocolate or strawberry milk.

Just plain 2% milk.",micah_gj,2022-03-20 13:14:53+00:00,,,
742,1505533207806201857,"Source #Vaporizers - Source Vapes for #Wax Concentrates | VaporNation  #vapes #vapepens #rigs #bongs #dabs #pipes #vaporizers 
 https://t.co/LRSABVmnbr https://t.co/m6AJjDX9zd",The_Audio_Pimp,2022-03-20 13:14:22+00:00,,,
743,1505532978017050625,tl telling me to buy a vape,nothotchris,2022-03-20 13:13:28+00:00,,,
