,TweetID,TweetContent,TweeterUsername,TweetDatetime,TweetLongitude,TweetLatitude,TweetPlace
306,1505629253848776710,"Depressing music ✅ 
Smoking✅
Vaping✅
Cutting✅
Sketching✅
Ignoring✅ 

Ah, Life.",blufadestogray,2022-03-20 19:36:02+00:00,,,
307,1505628743049494530,"This electric nectar collector takes the pure flavor and convenient vaping experience to the next level! It's great for dabs without the scorching heat typical w/ a regular nectar collector, dab rig, or vape pen. 

*Available for in-store pickup only

https://t.co/42i7K447Co https://t.co/N5ErS7t1Me",ShopShag,2022-03-20 19:34:00+00:00,,,
308,1505628657875886083,"Look at that surly, poor-killing grimace upon a face so fair.

I shall name him Dearth Vaper.",TheAcademyofSun,2022-03-20 19:33:39+00:00,,,
309,1505628600942403585,odeio quando n tragam meus vape tipo why u wasting my spicy air dude,escitaloplara,2022-03-20 19:33:26+00:00,,,
310,1505628526313058304,"running to work late off a walk of nonshame vaping past a family walking out of church, cars been downtown for 2?3? days 🥴&lt;3",lligatoe_87,2022-03-20 19:33:08+00:00,,,
311,1505628481685762054,Been watching a little tv today and they have been playing an ad from Vuse vape pens. They are claiming to use less packing to help save the planet. Maybe by also killing people along the way to decrease the surface population??,PamB1433,2022-03-20 19:32:57+00:00,,,
312,1505628252571942920,"I am now a proud parent to 5 Baby Vapers!🥳 

Even with the recent changes to make the project more sustainable, I'm still earning 1% per day!

They also own #BAYC #3442 in the treasury and developing their own @VAPORCHAlN.

Check it out! 👇👇
https://t.co/I1SL70D1ko

@VaporNodes https://t.co/XTru8mI5Ow",X_Unknown14,2022-03-20 19:32:03+00:00,,,
313,1505627252003938319,it's been two years since I found mint juul pods at a gas station in the middle of the desert,maesteremo,2022-03-20 19:28:04+00:00,,,
314,1505627116720824326,Vapes and arctic monkeys is what’s keeping me alive rn‼️‼️,goldentr0nks,2022-03-20 19:27:32+00:00,,,
315,1505627027617067012,j dropped my bag in middle of new street and crystals and 3 vapes fell on the floor. embarrassing,miaday777,2022-03-20 19:27:11+00:00,,,
316,1505626711534280709,we get it you vape,2Nandope,2022-03-20 19:25:55+00:00,,,
317,1505626450010918913,"Niggas be in the club sharing vapes, like bro do you know who’s dick you just sucked? 😂",therealvntge,2022-03-20 19:24:53+00:00,,,
318,1505626382772183041,all three vapes in my pocket dead or dying and i refuse to work w out it,choxke,2022-03-20 19:24:37+00:00,,,
319,1505626161551925261,I miss having a snake but I can’t get a new one bc its tiny little lungs wouldn’t be able to handle how much of a vape god I am &lt;/3,DirtyFxcker,2022-03-20 19:23:44+00:00,,,
320,1505626161258250242,"For your safety and comfort, this station operates a no vaping policy. Be vigilant, citizens.",traindroid_se,2022-03-20 19:23:44+00:00,,,
321,1505626006132076551,Y’all too young to be on dem vapes dat bad,_iamniya,2022-03-20 19:23:07+00:00,,,
322,1505625905615421440,peer pressured a señora at the club to smack my vape 😭,an9thruiz,2022-03-20 19:22:43+00:00,,,
323,1505625743275040778,"If military strategy expert Bergen is in Ottawa, she’ll be lucky and get vaped, or ushered into a bunker. Not sure Russians still have Toronto on hit list circa Cold War, but doubtful likely targets like Niagara Falls &amp; Trenton reachable within 30 minutes if you want to go quick",roofthatpeach,2022-03-20 19:22:05+00:00,,,
324,1505625588563951621,huzaifa helping me choosing my first vape lmao me bhi burgero wali snaps bhejunga ab,whathefahad,2022-03-20 19:21:28+00:00,,,
325,1505625550328635400,"How have we gone from masks being mandatory on trains, to people openly vaping in a crowded carriage, in less than a month??",beckylu_22,2022-03-20 19:21:19+00:00,,,
326,1505625309126840325,"CORRECTED

US High School ""current use"":

2002:  22.5% (cigarettes only)
https://t.co/64L6iZQukE

2012:  16.8% (cigarettes + nicotine vapes)
https://t.co/2B3UUqLBTS

2021:  13.2% (cigarettes + nicotine vapes)
https://t.co/uwuWMu91OU https://t.co/9Ze8JY4QTJ",ChaunceyGardner,2022-03-20 19:20:21+00:00,,,
327,1505625268517437445,Vaping is so addictive ahh 😭my juice finished and I feel like I’m dying .,UnvleMackenzie,2022-03-20 19:20:11+00:00,,,
328,1505625046584283147,Good vape? #vape https://t.co/CxucENPfYZ,BatuskaCrypto,2022-03-20 19:19:18+00:00,,,
329,1505624984823242757,sometimes when i have no money i suck on a dead vape to get a placebo effect it works half the time if i put my mind to it,slimethot,2022-03-20 19:19:04+00:00,,,
330,1505624870448766979,You mean like a keychain?,juul_survivor,2022-03-20 19:18:36+00:00,,,
331,1505624339219165185,Painting this fckg clown house has me so shook I dropped my vape in the primer 🥺 https://t.co/49V0eXNvnH,urbanelevations,2022-03-20 19:16:30+00:00,,,
332,1505624255291088897,"anti-vaping ad: vaping can add metals like iron and nickel into your lungs. 

me: metal lungs 😎",marleaandme,2022-03-20 19:16:10+00:00,,,
333,1505623816730521605,Pls let us have zero injuries during the international break for once 😩😩😩😩,Juuls_WRLD,2022-03-20 19:14:25+00:00,,,
334,1505623003119370241,Frantically looking for my vape even though i remember putting it on the charger 10 minutes ago. Ah a classic,KCarnageWV,2022-03-20 19:11:11+00:00,,,
335,1505622941299458049,"Not me losing my DDD hat, vape &amp; fracturing my arm in the pits at @versadubz last night 🤣🤣🤣",sektahdubz,2022-03-20 19:10:56+00:00,,,
336,1505622845392670727,thinking about actually where is my vape from the othher day like actually where could it have possibly gone,idrivememad222,2022-03-20 19:10:34+00:00,,,
337,1505622526176673796,my vape died kms,buckleyIvrr,2022-03-20 19:09:18+00:00,,,
338,1505622415426076677,The biggest struggle is laying in bed and losing your vape to your blankets 😅,gteeex3,2022-03-20 19:08:51+00:00,,,
339,1505622230125928453,bought a cherry coke and a juul my life is ok now,catloafers,2022-03-20 19:08:07+00:00,,,
340,1505621703686524928,zack fair sick vape tricks compilation,swagpuppybot,2022-03-20 19:06:01+00:00,,,
341,1505621549751193601,Y’all gotta hit a plug for a vape??,QfoeSicko,2022-03-20 19:05:25+00:00,,,
342,1505621364513951744,"Must say, this is definitely my favourite daytime vape for a while, not enjoyed my medicine so much since the Gorilla Glue, imagine if this hadn’t been irradiated! 🤩

UK Medical Cannabis. Review of Noidecs T20C1 Royal Moby Sativa now avail... https://t.co/MrtBpjDKxo via @YouTube",crazyjane125,2022-03-20 19:04:41+00:00,,,
343,1505621295165321221,clocking out https://t.co/cDikdwNXsS,juul_survivor,2022-03-20 19:04:24+00:00,,,
344,1505621179326943238,"TW // Breaking Habits, Smoking

I'll catch up in a fee min besties, but I will say this...

NEVER START VAPING IN THE FIRST PLACE OR SMOKING OR ANY OF THAT!!!

I backslid, but atm I am tired of wasting more money on abusing food and drink.",ACNH_Jimmy,2022-03-20 19:03:56+00:00,,,
345,1505621072246362112,Bro I lost my vape💔,ChapoRx,2022-03-20 19:03:31+00:00,,,
346,1505620743479971841,Pwhoa!!! China with world's biggest ecig export volume set to kybosh global vaping flavours &amp; open system trade. 👏👏👏 https://t.co/XLyuDymo62 https://t.co/i6Bh8vh8Kx,SimonChapman6,2022-03-20 19:02:12+00:00,,,
347,1505620714631712774,"I need ps plus 😩
It's an L to be unable to play multiplayer if you don't have the plus",Vaper_999,2022-03-20 19:02:06+00:00,,,
348,1505620693802635265,"Just because you don’t need masks in stores, doesn’t mean you can vape in stores.",TheheroTito,2022-03-20 19:02:01+00:00,,,
349,1505620555663351812,"They're here! The new Caribbean-inspired #NicSalts from #WildThing are now in stock! Just £3.49 each or 4 for £10!😀
https://t.co/COMlzmIc6A

#vape #vaping #vapegreen #eliquid #nicsalt #nicsalts #nicotinesalt #vapefam #ukvapers #vapejuice #freeshipping #freeukdelivery https://t.co/ylwwfojIbx",VapeGreenUK,2022-03-20 19:01:28+00:00,,,
350,1505620411853197321,Almost sold someone a nicotine vape cause they just asked for a disposable vape they wanted a delta 8 vape,anneh222,2022-03-20 19:00:53+00:00,,,
351,1505620343834165251,"Choosing an #Eliquid flavour is a very personal choice, and finding a flavour that you want to keep #Vaping all day is an important step for a successful quit attempt 🙌

🗞️ Read more here: https://t.co/QeWBXl27tP

#VapeAdvice #Vaping #VapingAdvice https://t.co/HoyPkuZFlQ",EvapoHub,2022-03-20 19:00:37+00:00,,,
352,1505620298854551554,"12 MORE DAYS!! 12 days until you get to have:

- Free Food
- Free Music
- Discounted Vapes
- FREE JOKERS WITH THE PURCHASE OF ANY VAPE https://t.co/lLPVmXqCOU",tgsmarket,2022-03-20 19:00:26+00:00,,,
353,1505620235419742208,Why would you fucking vape you bitch,Dont_Vape_Bot,2022-03-20 19:00:11+00:00,,,
354,1505620200888094727,"The makers of Marlboro cigarettes—Altria, formerly Phillip Morris—own a huge portion of the e-cigarette company Juul. 

Reshuffling the deck isn’t going to change the cards. Big Tobacco isn’t fooling anyone. https://t.co/9W46iB61g6",YesProtectKids,2022-03-20 19:00:03+00:00,,,
355,1505619842182926342,"The amendments were necessary, Rep. Ryan Yamane said, and were in no way influenced by thousands in donations from tobacco companies and lobbyists.

Source https://t.co/bphi3ktfMd

#VapeNews #vape #vaping https://t.co/9AzMG6QjjN",Kingkongvapeuk,2022-03-20 18:58:38+00:00,,,
356,1505619634455785474,weather is so nice time to go back to cigs instead of vaping lol,cherry0pal,2022-03-20 18:57:48+00:00,,,
357,1505619606857302022,keep hitting vape cuz i forgot giv it back 2 friend Well,shawtyeon,2022-03-20 18:57:41+00:00,,,
358,1505619606290980870,Some duo that 🪄🪄🪄🪄,Juuls_WRLD,2022-03-20 18:57:41+00:00,,,
359,1505619206859014151,How addicted to vape you gotta be to have a carrying sleeve for it? 😭,justfinnjamin,2022-03-20 18:56:06+00:00,,,
360,1505618938096463876,"In the triage room with my doctor:

Doc: Do you dip, smoke, chew, or vape?

Marine: I vape.

Doc: Did you know that the number one reason for (insert chief complaint) here is vaping?

The greatest.",HaseyCagen,2022-03-20 18:55:02+00:00,,,
361,1505618926000308224,People Being Trippy after 1 Puff of Vape Then Thinking of Cigarette 💨 😂😂,NishchayKhurana,2022-03-20 18:54:59+00:00,,,
362,1505618454061064193,trying to fight the urge to vape in the uber like a sexy werewolf fighting its transformation during a full moon,cheeklings,2022-03-20 18:53:07+00:00,,,
363,1505618351904669699,"Cigarettes &gt; vapes 
Any fucking day of the week https://t.co/4auLjvYAdq",NormalHendrix,2022-03-20 18:52:42+00:00,,,
364,1505617903588159488,"inhaling all that fart and encapsulating them substance in a empty juul pod so i can vape them later, when i miss mikasa, and have hopes she get her hands on my neck and wring it and this the last thing i see https://t.co/l6vvyZs3fl",masturba1t,2022-03-20 18:50:55+00:00,,,
365,1505617805894332416,Are air fryers the equivalent to vaping? 🤔,HaleyVeraisabe1,2022-03-20 18:50:32+00:00,,,
366,1505617740639350787,"My dad has been trying to gaslight me about him smoking/vaping weed in the house. It was my one recovery boundary, just do it outside. Like the occasional smell isn't a trigger, but *strongly* smelling it every single night in my room with a closed door...it fucks with you.",MelsAngels711,2022-03-20 18:50:17+00:00,,,
367,1505617597013897217,Haven’t rolled a blunt in a min str8 Vape,RoseBlkHuncho,2022-03-20 18:49:42+00:00,,,
368,1505617494266064898,Terrible call . 1. Coach in the back appears to be vaping. 2.,itsthecurls,2022-03-20 18:49:18+00:00,,,
369,1505617426120994816,You know I really like someone when I don’t scream at them for losing my favorite vape pen 🤷🏻‍♀️ you are one lucky little dude 💀🦋,towerofdaniels,2022-03-20 18:49:02+00:00,,,
370,1505617180750069760,"bouta go buy myself a vape, reimburse me that $23 pet 😘

findom ~ finsub ~ paypig ~ beta ~ cashpig ~ humanatm",brainspitz,2022-03-20 18:48:03+00:00,,,
371,1505617110764081153,Lmaoooo yo I took a couple pulls of my vape for the first time in 8 months and facts,mulatttogem,2022-03-20 18:47:46+00:00,,,
372,1505617108373327875,coal vape https://t.co/3IHCcOAj2P,mcwalles420,2022-03-20 18:47:46+00:00,,,
373,1505617030325673991,Accidentally washed a mostly empty vape juice bottle with my clothes but now everything in that load has a +1 stamina buffer,ChillenThaMost,2022-03-20 18:47:27+00:00,,,
374,1505616991629025288,this delta 8 vape tastes like dirt lol,deej__________,2022-03-20 18:47:18+00:00,,,
375,1505616931398819840,Pennsylvania’s sudden move to recall marijuana vapes raised questions. Were these products harmful all along?   https://t.co/i1u2QdnVtp via @PhillyInquirer,jyeh29,2022-03-20 18:47:04+00:00,,,
376,1505616697134301206,"Over a week without smoking cigarettes! After nearly 20 years of smoking them, well done bub @Dad_Squad_ 🥰 #streamer #UKStreamer #Vaping #NoCigarettes #youtubegaming #twitchstreaming #smallstreamer #pcgamer https://t.co/dwYheC9kc5",Miss_CJ___,2022-03-20 18:46:08+00:00,,,
377,1505616290999947270,changing vape flavours for her why have i fallen this deep?,pineslims,2022-03-20 18:44:31+00:00,,,
378,1505616204601311239,"PARKER, I WANT PICTURES OF SPIDER-MAN'S VAPE BY SATURDAY AFTERNOON OR I'LL SADPOST ON MY STORY",jonahjamesonbot,2022-03-20 18:44:10+00:00,,,
379,1505616069779730440,"Gonna open a vape shoppe that also sells scones, call that shit a vapery.",TheAndersHour,2022-03-20 18:43:38+00:00,,,
380,1505615949751271427,"i just discovered a new way to clean the hose attachment for my desktop vape, everyday is a new day 4 knowledge lads 🧠⚡️ https://t.co/cGFJAJYnJZ",syst_anmly,2022-03-20 18:43:10+00:00,,,
381,1505615838899957760,Where the fuck am I supposed to buy a vape from up here,nessalovezyou,2022-03-20 18:42:43+00:00,,,
382,1505615757912285184,the taehyung vaping jokes were never funny https://t.co/Cy1Qri40Pw,T4EHYUNGSE0K,2022-03-20 18:42:24+00:00,,,
383,1505615693236080641,"#edibles #cbdoil #prerolls #cannabis  #vapejuice #cannabiscommunity Pineapple Express Vape Cartridge 900mg Go higher, harder, and faster with 10X disposable vape cartridges infused with Delta-8. It’s a quick, easy, on-the-go way to https://t.co/7DO1F9vTvg #cbdedibles #delta8 https://t.co/Agfv7ZpBy4",CBDSmokeShop,2022-03-20 18:42:08+00:00,,,
384,1505615688634937346,i wanna go to the vape store but i dony wanna drive there this is so fucked up,spiralweather,2022-03-20 18:42:07+00:00,,,
385,1505615510188212231,"my manager and coworker scolded me for eating fruit snacks and vaping for lunch bc apparently that “isn’t a real meal”
like i know they mean it in a mom kind of way like, they care about me but STILL LET ME LIVE MY BEST SKINNY LIFE OKAY https://t.co/KiC37Mg8et",dainty_gh0st,2022-03-20 18:41:25+00:00,,,
386,1505615446376071176,"TW // Nicotine Usage

Besties, sigh, after a year and a half of being clean, I'm back to vaping.  Just canNOT deal with the stress anymore, I refuse to abuse alcohol and refuse to abuse my prescription drugs!  I'm sorry.",ACNH_Jimmy,2022-03-20 18:41:10+00:00,,,
387,1505615345251356673,"i’ve only gotten attention on twitter like once, but i’m writing this down to set it in stone for myself. today marks DAY 1 of no nicotine. no cigarettes, no vapes, no punches, nothing.",nkailx,2022-03-20 18:40:45+00:00,,,
388,1505615338033106948,"Armerah 510 thread cooling heatsink adaptor for 22mm #ecig #vape tanks made from tough and hygienic stainless steel. Just £5.99 each, fast shipping from UK stock, buy online here https://t.co/NszShzUC6m https://t.co/c10q8S8dus",armerahuk,2022-03-20 18:40:44+00:00,,,
389,1505614909236813827,R5’s Bad Motivator : reincarnation: https://t.co/N61VPBlDmX #r5d4 #badmotivator #vape #StarWars #astromechdroid #Authentic …only a week to get R5’s bad motivator working again 😂👍🏽 https://t.co/GALSv4yVeL,JamesR5D4,2022-03-20 18:39:01+00:00,,,
390,1505614905507995652,Starting to like the portable vapes more than the carts,HighNaj,2022-03-20 18:39:01+00:00,,,
391,1505614658455195652,guess who forgot their juul charger at their bfs again 😀,YSLGLAMOUR,2022-03-20 18:38:02+00:00,,,
392,1505614528133926913,I want a new vape,nyebankz,2022-03-20 18:37:31+00:00,,,
393,1505614136335638530,R5-D4's Bad Motivator system 2021 - Part 1.3: https://t.co/XUJLeeoYLV #r5d4 #badmotivator #StarWars #astromechdroid #electonics #vape #remotecontrol ….thought I’d posted this post last year 😂😂😂 https://t.co/bdMdsL6AS0,JamesR5D4,2022-03-20 18:35:57+00:00,,,
394,1505614102776930310,Sums up my Sunday margarita vape and pished https://t.co/Dl7eVH8sjn,jasonmeacher,2022-03-20 18:35:49+00:00,,,
395,1505613847268274178,"its wild that mfs think they tough for vaping, bro you smell like strawberry and vanilla no one thinks you’re cool. 
🚫🧢",Master_Yodie,2022-03-20 18:34:48+00:00,,,
396,1505613700576727045,I saw who used Stax’s vape last night 😭,chilo_ket,2022-03-20 18:34:13+00:00,19.9976747,-26.9070352,Botswana
397,1505613685741424641,"howdy gen z... vaping is not a personality trait!!! think about it.
😌",generationZpsa,2022-03-20 18:34:10+00:00,,,
398,1505613478488272896,Not me almost vaping in front of my father lol,maaryll27,2022-03-20 18:33:20+00:00,,,
399,1505613214440062978,"we got so wasted last night we tried to hit a vape that was vibrating??

it was a nose trimmer.",AlixRude,2022-03-20 18:32:17+00:00,,,
400,1505613001474203650,just vaped resin with my metamour 😵,gayweedbot,2022-03-20 18:31:27+00:00,,,
401,1505612937607757829,sometimes i hella miss my vaping days,elierobbins,2022-03-20 18:31:11+00:00,,,
402,1505612667771400193,"93TAB

Brutal technical precision from Independent Mods.

The DNA ripping 93TAB available now!

https://t.co/ZaMLr4WdLs

 #vape #dnaboard #vapemod #boxmod #independentmods #evolv #stealthvapeUK #whysquirrel https://t.co/hFQvP53upj",Stealthvape1,2022-03-20 18:30:07+00:00,,,
403,1505612597562949635,Okay todays the day I put down nicotine and vaping for good! Cavities are worth it they really hurt and my mouth health is suffering! That’s it ima quit nicotine for good,BelleVeeta,2022-03-20 18:29:50+00:00,,,
404,1505612531863371782,Charging my vape for the sole reason of smoking weed while my sweetie sleeps soundly on my titties,lynzoheartthrob,2022-03-20 18:29:35+00:00,,,
405,1505612358022012932,Please looks at these Cigarette Crusaders in my mentions cause my tweet 😭. The Vaping Vixens. Grown ass clowns,RaikageRakeem,2022-03-20 18:28:53+00:00,,,
406,1505612319748988932,They just vape and do cigarettes lol,__FemmeFatalee_,2022-03-20 18:28:44+00:00,,,
407,1505612307291799554,why do gross ass men smell like watermelon vape? be a man and pick up a cigarette,golddigger28,2022-03-20 18:28:41+00:00,,,
408,1505612216912990209,"Another New vape heading my way soon, the innokin Endora T18E, in a nice Rainbow finish https://t.co/iYenSHEK1k",MartynWilliams6,2022-03-20 18:28:20+00:00,-3.6710871,51.59196,"Maesteg, Wales"
409,1505612141818122241,"it's almost 2:30 AM anyway have fun vapes!

BIGBANG IS BACK 
#WelcomeBackBIGBANG",yamesor_a,2022-03-20 18:28:02+00:00,,,
410,1505612011262160900,quitting vaping worst decision ever i want to scream and cry and i don’t even have mango flavoured air 😕😕😕😕,blairpfaff,2022-03-20 18:27:31+00:00,,,
411,1505611998909894661,"""what cant u do without"" - A vape 💨 #tellonym  https://t.co/oziLBnfOSV",loulalou0,2022-03-20 18:27:28+00:00,,,
412,1505611813613879298,it’s literally a crime that i “can’t juul” here,uncle_daddy_420,2022-03-20 18:26:43+00:00,,,
413,1505611709389676550,Lost my vape. I'm gna cry,Denzi_DeeDz,2022-03-20 18:26:19+00:00,,,
414,1505611339963809798,i hate people who vape i cant lie,morro_ofwind,2022-03-20 18:24:51+00:00,,,
415,1505610904053989377,the mother in front of me hitting her vape 😭,ballerinahrry,2022-03-20 18:23:07+00:00,,,
416,1505610626109947912,"NEW VIDEO 🔥🔥🔥 VAPMAN INTRO AND HOW TO VIDEO. Check it out the full video @ https://t.co/SE0Qc35rBP
The VAPMAN is a very unique device that has been around since the early 2000’S. invented in Switzerland by Rene Balli and now reemerging in the vape world.
#vapman #vaporizer https://t.co/E5de9ExFOd",TheStashShack,2022-03-20 18:22:00+00:00,,,
417,1505610242800893955,This Green Tea vape really tastes like green tea and I'm very much pleased! I need to try this Mike Tyson 2.0 shit.....kinda dumb if it's really just a bag and the dispo really just uses their bud...if so wtf is that Mike?,JustBrittney26,2022-03-20 18:20:29+00:00,,,
418,1505610161838297092,"Another New vape heading my way soon, the innokin Endora T18E, in a nice Rainbow finish @ Charles Row https://t.co/La0yGz6WnN",MartynWilliams6,2022-03-20 18:20:10+00:00,-3.66126871,51.61379089,"Maesteg, Wales"
419,1505610097120141321,THE DEADLY DUO STRIKES AGAIN 😍😍😍😍😍😍😍😍😍😍😍,Juuls_WRLD,2022-03-20 18:19:54+00:00,,,
420,1505609497305391104,"Just posted a photo @ New York, N Y https://t.co/SHYvU1FtzO",vape_nation411,2022-03-20 18:17:31+00:00,,,
421,1505609477420195842,getting on a plane for the first time in 4 years jus realised i cant vape im gona cry,spilledfrube,2022-03-20 18:17:26+00:00,,,
422,1505608925357424654,Dis foger vape been bussin Al week,DreezyNapz,2022-03-20 18:15:15+00:00,-97.129669,32.8785707,"Grapevine, TX"
423,1505608561979707395,i got my vape in my purse ☝🏾🤣,kxn_dxwns,2022-03-20 18:13:48+00:00,,,
424,1505607859941396483,"“We get it bro, you vape” 😆",greg_mamba,2022-03-20 18:11:01+00:00,,,
425,1505607854711001096,My mom asked if I was vaping in the bathroom and I convinced her my piss just smells like mint.,Ionlysquirt,2022-03-20 18:11:00+00:00,,,
426,1505607539479785473,Cant believe im on vapes bad 😭 im finna throw this mf away 😭,__myia,2022-03-20 18:09:44+00:00,,,
427,1505607430624980999,all my friends been vaping consistently for the past 5 years,linkielouis,2022-03-20 18:09:18+00:00,,,
428,1505607261334519813,CANT FIND MY VAPE ITS LOST IB TGE BED https://t.co/EyPS4j3uQn,alabamachar,2022-03-20 18:08:38+00:00,,,
429,1505607128966471681,"Smoke &amp; Vape: Public Health Menace, &amp; Panic Attack Inferno https://t.co/lqPHjdvZIt",ShiraDest,2022-03-20 18:08:07+00:00,,,
430,1505607125514567680,i want a vape pen 🖊,finallgirll,2022-03-20 18:08:06+00:00,,,
431,1505607007822397440,Flat on a vape &amp; don’t even smoke,katelyn_foley1,2022-03-20 18:07:38+00:00,,,
432,1505606930240184320,How does a juul work,EverMutating,2022-03-20 18:07:19+00:00,,,
433,1505606513926225922,its me flipping my whole bed for the third time this day trying to find my vape,poompoomnicus,2022-03-20 18:05:40+00:00,,,
434,1505606344841310211,teamo vape de cookies and cream 🫶🏻,vilsanzz,2022-03-20 18:05:00+00:00,,,
435,1505606157544706049,why did my manager just walk into the bathroom. let me vape in peace !,cybernozomi,2022-03-20 18:04:15+00:00,,,
436,1505606110551683077,"The @US_FDA is paying for anti-vaping commercials that promise teen girls they'll look disgusting and their friends won't like them. In other words, peer pressure. How is this different from toxic Tumblr culture?",gregpiper,2022-03-20 18:04:04+00:00,,,
437,1505606107989147649,for the last time kanade I'm not gonna vape with you,jougasak_ebooks,2022-03-20 18:04:03+00:00,,,
438,1505606025046544384,quit my juul 20 days ago. on my 20th day i did my first 8k race (The Shamrock Shuffle). I wasn’t playing when i said 2022 was gone be my year. #NOEXCUSES https://t.co/M75xhtI5z3,ImagineNese,2022-03-20 18:03:43+00:00,,,
439,1505605986446422025,Doctors call to restrict vapes ‘aimed at kids’ as import ban fails to hurt black market https://t.co/4IREDKbwwm,averann14,2022-03-20 18:03:34+00:00,,,
440,1505605674931302414,i feel like all i do is scroll and vape and go to the bathroom hehe,grrrlenergy,2022-03-20 18:02:20+00:00,,,
441,1505605592680841216,Hi. @Lessharmful. Are you a vape lobby group? Asking for friends who are planning to attend your conference.,garthmullins,2022-03-20 18:02:00+00:00,,,
442,1505605507372961794,"So someone was caught vaping (thus the entire drama department may have to be shut down), nose started bleeding which ruined my costume AND i can’t get over a panic attack. I’m having fun guys!!!!!!!!!!!",MorrowLazuli,2022-03-20 18:01:40+00:00,,,
443,1505605435100831745,RT   this bro we need him to stop vaping,Anferneefanpage,2022-03-20 18:01:23+00:00,,,
444,1505605431120515075,"We know that many of you were scared...

Don't worry. 

💥The Davinci IQ2 is back in stock!💥
.
.
.
#vape #vapelife #vapelove #vapecommunity #design #davinci https://t.co/viKrecU78e",VapoShop,2022-03-20 18:01:22+00:00,,,
445,1505605231513636872,quit vaping and smoke ciggies,chewaddysfrv,2022-03-20 18:00:34+00:00,,,
446,1505604608277848066,I love putting 4 weighted blankets on me while I employ my industrial strength vape pen to induce a psychotic episode,Jessi_Rihanna,2022-03-20 17:58:06+00:00,,,
447,1505604388248702976,Purposely walked through a vape cloud so I could see what flavor they were shmacking,KymWiz,2022-03-20 17:57:13+00:00,,,
448,1505604020467126276,"Go check out this awesome streamer, and her brilliant bright orange carrot vape, of which she will not forgive me for calling 🤣. Honestly though she's lovely, check her out.",ArcaneMarauder,2022-03-20 17:55:45+00:00,,,
449,1505603784990461964,Vap’News : 20 mars 2022 https://t.co/fcXOKZNjT4 #vape #ecig,vapeurfou,2022-03-20 17:54:49+00:00,,,
450,1505603751901478920,Vaping in a church bathroom. Gang gang. #exmormon,PaulsenCece,2022-03-20 17:54:41+00:00,-111.921988,40.45236,"Draper, UT"
