,TweetID,TweetContent,TweeterUsername,TweetDatetime
902,1545780199920386050,"At a time when teens as young as middle school students are vaping both nicotine and marijuana in record numbers, the FDA should be acting responsibly to assess e-cigarettes and their potential health impacts.
https://t.co/qgY4hMeVxh",RosenthalCenter,2022-07-09 14:41:33+00:00
903,1545780057955762176,Vape? No. Stacked Minion Soda Cup. https://t.co/knqlzqs6yE,jaidynsukulele,2022-07-09 14:40:59+00:00
904,1545779829034758145,She Hits Distinct Cake Bars Disposable #weed #cart #vape #thc #carts #delta8 #hhc #420 https://t.co/yJjynwmrpR #thc #vape #weed,hempnewsonline,2022-07-09 14:40:05+00:00
905,1545779712470949889,directly exposed to covid last night 🤪 this girl shared my vape with me and then tested positive an hour later and I’ve never been so directly exposed and I’m scared,homo_normative,2022-07-09 14:39:37+00:00
906,1545779696608202753,CHOPPA. ANY 2 FOR £25 By Choppa Vapes. Free Postage. https://t.co/y8rXjhgJ51,topvapeone,2022-07-09 14:39:33+00:00
907,1545779429250478080,"#BrittneyGriner 

is  a MALE! cracks me up how ppl don't call it what it is! his voice his body his adam's apple...not of a women! typical leftist mental illness...+ saying ""it was a mistake"" to have a hasish vape in his luggage 🤣🤣🤣🤣🤣🤣BULL💩UGOT CAUGHT! Hope u do ur time🤪",V17436743,2022-07-09 14:38:29+00:00
908,1545779312233746432,"Laid on sofa and lost my vape so I’ve been on the floor, taken all the cushions off the sofa, checked the bin in case I forgot I’d got up and put something in there ??? Was in my boxers ??",BrettCowch,2022-07-09 14:38:01+00:00
909,1545779114531061767,"Why NEPA leave this light now😭😭, transformer don blow🤦. I knew it.😂🤦",iam_Juuls,2022-07-09 14:37:14+00:00
910,1545778943386521602,There is a Yuoto named Vape in Mumbai. Lol. https://t.co/RD2Fls6jHM,Momochutney1,2022-07-09 14:36:33+00:00
911,1545778657754599424,"vape sub-letting

when you give your vape for your mate to hit, but then gives it to someone else to hit without your express permission",oddprophet,2022-07-09 14:35:25+00:00
912,1545778581179174912,ASPIRE FLEXUS BLOK VAPE KIT. Free Postage. https://t.co/lX4EylgbSc,topvapeone,2022-07-09 14:35:07+00:00
913,1545778538334359552,"The Aspire Flexus Stik has a built in 750mAh battery,
three different power settings and uses replacable coils. Included are the 0.6ohm / 1.0ohmAspire Flexus Q Coil 

Unique feature is the dual fire modes, either auto draw or a bottom firing button.

@aspirecigs #vapefam #vapers https://t.co/GmG3T2805P",KieronBeckett,2022-07-09 14:34:57+00:00
914,1545778504998031364,"Grand opening today!! Free jambalaya and snowballs, free 120ml Humble vape juice or tshirt with a 75$ purchase and a free EDGE pen with purchase of vape mod!! #hollywoodvape985 https://t.co/BCSJtEmnHD",cassiebabyyy_,2022-07-09 14:34:49+00:00
915,1545778230875103234,"Movie about an asshole, Juul vaping Orlando real estate broker that hits the mark! Undercover gem of movie.

My ★★★★ review of 99 Homes on @letterboxd: https://t.co/hLE9gA3srr",Harry_Husker,2022-07-09 14:33:44+00:00
916,1545778088130228224,Wake up vape up,sampucketttwt,2022-07-09 14:33:10+00:00
917,1545777599841910784,should i take vape instead???? I can't take the taste of that stick sometimes. 😐💀,baiwiiin,2022-07-09 14:31:13+00:00
918,1545777464898732033,This girl just said she paid $30 for a vape! Just buy a pack of cigarettes already 😂😂,KamTheDiplomat,2022-07-09 14:30:41+00:00
919,1545777356387692546,what if I just wore a regular suit- like a prom suit! but that's my superhero suit! like a tuxedo- and I like KICKED ASS in a tuxedo? I could start SMOKING VAPE!,DakotaColeBot,2022-07-09 14:30:15+00:00
920,1545777318987042817,"Don’t Vape, instead play some EPIC Minecraft",Dont_Vape_Bot,2022-07-09 14:30:06+00:00
921,1545777302352678914,"Check out the Innokin Klypse pod kit 🙌⁣⁣

🎉 Chance to win! https://t.co/Ak7cKruA6h

The Klypse pod kit features an internal 700 mAh battery, dust proof cap, mesh coils, draw activation &amp; more

🔍 Get yours in store or online: https://t.co/2vvq4suVcO

#Vaping #VapeKit #PodKit https://t.co/vABE38vNBd",EvapoHub,2022-07-09 14:30:02+00:00
922,1545777220056059904,"Kids today are… vaping Benadryl, don’t you keep up with this?",chuusdayinnit,2022-07-09 14:29:43+00:00
923,1545777109293056000,Doing some serious vaping today,G_i_b_b_s_y,2022-07-09 14:29:16+00:00
924,1545777072940924928,chugging black coffee // ripping vape,thecotter4,2022-07-09 14:29:07+00:00
925,1545775974595416070,The irony of a pharmacy selling vapes 😂,heenaramch,2022-07-09 14:24:46+00:00
926,1545775675143065602,"I start off every morning right! (30 vape hits, slamming a monster, and listening to hardcore music)",rottenstawb3rry,2022-07-09 14:23:34+00:00
927,1545775596491399169,"I done forgot my damn vape, at home... don't talk to me today!",TheRealJahh__,2022-07-09 14:23:15+00:00
928,1545775320451747840,"Banana split flavour, the best vapes money can buy https://t.co/0FAuzGBqIZ https://t.co/ToEuftlxT0",Alba_Mist,2022-07-09 14:22:10+00:00
929,1545775198292660224,"had a rough day yesterday and bought a vape, it started blinking this morning",fuckmeoutt,2022-07-09 14:21:41+00:00
930,1545774987977580545,"Yoo! 🚨 CRAZY DEALS AT DISPO THIS WEEKEND 🚨 
• Platinum vapes and MKX 11/$100 1g carts
• 4/$10 1g pre rolls (lots of options) 
• $50 ounces (nice bud)
• 10/$40 100mg edibles (1,000mg’s for $40)",BizzleOtizzle,2022-07-09 14:20:50+00:00
931,1545774801301774337,Bith im amassed w the pack no trap lord,Vaper_999,2022-07-09 14:20:06+00:00
932,1545774792602689536,"https://t.co/ynUPmocfyc fresh fruity goodness, perfect summer vape https://t.co/6wBj0EEXxR",Alba_Mist,2022-07-09 14:20:04+00:00
933,1545774677322334209,does vaping really help w weight loss??,sopecalz,2022-07-09 14:19:36+00:00
934,1545774609135534081,Beer and a blunt for my breakfast with a side of vape,SbSam_iam,2022-07-09 14:19:20+00:00
935,1545773544650543104,"We visited Camp Courant to talk to kids about substance use, and topics like alcohol, vaping, &amp; marijuana, plus how to ask for help. TY, Carly Gonzalez, an IOP Counselor, and Makia Johnson, an MMTP Counselor, both from our Torrington Clinic, for helping our future #RootCares https://t.co/yaRm2G4kdx",RootCenterCT,2022-07-09 14:15:06+00:00
936,1545773358041776128,One more tweet ab the cuck who took my 2 gram THC vape cuz fuck that guy I was riding a vibe!!,damerbear,2022-07-09 14:14:22+00:00
937,1545773357877972993,"Conservatives keep blaming marijuana for mass shootings https://t.co/cr83LUWP0w WHAT?!?! Are they freaking kidding us??? One Toke; Vape; or however one chooses to partake in any Marijuana derivatives into their bodies/heads (lol), is up to them. And last thing one would do is ths",JamesEdwardTay5,2022-07-09 14:14:22+00:00
938,1545773355596390400,"#edibles #cbd #gummies #hemp  #vapejuice #delta9 Green Crack Miami High Delta-8 THC Disposable Vape Pen. Bienvenido a Miami, the most beautiful city in the world where the people are hot. The weather is gorgeous, and the buzz from the https://t.co/MX26ucc876 #cbdedibles #delta8 https://t.co/r7tWEc7Ppe",CBDSmokeShop,2022-07-09 14:14:21+00:00
939,1545773214919450625,"Altria dividend yield spiked after Juul ban, payout looks secure, Barron's says https://t.co/3PbF38uemb See the rest of the story here.

https://t.co/tnMXlCjEqv provides the latest financial news as it breaks. Known as a leader in market intelligence, The Fly's real-time, strea…",flylemurs,2022-07-09 14:13:48+00:00
940,1545773187983622144,My lovely gf boight me vapes 😭🤍,lilyis_st4rv1ng,2022-07-09 14:13:41+00:00
941,1545773123601018881,my vapes r almost dead i wanna cri,thinphantom,2022-07-09 14:13:26+00:00
942,1545773046069448707,#weed #vapes rule. Totally will get you toasted. As fuck. These shits are #urb and #kik #baked #ripped #toasty #vape #toke https://t.co/X4hb7p0iHp,toxicdelir1um,2022-07-09 14:13:07+00:00
943,1545772500977684484,I’ve bought a vape everyday and lost it every single day within an hour ffs,miakilgourx,2022-07-09 14:10:57+00:00
944,1545772330265284608,"Birthday blessings to the one and only star boy Aycee @ArnoldAycee live long and prosper!!! At your spare time, come and collect Vuse refills for your vape!",ebonyboy9ja,2022-07-09 14:10:17+00:00
945,1545772258475507713,people that smoke/vape at crowded concerts are assholes and will burn in hell,grrrl_boss,2022-07-09 14:10:00+00:00
946,1545771987141812226,"cant wait for the tiktok girls to have their first drug scandals like yk it’s coming up soon .,, remember the outrage when charli hit that vape imagine what happens when they catch her doing a line 😭😭",ovaloceans,2022-07-09 14:08:55+00:00
947,1545771972969353216,this morning my vape got stuck on a screen I’ve never seen that just said “TIMES OVER”  very not ominous very cool and fun,rickort420,2022-07-09 14:08:52+00:00
948,1545771782564634625,One thing Hulu gonna do is push these ads against vaping.,snow_childx,2022-07-09 14:08:06+00:00
949,1545771506600497153,"Apparently is now ok to vape when on the 220 bus with out a care in the world!!! When did teenagers become absolute 
a$$holes! #getinthebin @Buseireann",wayne_sp8,2022-07-09 14:07:00+00:00
950,1545771498102591488,so i think dendro will work well in both vape and taser team.. or maybe not.. https://t.co/MGpls4TMXL,pidnaah,2022-07-09 14:06:58+00:00
951,1545771393576484866,Y’all addicted to vaping you walked half a block and hit it,TLNTLR,2022-07-09 14:06:33+00:00
952,1545771103481724929,"Fall in love with Adonis, or any of the great flavours brought to you by @zeusjuiceuk!

Available in store 🏪 
Visit our website 💻
#vape #vapenation #vaperexpouk #vaper #vapecommunity #vapedaily #eliquids https://t.co/iLhorKSPTA",vapemindsltd,2022-07-09 14:05:24+00:00
953,1545771079523868672,"The 10 Best #Vape #Mods of 2022
https://t.co/d5r848CCRu
#liveline #life #Trending #BREAKING #viral",5bestthing,2022-07-09 14:05:19+00:00
954,1545771011454410752,I hate vaping.. but the club ain't have hookah 😂,_Leo_ns_,2022-07-09 14:05:02+00:00
955,1545770698202914816,"""Promote vaping as a harm reduction approach. The government should also increase its promotion of the use of e-cigarettes to help people quit smoking tobacc""
@GovCanHealth
@rights4vapers
@DocsVsTobacco

https://t.co/xCPFHpOyW9",QuitByVaping,2022-07-09 14:03:48+00:00
956,1545770532817223687,https://t.co/SoH7NjPN1E Over 100 #brands to choose from -- #vape megastore ------- #thc #vapes #dabs #vaporize #cbd #cbdvapes #cannabis #weed #bongs #pipes,vapor_dot_com,2022-07-09 14:03:08+00:00
957,1545770388126326784,"⁉️CAN YOU BELIEVE IT⁉️
👌😍 Now selling at £17.00 😍👌
MAN 20mg CBD infused Beard Oil 30ml by Man
👉 Shop the range here ⏩ https://t.co/xsQK0eeSgE 👈 https://t.co/2dHTDZtAT3",Henrys_Vapes,2022-07-09 14:02:34+00:00
958,1545770039311204355,"Is the FDA’s ban on JUUL e-cigarettes a step in the right direction, or does it merely limit safer alternatives to combustible cigarettes? @Marc_Hyden of @RSI explores the question. https://t.co/wCYFhPasKo",TheRegReview,2022-07-09 14:01:11+00:00
959,1545769972315860993,I got Lipsoul's color Vape,GayWarrior_Cult,2022-07-09 14:00:55+00:00
960,1545769917181575169,"We’ve found new data showing that UK sales of disposable vapes boomed over the last year, growing 883% between May 2021 &amp; May 2022 at some retailers, but there are some concerns that must be addressed.

https://t.co/8bFHT2naPf

#VapeClubUK #UKVape #DisposableVape #Vaping #ElfBar",vapeclub,2022-07-09 14:00:41+00:00
961,1545769876127629321,"This weekend please remember that all properties owned or leased by the City of Orillia are smoke &amp; vape free, including municipal parking lots, parks and beaches. For full details, including a location map &amp; exclusions, visit https://t.co/wfvgZN39NU. #orillia https://t.co/CWKQ7xdmem",cityoforillia,2022-07-09 14:00:32+00:00
962,1545769846322905089,"If it’s not my vape it’s my makeup or natural hair products, yoh my cousin’s holiday needs to end😭",N_Tee_Bee,2022-07-09 14:00:25+00:00
963,1545769816119988224,Vaping kills so why do it because instead of dying you can play Minecraft,Dont_Vape_Bot,2022-07-09 14:00:17+00:00
964,1545769625853562890,I regret that I drowned the vape 🤝🤝,itssam12221,2022-07-09 13:59:32+00:00
965,1545769466289885184,Juul-Jensen putting in a power of work on the front #CouchPeloton,MelBeer93,2022-07-09 13:58:54+00:00
966,1545769387927412736,does vaping give yall the shits sometimes ?,CHEV0GUE,2022-07-09 13:58:35+00:00
967,1545769226350239745,thinking about me blowing vape smoke in michaela’s face and her going ”AND NOW YOU’RE GONNA DIE TOO”,gagasbooobs,2022-07-09 13:57:57+00:00
968,1545769109199126528,"A KNOIFE!! - NO!!

There is only one thing worse than a r4pist *boom* - a child - no!

FRE SH A VOCA DO

0mg Cholesterol!!! 

*vaping girl* - woaaoow

Road work ahead? I sure hope it does!!

Welcome to bible study, We are all children of Jesus.

I won’t hesitate b*tch!! https://t.co/EAMooDIKnI",Myrmidia,2022-07-09 13:57:29+00:00
969,1545768685435908098,when is Hilary Swank's anniversary? I need to make sure I don't forget my juul.,FinnVonFritter,2022-07-09 13:55:48+00:00
970,1545768274281091073,Because it was never about child safety @MattFromSMM. It’s about vaping’s financial threat to the tobacco industry and big tobacco’s manipulation of @TeamYouTube to wipe great content like yours out. https://t.co/b65XpONM7b,kav3rnus,2022-07-09 13:54:10+00:00
971,1545768138956066817,People vaping in indoor public places is weird to me.,WhothehellisKim,2022-07-09 13:53:37+00:00
972,1545767313370071046,"BIG MEDICINE
BIG VAPING
BIG COFFEE
VAXX PUSHERS
C19 SHILLS
ALL DESPISE ME

WHY?

Because I preach pulling 
away from them &amp; 
healing yourself with
diet &amp; habit change!!

When we crush giants
they get so angry!

We must push harder...
#rogerbezanis
#LetsGoBrandon
#fkcovid19 https://t.co/tMAoB6zxap",RogerBezanis,2022-07-09 13:50:21+00:00
973,1545767210232135680,"#BrittneyGriner is not being unjustly imprisoned in Russia. We have known, and she has now admitted, that she brought vape cartridges laced with drugs into the country. She says she didn't mean to but that is not a defense against breaking the law anywhere.",BWilson91830844,2022-07-09 13:49:56+00:00
974,1545767146206236672,I'll be glad when I can stand on the sidewalk openly and smoke....like yall do with vape pens,LadyMarley88,2022-07-09 13:49:41+00:00
975,1545767014022541312,Sent to: PM_ME_YOUR_VAPE_PICS https://t.co/UREzglAi7j,pmmebot,2022-07-09 13:49:09+00:00
976,1545766997098643456,"Danish blood, Irish heart – Chris Juul-Jensen may race with a red and white flag but he was born and raised in Wicklow - https://t.co/a5zqRIj4dX ⁦@mcewenrobbie⁩ ⁦@AdamBlythe89⁩  https://t.co/KauPt2Yeeb",irishcycling,2022-07-09 13:49:05+00:00
977,1545766986025943041,I will never beat the era where my Microsoft teams pfp was the cat hitting a vape and I had to explain it to my principal in a class call https://t.co/EcdOHocmI3,Willow0Wisp,2022-07-09 13:49:03+00:00
978,1545766985870389248,"4500 puffs of amazing strawberry banana surely hits me! What's your fav fruits combo? Go check in the link below👇

https://t.co/E9PQooBvpZ

Warning: This product contains nicotine. Nicotine is an addictive chemical.
#freetonvape #FBarmax #vape #vapelife #vapefam #vapecommunity https://t.co/BIPLXc3MwU",Freetonofficial,2022-07-09 13:49:03+00:00
979,1545766825077735425,Remember when Natalie thought she could rip her vape on an airplane? Me too,bandleee,2022-07-09 13:48:24+00:00
980,1545766753506152449,"Me: ""the average woman absorbs 5 lbs of toxic chemicals from cosmetics and feminine products a year, birth control is carcinogenic, tap water is full of 1000s of untested toxins, 4 billion pounds of glyphosate are sprayed a year, your vape is seed oils and i'm not sexist but..."" https://t.co/xitvbL11pM",AlpacaAurelius,2022-07-09 13:48:07+00:00
981,1545766734296190980,"🚨FINAL DAYS🚨 Last chance to save 40% OFF most products with code FIREWORKS. Sale ends Sunday! https://t.co/bdohUHnP5g

#cbd #hhc #delta8 #thco #vapes #flower #hempflower #concentrates #edibles #boston #cbdsuperstore #Atlanta #Nashville #austin #cali #Chicago #miami #houstontx https://t.co/pXsY8GQLRk",BostonHempire,2022-07-09 13:48:03+00:00
982,1545766694118834176,"My mother vaping and when my grandmother walked out, she quickly hide it lol",syadz1,2022-07-09 13:47:53+00:00
983,1545766452506001415,I hold my lip balm outside like a vape lol,LeewenRamos,2022-07-09 13:46:55+00:00
984,1545766432163627008,i had a crazy ass dream that involved falling in a lake in pointe shoes and military equipment? a parachute? my phone was red and i kept stealing vapes from the convenience store because they got lost repeatedly also someone got shot and my cousins were there,gispodump,2022-07-09 13:46:51+00:00
985,1545766363691503616,"Ugh, I'm turning into vape juice, NOO-!",mephileshourly,2022-07-09 13:46:34+00:00
986,1545766351209467905,"My throat hurts so it’s one of four things:

The vaping is finally catching up to me
Covid 
Testosterone and the ol Adam’s apple 
Talking too much",willbondway,2022-07-09 13:46:31+00:00
987,1545766336701562881,"// lbd vaping is going to be the whole joke of the possessed arc, isnt it https://t.co/MjWSLGZe0Z",goldenyumyum,2022-07-09 13:46:28+00:00
988,1545766212365434884,"Forgot my work belt at home, lost my vape charger, off two hours of sleep, work bout to be a movie",umdonthackme,2022-07-09 13:45:58+00:00
989,1545766172515262470,"Tell that dead bitch to stop vaping, first. Otherwise people gonna keep going in that shit. https://t.co/2uu4vLj4an",liuearedhorror,2022-07-09 13:45:49+00:00
990,1545766147517140992,Some Saturday Relief from Buckeye Relief!: Get 25% off your whole BR order if you buy 2 BR Vape Carts And 15% off all BR Products Order Online: https://t.co/PZQPzcWcZw https://t.co/RByGxVBs3w,TerrasanaCC,2022-07-09 13:45:43+00:00
991,1545766135332847617,Who will win a battle? Andre300 or Lupe Fiasco,Vaper_999,2022-07-09 13:45:40+00:00
992,1545765788732100608,i love shaking my keychains and acting like a teacher catching my friends vape but instead i also wanted to hit z_z,hornyasfluna,2022-07-09 13:44:17+00:00
993,1545765122475524099,Quitting all social media except Twitter and tumblr is like quitting vaping in exchange for smoking cigarettes (something I also did),girleunuch,2022-07-09 13:41:38+00:00
994,1545765090259095552,im trying to finish the vape before going to the airport oml😭😭😭,NanaD3lRey,2022-07-09 13:41:31+00:00
995,1545764868615192576,Getting my vape snatched by security was mad childish and that guy is a CUCK,damerbear,2022-07-09 13:40:38+00:00
996,1545764634812157953,"I love vapes, I can’t stop😭😭 https://t.co/WZtyCADtQy",Sanemi78074585,2022-07-09 13:39:42+00:00
997,1545764280838012931,almost just vaped on the bus my bad,suprncvas,2022-07-09 13:38:18+00:00
998,1545764192837328896,Lost Vape Centaurus Q200 Kit. FREE POSTAGE. COMING SOON. https://t.co/GNlkn9FPj1,topvapeone,2022-07-09 13:37:57+00:00
999,1545764126235967488,i really wanna vape,moonynickk,2022-07-09 13:37:41+00:00
1000,1545764031373484033,"Day and night difference in cognitive performance on nicotine, and obvious in biographic review (periods when I smoked or vaped vastly more productive). Hard problem. 

Non-tobacco nicotine pouches now but possibly both unhealthy and dorky. https://t.co/kBwOt05IZS",Supreme_Owl_FTW,2022-07-09 13:37:18+00:00
1001,1545763857519575040,"I’ve got my vape in one hand, coffee in the other, and croissant in the other hand",sam_porg,2022-07-09 13:36:37+00:00
1002,1545763424935845889,"saw a 7 with juul pod earrings, instant -17",adventofdawn,2022-07-09 13:34:54+00:00
1003,1545763212200923136,"Here at @O2VAPE we are always innovating to offer the best selection of premium #vape products and give our customers exactly what they want. For those of you who wanted a cotton free ceramic #vapecartridge option, #O2VAPE has answered the call! 📞 ☎️ 💨 

https://t.co/mbFhSSjxpM https://t.co/Zf9K9zyN9A",O2vape,2022-07-09 13:34:03+00:00
1004,1545763150330531842,cba my vapes burning out and i’ve had it 1 day,dcvilsdrip,2022-07-09 13:33:48+00:00
1005,1545762920616734720,I'm all out of carts so I can't vape on break at work and I'm not looking forward to it,Dalaenthusiast,2022-07-09 13:32:53+00:00
1006,1545762894524174341,"📷 Airis Mega disposable vape pods are pre-charged and prefilled to produce 2000 puffs, and best of all, it features an adjustable airflow to control vapor flow. Airis Mega vape pods are available in fifteen flavors. Get #airismega... https://t.co/kAzeSAc1ce",GypsyVapes,2022-07-09 13:32:47+00:00
1007,1545762566290681856,i am not drinking anymore but i am still vaping a bit but i feel a lot better https://t.co/tx07kjJqZ0,jkgyus,2022-07-09 13:31:29+00:00
1008,1545762460434571266,vape in hand as always but happy weekend losers &lt;3 https://t.co/FAdUWRxTSH,LUVSICKNICK,2022-07-09 13:31:04+00:00
1009,1545762268578717697,Get 10% Off @ Royal Flush Vape With Code: IMNEW10 https://t.co/DCSevDK50u https://t.co/DCSevDK50u,dounutpringle,2022-07-09 13:30:18+00:00
1010,1545762254041321473,Great music!! Recently added I Met Her in a Vape Shop - Mishappenings @mishappenings1 via @plugginbaby on https://t.co/PoA3hywOF4,Classic21819467,2022-07-09 13:30:14+00:00
1011,1545761558910959617,"🇫🇷 Tour de France Stage8️⃣🇫🇷
🟢 Intermediate sprint🟢
🥇 Wright🇬🇧+20p.
🥈 Frison🇧🇪+17p.
🥉 Cattaneo🇮🇹+15p.
4️⃣ Philipsen 🇧🇪+13p.
5️⃣ Van Aert 🇧🇪+11p.
6️⃣ Laporte 🇫🇷+10p.
7️⃣ Jakobsen 🇳🇱+9p.
8️⃣ Morkov 🇩🇰+8p.
9️⃣ Kruijswijk 🇳🇱+7p
1️⃣0️⃣ Juul-Jensen 🇩🇰+6p.
#TDF #TourdeFrance #tdf2022",cyclingmaster3,2022-07-09 13:27:29+00:00
1012,1545761448793628672,"My vape pen got crushed! Then just like that, my partner produce a new one from thin air. Talk about a magical wake &amp; vape morning.",PipPipPirrip,2022-07-09 13:27:02+00:00
1013,1545761341574524929,vaping does not make u look cool at all,adam_mukhriz101,2022-07-09 13:26:37+00:00
1014,1545760915886424064,"I support @truthinitiative's vaping cessation app
https://t.co/B8STE6f8qm

It helps 16.2% quit vs. 8.3% for control
https://t.co/UYqmRwSQXS

@robinkoval:  There IS a more effective way.

-Use an open system
-Taper down nicotine over time
-Get to zero
-Quit

Smokers can't do that.",ChaunceyGardner,2022-07-09 13:24:55+00:00
1015,1545760839990484992,i wonder if I can find a vape at the airport,_hananmohamed,2022-07-09 13:24:37+00:00
1016,1545760824559636480,Oh baby. U should’ve stacked the vapes up they’re a necessity. Bet your pure itching https://t.co/jtPYdxqEpF,Sheridan7j,2022-07-09 13:24:34+00:00
1017,1545760659203399682,If you’re having a hard time quitting vape… just imagine yourself among very wealthy people enjoying a pastry at a cafe in Paris and you pull out a vape …,Tamara_mvt,2022-07-09 13:23:54+00:00
1018,1545760507159773184,"I clench the fuck out of that vape, but always drop my ciggy… This is a metaphor",spicycrumbz,2022-07-09 13:23:18+00:00
1019,1545759240043876353,They should make a Durban curry flavoured vape,Shalatheunicorn,2022-07-09 13:18:16+00:00
1020,1545758921058574342,"How about this cloud check fam? 😎😎 

#recurvev2rda 

https://t.co/imXrBNAu5E

#wotofo #wotofoofficial #recurverda #wotoforecurve #rda #coilbuiding #vapeclouds #vapetricks #vapor #vaping #vapenation #vapefam #vapeshop https://t.co/Q0Edlrblsc",wotofoofficial,2022-07-09 13:17:00+00:00
1021,1545758596125696002,kagasto aning vape oy pota,rashedahaha,2022-07-09 13:15:42+00:00
1022,1545758435496628225,Jfc my Apple Music algorithm just hit me with Mac demarco after I was listening to my little playlist. May be time to go back to Spotify,vape_nap,2022-07-09 13:15:04+00:00
1023,1545758281322401793,how did I bring a whole bottle of tequila in my purse to the show last night - and the door guy gave me a new vape 🎂,stonermamiiii,2022-07-09 13:14:27+00:00
1024,1545757933786566656,vaped in front of my dad by accident,dezzobaby,2022-07-09 13:13:04+00:00
1025,1545757779981385728,How can you wake up in the morning and the first thing you do is vape,_jadeluck,2022-07-09 13:12:28+00:00
1026,1545757672334581760,Cigarettes really stink. I’m glad I don’t smoke them anymore. Vape life. 🙂,Yo_yo_v87,2022-07-09 13:12:02+00:00
1027,1545757547101147138,why can’t i vape on train platforms that’s so bs,Slay_Qween_Girl,2022-07-09 13:11:32+00:00
1028,1545757297686859778,"93° here already, vaping papaya cake &amp; waiting on my 22yr old daughter. Let's get on board this love train, takes up. #PPP https://t.co/bEZJTmChuR",canna__momma,2022-07-09 13:10:33+00:00
1029,1545757171236966401,"📣 The UKVIA Vaping Industry Forum is coming up on the 9th of September and there is an exciting opportunity for members to exhibit! 🤩

🔗 Click here for more info on how to get involved ⬇️
https://t.co/4s141Hy4Ax https://t.co/BMuoee889Y",Vaping_Industry,2022-07-09 13:10:03+00:00
1030,1545756648056279040,We vape the right way at this pride https://t.co/RH2E0ynuJv,thirstynoona,2022-07-09 13:07:58+00:00
1031,1545756494758649857,I told this damn boy to bring me a vape pen that nigga bought me the money for it 😂😂😂,RudyHuxstableJr,2022-07-09 13:07:21+00:00
1032,1545756314344857600,darthhhh vaper,ndrgrfld,2022-07-09 13:06:38+00:00
1033,1545756265317601280,Stop fucking vaping.,t25596114,2022-07-09 13:06:27+00:00
1034,1545756225777926144,MRS GORILLA VAPES https://t.co/Iv8qsTrLh8,HRHInternetCafe,2022-07-09 13:06:17+00:00
1035,1545755794515558400,Hari ini I tried not to vape for the whole day and gak bisa anjir,jaf_jess,2022-07-09 13:04:34+00:00
