,TweetID,TweetContent,TweeterUsername,TweetDatetime
462,1545851794999414784,I finna be the mf who take hits of they vape during sex 🤣🤣,whereszee,2022-07-09 19:26:03+00:00
463,1545851759951810567,This is so ass i NEEEEEED to rip my vape 🥺😭,SalBucks721,2022-07-09 19:25:54+00:00
464,1545851663587721220,i just know juul is crying rn,ttsloverry,2022-07-09 19:25:31+00:00
465,1545851376688713728,these old ladies need to leave my store so i can go hit my mf vape yo,rangosdreams,2022-07-09 19:24:23+00:00
466,1545851074187337730,"Vaping is legal in Argentina. Here’s some places where you can get vapes in Buenos Aires. And how to bring your own vapes into Argentina.

#vape #vaping #vapejuice #ecig #travel #travellingwithvape #southamerica #argentina #uruguay https://t.co/Iv3o55srrR",inlovelyblue,2022-07-09 19:23:11+00:00
467,1545851061071761408,Vapes are for children change my mind,daquer66,2022-07-09 19:23:08+00:00
468,1545850718006829056,Sometimes I think I look ugly but then I realize there’s people out there who vape and I feel better about myself,aarimmango,2022-07-09 19:21:46+00:00
469,1545850635727163392,"Holy shit, just set off my fire alarm in a hotel room for the first time and I legit hit a vape, with my slider open, on the other side of the hotel room
The fuck.",Dahliaisdopey,2022-07-09 19:21:26+00:00
470,1545850528667770880,Honeycomb Tank https://t.co/C61DmPtihg | #Aromatherapy? Stay healthy: #Jamaica #NYC; #NewYork | Spend your $CLO | #Vaping #Clouds #Tank,VAPEPENstore,2022-07-09 19:21:01+00:00
471,1545850387340615680,"Overheard at the vape shop: 

“I dated a guy last year who tried cocaine for the first time. He went on a week-long bender. Then he went to rehab.”",mycatisatiger,2022-07-09 19:20:27+00:00
472,1545850360207745030,"Some of y’all are finished, how u leaving the mosque to go outside for a vape break💀💀?",hersigacal,2022-07-09 19:20:21+00:00
473,1545849813249544192,"{ Medellin } Dry Flower vape carts 🇨🇴🌿 for real flavors , wherever u go ... https://t.co/FxFZ3H2JJB",the_lemonnade,2022-07-09 19:18:10+00:00
474,1545849278874222597,They should make a vape for crack,wheres_joel,2022-07-09 19:16:03+00:00
475,1545848615775649792,First time having a headache after vaping,vicontheground,2022-07-09 19:13:25+00:00
476,1545848539439398918,Just left my weed plugs house. She got vape cartridges again 🙂 https://t.co/B8OOFXeSQB,traphouseruss,2022-07-09 19:13:06+00:00
477,1545848532132937733,me pretending idc about my vape so it can magically appear in front of me,misotrill,2022-07-09 19:13:05+00:00
478,1545848494111346688,"Vape fully charged, phone fully charged, great day so far",rubylovesbirds,2022-07-09 19:12:56+00:00
479,1545848459982475264,Just threw my vape in the garbage everyone cheer for me rn,thegoldflinch,2022-07-09 19:12:47+00:00
480,1545848329392857088,he’s a 10 but he doesn’t vape,newuser__1234,2022-07-09 19:12:16+00:00
481,1545848001821917184,I am now day 3 quitting vaping cold Turkey but also I am week 8 not smoking weed :) feeling proud of myself and can also smell and breathe so much better,SpookyKiki,2022-07-09 19:10:58+00:00
482,1545847962319953921,Cleaned out the car and found two juul devices lol anyway I haven’t vapes in a month,BlTCHMADI,2022-07-09 19:10:49+00:00
483,1545847748099862528,almost got thrown out for vaping in my bedroom 😐 normal things,vivzthots,2022-07-09 19:09:58+00:00
484,1545847251918065664,"Saturday afternoon, sunny and 75, top off the jeep, Teenage Dream on full blast, 2 homos screaming on the top of their lungs, and 1 lesbian in the backseat taking a very long hit of her vape",JoshieMoloshie,2022-07-09 19:07:59+00:00
485,1545847145735102466,"every time I go to the vape shop there’s this one guy who knows my dad and he talks so casually to me, and one guy who ALWAYS checks my ID was there. he told me to be safe and then ig dude looked confused so he goes “I know her DAD!” LMAOO",stiIIstarving,2022-07-09 19:07:34+00:00
486,1545846951551373312,I be waking up cold sweating because I quit those little ecig vapes bro that shit is Not good for U,IAM114105099104,2022-07-09 19:06:48+00:00
487,1545846611548454912,Hit my tetes vape to see the rage &amp; almost died,xoxotjanell,2022-07-09 19:05:27+00:00
488,1545846600978808833,vaping eating takis drinking a mountain dew the hair on my legs is growing back i need to shave hair greasy,groiIet,2022-07-09 19:05:24+00:00
489,1545846496213565442,Congress gave the FDA a clear directive to crack down on vape companies skirting the agency’s rules. But there are growing signs the agency is not ready to do as instructed. (@NicholasFlorko via @statnews) https://t.co/iZW79Az9OZ,AppleNews,2022-07-09 19:04:59+00:00
490,1545846158190383110,The FDA will temporarily allow Juul vaping products to stay on the market while the company appeals a ban. https://t.co/TpeNn1vbfy,NYTHealth,2022-07-09 19:03:39+00:00
491,1545845912961830912,"The Chairman of Cannabis ft. Jason Wild | The Dime

#Technology #Vapes $TRSSF  https://t.co/uePLz2By7W",wind4me,2022-07-09 19:02:40+00:00
492,1545845412225073158,got a citation for vaping on the boardwalk. foucault freaking warned us it would be like this https://t.co/YQJna2StFu,Doublelen,2022-07-09 19:00:41+00:00
493,1545845329928544256,MY VAPE DIED NOOOO,clairoismylover,2022-07-09 19:00:21+00:00
494,1545845237620191232,That mint vape hit back,terrterrdaloc,2022-07-09 18:59:59+00:00
495,1545845231593160705,Attempt number 98374729648263 to not lose my vape,iambluujay,2022-07-09 18:59:58+00:00
496,1545845215541567493,**hits vape** Reports me for cheating ✅ https://t.co/Vp7hmCwlkG,MacBreeezy,2022-07-09 18:59:54+00:00
497,1545844979238666241,Bro how do I explain to these nail people I’m acting jittery asf bc I haven’t eaten I chugged a whole Starbucks cup and hit my vape 5 times for breakfast 🥲,Breannabihhh1,2022-07-09 18:58:58+00:00
498,1545844811747426304,This vaping inside of public transport thing needs to stop immediately,ki_danaex,2022-07-09 18:58:18+00:00
499,1545844769632518144,Best Buy is selling vapes now,cannab1tch__,2022-07-09 18:58:08+00:00
500,1545844713537671170,710 Weekend Deals include a $5 Discount and #B3G1 Buy 3 Get 1 Free from Stack N Trees.  We also have several Daily Deals for Vape Carts #710Deals #vape #hash #crumble #badder #Diamonds #palmtreez https://t.co/1RDJZRxVlz,emeraldsupply,2022-07-09 18:57:54+00:00
501,1545844597414297600,quit vaping cold turkey last night this is very insane,LOV3ME4ME,2022-07-09 18:57:27+00:00
502,1545844297609748484,The grip that fruity little vapes have on me lol,worrmspo,2022-07-09 18:56:15+00:00
503,1545844009741983745,Don’t ask to hit mfs vapes little do Yk she be re charging it the feen way for a month,rryredhead,2022-07-09 18:55:06+00:00
504,1545843487031152644,"#cannabis #marijuana #weed #cannabiscommunity Medical Marijuana: How to Vape Safely 

The use of vapes to vaporize medical marijuana is on the rise. However, safety concerns remain as experts do not fully understand the risks and benefits https://t.co/3YWqs07QBs https://t.co/675Ayv8tPD",MMPconnect,2022-07-09 18:53:02+00:00
505,1545843446992216066,i got it bad buying vapes instead of seeing what’s wrong with the ones i got 😩,_dyelexxyia,2022-07-09 18:52:52+00:00
506,1545843414729719810,"can't do sleight of hand by any means, but give me a vape pen and I'm David Copperfield",coryandtreezy,2022-07-09 18:52:45+00:00
507,1545843139772030978,Just posted a photo @ All Day Vape https://t.co/R2I4TRGmH9,alldayvapejax,2022-07-09 18:51:39+00:00
508,1545843084008857600,"Gave a homeless dude a $1, and he asked if I wanted a hit of his vape..",raydevito,2022-07-09 18:51:26+00:00
509,1545842997392449536,"Ang breakfast, lunch at dinner ko ay ✨vape✨",howareyoufolks,2022-07-09 18:51:05+00:00
510,1545842989708320768,🚨 Win $710 by tweeting about cookies vapes and extracts with the tag #Cookies710 .. https://t.co/kW43FgoBgB,cookiesglobal,2022-07-09 18:51:03+00:00
511,1545842972444528646,we all do shit that isn’t good for us so I try not to judge but I really wish folks let them vapes go.,paileeeee,2022-07-09 18:50:59+00:00
512,1545842954551431168,"To obtain and maintain optimal heart health, Weinberg’s recommendations include:

•Not smoking or vaping
•Maintaining a healthy diet
•Getting sufficient sleep
•Keeping blood pressure in a healthy range (below 120/80mmHg)

#optimalhearthealth #hearthealth 🫀",MarjanDeganian,2022-07-09 18:50:55+00:00
513,1545842792768978944,completely naked save for my lanyard vape,goblinkingkt,2022-07-09 18:50:16+00:00
514,1545842624245923840,I really slowed down on vaping and picked up cigarettes again I hate myself smh,sydney_dawn20,2022-07-09 18:49:36+00:00
515,1545842305017552896,Opinion on a girl who smoke vapes,rryredhead,2022-07-09 18:48:20+00:00
516,1545842285249806337,Britney Griner had to plead guilty to Vape(thc) charges in Russia?  What if they decide to make an “ American “ example of her?,DaPitBully,2022-07-09 18:48:15+00:00
517,1545842210951680000,9th Man is weak and vapes are coming for them.,ZEshitpostbot,2022-07-09 18:47:58+00:00
518,1545842001869930496,"Hahahahsh, Take the L vape kids, Fuck vape and Fuck Juul #fuckvape https://t.co/l9jKirwLgm",Kidddo62832976,2022-07-09 18:47:08+00:00
519,1545841276284715008,SHKAJSJAKA this dudes been standing there filming deleting and filming himself vape for 15 minutes https://t.co/IxgaZ9mNaA,PrncessDaffodil,2022-07-09 18:44:15+00:00
520,1545840914760867840,The amount of times I have to run to the shop to get vapes is ridiculous,icequeenx_o_x,2022-07-09 18:42:49+00:00
521,1545840617397407747,"i started vaping to quit smoking, now I'm doing both",r01000111,2022-07-09 18:41:38+00:00
522,1545840496140066816,"I was in line yesterday at the mva and saw this girl, couldn’t have even reached 18 yet, sneak a pull from her vape. She looked right in my direction &amp; I held her gaze so she knew i was judging her. Like damn, you couldn’t wait 30 minutes???",kiss_7018,2022-07-09 18:41:09+00:00
523,1545840494336507904,idk why i get so nervous every time someone passes me a vape and i have to ask if its weed as if my friends are trying to trick me into a nicotine addiction,randatherat,2022-07-09 18:41:08+00:00
524,1545840350446718978,"The sun is out, there's 5 cups of coffee coursing thru my veins, and I'm eating wild blackberries let's go https://t.co/l15f2jdILb",Kay_Juulers,2022-07-09 18:40:34+00:00
525,1545840228946124801,I have to close today and I don't have a vape and idk if I'll be able to smoke during the shift,lisbongs,2022-07-09 18:40:05+00:00
526,1545840188873707522,"I refuse to believe this many people at the pub have quit smoking.

Does everyone just start on Vapes Now!!?! https://t.co/pIkltuV21e",MikeBeeOfficial,2022-07-09 18:39:56+00:00
527,1545840172293570561,"Check out this shop!
One of my favourites 💙
#vapefam 
Old school vapers already know 😉 https://t.co/MoSoFrMv6Q",d17j17h17,2022-07-09 18:39:52+00:00
528,1545840073068974086,i just realized today marks 6 weeks since i vaped &amp; last time i got drunk 😇,justine__amber,2022-07-09 18:39:28+00:00
529,1545839977623441409,My uncle and I are here vaping and everyone is looking at us like we’re crazy😂,bazengirrll,2022-07-09 18:39:05+00:00
530,1545839702439333888,"Let's see Sean Feuchts mangers gas station haul, lighters, cigarettes, a wallet, caffeine pills with 2 left, matches, a tampon?, some vapes? and I'm pretty sure that black thing is lube. https://t.co/46te8GCN9k",FundieFlounders,2022-07-09 18:38:00+00:00
531,1545839626002259968,Capitalism won't fall until I can buy a DMT vape pen at the offie,sledgang420,2022-07-09 18:37:41+00:00
532,1545839565956579331,Oomf is in his vape era 😵‍💫😞,99Perspective_,2022-07-09 18:37:27+00:00
533,1545839339854184448,"asked the woman doing my pedi if it was cool to take a hit of my vape, like out of respect . . . she shrugged &amp; looked at me like idgaf kill yourself 🤩🤩🤩",IraRaquel_,2022-07-09 18:36:33+00:00
534,1545839070558822400,SOMEONE BOUGHT A VAPE AT 7/11 😭😭😭,thotyoonoh,2022-07-09 18:35:29+00:00
535,1545838889520320512,Family of 5 vaping in a kia picanto,ewanrobertson03,2022-07-09 18:34:46+00:00
536,1545838886143901698,i love sucking dick but i wish they had a little vape feature. like a little reward when he’s getting close,eluxluvr,2022-07-09 18:34:45+00:00
537,1545838628017819648,Samsung users only goal in life is to prove to you that their phone is better then your iPhone,juul_ian_,2022-07-09 18:33:43+00:00
538,1545838548607275011,"The Freemax Marvos X 100W pod vape kit is an ideal option for sub ohm vapers that are looking for a device that’s easy to use. It runs on a 18650 battery  to power its 5 - 100W output range. Along with the 2ml Marvos CRC DTL pod, in the box https://t.co/hBUo7fIYT3",ianpreston1975,2022-07-09 18:33:24+00:00
539,1545838370240270336,"The Freemax Marvos X 100W pod vape kit is an ideal option for sub ohm vapers that are looking for a device that’s easy to use. It runs on a 18650 battery  to power its 5 - 100W output range. Along with the 2ml Marvos CRC DTL pod, in the box https://t.co/esxLtU3DVK",ianpreston1975,2022-07-09 18:32:42+00:00
540,1545838198324183042,Whipped Cream ft. SaschaAlexandra | Noted: Ep. 205 - DIY OR DIE Vaping https://t.co/pHimJXJhEm,vapedv8,2022-07-09 18:32:01+00:00
541,1545838041796816897,THEY'RE TAKING AWAY MY VAPER'S RIGHTS!,FactoryBot2,2022-07-09 18:31:24+00:00
542,1545838037774618625,remember when ppl tried to vape alcohol? dude those were much simpler times lol,h3llosunshin3,2022-07-09 18:31:23+00:00
543,1545838008229830657,a vape that turns into a kazoo,thenaythe,2022-07-09 18:31:16+00:00
544,1545837945822752768,I fucking lost my vape pen again 😂💀☹️,burntchikynuggi,2022-07-09 18:31:01+00:00
545,1545837912251838464,Marco has vapes in his backpack.,knrdknrd,2022-07-09 18:30:53+00:00
546,1545837710153228288,I think Will really enjoys going and buying me a new vape because each time he’s brought back a totally different brand than before and telling me how the guy explained it’s so much better than the last one 🤦🏼‍♀️🤣 he be so excited to tell me about it 🤣,breannadillon07,2022-07-09 18:30:05+00:00
547,1545837700665819137,"Five Convenient Products for Vaping on the Go
https://t.co/eFqFClrhpO",InnerToWords,2022-07-09 18:30:02+00:00
548,1545837398440960005,might get thc vape tomorrow I need to walk over an hour to get there tho 😒 might Uber,daspondent,2022-07-09 18:28:50+00:00
549,1545837314861109253,"We really are in a vaping epidemic, so sad",atinukeayorinde,2022-07-09 18:28:30+00:00
550,1545837260049891328,// i’m on break and this old guy keeps looking at me while i vape pls leave me alone,sunshincfakc,2022-07-09 18:28:17+00:00
551,1545836571957641218,👋 Punk 8238 is no longer for sale. https://t.co/D8o1FJ14Tb #cryptopunks #punk8238 #punksale #2traits #male #mohawkthin #vape,CryptopunksFeed,2022-07-09 18:25:33+00:00
552,1545836563443372033,imagine if vaping had cals,urineily,2022-07-09 18:25:31+00:00
553,1545836332752089088,"For your safety and comfort, this station operates a no vaping policy. Trust no-one.",traindroid_se,2022-07-09 18:24:36+00:00
554,1545836318206345216,I quit vaping like a month ago and I feel great 🫡,finessahudgens2,2022-07-09 18:24:33+00:00
555,1545835993114333186,sorry for vaping tao 😭 https://t.co/i2PulE1IZb https://t.co/BRlY4HL6z5,steddieholic,2022-07-09 18:23:15+00:00
556,1545835463277158400,vaping at a puberty ceremony feels sacrilegious,taamriddlz,2022-07-09 18:21:09+00:00
557,1545835355601092610,i need a vape rn before i bite someone,comradebritknee,2022-07-09 18:20:43+00:00
558,1545835203737767938,This club smells like juul and hpv,RybotB,2022-07-09 18:20:07+00:00
559,1545834995922739200,I put up a good fight but the vape won this round 🥊 💥 😫,tyrus_woods,2022-07-09 18:19:17+00:00
560,1545834962225889280,either my vape is going out or im getting sick… either way i’ll cry,analiza_lugo,2022-07-09 18:19:09+00:00
561,1545834223562539013,boys who hit the vape and say weeee,8oseok,2022-07-09 18:16:13+00:00
562,1545833981286895616,"Fit and Well Idaho: The dangers of vaping
https://t.co/8BCFxlEtGa",SheridanVanArn2,2022-07-09 18:15:16+00:00
563,1545833940157698053,kids aren't smoking enough cigarettes and that's why we got them Juuls banned baby! Nothing beats the old fashioned way of dying slowly,teaheadjoyride,2022-07-09 18:15:06+00:00
564,1545833590617001989,"#edibles #cbd #gummies #hemp  #vapejuice #delta9 Pink Lemonade Disposable Vape THC O Alibi . When it’s late at night, and they catch you with a good buzz, you’re going to need a decent Alibi. Do you want to say you were vaping with https://t.co/j6jyoe3cO1 #cbdedibles #delta8 https://t.co/VENlRJfCnv",CBDSmokeShop,2022-07-09 18:13:42+00:00
565,1545833547927134208,"Hey broski, can't believe I ran into you! I got you tickets to see my stoner rock band Galaxy Vape!",MyEpicBand,2022-07-09 18:13:32+00:00
566,1545832997504667652,Feel I have to buy a vape wii 💨,RickyBlazeVsF,2022-07-09 18:11:21+00:00
567,1545832933855985664,Is… is that a vape? Lol https://t.co/8u4b22TGjP,PrinceEddie263,2022-07-09 18:11:06+00:00
568,1545832887441797120,"modern shakespeare would probably be like, doth she hit the vape or doth she not hit the vape.",awildjoel,2022-07-09 18:10:55+00:00
569,1545832383429107714,📷 vape-goblin: he said the f word (fr*end) https://t.co/Z7ZGi82vVF,Galagraphia,2022-07-09 18:08:55+00:00
570,1545832128373571584,the despair that descends over a group when the one person with a juul’s juul dies,lyingdownrn,2022-07-09 18:07:54+00:00
571,1545831813762908161,Ah so it really was the French dub only who announced it. That's why everyone is confused including myself. https://t.co/TaBEK0EmVm,juul_bee,2022-07-09 18:06:39+00:00
572,1545831603426975745,"""you know that basketball star we have here for a few vape cartridges?...we'll give her to you in exchange for an arms dealer who will never deal arms again...you have our word.""-moscow. https://t.co/CvcawMMf1Y https://t.co/T8hzylzyWT",lif3asmaj,2022-07-09 18:05:49+00:00
573,1545831488947720197,"#BlackDesertOnline #BlackDesertMobile 
Grinding both games while vaping, this is life indeed! Happy weekends everyone! 🥰 https://t.co/sEM0AYdEx8",GrandXRevolt,2022-07-09 18:05:21+00:00
574,1545831349474529286,"Just like caffeine, nicotine is a mild stimulant, creates dependence &amp; causes withdrawal without it.
Like drinking coffee, vaping nicotine doesn't cause disease and is intended for adults.
The difference is drinking coffee doesn't help you quit smoking.
https://t.co/cE9OVHBBlW https://t.co/a1J93Dkajs",ChickenGate,2022-07-09 18:04:48+00:00
575,1545831298157400065,Maybe I need to stop vaping for a while...,poncexm,2022-07-09 18:04:36+00:00
576,1545831217148428296,Whomst the fuck is throwing juul pods in my truck https://t.co/47MPlAPYGt,Jerkyroo,2022-07-09 18:04:16+00:00
577,1545831187482087425,"#EndWarOnDrugs!
Today's focus is on pot, but *I* say: Americans should have a Right to do ANYTHING that does not unduly infringe of the rights of others, including ALL drugs, vaping, gambling, etc.
Besides RIGHTS, legalization would provide quality control and defang drug gangs. https://t.co/sxnRhUrgow",AmerLiberal,2022-07-09 18:04:09+00:00
578,1545831187352109056,Vape pens smell like dryer sheets,Tunk420,2022-07-09 18:04:09+00:00
579,1545831081273851908,Going to my dads for the night and he warned me the kids are being awful. My mom handed me the vape we got and goes “you might want this” 😂💀,tthattguyty,2022-07-09 18:03:44+00:00
580,1545831020598923264,"Going to urgent care because i dropped my vape on my big toe like three days ago and I still can’t move it. 

Feel like it doesn’t matter but I had issues with my other toe for over a year after I didn’t get it looked at so… don’t want to do that again.",ms_queenbitch0,2022-07-09 18:03:30+00:00
581,1545831013720305667,"Me at gym: Its called incline walking. Just crank it up to 15 and set the speed to like 3 and youre cruising. You wouldnt believe how many calories you burn and you dont have to quit vaping 

Reanimated John Lennon corpse: please mate. It all hurts so bad 

Me: Lets do it big dog",Senn_Spud,2022-07-09 18:03:28+00:00
582,1545830828546179073,So...I..uh..bought a vape- https://t.co/a1V3pk4RD1,witchy_frog,2022-07-09 18:02:44+00:00
583,1545830790998679554,You can’t give prices over the phone ? Bitch then I can’t drive to find out the prices Bc wtf ???? For a vape ?,champagnejesus_,2022-07-09 18:02:35+00:00
584,1545830744999841796,"ideal symbiotic relationship
*either of us have weed or a vape*:
""switch?"" 
""wait I’m almost buzzed""
""bet""",irsnommis,2022-07-09 18:02:24+00:00
585,1545830710510080009,🚁 Punk 4775 was transfered from 0xaFb60B to 0xb7F7F6. https://t.co/xh0oA31bTY #cryptopunks #punk4775 #punksale #3traits #male #vampirehair #vape #mole,CryptopunksFeed,2022-07-09 18:02:16+00:00
586,1545830403063402502,"Just like caffeine, nicotine is a mild stimulant, creates dependence &amp; causes withdrawal without it.

Like drinking coffee, vaping nicotine doesn't cause disease and is intended for adults.

The difference is drinking coffee doesn't help you quit smoking.

https://t.co/Ptst5DUnzI https://t.co/d5v0VmG2B9",VAEPinfo,2022-07-09 18:01:02+00:00
587,1545830312118079488,"Vaping bad, Exercising good",Dont_Vape_Bot,2022-07-09 18:00:41+00:00
588,1545830254698057728,Ahhh that first hit of the vape in the morning before eating 😵‍💫🫠,Binninew,2022-07-09 18:00:27+00:00
589,1545830215456284672,"Rechargeable #DisposableVapes allow the user to top up the battery to ensure that all of the #Eliquid can be used and help you get the most out of each device 🙌

🗞️ Find out more here: https://t.co/bytotR4zfL

#VapeNews #Vaping #VapingNews https://t.co/hRplMIW1a0",EvapoHub,2022-07-09 18:00:18+00:00
590,1545830195097210881,"Take your tastebuds on a journey with our Blueberry Novo Bar.

Delectable flavours, delightful experiences.
Become a stockist.
https://t.co/bCp6vq7krC
-
-
#SMOK #stopsmoking #vaping #disposables #vape #novobar https://t.co/8vDTPYxOdM",SmokTechUK,2022-07-09 18:00:13+00:00
591,1545830192555360263,"The NICOTINE INDUSTRY SHOULD BURN IN HELL: it’s easier to help someone get over their cocaine addiction than nicotine addiction. How terrible for our kids. 

Number of children who regularly vape DOUBLES in two years https://t.co/It9D8wGMoJ via @MailOnline",AMErikaNGIRLLL,2022-07-09 18:00:12+00:00
592,1545830190818918400,"Our Flerbars are recyclable, simply pop off the top, remove the battery and the plastic casing is ready to be recycled.

🌐 https://t.co/pzeAyaexgn
✉️ todd@innevape.com
-
#vape #vaping #vapestagram #instavape #flerbar #eliquidbrand #innevape #recycle https://t.co/IAVUSHnb5w",innevape,2022-07-09 18:00:12+00:00
593,1545830168333361158,"Ice cold - Strawmelon Apple is! Cool down on this summer day with this delicious flavor. Tag a friend (21+) who needs this!

 #vapecatz #delandvapeshop #floridavapes #ecigsourcedeland #deland #vapingsaveslives #flavorsaveslives #vaping #vapeshop #Monstervapelabs
@monstervapelabs https://t.co/Y7sqSyBfQ4",ECigSourceFL,2022-07-09 18:00:06+00:00
594,1545829905870487557,vape=dead,spegeettii,2022-07-09 17:59:04+00:00
595,1545829626244644864,if i retweet the anti-vape ads its ironically btw,alcameso,2022-07-09 17:57:57+00:00
596,1545829566706491393,"bacc in the cart game , soon bout to get off these vapes !",juss50zzz,2022-07-09 17:57:43+00:00
597,1545829511626985474,Vaping is sooo lame i need to stop.,shimslaady,2022-07-09 17:57:30+00:00
598,1545829142150557698,YOURWAY CANNABIS BRANDS: MULTI-YEAR AGREEMENT WITH AIRO BRANDS 💨 https://t.co/BtcLbij0pS #AiroPro #AiroBrands  #Vaping #Delta8 #THC #Vape #VapeLife #CBDProduct #CBDTwitterParty #50ShadesofGreen,5OShadeOfGreen,2022-07-09 17:56:02+00:00
599,1545829084638220288,why do influencers get canceled for vaping? why dont teenagers get canceled for it? why only influencers?? “they have a fanbase” so what? are they on live promoting it? no they just do it and its their lives idc “charli vaped” so?? its her life,reincgdd,2022-07-09 17:55:48+00:00
600,1545829036273827842,Only thing that sucks about vaping is that I can’t ask a stranger for a spare out at the bar https://t.co/Ulc1FbABIe,2cunty4you,2022-07-09 17:55:37+00:00
601,1545828852789874689,I’ll vape anywhere idc bitch put me out,therealtsuzanna,2022-07-09 17:54:53+00:00
602,1545828809865560064,i have no idea what is in vape juice,HoneysStoned,2022-07-09 17:54:43+00:00
603,1545828682455040002,"tote bag full of drinks, vape in hand i am ready for a good time 💪💪💪💪",C4K3C4T,2022-07-09 17:54:12+00:00
604,1545828407925248000,yuri just bought me the nastiest vape 🤮🤢🤢,JuarezViry,2022-07-09 17:53:07+00:00
605,1545828375897559040,Realized all the Juuls I’ve lost in the past was to prepare me for these dispos’,justzrod_thegod,2022-07-09 17:52:59+00:00
606,1545828273028210688,dad smoking in balcony 🤝 daughter vaping in bedroom,stinkilinski,2022-07-09 17:52:35+00:00
607,1545828207907201025,day 2 no vape it’s going well gonna throw my dispos away tomorrow and in another few days throw my stlth away ✨,noor_zakariaa,2022-07-09 17:52:19+00:00
608,1545828168661192706,"Pre-order our new vapes. In the meantime, please enjoy this meme we slapped together in paint dot NET. https://t.co/oFRAMutWsa",CbdxOfficial,2022-07-09 17:52:10+00:00
609,1545828061744168962,If I ever got accused of stealing someone’s vape I would feel so disrespected,coleaballard_,2022-07-09 17:51:44+00:00
610,1545827862107852800,Quitting vaping is way harder then smoking cigs,Malik__Silver,2022-07-09 17:50:57+00:00
611,1545827779819683840,i flirted with papi at the smoke shop for a discount on these vapes just to lose them smh,lvmpia,2022-07-09 17:50:37+00:00
