,TweetID,TweetContent,TweeterUsername,TweetDatetime
0,1545920539138568193,"A fuckboi shakespearean love letter: I wish to take thy blessed honey which emanates from thyne sacred pot and pour it into mine vape to rip fat clouds of your honey and watch it ascend into the heavens.

I made you read this with your eyes. You're welcome.",Tiqalicious,2022-07-09 23:59:13+00:00
1,1545920269319110657,hiding in the supply closet at work  hitting the juul while pumped up kicks plays in the background…yeah that’s about where I expected my life would end up,quinnpostingLs,2022-07-09 23:58:08+00:00
2,1545920070345424901,Taking too many hits of a CBD vape at minions: rise of gru and having a panic attack,souljaboyle,2022-07-09 23:57:21+00:00
3,1545920065513611265,damn who the hell cursed all my vape pods to taste like piss,f4wn1ng,2022-07-09 23:57:20+00:00
4,1545919438179876865,"Soon, all that will be left in Tempe from my undergrad years are the hookah lounges with tattered couches and owners vaping in the parking lots. https://t.co/zZlbv0Q4Kj",Shadynasty15,2022-07-09 23:54:50+00:00
5,1545919004283351040,I just swallowed my juul 😰,sampucketttwt,2022-07-09 23:53:07+00:00
6,1545918991096750080,i’m finna go get me a whole nother vape ion kno what this vape on fr,K_doll2,2022-07-09 23:53:03+00:00
7,1545918977444126723,Court rules #Juul can temporarily keep selling e-cigarettes while it prepares challenge to FDA ban https://t.co/5my2xXdPeg via @statnews #healthcare,hughdsullivan,2022-07-09 23:53:00+00:00
8,1545918814554030080,"How, exactly, are single-use vapes legal?",MarmiteJunction,2022-07-09 23:52:21+00:00
9,1545918392976248838,josuke and i tried to steal rohans vape pen but apparently he literally has a drawer full of em,OkuNijimura,2022-07-09 23:50:41+00:00
10,1545918362991181826,My brother blessed me with gummies and his vape bc I had cramps so I had 5 of em and y’all I’m afloat rn 😭,michellers1313,2022-07-09 23:50:34+00:00
11,1545918346037567488,cigarettes are just acoustic vapes,_Dirt_Cobain,2022-07-09 23:50:30+00:00
12,1545918322013011968,The cute ass girl at the vape shop that hyped me the fuck up is the only thing motivating me,harleymaridavis,2022-07-09 23:50:24+00:00
13,1545917991816114176,Gets a vape to curb smoking: puffs endlessly then goes and smokes a cigarette….,DollPartz84,2022-07-09 23:49:05+00:00
14,1545917985482674176,i would like to have a word with the bro that decided vape pods and coils should be sold separately,appleb33shater,2022-07-09 23:49:04+00:00
15,1545917851332218880,i always feel dizzy when im going back from my break its probably bc of vape + strong coffee connection lmao,NOTHlNGTOYOU,2022-07-09 23:48:32+00:00
16,1545917131581280261,"It's no secret to anyone that follows me that I have struggled with my mental health. Therapy, and meds just couldn't cut it. About a month ago I started vaping delta 8 THC and it has been a game changer. 1 of 2",UndeadPapa,2022-07-09 23:45:40+00:00
17,1545916721604616192,red bull n a vape 🤞🏽,ahhnjelica,2022-07-09 23:44:02+00:00
18,1545916638947581953,Vape people are different,simplyhawaa,2022-07-09 23:43:43+00:00
19,1545916576884572162,"Best players in owl

1. Super on map 5's
2. Checkmate in garbage time
3. the entire shock roster after a loss
4. Nero when he wears a beanie
5. all of the outlaws in the first 5 games of a season
6. ANS after ripping a fat vape
7. Sp9 when he prays to allah
8. Hydron on friday's",thismf1DC,2022-07-09 23:43:28+00:00
20,1545916573340561417,Shes a ten but she vapes,Rommus_Teegan,2022-07-09 23:43:27+00:00
21,1545916540196753410,O C PHARM! Premium vape cartridges ✨ https://t.co/85oQTyT04i,BudsofPasadena,2022-07-09 23:43:19+00:00
22,1545916153461096450,"coming out of my cage* and i’ve been in doing just fine*

*the walk in cooler
*vaping",wh0reganic,2022-07-09 23:41:47+00:00
23,1545915908035674112,every attempt of mine to quit vaping is ended by lana’s white dress vape crackle,hotfunnysexyboy,2022-07-09 23:40:48+00:00
24,1545915860178685952,"Top story: F.D.A. Lets Juul Appeal Ban and Stay on the Market During a Review https://t.co/1NouZM3NMh, see more https://t.co/pJOewKEgID",matthewjoseph99,2022-07-09 23:40:37+00:00
25,1545915835771805696,thanks mom for stealing a vape from one of your friends for me after the fact that i quit…,itssfrancheska,2022-07-09 23:40:31+00:00
26,1545915680708431873,Day ten of no vaping (:,SarieElaine,2022-07-09 23:39:54+00:00
27,1545915641655398406,"If you vape, you could be inhaling toxic metals into your lungs. To show you how scary that is, we made metal monsters. (Wilhelm scream)

But nothing is as scary as the facts, vaping can deliver toxic metals like nickel and lead into your lungs. https://t.co/nprQZ9ojAi",ElizaBethBitc,2022-07-09 23:39:45+00:00
28,1545915613209673728,mfw i’m in the middle of refilling my vape and the fish sticks are done https://t.co/azfcqwHSc1,notbryancannoy,2022-07-09 23:39:38+00:00
29,1545915465733636098,Afasht Sully be Vape https://t.co/UXFYdRcWY9,BetterCallSamir,2022-07-09 23:39:03+00:00
30,1545915413862629377,my sisters bf was like I have a present for u back home and when we got to their house he gave me a new vape setup blessssss,countingthin,2022-07-09 23:38:51+00:00
31,1545915240507899908,"// if eddie was to live in 2022, what flavor vape would he choose?",BCKT0FUTURE,2022-07-09 23:38:09+00:00
32,1545915170828042240,vaping and reading. https://t.co/TqvAbcYg7b,slvthughes,2022-07-09 23:37:53+00:00
33,1545915104482529281,"damn my dyslexia acting up, thought shawty was a vape god. turns out she’s just from Cape Cod",radioroadhead,2022-07-09 23:37:37+00:00
34,1545915057875390464,New vape 💨🍑 https://t.co/pooGYmmDMB,breanna_biliak,2022-07-09 23:37:26+00:00
35,1545914997653803008,This man threw my vape out the damn window 😭😭😭😭😭,damyamikel,2022-07-09 23:37:11+00:00
36,1545914803499126784,vaping overdoses are serious business https://t.co/ji3DTj5Zee,streamed_hams,2022-07-09 23:36:25+00:00
37,1545914721769062400,Right wingers hoping an influential AMERICAN black female basketball player gets sentenced to ten years in a Russian prison for a vape cartridge really shows their true colors… #FreeBrittneyGriner,BEASTfromEAST73,2022-07-09 23:36:06+00:00
38,1545914648142221315,Vaping isn’t even a little taboo at this point but I work exclusively with people 25+ so none of them vape and consequently my young beautiful perfect 20 y/o self is horrified to mention anything about The Electric Nicotine,redfoobigafro69,2022-07-09 23:35:48+00:00
39,1545914461986471936,meu irmão soltou pra um estranho: my brother doesn t vape.. he just hold it to make himself (((more))) cool,geuflasio,2022-07-09 23:35:04+00:00
40,1545914334764736512,why does juice taste like vape,eIaanoftroyius,2022-07-09 23:34:33+00:00
41,1545914243438067717,I left my vape at home bro 💀 im like abt to scream I need that shit,siickiii,2022-07-09 23:34:11+00:00
42,1545914174726873088,let’s vape and drink red bull together https://t.co/KjxmTTMrTd,ofwildfIower,2022-07-09 23:33:55+00:00
43,1545914042442813441,the juul wont let me have my seretonin,eilish_lauren,2022-07-09 23:33:24+00:00
44,1545913920669601793,I swear my vape gets me through anything and everything,purecapri,2022-07-09 23:32:55+00:00
45,1545913882761478148,bitches be acting worried about microplastics and seedoils but stay buying delta10 vapes at their local gas station,silencemethod,2022-07-09 23:32:45+00:00
46,1545913671179722752,"80% of US should use this coupon code. Maybe you can stop smoking, vaping, eating too much and drinking too much...though I love a good drink... https://t.co/UJkEmIczX6",flavwood,2022-07-09 23:31:55+00:00
47,1545913377670647808,"Narwhal | OG True Hydro Vaping Machine Dps #GenshinImpact #Tartaglia 

https://t.co/wdCvs6oXUc https://t.co/89qgSobmpk",MinaKamiEi,2022-07-09 23:30:45+00:00
48,1545913106194264065,"Fixing so many thing lately 
Suunto core watch 
Casio watch
A few Vapes 
2 ps5 controllers 
And a pc I’m working on for a friend in progress. 

Sheesh man I just wanna play video games.",WrathsPath,2022-07-09 23:29:40+00:00
49,1545912794238914561,"Just ordered this guy off ElementVape. Couldnt pass up in the price. Just wish my state didnt have that stupid vape tax b.s. Also got 2 new batteries and a 4 bay charger coming along with it :) [by KFizzle290TTV]
  
 #vapeNation #vapes https://t.co/rvHrAFOeAS",VapesHeaven,2022-07-09 23:28:26+00:00
50,1545912758021095427,"nothing better then vaping at a beach [by IzzyNier]
  
 #juice #vapeNation https://t.co/Rkd7qPwTy6",VapesHeaven,2022-07-09 23:28:17+00:00
51,1545912545457762305,Can I still vape even though I got covid ? or is that taking it to far … 🧐,xodemonexo,2022-07-09 23:27:27+00:00
52,1545912509068197890,okay juul which of ur two shows was ur favorite,chalametshouse,2022-07-09 23:27:18+00:00
53,1545912194608545799,"Here's a £5 Off Orders over £20 for your first order at Vape Superstore. To accept, use my referral link: https://t.co/feGgL8MK2N",janholl39ffs,2022-07-09 23:26:03+00:00
54,1545912070113472512,miss my vape too,chasahi_,2022-07-09 23:25:33+00:00
55,1545912016375791618,Tyra has a vape on deck at all times 😭,dubsy__,2022-07-09 23:25:21+00:00
56,1545911851967549446,Stepped off the food truck to vape and immediately made eye contact with Mrs.Turocy,gdd426,2022-07-09 23:24:41+00:00
57,1545911729279815682,i bet you got a little vape pen in that stupid satchel of yours right now.,puppethbot,2022-07-09 23:24:12+00:00
58,1545911562870738944,"H&amp;M plain colored T shirts are basically condoms for your torso. It’s the Juul pod of shirts. The pregnancy test of Clothing. The opened can of beer of appeal. The 15 dollar paper plate of a basic necessity. 

Single use T Shirts. Fuck you @hm",SomeGuy129,2022-07-09 23:23:32+00:00
59,1545911469157539846,*hits vape sadly*,Ansonio2,2022-07-09 23:23:10+00:00
60,1545911161912233985,"I love being in @BPLBoston when there's a ballgame that night. The library was full of people in Red Sox fan gear, legit enjoying all of the fine art and culture there. And in a few hours, many of them would be chucking disposable vape pens at pitchers in the Yankee bullpen.",Ihnatko,2022-07-09 23:21:57+00:00
61,1545911094534934529,"Filtro vegetariano no ifood:
Frango no balde
Vape shop
https://t.co/Qy1DJEBu8r",falacavinha,2022-07-09 23:21:41+00:00
62,1545910798396039169,How to Talk to Your Teen About the Dangers of Vaping and E-Cigarettes Recent studies have shown that over 11 percent https://t.co/HbiZrHOSq5,TutorinTinslTwn,2022-07-09 23:20:30+00:00
63,1545910639494848512,Hotboxing a vape is insanity,KissMyMahogany,2022-07-09 23:19:52+00:00
64,1545910550445572096,"""The effect of conflicting public health guidance on smokers’ and vapers’ e-cigarette harm perceptions""

Full text available as PDF here:

https://t.co/VAa8ADJxIF https://t.co/VLDX1nHthh",jkelovuori,2022-07-09 23:19:31+00:00
65,1545910473228312576,Those weekend feels #vape #rum https://t.co/kaGaHFX3kr,chaosbyjes,2022-07-09 23:19:13+00:00
66,1545910449312370688,"As a pediatrician, I've been concerned about teens &amp; vaping for a while. So I was glad to see the FDA cracking down on Juul products. Flavors and ads target teens, and there is a real concern that vaping has an adverse impact on kid and teen health. We need to put our kids first. https://t.co/YuJz1jPTEQ",SEAROSE19606266,2022-07-09 23:19:07+00:00
67,1545910149566668801,Narcos but it’s college kids moving mint Juul pods across the border with Canada,ParkerNathans,2022-07-09 23:17:55+00:00
68,1545910043509280769,thats a vape babe https://t.co/WB8PF6CKLQ,havinaswelltime,2022-07-09 23:17:30+00:00
69,1545910034571329536,Left my vape in the car and it's raining,chimp_fan,2022-07-09 23:17:28+00:00
70,1545909718001991680,pov : you dont vape but it sure as hell look tasty..and nice for collections🙃 https://t.co/6gWVN8p2mz,arydaclown,2022-07-09 23:16:13+00:00
71,1545909611751821312,My vape died but that shit be giving me headaches idk how y’all do it on the daily tbh,VICBEVEXED,2022-07-09 23:15:47+00:00
72,1545909563945254912,"Just because it's a Subaru doesn't mean we vape, Karen",TheSubaruBot,2022-07-09 23:15:36+00:00
73,1545909190018809858,"bought a disposable vape, everyone shame me",mmdnnp,2022-07-09 23:14:07+00:00
74,1545908666590806017,Yall losers smoking vape shit with a pipe 🤣🤣🤣🤣🤣 https://t.co/ER3YoAJhZb,freddypined_ayy,2022-07-09 23:12:02+00:00
75,1545908525775323136,I think the bartender is drunk. She keeps takeing drinks when people go out to smoke there ciggies. When i go out to vape my 420 pen she picks it up and throws it out. Lucky i got a new one.,jesse_kavanaugh,2022-07-09 23:11:28+00:00
76,1545908390718840832,Vaping: An Unnecessarily Dangerous Lifestyle Choice | Nature's Real Health https://t.co/vfKwzcAV6f,nicktompan,2022-07-09 23:10:56+00:00
77,1545908298943148033,Vape up the nose better,wearetheSGA,2022-07-09 23:10:34+00:00
78,1545908181020426240,"vapes are fucking cringe, smoke actual tobacco you pussy I need u to die.",krawlerfizz,2022-07-09 23:10:06+00:00
79,1545908040297218051,lmfao this vape be having me out my mind,yemamaas,2022-07-09 23:09:33+00:00
80,1545908021221400576,how u gonna be vaping with a whole ass baby in ur belly,MykeyMercado,2022-07-09 23:09:28+00:00
81,1545907854367924225,y’all got 40 year old men holding vapes!! THIS IS TOO FEM FOR THEM LMFAOOO,itzrolanddude,2022-07-09 23:08:48+00:00
82,1545907709655916544,"*passing out on muscle relaxers sitting up with a vape in my mouth, phone in hand and headphones on*
him: “baby are you sleeping?”
me when I lie: https://t.co/PBTNALfbbr",notbadmimi,2022-07-09 23:08:14+00:00
83,1545907697333174273,"#thc #cbdhealth #cbd #cannabis
 The perfect balance makes Peppermint Kush CBD Vape Pen. A combination of crisp, cool peppermint and sweet, piney, earthy goodness. This profile has a complex aroma and tastes like mint and cookies, which https://t.co/a3IHndRCGe #cannabiscommunity https://t.co/XgmHh02qqy",cbdhealthbasket,2022-07-09 23:08:11+00:00
84,1545907598246830080,Sometimes you just gotta put down the vape and pick up the joint 😮‍💨💨,GioTheCloser,2022-07-09 23:07:47+00:00
85,1545907279580512256,nooo just finished a vape in two days somebody stage an intervention,colettemarita,2022-07-09 23:06:31+00:00
86,1545906968153522176,never did i think i could go 25 days without vaping 😂,yung_kaspa,2022-07-09 23:05:17+00:00
87,1545906726804897792,When she lets go of your hand to hit her vape &lt;,jazzyy_o,2022-07-09 23:04:19+00:00
88,1545906594856288256,Vaping so hard at work that I throw up and they let me go home,ClownZoneGuru,2022-07-09 23:03:48+00:00
89,1545906546739118080,"All these bitches vape, I do acapella",gracehasfun,2022-07-09 23:03:36+00:00
90,1545906282334457866,If u remember my juuling in the bathroom selfie era I love u,bingobungus,2022-07-09 23:02:33+00:00
91,1545906221269614595,my new vibe is just apparently living off my vape and red bull 👹,ofwildfIower,2022-07-09 23:02:19+00:00
92,1545906188209967105,Lol why would she take a vape pen to Russia? https://t.co/fIq7AXXSiz,Yeg510,2022-07-09 23:02:11+00:00
93,1545906163409207297,i’ve really fallen down the vaping to cigarettes pipeline… https://t.co/wUpONTPuHv,aleziiaalize,2022-07-09 23:02:05+00:00
94,1545906114004299776,Going into vape shops asking them to sponsor me as a professional poker player,AlexShaneMoore,2022-07-09 23:01:53+00:00
95,1545905956587913216,Vaping is for weaklings,AwesomeDCFacts,2022-07-09 23:01:16+00:00
96,1545905645559418882,how you gonna judge me for vaping but you smoke BLACKS… calm down uncle!,brwnmaggit,2022-07-09 23:00:02+00:00
97,1545904933979013122,"stop getting my kills, bitchass -juul",posadamaggie111,2022-07-09 22:57:12+00:00
98,1545904892358799361,F.D.A. Lets Juul Appeal Ban and Stay on the Market During a Review https://t.co/sVTd9FYqRv,karmanfinancial,2022-07-09 22:57:02+00:00
99,1545904849291968512,pro tip if ur a good singer dont start vaping,ateezc4ls,2022-07-09 22:56:52+00:00
100,1545904822380941312,Wake up vape up,trinavegatwt,2022-07-09 22:56:45+00:00
101,1545904727719821313,Accidentally got vape juice in my eye,itsramathegreat,2022-07-09 22:56:23+00:00
102,1545904719029080064,if i owned a vape would you unfollow me,felikitti,2022-07-09 22:56:21+00:00
103,1545904167193120768,"im gonna stay up tonight, go to the gym and the grocery store with my mom and go get a vape somewhere and then i’ll sleep",mygc4ls,2022-07-09 22:54:09+00:00
104,1545904073999654912,i hate when ppl blow their vape smoke in my direction,pxnghtmrgrl,2022-07-09 22:53:47+00:00
105,1545903966168686593,I’ve quit vaping for good this time i promise,PinkHondaS2000,2022-07-09 22:53:21+00:00
106,1545903952335626242,This Indian man was vaping lol,_ReidDollaz,2022-07-09 22:53:18+00:00
107,1545903795259031552,vaping has changed my singing voice,digitalha1o,2022-07-09 22:52:40+00:00
108,1545903241170489344,"Swapped the cigarette for vapes 

Now you have blueberry mango ice blast cancer",jiggypierre,2022-07-09 22:50:28+00:00
109,1545903196836593665,20 dollars for a vape😒 u niggas getting stingy,peakamani,2022-07-09 22:50:18+00:00
110,1545902837778919425,every time i’m in the bathroom someone wants to come in and rip ass! can i vape in peace ????!,AngletonJada,2022-07-09 22:48:52+00:00
111,1545902455107383297,“I’m aching dude and you’re vaping on me.”,divin3sewage,2022-07-09 22:47:21+00:00
112,1545902121467293696,Love that Steph works next to a vape shop so i can have him buy me one 😇,HappyMason182,2022-07-09 22:46:01+00:00
113,1545901880894685184,"SHE VAPE ALL DAY 

https://t.co/e22qtlrLmZ",LILBOYROC,2022-07-09 22:45:04+00:00
114,1545901694134919175,"#thc #cbdhealth #cbd #cannabis
 Now Wedding Cake Cart Active CBD 800mg comes with the raw power of Active CBD. Pure, hemp-based cannabinoids combined for strength and power. Raw Cannabinoid Active CBD Vape Cartridges offer you 800mg of https://t.co/xgWvpXGqSn #cannabiscommunity https://t.co/LXjtV2Nt7k",cbdhealthbasket,2022-07-09 22:44:20+00:00
115,1545901690246815744,"#thc #cbdhealth #cbd #cannabis
 Delta-8 THC Disposable Vaping Pen Zkittlez (Indica). Zkittlez is an indica-dominated hybrid who’s name reminds you of a certain candy. For a reason, this strain is a fruit explosion. Zkittlez will have https://t.co/HY3IiSAWe6 #cannabiscommunity https://t.co/EvZJE9tewV",cbdhealthbasket,2022-07-09 22:44:19+00:00
116,1545901653328416770,this nigga got the Scooby Doo haircut 🤣🤣🤣😭😭😭😭 https://t.co/eGb1hNa6cG,i_lost_my_juul,2022-07-09 22:44:10+00:00
117,1545901615026167808,my sister told my dad she couldnt come out this weekend cuz she was sick and then we saw her in town today w her friends vaping #Busted,ierotism,2022-07-09 22:44:01+00:00
118,1545901533178597378,"egyptian boys are all exactly the same kolo copy paste, gym, curly hair, vapes, redbull, lobby, football or basketball.. y'all r the same",nayucalz,2022-07-09 22:43:41+00:00
119,1545901482444193793,"Took the great minds and the vapers
And a pocketful of seed
It's time for us to leave",lordelyricsbot,2022-07-09 22:43:29+00:00
120,1545901263145009152,“it was just a weed vape pen” yeah…..those are illegal in Russia 😂 what’s not clicking here lol?,BradleyDesmondB,2022-07-09 22:42:37+00:00
121,1545901089806901248,IM FUCKING GONE LMAOOOOOOOO https://t.co/eGb1hNa6cG,i_lost_my_juul,2022-07-09 22:41:55+00:00
122,1545900893886898176,Going to a festival is embarrassing when you’re over 16 and don’t own a vape,mywiId,2022-07-09 22:41:09+00:00
123,1545900594254209024,Vapes are cool but ain’t nothing like hitting the L,_rosslife,2022-07-09 22:39:57+00:00
124,1545900335511883783,lost my favourite vape... my enemies are shouting in exultation 😔😔,commiebinch,2022-07-09 22:38:56+00:00
125,1545899905176244224,just got a peach mango flavored vape im gonna have an orgasm,beesadhours,2022-07-09 22:37:13+00:00
126,1545899819230580736,"FINALLY beat my 29 second record :’) I sometimes wonder if some vape or melt comp would make this faster but it’s so satisfying not letting the big guy get his shield

If anything maybe pyro resonance instead of cryo resonance and just pray Ayaka crits lmao https://t.co/WUZLtipTBY",quietpianoguy,2022-07-09 22:36:52+00:00
127,1545899549218246656,im gonna attempt to vape as the same room as my sister hopefully i dont get caught,slut4lover,2022-07-09 22:35:48+00:00
128,1545899500451123200,finished my last juul pod im shaking &amp; foaming at the mouth,coochiefirst,2022-07-09 22:35:36+00:00
129,1545899197559234560,atp im gonna buy a rechargeable vape n stuff,httpsfaii,2022-07-09 22:34:24+00:00
130,1545898744553435136,"holy shit, the comments are killing me

every natural disaster or new disease DLC people have to make it fucking political https://t.co/8hSSelbBcv",i_lost_my_juul,2022-07-09 22:32:36+00:00
131,1545898427569012736,Damn erbody got a vape box I need to sale dem hoes 😹,YungJapFlame_,2022-07-09 22:31:21+00:00
132,1545898108214685696,"Their are many things that kill you. Like vaping, so why do it when you can do less deadly things, like playing minecraft, or even FORTNITE!",Dont_Vape_Bot,2022-07-09 22:30:05+00:00
133,1545898074253545473,Just blew an O on my bi-hourly vape break everyone clap,chemdawgtweaker,2022-07-09 22:29:56+00:00
134,1545898045656662016,How you lot that vape look to me https://t.co/DCaiemCLGJ,JaySimMusic,2022-07-09 22:29:50+00:00
135,1545898020037967872,my mom once thought the box my perfume came in was vape packaging,UnitEVA_00,2022-07-09 22:29:44+00:00
136,1545898010340724736,In my living room wondering why it’s smelling of vape and then I realised the mum is eating strawberry yoghurt,senorgaddafi,2022-07-09 22:29:41+00:00
137,1545897878450733069,Eew I act like I can’t go one day without puffin a vape,psychossyydd,2022-07-09 22:29:10+00:00
138,1545897848482447363,Eff. The MD primaries are less than two weeks away and I know jack about any of the candidates. Which one is least likely to ban vaping?,jimcollins,2022-07-09 22:29:03+00:00
139,1545897774713036801,my nephew “is that a vape?” mf why you calling me out,savleibow,2022-07-09 22:28:45+00:00
140,1545897451407671296,"Trying to quit smoking (Again! LOL). I vape to supplement. It helps me cut back, but it doesn't hit the same. I went several years without it, but keep going back. Any non-medical advice? Please don't say gum. Tried that... https://t.co/43gcJN6pYp",not_a_piano_key,2022-07-09 22:27:28+00:00
141,1545897178769547274,working was so much easier when i used to vape,fairyszn,2022-07-09 22:26:23+00:00
142,1545897025618714625,not me vaping on the train,S0FARSOGOOD,2022-07-09 22:25:46+00:00
143,1545896659728535552,buying a crappy vape one of the worst feelings,cassidycross0,2022-07-09 22:24:19+00:00
144,1545896621128531976,NOT A FUCKING VAPE GOD AJKEHKJHAE https://t.co/zXAzCUxWcB,cordeIiafm,2022-07-09 22:24:10+00:00
145,1545896295780388864,Wake up vape up,jadewesttwt,2022-07-09 22:22:52+00:00
146,1545895999146795016,praying that my gf left her vape on my bed,DISCOCOW3OY,2022-07-09 22:21:42+00:00
147,1545895982113734656,when vape is a meal&gt;&gt;,spitoutcals,2022-07-09 22:21:38+00:00
148,1545895934533541892,#tomorrow #vape #pen #vapepen #vapelife #concentrates #dollardeal #oil #710 #discount #coupon #promo @atldispensary We got your #highlife covered 🥰👍🏻 https://t.co/aPQtqdDW6D,AtlDispensary,2022-07-09 22:21:26+00:00
149,1545895515572805635,juul and i screamed so hard when medicine came on😭😭😭💀,onlyhabitx,2022-07-09 22:19:46+00:00
150,1545895367081852929,Anyone else get a random feeling that one of your friends is doin some stupid shit? Which one of you saw your ex? Did someone start vaping again? Who got in a fight last night?? Gonna have to reach out to everyone now 😅,littlebill5184,2022-07-09 22:19:11+00:00
151,1545895321116352512,"*Inhales vape, kills yourself* https://t.co/2qDtZ075nn",SketchyWolf_13,2022-07-09 22:19:00+00:00
152,1545895266175303680,my coworkers need to buy their own vapes instead of acting like mine is communal,canismajcr,2022-07-09 22:18:47+00:00
153,1545894656709369856,Hitting my vape in my childhood bathroom so my fascist grandparents don’t execute me,_Pugnacious,2022-07-09 22:16:22+00:00
154,1545894414568116224,idc if you try to “pass me” a vape i’m laughing at you,iiamm__marii,2022-07-09 22:15:24+00:00
155,1545894168093933572,"#edibles #cbd #gummies #hemp  #vapejuice #delta9 Pink Lemonade Disposable Vape THC O Alibi . When it’s late at night, and they catch you with a good buzz, you’re going to need a decent Alibi. Do you want to say you were vaping with https://t.co/j6jyoe3cO1 #cbdedibles #delta8 https://t.co/ZwwURO3ae8",CBDSmokeShop,2022-07-09 22:14:25+00:00
156,1545894123202379776,i just saw this tiktok video WHY IS HER VAPE SO BIG LMAOOOOOO https://t.co/gN1GtIkEOm,jadebugzz,2022-07-09 22:14:14+00:00
157,1545894121742688258,"after this vape, im done w em 😮‍💨",Itss_Janayee,2022-07-09 22:14:14+00:00
158,1545893982072455170,I’m sorry I vaped on the Colby Jack cheese,rawritsliv,2022-07-09 22:13:41+00:00
159,1545893800727306240,Charlie took a fat rip off their juul,slugtsbot,2022-07-09 22:12:58+00:00
160,1545893645731221505,"Not sure when I last actually visited a pub on a night out but all the youngsters are vaping - me, I’m using them as I quit - can’t quite get my head around it #daft https://t.co/IHMEu4Myy2",wickedladybiker,2022-07-09 22:12:21+00:00
161,1545893624226914307,"I believe she admitted to having hash oil in vape cartridges. Can someone educate me if this is the same as THC? I remember hash in a cube form you smoked. Btw, I was watching friends do this. https://t.co/2V9ANfnrjd",EhungateEric,2022-07-09 22:12:15+00:00
162,1545893576957116422,some kid just blew his fkn juul smoke in my face I’m gonna kill someone,fiatmanus,2022-07-09 22:12:04+00:00
