,TweetID,TweetContent,TweeterUsername,TweetDatetime
1463,1545645891390177281,Konting starbs na may halong vape 💯 https://t.co/pHKfHjaDUt,BunnyTurtle98,2022-07-09 05:47:51+00:00
1464,1545645795462074368,Vape high makes me feel functional for like ten minutes then my whole life crashes down aggressively. It’s a spliff ting for life lol,suburban6lack,2022-07-09 05:47:29+00:00
1465,1545645637563211776,Wonder if anyone realizes laying on a heating pad is basically you laying on a giant wall powered vape coil.,dilutedspine,2022-07-09 05:46:51+00:00
1466,1545645458911109120,"i accidentally flushed my vape down the toilet, i think issa sign",ziariaaaa,2022-07-09 05:46:08+00:00
1467,1545645349716598784,doing 10 yrs for having a vape seem like a poorly funded short film,countdemroIIz,2022-07-09 05:45:42+00:00
1468,1545645274109882368,"Saturday, I have an appointment with the juul doctor, and he is going to munch on me to fix the problem!",FinnVonFritter,2022-07-09 05:45:24+00:00
1469,1545645130547429377,"Everything starts small &amp; everyone is unique, that’s the ethos of the #NFVapeClub

Building a @discocoop 🔗 #phygital #vapes
If you’re feeling it, come &amp; join the #AntiPanicRoom , still some OG roles left🥦

https://t.co/HO62XlMEuk

#NFVC #CardanoCannabisCommunity #plantmedicine https://t.co/ALGpAQSIMB",Retrosteam_,2022-07-09 05:44:50+00:00
1470,1545644928100868096,"idk how ppl vape. hit my coworkers pen and felt like my lungs were gonna explode and like I couldn't get enough air in them 😵
not doing THAT again",blvebeetle,2022-07-09 05:44:02+00:00
1471,1545644450596245505,Is Vaping CBD Safe or Dangerous? Avoiding the Risks https://t.co/81ILYwa3GB #hemp #healthylifestyle #cannabis #wellness #cbdoil #healthy #painrelief #wellbeing #health,BondiMarijuana,2022-07-09 05:42:08+00:00
1472,1545644127181758464,darth vaper https://t.co/J3IVIUmtCB,ndrgrfld,2022-07-09 05:40:51+00:00
1473,1545644114120626176,"vape on Saturday

https://t.co/ix8QvptwTi https://t.co/uYZS4wk8Xq",LeoLee88738055,2022-07-09 05:40:48+00:00
1474,1545643932524023808,Me n my two 2 vapes 😂 https://t.co/750axkBaK1,UnholySage666,2022-07-09 05:40:04+00:00
1475,1545643928627675137,VAPE PENS,knucklelength,2022-07-09 05:40:03+00:00
1476,1545643840081604608,stiizy really capitalized on the market of the white girl they took the rebelliousness of drugs and put in it the recognizable form of a juul,Isabellewheat,2022-07-09 05:39:42+00:00
1477,1545643663132397569,what about vaping ? https://t.co/TrdEgYjuFe,lNTOTHEPlT,2022-07-09 05:39:00+00:00
1478,1545643362883182593,He's not wrong.... https://t.co/ZzjlWVSGtS,DOM_FADDA,2022-07-09 05:37:49+00:00
1479,1545643062633762817,my vape battery ran out of juice and nobody can go take me to a smoke shop to get a battery tomorrow so i have to wait till Sunday for ones i ordered online to come... agony,ezrabirdhouse,2022-07-09 05:36:37+00:00
1480,1545643032955027456,Binoid | Blue Dream Hybrid Delta 8 Rechargeable Disposable Vape Pen 1g https://t.co/L4XFeBcMig https://t.co/rZeMKcDCHo,buyCBDhub,2022-07-09 05:36:30+00:00
1481,1545642675764097024,July 13 is a big day for the future of vaping products https://t.co/a3gp6vTrff,WCPO,2022-07-09 05:35:05+00:00
1482,1545642584910860291,So no one vapes in Burbank huh?,BettyieJayne,2022-07-09 05:34:43+00:00
1483,1545642033494122496,"Now chat, whenever I see y'all talk about these ""Cloud Chasers"" I want you to first remember that there was a song in KH II called Cloud Chasers.

Yes I am indeed sayin' that Kingdom Hearts allows Vape in it's OST!",Koromaru_GBD,2022-07-09 05:32:32+00:00
1484,1545641832478310401,had a dream i went back to the toilet to get my vape. woke up disappointed.,nafridyas,2022-07-09 05:31:44+00:00
1485,1545641823456174080,"One thing bout me, imma hit my vape idgaf where we are 😂",_xoJaee_,2022-07-09 05:31:42+00:00
1486,1545641671425003521,i think we can all agree that sylvanas smokes and nathanos vapes,KimaisAlloren,2022-07-09 05:31:05+00:00
1487,1545640976282275840,I miss my vape,venicethin,2022-07-09 05:28:20+00:00
1488,1545640842156601346,Excellent! More repression➡️more powerful drugs in smaller volume ➡️ much higher risk of overdose but ⬇️risk of detection. Now #vaping➡️disposable vapes➡️❓@drjoesDIYhealth @ColinMendelsohn @VaperNt @LivePippas @vaper_the @legionvapes https://t.co/N3UpO3H5eF,AlexWodak,2022-07-09 05:27:48+00:00
1489,1545640455492186113,"Stopped vaping like 10 days ago, already feel the differences. 🫡",AiG300,2022-07-09 05:26:15+00:00
1490,1545640378170228736,"I been thru so much  trauma, ptsd, derealization/depersonalization  for the past 2 years yet I’ve been living life, but y’all “I’m in luv with an emo girl” mgk built ass’ goes to therapy bc of a juul",MassiveWhales,2022-07-09 05:25:57+00:00
1491,1545640184758378496,"we quit vaping nic , my new dude said cut back the tree .. 🤔🤔 maybe just maybe ..",ovoxochina,2022-07-09 05:25:11+00:00
1492,1545640047029981184,"People really smoking those flash drive vape things, just because they see other people smoking em. That’s wild af to me",Simply_MisRissa,2022-07-09 05:24:38+00:00
1493,1545639853546622977,my vape broke so im taking this as a sign to quit,glitzlina,2022-07-09 05:23:52+00:00
1494,1545639829588828163,almost grabbed my vape 💨 omg no 😂,_mellowmangoes,2022-07-09 05:23:46+00:00
1495,1545639807166054407,Alea’s vape tastes like Bath and Body Works Cucumber Melon scent smelled in my youth.,gingyrooni,2022-07-09 05:23:41+00:00
1496,1545639434791550978,DO I GO CHECK TO SEE IF IT SMELLS LIKE VAPE JUICE OR WHAT IDK FUCK LOL THIS IS SO DUMB AND CRINGE,violetfawn,2022-07-09 05:22:12+00:00
1497,1545639331456602114,I let this guy hit my vape only bc he said “that ole thing”,Jaide85303580,2022-07-09 05:21:47+00:00
1498,1545639197435777024,My dad informed me today that he was going to 7Eleven to get “vaping pencils”,CoolCatsnKittns,2022-07-09 05:21:15+00:00
1499,1545639165207134208,dipping into the utility closet at work to take fat rips from my vape,doseyourdreams,2022-07-09 05:21:08+00:00
1500,1545639040988467200,my vape is brocken help mi,poopygirl420,2022-07-09 05:20:38+00:00
1501,1545638685177249798,Fume vape pens are the Best I’m Addicted 😩,_Nunu01,2022-07-09 05:19:13+00:00
1502,1545638650037374976,The Food &amp; Drug Administration Has a Vaping Problem https://t.co/rh7i2yJp6J via @reason,imaracingmom,2022-07-09 05:19:05+00:00
1503,1545638429064458240,"At a Wolf Parade show, they've spent 5 minutes debugging some AV issue and the guitarist is vaping onstage. Feels like a college band performance. This is great.",HeyImSeph,2022-07-09 05:18:12+00:00
1504,1545638362941648896,vaping and wearing a nicotine patch,retardmuppet,2022-07-09 05:17:56+00:00
1505,1545638246851481602,Some boy just hit my lip plumper lip gloss like it was as vape,nnnnnnnikki_,2022-07-09 05:17:29+00:00
1506,1545638017406230529,You don’t know pain until you hiccup while hitting your vape 😭,reagan1108,2022-07-09 05:16:34+00:00
1507,1545637851815378944,Vape coil burnt and I died in raft everything is NOT coming up Milhouse rn,sum69mer,2022-07-09 05:15:55+00:00
1508,1545637659216846848,disposable vapes be like “3000 puffs” yeah if ur a fucking noob😭😭😭,yasspilled,2022-07-09 05:15:09+00:00
1509,1545637513351643136,My frosted banana vape just died  https://t.co/o2gVTKk06S,grrtt_wrich,2022-07-09 05:14:34+00:00
1510,1545637403414650880,"#edibles #cbd #gummies #hemp  #vapejuice #delta9 Pink Lemonade Disposable Vape THC O Alibi . When it’s late at night, and they catch you with a good buzz, you’re going to need a decent Alibi. Do you want to say you were vaping with https://t.co/j6jyoe3cO1 #cbdedibles #delta8 https://t.co/vIe8GGTVje",CBDSmokeShop,2022-07-09 05:14:08+00:00
1511,1545637001851977733,a horror movie where the only light is them hitting their vape,alysemurphy,2022-07-09 05:12:32+00:00
1512,1545636987050135555,mom almost caught me mid vape,vanteours,2022-07-09 05:12:28+00:00
1513,1545636976279244801,all my vapes on their last live https://t.co/hltdFmRiwH,vanilladoIl,2022-07-09 05:12:26+00:00
1514,1545636927113760768,slowly been cutting off on vapes 👋🏻,jackslackk,2022-07-09 05:12:14+00:00
1515,1545636660750188547,put that vape down and pick up a cigarette so u can have a REAL nicotine addiction 🙄,ros3lynnvasquez,2022-07-09 05:11:11+00:00
1516,1545636194612125697,I’m so glad I don’t smoke vapes no more 😖 they use to make my head hurts so bad,thedollming,2022-07-09 05:09:19+00:00
1517,1545636084788465665,I just lost my chapstick in my bed the way yall be losing yall’s juuls and roku remotes,__taylormarie,2022-07-09 05:08:53+00:00
1518,1545636017813733377,I was fine until my mama told me she had my vape 😭,heicyy_,2022-07-09 05:08:37+00:00
1519,1545635995235676161,I lose my vape every 30 min I swear,KylesWrldd,2022-07-09 05:08:32+00:00
1520,1545635919142785024,"Watermelon Madness #vape #vapecommunity
$19.99
➤ https://t.co/NUFdOO0B43 https://t.co/xmUjayY0xL",MaxVapingStore,2022-07-09 05:08:14+00:00
1521,1545635855758331905,Hit my vape now I’m in San Diego 😭😭,monkeybaIIin,2022-07-09 05:07:59+00:00
1522,1545635834052878336,She’s a 10 but falls asleep holding her vape,brookelucas5683,2022-07-09 05:07:54+00:00
1523,1545635757892714496,My last meal request on death row would be to hit my vape,shitbaby4444,2022-07-09 05:07:35+00:00
1524,1545635742654791680,I'm a 'put Little Twin Stars stickers all over my new vape' type of little girl,RukaPuddlegum,2022-07-09 05:07:32+00:00
1525,1545635609066225665,Cancel the vapes .. then maybe ppl will start be real af and smoking fckin cigarettes,lllleeeah,2022-07-09 05:07:00+00:00
1526,1545635603290566657,Wake up vape up,trinavegatwt,2022-07-09 05:06:59+00:00
1527,1545635306182934528,"#thc #cbdhealth #cbd #cannabis
 Skywalker Miami High Delta-8 THC Vape Cartridge Bienvenido a Miami. The most beautiful city in the world where the people are hot. The weather is gorgeous, and the buzz from the delta 8 is High.  https://t.co/vTHtux6hSk #hemp #cannabiscommunity https://t.co/mgv0AWJXsa",cbdhealthbasket,2022-07-09 05:05:48+00:00
1528,1545635130752077825,"Minnesota set for 2023 trial against Juul Labs and Altria, for the central role they allegedly played in the youth vaping epidemic. https://t.co/ZOf5OIelOX",wahpeton,2022-07-09 05:05:06+00:00
1529,1545635110824726531,Thinking about how choosing a bubble gum flavored vape instead of any of the other flavors 7 months ago ruined the trajectory of the rest of my life,kartik_gopalani,2022-07-09 05:05:01+00:00
1530,1545635047763546113,"I don't know how so many people prefer non-menthol vape juice, my throat is like pls",trippingcals,2022-07-09 05:04:46+00:00
1531,1545634919811911682,the window's open watch your chai vaping,hellamouseshit,2022-07-09 05:04:16+00:00
1532,1545634533772365824,"If you smoke anything other than weed or a vape around me, just know that I’m judging the fuck out of you for it.",MrGotMyGirlBack,2022-07-09 05:02:44+00:00
1533,1545634530899492865,This vape pen sucks or whatever the hell it is,Lovinitbabes_,2022-07-09 05:02:43+00:00
1534,1545634503699312642,I almost cut dime off for not finding my vape 😂,Jamiaya_Shantel,2022-07-09 05:02:36+00:00
1535,1545634425123192832,All I do is blow this vape Lmaoo,justiceeasia,2022-07-09 05:02:18+00:00
1536,1545634178686783489,blake: *blows vape* me: ...WoW😏,sunnydragonbot,2022-07-09 05:01:19+00:00
1537,1545634171191758849,Stop vaping yalll we cant see,nako137,2022-07-09 05:01:17+00:00
1538,1545633888151621634,"Vaping bad, Exercising good",Dont_Vape_Bot,2022-07-09 05:00:10+00:00
1539,1545633702046117888,when u quit vaping #DarkSouls #DarkSoulsRemastered #NintendoSwitch https://t.co/AxkTMhNIb5,actremix,2022-07-09 04:59:25+00:00
1540,1545633625953140737,"Following the ban on Juul vaping products, a new study is looking into whether doing hookah is safer, and experts are sharing the differences. https://t.co/JcSqOaaCsj",KAMRLocal4News,2022-07-09 04:59:07+00:00
1541,1545633434864717826,"Yes, he vapes and I don’t really like that",manymains_p,2022-07-09 04:58:22+00:00
1542,1545633426455379968,Dropped my vape in the Uber 🫠,not_blaine,2022-07-09 04:58:20+00:00
1543,1545633241817747458,i hope thats a vape and not a flashlight..,codyvasy,2022-07-09 04:57:35+00:00
1544,1545632791768989697,I just want to see stressed out captain olivia benson hit a vape one time,90sbenson,2022-07-09 04:55:48+00:00
1545,1545632290947993600,Mbela your girlfriends are quite when we talk about degrees and college patiently waiting for the topic of alcohol and vape and they're your girlfriends😂😂😂,_KAU_NDA_,2022-07-09 04:53:49+00:00
1546,1545632089340403712,Bruh someone bring me a vape now,mama_shelbss,2022-07-09 04:53:01+00:00
1547,1545631855935881216,Vape god gym teacher #Moonrunners https://t.co/i0sKAbTXVt,obiwansponcho,2022-07-09 04:52:05+00:00
1548,1545631466419359747,MAJOR FLAVOR RELOADED 100ml E Liquid Juice 0MG Vape https://t.co/4OTbn7huww,UKVapeDeals,2022-07-09 04:50:32+00:00
1549,1545631449654886400,my vape died does anybody want to kill me,tweecunt,2022-07-09 04:50:28+00:00
1550,1545631127444115457,got free nic today bro literally let me choose which vape i wanted for free 😂,sweetsoursaucx,2022-07-09 04:49:11+00:00
1551,1545631084704141312,ngl i thought the red one was a vape https://t.co/PB6eeZU3aK,LALlSAGF,2022-07-09 04:49:01+00:00
1552,1545630609472913410,Some kid just stopped me at a red light and asked if he could hit my vape 😂,Halesthemoon,2022-07-09 04:47:08+00:00
1553,1545630224842358785,Going to lose my mind if I see one more Subaru vape joke on the Xbox X tweets,TheSubaruBot,2022-07-09 04:45:36+00:00
1554,1545629955035463681,do i deserve a new vape pen? be honest. also it has little 🍳🥚s on it,no444h,2022-07-09 04:44:32+00:00
1555,1545629938996236288,All our trains and stations are no vaping areas. Please do not vape.,traindroid_se,2022-07-09 04:44:28+00:00
1556,1545629905274015746,not me getting yelled at chase field because i cant “vape” 🙂,kymmburnss,2022-07-09 04:44:20+00:00
1557,1545629794057986048,temporarily not going on any social media cos mom found my vape LMFAO see you all in a week,beefybf,2022-07-09 04:43:53+00:00
1558,1545629741780180994,"#edibles #cbd #gummies #hemp  #vapejuice #delta9 Mango Kush CBD Disposable Vape Pen, Forget the coffee. Add some real buzz to your next Doughnut run. Doughnuts Active CBD Disposable Vape Pens, now in Mango Kush, blend the sweet and https://t.co/rGDmh8NEkh #cbdedibles #delta8 https://t.co/tJdR5ai3Z7",CBDSmokeShop,2022-07-09 04:43:41+00:00
1559,1545629609005285378,left my juul at keystone in ypsi. no one text,kendallroygrl,2022-07-09 04:43:09+00:00
1560,1545629433930960896,They’re gonna make mint flavoured vapes and expect me to NOT want to drink it?,Skelijay,2022-07-09 04:42:28+00:00
1561,1545629213062926337,about to fill up my vape https://t.co/OjOgPkRwNf,frizzybob,2022-07-09 04:41:35+00:00
1562,1545628743326019585,Those anti vaping videos crack me tf up !!!,crownedoscar,2022-07-09 04:39:43+00:00
1563,1545628685407059968,This mf threw his vape out the window on the highway because I said they were bad for you 😂😂😂,perezy_,2022-07-09 04:39:29+00:00
1564,1545628664049565696,Got my vape back that my sister locked away from me 😒,Dobcc3,2022-07-09 04:39:24+00:00
1565,1545628578032881666,She’s a 10. But vapes 🤢,soOmk_NuKe,2022-07-09 04:39:04+00:00
1566,1545628566544605184,1yr no vape no weed who’ve I become,MorganioJ1,2022-07-09 04:39:01+00:00
1567,1545628426090029056,"#thc #cbdhealth #cbd #cannabis
 Now Wedding Cake Cart Active CBD 800mg comes with the raw power of Active CBD. Pure, hemp-based cannabinoids combined for strength and power. Raw Cannabinoid Active CBD Vape Cartridges offer you 800mg of https://t.co/xgWvpXGqSn #cannabiscommunity https://t.co/C5Drrf2aIM",cbdhealthbasket,2022-07-09 04:38:27+00:00
1568,1545628421983698944,"#thc #cbdhealth #cbd #cannabis
 Try the only cannabinoid with built-in raw power. Pineapple Express Disposable CBD Vape Pen — Active CBD a proprietary blend of nature’s best all-natural hemp-derived cannabinoids. Give you the freedom https://t.co/gEOyD2fiTW #cannabiscommunity https://t.co/TRqICqZCOX",cbdhealthbasket,2022-07-09 04:38:26+00:00
1569,1545628363103932417,I hit my vape for the first time in a long time and just died immediately,priincessleya,2022-07-09 04:38:12+00:00
1570,1545628305092665345,i think my dog ate my vape https://t.co/IZsPlX9Kz3,soulskper,2022-07-09 04:37:58+00:00
1571,1545628190823301120,Said man getting his marching orders from 12 officers in the end. Reason 2= “we cannot disclose that” reason 3= “he was smoking a vape” https://t.co/e1mOn0X2se https://t.co/aAqgeZGDdQ,yehnahnogood,2022-07-09 04:37:31+00:00
1572,1545627874543140864,"In Toronto there’s a cool guessing game you get to play. You walk through a bar and smell something sweet and fruity, is it: 

A. A pretty girl’s perfume 
B. And ugly guy’s vape juice",KeithCapstick,2022-07-09 04:36:16+00:00
1573,1545627384119848960,you know you in the bay when the tesla uber says we can’t hit vapes cause it’s a rental,krixsssy,2022-07-09 04:34:19+00:00
1574,1545627132423856129,Wake up vape up,sampucketttwt,2022-07-09 04:33:19+00:00
1575,1545626879029383169,"So. What's in that bag? A weed vape for sure. Isotoners is my DarkHorse guess.
😏🤦‍♂️ https://t.co/4hZzuTl3q0",tchadwyk1,2022-07-09 04:32:18+00:00
1576,1545626369001938948,That was a dab pen not a juul,pppppppjax,2022-07-09 04:30:17+00:00
1577,1545626342678478848,I just wrote a review on Crave Max 2500 Puff Disposable Vape - Passion Fruit Lemon https://t.co/UKEKhg1Ist via @yotpo,OMGitsBralland,2022-07-09 04:30:11+00:00
1578,1545625796898848768,trying to quit vaping w/ an ed is the worst thing ever,eggunscrambled,2022-07-09 04:28:00+00:00
1579,1545625469315194881,I hate it here,Siren_Vapes_13,2022-07-09 04:26:42+00:00
1580,1545625421554896898,I’m vaping clouds at the minions movie 😩,_KetamineCowboy,2022-07-09 04:26:31+00:00
1581,1545625343788204032,"nothing will ever top the autumn before my surgery when i was hopped up on stress, malnutrition, no sleep, pain &amp; that high thc vape that absolutely fucked me up",nerobabss,2022-07-09 04:26:12+00:00
1582,1545625189907570690,me breathing out visible breath like Danny Phantom when he senses ghosts but it’s when hot boys I will ghost are around and the breath is just my vape,rhettrhaps,2022-07-09 04:25:36+00:00
1583,1545624794892206081,Discarded Disposable Vapes Help Ukraine Fight Russia | #students | #parents https://t.co/GvWlvOer6U,ParentSecurity,2022-07-09 04:24:02+00:00
1584,1545624465161207808,Grew up my way but I respect his juul at home,ClayBorrellBot,2022-07-09 04:22:43+00:00
1585,1545624423742541824,I’m a vaper now 🤮,Bonitamaaa__,2022-07-09 04:22:33+00:00
1586,1545624247346896903,los vapes de mango passed the vibe check,vero_isabel99,2022-07-09 04:21:51+00:00
1587,1545623848527208448,"I just lost my vape, found it in my pocket, spilled Mountain Dew all over me trying to take a sip of it, and then lost my vape again. https://t.co/sFhxmcr6Os",ZenithTheDeer,2022-07-09 04:20:16+00:00
1588,1545622909993058304,Not understanding how to use my mom's weed vape is the ultimate boomer/millenial Uno reverse card,olbronzeears,2022-07-09 04:16:32+00:00
1589,1545622748512518145,vaping? hell no! i also say fuck that,fritzbustamant1,2022-07-09 04:15:54+00:00
1590,1545622086999126017,"Our CEO, Selah Hart, will join other experts this Sunday evening live on Facebook following the @SundayTVNZ show to discuss the topic of vaping. https://t.co/dmNTC8zS7X",hapaitehauora,2022-07-09 04:13:16+00:00
1591,1545622063448195072,i gotta stop vaping asap i had this headache since yesterday ☹️,baebllanco,2022-07-09 04:13:10+00:00
1592,1545621698661306371,Annoying ass dude vaping next to me in the theater,szn_darnold,2022-07-09 04:11:43+00:00
1593,1545621550388236289,people really be waking up and the first thing they do is hit a vape and down kratingdaeng (i'm people),discoIazytime,2022-07-09 04:11:08+00:00
1594,1545621508868886530,EFFEX Delta 8 #THC Strawberry Cough Cartridge Overview – Astounding #TERPENES 🍓🍓🍓 https://t.co/3ShcGarCDU #alternative #clean #comfort #delivery #free #glass #growing #high #lung #vape #vaping,hempnewsonline,2022-07-09 04:10:58+00:00
1595,1545621459896262658,I think it’s so funny when people vape at concerts like people are trying to mosh and it smells like fruity pebbles,emilioisntfunny,2022-07-09 04:10:46+00:00
1596,1545621071268814848,Never have I been so stressed out that I bought a vape. I folded. 😢,Vile_Nixie,2022-07-09 04:09:14+00:00
1597,1545620730397720577,Don’t mind me just learning Arabic from my friends at the vape shop,MrDrennen,2022-07-09 04:07:53+00:00
1598,1545620494107303938,For those wondering I used a blow dryer to heat the thick concentrate or crumble once I put it in the tank. It’ll liquefy and then absorb into the cotton or chamber atomizer. I keep it topped off so the intake ports are covered and there are no dry spots that occur after vaping,royaltse,2022-07-09 04:06:56+00:00
1599,1545620221649719297,"or hitting a vape, them ppl the new crackheads. https://t.co/KGyNmWt48P",xxNeneK,2022-07-09 04:05:51+00:00
1600,1545620164107976705,odds i break into my own house rn. not one person in a 30 mile radius has a key. my vape charger is in there she’s on 5% i’m getting in there,b3llab1tch333,2022-07-09 04:05:38+00:00
1601,1545619956414439425,Just watched a snap story of someone vaping on a plane,ActualGod,2022-07-09 04:04:48+00:00
1602,1545619450350555136,I’m 7 months free of self harm 9 months clean off of alcohol &amp; vaping. My last suicide attempt was in February and I’m glad it didn’t work. I was in the hospital many times this year and I’m seeing a therapist weekly &amp; moving forward with my life. https://t.co/Nfktn1wNr9,akr47187,2022-07-09 04:02:47+00:00
1603,1545619310927757314,Need a rip from the vape Penn after those two ground balls found some grass to chase George,MarinerMuse,2022-07-09 04:02:14+00:00
1604,1545619278501756928,7️⃣ 1️⃣ 0️⃣  IS AROUND THE CORNER! ENJOY 25% OFF VAPES &amp; EXTRACTS 🍯 🍯 🍯 @cookiesglobal #CookiesSantaAna https://t.co/Bbf5zSyMOR,CookiesSantaAna,2022-07-09 04:02:06+00:00
1605,1545619261196062720,my dead vapes ceramony will be held at midnight. Thank you❤️,ifyou4got,2022-07-09 04:02:02+00:00
1606,1545619197765378048,🍌: I don’t understand how people can vape. stinks far worse than cigarettes in my opinion.,_Sun_Wukong_,2022-07-09 04:01:47+00:00
1607,1545618920664485888,how to get ur mom to buy you vapes: smoke lots of cigs,smel_thatshit,2022-07-09 04:00:41+00:00
1608,1545618795502309376,"Lost Vape Centaurus Q200 Box Mod
Buy it on:
https://t.co/S6Wf5FwxMI https://t.co/HJx5vbfdDu",3FVape,2022-07-09 04:00:11+00:00
1609,1545618494598926337,Imagine letting a medieval peasant hit your vape,crackediphone98,2022-07-09 03:58:59+00:00
1610,1545618445236043777,I seen a mf French inhale a vape 😢🤢,GloccThaDon,2022-07-09 03:58:48+00:00
1611,1545618095217205248,"FDA backpedals on Juul ban, says it’s re-reviewing company’s “unique” issues
#science
https://t.co/htCWcOCPCc",Pur3Science,2022-07-09 03:57:24+00:00
1612,1545617760259956736,"In about fifteen years, teens will be telling heartbreaking stories about how their dad left to buy vape pen refills and never came back.",karanbirtinna,2022-07-09 03:56:04+00:00
1613,1545617579401654273,YOURWAY CANNABIS BRANDS: MULTI-YEAR AGREEMENT WITH AIRO BRANDS 💨 https://t.co/BtcLbij0pS #AiroPro #AiroBrands  #Vaping #Delta8 #THC #Vape #VapeLife #CBDProduct #CBDTwitterParty #50ShadesofGreen,5OShadeOfGreen,2022-07-09 03:55:21+00:00
1614,1545617362262659072,Today I took the biggest hit of a vape with my co workers at my bar when the GM came up. I held as long as I could but he asked a question so I turned around to play it off &amp; release it the other way. But the fans blew the largest cloud over them &amp; I heard dying laughter 💀💀💀,LordDrewZavala,2022-07-09 03:54:30+00:00
1615,1545617122323320833,Haven’t bought a vape since December 🥹,lawniexo,2022-07-09 03:53:32+00:00
1616,1545617117407432704,and so I lost my vape 😂,fayemusofficial,2022-07-09 03:53:31+00:00
1617,1545616870002286592,I can take all the shots in the world in front of moms but the moment she see any vape is when all hell breaks loose every time,PurnellDeangelo,2022-07-09 03:52:32+00:00
1618,1545616797470269441,vaping and smoking hookah is another form of suicide…don’t @ me,SkyBee_13,2022-07-09 03:52:15+00:00
1619,1545616625034215424,do u think minions hit the banana ice vape or what,t0il3tbleach,2022-07-09 03:51:34+00:00
1620,1545616554171469824,might as well just end up this whole vape,jenesaypah,2022-07-09 03:51:17+00:00
1621,1545616342916599809,Been hitting my vape in front of gma on some faded shit omfg,vasac333,2022-07-09 03:50:26+00:00
1622,1545616124657680390,"My vape was attached to my hip 🥹 I still see dat bit out the corner of my eye, ready to grab it.",1mallymal_,2022-07-09 03:49:34+00:00
1623,1545616097214435328,doja cat should sell me a vape,xXeddieXx69_420,2022-07-09 03:49:28+00:00
1624,1545615534711902209,marx failed to consider the vape,0ex10c,2022-07-09 03:47:14+00:00
1625,1545615353987866624,"If the Biden administration wants to play nanny state, they should pay for a decent vape mod setup for any American that wants one, and stop fucking around with the regulations on juice. And ban these disposable vapes. This shit goes straight to a landfill.",slphilxyz,2022-07-09 03:46:31+00:00
1626,1545615051498962945,She’s a 10 but carries a vape like her life depended on it,twantwan15,2022-07-09 03:45:19+00:00
1627,1545614950219104256,halsey looking down at me in the crowd: damn this bitch does not let go of their vape,p1halsey,2022-07-09 03:44:54+00:00
