,TweetID,TweetContent,TweeterUsername,TweetDatetime
837,718876371682873344,Is that guy eating an ice cream cone or vaping? #peoplewatchingthoughts,citronhella,2016-04-09 19:00:57+00:00
838,718876215151431680,"Vaping just got a whole lot better. Coilart, the official brand for coil head replacements.
-----------
Stock... https://t.co/F7zfaDBm5H",OfficialCoilART,2016-04-09 19:00:20+00:00
839,718876208914702336,Check out these costume winners from last year's Vape Nights. Got some interesting costume ideas? Well come on... https://t.co/vL6rqw2mI7,Vapenight,2016-04-09 19:00:18+00:00
840,718876171203710976,Day 1 of Vape Con! Head on over to Booth 507 and take a bite of our delectable funnel cakes we have available for... https://t.co/FCAH3oj0Rd,funnelcakejuice,2016-04-09 19:00:09+00:00
841,718876154547965954,Win a Joyetech Cuboid Mod + Cubis Tank from @cigbuyer: https://t.co/TSCHathFym #vaping #joyetech #cuboidmod #vapecontest #vapegiveaway,kymp322,2016-04-09 19:00:05+00:00
842,718876096448475137,Vape talks have me just on the edge of my seat as that little tweet did... More like get of the chair and go for a walk #VapeRant,OMalTheAlleyCat,2016-04-09 18:59:52+00:00
843,718876087875338240,Blue Out Vape Juice https://t.co/3xEVcXAKev #grandrapids #vapor #eliquid #Fruit https://t.co/IKvwXMBPAz,4_Fox_Sakes,2016-04-09 18:59:50+00:00
844,718876056741158913,Promposal ideas: rent a tux vape out each letter of her name with the song we dem boys by wiz khalifa playing in the background then dab,victoriaortiz45,2016-04-09 18:59:42+00:00
845,718875997207150592,I so want this combo to work without some kind of leaking from somewhere! #vape #vaping #vapelife https://t.co/30kf0dfcBf,g33z3r_hd,2016-04-09 18:59:28+00:00
846,718875965619720192,"Hello, Twitter. I'm still here and alive. Quit smoking cigarettes 21 days ago. Having lots of fun w/vaping!",EricFryHTX,2016-04-09 18:59:20+00:00
847,718875956824379392,"Revealed: Vaping GOP congressman’s campaign funds used for video games, dentist and school tuition https://t.co/f9J2eQmc9q",ReformedBully,2016-04-09 18:59:18+00:00
848,718875948158988288,I need a casual way of saying 'hi neighbor can I borrow your vape?' without actually saying 'hi neighbor can I borrow your vape?'.,KennyJMW,2016-04-09 18:59:16+00:00
849,718875907205828613,#vaping Granny is totally digging her new #smok Guardian 111 #epipe this thing rocks my #vape… https://t.co/Ab7IDfpmRp,RealDonnaDeVane,2016-04-09 18:59:07+00:00
850,718875878684520449,the store i used to buy webkinz from is now sells vape stuff and thats the story of how my childhood was ruined,ayykarly,2016-04-09 18:59:00+00:00
851,718875690968477698,https://t.co/5tKefdZY0n #MGWV #F4F #RT @the_og_lazy_vaper has a tasty treat to keep hi… https://t.co/tgvJ0XB08g https://t.co/otrhI6dzfY,ToutPourVapoter,2016-04-09 18:58:15+00:00
852,718875684739932160,"This is best stuff I saw in the Vapor EXPO😜😜😜😜😜

 #vape #vapeporn #vapelyfe #vapefam #vaping… https://t.co/YCdZmMyIQT",MovkinVapor,2016-04-09 18:58:13+00:00
853,718875644944211968,Win a DNA200 LavaBox Mod with 2 extra Grips from @VapingCheap - https://t.co/V9Xwqm9PCn #ecig #Vape,FroDaddy26,2016-04-09 18:58:04+00:00
854,718875588291858432,2 funny! #vape #ejuice https://t.co/bckOGeYHGW,RockyTopABlaze1,2016-04-09 18:57:50+00:00
855,718875519132020737,"There isn't a whole lot of conversations my friends can have around me that I can't be involved in that bother me as much as ""vape convos""",OMalTheAlleyCat,2016-04-09 18:57:34+00:00
856,718875436072067072,Enter to win over $147 worth of vape gear from 3avape at https://t.co/SQcJuJa8sy,FroDaddy26,2016-04-09 18:57:14+00:00
857,718875388735127553,Win a DNA200 LavaBox Mod with 2 extra Grips from @VapingCheap - https://t.co/pwtOinrwoD #ecig #Vape,ThomasEicke,2016-04-09 18:57:03+00:00
858,718875324683919360,"Revealed: Vaping GOP congressman's campaign funds used for video games, dentist and school ... https://t.co/BJB3OXqi2Q",happywheelsvide,2016-04-09 18:56:48+00:00
859,718875292702519296,"Original Eleaf Ijust 2 Sub ...:  https://t.co/yt1ynjpsnu
#Vape https://t.co/cUPFHGlVpN",VapOrgasme,2016-04-09 18:56:40+00:00
860,718875207042072577,Win a DNA200 LavaBox Mod with 2 extra Grips from @VapingCheap - https://t.co/esQRUj2pTl #ecig #Vape,nikitapupkin102,2016-04-09 18:56:20+00:00
861,718875091539464192,"TAG a friend who wants this mod😂📣📣📣📣

 #vape #vapeporn #vapelyfe #vapefam #vaping #vapefriends… https://t.co/ukdrwriFfk",MovkinVapor,2016-04-09 18:55:52+00:00
862,718875036145168384,"Revealed: Vaping GOP congressman's campaign funds used for video games, dentist and school ...: He's facing he... https://t.co/qkDrfFtTAa",ElisavetRafael,2016-04-09 18:55:39+00:00
863,718874916305539072,eman up bid 500 bgi 1 set vape full complete tools.,alleysonburgez,2016-04-09 18:55:10+00:00
864,718874858201821185,Why yall french inhale yo vape u gun die,babymattt_,2016-04-09 18:54:56+00:00
865,718874810395324417,"Chinese Vaping Industry is getting HOT!!👈👊💨📣👏

 #vape #vapeporn #vapelyfe #vapefam #vaping… https://t.co/SIXM1pDOXD",MovkinVapor,2016-04-09 18:54:45+00:00
866,718874381737283586,Win a Joyetech Cuboid Mod + Cubis Tank from @cigbuyer: https://t.co/ubTVMiYsWq #vaping #joyetech #cuboidmod #vapecontest #vapegiveaway,nikitapupkin102,2016-04-09 18:53:03+00:00
867,718874248509427713,"the guy at Vapetronics at the mall asked if I had ever vaped and I go ""no... I have asthma...""",AlliStrang,2016-04-09 18:52:31+00:00
868,718874205001940993,"Vaping in the room, because my ciggy finish already... 😒",AmyAmins,2016-04-09 18:52:21+00:00
869,718874201545961476,I walked in on a group of kids vaping in a chipotle bathroom in Boston and they had Braintree sweatshirts on of course,suregoonthen,2016-04-09 18:52:20+00:00
870,718874195036217346,One big vape cloud a day keeps the sadness away :(,OrangeAppleJuis,2016-04-09 18:52:18+00:00
871,718874158537580544,"""@ElyceRoss: he vapes, abort mission"" @anotherhelmers @11_12_sigh",francesf4rts,2016-04-09 18:52:10+00:00
872,718874098550452224,Mouth To Lung Vapers vs Cloud Chasers... Big Rant https://t.co/yzSYWompn2,tylercormier1,2016-04-09 18:51:55+00:00
873,718873888621531136,VAPING UNDERGROUND ROG LAPTOP GIVEAWAY! https://t.co/N0WGXRT3L9,sos220400,2016-04-09 18:51:05+00:00
874,718873788461375488,Idk why I bought a vape again,JayyyyyyC,2016-04-09 18:50:41+00:00
875,718873728260513792,There's vaping contests are you fucking kidding me.,avalon_combs,2016-04-09 18:50:27+00:00
876,718873669842419712,when ur twin messes up your vape tornado (Vine by packie) https://t.co/X0uQ9p1fjb,Brandon96826658,2016-04-09 18:50:13+00:00
877,718873428514717696,I liked a @YouTube video https://t.co/o7XIYRXc45 VAPE NATION,MalloyHugry,2016-04-09 18:49:16+00:00
878,718873302618476545,"VAPE NATION https://t.co/dEPJxPvLXu via @YouTube
Just watch it lmfao",Brendan_Alk,2016-04-09 18:48:46+00:00
879,718873286906617857,I liked a @YouTube video from @luvsvapor https://t.co/n9UklbuUpH VAPESTA JUICE by INDOORSMOKERS | Available Now! | IndoorSmokers,BigNati_Vapes,2016-04-09 18:48:42+00:00
880,718873216438112258,"Working on our new website, the traffic is so good I might have to take a different route to work lol #CBD #vape",jack_cbd,2016-04-09 18:48:25+00:00
881,718873073823391744,"Vape Chronicles, Day 3: Some what I think were Vocaloid cosplayers insult vaping as they walk past guy in ""I vape"" shirt. He simply smirks.",ElMas1201,2016-04-09 18:47:51+00:00
882,718873023420477440,Perfection. 👌😄 #vape #vapelife #vapestagram #love #life https://t.co/POIH8FX56Z,British_Shadow_,2016-04-09 18:47:39+00:00
883,718872973604757504,Love when my babe brings me presents for no reason. He brought me a rose and a brand new vape today. (: he the best. https://t.co/F9thj8gHy6,AllieInTheStars,2016-04-09 18:47:27+00:00
884,718872885994110977,Win a DNA200 LavaBox Mod with 2 extra Grips from @VapingCheap - https://t.co/EZm3IcWtDH #ecig #Vape,YGirinis,2016-04-09 18:47:06+00:00
885,718872678065664000,High off the vape smoke 🚮,wizvrd_kelly,2016-04-09 18:46:17+00:00
886,718872448611983360,I just recieved a 15% off coupon for infusion vape ejuie at https://t.co/5XJ2dLHZoi https://t.co/5XJ2dLHZoi via @infusion ejuice,TracyRayLanier,2016-04-09 18:45:22+00:00
887,718872437547524098,Left l7 rwe is a hardcore vaper,aquanenn,2016-04-09 18:45:19+00:00
888,718872431763394565,"😤Fat Boy Dry Vape😤
Small and discreet portable dry vape!
#md #md420 #mdsmokes #mdsmoker… https://t.co/jMCLQM65PM",LstPlaceonEarth,2016-04-09 18:45:18+00:00
889,718872404638961666,I liked a @YouTube video from @mike_vapes https://t.co/Yys4xnHjcp Petri v2 RDA By DotMod - Mike Vapes,BigNati_Vapes,2016-04-09 18:45:11+00:00
890,718872397315710980,My man @Laelo202 came through n laced me up @hd_society #vapes #hdlife #pen #studiolife https://t.co/tjHbwOHFbE,sergiocortez_,2016-04-09 18:45:10+00:00
891,718872320539041793,"Revealed: Vaping GOP congressman's campaign funds used for video games, dentist and school ... https://t.co/wfTcFWCEKx",ohm_god,2016-04-09 18:44:51+00:00
892,718872118876839938,I don't understand vaping,0JeffreySewell,2016-04-09 18:44:03+00:00
893,718872089307017219,"Ok, I get it. you vape",ominousblog,2016-04-09 18:43:56+00:00
894,718872075419561984,"Revealed: Vaping GOP congressman's campaign funds used for video games, dentist and school ...: He's facing he... https://t.co/UvMhokHkaP",Wilsonlule,2016-04-09 18:43:53+00:00
895,718871984034086912,Enter to win Wotofo #vape gear including a Chieftain mod &amp; Conqueror RTA from @v_a_p_e &amp; @wotofoofficial. #Giveaway https://t.co/V8BfFGk1yr,Tihomir2512,2016-04-09 18:43:31+00:00
896,718871973057527811,Enter to win Wotofo #vape gear including a Chieftain mod &amp; Conqueror RTA from @v_a_p_e &amp; @wotofoofficial. #Giveaway https://t.co/w56T6DpoVA,CorneliuSovan,2016-04-09 18:43:29+00:00
897,718871874529140736,#CASAA: National Call to Action - Take action to oppose a ban on flying with #vapor products! #ecig #ecigs #vape https://t.co/JAOVqLPQo3,Addicted2Vapor,2016-04-09 18:43:05+00:00
898,718871869689044992,"Your Vape, Your Voice: Gawker's 2016 GOP Presidential Town Hall https://t.co/8CKZkQUROW https://t.co/TXMiCcpPFN",Gawker,2016-04-09 18:43:04+00:00
899,718871733663567872,"Keep calm and vape…
#ecig #vape #vapote #vapor #vaping #freevape #vapegirls #subohm #cloudchasing #vapebabes https://t.co/vW7xIU2yMl",VapoteurLand,2016-04-09 18:42:31+00:00
900,718871700406808576,Gotta new vape pen otw in the mail. This one should hit💨,FadedwithMary,2016-04-09 18:42:24+00:00
901,718871652004532224,Why does this dude keep taking Rachels vape,CIENNAJORDYN,2016-04-09 18:42:12+00:00
902,718871609382199296,🍓Juicy Ripe Strawberry🍓 🌿Freshly Picked Mint🌿 ••••• #vape #vaper #vapor #vaping #vapeon #v… https://t.co/P0hTZop3L9 https://t.co/Lorld2bMx8,LunarRoverUSA,2016-04-09 18:42:02+00:00
903,718871551299301376,Enter to win Wotofo #vape gear including a Chieftain mod &amp; Conqueror RTA from @v_a_p_e &amp; @wotofoofficial. #Giveaway https://t.co/GmOUgjqquY,tattooedbert,2016-04-09 18:41:48+00:00
904,718871364921270273,just waiting until I find my vape prince 💍💨💎👑,TheDisasterGuru,2016-04-09 18:41:04+00:00
905,718871307333578752,There is a 100% chance Bauer vapes. https://t.co/ybCEDnU4gU,JATayler,2016-04-09 18:40:50+00:00
906,718871292192169987,"Revealed: #Vaping #GOP congressman’s campaign funds used for video games,dentist and school tuition
https://t.co/948yeSTPYC
#USA #California",Timbo972,2016-04-09 18:40:46+00:00
907,718871271014944768,"Revealed: Vaping GOP congressman's campaign funds used for video games, dentist and school ...: He's facing he... https://t.co/Fm1qaymwoW",latenightgamer,2016-04-09 18:40:41+00:00
908,718871238257602561,I liked a @YouTube video https://t.co/Xx9L6uhAgt VAPE NATION,eIIis98,2016-04-09 18:40:33+00:00
909,718871159899623424,Vape convention is in town https://t.co/xfH7kAs5nG,RobynSteam,2016-04-09 18:40:15+00:00
910,718871127767035907,LCS Handcheck via /r/Vaping https://t.co/PfUDrxTOBn https://t.co/oipq2qVKnz,CannonballVapes,2016-04-09 18:40:07+00:00
911,718870975882928129,Vape into the toilet.,InjectCoffee,2016-04-09 18:39:31+00:00
912,718870927782592512,"When you have a long day ahead of you, you find plugs to charge your vape so you don't smoke a cigarette #vapelife https://t.co/D4EQq6uWIh",lucyintheskye,2016-04-09 18:39:19+00:00
913,718870817061367808,"For all you youngins in high school thinking you're a ""vape"" God bitch I am the vape God your clouds are weak af! https://t.co/xhwihZKl8k",BrandonMartin94,2016-04-09 18:38:53+00:00
914,718870724556038144,VAPING UNDERGROUND ROG LAPTOP GIVEAWAY! https://t.co/caAFTX5M85,PircomTeet,2016-04-09 18:38:31+00:00
915,718870612232548352,"Prepare for the cool, soothing climax of menthol and mountain mint with #Ronin Banzai https://t.co/gObeqn1Sd5 #Vape https://t.co/YYyiY4nvBg",ModMonth,2016-04-09 18:38:04+00:00
916,718870606645719040,Done cleaning the house. Time for a cold beer and a vape 🍻☁ #beer #budselect #vape #vapefam… https://t.co/pNUWQAdiP1,robfromthe314,2016-04-09 18:38:03+00:00
917,718870566506082304,When the vape mail gets here sooner than expected. Have the shit on… https://t.co/eSG4HMoYWM,dil821,2016-04-09 18:37:53+00:00
918,718870539645784064,Fucking vapers,JakeDuman17,2016-04-09 18:37:47+00:00
919,718870463594803200,"Soundcheck at Scarycanary. Beavertown beer, Northern Soul, and vaping is allowed. Coolest staff. Gonna be a good 'un https://t.co/NDyM6qDnqk",bencalvert,2016-04-09 18:37:29+00:00
920,718870323882549248,"wake up, bake up, gotta get this cake up, heat the vape up",svrachvrid1,2016-04-09 18:36:55+00:00
921,718870290613207040,"#puffmonster
Please help me out vape fam and followers I need as many likes as possible… https://t.co/6dqG2d5LCV",DSTEGNER119,2016-04-09 18:36:47+00:00
922,718870157096009729,Yeah bruh I vape,MMyersTF,2016-04-09 18:36:16+00:00
923,718870101999484928,"Awesome #GIVEAWAY this weekend on our Facebook!! Click the link to enter!
https://t.co/aS1q0ELLbO
#vapers #vape #vapegiveaway #vapenation",PopBotELiquid,2016-04-09 18:36:02+00:00
924,718869956226654210,Great #vaping deals at https://t.co/EkGNG3iSnx and here's 10% off those deals with exclusive coupon code vapingtruth. #vapingtruth,thevapegoods,2016-04-09 18:35:28+00:00
925,718869880758525952,"Vaping GOP congressman’s campaign funds used for video games, dentist and school tuition https://t.co/JqH6vCbaaC https://t.co/yNIHC5Jh8I",RawStory,2016-04-09 18:35:10+00:00
926,718869853088538624,"""vaping is not smoking."" These losers. Protest for something important man!!! https://t.co/rOy14l0cyh",RadAstria,2016-04-09 18:35:03+00:00
927,718869703507251200,Have you seen ZampleBox? #eliquid subscription for #vapers. Up to 180mL of #vaping liquids from just $25! https://t.co/TgHPITWqpd,BellissimoDar,2016-04-09 18:34:27+00:00
928,718869626365448193,Vape con today!,RickyTZzz,2016-04-09 18:34:09+00:00
929,718869494639104000,"Revealed: Vaping GOP congressman’s campaign funds used for video games, dentist and school tuition https://t.co/tvCpaXVREc #SmartNews",PoliticalDis,2016-04-09 18:33:38+00:00
930,718869430051033088,"Thx 4 following @VapevineAUS 50% OFF at https://t.co/CXq2ozjOvL #couponcode TeamLowa 
#vape #ecig #vapelife via https://t.co/SA4jadKSHj",THEroccobiggs,2016-04-09 18:33:22+00:00
931,718869379933466624,"POLL: Do you agree with Vapour Advocates of Ontario that ""vaping is not smoking?"" VOTE: https://t.co/dXfW0JesQP",NEWSTALK1010,2016-04-09 18:33:10+00:00
932,718869298567995392,"SCV, cuz all there to do is go to six flags, vape and go to parties that get shut down within 10 mins https://t.co/pgchXYkbc5",Alex_Meloni_,2016-04-09 18:32:51+00:00
933,718869206368972804,Doing some coil building up here at Gresham!! #vape #vapecommunity #vapeporn #vapor #vapelife… https://t.co/AaZLHj095U,UptownVapor,2016-04-09 18:32:29+00:00
934,718869205160845312,Video: Vaping &amp; Gaming Congress  https://t.co/sv6k6OKLiG via https://t.co/80P6UKD3u7,VodioGames,2016-04-09 18:32:29+00:00
935,718869158042169344,Wish i was vaping rn,mzstvrj,2016-04-09 18:32:17+00:00
936,718869082435661824,Aspire Cleito ~ Kanger KBOX 120 ~ MX Box ~ Fire Alarms https://t.co/0vjF5oTPFB #Vape,EastCoastVaped,2016-04-09 18:31:59+00:00
937,718869055642451969,Vape Mail c/o https://t.co/6dmAuodGia Delectable Golden Ticket by Met4 Vapor chocolate milk in a vape! #vape #ejuice https://t.co/2xdn5oD6xT,RockyTopABlaze1,2016-04-09 18:31:53+00:00
938,718869041830502400,Having a good weekend?? Well am jus relaxing with this #cov #councilofvapor #twistedmesses… https://t.co/Tsloj4CX5Z,vape_tech_1,2016-04-09 18:31:50+00:00
939,718869025401475072,"Stop smoking, keep vaping #vape @ Bento's Room https://t.co/Gk9TeRk0Cf",bentoshw,2016-04-09 18:31:46+00:00
940,718868938268880896,Vaping is life,yourfavbitch33,2016-04-09 18:31:25+00:00
941,718868884133134336,"I don't get #Vaping. Walking down the street, tattoo'd up &amp; ready to rumble, angry gaze... then *poof* ... strawberry cloud.",yyjchris,2016-04-09 18:31:12+00:00
942,718868852772196352,Win a DNA200 LavaBox Mod with 2 extra Grips from @VapingCheap - https://t.co/qzWCA2rafB #ecig #Vape,olegbel2010,2016-04-09 18:31:05+00:00
943,718868762334773248,"I hate not being able to vape where I want, when I want #VapeTheStressAway https://t.co/DhAHhItJla",RTSvapes,2016-04-09 18:30:43+00:00
944,718868757465194497,Pic of the Day: Viva Vape! https://t.co/BkvzyPROBf https://t.co/JGMc08Bdv3,biomatchina,2016-04-09 18:30:42+00:00
945,718868655853801474,I'm hosting a vape sess hmu if you tryin to come,DarailMvp,2016-04-09 18:30:18+00:00
946,718868621477470208,Pic of the Day: Viva Vape! https://t.co/Ja94vUC7IC https://t.co/5NTakxnLdt,JakeWizard27,2016-04-09 18:30:09+00:00
947,718868609242673153,"Interesting prediction…
Vape CEO: Pot concentrate sales will soon outpace cannabis flower https://t.co/EU2Ka5dPC6
#cannabis #concentrates",headset_io,2016-04-09 18:30:07+00:00
948,718868531367047168,we all know that one group of people who think there better than everyone cause they smoke 'vape'😖🖕🏻,_petermayes,2016-04-09 18:29:48+00:00
949,718868475171614720,When you get offered free vape lmao what https://t.co/8WbxRcpl1w,dreuhh_07,2016-04-09 18:29:35+00:00
950,718868413867634688,Some poor hipster lost their vape,maxcaulbot,2016-04-09 18:29:20+00:00
951,718868407999836160,Guy who is vaping is yelling at dude who is smoking a one hitter telling him he's being disrespectful #WhitePeopleBrunching,Leighzus,2016-04-09 18:29:19+00:00
952,718868357991280640,The best beginner #ecig kit. Complete kit with best warranty. https://t.co/JDPUU1vuht #smoking #vaping #ecigs https://t.co/4GVWCL0oNm,expertvaping,2016-04-09 18:29:07+00:00
953,718868253477482496,"Come on into the VapeShack!! We got builds for days!
#vapor #vaping #thevapeshack #coils #claptons #flavors #CO https://t.co/TIIdNc1ofs",TheVapeShackCO,2016-04-09 18:28:42+00:00
954,718868142303363073,Movie night selfie with the vape addict #movienight #marriage #love https://t.co/ZBEhtvDSwM,xMzwolfiex,2016-04-09 18:28:15+00:00
955,718868058689765377,A vegan that vapes would probably be pretty annoying.,Taco_Expert,2016-04-09 18:27:55+00:00
956,718868001261531136,Yup...acting a fool with these 💨💨💨 #vape #vapelife #vapelyfe #vapesociety https://t.co/aPxS0kkDKH,timepeacelove,2016-04-09 18:27:42+00:00
957,718867842582482944,Not much going on at work today. Just lots of vape,cactard,2016-04-09 18:27:04+00:00
958,718867637506351104,Enter this giveaway for the chance to win some superb vape gear!  https://t.co/G7yhJyyECB,titobernito,2016-04-09 18:26:15+00:00
959,718867489464066049,Win a DNA200 LavaBox Mod with 2 extra Grips from @VapingCheap - https://t.co/qyQdv3yoo9 #ecig #Vape,robgoss04,2016-04-09 18:25:40+00:00
960,718867474448420864,Win a Joyetech Cuboid Mod + Cubis Tank from @cigbuyer: https://t.co/UlbNdTq0gC #vaping #joyetech #cuboidmod #vapecontest #vapegiveaway,bmsdi,2016-04-09 18:25:36+00:00
961,718867446808055809,Meeting some awesome people here!!  Shout out to our vaping family!!! https://t.co/Mqdm68PmJP,Bakerwhiteinc,2016-04-09 18:25:29+00:00
962,718867446208294913,Meeting some awesome people here!!  Shout out to our vaping family!!! https://t.co/FiBDuUtM45,vapethesystem,2016-04-09 18:25:29+00:00
963,718867434174877696,Kyle vapes like a 85 year old chain smoking grandma smokes,kenzaayyeee,2016-04-09 18:25:26+00:00
964,718867323726262273,Banning vaping affects who &amp; solves what? Maybe they should worry about the corrupted leaders in power &amp;  all the violence in the city.,re3msicle,2016-04-09 18:25:00+00:00
965,718867195913191424,"""I'll vape in my car if I want to"" ok bud",kenzaayyeee,2016-04-09 18:24:30+00:00
966,718867070432231424,I'm not big into vaping or anything... via /r/Vaping https://t.co/Lxt6odbUBZ https://t.co/YhfI1euBXi,CannonballVapes,2016-04-09 18:24:00+00:00
967,718867034377949185,"My #miitomomii  is #proudofme  for #vaping n not #smokingcigs 

#miitomo 
#miifoto @ Lake… https://t.co/fmyc8BpAbd",kencombo182,2016-04-09 18:23:51+00:00
968,718867025964077056,Enter to win Wotofo #vape gear including a Chieftain mod &amp; Conqueror RTA from @v_a_p_e &amp; @wotofoofficial. #Giveaway https://t.co/Q1tJDo5vIp,zalderzis,2016-04-09 18:23:49+00:00
969,718866970683179008,I bought a Vape for a good reason,IvanCamacho_,2016-04-09 18:23:36+00:00
970,718866836167725057,"Darth #vaping on my #cuboid &amp; #crius , #vapedad #vapingsavedmylife #vapelife #vapeporn #coilporn… https://t.co/9tBPiaRjZz",VapeDaddy78,2016-04-09 18:23:04+00:00
971,718866710992818176,"Work, work, work. 

Thanks _d0minick_ for the tips!

#sfc #coilporn #vape #vapelyfe #vapelife… https://t.co/gOSphaJwkH",ennveeliquid,2016-04-09 18:22:34+00:00
972,718866638376804353,The Vaping Section on #Yelp: Vaping section diamond bar is where I started Vaping so I had to stop by Vaping sectio… https://t.co/uppmSznCJe,Rjayd,2016-04-09 18:22:17+00:00
973,718866625726951424,"#Repost @calyraevapes with repostapp.
・・・
Yum!

#vape #vaper #vapeon #vapers #vapor #vapors… https://t.co/Qzr21ul4oj",modifiedeliquid,2016-04-09 18:22:14+00:00
974,718866516083654658,They do set off smoke alarms. #vape #vaper #vapefriends #vapepics #vapestagram #vapeporn… https://t.co/zharMwJbJa,vapetrottercom,2016-04-09 18:21:47+00:00
975,718866395359002624,"As one of the original creators of the #vapecommunity, we think this art should #Vape more… https://t.co/YZJn4q3KqR",vaporroom,2016-04-09 18:21:19+00:00
976,718866318288666624,"RT: ""This is what we do for our family??? Can your local Bronx vape shop say the same???? We'll wait 😂🙌💯💪😤 HAPPY BI… https://t.co/d9SOse0s83",CannonballVapes,2016-04-09 18:21:00+00:00
977,718866267038466049,Ok so is it a 'thing' to have 2 vape thingy's?! Or was that guy I saw just being a bellend😂😂,selinaarmstrong,2016-04-09 18:20:48+00:00
978,718866241847431171,Just joined the #Vape Club's awesome contest at https://t.co/wpXMf8v4lC . Check it out. If you do I get more chances to win ;) #vapelife,TerryPoage1,2016-04-09 18:20:42+00:00
979,718866023953223680,New twisted Claptons in my Velocity RDA #vape #vapelife #vapor #clouds #ejuice https://t.co/DCcgsPK0PC,craig_handsley,2016-04-09 18:19:50+00:00
980,718865926599213057,Had a kid vaping and angrily revving his engine behind me at a red light. Real cool.,akstepniak,2016-04-09 18:19:27+00:00
981,718865871184261120,"This months Signature Pack 75ML of ejuice, OMEGA VAPES. Place your orders NOW https://t.co/1xMQkrRwWp",CloudsElectro,2016-04-09 18:19:14+00:00
982,718865844709687296,Enter to win Wotofo #vape gear including a Chieftain mod &amp; Conqueror RTA from @v_a_p_e &amp; @wotofoofficial. #Giveaway https://t.co/vmZuUB6Wl4,wertris,2016-04-09 18:19:07+00:00
983,718865838074306560,VAPE NATION,tinfawn2,2016-04-09 18:19:06+00:00
984,718865834815266816,i wanna vape with you brother! HH @HulkHogan,DongeredBot,2016-04-09 18:19:05+00:00
985,718865794147352576,I dont vape but when i do. I use #theclear. Sooo many tasty flavors oh and like 92% #thc https://t.co/lZFywIYkY0,substancesticky,2016-04-09 18:18:55+00:00
986,718865423819792384,I liked a @YouTube video https://t.co/uTJg0K0zd8 Call Of Duty Black Ops 3 | FURY SONG | SWORD MONTAGE by ♛rAiN Vape♛,PRIMEEZYD,2016-04-09 18:17:27+00:00
987,718865416462831617,mourn the loss of the precious soul that was my vape https://t.co/Cp46cDjyPD,aavadaviss,2016-04-09 18:17:25+00:00
988,718865287936741378,The only thing I like about being home alone at home is that I can vape anywhere in the house,AACMXGGB,2016-04-09 18:16:55+00:00
989,718865247587536897,No better feeling than spilling ur whole bottle of vape juice all over yourself while fill up ur tank #vapelifebro,iamkonium,2016-04-09 18:16:45+00:00
990,718865189261688832,Did I really just see a vaping is dangerous commercial lmao,JACKLEMUNYON,2016-04-09 18:16:31+00:00
991,718865178226372608,Enter to win Wotofo #vape gear including a Chieftain mod &amp; Conqueror RTA from @v_a_p_e &amp; @wotofoofficial. #Giveaway https://t.co/X6dmWZy9ek,wardekswert,2016-04-09 18:16:29+00:00
992,718865085737742336,"Stop #bill45 #VapingIsntSmoking 

#vapenation #vape #vapelife #vapenews #vapefam #vapecommunity #queenspark #toronto https://t.co/a3vSsIhp7R",vape_29,2016-04-09 18:16:06+00:00
993,718865048471543808,"I love listenening to ""the vape council"" on cassette",3DBLAST4EVER,2016-04-09 18:15:58+00:00
994,718865038535032832,Welcome to our new retail location!  #dispensary #mmj #cannabis #marijuana #vape #startup #investment https://t.co/BIMOVTxWgI,Weederizer,2016-04-09 18:15:55+00:00
995,718865038321270784,Everyday i wake up i thank god i dont vape 😭😭😭😭,Kmackey11,2016-04-09 18:15:55+00:00
996,718865013398769664,The only thing I vape is the Holy Spirit. #WWJD,benji_graham98,2016-04-09 18:15:49+00:00
997,718864950794399744,Win a DNA200 LavaBox Mod with 2 extra Grips from @VapingCheap - https://t.co/0HFjfrc9Ax #ecig #Vape,sergey_msi,2016-04-09 18:15:34+00:00
