,TweetID,TweetContent,TweeterUsername,TweetDatetime
0,718951484914855936,"Vaping rum at El Arsenal in Cartagena.. Yup, just like it sounds. #BoozeTraveler Colombia https://t.co/lkvVSJKEzU",SouthieJack,2016-04-09 23:59:26+00:00
1,718951477352407040,"we get it posey, you vape",huntermellas,2016-04-09 23:59:24+00:00
2,718951256203472896,The same people who used to vape are the ones making fun of the people who vape now lmfao,rielymacdon,2016-04-09 23:58:31+00:00
3,718951176146825216,pry this vape from my cold dead hands,___Daark,2016-04-09 23:58:12+00:00
4,718950732561571841,UK’s Big Vape Show https://t.co/7NmGy5eUWm #ecig,VaponewsUS,2016-04-09 23:56:26+00:00
5,718950719617781760,So True.... :D #gCeramic #AtomVapes https://t.co/IvfzcnilDh,Atom_Vapes,2016-04-09 23:56:23+00:00
6,718950682942832641,There's a young man holding a vape pen and shopping around staples with his mom,willbarbaro,2016-04-09 23:56:14+00:00
7,718950636100853760,Protesters rally against Ontario's move to ban vaping in public: Ontario says a new bill aims to improve... https://t.co/P9uLukK6Al Chino,Chino_CA_News,2016-04-09 23:56:03+00:00
8,718950543222312961,"Less rape culture, more vape culture, fam! #FeministFuckboi",TheBobKeen,2016-04-09 23:55:41+00:00
9,718950525488607232,"❗️RESTOCK ALERT❗️ Mini Volt by @councilofvapor is now available at The Vape Shop

Mini Volt 40W Box Mod Features:... https://t.co/i5tC7WQ0JM",TheVapeShop_LA,2016-04-09 23:55:37+00:00
10,718950520547864576,"Can I walk a block in the city without getting hit by vape, cig or weed smoke? Probably not",AngeryBeags,2016-04-09 23:55:36+00:00
11,718950369338998785,My vape fever is cured!,jakeypoo152,2016-04-09 23:55:00+00:00
12,718950240812802048,"""you got it all wrong officer, that sign says 'no SMOKING'; This is VAPE!""",ThatOneKidMick,2016-04-09 23:54:29+00:00
13,718950199800913920,I'm Carver Hawke And I Endorse Vaping,CarverBot,2016-04-09 23:54:19+00:00
14,718950106775580673,Vapor Joes - Daily Vaping Deals: GET A FREE 12ML BOTTLE OF JUICE FROM VISTA VAPORS https://t.co/DMYk0sKwMS,vaporjoes,2016-04-09 23:53:57+00:00
15,718949778369986560,I want to have the confidence of a white dude vaping in public.,jetgirl78,2016-04-09 23:52:39+00:00
16,718949740315090944,"""your boyfriend gets his temps, mine gets a vape""",hannahnhowell,2016-04-09 23:52:30+00:00
17,718949550078099464,Smoking to Vaping https://t.co/PSu8t98jxT,owlofssc,2016-04-09 23:51:44+00:00
18,718949539017830400,#CASAA National Call to Action - Take action to oppose a ban on flying with vapor products! https://t.co/NyZUM0cPgp #vaping #ecigs #SA3547,BlacksmithPro,2016-04-09 23:51:42+00:00
19,718949358436093952,10 minutes till I clock in might as well go Vape outside real quick,justin_boblett,2016-04-09 23:50:59+00:00
20,718949350005542913,Perfect for a rainy day. #Flowermate #WeedCommunity #dabs #vape https://t.co/CZrWhzHOQn,FlowermateVapes,2016-04-09 23:50:57+00:00
21,718949270859030528,"If thats the case, vape should replace cigarettes.. #notosecondhandsmoke #lungcancerpamore https://t.co/dYNry1uePW",iamSassySeven,2016-04-09 23:50:38+00:00
22,718949082182610944,Protesters want Ontario's vaping legislation scrapped - Toronto Sun https://t.co/OdpBg4VEqa,pharma_global,2016-04-09 23:49:53+00:00
23,718949077535174657,"""Are high schoolers even allowed to vape?"" 😂😂😂😂😂",Jenna_Quinn15,2016-04-09 23:49:52+00:00
24,718949055393579012,I tried vaping for the first time last night and that shit was awful I was gonna die,ohmygodliam,2016-04-09 23:49:46+00:00
25,718948660386603008,"Toronto vape uprising: doctor claims vaping risks worse in some instances than ""traditional smoking"". https://t.co/PCJ0biZ1VZ + my comment.",Clive_Bates,2016-04-09 23:48:12+00:00
26,718948640455323649,"why is it ok for ecigs/vapes to be advertised on tv, and not actual cigarettes?? this massive double standard pisses me off so much",ThatDocktorGirl,2016-04-09 23:48:07+00:00
27,718948507680432128,"If you #vape follow me I'll #follow you back!
I'll be have some unreal #deals
On vape acceories 😀 
https://t.co/T5XXtv60E8",jack_cbd,2016-04-09 23:47:36+00:00
28,718948435294982144,Vaping is supposedly worse and I'm on board with banning....,RyanMW_,2016-04-09 23:47:19+00:00
29,718948207112417280,"Vape pen ✔️ 
#disneyready",eamonmccarren,2016-04-09 23:46:24+00:00
30,718948128368435200,"Anybody who wants a vape mod, im selling my old mod and tank
MVP3 Pro - 60Watt / Mod Box
Cleito, Aspire / Tank
Contact me if interested",deanvonsunn,2016-04-09 23:46:05+00:00
31,718948105962569730,Stupid question but...how to vape using Kangertech Dripbox? via /r/Vaping101 https://t.co/mRfH2iXQVC,VapingEnFrance,2016-04-09 23:46:00+00:00
32,718948066418515968,Enter to win Wotofo #vape gear including a Chieftain mod &amp; Conqueror RTA from @v_a_p_e &amp; @wotofoofficial. #Giveaway https://t.co/O199KkFx6x,billy_johnson31,2016-04-09 23:45:51+00:00
33,718948003613003776,I'm vaping so hard rn,BanzaiTakesAnal,2016-04-09 23:45:36+00:00
34,718947889054105600,"We can't get any decent stores at the Eastwood Mall, but worry not!!!!! We have a Vape Land!!!!!!!",jmarsico_,2016-04-09 23:45:08+00:00
35,718947669859643392,Teta just pressed my life for vaping,anthony_fak,2016-04-09 23:44:16+00:00
36,718947407183028224,Listening to people talk about vapes is like another language.,martliefartly,2016-04-09 23:43:13+00:00
37,718947356851380226,Check out @AmericannaRX for a wide selection of @GoldenXTRX products! #cannabis #co2 #vape #marijuana #OMMP https://t.co/daH9IYrjEJ,GLHoldings,2016-04-09 23:43:01+00:00
38,718947225490038784,There's this little old lady next to me vaping in her car,CarlieBrahler,2016-04-09 23:42:30+00:00
39,718947202597388288,Enter to win Wotofo #vape gear including a Chieftain mod &amp; Conqueror RTA from @v_a_p_e &amp; @wotofoofficial. #Giveaway https://t.co/kOBipJ5PS4,4OverKill,2016-04-09 23:42:25+00:00
40,718947050822377472,I vape holy water,laur3npow3ll,2016-04-09 23:41:48+00:00
41,718947044459745280,"GregTHR https://t.co/OF44bdOwDj

Good to get coverage, but It is categorically incorrect to state #vaping is remotely comparable to smokin…",VaperPix,2016-04-09 23:41:47+00:00
42,718946955246845952,2 favs and I'll teach the children how to vape,0fficialRoach,2016-04-09 23:41:26+00:00
43,718946911412035584,"Shinsuke won't stop talking about this ""vaping"" thing...",tsurugibot_en,2016-04-09 23:41:15+00:00
44,718946893598855168,I just bought '(S+C)2 e-Juice' on #Vape Wild https://t.co/IhbV3vqC5Z Trying something new and also this place is #kind on the #wallet. &lt;3,flynnette30,2016-04-09 23:41:11+00:00
45,718946781351043072,Tonight On #VapeTV @8pm est #Quitters Stream @9 Terraphon #JungleRulesVaping @10 Diablo #TheMadHatter @11 Tunes n Chat #Vaping #ecigs,BlacksmithPro,2016-04-09 23:40:44+00:00
46,718946728796418048,TPD won't cloud Vaping - New e-cig regulations not expected to curb vapers’ enthusiasm https://t.co/SB31gV5SFr,WholesaleManage,2016-04-09 23:40:32+00:00
47,718946455226986496,Vape Comp fun at #mnpvape https://t.co/2qFFSUsdd4,MainHamett,2016-04-09 23:39:26+00:00
48,718946419898343424,Vape needed,GroverCarilo,2016-04-09 23:39:18+00:00
49,718946408934567936,"It's Saturday! 💨Let's VAPE!💨
Go to https://t.co/8t8pDysAQ5...we can help you save money, save 5% PLUS FREE… https://t.co/Bzpcl74bef",vapegard,2016-04-09 23:39:15+00:00
50,718946385349984256,"Get your #vapeon 
https://t.co/eywOe928UY

#vape #vapelife #o2vape #vapepen #vapeshop #smokeshop… https://t.co/1jSelRiHig",O2vape,2016-04-09 23:39:10+00:00
51,718946380971171840,Who's craving cereal and a beer? #vape #vaper #vapeon #vapebox #vapelife #vapelove #vapelyfe… https://t.co/KPcqv6UzLV,shanemiller77,2016-04-09 23:39:09+00:00
52,718946377707995137,I would love it if people didn't vape in waiting areas of restaurants.,Benlaihr21,2016-04-09 23:39:08+00:00
53,718946353439776768,"Vape fans in eye warning: E-cigs can damage your vision, says expert https://t.co/Na6n6ue3OZ",ohm_god,2016-04-09 23:39:02+00:00
54,718946341544685568,Well aren't you just the saddest little vape shop in the strip mall...,gaskinesque,2016-04-09 23:38:59+00:00
55,718945994910670848,Got to hang out with this lovely lady for awhile today.  One of our favorite customers!!  ❤️❤️ we love you Monique. https://t.co/TaeV5JUZ2t,Mystic_Vapes,2016-04-09 23:37:37+00:00
56,718945976149389312,Yo. Important Message time! #VapeNation #vapelife #vapefamily #VapeOn #vape CR1M3 https://t.co/4eJprKBd3Q,Kap10j_kirk,2016-04-09 23:37:32+00:00
57,718945960974417921,Premium Cigar “Gurkha Ghost Envy” now available at Elite Tobacco &amp; Vape. https://t.co/URdoxsXUKU,Elite_Vape,2016-04-09 23:37:29+00:00
58,718945916154159104,"Good to get coverage, but It is categorically incorrect to state #vaping is remotely comparable to smoking dangers  https://t.co/QRhOundiHJ",docgopal,2016-04-09 23:37:18+00:00
59,718945710327140352,"The collection:)
#vape #vaper #vapes #vapor #vapin #vapeon #comingsoon #launch #canadavapes… https://t.co/550BeGmgA5",7monkseliquid,2016-04-09 23:36:29+00:00
60,718945602067795968,My mom is using a vape pen now I'm MAD,oryalau,2016-04-09 23:36:03+00:00
61,718945598297104384,Win a DNA200 LavaBox Mod with 2 extra Grips from @VapingCheap - https://t.co/TAtjGb5rtc #ecig #Vape,lmh906,2016-04-09 23:36:02+00:00
62,718945496753119232,Claptons are a go! via /r/Vaping https://t.co/wWW7P3kSRX https://t.co/gLxfTLqYAv,CannonballVapes,2016-04-09 23:35:38+00:00
63,718945419405856770,$VAPE bears3434: I agree somewhat the Symbol u don't think: bears3434 https://t.co/u1lQRwLUXc,mjcharts,2016-04-09 23:35:20+00:00
64,718945368663310336,#vaping #purplerain #vapelyfe #girlsthatvapedoitbetter #future #drake @ The Queens Layer https://t.co/sm9zqEqpYv,lalalovespie,2016-04-09 23:35:07+00:00
65,718945361818173440,"If u work at a vape shop, do u have to vape for ur entire shift?",hanlllee,2016-04-09 23:35:06+00:00
66,718945239558295552,Protesters rally against Ontario's move to ban vaping in public: Ontario says a new bill aims to improve publi... https://t.co/OmsiKsIadU,ayskj_store,2016-04-09 23:34:37+00:00
67,718945072885166080,Sitting here in the mall watching this guy vape in front of villa pizza,human_racket,2016-04-09 23:33:57+00:00
68,718944881356328960,Happy birthday @igortron2! I hope your day is filled with some sick vape clouds,Remington____,2016-04-09 23:33:11+00:00
69,718944414626754560,Well my vape just exploded.. https://t.co/jBGzwuwYqI,Jake__19,2016-04-09 23:31:20+00:00
70,718944254962376704,"Best RTA Vapes - we show you our favorite RTAs on the market right now!
by Audrey Saccogna
https://t.co/JDnIuJEIX9",Vaping360,2016-04-09 23:30:42+00:00
71,718944192844705792,why stop at vaping? replace all unhealthy habits with robot penises.,FOGplaya,2016-04-09 23:30:27+00:00
72,718944182421688320,There's no such thing as a funny vape joke.,HouseofGlib,2016-04-09 23:30:25+00:00
73,718944181683507200,No more vape okay I'm done I'm sorry,thenoelmiller,2016-04-09 23:30:24+00:00
74,718944141590171649,Night &amp; smokin' VAPE #пар #ништяк ...................... #goodnight #night #goodnight #night… https://t.co/bBu2c2wpM4,real_young_male,2016-04-09 23:30:15+00:00
75,718944101073162240,Win a Joyetech Cuboid Mod + Cubis Tank from @cigbuyer: https://t.co/1NCyWwNPeF #vaping #joyetech #cuboidmod #vapecontest #vapegiveaway,dainbramaged77,2016-04-09 23:30:05+00:00
76,718943894067503104,DAILY DEAL #vape #discount  https://t.co/ob6U2lIcJv,cannabis5280,2016-04-09 23:29:16+00:00
77,718943717424390144,need to get to a point in my life where the photo they use for headlines is me vaping https://t.co/AExyjArtcU,COLLINPWER,2016-04-09 23:28:34+00:00
78,718943706858979329,...there's windex in vape?¿ https://t.co/S90y2POt3c,allvnnleon,2016-04-09 23:28:31+00:00
79,718943679956807685,Lets vape :) https://t.co/CpA8HBwKsP #vape https://t.co/i6IPrp9RQm,esheeshforecigs,2016-04-09 23:28:25+00:00
80,718943624730447872,Lets vape :) https://t.co/ODc0Cx2gnF #vape https://t.co/jZCPa12Lod,Esheeshuk,2016-04-09 23:28:12+00:00
81,718943583252779008,"I just wrote the first review for Summit City Vapes on #Yelp!
A friend of mine introduced me to this location, and … https://t.co/h5zCbBcO0G",BAChapin,2016-04-09 23:28:02+00:00
82,718943338775330816,The key to making #potent #hashoil at home is the #quickwash. For #vaping #edibles #dabbing. https://t.co/enaRJ2nvue,extracts101,2016-04-09 23:27:03+00:00
83,718943286103318528,New toy #vapelife #vape https://t.co/jT5MLKLElD,AyeBaam,2016-04-09 23:26:51+00:00
84,718943273474068482,I'll never grasp the reason why vaping is cool😕😑😂,AmorousMicah,2016-04-09 23:26:48+00:00
85,718943236941701120,Equating Vaping With Smoking Is Medical Malpractice https://t.co/f3PgH23Gl3,LibertarianMac,2016-04-09 23:26:39+00:00
86,718943195690770432,Enter to win Wotofo #vape gear including a Chieftain mod &amp; Conqueror RTA from @v_a_p_e &amp; @wotofoofficial. #Giveaway https://t.co/i0F2Ob3sDA,Yarik_V,2016-04-09 23:26:29+00:00
87,718943182646484993,"#VapeDeals to check out at https://t.co/sBsLuYO0E7 this weekend! 

#vapers #vapesale #vapeshop #vapepromote #vapefam https://t.co/sCEdeHZrdz",DFWvapor,2016-04-09 23:26:26+00:00
88,718942726616653824,The group of 4 vaping guys all hitting on the girl next to me for 20 min is the best thing that's happened to me all day.,AthenasAdventrs,2016-04-09 23:24:37+00:00
89,718942640419409920,"#puffmonster
Please help me out vape fam and followers I need as many likes as possible… https://t.co/VnRmr6TiAj",DSTEGNER119,2016-04-09 23:24:17+00:00
90,718942516071043072,"Allow people to vape instead. There's precedent it can work, &amp; it's position supported by many public health bodies https://t.co/0QcyGKZ7LS",gillianegolden,2016-04-09 23:23:47+00:00
91,718942412295577601,Good morning sir. #vape #cup #fun #friends #nikon #d5200 #party #smoke #everyday #ijust #liquid… https://t.co/8DE5C96BCg,HiiGamerz,2016-04-09 23:23:23+00:00
92,718942243327901696,I think I'm gonna start vaping and get a bunch of vapers together and start and gang of badass vape people. Who's in?,cummings_lexie,2016-04-09 23:22:42+00:00
93,718942192849575937,"Me: dad, it's not ""smoke vape"" you just vape- it's a noun and a verb
Mom: like fuck?
Dad: how is fuck a noun?
Mom: idk you fuck",leah_mullen14,2016-04-09 23:22:30+00:00
94,718942134594879492,I liked a @YouTube video from @atomicecigs https://t.co/rGgwYhPtob HOW TO: Do a Tornado Vape,marvestal,2016-04-09 23:22:16+00:00
95,718942062721253376,When she likes guys that vape. https://t.co/xRI9klUPnV,Dovahkevv,2016-04-09 23:21:59+00:00
96,718941857971961856,FINALLY made it over to #puffvaporslv today! Thanks Shane! BEST VAPE SHOP IN TOWN! #lebowski https://t.co/jwrODIA1jb,xxaliciamariexx,2016-04-09 23:21:10+00:00
97,718941856269266945,Help me win some amazing Wotofo #vape gear from @wotofoofficial and @v_a_p_e. https://t.co/YIw6CPVVyG,VapeGod0220,2016-04-09 23:21:10+00:00
98,718941785578450944,VAPE NATION,Anjo2221,2016-04-09 23:20:53+00:00
99,718941705467113472,Enter to win Wotofo #vape gear including a Chieftain mod &amp; Conqueror RTA from @v_a_p_e &amp; @wotofoofficial. #Giveaway https://t.co/YIw6CQdwqe,VapeGod0220,2016-04-09 23:20:34+00:00
100,718941580854431745,#nitemarecreations had an awesome event at Vape blast 2016! #vapelyfe #vapelife  #Victoryliquid #casaa... https://t.co/ABfqyZAtGu,nitemarejuice,2016-04-09 23:20:04+00:00
101,718941572264361984,Enter to win Wotofo #vape gear including a Chieftain mod &amp; Conqueror RTA from @v_a_p_e &amp; @wotofoofficial. #Giveaway https://t.co/UE2Qdvh9C6,boopsgirl,2016-04-09 23:20:02+00:00
102,718941510566297600,"Sound check done, and it's almost show time! :) via /r/Vaping https://t.co/qQ4Jr6vnrz https://t.co/Jw6akrPuUB",CannonballVapes,2016-04-09 23:19:48+00:00
103,718941503498907653,"vapedragonz's photo https://t.co/bul7pG5FP9
#vape #vapers #VapeDragons #Vapstagram #SmokeWars",mthennessy82,2016-04-09 23:19:46+00:00
104,718941412453167104,No vaping,Jenagsan,2016-04-09 23:19:24+00:00
105,718940890111348736,Want to catch an L? #funrun2 #Monsta103 #darkeclipse #Xpertrocky101 https://t.co/52gXX5IsSE,Vape_Luke,2016-04-09 23:17:20+00:00
106,718940703812927488,"Need to catch up on weekly #ecig news? Check out the this educational round-up from the #vape blog - https://t.co/kkqDIyeI1V
#vapenews",ecig,2016-04-09 23:16:35+00:00
107,718940675559936000,Am I really about to go buy a vape right now? #Looossssseeer,Yogiwoodss,2016-04-09 23:16:28+00:00
108,718940622481072129,"#TorontoSun Protesters want Ontario's vaping legislation scrapped
                            
         ... https://t.co/Q4F2Kho6P2 #news",tuitCanada,2016-04-09 23:16:16+00:00
109,718940619503063041,"Protesters want Ontario's vaping legislation scrapped
                            
                           ... https://t.co/quWlQlgMbA",bheavenly,2016-04-09 23:16:15+00:00
110,718940612280598530,Vape is a gateway drug,WinnDicksy,2016-04-09 23:16:13+00:00
111,718940326988087296,"Protesters want Ontario's vaping legislation scrapped [Video]: Vaping advocates took to the streets on Saturday,… https://t.co/BjGirtVIw1",TorontoCentral,2016-04-09 23:15:05+00:00
112,718940320117891072,my father invented vaping but I don't want another nuclear disaster attached to the Emmerich name.,OtaconTxt,2016-04-09 23:15:04+00:00
113,718940319061041155,VAPING UNDERGROUND ROG #LAPTOP #GIVEAWAY! https://t.co/Z5LGutbhDr #gaming,Share_Giveaway,2016-04-09 23:15:03+00:00
114,718940237175463936,"We get it, you vape. https://t.co/BGGBpEG4wf https://t.co/VzU73JDvUx",gagalaxysite,2016-04-09 23:14:44+00:00
115,718940200332865536,I no longer smoke cigarettes because I #vaped as a harm reduction method #tobaccokills #vapingsaveslives,BethJordan6,2016-04-09 23:14:35+00:00
116,718940121496731653,Win a DNA200 LavaBox Mod with 2 extra Grips from @VapingCheap - https://t.co/PYwH5e5lkg #ecig #Vape,Mikeyprev,2016-04-09 23:14:16+00:00
117,718940091427610624,Sorry I brought my vape pen to your wedding reception.,DJRoberts84,2016-04-09 23:14:09+00:00
118,718940050394730496,#Vaping Mayo Investigates possible medical value for e-cigarettes: By COREY NOLES A recently released study co... https://t.co/GEkNsMJSUK,dvdido,2016-04-09 23:13:59+00:00
119,718940048180305921,vape nation https://t.co/sQ78oME9hs,suhdune,2016-04-09 23:13:59+00:00
120,718939962704556033,Want to catch an L? #funrun2 #brandon98508 #CLANMASTERXD #MacyNoLue https://t.co/FcyDE7EiNB,Vape_Luke,2016-04-09 23:13:39+00:00
121,718939935420461056,"Protesters want Ontario's vaping legislation scrapped
                            
        ... https://t.co/Q4F2Kho6P2 #canada #gta #news",tuitCanada,2016-04-09 23:13:32+00:00
122,718939759549153280,Win a DNA200 LavaBox Mod with 2 extra Grips from @VapingCheap - https://t.co/rcBvjM9h2L #ecig #Vape,Gpaubzzz,2016-04-09 23:12:50+00:00
123,718939714754068481,Chili's is like vape central rn,ksnedrock,2016-04-09 23:12:39+00:00
124,718939666439741440,Enter to win Wotofo #vape gear including a Chieftain mod &amp; Conqueror RTA from @v_a_p_e &amp; @wotofoofficial. #Giveaway https://t.co/WvYA33AptR,kenhaley5_ken,2016-04-09 23:12:28+00:00
125,718939666293071872,"Dude in front of me is wearing a ""vape magazine"" snapback. This is my crowd.",IsClaireAnAries,2016-04-09 23:12:28+00:00
126,718939493366112256,Still figuring out Conakry but am 100% amused by the military officer vaping onstage at an indoor concert tonight.,careiling,2016-04-09 23:11:47+00:00
127,718939353012043776,National Unicorn Day! What flavor would a unicorn vape? #Vape #VapePorn #NationalUnicornDay https://t.co/TZnThVHK99,USVAPECO,2016-04-09 23:11:13+00:00
128,718939324453007360,When your vape pen has a screen saver,coolbeans1898,2016-04-09 23:11:06+00:00
129,718939268509515776,yo hey newsflash I don't have a car bought by my parents I don't have money to pour into tattoos and vape and video games,x_maremo,2016-04-09 23:10:53+00:00
130,718939244580843520,Naked and Vaping: A Memoir,valerie_tosi,2016-04-09 23:10:47+00:00
131,718939150993530880,anyone vape.. anyone?,vSpectYT,2016-04-09 23:10:25+00:00
132,718938874202882048,Win a DNA200 LavaBox Mod with 2 extra Grips from @VapingCheap - https://t.co/HMJcvfhqCa #ecig #Vape,93Shym,2016-04-09 23:09:19+00:00
133,718938839482404864,"If you're in a tiny room with 100 other people, for the love of god don't vape please.",RathFGC,2016-04-09 23:09:11+00:00
134,718938516814708736,Vaping's Dirty Little Secret https://t.co/lsy9H0MAAP,cacecar,2016-04-09 23:07:54+00:00
135,718938413483823104,Win a DNA200 LavaBox Mod with 2 extra Grips from @VapingCheap - https://t.co/qlcMs0vZ3Q #ecig #Vape,SleeplessIva,2016-04-09 23:07:29+00:00
136,718938299478323200,"IFUS Bid Size
https://t.co/oALYTJFNnZ

$IFUS $LEAS $NRTI $VAPE  #invest #pennystocks",kingtin1978,2016-04-09 23:07:02+00:00
137,718938182318841856,Girlie power! We vape power too 😘 #TheMasterMixer #MyFavoriteFlavor #BadAssGirl #BrutalVaping… https://t.co/ZIQLcTCbup,Fenix_VaporShop,2016-04-09 23:06:34+00:00
138,718938016455200769,"I haven't actually seen anyone vape. When they exhale is it just one long ""broooooooooooooooooooooooooooooooooooooooooooooooooooooooooooo""?",6stringhero,2016-04-09 23:05:55+00:00
139,718937986470191104,LIVE on #Periscope: vape stream  https://t.co/OMq9d19hxQ,93simoon,2016-04-09 23:05:47+00:00
140,718937980149370880,Seeking product sponsor for THC tinctures/oils for my vape pen. I go out several times a week and almost always... https://t.co/ThffiLKUb1,Christinaxrose,2016-04-09 23:05:46+00:00
141,718937946594926593,"Survey: Trump, Clinton Are the Vaping Candidates https://t.co/Z24adxp8zO",cacecar,2016-04-09 23:05:38+00:00
142,718937862733848576,"C you in court: Deadmau5 is not amused at vape company using a ""deadmodz"" trademark. With pictures: 
https://t.co/gCycx3Ak7y",MarkJKings,2016-04-09 23:05:18+00:00
143,718937810401697792,https://t.co/poUeewDgi9 it's lit af w the vape lord @Garrityyy,AndrewG725,2016-04-09 23:05:05+00:00
144,718937809273401344,RT @CTVToronto: Protests against Ontario's move to ban vaping in public: https://t.co/IwKqMig8Ni https://t.co/KM2joUaHLQ.,WatchCTVNews,2016-04-09 23:05:05+00:00
145,718937626041049089,My vape pen just broke. This year is ruined,ColaWarsVeteran,2016-04-09 23:04:21+00:00
146,718937584060207105,"100% Original Eleaf iJust 2 ...:  https://t.co/Dj79WBNCbw
#Vaping https://t.co/ULTcySjgnF",VapOrgasme,2016-04-09 23:04:11+00:00
147,718937451973210112,Grab yours today! Anarchist Ejuice (60ml) is now available at Vape Street. https://t.co/g1pSTofyMs,vapestreet_au,2016-04-09 23:03:40+00:00
148,718937433560092672,VAPING UNDERGROUND ROG LAPTOP GIVEAWAY! https://t.co/7oMBflh7wE,tortextest,2016-04-09 23:03:36+00:00
149,718937427239264256,"normal people flirting: haha then what;)
me flirting: ha ha hey boy if ur vape was a facebook post I'd smash the fuccin licc xD",zhoumxng,2016-04-09 23:03:34+00:00
150,718937396482596864,Teen vapers have easy time buying supplies online https://t.co/eUcTUnW61c #ecigarettes,cacecar,2016-04-09 23:03:27+00:00
151,718937390400675840,Vaping sessions with my mom are the best👌🏼💨,kaidenashton_,2016-04-09 23:03:25+00:00
152,718937314928361472,"Protesters want Ontario's vaping legislation scrapped [Video]: Vaping advocates took to the streets on Saturday,… https://t.co/volO5uECuS",torontodowntown,2016-04-09 23:03:07+00:00
153,718937303125635072,"GATA Market Cap
https://t.co/UJYO9d1MUA

$GATA $CDNL $SHOM $VAPE  #share #stock",stockmarket2013,2016-04-09 23:03:04+00:00
154,718937279318757376,InstaGram upload by vapeporn #Vapeporn #Vape #Vapelife https://t.co/tiPctYLZlZ https://t.co/HDxux8cq5E,VapingLove,2016-04-09 23:02:59+00:00
155,718937232409669632,If you're against the vape nation yours against me,kenosopiac,2016-04-09 23:02:48+00:00
156,718937210204979200,InstaGram upload by vapeporn #Vapeporn #Vape #Vapelife https://t.co/tS7uQBboV0 https://t.co/0qwr18GcdL,VapingLove,2016-04-09 23:02:42+00:00
157,718937205432061952,I had a dream that my mom told me I have to calm down and vape. My brain...,mooninesss,2016-04-09 23:02:41+00:00
158,718937147714203651,"9TH ISLE | Silhouette 
A slightly sweet and tart cherry limeade that you'll want to vape all… https://t.co/J8R3o1YfJp",OvertonPeter,2016-04-09 23:02:27+00:00
159,718937130941046784,InstaGram Upload by worldwide_vape https://t.co/Dy1Zfu2ZcB https://t.co/TSodMreoqk,VapingLove,2016-04-09 23:02:23+00:00
160,718937130463076352,I liked a @YouTube video from @vape_mighty https://t.co/5dkmAPICe8 NBA2K16 Best Jumpshot!!!,cookiesrock12,2016-04-09 23:02:23+00:00
161,718937047642181632,I just saw a group of 14 year old boys vaping LOL,pandulcemamii,2016-04-09 23:02:04+00:00
162,718937034342211584,Everybody has a goal and a big dream #Lyrics #Music #Tune #LunarC #Vape #Vaper #Vaping #Vapor… https://t.co/buaIYFsKYJ,RustyManDan,2016-04-09 23:02:00+00:00
163,718936956617506816,Bit of evening vaping! Sweet salt on the snow wolf and dot mod v2!… https://t.co/R1rYrjMH5d,OvertonPeter,2016-04-09 23:01:42+00:00
164,718936790225133568,$VAPE How Much Momentum is Driving Your #Marijuana Stock? FIND OUT! (FREE) https://t.co/JCvFFrhOGJ Influence Your #Investment! #Momo420,OtcPicker,2016-04-09 23:01:02+00:00
165,718936611115806720,Enter to win Wotofo #vape gear including a Chieftain mod &amp; Conqueror RTA from @v_a_p_e &amp; @wotofoofficial. #Giveaway https://t.co/Gx9ukekE3E,dannialiy,2016-04-09 23:00:19+00:00
166,718936559865573376,When you hear your mom come home from work at 6pm and all you've done the whole day is vape and watch Twister. https://t.co/tluQK2hFSl,WhatsNewDonehue,2016-04-09 23:00:07+00:00
167,718936512272838657,"I'm a little excited about all our new vapes!
#seattle #vape #budtender #weed #cannabis #kusharmy #vapelife #vapeon https://t.co/RlY3bRgDs3",WR_Cannabis,2016-04-09 22:59:56+00:00
168,718936485873848320,Hazelnut Vape Juice https://t.co/AKEOPVVUDz #grandrapids #NotBlowingSmoke #ecig #E-Liquid https://t.co/Ie7XW4zh7A,4_Fox_Sakes,2016-04-09 22:59:50+00:00
