,TweetID,TweetContent,TweeterUsername,TweetDatetime
2615,718683316304523266,Im here....at  @nurul1808 2nd Anniversary 9 April 2016.. #dstaroza  🎈🎂🎁 @ Vintage Vape Cafe… https://t.co/VYNIh3wc3w,nurain07,2016-04-09 06:13:49+00:00
2616,718683147668365312,I'm on that OG churro vape,daay_vidd,2016-04-09 06:13:09+00:00
2617,718683110985068546,win some amazing Wotofo #vape gear from @wotofoofficial and @v_a_p_e. https://t.co/0pkVfupXaM,DonovaneLiz,2016-04-09 06:13:00+00:00
2618,718683008274952192,Enter to win Wotofo #vape gear including a Chieftain mod &amp; Conqueror RTA from @v_a_p_e &amp; @wotofoofficial. https://t.co/S0aRvIHxZv #Giveaway,DonovaneLiz,2016-04-09 06:12:36+00:00
2619,718682812996452352,I liked a @YouTube video from @mike_vapes https://t.co/kMSceoXlWz Herakles RTA By Sense 25mm - 6ML - Mike Vapes,donunus,2016-04-09 06:11:49+00:00
2620,718682720642027520,Win a DNA200 LavaBox Mod with 2 extra Grips from @VapingCheap - https://t.co/aTKbBpPqNE #ecig #Vape,DrakisBack,2016-04-09 06:11:27+00:00
2621,718682462176411648,Enter to win Wotofo #vape gear including a Chieftain mod &amp; Conqueror RTA from @v_a_p_e &amp; @wotofoofficial. #Giveaway https://t.co/tIaTJmu7su,SaschaPirkowski,2016-04-09 06:10:26+00:00
2622,718682430639575040,The crew at VapeWild must be having a laugh :P via /r/Vaping https://t.co/AMoS2nLG3Z https://t.co/6c9uhFAofK,CannonballVapes,2016-04-09 06:10:18+00:00
2623,718682409026191361,Vape foo  https://t.co/2Rma7gKLRD,RickyTZzz,2016-04-09 06:10:13+00:00
2624,718682105908174848,Enjoy perfect #vaping with the all new #SUBOXNano starter kit from #Kangertech - https://t.co/MXSGSwnhSw,SwytchVaping,2016-04-09 06:09:01+00:00
2625,718681810796994560,"rt: @VapePositive 󾭝 Archon https://t.co/BRnKOeSF3z #vape, #vapecommunity, #vapefam, #vapepositive,... https://t.co/hnA1kPsfU7",leadsdirectusa,2016-04-09 06:07:50+00:00
2626,718681786042048512,"rt: @VapePositive 💨 Archon https://t.co/9mnNubYtL8 #vape, #vapecommunity, #vapefam, #vapepositive, #freshjivejuice https://t.co/b3Ool9Zyf5",freshjivejuice,2016-04-09 06:07:44+00:00
2627,718681738768199680,"Kali is bringing bapes back apparently
She's the bape ape I guess
Vape, bape?",completeGarbage,2016-04-09 06:07:33+00:00
2628,718681657092534272,"No smoking,just vaping 💨
#vape #vapejogja #vapeasik
📷 by : @adysky99 https://t.co/IUFdXKuOrp",ekisyahputro,2016-04-09 06:07:14+00:00
2629,718681499822727168,You don't need to ask someone if they are vegan or vape. Chances are that's how they start the conversation.,UCWesteros,2016-04-09 06:06:36+00:00
2630,718681461340024832,Enter to win Wotofo #vape gear including a Chieftain mod &amp; Conqueror RTA from @v_a_p_e &amp; @wotofoofficial. #Giveaway https://t.co/ajqjl44KN9,meisterkajo77,2016-04-09 06:06:27+00:00
2631,718681459100286976,Win a DNA200 LavaBox Mod with 2 extra Grips from @VapingCheap - https://t.co/0iRBO1h5wR #ecig #Vape,Rmarini85,2016-04-09 06:06:26+00:00
2632,718681126009573376,I wanna visit a vape shop,Itzstefanbruh,2016-04-09 06:05:07+00:00
2633,718680884908400641,"I wanna film a vape montage with ""Animal I Have Become"" by Three Days Grace playing in the background.",uh_Jesse,2016-04-09 06:04:10+00:00
2634,718680831196135424,Don't vape and drive kids you'll fucking die,CallieMia,2016-04-09 06:03:57+00:00
2635,718680395009515521,HELP MY FRIENDS THINK THEY ARE VAPE GODS https://t.co/ctINy3rxEy,sonyiittaa,2016-04-09 06:02:13+00:00
2636,718680276830801920,Enter to win Wotofo #vape gear including a Chieftain mod &amp; Conqueror RTA from @v_a_p_e &amp; @wotofoofficial. #Giveaway https://t.co/edmvQrRaeL,Bo8ka_,2016-04-09 06:01:45+00:00
2637,718680109142667264,Want to Quit Smoking? Try Twitter #vape #vaping https://t.co/K7NG1wm6sW https://t.co/wj9QGsng58,esheeshvaping,2016-04-09 06:01:05+00:00
2638,718680064188030976,Enter to win a brand new Sigelei T150 Touch Screen! Enter in seconds #vape #vapelife #vapefamily #ecig #vapefam https://t.co/fsIzehbluT,Bo8ka_,2016-04-09 06:00:54+00:00
2639,718679904854896641,Free bottle of juice with every order @MtBakerVapor https://t.co/stvt94uR9k  #vapelife #vapor #vaping #vape #coupons https://t.co/3Rfm4THRdK,Suckmybox_com,2016-04-09 06:00:16+00:00
2640,718679866741297152,"Michigan NORML Gives Awards To Irwin, Komorn, And Others #vape https://t.co/Mq0QYKznyV",vapingtruth,2016-04-09 06:00:07+00:00
2641,718679582820278273,im suffocating from vape exhaust in this line rn,jonsuxx,2016-04-09 05:58:59+00:00
2642,718679530366349312,Update: Re: Vaping's Dirty Little Secret: I'm shocked at how many young people smoke. Anyone under 40 knows ho... https://t.co/Eu6tfTLKc0,TheJaxsonMag,2016-04-09 05:58:47+00:00
2643,718679380784840704,Vape all day: https://t.co/9XclncnRrB via @YouTube,superglu3,2016-04-09 05:58:11+00:00
2644,718679265919819776,The real reason Government doesn't like vaping! https://t.co/ZftnFitd98 via @imgur,gstriftos,2016-04-09 05:57:44+00:00
2645,718678795461341185,I liked a @YouTube video from @leafyishere https://t.co/IpbHyyFYsJ VAPE KIDS,Tostupidtohunt,2016-04-09 05:55:51+00:00
2646,718678425729261569,""" look lil, I'm vaping"" 😂😂 https://t.co/cTQKHISIKX",lillie_lewis15,2016-04-09 05:54:23+00:00
2647,718678333463113728,SWITCHING HABITS: To Smoke Or To Vape? https://t.co/ZmJuFYWzmx,glenandrews,2016-04-09 05:54:01+00:00
2648,718678193213820928,$MNTR Mentor Capital Acquires International Vaporizer #THC &amp; #CBD Patent | Business Wire #Vape https://t.co/gsfRk7hnqF,George323818,2016-04-09 05:53:28+00:00
2649,718678155683348480,Flav Rx just arrived 🤗🔥 get your vape on 🌬 #weedstagram #weedstagram420 #prop215 #420 #indica… https://t.co/8yxIkcRdF4,chulavistameds_,2016-04-09 05:53:19+00:00
2650,718678134137028608,Win a Joyetech Cuboid Mod + Cubis Tank from @cigbuyer: https://t.co/bzgnp07bTP #vaping #joyetech #cuboidmod #vapecontest #vapegiveaway,NenciuCristian,2016-04-09 05:53:14+00:00
2651,718678091338530816,I officiallh joined the vape clan lol. Time to start learning party tricks lmao,DreaminOfTokyo9,2016-04-09 05:53:04+00:00
2652,718677862883020802,"#puffmonster
Please help me out vape fam and followers I need as many likes as possible… https://t.co/NNyE3ASncK",DSTEGNER119,2016-04-09 05:52:09+00:00
2653,718677818297708544,"Read an Amazon review where someone referred to their ""vape pouch"" put that shit in your pocket like man",howbouthemboys8,2016-04-09 05:51:58+00:00
2654,718677811779747840,Invisible Inc. but with vaping,FadGameIdeas,2016-04-09 05:51:57+00:00
2655,718677803659608064,Beer and vape. Not too shabby,TylerPierson95,2016-04-09 05:51:55+00:00
2656,718677546984980480,Firefighters think they're so cool! #vape #wegetityouvape (Vine by @DanielsOfficer) https://t.co/7eZITPpQ53,kaatiee_t,2016-04-09 05:50:54+00:00
2657,718677534687125504,Vapers are really fighting to earn top spot on the list of people who are the worst,BigFunk__,2016-04-09 05:50:51+00:00
2658,718677447672209408,vapers be like (Vine by @Kopke613) https://t.co/zeyGLkR25O,RyanRoggie21,2016-04-09 05:50:30+00:00
2659,718677270546804736,"New post added at Coil Vapes eLiquid Review! | TiaVapes

eliquid... https://t.co/eipP6pc2ky",ECIGCANADAZONE,2016-04-09 05:49:48+00:00
2660,718677268504162304,"Love this share!! 😘📸
@kmacbain89 
・・・
The charm looks great on my minikin! #vapordolls #vape… https://t.co/kCMfyShiUT",sdvapordolls,2016-04-09 05:49:47+00:00
2661,718677268248272896,"New post added at Coil Vapes eLiquid Review! | TiaVapes

eliquid... https://t.co/7VBjoFuJRL",ECIGCANADAZONE,2016-04-09 05:49:47+00:00
2662,718677265886887936,"New post added at Coil Vapes eLiquid Review! | TiaVapes

eliquid... https://t.co/6jtWiiRwDa",ECIGCANADAZONE,2016-04-09 05:49:47+00:00
2663,718677259985559552,"New post added at Coil Vapes eLiquid Review! | TiaVapes

eliquid... https://t.co/ljlOdbFZDg",ECIGCANADAZONE,2016-04-09 05:49:45+00:00
2664,718677257678680064,"New post added at Coil Vapes eLiquid Review! | TiaVapes

eliquid... https://t.co/HN73y9wjhq",ECIGCANADAZONE,2016-04-09 05:49:45+00:00
2665,718677135095963648,i need a vape to deal with life honestly not afraid to say it,yungchunk_,2016-04-09 05:49:16+00:00
2666,718676540599328768,Win a DNA200 LavaBox Mod with 2 extra Grips from @VapingCheap - https://t.co/U8gxHc0jNa #ecig #Vape,beerbabe94,2016-04-09 05:46:54+00:00
2667,718676479110995968,someone buy me a vape pen xD,braedenLS,2016-04-09 05:46:39+00:00
2668,718676460496486400,I liked a @YouTube video https://t.co/z2PQE0voOb Mouth To Lung Vapers vs Cloud Chasers... Big Rant,skyman21277,2016-04-09 05:46:35+00:00
2669,718676426333884416,if you blow big enough vape clouds you can't see haters bro,Ryramirez7,2016-04-09 05:46:27+00:00
2670,718676262177218560,I'm vaping so hard rn,BanzaiTakesAnal,2016-04-09 05:45:47+00:00
2671,718675974875975680,Had to use Eric's vape as a chaser,shant__________,2016-04-09 05:44:39+00:00
2672,718675927421464576,Vape Nation/Rupert Investigates the Flint Water Crisis- Beta Provider: https://t.co/5rcqzRDEBg via @YouTube,betaprovidersho,2016-04-09 05:44:28+00:00
2673,718675719715479552,I just paid a $364 ticket for speeding. I just saw a meme about vapes on a loop wherever I go*.,powertooles2,2016-04-09 05:43:38+00:00
2674,718675698659897344,"New state rules to govern vape shops and electronic cigarettes: Then, he discovered vaping and quit that same ... https://t.co/6wl3tCg7nc",SkylarGordon202,2016-04-09 05:43:33+00:00
2675,718675538282287104,stupid youtubers promoting vapes.,JSManaloto,2016-04-09 05:42:55+00:00
2676,718675424994205696,Im chillin in the backseat lit and smoked out off vape cuh https://t.co/NV2jx9Ql3y,EmadDoItBetter,2016-04-09 05:42:28+00:00
2677,718675356132122624,Enter to win over $757 dollars worth of Vape Gear at https://t.co/MjbbtPAGXj! Sponsored by: Vape Craft Inc.,beerbabe94,2016-04-09 05:42:11+00:00
2678,718675264708952065,VAPE JUICE IS SO GROSS,emnicolesanta,2016-04-09 05:41:50+00:00
2679,718675216675672064,So much vape,lacroixboix_,2016-04-09 05:41:38+00:00
2680,718675209474060289,Vape nation at this party rn,KyleOilar,2016-04-09 05:41:36+00:00
2681,718675104637407232,New state rules to govern vape shops and electronic cigarettes - The News Tribune https://t.co/V559WMf2FN #ecigs #vaping,VapinXsmoker,2016-04-09 05:41:11+00:00
2682,718675103987290112,Vaping supporters to rally at Queen's Park - Toronto Sun https://t.co/PlOIrwHNl0 #ecigs #vaping,VapinXsmoker,2016-04-09 05:41:11+00:00
2683,718675102729043968,"Local vape businesses get a win, await governor's action on statewide rules - The News Tribune https://t.co/8U4Vgi17L5 #ecigs #vaping",VapinXsmoker,2016-04-09 05:41:11+00:00
2684,718675016339038210,AU where hikari runs an underground vaping bar at starlight,BowserSexer,2016-04-09 05:40:50+00:00
2685,718674988669255680,First batch of my April Fools order from VapeWild. 11 more to go: 570ml! via /r/Vaping https://t.co/aemyFOB5JT https://t.co/ww0bFU0q9y,CannonballVapes,2016-04-09 05:40:44+00:00
2686,718674952715567109,"Kids nowadays be like ""Tol, tara vape tayo"" Are you guys fcking crazy? You're too young to experience everything na hindi naman dapat.",laradominiquex,2016-04-09 05:40:35+00:00
2687,718674453991972864,"20pcs Original innokin ...: icle ... https://t.co/Xs6Hm0iYE5
#Vape https://t.co/CbW1Bj8QVQ",VapOrgasme,2016-04-09 05:38:36+00:00
2688,718674444164575233,wow myrhow the vape god,sophiehart22,2016-04-09 05:38:34+00:00
2689,718674343350276096,Win a DNA200 LavaBox Mod with 2 extra Grips from @VapingCheap - https://t.co/J7aRpkcSVk #ecig #Vape,Jediriccan,2016-04-09 05:38:10+00:00
2690,718674338476462082,"I think I'm pretty open minded... I just hope my (hypothetical) kid never grows up to ""vape""",mptmusic,2016-04-09 05:38:09+00:00
2691,718674185678123009,A Lot More Ads https://t.co/WRAC8Mt5O2 #vape #vaping #ecigs,vapedotto,2016-04-09 05:37:32+00:00
2692,718674067205677056,"All the douchebags at the douchebag convention, douching out tonight. Don't forget your vape pens you fucks! Hahahahaha!!!!",papijuancho_fc,2016-04-09 05:37:04+00:00
2693,718673943687598080,Vape is my teddy bear tonight,not_your_basicc,2016-04-09 05:36:35+00:00
2694,718673651248148480,Okk Okk Jhonny needa get me a new vape I ran out 😂,liljessxv,2016-04-09 05:35:25+00:00
2695,718673084140494848,Enter to win Wotofo #vape gear including a Chieftain mod &amp; Conqueror RTA from @v_a_p_e &amp; @wotofoofficial. #Giveaway https://t.co/BJXMiWDgji,EazyRighter,2016-04-09 05:33:10+00:00
2696,718673065274544128,I liked a @YouTube video https://t.co/88JFenH81C Mouth To Lung Vapers vs Cloud Chasers... Big Rant,robbie_vapes,2016-04-09 05:33:05+00:00
2697,718673045552893952,Win a Joyetech Cuboid Mod + Cubis Tank from @cigbuyer: https://t.co/wmmemvWv0k #vaping #joyetech #cuboidmod #vapecontest #vapegiveaway,RndBishop,2016-04-09 05:33:01+00:00
2698,718672905484144640,Win a DNA200 LavaBox Mod with 2 extra Grips from @VapingCheap - https://t.co/ThFWgsgMmw #ecig #Vape,EazyRighter,2016-04-09 05:32:27+00:00
2699,718672874504990720,i vape part 2 https://t.co/FtKsfhLi5K,kingkaylee1,2016-04-09 05:32:20+00:00
2700,718672788240916480,Bring on summer  #teamNGV #premiumeliquid #alwaysfirst #thatnewjuice #premiumeliquid #vape… https://t.co/2UypZbRxcD,NiceGuyVapors,2016-04-09 05:31:59+00:00
2701,718672743873560576,VAPING UNDERGROUND ROG LAPTOP GIVEAWAY! https://t.co/9ODcZPaG7h,hippel1968,2016-04-09 05:31:49+00:00
2702,718672524536446976,"boyfriend material:
-light bar
-vapes
-""like for honest DM"" tweets",clairemparker,2016-04-09 05:30:56+00:00
2703,718672478772416512,Joseph has a vape pen........,WhatIsabell,2016-04-09 05:30:45+00:00
2704,718672459889713152,Some guy in the drive thru blew his vape in my face tonight,DNCervantes,2016-04-09 05:30:41+00:00
2705,718672437341061120,Vaping is for no good dropout sinners,KarterRidout,2016-04-09 05:30:36+00:00
2706,718672419699843073,I got offered a job at a vape shop today and I basically have the job. I could not be more excited to leave Burger King.,JarrettBSdrums,2016-04-09 05:30:31+00:00
2707,718672409759326209,I liked a @YouTube video from @keaton https://t.co/gWXzxYUGVb A Phone That Vapes,TehnoGuy,2016-04-09 05:30:29+00:00
2708,718672305107386368,Thank you to everyone who follows. Please spread the word by following us on facebook #vapingtruth #vapelife #vape,vapingtruth,2016-04-09 05:30:04+00:00
2709,718672304356605952,Teen vapers have easy time buying supplies online | Fox News https://t.co/92XdNhQlQJ #health #wellness https://t.co/LjurozqiRW,zesty_health,2016-04-09 05:30:04+00:00
2710,718671819696279553,Enter to win Wotofo #vape gear including a Chieftain mod &amp; Conqueror RTA from @v_a_p_e &amp; @wotofoofficial. #Giveaway https://t.co/VwiyOcCYir,goran_flego,2016-04-09 05:28:08+00:00
2711,718671816441475073,Cremeria and Black Bart line up #vape #vaping #vapingmalaysia #vapingcomunity https://t.co/5fdnyCHRP6 https://t.co/Qyn7OFz3AA,garage_dwap,2016-04-09 05:28:07+00:00
2712,718671714750586880,I liked a @YouTube video https://t.co/J0eQnVmcHF Mouth To Lung Vapers vs Cloud Chasers... Big Rant,donunus,2016-04-09 05:27:43+00:00
2713,718671599319166976,Vape On,kimmtoledo,2016-04-09 05:27:16+00:00
2714,718671243038167040,Vaping supporters to rally at Queen's Park – Toronto Sun https://t.co/6XOYDnAzGZ https://t.co/dkOhETu9w7,neo_vape,2016-04-09 05:25:51+00:00
2715,718671018768752640,Win a Joyetech Cuboid Mod + Cubis Tank from @cigbuyer: https://t.co/bVFW5yb7fL #vaping #joyetech #cuboidmod #vapecontest #vapegiveaway,Bo8ka_,2016-04-09 05:24:57+00:00
2716,718670949545938944,Enter to win Wotofo #vape gear including a Chieftain mod &amp; Conqueror RTA from @v_a_p_e &amp; @wotofoofficial. #Giveaway https://t.co/9aZ8VnRoNN,mysticlady66,2016-04-09 05:24:41+00:00
2717,718670841844604938,I'm just trying to vape bro,PacBoyPanda,2016-04-09 05:24:15+00:00
2718,718670758864560128,You know my dads drunk when he tries to vape,g0awayplz,2016-04-09 05:23:55+00:00
2719,718670647686135808,"Hey Vapers, you're not frigging dragons!!!",Justgreat79,2016-04-09 05:23:29+00:00
2720,718670515292872704,Enter to win a brand new Sigelei T150 Touch Screen! Enter in seconds #vape #vapelife #vapefamily #ecig #vapefam https://t.co/ndLtnkMU6z,Boris_bmp,2016-04-09 05:22:57+00:00
2721,718670308018794501,Shout out to the kid vaping on his phone and burping during a movie,ChrisDorta36,2016-04-09 05:22:08+00:00
2722,718670275403907072,I'm vaped out,daay_vidd,2016-04-09 05:22:00+00:00
2723,718670242700853248,pucha his vape smells so good im addicted :(,Trisyaaa_15,2016-04-09 05:21:52+00:00
2724,718670016317648896,Check out these awesome deals from Vaping Express. https://t.co/xWi01d3RMw,catgirlsnm,2016-04-09 05:20:58+00:00
2725,718669848331464704,Enter to win Wotofo #vape gear including a Chieftain mod &amp; Conqueror RTA from @v_a_p_e &amp; @wotofoofficial. #Giveaway https://t.co/EBNKyb0AAF,Frostzillah,2016-04-09 05:20:18+00:00
2726,718669794740834304,Win a DNA200 LavaBox Mod with 2 extra Grips from @VapingCheap - https://t.co/LcEWC1RUzB #ecig #Vape,schura84,2016-04-09 05:20:05+00:00
2727,718669684594368512,#Vape #vapelife #bathroom #chill. Just doing my thing while doing the thing. #youknow #uknow https://t.co/bstJfzbj13,slow_turn_,2016-04-09 05:19:39+00:00
2728,718669359934091264,"Retweet&amp;Enter to win over $1,500 worth of  at: HeavenGifts. https://t.co/VKPsiYFKKn  #vape #international #giveaway https://t.co/OI6VcZTJni",rihga_111,2016-04-09 05:18:22+00:00
2729,718669321568980992,How to vape https://t.co/K9fRS1KyEk,Byoncak,2016-04-09 05:18:13+00:00
2730,718669188605194241,Enter to win Wotofo #vape gear including a Chieftain mod &amp; Conqueror RTA from @v_a_p_e &amp; @wotofoofficial. #Giveaway https://t.co/PgzVH1WWKe,axelbeam,2016-04-09 05:17:41+00:00
2731,718669107072073731,fun fact: people who do improv also vape,rob_hoffman,2016-04-09 05:17:22+00:00
2732,718668919544762369,The vape God vaping rn #vapenation,daay_vidd,2016-04-09 05:16:37+00:00
2733,718668822681673728,"I'm at Ro Vaping in Muscle Shoals, AL https://t.co/BwbHQFvd4U",rosmallwood75,2016-04-09 05:16:14+00:00
2734,718668754767515649,Thanks for the attention  nessalkrunch #vapelife #vapeporn #vapelyf #vapelyfe #vape #vaporizer… https://t.co/IPqYruxfgo,joes_ohms,2016-04-09 05:15:58+00:00
2735,718668749805453312,"Dekat flavour vape ni selalu kata,drink the flavour if you stupid hahahaha",HazwanJu,2016-04-09 05:15:56+00:00
2736,718668700581302273,Where all the girls that just wanna. Vape and chill with me,C0lin_Warren,2016-04-09 05:15:45+00:00
2737,718668598412075009,I liked a @YouTube video https://t.co/ojolkgK11f Mouth To Lung Vapers vs Cloud Chasers... Big Rant,donhuk,2016-04-09 05:15:20+00:00
2738,718668550521524224,Win a Joyetech Cuboid Mod + Cubis Tank from @cigbuyer: https://t.co/SGynsaR8KU #vaping #joyetech #cuboidmod #vapecontest #vapegiveaway,SlickDelicious,2016-04-09 05:15:09+00:00
2739,718668528056840193,becuz #dope #indica 💤💤😴 #weed #vape #dopedeals... https://t.co/3REPLoh6Wf,dopedealsla,2016-04-09 05:15:03+00:00
2740,718668445747798017,Friday shenanigans 😂😱😂 Just kidding we love ourselves some Vape Models📸 #ejuice #legends… https://t.co/RqYUVQ4wMY,hollywoodvapelb,2016-04-09 05:14:44+00:00
2741,718668422867992576,I just wrote a review on UD YouDe Vapor Pocket Double Sided Zipper Vaping Bag https://t.co/7GYCiCbwXZ via @yotpo,tareq_alzamami,2016-04-09 05:14:38+00:00
2742,718668322691248129,A bit of me at maniak_industries 😤😤#vapelife #vapeporn #vapelyf #vapelyfe #vape #vaporizer… https://t.co/ozByj1SPUC,joes_ohms,2016-04-09 05:14:14+00:00
2743,718668076707745793,finally got my vape pen back 👌👌 #vapelife #vapepen #vapefam,cgarcia_420,2016-04-09 05:13:16+00:00
2744,718668057749647360,"Skull Camo Rig Mod V2 by Vaping American Made Products
Only $145 at #blazinvapors
 
https://t.co/Z1UjyDG0gA https://t.co/3h57vmp218",BlazinVapors,2016-04-09 05:13:11+00:00
2745,718667955349757952,"*points camera at giant Jamaican Banana*

""This my number one smoke buddy.""

*blows vape cloud*",HunterWalker_,2016-04-09 05:12:47+00:00
2746,718667908801499136,"Cloud chasing Girl
#ecig #vape #vapote #vapor #vaping #freevape #vapegirls #subohm #cloudchasing #vapebabes https://t.co/3BCib1vTfq",VapoteurLand,2016-04-09 05:12:36+00:00
2747,718667732498026496,i will only answer to vivian 'vape queen' curtis from now on thanks :),hotcisboy,2016-04-09 05:11:54+00:00
2748,718667696020328449,"Vaping selfie
#vaping #vape #vapegirl #selfie https://t.co/jYnJO9qqK5",VapoteurLand,2016-04-09 05:11:45+00:00
2749,718667507721117696,A nice table check with some great friends at our weekend compound during Vape Showcase. #vape #vapefam #vapearmy... https://t.co/pFTK8FnpfX,TheArtOfVape,2016-04-09 05:11:00+00:00
2750,718667453077659649,Kangers new top fill evod. $10.55 https://t.co/O1Bv1pbbQC #vape #ecigs #reddit,ukvaper,2016-04-09 05:10:47+00:00
2751,718667451437699073,"Little discussion, but what do YOU hate most about rebuilding? https://t.co/acNMsT801w #vape #ecigs #reddit",ukvaper,2016-04-09 05:10:47+00:00
2752,718667428520136704,"When,what and why did you begin vaping",GrayVapes,2016-04-09 05:10:41+00:00
2753,718667357703573504,"New rda, the godzilla. 28.5mm rda, great flavor and vape… https://t.co/jhaUTPLABv",brewkodiak,2016-04-09 05:10:24+00:00
2754,718667351244148740,What's your daily vape juice? #vape #vaping #vapingmalaysia #vapingcomunity https://t.co/5fdnyCHRP6 https://t.co/pWhRwi1SMh,garage_dwap,2016-04-09 05:10:23+00:00
2755,718667331715465216,I want to go somewhere and vape,imisack,2016-04-09 05:10:18+00:00
2756,718667262454931458,Win a Joyetech Cuboid Mod + Cubis Tank from @cigbuyer: https://t.co/N8W1Ts4ui9 #vaping #joyetech #cuboidmod #vapecontest #vapegiveaway,WizsWorld,2016-04-09 05:10:02+00:00
2757,718667249213550593,#Prohibition? Let them fûcking try. The #vaping Underground Railway is ready https://t.co/bDx62PAl1A,mihotep,2016-04-09 05:09:59+00:00
2758,718667193584631808,Late night hand check while playing Injustice via /r/Vaping https://t.co/BG2NRVnzt9 https://t.co/1byF9PerxQ,CannonballVapes,2016-04-09 05:09:45+00:00
2759,718667129034158081,Enter to win Wotofo #vape gear including a Chieftain mod &amp; Conqueror RTA from @v_a_p_e &amp; @wotofoofficial. #Giveaway https://t.co/jQ2XrpFAT9,vitalis74,2016-04-09 05:09:30+00:00
2760,718666903594491904,VIRGIN NIGHT BITCHES DONT CUM EMPTY HANDEd DNT BRING VAPEs whos got da purp PLUTO,dillonTRAPtain,2016-04-09 05:08:36+00:00
2761,718666843892752384,InstaGram upload by vapeporn #Vapeporn #Vape #Vapelife https://t.co/LsIPd2IiCj https://t.co/V7YJFBcSYF,VapingLove,2016-04-09 05:08:22+00:00
2762,718666797084377088,My vape pen was a great investment.,MelodyReyne,2016-04-09 05:08:11+00:00
2763,718666647699988482,"Quit Squad aims to help smokers: A new service to help people who vape, smoke or chew nicotine or tobacco products… https://t.co/BLaX5vZKS9",blackpooldaily,2016-04-09 05:07:35+00:00
2764,718666574874419200,Use your #logicecig! Start vaping today and save:https://t.co/p3p2fKmRxp https://t.co/tyHAqQTIHA,LOGICSMOKES,2016-04-09 05:07:18+00:00
2765,718666498303201280,Can someone send me some #ejuice ? Lol I'm running low. #vape #vaping #vapelife #vapingcommunity #vapers,BigHec217,2016-04-09 05:07:00+00:00
2766,718666377683292160,Past me the hookah vape life https://t.co/Ygrv3CXggY,c_atkins3,2016-04-09 05:06:31+00:00
2767,718666252063887360,Spotted at DU: a mom vaping,Helen_Hallie,2016-04-09 05:06:01+00:00
2768,718666150721130496,I have vape smoke all up in my eyebrows and I love it,brother_carson,2016-04-09 05:05:37+00:00
2769,718666040155070466,Win a Joyetech Cuboid Mod + Cubis Tank from @cigbuyer: https://t.co/v5XMlWA2WR #vaping #joyetech #cuboidmod #vapecontest #vapegiveaway,zaja1715,2016-04-09 05:05:10+00:00
2770,718666021565911040,Enter to win Wotofo #vape gear including a Chieftain mod &amp; Conqueror RTA from @v_a_p_e &amp; @wotofoofficial. #Giveaway https://t.co/WrBrKecmR3,vasiliwerq,2016-04-09 05:05:06+00:00
2771,718665969648840704,when we exhale vape clouds it's like human exhaust. like a car,IAmSyntact,2016-04-09 05:04:53+00:00
2772,718665872219308033,Excalibur vape 😭,AllanSalem_,2016-04-09 05:04:30+00:00
2773,718665865781198848,Another look at our Titan 2 vape case … https://t.co/8K5HV5evV2 https://t.co/8K5HV5evV2,hydravaportech,2016-04-09 05:04:29+00:00
2774,718665769194819584,"At the UK’s Biggest Vaping Show, the Future Looks Hazy -  https://t.co/n5wqLBvRyx https://t.co/EQlq8zPhmk",GradyR74,2016-04-09 05:04:06+00:00
2775,718665543155224576,Enter to win Wotofo #vape gear including a Chieftain mod &amp; Conqueror RTA from @v_a_p_e &amp; @wotofoofficial. #Giveaway https://t.co/ekDek0mboT,digersui,2016-04-09 05:03:12+00:00
2776,718665512193028096,Can we just kick out those who set off the fire alarms from vaping in their dorm rooms?,cjp715,2016-04-09 05:03:04+00:00
2777,718665457406857216,Enter to win Wotofo #vape gear including a Chieftain mod &amp; Conqueror RTA from @v_a_p_e &amp; @wotofoofficial. #Giveaway https://t.co/giE3cmDqxH,chel_vit,2016-04-09 05:02:51+00:00
2778,718665298245582849,"BOBBYS HAVING A VAPE TANTRUM, HES BLOWING CLOUDS EVERYWHERE SEND HELP 🆘",DrewPak410,2016-04-09 05:02:13+00:00
2779,718664988676587525,Meet us at china vape expo #dwapgarage #vape #vaping #vapingmalaysia https://t.co/5fdnyCHRP6 https://t.co/KMJU0TH8gD,garage_dwap,2016-04-09 05:01:00+00:00
2780,718664844149268481,Win a DNA200 LavaBox Mod with 2 extra Grips from @VapingCheap - https://t.co/uA7vtnSsmZ #ecig #Vape,magnuson_adam,2016-04-09 05:00:25+00:00
2781,718664694211289088,NBL Cream Vape Juice https://t.co/PC1Y6zrdnb #quitsmoking #sale #discountcode #E-Liquid https://t.co/B7lM9vsPqu,4_Fox_Sakes,2016-04-09 04:59:49+00:00
2782,718664513768140800,Good day today got a sick new apartment and won a 200 dollar mod e cig from Southwest smokeless. Gotta love that place if you vape,TucTownRyda,2016-04-09 04:59:06+00:00
2783,718664433392701440,Win a DNA200 LavaBox Mod with 2 extra Grips from @VapingCheap - https://t.co/IRYrwHQvKz #ecig #Vape,IQexposure777,2016-04-09 04:58:47+00:00
