,TweetID,TweetContent,TweeterUsername,TweetDatetime,TweetLongitude,TweetLatitude,TweetPlace
1560,1593848871435653121,I be looking for my vibrator how y’all be looking for them vapes,lolo_getdough,2022-11-19 06:09:17+00:00,,,
1561,1593848548478619648,"#thc #cbdhealth 
#cannabiscommunity
 There are many best reasons to buy #CBD Vape Pens, in this article we will discuss why. It is well known that people who wish to try CBD for the first time have never vaped before. At the same time, https://t.co/EgSr1IRHwc #hemp #cbdoil https://t.co/0TpSQZmg4a",cbdhealthbasket,2022-11-19 06:08:00+00:00,,,
1562,1593848446376906754,"3 additional new flavours from the King X series are on the way to Vape Empire! 

Stay tuned! Conquer or be conquered. 

#vapeempiremalaysia #kingx #newflavor #stopsmokingstartvaping #interesting #forallyourvapingneeds #original #lostvape #malaysia https://t.co/XcEWAxhbRS",vapempire_my,2022-11-19 06:07:36+00:00,,,
1563,1593848444816326656,nothing is worse than when your vape is dying and you don’t have your charger,svftsvn,2022-11-19 06:07:36+00:00,,,
1564,1593848356773974016,my vape died so i guess ill quit idk,draziwizard,2022-11-19 06:07:15+00:00,-105.193475,39.60973,"Lakewood, CO"
1565,1593847401126973441,"Santa agrees with @AlexWodak, ditch the smokes for less harm - one of the very best gifts this Christmas.

Vaping nicotine is for harm reduction as seat belts are for road travel. https://t.co/R0IEyiHfFR",VaperNt,2022-11-19 06:03:27+00:00,,,
1566,1593846796454805506,Westbrook woman accused of selling marijuana and vape products to minors https://t.co/4m9250VRsj,WMTWTV,2022-11-19 06:01:03+00:00,,,
1567,1593846628246396928,Don’t Vape have a Cape,Dont_Vape_Bot,2022-11-19 06:00:23+00:00,,,
1568,1593846535157972992,"#mckesse MK BAR Cherry Ice. The thick pulp is sweet and delicious. Take you into the world of fruits. 🍒🧊
---
Warning: you must be of legal age to vape, thank you🚭21+
#vapelife #vapefam #disposablevape #vape #vapers #vaping #vapeshop #ukvapers #vapeuk https://t.co/dJXZPUACox",NgocThuc15,2022-11-19 06:00:00+00:00,,,
1569,1593846534612942848,"Get out in the fresh air with a fresh lemon flavor. It will help improve your mood 🤩🍂🍋

#schatzevapes #schatzebio #vaping #vapeamos #vapeo #vapelife #vaping #vapepics #vapeon #vapecommunity #vapelyfe #vapedaily #vapeworld #eliquid #vapesociety #vapor #vapeshop #vapespain #vape https://t.co/HUMRmZb9RJ",schatzebio,2022-11-19 06:00:00+00:00,,,
1570,1593846533123891201,"#Comingsoon
Here comes the most futuristic series in Aspire - Cyber series! Combining the see-through element with metal, the Cyber series products are here to be the coolest vapes ever!

Warning: This product is only designed for 21+ Adults.
#purchaseaspire #aspire #alwaysaspire https://t.co/xGVHvuqNtV",PurchaseAspire,2022-11-19 06:00:00+00:00,,,
1571,1593846532326817793,"#mckesse One of the most reliable manufacturers of disposable e-cigarette pens in China Reliability and perfection in every work process. https://t.co/ZADtcFvhuG
#ecig #vapes #vapelife #vapefam #vapelove #vape #vapers #vaping #vapegirls #vapelyfe #vapingstyle #ukvapers #ukvape https://t.co/hDAKTtAsM8",McKesseOfficial,2022-11-19 06:00:00+00:00,,,
1572,1593846109276815362,All our trains and stations are no vaping areas. Please do not vape.,traindroid_se,2022-11-19 05:58:19+00:00,,,
1573,1593846096135979008,"•Standard quit smoking methods (NRT &amp; medications) usually fail
•Most doctors &amp; public misperceive risks of nicotine; danger comes from smoke
•Switching from smoking to #vaping should be encouraged 
•Smoking &gt; 20 times riskier than vaping nicotine
1/2",AlexWodak,2022-11-19 05:58:16+00:00,,,
1574,1593845750777135104,Not this random ass lady using an ER charger for her vape https://t.co/XmxbRZ1y0X,AimeeS1997,2022-11-19 05:56:53+00:00,,,
1575,1593845717977776131,"QNTM DISPOSABLE PEN – ROOTBEER (1.0ML)  (1
$40.00  
QNTM Disposable vape pens are made of quality stainless steel and food-grade silicone. They feature a custom ceramic heater designed specifically for cannabis

https://t.co/aokLrotdRj",MaskeDierk,2022-11-19 05:56:46+00:00,,,
1576,1593845500780105730,"“Mmm. Smells like vanilla blossom cherry unicorn farts in here.” -my coworker who hit her vape, walked out of the room and back in 😂😂😂",its_Stevenss,2022-11-19 05:55:54+00:00,,,
1577,1593845213700804609,"“Do you have a vape charger”

No bro, I dont vape. I’m not addicted to nicotine. Get help.",jadeOF_,2022-11-19 05:54:45+00:00,,,
1578,1593844770388205569,IQOS Mauve Selection HEETS | Lontech Vape Shop London UK https://t.co/LIqOLy0EFV https://t.co/YxOoxRLhmp,LontechVapeShop,2022-11-19 05:53:00+00:00,,,
1579,1593844400513503234,singing “hopelessly devoted to you” to my vape,mckennabryn,2022-11-19 05:51:31+00:00,,,
1580,1593844343663579136,"Marijuana  SMOKER DREAM COME TRUE  a(1
440+ Items to choose from.
HYBRID PRE ROLLS (7 PACK)
BLACK GAS – AAAA+
BOOST CBD VAPE CARTRIDGES – CHARLOTTE’S WEB
DOOBIE SNACKS – 180MG THC HARD CANDY 

https://t.co/yGY8RCIAGe",MaskeDierk,2022-11-19 05:51:18+00:00,,,
1581,1593844037684891649,vape fucking stinks bro,gemmakoshe,2022-11-19 05:50:05+00:00,,,
1582,1593843837784526849,"I wish they made a vape that was just air..I’m sick of flavors, I’m sick of additives. I just want something that will hit my lungs like a cig…a strong gust of air I can puff.",waughtsup,2022-11-19 05:49:17+00:00,,,
1583,1593843503527665666,Know what? @LegaliseVaping is quite right! Insisting as Australia does smokers switching to vaping cost Medicare $177 million/year because prescription requirement for #vaping nicotine is just nuts!,AlexWodak,2022-11-19 05:47:58+00:00,,,
1584,1593843349294788608,I use vapes to take me down faster,crybabybuick,2022-11-19 05:47:21+00:00,,,
1585,1593843271368814593,Sleek sellouts! 🤓. Order New 2022 Disposable Vape Pods Custom Printed 2ml - MQO 5000 at $3.29 from https://t.co/96UlhElVDn #silicon #barrier https://t.co/GPTKNxkAig,MsnPacking,2022-11-19 05:47:02+00:00,,,
1586,1593842476972150786,"it’s time. 

the vape is charging as we speak.",youralaskanbf,2022-11-19 05:43:53+00:00,,,
1587,1593842393169760256,Since I did the quit smoking hypnosis last night my vape tastes nasty omg 🙀,evil_AOC,2022-11-19 05:43:33+00:00,,,
1588,1593842073911889920,Anyone else crack the vape open and suck out all the yummy juice,kidtrashpop,2022-11-19 05:42:17+00:00,,,
1589,1593842044010606592,i’ve tried many drugs in my life. but i will never be as hooked on something as my vape bro idc 😭,s3xykokis,2022-11-19 05:42:10+00:00,,,
1590,1593841940201619456,"QNTM DISPOSABLE PEN – ROOTBEER (1.0ML)  (
$40.00  
QNTM Disposable vape pens are made of quality stainless steel and food-grade silicone. They feature a custom ceramic heater designed specifically for cannabis

https://t.co/aokLrotdRj",MaskeDierk,2022-11-19 05:41:45+00:00,,,
1591,1593841232266285057,Does Vaping Impact Athletic Performance? https://t.co/AVT2CMd58X,RogerKelly18,2022-11-19 05:38:56+00:00,,,
1592,1593841232094134273,Does Vaping Impact Athletic Performance? https://t.co/MA23p2twND,jtmckeon,2022-11-19 05:38:56+00:00,,,
1593,1593841206081261568,My vape died 🤧🤧🤧,yogirlrainbow,2022-11-19 05:38:50+00:00,,,
1594,1593840862198276096,Moms spaghetti 🍝 this foo vaping on stage already,preyformemusic,2022-11-19 05:37:28+00:00,,,
1595,1593840559822901248,"Marijuana  SMOKER DREAM COME TRUE  a(
440+ Items to choose from.
HYBRID PRE ROLLS (7 PACK)
BLACK GAS – AAAA+
BOOST CBD VAPE CARTRIDGES – CHARLOTTE’S WEB
DOOBIE SNACKS – 180MG THC HARD CANDY 

https://t.co/yGY8RD0JUm",MaskeDierk,2022-11-19 05:36:16+00:00,,,
1596,1593840428079423488,Vaping. For when you aren't smoking but want everyone to know that you wish you were,Powerman5006,2022-11-19 05:35:44+00:00,,,
1597,1593840052890738691,I lose my vape every single dayyy. I’m fed up. Where the hell do I really be putting it smh,danielletoniann,2022-11-19 05:34:15+00:00,,,
1598,1593839074988679168,"QNTM DISPOSABLE PEN – ROOTBEER (1.0ML)  (17
$40.00  
QNTM Disposable vape pens are made of quality stainless steel and food-grade silicone. They feature a custom ceramic heater designed specifically for cannabis

https://t.co/aokLrotdRj",MaskeDierk,2022-11-19 05:30:22+00:00,,,
1599,1593839009356484608,Mother and sons convicted in Kenosha County THC vape ring avoid prison time https://t.co/XWFj5dMrmz,WISN12News,2022-11-19 05:30:06+00:00,,,
1600,1593838790833045505,How much money can I make if I make a vape that’s a binky,eggsandsamantha,2022-11-19 05:29:14+00:00,,,
1601,1593838708859576321,bro i make a meme tweet and karma gets my ass by me accidentally getting smoke from my vape in my fuckin eye,kitsuneminx,2022-11-19 05:28:54+00:00,,,
1602,1593838585320382464,Covertly vaping in the Uber since 00’,afuckinfairy,2022-11-19 05:28:25+00:00,,,
1603,1593838489921003520,dr wham vs vape :/,nagitosheadlice,2022-11-19 05:28:02+00:00,,,
1604,1593838464146976769,at a party and i see this cool vape PLEASE DONT LET ME LOSE NO NIC NOVEMBER,christaa_rioss,2022-11-19 05:27:56+00:00,,,
1605,1593838356864958465,Where the fuck is my juul,trinavegatwt,2022-11-19 05:27:31+00:00,,,
1606,1593838328733847554,i rly tried doordashing a vape. apparently u cant do that lmfao,cinnamnxgrl,2022-11-19 05:27:24+00:00,,,
1607,1593838242935107584,"Y'all ever hit the vape &amp; be like damn, this cartridge tastes carcinogenic af? 🤢",prettyynastyyy,2022-11-19 05:27:03+00:00,,,
1608,1593838072571072516,vape died. kill self?,ccornsalsa,2022-11-19 05:26:23+00:00,,,
1609,1593838069114814464,I just swallowed my juul 😰,catvaIentinetwt,2022-11-19 05:26:22+00:00,,,
1610,1593838061250523136,i been 2 months vape free as of today 💃🏻 🚫,sukigabriell,2022-11-19 05:26:20+00:00,,,
1611,1593837931378401281,When they pull out the vape I lost,jocelyynn____,2022-11-19 05:25:49+00:00,,,
1612,1593837852013494273,"Marijuana  SMOKER DREAM COME TRUE  a(17
440+ Items to choose from.
HYBRID PRE ROLLS (7 PACK)
BLACK GAS – AAAA+
BOOST CBD VAPE CARTRIDGES – CHARLOTTE’S WEB
DOOBIE SNACKS – 180MG THC HARD CANDY 

https://t.co/yGY8RD0c4O",MaskeDierk,2022-11-19 05:25:30+00:00,,,
1613,1593837702025482241,Newest Sample Size BIGBOX mini 80W starter kits Box Mod 2200mah build-in battery E Cig LED Big vape Vaporizer Hookah Vapor e Cigarettes: https://t.co/OmlqaDaTjJ,TomBoyMamax3,2022-11-19 05:24:54+00:00,,,
1614,1593837171882033153,i don’t want to sound like an old fuddy duddy but it’s honestly astounding how much young people vape,cubsgirl1825,2022-11-19 05:22:48+00:00,,,
1615,1593837137425829888,got carded for a vape by a child who counted out my age extremely out loud and extraordinarily on his fingers  while his older coworker tried to swat his hands to stop him counting a customer’s age out loud lol,whosdinga,2022-11-19 05:22:40+00:00,,,
1616,1593837099177967616,RIP MI VAPE 2022 - 2022,imsierrau,2022-11-19 05:22:31+00:00,,,
1617,1593837054382804992,I acquired a vape today. No regrets.,Maaaggi,2022-11-19 05:22:20+00:00,,,
1618,1593836921469521927,i been doing good w/out buying a vape 🙌🏼,_Vannah__,2022-11-19 05:21:48+00:00,,,
1619,1593836832197943297,Sports Vape 💨,ribs_hot,2022-11-19 05:21:27+00:00,,,
1620,1593836825298309122,QUIT VAPING,azarias416,2022-11-19 05:21:25+00:00,,,
1621,1593836624705572864,Me taking a huge rip from my vape,acenter102,2022-11-19 05:20:38+00:00,,,
1622,1593836390906843136,HELP IM IN DANGER!! My friend choked me pa haña vape,tresslechess,2022-11-19 05:19:42+00:00,,,
1623,1593836367468843008,two weeks and i'll be home,juul_28,2022-11-19 05:19:36+00:00,,,
1624,1593836214008053760,Cherry Bomb Waka Mini Disposable Vape| Lontech Shop https://t.co/XmLkHfQDER https://t.co/IdmtE7qrLV,LontechVapeShop,2022-11-19 05:19:00+00:00,,,
1625,1593836060861034496,"Been trying to recover from my vape addiction so hard I've been clean for almost 2 weeks and no one fucking cares , everyone still makes drug addict jokes about me . Why recover if no one cares or notices ? So close to relapsing",mugscent,2022-11-19 05:18:23+00:00,,,
1626,1593836043102363648,The PTSD of trying the first vape juice you ever had again,briaisbria,2022-11-19 05:18:19+00:00,,,
1627,1593835561185251328,Lol love vape ing,mar_in__,2022-11-19 05:16:24+00:00,,,
1628,1593835459087839232,Watermelon Ice Sky Crystal Bar Pro Disposable Vape | Lontech https://t.co/frpSK6waa4 https://t.co/yIrJMG3qBI,LontechVapeShop,2022-11-19 05:16:00+00:00,,,
1629,1593835305878147072,Why are you surrounding yourself around people who vape???,RDGeeZus,2022-11-19 05:15:23+00:00,,,
1630,1593834873155817472,i’m thinkin Juul is a cute name for a baby,MirandaStn,2022-11-19 05:13:40+00:00,,,
1631,1593834704956162049,Good thing I brought my vape,NeoYokio_ebooks,2022-11-19 05:13:00+00:00,,,
1632,1593834452639043584,I love the taste of mango juul pods so god damn much.,thehatspeak,2022-11-19 05:12:00+00:00,,,
1633,1593834220962476033,This generation is gonna die young and age so badly bc of the insane consumption of nicotine w vapes like I ain’t forgot when ppl would go thru one vape in a few days 😭,munaverse,2022-11-19 05:11:04+00:00,,,
1634,1593834106244456448,I really loooove Juul Encarnacion,volleyspecs,2022-11-19 05:10:37+00:00,,,
1635,1593833963977441281,"People probably think I constantly go to the bathroom to hit my vape, but actually I just need a break from everyone. The anxiety just be sky rocketing bruh.",taylor_dlc,2022-11-19 05:10:03+00:00,,,
1636,1593833484744855552,Still aint never smoked a vape iml,GeneJune_,2022-11-19 05:08:09+00:00,,,
1637,1593833482563637249,"#thc #cbdhealth 
#cannabiscommunity
 Jack Herer Disposable Vape Pen Delta-8 THC  is here. Now that Delta-8 THC is the most dominant cannabinoid on the planet. Why haven’t you joined in the fun? And now, with Chill Plus Delta-8 THC https://t.co/nnbLUzomkU #hemp #cbd #cbdoil https://t.co/PO8OfEs9q4",cbdhealthbasket,2022-11-19 05:08:08+00:00,,,
1638,1593833381573414912,Alabama girl who died of fentanyl overdose told parents vapes laced with drug were in her school https://t.co/Wv5QDA72e0,papawolfman01,2022-11-19 05:07:44+00:00,,,
1639,1593833338078306305,wow bro this quality. it’s crazy. and it’s so strong too omg it’s so smoothhh and the taste is raw as fuck 😭😭 ok maybe there’s such a thing as being TOO GOOD at vaping because holy fuck I’m high again already 😭😭,Kurotsuchi25,2022-11-19 05:07:34+00:00,,,
1640,1593833238002565121,"(bot) sex, vape, love and trust",Shozzie_ebooks,2022-11-19 05:07:10+00:00,,,
1641,1593833197833445377,I understand vaping now tbh i used to make fun of y’all but it’s been the best thing for getting off harder drugs,heavensdoII,2022-11-19 05:07:01+00:00,,,
1642,1593833040438259713,"Don't think the youths are voting
Polling centers didn't smell of vape flavours",briantanlive,2022-11-19 05:06:23+00:00,,,
1643,1593832784828968961,i have dropped my vape in the toilet so many times i am actually terrified of bringing it with me to a bathroom now,spoookiequeen,2022-11-19 05:05:22+00:00,,,
1644,1593832770563776512,"Hatori: Pass the Juul
Me: Shimazaki stole it
Shimazaki, making smoke rings with his eyes:",minegishibot_,2022-11-19 05:05:19+00:00,,,
1645,1593832768705679361,Storz and Bickel HQ Tour in #Germany Vlog https://t.co/gtXf1KiXkZ #austin #cannabis #cbd #dispensary #edibles #hemp #high #highquality #products #texas #topicals #vapes,hempnewsonline,2022-11-19 05:05:18+00:00,,,
1646,1593832571040940032,FCMS students participated in an anti-vaping/safety convocation Friday.  Thank you @SweetwaterSound for sponsoring this program! https://t.co/SbuNOixYy8,ChrisBundy_FC,2022-11-19 05:04:31+00:00,,,
1647,1593832477176565760,"Taking high: apparently what I say when I mean getting high in any possible way, whether it's vaping, shotgunning, smoking, eating, whatever",kitsunecommune,2022-11-19 05:04:09+00:00,,,
1648,1593832421517971457,holy fuck this new vape is the shit wtf WTF,Kurotsuchi25,2022-11-19 05:03:55+00:00,,,
1649,1593832374663630848,"When you eat the 100mg gummy, smoke the joints and finish with a weed vape before you come back in because it's getting a little too cold and your space heater isn't cutting it - the wall of heat makes me almost want to run back outside holy phook. #canadianwinter #preferthecold",Betty_Burlesque,2022-11-19 05:03:44+00:00,,,
1650,1593832197559132160,she vaping in my room dat shit lit up like a glow lamp,theamberkelis,2022-11-19 05:03:02+00:00,,,
1651,1593832183344545792,Hi we are charging our phones next to Caravaggio waiting for some live-streamer named Matt proctor to arrive Espresso martini in hand Wishing we could smoke inside Then this would be a Salon but dw we vaped,quinoa_cowboy,2022-11-19 05:02:59+00:00,,,
1652,1593831851491471367,Ok no but my vape died tonight so I gotta go get a new one tomorrow and I’m very fucking upset 😩😩😩😭😭😭,leahpearson9494,2022-11-19 05:01:40+00:00,,,
1653,1593831400050130944,bffr who’s vape is this? https://t.co/EKamsgJSg9,_sammiedani,2022-11-19 04:59:52+00:00,,,
1654,1593831316297900032,needa hit my vape,7yearsbaek,2022-11-19 04:59:32+00:00,,,
1655,1593831207669846017,reintroducing the idea of a vicks vape i cannot stand being sick,rabidwebkinz,2022-11-19 04:59:06+00:00,,,
1656,1593831159414534144,A lil drunk and can’t find my vape. RIP,megdiegs_,2022-11-19 04:58:55+00:00,,,
1657,1593831018200694784,"ur too pretty to be vaping love, put that thing down",VonnyBalboa,2022-11-19 04:58:21+00:00,,,
1658,1593830839627948032,Oatmeal flavored vape,treympg,2022-11-19 04:57:38+00:00,,,
1659,1593830786813132801,I'm vaping so hard rn,BanzaiTakesAnal,2022-11-19 04:57:26+00:00,,,
1660,1593829954789281792,Not square washing my vape in the washer 🥲,danigga_,2022-11-19 04:54:07+00:00,,,
1661,1593829851630297090,They sneak the vaccine in ur bubble gum flavored vape thumb-drive,MintChipMusic,2022-11-19 04:53:43+00:00,,,
1662,1593829844621705219,if i was a cop i would vape CBD and keep it real with everyone,rapeswisher,2022-11-19 04:53:41+00:00,,,
1663,1593829806520631301,Lost Vape Centaurus M200 Kit Giveaway https://t.co/BLNVe5VSCr,chrissiedixon21,2022-11-19 04:53:32+00:00,,,
1664,1593829784110473217,Teaching my cat to vape because he’ll look so cool,RPtheSheriff,2022-11-19 04:53:27+00:00,,,
1665,1593829719727919106,"""Girl built like a vape pen"" 😭😭😭 https://t.co/RSz5XUFRUl",hiatuskariuki,2022-11-19 04:53:11+00:00,,,
1666,1593829671434653698,"🔥24% OFF🔥
£30.99 for Vaporesso GEN 200 &amp; 80 S Vape Mode Kit

👉https://t.co/HJ3IzPhoyx

#vaporesso #vaporessogen200 #vaporessoh80s #vapedeal #vaping #podsystem #vapecommunity #vapelife #vapinglover #vapeshop #vapestore #vapelifestyle ⁣⁣#vapephoto #vapepics ⁣⁣#alldayvape https://t.co/jB5yKOVf5f",myvapereview,2022-11-19 04:53:00+00:00,,,
1667,1593829649263792128,"I've visited 4 or 5 towns recently, and noticed they all have barber shops, phone repair shops and vape shops recently opened,  run by foreigners.  What's going on?",Southwalesaudit,2022-11-19 04:52:54+00:00,,,
1668,1593829573908901889,This girl ik used to hide my vape before we would go somewhere. I knew from jump but Idk if she was trynna be funny or not. I wanted to stop anyway so I never said anything. Now I don’t smoke anything so 🤷🏾‍♀️,AyeeitsGinaa,2022-11-19 04:52:36+00:00,,,
1669,1593829411190546432,"GenZ will smoke toxic cherry vapes, drink 6 nights a week, and eat a strangers ass on the first date, but they think that grass fed beef is too unhealthy to eat. 🤦‍♂️🤦‍♂️🤡🤡",Panz3r55,2022-11-19 04:51:58+00:00,,,
1670,1593829193044791296,Where is my vape?,beckathecreator,2022-11-19 04:51:06+00:00,,,
1671,1593829125340397568,i got a new vape,chasescookies,2022-11-19 04:50:50+00:00,,,
1672,1593828308260737026,My friend is so high that he just tried to light his cigarette with his vape.,orangecooper23,2022-11-19 04:47:35+00:00,,,
1673,1593828266476986372,If my child vaped id drive his ass to the nearest gas station and get him 3 cartons of Marlboro reds,MintChipMusic,2022-11-19 04:47:25+00:00,,,
1674,1593828139960094722,You're never to old to switch to a less harmful alternative. #vape #australia https://t.co/UvBg3CE62m,VaporStateAU,2022-11-19 04:46:55+00:00,,,
1675,1593827753333329921,Haven’t vaped in 48 hours,Sashassak,2022-11-19 04:45:22+00:00,,,
1676,1593827610345308160,"You can't vape in Qatar, but smoking, flogging, and stoning is all good.",stu_dowling,2022-11-19 04:44:48+00:00,,,
1677,1593827446528294913,I let this man use my charger block to charge his vape for two minutes  and he just told me I’m a good person and I shouldn’t let anyone tell me otherwise 💀💀💀💀,wymhak33m,2022-11-19 04:44:09+00:00,,,
1678,1593827112292864000,"VAPOREVER O-POSITIVE E-LIQUID captures the vibrantly colourful flavours of Blood Oranges plus hints of Lemon.  #vape #bloodorange

More info here
https://t.co/Uide7xoGW6 https://t.co/39oM49HhzV",VaporStateAU,2022-11-19 04:42:50+00:00,,,
1679,1593827094995390465,I’m a little sleepy tonight but tomorrow im going death con 3 on VAPERS,MintChipMusic,2022-11-19 04:42:45+00:00,,,
1680,1593826866552528896,"Would you like to get this t-shirt: Rat And Cigarette Vaping Sucks Smoke A Cig Like A Man T-Shirt

You can get all the designs and t-shirts by buying them here: https://t.co/YP6RvzpULe https://t.co/3v7Q5KyKt4",digprintcustom,2022-11-19 04:41:51+00:00,,,
1681,1593826669349011459,My vape pen be hitting bruh 😮‍💨,Chantanathedon,2022-11-19 04:41:04+00:00,,,
1682,1593826594920988672,"I feel like we’re gonna find out how bad vapes are for you, and we’re gonna find out through @tanamongeau they gone get to her first.",miltonyrod,2022-11-19 04:40:46+00:00,,,
1683,1593826280059047936,vape nation,kiawe_bot,2022-11-19 04:39:31+00:00,,,
1684,1593826170327691265,"...im gunna buy a vape 😧 
tbh disgusted in myself but anything to help my cravings !!",big_toddys,2022-11-19 04:39:05+00:00,,,
1685,1593825920124682240,When i accidentally put soap in my vape: https://t.co/zWIV4oa0fx,Mollybdenym,2022-11-19 04:38:05+00:00,,,
1686,1593825855314214912,"""but vaping can irreversibly damage yo-"" GOOD. I hope it fucking kills me.",mvtherfvcking,2022-11-19 04:37:50+00:00,,,
1687,1593825751044063233,candice why is your vape pen on the dinner table,flintebooks,2022-11-19 04:37:25+00:00,,,
1688,1593825393164701696,thinking abt the brand new vape I lost at the harrys house popup… @Harry_Styles ur welcome,notdispleased,2022-11-19 04:36:00+00:00,,,
1689,1593825293353246725,Determining if a DJ is good or not based on how much their set makes me want to vape instead of dance,lucidbreakfast,2022-11-19 04:35:36+00:00,,,
1690,1593825231365357568,"Vapes are twice as good as NRT at helping smokers quit, landmark review concludes https://t.co/zuwCQmvEXX",PophaleSamarth,2022-11-19 04:35:21+00:00,,,
1691,1593825183294541825,"Having pain swallowing bc of the flu and vaping is A combo, good or bad? Idk",TH3D1ST0RT10N,2022-11-19 04:35:10+00:00,,,
1692,1593825080014000129,"why do people at school ask me if I vape n shit

BITCH I HAVE ASTHMA. MY LUNGS ARE S H I T T Y",Frey0Mai,2022-11-19 04:34:45+00:00,,,
1693,1593824923717636097,"Breath of 420 vaping
69th form

Joe",tanjiro_auto,2022-11-19 04:34:08+00:00,,,
1694,1593824870390845441,FOUND MY DADS GIRLFRIENDS VAPE SHE DIDNT LIKE THE TASTE OF AND YOINKED IT LMAO,acidcaIs,2022-11-19 04:33:55+00:00,,,
1695,1593824780456804352,The fact that Doja sprayed windex on her vapes so she wouldn’t relapse 🥹🌱🌱 she’s succeeding at quitting 🥲,KaylaOnShine,2022-11-19 04:33:34+00:00,,,
1696,1593824751033909248,Lost Vape Centaurus M200 Kit Giveaway https://t.co/2HR7q6RME8,TaylorKittenpur,2022-11-19 04:33:27+00:00,,,
1697,1593824707497070592,"Don’t vape y’all, these nicotine withdrawals are beating my ass rn",solinotsoil,2022-11-19 04:33:16+00:00,,,
1698,1593824614878257152,been avoiding the dentist due to vaping,weknowursweet,2022-11-19 04:32:54+00:00,,,
1699,1593824381645594624,not me missing breaking the law to go vape in the bathroom in secret,snobison,2022-11-19 04:31:59+00:00,,,
1700,1593824324804288515,4.30am and i’m sat outside smoking my vape because i cannot for the LIFE of me go back to sleep 😒 sick of this like,courtneyangel_,2022-11-19 04:31:45+00:00,,,
1701,1593824324632588289,yo you mind if i hit that? *spits milk into your vape*,meowkuins,2022-11-19 04:31:45+00:00,,,
1702,1593824148324769793,forgot my dab in the dorm and my vape's burnt. life is hell,shartandfart,2022-11-19 04:31:03+00:00,,,
1703,1593824055588966401,Vape died so imma kms,PlayboiButtSmel,2022-11-19 04:30:41+00:00,,,
1704,1593823916895895553,Don’t hit it be with it,Dont_Vape_Bot,2022-11-19 04:30:08+00:00,,,
1705,1593823850940182528,I quit vaping at the beginning of the year cold turkey and omgggg I've been craving it so bad lately fml,that0nekidd_joe,2022-11-19 04:29:52+00:00,,,
1706,1593823791897104385,Smoking two vapes at once and almost dying from the niccy rush is excellent,AugustTheElrinn,2022-11-19 04:29:38+00:00,,,
1707,1593823598174961664,"Childe's character trial is just him and Kaeya...mhy, pls at least put him in vape and in a bigger team so people can work around the E cooldown 😭😭😭",sailor_suits,2022-11-19 04:28:52+00:00,,,
1708,1593823490104299525,Vaping is now no more 🙏🙌,hugowater2,2022-11-19 04:28:26+00:00,,,
1709,1593823313138253824,day 4 no vape 🤞🏻,lesbrrry,2022-11-19 04:27:44+00:00,,,
1710,1593823278698668032,"Journey of vaping: current vape mfr is discontinuing all cartridges, replacing with a newer model, &amp; I can't buy cartridges anywhere except their website, which is broken.

Took the plunge &amp; bought an AEQ refillable device 2wks ago.

Device leaks. 🙃",jamiehowarth0,2022-11-19 04:27:36+00:00,,,
