,TweetID,TweetContent,TweeterUsername,TweetDatetime,TweetLongitude,TweetLatitude,TweetPlace
1156,1593941477318598657,"Vaping proven to be the best way to quit smoking, media look the other way https://t.co/wqe2vpyLAh via @cjsnowdon",amendlocke,2022-11-19 12:17:16+00:00,,,
1157,1593941460667113472,im all under the bed looking in Moni toy box all kind of shit looking for my vape just for him to be sleep on it 😒😂,x_diandria,2022-11-19 12:17:12+00:00,,,
1158,1593941413896474624,my vape is dead i wish i was dead,spitmouthgrl,2022-11-19 12:17:01+00:00,,,
1159,1593941331918848003,"Marijuana  SMOKER DREAM COME TRUE  a
440+ Items to choose from.
HYBRID PRE ROLLS (7 PACK)
BLACK GAS – AAAA+
BOOST CBD VAPE CARTRIDGES – CHARLOTTE’S WEB
DOOBIE SNACKS – 180MG THC HARD CANDY 

https://t.co/yGY8RD0c4O",MaskeDierk,2022-11-19 12:16:42+00:00,,,
1160,1593940958025904128,I was covering a shift yesterday and my vape fell in the toilet. This is what happens to me when I do nice shit. 😪🥲,notmeghand,2022-11-19 12:15:13+00:00,,,
1161,1593940483029536768,I have home monsters and work monsters at work I simply don't care about the flavour but at home only my fav flavour bc the mixed taste of that specific one and my vape is heaven. I think I'm fine personally,seolarjoong,2022-11-19 12:13:19+00:00,,,
1162,1593939129435181056,just bought 4 vapes LMFAO,smmrtfem,2022-11-19 12:07:57+00:00,,,
1163,1593939099710554113,quit vape :&lt;,ranielbltzr_,2022-11-19 12:07:49+00:00,,,
1164,1593938990335410177,Vape carts truly ruined the game tbh $60-100 a g for distillate LMFAO then people complain they don’t feel anything like they aren’t inhaling non diverse THC-A Isolate like yup there’s one whole cannabinoid in there!,CornMemory,2022-11-19 12:07:23+00:00,,,
1165,1593938906348765185,no more vape just weedies,ayekiii,2022-11-19 12:07:03+00:00,,,
1166,1593938655303041024,Why would you play an MMO if you don't want to trade vape secrets?,monfacbot,2022-11-19 12:06:04+00:00,,,
1167,1593938404433174529,if my vape is dead https://t.co/3og2H2UAE1,hanbutvintage,2022-11-19 12:05:04+00:00,,,
1168,1593937428284379137,"Thankfully, I’ve stopped smoking for over a year now. Longest time since 2 previous 1 year efforts to quit. 

I vape tobacco. This isn’t smoking, as nothing is burning, only heating for the intake of the nicotine. I’m still an addict, but not to smoking, thank God.",KimaClementine,2022-11-19 12:01:11+00:00,,,
1169,1593937414430818305,i rly want to buy my new vape but i think i want to inbox it more than i want to buy it,amanitic,2022-11-19 12:01:08+00:00,,,
1170,1593937266245652481,Why vape when you can sleep,Dont_Vape_Bot,2022-11-19 12:00:32+00:00,,,
1171,1593937213049384961,"The BEAR+aspire R1 3500 Puff!
🔞
This Product Contains Nicotine
💨
Get yours in local Eco vape Stores or purchase them online through our website!
https://t.co/7Ha0B2r65x
🎩
#vapedevice #disposable #blue #night #nightlife #nicotine https://t.co/0tygMuwkEJ",ecovapeuk,2022-11-19 12:00:20+00:00,,,
1172,1593937173987860483,"🌈🌈
🆕☕️Having a good time with #hellvapeeirkit in light pink~💗

🦁❗️20% OFF Sitewide with Coupon Code: BFS20
✔️Built-in 800mAh Battery
✔️2.5ml Pod Capacity
🙋7 Colors Available Now💚
..
💃Get Yours:👇
https://t.co/N3pxI7UCjY
&gt;
#hellvape #eirpodkit #hellvapeeirpod #vape https://t.co/m0CzsZ9ZsS",HealthCabin,2022-11-19 12:00:10+00:00,,,
1173,1593937152488136706,"Such a Grape Vape 🍇

https://t.co/bCp6vq7Sha
-
#SMOK #smoktech #smokvape #vape #novobar https://t.co/hDGKBgfWPi",SmokTechUK,2022-11-19 12:00:05+00:00,,,
1174,1593936830772092928,"Beef vape!
Beef vape,  final answer.",GMMQuotesBot,2022-11-19 11:58:49+00:00,,,
1175,1593936494829371393,"had this proper dry cough for about 3 weeks now and either it’s cause i’ve lunged so many bifters on the nights out i’ve been on, ive got popcorn lung from hurting the odd vape or i’m dying of cancer and this is my first symptom",dstar94x,2022-11-19 11:57:28+00:00,,,
1176,1593936253610651648,Smoking is fucking cool. Shame anyone who vapes,FilthyFingers42,2022-11-19 11:56:31+00:00,,,
1177,1593936006784638977,"As a parent, don't teach your children to get a reward for doing something. 

Like danish family psychologist Jesper Juul said:

""Rewarding desired behavior is an abuse of power.""",nilsgramckau,2022-11-19 11:55:32+00:00,,,
1178,1593935788571787264,"me after i buy my ""last vape"" and it dies https://t.co/4NVFFVVW7A",V4NHALEN_,2022-11-19 11:54:40+00:00,,,
1179,1593935732074225666,i actual wander around the house at night with my vape like a victorian ghost with a candle,sarahmaloneyxx,2022-11-19 11:54:27+00:00,,,
1180,1593935336387715072,Fuck ur vape,teethforsale,2022-11-19 11:52:52+00:00,,,
1181,1593935177255886850,I bought KFC and forgot it ko Uncle fouzi in town as I was paying for flavour ya Vape. I literally left it on the counter. I'm only remembering it now that I'm home😭😭😒,temogo_ZA,2022-11-19 11:52:14+00:00,,,
1182,1593935100734894080,someone send me vape money before i k*ll myself,winemom300,2022-11-19 11:51:56+00:00,,,
1183,1593934931050303490,Downed a can of Monster whilst chuffing on my Elfbull vape. The vibes are unhinged this morn x,courtaknee_,2022-11-19 11:51:16+00:00,,,
1184,1593934901484539905,Vaping fat (phat) clouds rn,growmorebones,2022-11-19 11:51:09+00:00,,,
1185,1593934745888751617,"BASED!! I don’t drink alcohol, I don’t smoke, I don’t do drugs, I don’t vape, etc. I don’t even drink soda or coffee.",threalrosemulet,2022-11-19 11:50:31+00:00,,,
1186,1593934520583159808,I quit vaping a few months ago and not a day goes by that I dont miss that evil little fruit stick,hotsaucecowgirl,2022-11-19 11:49:38+00:00,,,
1187,1593934255901487104,My vape died just as i got to mows....gonna be a cranky night mb in advance,ulzzang_pistol,2022-11-19 11:48:35+00:00,,,
1188,1593934103241539584,Just woke myself out of a dream because my vape died. Currently vaping and pondering my addiction.,AshleyLolaWhite,2022-11-19 11:47:58+00:00,,,
1189,1593933355887771648,"this strawberry ice cream crystal bar actually tastes disgusting ewewew. why would somebody look at strawberry ice cream and go “hm, good vape flavour, yum yum” NO. cancelled.",haydenkirkx,2022-11-19 11:45:00+00:00,,,
1190,1593933245196144640,"Woomi vape's prize-winning competition during the 2022 FIFA World Cup is starting! 🔥🎉 #FIFAWorldCup to begin 💯

Welcome everyone to actively participate
Big suprise for you 🎁🎁 
Expecting~😍
#vape #worldcup #woomivape #vapemeet #vaporwave  #disposable #Qatar2022 #football https://t.co/nRCDcfsbjM",woomivape1,2022-11-19 11:44:34+00:00,,,
1191,1593932826105315329,‘throw that vape away and pop a strepsil if u wanna see the light of a new dawn fucker’,sukaina_zehra17,2022-11-19 11:42:54+00:00,66.654132,23.703272,"Sindh, Pakistan"
1192,1593932724833845248,Be a real man and get addicted to smoking cigarettes instead of vaping PUSSY,VlNDACAT,2022-11-19 11:42:30+00:00,,,
1193,1593932705153970176,The only downside to adopting Frisk is that I can no longer vape inside the house (snail flavor),ToriGoatBot,2022-11-19 11:42:25+00:00,,,
1194,1593932604931117056,"Ecigclick Vape Awards Giveaway 2022 – 20 prizes to win from @VOOPOO_ZOVOO, @ZeusJuiceUK , https://t.co/NK18BqIRYT, @Innokintech , @yihisxmini, @vape_lost , @feelmtech,  @OXVAOfficial and @vapeclub ! Enter here... https://t.co/wUMPwMvLBN #Win #EcigclickAwards #Vape #Ecigclick https://t.co/CjmnOK0B22",EcigClick,2022-11-19 11:42:01+00:00,,,
1195,1593931675343327232,Just posted a photo https://t.co/lLnVxVD6zt,vape_z0ne_uk,2022-11-19 11:38:19+00:00,,,
1196,1593931251437785088,"With our website incoming, today is being spent getting our first round of #blogposts planned and written - what info would you like to see? Are there any #vaping/#HeatedTobacco related questions that you struggle to find the answers to?

Let us know!!",Scarlett_Vapes,2022-11-19 11:36:38+00:00,,,
1197,1593930947472130048,"MECHAX features first-class leak-resistant structure. 😍
So you don't have to worry about oil leaking if you use MECHAX.💥
Are you ready to try MECHAX?

https://t.co/Oh0hmNUBnu

#VaptexMechax #newrelease #pod #vapepen #mtl #vapelife #vapefam #ecigs #vapers #vapebar https://t.co/Gic5aLcn78",VaptexOfficial,2022-11-19 11:35:26+00:00,,,
1198,1593930197983956992,I quit vaping and I’ve never been more proud 🥰,sanjanak259,2022-11-19 11:32:27+00:00,,,
1199,1593929981582770177,Big Conversation findings told us that there needs to be more education on substances and how vaping is an epidemic amongst young people #HantsYC2022 https://t.co/N5hBtkXai0,HantsYC,2022-11-19 11:31:36+00:00,,,
1200,1593929791601872896,"""You may wonder what the anti-vaping groups have to say about all this. I did, too, so I reached out by email to the Campaign for Tobacco-Free Kids, Truth Initiative, PAVE and Vital Strategies. None responded"" https://t.co/DBPhyQKjw7",NannyFreeState,2022-11-19 11:30:50+00:00,,,
1201,1593929729475633152,Clara and I searched her whole district No vape store to be found bestie gets them imported or something,confeggi_davis,2022-11-19 11:30:35+00:00,,,
1202,1593929609547902977,"Disposable CBD vapes are a delicious and convenient way of taking your CBD. The GO CBD Puff Bar range is some of the best on the market 🙌

Available in 4 great flavours.

👀 To see the full range click here 👉 https://t.co/4rcJKq7qO4

#Vape #CBD #CBDDisposable https://t.co/bSPTBnQvb8",EvapoHub,2022-11-19 11:30:07+00:00,,,
1203,1593929592330489863,"In a recent national report, findings showed vape and e-cigarette use among U.S. youth remains high, nearly 2.5 million middle and high school students, and the Kendall County area is no exception. https://t.co/mEEoKEBRHy",KCRNewspapers,2022-11-19 11:30:03+00:00,,,
1204,1593929496960319494,The guy at my local vape store can get all of it,alutas_theory,2022-11-19 11:29:40+00:00,,,
1205,1593929442673426432,i wish i still smoked or like at least started tp vape because that shit would keep my brain busy,flowertaemins,2022-11-19 11:29:27+00:00,,,
1206,1593929340005552129,the worst part of having teenage siblings is not their mean phase but is instead witnessing them vape,mothfuz,2022-11-19 11:29:03+00:00,,,
1207,1593928695583907842,"vapes might be the cringiest thing this generation brought, and some are showing off with it😂",ibet0,2022-11-19 11:26:29+00:00,,,
1208,1593928683357552640,"I think we should let her vape. Give her the freedom to vape. All living things deserve freedom, Sliver.",snapcubesonic,2022-11-19 11:26:26+00:00,,,
1209,1593928520606031876,Gone make a effort to quit vaping for good this time.,PupRex8,2022-11-19 11:25:47+00:00,,,
1210,1593928454294028290,Jade has vape awareness,duuuudeno,2022-11-19 11:25:31+00:00,,,
1211,1593928161900736518,a couple is staring at us as we passionately rap along to baby by justin bieber in this restaurant. to be fair it might be bc kye is wearing a bintang singlet and is gripping a vape but,dmumtbz,2022-11-19 11:24:22+00:00,,,
1212,1593927850255699971,how has this vape lasted so long DIE ALREADY SO I CAN GET A NEW FLAVOR DAMN,starzdior,2022-11-19 11:23:07+00:00,,,
1213,1593927119540584448,"Woomi vape's prize-winning competition during the 2022 FIFA World Cup is starting! 🔥🔥🔥🎉🎉🎉

Welcome everyone to actively participate, the mysterious prize🎁🎁🎁 is waiting for you~😍😍😍 https://t.co/VzCS4Jdtgj",Sharon82421717,2022-11-19 11:20:13+00:00,,,
1214,1593927110116212737,Everyday I add new conditions to my vaping it’s bad for me I fear,peachmouth,2022-11-19 11:20:11+00:00,,,
1215,1593926548767268867,Live Gold Vapes https://t.co/YDqPbqbyTL,SherleneSmith,2022-11-19 11:17:57+00:00,,,
1216,1593926495114002432,Just posted a photo https://t.co/24Otb0LC79,vape_z0ne_uk,2022-11-19 11:17:44+00:00,,,
1217,1593925882695106565,Water-Based Vaping Breakthrough Unveiled At UKVIA Forum https://t.co/Ubq3AG3KTC,entitydigitalco,2022-11-19 11:15:18+00:00,,,
1218,1593925874679566337,Water-Based Vaping Breakthrough Unveiled At UKVIA Forum https://t.co/TrBQMMNXOp,nurjeevangsr,2022-11-19 11:15:16+00:00,,,
1219,1593925869797576704,Water-Based Vaping Breakthrough Unveiled At UKVIA Forum https://t.co/MWMc19hq7K,thepkgofficial,2022-11-19 11:15:15+00:00,,,
1220,1593925761102118912,and vaping,waz6700,2022-11-19 11:14:49+00:00,,,
1221,1593925589836369920,Water-Based Vaping Breakthrough Unveiled At UKVIA Forum https://t.co/BPDyyTwp1i #PRNewsWire #PRNewswire https://t.co/J78K7wDipQ,Stock_Market_Pr,2022-11-19 11:14:08+00:00,,,
1222,1593925275544420354,"New @ecigclick Vape Awards Giveaway Now Live! -  Enter now for a chance to win prizes from - @zeusjuiceuk - @innokintech - VOOPOO - @vapeclub - @uk_vapour - https://t.co/KMRlWYVQXZ

#ecigclick #vapeawards #vapegiveaway #vapefam #eliquid #vapelyfe #giveaway",UkAlexLondon,2022-11-19 11:12:54+00:00,,,
1223,1593924864611475456,Did I drive all the way back to work for my vape? Yes I did. Am I ashamed? A little.,omfgitselba,2022-11-19 11:11:16+00:00,-119.93251,36.648905,"Fresno, CA"
1224,1593924804499116032,took a group photo all my friends puffing on some vapes n i’m there standing wit clean lungs,JUNAIDBRUH,2022-11-19 11:11:01+00:00,,,
1225,1593924775646490624,"""Higher prevalence of alternative product use among young adults implies a turning point. Because of addictive potential, young adults can be expected to maintain their use into middle and older adulthood""
https://t.co/wLvdnasw7B
#vaping https://t.co/bS7VHDI3Qy",gbiondizoccai,2022-11-19 11:10:54+00:00,,,
1226,1593924753622200323,should i start hiding my friend's vape. Be real wtih me,ruibait,2022-11-19 11:10:49+00:00,,,
1227,1593924625351712769,Just posted a photo https://t.co/T9WDg88emn,vape_z0ne_uk,2022-11-19 11:10:19+00:00,,,
1228,1593924238221901826,feel like my cig/vape(?) era is coming back,verdant_space,2022-11-19 11:08:46+00:00,,,
1229,1593924222065123328,"For your safety and comfort, this station operates a no vaping policy. Have a nice day.",traindroid_se,2022-11-19 11:08:42+00:00,,,
1230,1593924030108770306,"If 3 hits on a vape is equal in nicotine to a cigarette
...
I was legit doing like 1600 cigarettes worth in nic a week",respirrave,2022-11-19 11:07:57+00:00,,,
1231,1593924006910070784,That nic rush from a fresh vape hits,Notorious_VIII,2022-11-19 11:07:51+00:00,,,
1232,1593923952560128000,the average banteer person consumes 87 gallons of Vape juice in their sleep each year,mallowbot,2022-11-19 11:07:38+00:00,,,
1233,1593923430361235457,Teen Vaping Stats - How the CDC is Cooking the Books for Clickbait Headlines https://t.co/3b7w8AeUVx https://t.co/1HbRynLzeS,ArtSupplyDC,2022-11-19 11:05:34+00:00,,,
1234,1593923367702519808,my friend keeps talking abt how she wants to buy a vape girl ur 13 u don’t need to rely on flavoured air wait until ur older,svngminhat,2022-11-19 11:05:19+00:00,,,
1235,1593923098843447299,I dead just vomited blood from dis vape,fuckurdesigner,2022-11-19 11:04:15+00:00,,,
1236,1593922915514257408,Wake up vape up,jadewesttwt,2022-11-19 11:03:31+00:00,,,
1237,1593922390496518146,Stock market inclines as Florida man vapes semen.,FinHeadBot,2022-11-19 11:01:26+00:00,,,
1238,1593922339602931716,"Best Vape Pens - There's a vape pen for whatever and however you want to vape! 

https://t.co/prY39Jqdf5",Vaping360,2022-11-19 11:01:14+00:00,,,
1239,1593922130516709378,Teen Vaping Stats - How the CDC is Cooking the Books for Clickbait Headlines https://t.co/AcLqDrWijA,GreenCulturED,2022-11-19 11:00:24+00:00,,,
1240,1593922031673827329,"Anything is good if it's made of chocolate; Especially if it's made from Chocolaterie Bernard Callebaut® products. 🍫

#decibel #shoplocal #generaladmission #wetaskiwin #budxpress #madeinalberta #vapes #cartridges #new #instock #indica #sativa #hybrid #budxpressca #budxpress https://t.co/dmnZ3qX1DR",BudxpressCa,2022-11-19 11:00:00+00:00,,,
1241,1593922030163750913,Your reminder from @itsjustdj13 to clean your vape! 🧽 https://t.co/nEAdzmpn2o,GAMEONJUICE,2022-11-19 11:00:00+00:00,,,
1242,1593922003731615745,I don’t care how broke I am I’ll always have money for a vape,nicestorymate,2022-11-19 10:59:53+00:00,,,
1243,1593921949457035265,"Today's Setup

It's Saturday so it's a mech day &amp; I'm pulling out an oldie the Ruby 21 By Kenndy Vapor the classic American-made tube mod shame they are not around anymore ☹️

Let me know what you are running today in the comments below
#Vaping101 #vape #vapelife #mechday https://t.co/bIE0w67vMF",UKVaping101,2022-11-19 10:59:41+00:00,,,
1244,1593921853709770754,"You can significantly improve mum or dad's ""best by date"" by helping them seek truthful information about #smoking cessation using #nicotine #vapes this Christmas.

Millions have switched away from smoking - what a great family gift.

Safer is far better than the alternative. https://t.co/ThnWg6HEYd",VaperNt,2022-11-19 10:59:18+00:00,,,
1245,1593921779222958081,This just reminded of when someone was smoking a vape in the cinema last week..Like you couldn’t wait?,IamAxhlxi,2022-11-19 10:59:00+00:00,,,
1246,1593921778371334144,"How do you like them apples?

My series of #ELiquid reviews continues with DNA #Vapes Green Apple Ice:

https://t.co/lrTl6OjIDt",vapegeezer,2022-11-19 10:59:00+00:00,,,
1247,1593921566487846913,"This is absolutely stunning!! The #OXVA #XLIM is one of our best selling starter kits, may have to try and get some of these in too, it's so pretty!!",Scarlett_Vapes,2022-11-19 10:58:09+00:00,,,
1248,1593921532870287360,Water-Based Vaping Breakthrough Unveiled At UKVIA Forum https://t.co/3PSkMyJSX2,jimmys_post,2022-11-19 10:58:01+00:00,,,
1249,1593921513966964739,keep seeing these anti vape tweets after i just bought mine help i already felt bad give me a break !!!!!!!!,milfluvr369,2022-11-19 10:57:57+00:00,,,
1250,1593920815585792001,"We're looking at getting some new duel 18650 sub-ohm kits in store, what would you like to see us stock?",Scarlett_Vapes,2022-11-19 10:55:10+00:00,,,
1251,1593920403243950081,i wanna buy vapes or alc edtwt i need tips,hayley4hunger,2022-11-19 10:53:32+00:00,,,
1252,1593920130639069184,the blunt is question being a blueberry custard flavoured vape goes crazy,blueberriwine1,2022-11-19 10:52:27+00:00,,,
1253,1593919901621800961,"ONLINE STORE AND BLOG COMING SOON

With exclusive deals on premium brand Vapes, E-Liquids, Disposables and more.

Subscribe to updates and, for a limited time only, receive a 10% discount code to use online or in store - see our website for more details!

https://t.co/695eHVgws5",Scarlett_Vapes,2022-11-19 10:51:32+00:00,,,
1254,1593919838698835968,"#edibles #cbdoil 
#cannabiscommunity Green Crack Miami High Delta-8 THC Disposable Vape Pen. Bienvenido a Miami, the most beautiful city in the world where the people are hot. The weather is gorgeous, and the buzz from the delta 8 is https://t.co/MX26ucc876 #cbd #cannabis #hemp https://t.co/ZYuiZq0sUr",CBDSmokeShop,2022-11-19 10:51:17+00:00,,,
1255,1593919186568257537,"Don't Miss This Spectacular Offer!
Elf Bar 600 Disposable Vapes - All Flavours

3 for £10* While Stocks Last

https://t.co/NfEhzzcppa

*Plus, Standard Delivery £2.99 https://t.co/wDp7t7QL9s",VapeStoresShop,2022-11-19 10:48:42+00:00,,,
1256,1593918884255506432,I will judge you if you smoke or vape on the touch line of any sporting activity that involves children. I will also judge you if you shout at the kids and ref. It’s Saturday. Chill out. Grow up. Shut up. #football #saturday,jpmanwaring,2022-11-19 10:47:30+00:00,-1.95729593780907,50.5746064789388,"South East, England"
1257,1593918683461685248,"Continuing with ""SIZE MATTERS""... 5,500 puffs with the same great taste...

Fresh batch of Banana Ice Cream incoming... 🍌🍨

Let the flavor take you places!

#ivapepassport
#bananaicecream #bananaicecream🍌
#sizematters
#vape https://t.co/KWCymMHcv3",ivapepassport,2022-11-19 10:46:42+00:00,,,
1258,1593918603438563329,Football fans are being warned that vaping products are banned in Qatar and subject to a fine of $2700 or three months imprisonment. https://t.co/YM9qKVyrdN,NNAlliance,2022-11-19 10:46:23+00:00,,,
1259,1593918546324717569,"138 disposable vapes that @AylesburyWombl1 have picked up of the streets #Aylesbury in the last month

We have a problem @DefraGovUK 

@KeepBritainTidy @TalkRoberto @JustinDealey @YourBucksRadio @BucksCouncil @aylesburytc @aogdennewton @EricTorrington @KevinsDoherty1 https://t.co/kJyzT61uRC",Rubyjones1926,2022-11-19 10:46:09+00:00,,,
1260,1593918453613617154,Where the fuck is my juul,catvaIentinetwt,2022-11-19 10:45:47+00:00,,,
1261,1593917901085483008,"We loved meeting our girl @jadelaurice this summer at the @strawberriesandcreem festival!🍓

Since she came over to our infamous Riot bus, it would have been rude of us not to give her a sneak peek of the Riot Bar!

Rio Bar is out now in vape stores &amp; our online store! https://t.co/t9DXdZh5X9",Rioteliquid,2022-11-19 10:43:35+00:00,,,
1262,1593917859876720641,Water-Based Vaping Breakthrough Unveiled At UKVIA Forum https://t.co/pXf4c87Mc7,HeadlinesOT,2022-11-19 10:43:26+00:00,,,
1263,1593917813906804736,The Best ASMR Vape Unboxing Ever,TitlesASMR,2022-11-19 10:43:15+00:00,,,
1264,1593917778733502467,"#thc #cbdhealth 
#cannabiscommunity
 Delta-10 THC Disposable Vaping Pen Strawberry Cough. Our vape cartridges are responsibly formulated using only two ingredients. 100% all-natural premium cannabis oils and STRAIN SPECIFIC cannabis derived https://t.co/SH8wt2VnvE #cbd #cbdoil https://t.co/DNBeLkYafK",cbdhealthbasket,2022-11-19 10:43:06+00:00,,,
1265,1593917458607665153,"A REAL CONVOSATION 
“wanna try my vape”
“nah sorry”
“why? you allergic? 😨”
“im asthmatic ☠️”",s0upb1n,2022-11-19 10:41:50+00:00,,,
1266,1593917131912990721,"Buy Riot Squad 50ml Shortfill online in the UK. Riot Squad is flavor of E-Liquid. 50ml Vape Juice E-Liquid Bottle with 0mg Nicotine. Available in all Ranges Flavours.
https://t.co/0MhaqlQJMZ
#riotsquad #riotsquadvape #eliquid #disposablepods #wholesalesupplier #elux #eluxbar #elf https://t.co/SRSA1F5pxC",vapeukwholesale,2022-11-19 10:40:32+00:00,,,
1267,1593917061415448577,quitting vaping forreal this time wish me luck,sleeepsheeps,2022-11-19 10:40:15+00:00,,,
1268,1593917026753454086,"60W All-in-One VW Box Mod Vape Kit with Evolv DNA 60
Buy it on:
https://t.co/TbcKzhQ3c0 https://t.co/kekDdCX7f8",3FVape,2022-11-19 10:40:07+00:00,,,
1269,1593917025797427202,she vaping in my room that shit lit up like a glow lamp,kushyyfbabyy,2022-11-19 10:40:07+00:00,,,
1270,1593917016867426304,"Brookfield schools study draws ire for topics like vaping, ‘making love.' Why students take it https://t.co/wK1PTfoBsS",NewsTimes,2022-11-19 10:40:05+00:00,,,
1271,1593916794279952384,"Totally agree @Forge_Recycling. Funnily enough I mentioned recycling them in my article on the dark side of disposable #vapes:

https://t.co/6mic07TcNw",vapegeezer,2022-11-19 10:39:11+00:00,,,
1272,1593916650247852032,"WIN!!! &amp; GIVEAWAY ALERT - Win £25 to spend online on disposable vapes of your choice with @disposavapes

Entering couldn't be easier. All you need to do is: 

- Follow @disposavapes

- Like/retweet this post 

- Comment your favourite #vape flavour below",disposavapes,2022-11-19 10:38:37+00:00,,,
1273,1593915635469541377,"TW :  Vaping more effective for quitting smoking than patches or gum: The Cochrane Library review, led by the University of Oxford and funded by Cancer Research UK, has concluded there is “high-certainty evidence” that people are more likely to stop… https://t.co/S95wyGi8K2 https://t.co/vYzl8aLEQS",StigmabaseN,2022-11-19 10:34:35+00:00,,,
1274,1593915384453017600,Kids spend all day vaping does my head in,harvey71578123,2022-11-19 10:33:35+00:00,,,
1275,1593915272376643585,Where the fuck is my juul,sampucketttwt,2022-11-19 10:33:09+00:00,,,
1276,1593915216256897024,Fuck Vape,FuckEvery0SC,2022-11-19 10:32:55+00:00,,,
1277,1593915129011150848,"Hey dude, I vape. Yeah you know vaping? I do it. Yeah vaping, it's something I do. I don't smoke, I vape. Vaping dude, it's amazing. You sho",IuIu_ebooks,2022-11-19 10:32:34+00:00,,,
1278,1593915070672617473,I miss vaping 🥲,ogdionnee,2022-11-19 10:32:21+00:00,,,
1279,1593914950241484800,"Loading this bad boy up you can get all this from @thevapespot2018 https://t.co/jD1YwVK0JC 
#SaturdayMorning #theweekend #FYP #vape https://t.co/JTGhr2fW5l",Alreadymixedup,2022-11-19 10:31:52+00:00,-96.6396669,40.375437,"Iowa, USA"
1280,1593914916477337600,Water-Based Vaping Breakthrough Unveiled At UKVIA Forum,MasdelMedio,2022-11-19 10:31:44+00:00,,,
1281,1593914895845625856,"#CallToTender @Foroige: Research into #vaping among children &amp; young people in Sligo &amp; Leitrim (though surely this should be a national endeavour @HSELive @roinnslainte @publichealthie @GalwayHPRC?). DL: 12pm, Friday, 25 November 2022 https://t.co/MQQ0AsdJYD via @Activelink",MaritaHennessy,2022-11-19 10:31:39+00:00,,,
1282,1593914534334726144,Regulate vapes separately from combustible cigarettes - pro-vaping group https://t.co/RlTae3xX7b,NewsPrimeShare,2022-11-19 10:30:13+00:00,,,
1283,1593914322840854531,VAPE companies advertising on billboards is wild,zovuyomputablog,2022-11-19 10:29:22+00:00,,,
1284,1593913934582620160,Teen Vaping Stats - How the CDC is Cooking the Books for Clickbait Headlines https://t.co/R1eaFbP6KV,growbuddysupply,2022-11-19 10:27:50+00:00,,,
1285,1593913929889193984,One of my friends said they only vape cause it tastes good like nigga chew some chewing gum or something 💀,XAVIERISDOOMED,2022-11-19 10:27:49+00:00,,,
1286,1593913896389079040,why does my vape sometimes smell of bleach,nyyke__,2022-11-19 10:27:41+00:00,,,
