,TweetID,TweetContent,TweeterUsername,TweetDatetime
1956,1596742778867752961,Why would I go to therapy when I can vape in the bathroom,zampowboom,2022-11-27 05:48:39+00:00
1957,1596742732260999169,flying international with a weed vape up my ass,TheJohnRobles,2022-11-27 05:48:28+00:00
1958,1596742581257658369,Putting my juul on the charger while trying to be productive is my version of donut on a string treadmill,papamolly420,2022-11-27 05:47:52+00:00
1959,1596742514333343744,"This no vaping thing fucking sucks. I deadass just bit into a water bottle! 

A MTHR FCKN WATTTTTEEEERRRRR BOOTTTTTLEEEEEEE!!!!!",king_femme,2022-11-27 05:47:36+00:00
1960,1596742452039544833,shhhh don’t bother me i’m having enrichment time in my enclosure *vapes on the couch while eating cereal and watching rep tour on netflix*,fiiyerotigelaar,2022-11-27 05:47:21+00:00
1961,1596742378873794560,"Yocan STIX 2.0 
https://t.co/ZRuxY9ZTkh",black_stone_jp,2022-11-27 05:47:03+00:00
1962,1596742270287769600,Just saw a truth commercial targeting vapes for the first time!! Some high school/college aged woman missed the bus to her basketball game because she spent too much time looking for her vape in her locker. Did the coach not do a head count before leaving????,PhishatDicks,2022-11-27 05:46:37+00:00
1963,1596742268459061248,Mi vape me sabe a pollo gooood🥴,Perroni1_,2022-11-27 05:46:37+00:00
1964,1596742074363416576,someone should come to my house and donate a vape to me i cannot breath rn i need to breath some fruity flavored air before i suffocate,urmomsgirl,2022-11-27 05:45:51+00:00
1965,1596741988795092992,the average mallow person consumes 9 gallons of Vape juice in their sleep each year,mallowbot,2022-11-27 05:45:30+00:00
1966,1596741621210845184,fuck a vape i need a cigar w/ a whisky rn,urmomsgirl,2022-11-27 05:44:03+00:00
1967,1596741506416934912,Karma coming for blockberry ceo I love it https://t.co/2Tvnr17K28,snsd_enjoyer,2022-11-27 05:43:35+00:00
1968,1596741432361877504,"For your safety and comfort, this station operates a no vaping policy. All change please.",traindroid_se,2022-11-27 05:43:18+00:00
1969,1596741376754212865,"What would stop you vaping?
Watch this secret footage😱
https://t.co/4vd2iXOPpM
#Vaping #StopVaping #Smoke #Vape
#Herpes #Covid #Hepatitis #Cooties",TheScottishTra1,2022-11-27 05:43:04+00:00
1970,1596741359615954944,"Hey twitter, can we normalise dap ups before bed? https://t.co/Xa40xAZ6lm",urbancowwboy,2022-11-27 05:43:00+00:00
1971,1596740989796093952,Brussels to propose rise in cigarette taxes and first EU-wide vaping levy https://t.co/IYBzGfvI7Q - source/editor :,EUwatchers,2022-11-27 05:41:32+00:00
1972,1596740844174061570,you know it’s bad when someone pulls out a highlighter for their notes and you think it’s a vape,gaaneshaha,2022-11-27 05:40:57+00:00
1973,1596740630260043776,im silly im silly im silly im silly im silly im silly im silly im silly im silly im silly im silly im silly im silly im silly im silly im silly im silly im silly im silly im silly im silly im silly im silly im silly im silly im silly im silly im silly im silly im silly im silly,demoloving,2022-11-27 05:40:06+00:00
1974,1596739957648867330,7 days no vape.. I’m twitching,PBKee,2022-11-27 05:37:26+00:00
1975,1596739954323132418,I knew I was feening when I continued to hit my besties vape,myfavlibra,2022-11-27 05:37:25+00:00
1976,1596739836198924288,the 10 sec pre heat function on this vape ain’t no joke,riiocul,2022-11-27 05:36:57+00:00
1977,1596739542349795328,now that I don’t vape I b seein what y’all mean ab havin peach ice flavored air bein blown in ur face every 5 mins😭😂😂,shortaaaayyxo,2022-11-27 05:35:47+00:00
1978,1596739187897937921,My Lutheran babysitter played this song for me and my sister in 1996 lmfao https://t.co/RcHAeGBIcl,LitteraCanis,2022-11-27 05:34:23+00:00
1979,1596739132319223809,babe whats wrong you didnt ask for help when you lost your vape at all today,k177y0urs37f,2022-11-27 05:34:09+00:00
1980,1596739080720896000,"ROFL coz I just discovered from #bhabhi that my friends adventurous father who is clearly suspicious of his son's intentions is using his incense burner as vape behind his back
#basyahidindekhnabakitha",SamanaMadhuri,2022-11-27 05:33:57+00:00
1981,1596738992539840514,#cbd #cbdproducts #cbdoil #cbdlife #cbdhealth #cbdgummies #cbdpainrelief #cbdpaincream #cbdpain #cbdstress #cbdanxiety #cbdchill #cbdrelax #cbdrelief #cbdworks #cbdsale #cbdshop #hemp #hempproducts #hemplife #hempoil #hempcream #vape #vapelife #vapeshop  FREE SHIPPING no minimum https://t.co/0H8HoMZD3Z,cbd4pleasure,2022-11-27 05:33:36+00:00
1982,1596738460798267392,I haven't hit my vape in over 24 hours I'm SLAYING,tipsyguttergirl,2022-11-27 05:31:29+00:00
1983,1596738122171256832,Carnival cruiser fell overboard after he was repeatedly told to stop vaping by staff while drunk https://t.co/FGV2uKj85G,DailyMailUK,2022-11-27 05:30:08+00:00
1984,1596737884962271232,There’s no “vape” in team,karl_karl__karl,2022-11-27 05:29:12+00:00
1985,1596737736320454657,I want to smoke my vape in the hospital so bad 😂😂😂,Tahliban2x,2022-11-27 05:28:36+00:00
1986,1596737724186497024,I'm hitting tf outta this vape my nerve bad.,_jamiyajanae_,2022-11-27 05:28:34+00:00
1987,1596737526227554304,"40 hours ish awake, bit tipsy, sat in a wooden row boat in vrc staring up at the virtual stars with a beer in one hand, vape in the other while listening to the cranberries. Now that’s a fkn vibe.",DJ_Timboy,2022-11-27 05:27:46+00:00
1988,1596737477062320134,I'm vaping so hard rn,BanzaiTakesAnal,2022-11-27 05:27:35+00:00
1989,1596737395474698240,oh those platform uggs r hideous ppl r lying to yall,snsd_enjoyer,2022-11-27 05:27:15+00:00
1990,1596737352063336448,Carnival cruiser fell overboard after he was repeatedly told to stop vaping by staff while drunk https://t.co/JxIFivhYXk,Wunitednews,2022-11-27 05:27:05+00:00
1991,1596737243913195520,It’s the damn vaping https://t.co/Hmrmwg6OP2,wrldofda,2022-11-27 05:26:39+00:00
1992,1596737046361800704,Vaping is a 95% healthier alternative to 🚬 u. Why would people wanna ban it. It would cause 14000000 US vapers to decide to go back to 🚬 . We're talking about a very small,john_benenati,2022-11-27 05:25:52+00:00
1993,1596736697244717056,"i used to leave the building and take a smoke break like a normal person
but now i have to vape in a bathroom like im 15 years old or sum shit
fuck anti smoking and fuck the anti smoking propaganda",ban3446,2022-11-27 05:24:29+00:00
1994,1596736559130112002,"vaping is so lame, why is that the norm now, just completely destroying your lungs",rihodd,2022-11-27 05:23:56+00:00
1995,1596736490343911424,vape god + her matching ring with charlie + her cute lil phone case 🥺 https://t.co/gdhPXptR2G,fighternance,2022-11-27 05:23:39+00:00
1996,1596736425453449223,I need company rn…🥺,NokuWolf,2022-11-27 05:23:24+00:00
1997,1596736327038676993,like wtf and even then if i wanna smoke my vape i will. unless y’all want me to go outside,Wholetimeshawty,2022-11-27 05:23:00+00:00
1998,1596735872627793920,this is me every time @piscesencrisis vapes https://t.co/yregjDIvXr,puglights,2022-11-27 05:21:12+00:00
1999,1596735805841555456,andddd my vape is missing,uralrdeadtome,2022-11-27 05:20:56+00:00
2000,1596735450546589697,should I start vaping,eclipse_cals,2022-11-27 05:19:31+00:00
2001,1596735278278115328,im going to end u @BBC_blockberry https://t.co/hazoTkaOfU,jiwooerry,2022-11-27 05:18:50+00:00
2002,1596735121675079682,the smoking the vaping the drinking the FUCKING so many pregnant teenagers listen do what u want with your life but My Heavens https://t.co/kE7tE0P0FX,confs4yoongi,2022-11-27 05:18:13+00:00
2003,1596734884688855041,waiting 4 him 2 STOP BEING DISTRACTED N TEXT ME BACK N LET ME INSIDE BC I HAVE HIS VAPE AND I MISS HIM https://t.co/R1bhoBPe5P,et1zolam,2022-11-27 05:17:17+00:00
2004,1596734763473084416,Vape = therapy,kryzler_aranez,2022-11-27 05:16:48+00:00
2005,1596734695340838912,"Omg had my first hit off a vape in like 6 months today and I’m not ruined. It was a nice treat, but I can never go back to that haha",kingchandougie,2022-11-27 05:16:31+00:00
2006,1596734396651954177,"vaping is not for me at all idc if it’s THC , i’ll pass",_xxmichaelaa,2022-11-27 05:15:20+00:00
2007,1596734365278535680,My new goal is to quit vaping 🤧,cornaveli,2022-11-27 05:15:13+00:00
2008,1596734133681934337,They deadass took my fucking vape here,badmoonz_,2022-11-27 05:14:18+00:00
2009,1596734083085631488,Little late night chillin and vapin on #twitch! https://t.co/Xr43B4dteb #gaming #COD #WZ2 #Warzone2 #livestream #saturdays #SaturdaySocial #affiliate #prowrestler #prowrestling,VapeGodFletch,2022-11-27 05:14:05+00:00
2010,1596733807386058752,Check out my broadcast from my PlayStation 4! #PS4live (Call of Duty®: Modern Warfare II)  live at https://t.co/Q2XvqH3UMK,VapeGodFletch,2022-11-27 05:13:00+00:00
2011,1596733582688808964,Pretty positive I dropped my vape getting in my uber. I’m absolutely over this evening and would like to go home immediately,thayes47,2022-11-27 05:12:06+00:00
2012,1596733395916435456,"got four vapes in my vehicle right now 
how come i each time i pick nicotine back up i go harder than before",caleblanc145,2022-11-27 05:11:22+00:00
2013,1596733352090173440,☆ i need a vape https://t.co/EiAAk5pE2R,wantingdainty,2022-11-27 05:11:11+00:00
2014,1596733285006467079,She vaping in my room that shit lit up like a glo lamp,Hovshelper,2022-11-27 05:10:55+00:00
2015,1596733266492473344,Genuinely wondering why so many people are hooked onto vaping,ChEChxE,2022-11-27 05:10:51+00:00
2016,1596733116483534848,This cheap ass vape battery just broke. I shouldn’t be surprised. Ima buy a better one. F it. 🤷🏾‍♂️,MidnightExp17,2022-11-27 05:10:15+00:00
2017,1596733088285220865,"mobile smoke shop on the go‼️ insta: elsmokingjefe_ 

#smokeshop #headshop #smoke #vape #cbd #vapeshop #glass #cannabis #cannabiscommunity #weed #glassforsale #hookah #waterpipe #headyglass #bong #bongs #smokeshops #glassofig #glassart #vapelife #hightimes #dabs #glasspipes #hemp https://t.co/Njoji133WL",elsmokingjefe_,2022-11-27 05:10:08+00:00
2018,1596733009318723584,As of the 26th of November I am 3 months free of vaping nicotine 🤩,mdez350,2022-11-27 05:09:49+00:00
2019,1596732994508947456,Nicotine addicts when they forget the name for vapes https://t.co/SF2phgqgs0,diIfinator,2022-11-27 05:09:46+00:00
2020,1596732916469444608,Lost Vape Centaurus M200 Kit Giveaway https://t.co/BLNVe5EhdR,chrissiedixon21,2022-11-27 05:09:27+00:00
2021,1596732915626696704,the juice is loooose (i stole the vape),finfanjess,2022-11-27 05:09:27+00:00
2022,1596732815143751680,He was “flexing” vape in tuition yesterday. Who’s gonna tell him how dumb he looks?,istgmafo,2022-11-27 05:09:03+00:00
2023,1596732759300800513,Vandy Vape Pulse AIO Mini Kit Giveaway https://t.co/aDfuxMVN5j,chrissiedixon21,2022-11-27 05:08:50+00:00
2024,1596732565171621891,"Spent most of the day yesterday thinking I was dying of mouth cancer from years of cigs &amp; vaping, then I realized it was just burnt from trying to taste gravy out the pot on thanksgiving…",YungCeaux_,2022-11-27 05:08:04+00:00
2025,1596732500767698944,"okay, i need some opinions/advice

My mom vapes and occasionally i have to replace the atomizer because ya know it gets awful after a while. But *someone* in the house doesn't want me to do it, even though *that* person likes to procrastinate and be bitchy. They don't...",flleeppyy,2022-11-27 05:07:48+00:00
2026,1596732230805880832,"I think vapes are middle school shit
Grow up and get cancer the same way the rest of us smokers do",Jsalazad,2022-11-27 05:06:44+00:00
2027,1596732076128358400,Disposable vapes are probably ass for the environment,foodnetworkfan5,2022-11-27 05:06:07+00:00
2028,1596731930581557248,I just swallowed my juul 😰,sampucketttwt,2022-11-27 05:05:32+00:00
2029,1596731222134345730,Brussels to propose rise in cigarette taxes and first EU-wide vaping levy https://t.co/EBVn6Lzi0x,ftbrussels,2022-11-27 05:02:43+00:00
2030,1596731061920501760,i been blowing my gummy bear vape all in kayla face 😭😭😭,miiyahplayhouse,2022-11-27 05:02:05+00:00
2031,1596730937941057536,If I were to die I want to buzzed off a vape drunk af getting it to some dark industry house shid 🔥,Smackaneez,2022-11-27 05:01:36+00:00
2032,1596730840767254531,phelloderm,VAPESFR26570598,2022-11-27 05:01:12+00:00
2033,1596730783007272960,If you got a vape from Morriston you can get in places. Plan B accepting vape or cash,langleyjordan,2022-11-27 05:00:59+00:00
2034,1596730665277730818,"remembered the queen that is hands up by cherry bullet

https://t.co/a1F7M4iKft",jiwooerry,2022-11-27 05:00:31+00:00
2035,1596730602480279553,3 weeks with no vape. When do the cravings go away?,shelbs1326,2022-11-27 05:00:16+00:00
2036,1596730462428618752,"she vaping in my room , that shit lit up like a glow lamp",youngahk__,2022-11-27 04:59:42+00:00
2037,1596730432640327680,Which dry herb vapes have you tried? Did they suck?,troytime420,2022-11-27 04:59:35+00:00
2038,1596730344040206337,GIRL,jiwooerry,2022-11-27 04:59:14+00:00
2039,1596730167988465664,Y’all be hitting vapes like blunts in the mid-convo &amp; y’all be blowing your blueberry cheesecake on my face,bigdadddyenergy,2022-11-27 04:58:32+00:00
2040,1596730069703016449,"Skin Decal Vinyl Wrap for Smok TFV12 Prince Tank Vape Kit skins stickers cover/Dark Force, rebel trooper IPKYSUJ

https://t.co/ehFz0NDANT https://t.co/XCp1Deyti8",flatleytkzh,2022-11-27 04:58:09+00:00
2041,1596730028850434049,i love coughing up a lung because my vape spits in my mouth like the little whore i am,Ozzzyyy___,2022-11-27 04:57:59+00:00
2042,1596729811166457856,"OH:
“Why are you doing this (ig live)?”
“Idk my vape died”",OnlyChrisGrant,2022-11-27 04:57:07+00:00
2043,1596729241114415104,sukin the life out of my vape and ur dad,eroske666,2022-11-27 04:54:51+00:00
2044,1596729231572361217,I await whatever the alcohol equivalency is to vaping https://t.co/btVR3CRfq6,stack_tracy_,2022-11-27 04:54:49+00:00
2045,1596729056854441986,cousins mom is vaping I am coughing so much someone get me out of here,MUSHR00ME_,2022-11-27 04:54:07+00:00
2046,1596728993893556224,Is it weird that I’ve never smoked a cigarette but I chuff on some random persons vape?,NathanielOUFC,2022-11-27 04:53:52+00:00
2047,1596728549477523457,Man these randoms don’t wanna even mess with the chemist 🥺,JuulTeam6ix,2022-11-27 04:52:06+00:00
2048,1596728503801589760,Bars should sell vapes but like loosies.,reeserosalyn,2022-11-27 04:51:55+00:00
2049,1596728392446976004,nothing more soul crushing than going to the vape shop and the guy saying ‘the usual?’,buggymobile,2022-11-27 04:51:29+00:00
2050,1596728234821193728,"Thank you Black Friday sale, I got a new dry herb vape that can also do concentrates 😩 next step, puffco 🤪",princecosplays_,2022-11-27 04:50:51+00:00
2051,1596728077094035457,"Back live now. 2 usb ports got killed by the wife's vape charging. Burnt a USB control board but I'm back up now! 
https://t.co/G1NYTzbLYO",H1llb1llyg4m3r,2022-11-27 04:50:14+00:00
2052,1596727942746640384,Modern life is incredible romantic. The sexual tension between you and someone who lets you borrow their vape at a bar can only be measured by gravitational equations. Carrying a woman in a shopping cart has a similar quality.,SandwichConsul1,2022-11-27 04:49:41+00:00
2053,1596727936035745792,No one can stop me from ❄️ 🦅 ing https://t.co/W900Enpr3a,CRlSlSACTOR,2022-11-27 04:49:40+00:00
2054,1596727835716030464,smoking fentanyl because my vape died,sopbrodick,2022-11-27 04:49:16+00:00
2055,1596727777247784960,"What if aliens came down and said ""take me to your leader"" and someone handed them a juul and they hit it and they got addicted to nicotine and just didn't leave",DoduoDarling,2022-11-27 04:49:02+00:00
2056,1596727762181423104,It’s going to be on rApApOrT 🤣 https://t.co/bmqrILun3s,JUUL42O,2022-11-27 04:48:58+00:00
2057,1596727741264822273,sighhh he can’t compare to him…..,_emilyj___,2022-11-27 04:48:53+00:00
2058,1596727732758401024,What can you do for me peasant? Findom smoking fetish vape siren https://t.co/ViJT73dlPS,GreedyIvy,2022-11-27 04:48:51+00:00
2059,1596727670317850624,"theoretically, what would happen if a baby (3-12 months old) hit a vape ???",willxsqeon,2022-11-27 04:48:37+00:00
2060,1596727356340998145,vape pro tip: accidentally drop your juul pod in sriracha for an extra kick to your menthol experience,dan_loggedon,2022-11-27 04:47:22+00:00
2061,1596727176824397824,I loveee doing tricks when i vape !! Its so cool to me,sweetbunluvr,2022-11-27 04:46:39+00:00
2062,1596726761089159169,"💥BUY 10 GET 11th Disposable Vapes💥
Black Friday Cyber Monday Top Deals at https://t.co/1r4VCV7eUk😍

👉https://t.co/vKYISpqtwN

#blackfriday #blackfridaysale #cybermonday #cybermondaysale #veevaping #vapecoupons #vapecommunity #vapelife #vapinglover #vapestore #vapelifestyle⁣ https://t.co/6OtsoRb3tL",myvapereview,2022-11-27 04:45:00+00:00
2063,1596726563617538048,people need to stop vaping i can barely see him https://t.co/vt2sku2liG,sagicidal,2022-11-27 04:44:13+00:00
2064,1596726546261495808,i can’t tell if vaping is making me sick or if i’m sick and vaping is making it worse &gt;:(,ThatOneEmoBoy1,2022-11-27 04:44:09+00:00
2065,1596726506876981250,"Give me a bag of hot Cheetos, a blueberry flavored vape, a New order album, and a time machine and watch me take over Ancient Rome",LRoy65257750,2022-11-27 04:43:59+00:00
2066,1596726275296890881,when u take a hit off a vape pen that’s fully charged for once https://t.co/sroJ9jC0j6,lxmbrs,2022-11-27 04:43:04+00:00
2067,1596726207579492352,I don’t usually condone snitching behavior but when it comes to underage vaping I absolutely do! GET THEIR ASSES GROUNDED 😂😂😂😂 https://t.co/BhreF1XS96,omgcristal,2022-11-27 04:42:48+00:00
2068,1596726080328859649,Vaping mirip fapping https://t.co/8bOVcx7FM2,SMOKExGTA,2022-11-27 04:42:17+00:00
2069,1596726078944727041,it’s actually legal to vape inside LAX,nyyyyyyyya,2022-11-27 04:42:17+00:00
2070,1596726059545743360,Packing for a vacation (sleeping on Caitlin’s couch),hand_me_da_vape,2022-11-27 04:42:12+00:00
2071,1596725842477862912,really need to get off this damn vape,juliaaa__24,2022-11-27 04:41:21+00:00
2072,1596725722814369792,I hope this email finds you being fucking for real rn,hand_me_da_vape,2022-11-27 04:40:52+00:00
2073,1596725684335890432,lost my juul last night when it had a full pod in it everyone say rip,gxngrave,2022-11-27 04:40:43+00:00
2074,1596725478467186688,vape nation,Kamii9x,2022-11-27 04:39:54+00:00
2075,1596725393293078528,my vape is out of flavor 😵‍💫😵‍💫🤨 ew. but i just bought it like 4 days ago??,4everf4iling,2022-11-27 04:39:34+00:00
2076,1596725157061881858,"Mr. Brain Genius made the ""User active minutes"" x-axis span from 1/1/2020 to 11/15/2020.  And the increased bots can cover almost all the other slides (included reported impersonations, likely people just stopped bothering to report).  The presentation equivalent of panel gaps. https://t.co/9ccTaF9MkG",CoolVapeDad,2022-11-27 04:38:37+00:00
2077,1596725082055139328,Got me a green vape i love it https://t.co/R9HQnOkhXo,ccm22_,2022-11-27 04:38:19+00:00
2078,1596724928413593600,"A very happy birthday to our beloved commentator and demon who vapes and knows things @RemiJCrowley! We hope you had a wonderful day and that you ate more cake than is good for you. If not, we have some on the way to your house. Get a fork ready. :3 https://t.co/l1yfAMSnBL",Valiant_SL,2022-11-27 04:37:43+00:00
2079,1596724906191978497,"Code BLCK for 15% off any order through Monday with very few exclusions.  Can be used more than once 💨💨💨

https://t.co/ZWgQFHX224 https://t.co/K64Jaf2Uip",DelightsVaping,2022-11-27 04:37:38+00:00
2080,1596724584459702272,Me &amp; Steph tripping on shrooms searching for her vape is everything to me rn 😹,floweychloe,2022-11-27 04:36:21+00:00
2081,1596724527894908928,in the background of all my families videos either eating or hitting my vape,IsabelJoyyy,2022-11-27 04:36:07+00:00
2082,1596724430344192000,what is vaping,Jawsofdcath,2022-11-27 04:35:44+00:00
2083,1596724192455852032,VAPE KIDS,LEAFYSVIDTITLES,2022-11-27 04:34:47+00:00
2084,1596724123115597828,"i am so afraid of living everything is always out to get ppl who are alive and i am unfortunately apart of the ""currently living"" demographic",juleiscool1,2022-11-27 04:34:31+00:00
2085,1596723812518592512,The vape went out the window I got to get back healthy.. I have to be shredded the end of December,KING__CHING,2022-11-27 04:33:17+00:00
2086,1596723802830155781,Girls night: making mixes and vaping,justjadaa,2022-11-27 04:33:14+00:00
2087,1596723669359022080,I wish i vaped,stort_babygru,2022-11-27 04:32:43+00:00
2088,1596723644385796096,wednesday addams is so me,onlyrockland,2022-11-27 04:32:37+00:00
2089,1596723577805414401,boze mam wrażenie ze i used to Have a personality and now im so bland i want to throw up When i see myself,sk1nnyw4nnab33,2022-11-27 04:32:21+00:00
2090,1596723540451287040,LMFAOOO ROLLING IN MY GRAVE,filthmonki,2022-11-27 04:32:12+00:00
2091,1596723489817657344,"2/2  and now going to vape very much less often.
I know sample size is 1, lol 😆 
Just saying 😌 https://t.co/9K6uINliqy",MorawetzTom,2022-11-27 04:32:00+00:00
2092,1596723346062069761,I KNEW ITT (sorta.) I KNEW SOMETHING WAS FISHY WITH THAT CHARACTER,lianna444,2022-11-27 04:31:26+00:00
2093,1596723258300465155,told my girl i was gonna take away her vape https://t.co/yRHYUflEtA,okjay0,2022-11-27 04:31:05+00:00
2094,1596723123487150080,"Personally I agree. Deliberate overnight quit. Yes hand to mouth very important,  but I believe that getting the nic level is perhaps equally important. I got my neighbor on to 12mg Blueberry menthol,  and after maybe 6 months she said I'm always on my vape. Upped to 18mg https://t.co/9K6uINliqy",MorawetzTom,2022-11-27 04:30:32+00:00
2095,1596723085159583744,"🚨The NEW Randy's Loov introduces a whole new way to enjoy your clouds. Fill the glass, tip it, and take a sip. The Loov brings new levels of fun and sophistication to your sesh. Get it @ https://t.co/jcK4ac9Owy
Bottoms up! Cheers!
Ships free!
#loov #randys #vape https://t.co/kW5Z6MpUPA",TheStashShack,2022-11-27 04:30:23+00:00
2096,1596723022442139649,Why would you fucking vape you bitch,Dont_Vape_Bot,2022-11-27 04:30:08+00:00
2097,1596723009036820480,vapers are gross,JackMessSellout,2022-11-27 04:30:05+00:00
2098,1596722883195117571,These bitches want nikkeeesss,_jules,2022-11-27 04:29:35+00:00
2099,1596722755076239360,mf at work told me “wow your job must be so hard” yeah it’s almost as hard as fucking cna’s in the bathroom then taking a 3 hour nap instead of responding to call bells BITCH MOVE,jenessa4prez,2022-11-27 04:29:05+00:00
2100,1596722235829805057,sweeping scientific lit review finds vaping totally harmless except all those hits you held in until no cloud came back out which will definitely kill you,thetomzone,2022-11-27 04:27:01+00:00
2101,1596722105185603586,I really stopped vaping and been taking my vitamins everyday 🥰 I love that for me,kethegeniee,2022-11-27 04:26:30+00:00
2102,1596722038995308544,"Video: Should Singapore regulate vaping instead of banning it? Heart of the Matter podcast
https://t.co/GLx1C0HJw2",livetubealerts,2022-11-27 04:26:14+00:00
2103,1596722036377673729,Wake up vape up,jadewesttwt,2022-11-27 04:26:13+00:00
2104,1596722013187424257,"I can't believe CA banned flavored vapes bro that's fucking wild. Knocks it off our ""potential places to move"" list -- we have nicotine addictions and hate the taste of tobacco lmao. Even menthol cigs. Wild.",kaylahkiss,2022-11-27 04:26:08+00:00
2105,1596721773340659714,VAPES AND ENERGY DRINKS https://t.co/7howEMmwkG,r0ttenporcelain,2022-11-27 04:25:11+00:00
2106,1596721082941075457,just started watching wednesday ❤️ I LOVE HER,onlyrockland,2022-11-27 04:22:26+00:00
2107,1596721016621129728,very much considering getting a vape to help with appetite but also vape gross,markertwenty7,2022-11-27 04:22:10+00:00
2108,1596720771392733184,"But, but, I luvs my vapes!! https://t.co/CMayk8GI5s",MorawetzTom,2022-11-27 04:21:12+00:00
2109,1596720767533780996,"#edibles #cbdoil 
#cannabiscommunity Gorilla Glue Vape Delta-8 THC Cartridge. When you’re looking to feel something more, try 10X disposable vape cartridges infused with Delta-8. It’s a quick, easy, on-the-go way to enjoy your https://t.co/BamsYqm8lO #cbd #cannabis #hemp https://t.co/H7dMOIRq1W",CBDSmokeShop,2022-11-27 04:21:11+00:00
2110,1596720626454052864,Someone should buy me a new vape;(,sweetbunluvr,2022-11-27 04:20:37+00:00
2111,1596720535303774208,Do something nice for yourself like put on a fuzzy pair of socks or make yourself a nice snack idk be nice to yourself 💗,GBPPSTARK,2022-11-27 04:20:15+00:00
2112,1596720371155488769,i want to vape inside,drunkearthday,2022-11-27 04:19:36+00:00
2113,1596720324535459840,new vape juice: fentanyl,brdyktn,2022-11-27 04:19:25+00:00
2114,1596720273163968514,I’m staying in my pjs today I think. I’m very tired 😴,GBPPSTARK,2022-11-27 04:19:13+00:00
2115,1596719926185979904,I take one shot and need a vape immediately,SnipesKelli,2022-11-27 04:17:50+00:00
2116,1596719701509672960,is new jersey a pvp enabled zone,demoloving,2022-11-27 04:16:57+00:00
2117,1596719622765838337,You’ve uh oh’ed your last spaghettio,hand_me_da_vape,2022-11-27 04:16:38+00:00
2118,1596719570298904576,My strawberry watermelon vape pen. ☹️☹️☹️☹️☹️ https://t.co/DOjIE2nRDR,plzseola,2022-11-27 04:16:25+00:00
2119,1596719516180185088,i need gnf content now,gnfvol6,2022-11-27 04:16:12+00:00
