,TweetID,TweetContent,TweeterUsername,TweetDatetime
0,1597017357553369091,Me when my boss yell at me for hitting my vape in the bathroom stall for 45 minutes during a rush https://t.co/YhZ3cj7spO,JuneixAFK,2022-11-27 23:59:43+00:00
1,1597017308324859904,me calling the vape shops to find the best price,chaoticicedchai,2022-11-27 23:59:32+00:00
2,1597017255526924291,"i wake up and grab my glasses, you wake up and grab your vape… we are not the same",annethrangel,2022-11-27 23:59:19+00:00
3,1597017214376300544,my life has been downhill since they abolished mango juul pods,dottadottadah,2022-11-27 23:59:09+00:00
4,1597017141945196544,It’s taking me longer to walk away from vaping then what it took me to walk away from my 5 year relationship 😂,iamsandrra,2022-11-27 23:58:52+00:00
5,1597017084202225664,DMT Vape Carts Are Now available.Tap in #dmt #psilocybin #psychedelic https://t.co/PhYgN3hcJk,Billyban9,2022-11-27 23:58:38+00:00
6,1597017072881782786,omad ~ 360 cals 🫧 https://t.co/710CZgbsaP,smolandhungie,2022-11-27 23:58:35+00:00
7,1597017069715066881,These new hookah vapes flavors&gt;&gt;,uncleclifford16,2022-11-27 23:58:35+00:00
8,1597016972159778818,"SUPER GRAB BAG DEALS!!!
Supplies are limited!
In store only.
#vape #vaping #vapelyfe #vapefam #blackfriday #sale #hatborohighlights #shophatboro #smallbusiness https://t.co/ykyG1rZfNW",VaporPhoxxe,2022-11-27 23:58:11+00:00
9,1597016867608354818,DMT powder/DMT vapes. Grab them in bulk and get good tickets https://t.co/dvHe6HQp5P,Billyban9,2022-11-27 23:57:47+00:00
10,1597016749198954496,kai bought juul pods again but she been off for a few weeks so she might get addicted again https://t.co/r98yNwbsli,biyebo,2022-11-27 23:57:18+00:00
11,1597016644618194945,"The smoker menace has me surrounded 
Came back to a room that smelled so fucking bad
Pick up vaping or go back to 1963 you fucking savages you fucking barbarians",PAPAPOPKOFF,2022-11-27 23:56:53+00:00
12,1597016587076182016,I can’t even explain how fucked it is that I have abstained and even protested against disposable vapes for YEARS while all my friends are addicted and now I’M the one having chest pains y’all can go to hell,miktheprick18,2022-11-27 23:56:40+00:00
13,1597016418243194883,"Solo Q on apex is killing me, a mf mad rusty",WildernessEcho,2022-11-27 23:55:59+00:00
14,1597016379055812610,i had a dream i met @ann_forcino and she was really mean to me so id like an apology /j,00juuls,2022-11-27 23:55:50+00:00
15,1597016213330485249,vape juice tastes nasty but pretty O clouds make brain go brrrrrrrrtt,fairytypingL,2022-11-27 23:55:11+00:00
16,1597016067834281985,keep everything real place your order now #dmt #vape #dmtcarts #psychedelics #lsd #mdma #shrooms https://t.co/AGYdKtqFH1,Billyban9,2022-11-27 23:54:36+00:00
17,1597015689268965376,The left is embracing anti-lockdown protestors in china. When we did it here they called us murderers and said we wanted people to die.,TankerVapes,2022-11-27 23:53:06+00:00
18,1597015522205376514,"Helping parents and teachers combat vaping
https://t.co/rJzs8mtITr",MirageNewsCom,2022-11-27 23:52:26+00:00
19,1597015457240076288,Bought a vape for the first time today. And now I can’t put the darn thing down.,ghostybpd,2022-11-27 23:52:10+00:00
20,1597015287437877249,DMT Vapes the divine truth 🍄🔥 #DMT #Psitwitter #Psilocybin #psychedelicart https://t.co/9wuZQYcpcV,Billyban9,2022-11-27 23:51:30+00:00
21,1597015233255550976,I love when the vape makes me feel like I’m gonna faint,iamgod4real,2022-11-27 23:51:17+00:00
22,1597015192428511232,keep everything real place your order now #dmt #vape #dmtcarts #psychedelics #lsd #mdma #shrooms https://t.co/bPJhf3T9hU,Billyban9,2022-11-27 23:51:07+00:00
23,1597015151189798913,y’all i stopped vaping 🤭 it’s almost been 2 weeks,TheBodyJR,2022-11-27 23:50:57+00:00
24,1597015034693320704,"#edibles #cbdoil 
#cannabiscommunity Green Crack Miami High Delta-8 THC Disposable Vape Pen. Bienvenido a Miami, the most beautiful city in the world where the people are hot. The weather is gorgeous, and the buzz from the delta 8 is https://t.co/MX26uccFWE #cbd #cannabis #hemp https://t.co/rm9ZdxxuU7",CBDSmokeShop,2022-11-27 23:50:30+00:00
25,1597015022127153152,I noticed that you guys were deciding to vape instead of smoke our very healthy and delicious... cigarettes.,botppio,2022-11-27 23:50:27+00:00
26,1597014935439302656,omg she gotta vape💔💔,cantstopnas,2022-11-27 23:50:06+00:00
27,1597014876928737280,"me with the homies' vapes bc i ""quit vaping"" (won't buy my own) https://t.co/UNFSGuEKLY",apartidus,2022-11-27 23:49:52+00:00
28,1597014639241351169,Tomorrow is the last day of our Black Friday sales! OPEN 9am to 9pm,Boondock_Vape,2022-11-27 23:48:55+00:00
29,1597014584208293888,"It's been a good multi decade run but #nicotine addiction ends today. From cigarettes to vaping, it's been a good run. I have some anti anx pills on hand for the big challenge. Wish me luck",TMcteag,2022-11-27 23:48:42+00:00
30,1597014307132563458,Ok losing without any form of nicotine will be the death of me. If I was still vaping I could lose 15 lb just like that.,njtransitwaif,2022-11-27 23:47:36+00:00
31,1597014294864211968,3 weeks vape free,spacecowbitch,2022-11-27 23:47:33+00:00
32,1597014270851497985,one time i vaped zaaaa in the movie theater bathroom,Hi_Im_Dana,2022-11-27 23:47:27+00:00
33,1597014176341594112,"Yocan STIX 2.0 
https://t.co/ZRuxYai2yp",black_stone_jp,2022-11-27 23:47:05+00:00
34,1597013992446124032,quitting vaping feels like shit but at least i don’t have to reapply my lipstick as often now,tea3ww,2022-11-27 23:46:21+00:00
35,1597013781967929345,most toxic ex = best sex #sorrynotsorry,vape_in_peace,2022-11-27 23:45:31+00:00
36,1597013694537297920,i think i finally know what it feels like to be a guy bc i’m bare minimum flirting with my most toxic ex just so he comes and has sex with me,vape_in_peace,2022-11-27 23:45:10+00:00
37,1597013354630983680,Okay that was a delicious meal Now lets get up from the seat put the dishes in the sink and sit on the couch Vape and watch GOT,justinensalada,2022-11-27 23:43:49+00:00
38,1597013084924964864,It blows my mind when people say they are quitting nicotine and it’s vaping. Vaping help me quit actual smoking lmao,dre_c92,2022-11-27 23:42:45+00:00
39,1597013057565495297,vape accessories bulk sale https://t.co/iLSpnavjz9,GRin59403713,2022-11-27 23:42:38+00:00
40,1597012866011648000,Cigarettes are way healthier and cooler than vaping,OOHKAYEYE,2022-11-27 23:41:52+00:00
41,1597012792317382656,VAPING increased my anxiety,soIodown,2022-11-27 23:41:35+00:00
42,1597012755248480256,my cousin let me front a vape off her bf and its a rechargeable dispo?!?@??$?# hello ehen did they make these,samrckwell,2022-11-27 23:41:26+00:00
43,1597012699082555393,Oh no my kid just found out his disposable vapes are just old cat turds,reapingwildoats,2022-11-27 23:41:13+00:00
44,1597012613803945986,it's so transphobic you can't get juul pods delivered,GRIMYWAIFU_,2022-11-27 23:40:52+00:00
45,1597012523534151680,she has been and will always be my friend. https://t.co/IvD1iKY0Jr,swaggyg1rl21,2022-11-27 23:40:31+00:00
46,1597012161418907648,Finna tell the dominos driver that’s delivering my food to stop at the store for me to get a vape😂😂😂,Jvst_ksh,2022-11-27 23:39:04+00:00
47,1597011547544772609,so good i had to rt on both accounts https://t.co/R4yRC1pFtg,antiherolive_,2022-11-27 23:36:38+00:00
48,1597011512971120640,orange soda rick and morty vape,d3athbugz,2022-11-27 23:36:30+00:00
49,1597011259308011520,Ok finished Wednesday and it was cute. Kinda cringe script but it was overall really fun. I mean it does seem like it's meant for like 14 year olds.,electic27,2022-11-27 23:35:29+00:00
50,1597011141041197056,I can’t find my vape,_lamb0o,2022-11-27 23:35:01+00:00
51,1597010918424342529,Playing Dark anthology and puffing my vape like it a pipe https://t.co/7pGxZaFolN,nessplaystheuke,2022-11-27 23:34:08+00:00
52,1597010905480323072,DON'T HIT YOUR VAPE PEN WHILE I'M TALKING TO YOU.,sorrensbot,2022-11-27 23:34:05+00:00
53,1597010858881986560,In love with the new shop in my town that closes at midnight every day because it’s 11:30pm and I was able to walk 2 mins and go buy a monster and a vape,bluegreenrry28,2022-11-27 23:33:54+00:00
54,1597010799767453696,why am i still awake waaaaa,aIlsaints,2022-11-27 23:33:40+00:00
55,1597010571013984256,EU to introduce bloc-wide vaping levy https://t.co/vlLSiEHIZL,VaporTax,2022-11-27 23:32:45+00:00
56,1597010468593618945,"video games are fun for a while, but then i have to go lay in bed and vape for 3 hours",slizzardkong,2022-11-27 23:32:21+00:00
57,1597010406207553538,Having to sit around people vaping the entire @seahawks game is annoying. 🙄🙄,cyorozu3,2022-11-27 23:32:06+00:00
58,1597010343615954944,HELLO?? https://t.co/Jl6ji2GV8Q,jb_mmiii,2022-11-27 23:31:51+00:00
59,1597009964660244480,"i got banned on Joel's stream for 600 sec a couple of days ago because i said ""Vape in my pussy and call me your meme slut""",vinechatbot,2022-11-27 23:30:21+00:00
60,1597009908146139136,"Vaping bad, Exercising good",Dont_Vape_Bot,2022-11-27 23:30:07+00:00
61,1597009895345242114,CBD Tinctures vs Vapes: What’s the Difference? https://t.co/CpxXiIUFbu #bipolar https://t.co/3ZO5EUcvE2,dbell_novus,2022-11-27 23:30:04+00:00
62,1597009821299007489,Typical day in a vape shop… #shorts https://t.co/AJm4wHmInK,ECIGCANADAZONE,2022-11-27 23:29:47+00:00
63,1597009583197007873,My man is not your man bitch you will end up negative six feet right along with him https://t.co/GTx7jaD8vy,_fvckhippies,2022-11-27 23:28:50+00:00
64,1597009418142756866,i only dj sets off my vape,thestr8agenda,2022-11-27 23:28:10+00:00
65,1597009390552612865,If u charge ur juul with a dj kontroller it automatically uploads this album https://t.co/ByauhCziML,butangel420,2022-11-27 23:28:04+00:00
66,1597009389382033408,"A vape store in the Christchurch suburb of Avonside was ramraided in the early hours - and just hours later, an aggravated robbery took place at a supermarket. https://t.co/xezjeHq9RF",QudachNZ,2022-11-27 23:28:04+00:00
67,1597009344738230272,"I never thought about suicide, but I'm thinking about it now my mother hates me. She thinks I'm a piece of shit and always keeps on telling me that she shouldn't of had abortion with me. I'm willing to blow my brains out and never thought about it until now.",_vaping_gam3r_,2022-11-27 23:27:53+00:00
68,1597009272952434688,Wake up vape up,trinavegatwt,2022-11-27 23:27:36+00:00
69,1597009218196107267,jus took. a hit out of my vape at a restaurant while on a date whos gonna stop me…,yanelluh,2022-11-27 23:27:23+00:00
70,1597009207038922752,"Allen Carr's Easy Way to Quit Vaping DOQKJLY

https://t.co/9D1jK411Tj https://t.co/BjNRotM9sb",Aida46H,2022-11-27 23:27:20+00:00
71,1597008376533200899,"#CBD #cbdlife #cbdedibles #BuyFast #cbdhealth #CBDグミ #cbdoil #cbdproducts #cbdchocolate #cbdvape #cbdcapsule #tincture #vape
For Pain relief, Anxiety, sleep issues, clarity, skin, and more. CANADIAN #1 C*____B*____D*____OILS https://t.co/eK4mpmP5vo CHECK OUT Promo Code: PIN20 https://t.co/5lCPXYl2vc",deg26xj,2022-11-27 23:24:02+00:00
72,1597008278479069184,just got bit by a dog and now hot boxing the car with vape in the taco bell drive thru,birkclogs,2022-11-27 23:23:39+00:00
73,1597008223885672448,droppin a new song yesterday cuz i guess i hit the vape on the internet &amp;amp; not actually go anywhere,imalsoblackbear,2022-11-27 23:23:26+00:00
74,1597008188305338368,FUNNY VAPE DUDE??? https://t.co/grbUMWLQ0p https://t.co/uoi26ssK1m,ohyasagohan,2022-11-27 23:23:17+00:00
75,1597007940036460544,vaped.eth added to my collection https://t.co/58VDP5VVZH,imlucky_eth,2022-11-27 23:22:18+00:00
76,1597007614101319680,deadass think my room is haunting.. STOP HITTING MY VAPE WITHOUT ASKING GODDAMN. WHY THIS SHIT KEEP GOING OFF WHEN ITS JUST SITTING ON MY BED,heartsforviii,2022-11-27 23:21:00+00:00
77,1597007316552818688,adulthood is deciding whether to buy essential groceries or vape juice,lalckly,2022-11-27 23:19:49+00:00
78,1597007293660659712,People who vape wanna be weed smokers so bad 😂😂😂,jasoncraig___,2022-11-27 23:19:44+00:00
79,1597006959278190593,"The evil in this space tried to destroy it, a rael community on the internet attacked by npcs and it made me soooooo angry that i rose up and WON forever https://t.co/5aHji6JOEi",vapes_fresh,2022-11-27 23:18:24+00:00
80,1597006887366832129,Just the facts! https://t.co/lUvuUCf8Mt,rights4vapers,2022-11-27 23:18:07+00:00
81,1597006844396187649,Dawn schedules #weedsmokers #WeedLife #THC #cannabisindustry   #plug https://t.co/CLWYk7C3zH,Vape_cake_cart,2022-11-27 23:17:57+00:00
82,1597006787752112130,I was listening to this young man speak who was affected by vaping. His voice sounds x_x. Please leave that shit alone.,LePetiteLeRoux,2022-11-27 23:17:43+00:00
83,1597006773751549952,The Vapes 1st single「Rock is Dummy」trailer(2018年9月REC&amp;MIX）https://t.co/QZZAqPeWfU,tttst_sound,2022-11-27 23:17:40+00:00
84,1597006531186536448,"Arctic Monkeys - 505 (Lyrics) https://t.co/npMcfJKleG via @YouTube

“I’d probably still adore you with your hands around my neck”",CakesNotVapes,2022-11-27 23:16:42+00:00
85,1597006239212662784,frank is my bias but tucker is my bias wrecker,demoloving,2022-11-27 23:15:33+00:00
86,1597006225119784960,It’s Sunday funday so come hang out on stream and we’ll talk about the YUGE weekend of wrestling I have coming up! https://t.co/Xr43B4vCsj #twitch #SundayFunday #gaming #consolegaming #CoD #MW2 #MWII #ModernWarfare2 #ModernWarfareII #Warzone2 #WZ2 #prowrestling #prowrestler,VapeGodFletch,2022-11-27 23:15:29+00:00
87,1597006086686797825,i was videocalling my friend and i thought i had tomorrow off and then i got a text saying i had to go to uni tomorrow so i nearly started crying but the text wasn't for me so i do have tomorrow off,aIlsaints,2022-11-27 23:14:56+00:00
88,1597006052666462210,Rise in cigarette taxes first EU-wide vaping levy on the cards https://t.co/d9DtbKSuxG,philgambaccini,2022-11-27 23:14:48+00:00
89,1597005747618881538,Check out my broadcast from my PlayStation 4! #PS4live (Call of Duty®: Modern Warfare II)  live at https://t.co/Q2XvqGLLyC,VapeGodFletch,2022-11-27 23:13:35+00:00
90,1597005585680957440,Ugh. I lost my vape.,Steysi_GZ,2022-11-27 23:12:57+00:00
91,1597005474708484096,I GOT MY MAHAGRID STUFF,0320wrId,2022-11-27 23:12:30+00:00
92,1597005440386494464,"my first milady &lt;3  he has a music video

https://t.co/0v4KGxgHvg",vapes_fresh,2022-11-27 23:12:22+00:00
93,1597005402277031936,if we had the nations greatest scientists focused on cancer research instead of working for Mr Fog we’d have a lot less cancer (but also less tasty vapes),trevorcory99,2022-11-27 23:12:13+00:00
94,1597005245711757313,"Nearly a year since I stopped drinking, a year of journalling &amp; it's been a full year of celibacy. 

I want to stop smoking weed and start eating edibles every now and then. I also need to stop vaping man, fuck it's hard. 

Might stop the vape for new years, get on patches etc😅",RemyAndCo2016,2022-11-27 23:11:36+00:00
95,1597005021434249216,We dnt smoke hookah &amp; vapes we smoke Kill pack,_KingGl0,2022-11-27 23:10:42+00:00
96,1597004969248374784,Every time I buy a vape nd get drunk I loose my shit ion buying nomo,CarlosJ5hunnit,2022-11-27 23:10:30+00:00
97,1597004965243162624,still thinking about...the 0mg flavourless vape. i would be ecstatic if i got that. i truly believe its one of the funniest things,nomallnogardens,2022-11-27 23:10:29+00:00
98,1597004717108101121,There need to be vaping rehab in schools at this point 💀,cdalt_pb,2022-11-27 23:09:30+00:00
99,1597004390732156928,"iiRov Premium Skin Wrap Vinyl Protective Cute Decal Compatible with The Pax JUUL Vape (Device Not Included) - Protective Stic KVOJEJX

https://t.co/2GPhDHnOcb",MNakia40,2022-11-27 23:08:12+00:00
100,1597004306556674048,can y’all stop vaping please its stupid,funnylatinx,2022-11-27 23:07:52+00:00
101,1597004192438431745,"guys, i can't believe 2022 is almost over -- i did so much this year :
i started vaping,
i quit vaping",_urnma,2022-11-27 23:07:25+00:00
102,1597004051643740160,if someone blows their vape by me it’s a hate crime idc,emomami1,2022-11-27 23:06:51+00:00
103,1597004003258159106,"#thc #cbdhealth 
#cannabiscommunity
 Our Granddaddy Purple Disposable #CBD Vape Pen is a powerful fusion of grape &amp; berry essence mixed with floral. Earthy undertones to give you a blissful experience any time you want.  Not like your Grandpappy's https://t.co/okSrgrg73m #cbdoil https://t.co/MU0FYpiJpz",cbdhealthbasket,2022-11-27 23:06:39+00:00
104,1597003998502043649,"#thc #cbdhealth 
#cannabiscommunity
 There are many best reasons to buy #CBD Vape Pens, in this article we will discuss why. It is well known that people who wish to try CBD for the first time have never vaped before. At the same time, https://t.co/EgSr1IRHwc #hemp #cbdoil https://t.co/di2HOT0eYU",cbdhealthbasket,2022-11-27 23:06:38+00:00
105,1597003945230340096,i vape not for the nicotine but as a stim,VeeWitchery,2022-11-27 23:06:26+00:00
106,1597003823129600000,i haven’t had NO VAPE https://t.co/KchdOt9Cjc,astrobunny888,2022-11-27 23:05:56+00:00
107,1597003735095422977,"my parents keep stealing my vape. not to take it away, but literally to hit it.",alexa_furuta,2022-11-27 23:05:35+00:00
108,1597003321201790978,Just met my bf outside for a vape n a laugh and it gave me the strength and good vibes I need to get thru this day UNTIL I remembered that our office is moving this week and I will no longer be two buildings away from my fave….. cry reacts only pls,kazface,2022-11-27 23:03:57+00:00
109,1597003319062716416,"Shinsuke won't stop talking about this ""vaping"" thing...",tsurugibot_en,2022-11-27 23:03:56+00:00
110,1597003284107010048,they should make a diet coke flavour vape,vapesmuggler,2022-11-27 23:03:48+00:00
111,1597003220483653632,got vape flavor espresso cuz drinking coffee and smoking cigarettes are not enough,uincunt,2022-11-27 23:03:33+00:00
112,1597003120231747585,when my juul dies I’m going home,dicktalklmk,2022-11-27 23:03:09+00:00
113,1597003091374534656,"New #ENS domain registrations 

vaped.eth
modularwallet.eth",ensregistry,2022-11-27 23:03:02+00:00
114,1597003078296686592,hey guys i vape,finley_ebooks,2022-11-27 23:02:59+00:00
115,1597003067459006465,a dead vape 😻 https://t.co/8hud1anBAt,heartbrkhalo,2022-11-27 23:02:56+00:00
116,1597002988421533697,one thing about me is that i will have a diet coke with me,gnfvol6,2022-11-27 23:02:37+00:00
117,1597002939385937921,"My go to vape shop - super nice, always chill, and the price is right (@ Liquid Vapor Lounge) on #Yelp https://t.co/CuzZZTVJud",wuvva,2022-11-27 23:02:26+00:00
118,1597002530239692801,"THCP: Is It Really 33 Times Stronger Than THC?
By Jim McDonald

https://t.co/zTmCLjizVM",Vaping360,2022-11-27 23:00:48+00:00
119,1597002484563824643,"England warned their public about the health risks of smoking in 1957; the USA denied it until 1964.

How many US citizens continued to smoke &amp; got chronic disease in those 7 years?

England promotes vaping as harm reduction since 2015; the USA denies it.

https://t.co/sRbeOSgdf7 https://t.co/sMFYUGsj55",VAEPinfo,2022-11-27 23:00:37+00:00
120,1597002244758843397,charging the vape at the host stand,jitbroadway,2022-11-27 22:59:40+00:00
121,1597002014843863042,Tbh not only am I glad I quit cigarettes but damn I’m glad I stopped vaping too! 🤯,sinnersaddixion,2022-11-27 22:58:45+00:00
122,1597001724517941249,"Powerdynamo MZ-B VAPE Ignition Sys Stator for Simson 64-75 SR4 1 2 66-80 KR51 DC 8MEAXYO

https://t.co/WtHFftATMl https://t.co/XZUsypFRPK",bradtke35crjub,2022-11-27 22:57:36+00:00
123,1597001274364690433,this is clitstick when they don’t let her hit her raspberry bosbes bubblegum vape till she does ten push ups in a row https://t.co/1L2XPdqkub,diaan422,2022-11-27 22:55:49+00:00
124,1597001127781797889,do i spend my money on ubereats for a starbucks eggnog latte or a new vape is the real question,chaewonblunts,2022-11-27 22:55:14+00:00
125,1597000995783204864,I’m going to find all my missing vapes when we move… I just know it. The amount of vapes that’s when missing INSIDE my apartment is ridiculous. 💀,panga_nicole,2022-11-27 22:54:42+00:00
126,1597000919698194432,was considering buying another vape pen and then god nerfed me and gave me long term covid symptoms… hate it here,gothrights,2022-11-27 22:54:24+00:00
127,1597000776710524928,lmao I was in Walmart &amp; this girl said i’m on vapes so bad i’ll flip somebody’s grandad recliner over looking for it 😂😂😂😂😂😂😂😂😂😂🤣,DenariusStevens,2022-11-27 22:53:50+00:00
128,1597000645533323264,this vape is hitting my ass back. 😭 I think its a new fav 🥲,mfnbrig,2022-11-27 22:53:19+00:00
129,1597000640076877825,Cannot wait to go home and hit my vape,myheadthoughts1,2022-11-27 22:53:18+00:00
130,1597000493477539842,god is good i just found a vape and an 8th of weed in my car that i lost 😭,graceodembo3,2022-11-27 22:52:43+00:00
131,1597000402880565249,"I was asleep the whole day yesterday.
Litteraly. No breakfast lunch nor dinner.

And I still hate that girl who litteraly stole my vape. Yawa.",levrodriguez,2022-11-27 22:52:21+00:00
132,1597000288438652928,doctors should start prescribing vapes like they used to cigarettes,PunishedKirby,2022-11-27 22:51:54+00:00
133,1597000217093541888,"started losing my eyesight due to vaping, call that a STIGmatism",bark4scoobysnac,2022-11-27 22:51:37+00:00
134,1597000094519242752,"As a female, wearing vintage Levi’s, let me just say how strange it is to have such cavernous front pockets. I’m up to my mid forearm looking for my juul.",fivefootferal,2022-11-27 22:51:08+00:00
135,1596999915158515715,if you have quit nicotine…. Can you tell me some tips you’ve used? Im so tired of vaping but my goblin brain says keep suckin it down,dangbozo,2022-11-27 22:50:25+00:00
136,1596999892660269056,We are on day 4 of my period guys and I am still feeling like I got hit by a truck,GBPPSTARK,2022-11-27 22:50:19+00:00
137,1596999666222395392,Vape horse,_spellegrino,2022-11-27 22:49:25+00:00
138,1596999638065692672,Horse vape,_spellegrino,2022-11-27 22:49:19+00:00
139,1596999625159778304,this job so unserious... the supervisor explaining stuff and nickgurs started vaping 👩🏾‍🦯,yngcarla,2022-11-27 22:49:16+00:00
140,1596999610928492544,rip to the brother who left their vape on the library floor https://t.co/9xyLKGW0Y9,jaegerbombed,2022-11-27 22:49:12+00:00
141,1596999608822964224,"I’m going through it guys 

https://t.co/f12pWHq4KY",CakesNotVapes,2022-11-27 22:49:12+00:00
142,1596999077329514496,"After this vape goes out, i’m done with em!",DenariusStevens,2022-11-27 22:47:05+00:00
143,1596998812694106112,how u vape and wear a binder. cmon stink,soulwormz,2022-11-27 22:46:02+00:00
144,1596998659391922176,"refilling my vape, thought of you",_desolate_angel,2022-11-27 22:45:25+00:00
145,1596998367950753792,"cant be with people who smokes/vapes🙂 matay kog sayo🥲🥲. i tried those things mn, di nkom usab gi atake ko ste🙂🙃",Itssswrynethjb,2022-11-27 22:44:16+00:00
146,1596997930472583169,I really bought a vape today 😭,REALLYHER07,2022-11-27 22:42:32+00:00
147,1596997841935028225,My throat is sore asf &amp; im still vaping #GRINDDONTSTOP,izzytherulaa,2022-11-27 22:42:10+00:00
148,1596997568315396097,that's what she gets for vaping !! https://t.co/LNmFFEVgl4,raggedyhiip,2022-11-27 22:41:05+00:00
149,1596997473125695489,so tempted to go into this smoke shop n buy a vape 😂😂😂😂,yung_daee,2022-11-27 22:40:43+00:00
150,1596997395304558593,"The EU is set to introduce a new vaping levy as it revamps the tobacco industry’s tax structures and adapts to the vape boom.

https://t.co/2KaSemWrWD",ComAware_4S,2022-11-27 22:40:24+00:00
151,1596997384080621568,"So you decided you want to quit vaping?  Three pieces of advice I have to offer include stay focused, don't give up, and ASK FOR HELP if needed. #inthistogether #livehealthy",chrisviering1,2022-11-27 22:40:21+00:00
152,1596997289364848640,I’m sorry but who is buying organic food?,zsmit2,2022-11-27 22:39:59+00:00
153,1596997075254018049,reaching for  my bfs vape  as  soon  as he leaves the room,loveangelb4by,2022-11-27 22:39:08+00:00
154,1596996841152708608,"🙂 Just put a load of laundry in the wash

🥲 Pretty sure my vape’s in there too",hash_jag412,2022-11-27 22:38:12+00:00
155,1596996790313697286,Special Sale https://t.co/i8y4ENxTZW https://t.co/WWGSJLeVgM,EightVape,2022-11-27 22:38:00+00:00
156,1596996596029276160,"kenneth murray was drafted for highlights of him stopping mobile qb's, begging the question of what he even does here",juul_apatow,2022-11-27 22:37:13+00:00
157,1596996590652514306,This is how me Alexa Demie started dating when she went to Alonso https://t.co/YlOVyWsOjB,AnalogJuul,2022-11-27 22:37:12+00:00
158,1596996418665066497,I’ll be selling illegal vape cartridges here https://t.co/iqXfJnnJhA,codyblackedout,2022-11-27 22:36:31+00:00
159,1596996404496732160,I’m not fucking with no shorty that smokes Juul pens or portable hookah.,Gatti4K,2022-11-27 22:36:28+00:00
160,1596996383277748224,"You may be asking yourself, ""Well vaping can't be as harmful as smoking so what is the problem?"" Well you see, vaping is so new that we do not currently understand the full implications of how harmful it is. The one thing that is clear is that it is harmful. #invisibleharm #help",chrisviering1,2022-11-27 22:36:23+00:00
161,1596996239333412865,ah jeez https://t.co/4XOcOcj83g https://t.co/TEEdFxFhWL,demoloving,2022-11-27 22:35:48+00:00
162,1596996127718805505,we can’t share cigarettes I’m sorry haisi vape,oan_coffee,2022-11-27 22:35:22+00:00
