,TweetID,TweetContent,TweeterUsername,TweetDatetime
1200,1596883461910188032,"Sometimes, I look at tweets and just be like… it’s not their fault, they don’t know any better 🤷‍♂️ #TogetherBlue https://t.co/c9esR3groA",EEveryDayVaper,2022-11-27 15:07:40+00:00
1201,1596883443459461121,Will Stuart vaping in the Twickenham tunnel before England versus South Africa https://t.co/KODnfeW51U,UKSearch1,2022-11-27 15:07:36+00:00
1202,1596883412220284930,She vaping in my room that shit lit up like a glow lamp.,Bell_Kisss,2022-11-27 15:07:28+00:00
1203,1596883039635865603,"Just posted a photo @ Ipswich, Suffolk https://t.co/yR3PULw6RN",chanzie_vapes,2022-11-27 15:05:59+00:00
1204,1596883017234272257,someone is literally vaping in the bathroom stall next to me… babe… I CAN HEAR YOU,alltoomeg,2022-11-27 15:05:54+00:00
1205,1596882836858208257,VAPE DOESNT WORK WHATD I DO TO IT UGHHHHHHH MY DAY KEEPS GETTING WORSE,hottestadhdkid,2022-11-27 15:05:11+00:00
1206,1596882825029906432,"Man vaping is so fun its such an addictive habit 
Im glad im too broke to buy one",MasterCunt4,2022-11-27 15:05:08+00:00
1207,1596882746550677504,Fuck it. Thanksgiving was a cute time to give it a break. But ima start vaping again.,Khamdaddy_,2022-11-27 15:04:50+00:00
1208,1596882676438687744,bitches be so fine then boom! vape in their hand,xanaxist,2022-11-27 15:04:33+00:00
1209,1596882521081675778,Brussels to Propose First EU-Wide Vaping Levy - https://t.co/MJtuVut2EW https://t.co/xaOKxt8vOu,vaporvoicemag,2022-11-27 15:03:56+00:00
1210,1596882395986558977,"Brussels to propose rise in cigarette taxes and first EU-wide vaping levy 

The changes would also increase taxes on hand-rolled tobacco and usher in the first EU-wide minimum excise duty for vapes and heated tobacco 
© Hollie Adams/Bloomberg https://t.co/s3wyLbpr0l",MsResJudicata,2022-11-27 15:03:26+00:00
1211,1596882357323124736,Policies to correct Market Failure: new indirect taxes on vapes. https://t.co/6JrEPJQkqZ,mathenomics,2022-11-27 15:03:17+00:00
1212,1596882331654320128,goodmorning 🥱,gnfvol6,2022-11-27 15:03:11+00:00
1213,1596882314298015745,Who had the better rebrand pleather going as “vegan leather” or cigarettes as vapes,GoodfellaWGM,2022-11-27 15:03:07+00:00
1214,1596882276599533568,"The patented ALL GLASS vape cartridges.

NOW ON SALE 💨 
https://t.co/mbFhSS1obE 

#vapenation #vapefam #vapelove #vapeart #liverosin #liveresin #extracts #mjbizcon #hightimes #vapereview https://t.co/q0CEo5DDfk",O2vape,2022-11-27 15:02:58+00:00
1215,1596882078997811206,About to watch the new Black Panther 🙏🏻,OfficialJuuls,2022-11-27 15:02:10+00:00
1216,1596882017634770944,Vaping my way through life,nishaaantttt,2022-11-27 15:01:56+00:00
1217,1596881990505988096,"Best Nicotine Pouches  -  Discover a tasty, discreet way to consume nicotine, and the best brands to try

https://t.co/Nd0E816LKB",Vaping360,2022-11-27 15:01:49+00:00
1218,1596881975331409920,"Save 15% on the Vaporesso FORZ TX80 Mod as this eek's device of the week! 

https://t.co/kFpQWxUi5H https://t.co/p88TTOP4oj",GiantVapes,2022-11-27 15:01:46+00:00
1219,1596881896679800832,"rewarding 30 mins of uni work with a sip of water, a toke on my vape and a few tiktoks x",_georginalea,2022-11-27 15:01:27+00:00
1220,1596881798612799494,"Vaping may increase a person's risk for cavities and tooth decay due to the artificial sweeteners and flavorings used, preliminary new research suggests. https://t.co/gK8XFXNWjT",NBCNews,2022-11-27 15:01:04+00:00
1221,1596881573697052672,"Each day more and more smokers are trading in their pack of smokes for a vape, only to find out how enjoyable vaping can be.  #vape #nation #smoke #shop https://t.co/MLqzNHXoyF",kmsmokeshop,2022-11-27 15:00:10+00:00
1222,1596881490222383105,i was today years old when i learned anya taylor joy is latina https://t.co/D7wJHqWZnz,bionicbitch420,2022-11-27 14:59:50+00:00
1223,1596881449331761152,Check out the great deals at https://t.co/Pau7B2mHhb and take another 10% off those deals with a followers coupon code: vapingtruth. #vapingtruth,thevapegoods,2022-11-27 14:59:40+00:00
1224,1596881232352403457,gen z is in cig/alcohol vs vape/weed dichotomy and only the former group will inherit the earth https://t.co/1O4WVe90Tk,FlumeStone,2022-11-27 14:58:49+00:00
1225,1596880982233468928,"I am furious. I saw passenger next to me vaping on 2-hour flight last night. I didn't realize what he was doing until right before landing. Alerted everyone. They made a ""report.""

@AmericanAir : prove to me that vaping on a plane is a federal offense - even w only 1 witness!!!!",AnthroJonna,2022-11-27 14:57:49+00:00
1226,1596880979653955585,"the nile is a tiver in egypt, your husband is GAY",matheusisonline,2022-11-27 14:57:48+00:00
1227,1596880971617697792,We’re the vape team #cousins 🤣🤣🤣 https://t.co/cMQdUr9Oe8,celinni13,2022-11-27 14:57:46+00:00
1228,1596880875177795584,"Today's Setup 

It's Sunday so its a day off chilling at home playing games. The setup is the Dovpo MVV 2 Box Mod &amp; the Vaperz Cloud Dreadnought V2

Love the limited edition POTV side panels

Let me know what you are running today in the comments below

#Vaping101 #vape #offday https://t.co/eenmGWpV3s",UKVaping101,2022-11-27 14:57:23+00:00
1229,1596880795246870528,Where were you when you saw the 40 ft vape bag?,pitterpat98,2022-11-27 14:57:04+00:00
1230,1596880663310872576,Series B + Hurricane JR #vape #seriesb #hurricanejr https://t.co/i7I4ruv52t,Vungo1710,2022-11-27 14:56:33+00:00
1231,1596880610303176704,"my most radical, braindead, completely personal and extremely weird take is we should all take baseball bats and destroy any vape shop in sight. i hate that shit. if your homies vape, slap that shit outta their hands and hit it with a claw hammer",Molagz,2022-11-27 14:56:20+00:00
1232,1596880271869366273,BTS vaped the way😋,igora7gof,2022-11-27 14:55:00+00:00
1233,1596880253338537985,They have a vape section in church? Asking for myself I ain’t been In years Lmaoo,ohh_7even,2022-11-27 14:54:55+00:00
1234,1596880203405721603,Calls for ban on disposable vapes as 1.3m thrown away weekly.. https://t.co/cn2d44ulS8,thenorfolkcoast,2022-11-27 14:54:43+00:00
1235,1596880129485332480,i honestly would do laundry daily if i had an in unit w/d,bionicbitch420,2022-11-27 14:54:26+00:00
1236,1596879707898671106,my favorite part of wednesday was randomly meeting a girl who knew this girl from my HS who tried to beat me up in 10th grade and we got to talk shit on how crazy she was it was great,bionicbitch420,2022-11-27 14:52:45+00:00
1237,1596879694401802242,WTF’s wrong with you???,VapePzpoih,2022-11-27 14:52:42+00:00
1238,1596879637728182272,"Tell you what, bloody fair play to Morocco, they e made Belgium look ordinary.  Wish they would play Anass Zaroury though. #moroccovsbelgium https://t.co/C6I47L7Q3g",MrBVapeApe,2022-11-27 14:52:28+00:00
1239,1596879173150470144,"i dreamt abt a vape and woke up, once again, without a vape",edtwt_bf,2022-11-27 14:50:38+00:00
1240,1596879119601438721,ON MY MOMMA!!!!! #Titans https://t.co/SRgayhUVTA,juul_mango,2022-11-27 14:50:25+00:00
1241,1596879009018949633,"Hatori: Pass the Juul
Me: Shimazaki stole it
Shimazaki, making smoke rings with his eyes:",minegishibot_,2022-11-27 14:49:58+00:00
1242,1596878506797027329,I blame the vapes https://t.co/7eYI3jWdYL,bykeia,2022-11-27 14:47:59+00:00
1243,1596878455186264064,"Like 50% of gen z people I know vape though, so there's that. But this is good trend. Alcohol is honestly one of the worst/most dangerous drugs https://t.co/jU06KUCgpp",AdamSinger,2022-11-27 14:47:46+00:00
1244,1596878263250477057,"Unfortunately out of eCL💔 I played good most of the time so there is definitely something positive I can take from this.

Back to the grind🦆
@MikkelHaller https://t.co/BsBDMK53VB",AndersJuul8,2022-11-27 14:47:01+00:00
1245,1596878007641284609,Nectar of the gods: Valhalla Custard https://t.co/2tCpKa1yud https://t.co/DyiRHUxRQ6,SgothanGeal,2022-11-27 14:46:00+00:00
1246,1596877935683588096,My vape is running out. I've got to get home,melanchoeddie,2022-11-27 14:45:43+00:00
1247,1596877909628956673,HOW SOON I NEED ANSWERS https://t.co/oFmvXVgsDg,baboyeol,2022-11-27 14:45:36+00:00
1248,1596877853894680576,realized I vape too much because I let someone suck my nipples and now he’s addicted to nicotine,milaflops,2022-11-27 14:45:23+00:00
1249,1596877265073500160,Have we ran out of things to argue about on this site that we decide to argue about a movie studio logo?,MemeLordVape,2022-11-27 14:43:03+00:00
1250,1596877171246927872,Lost Vape Centaurus M200 Kit Giveaway https://t.co/d53wYCm1Ql,MissiBeasley,2022-11-27 14:42:40+00:00
1251,1596877064451555328,me on my way to alter my brain chemistry by smoking a fat j chugging some cold brew and ripping the vape 20 minutes after i wake up https://t.co/G4F3Bh9eYN,bionicbitch420,2022-11-27 14:42:15+00:00
1252,1596876829364989953,"If you are nnot a gamer we also make Vape, E-cig, and modfications as well as Civilasation 2, Ingress free coins ,",jason28_hongfu,2022-11-27 14:41:19+00:00
1253,1596876761114980352,2 days no vaping,Tiiipsss,2022-11-27 14:41:03+00:00
1254,1596876665015382018,this is the corniest shit i’ve seen in a while like why are you as an adult doxxing a teen to the whole internet because they’re vaping at school 😐 and the males in the replies are weirdos too https://t.co/4xeAaBnDAP,heejinslisa,2022-11-27 14:40:40+00:00
1255,1596876662087434242,Vandy Vape Pulse AIO Mini Kit Giveaway https://t.co/9e1Pv9kPst,MissiBeasley,2022-11-27 14:40:39+00:00
1256,1596876632928620545,Lost Vape Centaurus M200 Kit Giveaway https://t.co/UItzPvPkwo  @Sourcemore_Ecig,ganante,2022-11-27 14:40:32+00:00
1257,1596876058854584320,I have this shitty little vape that I hardly ever use but it literally says dinner lady on it and I'm like.. how did u know?,AllThisWreckage,2022-11-27 14:38:15+00:00
1258,1596876031230607361,The way ppl share vapes is nasty work,DAMN_Swartz,2022-11-27 14:38:09+00:00
1259,1596875857334779905,"Last night in Lochgilphead, our officers found teenagers of various ages in possession of alcohol, vapes, cigarettes, lighters and a  grinder.  As they were all under age, items were handed to police for disposal.  #KeepingPeopleSafe https://t.co/oxZiwv3uuu",MAKIPolice,2022-11-27 14:37:27+00:00
1260,1596875769837670400,"yey congrats to me, i didn't use my vape today 🥳",wdymmmcat,2022-11-27 14:37:06+00:00
1261,1596875472037564416,quit vaping my chest ah kill meeeee,bellaasmj,2022-11-27 14:35:55+00:00
1262,1596875322586431488,Vape instead of cigs or nah,421EVER,2022-11-27 14:35:20+00:00
1263,1596875151442071552,"Time to give GBs vape a bash. Tastes great, good start ✌️ https://t.co/NMzIB5fWXq",le4Twenty,2022-11-27 14:34:39+00:00
1264,1596874844855226369,EU to introduce bloc-wide vaping levy https://t.co/WArVyW3g8m,phil_w888,2022-11-27 14:33:26+00:00
1265,1596874710562000898,*hits vape* “damn this song is sad…” https://t.co/PAAi3odoWa,underwaterbby,2022-11-27 14:32:54+00:00
1266,1596874708435488774,Yall also need to stop vaping and just smoke weed lol,ElHuelePanti,2022-11-27 14:32:53+00:00
1267,1596874569557585921,i ain’t gonna lie this will be the nerdiest thing i ever say…it genuinely hurts my soul when people call soil dirt LMAO,snoochyboochyzz,2022-11-27 14:32:20+00:00
1268,1596874396479938560,my toxic trait is i don’t like messaging people who sell vapes cause i feel bad for bothering them all the time but also like they signed themselves up for it by going into that line of business,ruby420169,2022-11-27 14:31:39+00:00
1269,1596874171426181120,Thank you York Region Public Health for educating us on the risks of vaping. ⁦⁦@YRDSB⁩ https://t.co/7E1UpRW8aZ,StouffvilleDSS,2022-11-27 14:30:45+00:00
1270,1596874072360882177,4 hour drive back to chicago with a dead vape and no new red scare ep https://t.co/LjOtH2gUA4,chimp__simp,2022-11-27 14:30:21+00:00
1271,1596874056422547456,Check out the great deals at https://t.co/Pau7B25Efb and take another 10% off those deals with exclusive coupon code vapingtruth. #vapingtruth,thevapegoods,2022-11-27 14:30:18+00:00
1272,1596874003645440003,"Health risk of counterfeit vape products highlighted by Elf Bar
https://t.co/xy8rAYZ1zt",CStoreTweets,2022-11-27 14:30:05+00:00
1273,1596873983470993408,Is it Wrong to order a vape mine is so bad,starryhaze69,2022-11-27 14:30:00+00:00
1274,1596873981503672325,"Vampire Vape 50/50 Vanilla Tobacco is a rich, creamy flavour with notes of vanilla and earthy tobacco.

https://t.co/LDZFnIg8ZX

#ukvaporwaves #vapeuk #vapor #vaping #vapers #eliquid #eliquiduk #vapejuice #vape https://t.co/gj3Lxy9Xu3",ukvaporwaves,2022-11-27 14:30:00+00:00
1275,1596873964554317824,these were free u know i had to grab em😂 https://t.co/V1v8pR0dGZ,snoochyboochyzz,2022-11-27 14:29:56+00:00
1276,1596873740687929345,Whoever took my vape last night ya motha a whore,buttdick69,2022-11-27 14:29:02+00:00
1277,1596873730445103104,"Over the last year, Money Twitter literally bullied me into:

• Quitting porn
• Quitting weed
• Quitting vaping
• Minimizing alcohol
• Eating 8+ eggs/day
• Gaining 15 lbs of muscle
• Generating online cashflow
• Networking with new best friends

I’m staying here forever.",selfautonomy,2022-11-27 14:29:00+00:00
1278,1596873663378124800,On day 3 no vaping 😊,gvc367,2022-11-27 14:28:44+00:00
1279,1596873637180903424,Ocakes good night lelz,severus_vape0,2022-11-27 14:28:38+00:00
1280,1596873614103486465,"Allen Carr's Easy Way to Quit Smoking Without Willpower - Includes Quit Vaping: The Best-selling Quit Smoking Method Updated XZ1NBNK

https://t.co/s6xV2Wzdt6 https://t.co/xolcciKK1r",rl_ucp,2022-11-27 14:28:32+00:00
1281,1596873230496710657,"😍 Dinner Lady has Just landed with a Full Range of NEW products! From E-liquids to disposables enjoy your favourite flavours from this classic brand! 

#clearance #disposablevape #vape #vapeuk #vaping #vapinguk #fruitflavours #vapefam #vapelife #vapepen #instavape https://t.co/HYex5qCdlf",JM_WholesaleLtd,2022-11-27 14:27:01+00:00
1282,1596873226247802880,"From tobacco to vape
From meat to fake meat
From beer to alcohol free

Vices are changing fast...",UmbertoUrso,2022-11-27 14:27:00+00:00
1283,1596873205657964545,they got y’all with the vapes now they rebranding gambling addiction too https://t.co/pvXhFNRlGS,11thhaus,2022-11-27 14:26:55+00:00
1284,1596873064691929088,End the vaping epidemic https://t.co/BXKmSRjRLu,R_Orv,2022-11-27 14:26:21+00:00
1285,1596872815071879169,Hey does anyone know if MetLife stadium allows you to bring a vape?,OmG_SheGorgeous,2022-11-27 14:25:22+00:00
1286,1596872638668111873,sharing vape pens is criminal,EVass500_,2022-11-27 14:24:40+00:00
1287,1596872590307786753,"DEAR ANTIVAPE COMPANIES THAT ARE TRYING TO GET ME TO STOP VAPING. IM A TERMITE, I DO NOT VAPE.",TermiteArtist,2022-11-27 14:24:28+00:00
1288,1596872348002488320,i’m never getting one of these done bc if i don’t like it i will k*ll myself in front of the artist so they have to think about it every day for the rest of their life https://t.co/NB1e6K8yI0,bionicbitch420,2022-11-27 14:23:30+00:00
1289,1596872209028763648,This is actually wild https://t.co/hZV3hsPICu,Lankydave94,2022-11-27 14:22:57+00:00
1290,1596871792957984768,The light-headedness I feel after vaping so much so quickly is the best feeling in the world I wish it lasted longer,Hi_Im_Praba,2022-11-27 14:21:18+00:00
1291,1596871520122728450,BUY PREMIUM QUALITY WEED VAPE CARTRIDGES EDIBLES IN LONDON https://t.co/cq46as35ab,CaliWeedLondon1,2022-11-27 14:20:13+00:00
1292,1596871366007230464,"HE exists sick weed vape, I'm gonna go to the dentist's woop I say my race at all fuck little bit since I enjoy this loud",sentences424,2022-11-27 14:19:36+00:00
1293,1596871251691470850,Over 30% of matrices at affluent schools are vaping Watch #carteblanche tonight. https://t.co/tYlNr4UTi5,CarolAlbertyn,2022-11-27 14:19:09+00:00
1294,1596871120044830721,"The new L200 Classic is the most durable box mod ever, featuring a timeless design inherited from OG Legend. Supported by dual 21700 batteries, this robust beast provides up to 200W output. 
🌐 https://t.co/KvH7MHcOFF
#Vapekinguae #vapekingdubai #vapeking #vapejuice #vapeshop https://t.co/8g38BoBKye",Vapekinguae,2022-11-27 14:18:38+00:00
1295,1596870871872057345,"(Part 1) In a year I went from a sweet innocent girl that cried when she saw her brother vaping or her parents smoking pot, never said a cuss word in her life, 3 months clean of #sh and getting her mental health back on track to shing everyday again, being high everyday all day",N_EDTW,2022-11-27 14:17:38+00:00
1296,1596870560839274496,"Every time I see people vape in public, I always think about that commercial with the lady who had a lil hole in her throat 😭",harveybookr,2022-11-27 14:16:24+00:00
1297,1596870409970155520,hitting the vape when drunk is so heavenly but when i’m sober it just feels like an inhaler,moistlitmus,2022-11-27 14:15:48+00:00
1298,1596870389983911936,"All month we are celebrating #NoVapeNOVEMBER 

This month help your child, or a child you know trash all the vapes and tobacco products, because we are promoting the prevention and cessation of youth tobacco use and vaping! https://t.co/hcqjVqYlLA",DFCofDC,2022-11-27 14:15:44+00:00
1299,1596869921568264192,not liking any disco pics with bad outfits,bionicbitch420,2022-11-27 14:13:52+00:00
1300,1596869785866113024,Two kids swapping a vape and a cigarette? Wtf? Methinks vaping isn’t quite the smoking quitting thing it is marketed as…see also Nike knowing their shoes aren’t just for running…,amotorhomme,2022-11-27 14:13:20+00:00
1301,1596869489563697152,Anybody when they first start vaping https://t.co/hZ12QYQZPz,SoOutplayed,2022-11-27 14:12:09+00:00
1302,1596869468600225792,somewhere tropical https://t.co/GWDmFBiiop,444juul,2022-11-27 14:12:04+00:00
1303,1596869145135525888,"Playtime…

“Of course I invited you. You promised me a replacement for the cape I have.”

She sits up, as she takes one more drag off the vape just to tease him. “Relax. You can just take a play out of Bill Clinton’s book.” She clears her throat and tries to sound stern, “I -&gt; https://t.co/PTDvkz0oQD",Complain2Vought,2022-11-27 14:10:47+00:00
1304,1596868996019937291,umay lowbatt vape alaws charger,ivnsuministrado,2022-11-27 14:10:11+00:00
1305,1596868987094433792,"Pride and Prejudice: But Mr  Darcy is a Vape God RAOZUUS

https://t.co/wAaM0UESKq https://t.co/h9eoIUZ2Kq",senger19ltx,2022-11-27 14:10:09+00:00
1306,1596868915207905281,I just swallowed my juul 😰,trinavegatwt,2022-11-27 14:09:52+00:00
1307,1596868877845401600,"My husband’s laptop is charging my vape pen and I think technology is amazing. 😂 Thanks for the Maryjane, Robots!",BethT79,2022-11-27 14:09:43+00:00
1308,1596868769045184512,nothing wrong w smokin mid. I got plenty of already vaped bud I can sell you since you like smoking shit https://t.co/bhZ2HY5qLg,RoyalsMLBChamps,2022-11-27 14:09:17+00:00
1309,1596868480778633218,someone buying you a vape in a flavour you love without even asking you… green flag &lt;3,tesco4eurowine,2022-11-27 14:08:08+00:00
1310,1596868379645657088,fucc i miss my vape,bngrll,2022-11-27 14:07:44+00:00
1311,1596868179434708995,YAYYYYY THE REP VINYL https://t.co/Hvg1K7DRnf,canyonhalos,2022-11-27 14:06:57+00:00
1312,1596868042058715138,"AAAAIIIGHT HERE WE GO! CHRISTIAN MINGLE, GRINDR, GEEKS, FREAKS, KINGS, QUEENS, PIMPS, HOES, THE MFKN 🌈, STONERS, SMOKERS, GROWERS, VAPERS, RAIDERFANS, DEMBOIS, RASTAS &amp; THEE REST OF TWITTERVERSE! WAKE, BAKE, RISE, GRIND, SHAKE WAT YA MAMA GAVE YA! CAN I GET A ""HELL YEAH"" 1X",savagedrgn4u,2022-11-27 14:06:24+00:00
1313,1596868008651390976,I quit vaping yesterday like cold Turkey no intention buying another - so far so good,un1c0rnprinc3ss,2022-11-27 14:06:16+00:00
1314,1596867852145156096,THIS GUY JUST BLEW HIS VAPE PEN SMOKE IN MY FACE AND IT SMELLED LIKE HOT DOGS,MTHRTRSA,2022-11-27 14:05:38+00:00
1315,1596867847204265990,You could excel at combining friendship and family in a unique... More for Aquarius https://t.co/MzDLJN8R6w,VRocksVapeShop,2022-11-27 14:05:37+00:00
1316,1596867562092269568,"You may presently be on a hunt for privileged information, and... More for Gemini https://t.co/w23C6YGOGN",vape_loverr,2022-11-27 14:04:29+00:00
1317,1596867557285277696,Are vapers the new vegans?,2R_JG,2022-11-27 14:04:28+00:00
1318,1596867543838646273,Sponsor po vape juice ung pastry na ry4🥰.,AndreiDeala,2022-11-27 14:04:25+00:00
1319,1596867262715408385,Bitches really want to talk about ancestral healing while drinking oat milk and hitting a vape,SpeepyBunny,2022-11-27 14:03:18+00:00
1320,1596867194364698626,First thing I grab in the morning is my vape smh,mommianap,2022-11-27 14:03:02+00:00
1321,1596867165973381120,The UK Government wants us all on the vape...like good little prisoners.,Deanmadalba,2022-11-27 14:02:55+00:00
1322,1596866842655870977,VAPES DONT GO OUT WHEN WALKING YALL JUST STOP SMOKING CIGS,sourth1n,2022-11-27 14:01:38+00:00
1323,1596866833717809152,"Just a few days left of our Black Out Sale!

https://t.co/QAD6UzN61V

#Vape #vapelife #Eliquid #Ejuice #GiantVapes #GV #gvfamily #gvfam #ecig #ecigarette #vapedaily #vapestagram #vapeon #instadaily #vapeallday #blackfriday #blackfridaysale https://t.co/99eXYSDsXg",GiantVapes,2022-11-27 14:01:36+00:00
1324,1596866768080752640,Check out the great deals at https://t.co/Kait3u5FEH and take another 10% off those deals with promo coupon code vapingtruth. #vapingtruth,thevapegoods,2022-11-27 14:01:20+00:00
1325,1596866742130987010,"🎯Crazy deal! Don’t miss out!🎯
💥Banana Cheesecake XL - 250ml By Home Vapers on sale for £19.99 💥
Shop now before we sell out! 👉 https://t.co/JoyEVqqFup https://t.co/7vcTxp6q4M",home_vapers,2022-11-27 14:01:14+00:00
1326,1596866667174187008,"The star-spangled patriot approached his secretary, gloved hands clasped behind his back as he strolled leisurely. Making it seem like he's not in a hurry. 

""Don't act so surprised. You practically invited me."" 

And when he caught a whiff of the vape, it was like torture + https://t.co/NuUNqSf9Nc",AIIAmericanSupe,2022-11-27 14:00:56+00:00
1327,1596866658848514049,"Many young e-cigarette ever-users surveyed started vaping to lessen feelings of stress, anxiety, and depression. But research shows links between nicotine use &amp; worsening mental health symptoms. Learn more from @truthinitiative Visit https://t.co/U8s3wfDYIx",DHD2_MI,2022-11-27 14:00:54+00:00
1328,1596866551248203777,I have seen so many wild things in this country but seeing a grandma and a mum smoke cigs with their 13-14 y/o smoking a vape in front of a children’s hospital that has “please don’t smoke in front of the hospital” signs plastered all over it is insane,blakaid,2022-11-27 14:00:28+00:00
1329,1596866543329378306,Don’t Vape have a Cape,Dont_Vape_Bot,2022-11-27 14:00:26+00:00
1330,1596866174054121472,parent-proofing my apartment (putting my weed pen and vape in a drawer),roooo_bert,2022-11-27 13:58:58+00:00
1331,1596866148024328192,Earned 2 PSN trophies (2 bronze) in Goat Simulator 3 https://t.co/ZbawGqJreo,JuulStreamt,2022-11-27 13:58:52+00:00
1332,1596866114524393472,Where the fuck is my juul,catvaIentinetwt,2022-11-27 13:58:44+00:00
1333,1596865926460100610,"blow vape, scotch tape, tape deck, neck brace",QwuhBot,2022-11-27 13:57:59+00:00
1334,1596865648042266624,"We get it, you vape &gt;.&gt; https://t.co/vkxbcppIJw",_pronto_,2022-11-27 13:56:53+00:00
1335,1596865642728415234,New mission. Attempt to walk the length of Chippenham high street and not get engulfed in vape smoke.,Moulesy23,2022-11-27 13:56:52+00:00
1336,1596865273600307202,update: i lost a vape and my lipgloss. https://t.co/apJqB2GhFX,jamiebqwer,2022-11-27 13:55:24+00:00
1337,1596865175994630150,Grab some great Black Friday / Cyber Monday Vape Deals from @vapesourcinguk ! We have a discount code plus there will be various flash sales ending 30th November!    https://t.co/r5rqCMEVP5         #VapesourcingUK #BlackFriday #CyberMonday #Vape #Ecigclick https://t.co/6bma9KFxLm,EcigClick,2022-11-27 13:55:00+00:00
1338,1596864462128287744,"Technically, if you ever see a kid vaping outside you could always take it from them, what are they gonna do? Tell their parents/teachers?",Meanb3anMachine,2022-11-27 13:52:10+00:00
1339,1596864373645258757,Vapes out game on https://t.co/n3evsf01sq,tom77714,2022-11-27 13:51:49+00:00
1340,1596864328447438848,I got banned on fb for posting my vape shops Black Friday deals 🙄,XeXee_D,2022-11-27 13:51:38+00:00
1341,1596864033705320450,How come every single kid under 16 now has an addiction to vaping?,simonr555,2022-11-27 13:50:28+00:00
1342,1596863950670692352,Vape shop x mental health collab https://t.co/eonFO33ER9,alexeptable,2022-11-27 13:50:08+00:00
1343,1596863896874209280,Vape Cartridges Edibles and Weed Strains with Discreet Delivery in London https://t.co/lq1sAmXawz,BUYWEEDLONDON1,2022-11-27 13:49:55+00:00
1344,1596863817543450624,Some people are really hot up until the minute you learn they vape,psoriatic_jack,2022-11-27 13:49:37+00:00
1345,1596863723615834112,BTS as creators create this is warning ⚠️ and some convos we have as we see trends along with ppl trying to be friend truthers who are just living authentic lives advocating ✌🏽 so I’ll be creating new content #bluelotus #vapes #oils https://t.co/j7L8a8dDsD,peacelovbridge,2022-11-27 13:49:14+00:00
1346,1596863671434715146,"Top Quality Weed Strains, Vape Cartridges, Edibles available for delivery in London UK https://t.co/qUfYBBw3Ua",BUYWEEDLONDON1,2022-11-27 13:49:02+00:00
1347,1596863483596853248,I just swallowed my juul 😰,catvaIentinetwt,2022-11-27 13:48:17+00:00
1348,1596863475699314689,Vapes really have a grip on everyone I thought it was just America,idreamofher2,2022-11-27 13:48:15+00:00
