,TweetID,TweetContent,TweeterUsername,TweetDatetime
612,1596949815904337920,check out my new vape pen,andrejchanbot,2022-11-27 19:31:20+00:00
613,1596949738892722177,Brussels to propose first EU-wide vaping levy https://t.co/YGDa7BSEOY,Forest_Ireland,2022-11-27 19:31:02+00:00
614,1596949656876904448,you either vape or you die,anasuibot,2022-11-27 19:30:42+00:00
615,1596949529370460161,fries,demoloving,2022-11-27 19:30:12+00:00
616,1596949508122116096,Why vape when you can sleep,Dont_Vape_Bot,2022-11-27 19:30:07+00:00
617,1596949465629335554,"20mg Elux KOV Bar Lemonade Series Disposable Vape Device 600 Puffs - Flavour: Pink Lemonade | Tobacco Products

https://t.co/OY39WoQ85i

#TobaccoProducts #FoodBever...",addtocart,2022-11-27 19:29:57+00:00
618,1596949386386640897,I just saw someone vape in the Cheesecake Factory,swiftbitism,2022-11-27 19:29:38+00:00
619,1596949371085803520,Fat Randy would have made that smh.,juul_mango,2022-11-27 19:29:34+00:00
620,1596949282720206848,after lunch vape hits just hit the spot😝😝,prozacpusssy,2022-11-27 19:29:13+00:00
621,1596949166051119104,Vaping products have been placed in a prominent position in @coopuk Ruddington shop. I feel this promotes the products to young people and is irresponsible. Please look into this @RUDDINGTON_info,Philrobertss,2022-11-27 19:28:45+00:00
622,1596948660147081217,A surprising side effect of vaping — dental health. https://t.co/UmcmnR7mDk,MarianHolling,2022-11-27 19:26:45+00:00
623,1596948370454900736,how i hide my backup vape so well i can’t even find it now 🥲,kenzie_deshea,2022-11-27 19:25:36+00:00
624,1596948279433957377,Using my juul like an oxygen mask in the employee bathroom,_DockEllis,2022-11-27 19:25:14+00:00
625,1596948008280940544,Vape and gin hindi magandang combination amp 🤮,MartyMcfly_11,2022-11-27 19:24:09+00:00
626,1596948004740943873,im living off of dead vapes,ooohmygoth,2022-11-27 19:24:08+00:00
627,1596947835492368384,whitelist Assigned  @yijane @KingPzKpfw @Frums4G @KuroooooHachi @0xKate_web3 @francois_waters @LadyGagita00 @baiiley_wright @ClubNeokats @vapes_lord @SillyThakidd @prickypitanga @GeerBoxx_Inc https://t.co/pz3LtZKXef,livario11218609,2022-11-27 19:23:28+00:00
628,1596947783147491330,the way me and other people’s vapes are the perfect pairing lmfaoo,smallbabylil,2022-11-27 19:23:16+00:00
629,1596947730039209984,should i start vaping,starving4sap,2022-11-27 19:23:03+00:00
630,1596947725454823425,"Tucker took a
few vapes with
With Sean https://t.co/jlQZKgJyUV",ChrisFi24960366,2022-11-27 19:23:02+00:00
631,1596947494092820480,can someone send money i want to buy vape🙏🏼,dumbm4rshmallow,2022-11-27 19:22:07+00:00
632,1596947422655426561,the amount i smoke and vape i dnt fink ill make it pasg 29,lizzygrcnt,2022-11-27 19:21:50+00:00
633,1596947359262728192,who the fuck ripped this fat vape at silent hill ?,L00KINGFORMARY,2022-11-27 19:21:34+00:00
634,1596947327381823488,"Apple pie and custard available from @SweetGeezVapes 

Check it out! This juice is honestly banging..

Check the gram kit (link in my bio)🙏

#vaporwave #vaper #Influencer #ukvaper https://t.co/a1m30RSipR",thevapeking93,2022-11-27 19:21:27+00:00
635,1596947200285679616,"can someone buy me a vape? it’s day 4 wo one and i’m on edge, also been at work all day the past 4 so i can’t buy it. i’ll pick it up after work tho??? lmao",tufavoritaa__,2022-11-27 19:20:57+00:00
636,1596947033772130304,Emotional support vape to get me through the day,MadisonBice,2022-11-27 19:20:17+00:00
637,1596947033763778560,Does anyone know where I get these caffeine vape or pods? I can only think they just sell them online,chibi_chan2022,2022-11-27 19:20:17+00:00
638,1596946925353590784,"fucking being heartbroken, have y’all ever lost a vape the same night you bought it? that’s a different type of hurt 💔",Mariooota,2022-11-27 19:19:51+00:00
639,1596946880369688577,Nottingham is addicted to vapes,dillon_bangar,2022-11-27 19:19:40+00:00
640,1596946837919137792,why does no one have vape i need to buy a new one,prozacgirlblogr,2022-11-27 19:19:30+00:00
641,1596946837277376512,It was pretty difficult but I beat the Pyro cube in the hardest mode!!So proud of my vaping queen. https://t.co/0ImIuC08wC,BunniesPeachie,2022-11-27 19:19:30+00:00
642,1596946768058458113,Sucking on vapes and blowing out big clouds of cum,rootbeerfloats0,2022-11-27 19:19:13+00:00
643,1596946520804245504,"Get you a girlfriend who vapes, and also will use a condom.",whocandobot,2022-11-27 19:18:15+00:00
644,1596946315274948609,ISIS has won. my thc vape is not allowed in my carryon. rights no longer exist. black adam was right : we should kill people we dislike,slippintrimmy,2022-11-27 19:17:26+00:00
645,1596946285093072896,Reminds me of that Juul episode on that very shortlived Neflix docuseries Broken. https://t.co/UKShLiaXpx,lerato_motau,2022-11-27 19:17:18+00:00
646,1596946274158141440,I dont fux with vape cuz my life is straight,rootbeerfloats0,2022-11-27 19:17:16+00:00
647,1596946198379696129,"Love that because I’m a man, the shit that happened to me is our down to someone being “immature”
Or completely swept under the fucking rug. Wish more men would speak up",BlueberryVape69,2022-11-27 19:16:58+00:00
648,1596946134957985794,"The real vape epidemic is in the UK, that’s for sure",lalawosala,2022-11-27 19:16:43+00:00
649,1596946047577731073,someone please send my money for a new vape 😭 this weeks been the worst,harleenfrancis,2022-11-27 19:16:22+00:00
650,1596945928925360129,"Yeah, put that in your Vape 💨 https://t.co/Cpgir4Exyz",antiintelect,2022-11-27 19:15:53+00:00
651,1596945665565020162,me hitting all my friends vapes constantly https://t.co/dNYCeVAN8J,s_ofs_,2022-11-27 19:14:51+00:00
652,1596945629074587650,"Welcome to CakeCartsBrand. The Best place to buy high-quality carts online, flavors for sale, edibles, Indica, and hybrid Strains. Top-quality medical cartridges well lab tested. Buy Vapes and carts online… Buy cartridges online without a medical card...
https://t.co/5K2jkIdfym",Abdulhayeekh,2022-11-27 19:14:42+00:00
653,1596945397997793280,"Excuse me, but can you please not vape around my rescue puppy.",NelRock777,2022-11-27 19:13:47+00:00
654,1596945260667895808,She vaping in my room that shit lit up like a glow lamp,Roach__45,2022-11-27 19:13:14+00:00
655,1596944793695059968,"Disposable vapes should be banned. They are near impossible to recycle, the waste is damaging to the environment and they’re specifically designed to encourage more young people to take up a habit that evidence increasingly shows is damaging to health. https://t.co/LHFZmgk94i",violatricky,2022-11-27 19:11:23+00:00
656,1596944718466015233,Fog is God’s vape cloud.,JBNpod,2022-11-27 19:11:05+00:00
657,1596944154080456704,The Latest GSTHR Estimate Shows a Significant Rise in Vaping Globally  *Curated content by RegWatch  https://t.co/MNBAkwoe1G https://t.co/mDlDR8OL8y,RegWatchCanada,2022-11-27 19:08:50+00:00
658,1596943918821953536,"Welcome to CakeCartsBrand. The Best place to buy high-quality carts online, flavors for sale, edibles, Indica, and hybrid Strains. Top-quality medical cartridges well lab tested. Buy Vapes and carts online… Buy cartridges online without a medical card.
https://t.co/5K2jkIdfym",Abdulhayeekh,2022-11-27 19:07:54+00:00
659,1596943821325012992,Sneaking vape hits in your family home should be an Olympic sport,carnalhunger999,2022-11-27 19:07:31+00:00
660,1596943796201480192,Thank you so much for this.....i thought my vaping had finally caught up to me . https://t.co/32MmLgzPQG,geminhighhhh,2022-11-27 19:07:25+00:00
661,1596943792187506688,Just found half a vape cartridge in my closet... happy Sunday to me!,AllieTheEditor,2022-11-27 19:07:24+00:00
662,1596943676244398081,The people that still use Juuls are the real soldiers,MagicUser666,2022-11-27 19:06:56+00:00
663,1596943514150936576,Vap’News : 27 novembre 2022  https://t.co/z7E5M4wXlg #vape #ecig,benoit_durand,2022-11-27 19:06:18+00:00
664,1596943480324231169,Vap’News : 27 novembre 2022  https://t.co/yaz0vzKgC3 #vape #ecig,FernandDurand3,2022-11-27 19:06:10+00:00
665,1596943454633807872,On the verge of a fucking breakdown. I do not want to exist rn,BlueberryVape69,2022-11-27 19:06:04+00:00
666,1596943355568885760,"#thc #cbdhealth 
#cannabiscommunity
 When you need a quick burst of creative energy, you need to grab some. Delta-10 Disposable Vape Pen Rainbow Sherbet! With Hyper Delta-10 Disposable Vape Pens in Rainbow Sherbet, you can experience an https://t.co/6zdDeP92uF #cbd #cbdoil https://t.co/0zuz6heQZ6",cbdhealthbasket,2022-11-27 19:05:40+00:00
667,1596943318960984066,Vap’News : 27 novembre 2022 https://t.co/yaz0vzKgC3 #vape #ecig,FernandDurand3,2022-11-27 19:05:31+00:00
668,1596943318357004288,millennial uncle/aunts instagram posts feel like shitposts,Bread5password,2022-11-27 19:05:31+00:00
669,1596943279584870400,Vap’News : 27 novembre 2022 https://t.co/z7E5M4fUjg #vape #ecig,benoit_durand,2022-11-27 19:05:22+00:00
670,1596943278238142464,*hits vape*,KurtKunkleQuote,2022-11-27 19:05:21+00:00
671,1596942855595261955,"The Vaporesso Target 100 vape kit is a compact option for sub ohm vaping that still delivers on power. It can be used with your choice of either a 18650 or 21700 battery (sold separately) and it delivers up to 100W.

660 Vape and Smoke Shop KC

https://t.co/0e9c788yHQ https://t.co/3tlLririAo",660vapeandsmoke,2022-11-27 19:03:41+00:00
672,1596942767682617344,there is just something about vaping that will always piss me off sorry ❌️ like if u come around me with ur vape that smells like Ass i will just assume i have full permission to knock u out,odeioalternas,2022-11-27 19:03:20+00:00
673,1596942753824673794,"The #vape market is exploding! Earn money promoting #vaporizers in the AirVape #AffiliateProgram.

JOIN NOW &gt; https://t.co/kMnFTp8Ujy

#digitalmarketing #passiveincome #earnmoney #marketing #vape #cannabis #marijuana #blogging #blogger #job #seo #business #smm #influencer #job https://t.co/YxPC34bHst",CannaAffiliates,2022-11-27 19:03:16+00:00
674,1596942692902002688,"WE HAVE 3 DAYS SALE‼️‼️ 
( Nov. 27 - 30 )

Kicks &amp; Clouds celebrating 1st Monthsarry today!
 Less 20 pesos vape juice &amp; disposable vape 
Less 100 pesos all shoes.

HAPPY MONTHSARRY KICKS &amp; CLOUDS‼️🎂🎉 https://t.co/JoGAIcaNC0",jeckyluckychan,2022-11-27 19:03:02+00:00
675,1596942688086917121,taking a bunch of puffs off my juul and stumbling around like a drunk skyrim character,TessCo10,2022-11-27 19:03:01+00:00
676,1596942570193649665,I was going to happen at some mf at a party who left his juul at home,ClayBorrellBot,2022-11-27 19:02:33+00:00
677,1596942525717417984,Where’s my vape,SophieMartini,2022-11-27 19:02:22+00:00
678,1596942435363323904,"the losers are starting to vape, that’s my sign to quit",erikvmve,2022-11-27 19:02:01+00:00
679,1596942336101343233,residual vape air/breath stench smells so bad like warm milk with a side of mayonnaise no matter that flavor it is .. https://t.co/oxEJfLwsAE,pip___squeak,2022-11-27 19:01:37+00:00
680,1596942271639097345,I’ve legit seen this type of guy on the side of the road spinning a sign for a vape store. https://t.co/2CprZ6fYpg,EmmaAdella,2022-11-27 19:01:21+00:00
681,1596942269210558464,"Best CBD Vape Juice - A guide to CBD e-liquids, how to incorporate CBD into your routine, and the most dependable brands

https://t.co/soPxnpGAXu",Vaping360,2022-11-27 19:01:21+00:00
682,1596942199526428672,No chance in hell that I'd be roommates to someone who vapes 🤮 https://t.co/AV1nVHXK73,Ds11Smith,2022-11-27 19:01:04+00:00
683,1596942180807069698,"For those of us who know the truth about vaping, it is frustrating to watch authorities deceive the public about tobacco harm reduction.

Are they knowingly lying or are they just repeating a false narrative?

If so, who is dictating the narrative???

https://t.co/sRbeOSgdf7 https://t.co/egKksFzLN8",VAEPinfo,2022-11-27 19:01:00+00:00
684,1596942137597497346,"It's here!! The new Feenix University design is now a T-Shirt, Hoodie, Tank and more!

T-Shirt: https://t.co/quRebUsUNy 

Hoodie: https://t.co/ilCmftfnlC

Tank: https://t.co/0N7tMwxDT7 (for you @oso_vapes )",Ki11ersix,2022-11-27 19:00:50+00:00
685,1596942055343017984,"The XROS Mini by Vaporesso is a fantastic starter kit for any new vaper 🙌 

1000 mAh battery, up to 16 watts of power and USB-C charging. Ideal for any newbie.

🎥 To watch the full video click here 👉 https://t.co/cdeQzVmf4S

#Vape #VapeKit #Vaping https://t.co/spKHfZSXu8",EvapoHub,2022-11-27 19:00:30+00:00
686,1596941935922405376,"🟢🌿💨Our November 2⃣0⃣% off sale on @GreenDotLabs Black &amp; Blue Label vape carts and concentrate grams ends soon, Purests! Stop into Simply Pure before Thursday, 12/1 to stock up and save.💨🌿🟢
#Denver #dispensary #cannabis #BlackOwned #WomanOwned #VeteranOwned #IAmAPurest💚 https://t.co/avctDpfRLa",SimplyPureMJ,2022-11-27 19:00:01+00:00
687,1596941813499166721,"Adult live streaming platform for #cannabis lovers worldwide ! ......  
https://t.co/vsjPLNgFXb ...... #OnlyFans #onlyfansgirl 
#OnlyFansPromo 
#onlyfan
#chaturbate 
#stripchat
#camgirl
#nudes
#tease 
#stonerchicks 
#stoners https://t.co/lpnpZZL2CS",vapor_dot_com,2022-11-27 18:59:32+00:00
688,1596941758168195072,I still miss vaping and it’s been more than 2 months wtf,ogdionnee,2022-11-27 18:59:19+00:00
689,1596941464399147008,not my recent exmo cousin posting on his story that he feels crazy after a big hit of his nicotine vape lmao,pnwkww,2022-11-27 18:58:09+00:00
690,1596941173909819394,"Youth may turn to vaping to try to deal with stress or anxiety, creating a cycle of nicotine dependence. But nicotine addiction can be a source of stress. Visit https://t.co/Sgtwz4Td9f or text QUITNOW to 333888 for free, one-on-one help right from your home! #QuitVaping https://t.co/Mte1ULaQ8f",KYTobaccoFree,2022-11-27 18:57:00+00:00
691,1596941120365563904,The first 90 minutes of a game are completely pointless. All hell breaks out when you make a couple of substitutions in injury time. (Scroll up the thread to see the ridiculous brawl that led to those red cards). https://t.co/rlA07KAPj1,ArtyVapes,2022-11-27 18:56:47+00:00
692,1596940993869545472,Blueberry vape 🫐 https://t.co/9PS0SeoVDg,thewavebenderr,2022-11-27 18:56:17+00:00
693,1596940950341050369,"SMOKES in Dad by the Sword, because my dad used to smoke**

Gives 6 seconds of crits, but depletes your health. Soon all the other cigarettes will fly out of the package during the animation, only one gets in your mouth

**He vapes now, which is also an item in Dad by the Sword https://t.co/pDfif4LOEg",rocketcatgames,2022-11-27 18:56:06+00:00
694,1596940836356472832,"Down to my last bottle of liquid! [by NXPRO27]
  
 #vapeOn #vapor https://t.co/PYy4dvWZjv",VapesHeaven,2022-11-27 18:55:39+00:00
695,1596940557116661760,Vap’News : 27 novembre 2022 https://t.co/jO9RaWTCX0 #vape #ecig,vapeurfou,2022-11-27 18:54:33+00:00
696,1596940484412604416,off to Harrods for a new vape,chlo_myerss,2022-11-27 18:54:15+00:00
697,1596940370318761985,This mf in the twittwr space has just claimed to “vape four hamburgers” please someone explaim,Louispills66,2022-11-27 18:53:48+00:00
698,1596940331987402753,in the morning when I wake up I always grab my vape but then fall back asleep before I can hit it,samxra,2022-11-27 18:53:39+00:00
699,1596940251746177025,Not only vape it's my memories https://t.co/qb83LWNOhu,N0_Beautiful,2022-11-27 18:53:20+00:00
700,1596940226727116800,dude if I got money every time I lost my mf vape I'd be SO RICH! Like how tf it end up across my room and I was just hitting it ???,allaboutJAZZZy,2022-11-27 18:53:14+00:00
701,1596940064969592832,can’t find my vape so naturally i’m losing my mind,redwhines_,2022-11-27 18:52:35+00:00
702,1596940036158914560,"i’m gonna quit vaping,, wish me luck",SHAlSHYSHY,2022-11-27 18:52:28+00:00
703,1596940020157665280,if there's anyone who is in a position to talk to dan about top dan memes in 2022 this year still and who would be able to give him the qr code to the thread vii and i made???? please let me know because i have a qr code,aIlsaints,2022-11-27 18:52:25+00:00
704,1596939988163506178,Those iraqi boys who have their vape on a lanyard are weird,simitbread,2022-11-27 18:52:17+00:00
705,1596939880994856961,i'm gonna switch from vaping to smoking to improve my attention span and hand eye coordination,whitest__dad,2022-11-27 18:51:51+00:00
706,1596939823583219712,can someone please help me decide what new shoes to get PLEASE,juleiscool1,2022-11-27 18:51:38+00:00
707,1596939739739066368,I just wasted my money on this vape 🥴,PrettyfaceYae_,2022-11-27 18:51:18+00:00
708,1596939619693912064,Quitting vaping the same week I’m out of state alone with all 3 kids is the worst decision I’ve ever made,moriahmcsperitt,2022-11-27 18:50:49+00:00
709,1596939477250818048,"Gravity Wraps Opal Holographic Skin for Vape | Decal | Wrap | Sticker CIVOA6X

https://t.co/KiFZuE6GdE https://t.co/PxEazFgYBg",swaniawskitoqzj,2022-11-27 18:50:15+00:00
710,1596939463011094528,“Call my vape” -me last night drunk asf,mikayla_maxx,2022-11-27 18:50:12+00:00
711,1596939289769959424,yelan's e just vape one shot childe form 2 :3,gorakechi,2022-11-27 18:49:31+00:00
712,1596939085263687680,"Awesome overview and summary of what we've shared on $VAPE tokenomics so far! @CryptoAllStarrs always going the extra mile to consolidate, synthesize, and share information out to the @_VaporFi community https://t.co/zfcKvtT7QV",BabaYetuNFT,2022-11-27 18:48:42+00:00
713,1596939068612685824,Hey #Twitter anyone in for a #helpinghand to a #GameFreak ? My #GoFundMe campain is https://t.co/fkHvDabIcI and i would be so happy if some #gamer or #vaper could give a hand! Stay healthy y'all 🌲🕯🥰,P1n_head,2022-11-27 18:48:38+00:00
714,1596938997762183170,my vape is across the room and NONE of my cats are bringing it to me,bitterchord_,2022-11-27 18:48:21+00:00
715,1596938950115221506,"in my natural habitat 
vaping in the back of shakers",spiidersam,2022-11-27 18:48:10+00:00
716,1596938896129941504,"Vancouver, I’m here. Bringing you the great brand of vape: ILEVA. @ Stanley Park https://t.co/nV3U9C75rI",vapepoddevice,2022-11-27 18:47:57+00:00
717,1596938893135589376,Dad is complaining about my addiction to chocky milk now. Like bruh at least i ain’t sucking on to strawberry vape or whatever???????,mehzbnn,2022-11-27 18:47:56+00:00
718,1596938654730973184,I need a vape 😩,sexii_kk,2022-11-27 18:46:59+00:00
719,1596938419523190785,It's important to stop for vape breaks https://t.co/fmfOF5vSsZ,willems_steph,2022-11-27 18:46:03+00:00
720,1596938240711278592,i got new vape juice but im scared to try it,abbymiller121,2022-11-27 18:45:20+00:00
721,1596938212341063685,Experts say vapes get young people hooked on nicotine and contain plastic and batteries https://t.co/4ktLfGXzc1,vale50plus,2022-11-27 18:45:14+00:00
722,1596938133861728259,Honestly I hate it cause it gives me horrible headaches that last for hours! I wish people would be more self conscious about smoking anything (including vapes) around other people :( https://t.co/7xcI45sgyo,catsoo12,2022-11-27 18:44:55+00:00
723,1596938125372231680,"Wordle 526 4/6

⬜⬜⬜⬜🟩
⬜⬜🟨⬜🟩
⬜🟩⬜🟨🟩
🟩🟩🟩🟩🟩",ArtyVapes,2022-11-27 18:44:53+00:00
724,1596938089498562560,Not me vaping in the work bathroom hoping that the nicotine will keep me awake,LilUziBert_13,2022-11-27 18:44:44+00:00
725,1596937963153526784,14 year olds posting their weed and vape addiction with a ‘romantic’ audio in the back will never not be funny to me 💀,Slushedlava,2022-11-27 18:44:14+00:00
726,1596937920895922181,need me a vape so i can ponder,sirjameswthe3rd,2022-11-27 18:44:04+00:00
727,1596937829795631104,tell me why my alarm went off and instead of grabbing my phone to snooze i grabbed my fucking vape,BRlBEAR,2022-11-27 18:43:42+00:00
728,1596937812925784064,Quitting vaping cold-turkey while pregnant would not harm her baby more than she is already harming them by not quitting immediately. Really wish people would stop believing this shit it's literally a proven myth. https://t.co/6q3qAdjvEo,cilantrowife,2022-11-27 18:43:38+00:00
729,1596937525603418112,omg we're finally getting rid of urk https://t.co/cWM15d1rHx,aIlsaints,2022-11-27 18:42:30+00:00
730,1596937169868050432,My vape is broken 😢,An_dre_C,2022-11-27 18:41:05+00:00
731,1596936958399643648,"If you have #COPD and have used #vaping exclusively over the last year or more to #quitsmoking, what have your results been?  I think this type of information needs to be discussed on @Twitter https://t.co/TTqp2qGKUM",MichelleHughes_,2022-11-27 18:40:15+00:00
732,1596936661807439872,Lost Vape Centaurus M200 Kit Giveaway https://t.co/2OGtCF1hxV,zsuberacs,2022-11-27 18:39:04+00:00
733,1596936496271224833,No but seriously the withdrawal from sugar free soda is the worst thing ever. Idk if it’s psychological or biological? i used to drink diet soda religiously instead of water for 7 yrs 🙂 https://t.co/QIWEKTnzyi,TobeAJ,2022-11-27 18:38:25+00:00
734,1596936444781613056,"I bought myself a dry herb vape today to cut down on rolling with tobacco, I saw them when I went to Europe and they seemed a big thing there and tbh I highly recommend if you like a clean and manageable high.",nononocialism,2022-11-27 18:38:12+00:00
735,1596936426503180289,jokes over im asking my mom for an airtag for my vape and cat,MAX1NES,2022-11-27 18:38:08+00:00
736,1596936357938855937,i have never bought any smoke or vapes in my life and yet i have a drawer full… i may not have to confidence to gw ppl but i will finesse them,ermmatthews,2022-11-27 18:37:52+00:00
737,1596936286874767360,"What do you think is healthier? 
#Nicotine E-Liquid vaping? Or Nicotine Dry Herb vaping?
One is more natural, but has non-soluble resins
The other is chemicals (nontoxic) but is completely water soluble (your body flushes it out with ease)
#vape #vaping",Old_Snake22m,2022-11-27 18:37:35+00:00
738,1596935744253067265,I haven’t vaped in a month 😭,krissyarmoni,2022-11-27 18:35:25+00:00
739,1596935540024438784,Vaping: A Lesson in Irony https://t.co/KxVjKqn0Wu via @YouTube,FGUltimate,2022-11-27 18:34:37+00:00
740,1596935480964415488,*hits vape while continuously having a nasty ass wet cough*,oldcoldfry,2022-11-27 18:34:22+00:00
741,1596935440460054528,why do you go to UA if you didn't want to trade vape secrets,tsuyu_en,2022-11-27 18:34:13+00:00
742,1596935314274021376,"Regular concerts - * artist chucks merch and other personal items to the crowd *
Concerts in Pune- * rapper chucks vapes at the audience *",ansh_kothari1,2022-11-27 18:33:43+00:00
743,1596935058782588929,im so glad i don’t have a vape pen addiction,SleepWith_TheK,2022-11-27 18:32:42+00:00
744,1596935027782086656,i hit slightly too many god tier vape cartridges 🤪,gayweedbot,2022-11-27 18:32:34+00:00
745,1596934959448887296,All that’s missing is a blo vape 💨 https://t.co/e35YBbW859,blo_vapes,2022-11-27 18:32:18+00:00
746,1596934883125104641,How my 17 year old coworker looks at me when I tell them smoking weed and vaping isn't a personality trait https://t.co/It3P8OSZhc,Xlad99,2022-11-27 18:32:00+00:00
747,1596934857367506945,I should be able to vape at work idc what anyone has to say,dadbod2007,2022-11-27 18:31:54+00:00
748,1596934842968838144,day one without a vape and i’m losing my damn mind 😂😂😂😂,yung_daee,2022-11-27 18:31:50+00:00
749,1596934762543087616,Cyber Monday Has Begun. 20% off Site wide!!! Last Chance!!! - https://t.co/4gMLaHurV5 https://t.co/nQogjaTz6i,TheVapeMall,2022-11-27 18:31:31+00:00
750,1596934726379790336,giddy and gleeful dhmu,demoloving,2022-11-27 18:31:23+00:00
751,1596934386540490752,just vaped for the first time and for gods sake never try this shit my life flashed between my eyes and my sinuses hurt like crazy rn.if this is how i die i want you to know i love yall💗 https://t.co/v7U7XIrQva,MAGGOTPAWS,2022-11-27 18:30:02+00:00
752,1596934385420275712,Smh cardinal stadium made me throw away my vape. Bad spot,jaylow_93,2022-11-27 18:30:01+00:00
753,1596934219514908673,"BUY 2 GET 1 FREE ON BARFILL E-LQIUID 🔥

BarFill is a Vapour Depot Labs product, designed to replicate the most popular disposable vape flavours. Get up to 30 times the puffs using comparable coils, at a fraction of the price.

Check it out here 👇
https://t.co/9a9Lcso68S https://t.co/SVUKLJbof5",vapourdepot,2022-11-27 18:29:22+00:00
754,1596934209548926978,"This is appreciated cause these boof smoke shops got all kinds of fake cookies accessories smh #CookiesLNK @CookiesCBDStore 

HHC Vape Technology https://t.co/hrMys2QAsh",eyekelley,2022-11-27 18:29:19+00:00
755,1596934107577171975,"For your safety and comfort, this station operates a no vaping policy. This train will terminate.",traindroid_se,2022-11-27 18:28:55+00:00
756,1596933888571760641,"Nannyflation (with added stupidity on vaping)
https://t.co/Zl6398m2lJ",AStuttaford,2022-11-27 18:28:03+00:00
757,1596933886801428480,they should make vapes for babies,alyxiaBewbs,2022-11-27 18:28:02+00:00
758,1596933610409721856,Me and Diana fr fr https://t.co/Wr1Na632vA,TobeAJ,2022-11-27 18:26:56+00:00
759,1596933500145238017,"***EXCLUSIVE AND LIMITED STOCK ***

ARRIVING THIS WEEK IS THE ELFLIQ THE BRAND NEW ELF BAR JUICES IN 10 ML BOTTLES .. LOOK OUT FOR WHEN THEY ARE REALESED AS SELLING FAST EVERYWHERE !!!

https://t.co/iLjJBIsA6Z https://t.co/85YIzwFt0p",fogmonstersvape,2022-11-27 18:26:30+00:00
760,1596933438350626816,SO EXCITED me and stanli are PLAYING dramatical murder 💃,TobeAJ,2022-11-27 18:26:15+00:00
761,1596933392976994306,went to take this girl panties off and her coochie was hitting an Elfbar 😕 this vape shi gotta stop,ekswerv,2022-11-27 18:26:05+00:00
762,1596933329122906112,Vaping Increases Risk for Cavities https://t.co/89qHs3oPaX,DSMWcom,2022-11-27 18:25:49+00:00
