,TweetID,TweetContent,TweeterUsername,TweetDatetime,TweetLongitude,TweetLatitude,TweetPlace
1022,1540738444187602944,"raw dogging my walk (no airpods, no vape, no umbrella)",OfficialBrohoss,2022-06-25 16:47:25+00:00,,,
1023,1540738405281193985,Lmao juul got unbanned yesterday,Cryptoiscrack,2022-06-25 16:47:16+00:00,,,
1024,1540738303384727553,"“When it comes to tobacco we aren’t going mild…we’re going after the vaping industry which was going around the rules and marketing to kids…we’re not just tackling vaping, we’re going after tobacco, going after nicotine.” #AspenIdeasHealth #tobaccoprevention @XavierBecerra",jmessengerpdx,2022-06-25 16:46:51+00:00,,,
1025,1540738280647442432,Can’t get a abortion or a juul but i can get a AK-47 is crazyyyyyy,Supreme_Ana,2022-06-25 16:46:46+00:00,,,
1026,1540738278034272258,Wow I really missed having my normally hour commute turning to 2 hours through the cajon pass during my Covid leave,juul__ian,2022-06-25 16:46:45+00:00,,,
1027,1540738029425496064,"Ain't it a bitch when the government tries to control your body like having to give birth to a child you created, wearing a mask, getting a vax with zero long term studies, not being able to vape or smoke - EXCEPT Marijuana that shit you can smoke away. I mean how dare they!!!",commonsensereb,2022-06-25 16:45:46+00:00,,,
1028,1540737835690430465,Juul appeals to US federal court to end ban on e-cigarettes https://t.co/QqnpnuiJak https://t.co/vn1KgUugMR,AJEnglish,2022-06-25 16:45:00+00:00,,,
1029,1540737689254670337,"""Kids are kids, of course they're going to find another way. But we're doing what's right,"" @SecBecerra on whether kids will just find another way to access Juul after the FDA decision to pull  ""We're not just tackling vaping, we're tackling tobacco."" #AspenIdeasHealth",MedResJourno,2022-06-25 16:44:25+00:00,,,
1030,1540737565577269248,"Abortion: canceled
Juul: canceled
Guns problem: turn the emoji into a water gun",_bulien,2022-06-25 16:43:55+00:00,-123.224215,49.19854,"Vancouver, British Columbia"
1031,1540737478587555843,can one of u run out to the car and grab my sunglasses? and my juul and my seltzer off the table https://t.co/aIhkv3NBjk,buttcurses,2022-06-25 16:43:35+00:00,,,
1032,1540737349046243336,Finna gonna start vaping the moment i turn 21.,_sushi_rice_,2022-06-25 16:43:04+00:00,,,
1033,1540737279978643463,It’s funny how vapes and abortion were banned guns were…🤔 https://t.co/cgPBM6Lyt2,_mexicanfag,2022-06-25 16:42:47+00:00,,,
1034,1540736966370549760,"New review up on Youtube of the Lost Vape Ursa Mini.
@LostVape @LostVape_sales @lostvapeLinda @VeraLostvape @SLostvape @AlfredLostvape @LostVape_Supply 
https://t.co/sHtaoNuISc",eatmabb,2022-06-25 16:41:32+00:00,,,
1035,1540736795578667008,I know juuls just got banned so let me put y’all onto something. These bad boys (Alo 2500) last around 4 days each and are cheaper than a pack of juul pods. No charging. Just open and puff away until it runs out. Plus there’s like 16-20 flavours all of which taste better too. https://t.co/ro5GFwBpp2,ArtOfWumbology,2022-06-25 16:40:52+00:00,,,
1036,1540736781439606785,Juul can keep selling its vaping products in the U.S. — for now https://t.co/Yxsw4LHNvN,BlueGoo34535448,2022-06-25 16:40:48+00:00,,,
1037,1540736724283772933,MULTI MEDIA PROMOS - Direct Delta 8 CBD / Vapes https://t.co/xyCFJFXOP5 Blessed Weekend Everyone! Multi Media Promos! Your Online Promo Source!,BLOCKWORKMEDIA1,2022-06-25 16:40:35+00:00,,,
1038,1540736683737460737,"Biden administration banning Juul vape products due to nicotine but haven't lifted a finger on fentanyl, heroin , cocaine and methamphetamine flooding into the US causing many deaths and  to be clear I'm not backing Juul if they targeted teens they should be reprimanded. https://t.co/OV0FT3vVEr",Sanchez_Dan1969,2022-06-25 16:40:25+00:00,,,
1039,1540736625302351872,hmmm those vuse vapes 👁👄👁,AndrewMkize,2022-06-25 16:40:11+00:00,,,
1040,1540736523456262144,Naurr they banned juul what am I gonna fill my lungs with now :((((((,Angel_Barks,2022-06-25 16:39:47+00:00,,,
1041,1540736508587454464,Oh hey they banned vapes because they are dangerous. That’s good news. They did something to protect the kids…by regulating vapes because they are dangerous. But you know guns,Pdao8,2022-06-25 16:39:43+00:00,,,
1042,1540736301082628101,"Save-up for relationships that make you feel like you’re always losing and, then finding, your Juul #SaturdayMorning",JViccarro,2022-06-25 16:38:54+00:00,,,
1043,1540736234984976384,so my vape decided to fall out of my pocket in front of my father just now soooooooooo yaaa …….,_slapurmother,2022-06-25 16:38:38+00:00,,,
1044,1540736195793063938,Punk scene gonna look a lot different if cigs and juuls are taken off the market,NantendoSwitch,2022-06-25 16:38:29+00:00,,,
1045,1540736177493266432,owning a vape is such a good conversation starter honestly,livil0nglegs,2022-06-25 16:38:24+00:00,,,
1046,1540735957137117186,Juul can keep selling vaping products in the US for now https://t.co/piOWVjh312,WiresPr,2022-06-25 16:37:32+00:00,,,
1047,1540735922181812224,"Rip Juul, you served me well freshman year",BabeyPluto,2022-06-25 16:37:23+00:00,,,
1048,1540735837398110213,"""To be a Democrat in 2022 is to insist that 'bodily autonomy' means that you may kill your children but you may not hit a Juul."" https://t.co/ckR1Ke0PWs",JASmius,2022-06-25 16:37:03+00:00,,,
1049,1540735712701476869,Juul Survives a Blow From the FDA—for Now https://t.co/wIi8nihQ78,nazmulmarketer1,2022-06-25 16:36:34+00:00,,,
1050,1540735663988809728,"Alien Labs 👽⚗️ live resin vape just landed at Cookies Oakland 💨

Xeno X Baklava

&amp; Biskanté X Gelato 41 https://t.co/tt4nnRrYc2",cookies_oakland,2022-06-25 16:36:22+00:00,-122.332411,37.720367,"Alameda, CA"
1051,1540735373080694784,my mom almost caught me vaping i got so scared fr,1004wzi,2022-06-25 16:35:13+00:00,,,
1052,1540735370869866497,"All this startup news, and we didn�t even talk about Juul #Tech #Startup #IT  https://t.co/M0D1Sfr9jo",Futurwerk,2022-06-25 16:35:12+00:00,,,
1053,1540735341128257536,I wanna know what strings were pulled to get Juuls back cause I need to pull those for some stuff 😂😂😂,Gage_Poling1994,2022-06-25 16:35:05+00:00,,,
1054,1540735301508669441,"It's officially Juul hoarding seaup. already?
Dang.
I still have my monkey pox decorations up.
#SaturdayMorning",Thomas195013,2022-06-25 16:34:56+00:00,,,
1055,1540735043374653440,I CAN HARDLY SEE AND SHE WANTS ME TO TAKE HER TO THE BUS STOP i am goin 2 abuse her vape,vodkautism,2022-06-25 16:33:54+00:00,,,
1056,1540734991969165312,"When Housing Crash? Sometime In The Next 2 Years. 14k+ bet on the housing market AT LEAST slowing down in the next 10 quarters with OTM put options on VMBS and BXMT.
Invest your money everyday.
#StocksToBuy #StockMarket #BETHESUN #RoeVsWade #Juul https://t.co/suKwOiG2By",michaelbyrdy,2022-06-25 16:33:42+00:00,,,
1057,1540734837476143106,It’s clearly not a vaping issue if you can still buy posh and mr.fog. Juul was too successful.,TheShlow,2022-06-25 16:33:05+00:00,,,
1058,1540734679556313093,"Cigarettes may have been around for decades, but their role in our everyday lives has long been established. But think about it – what if you could enjoy your break at work without smelling cigarettes? Vaping is the answer.⁣
.
#myeliquidsupplies #eliquid #vapeflavourconcentrates https://t.co/aX6S7yRvbI",myeliquidsupply,2022-06-25 16:32:27+00:00,,,
1059,1540734583435472896,"yes my camera is on auto inside the club?! who tf do you think I am juggling my cup,vape,phone and camera?",saintn1c,2022-06-25 16:32:04+00:00,,,
1060,1540734490548482050,"Thank you Chris, flight attendant from Salt Lake City, for letting me hit your pineapple vape last night",fruityvegcusp,2022-06-25 16:31:42+00:00,,,
1061,1540734331630473216,"Juul Survives a Blow From the FDA—for Now: Plus: Instagram cracks down on age verification, Microsoft says it will stop using AI to track emotions, and Twitter wants to be a blog. via @Wired https://t.co/JQM1r5fNcv",Towards2100,2022-06-25 16:31:04+00:00,,,
1062,1540734186343890948,I really can’t comprehend banning juul idk maybe I’m making a big deal but tobacco and menthol are not appealing flavors to kids. And they’re allowing the bottles of all types of fruit flavors/combos? like those aren’t marketed toward kids? And flavored alcohol? Flavored cigars?,GUTTERXPUNK,2022-06-25 16:30:30+00:00,,,
1063,1540734159378710529,"A Look at Vapes That Look Like Pipes - #Health #Blog #Articles #Tips #Healthcare #Healthy #Wellness #Read

https://t.co/8ntcQjtSEB",HandBstuff,2022-06-25 16:30:23+00:00,,,
1064,1540734099987566592,"Dozens of  vape manufacturers have challenged FDA's marketing denial orders in federal court. Stay up to date on all the legal action here! 

https://t.co/tOx8gsGMxx",Vaping360,2022-06-25 16:30:09+00:00,,,
1065,1540734045889470464,couldn't understand why the smell of mango tang was making my heart sink then I remembered what flavor juul he used to smoke looool,maulana_banana,2022-06-25 16:29:56+00:00,,,
1066,1540733958194835461,"they got juuls gone, now do nics while ya at it like ya lame ass puffs",prrtybd,2022-06-25 16:29:35+00:00,,,
1067,1540733919095427072,Showing my vape off to the studs in the smoking area,sickscumcunt,2022-06-25 16:29:26+00:00,,,
1068,1540733882563063809,why couldn’t i live in the ‘cigarettes are good for you’ era? instead i gotta vape like some l0ser who gets no pussy because everyone knows cigarettes are infinitely cooler,nicoteanee,2022-06-25 16:29:17+00:00,,,
1069,1540733695543447553,Them Chinese vapes got me in a choke hold,Muhamnnad,2022-06-25 16:28:33+00:00,,,
1070,1540733647170306050,the u.s. started going to shit once everyone started smoking vapes smh smoke a stogie like a man,Ray_Rice10,2022-06-25 16:28:21+00:00,,,
1071,1540733570469224448,Roe v. Wade and Juul pods. I don’t belong in this generation.,NDPBaller,2022-06-25 16:28:03+00:00,,,
1072,1540733480723546112,"Banned #Juuls?
What's the matter? Not enough people died from the pandemic? Gotta bring back cigarette smoking and lung cancer?",Thomas195013,2022-06-25 16:27:41+00:00,,,
1073,1540733334472609792,has anyone ever vaped cum,drunkandfatguy,2022-06-25 16:27:07+00:00,,,
1074,1540733075813896197,"Vapes banned for being addictive and apparently unsafe, .. but AK-47's and automatic weapons are apparently not

https://t.co/4E0SZYjK63",CntrlPimpernel,2022-06-25 16:26:05+00:00,,,
1075,1540733056255873032,"The FDA said it did not receive clinical information suggesting an immediate health threat, but are urging e-cigarette users, especially those using the products for smoking cessation, to find other vaping products. https://t.co/JAOU2a3clc",MoffittNews,2022-06-25 16:26:00+00:00,,,
1076,1540733046453706752,Did i just smell bbq lays flavored vape,lunarsolitaire,2022-06-25 16:25:58+00:00,,,
1077,1540733044889247745,Somebody outside vaping rn,Bior_Blake,2022-06-25 16:25:57+00:00,,,
1078,1540732892199866368,"day 1 no juul. not well, ready to d!e",myelah98,2022-06-25 16:25:21+00:00,,,
1079,1540732877045899264,"Banning juuls and women’s rights before coming up with some kind of gun control/regulation? …this country is so fucked. 

It’s gonna take more than just voting. 
We were told to vote for the “lesser evil” and look where we’re at now…it’s only going to get scarier.",JasmineOchoahhh,2022-06-25 16:25:17+00:00,,,
1080,1540732866149113856,The Juul ban will disproportionally effect dumb and poor people. They have a hard enough time these days.,Re4lJuan,2022-06-25 16:25:15+00:00,,,
1081,1540732839368372224,Juul can temporarily keep selling its vaping products in the US https://t.co/wnqz7JnCdZ,venturecation,2022-06-25 16:25:08+00:00,,,
1082,1540732344381743105,i got 50€ from my grandparents and i’m gonna spend it all on vapes 😈,bloodynblue,2022-06-25 16:23:10+00:00,,,
1083,1540732297099354112,"I cant believe juul pods and abortions are banned. 

#lame",platano_bb,2022-06-25 16:22:59+00:00,,,
1084,1540732240304345089,Second mistake was not talking to homie that let me hit that vape twice 😭,BankaiBabi,2022-06-25 16:22:46+00:00,,,
1085,1540732073706545153,the midwest has been on Breeze’s for a couple years. we’ll ride out this juul thing with combination nic salt &amp; delta-10 juice.,hausofventura,2022-06-25 16:22:06+00:00,,,
1086,1540731915375824897,handing my roommates boyfriend my juul wordlessly as he also wordlessly hands me a poptart and then we shuffle to our respective sides of the room and start giggling,trouthusband,2022-06-25 16:21:28+00:00,,,
1087,1540731813831876609,"E-cigarettes developed by Juul Labs can remain on store shelves after a federal appeals court temporarily blocked a government ban, outlawing their sale. The appeal came just one day after the FDA ordered the company to immediately halt its business.
https://t.co/mHgIpbASXm",NYDailyNews,2022-06-25 16:21:04+00:00,,,
1088,1540731787592318976,getting juul back before abortion is crazy,chickenpete15,2022-06-25 16:20:58+00:00,,,
1089,1540731563301806081,All products of a popular vaping brand have been removed from sale in the United States over safety concerns. https://t.co/kIzA1P6e51,TheScotsman,2022-06-25 16:20:04+00:00,,,
1090,1540731544280522752,"Juul can continue to sell its electronic cigarettes, at least for now, after a federal appeals court on Friday temporarily blocked a government ban.

https://t.co/jXP2F2aftW",gpbnews,2022-06-25 16:20:00+00:00,,,
1091,1540731375048953856,"This is a take from my Instagram because I haven't slept in like a day but: you're tryna tell me the US government thinks women's rights, Juuls, and drag queens are more dangerous than guns? 🥴 Crazy country we live in amirite",wlwgoth,2022-06-25 16:19:19+00:00,,,
1092,1540731312843247618,My vape just flashed I’m hurt 🥹,PRESiOUS_NiCOLE,2022-06-25 16:19:05+00:00,,,
1093,1540731291317850112,How they gonna ban juuls and abortions right before hot girl summer smh,patty_cakes0,2022-06-25 16:18:59+00:00,,,
1094,1540731169670451201,"smoking is now prohibited on all Florida Beaches. And the Feds are lowering nicotine tolerances and getting rid of certain nicotine vaping. all good things, regardless of what party is responsible.",donotfo15794591,2022-06-25 16:18:30+00:00,,,
1095,1540731104444817409,Dry herb vaping probably gets you more lit with less because you're getting your terpenes (flavor) too. #EntourageEffect,ThaRealJesC,2022-06-25 16:18:15+00:00,,,
1096,1540730988640079872,"Sweatpants, hair tied, chillin' with no make-up on. That's when you're the prettiest. I hope that you don't take it wrong.",bill_juul_burn,2022-06-25 16:17:47+00:00,,,
1097,1540730821291585545,Juul Survives a Blow From the FDA—for Now - https://t.co/mMq8TgLr29,TheTechShowTV,2022-06-25 16:17:07+00:00,,,
1098,1540730784809484288,"First juul now abortions, this government system is not doing a a good job",letsburnstuff,2022-06-25 16:16:59+00:00,,,
1099,1540730565388750850,She’s a 10 but she likes my hands always holding hers so I can’t hit my vape while driving  :),luisrocha102,2022-06-25 16:16:06+00:00,,,
1100,1540730114509574144,"What if I released a fourth single while I shop around my beautiful ep? I have a song that’s very Song Of The Summer* if I do say so myself 🤔🤔🤔

*it’s about vaping",gaymeatkarl,2022-06-25 16:14:19+00:00,,,
1101,1540730099200311297,"Excuse me, sir, but you're going to have to move your leapord skin tangarade hover vape. https://t.co/mZTVXGEc4y",JoeChrist42,2022-06-25 16:14:15+00:00,-87.634643,24.396308,"Florida, USA"
1102,1540729851849674752,This crackhead really put his vape in rice cause it got wet last night…my boy down bad,daryyyy__,2022-06-25 16:13:16+00:00,,,
1103,1540729839539392513,my fat ass thought this was a juul 😳🤣,B1017G,2022-06-25 16:13:13+00:00,,,
1104,1540729651525406721,"Add up @king_of_flavours on telegram , my man has vapes the local boss man can’t offer you 🤣 #iykyk",ukdrillings,2022-06-25 16:12:28+00:00,,,
1105,1540729590628290562,"Juul can continue to sell its electronic cigarettes, at least for now, after a federal appeals court on Friday temporarily blocked a government ban. https://t.co/AMFDlpfyRB",HDdailynews,2022-06-25 16:12:14+00:00,,,
1106,1540729527852212224,Finna hit my vape during this funeral,Rjayzuss,2022-06-25 16:11:59+00:00,,,
1107,1540729401737768968,"mozzarella, tomato, and pesto on ciabatta (plus new menthol juul pods which are a 10/10) https://t.co/PJ4XYUIcO5",cyanc4t,2022-06-25 16:11:29+00:00,,,
1108,1540729390631231490,Insane I lost rights to my own body and can’t Juul to take the edge off,edmbasskitten,2022-06-25 16:11:26+00:00,,,
1109,1540729187060879360,"""To be a Democrat in 2022 is to insist that “bodily autonomy” means that you may kill your children but you may not hit a Juul.""

https://t.co/HrBWEKB6ZE",DianaVilliers1,2022-06-25 16:10:38+00:00,,,
1110,1540729093909401602,"Make sure your oil never comes in contact with any metal ever again 👏💨

Our new All Glass Vari-Flow Cartridges feature O2VAPE’s award winning ceramic core technology in an all glass cartridge, for the ultimate in clean, metal free #vaping. 
 
https://t.co/mbFhSS1obE https://t.co/sgoI8nDLNs",O2vape,2022-06-25 16:10:16+00:00,,,
1111,1540729084757454850,"Quick reminder that Juuls we're banned, guns received rights, and women were thrown back 50 years",Ethnic_Friend,2022-06-25 16:10:13+00:00,-122.436232,47.4953154,"Seattle, WA"
1112,1540728786882203654,Back Vaping. Beat Smoking https://t.co/FHx69Zwf22,texasgulfcoast,2022-06-25 16:09:02+00:00,,,
1113,1540728769480036352,"Blow extra $3-4T 🔜 📉 stonks &amp; wages, no 💵 for 😷

No nuclear plant approvals for 50 years 🔜 🥵🌏

Ban domestic ⛽️ 🔜 🙏 Saudis

Politicized school closures 🔜 🏅 learning loss for poor

Ban vapes &amp; menthol 🔜 black market 🚬 + 👮‍♂️

🧎‍♀️ politicians 🔜 unabated drug war, 📈 crime https://t.co/onrP318dVL",jeffbax,2022-06-25 16:08:58+00:00,,,
1114,1540728722407530496,juuls have more rights than women,shannondevineee,2022-06-25 16:08:47+00:00,,,
1115,1540728671304302594,"top 2 lies (pune edition)
1. she’s/he’s just a friend (entire city hooked up w her/him)
2. i’ll quit vaping",kuchbhipattu,2022-06-25 16:08:35+00:00,,,
1116,1540728507508162562,So let me get this straight…#Vuse now has a #Monopoly on #ecigarettes and of course is more expensive than #JUUL  What’s going on with ##FDA Why haven’t they approved JULL’s application yet?! @marcorubio and @SenRickScott this is cleaner than cigarettes and better alternative!!,TrishRohal,2022-06-25 16:07:56+00:00,,,
1117,1540728417540222984,Welp looks like no more juul for me probably good 😂,ahuntsman22,2022-06-25 16:07:34+00:00,,,
1118,1540728396019167233,Juul can keep selling e-cigarettes as court blocks FDA ban #NewsBreak https://t.co/JQ7S7N3G8x,Rparksjr85,2022-06-25 16:07:29+00:00,,,
1119,1540728372824637440,im high at ihop and i forgot abt public rules and almost hit my vape pen inside,lndeedee,2022-06-25 16:07:24+00:00,,,
1120,1540728363395866625,Chevron deference will be overturned to allow Juuls to be sold,metalgearobama,2022-06-25 16:07:21+00:00,,,
1121,1540728290033315844,Juul can keep selling e-cigarettes as court blocks FDA ban - https://t.co/3LedJXiOsR,Dataemia,2022-06-25 16:07:04+00:00,,,
1122,1540727989163401216,guys who vape does it help you with repressing cravings for candy,slavdelrey,2022-06-25 16:05:52+00:00,,,
1123,1540727945878065152,How tf is American going to ban fucking Juul but not ban guns ?!?,5280_angel,2022-06-25 16:05:42+00:00,,,
1124,1540727483598880768,"why do we give a fuck about what the constitution says is what i wanna know 😭 “iT’s tRAdiTiON” okay well YOU go live under candle light. give me your cell phone, car and vape sir. that is not tradition",urfavdad,2022-06-25 16:03:52+00:00,,,
1125,1540727448534274049,"It’s crazy to me how many smart, accomplished people I know voluntarily decided to work at Juul Labs",cailen,2022-06-25 16:03:43+00:00,,,
1126,1540727380867686405,Juul: US bans all products from leading vaping company https://t.co/j7T5Qts8ys,dhraju,2022-06-25 16:03:27+00:00,,,
1127,1540727364211970056,top ten scariest moments of my life was when i thought all vapes were being banned just to find out it’s just juuls,jupesclaim,2022-06-25 16:03:23+00:00,,,
1128,1540727361041141762,"Doing it LIVE today so we can chat about the news in real time! SHOW STARTS AT 1PM EST.
Global 20 Vape Science Advocacy News s2e10 LIVE https://t.co/9qQBSBFora via @YouTube",HunkyVape,2022-06-25 16:03:22+00:00,,,
1129,1540727285329711104,i literally got my vape two days ago why is it dead already,litningmcqueeef,2022-06-25 16:03:04+00:00,,,
1130,1540727253843283968,gonna go try an get an new vape from the Indian dudes may or may not tweet ever again,SnackPrescott,2022-06-25 16:02:57+00:00,,,
1131,1540727222348255232,Juul wins temporary hold on the FDA ban https://t.co/WNqTSlOILi,IndivCincy,2022-06-25 16:02:49+00:00,,,
1132,1540727118232817666,Juul Gets Temporary Reprieve to Keep Selling Its E-Cigarettes https://t.co/oszuhrNEDI,marknyt,2022-06-25 16:02:24+00:00,,,
1133,1540726993699872768,"Hellvape Helheim S30 RDTA Rebuildable Dripping Tank Vape Atomizer
Buy it on:
https://t.co/eRQt8hpgPP https://t.co/Oa5c5xeyJD",3FVape,2022-06-25 16:01:55+00:00,,,
1134,1540726967858655232,"Juul e-cigarettes can stay on the market for now, judge rules https://t.co/ZIFcp6Veme",lmay4949,2022-06-25 16:01:49+00:00,,,
1135,1540726924036608000,Professional matters could come to a head at any moment. The M... More for Sagittarius https://t.co/tb85cLOmfB,vaper_kitten,2022-06-25 16:01:38+00:00,,,
1136,1540726892445126658,(teaching my 5 year old to vape) so u do a long line of smoke and then 2 balls at the end,SLVGGIE,2022-06-25 16:01:31+00:00,,,
1137,1540726791513509888,Appeals Court grants temporary stay in Juul fight against FDA banning its e-cigarettes https://t.co/4deAzzN0QB,EINTobaccoNews,2022-06-25 16:01:07+00:00,,,
1138,1540726770877353984,"NEW IN!!! DotTank 25mm By Dotmod is sure to impress with its wide range of coil options to fine-tune the perfect vape for anyone 😍💯🔥
-
https://t.co/JaRNy25i20
#vapeon #vapelyfe #vapedaily #vapefam #vapestore #vapesociety https://t.co/4wZkkXVO7Q",evovapinguk,2022-06-25 16:01:02+00:00,,,
1139,1540726742662381569,"first juuls, now abortion, what's next? gay sex? https://t.co/x5n7ZKfASH",JuulLewds,2022-06-25 16:00:55+00:00,,,
1140,1540726720252104706,Federal appeals court puts FDA ban on Juul e-cigarette sales on hold https://t.co/0Bn4hM25Cd,newsrantz,2022-06-25 16:00:50+00:00,,,
1141,1540726719098884096,Make sure you go and check out @SgothanGeal for all your vaping needs https://t.co/IV0BwWGH7L,thevapemanphoto,2022-06-25 16:00:49+00:00,,,
1142,1540726662572044289,Going to lose my mind if I see one more Subaru vape joke on the Xbox X tweets,TheSubaruBot,2022-06-25 16:00:36+00:00,,,
1143,1540726658642186242,"Today, we celebrate a huge victory in our fight against smoking!

Flavours are a determining factor in helping smokers quit. If this ban had been adopted, 150,000 people in Sweden – almost the population of Upsala – could have been pushed back to smoking. 

+ https://t.co/VbjoZWF3aE",vapers_alliance,2022-06-25 16:00:35+00:00,,,
1144,1540726612630507520,"Delta 8, #HHC, #THCO &amp; #Delta10 Vape Carts: Rising #Cannabanoids ... https://t.co/O0lPM7XiNa  #CBD #Delta8 #THC #Vape #CannabisLegal",5OShadeOfGreen,2022-06-25 16:00:24+00:00,,,
1145,1540726565822009344,Juul’s e-cigarettes won’t be pulled off the shelves just yet. https://t.co/SpH5RC0E1M,statnews,2022-06-25 16:00:13+00:00,,,
1146,1540726513284308993,"What will Juul do before the ban is fully implemented? 

https://t.co/8c6WO90lxa",TechTimes_News,2022-06-25 16:00:00+00:00,,,
1147,1540726444929667073,Juul Gets Temporary Reprieve to Keep Selling Its E-Cigarettes https://t.co/VFnnvJf5vm,HeartsMaker1,2022-06-25 15:59:44+00:00,,,
1148,1540726337782001668,Juul can keep selling e-cigarettes as court blocks FDA ban https://t.co/VzmlIyovzI via @Yahoo,pmcall,2022-06-25 15:59:18+00:00,,,
1149,1540726017626476551,I have never vaped.,UncutLifter,2022-06-25 15:58:02+00:00,,,
1150,1540725968108519424,I hate a nigga dat always wanna hit my vape,Full_Throttle21,2022-06-25 15:57:50+00:00,,,
1151,1540725774671421440,Juul can keep selling e-cigarettes as court blocks FDA ban https://t.co/qs6DZtgtc2 https://t.co/xa2xDzYqAy,everydaycpatax,2022-06-25 15:57:04+00:00,,,
1152,1540725717284970497,Federal court blocks FDA ban on Juul e-cigarette sales in U.S. https://t.co/o0lVEuuQ6q https://t.co/n7wMoOCkWq,everydaycpatax,2022-06-25 15:56:50+00:00,,,
1153,1540725692467294209,All products of a popular vaping brand have been removed from sale in the United States over safety concerns. https://t.co/Xcl5NDN3wW,edinburghpaper,2022-06-25 15:56:45+00:00,,,
1154,1540725680861741056,"Everything is cyclical

My friends started vaping so they would stop smoking cigs... 

Now they're smoking cigs to reduce how much they vape...",DandSiddhant,2022-06-25 15:56:42+00:00,72.74484,18.845343,"Mumbai, India"
1155,1540725529497817090,Juul Survives a Blow From the FDA—for Now https://t.co/j08bXdrdJ4,nazmulmarketer1,2022-06-25 15:56:06+00:00,,,
1156,1540725492742885379,"No juuls, no abortions, but at least I can walk around town with a bazooka 🙏🏿🙏🏿 God’s Country!!! MERICA 🇺🇸🎇",_ag8three,2022-06-25 15:55:57+00:00,,,
1157,1540725479761711104,not gonna vape all day 💯💯,bubblebesti3,2022-06-25 15:55:54+00:00,,,
1158,1540725406600294400,FDA reportedly preparing to force Juul products off the US market https://t.co/WpsEt7OlGZ https://t.co/ZEZwt5neOo,DaltonRoad,2022-06-25 15:55:36+00:00,,,
