,TweetID,TweetContent,TweeterUsername,TweetDatetime,TweetLongitude,TweetLatitude,TweetPlace
2989,1540539240555085824,Court temporarily blocks FDA ban on sale of Juul e-cigarettes https://t.co/liaXoHZIEI,WGNRadio,2022-06-25 03:35:51+00:00,,,
2990,1540539193868386305,my vape is dead.,mattsflwrs,2022-06-25 03:35:40+00:00,,,
2991,1540539149844975616,Well thank GOD I can go grab a juul while I’m forced into labor,CrankyComrade,2022-06-25 03:35:29+00:00,,,
2992,1540539147836100608,you’re telling me that the government is blocking the band of juuls because it’s to much of a DRAMATIC CHANGE at this time and would cause damage to particular citizens of the US and yet they still have the audacity to override roe v. wade?!? MAKE IT MAKE SENSE,Myrajae4,2022-06-25 03:35:29+00:00,,,
2993,1540539138398736384,Future historians will assume we administered abortions by JUUL,heyguys_heyguys,2022-06-25 03:35:27+00:00,,,
2994,1540539018600914945,"You’re banning Juuls, reversing Roe v Wade, and reconsidering marriage equality, BUT don’t worry guys they made it so you don’t need a permit to carry a gun in NY… cause that’s the rights we need with shootings nearly everyday right?",WilliamsEponine,2022-06-25 03:34:58+00:00,,,
2995,1540538863071858688,"follow me if you like silly kitties, funny bunnies, substance abuse and cool vape tricks ^_^",cryptiic33,2022-06-25 03:34:21+00:00,,,
2996,1540538855832653825,"federal courts blocked the fdas ban of juuls because of “dramatic and irreparable damage to citizens” yet overturned roe v wade today
 
MAKE IT MAKE SENSE",emily_lacerais,2022-06-25 03:34:19+00:00,,,
2997,1540538847355961344,i sold vape juice and devices longer than the confederacy lasted,WerewolfMoms,2022-06-25 03:34:17+00:00,,,
2998,1540538775159406593,"Juul can continue to sell its electronic cigarettes, at least for now, after a federal appeals court on Friday temporarily blocked a government ban. https://t.co/8hmkuVpPbC",WBTV_News,2022-06-25 03:34:00+00:00,,,
2999,1540538704556703744,BREAKING: Federal Court Places Hold On Juul Ban https://t.co/bUD2jH1r6D,PAMGRIGGS308,2022-06-25 03:33:43+00:00,,,
3000,1540538693827575808,bruh vaping is not cool why do yall wanna vape so bad,slayrxic,2022-06-25 03:33:41+00:00,,,
3001,1540538668653260805,I vape,hayatobot_,2022-06-25 03:33:35+00:00,,,
3002,1540538580308635648,"Part 2 of the Juul thread is taking a bit more time than expected. 

Way longer than I thought it would be.

Should be out within an hour or maybe tomorrow? 

The deets are joocy.",BowTiedRobin,2022-06-25 03:33:14+00:00,,,
3003,1540538557756055552,They banned abortion just to cover up that they banned Juul just a couple days ago https://t.co/1SH9DDvZIc,notkruse,2022-06-25 03:33:08+00:00,,,
3004,1540538464378257411,I don't think I can live in a world where I can't creampie sluts while I rip from my juul,ElderlyPoster,2022-06-25 03:32:46+00:00,,,
3005,1540538409613086720,hey guys i vape,finley_ebooks,2022-06-25 03:32:33+00:00,,,
3006,1540538223683944448,Federal appeals court puts FDA ban on Juul e-cigarette sales on hold https://t.co/5YZbAuQsQI,elakhbargate,2022-06-25 03:31:48+00:00,,,
3007,1540538210199097344,"FDA bans e-cigarette Juul; impact on cannabis vape market to be determined
 https://t.co/LrxvCIH6Sc #MME #marijuana #cannabis #vape https://t.co/Z9xf3AgsV9",THEMMEXCHANGE,2022-06-25 03:31:45+00:00,,,
3008,1540538187440865280,Oomf just started clapping in the middle of the bar when they saw the juul ban got temporarily overturned,Gabby_verdejo,2022-06-25 03:31:40+00:00,,,
3009,1540538112887201792,Hittin the vape while it's still plugged in to get that shit right from the source,TheBigLode,2022-06-25 03:31:22+00:00,,,
3010,1540538051377696769,"Marxist Biden FDA’s Fascist Ban on Juul E-Cigarettes Temporarily Blocked by Court

https://t.co/ZAdOFQQQIA",pcisbs1,2022-06-25 03:31:07+00:00,,,
3011,1540538046784737282,NZ Hospital Leads the Way by Giving Vapes to Patients Who Smoke https://t.co/VdvgMLEKJX,MattKel75081418,2022-06-25 03:31:06+00:00,,,
3012,1540537867121958913,Federal appeals court pauses FDA ban on Juul's e-cigarettes #SocialMedia #digital #digitalhealth #health via https://t.co/knNq35jedD https://t.co/a01BFaQj81,shri_narayan5,2022-06-25 03:30:23+00:00,,,
3013,1540537853528219648,Eva’s vape must have died early on into the trip cause she moved on to cigarettes QUICK #RHUGT,vandercunts,2022-06-25 03:30:20+00:00,,,
3014,1540537786230611972,"A federal appeals court on Friday temporarily blocked the Food and Drug Administration’s order banning the sale of Juul e-cigarettes, giving a reprieve to the company while the court hears more arguments.  https://t.co/VQjCqbPnnk",kolr10kozl,2022-06-25 03:30:04+00:00,,,
3015,1540537785299476481,"Court temporarily blocks FDA ban on sale of Juul e-cigarettes

https://t.co/5AZCNEn5GL",KXAN_News,2022-06-25 03:30:04+00:00,,,
3016,1540537768601845760,"A federal court has put a temporary hold on the government's order for Juul to stop selling its electronic cigarettes.

https://t.co/9SCHVq6mrh",CBS6,2022-06-25 03:30:00+00:00,,,
3017,1540537710267420672,They took away womens rights and juul in the same week bruh,FrankieGoldie,2022-06-25 03:29:46+00:00,,,
3018,1540537633629241345,the way a fucking juul has more rights in america than women,rachel_paniak,2022-06-25 03:29:28+00:00,,,
3019,1540537583050031105,white ppl love smoking juuls on the train like are y’all ok?,_fatale,2022-06-25 03:29:16+00:00,-74.041878,40.570842,"Brooklyn, NY"
3020,1540537411591094272,i know i did not just see a straight white cis man go on a rant on snapchat about the juul ban right now,jennyswarld,2022-06-25 03:28:35+00:00,,,
3021,1540537271992057857,Watching all these protests on TV. I know people love their Juuls but wow this is unexpected,blahdevivre,2022-06-25 03:28:02+00:00,,,
3022,1540537213070499840,Juul can keep selling vaping products in the US for now – TechCrunch https://t.co/nyI0ca9Ooq,AsiaPost3,2022-06-25 03:27:48+00:00,,,
3023,1540537212516945920,america was so quick to ban juuls and abortions* but not cigarettes or guns make it make sense,addytbh,2022-06-25 03:27:47+00:00,,,
3024,1540537185161678848,about ready to dumpster dive for some juul pods,elyssalynnn,2022-06-25 03:27:41+00:00,,,
3025,1540537061601591296,"New @geekvapetech Giveaway Now Live! -  Enter now for a chance to win the new Geekvape B60 Boost kit - https://t.co/fcrMXrqxkr

#ecigclick #geekvape #geekvapeb60 #vaping #vapegiveaway #vapefam #vape #vapelyfe #giveaway",BillDee8,2022-06-25 03:27:11+00:00,,,
3026,1540536922044452864,"This is wrong and based on obviously faulty assumptions. Vaping helped me STOP smoking. I eventually stopped vaping (nicotine) as well. This will just push people back to smoking tobacco.

Teens and vaping: ‘We would have had a nicotine-free generation’ https://t.co/oJDTeht7hX",exceptionalnull,2022-06-25 03:26:38+00:00,,,
3027,1540536825659265024,America banned JUULs and abortions in the same week. country is in the gutter,carjoel3000,2022-06-25 03:26:15+00:00,,,
3028,1540536809586843653,"US government just hates women that can rip an awesome fucking fat vape cloud, they r so scared of us.",PorphyriaJuice,2022-06-25 03:26:11+00:00,,,
3029,1540536651105320960,"Who isn’t worried sick 95% safer #vaping is replacing deadly cigarettes? Could be terrible with plummeting cancer, heart &amp; lung deaths! But enter ⁦@CancerCouncilOz⁩ to protect Big Tobacco! ⁦@LivePippas⁩ ⁦@VaperNt⁩ ⁦@legionvapes⁩ ⁦ https://t.co/8B5WdGVgf1",AlexWodak,2022-06-25 03:25:34+00:00,,,
3030,1540536578849681409,ok  good  im  glad  juul  is  Gone.  u  cannot  put  these  two  in  the  same  sentence,dndmansplainer,2022-06-25 03:25:16+00:00,,,
3031,1540536503641804801,I can’t go without hitting my vape for to long so they need to hurry up.,DoingmeePERIODT,2022-06-25 03:24:58+00:00,,,
3032,1540536501762670592,"*in the crowd at a show*

*can’t differentiate vape amoke and fog smoke*",hartlandub,2022-06-25 03:24:58+00:00,,,
3033,1540536492514283520,Imagine a juul plugged into a think pad,thegammavariant,2022-06-25 03:24:56+00:00,,,
3034,1540536428890685440,"I’m almost 30 living in a house my parents bought me, I’m addicted to vaping and sports gambling and I have autism with a lisp WHATS my name? Oh and I eat pizza rolls for every meal and my girlfriend just left me https://t.co/sAt9cDnXtY",GranuIate_,2022-06-25 03:24:41+00:00,,,
3035,1540536404253544448,Federal appeals court pauses FDA ban on Juul's e-cigarettes #SocialMedia #digital #digitalhealth #health via https://t.co/ntfWx9f9NY https://t.co/udZxySR6kv,AdswiseDigital,2022-06-25 03:24:35+00:00,,,
3036,1540536172341907456,I just swallowed my juul 😰,sampucketttwt,2022-06-25 03:23:39+00:00,,,
3037,1540536159369138178,they should regulate juuls and it should be said,Shancakess,2022-06-25 03:23:36+00:00,,,
3038,1540536132856840193,BREAKING NEWS: Federal court blocks FDA's ban on Juul https://t.co/TmIFpkN8XE via @MailOnline,Joyenz1,2022-06-25 03:23:30+00:00,,,
3039,1540536130638168067,Juul can keep selling e-cigarettes as court blocks FDA ban https://t.co/GV34Ul0hyN,WNYT,2022-06-25 03:23:29+00:00,,,
3040,1540535972072415234,Let’s not forget about the Juul Community in these trying times..,SethAberle,2022-06-25 03:22:52+00:00,,,
3041,1540535946860498951,What a week to quit condoms and to start vaping.,CRZYKDTV,2022-06-25 03:22:46+00:00,,,
3042,1540535902014808064,"no abortions, no juul, no fricken fun, that’s what.",_CapeBrooklyn,2022-06-25 03:22:35+00:00,,,
3043,1540535730199531525,who tf still used juuls tho 😭😭 we be usin hyde’s and elf bars,mbpenninger,2022-06-25 03:21:54+00:00,,,
3044,1540535729578684416,"America is a bacon wrapped, tattooed, vape pen that’s driving a Jack &amp; Cherry Coke powered truck, carrying an all-you-can-eat gun buffet. Drag racing through an insane asylum on Super Bowl Sunday. There is also a plug-in hybrid model w/ organic bullets for the woke crowd.",grahamelwood,2022-06-25 03:21:54+00:00,,,
3045,1540535678164996096,"Between juul pods and abortion white trash women are having a terrible week.

And to be clear I support all three of those.",AlbyDominguez,2022-06-25 03:21:42+00:00,,,
3046,1540535636536348674,Fuck I can’t juul anymore. At least I have a cock #RoeVsWade,timsingh_,2022-06-25 03:21:32+00:00,,,
3047,1540535535667712014,"The FDA’s Juul ban is on pause for the moment I Tech Talk
#smartwatch #iPhone #android
https://t.co/BP151QCCKa",TechTalkWeb,2022-06-25 03:21:08+00:00,,,
3048,1540535493095526400,ur in america.. in ur purse u got a juul and u got a glock 17.. and one of these things is NOT ALLOWED &amp; it’s not the gun … i’m not even trying 2 be tricky 🥀,hallyluke,2022-06-25 03:20:57+00:00,,,
3049,1540535466486910977,"prayers to all the juul users in these times, the FDA really meant business",lizzzzyyyy6,2022-06-25 03:20:51+00:00,,,
3050,1540535459725672449,Juul is gone :( /// any vape recommendations?? https://t.co/adTCtWV1jl,IrishxTV,2022-06-25 03:20:50+00:00,,,
3051,1540535440977149953,"Perfect coincidence that I chose to buy some juul pods for the first time in like 2~ years a few days before the ban (totally underwhelmed by the experience, I had remembered juul to be better)",aruonora,2022-06-25 03:20:45+00:00,,,
3052,1540535311192801280,"it’s back* baby!

*while the stay is in place

Juul Gets Temporary Reprieve to Keep Selling Its E-Cigarettes https://t.co/pTTSv1sCDG",bethbourdon,2022-06-25 03:20:14+00:00,,,
3053,1540535305777864712,Juuls finally got banned,goretilovesfood,2022-06-25 03:20:13+00:00,,,
3054,1540535261863366656,Federal appeals court pauses FDA ban on Juul’s e-cigarettes https://t.co/iqS2dZDld9 https://t.co/cifJyRBWAH,Toni_chacon,2022-06-25 03:20:02+00:00,,,
3055,1540535016915996680,Just Vape Wrist Watch https://t.co/SZjBkSKkGT,VapeoramaNet,2022-06-25 03:19:04+00:00,,,
3056,1540534960674725889,"You can mutilate your child, but not harm your own body?
#LiberalLogic 
FDA’s Ban on Juul E-Cigarettes Temporarily Blocked by Court https://t.co/ZLcvXTEy2u",LindaStickle,2022-06-25 03:18:51+00:00,,,
3057,1540534945466425345,ik we aren’t supposed to say it but how good is a vape 😩🍆💦,RobertParty01,2022-06-25 03:18:47+00:00,,,
3058,1540534932585472003,not a man posting about how JUUL PODS GOT BANNED TODAY…… read the roooooo@mmmm,svnteenvinyl,2022-06-25 03:18:44+00:00,,,
3059,1540534928668065792,First they came for the juuls…,philip64470820,2022-06-25 03:18:43+00:00,,,
3060,1540534917091565570,they banned juuls AND abortion before at least tightening gun legislations. priorities ppl!,gh0stgoth,2022-06-25 03:18:40+00:00,,,
3061,1540534906484588545,ah yes save the children during birth so they can be killed during school! thank god we also banned juuls !!!,djruuster,2022-06-25 03:18:38+00:00,,,
3062,1540534903128920065,Riding round with my ak47 and my pregnant gf looking for an abortion clinic. All I want is a Juul man :(,MRMONTA97080019,2022-06-25 03:18:37+00:00,,,
3063,1540534890013560832,"Check out my latest article: Everything You Need to Know About Aldvapor’s best vape
 https://t.co/2mfQpXXVRQ via @LinkedIn",Joywayled,2022-06-25 03:18:34+00:00,,,
3064,1540534821780213760,Boo fucking hoo they stopped juuls from being sold in the markets. Don’t compare that shit to abortion. Women should have control over what they wanna do with their body. The fact that GUNS have more rights than we do is disgusting and sickening!,Nataliex34,2022-06-25 03:18:17+00:00,,,
3065,1540534684316160002,i have 1 juul pod left no one talk to me,flatatouille,2022-06-25 03:17:45+00:00,,,
3066,1540534673902043136,"Me: energy drinks are bad for your kidneys.
V: everything’s bad for your kidneys.
Me: not even.
V: look it’s either Red Bull or vaping. 
Me: 👀",Becs,2022-06-25 03:17:42+00:00,,,
3067,1540534611280797696,Drugs &amp; vapes,pleasebyourself,2022-06-25 03:17:27+00:00,,,
3068,1540534609275920385,Abortions and Juuls got banned before guns lmaoooooo what the fuck bro,finnianlyon,2022-06-25 03:17:27+00:00,,,
3069,1540534592360382464,Why do buildings keep burning down if Juuls are banned,idislikenh,2022-06-25 03:17:23+00:00,,,
3070,1540534434390192133,The FDA banned juul the same week abortions were banned. Women I feel your pain. #protectourrights #RoeVsWade,timsingh_,2022-06-25 03:16:45+00:00,,,
3071,1540534401657864192,my vape has been dead this whole shift 😀👍,1800milfeet,2022-06-25 03:16:37+00:00,,,
3072,1540534215179116544,"I cannot live without my Juul and I don’t want women having to live without having abortion being available to them. I hate it here…. Mom pick me up, I’m scared.",BritttHaun,2022-06-25 03:15:53+00:00,,,
3073,1540534140218806272,i can’t believe we live in a country where a gun has more rights than a Juul,lilwokeazn,2022-06-25 03:15:35+00:00,,,
3074,1540534103669448710,a grown ass man asked me where he could vape today,EnthusiastMobo,2022-06-25 03:15:26+00:00,,,
3075,1540533826212007937,How are we banning vapes but not guns ?,DreamCature,2022-06-25 03:14:20+00:00,,,
3076,1540533778657017856,juul ban and roe v wade within a few days. I’m surprised the twitter servers haven’t blown up.,Winthrogany,2022-06-25 03:14:09+00:00,,,
3077,1540533735300468737,#edibles #cbd #gummies #hemp  #vapejuice #delta9 Alibi THC-O Disposable Vape Pen Watermelon. Don’t answer any questions about your buzz; just give them your Alibi. Do you want to say you were vaping with a pretender or that you were https://t.co/lOv1rchKu1 #cbdedibles #delta8 https://t.co/UJfno9104J,CBDSmokeShop,2022-06-25 03:13:58+00:00,,,
3078,1540533695194533889,Vaping: An Unnecessarily Dangerous Lifestyle Choice | Nature's Real Health https://t.co/bBvObZdvMN,nicktompan,2022-06-25 03:13:49+00:00,,,
3079,1540533692334018567,"I don't blame the leftists for fedposting today. I just got back from the gas station to find that Juul really has been discontinued and let's just say, well, I'm trying real hard to be the shepherd",knrd_z,2022-06-25 03:13:48+00:00,,,
3080,1540533641688006658,Teens and vaping: ‘We would have had a nicotine-free generation’ https://t.co/s1E6yyWjj8,nobby15,2022-06-25 03:13:36+00:00,,,
3081,1540533528064139266,juul must have pissed off hillary clinton,NateMarinelli,2022-06-25 03:13:09+00:00,,,
3082,1540533509265186816,Sign the petition: Save Juul https://t.co/UYd48kHwqV via @RebelNewsOnline,njpana,2022-06-25 03:13:04+00:00,,,
3083,1540533475526279168,so the juul ban is just some money shit? looks like they're just clearing the market for rj Reynolds etc  https://t.co/MmNvzpYr8a https://t.co/horL6BJ2lq,eschatoncomrade,2022-06-25 03:12:56+00:00,,,
3084,1540533382701993984,"I should’ve expected it because I’m in SF, but two of the families I babysit for are frequent recreational weed users 🙏🙏 I’ve been offered edibles twice by one family and I stumbled across a super fancy vape another family had charging in the corner hehe",LeeLeeLeeLeeN,2022-06-25 03:12:34+00:00,,,
3085,1540533068926111745,I’m depressed as fuck at work lol I look like shit and I’m on my period and the avs lost and the government is on some fuck shit and I can’t buy Juul pods anymore and I just wanna cry,sugareebabie,2022-06-25 03:11:20+00:00,,,
3086,1540533004665204737,Federal appeals court pauses FDA ban on Juul’s e-cigarettes https://t.co/T3HR19XSzF https://t.co/Ufyee6J0TA,InTime_Blog,2022-06-25 03:11:04+00:00,,,
3087,1540532821537718272,“RICKY COME BACK WE NEED THE JUULS” falen to the tow truck driver driving their car away after they got in a wreck w an 18 wheeler,barretttinker,2022-06-25 03:10:21+00:00,,,
3088,1540532763572551682,cant believe the us is banning juuls before banning guns,giogioflower,2022-06-25 03:10:07+00:00,,,
3089,1540532753355112449,Juul wins temporary hold on the FDA ban : NPR https://t.co/7PBTzHrqLd,youcef84731359,2022-06-25 03:10:04+00:00,,,
3090,1540532735026028546,"Juul filed an emergency motion earlier Friday, seeking the temporary hold while it appeals the sales ban.

 https://t.co/O4zdRAIOFx",WOWT6News,2022-06-25 03:10:00+00:00,,,
3091,1540532730940776448,vaping is bad but when people do it in fursuits its hot ngl,dragon_catz,2022-06-25 03:09:59+00:00,,,
3092,1540532717254856705,Big tobacco’s (BT) Juuls got banned and as a consequence BT took away our abortions,jimjonesfanacct,2022-06-25 03:09:56+00:00,,,
3093,1540532699546300416,U.S. Appeals Court grants temporary stay of FDA’s ban on Juul e-cigarettes. Vaping company has also consulted with restructuring lawyers on possible bankruptcy filing. https://t.co/Brans7RuDk,Todd_Yancey,2022-06-25 03:09:51+00:00,,,
3094,1540532664922304513,"Here’s what to know about the crackdown on Juul e-cigarettes, and regulatory efforts to eliminate menthol cigarettes and nicotine in cigarettes https://t.co/K9IzkwSV5O",Todd_Yancey,2022-06-25 03:09:43+00:00,,,
3095,1540532531518398464,Can we protest the ban on juul too? Cuz they want me to smoke cigs and I definitely will,GoodNoiz,2022-06-25 03:09:11+00:00,,,
3096,1540532384885444608,Federal appeals court pauses FDA ban on Juul’s e-cigarettes https://t.co/mla6UM3eff #digitalhealth #socialmedia #digitalmarketing #healthtech #AI #industry40 #mhealth #IoT https://t.co/AcSIobUS0y,_timos_,2022-06-25 03:08:36+00:00,,,
3097,1540532270058164225,Juul wins temporary hold on the FDA ban: NPR https://t.co/MkLpatcHve,AlpesHolidays,2022-06-25 03:08:09+00:00,,,
3098,1540532255298392064,shoutout to @kelsey_law for buying me dinner and a vape and putting gas into my tank today 🥺🥺🖤 real OG wifey shit,kristcnn,2022-06-25 03:08:06+00:00,,,
3099,1540532236050522113,"you can get sample for free 
#vape #vaping #vapepen https://t.co/4vxVl2P3pj",ricky30670662,2022-06-25 03:08:01+00:00,,,
3100,1540532221005778944,"The Food and Drug Administration on Thursday ordered best-selling vaping brand Juul to stop selling e-cigarettes on the U.S. market.

 https://t.co/8IbpPBkkyH",Icewhiz200k,2022-06-25 03:07:57+00:00,,,
3101,1540532212298354689,Yesterday I was mad about JUULS,damagedave,2022-06-25 03:07:55+00:00,,,
3102,1540532111186178048,The government is banning juuls but not the fake $5 Coca Cola vape I bought from a tattoo store?🤨,lambriniyes,2022-06-25 03:07:31+00:00,,,
3103,1540532086607556608,"this manchild beside me ""almost got kicked out for vaping by his dad"" and  his voice sounds like a chipmunk impersonating a fuckboi and the second hand embarassment is UNREAL",zecapitane,2022-06-25 03:07:25+00:00,,,
3104,1540532072825163777,michigan is just one big M I T C H ' S BEER &amp; FINE WINE LOTTERY LIQUOR SUB Pick up &amp; Delivery SMOKE SHOP GLASS PIPES-KRATOM-VAPE-CBD LARGE PIZZA $5.99 https://t.co/e5Gr0R2CzI,TayAsmoday,2022-06-25 03:07:22+00:00,,,
3105,1540532047038627842,this guy in his mid 40s at the very least just now found out about the juul ban at this gas station and he’s absolutely crushed,ziyanm_,2022-06-25 03:07:16+00:00,,,
3106,1540531915878440961,Federal appeals court pauses FDA ban on Juul’s e-cigarettes - #naijaforum #naijablog #naijamusic - https://t.co/1OWD3mtG39 https://t.co/yUxTHXP2WH,Wazupnaija,2022-06-25 03:06:45+00:00,,,
3107,1540531814971846658,How tf y’all just now banning juul… boi don’t nobody use that old dumb ass shit… get a flumeee but nah don’t do drugs kids https://t.co/1P7Z2VEpKC,skrawberry02,2022-06-25 03:06:21+00:00,,,
3108,1540531810156695552,I can't believe I'm watching mass protests tonight in America all because they banned juul,AlexanderDHall,2022-06-25 03:06:19+00:00,,,
3109,1540531776572891136,"Just as an observation, I’ve generally smoked a few cigarettes a day since I was 18, and gave up after a medical thing pretty easily.

Bought a vape from a tobacconist thinking it had no nicotine (cause nicotine vapes are illegal here), I’ve used it for about a week (1/2)",chonkybongwater,2022-06-25 03:06:11+00:00,,,
3110,1540531617373908992,"Will ban of Juul reduce the smoking rate among teenagers? Probably there are some other factors i think. Indeed, we should consider whether Juul is the fundamental cause of the increase in smoking rates in teenagers. #juulban #SMJnews",Sun991110,2022-06-25 03:05:33+00:00,,,
3111,1540531590648008704,you might be able to ban juuls but you cant ever ban reclaim dabs!,YAbutWYDtho,2022-06-25 03:05:27+00:00,,,
3112,1540531560142802944,Juul Users Prepare to Say Goodbye to Their Vape of Choice https://t.co/CqqVVvLkv1,leafypage1,2022-06-25 03:05:20+00:00,,,
3113,1540531482799644673,Even using my vape pen while doing it https://t.co/SPU5a0Tkr8,kingbtheoneandy,2022-06-25 03:05:01+00:00,,,
3114,1540531482107580416,All our trains and stations are no vaping areas. Please do not vape.,traindroid_se,2022-06-25 03:05:01+00:00,,,
3115,1540531427716272130,"A US Court put on hold the FDA's sales ban Juul e-cigarettes citing its failure to address ""the toxicological profile of the products."" https://t.co/iN0bVpd418",philstarlife,2022-06-25 03:04:48+00:00,,,
3116,1540531404068487173,Is it a good business decision to buy all the Juul pods I can possibly buy?,post_bud,2022-06-25 03:04:43+00:00,,,
3117,1540531375983542272,Vaping THC nearly killed me - https://t.co/Vf6YEeVkSA #CBDTelegraph #CBDOil #CBD,cbdtelegraphla,2022-06-25 03:04:36+00:00,,,
3118,1540531352461885454,She left her vape lol .. finessed 😌,AskYoHoeAboutMe,2022-06-25 03:04:30+00:00,,,
3119,1540531330018164738,Juul wins temporary hold on the FDA ban : NPR https://t.co/VwpKACqioJ,Mangakiko12,2022-06-25 03:04:25+00:00,,,
3120,1540531305754017792,"Abortions = banned
Juul = banned

Guns = here have 10 of them",jd_englehart,2022-06-25 03:04:19+00:00,,,
3121,1540531295364726785,"I may have it bad cause I have a uterus, but I don’t have it as bad as a someone with a uterus and a juul addiction. that has to suck.",zombknee,2022-06-25 03:04:17+00:00,,,
3122,1540531223004577792,How am I supposed to be forced to raise children who can’t Juul,missmagentaa,2022-06-25 03:03:59+00:00,,,
3123,1540531189135446016,Which mdfk thinks vape doesnt contain nicotine 🤡,hknshi,2022-06-25 03:03:51+00:00,,,
3124,1540531135960055808,look at this cool vape trick,mitamabot,2022-06-25 03:03:39+00:00,,,
3125,1540530933513814016,"Why would anyone smoke something called Juul anyways?

Sounds like a poisonous frog lol",the_chill_otter,2022-06-25 03:02:50+00:00,,,
3126,1540530867533017090,What is the difference between Juul and a disposable vape?,christiangust,2022-06-25 03:02:35+00:00,,,
3127,1540530827188125698,thank god they banned juuls https://t.co/2ToRFcuAMX,vminsvillain,2022-06-25 03:02:25+00:00,,,
3128,1540530745541795840,Juul can keep selling its vaping products in the U.S. — for now https://t.co/rMWZ43FlQD,charotardaily,2022-06-25 03:02:06+00:00,,,
3129,1540530733172764672,"My platform is women getting abortions while their boyfriends are juuling and concealed carrying alongside them supportively.

We could have a society…",SalomeSibonex,2022-06-25 03:02:03+00:00,,,
3130,1540530721630060544,And now the govt. is taking away my JUUL's all of a sudden. This is not. the. time.,originalratched,2022-06-25 03:02:00+00:00,,,
3131,1540530705343586306,omg now they’ll start smoking cigarettes even more as they keep cracking down on vapes slay 😍,catacraze,2022-06-25 03:01:56+00:00,,,
3132,1540530691754057728,"It's a ""miss an important Pride event because of a disability that no one knows how to treat, so buy edibles, toke my vape, eat chinese food, love up my wife, cuddle my son and watch trashy television and then have a meltdown from being emotionally overwhelmed"" kinda night",MerMucinJones,2022-06-25 03:01:53+00:00,,,
3133,1540530667078967298,juuls and life saving medical procedures banned before assault rifles. this country is a fucking joke.,mentalmillness,2022-06-25 03:01:47+00:00,,,
3134,1540530584291885057,Court temporarily blocks FDA ban on sale of Juul e-cigarettes https://t.co/O5aT75vdyE via @WSAV,WSAV,2022-06-25 03:01:27+00:00,,,
