,TweetID,TweetContent,TweeterUsername,TweetDatetime,TweetLongitude,TweetLatitude,TweetPlace
1990,1540642457360138240,"How did Vaping become a thing? A brief history of vaping…

https://t.co/jswLBR6EnC…

#vaping #vape #vapelife https://t.co/bVkoNR9QXA",thevikingvapist,2022-06-25 10:26:00+00:00,,,
1991,1540642422346158082,NO abortions… absolutely NO JUUL’s… but here is an AR-15 💖,joeyjayisgay,2022-06-25 10:25:51+00:00,,,
1992,1540642407179440129,510 Thread Vape Battery Magnetic Adapter: #VapeBattey magnetic adapter for 510 thread : https://t.co/Gm7uem6yaY  #Vaping #Delta8 #THC #Vape #VapeLife,5OShadeOfGreen,2022-06-25 10:25:48+00:00,,,
1993,1540642380121944065,"chasing my wine with my vape 

✨reasonable✨",bigredwh0re,2022-06-25 10:25:41+00:00,,,
1994,1540642273968508928,Top 10 Reasons You Should Try Blu Electronic Vaping Accessories https://t.co/WJLJMpOXK0 #bluvaping #myblu,listland,2022-06-25 10:25:16+00:00,,,
1995,1540641843381211138,Good morning to everyone except those who vape on the bus. I hope you lot forgot to charge your phones overnight,jeremiah_ldn,2022-06-25 10:23:33+00:00,,,
1996,1540641702305595392,"JUICE POINT, TRIPLE PACK!! for just £14.99!

https://t.co/Y3twfCg08S

#vaping #vapers #vapelife #vapefam #vapelyfe #vapemod #vapekit #eliquids #ecig #ejuice #vapejuice #thevikingvapist https://t.co/rtyJnsisLC",thevikingvapist,2022-06-25 10:23:00+00:00,,,
1997,1540641438957985792,"Federal appeals court pauses FDA ban on Juul’s e-cigarettes https://t.co/zWN7e1m84r via @Verge 
Good. Unelected agency officials should not be allowed to create laws.",KeithBrooker5,2022-06-25 10:21:57+00:00,,,
1998,1540641348059029504,"Juul can keep selling vaping products in the US for now – Website Maker News
https://t.co/5M75BAe7gw",mywebsitemaker,2022-06-25 10:21:35+00:00,,,
1999,1540640979245568000,"FDA Bans Juul, Orders Products Removed From U.S. Market https://t.co/zsE8nsVKg7",RadarsScience,2022-06-25 10:20:07+00:00,,,
2000,1540640966696214529,All products of a popular vaping brand have been removed from sale in the United States over safety concerns. https://t.co/kdZUwEldxh,TheScotsman,2022-06-25 10:20:04+00:00,,,
2001,1540640933959663616,US bans popular vaping brand amid safety concerns https://t.co/fOhMievRwY,EnglishJaun,2022-06-25 10:19:57+00:00,,,
2002,1540640931900170240,"Biden: Im banning Juul vapes. They are dangerous.
Biden: Anyone want a free glass crack pipe??",auntyelaine781,2022-06-25 10:19:56+00:00,,,
2003,1540640906738401280,i left my vape at my moms house. fuck🤦🏽‍♂️🤦🏽‍♂️,RiddimJxke,2022-06-25 10:19:50+00:00,,,
2004,1540640807962775552,"Juul Gets Temporary Reprieve to Keep Selling Its E-Cigarettes 

https://t.co/ty6Bjx2fkk",LaurenSHirsch,2022-06-25 10:19:26+00:00,,,
2005,1540640795191132160,"#WorldDrugDay_2022
Smoking alternatives such as vape products were introduced in Pakistan in 2013, and have since then grown to a niche market with many local brands opening shops across the country.
@LegacyLeavers_ 
@janglus_ 
JB",ili_JB_ili,2022-06-25 10:19:23+00:00,,,
2006,1540640624012959745,"you're the *gunshot* *gunshot* gunshot* *cash register noise*  now, vape back at it again with the white Vans",skellxp,2022-06-25 10:18:43+00:00,,,
2007,1540640198433701888,"Moving to Ban Juul, the FDA Delivers a Blow to Big Nicotine https://t.co/eUPYIu6Cyb",ronmc1,2022-06-25 10:17:01+00:00,,,
2008,1540639716235698178,A federal court has put a temporary hold on the government's order for Juul to stop selling its electronic cigarettes.  https://t.co/qkqJgxtiEf,FOX13News,2022-06-25 10:15:06+00:00,,,
2009,1540639700561567745,Federal court blocks FDA ban on Juul allowing company to sell e-cigarettes https://t.co/149qCP1VYK,fox5dc,2022-06-25 10:15:02+00:00,,,
2010,1540639671922970624,#edibles #cbd #gummies #hemp  #vapejuice #delta9 Our Sour Space Candy Live Resin CBD Vape Pen is an enjoyable and complex flavor.  It leads with tart notes and because we use Live Resin. You will taste real natural hemp with an earthy https://t.co/GsdXnwvwRg #cbdedibles #delta8 https://t.co/hLNtVqmNe8,CBDSmokeShop,2022-06-25 10:14:56+00:00,,,
2011,1540639416024289286,Lol banning juuls isn’t gonna stop anyone try again.,BNHowell1,2022-06-25 10:13:55+00:00,,,
2012,1540639378971807744,i’m ngl i really ought to stop vaping 😩🤩,honeyfairymyg,2022-06-25 10:13:46+00:00,,,
2013,1540639346562310146,FDA Orders Juul Labs To Remove Products From US Market https://t.co/wE9BeCRMai,jeguru1,2022-06-25 10:13:38+00:00,,,
2014,1540639303230836737,Where the fuck is my juul,sampucketttwt,2022-06-25 10:13:28+00:00,,,
2015,1540639200441241600,All products of a popular vaping brand have been removed from sale in the United States over safety concerns. https://t.co/DsOBpbHwqV,edinburghpaper,2022-06-25 10:13:03+00:00,,,
2016,1540639024200617984,stop vaping/smoking,Mat_DuanWan,2022-06-25 10:12:21+00:00,,,
2017,1540639000641273856,#Juul can keep selling e-cigarettes as court blocks #FDA ban https://t.co/VtdLT7WYmd,physorg_health,2022-06-25 10:12:16+00:00,,,
2018,1540638704179458048,vaping confirmed for smash,ConfirmedFor,2022-06-25 10:11:05+00:00,,,
2019,1540638342408278017,They really banned abortions and JUULs before assault weapons,brosiph2014,2022-06-25 10:09:39+00:00,,,
2020,1540638315237756928,vape or die,kiawe_bot,2022-06-25 10:09:32+00:00,,,
2021,1540638258819788803,casually walking into the vape store and this random trick wanna fight me bc her bf was looking..like damn girl..you want me to buy you a vape as well? Gtfo 😂,KelzNDT,2022-06-25 10:09:19+00:00,,,
2022,1540638180629590016,"Juul appeals to US federal court to end ban on e-cigarettes Fri, 24 Jun 2022 21:57:18 +0000 https://t.co/L18L9HTmKR 全確保支援士NEWS",kai_ri_0001,2022-06-25 10:09:00+00:00,,,
2023,1540637946990190592,"Steam Crave Hadron RDSA Rebuildable Dripping Vape Atomize
Buy it on:
https://t.co/PAbrwVk5CN https://t.co/bu3J1nM1CC",3FVape,2022-06-25 10:08:04+00:00,,,
2024,1540637927402766337,yall why did they ban Juul’s just to unban them all in 24 hours 🙃,shanialee73,2022-06-25 10:08:00+00:00,,,
2025,1540637914027405312,"If you live in Bangalore and you vape... you're braindead. Just breathe air man , not blueberry flavoured lung cancer. The weather is so fine here.",pinak_singhania,2022-06-25 10:07:57+00:00,,,
2026,1540637705482149888,(Daily Record):#America bans the sale of all #Juul vaping products amid safety concerns : Retailers and shops face 'enforcement action' if they are found to have any Juul products on sale. .. https://t.co/i0SflD0eIQ,newsoneplace,2022-06-25 10:07:07+00:00,,,
2027,1540637523226939392,Kids recently posting about making their own vape... https://t.co/MszaXpTgMo,AndraeJones816,2022-06-25 10:06:23+00:00,,,
2028,1540637441631158272,I'm disappointed to report the kulinski has reverted to his natural state of vape bro,ThePlanBPill,2022-06-25 10:06:04+00:00,,,
2029,1540637388443160576,🖤🤎 @ Vape n' Pong https://t.co/0Z9pJaiAlY,noooooonel,2022-06-25 10:05:51+00:00,121.0178757,14.602218,"Manila City, National Capital Region"
2030,1540637366678847488,"Following the FDA's ban on JUUL products, we look at JUUL's rise from a small company to the industry leader in vapes and vaping-related products. https://t.co/vzT7IXGqwn",QuintFit,2022-06-25 10:05:46+00:00,,,
2031,1540637349763317760,"Juul argued that the F.D.A.’s decision to ban sales was motivated by political forces that sought to blame the company for the youth vaping crisis. 

Juul Gets Temporary Reprieve to Keep Selling Its E-Cigarettes https://t.co/HMADt6Vlq8",seangraf,2022-06-25 10:05:42+00:00,,,
2032,1540637321707544576,Juul can temporarily keep selling its vaping products in the US https://t.co/hSqCi61BzM,info_blooket,2022-06-25 10:05:35+00:00,,,
2033,1540637092455276544,Juul can temporarily keep selling its vaping products in the US https://t.co/Kt8iqqWXgy,TheBlogger_in,2022-06-25 10:04:41+00:00,,,
2034,1540637017465229317,Juul can temporarily keep selling its vaping products in the US https://t.co/1pXYwjoktV,medicinehelp,2022-06-25 10:04:23+00:00,,,
2035,1540636733909266437,Wake up vape up,carlyshaytwt,2022-06-25 10:03:15+00:00,,,
2036,1540636437246263296,Just posted a photo https://t.co/ql51t3ksuY,vape_z0ne_uk,2022-06-25 10:02:04+00:00,,,
2037,1540636426261639168,Juul can temporarily keep selling its vaping products in the US 他 &gt; https://t.co/5c4dRfFCSV   PR:https://t.co/CTArOdNlHK,gadget_anderson,2022-06-25 10:02:02+00:00,,,
2038,1540636117782888454,"⁉️CAN YOU BELIEVE IT⁉️
👌😍 Now selling at £33.60 😍👌
10 x BumbleZest Calm &amp; Comfort 12mg CBD Drink 60ml by BumbleZest
👉 Shop the range here ⏩ https://t.co/6S2Eibo7cP 👈 https://t.co/4WZTDNjbYL",Henrys_Vapes,2022-06-25 10:00:48+00:00,,,
2039,1540636114846978050,Court temporarily halts FDA ban on Juul e-cigarettes https://t.co/U6CFjqqBT5,EINTobaccoNews,2022-06-25 10:00:48+00:00,,,
2040,1540635986694385664,Vaping kills so why do it because instead of dying you can play Minecraft,Dont_Vape_Bot,2022-06-25 10:00:17+00:00,,,
2041,1540635963067596800,Federal court blocks FDA ban on Juul e-cigarette sales in US https://t.co/buLCBaMdI6,KVUE,2022-06-25 10:00:11+00:00,,,
2042,1540635953529868289,"The government’s order for Juul to stop selling its electronic cigarettes was put on hold, after the company filed an emergency motion to appeal the sales ban from the FDA — which said Juul didn’t give enough info to evaluate potential health risks
https://t.co/V6XJUXRiaJ",NBCNewYork,2022-06-25 10:00:09+00:00,,,
2043,1540635946852425729,"A federal appeals court on Friday temporarily blocked the Food and Drug Administration’s order banning the sale of Juul e-cigarettes, giving a reprieve to the company while the court hears more arguments.  

https://t.co/f4dr5dfyx7",WAVY_News,2022-06-25 10:00:08+00:00,,,
2044,1540635922634776577,Juul can temporarily keep selling its vaping products in the US 他 &gt; https://t.co/WqNb73KMo0   PR:https://t.co/4ygwrNjGeC,the_gekko_mask,2022-06-25 10:00:02+00:00,,,
2045,1540635920637906945,Want to set a healthy example and transform your club into a Smoke &amp; Vape Free zone? To get your club involved visit: https://t.co/4CHuHU0trW https://t.co/E5qyc9g1HV,officialgaa,2022-06-25 10:00:01+00:00,,,
2046,1540635430088871936,"If people seen personally how the stuff is made, people wouldn't be smoking that. Kids think it's so harmless, they be vaping inside public spaces...",AndraeJones816,2022-06-25 09:58:04+00:00,,,
2047,1540635299621003264,Court temporarily halts FDA ban on Juul e-cigarettes https://t.co/bl6eZjtwLw,Md_Asif_Ali_,2022-06-25 09:57:33+00:00,,,
2048,1540634917419134983,Court temporarily halts FDA ban on Juul e-cigarettes https://t.co/9FwAVz6kSI,ChiSchoolofYoga,2022-06-25 09:56:02+00:00,,,
2049,1540634876382433281,nearly dropped my vape in the fuckinf toilet and indro,LucyPhi00963236,2022-06-25 09:55:52+00:00,,,
2050,1540634861635080192,banning abortions and juuls before guns😭😭😭😭😭😭😭😭,libbysykes7,2022-06-25 09:55:49+00:00,,,
2051,1540634556180602880,Federal appeals court pauses FDA ban on Juul’s e-cigarettes https://t.co/JHbbGR83mY,PyotrKropotkin4,2022-06-25 09:54:36+00:00,,,
2052,1540634236247752704,"While The Hall Of Vape is going on, our booth number is D90 ，what are we waiting for. Welcome to our booth to see our new products and get our latest models with the purest taste.，
# The Hall Of Vape #vape #vapeshop#Abufan#clouds #smok https://t.co/zHl6BugLON",perkey_Jude,2022-06-25 09:53:20+00:00,,,
2053,1540634116903038976,Should stop vaping,snowflakestwt,2022-06-25 09:52:51+00:00,,,
2054,1540633676639342592,"they had no menthol pods and the virginia tobacco juul pods taste absolutely awful,  hope you’re fucking happy FDA!",heroinjuulp0d,2022-06-25 09:51:06+00:00,,,
2055,1540633649271345152,"Fantasi Ice #ELiquid Bundle £24.99 - 4 X 100ml Vape Juices!

https://t.co/AFVbYHZrrt

#vaping #vapers #vapelife #vapefam #vapelyfe #vapemod #vapekit #eliquids #ecig #ejuice #vapejuice #thevikingvapist https://t.co/ojIwYOSv3i",thevikingvapist,2022-06-25 09:51:00+00:00,,,
2056,1540632638779756546,Nebudu promovat vapes ani cbd 😂 fuck that,gunpoint_pod,2022-06-25 09:46:59+00:00,,,
2057,1540632627807326208,Wake up vape up,trinavegatwt,2022-06-25 09:46:56+00:00,,,
2058,1540632561919090689,Juul can temporarily keep selling its vaping products in the US https://t.co/GEmKWbquvc #metabloks,metabloks,2022-06-25 09:46:40+00:00,,,
2059,1540632368117080064,Court temporarily halts FDA ban on Juul e-cigarettes https://t.co/IxPXWTyjx5,PostHealthSci,2022-06-25 09:45:54+00:00,,,
2060,1540632357904023553,"Federal appeals court puts FDA ban on Juul e-cigarette sales on hold: A U.S. federal appeals court on Friday put on hold the Food and Drug Administration's ban on sales of Juul Labs Inc's e-cigarettes, after the company appealed via NBCNews https://t.co/fySmj2UAFi",jilevin,2022-06-25 09:45:52+00:00,,,
2061,1540632302413156352,didnt vape at all today plz congratulate me (っ- ‸ - ς),w0nyoungluv,2022-06-25 09:45:39+00:00,,,
2062,1540631811818041344,Insane that they tried to hide the overturning of roe v wade by banning juul,SprawIii,2022-06-25 09:43:42+00:00,,,
2063,1540631634676183040,"VOZOL is showing up at the ""Hall of Vape"" exhibition today. If you are around, come and visit us at booth number B57.

#vozol #vozolshow #thehallofvape #vapeshowingermany #vapeexpoingermany #vozolnewproduct #vozolvape #disposablevape #stuttgartvape #vapeshowinstuttgart https://t.co/tOB5X0yBsp",Henry_VOZOL,2022-06-25 09:42:59+00:00,,,
2064,1540631570826100737,Court temporarily halts FDA ban on Juul e-cigarettes https://t.co/qW8xcudUJf,washpostbiz,2022-06-25 09:42:44+00:00,,,
2065,1540631404773576705,"Chat talking about how increasing hatred towards the LGBTQIA+ is worrying.
Big streamers ""I don't talk politics in my stream""....
You have a platform, grow a spine you FFDP vaping fuck knuckle.",TheMushroomInc,2022-06-25 09:42:05+00:00,,,
2066,1540631347076554752,they banned Juuls and abortions how are we supposed to have any fun in this country,DolliesNFT,2022-06-25 09:41:51+00:00,,,
2067,1540630925255446528,"TW :  The FDA Is Banning Juul Products. That’s Bad for Our Health.: One accused seller faces five years in prison. In another instance, police staked out a Latin American clothing store to spot a customer leaving the shop with menthols; the owner was… https://t.co/eUJkgN1A0K https://t.co/9gGaowiYgD",StigmabaseO,2022-06-25 09:40:10+00:00,,,
2068,1540630793357185024,"FDA Orders All JUUL Products Off The Market - The Madras Tribune 
#MadrasTribune #News #BreakingNews
https://t.co/LwSRyoVMUx",MadrasTribune,2022-06-25 09:39:39+00:00,,,
2069,1540630678945075200,Juul Gets Temporary Reprieve to Keep Selling Its E-Cigarettes https://t.co/U1oCiCPBfm,JanatakhabarP,2022-06-25 09:39:12+00:00,,,
2070,1540630538419060736,Federal appeals court pauses FDA ban on Juul’s e-cigarettes https://t.co/lEZb6Y6l98,Unitednewsbag,2022-06-25 09:38:38+00:00,,,
2071,1540630441761406982,"New @geekvapetech Giveaway Now Live! -  Enter now for a chance to win the new Geekvape B60 Boost kit - https://t.co/sbdquwhQOb

#ecigclick #geekvape #geekvapeb60 #vaping #vapegiveaway #vapefam #vape #vapelyfe #giveaway",IgorMelnik17,2022-06-25 09:38:15+00:00,,,
2072,1540630325318995968,I need to get a weed vape this weekend. Need to be able micro dose throughout the work day.,MikeJAnthony,2022-06-25 09:37:47+00:00,,,
2073,1540630201939419137,Juul Users Prepare to Say Goodbye to Their Vape of Choice https://t.co/lxrct7bSWI,seangraf,2022-06-25 09:37:18+00:00,,,
2074,1540629773780586496,crap! I have 3000 of assignments due on Halloween and I broke my juul,FinnVonFritter,2022-06-25 09:35:36+00:00,,,
2075,1540629672031035392,Hall of Vape! https://t.co/zk8HprfBwV,VdeH_Verband,2022-06-25 09:35:11+00:00,,,
2076,1540629582835073024,I DIDNT KNOW NIALL VAPES???!!! also 100% mint flavor or mango,dydrming,2022-06-25 09:34:50+00:00,,,
2077,1540629576950358016,smoking a pipe is mad lame looking its almost as bad as vaping but smoking joints uses too much weed !!,jokes316,2022-06-25 09:34:49+00:00,,,
2078,1540629545396617217,vaping puts you at a 70% risk of having a stroke at a young age,blushhirai,2022-06-25 09:34:41+00:00,,,
2079,1540629542590910465,Juul can temporarily keep selling its vaping products in the US https://t.co/3Qd2oAZq1G,medicinehelp,2022-06-25 09:34:41+00:00,,,
2080,1540629474433179648,Juul can temporarily keep selling its vaping products in the US Juul has successfully convinced the United States Court of Appeals for the District of Columbia to delay the Food and Drug Administration's ban on its products. The agency recently banned Ju… https://t.co/sNY5zmVMVK,Feedjunkie,2022-06-25 09:34:24+00:00,,,
2081,1540629455856623616,"Check out our Von Duke CBD Bundle's 5 for £24.99
4 bundle's to choose from.
https://t.co/EMUEkm9W5x
#CBD #vape https://t.co/CMiC7LrZp3",vapeselective,2022-06-25 09:34:20+00:00,,,
2082,1540629442866733056,"in additional news that sucks there's also the juul ban, so if anybody wants any advice on what other kinds of devices are available and how to make your own vape juice at home feel free to DM me about that",SoupGargoyle,2022-06-25 09:34:17+00:00,,,
2083,1540629348050472960,I cant buy a juul but i can buy an IRL Vandal in 15 minutes!!,76kdot,2022-06-25 09:33:54+00:00,,,
2084,1540629293436239872,"In a surprising move, #juul - a company known to roll over and side with the enemy - has challenged #FDA's MDO. This has the potential to expose FDA for the arbitrary and capricious cult it has always been. #AbolishFDA 

https://t.co/yh3Qvh9JHT",mihotep,2022-06-25 09:33:41+00:00,,,
2085,1540629177916743680,"Monarch J3S JIIIS 2 Style 316SS RTA Rebuildable Tank Vape Atomizer
https://t.co/SXhev3LJxy
510 threading connection
316 stainless steel construction https://t.co/kXqR9Lmmmf",2Fdeal,2022-06-25 09:33:14+00:00,,,
2086,1540628738488025089,"Frigus Mint - A subtle cooled, refreshing mint with a sugary note on the aftertaste. Reminiscent of the famous Kendal Mint Cake. A great warm weather vape and if you want it extra cool, try it with an ice nicotine shot.

Custom mod by @vapesmarter00 https://t.co/DV26jVGg56",LegioXELiquid,2022-06-25 09:31:29+00:00,,,
2087,1540628637690494976,Juul can keep selling e-cigarettes as court blocks FDA ban https://t.co/bV2FDixzyA,WMCActionNews5,2022-06-25 09:31:05+00:00,,,
2088,1540628553368322048,Juul asks court for temporary block on FDA’s ban of its e-cigarettes – EAST AUTO NEWS https://t.co/yJDzINDFsw,Automobilnews1,2022-06-25 09:30:45+00:00,,,
2089,1540628415086112768,Juul Is an Easy Target—Let's Ban More Tech Products That Harm Us https://t.co/Rj8LVMmFCg https://t.co/kVZOyGxgKa,Technology_Bits,2022-06-25 09:30:12+00:00,,,
2090,1540628393313460225,"RBA Vape Guide: RDA, RTA, RDTA, and More - what makes the different kinds of rebuildable atomizers unique?
By Jeremy Mann 

https://t.co/QOa7d6PUFn",Vaping360,2022-06-25 09:30:07+00:00,,,
2091,1540628380596551681,Juul can keep selling vaping products in the US for now – TechCrunch https://t.co/efaeq8Tdyh,UpdatesFinance2,2022-06-25 09:30:04+00:00,,,
2092,1540628365757104131,"A #US court puts on hold the health regulator’s decision to order all of #Juul Labs vaping products off the American market over safety concerns.

https://t.co/G1DVIdJB4h",AlArabiya_Eng,2022-06-25 09:30:00+00:00,,,
2093,1540628113981308928,"OSU: Fast food companies still in Russia, ban on juuls, and OSU patents ""the."" : The Indicator from Planet Money - NPR

https://t.co/cGUMd952SJ",SelfSanctions,2022-06-25 09:29:00+00:00,,,
2094,1540628023870889984,SPENT WAY TOO WET I ASSUME SO I HAVE THAT SAME VAPE HELL YES.,wheredthebotgo,2022-06-25 09:28:39+00:00,,,
2095,1540627922712666114,don't let the abortion ruling distract you from the juul ban,Mitosis01,2022-06-25 09:28:14+00:00,,,
2096,1540627707809206274,Ollie got moves #thehallofvape #vape # https://t.co/2S8sjgeDiV,orangecountycbd,2022-06-25 09:27:23+00:00,,,
2097,1540627624493568002,"Federal court blocks FDA ban on Juul e-cigarette sales in U.S.

https://t.co/IGesqHV9cb",Internewscast1,2022-06-25 09:27:03+00:00,,,
2098,1540627616205529088,It’s 4 am and I wanna know if you can vape cum,glitter_glock,2022-06-25 09:27:01+00:00,,,
2099,1540627489726382082,Juul can temporarily keep selling its vaping products in the US https://t.co/kmEfc01pCJ,PavelNosok,2022-06-25 09:26:31+00:00,,,
2100,1540627461486137345,What’s the point of vaping idgi,Maanlikekai,2022-06-25 09:26:24+00:00,,,
2101,1540627424349667329,"In other news, the FDA ban on JUUL vape pens has been overturned by the SCOTUS. In a 6-3 ruling, SCOTUS has upheld the ban for men, JUUL pen vaping will be required twice daily for women.",jaxmeier,2022-06-25 09:26:16+00:00,,,
2102,1540627155201265664,The FDA orders Juul to pull all of its vaping products from the U.S. market https://t.co/aPLarSnakC https://t.co/wAE2sbfisx,HealthSmartMe,2022-06-25 09:25:11+00:00,,,
2103,1540626903815659520,"Check out our range of Vape Kits available on our website!

https://t.co/LG1ktM2R7O

#vaping #vapers #vapelife #vapefam #vapelyfe #vapemod #vapekit #eliquids #ecig #ejuice #vapejuice #thevikingvapist https://t.co/Un0dBW8p21",thevikingvapist,2022-06-25 09:24:11+00:00,,,
2104,1540626672256520193,Supreme Court: Buy All the Guns You Want! FDA: But Not Any JUUL Pods https://t.co/NKiY4kLXd2,TOPSHELFtoday,2022-06-25 09:23:16+00:00,,,
2105,1540626462344155149,can't believe juuls got banned,andyproductionz,2022-06-25 09:22:26+00:00,,,
2106,1540626348053389313,"Idk what’s worse, the juul being banned or Roe v. Wade",doverdarren2,2022-06-25 09:21:59+00:00,,,
2107,1540626185264271360,"All Juul products have been removed from sale in America over safety concerns 

https://t.co/bdmJX6Fj3Q",Daily_Record,2022-06-25 09:21:20+00:00,,,
2108,1540626154851295233,can i vape in the shower,FORMERCLARlTY,2022-06-25 09:21:13+00:00,,,
2109,1540626113759543297,Juul can temporarily keep selling its vaping products in the US https://t.co/5WaFpeFjPV,Klimasense,2022-06-25 09:21:03+00:00,,,
2110,1540626087759298561,"All this startup news, and we didn’t even talk about Juul – World News https://t.co/dweinxHJmf",onetech_blog,2022-06-25 09:20:57+00:00,,,
2111,1540626070071828480,Court temporarily blocks FDA ban on sale of Juul e-cigarettes https://t.co/CjyxkJkGOU,KAMRLocal4News,2022-06-25 09:20:53+00:00,,,
2112,1540626067056201728,"Dank Bar Pro Edition 350mg Full Spectrum CBD Vape Disposable by Purple Dank - 12 flavours #cbdworldonline #retweet #cbd #cbdoil #CBD #follow #Cannabidiol #Cannabis #Cannabisoil #News #BreakingNews #Retweet #RETWEEET #Glastonbury

https://t.co/keERW1p7A8",CBD_Support_UK,2022-06-25 09:20:52+00:00,,,
2113,1540625860662906882,Juul can keep selling e-cigarettes as court blocks FDA ban https://t.co/tB5g4ygNyG,borowest,2022-06-25 09:20:03+00:00,,,
2114,1540625524355211264,bruh i am going to marry my vape one day,cdrmsimp,2022-06-25 09:18:43+00:00,,,
2115,1540625518814453760,"So people better stock up to make plans because what you don’t know is menthol is already banned and about to be phased out and if you aren’t ready, you will be like these JUUL people who are pissed off they can’t smoke and want to beat Biden’s ass https://t.co/Hpx3g2Kisf",JacobGo97134711,2022-06-25 09:18:41+00:00,,,
2116,1540625264996139008,"More exciting news!!!🔔🔔🔔

We're opening up a third outlet near Abu Abbas Super Market in Makeni be sure to visit it and Stand a chance to win some complimentary vapes💨

Stay tuned for our grand opening😃 https://t.co/nyQPdff3cL",vapeking_zambia,2022-06-25 09:17:41+00:00,27.7691065,-15.9703669,"Lusaka, Zambia"
2117,1540625078076989442,Juul wants to continue selling its products while it files an appeal of the FDA's decision. https://t.co/Dx8sWHkij3,NewsRadio710,2022-06-25 09:16:56+00:00,,,
2118,1540624980278480896,"The FDA under Biden’s directives already pass laws to ban and phase out menthol and soon Vapes of all types, so people are about to be a bunch of mean mad motherfuckers suffering from cravings when that happens. Everyone will be on the edge. Ducking Biden and his I know best shit https://t.co/MTeweFhL2K",JacobGo97134711,2022-06-25 09:16:33+00:00,,,
2119,1540624831582031872,I feel left his juul at his rest...,ClayBorrellBot,2022-06-25 09:15:57+00:00,,,
2120,1540624818554503168,I have a whole fuckin 1 graham vape,Anthony10468555,2022-06-25 09:15:54+00:00,,,
2121,1540624750195654660,"just saw a picture of niall with a vape. i will not make a joke abt my name, i will not make a joke abt my name, i will not-

you can have me next niall",fruitmanlover,2022-06-25 09:15:38+00:00,,,
2122,1540624606259716096,Juul can keep selling e-cigarettes as court blocks FDA ban https://t.co/Bh62siQ3p0,WKBW,2022-06-25 09:15:04+00:00,,,
2123,1540624516816273410,"Buy 🏆 Award Winning Brands at #cbdworldonline 

Over 1000 Top Quality #cbd products to choose from! 

CBD OIL
CBD CAPSULES
CBD VAPE
CBD PASTE
CBD EDIBLES
CBD DRINKS

And Much More...

TRY OUR AWARD WINNING 
CALI GREENS CBD RANGE TODAY 😋 👌 🙌 😍 
https://t.co/wM75n7ohzd",CBD_Support,2022-06-25 09:14:42+00:00,,,
2124,1540624459668807681,It’s like the JUUL ban that went into effect yesterday. JUUL and vapes with the JUUL brand are now illegal in the US. And it’s the start of banning menthol and the ban is moving to Menthol Cigarettes because Biden wants to ban menthol and cigarettes. https://t.co/tHXgeNNdyK,JacobGo97134711,2022-06-25 09:14:29+00:00,,,
2125,1540624386708873218,The U.S. wants to ban Juul. Where is Canada on regulating e-cigarettes? https://t.co/1NE3fldo1E https://t.co/VhbI4ln0Qk,CBCHealth,2022-06-25 09:14:11+00:00,,,
2126,1540624326667472896,"Pick up your favorite products from @EightVape MixedUp10 saves you some $$$
#SaturdayMorning #vape #vaping #theweekend #eightvape #ORDERNOW https://t.co/dFhlfcVddT",Alreadymixedup,2022-06-25 09:13:57+00:00,,,
