,TweetID,TweetContent,TweeterUsername,TweetDatetime
0,699020255373488128,Representative Tom Cole (R-Ok) H.R. 2058 bill is gaining political support for vaping https://t.co/DrYIaqrMDQ,Vapingit,2016-02-14 23:59:50+00:00
1,699020242236870656,"Sooooo....I've been home all day watching Netflix,  YouTube,  and Vaping😑.......This is not how my Valentine's Day was supposed to be spent😐",BlessedNGroovy,2016-02-14 23:59:47+00:00
2,699020229347770368,"Still love your vids @RipTrippers. Best info, best quality, most humorous vape videos online. Paid or not paid....who cares! Vape on dude!",The1DansAnger,2016-02-14 23:59:44+00:00
3,699020130383048704,Hooked on vaping.💨😝,coleman_shel,2016-02-14 23:59:20+00:00
4,699020096124153856,I liked a @YouTube video from @24thdoctor https://t.co/Ns4SsuX8PP A very cold Valentine's Vape Log,DailyRandomVlog,2016-02-14 23:59:12+00:00
5,699019961679921153,This guy has obviously never had a person close to him saved by vaping... https://t.co/K9Q13ZcxEa,JamesKnupp,2016-02-14 23:58:40+00:00
6,699019791235883009,"SO to the kid vaping in the movie theater, you're totally cool",ukrainekraine,2016-02-14 23:58:00+00:00
7,699019782897725442,A Boy and His Vape: A Love Story,hannnnnnahrose,2016-02-14 23:57:58+00:00
8,699019762899230720,Calling on Kiwi  - Flash  event outside Parliament 3 March 2016    https://t.co/IpHfKTSaK3 #vape #ecig,ecigitesztek,2016-02-14 23:57:53+00:00
9,699019664903553025,"HappyHour@KingKush
FREE Dab w/Don
$7 OFF Spliffin Vape
$5 OFF DELTA Vape
$5 Off Wax/Crumble 20 
20% OFF EDIBLES",KingKush_LA,2016-02-14 23:57:29+00:00
10,699019599677935616,I liked a @YouTube video from @spicy110sm https://t.co/MYMmCoczku Vaping....Gateway to smoking!,REBullet03,2016-02-14 23:57:14+00:00
11,699019434523041792,"The Good, the Bad n the Ugly Barron's Choice https://t.co/Z2PlmMiMaL via @YouTube #vape #vapers #vaping #vaping2016 #vapefam #vapecommunity",daznrach,2016-02-14 23:56:35+00:00
12,699019386947035136,How to vape on Valentine's Day: https://t.co/784gg9vTXn,kayla_patnode,2016-02-14 23:56:23+00:00
13,699019128296706048,Yung vape 😭,danicamothis,2016-02-14 23:55:21+00:00
14,699019109208559616,Win a 5 pack of Stealth eSkillet #wax #vape atomizers from https://t.co/tEJSWee1Uk https://t.co/xApsFpryDw via @edab710,jeffrey_voss,2016-02-14 23:55:17+00:00
15,699018897001943040,#Valentines #Ecigs Promo @NJOYVape - 30% Off Sitewide + Free Shipping w/ coupon https://t.co/RUqXdeGQJH #vape #HappyValentinesDay #vaping,HelpMeFindDeals,2016-02-14 23:54:26+00:00
16,699018703782850560,Lost Fog Collection by Cosmic Fog Review https://t.co/cUZzfNDzBS via @YouTube #vape #ecigarette,VapesTopher,2016-02-14 23:53:40+00:00
17,699018327721545728,Calling on Kiwi #vapers - Flash #vape event outside Parliament 3 March 2016 https://t.co/ruseBExjhm @HanleySoloway https://t.co/vUUstK6bPp,VapingAlliance,2016-02-14 23:52:11+00:00
18,699018066860994560,"i explained vaping to my friend abroad and she was like ""wtf is this that looks so stupid"" and i agree",frogpiss,2016-02-14 23:51:08+00:00
19,699017893581697024,"Get the lates vape news here via the @vapourator 
https://t.co/7RSryolsoa

#VapeNews #Ecig #VapePromote https://t.co/HAAZZyq7Dj",CCVapes,2016-02-14 23:50:27+00:00
20,699017726837334016,WE GET IT YOU VAPE YOU UGLY RAT,katesmfn,2016-02-14 23:49:47+00:00
21,699017628879233024,❤️💨 Vape Vixen Sunday: Dawny D : vcp_dawnyd vcp_dawnyd :: Valentine's Day Hottie ::: Get your… https://t.co/jHEOCiqgPu,VaperUSA,2016-02-14 23:49:24+00:00
22,699017346216828928,Someone just outbid me with 2 seconds left,vape_peace,2016-02-14 23:48:17+00:00
23,699017119900442624,"This is Vaper Mike. Come check us out on https://t.co/1k9dsQAtiv and you will get great product, prices and service. https://t.co/hbZU4UuUNe",CloudsOfVapor,2016-02-14 23:47:23+00:00
24,699017097897242624,"I can vape and blow shit out of my nose look how cool I am, fuck off",kanewhelan2,2016-02-14 23:47:17+00:00
25,699017056960643072,awww he got me a vape 😂😍,_rayrayyyyy,2016-02-14 23:47:08+00:00
26,699016941793509376,If someone brought me some juice this week I'd love you forever. I haven't vaped in 2 weeks and im feining,IndyTrollsAlot,2016-02-14 23:46:40+00:00
27,699016738428579840,You never realized how bad your apartment has a draft until you try to vape😂😂😂,Roeboat94,2016-02-14 23:45:52+00:00
28,699016633583534084,🔴 LIVE on #YouNow - https://t.co/TfaMKeq1Uq,vape_rhys,2016-02-14 23:45:27+00:00
29,699016535164219393,Vaping is hard gay,thyartisconor,2016-02-14 23:45:03+00:00
30,699016337083871232,Who will support the vape constituency and stand up for big vape.,chewacow,2016-02-14 23:44:16+00:00
31,699016230397677568,My dad went out to get e-juice for his vape and he never came back.,mrdrewhuff,2016-02-14 23:43:51+00:00
32,699016197942198274,garth vaper,autoremiPK,2016-02-14 23:43:43+00:00
33,699016177167654912,You know my boyfriend knows me pretty well when he shows up with flowers and vape juice on Valentine's Day 😂,GabbyHolm,2016-02-14 23:43:38+00:00
34,699016015095721984,Just saw the hottest guy but then he was vaping so nahh😪,yourbratzbabe,2016-02-14 23:42:59+00:00
35,699015986729656320,"Enter to win a brand new Laisimo L1 https://t.co/FOshjVMpkq. Enter
 https://t.co/dwZYV3khwU #vape #vapelife #vapefamily #ecig #vapeon",GborHor,2016-02-14 23:42:52+00:00
36,699015975937638400,Have you entered our giveaway on twitter? Why not!? |  |        https://t.co/fYVgKPO1Wc #vape #ecig,ecigitesztek,2016-02-14 23:42:50+00:00
37,699015974020894724,Fresh build day :)        …  https://t.co/BZKy6oAFQC #vape #ecig,ecigitesztek,2016-02-14 23:42:49+00:00
38,699015972896837633,Now's your chance to save 16% on  &amp;  supplies when you try !     https://t.co/k0UR2ibkrr #vape #ecig,ecigitesztek,2016-02-14 23:42:49+00:00
39,699015951191244802,RT TheThriftyVaper: Have you entered our giveaway on twitter? Why not!? | https://t.co/BCQZ2Ws4NL  | #ejuice #eliquid #vape #vaping #vapefa…,vapemerch,2016-02-14 23:42:44+00:00
40,699015949823909888,RT 77WildFlower: Fresh build day :) #vape #vaping #vapingcommunity #vapestagram #tfv4mini #rba #smok #xcubemini… https://t.co/uFAH3z0h63;,vapemerch,2016-02-14 23:42:44+00:00
41,699015947701633024,RT adfabus: Now's your chance to save 16% on #ecigs &amp; #vaporizer supplies when you try v2! https://t.co/wnuVRUbgno; #vaping #ecig #vape,vapemerch,2016-02-14 23:42:43+00:00
42,699015788083032064,"#ecigaretes https://t.co/tEj8eRmwEG Make the switch to e-cigarettes -e-cig, vaping, vaper, vape #electroniccigarette or call 877-217-6701",PGSweeps,2016-02-14 23:42:05+00:00
43,699015773197623296,Bad Wolf open till 10pm Sundays so drop on by.#sanantonio #texas #vape  #vapelyfe  #vapesale https://t.co/kPY7BZgRw3,BadWolfVape,2016-02-14 23:42:02+00:00
44,699015741140549633,"If you haven't been to the vape lounge, go its blessed",just2nic3,2016-02-14 23:41:54+00:00
45,699015616552968192,Why were we vaping for fun earlier,ThePlaanetThief,2016-02-14 23:41:24+00:00
46,699015459694256128,People who vape are the most annoying pieces of shit on earth. 🙄🙄🙄🙄,griffjgriffith,2016-02-14 23:40:47+00:00
47,699015454703120384,A very cold Valentine's Vape Log: https://t.co/Ns4SsuX8PP via @YouTube,DailyRandomVlog,2016-02-14 23:40:46+00:00
48,699015370728931332,Last Chance for St. Valentines Day E-Cigarette Savings from PrimeVapor  #ecigarette  #eliquid  #vaping #ecig https://t.co/unt91sAmH5,PrimeVaporProds,2016-02-14 23:40:26+00:00
49,699015369361641477,Last Chance for St. Valentines Day E-Cigarette Savings from PrimeVapor  #ecigarette  #eliquid  #vaping #ecig https://t.co/VRVzcS8MWd,ecigtimesreview,2016-02-14 23:40:25+00:00
50,699015217452158976,We get it Ogden.. You vape .,Koreena_Darling,2016-02-14 23:39:49+00:00
51,699015129363419136,#4: Vape &amp; Mod Portable Travel Case Compatible with O Pen e-cig Vape G Pen eGo Atmos oil HERBAL wax Vaporizer ... https://t.co/S19CANNPEs,pzrius,2016-02-14 23:39:28+00:00
52,699015120752496640,#4: Vape &amp; Mod Portable Travel Case Compatible with O Pen e-cig Vape G Pen eGo Atmos oil HERBAL wax Vaporizer ... https://t.co/gsLQuGqLdm,cmrtsius,2016-02-14 23:39:26+00:00
53,699015111973933056,"""what side of the family is he on?""
""hold on let me hit my vape real quick""",hannnnnnahrose,2016-02-14 23:39:24+00:00
54,699014960966459393,Wanna take a second to wish everyone in our huge vape fam a happy V day love all of you an hope you are spending the day with special sum1!,TheCloudRipper,2016-02-14 23:38:48+00:00
55,699014926203899905,Have you entered our giveaway on twitter? Why not!? | https://t.co/OJYMjYctlM | #ejuice #eliquid #vape #vaping #vapefam #giveaway #ecig,TheThriftyVaper,2016-02-14 23:38:40+00:00
56,699014866300858369,#4: Vape &amp; Mod Portable Travel Case Compatible with O Pen e-cig Vape G Pen eGo Atmos oil HERBAL wax Vaporizer ... https://t.co/GVYa3HODnH,pzrius,2016-02-14 23:38:25+00:00
57,699014857824153600,#4: Vape &amp; Mod Portable Travel Case Compatible with O Pen e-cig Vape G Pen eGo Atmos oil HERBAL wax Vaporizer ... https://t.co/GXMUt7uCDD,cmrtsius,2016-02-14 23:38:23+00:00
58,699014843509018624,Win a DNA200 LavaBox Mod with 2 extra Grips from @VapingCheap - https://t.co/H5J2Yi54nq #ecig #Vape,dannialiy,2016-02-14 23:38:20+00:00
59,699014576814292992,if u vape minus cape then ur just wasting the opportunities life has given you,wahacakua,2016-02-14 23:37:16+00:00
60,699014452780335105,if u vape while wearing a cape u are automatically a 21st century superhero congrats,wahacakua,2016-02-14 23:36:47+00:00
61,699014442143584257,"What would Valentines Day be without #bukuvapor #bukuselect??? Exactly.
Go pick yours up at… https://t.co/ceG7fi3qxM",vape_it_up,2016-02-14 23:36:44+00:00
62,699014410711527428,Help me win a Thank Vape Box 133 mod from https://t.co/NPIjXvoCVs https://t.co/ElTESrYrCK,Bibers021,2016-02-14 23:36:37+00:00
63,699014156486340608,🔴 LIVE on #YouNow - https://t.co/HayVx4Nfdr,vape_rhys,2016-02-14 23:35:36+00:00
64,699014155039277056,"Nothing like vaping on the smurf gurt on a cloudy day. ""So good it coats your… https://t.co/MGWfRJHkIv",falker2008,2016-02-14 23:35:36+00:00
65,699014151092436992,why bother vaping when u can blow o's with your breath in the freezing -30 degree weather here in central ny,youneverhadrae,2016-02-14 23:35:35+00:00
66,699014062735302656,Tag a friend who would like this! #vape #vapelife #ecig #ejuice #mod https://t.co/uplTyQhold,CloudsVaping,2016-02-14 23:35:14+00:00
67,699014062059945984,I liked a @YouTube video from @derekkeefe1 https://t.co/YKFEF0fDoh Cthulhu Mods Hastur RDTA (Crius Killer?) | Kendo Vape Cotton Gold,AmbitionZVapeR,2016-02-14 23:35:14+00:00
68,699014058029223936,#vaping after #yoga. Busting out the #vapeOs . #vapetricks #vapeporn #Vapelife #vape #stitches https://t.co/nicMNWnR3D,TheMaddChefie,2016-02-14 23:35:13+00:00
69,699014012244103168,Raspberry Sherbet Vape Juice,everyVapeJuice,2016-02-14 23:35:02+00:00
70,699013888734535680,40% Off Juice thru 2/15 @GothicVapor code = LOVESTINKS #vape #ejuice,RockyTopABlaze1,2016-02-14 23:34:32+00:00
71,699013824129556480,Dear weird person in parking lot...vaping in negative degree weather doesnt make vaping cool...not even a little bit,AdelBrkic,2016-02-14 23:34:17+00:00
72,699013657485819904,My brand new Kangertech subbox mini &lt;3 #vaping https://t.co/Sv6lzI6AyD,TyneTheZombie,2016-02-14 23:33:37+00:00
73,699013641094483968,Special offer from Giant Vapes: 10% Off your 1st purchase - https://t.co/XMXATO5IYt,Vaperman1951,2016-02-14 23:33:33+00:00
74,699013556247748608,Enter to win some amazing Coil Master #vape kit from @coilmasteruk and @v_a_p_e. #coilmaster #Giveaway #VapeLife https://t.co/vR9tR579oh,vaporfee,2016-02-14 23:33:13+00:00
75,699013397552230400,support white boys who vape,nyohos,2016-02-14 23:32:35+00:00
76,699013371564175364,#4: Vape &amp; Mod Portable Travel Case Compatible with O Pen e-cig Vape G Pen eGo Atmos oil HERBAL wax Vaporizer ... https://t.co/XcaGGXj3CX,dorduncua,2016-02-14 23:32:29+00:00
77,699013362693197826,#4: Vape &amp; Mod Portable Travel Case Compatible with O Pen e-cig Vape G Pen eGo Atmos oil HERBAL wax Vaporizer ... https://t.co/95LhLRNA5w,ucuncua,2016-02-14 23:32:27+00:00
78,699013361309188096,15% Off Juice on 2/15 @EVCigarettes code = GEORGE15 #vape #ejuice,RockyTopABlaze1,2016-02-14 23:32:27+00:00
79,699013345785974784,#4: Vape &amp; Mod Portable Travel Case Compatible with O Pen e-cig Vape G Pen eGo Atmos oil HERBAL wax Vaporizer ... https://t.co/0AVHcOKScs,birinciaa,2016-02-14 23:32:23+00:00
80,699013262755700737,"Where Was All the Vape Talk at the Debate, Demands Right-Wing Vaping Champion - https://t.co/azv4ETibdB",CjEggett,2016-02-14 23:32:03+00:00
81,699013199690141696,"Should I hit the bowl, vape or roll? (There is more, this is just a nugget for the photo lol)… https://t.co/lth05CMScO",highowlsapparel,2016-02-14 23:31:48+00:00
82,699013060623601666,Happy vape day,ayy_cody_lmao,2016-02-14 23:31:15+00:00
83,699012962552586244,Few more Vapes before bed https://t.co/Rll7v0l0dU,plugmartin19,2016-02-14 23:30:51+00:00
84,699012942642057216,"Enter to #win a pair of ""Heartbeat"" #PAX2 vapes from @DigitalTrends and @PAXVapor! #IHeartPax #giveaway https://t.co/FTkdw6vzVC",AlYoshimoto,2016-02-14 23:30:47+00:00
85,699012823699951617,"Happy Birthday Matt ""Vape God"" Pitto. Keeping vaping. I am still Alma's favorite student. @MattPitto",JWolger,2016-02-14 23:30:18+00:00
86,699012771158036480,Where do European countries stand on vaping products? @patriciakova has the answer! @VapeMZ  https://t.co/ZrSwucz4TY https://t.co/4nCdJWVCwH,HaloCigs,2016-02-14 23:30:06+00:00
87,699012742322253824,25% Off Juice thru 2/15 @Alchemyst code = VAPESHARE #vape #ejuice,RockyTopABlaze1,2016-02-14 23:29:59+00:00
88,699012620569939968,Hey Enovap thanks for the follow! We want to be your #1 choice for DIY Vaping Supplies! Feel free to check out our site to see how we can b…,RTSvapes,2016-02-14 23:29:30+00:00
89,699012602744078337,"Enter to #win a pair of ""Heartbeat"" #PAX2 vapes from @DigitalTrends and @PAXVapor! #IHeartPax #giveaway https://t.co/mOsnqdAsAs",fourspire,2016-02-14 23:29:26+00:00
90,699012597173997569,Why have vape culture when you could have https://t.co/n692Hz8FU9,SSBPorygon,2016-02-14 23:29:24+00:00
91,699012503376916480,Remember how I told you #vaping sounds too good to be true? I was right! https://t.co/MIP0HqKQpB,Grown_UpWoman,2016-02-14 23:29:02+00:00
92,699012476361445377,Can anyone tell me how to get a vape coil to work after it burns out? Is it possible to open it and replace the cotton??,tizzlemaine14,2016-02-14 23:28:56+00:00
93,699012310648500224,"#Vapers what are you doing to protect your health and to save @ABillionLives? Do Nothing, Expect Nothing. https://t.co/p0OIU1HhDK",smileyeliquid,2016-02-14 23:28:16+00:00
94,699012222186582016,LIVE on : Bubble bath        https://t.co/nuEJuW0rxx #vape #ecig,ecigitesztek,2016-02-14 23:27:55+00:00
95,699012220873785345,This how you coils supose perform glows from the inside and out. !!  https://t.co/pW3pUL7qKo #vape #ecig,ecigitesztek,2016-02-14 23:27:55+00:00
96,699012219317649408,Dick Puddlecote: Sunday Psychopaths       https://t.co/PKwrCbG0uB #vape #ecig,ecigitesztek,2016-02-14 23:27:54+00:00
97,699012218319462400,Win a DNA200 LavaBox Mod with 2 extra Grips from -    https://t.co/UPaRs3xtHQ #vape #ecig,ecigitesztek,2016-02-14 23:27:54+00:00
98,699012148551405569,RT Strawb3rryLady: LIVE on #Periscope: Bubble bath #bath #bubble #bubbles #vape #ginger #bathtub https://t.co/nmSlKUS7eW,vapemerch,2016-02-14 23:27:37+00:00
99,699012147108573185,RT JahDextah: This how you coils supose perform glows from the inside and out. #vape!! https://t.co/pnFni1kfg9;,vapemerch,2016-02-14 23:27:37+00:00
100,699012143652474880,RT ecigitesztek: Win a DNA200 LavaBox Mod with 2 extra Grips from - https://t.co/xo7BgBsYEv … #vape #ecig,vapemerch,2016-02-14 23:27:36+00:00
101,699012138673774592,RT UtinamOG: Hey Fam! I'm on my way to winning WET CRATE's For the Love of #Vape #Ejuice Giveaway! https://t.co/g7uh1XeyF9 #WetCrate,vapemerch,2016-02-14 23:27:35+00:00
102,699012132260749313,Fresh build day :) #vape #vaping #vapingcommunity #vapestagram #tfv4mini #rba #smok #xcubemini… https://t.co/QG0Twuye4E,77WildFlower,2016-02-14 23:27:34+00:00
103,699012064417816576,"Happy Valentine's Day Vapers, are you looking to fall in love with an #ejuice ...look no further https://t.co/5dMNqkbuoO",OrionsVapor,2016-02-14 23:27:17+00:00
104,699012016078352384,sick vape https://t.co/AnLiCDHP70,DuderMcBrohan,2016-02-14 23:27:06+00:00
105,699012012446244864,Check out my sweet vape trick! #vapetrick #notblowingohs https://t.co/PsafRA8KXI,avapersquest,2016-02-14 23:27:05+00:00
106,699011956888305664,People who want to ban vaping confuse me. We told smoking for health reasons and now the smokers have a way to kick the habit 1/2,GrittyCitySndr,2016-02-14 23:26:52+00:00
107,699011887271251968,"*owen on the chairlift*

Some guy vaping: bro you wanna hit

Owen: sorry, I'm not gay",RemingtonCurren,2016-02-14 23:26:35+00:00
108,699011883488186368,Have u heard of #eCigs or #vaporizers? Try #V2 https://t.co/yyFfLGP2gk #coupons #ecigarettes #VAPOR #SMOKE #vapelife #eLiquids #RT #Vaping,VaporElectrico,2016-02-14 23:26:34+00:00
109,699011848444706816,This chill Congressman vaped by legislating https://t.co/iHF0KgWQvC via @NowThisNews https://t.co/yt79PMAadD,Dailymotion,2016-02-14 23:26:26+00:00
110,699011744895619072,"Vaping may threaten brain, immunity and more: WASHINGTON, D.C. — Today, more U.S. teens vape than smoke. Many ... https://t.co/0XyyRqy1Qc",ayskj_store,2016-02-14 23:26:01+00:00
111,699011197283254272,Feel the love all week from @HooliganVapes . #vape #vapefam #Ejuice #sale https://t.co/4KxgnXzM12,HooliCord,2016-02-14 23:23:51+00:00
112,699011150625820672,https://t.co/5tKefdZY0n #MGWV #F4F #RT Repost: @missy_vapes Just got hooked up by @myt… https://t.co/0YN4fVZz9S https://t.co/Di8wJoU4lv,ToutPourVapoter,2016-02-14 23:23:39+00:00
113,699011143554232326,https://t.co/5tKefdZY0n #MGWV #F4F #RT Repost: @the_vape_lounge Getting in a little sh… https://t.co/ANBlAjqxDL https://t.co/S0MbZ1koU4,ToutPourVapoter,2016-02-14 23:23:38+00:00
114,699011142627135489,There's a guy vaping in winco lol,aloeruhh,2016-02-14 23:23:38+00:00
115,699011107827146752,I can't take people who Vape seriously oh my god 😂😭,Harrison_Grimm,2016-02-14 23:23:29+00:00
116,699011094761701376,Morning vape. 👄💨,RAYchuu18,2016-02-14 23:23:26+00:00
117,699011061672837120,#4: Vape &amp; Mod Portable Travel Case Compatible with O Pen e-cig Vape G Pen eGo Atmos oil HERBAL wax Vaporizer ... https://t.co/EEHXLi3Abb,birinciaa,2016-02-14 23:23:18+00:00
118,699011039984275462,lol when vapes life  https://t.co/n9OyMeo8AU,lyss22__,2016-02-14 23:23:13+00:00
119,699011034720268288,#4: Vape &amp; Mod Portable Travel Case Compatible with O Pen e-cig Vape G Pen eGo Atmos oil HERBAL wax Vaporizer ... https://t.co/JWTZAbqKFB,ClickbankValley,2016-02-14 23:23:12+00:00
120,699011025975115776,#4: Vape &amp; Mod Portable Travel Case Compatible with O Pen e-cig Vape G Pen eGo Atmos oil HERBAL wax Vaporizer ... https://t.co/5OyMzvT3hK,birinciaa,2016-02-14 23:23:10+00:00
121,699010999165169664,#4: Vape &amp; Mod Portable Travel Case Compatible with O Pen e-cig Vape G Pen eGo Atmos oil HERBAL wax Vaporizer ... https://t.co/7pTiH2cInp,ClickbankValley,2016-02-14 23:23:03+00:00
122,699010983323430914,#Vape life #Clouds. #ipv3 https://t.co/W6zGVFItON,MrRottenTreats6,2016-02-14 23:23:00+00:00
123,699010900083216384,Best place to buy replacement screws? https://t.co/nDHgEfqylV #vape #ecigs #reddit,ukvaper,2016-02-14 23:22:40+00:00
124,699010898296307712,Moving! https://t.co/0alHj8T2Rc #vape #ecigs #reddit,ukvaper,2016-02-14 23:22:39+00:00
125,699010817149247488,For the love of vaping and recycling. #vapecycle #vapelife https://t.co/NcarwXw5tt,VapeCycle,2016-02-14 23:22:20+00:00
126,699010656343871489,Just found out about @Vape_Meet which is just down the road from me.  I cant wait to go try some new juice!!,MosportMike,2016-02-14 23:21:42+00:00
127,699010538785935360,"This is why i don't worry about the minute health risk of #vaping, i face far greater risks at work #Ecigs 
https://t.co/nlTDNry69L",plopnl,2016-02-14 23:21:14+00:00
128,699010385035313152,"Wow, I love @Listia! I just won this for free, Vape sticker https://t.co/H7Ro8c11xS",happyserver74,2016-02-14 23:20:37+00:00
129,699010340152020996,Last Chance for St. Valentines Day E-Cigarette Savings from PrimeVapor  #ecigarette  #eliquid  #vaping #ecig https://t.co/PS9AEMSFG7,ecigtimesreview,2016-02-14 23:20:26+00:00
130,699010339178946560,Last Chance for St. Valentines Day E-Cigarette Savings from PrimeVapor  #ecigarette  #eliquid  #vaping #ecig https://t.co/sUqoLkxhhx,PrimeVaporProds,2016-02-14 23:20:26+00:00
131,699009915516493824,I only like second hand vape smoke,YungCott,2016-02-14 23:18:45+00:00
132,699009904279953408,Saw my girl at a random vape store in Hollison MA @ItsMsBernadette 😍😍😍 https://t.co/afnLcXMKUm,KevinPineau3,2016-02-14 23:18:42+00:00
133,699009881785774080,I've entered the 70 W UD Balrog kit giveaway from @ecigreviewed - enter here!  https://t.co/eCAGQ3ye1D #vaping #giveaway #vape,snowsparks40,2016-02-14 23:18:37+00:00
134,699009822725955584,pat put fake rose petals all over my room and gave me a bear and cheesecake flavoured vape juice and a shirt I've been eyeing :'),astromomical,2016-02-14 23:18:23+00:00
135,699009708632510464,Vape hard or go home loudpacklaura @sammibeers #vape #babes #tiltwo #metal #sandiego https://t.co/e8IRlO7rf5,og_brittneyc,2016-02-14 23:17:56+00:00
136,699009647341084672,Weird seeing someone openly smoke indoors though - wonder if he vapes now? #RickysXFilesBinge,rickylovestv,2016-02-14 23:17:41+00:00
137,699009300467990528,"Wow, I love @Listia! I just won this for free, Vape sticker https://t.co/OUScA0yfDU",happyserver74,2016-02-14 23:16:18+00:00
138,699009256037728256,@GuerillaStraps great work! 📷 @just.vape https://t.co/pxGU4Wc3MH #sneaker #fashion #minimalspieltrieb #lifestyle #… https://t.co/Cg6ONU8uqe,minimalspielt,2016-02-14 23:16:08+00:00
139,699009028081459201,Congressman Opposes Ban on Vaping in the Air https://t.co/MyawjEzY4u #Travel https://t.co/M7SohrpB90,TravelPulse,2016-02-14 23:15:13+00:00
140,699008920564551680,#4: Vape &amp; Mod Portable Travel Case Compatible with O Pen e-cig Vape G Pen eGo Atmos oil HERBAL wax Vaporizer ... https://t.co/O8JJrd8mnm,mynisania,2016-02-14 23:14:48+00:00
141,699008911693602816,#4: Vape &amp; Mod Portable Travel Case Compatible with O Pen e-cig Vape G Pen eGo Atmos oil HERBAL wax Vaporizer ... https://t.co/2MK0FiX2qV,mymartia,2016-02-14 23:14:46+00:00
142,699008828688330752,WATCH: California Representative vapes while debating vaping bill  https://t.co/OavV31WlKh,GunnGinger,2016-02-14 23:14:26+00:00
143,699008755359350784,Introducing Cute &amp; Buff😍 Milk and Nutty Honey👌🏼Perfect for your Valentines Vaping Sweetheart… https://t.co/q7LFz0tClU,hollywoodvapelb,2016-02-14 23:14:08+00:00
144,699008546151641088,E-cigs shut down hundreds of immune-system genes. https://t.co/tMq5gDFAB4 People who vape may have weakened defenses against infections.,aem76us,2016-02-14 23:13:19+00:00
145,699008464975220736,Oxford is a happy !         https://t.co/TXBfGouBoZ #vape #ecig,ecigitesztek,2016-02-14 23:12:59+00:00
146,699008463549132800,February giveaway for a ENCOM Voidray and you can be too    https://t.co/NpdJpruXvO #vape #ecig,ecigitesztek,2016-02-14 23:12:59+00:00
147,699008462450204674,Don't miss The Vapor Spot Pick Six Giveaway!  &amp;    https://t.co/42qXyACaRw #vape #ecig,ecigitesztek,2016-02-14 23:12:59+00:00
148,699008458209808385,Take our Rip Tripper Poll       https://t.co/BDDxYpNaaF #vape #ecig,ecigitesztek,2016-02-14 23:12:58+00:00
149,699008456464924673,Does anyone else get dry skin on their face from #vaping ???,Milts82,2016-02-14 23:12:57+00:00
150,699008441617158145,Medical Professionals Support Vaping And Electronic Cigarettes       https://t.co/txQdEIOV9I #ecig,ecigitesztek,2016-02-14 23:12:54+00:00
151,699008399191752705,RT GloryWalkin: February giveaway for a ENCOM Voidray and you can be too https://t.co/cUi0vCxELk #VAPE #DVNT,vapemerch,2016-02-14 23:12:43+00:00
152,699008394724843520,RT chad_strategic: #vape #vapelife https://t.co/qQdxNZblwV …,vapemerch,2016-02-14 23:12:42+00:00
153,699008393416175616,RT VaporFace: Take our Rip Tripper Poll#vape #vapor #vaper #vaping #vapecommunity #vapenews #vapelifehttp://ift.tt/1Vf3B8y,vapemerch,2016-02-14 23:12:42+00:00
154,699008279419072513,One time I lost my vape in a cheese it box... for 3 weeks,connors_stuff,2016-02-14 23:12:15+00:00
155,699008256556011521,cabbabe we vape,owldork,2016-02-14 23:12:09+00:00
156,699008120069218305,Currently watching the vape episode of full house,FORTLEAN,2016-02-14 23:11:37+00:00
157,699008058773655552,You can do the sickest vape tricks in 5 degrees!! #itscalledbreathing,Rozball,2016-02-14 23:11:22+00:00
158,699008004549701633,Happy Valentines Day! #vapetricks #oc #vape #714vapers #vapelife #vapecommunity #ecig #ejuice… https://t.co/WbpHuJPZrn,vape_to_u,2016-02-14 23:11:09+00:00
159,699007943253979136,"""I don't care about their fucking vapes, okay? It's gay as shit."" 😂😂",blueeye3334,2016-02-14 23:10:55+00:00
160,699007913143078913,I want to win some delicious #ejuice from @thethriftyvaper -  #ecig #vape #vapefam #vaping #vapejuice #vapecommunity https://t.co/twX9pjpITi,Jediriccan,2016-02-14 23:10:48+00:00
161,699007875654352896,Hey @DougFresh84 let's grab a beer and a #Vape soon,TheRealVapeDad,2016-02-14 23:10:39+00:00
162,699007821514321920,Win a DNA200 LavaBox Mod with 2 extra Grips from @VapingCheap - https://t.co/T0a6uAlDoT #ecig #Vape,Jediriccan,2016-02-14 23:10:26+00:00
163,699007774856974337,Our Ritual vape juices are sure to take your taste buds for a wild ride! Check them all out here: https://t.co/VVln3wdGuE,GFVaporShop,2016-02-14 23:10:15+00:00
