,TweetID,TweetContent,TweeterUsername,TweetDatetime
2596,698753264737722368,"had a 5ml of ""Killer Baby"" by Planète Vape in Quebec. Fucking Amazing Fruity Loops vape. thanks to #LOI44 I can't ever have it again :(",fakehater,2016-02-14 06:18:55+00:00
2597,698752574627786752,Jasmine milk tea vape juice,deliciousslizzy,2016-02-14 06:16:10+00:00
2598,698752476334391296,California Congressman About That Vape Life Vapes During Congressional Hearing https://t.co/wd0ZdfpfD2 via @ComplexMagLife,QUEENGODDESS49,2016-02-14 06:15:47+00:00
2599,698752465068404736,Couples that vape together stay together,HeratyBrooke,2016-02-14 06:15:44+00:00
2600,698752391777271808,"Spring 2016 Vaping Carnival Worth $10,500: Wish &amp; Win!    https://t.co/RGjEOn3wx5",elitegunslinger,2016-02-14 06:15:27+00:00
2601,698752197987844096,"#Repost drakomilitia with repostapp.

Absolute Art 

・・・
#DrakoModz #drakomilitia #vape… https://t.co/vTDuHJtMzE",Despite_Mexico,2016-02-14 06:14:40+00:00
2602,698752036419067905,You vape bro?😂,mweavvvy,2016-02-14 06:14:02+00:00
2603,698751908547268609,https://t.co/YXwD32Jnlu &amp; https://t.co/cOaPFxUsEm February giveaway for a ENCOM Voidray  https://t.co/nqmuasnnoh #VAPE #DVNT,jsummers71,2016-02-14 06:13:31+00:00
2604,698751877849067520,Win a DNA200 LavaBox Mod with 2 extra Grips from @VapingCheap - https://t.co/IjcM4XPZ3R #ecig #Vape,zubifunk,2016-02-14 06:13:24+00:00
2605,698751850636537856,"Happy Valentine's Day Fam!
-- #repost @_kels_brooke_vapes --
Good morningggg! 😊

#vape #va… https://t.co/D1YDX0oqiA https://t.co/yIJ5elLUwK",WeirdVapes,2016-02-14 06:13:18+00:00
2606,698751661141942272,Enter to win some amazing Coil Master #vape kit from @coilmasteruk and @v_a_p_e. #coilmaster #Giveaway #VapeLife https://t.co/yy8cGRO5og,jsummers71,2016-02-14 06:12:32+00:00
2607,698751561695150080,Ready for bed. Vape in one hand bottle of water in the other. https://t.co/Ra5KjcwyrM,RooGirl78,2016-02-14 06:12:09+00:00
2608,698751516996411392,early mornin g vape,kingtiger666,2016-02-14 06:11:58+00:00
2609,698751446469050369,Pregnant Women Who Smoke Electronic Cigarettes May Risk Damage To Fetal Development - Medical Daily https://t.co/gqhhH0qJnR #ecigs #vaping,VapinXsmoker,2016-02-14 06:11:41+00:00
2610,698751430597943296,"Luke said I can go visit Guam if I bring vape juice... That's it? Okay here I come paradise, seeya North Pole",iGoByLaura,2016-02-14 06:11:37+00:00
2611,698751346149732352,The 24 Hour Stream Is Here. Counter Strike Time #Vape #PrettyROBellion: https://t.co/PGXSKp2DAq,ProtoSwagginz,2016-02-14 06:11:17+00:00
2612,698751314533027840,vaping is life,_pr1mo,2016-02-14 06:11:10+00:00
2613,698750892430888960,Win a DNA200 LavaBox Mod with 2 extra Grips from @VapingCheap - https://t.co/NRqQHj1Ee5 #ecig #Vape,jsummers71,2016-02-14 06:09:29+00:00
2614,698750801267728384,vape song im doing a remix  of the song crazy train by ozzy osbourne one of my favorite songs by my idol,communityVapers,2016-02-14 06:09:07+00:00
2615,698750746733338624,Vape On sa Cr. 😂💨,rpdelmundo,2016-02-14 06:08:54+00:00
2616,698750497084145664,"Just when the election can’t get bizarro-ier, Norquist pins his hopes on the “Republican vape fan” demographic.

 https://t.co/uHktEDJoEb",hidvorak,2016-02-14 06:07:55+00:00
2617,698750228795650048,Hey JakeTheMisfit thanks for the follow! We want to be your #1 choice for DIY Vaping Supplies! Feel free to check out our site to see how w…,RTSvapes,2016-02-14 06:06:51+00:00
2618,698750180993044481,Looking for vape 😭,MclouieLugue,2016-02-14 06:06:39+00:00
2619,698749920031940608,Nick and Oliwia came to my house to charge their vape and watch Scooby doo I love friends,RachaelJayMarie,2016-02-14 06:05:37+00:00
2620,698749798610919424,Chain Vape.,okey_dustin,2016-02-14 06:05:08+00:00
2621,698749672555356160,Middle aged adults vape and if that's not upsetting I don't know what is,soniccnurse,2016-02-14 06:04:38+00:00
2622,698749670504312833,"I think @GroverNorquist has been vaping a little too much something, if you get my drift  https://t.co/KZ8mOUDMXK",may_or_maynot,2016-02-14 06:04:38+00:00
2623,698749550304043008,Really Great  deals Thanks   https://t.co/BCjTH18R9D #vape #ecig,ecigitesztek,2016-02-14 06:04:09+00:00
2624,698749368611008512,ct_vape_guy thanks for the #vapelove #vapelife #vapefam #vapehard #girlswhovape #vapstergram… https://t.co/HVZfgDjxPW,RooGirl78,2016-02-14 06:03:26+00:00
2625,698749364731129856,I want to win some delicious #ejuice from @thethriftyvaper -  #ecig #vape #vapefam #vaping #vapejuice #vapecommunity https://t.co/M5jwxT7omW,rihga_111,2016-02-14 06:03:25+00:00
2626,698749335647838208,Retweet&amp;Enter to win some delicious E-Juice! https://t.co/M5jwxT7omW #vaper #giveaway,rihga_111,2016-02-14 06:03:18+00:00
2627,698749210070532096,"""'vaping' more like 'marijuana-ing'""",alaiina_v,2016-02-14 06:02:48+00:00
2628,698749035528716290,Vaping again.... https://t.co/7usYwvqXiz,jimchap,2016-02-14 06:02:06+00:00
2629,698748517372788736,Really Great #vape deals Thanks @vapediscounts #vape,sovapeone,2016-02-14 06:00:03+00:00
2630,698748253991469056,"vaping allowed. 😁 — I'm at E's 24-Hour Cafe in Memphis, TN https://t.co/n1wvSudVwi https://t.co/lNCfsxys0f",memphisguy,2016-02-14 05:59:00+00:00
2631,698747943482957824,Enter to win some delicious E-Juice! https://t.co/zoIqHWkZyn  #vape #giveaway,GabbyVapes,2016-02-14 05:57:46+00:00
2632,698747830144540672,Don't rape just vape,AJbaseballog8,2016-02-14 05:57:19+00:00
2633,698747732312379392,Come to our store for our Valentine's Day sale!! #bemine #valentine #vape #sale #vapeporn #artisanvaporkeller https://t.co/bvgAC7yWVM,ArtisanKeller,2016-02-14 05:56:56+00:00
2634,698747709201768448,Help me win a 70 W UD Balrog TC Kit - enter here! https://t.co/Fcg1nraXOF https://t.co/BKYRKO1mt2  #vape #giveaway,GabbyVapes,2016-02-14 05:56:50+00:00
2635,698747525487009792,"Spring 2016 Vaping Carnival Worth $10,500: Wish &amp; Win! https://t.co/2PHnw8FxCp  #vape #giveaway",GabbyVapes,2016-02-14 05:56:06+00:00
2636,698747480054353921,All those guys just got washed #funrun2 #VAPEBEN #DABWIZARD #Southwest1 https://t.co/a8QtFjNqlk,Vape_Luke,2016-02-14 05:55:56+00:00
2637,698747378887561216,Looking for some good berry e-juice. https://t.co/kgNdukD697 #vape #ecigs #reddit,ukvaper,2016-02-14 05:55:31+00:00
2638,698747336881803264,When no one hits you up AND your vape batteries are charging😭😭😭😭😭😭😭😭,jacked_charlie,2016-02-14 05:55:21+00:00
2639,698747309002244096,Love this @kangerusa #kbox #vape #vaper #vapes #vapeon #vapers #vapecommunity #vapelife… https://t.co/hHzHF67Gvl,angelrub_i,2016-02-14 05:55:15+00:00
2640,698747183823265792,Vape can not penetrate water FACT,TheDeonator,2016-02-14 05:54:45+00:00
2641,698747132342378496,AVE40 Spring Festival Giveaway Round One https://t.co/Zylh34lOfb  #vape #giveaway,GabbyVapes,2016-02-14 05:54:33+00:00
2642,698746912342552577,People compete in vape battles? 😂,johnnyxswank,2016-02-14 05:53:40+00:00
2643,698746692871548929,Please help me win this new Encom Voidray mod from the https://t.co/M0SVE8awAn February giveaway! https://t.co/L9SQuCuhNu #vape #giveaway,GabbyVapes,2016-02-14 05:52:48+00:00
2644,698746514185809921,"Help me win over $1,000 worth of Vape gear from Vapor Leaf at: https://t.co/PJD5dDIh2U https://t.co/SgXmfHQSwU  #vape #giveaway",GabbyVapes,2016-02-14 05:52:05+00:00
2645,698746455721385984,I wanna vape 💨,xPRADOx,2016-02-14 05:51:51+00:00
2646,698746292453793792,Help me win this awesome competition from @Gleamapp https://t.co/rNAaFWDVvE  #vape #giveaway,GabbyVapes,2016-02-14 05:51:12+00:00
2647,698746242063413249,ferrets vape,MONKEY_TEMPLE,2016-02-14 05:51:00+00:00
2648,698746210950254592,I added a video to a @YouTube playlist https://t.co/gEmDETcxOJ February Vape Mail Review,MAD_sMoKe,2016-02-14 05:50:53+00:00
2649,698746167627087872,Win a DNA200 LavaBox Mod with 2 extra Grips from @VapingCheap - https://t.co/UGU2AlkaKd #ecig #Vape,guerreroabbie,2016-02-14 05:50:43+00:00
2650,698746118558130176,Help me win this awesome giveaway from ZampleBox! https://t.co/EP1UbSydt5   #vape #giveaway,GabbyVapes,2016-02-14 05:50:31+00:00
2651,698746026891415552,♥ FREE ⤵DWNLD⤵ 4-U ♥ Pass iT oN ! ! ! ♥ https://t.co/E80y4bhddP  #stoner #cannabis #vape #blunt #weed #puff #hemp #cbd #thc #cannabis #weed,QuantiFreqMusic,2016-02-14 05:50:09+00:00
2652,698745908003995648,PROBABLY VAPES,lzuminokami,2016-02-14 05:49:41+00:00
2653,698745873245667328,TOM HARDY VAPES 😭😭😭😭,sylviathefirst,2016-02-14 05:49:32+00:00
2654,698745772594991105,Win a bottle of Specimen E-Juice from @CigBuyer &amp; @DFWvapor: https://t.co/TRktiwP0ju #ecigs #vaping #eliquid #ejuice #vapegiveaway,GabbyVapes,2016-02-14 05:49:08+00:00
2655,698745716554989568,Help me win some amazing Coil Master #vape kit from @coilmasteruk and @v_a_p_e. https://t.co/SlWNRJb4tf,PineapplepunkFB,2016-02-14 05:48:55+00:00
2656,698745696451743744,Rep. Duncan Hunter Vapes During Congressional Hearing https://t.co/OiZrxmTZZ0,Ruthie19,2016-02-14 05:48:50+00:00
2657,698745653590147072,And a new lobby is born? Grover is into vaping? https://t.co/IAewIVVT6a,jimchap,2016-02-14 05:48:40+00:00
2658,698745561562943488,Deeply love folks who think that _vaping_ is the swing issue of the election.,mfstrong,2016-02-14 05:48:18+00:00
2659,698745313134317568,Enter to win some amazing Coil Master #vape kit from @coilmasteruk and @v_a_p_e. #coilmaster #Giveaway #VapeLife https://t.co/PW6qWLFT3L,PineapplepunkFB,2016-02-14 05:47:19+00:00
2660,698745199732899840,"rt: @vapescorp • rt: @VapePositive 💨 Liquide https://t.co/IuM0UUXoRZ #vape, #vapecommunity, #vapefam, #vapepositive, #freshjivejuice …",PostAdviser,2016-02-14 05:46:52+00:00
2661,698745154006446082,"【定期】KAMIKAZE E-JUICE Facebook Page
https://t.co/EHnIVhZTPq #VAPE,#KAMIKAZE",JuiceKamikaze,2016-02-14 05:46:41+00:00
2662,698745095621742592,if you vape gtfo,kindacait,2016-02-14 05:46:27+00:00
2663,698744905791713280,Do people still vape??? Lol,sacredcactus_,2016-02-14 05:45:42+00:00
2664,698744558092288000,We get it bro you vape https://t.co/o2dyOrvKQ9,PatrickRedman4,2016-02-14 05:44:19+00:00
2665,698744417516015616,Hey Fam! I'm on my way to winning WET CRATE's For the Love of #Vape #Ejuice Giveaway! https://t.co/x8BPOP6ynf #WetCrate,jmoney227,2016-02-14 05:43:45+00:00
2666,698744243783729152,Small enough to vape in a bathtub as IS MY GOD GIVEN RIGHT https://t.co/rOUXq5zeV3,ClaraJeffery,2016-02-14 05:43:04+00:00
2667,698744038749564928,Selling vape let me know if you want it!,Beidleman_2,2016-02-14 05:42:15+00:00
2668,698743957254111232,Well. . . Here's my valentine. . . 😘💨🌪#vape #vaper #vapelife #vapershouts #vapestagram #vapor… https://t.co/qQnar77Q75,nibrad_02,2016-02-14 05:41:56+00:00
2669,698743955622596609,"""I smoked too much vape I think I'm high"" -coral",rayerco26,2016-02-14 05:41:55+00:00
2670,698743773749252096,"#redhook my beer, my vape and Saturday #bryansworld https://t.co/KxHPRvk4Ca",b_ellicott,2016-02-14 05:41:12+00:00
2671,698743730849914880,grover norquist: noted conservative and vaping enthusiast,ttl_anderson,2016-02-14 05:41:02+00:00
2672,698743567217401856,"*#GroverNorquist in a cloud of vape smoke* 
My goal is to cut government down to the size 
*wheeze*
...where we can drown it in the bathtub.",tellahtruth,2016-02-14 05:40:23+00:00
2673,698743495993856001,"Smoking my vape, and can't wait to go to bed, I'm sleepy",lezygal,2016-02-14 05:40:06+00:00
2674,698743488356155392,"Vaping is to smoking as Soylent is to eating.

That'll be an SAT question folks.  https://t.co/XcvB6SZhmK",tmclaughbos,2016-02-14 05:40:04+00:00
2675,698743456907264000,"the belmont clan, sworn to defeat all of moducla's dark vape children",kuebikodaughter,2016-02-14 05:39:56+00:00
2676,698743421666729984,"*hits vape*
""I gotta fat heady"" @samdelaney1999",brycehebert20,2016-02-14 05:39:48+00:00
2677,698743374359228416,I just wanna sleep with my bf rn but he'd rather do vape tricks to dub step music..what the fuck,queenbjordyn,2016-02-14 05:39:37+00:00
2678,698743072658714624,"""By God, you must not value your vape ABOVE this play (Hamlet)"" I love these freshmen",idorachelkiefer,2016-02-14 05:38:25+00:00
2679,698742781129392129,"I added a video to a @YouTube playlist https://t.co/VNJTuIsFpP ""Dope"" Baltimoron Vape Juice | 2 flavors ~ Dope &amp; Boss | E Juice Review",D8oy,2016-02-14 05:37:15+00:00
2680,698742661600051200,Need to get a tank for it. I'm new to the vape life bruh need help #BecomingABrad,F_N_Genius,2016-02-14 05:36:47+00:00
2681,698742566993289216,"Trolling #vaping with @GreatDismal, reality is the weirdest fucking thing ever",LusciousPear,2016-02-14 05:36:24+00:00
2682,698742465768071168,america's war on Vaping,kuebikodaughter,2016-02-14 05:36:00+00:00
2683,698742443030798337,VAPE LIFE: Grover Norquist. https://t.co/1te3ALIkjF,jimheps,2016-02-14 05:35:55+00:00
2684,698742406619987968,"We get it, Mr. Norquist, you *vape.* https://t.co/1NXX3Ae5ff",Quinnae_Moon,2016-02-14 05:35:46+00:00
2685,698742356695236609,"Norquist, we get it, you vape. https://t.co/EHsAOUlVh4",gameism,2016-02-14 05:35:34+00:00
2686,698742331063709696,I forgot that I have a vape,F_N_Genius,2016-02-14 05:35:28+00:00
2687,698742246817075200,"mom got me this I don't even have a record player (but my sister in law does, so that's cool) @twentyonepilots https://t.co/LHC2loWkpp",vaped_crusader,2016-02-14 05:35:08+00:00
2688,698742222955479040,When boyz vape 😩😩✊🏽💦,itsizzymartin,2016-02-14 05:35:02+00:00
2689,698742222678728704,Radishes Vape Juice,everyVapeJuice,2016-02-14 05:35:02+00:00
2690,698742220166303744,I drove next to this truck with two guys and the driver was eating a banana while the guy in the passenger seat was vaping 😂😂,harianascinema,2016-02-14 05:35:01+00:00
2691,698742079153840128,Moscow Vape Expo Encompasses 2015 Events Circuit https://t.co/UUq0GoyVQN https://t.co/A5PXtTiVR3,janetfoxvblog,2016-02-14 05:34:28+00:00
2692,698742018772602881,Teens with moderate mental health problems vape e-cigarettes https://t.co/R2UOFVXrFh,BBlogger0123,2016-02-14 05:34:13+00:00
2693,698741711703404545,Win a DNA200 LavaBox Mod with 2 extra Grips from @VapingCheap - https://t.co/gO9be0AX8W #ecig #Vape,RBuschy,2016-02-14 05:33:00+00:00
2694,698741591284981760,Glad I did not just die in a raging vape fire at the top of a tower,LFCseagren,2016-02-14 05:32:32+00:00
2695,698741315438129152,Hey Fam! I'm on my way to winning WET CRATE's For the Love of #Vape #Ejuice Giveaway! https://t.co/QIwDmKJcyt #WetCrate,IzakillD,2016-02-14 05:31:26+00:00
2696,698741077092728832,"Thanks for following us , check out our Pure VG  juices and get  with us! We are Sodium and Diacetyl free! https://t.co/orGqRxPfbu #vape #…",ecigitesztek,2016-02-14 05:30:29+00:00
2697,698741007865741313,Don’t miss out! https://t.co/dT5sx0zLQm #valentinesday #sale #vapes #pipes #headshop https://t.co/YpAIqVL7ox,the_headie_c,2016-02-14 05:30:12+00:00
2698,698741001368707073,My mom just said she would rather have me smoke weed than Vape 🤔 haha,squirtyyy,2016-02-14 05:30:11+00:00
2699,698740930740953088,Fisty &amp; Friends TROVE Fisty Panda 300 Follower Goal Vape Hit for every follower: https://t.co/q5iYGqxKPc via @YouTube,fistycuffs36,2016-02-14 05:29:54+00:00
2700,698740817297444864,"We get it Utah, you vape.",connordeekelly,2016-02-14 05:29:27+00:00
2701,698740791498428417,Hey Fam! I'm on my way to winning WET CRATE's For the Love of #Vape #Ejuice Giveaway! https://t.co/Un5Ii9HcmC #WetCrate,tristan646,2016-02-14 05:29:21+00:00
2702,698740685436907520,"Jeez, cuz vaping is so GOOD for you...just a dirty trick to get a new generation hooked on nicotine https://t.co/FgEzZ2t7T2",GrumpyMcDiarmid,2016-02-14 05:28:56+00:00
2703,698740524023357440,Win a DNA200 LavaBox Mod with 2 extra Grips from @VapingCheap - https://t.co/lDeZWT0M0M #ecig #Vape,kamcb29,2016-02-14 05:28:17+00:00
2704,698740513462071296,"""hahahahahaha I just vaped""",ughbecca_,2016-02-14 05:28:15+00:00
2705,698740257164890112,Had a good time at the signing for The Dark &amp; Bloody with @shawnaldridge and @MrTylerCrook! #dogs #vaping #vapingdog https://t.co/xBPDBq9bqg,mr_oberts,2016-02-14 05:27:13+00:00
2706,698740255130832896,NITECORE i4 New 2014 Ver BUY #batteryCharger https://t.co/99XrbGeNT7 #vape #vaping #flashlight #rechargeable @nba https://t.co/QVemKrA719,rawvibes,2016-02-14 05:27:13+00:00
2707,698740247962763265,Staged Heating Coil https://t.co/kI9X5axsVy #Vape,ModMonth,2016-02-14 05:27:11+00:00
2708,698740224399028227,"Thanks for following us @crystalbonner08, check out our Pure VG #vape juices and get #vaping with us! We are Sodium and Diacetyl free!",tootejuice,2016-02-14 05:27:06+00:00
2709,698740192857890817,"me every time I smell something unfamiliar at a con: ""is someone vaping""",MegTheJames,2016-02-14 05:26:58+00:00
2710,698740119575068672,Breaking: Grover Norquist vapes hard. https://t.co/5EscctodyX,LeeBillings,2016-02-14 05:26:41+00:00
2711,698740086104395776,WAR ON VAPING.  https://t.co/pNDRTNNybB,jenboseph,2016-02-14 05:26:33+00:00
2712,698740079821455360,"A BIG SHOUT OUT TO MARLOW AND HIS CREW @760 TVL VAPE LOUNGE , WHAT ARE U WAITING FOR GET URSELF… https://t.co/LqHly3o8m9",realvaporinc,2016-02-14 05:26:31+00:00
2713,698740059722354689,RT @GroverNorquist: None of the candidates mentioned the Obama/Democrat war on Vaping and the (cont) https://t.co/w708C1INpo,ncblondegardner,2016-02-14 05:26:26+00:00
2714,698739898862272512,xcom 2 but you play as a group of ragtag vapers trying to stop the nwo from completing a project to wipe out all vape rigs on earth,garbagezone,2016-02-14 05:25:48+00:00
2715,698739894747725824,"We want to give you free things.

Click the tweet below to vote!

https://t.co/AyCzPlnRh0
#vape #vaping #vapeporn #vapelife #vapeon",vapetrottercom,2016-02-14 05:25:47+00:00
2716,698739881619623937,"My first braided coil, I love vaping on this one.#coil #coilbuild #cleanbuild #coilporn… https://t.co/YnqgCmSPqq",Freak_xtc,2016-02-14 05:25:44+00:00
2717,698739828788039680,Damn I wish I knew how to do crazy awesome vape tricks😩😤,adrianflorez97,2016-02-14 05:25:31+00:00
2718,698739822534488065,"anyway: it's comforting to know that when this whole politics thing falls through, Grover's got a career ahead as the face of Big Vape",coolranchzaku,2016-02-14 05:25:30+00:00
2719,698739706293587968,"I added a video to a @YouTube playlist https://t.co/yOCTeTL19e ""Dope"" Baltimoron Vape Juice | 2 Flavors Boss &amp; Dope | EJuice Review",D8oy,2016-02-14 05:25:02+00:00
2720,698739566535020549,WHEN WILL VAPING NOT BE FUNNY https://t.co/MP96749e8n,trappedinazorb,2016-02-14 05:24:29+00:00
2721,698739435547004931,"I forget who observed that vape == mouth fedora

but there you have it, huh?

https://t.co/YQntjdawM3",_danilo,2016-02-14 05:23:58+00:00
2722,698739372674297857,when did grover norquist decide that he had to make his brand about vaping single-issue voters?,itsgrozz,2016-02-14 05:23:43+00:00
2723,698739318530174976,When @tinypotat vapes your burp https://t.co/3xd8WbvaOR,meuliinn,2016-02-14 05:23:30+00:00
2724,698739274619813888,MY MOM IS TRYING TO VAPE NOOOOOOOOOOOOOOOOO https://t.co/7zzOJ4OV2h,Blismatic,2016-02-14 05:23:19+00:00
2725,698739079433883649,"Never have I ever been to an event, let alone a wedding, where there were more vapes than there were people.",andiicantu,2016-02-14 05:22:33+00:00
2726,698738972780933120,"""Deadpool? I think I need some identification."" 

*Vapes*

""Oh my god I'm so sorry. Second door on the right.""",devoffna,2016-02-14 05:22:07+00:00
2727,698738819617546240,"""Let me see them vape tricks Wendy""",kayceerae1,2016-02-14 05:21:31+00:00
2728,698738706941923329,#fishing #hd Vaping Tricks - Blowing Rings with a Tube/Roll https://t.co/9fKlK9vfK6 https://t.co/CI1ywTeRAN,fishing_hd,2016-02-14 05:21:04+00:00
2729,698738640076173312,"""she vapes and has no eyebrows""",dumbamber,2016-02-14 05:20:48+00:00
2730,698738593485946880,"the real actual grover norquist, fighting for vape rights. what is the world",coolranchzaku,2016-02-14 05:20:37+00:00
2731,698738492424200194,Check out these awesome deals from Vaping Express. https://t.co/O4lvgtAXti,catgirlsnm,2016-02-14 05:20:13+00:00
2732,698738309351145472,Lmao Ayanna: I got a penny board Nic : do you vape too ? 😂😂💀,JabiPapi_,2016-02-14 05:19:29+00:00
2733,698738254481387520,RT KEITHGREEN_AAK #emerikentshirtcompany #post #vape #skatergirl #fashion #shop #musthave #musthavelist… https://t.co/rVDqtjSQ2D,jensontaylor26,2016-02-14 05:19:16+00:00
2734,698737958136868865,Shouldn't have took that nap from 7-10 lmao fuck... Now I'll have to vape hard to go back to sleep 😁💨,PaulineBomberry,2016-02-14 05:18:05+00:00
2735,698737936867598338,"Rip Tripers Sold us out ?[QUOTE=""stevegmu, post: 944584, member: 18610""]Vapers who don't li... https://t.co/eeddkWLdFC",blacknoy_,2016-02-14 05:18:00+00:00
2736,698737853833019392,"""I gave up vape for lent""",paige_garncarz,2016-02-14 05:17:40+00:00
2737,698737853233115136,"Ppl come up to me and will show me their vape then i get to mess with it, give it back to them, and they love it haha",garrisonmax,2016-02-14 05:17:40+00:00
2738,698737780248203264,Drew another monster-thing after vaping some stems https://t.co/5TD1SDB9Jq,GanjaNug,2016-02-14 05:17:23+00:00
2739,698737737013133312,I get it mom you vape https://t.co/0k66wCQkKS,haydencrandall,2016-02-14 05:17:13+00:00
2740,698737478065213440,Who the fuck is vaping on the roads tonight?!,sunfloweryouth,2016-02-14 05:16:11+00:00
2741,698737130458120192,Previously untaxed e-cigarettes may face an 86.5% tax in Utah https://t.co/HLRkBkxCFU #ecigs #vaping,VapinXsmoker,2016-02-14 05:14:48+00:00
2742,698737129665355778,E-cigs shut down hundreds of immune system genes—regular cigs don’t https://t.co/3WbMskItn7 #ecigs #vaping,VapinXsmoker,2016-02-14 05:14:48+00:00
2743,698737128788758528,Smoking in a car with kids may soon be illegal https://t.co/4i0UTXBpJ5 #ecigs #vaping,VapinXsmoker,2016-02-14 05:14:48+00:00
2744,698737127920513024,New Electronic Cigarette eCommerce Guide Outlines Some Differences in Regulations Between State... https://t.co/284RqeTf53 #ecigs #vaping,VapinXsmoker,2016-02-14 05:14:47+00:00
2745,698737126637043712,"E-cigs could damage airways more than traditional cigarettes, finds study https://t.co/QF9w0t1OE5 #ecigs #vaping",VapinXsmoker,2016-02-14 05:14:47+00:00
2746,698737099831250944,Vape is life https://t.co/busqq8BCOk,_karenuvalle,2016-02-14 05:14:41+00:00
2747,698737007439306752,Super  deals Thanks   https://t.co/XGfuNz2XlS #vape #ecig,ecigitesztek,2016-02-14 05:14:19+00:00
2748,698737005262434305,Caramel Coffee 100% USA Free shipping! &amp; Free  Ring.     https://t.co/vqwwg6SGQx #vape #ecig,ecigitesztek,2016-02-14 05:14:18+00:00
2749,698737004159352834,Great Deals: The Juice Cartel Where High Quality Meets Low Prices - |    https://t.co/244KjiiySx #vape #ecig,ecigitesztek,2016-02-14 05:14:18+00:00
2750,698737002888437760,Thank you to everyone who follows. Please spread the word by retweeting    https://t.co/8TQK0tSGll #vape #ecig,ecigitesztek,2016-02-14 05:14:18+00:00
2751,698736933518741505,"""hey bleu are you busy, can you bring me my vape juice?""",bbleuboy,2016-02-14 05:14:01+00:00
2752,698736930519961600,S/O to the dude vaping at the bar. You the real #vapegod/#mvp,adamebruce,2016-02-14 05:14:00+00:00
2753,698736919899983872,RT sovapeone: Super #vape deals Thanks vapediscounts #vape,vapemerch,2016-02-14 05:13:58+00:00
2754,698736916078854144,RT ZeroNicJuice: #Eliquid Caramel Coffee 100% USA Free shipping! &amp; Free #Vape Ring. #ecigarette #VapeLife #ecig https://t.co/zQQPSgTAly,vapemerch,2016-02-14 05:13:57+00:00
2755,698736914199875584,RT RealRiPTrippers: Tug Tank!#vape #vapor #vaper #vaping #vapelifestyle #vapelife #vapefam #vapecommunity #riptrip… https://t.co/No0Cy27Kbg,vapemerch,2016-02-14 05:13:56+00:00
2756,698736912991985664,RT Dan_H: rollingintrash i'll #vape to that,vapemerch,2016-02-14 05:13:56+00:00
2757,698736910672531458,RT Vapeauctions: Great Deals: The Juice Cartel Where High Quality Meets Low Prices - | https://t.co/MNydKc8yCZ #vape #eliquid,vapemerch,2016-02-14 05:13:56+00:00
2758,698736909141602304,RT vapingtruth: Thank you to everyone who follows. Please spread the word by retweeting #vapingtruth #vapelife #vape,vapemerch,2016-02-14 05:13:55+00:00
2759,698736906394345473,RT HidzhamHanif: Vape on brothers! #vape #vapeon #vaping #vapefam #vapemate #VapeGoals https://t.co/RuJol8EerL,vapemerch,2016-02-14 05:13:55+00:00
2760,698736905274396673,RT DeltaQSquared: #HB1645 passed the House. We need to Senate to kill this bill! #vape #vapeon #vapelife… https://t.co/wAQYmP2Mhv;,vapemerch,2016-02-14 05:13:54+00:00
2761,698736903747719168,RT PenlessEJ: RiP Trippers review of the eVic VTC Mini (the build that I am currently using) https://t.co/B1pGlo5lQ3; #vape #vapelife #vtcm…,vapemerch,2016-02-14 05:13:54+00:00
2762,698736902086721536,RT Reidser71: Enter to win some amazing Coil Master #vape kit from coilmasteruk and v_a_p_e. #coilmaster #Giveaway… https://t.co/VvGZe7fAVL,vapemerch,2016-02-14 05:13:54+00:00
2763,698736894813802498,RT Reidser71: Check out this #Vape #StarterKit #GiveAway TheVapeTrader! #thevapetrader #heavengifts https://t.co/0UEWOCyweK;,vapemerch,2016-02-14 05:13:52+00:00
2764,698736858004594688,you ever vape so hard you pop a boner?,swamp_asss,2016-02-14 05:13:43+00:00
2765,698736752996020224,MY 67 YEAR OLD AUNT IS VAPING IN THE BACK SEAT OF MY CAR,alien1578,2016-02-14 05:13:18+00:00
2766,698736480345260033,what vape u got ? https://t.co/vhcB6o2kXS,MRvibegaming,2016-02-14 05:12:13+00:00
2767,698736188744691712,Breaking: #Trump reveals there are 106 year olds who don't exist. Breaking: #Trump is #vaping.,PhilipAShane,2016-02-14 05:11:03+00:00
2768,698736157257957376,tru friendship is sending videos of celebs vaping,hurlscouts,2016-02-14 05:10:56+00:00
