,TweetID,TweetContent,TweeterUsername,TweetDatetime,TweetLongitude,TweetLatitude,TweetPlace
1289,1531637467241234435,https://t.co/SoH7NjPN1E Over 100 #brands to choose from -- #vape megastore ------- #thc #vapes #dabs #vaporize #cbd #cbdvapes #cannabis #weed #bongs #pipes,vapor_dot_com,2022-05-31 14:03:23+00:00,,,
1290,1531637445451984896,hey tepig i vape,oshawott_ebooks,2022-05-31 14:03:18+00:00,,,
1291,1531637266069827584,"“Our analysis translates to 2,284 new underaged daily tobacco users each day between 2017 &amp; 2019. This rate of youth tobacco initiation has not been seen since the early 1990s, prior to the implementation of tobacco control measures,”
#JUUL #teens #vaping
https://t.co/PmI5o6cbJg",TrustwellLaw,2022-05-31 14:02:35+00:00,,,
1292,1531637195580252162,"Check out this product 😍 Green Apron 100ml Shortfill 0mg (80VG/20PG) 😍 
£9.99.  Shop now 👉👉 https://t.co/TtMAtLVxId
 #vape #vapelife #vapecommunity #vapenation #fyp https://t.co/ztU4hjo3FZ",MrhVapes,2022-05-31 14:02:18+00:00,,,
1293,1531637170003488769,The extraction team at Green Meadows is hard at work preparing all new vape cartridges just for you. Green Meadows Insiders will be the first to know about these new products in June. https://t.co/K3wmspdJGd,Greenmeadows,2022-05-31 14:02:12+00:00,,,
1294,1531636923239890947,"Every year, on World No Tobacco Day, we recognize the detrimental effects of tobacco on personal health and the environment #TobaccoExposed. Talk to your healthcare provider or local pharmacist for help to quit smoking or vaping. To learn more visit https://t.co/Lxt0tft9fl https://t.co/HuuDY4duFw",BrantHealthUnit,2022-05-31 14:01:13+00:00,,,
1295,1531636882941034497,"Vanilla Biscuit by IVG Salts is a multi-layered dessert style vape that features a sweet vanilla filling, sandwiched between two crunchy biscuits.

Just £4.99 each or 5 for £20!
https://t.co/GI2S7kJMqE

#ivg #eliquid #nicsalt #ivapegreat #vanilla #ejuice #vapeshop #vape #vaping https://t.co/4MFSg3BUX6",ELIQUIDSUKCOM,2022-05-31 14:01:03+00:00,,,
1296,1531636853719302144,"Although not all #vaping products contain nicotine, the majority of them do and the level of nicotine can very widely. In honour of #NoTobaccoDay, take some time to talk to your child about vaping: https://t.co/xH66QLUrk3
#tobacco #vape #teens #teenager #parenting #parents https://t.co/67V78PDI5d",CaringforKids,2022-05-31 14:00:57+00:00,,,
1297,1531636787726241798,Vaping carries a small fraction of the risk of smoking. People who smoke drastically reduce their risk of smoking related illness and premature death by switching #WorldVapeDay #SayYesToTHR #WVD22 #WNTD22 https://t.co/jqBjVV91SR,AsovapeCR,2022-05-31 14:00:41+00:00,,,
1298,1531636709573677057,"Attention student-athletes! Want to dash your dreams of playing sports? Then start vaping. It’s a guaranteed way to irreversibly damage your lungs, your game … and your life. Dreams aren’t that important, are they? #VapingKillsDreams https://t.co/sIDQ0Gvp9J",IHSAA1,2022-05-31 14:00:22+00:00,,,
1299,1531636684324237312,TEENAGERS VAPE which is a big problem because unlike adults teenagers have undeveloped brains which can lead to more problems!,Dont_Vape_Bot,2022-05-31 14:00:16+00:00,,,
1300,1531636633266704384,"You'll huff, you'll puff, and you'll blow away your stress with natural relief.😤

Get some help with that from our .5g Vape Carts at your favorite neighborhood location!🏬💚 https://t.co/0tzvia33TV",Trulieve,2022-05-31 14:00:04+00:00,,,
1301,1531636627260338177,"We found a solution to quitting smoking and many of us started small businesses to provide other people #SaferAlternatives. Vaping is a grass-roots, consumer-driven solution to smoking. The Tobacco Industry was late to the game #WorldNoTobaccoDay #WNTD22 https://t.co/UeIGxl8uMw",worldvapeday,2022-05-31 14:00:03+00:00,,,
1302,1531636627130359813,"Today is @WHO's World #NoTobacco Day, raising awareness of how tobacco harms health and our environment. Read more about the harms of tobacco (https://t.co/H9WISKh4RH) and vapes (https://t.co/fY01reVfuo) For help quitting, call 1-800-784-8669 or text QUIT to 47848. https://t.co/jzQIiRTjL4",PlanningSalem,2022-05-31 14:00:02+00:00,,,
1303,1531636620864024576,"It’s #WorldNoTobaccoDay – a day to highlight the dangers of using tobacco and help individuals quit smoking or vaping. 

@AlbertaQuits has a free text service which sends tips and motivational messaging to your phone to keep you on track. 

Text ABQUITS to 12345 to sign up. https://t.co/hb7eJyjYKv",scpcn,2022-05-31 14:00:01+00:00,,,
1304,1531636565637750795,"Attention student-athletes! Want to dash your dreams of playing sports? Then start vaping. It’s a guaranteed way to irreversibly damage your lungs, your game … and your life. Dreams aren’t that important, are they? #VapingKillsDreams https://t.co/n565PnurJM",lphsathletics,2022-05-31 13:59:48+00:00,,,
1305,1531636163018203138,if they won with something it’s menthol juul pods,janezwurld,2022-05-31 13:58:12+00:00,,,
1306,1531636118348783621,Manifesting that I get a vape for my birthday 🤞🤞🤞,ratsoncrack1,2022-05-31 13:58:01+00:00,,,
1307,1531636116297723904,"Can't find a tweet, but heard a piece on Los Angeles radio on harmful flavors &amp; increased nicotine  in vapes &amp; ecigs. These ingredients are meant to DIGEST not BREATHE. Nobody knows what's in someone else's juice. Both 2nd &amp; 3rd hand smoke is a harmful. #WorldNoTobaccoDay",CarrieHKelly,2022-05-31 13:58:01+00:00,,,
1308,1531635920465711105,"One million young people became daily tobacco users, most used JUUL e-cigarettes https://t.co/06dIsRIXae",nazmulmarketer1,2022-05-31 13:57:14+00:00,,,
1309,1531635914232971264,The vape store must be hit before I start these deliveries,barbiepumi,2022-05-31 13:57:13+00:00,-75.40809,39.822204,"Chester, PA"
1310,1531635837812629504,Was at the ball games over the weekend and I overheard a mom say how her and her friends went for a walk and her one friend whipped out a vape pen (weed) and that she can’t control her actions and if she’s doing things like that the best she can do is  distance herself.,Sky_Hiigh_,2022-05-31 13:56:54+00:00,,,
1311,1531635500351488000,"My vape shop played a key role in my successful quit journey. They were able to tailor my specific needs, provide a safe place for ""silly"" questions &amp; hear other's quit stories. Their presence is invaluable.
#WNTD2022",grayjaynine,2022-05-31 13:55:34+00:00,,,
1312,1531635469074710528,"""To sum things up thus far, the FDA funds questionable vaping research, which it uses to inform heavy-handed e-cigarette restrictions. This effort is led by the CTP, which relies on tobacco-industry user fees, as the agency itself acknowledges.""
https://t.co/rmJ8YIT6B8",bethelight310,2022-05-31 13:55:26+00:00,,,
1313,1531635446152929280,Just posted a photo @ SHIFT Vape Cainta https://t.co/eSBENXOgwm,ShiftVapeCainta,2022-05-31 13:55:21+00:00,121.12154,14.57603722,"Cainta, Calabarzon"
1314,1531635278242320393,NSW vaping rates double; smoking drops https://t.co/JKuy4T5vlr,askbygeeks,2022-05-31 13:54:41+00:00,,,
1315,1531635156716503046,"disposable-vape-carts 5 gram size will typically yield 150 puffs and 300 puffs from a full gram cartridge - zushiweed Disposable
#FYR_disposable
https://t.co/WoJmuemxoW",YousufK71133110,2022-05-31 13:54:12+00:00,,,
1316,1531635082284310528,"Nextleaf Announces Q2 Results with Strong Revenue Growth in Vapes and CBD Oils 

“@GlacialGold continues to establish itself as one of the best-selling brands in vapes and CBD oil."" @paul_oils 
$OILS $OILFF #ExperienceTheLegacy #CBD 

Read the full PR: https://t.co/4Fn1c1GHau",nextleaf_oils,2022-05-31 13:53:54+00:00,,,
1317,1531634812640890880,"Teen driving fatalities are up. Teen tobacco use is up for the first time since the 90’s, and tied to the introduction of Juul products.",NevskyClaire,2022-05-31 13:52:50+00:00,,,
1318,1531634496478617603,"""To sum things up thus far, the FDA funds questionable vaping research, which it uses to inform heavy-handed e-cigarette restrictions. This effort is led by the CTP, which relies on tobacco-industry user fees, as the agency itself acknowledges.""
https://t.co/3fqCrHiH8v",alli_vapes,2022-05-31 13:51:35+00:00,,,
1319,1531634487984984064,Cannabis Stock News: Nextleaf (CSE: OILS) Announces Q2 Results with Strong Revenue Growth in Vapes and CBD Oils https://t.co/4rt5biQdNL #Cannabis,InvestorIdeas,2022-05-31 13:51:32+00:00,,,
1320,1531634487758450688,Cannabis Stock News: Nextleaf (CSE: OILS) Announces Q2 Results with Strong Revenue Growth in Vapes and CBD Oils https://t.co/5sZ4y3eui2 #Cannabis,MJInvestorIdeas,2022-05-31 13:51:32+00:00,,,
1321,1531634396683444229,anyone tryna hit the vape https://t.co/iXvX4IJjGr,MustrdBucket,2022-05-31 13:51:11+00:00,,,
1322,1531634230266044416,I want a vape. I ❤️ COUNTRY MUSIC|＿＿＿＿＿＿＿＿＿＿＿| \__/ || •ㅅ•….,auto_badkerr,2022-05-31 13:50:31+00:00,,,
1323,1531634148821020673,Study Raises Questions About Anti-Vaping Bias At FDA https://t.co/4ABlkHG9wU,NLAAlliance,2022-05-31 13:50:12+00:00,,,
1324,1531633966071042048,ONE PUFF &amp; YOUR HOOK’D !! NOW AVAILABLE AT HAUS OF VAPES. 🔥 @rgv @hausofvapes @vape @smoke @hookd https://t.co/eiAR9fVnUs,hausofvapes,2022-05-31 13:49:28+00:00,,,
1325,1531633934890434560,was --&gt; &lt;--- close to vaping fml those matreps jek,iikkhhhsaaan,2022-05-31 13:49:21+00:00,,,
1326,1531633914548310018,"*says I’m going to quit vaping*
*one minor inconvenience happens*",spookymayra,2022-05-31 13:49:16+00:00,-97.034184,32.771786,"Irving, TX"
1327,1531633739436105730,GRAV LABS GLASS AT HAUS OF VAPES 🧪🥼🧫 https://t.co/B91fI6Jzl2,hausofvapes,2022-05-31 13:48:34+00:00,,,
1328,1531633611715272706,"#cake_bar_disposable
disposable-vape-carts 5 gram size will typically yield 150 puffs and 300 puffs from a full gram cartridge - zushiweed Disposable
https://t.co/APs3x7h5Iy",YousufK71133110,2022-05-31 13:48:04+00:00,,,
1329,1531633595739258880,"The availability of scientifically substantiated, less risky products such as vapes are crucial to effective #TobaccoHarmReduction #WorldVapeDay",ITCANNews,2022-05-31 13:48:00+00:00,,,
1330,1531633471587815424,"If you know you know.I love that 3yrs later our little,weird labor of love film is still making lists &amp; finding its audience.If you haven’t experienced @A24’s #TheDeathOfDickLong yet, it’s time to hit your vape &amp; get weird! #a24 #swissarmyman #everythingeverywhereallatonce #film https://t.co/8f1c0La0Uu",mykabit,2022-05-31 13:47:30+00:00,,,
1331,1531633471533334529,"MY SISTER LOST HER VAPE AND SHE HAS TO ASK OUR MOM IF IT'S AT HOME, I'M READY",wheeins_cow,2022-05-31 13:47:30+00:00,,,
1332,1531633255258128385,Soo one of my students had a Rick and Morty THC vape……. It’s the fact that they in 8th grade. 😩😩😩😩 like come on now y’all wild. This why we need metal detectors and bags checked before entering the building.,thats_Embry,2022-05-31 13:46:39+00:00,,,
1333,1531633175465668608,"The Numbers of Young Vapers is Rising as Smoking Rates Fall

https://t.co/6c4rm3dwsy",skorpios60,2022-05-31 13:46:20+00:00,,,
1334,1531633007974567936,I always got it on me 💯 (my vape),hoefrombirth,2022-05-31 13:45:40+00:00,,,
1335,1531632992959057920,inhaling my vape isn't enough i need to eat it,faiIedgod,2022-05-31 13:45:36+00:00,,,
1336,1531632702159568896,Do some flavours contain nuts as these may be harmful to nut allergy passers by  who inadvertently breathe in the vape,Szeal2,2022-05-31 13:44:27+00:00,,,
1337,1531632397531373569,Don't vape guys it's not good,Abdullaaar,2022-05-31 13:43:14+00:00,,,
1338,1531632206589870082,"all the girlies who wanna date military dudes now after seeing top gun, dont. they look exactly like miles teller in that movie but the personality is a -3/10. hes broke, he has stains on his clothes from spilled vape juice, he survives on fast food or unseasoned chicken. dont.",Perriwinkle20,2022-05-31 13:42:29+00:00,,,
1339,1531631615968833537,"Who has won Monaco F1 Grand Prix 2022 ?
- Sergio Perez (Red Bull)

World Vape Day 2022 observed on ?
- 30 May

Who has received the Immunisation Champion award by UNICEF ?
- Radio Jockey Umar Nisar

Which country overtakes China as India’s Largest Trading Partner in FY22 ?
- USA.",GuideforAll,2022-05-31 13:40:08+00:00,,,
1340,1531631338243215360,My partner is going to freak should he find out I may have lost my vape. It has just been a month. Oh bethuna 🙆🏾‍♂️😭,SbuMohale,2022-05-31 13:39:02+00:00,,,
1341,1531631302273028096,"Your family and friends need you. Save their lives and save yours. Happy World No Tobacco Day!
.
.
.
#nosmoking  #vape  #quitsmoking #smokefree #stopsmoking #vaping #vapelife #vapetricks #smoking #vapeshop #vapefam #health #smokingkills #vapecommunity #motivation #vapeon https://t.co/tn2GF1fZd0",Seacomgroup,2022-05-31 13:38:53+00:00,,,
1342,1531631177379024896,I want to pull for yelan lowkey but idk if hu tao vapes all her CAs with her rip,dragonzhongli,2022-05-31 13:38:23+00:00,,,
1343,1531631166645739520,I can’t believe I’m the kinda bitch that can leave early enough for work in the morning that I can stop at the vape shop and bread co,Aiirr_en,2022-05-31 13:38:21+00:00,,,
1344,1531631161352519682,disappointed to learn this doesn’t have anything to do with vapes https://t.co/HOEDNIWbCB,beefy_burrito,2022-05-31 13:38:19+00:00,,,
1345,1531630964799045632,DEPP vs HEARD This witness was vaping and driving while testifying https://t.co/7F9u8rrlUJ,starcasm,2022-05-31 13:37:32+00:00,,,
1346,1531630946570895361,you say i get no pussy but wait until you see my type 6 maximum universal shift v666.90 vape gun,raiden_bot,2022-05-31 13:37:28+00:00,,,
1347,1531630661462904838,me while my vape is literally in my hand “where is my vape” i think my brain is broken,louist_aimh,2022-05-31 13:36:20+00:00,,,
1348,1531630623617855489,Just saw someone use yelan and yoi. THEY ARE A LITERAL GENIUS. WHY DIDNT I THINK ABT IT BEFOREHAND THE VAPE DMG POTENTIAL,CatherineAdores,2022-05-31 13:36:11+00:00,,,
1349,1531630297749458944,"Honestly, switching from cigarettes to vape is a shit idea. I swear to god you're just switching from lung cancer to brain cancer.",AkidRosli,2022-05-31 13:34:53+00:00,,,
1350,1531630165033472000,"Nextleaf Announces Q2 Results with Strong Revenue Growth in Vapes and CBD Oils

$OILS $OILFF
 https://t.co/E2aA7daGDy",junglejava1,2022-05-31 13:34:22+00:00,,,
1351,1531629878641975297,anybody got pod? i now dak2 vapers ketinggalan zaman already,nnzrljm,2022-05-31 13:33:14+00:00,,,
1352,1531629860979884036,thank fuck my brother is a little addict like me &lt;3 i ran out of vape juice,dirty_queer,2022-05-31 13:33:09+00:00,,,
1353,1531629845381320705,"My mama found my vape, why am I not getting yelled at?? 🥴🥴🥴🥴🥴",babestationn,2022-05-31 13:33:06+00:00,,,
1354,1531629785318686720,"Revised code of practice for @smh: “we will seek independent comment from others with expertise in the field, &amp; include valid, informed criticisms of the research”*
* Conditions Apply: independent comment will not be sought if that comment supports #vaping",AlexWodak,2022-05-31 13:32:51+00:00,,,
1355,1531629698337284096,"Hey dude, I vape. Yeah you know vaping? I do it. Yeah vaping, it's something I do. I don't smoke, I vape. Vaping dude, it's amazing. You sho",IuIu_ebooks,2022-05-31 13:32:31+00:00,,,
1356,1531629402098143232,check out my new vape pen,andrejchanbot,2022-05-31 13:31:20+00:00,,,
1357,1531629344740847618,my yelan did a 92k vape w her skill👹👹👹👹,tanothaniel,2022-05-31 13:31:06+00:00,,,
1358,1531629106433036291,"“I do think vaping is seen as healthier than smoking as I feel like a lot of young people, especially those who weren’t smokers beforehand, don’t even associate vaping with smoking.”  #WorldNoTobaccoDay

https://t.co/N5llDkzguE",SpunOut,2022-05-31 13:30:09+00:00,,,
1359,1531629103719268353,Fucking forgot my vape 😩,msnewjudi,2022-05-31 13:30:09+00:00,,,
1360,1531629087369879554,"Wonky weed in wpg #cannabis 🤷🏽‍♂️🌿💨Not my bag baby but, ill check what the big hype is with #concentrates #dabs #vape #shatter #LiveResin #Badder @StigmaGrow @premium @YocanTechnology #LemonSKZ #Sativa #DabBods https://t.co/y1bI3ECb0O",Mario204Super,2022-05-31 13:30:05+00:00,,,
1361,1531629085272702976,"On #WorldNoTobaccoDay, you can help protect the environment from the impact of tobacco industry products by:
➡️Not starting to smoke or vape
➡️Quitting, if you smoke or vape
➡️Properly disposing of tobacco &amp; vapour product waste https://t.co/wDPxORFpJq",ROWPublicHealth,2022-05-31 13:30:04+00:00,,,
1362,1531629009859227648,It’s a lot of me looking at shit like this n thinking ok that’s 1” w 1” spacing bubble wrap is 1” w “.25 spacing polka dot is staggered not gridded etc https://t.co/u5qhKQ1oNT,JUUL_user1980,2022-05-31 13:29:46+00:00,,,
1363,1531628487961989120,"How safe is it to mail weed and not get caught?🤔

Specifically mailing a weed cartridge (for vaping).

Yes I'm aware of vacuum seal, airtight, non-porous mylar bags. But does that REALLY work? What about x ray machines?",JstMyEarbudsnMe,2022-05-31 13:27:42+00:00,,,
1364,1531628228661624832,cigarette in one hand vape in the other just puff puff chimney vibes,yesindeeder,2022-05-31 13:26:40+00:00,,,
1365,1531628066090659840,vaping in front of children should be illegal.,inniecharmer,2022-05-31 13:26:01+00:00,,,
1366,1531627875253768192,Over 1 Million Kids and Young Adults Vaped Every Day in 2019 https://t.co/6Uuk6AxtP5,ShepardMedical,2022-05-31 13:25:16+00:00,,,
1367,1531627782035255296,"#Vaping opponents support de facto prohibition of #vaping then complain about black market their own policies created. Black markets are pernicious. Best way to minimise vaping BM is to make vaping available for adults &amp; accessible, attractive &amp; affordable.",AlexWodak,2022-05-31 13:24:54+00:00,,,
1368,1531627573242908673,In better news I found out my vape DOES have a replaceable battery so cross your fingers that the new one I ordered works,rrroooiiirrr,2022-05-31 13:24:04+00:00,,,
1369,1531627394070724609,the same people who hate cigarettes are currently tearing apart their couch right now to find their strawberry kiwi vape,lilruut,2022-05-31 13:23:21+00:00,,,
1370,1531627368577744896,niggas used to say they was high off three hits of a vape like i know you fucking lying,Iochead,2022-05-31 13:23:15+00:00,,,
1371,1531627253892665344,People who vape always walking around holding it looking like a baby with a pacifier,purplefrostingg,2022-05-31 13:22:48+00:00,,,
1372,1531627182170132480,"The tobacco industry’s environmental damage can harm everyone. 

From deforestation and toxic chemicals to pollution from smoke, microplastics in cigarette butts, and hazardous vape waste, Californians deserve a new normal. #littlebiglie #microplastics",KerriRe90691915,2022-05-31 13:22:31+00:00,,,
1373,1531627004587655168,Smoking rate in Germany increased again. This trend must be stopped! #vaping #tobaccoharmreduction,europeanvaping,2022-05-31 13:21:48+00:00,,,
1374,1531626866335006720,Mcdonald's vape,BenLutyBot,2022-05-31 13:21:15+00:00,,,
1375,1531626827646906368,"It may be difficult to quit smoking at first, but it is not impossible. Vaping devices have helped many curb this unhealthy habit, so join us today! 
 #RightToVape
 #RightToChoice 
#RightToBetterHealth https://t.co/vnZnz5pcaj",VoVBangladesh,2022-05-31 13:21:06+00:00,,,
1376,1531626749964038151,We at the gas station she den got All type of cigs in vapes in her declinc,Bling096,2022-05-31 13:20:48+00:00,,,
1377,1531626685455470593,"#Vaping opponents avoid polite, respectful, private or public discussions or debates with vaping advocates. If they thought they had a good case surely they’d be happy to debate other experts with a different view!",AlexWodak,2022-05-31 13:20:32+00:00,,,
1378,1531626680271372288,i left my juul at home pls pray 4 me today,estiophobia,2022-05-31 13:20:31+00:00,,,
1379,1531626637560893441,Common man. Vaping  on the train while clearly being pregnant ain’t the move.,MR_SC_,2022-05-31 13:20:21+00:00,,,
1380,1531626553888722944,Police say such shops are used only to sell dangerous illegal cigarettes and vapes https://t.co/QXvi69Ji5Y,thelincolnite,2022-05-31 13:20:01+00:00,,,
1381,1531626516492259331,Im on my vape so bad and it’s Zan fault,_xBaddd,2022-05-31 13:19:52+00:00,,,
1382,1531626487421575168,bring back smoking indoors i want to vape at my desk,graceygabriella,2022-05-31 13:19:45+00:00,,,
1383,1531626475295850500,If I vaped mr fog I prolly woulda been gave ts up . Them mfs are terrrrrriibllleeee 😭,__intheclutch,2022-05-31 13:19:42+00:00,,,
1384,1531626336334368774,my mom throwing a tantrum bc i don’t wanna help her buy vapes,xiaoluvrr,2022-05-31 13:19:09+00:00,,,
1385,1531626227944988672,people vaping for breakfast is crazy to me,mvdei,2022-05-31 13:18:43+00:00,,,
1386,1531625909899431936,why do i love vape so much but despise cigs,dietvanillacola,2022-05-31 13:17:27+00:00,,,
1387,1531625727015415809,How y’all become vape addicts when y’all didn’t even smoke in the first place.,screwedshit,2022-05-31 13:16:44+00:00,,,
1388,1531625690969346048,My Vaping Mistake: How it impacted my sports performance presented by @KnowTheRealCost  https://t.co/qY2c5ypQB7,TRUinPA,2022-05-31 13:16:35+00:00,,,
1389,1531625689794785281,"Most Australian media reports on #vaping, like this one in SMH, only seek comments from vaping opponents! Don’t mention smoking rates declining much faster in countries with higher vaping rates eg UK, US, NZ. How can that be fair &amp; balanced reporting? https://t.co/gaSw1Be3qX",AlexWodak,2022-05-31 13:16:35+00:00,,,
1390,1531625553786245120,It's about time.  A federal court finally addresses #Delta8 #THC  in a #copyright and #trademark infringement case. https://t.co/hMNlrPwhvr #HEMP #cannabis #IPlaw #intellectualproperty #intellectualpropertylaw #cbd #cbdvape #vape #hempvape https://t.co/O6BP7hh7JQ,WardandSmith,2022-05-31 13:16:02+00:00,,,
1391,1531625532160458755,"tryna quit vaping cold turkey , i’m dying rn 🥲",breeswee_,2022-05-31 13:15:57+00:00,,,
1392,1531625525944455168,"Might dress up as a vape, so she’ll suck the life outta me 😩",hamoudi2144,2022-05-31 13:15:56+00:00,,,
1393,1531625129620512768,I've got lemon morange pi yet vape juice,lynchad28,2022-05-31 13:14:21+00:00,,,
1394,1531625106648313860,"disposable-vape-carts 5 gram size will typically yield 150 puffs and 300 puffs from a full gram cartridge - zushiweed Disposable #Baked_bar_disposable
https://t.co/g53R27hMbS",YousufK71133110,2022-05-31 13:14:16+00:00,,,
1395,1531625016248258561,"""Giving up doesn’t always mean you are weak, sometimes it means you are strong enough and smart enough to let go.""
📞Call: +91 8960510444
🌐Web: https://t.co/3uZh7DQT5x
#nosmoking #vape #quitsmoking #smokefree #stopsmoking #vaping #vapelife #vapetricks #smoking #vapeshop https://t.co/ny4gJ8UtKe",AvailHealthcar3,2022-05-31 13:13:54+00:00,,,
1396,1531624914305916928,7 days no vape,Nawitaintjah,2022-05-31 13:13:30+00:00,-91.655009,30.146096,"Mississippi, USA"
1397,1531624700396326913,"""A new threat is now facing our planet: vape waste."" 

Jérémie @Pourchez and colleagues voice concerns over the environmental impact of e-cigarettes in @LancetRespirMed. #WorldNoTobaccoDay https://t.co/SFkdnpGCNb",TheLancet,2022-05-31 13:12:39+00:00,,,
1398,1531624645073551363,"ok ngl, i think i know why my mates have got vapes but they wont let me get one of my own, or find a way to get them. yeahhhhh id get hooked and fuck up my body lol. already kinda do but oh well at least i dont have a personal one",KinkyAfro_Kes,2022-05-31 13:12:26+00:00,,,
1399,1531624462944116737,"Overwhelming consensus #vaping is much safer than smoking. So why on earth severely restrict safer option when deadly cigarettes readily available for Australian adults from 20,000 outlets?",AlexWodak,2022-05-31 13:11:42+00:00,,,
1400,1531624429968838657,"May 31 is World No Tobacco Day, highlighting the problem of tobacco-related diseases. Some smokers have switched to vaping to solve their addiction. But experts say it can cause others as much harm.

'Having the tube down my throat was really uncomfortable"" (RT) https://t.co/gDujr6CmAt",musthafaaa,2022-05-31 13:11:34+00:00,,,
1401,1531624412046295041,So uh day 5 no vape• lowkey going crazy the urge to hit it never subsides but uh i just think ab how much better my anxiety and moods are gonna be once all the nic gets out my system. Pretty sure my skin gonna start back glowing too so there’s an update. I could scream,Tiffkany,2022-05-31 13:11:30+00:00,,,
1402,1531624219137785856,"We saw this slow motion trainwreck coming and did nothing. ""In 2019, three-quarters of new daily tobacco users aged 14 to 17 vaped daily and had e-cigarette dependence scores similar to daily cigarette smokers ..."" #TobaccoControl
https://t.co/HgzAqerQcr",EricBernicker,2022-05-31 13:10:44+00:00,,,
1403,1531623907798548486,"Today is 🚭World No Tobacco Day! 🚭
Tobacco in all its forms is one of, if not THE hardest drug to quit 🙅. Whether you smoke 🚬, chew 🦷, vape 🔋 or whatever, a nicotine addiction is no laughing matter
... https://t.co/hNNPiag39S",CSN4_LIFE,2022-05-31 13:09:30+00:00,,,
1404,1531623816425783299,I’m officially letting vapes go 🙌🏾,WhySooBeautiful,2022-05-31 13:09:08+00:00,,,
1405,1531623759819329541,Nextleaf Announces Q2 Results with Strong Revenue Growth in Vapes and CBD Oils $OILFF https://t.co/68y34BR47I,greenstocknews,2022-05-31 13:08:55+00:00,,,
1406,1531623588100456448,Timmy gets cereal https://t.co/s8kJljTqGj,oso_vapes,2022-05-31 13:08:14+00:00,,,
