,TweetID,TweetContent,TweeterUsername,TweetDatetime
441,1521569798404014080,Having to wait at the westwood/strath intersection without my juul is soooo tough,J_Marsupial,2022-05-03 19:18:03+00:00
442,1521569676085665792,i hate my vape flavor,balloonsoons,2022-05-03 19:17:34+00:00
443,1521569633047826432,They’re trying to make all good things illegal! What’s next?! Banana ice vapes???,kerionmywayward,2022-05-03 19:17:24+00:00
444,1521569404999413767,"Local health unit concerned with ongoing increases in youth vaping
https://t.co/7Qyr4JkKAf",canadian_vaping,2022-05-03 19:16:30+00:00
445,1521569385588133892,"IDC ABT HIM VAPING, JUST WHY GRAPE?? ICE MANGO/ MINT CHOCOLATE CHIP FLAVOR BEST L MAJOR L",_k0k1ch1,2022-05-03 19:16:25+00:00
446,1521569280566902786,it is always ethical to take a juul break every 15 minutes at work,heroinjuulp0d,2022-05-03 19:16:00+00:00
447,1521569257863233536,Ok owning a vape pen  is cool but I actually want to be able to buy a home one day lol.,AViatedCreative,2022-05-03 19:15:55+00:00
448,1521569074819571718,60% of youth e-cigarette users want to quit vaping within the year. Are you ready to quit? We're here to help. Call 443-523-1700 to learn more about our youth cessation services. 🚭#TobaccoTuesday https://t.co/xrL6hjjchW,somersethdmd,2022-05-03 19:15:11+00:00
449,1521568737681461248,People always asking why I hit my vape through my shirt. Cuz I don’t want flavor. Unless it was this. This would be AMAZING. Get me a Marlboro Red Disposable and I’m set https://t.co/CTfpRX9jMj,ChrisRose712,2022-05-03 19:13:51+00:00
450,1521568720744710144,"https://t.co/LORX9lgi0q

@Uber Not everyone smokes and your driving people who smell like cigarette smoke, marijuana smoke or vape smoke throughout the day. Rider just needs a sniff and smells smoke, it's the drivers fault. Such a murky grey area.......",DudeitsVoss,2022-05-03 19:13:47+00:00
451,1521568611420315648,"why be mad at Kit for vaping 😭 how does that effect any of us, people who don't personally know him, in anyway..",parkershold,2022-05-03 19:13:20+00:00
452,1521568541916680193,"simone matching her vape to her outfits, what an icon",kanthonyily,2022-05-03 19:13:04+00:00
453,1521568517354631169,i don’t vape but GRAPE rlly i already know that tastes like shit and i’ve never even had it,pinksranboo,2022-05-03 19:12:58+00:00
454,1521568470969860099,Everytime i hear someone hit a vape box it brings back memories 🤣,uhhmo__,2022-05-03 19:12:47+00:00
455,1521568294372843520,SAVE KIT CONNOR FROM GRAPE FLAVORED VAPES,narkl315,2022-05-03 19:12:05+00:00
456,1521568063325360130,"Dude in my mentions must be a cigarette smoker. He a little too but hurt that vapes are just as harmful to your body as cigarettes are, lol",KiAirUh,2022-05-03 19:11:10+00:00
457,1521568048662167553,"Funny how the left is always barking about democracy this and democracy that UNLESS democracy runs counter to their agenda. 

Individual states deciding abortion laws by the will of the people via the democratic process is now all of a sudden EVIL! 

These ppl have 0 principles.",Vape_fbv,2022-05-03 19:11:06+00:00
458,1521567657744646146,new vape time,talluweekndluvr,2022-05-03 19:09:33+00:00
459,1521567005647806465,r people actually mad that kit connor vapes what the hell,pandaslcver,2022-05-03 19:06:58+00:00
460,1521566890598060034,"kit connor’s fav vape flavour is GRAPE??! 
HE JUST LIKE ME FRRR",zblanka18,2022-05-03 19:06:30+00:00
461,1521566812453761024,i havent tried vape ever in my life and seeing the tl say that grape is an L flavour makes me wanna try it💀,chumsnikki,2022-05-03 19:06:12+00:00
462,1521566633092780033,Jimmy Fallon just broke my maroon juul and I am banging!!!,FinnVonFritter,2022-05-03 19:05:29+00:00
463,1521566260718235653,Star wars but they battle with weed/vape pens,JurisDICCtion,2022-05-03 19:04:00+00:00
464,1521566169160986627,"Being addicted to vapes is so embarrassing 
Be addicted to cigarettes like a real man😡",itsjustguguyow,2022-05-03 19:03:38+00:00
465,1521565969696571392,who wants to play among us tn w me and juul,livforness,2022-05-03 19:02:51+00:00
466,1521565308171034624,Annnnnnnd now my vapes dead. Fuck today with a spoon,ThomasJawwsh,2022-05-03 19:00:13+00:00
467,1521565300449320968,"Griner was detained at an airport in February after Russian authorities said a search of her bag revealed vape cartridges containing traces of cannabis oil.

 https://t.co/BKAqi1bvNE",THV11,2022-05-03 19:00:11+00:00
468,1521565289712066561,Vape Bad,Dont_Vape_Bot,2022-05-03 19:00:09+00:00
469,1521565200616468481,"If you’re okay with anything not in the constitution to no longer be accessible then give up your cars, any weaponry created after 1789, your vape pens, and your phones",RyCHOfficial,2022-05-03 18:59:47+00:00
470,1521564975474651140,i dont vape but grape flavour really ?? 😭😭,CALUMBA55,2022-05-03 18:58:54+00:00
471,1521564872319905792,my lunch was two hits from a vape pen and a lollipop,Astr0gator,2022-05-03 18:58:29+00:00
472,1521564810135097344,officially in my vape era bc the price of cigs keeps going up and i cant afford to buy them all the time anymore &lt;/3,magdaelne,2022-05-03 18:58:14+00:00
473,1521564560037060608,if men got pregnant you could get an abortion at your local vape store,savannahelisse,2022-05-03 18:57:15+00:00
474,1521564541976461312,Wow by Steve Carell today at a party who left his juul at home,ClayBorrellBot,2022-05-03 18:57:10+00:00
475,1521564514520608768,I thought someone in the away end had let off a smoke bomb but he was just vaping.,dlmjnk,2022-05-03 18:57:04+00:00
476,1521563898301849603,y’all think I can hit the vape in therapy,bigholynina,2022-05-03 18:54:37+00:00
477,1521563741669761025,My boyfriend took my juul so that I would stop and I feel so fucking angry rn lolol,slimyaydie,2022-05-03 18:53:59+00:00
478,1521563721675546625,I said I would never try vapes but this strawberry mango ain’t that bad loll,021brii,2022-05-03 18:53:55+00:00
479,1521563383111340032,chokes on fat vape cloud drools all over my licensed xbox series x controller tastes blood in throat,hitsujixnoxyume,2022-05-03 18:52:34+00:00
480,1521563346788569089,god shivers in fear when i lose my vape,realkikedyke,2022-05-03 18:52:25+00:00
481,1521563085022105602,I swear I heard Lana hit her vape in white dress,a___germanotta,2022-05-03 18:51:23+00:00
482,1521562904537014273,ppl act like kit vaping is the end of the world like he’s a british teenager i promise you that it’s not uncommon 💀,FLICKERMV1,2022-05-03 18:50:40+00:00
483,1521562827802259459,Got this new vape &amp; I love ittt,itsyagirldiy,2022-05-03 18:50:22+00:00
484,1521562560239185921,Hey guys question? 🤔when you buy vape juice and you read the  ingredients and the word nicotine is not in the ingredients list does it still have nicotine 🤔🤔,Yuuka5324,2022-05-03 18:49:18+00:00
485,1521562458703515651,I'm actually glad I have hulu with ads I feel all like these awful vaping ads are rly adding to my experience of watching all of abbott elementary,cervixsyndrome,2022-05-03 18:48:54+00:00
486,1521562257641115651,What vape flavor is your go-to right now? 💨,smokesnstuff1,2022-05-03 18:48:06+00:00
487,1521562115038973953,Brittney Griner was arrested at a Moscow airport in Feb for allegedly carrying vape cartridges. Here's the latest. https://t.co/D1lxlufLdS,HIGH_TIMES_Mag,2022-05-03 18:47:32+00:00
488,1521561691120668672,I'm all out of vape juice i think I'll die,lunaPENIS,2022-05-03 18:45:51+00:00
489,1521561549550325761,"Auburn Police Department (APD) needs help finding two suspects who stole more than $1,000 worth of rechargeable vapes from a local grocery store. #FOX13 https://t.co/obpkGuuB9u",fox13seattle,2022-05-03 18:45:17+00:00
490,1521561330641162243,my vape fell out of my pocket in front of both of my bosses today while we were all talking 🤠 lovely timing wasn’t that 🤠,marykateroseee,2022-05-03 18:44:25+00:00
491,1521561230338633728,all this talk abt kit connor vaping makes me miss my nics,GNFGRANDE,2022-05-03 18:44:01+00:00
492,1521561160415211521,junes brand vape pens,trashcanfucker,2022-05-03 18:43:44+00:00
493,1521560973831778305,the best thing abt hs is definitely americans being shocked they all vape .. bro they’re as british as it can be 😭,b0russia11,2022-05-03 18:43:00+00:00
494,1521560649394192385,Caleb Kennedy is accused of killing a man by barreling into him with his pickup truck after using a marijuana vaping device. https://t.co/qNoqv0JwI0,cambio,2022-05-03 18:41:42+00:00
495,1521560162464456705,im also upset about vape flavors or flavored tobacco decisions. they gonna take away my lucky charms next. my flavored sugary cereals,codyvasy,2022-05-03 18:39:46+00:00
496,1521560100741079040,vape or die,kiawe_bot,2022-05-03 18:39:31+00:00
497,1521560021859020800,getting my vapes today i am no longer sad,nayeond1ets,2022-05-03 18:39:13+00:00
498,1521559857614229504,"Daily fact about vaping: Vapes contain nicotine, which is chemical extracted from tobacco. Making it just as addictive as smoking cigarettes.
Please continue reading our posts for more information about e-cigarettes.
@MortonCivics",GencMorton,2022-05-03 18:38:33+00:00
499,1521559511198093314,bruv best ting ever: chattin bout atheism while drinking moonshine and smoking the Volcano vape at Glasto!,Wasteman_Bot,2022-05-03 18:37:11+00:00
500,1521559481611661312,Griner was detained at an airport in February after Russian authorities said a search of her bag revealed vape cartridges containing traces of cannabis oil. https://t.co/zKgH78W0F5,ksdknews,2022-05-03 18:37:04+00:00
501,1521559175440052224,babe what do you mean you don’t want a lanyard for your vape,hxnmovingcastle,2022-05-03 18:35:51+00:00
502,1521558822183178240,Every day i come home i really badly want to vape. Its tough,BecayTV,2022-05-03 18:34:27+00:00
503,1521558504452116483,It’s only day 2/5 for my no vaping or drinking cleanse. Man I’m struggling bad omfg😭😭😭,emm_michaell,2022-05-03 18:33:11+00:00
504,1521558443911438338,My vape looks like it doubles as a vibrator,_krisrobs,2022-05-03 18:32:56+00:00
505,1521558417885827078,Thoughts on smoking/vaping w covid?? #StonerThoughts,HeadySpirit,2022-05-03 18:32:50+00:00
506,1521558384935325697,the fact parents let their kids vape really confuses me ?,userbigfatrat,2022-05-03 18:32:42+00:00
507,1521558372901916673,Caleb Kennedy is accused of killing a man by barreling into him with his pickup truck after using a marijuana vaping device. https://t.co/HrRbym2DjL,HuffPostEnt,2022-05-03 18:32:39+00:00
508,1521557813721542657,Where tf do i get a vape. I need something to keep me going goddamn,CutsAndCals,2022-05-03 18:30:26+00:00
509,1521557749397483520,Griner was detained at an airport in February after Russian authorities said a search of her bag revealed vape cartridges containing traces of cannabis oil. https://t.co/YDM5WhoStu,13abc,2022-05-03 18:30:11+00:00
510,1521557724659535873,Why vape when you can sleep,Dont_Vape_Bot,2022-05-03 18:30:05+00:00
511,1521557478571331584,Vapes are just getting shittier and shittier. Eventually I’m just going back to smoking cigs lmao,kingchandougie,2022-05-03 18:29:06+00:00
512,1521557323369484288,i need a new vape 😭,bambii2325,2022-05-03 18:28:29+00:00
513,1521557260794617858,full charge na full charge vape ko tas lobat cp buti may pc HAHAHHA,Da_dadei08,2022-05-03 18:28:14+00:00
514,1521557254469820418,unpopular opinions: grape flavored vape is good and kit is ginger,juliettesblade,2022-05-03 18:28:13+00:00
515,1521557135083118600,"my state is so confusing,,, do i need to be 18 or 21 to buy vapes 🙄",nintxndou,2022-05-03 18:27:44+00:00
516,1521556671151095810,if ur like genuinely pissed at kit connor for vaping then idk what to tell you other than eat grass.,violetvinyI,2022-05-03 18:25:54+00:00
517,1521556595049648128,"Here's @CDoug on the menthol ban. Well-argued. Wondering: How effective  has the menthol ban in Canada been? Any unintended consequences? Did menthol smokers quit or turn to regular tobacco or go black market? #vaping #smoking
 https://t.co/sD7knPkc9M",MarcGunther,2022-05-03 18:25:36+00:00
518,1521556472013991937,men who vape are so embarrassing smoke a cigar like a real man,_BIueveIvet,2022-05-03 18:25:06+00:00
519,1521556285753286660,Smoking on backwoods bad for me but ion wanna smoke outta vape,SweetNaeJones,2022-05-03 18:24:22+00:00
520,1521555924820934657,just witnessed a pregnant woman hitting a vape,dehydratedclown,2022-05-03 18:22:56+00:00
521,1521555831069675520,GUYS MY VAPE JUST BURNT OUT PLS BUY ME NEW VAPE,lamiacals,2022-05-03 18:22:33+00:00
522,1521555689352617990,fans being mad at the celebrities they like for smoking/vaping is so weird to me,diobrxdx,2022-05-03 18:22:00+00:00
523,1521555667982688256,"Sister's heart is at 16%. They have to put a Stent in her. 

Of course doctor said it's from vaping and drinking energy drinks. 

Now my parents want me to quit vaping. If I quit vaping, I'm going back to cigarettes or drinking.",BLITZENTERPRISE,2022-05-03 18:21:55+00:00
524,1521555518569037827,the new pandemic is disposable vapes,rhielen,2022-05-03 18:21:19+00:00
525,1521555363711098880,why are we acting like grape is the worst vape flavour. it could’ve been lychee ice. take ur wins where you can get them xx,BR1TISHB0MBS,2022-05-03 18:20:42+00:00
526,1521555316642443270,new vape is “Icy Airhead” flavor 🤯,teethofangels,2022-05-03 18:20:31+00:00
527,1521555162959015936,kit i don’t even care that you vape but GRAPE?! There’s so many flavors and you choose GRAPE??! fukcing GRAPE of all the flavors do better kittrick,beloved1beeduo,2022-05-03 18:19:54+00:00
528,1521554829730095104,"I thought the halls at school smelled like vape, but it was just my own breath inside my mask",WreckaCenter,2022-05-03 18:18:35+00:00
529,1521554698070802433,"At least one good thing has come from the #JohnnyDepp trial! The frustrated vaping witness has now become #TikTok famous after his hilarious deposition. #RadarExclusive
https://t.co/1eyCdaEDSP",radar_online,2022-05-03 18:18:03+00:00
530,1521554600280657921,I need a vape fuck,karlahemmo96,2022-05-03 18:17:40+00:00
531,1521554369920913408,how is banning fLaVoReD vApEs gonna help anything…. bitch if anything it’s gon make shit worse kuz that’s my stress reliever😭😭😭😭,babbyenaa,2022-05-03 18:16:45+00:00
532,1521554350476349441,absolutely in shambles rn that kit connors favorite vape flavor is grape,PISCESSAP,2022-05-03 18:16:40+00:00
533,1521554007210307585,"Need a new nice  vape flavour that doesnt give me ptsd someone help? 
 Peach ice -covid
Watermelon-alcohol &amp; clubs
Blue ras -bad coughs
Pineapple was ass so is strawbs and cream",chelleskirby,2022-05-03 18:15:19+00:00
534,1521553801328607233,HSTWT ROASTING KITS VAPE FLAVOUR HAS ME IN TEARS,torisdrink,2022-05-03 18:14:29+00:00
535,1521553469253079041,why are people so pressed about kitkat vaping,harryscuddlebot,2022-05-03 18:13:10+00:00
536,1521553454052880385,odds i bring eunji a vape,appIepiesucks,2022-05-03 18:13:07+00:00
537,1521553342312460288,this guy ne a shaba his donut ka vape smoke😭😭😭😭😭😭some nasty work,le10taosen,2022-05-03 18:12:40+00:00
538,1521553303984906242,people act so cool when they vape while smelling like mango peach watermelon,STANlVE,2022-05-03 18:12:31+00:00
539,1521552937000046592,That moment you bond with fellow humans at the laundromat over accidentally washing your weed vape. Lady let me know it should still work because she’s already done it 😂,SuperMilkChan6,2022-05-03 18:11:03+00:00
540,1521552595055226880,if 30 of my moots sent me a dollar i could get a new vape 😭😭😭,222fried,2022-05-03 18:09:42+00:00
541,1521551934313873410,"Johnny Depp’s former doorman was driving a car and vaping during his video testimony in the Depp v. Amber Heard defamation trial — though, to be clear, the video consisted of a deposition recorded in January 2021, and was not live. https://t.co/EGVQNXxxA3",snopes,2022-05-03 18:07:04+00:00
542,1521550832608571392,Laying in the hood of your car while vaping at 2 am in the morning looking at the stars type of love.,Haadde_ss,2022-05-03 18:02:42+00:00
543,1521550618590158854,If you’ve never smoked or vaped you’re a W human,theKrabs_11,2022-05-03 18:01:51+00:00
544,1521550323097432065,these kids were having fun vaping infront of me and i had like nothing 🧍🏼‍♀️...,yooneysus,2022-05-03 18:00:40+00:00
545,1521550280856248321,TEENAGERS VAPE which is a big problem because unlike adults teenagers have undeveloped brains which can lead to more problems!,Dont_Vape_Bot,2022-05-03 18:00:30+00:00
546,1521550138195386368,"Bro: Do you ever think houses look like faces?
Me: Yeah
Bro, hitting his vape: Shit only stoners think about lol",shitheadsenpai,2022-05-03 17:59:56+00:00
547,1521550046461841410,She caught the vapers,mrchiraqLo,2022-05-03 17:59:34+00:00
548,1521549747726790656,"Can we, as a global society, start slapping the fuck out of people who vape in doors?",OgLundberg,2022-05-03 17:58:23+00:00
549,1521549744971165696,please can people stop vaping it’s so embarrassing,userbigfatrat,2022-05-03 17:58:22+00:00
550,1521549696740831232,wonder what we’re all gonna look like in a few years after puffing on these vapes,angelturleyxox,2022-05-03 17:58:11+00:00
551,1521549448127594499,"I walked into the bathroom at school. And. There were these two girls at the very back. And. They were vaping. And were like ""hey dont snitch."" And i was like ""ok"" but. Butbut. What if i said ok suspiciously and now they think im gonna snitch ☹️☹️",MangoTheClovvn,2022-05-03 17:57:12+00:00
552,1521549306192449536,Have you ever vaped 🧐,paz_1k,2022-05-03 17:56:38+00:00
553,1521548672093331460,If you stare at the abyss long enough eventually he’ll offer you a hit of his juul,realstepson,2022-05-03 17:54:07+00:00
554,1521548587376668672,The teacher only bathroom kinda smelling like Vape…. Sussy,Melonballer22,2022-05-03 17:53:46+00:00
555,1521548559077842946,kit having a grape flavored vape ruins my image of him. GRAPE KITTRICK?! WHY GRAPE?!?,L0VELYNELS0N,2022-05-03 17:53:40+00:00
556,1521548481973866497,"Wait we really shouldn’t be vaping in airplane bathrooms?? I thought that was more of a ‘try not to but if you gotta, make it quick’ situation. 
Ya know, like masterbating?",Super_Dope_Kid,2022-05-03 17:53:21+00:00
557,1521548392291344387,"Griner was detained at an airport in February after Russian authorities said a search of her bag revealed vape cartridges containing traces of cannabis oil.
 https://t.co/fdsoSP1ZeP",AKNewsNow,2022-05-03 17:53:00+00:00
558,1521548304483450880,If the doctor don’t hurry imma vape in this hoe,_tamiaclayton,2022-05-03 17:52:39+00:00
559,1521548251668885504,tbh idk why people are so mad at celebs vaping and smoking and just doing it in general like?? i dont vape or smoke but idc if others do or not its their choice,bloomingksw,2022-05-03 17:52:26+00:00
560,1521548053404135425,These dumb ass vape commercials be have me screaming 😂😂😂,Icunvteee,2022-05-03 17:51:39+00:00
561,1521547803599716352,i say i'm gonna quit vaping then 2 days later i pick it back up,ST4LKERZz,2022-05-03 17:50:40+00:00
562,1521547799581847552,need ko na ng vape puta can’t focuz n can’t isoy here inside d condo lol,louisejxne,2022-05-03 17:50:39+00:00
563,1521547401441460225,Wait apparently I just missed kit vaping??? A grape flavoured vape??? That's a lot to take in,wilbursgiggles,2022-05-03 17:49:04+00:00
564,1521547369128468481,What flavor of vapes do u think everyone brought to the met gala,lucys555,2022-05-03 17:48:56+00:00
565,1521547107701641216,ppl getting mad at kit connor for vaping is the 2022 version of the IT fandom losing their shit at that video of jack dylan grazer smoking weed. history truly repeats itself,halosdiscs,2022-05-03 17:47:54+00:00
566,1521547098893824000,i forgot to lock my vape before throwing it in my bag and it fired without me realizing and burnt a hole in my beats 🥲 wtf,rinichhu,2022-05-03 17:47:52+00:00
567,1521546441478520834,“am i the only one who doesn’t vape???😌😌😌” okay so would you like a medal for doing the bare minimum? for doing what you’re supposed to be doing?,emostarlordd,2022-05-03 17:45:15+00:00
568,1521546421392101376,There is no way kit connor is fucking up grape flavor on his vape.,xLightsUpLouis,2022-05-03 17:45:10+00:00
569,1521546421001805824,Risking a felony mailing my gf her favorite vape so if I go MIA I’ve been taken to jail,scoottyy_,2022-05-03 17:45:10+00:00
570,1521546372910047234,how are you vaping/smoking cigs but judging ME for smoking weed? atleast im getting high while getting cancer,raajaaaan,2022-05-03 17:44:58+00:00
571,1521546233944461315,Those vapes are literally causing peoples lungs to collapse! They truly deserve to be banned.,_chala1000,2022-05-03 17:44:25+00:00
572,1521546091233263629,just stole nicotine fluid and spiked my vape with it so when am drunker I will be fooled and accidentally get a rush,vxdkacals,2022-05-03 17:43:51+00:00
573,1521545976133353472,big tobacco really been lacking because why is there no cigarette flavored vape,groovylmfao,2022-05-03 17:43:24+00:00
574,1521545716459610112,Warren threw my vapes away 😩😩,devann_b,2022-05-03 17:42:22+00:00
575,1521545617008340993,YALL I CAN BLOW O’S ON MY VAPE NOW,yunhosbackwash,2022-05-03 17:41:58+00:00
576,1521545195149479937,this man is tryna vape discreetly in wingstop n doing a terrible job,BEXXXNEXTDOOR,2022-05-03 17:40:18+00:00
577,1521545149226045442,"Spacing out my vape hits so that way when I do hit it, it makes me feel like shit &amp; makes me not wanna hit it again :) science lol",Colbiiii,2022-05-03 17:40:07+00:00
578,1521544198884933632,so I see the hype over vapes now 😂,tamerra_davis,2022-05-03 17:36:20+00:00
579,1521543790389047298,Why are disposable vape pens even legal? That's a lot of electronics for a disposable product.,jackfifield,2022-05-03 17:34:43+00:00
580,1521543641181061120,"Breath of 420 vaping
69th form

Joe",tanjiro_auto,2022-05-03 17:34:07+00:00
581,1521543512839262209,dragons vape,lilith_en,2022-05-03 17:33:37+00:00
582,1521543265190776833,kit connor pls discover a vape flavor that’s NOT grape,hugss4kit,2022-05-03 17:32:37+00:00
583,1521543106939789314,"It can seem daunting to want to make a difference as a teenager, but our #BeVapeFree hero Rithika knows that students can use the power of advocacy to create change! Learn how students can take a stand against vaping in our new Virtual Field Trip! https://t.co/Ls9M9FVE3y https://t.co/lc8izRHuxz",DiscoveryEd,2022-05-03 17:32:00+00:00
584,1521543090208653313,Y’all and these vapes be killing me 😂😂,de_matt23,2022-05-03 17:31:56+00:00
585,1521543021250199556,"I don't care if the vape juice tastes like literal vomit, as long as it gets me high",LibLoather,2022-05-03 17:31:39+00:00
586,1521542725627174913,“you are what you eat” i am now ur mum #roasted #urmum #vape 🔥🤑,bestiehrry,2022-05-03 17:30:29+00:00
587,1521542654881935362,Griner was detained at an airport in February after Russian authorities said a search of her bag revealed vape cartridges containing traces of cannabis oil. https://t.co/qXe3ZXZvYp,CBS8,2022-05-03 17:30:12+00:00
588,1521542647571226626,bitches look at me like i am a juul,miss_daddi,2022-05-03 17:30:10+00:00
589,1521542636196311042,Griner was detained at an airport in February after Russian authorities said a search of her bag revealed vape cartridges containing oil derived from cannabis. https://t.co/FRQt1QXWZX,WNDU,2022-05-03 17:30:08+00:00
590,1521542606693580801,"Mr Salt has the finest salts available with over 15 flavours to choose from they have a wide range of exclusive flavours. 

Shop Now at: https://t.co/mAiUfRLRo8

📩 Email: info@ukvaporwaves.com
☎️ Contact Number: 07417527519

#ukvaporwaves #vape #vapeshop #eliquid #smok #Ecig https://t.co/ChWsGdXlAe",ukvaporwaves,2022-05-03 17:30:00+00:00
591,1521542441358163968,KIT CONNOR'S VAPE FLAVOR WAS GRAPE ????,grey_the_poet,2022-05-03 17:29:21+00:00
592,1521542437780480000,kit connor's (apparent) favourite flavour of vape is grape. i can die happy,heartdroppers,2022-05-03 17:29:20+00:00
593,1521542268708134913,THE VAPE WAS GRAPE FLAVOR??,livlovescs,2022-05-03 17:28:40+00:00
594,1521541910061625344,The vaping dude that gave his testimony at the Johnny Depp and Amber Heard trial has a TikTok and it’s just as amazing omg #JohnnyDeppAmberHeardTrial #johnny #johnnydepp #AmberHeard #DeppVsHeard #DeppvHeard #DeppHeardTrial #JusticeForJohnnyDepp #JusticeForJohnny,archanaprasanna,2022-05-03 17:27:14+00:00
595,1521541822262222856,surely people are not genuinely upset with kit connor for vaping he is eighteen and british Obviously he owns a geek bar dont get ur knickers in a twist,fourleafdream,2022-05-03 17:26:53+00:00
596,1521541777622290432,"The U.S. State Department has determined that Russia has wrongfully detained American basketball player Brittney Griner, a department spokesperson said in a statement. Russia said it had detained Griner in February for possession of vape cartridges containing hash oil.",cgtnamerica,2022-05-03 17:26:43+00:00
597,1521541344304508935,Bitch I use to smoke vapes everyday but recently just the smell makes me nauseous 🤢,rosearyss,2022-05-03 17:25:00+00:00
598,1521541093510324224,"Many students may want to take a stand against vaping, but don’t know how to start. Our #BeVapeFree teen hero Robin has suggestions for students who are interested in advocacy, like organizing round table discussions. Hear more from him here &gt;&gt; https://t.co/Ls9M9FVE3y https://t.co/GHSIskFgW4",DiscoveryEd,2022-05-03 17:24:00+00:00
