,TweetID,TweetContent,TweeterUsername,TweetDatetime
1293,1521401612346208256,"""while the liquids/pods were “tobacco products,” the vapes themselves were technically not. So, as long as any ads were only advertising the vape itself, and not the tobacco-containing pods or liquids, it was all fair game.""

https://t.co/Sa78ZGHDs2",CriticTeArohi,2022-05-03 08:09:45+00:00
1294,1521401557782495232,vape or die,kiawe_bot,2022-05-03 08:09:32+00:00
1295,1521400888627437569,Vape juice in the ground in the motor,lynchad28,2022-05-03 08:06:52+00:00
1296,1521400830808580097,"Part 3 of the European awareness campaign aimed at educating smokers about the harm reduction potential of #vaping . 

👉 The difference between vaping and heated tobacco.

More information here: https://t.co/bPmLV6w5qu https://t.co/g4Bi0Xv9dA",europeanvaping,2022-05-03 08:06:38+00:00
1297,1521400131031126016,I pass a couple of secondary schools on the school run every day. An ever increasing number of children seem to be vaping on the way to school. I'm sure more kids are vaping now than smoked when I was at school in the 80s &amp; 90s. Am I right?,hicksyalex,2022-05-03 08:03:52+00:00
1298,1521399840868950016,hey guys i vape,finley_ebooks,2022-05-03 08:02:42+00:00
1299,1521399708358377472,"Guys all my vapes died and my plug stopped selling, this is the end for me 😭 https://t.co/qtN6jeSOqs",DBae221,2022-05-03 08:02:11+00:00
1300,1521399674909110272,3ml cannabis disposable vape https://t.co/TjqnPrE4Jf,WinyJay3,2022-05-03 08:02:03+00:00
1301,1521399640964296704,Why can’t I feel it when I smoke or vape I hate it,BisexualBrio,2022-05-03 08:01:55+00:00
1302,1521399483220873217,"Good Morning #GAMEONFAM! 

What vape flavour are you using today❓

Let us know in the comments! 💨",GAMEONJUICE,2022-05-03 08:01:17+00:00
1303,1521399415587880960,Welp got 4 hours left on my shift and my god damn vape just broke,daddydeanherb,2022-05-03 08:01:01+00:00
1304,1521399214349107200,"Mixed fruit flavor or Single fruit flavor?
Which one will be your daily choice?

💥3000 puffs/1.2Ω mesh/1400mAh/9ml/MTL/RDL

😲Don't miss our GAW 👇
Check the top tweets
.
.
#bmorringo #bmorvape #vape #vapenation #vapefam #vaping #vapelife #vapecommunity #disposablevape https://t.co/m4yJp7Rrr2",BMORVAPE,2022-05-03 08:00:13+00:00
1305,1521398811867844608,The Great Vape off Kanagawa https://t.co/kO1u5OvmTw,Fandombase,2022-05-03 07:58:37+00:00
1306,1521398725268033536,Steady drip-drip-drip of clinical &amp; population studies showing #vaping much safer &amp; game changer for reducing deadly smoking. Makes it increasingly difficult for vaping deniers to keep going. Reminds me of politicians in 2003 who just knew Iraq had WMDs! https://t.co/BzQZkU76LJ,AlexWodak,2022-05-03 07:58:16+00:00
1307,1521398525304705024,her &amp; thay damn vape bro 😂 SHEEESHHH THOOO 😍 https://t.co/Y1UpUrhDfa,jorgeeeeee69,2022-05-03 07:57:29+00:00
1308,1521398497165312001,this vape pen was a great investment. i may go back and get 2 more flavors.,__regidrago,2022-05-03 07:57:22+00:00
1309,1521398448007745536,"New paper! 📢🚨Impact of Smoking and Vaping in Films on Smoking and Vaping Uptake in Adolescents: Systematic Review and Meta-Analysis - Zeinab M. Hassanein, Alexander B. Barker, Rachael L. Murray, John Britton, Sanjay Agrawal, Jo Leonardi-Bee, 2022 https://t.co/WB3FnBGNxV",abbarkerpsych,2022-05-03 07:57:10+00:00
1310,1521397949128867841,"unsay flavor saimong juice sa vape, mareng @DojaCat ?? https://t.co/wpMfqtssUh",zetteeesu,2022-05-03 07:55:11+00:00
1311,1521397117725843457,Violently gagging on my vape after being yelled at by text message. Love my job,FireEscapeLord,2022-05-03 07:51:53+00:00
1312,1521396479839010816,Ikhal Vapes Love https://t.co/ObIaKdkBgP,HetfieldKikop,2022-05-03 07:49:21+00:00
1313,1521396240810127360,i would rather my dad find my vape then find out what i be doing w my friend,disamster,2022-05-03 07:48:24+00:00
1314,1521395858713247744,now why is kit connor vaping the third thing that comes up https://t.co/OAQifKnQzE,wiIhelmscrown,2022-05-03 07:46:53+00:00
1315,1521395801699672064,"also on sunday i ""honked"" on multiple vapes at the combination natural wine store/internet radio station/ taco bell

je suis zoomér",maine_offender,2022-05-03 07:46:39+00:00
1316,1521395649106694144,"DAD: want a sex?
ME: Ugh. jorts stans...
DAD: Ghost vape &amp; focus.
ME: wtf is a sneaky link you'sex 24",WeirdConvoBot,2022-05-03 07:46:03+00:00
1317,1521395410480386049,"#edibles #cbdoil #prerolls #cannabis  #vapejuice #cannabiscommunity Liquid Gold Vape Juice [5ml] - Jungle Juice

New and improved formula, now with more CBD! Liquid Gold CBD Vape Liquid Jungle Juice Flavor [5ml] is the CBD vape liquid https://t.co/xoXY58xTnK #cbdedibles #delta8 https://t.co/c4VKkYPEAf",CBDSmokeShop,2022-05-03 07:45:06+00:00
1318,1521395403425464321,"Commonly described as 'the Amazon of #vape_juice' #indeJuice_vaping holds one of the largest collections of direct-to-consumer #e_liquids in the world.

✨ SEE REVIEW : https://t.co/R17jOg57eS

🔎 SEE OFFER : https://t.co/CrAQ12cGV8 https://t.co/ptOmGwi2Xb",PrimeSiteUK,2022-05-03 07:45:04+00:00
1319,1521395104627318784,fuck vaping. this is what all the cool kids do https://t.co/xjnWAycwSF,theMemesBot,2022-05-03 07:43:53+00:00
1320,1521394765241413632,"Petition for Momota-chan to stop fucking vaping at breakfast, I'm trying to eat eggs but I'm trapped in a Berry Blast Vape Cloud",botkichiouma,2022-05-03 07:42:32+00:00
1321,1521394695145857024,not my relatives just vaping with my grandfather pls,frnechfires,2022-05-03 07:42:16+00:00
1322,1521394443135422465,My little czn took my Vape n i tell u it’s not a mubarak eid for me today,rollopollox,2022-05-03 07:41:16+00:00
1323,1521393862433927168,Take it from this tweet that you support availability of 95% safer #vaping being much more restricted in Australia than deadly cigarettes but sensibly afraid to admit this publicly. If I’m wrong please say so @ColinMendelsohn @drjoesDIYhealth https://t.co/K9Lk7b88Ow,AlexWodak,2022-05-03 07:38:57+00:00
1324,1521393730866999296,You know what's funny? Kpop stans getting mad when their favs smoke or vape saying that they are setting a bad example but y'all are so desensitized to them drinking ALCOHOL on live.,Bluelovesick,2022-05-03 07:38:26+00:00
1325,1521393494933196801,"BedWars Script VAPE V4 - KillAura, AutoUpgrade Hack &amp; MORE https://t.co/49uyiMfPNa",mangoharry28,2022-05-03 07:37:29+00:00
1326,1521393447051350016,coke-kape-juice-vape yes let’s all die,mariaajj__,2022-05-03 07:37:18+00:00
1327,1521393375378771968,not arguing with nb that vapes i’ll thow a cig at you ho,ykmina9,2022-05-03 07:37:01+00:00
1328,1521393133749215233,"Don’t miss the monthly vaping podcast from ⁦@jhb19⁩ and colleagues!

https://t.co/zYluIoqpEP",NCSCT,2022-05-03 07:36:03+00:00
1329,1521393037653704704,"CABOO was designed by AFJ team, there are many features about the vape, 3ml big capacity, better technology of atomization, preheat function, suitable for all cannabis oil. PM if interested.#vape #cbdvape #thcvape #delta8vape https://t.co/vwtBK0v4E3",afjvaping,2022-05-03 07:35:40+00:00
1330,1521393005373972481,I’m probably gonna go ask some dude to buy me a vape or something. Idk,emptylittlesoul,2022-05-03 07:35:33+00:00
1331,1521392528355856384,vapes dying😔,annetwistsbff,2022-05-03 07:33:39+00:00
1332,1521392175082184706,shouldn't went to vape sia fuck HAIS WASTED,yourhomeboyzan,2022-05-03 07:32:15+00:00
1333,1521391944923983872,We supply Dank vapes cartridges and offer vape customers with ton of astounding and incredibly potent flavors. We carry the biggest and supply of vape cartridges Online. For more information about empty vape cartridges visit https://t.co/TbJwhfi5ZX,xosowo1,2022-05-03 07:31:20+00:00
1334,1521391660944576513,my vape got me up at 3:30am looking for that damn thing cause i can’t fall asleep without it,tedsyjune,2022-05-03 07:30:12+00:00
1335,1521391648244375553,"TRPR review has acknowledged #Vaping as a crucial tool 🙌

The UK Vaping Industry Association (UKVIA) submitted their recommendations to the TRPR consultation, which included collaboration from Evapo.

🗞️ Find out more here: https://t.co/QaPtjGs0iE

#VapeNews #VapingNews https://t.co/sUV2z6dNCe",EvapoHub,2022-05-03 07:30:09+00:00
1336,1521391631806918657,Why vape when you can sleep,Dont_Vape_Bot,2022-05-03 07:30:05+00:00
1337,1521391105484369920,wasted go vape if not dapat kaching kaching 🙂,yourhomeboyzan,2022-05-03 07:28:00+00:00
1338,1521391056436494337,late night snack (my vape),miIanmagica,2022-05-03 07:27:48+00:00
1339,1521390937787670528,Seriously WHY DO YOU ALL CARE IF HE'S GAY OR IF HE'S VAPING NEXT YOU'RE GONNA YELL AT HIM FOR POOPING i was just searching for a tweet anfmd seeing this is just making me wanna slap someone https://t.co/U5763yhkAP,bananashark80s,2022-05-03 07:27:20+00:00
1340,1521390552998359041,"Is there a vape that smells of nuts as I know someone who thought they had a nut allergic reaction from going past someone blowing out vape smoke ?

These chemicals in smoking of cigarettes and vapes maybe should be named on the packet so people know what they are breathing https://t.co/tRzae3i6Zy",Szeal2,2022-05-03 07:25:48+00:00
1341,1521390482261438464,Top 10 Reasons You Should Try Blu Electronic Vaping Accessories https://t.co/WJLJMpPvzy #bluvaping #myblu,listland,2022-05-03 07:25:31+00:00
1342,1521390321543921665,"my friend called kit ugly last week and now, after seeing the vid of him vaping, she thinks he’s the most attractive person ever. is now a good time to gatekeep?",hveartstopper,2022-05-03 07:24:53+00:00
1343,1521389914314907649,"my dad my mom &amp; my abg ade vape , my pod dabes so my mom pinjam me hers GAHAHAH CUTE",qqyyxo,2022-05-03 07:23:16+00:00
1344,1521389712463826944,"Butter 👊

There ain't any other range quite like it! The problem is choosing which one to fill your vape with...real problems.

🛒 https://t.co/MEM1MRSJik 🛒

#Supergood #WeAreSupergood #Vapers #Vape #Vaping #GlazersOut #MetGala2022 https://t.co/DMNt46bOtX",wearesupergoodd,2022-05-03 07:22:28+00:00
1345,1521389441742524417,Mcdonald's vape,BenLutyBot,2022-05-03 07:21:23+00:00
1346,1521388838177763328,Vape smoke also makes a lot of smoke ! https://t.co/5znsgoZIGP,Szeal2,2022-05-03 07:18:59+00:00
1347,1521388800064516097,Im ready to go home 😂my vape dead i wanna drink some more and its hot in this house,naee_o5,2022-05-03 07:18:50+00:00
1348,1521388776362151936,i lowkey want this girl but she vapes 😭😭😭😭😭😭,babasnatcherx,2022-05-03 07:18:44+00:00
1349,1521388431581925376,"i can’t cry to beach life in death like i want to because it’s too associated with good feelings :,) my gf listen to it a lot in the car and we dance to it and stuff + hitting her vape listening to it all makes a very pleasant feeling when i listen to it now",L1PGL0SSHONEY,2022-05-03 07:17:22+00:00
1350,1521388004539244545,ang cravings po natin for today ay vape,arachneeeeeee,2022-05-03 07:15:40+00:00
1351,1521387980744658944,constantly avoiding ever taking a hit from someone's vape simply because i know i cannot afford a developing nicotine addiction🤩,OGCHANELBAG,2022-05-03 07:15:35+00:00
1352,1521387589718396930,Rare picture of Christopher Reeve holding a green vape pen 🙀🙀 https://t.co/xz7VBguUPJ,SupermanEnjoyer,2022-05-03 07:14:02+00:00
1353,1521387344527773697,note: don’t vape after working out,sunnberri,2022-05-03 07:13:03+00:00
1354,1521387062330597378,"Sad thing , my daughter told me yesterday she was face timing her friend and her friend was vaping on camera. 11 years old man",BtcStonks,2022-05-03 07:11:56+00:00
1355,1521386771887824896,"And another from @AshOrgUK and partners on vaping in pregnancy 

https://t.co/1OYYqkozwx",NCSCT,2022-05-03 07:10:47+00:00
1356,1521386499509743618,"Of 4753 smokers who tried to quit from 2015-2021 in England:

1⃣510 quit with #ecigs = 60% of total quitters✅
2⃣186 with OTC NRT
3⃣108 with prescription meds
4⃣78 with other support

Confirms massive population effect of #vaping vs other quit aids
https://t.co/K6i3luDECS",ColinMendelsohn,2022-05-03 07:09:42+00:00
1357,1521386457247928321,vape nation,kiawe_bot,2022-05-03 07:09:32+00:00
1358,1521386226636500993,"Does the JustFog Q16FF Kit really ""Focus on Flavour""? (that's what the ""FF"" stands for BTW!) Our Neil @ncboreas has the mission to find out - read his review here... https://t.co/kLpQRbNoy3 #JustFog #Q16FF #Vape #Ecigclick https://t.co/shvRHRWjLK",EcigClick,2022-05-03 07:08:37+00:00
1359,1521386115944435712,imagine hitting ur vape in the passenger seat of your friends car and they crash while it’s in your mouth and the airbag shoots it down ur throat. that must have happened to some ppl by now.,Jmartiann,2022-05-03 07:08:10+00:00
1360,1521385991314952193,i wanna quit vaping but i’m not a quitter,xobaedrian,2022-05-03 07:07:40+00:00
1361,1521385708023390208,there’s no good vape flavours at my shop i always just be getting energy ice but where’s all these fruity tooty unicorn rainbow flavours i keep seeing on tiktok 😭,kkbutterfly27xx,2022-05-03 07:06:33+00:00
1362,1521385611311316994,Exciting Announcement: Loving The Plant -- Cannabis Vape Brand Friday's Are Back. by Jessi Cox https://t.co/6KGFWsYWBG,cannabisseeds_,2022-05-03 07:06:10+00:00
1363,1521385607750107137,Vape shop guy https://t.co/swDTIrKpCx,IAmPhilChapman,2022-05-03 07:06:09+00:00
1364,1521385594169204738,Why would you play an MMO if you don't want to trade vape secrets?,monfacbot,2022-05-03 07:06:06+00:00
1365,1521384754641137665,my high ass really just said where did my vape go and looked for it only to realize it was in my other hand,dani_lou_hoo,2022-05-03 07:02:46+00:00
1366,1521382068667641856,"kitten corner i don’t care what colour ur hair is or what the flavour of ur vape is just tell me, apple juice or orange juice @kit_connor",hugsf0rdream,2022-05-03 06:52:05+00:00
1367,1521381638026182656,I noticed that you guys were deciding to vape instead of smoke our very healthy and delicious... cigarettes.,botppio,2022-05-03 06:50:23+00:00
1368,1521381411130806274,when the chorus in lügen hits &amp; you weren't ready &amp; you choke on your vape,brainwormboy,2022-05-03 06:49:28+00:00
1369,1521380865913151488,i’m just vaping with a pregnant woman at the bus shelter and she wants to know my credit score,Hooeylewis1,2022-05-03 06:47:18+00:00
1370,1521380494335692801,vaping just isn’t attractive or cool im sorry,ktlrosies,2022-05-03 06:45:50+00:00
1371,1521380472009498624,"my mom said i should start taking voice lessions again over the summer so i have something to do besides watch babies, and like im not opposed but like if i do i should probs quit vaping too and idk if i have the willpower to do that lol",kaylenaaaaa,2022-05-03 06:45:45+00:00
1372,1521380358037860353,"i can smell vapeeee here sa balay, wala namang ga vape na strawberry ang scent",chemtrailszs,2022-05-03 06:45:17+00:00
1373,1521380213820518400,sad sia my vape lost,eltokyyo,2022-05-03 06:44:43+00:00
1374,1521380149337407488,I've Been Catching Up On The Depp Trail Through The Week At First I Was Thinking It's Gonna Be A Very Serious Type Of Trial Then I'm Hearing Stuff About Shit On A Bed That Supposedly Their Dogs Did But Didn't To A Witness Vaping On Cam Lol It's Crazy But Entertaining #DeppvHeard https://t.co/6hYP56zFWN,Shadow13Nicky,2022-05-03 06:44:28+00:00
1375,1521380012858900480,"SAlt is just a bunch of soc majors holding no-touch top only orgies where they hold hands, light candles, and vape, so they are leaving the org to fight the Israeli state in Gaza",DSAInfighterBot,2022-05-03 06:43:55+00:00
1376,1521379831283286016,"Ceramics CBD Vape
E-cigarette manufacturer in China!
Welcome to get more information! https://t.co/c4xHZgzrEs",Lydia2022kk,2022-05-03 06:43:12+00:00
1377,1521379767408283650,Stabbing a hole in my vape and shotgunning the juice so it kills me quicker,ipsumdolorable,2022-05-03 06:42:57+00:00
1378,1521379624764194816,ok i been pulling all nighters for the entirety of finals week so take this as you will but i swear i just saw my cat vape,jackiebrucee,2022-05-03 06:42:23+00:00
1379,1521378283153096704,"i think i j helped a 14 year kid quite vaping, i feel proud.",giopulu,2022-05-03 06:37:03+00:00
1380,1521378186407432198,"Pills and Juuls and speed
Your little purse a pharmacy
And hide behind these things
So no one sees you not getting...",stvincentlyrics,2022-05-03 06:36:40+00:00
1381,1521378089153949696,"Aokit haha xxl 2800 puffs disposable vape pen, 
12 flavors: 1. Lush ice 2. Peach ice 3. Cotton Candy 4. Mango Ice 5. Blueberry ice 6. Banana ice 7. Guava ice 8. Strwaberry banana 9. Strawberry watermelon 10. Strawberry Raspberry Ice 11. Rainbow candy 12. Cool Mint #vape #puff https://t.co/oIzuUq1HoV",julia121499,2022-05-03 06:36:16+00:00
1382,1521377846974836736,heartstopper fans r abt to start vaping n call themselves “kit kinnies”,Hazings_Comet,2022-05-03 06:35:19+00:00
1383,1521377751785254912,"butters was pimpin and taking care of his hoes at one point, so ofc he started selling vapes to kindergartners on the playground lmfao",mindlxss_,2022-05-03 06:34:56+00:00
1384,1521377477385277441,"so my vape died, thus ima try to quite nicotine... ill be back in 24 hrs to report my failure https://t.co/f0sLc6Wyv2",brokebackboys,2022-05-03 06:33:51+00:00
1385,1521377457894354944,Funny what they did to juul considering shit like this https://t.co/9c77yGIiNG,bigtthehammer,2022-05-03 06:33:46+00:00
1386,1521377301992284160,I love this site! @eightvape has the best #deals for our #Vapers #VapeFam https://t.co/zQ1ZiePBpC,Gavzmom,2022-05-03 06:33:09+00:00
1387,1521376905047457792,"Our #Smoking pack allows young people to explore the reasons &amp; pressures as to why some people may choose to smoke &amp; vape, tackle the myths around smoking &amp; understand the risk &amp; harm smoking, vaping &amp; cannabis can cause.

#PSHE #RSHE #YouthWork

https://t.co/C724oLq581 https://t.co/cpNqihE9JR",WhatsTheDebate,2022-05-03 06:31:34+00:00
1388,1521376007906729986,"me, drinking a grape soda, smoking grape vape juice and wearing all purple clothes: plan is working",puddleofbrain,2022-05-03 06:28:00+00:00
1389,1521375446646071297,Hoes when the vape pen fall in the toilet and they go swimming in to save it https://t.co/Hr69mA2SKm,zwafflezV4,2022-05-03 06:25:46+00:00
1390,1521374878712188931,"Well now that Ramadan is officially over, back to buying a new vape every other day I guess",moeab23,2022-05-03 06:23:31+00:00
1391,1521374482765602816,"idk what it is about this pic that gets me. the vape on the bed, the target skirt, my dogs r out, abbi’s 626789 trillion cords by my dogs https://t.co/vuQ0MGpxyX",ginatingz,2022-05-03 06:21:57+00:00
1392,1521374176468094977,me and my disposable vape against the world,aishwarryaaa,2022-05-03 06:20:44+00:00
1393,1521373706706362369,"May is lung awareness month. 
Our lungs are one of our most important organs, so we need to look after them! 

Think vaping is safer than smoking? Think again! Do you know what you’re vaping? https://t.co/uqCaFCwDDx",WestSydHealth,2022-05-03 06:18:52+00:00
1394,1521373518524403713,It’s RELATIVE ease that really matters. In rational world governments would try nudging smokers FROM deadly cigarettes to 95% safer #vaping. Are you not troubled nudging people from safer vaping back to deadly smoking? What if this was one of your loved ones? https://t.co/Vg3lXUtjMu,AlexWodak,2022-05-03 06:18:07+00:00
1395,1521373351834488832,Hits vape,kamvazz,2022-05-03 06:17:27+00:00
1396,1521373288781557761,nothing beats the JUUL tho https://t.co/DT3l6cvhoY,willdabeast_eth,2022-05-03 06:17:12+00:00
1397,1521372622986129408,so it turns out the couch vape was live resin https://t.co/Vfta87Qjwe,girldrawsghosts,2022-05-03 06:14:33+00:00
1398,1521372544422526979,this the same mf that was shaking when he held a vape and said he'll try for the first time which he ended up not doing https://t.co/zfZQ0KidBu,HaidarPinkman,2022-05-03 06:14:14+00:00
1399,1521372191358554112,": go out serve water to my cousin ❌
: stay in room vape ✅",tejeh_15,2022-05-03 06:12:50+00:00
1400,1521371784364314625,This vape is tasting extra nxa today,Farhaan_05,2022-05-03 06:11:13+00:00
1401,1521371701937848321,Tiktokers clutch their vapes in their hand like it’s a limb,HVZ3D,2022-05-03 06:10:54+00:00
1402,1521371628344688641,I’m a faggot and I don’t understand how people use those huge WWII walkie talkie lookin vapes that blo,joeyculobot,2022-05-03 06:10:36+00:00
1403,1521371457015537664,"It's such a shock seeing people my age smoke cigs, like why did you do that, when did you start??? smoking is so expensive and bad for you, like at least vaping is cheap (in comparison) and is not yet known how bad it is, but cigarettes are just bad and taste bad ew",BatMilk777,2022-05-03 06:09:55+00:00
1404,1521370784983179265,I see why TSA let me though dirty. They STOLE my squares and my fucking vape. 😂 Pay them more please! Thirsty motherfuckas.,MetaSmith,2022-05-03 06:07:15+00:00
1405,1521370668125745153,just inhaled smoke from my vape through my nose what the hell,kslvvr,2022-05-03 06:06:47+00:00
1406,1521369740844883969,Going to lose my mind if I see one more Subaru vape joke on the Xbox X tweets,TheSubaruBot,2022-05-03 06:03:06+00:00
1407,1521369057575931904,"Don’t Vape, instead play some EPIC Minecraft",Dont_Vape_Bot,2022-05-03 06:00:23+00:00
1408,1521369044217212928,Why your school needs a vaping sensor solution from Verkada https://t.co/XixhiWAFce,MLRNetworks,2022-05-03 06:00:20+00:00
1409,1521369042124087296,Doja is gonna have lung disease if she keeps vaping oml https://t.co/Zxy64CZHpW,Sawneythetitan_,2022-05-03 06:00:19+00:00
1410,1521368850872160256,i want lip filler sooo bad but u can’t like vape or drink out of a straw for a bit and my oral fixation is obviously out of control ……….,j0lier0liep0lie,2022-05-03 05:59:34+00:00
1411,1521367727268450304,"Vaping among students across Central Coast schools becoming harder to crack down
https://t.co/DncFy75xBf",SmokeFreeMY,2022-05-03 05:55:06+00:00
1412,1521367665478098944,i was finna lose my weak ass mind without dis fuckin vape bro,n8sinatra,2022-05-03 05:54:51+00:00
1413,1521367578274316289,Literally a British teenager living in London of course he's vaping and he's slaying during it so https://t.co/O1TzdTsAQn,elysianloverboy,2022-05-03 05:54:30+00:00
1414,1521367334031544320,"Me handling my anxiety be like:

How my vape looks:     vs   How it should look. https://t.co/kzFqfsZ2T6",JedMuan,2022-05-03 05:53:32+00:00
1415,1521366898931384320,just remembered that i had a dream about my vape falling in the toilet,defnotshama,2022-05-03 05:51:48+00:00
1416,1521366728646688768,Youth Vaping is Posing a Serious Risk  https://t.co/Z1Wf5kNvgB,SmokeFreeMY,2022-05-03 05:51:08+00:00
1417,1521366390829158400,"Is @GlennHowerton side hustle, masquerading as a cartoon for a vape company in the UK? @RMcElhenney @TheSunnyPodcast @alwayssunny https://t.co/7Ydrzw6b0M",dickybow1984,2022-05-03 05:49:47+00:00
1418,1521366332360511489,This guy is vaping in the emergency room 😂😂😂😭💀,emiilygervais,2022-05-03 05:49:33+00:00
1419,1521365412079931392,stop bashing kit cause he vapes. so what. he’s a fucking adult leave him alone. ive seen people say they won’t like him anymore because he vapes. it’s his life just let him live,luvmatteoo,2022-05-03 05:45:54+00:00
1420,1521365237190041600,Maryland school district suing vaping company Juul claiming 'gross negligence' https://t.co/WBxxEMAqNI,fox5dc,2022-05-03 05:45:12+00:00
1421,1521365203358826496,Vaping among students across Central Coast schools becoming harder to crack down https://t.co/Dr8lEf3fEv,ksbw,2022-05-03 05:45:04+00:00
1422,1521364920264278020,"#edibles #cbdoil #prerolls #cannabis  #vapejuice #cannabiscommunity Unflavored Diamond CBD Oil 1000mg can be used as CBD oral drops (CBD tincture). In vape liquid, topically or added to foods. Diamond CBD Unflavored CBD Oils are infused https://t.co/BjV7P6VdT8 #cbdedibles #delta8 https://t.co/RA3vdepRUk",CBDSmokeShop,2022-05-03 05:43:57+00:00
1423,1521364830015348736,every. single. night. i lose my vape in my sheets &amp; then fling my sheets around looking for it &amp; then hear it smack against the wall 🙃,lexipagee,2022-05-03 05:43:35+00:00
1424,1521364425256718336,Just Vaping Bruh 🤡 https://t.co/LKGGDDM2BU,Proxiouslol,2022-05-03 05:41:59+00:00
1425,1521364405061042177,If you vape you a bitch a whole bitch and nothing BUT a bitch https://t.co/sXuW4Nc5HB,WashedByDak,2022-05-03 05:41:54+00:00
1426,1521364295585517569,Fuck vapes,WashedByDak,2022-05-03 05:41:28+00:00
1427,1521363543672582144,"Smokin on grapes, rollin up swishers no vapes",209_Jose,2022-05-03 05:38:29+00:00
1428,1521363161177198595,trynna do all the old vape tricks i used to do now i have a nic high 🥲,nikisha808,2022-05-03 05:36:57+00:00
1429,1521363106915827712,"FUNERAL DIRECTOR: YOU'RE NOT EVEN DEAD YET
ME: IRRELEVANT. ANYWAYS, I WANT MONDO OOWADA TO CHRISTEN MY GRAVE BY VAPING ON MY TOMB",ISHIMARU_ENG,2022-05-03 05:36:44+00:00
1430,1521363022220079107,"Thinking about the time I hid my vape in my bra, forgot abt it and it fell out right infront of my mom and we both just stared at the it on the ground together.",Mirnarhea1,2022-05-03 05:36:24+00:00
1431,1521362693273260032,if any of my relatives ltr dont smoke/vape imma go kms who am i gnna go sb w,R7NN4,2022-05-03 05:35:06+00:00
1432,1521362405024018439,"After the partial #evacuation from #Azovstal #Mariupol, the #enemy continues to #fire on the  buildings where #civilians hiding.
 @UN @antonioguterres @HoxhaFer @USAmbUN @mona_juul
@NDeRiviere @HaroldAgyeman
@ambtstirumurti @AmbMKimani
@POTUS
🆘DON'T YOU STOP YOU CAN DO THIS 🆘 https://t.co/9nUTiDgrCy",_bilka,2022-05-03 05:33:57+00:00
