,TweetID,TweetContent,TweeterUsername,TweetDatetime
0,1521640718435078146,Kids are vapers on one.,lab_ebooks,2022-05-03 23:59:52+00:00
1,1521640490612846594,"obtained coke zero 
refilled vape 
put on a dark academia playlist 
time to knock out this thesis",sunflowerlbs,2022-05-03 23:58:58+00:00
2,1521640400733224960,"Bro, bro, can I get a hit off your Juul please bro?  https://t.co/M6bADi2bIZ",dluque,2022-05-03 23:58:36+00:00
3,1521640006586142720,what’s everyone’s favourite vape flavour? x,litxllsk,2022-05-03 23:57:02+00:00
4,1521639613751824388,need a girl with no goals or aspirations who just sits in bed all day vaping like a savage and snapchatting,stinkylittlehog,2022-05-03 23:55:29+00:00
5,1521639567400579073,Today in the Psych ER waiting room a NYPD officer hit his Juul while escorting a patient in.,SaraAnneEats,2022-05-03 23:55:18+00:00
6,1521639217067044869,i don’t even vape but grape?? man😭 https://t.co/n07zWQhczf,dtqklvrr,2022-05-03 23:53:54+00:00
7,1521639197438021632,shoutout sa nag dm sa aspire thinking we're affiliated sa aspire brand of vape kits,elianajds,2022-05-03 23:53:50+00:00
8,1521639085730942976,I’ll start vaping when God let’s me down🤷🏾‍♂️,matt_chris17,2022-05-03 23:53:23+00:00
9,1521639076197277696,shout out to the lady vaping at the supreme court protest. u da real mvp,KevinLiao_,2022-05-03 23:53:21+00:00
10,1521638824488706048,"grape is the WORST FUCKING VAPE FLAVOR, its up there with mango pineapple and watermelon. https://t.co/OFJAXUO5ti",lesbrrry,2022-05-03 23:52:21+00:00
11,1521638759455989761,idc if kit is vaping his lungs not mine but GRAPE??? DUDE.,old_orange_peel,2022-05-03 23:52:05+00:00
12,1521638672797356032,Saw a girl hit her nic vape at the gym…… HOWWWWWWW I’m out of breath just from watching her lmao,liz_ardss,2022-05-03 23:51:44+00:00
13,1521638399785897985,Bubsy the Vaper,BubsyBot,2022-05-03 23:50:39+00:00
14,1521638175491653633,"https://t.co/9qLvO8OL0n
""i wish i could see one of his blood cells under a microscope... i bet its vaping""",LanceLeverage,2022-05-03 23:49:46+00:00
15,1521637966095032320,Whaat up with people hating on cigs but vape?,timmyeldridge51,2022-05-03 23:48:56+00:00
16,1521637925800267776,"Vaping is so dumb lol, never touching one",ADGotClapped,2022-05-03 23:48:46+00:00
17,1521637765275951105,"Not that interested in the crosstown ""rivalry"", but I would like to hit this vape pen trophy. https://t.co/z5EGXatxMd",SoxTwitt3r,2022-05-03 23:48:08+00:00
18,1521637462766161920,"Councils propose banning smoking and vaping in pedestrian laneways.
https://t.co/53RuXsjoXT",HawkesBayApp,2022-05-03 23:46:56+00:00
19,1521637286378496001,JUUL goes bankrupt for extortion now 58 billion in debt!,Boomer29275471,2022-05-03 23:46:14+00:00
20,1521636983000338433,"it’s crazy how just a month ago i was out drinking every weekend just spending money on things that don’t bring value to my life. now i work out 4 days a week, eat healthier, stopped vaping &amp; spend time with the people who actually care/love me. DO IT 4 YOU it’s worth it!",LiciSegura,2022-05-03 23:45:02+00:00
21,1521636717081595905,"This handy adapter converts your VooPoo Drag S, X or PnP Pod compatible ecig mod so it can power any of your 510 threaded tanks, made from black vape friendly POM Delrin with firmly fixed stainless steel fittings. £5.99 each, UK stock, buy here https://t.co/LaYbUztS8w https://t.co/sHAcXzeUZH",armerahuk,2022-05-03 23:43:58+00:00
22,1521636654385033216,"just got vape juice in my mouth, ee",hopeseok27,2022-05-03 23:43:43+00:00
23,1521635992003825665,I haven’t hit a vape pen all day. It’s over with for them bitches now. I’M DONE!!!,SippingOnTee,2022-05-03 23:41:05+00:00
24,1521635988820402177,"energy drinks, vape liquid, and cum 👹 https://t.co/qyOJOTmhY6",S4L3MC0R3,2022-05-03 23:41:05+00:00
25,1521635926681821192,a crazy thing about “oneness” is realizing that hurting others is the same as hurting yourself,be_juuled,2022-05-03 23:40:50+00:00
26,1521635774927626240,lost my vape for 5 seconds https://t.co/9ICqEFhtkR,ghbdreams,2022-05-03 23:40:14+00:00
27,1521635581897449473,How the vape prescription model has failed in Australia. It's costing lives. https://t.co/bfAbJ6dqAC,LegaliseVaping,2022-05-03 23:39:28+00:00
28,1521635479631900672,How much is vaping affecting the performances of certain “no miss players?”,ErnieErnst4,2022-05-03 23:39:03+00:00
29,1521635107043524612,"love going to crunch fitness, always smells like vape in the locker room",alyakcm_,2022-05-03 23:37:34+00:00
30,1521634993172144128,Reminder: Vaping is cringe,MrH71912099,2022-05-03 23:37:07+00:00
31,1521634916928307201,Was hitting my vape a bunch and forgot then freaked out that my room was on fire for a second when I took my headset off.,SpontaneityVR,2022-05-03 23:36:49+00:00
32,1521634765132242945,My back hurts I’m bleeding to death and I’m out of juul pods what else can go wrong,liyamataa,2022-05-03 23:36:13+00:00
33,1521634757188087809,"Quitting the vape, pls do not cross me.",MagicUser666,2022-05-03 23:36:11+00:00
34,1521634729560207360,every vape pen charger in our house in broken and I feel like dying,zyrtecnation,2022-05-03 23:36:04+00:00
35,1521634219612688388,Manoah looks like he works at a vape shop.,kevinfinnertyy,2022-05-03 23:34:03+00:00
36,1521633614781612032,Cronicle Asher voted as Most Likely to Vape,vgundam_ebooks,2022-05-03 23:31:39+00:00
37,1521633285507624963,"i can't .. help it . no matter now much i try to stop , i want more . it's addicting , akechi . i've even tried vaping instead , but it just wasn't the same . https://t.co/qBEtIaj7sG",HEARTOFBEAUTIES,2022-05-03 23:30:20+00:00
38,1521633224409055232,Don’t Juul Be Cool,Dont_Vape_Bot,2022-05-03 23:30:05+00:00
39,1521633222811078658,"Dozens of small vape manufacturers have challenged FDA's marketing denial orders in federal court. Stay up to date on all the legal action here! 

https://t.co/tOx8gsGMxx",Vaping360,2022-05-03 23:30:05+00:00
40,1521632680726523905,"Yesterday's find of disposable vapes was such a high point, I wound up finding more of them in my dreams.

Sadly those dreamsposable vapes did not materialize in my battery collection.",ginbot86,2022-05-03 23:27:56+00:00
41,1521632624334286848,Menthol juul pods literally taste like icy hot,fiIleenfeu,2022-05-03 23:27:42+00:00
42,1521632526447566848,"did i *really* just lose my brand new vape pen between my ass cheeks for about seven minutes???

=/////m/////=;;;;;

guh...i'm so dumb.",meltingfoxy,2022-05-03 23:27:19+00:00
43,1521632188009050113,been about a week without vaping 🔥 proud of myself but the munchies are real 🤣,psykodeliksav,2022-05-03 23:25:58+00:00
44,1521631787239165953,Serious question can we Ubereat vapes???,droptoposmosis,2022-05-03 23:24:23+00:00
45,1521631718934913024,"I don't understand why tobacco control fanatics get their panties in a bunch over the perceived ""aggression"" of vapers towards their ill-conceived policies. I mean, it's very different from the way things were not all that long ago... https://t.co/D2O4RQAVzZ",StefanDidak,2022-05-03 23:24:07+00:00
46,1521631554866405378,"🆕 !DISPOSABLE VAPE! 🆕

Mimosa (Hybrid) WildFlower™ THC-O Disposable Vape by Consider It Flowers

https://t.co/xA5GXPrfIw",consideritflwrs,2022-05-03 23:23:27+00:00
47,1521631490819432448,Don’t nobody gaf about the nigga vaping. They acting like kpoppies 😭. The only thing I would be mad about is the fact that it’s GRAPE.,Titties4Jay,2022-05-03 23:23:12+00:00
48,1521631425325408256,my new vape mod is the real deal https://t.co/NuGNjIYSF2,ryan05339427,2022-05-03 23:22:56+00:00
49,1521631409563185152,"*pulls thumb out of mouth*
This roe v wade shit reminds me of when they banned flavored JUUL pods🤦‍♀️
*puts thumb back in mouth*",sadforeskin,2022-05-03 23:22:53+00:00
50,1521631343745982464,Are the cigarette companies doing the research on vapes? 😋,Raejoylene,2022-05-03 23:22:37+00:00
51,1521631169204436995,megabed keeps eating my vape,maerinara_sauce,2022-05-03 23:21:55+00:00
52,1521631107422298113,should i get a vape,softyknj,2022-05-03 23:21:41+00:00
53,1521631106356760577,hitting the dead vapes in my car til i go buy a new one,frshbakedx,2022-05-03 23:21:40+00:00
54,1521630443380092937,Vaping: An Invitation to COVID-19 | Nature's Real Health https://t.co/HcvEYRloQ6,nicktompan,2022-05-03 23:19:02+00:00
55,1521630288517865472,"🥭 🌫 🌱 PICK OF THE DAY 🌱 🌫 🥭 
*** MANGO HAZE BALANCED by FORAY ***
Blend: THC: 400mg/g — CBD: 400mg/g
Made with high-quality cannabis distillate and botanical terpenes only, this blend is a balance of THC and CBD.
—&gt; 0.3g disposable vape cartridge : $22.99 https://t.co/oGrNtCGO50",123cannabiscros,2022-05-03 23:18:25+00:00
56,1521630005893210113,never smoking grape or non-flavored vapes pls dni,callahands,2022-05-03 23:17:18+00:00
57,1521629983755710467,My vapes dead I’m fine though I’m fine,StartWithF,2022-05-03 23:17:13+00:00
58,1521629621787275267,“i want everyone to dress like me” “okay ill be laying on the ground holding a vape”,sdzme,2022-05-03 23:15:47+00:00
59,1521629425988775937,"A South Carolina judge has denied bond for a former ""American Idol"" contestant accused of killing a man by barreling into him with his pickup truck after using a marijuana vaping device.
https://t.co/vo56cEQjg7",ABC13News,2022-05-03 23:15:00+00:00
60,1521628956557987846,for some reason i have a feeling it should rhyme with vape https://t.co/liqFzMdX0G,chuupoofjm,2022-05-03 23:13:08+00:00
61,1521628686088294400,absolutely cackling at the amount of tweets i’ve seen about people being shocked that kit connor’s vape was grape flavoured. y’all have proved one thing and that is that twitter users don’t have lives 😭😭,theonottlovebot,2022-05-03 23:12:03+00:00
62,1521628605448605698,once a dude asked if he could vape in my car and i said sure and then it was grape flavored and i changed the rule and he was no longer allowed to vape in my car for the rest of the year https://t.co/74ZSq37Mm2,vampireallegory,2022-05-03 23:11:44+00:00
63,1521628547525365760,People who vape are basically air frying their lungs,ShamrockMilk,2022-05-03 23:11:30+00:00
64,1521628502071681026,This boy just asked to see my vape. Wiped it off then hit it. I was like…SIR!,TouchedByTae,2022-05-03 23:11:20+00:00
65,1521628435042299905,"Woke up from a fever dream to so much political shit, I think I’m just going to return to the hole I was trapped in with my fathers skeleton and maybe bring my vape this time",salivadoordolly,2022-05-03 23:11:04+00:00
66,1521628432383283200,Runtz Vape Pens #OrderNow #TheyLeavingSuperFast https://t.co/43OJJtetKY,BiggFlame,2022-05-03 23:11:03+00:00
67,1521628416101031938,i feel like my brain is getting tickled anytime i ghost a mint vape,thelifeofzyy_,2022-05-03 23:10:59+00:00
68,1521628405325783042,Vaping in my room cause I’m not allowed to smoke inside the house,cherrycolalite,2022-05-03 23:10:56+00:00
69,1521627492523589638,Big tobacco political donations and government tax income from tobacco products is the only reason government is attacking vape industry. https://t.co/Hg6rSfUiBJ https://t.co/xR2tdmqFNp,wargoat,2022-05-03 23:07:19+00:00
70,1521626866314063881,headache I can only assume from lack of juul,ryl333y,2022-05-03 23:04:50+00:00
71,1521626673350852610,"Bro, bro, can I get a hit off your Juul please bro?  https://t.co/Fzt5463GHC",futurism,2022-05-03 23:04:04+00:00
72,1521626641058787328,If men could get pregnant they’d offer abortions at vape shops.,tableforjoe,2022-05-03 23:03:56+00:00
73,1521626515485900800,ion vape but grape sounds disgusting https://t.co/ijenNp7qwc,lvdovt,2022-05-03 23:03:26+00:00
74,1521626168788762624,my sis huffing the stupid vape before bed like it's the milk a kid has before bed on any tiny pop show,melalita_,2022-05-03 23:02:03+00:00
75,1521626163772379137,WRONGFULLY DETAINED: Brittney Griner was detained at an airport in February after Russian authorities said a search of her bag revealed vape cartridges containing traces of cannabis oil. https://t.co/QjDvx9Z1Dq,kron4news,2022-05-03 23:02:02+00:00
76,1521626090967601152,oh she gone take that vape anywhere she goes and i love it https://t.co/nZr5h5dFGa,heygoons,2022-05-03 23:01:45+00:00
77,1521625914655707136,lisping lesbian vaping in your area,magnispora,2022-05-03 23:01:03+00:00
78,1521625693246873605,Griner was detained at an airport in February after Russian authorities said a search of her bag revealed vape cartridges containing traces of cannabis oil. https://t.co/LjrYvyD3HS,WTOL11Toledo,2022-05-03 23:00:10+00:00
79,1521625665308667904,Gahhh my lungs are being so shitty rn that cotton candy vape stuff 100% triggered my allergies,ShamrockMilk,2022-05-03 23:00:03+00:00
80,1521625656701898755,when u haven’t had a vape in like a year so now you get lightheaded every single time you hit it&lt;&lt;&lt;&lt;&lt;&lt;&lt;,marissar0chelle,2022-05-03 23:00:01+00:00
81,1521625580407603201,"The convenience of not feeling like rolling, and being able to hop in a dispensary and buy disposable THC vapes on whim. 3-4 hits and you seeing airplanes in the night skies like shooting stars!

I don’t think I could live an another state w/o legalized recreation use after this.",djordxc,2022-05-03 22:59:43+00:00
82,1521625522622681091,Y’all really that red BMW from Cali lol the guy who vaped and had the famous cousin lol never saw him we were all about to go to Oakland but things feel threw I hope he’s having a great day,gingerthemenace,2022-05-03 22:59:29+00:00
83,1521624920677048322,I’m still having a hard time breathing from that lady’s vape being directly in my face,ShamrockMilk,2022-05-03 22:57:06+00:00
84,1521624907867729921,one week of no vaping :) small wins baby!,sunchilddd_,2022-05-03 22:57:03+00:00
85,1521624810392014848,vape god vape god https://t.co/dzYDIEWk9y,d3rwood,2022-05-03 22:56:39+00:00
86,1521624666514853888,imagine omading vaping xD,solnumeri,2022-05-03 22:56:05+00:00
87,1521624635078586375,There’s a dude straight up pissing in the parking lot and another dad hitting a weed vape and there are trains going right beside the ball field. It’s like the goddamn Wild West here 🤣🤣,Greinkefan,2022-05-03 22:55:58+00:00
88,1521624589545132033,Girl said she get high off vapes😂,_kyrahj_,2022-05-03 22:55:47+00:00
89,1521624070172860418,Mofuckas be in the gym doing dead lifts with their vape laying next to their water bottle .. you really can’t get through your workout without that thing ? 💀💀,ScottLagouche,2022-05-03 22:53:43+00:00
90,1521623729381515264,i don’t even vape but gRAPE???? https://t.co/OGxL5lwVBG,KottonKore,2022-05-03 22:52:22+00:00
91,1521623659659603968,Anne Arundel County Public Schools Is Joining Dozens Of Other School Districts In Suing A Vape Company https://t.co/KQkhLQLbvK,newslanes,2022-05-03 22:52:05+00:00
92,1521623499697229826,your mango strawberry vape madam,mrsbluntz,2022-05-03 22:51:27+00:00
93,1521623343358570498,Vaping among students across Central Coast schools becoming harder to crack down https://t.co/sYadPHCA44,CityofMonterey,2022-05-03 22:50:50+00:00
94,1521623160222793730,why is ella a vape god,papiirandyy,2022-05-03 22:50:06+00:00
95,1521623154212454400,Some lady just blew her cotton candy scented vape in my face- she didn’t mean to but I was directly downwind,ShamrockMilk,2022-05-03 22:50:05+00:00
96,1521623134138507270,What can Juul really get out of with these lawsuits? Read to learn more --https://t.co/hw5hFuLpNX,hpp_ne,2022-05-03 22:50:00+00:00
97,1521623081558683648,i am a vape god idc,barfbitch669,2022-05-03 22:49:47+00:00
98,1521622982665330693,If I see another truth anti-smoking/vaping ad I'm gonna start smoking out of spite,skyloscerberus,2022-05-03 22:49:24+00:00
99,1521622908468092929,Would you look at that! @safarisquadnft #CNFT https://t.co/zSfm44Qu6O,Ranger_Vapes,2022-05-03 22:49:06+00:00
100,1521622901119672321,kit grape flavored vape juice conner,hunterduggn,2022-05-03 22:49:04+00:00
101,1521622751466958849,"Bro where tf is mf vape, I’m always losing my shit",stu_clarkk,2022-05-03 22:48:28+00:00
102,1521622701986570241,No more vaping for this gorl. A time in my life I’d like to rest behind me. 🙃,uhleeesa,2022-05-03 22:48:17+00:00
103,1521622503868833799,The things I would do for a mango juul pod…,jacky_chen11,2022-05-03 22:47:29+00:00
104,1521622458700386304,"UCSD Scientists Publish First Study Looking at Impacts of JUUL Smoking on Organs

https://t.co/g0gdQKE3JH

https://t.co/pE7ROsr82R

#vape
#vaping
#juul
#puffbar
#smoking
#tobacco",MATFORCEAZ,2022-05-03 22:47:19+00:00
105,1521622387829010433,"My new favorite vape liquid: ""Frisee Ears"".",buttsex_subtext,2022-05-03 22:47:02+00:00
106,1521622253389160448,Society if I could just through the screen and beat the shit out of those middle schoolers who vape and brag about loosing their v card that look 5 times older than me,goblinsonfilm,2022-05-03 22:46:30+00:00
107,1521621875746476033,"A South Carolina judge denied bond for a former ""American Idol"" contestant accused of killing a man by barreling into him with his pickup truck after using a marijuana vaping device.
https://t.co/2HCkVSmNoQ",CBS4Local,2022-05-03 22:45:00+00:00
108,1521621864413638656,Love spam that throws me into a weird panic momentarily https://t.co/tfOhH5YVdK,vape_nap,2022-05-03 22:44:57+00:00
109,1521621688462553089,Sometimes the vape pen gets away from you and you end up at Angellos to go stuffing your face https://t.co/ovpSpu2b89,StansburyShow,2022-05-03 22:44:15+00:00
110,1521621271980748807,White airpods E53 X5 clean shave 20mg vape juice telling dealer to f off. Stopping at a green light symphony of horns,SiccSixEight18,2022-05-03 22:42:36+00:00
111,1521621182822457344,Anyone know of any non-nicotine vapes that could help as an appetite suppressant? /gen,DelusionalTeeth,2022-05-03 22:42:14+00:00
112,1521621114778177541,why are people mad at kit for vaping ?? he's an adult let him do what he wants.,caitisflwrs,2022-05-03 22:41:58+00:00
113,1521620991998373895,my vape just died https://t.co/VAcFNb3wCC,FlLMSLVT,2022-05-03 22:41:29+00:00
114,1521620949505818624,sour apple is the best vape flavor literally idc,marissar0chelle,2022-05-03 22:41:19+00:00
115,1521620827522879488,"Today is #WorldPressFreedomDay - appropriate day for @NorwayUN to launch ‘Life through the Afghan lens’, a thought provoking exhibition in UNHQ🇺🇳

It tells a story of #Afghan resilience &amp; the brave journalists who seek to tell their story

@baysontheroad @MaherNasserUN @mona_juul https://t.co/dW7UabnXxE",irishmissionun,2022-05-03 22:40:50+00:00
116,1521620691690401794,im the number 1 hater of anyone who vapes fr,greatestsince99,2022-05-03 22:40:17+00:00
117,1521620617589633025,"A South Carolina judge has denied bond for a former ""American Idol"" contestant accused of killing a man by barreling into him with his pickup truck after using a marijuana vaping device. https://t.co/6r7HpJl8SJ",wsyx6,2022-05-03 22:40:00+00:00
118,1521620447829319680,"We know that when one area of our health is affected, typically many other areas of our health follow suit as our bodies are an interconnected system. Find out more about the effects vaping has on our oral health on our Instagram this #ToothTipsTuesday. https://t.co/ymuLhe9Pn3",CATCHhealth,2022-05-03 22:39:19+00:00
119,1521620102386380800,fans that r mad at celebrities that smokes or vapes r weird as hell idc yall r so weird. https://t.co/hepbi52DcS,eizzhah,2022-05-03 22:37:57+00:00
120,1521620074175545345,MY NEW VAPE MY FRIEND BOUGHT IS RICK N MORTY THEMED N IT LIGHTS UP RAINBOW AT THE BOTTOM #AMAZING,ittoslvrr,2022-05-03 22:37:50+00:00
121,1521619832365486081,"(1 of 2) TODAY is Anti-Vaping Awareness Day! In recognition, CV high schools competed in an anti-vaping awareness contest, organized by SRO Off. Campolo. Students developed their own videos to bring awareness to the dangers of vaping. Bonita Vista HS was selected as the winner!",ChulaVistaPD,2022-05-03 22:36:53+00:00
122,1521619300129599488,"Ever worried about #vapers being able to express their view? Concerned about the wider debate about free speech... read this from @KiwiblogDPF 

https://t.co/rfiByYkUse https://t.co/AtxZSq2S5p",VapingAlliance,2022-05-03 22:34:46+00:00
123,1521619239278370819,IVG Disposable Vape Bar 800 Puff – Any 5 for £20 – available at DIY E Liquids https://t.co/IJbast8xld,UKVapeDeals,2022-05-03 22:34:31+00:00
124,1521618855596077056,Today I bought a vape called LOOPS! And it tast lik milky milky mmmmm milk milky,k3lpyluv3r,2022-05-03 22:33:00+00:00
125,1521618824025493504,silly little walks include buying a juul and eggs almost tripping on a rat and watching two hot guys beat the shit out of each other outside my apartment,sugarfreegay,2022-05-03 22:32:52+00:00
126,1521618791553187840,"yes, I have a karen face. it comes out when I see someone smoking their ugly vape.",hananfalm,2022-05-03 22:32:44+00:00
127,1521618392041537538,Damone don’t play with the vapin shit. Our house a vape free zone fr 🤣🤣🤣,_jaslynnchardae,2022-05-03 22:31:09+00:00
128,1521618122008313856,Don’t hit it be with it,Dont_Vape_Bot,2022-05-03 22:30:05+00:00
129,1521618053901000704,DO BETTER KIT VAPE LIKE BLACKBERRY OR SMTH https://t.co/sUnePzltl2,trueblueten,2022-05-03 22:29:49+00:00
130,1521618051346710529,"""you havent been doing anything bad im so proud of u"" they say as i have bleeding cvts on my thighs, a vape in my bra, and weed in my bag",fruitloopcalz,2022-05-03 22:29:48+00:00
131,1521617934027796481,just cause i cant vape doesn’t mean i cant criticize him for vaping fucking GRAPE????? https://t.co/sUnePzltl2,trueblueten,2022-05-03 22:29:20+00:00
132,1521617759238459392,"And normal Pete says: ''Dude I hate babies''
and normal Pete says: ''Have you seen my vape?''
and normal Pete says: ''Dude I can kick your ass in FIFA''",BugHunterLyric,2022-05-03 22:28:38+00:00
133,1521617749985869825,Anne Arundel County Public Schools Is Joining Dozens Of Other School Districts In Suing A Vape Company – CBS Baltimore https://t.co/LVrlmSPOka,rakeshrc99,2022-05-03 22:28:36+00:00
134,1521617597275455488,"reminder to fit test your respirators regularly to check for leaks!

here’s how to perform a simple and easy fit test. first, take the biggest hit you can off any vape, bong, or joint. then, simply don your respirator and exhale!",16kbps,2022-05-03 22:28:00+00:00
135,1521617419902484480,What’s 400 #Dispensaries really worth in #Michigan ? @platinum_vape https://t.co/PLAZ6I2Tf3,wind4me,2022-05-03 22:27:17+00:00
136,1521617415016267776,kit connor vaping doesn’t bother me. his choice of flavour is what bothers me.,LUVSICKNICK,2022-05-03 22:27:16+00:00
137,1521617140624904192,i have a huge exam tomorrow but i’m just vaping and thinking of food lol,usedcalories,2022-05-03 22:26:11+00:00
138,1521616988761690114,how do i make it clear to youtube that i have literally never consumed nicotine in any form in my life so it will stop giving me these anti vaping ads,NONBlNARY,2022-05-03 22:25:35+00:00
139,1521616854128676864,"Yeah, the other five vape https://t.co/7NiAQ6ehwc",twitnuq,2022-05-03 22:25:02+00:00
140,1521616778937475073,"Need help to stop smoking? 
Want the nicotine sensation without needing to go outside to vape or have a cigarette?

Visit https://t.co/AohHJsdGuJ https://t.co/CLikqUDu0r",NicopodsUk,2022-05-03 22:24:45+00:00
141,1521616705818136578,ew I don't even vape and I hate him for choosing grape https://t.co/vClfCEc3tX,takenbythebliss,2022-05-03 22:24:27+00:00
142,1521616705088327683,Fizzy Juice 600 Puffs Disposable Vape – Any 4 for £15 – available at DIY E Liquids https://t.co/WUAfNrZ3pZ,UKVapeDeals,2022-05-03 22:24:27+00:00
143,1521616672255217664,Not me accidentally spraying perfume on my vape pen 🙃🙃,LyssaLou818,2022-05-03 22:24:19+00:00
144,1521616626717794304,Maybe im just being dumb and edgy but i really wanna try a vape but my parents would instantly know and probably unalive me lol,Dravenisdying,2022-05-03 22:24:08+00:00
145,1521616574762786816,"Coming to the realization I've been vaping for 8 years now..

Yeah it's time to quit this shit.",MFDADFIA,2022-05-03 22:23:56+00:00
146,1521616394286206985,just submitted my assignment at 11:23pm after starting it 2 days ago and getting no sleep running on vape and doritos ! https://t.co/naalrfEdnv,3AMVENUS,2022-05-03 22:23:13+00:00
147,1521616353496600576,"#cannabiscommunity #marijuana #cannabis 5 Things to Know in Alaska Politics: Vape tax, cannabis convictions and cruising while vaccinated | Politics https://t.co/6zmLLigHxx https://t.co/gSqh2WK5B9",MMPconnect,2022-05-03 22:23:03+00:00
148,1521616294164189184,update: vape has been seized :( https://t.co/Q5qKwJ4Xvf,f1owwt,2022-05-03 22:22:49+00:00
149,1521616237121478656,Turning my camera off to hit my vape is a tale as old as time,WillyBalsh2,2022-05-03 22:22:35+00:00
150,1521616216573587457,"i be looking for my vape inna car, whole time it’s between my legs",dalyncarter,2022-05-03 22:22:30+00:00
151,1521616180913524738,why do ppl think that every person who vapes is addicted,yyearningheart,2022-05-03 22:22:22+00:00
152,1521615815120134145,"yea, i vape",nanako_jpeg,2022-05-03 22:20:55+00:00
153,1521615723197575169,I need a vape 😭,PIayTimeOva,2022-05-03 22:20:33+00:00
154,1521615136418533381,kinchan posting a pic of her vape wot 😭,suwaworId,2022-05-03 22:18:13+00:00
155,1521614909745901568,"If smokers can't smoke at the bar bc of health risks to the staff and other customers THEN WHY ARE WE GIVING CHEWERS A SPIT CUP?!?

and why can't I vape at the bar fuck you",underagekatz,2022-05-03 22:17:19+00:00
156,1521614161146437632,Was finding a place to hide my vapes and I found my old suicide note . What a day 🙃,mimikbp,2022-05-03 22:14:20+00:00
157,1521614001087655944,I quit vaping a week ago and the changes are wild already 😂😂,AboveAvgPropGuy,2022-05-03 22:13:42+00:00
