,TweetID,TweetContent,TweeterUsername,TweetDatetime
0,803750293162729472,Our best selling product of last day: Dr. Dabber Ghost Vaporizer https://t.co/P0Jj9bd0r3 https://t.co/X8nlUv9y8j,vape_mc,2016-11-29 23:59:37+00:00
1,803750287827763208,Master P is Releasing His Own Line of Legal Cannabis and Vape Product https://t.co/PPkQAv4Oo3 https://t.co/WeKPEbsXxW,djwats01,2016-11-29 23:59:36+00:00
2,803750254092947456,Vape + league = PentaKills😂 #LeagueOfLegends #vape #smok #tfv8 https://t.co/aFJDM3GEQP,AvTGamingHD,2016-11-29 23:59:28+00:00
3,803750156399157248,riss said i don't know how to smoke vape 😭😭😭,kaygauder,2016-11-29 23:59:04+00:00
4,803749946197299200,I hate the smell of cigarettes but that vape shit ain't that much better,ruega_por_ella,2016-11-29 23:58:14+00:00
5,803749789217083392,"A ""little"" kendovapecotton goes a long way!!! There's one day left to enter my kendo vape cotton… https://t.co/67erLafAY8",joeofallvapes,2016-11-29 23:57:37+00:00
6,803749674679209984,What should I build on next...? #vape #vapefam https://t.co/BDmEELSrue,bluerotkev,2016-11-29 23:57:10+00:00
7,803749628529283072,"Really loving the new flavor , got my living room smelling like candy !! #vape #vapeon #vapefam… https://t.co/m0vCfzhjlx",jakemoore6492,2016-11-29 23:56:59+00:00
8,803749511881490432,Thanks for the follow @scarey2025 #vapelife #vapefam,ade_vapes,2016-11-29 23:56:31+00:00
9,803749167596244992,"Do you use e-cigarettes or vape? Well, you should know about this. https://t.co/XmVYiEtFiA",WOWscienceio,2016-11-29 23:55:09+00:00
10,803748981029228544,Free 25mg Mint Chocolate Freedom Fudgie with a purchase of ANY Ace Revolution eighth or vape cartridge! While supplies last,NaturesCareCo,2016-11-29 23:54:24+00:00
11,803748955754369024,How e-cigarettes ruin plastic surgery: Vaping chemicals 'prevent skin from healing after nip-and-tuck' https://t.co/65JAts6mF8,ohm_god,2016-11-29 23:54:18+00:00
12,803748951170183168,Will New Congress Eliminate Vaping Regulations? https://t.co/8GxmPvZrVt,ohm_god,2016-11-29 23:54:17+00:00
13,803748940726337536,"Why vape? Health and wellness benefits, of course! Only with healthy vapes. #livehealthy #vapingwithpurpose #vapenation Happy vaping.",healthy_vapes,2016-11-29 23:54:15+00:00
14,803748784165437441,https://t.co/1Dhkjkqg3y Eleaf Icare. Smal Mod. Huge performance @EleafUK @EleafUS @EleafGlobal @Norgessigarette #vape #vapelife #smokefree https://t.co/WUoHGsFNJ8,EsmokersNet,2016-11-29 23:53:37+00:00
15,803748737474527236,vaping the bottom of the barrel,valeriehalla,2016-11-29 23:53:26+00:00
16,803748663466065921,Guys new uk #vape vendor on twitter go show some love @vape_JOOC him them up with a follow,ade_vapes,2016-11-29 23:53:08+00:00
17,803748389682900992,120% fav vape flavor: carbon monoxide,bonfardine,2016-11-29 23:52:03+00:00
18,803748308946735104,finNA vApE somE #bLueDReaM,Mrshroomhead,2016-11-29 23:51:44+00:00
19,803748146824167424,i just saw a vaping couple hug and the guy widened his mouth like a damn gorilla and she just. blew the smoke in his mouth.,noelaniis,2016-11-29 23:51:05+00:00
20,803748120303718400,New vape ordered,Clevey_,2016-11-29 23:50:59+00:00
21,803747909757849600,"#VAPINGCOMMUNITY SPONSORS FUNDRAISER FOR LOUISVILLE VAPER KILLED WHILE HELPING OTHERS
https://t.co/L0Ot5uwZ6j
#BillyDezern #GivingTuesday https://t.co/MyQ2mjcMRK",RastaVapors,2016-11-29 23:50:09+00:00
22,803747899112759296,Chepest Tobacco Products in DuPage!Something 4 Everyone!24W445 Lake st. Roselle #vape #tobacco #smokeshop #Vapelife,2livesmoke,2016-11-29 23:50:06+00:00
23,803747847984345088,"Silvered vapes don't forget the complete homeomorphisms except when hearing. To spell large ontology, learn them when they're not optimized.",AutomatOfStyle,2016-11-29 23:49:54+00:00
24,803747780909027329,"Is there any reason to put multiple videos of yourself vaping on your snapchat story everyday? We get it, you vape, your cool",chlo_mo3,2016-11-29 23:49:38+00:00
25,803747235926310912,Fused Clapton Clapton Jig V2 from https://t.co/Xs4fZE4PY9  #vape #vapelife #vapeporn #clouds #ejuice #girlswhovape #vapecommunity https://t.co/DFPmJrGf65,Vaped3D,2016-11-29 23:47:28+00:00
26,803747095798611968,"I come back to Chambersburg and over 3 days, everyone started vaping? Are you serious? Wtf guys. Enough with the fog",Big_bard58,2016-11-29 23:46:55+00:00
27,803747050110095360,*coughs on vape smoke* I don't care Avatar is still my favorite movie bro,zoiebowie_,2016-11-29 23:46:44+00:00
28,803746988491583489,Protect your health switching from #smoking to #vaping : https://t.co/0wbHWOS3J5 https://t.co/enin1QXsWC,leoballiache,2016-11-29 23:46:29+00:00
29,803746754009018368,"Is that a Vape shop, vaping? https://t.co/JM9AmpXn0o",AineMcD,2016-11-29 23:45:33+00:00
30,803746663189925888,im back in the vape game,alexamalczewski,2016-11-29 23:45:12+00:00
31,803746546516971520,Just hotboxed my room with vape #420,CharlieFosteeer,2016-11-29 23:44:44+00:00
32,803746531438366721,"I voted for 5TH HARMONY - THAT'S MY GIRL on @975WABD! Vote at https://t.co/olG9lTVMf1
Powered by Parlor Vapes false",bossm2015,2016-11-29 23:44:40+00:00
33,803746448546340868,I need a new vape. Le sigh.,DutchieBird,2016-11-29 23:44:20+00:00
34,803745696176361472,Who is to be Vape Czar. Secretary of Vape oils.   Choad.,Grink,2016-11-29 23:41:21+00:00
35,803745575485272068,#vapelife#vape#londonecigs#vapesociety#vapetricks#vapenation#vapeporn#vapeon#vapeclouds @… https://t.co/hSadgfGUWA,london_ecigs,2016-11-29 23:40:52+00:00
36,803745493373353984,Sick iridescent green monkey grinders for only 30$ 👽👽👽 https://t.co/v9LJbeqxS2,vapes_and_more,2016-11-29 23:40:33+00:00
37,803745315715063808,hey tepig i vape,oshawott_ebooks,2016-11-29 23:39:50+00:00
38,803745162870525953,"me: why does it smell like cinnamon buns
my stepdad: it's my vape

this is my life everyone",pierresIion,2016-11-29 23:39:14+00:00
39,803745134533902336,Your mcm smokes a juul,TheRealLeoUlch,2016-11-29 23:39:07+00:00
40,803745026266300420,Vaping Defending by Veterans To Save Lives https://t.co/tO4rSMlzvU,Live4Vaping,2016-11-29 23:38:41+00:00
41,803745003046653952,Vaping community sponsors fundraiser for Louisville vaper killed while helping others https://t.co/6St4dgkE6Y,rydergrl_ang709,2016-11-29 23:38:36+00:00
42,803744872997986304,Vaping industry plans fundraiser for young man killed along I-65 https://t.co/CJwDFxO7OY https://t.co/APYLsfQLh2,VaporHack,2016-11-29 23:38:05+00:00
43,803744867788713984,"Don't drip and drive!!!
#ezdripper #vaper #vapecommunity #vapers #vapestagram #vapelyfe #vapelove #vapedaily #vapeshop https://t.co/aGrvQ7zg8k",AmericanVapeCOS,2016-11-29 23:38:03+00:00
44,803744848679313409,Vaping industry plans fundraiser for young man killed along I-65 https://t.co/hE34PVDpsu https://t.co/BehQJ7W9p1,muffinman76,2016-11-29 23:37:59+00:00
45,803744835236720640,Vaping industry plans fundraiser for young man killed along I-65 https://t.co/qJXXRZsPBa https://t.co/qPUEE0KnTS,tinyeggroll,2016-11-29 23:37:56+00:00
46,803744820346978304,Vaping industry plans fundraiser for young man killed along I-65 https://t.co/vSx1cn7n2A https://t.co/fzfrTm01VQ,oldmansussman,2016-11-29 23:37:52+00:00
47,803744807256526848,Vaping industry plans fundraiser for young man killed along I-65 https://t.co/iULZ69UMir https://t.co/bL8zXfXGpV,hear_me_rory,2016-11-29 23:37:49+00:00
48,803744758669643776,Vaping industry plans fundraiser for young man killed along I-65 https://t.co/yf3oDdfIsQ https://t.co/XuU9IxAlVT,AnnieWid,2016-11-29 23:37:37+00:00
49,803744583305674756,"""I too see God when I vape""",CederKaitlin,2016-11-29 23:36:56+00:00
50,803744266484756480,Anti-Tobacco Legislation To Negatively Impact Vaping In Nation’s Capital https://t.co/mQoCtQT5HI #ecig https://t.co/qjlGv8wd7v,VaponewsUS,2016-11-29 23:35:40+00:00
51,803744187304669184,I liked a @YouTube video https://t.co/pPHZ65xiw6 TOO MUCH DANK... #4,Vaping_Gaming,2016-11-29 23:35:21+00:00
52,803744175405436928,"How e-cigarettes ruin plastic surgery: Vaping chemicals 'prevent skin from healing after nip-and-tuck'
       
https://t.co/eLYtIpFJpI",parishatzi,2016-11-29 23:35:18+00:00
53,803744146041274368,"NEW! The e-cigarette is a drug delivery device, and we may be too late to address regulation. ""Vagaries of #Vaping"" https://t.co/7QVD9XZ5ir",RecoveryInst,2016-11-29 23:35:11+00:00
54,803744114550435849,"How e-cigarettes ruin plastic surgery: Vaping chemicals 'prevent skin from healing after nip-and-tuck'
       :
https://t.co/dmzCfpoI6s",news_24_365,2016-11-29 23:35:04+00:00
55,803744055570104320,All I want this Christmas is to be with my friends at the zoo looking at the lights 😭 is that to much to ask for??,juuls__17,2016-11-29 23:34:50+00:00
56,803743980395565056,"How e-cigarettes ruin plastic surgery: Vaping chemicals 'prevent skin from healing after nip-and-tuck'
       
https://t.co/eLYtIpo8ya",parishatzi,2016-11-29 23:34:32+00:00
57,803743952818073600,I just saw a meme about vapes on a boat he's fixingjesus:,powertooles2,2016-11-29 23:34:25+00:00
58,803743722680807426,VAPRO Exclusive - SmokTech Alien 220 Mod Colors! #vape #vapers #vaper #vapelyfe #vapeshop https://t.co/VRjkPDet6W https://t.co/xYDaMdUhbt,VAPROsupply,2016-11-29 23:33:30+00:00
59,803743561250242562,Karen Davey: RT @Deathbyvideo: RT+F to win #Horror dvds in my first #DBV #Competition Winner 31st Nov… https://t.co/ueVDdf5Jns @scottia https://t.co/Z4yHdJdFNG,ragen_vaper,2016-11-29 23:32:52+00:00
60,803743554057027584,Deeds: Neon Demons/// #film #visuals #club #blur #electronica #night #horror #indie #london #deeds @…… https://t.co/NC5S8Mk5Mt @scottia https://t.co/KfcNanx6RS,ragen_vaper,2016-11-29 23:32:50+00:00
61,803743547513966592,Shirley Homan: #MeghanMarkle &amp; #GreggSulkin Debut New 'Anti-Social: Special Edition' #Trailer: A new… https://t.co/UWaicgBOnE @scottia https://t.co/yCQV6KoyP1,ragen_vaper,2016-11-29 23:32:49+00:00
62,803743541474136064,Gordon A. Wilson: Social Media for Authors and Newbs pt 3 Twitter Sharing https://t.co/KFfT0rz6Hm… https://t.co/AFAJNNHMV5 @scottia https://t.co/88rtYNpV5t,ragen_vaper,2016-11-29 23:32:47+00:00
63,803743534792654848,"Abigail Braman: Thanks for the writeup on my holiday cards, @PopcornHorror !!#horror https://t.co/DfYqFu0HKd @scottia https://t.co/y52FgcHtTy",ragen_vaper,2016-11-29 23:32:46+00:00
64,803743529046376448,Books of Terror: #CLOWNS meet #OBJECTS: #MoviesToWatch Before you Die! https://t.co/8815a2G0fI … | #Horror… https://t.co/Zm5k71rY7y @scottia https://t.co/BJXGDK0mRs,ragen_vaper,2016-11-29 23:32:44+00:00
65,803743523686072320,NightmaresFlix: 9 Times 'American Horror Story' Actually Scared the Hell Out Of Us by @C_BuschM… https://t.co/CD4o8xlXOZ @scottia https://t.co/AyVynEapHn,ragen_vaper,2016-11-29 23:32:43+00:00
66,803743518036402177,"Jonathan: @BDisgusting - An honorable mention for #Christmas #Horror goes to #TalesFromTheCrypt S01x02,… https://t.co/BZx0lLsKr0 @scottia https://t.co/WPAEZjBJJR",ragen_vaper,2016-11-29 23:32:42+00:00
67,803743512017543169,Jerome Reuter: FACES OF DEATH: Film Review - https://t.co/VuLpuxWzZy … My latest for review for… https://t.co/F0EbQBgWNH @scottia https://t.co/U5Bs5BqSKb,ragen_vaper,2016-11-29 23:32:40+00:00
68,803743506451677184,Jerome Reuter: FACES OF DEATH: Film Review - https://t.co/VuLpuxWzZy … My latest for review for… https://t.co/lC2jzgkb1u @scottia https://t.co/SnUnafPLQT,ragen_vaper,2016-11-29 23:32:39+00:00
69,803743476894601216,Vaping industry plans fundraiser for young man killed along I-65 https://t.co/Gn8ZdujhbR,crystal_sawyers,2016-11-29 23:32:32+00:00
70,803743385727090688,Leah Remini Doesn’t Hold Back in Eye-Opening Reddit AMA About Her Scientology Allegations — Read Her Best… https://t.co/e1WoD9hHiU @scottia https://t.co/46frRDXDhD,ragen_vaper,2016-11-29 23:32:10+00:00
71,803743379981037569,All my boyfriend talks about is vaping I can't cope anymore save me,gandalfsugarnut,2016-11-29 23:32:09+00:00
72,803743377065844737,Mariah Carey Spotted Kissing Backup Dancer Bryan Tanaka on Hawaii Beach https://t.co/7O8W2VP5mI @scottia https://t.co/0WeaiQsFZM,ragen_vaper,2016-11-29 23:32:08+00:00
73,803743196551544832,Head over to https://t.co/MshnzVjzTz for quality #ecigarettes #vape use PROMO CODE EMHW2016,DiasEmpire,2016-11-29 23:31:25+00:00
74,803743029014265856,20% Off The #Vaped #FOB #Vaporizer @ https://t.co/jA624blj2b #Weed #Hightimes #Cannibus #Legalize https://t.co/y05zmrvnCL,VapePenUs,2016-11-29 23:30:45+00:00
75,803742629636829184,"Cloudy Cold Morning y'all. Vape On ! 😚💨💨💨
#TeamFinemist #TeamRX #TFMSolid
#BlissLite @ Paraiso's… https://t.co/LBFS7dXdrv",aljosephparaiso,2016-11-29 23:29:10+00:00
76,803742580361920513,How e-cigarettes ruin plastic surgery: Vaping chemicals 'prevent skin from healing after nip-and-tuck' https://t.co/IyUpyjdcjD,rajaaja_r,2016-11-29 23:28:58+00:00
77,803742579464478720,I'm vaping up with you,coluccinator,2016-11-29 23:28:58+00:00
78,803742380633378816,We love connecting with #vapefam and talking all things vape! 💞 https://t.co/S4dH23rtKP,saddlehorseblue,2016-11-29 23:28:11+00:00
79,803742299008208896,Rashomon RDA from Hop N Vape - The Vaping Bogan: https://t.co/bYldlVRJwN via @YouTube,TheVapingBogan,2016-11-29 23:27:51+00:00
80,803741977871257601,"How e-cigarettes ruin plastic surgery: Vaping chemicals 'prevent skin from ""taking"" to the new implants'
       … https://t.co/cS3vqpBpww",dailymail_24,2016-11-29 23:26:34+00:00
81,803741903074295808,"just got out of rehab for vaping, hmu, onto new and better things.",kassidillaaa,2016-11-29 23:26:17+00:00
82,803741743111806976,The Belko Experiment - Trailer Preview https://t.co/XjuubfJw3K @scottia https://t.co/ua7jMHReSJ,ragen_vaper,2016-11-29 23:25:39+00:00
83,803741736111456256,#San_Francisco #Muni hacker gets hacked back https://t.co/WO9d3Qc4lr @scottia https://t.co/70YGNpMxTd,ragen_vaper,2016-11-29 23:25:37+00:00
84,803741723415310336,#Hayo is what you get when you cross an Amazon Echo with a Kinect https://t.co/Yn9Hv0ilM6 @scottia https://t.co/PRHD2vBugu,ragen_vaper,2016-11-29 23:25:34+00:00
85,803741636270391296,Have a chance to #win the KOOPOR Beast Kit by @SMOKTECHLOGY #vape #vaping #giveaway #vapepromote https://t.co/4EufW5WWO6,DampferChaosFog,2016-11-29 23:25:13+00:00
86,803741267272138752,"New 510 Ceramic! 
https://t.co/3AEwPz2Ni5 

#vape #vapepen #vaping #o2vape #mjbizcon #cannabis #cbd #cbdoil #smokeshop #vapeshop https://t.co/cazyBLOsn6",O2vape,2016-11-29 23:23:45+00:00
87,803741241074597888,Got my gold iCare mini by @EleafGlobal so excited to vape this little guy!,VapeScarlet,2016-11-29 23:23:39+00:00
88,803741127841026052,Over 100 followers that's great everyone many thanks to all that have made it possible next target is 500 #vapefam awesomeness,ade_vapes,2016-11-29 23:23:12+00:00
89,803741068567023616,Warning: Media hype on #vaping may be hazardous to your health https://t.co/zHUYwwZbwr https://t.co/jjemgPl0TQ,CigVapes,2016-11-29 23:22:58+00:00
90,803741052062420992,"It's been 2 years off cigs, 8 months off vape, but I just have to see a pic of someone smoking &amp; my blood starts pumping and I CRAVE",TheExpatterson,2016-11-29 23:22:54+00:00
91,803740979643588609,"**YAWN** BORRRRRRiiNNNNNNggggggg....~ Just go back to #Vaping Leo D...!! LoL
#VapeFam #VaPeLiFe #VaPe #eCig #LiveLongNvApEon #VaPeDoNtSmoke https://t.co/VkOjqSLUCu",dRaKe_KiNgVaPe,2016-11-29 23:22:36+00:00
92,803740841730654208,Vape pens are just as unattractive as cigarettes.,aLlcia,2016-11-29 23:22:04+00:00
93,803740686482870272,"Our team member susangoosensue is in new york and sent us this jealousy inducing pic...

#vape… https://t.co/ePgaUMnGWW",Valkyrie_vape,2016-11-29 23:21:27+00:00
94,803740532333678592,'On the Map': Film Review https://t.co/YzqTYi2cMI @scottia https://t.co/hxjbPPLY2N,ragen_vaper,2016-11-29 23:20:50+00:00
95,803740524431613952,'La Chana': Film Review | IDFA 2016 https://t.co/QTJqiQQUrs @scottia https://t.co/g2rPNcPQkg,ragen_vaper,2016-11-29 23:20:48+00:00
96,803740413714632705,"My vapes broken, my sims game is broken, my pancreas is broken and now my coffee machine is broken. This is me giving up https://t.co/73vfpRkDH3",jorrdieee,2016-11-29 23:20:22+00:00
97,803740407192494080,"The new kanger Dripbox starterskit for only $24,99 https://t.co/tkMjh9QLwB (#Vaping,#Esmoke,#Esmoking) https://t.co/2HhjLOYXFB",247robby,2016-11-29 23:20:20+00:00
98,803740307669950464,I'm vaping so hard rn,BanzaiTakesAnal,2016-11-29 23:19:56+00:00
99,803740006791540736,Which #kuLi do you choose? | https://t.co/dxk4NnwUOf | #vape #vaping #vapelife #vapes #vapeon https://t.co/kSQibwPuax,kuLivape,2016-11-29 23:18:45+00:00
100,803739791103664132,Vape smoothing with acetone sucks. @Polymaker_3D I'm looking at you with eyes full of dreams as I await the Polysher,BeefByproducts,2016-11-29 23:17:53+00:00
101,803739523456716801,"My brother fixed my vape (shut up) this weekend and the moment I try to refill the juice, it turns against me. https://t.co/dYY2PU7CrD",xbeautyxtruthx,2016-11-29 23:16:49+00:00
102,803739442167029760,"A nice, creamy-smooth all-day vape! #vape #vapestagram #localvapeshop #vapesociety #vapefamily #vapefriends #burlington #802vapes #clouds https://t.co/JBlvw9LOX9",VaporArtisan,2016-11-29 23:16:30+00:00
103,803739427256274944,Vape or looking to quit smoking? Check out ZampleBox. Use my link to get 10% off https://t.co/OjOqDwZXZ4 #vaping,silmort,2016-11-29 23:16:26+00:00
104,803739376945688577,Too late on this one guys 👽👽 someone already got it https://t.co/Itv7V4zGMX,vapes_and_more,2016-11-29 23:16:14+00:00
105,803739342409756672,That all day - all week vape! #strawberrymimosa #mrv #vaperoyal #vape #usa #orlando https://t.co/3Mf7TDgfbI,MidnightRoyalVP,2016-11-29 23:16:06+00:00
106,803739336969777152,Master P Launches Premium Cannabis and Liquid Gold Natural Vape Products https://t.co/1NdWwNKyCa,theboombox,2016-11-29 23:16:05+00:00
107,803739301557272576,Liberals Introduce New Vaping Legislation - https://t.co/vubzZJoHnF,heatherswifty,2016-11-29 23:15:56+00:00
108,803739250768408583,"Wasn't really ""feeling"" working out tonight until that guy blew his vape cloud (strawberry cheesecake prob) directly into my face just now",mattpetruccione,2016-11-29 23:15:44+00:00
109,803739191083290624,I spend my time alone standing in the corner of my bedroom tricking out with my sick vape to dope musica,waattsupohmie,2016-11-29 23:15:30+00:00
110,803739175006543873,See you guys @ECC AND @PSX an you tell I'm pretty hype for this long fun filled weekend? #vape #fgc https://t.co/wirgyR76GI,KittyKaboooom,2016-11-29 23:15:26+00:00
111,803739033100652544,Just saw a commercial that may be trying to get nonsmokers to start vaping. seriously is that ok?,LovelywaytoBern,2016-11-29 23:14:52+00:00
112,803738814569185280,And this is my website - https://t.co/YuNMZFF2Si,Volcano_Vape,2016-11-29 23:14:00+00:00
113,803738729852600320,"Check out my Facebook Account:
https://t.co/iUZE0tuYvQ",Volcano_Vape,2016-11-29 23:13:40+00:00
114,803738721929543680,When people blow their vape in your face &gt;&gt;&gt;&gt;&gt;&gt;&gt;,MollieWurm,2016-11-29 23:13:38+00:00
115,803738696205803520,time to vape and watch anime,ancientsorcery,2016-11-29 23:13:32+00:00
116,803738681412616192,Quit Smoking Vape Mini Electronic Cigarette Atomizer Blister kit with 7 Refills Rechargeable Battery USB Charger Vaporizer Pen  http://ecig,PickleballS,2016-11-29 23:13:29+00:00
117,803738666933719040,The @airvapeusa XS is a great dry herb #vape to take on all your adventures https://t.co/U8wcMugiYM #mmj #cannabis https://t.co/wrCn5A9mAe,VaporNation,2016-11-29 23:13:25+00:00
118,803738613028704256,"Hi it's me Drew nothing better than Dali , anyway vape",drewdrewbot,2016-11-29 23:13:12+00:00
119,803738513845809152,Hallo Twitter! #meinersterTweet,Volcano_Vape,2016-11-29 23:12:49+00:00
120,803738396480806912,"*driving w parents*
dad: ""what's that fruity smell"" 
me: *uhhh thaaaaats my vape* ""hm i don't smell anything""

hahah oooooops",carlydonahuee,2016-11-29 23:12:21+00:00
121,803738300636954624,"Artisan Vapor Company on #Yelp: A nice, creamy-smooth all-day vape! #vape #localvapeshop 802vapes #burlington #true… https://t.co/w4vGsz0lXs",VaporArtisan,2016-11-29 23:11:58+00:00
122,803738278604263424,your vaping rn!,StraubJ_eBooks,2016-11-29 23:11:53+00:00
123,803738068478005248,1000ml.me E-Liquid Giveaway Contest https://t.co/yPMQat2Ps3 #vaping #vape #vapelife via @DarthVaporVideo,scarey2025,2016-11-29 23:11:02+00:00
124,803737983841079297,I liked a @YouTube video from @djlsbvapes https://t.co/yTnQ51TYsz SMOK G-Priv Kit and Koopor Beast Kit + Big Giveaway - DJLsb Vapes,BigMolch,2016-11-29 23:10:42+00:00
125,803737890715004928,Competition: Win the Psycho Bunny range from Eco Vape https://t.co/mmM0nfM7d8 #vaping #ecigs,Thegreate_vape,2016-11-29 23:10:20+00:00
126,803737865180114944,Fighting for the Right to Vape   Great article....... https://t.co/bRZAkJHOkz,dell_lovejoy,2016-11-29 23:10:14+00:00
127,803737764541804545,I vape,liquid__bot,2016-11-29 23:09:50+00:00
128,803737664981757955,"BT: ""I call vapes douche flutes"" 😂😂😂",maddiex3x3,2016-11-29 23:09:26+00:00
129,803737351629508608,the taxi driver is vaping💨,NorbertJarski,2016-11-29 23:08:12+00:00
130,803737291059564544,Competition: Win the Psycho Bunny range from Eco Vape https://t.co/kK5FHIbovV #vaping #ecigs,scarey2025,2016-11-29 23:07:57+00:00
131,803737248352960512,From my shops fb account. Crazy deals on glass and ejuice going on https://t.co/d662Da67mV,vapes_and_more,2016-11-29 23:07:47+00:00
132,803737172629041153,Competition: Win an Innokin Coolfire IV and Axiom https://t.co/5E8yQopYUm #vaping #ecigs,scarey2025,2016-11-29 23:07:29+00:00
133,803737153972805632,Say no to cigarettes. And get that vape nonsense away from me too. I'm not at all interested in being a guinea... https://t.co/Au0anHc60T,Corkprichard,2016-11-29 23:07:24+00:00
134,803736947147554816,Why do people vape if they NEVER smoked before hand??????,_griffx,2016-11-29 23:06:35+00:00
135,803736891975680000,Competition: Win an Innokin Coolfire IV and Axiom https://t.co/5UCi593EBv #vaping #ecigs,ZGyurko,2016-11-29 23:06:22+00:00
136,803736863777226752,Have you tried our Strawberry Frosted Donut w\ Jam Filling? Your Missing Out If Not! #Vape #Vapes #Vapor #ECigarette https://t.co/7KchFUpCjd,The_Sekhmet,2016-11-29 23:06:15+00:00
137,803736849667723264,Competition: Win the Psycho Bunny range from Eco Vape https://t.co/3CpTi22L4B #vaping #ecigs,ZGyurko,2016-11-29 23:06:12+00:00
138,803736836157870080,having yummy smelling vape clouds blown on you is the goat,AmyTipton16,2016-11-29 23:06:09+00:00
139,803736801781260288,A W E S O M E !!! https://t.co/rj1bpM9oc5 #vape #vapenation #vaping #vapefam #vapelife #vapecommunity https://t.co/zuwA6hJkqf,dude_vape,2016-11-29 23:06:00+00:00
140,803736794000982016,Have a chance to #win the KOOPOR Beast Kit by @SMOKTECHLOGY #vape #vaping #giveaway #vapepromote https://t.co/nQPdYYPx4C,ZGyurko,2016-11-29 23:05:59+00:00
141,803736668318466049,"Watching the homie, what should I vape on?? #vape #vaping #vapecommunity #vapeporn #ejuice… https://t.co/PqP6Y4OFEG",iamjackvapes,2016-11-29 23:05:29+00:00
142,803736613436145665,5 facts that everyone gets wrong about vaping https://t.co/fH0rZx727I https://t.co/2PLTYUsenk,topshelfwhole,2016-11-29 23:05:16+00:00
143,803736367914225665,"Great article on @ABillionLives. Free screening in #Savannah, GA on Dec 5th. https://t.co/18AyIswDna #vaping #ecigs ht @TypeItLoud",GregTHR,2016-11-29 23:04:17+00:00
144,803736088728596480,"✨✔😘😘Defeat The Ghost For Me! 👻 YoKitty🔥$IN:#Vape #Music #FeatureMe
https://t.co/tDZmyHZtVx https://t.co/qCoJ4q2dRq",ShecklerTed,2016-11-29 23:03:10+00:00
145,803736027894423553,4.7-Inch iPhone to Feature #Wireless_Charging Next Year https://t.co/FjL9yU3DSL @scottia https://t.co/1tE70Ob44K,ragen_vaper,2016-11-29 23:02:56+00:00
146,803736021800079361,"Cyber Monday Sales Live for #iPhones, #Macs, #iPads, Accessories, and More https://t.co/kGpLnWAm2J @scottia https://t.co/Ygcesxf1ge",ragen_vaper,2016-11-29 23:02:54+00:00
147,803735973855010816,I just got a vape so am I cool yet ?,ben_santiago23,2016-11-29 23:02:43+00:00
148,803735964925497344,Shop Online here for your #Vaping &gt;&gt; https://t.co/5i46jwSQVt #ecigarette #vaper #ecigs #eliquids #ultracloud https://t.co/dYvD8Dx3vU,ShopDealers,2016-11-29 23:02:41+00:00
149,803735817239687168,What Is Sub Ohm #Vaping: Everything You Need To Know For Huge Clouds https://t.co/UUh22eXCXw #SubOhmVaping https://t.co/P4IKpt9iPp,VaporessoEcig,2016-11-29 23:02:06+00:00
150,803735725749452800,I present you The Vaper Mice from Mars via /r/funny https://t.co/1OvtLKq3Re,bizlunchbox,2016-11-29 23:01:44+00:00
151,803735707814461440,"however much shit sucks at this moment, at least I can vape weed &amp; surf the internet while on the toilet 

the future is now",ChristenP,2016-11-29 23:01:40+00:00
152,803735679003815936,"Episode 99: Dave Talks Dynasty, Vape Gravy, and Vaping Community. - https://t.co/W1Y4oqFh8n",JuiceChest,2016-11-29 23:01:33+00:00
153,803735557155225600,Green Apple Vape Juice https://t.co/ZHzicfHQZa #vaping #vapecommunity #eliquid #E-Liquid https://t.co/dST5q9MfyK,4_Fox_Sakes,2016-11-29 23:01:04+00:00
154,803735554508656640,Big LAs a big vape and vampire weekend kid,Winbolt,2016-11-29 23:01:03+00:00
155,803735550335320064,"Paradise is a tasty watermelon, strawberry-kiwi blend with a light tropical twist. #vape #vapelife #pearl #houston #houstonvapers #eliquid https://t.co/Qz31gf2AC1",pearleliquid,2016-11-29 23:01:02+00:00
156,803735498040680448,150$$ super clean rig 👽👽👽 https://t.co/E1knXfQuA8,vapes_and_more,2016-11-29 23:00:50+00:00
157,803735342104846337,Time to make your shopping list! Get the vapers on your list what they really want? Our holiday shopping tips: https://t.co/GMa5chkhdk #vape https://t.co/14LU4JLgp6,HaloCigs,2016-11-29 23:00:12+00:00
