,TweetID,TweetContent,TweeterUsername,TweetDatetime
2182,803486830536572928,We didn't have power last night - so the Vape Mat repellent was useless and the mozis came down on me like the Second battle of Fallujah,MediaMK,2016-11-29 06:32:43+00:00
2183,803486819044073472,"/pol/ack on electronic cigarettes:
""vape is more expensive, ie classy. It's like a mouth fedora""",Violence6K,2016-11-29 06:32:40+00:00
2184,803486640907821056,Now this is what I call a VAPE DATE #SEXYVAPER#VAPEME#CLOUDCHASER https://t.co/oZKKI5SHzO,GetItFromMeNow,2016-11-29 06:31:57+00:00
2185,803486455133663232,"Deadass, I'm no longer human.",sentient_juul,2016-11-29 06:31:13+00:00
2186,803486171221389312,MTV's Vape My Drone,thisisjbs,2016-11-29 06:30:05+00:00
2187,803485788122005504,I don't know why someone would willingly date someone who vapes,whitelightnin_g,2016-11-29 06:28:34+00:00
2188,803485723244408832,#MustWeed Hmbldt Vape Pens Just Made https://t.co/QRBBGEsao9’s 25 Best Inventions List https://t.co/X5GxgX54NW #Cannabis #Stocks #News https://t.co/pfvd3DXwMs,OtcPicker,2016-11-29 06:28:19+00:00
2189,803485695796883456,#MustWeed Hmbldt Vape Pens Just Made https://t.co/134jUlFBsv’s 25 Best Inventions List https://t.co/aqph7I7V9F #Cannabis #Stocks #News https://t.co/Y83BSMpGeq,Fortune420Group,2016-11-29 06:28:12+00:00
2190,803485686141595648,#MustWeed Hmbldt Vape Pens Just Made https://t.co/3Yq7xOd7Qs’s 25 Best Inventions List https://t.co/C1lstPP4BX #Cannabis #Stocks #News https://t.co/vNX0fagiJ2,MustWeed,2016-11-29 06:28:10+00:00
2191,803485684417736704,#MustWeed Hmbldt Vape Pens Just Made https://t.co/bDHm5THUz0’s 25 Best Inventions List https://t.co/TcPoiX1Z08 #Cannabis #Stocks #News https://t.co/jl0NNjpTJj,cannabistweets3,2016-11-29 06:28:09+00:00
2192,803485682228305920,#MustWeed Hmbldt Vape Pens Just Made https://t.co/CQeS2MtHo0’s 25 Best Inventions List https://t.co/ZfuePm1lho #Cannabis #Stocks #News https://t.co/mwY1IWE0XE,BurstingSquid,2016-11-29 06:28:09+00:00
2193,803485038281007104,I'm Carver Hawke And I Endorse Vaping,CarverBot,2016-11-29 06:25:35+00:00
2194,803484811687907328,"""I need new vape juice"" - my roommate",_kateirl,2016-11-29 06:24:41+00:00
2195,803484745300582400,Officer it's not a gun it's just my vape pen.,Amami_eBooks,2016-11-29 06:24:25+00:00
2196,803484724413034496,"Vaping – A Boon For Smoking Addicts

Smokers always feel tough to get rid of their habit. They continue to smoke in spite of knowing the il…",rcelindanisha41,2016-11-29 06:24:20+00:00
2197,803484619714818049,"Every time I exhale in this weather I'm just like ""aha suh dude clouds bro vape nation amirite 😂😂😂😂👌🏻👌🏻👌🏻👌🏻💯💯💯💯",Snackbarxx,2016-11-29 06:23:56+00:00
2198,803484148509741056,Get special offer on best e-liquid vape juice @ https://t.co/B73q1Kaf5G,uselectriclotus,2016-11-29 06:22:03+00:00
2199,803483555007447040,"Dio: you either forget or vape, dude.",ZEshitpostbot,2016-11-29 06:19:42+00:00
2200,803483439286521856,Obi-Wan Kenobi May Return in Star Wars: Episode VIII https://t.co/HvlOlHPB6B @scottia https://t.co/mhbnD9nYjP,ragen_vaper,2016-11-29 06:19:14+00:00
2201,803483431732584453,Star Wars 8 Trailer Won't Arrive Until Early 2017? https://t.co/eS09E0nFYC @scottia https://t.co/u88heetfo1,ragen_vaper,2016-11-29 06:19:12+00:00
2202,803483423314571264,Pinky by Iggy https://t.co/bZgctL6TEq @scottia https://t.co/v1zE5L8bMr,ragen_vaper,2016-11-29 06:19:10+00:00
2203,803483400858238976,Low key wanna get a new vape pen 👀,Royal_Oats,2016-11-29 06:19:05+00:00
2204,803482602980212737,"Just me and my OhmBoy joshuabandy497 after @DeathByToucan Black Friday Vape Bash 
#djdatjuice… https://t.co/YRevxWPhSY",DJK_dubb,2016-11-29 06:15:55+00:00
2205,803482334091579392,"Keep spamming me with snap chats of u vaping and smoking. I'm like, so interested! I wonder what it's like 🤔",kaitybabyxxx,2016-11-29 06:14:51+00:00
2206,803482237320634368,vape time,mariamikamikee,2016-11-29 06:14:28+00:00
2207,803482154340495361,The fuckery is real in the bath tub w my vape lol,interwebreality,2016-11-29 06:14:08+00:00
2208,803481702882562049,1000ml.me E-Liquid Giveaway Contest https://t.co/T7EbqnWQAr #vaping #vape #vapelife via @DarthVaporVideo,ready2mosh,2016-11-29 06:12:20+00:00
2209,803481665993658368,Like to vape #cannabis? Want to check #CBD? Try this https://t.co/4XhHxBEMtY eLiquid 500mg full plant for $30 #MMJ,ermphd,2016-11-29 06:12:11+00:00
2210,803481616203083776,"#vapefam For all your Vaping needs head over to @diamond_distro - Great Company, Fantastic People 👍💨💨💨👊 https://t.co/feXxWwB1Ei",SoulOhm,2016-11-29 06:11:59+00:00
2211,803481001011855360,i'm selling a herb vape for $50 if anyone wanna cop lmk!,NeriiAlvarez,2016-11-29 06:09:33+00:00
2212,803480453000794112,SD cards will soon get rated for app performance https://t.co/nUcAmAlkFA @scottia https://t.co/nBQdtHzLpp,ragen_vaper,2016-11-29 06:07:22+00:00
2213,803480433543348224,New York can jail ticket scalpers who use bots under new law https://t.co/qeCvyJBTMD @scottia https://t.co/7yhns35Zbw,ragen_vaper,2016-11-29 06:07:17+00:00
2214,803480416653049856,my face when I order my vape ... seriously,okayjohnsmith,2016-11-29 06:07:13+00:00
2215,803480330002898944,"Someone tell me where I can get a good vape mod for a good price, in need of one, thanks 😇",paigeejor_,2016-11-29 06:06:53+00:00
2216,803480066353221632,I need to buy me a vape asap,Alfredo_Sauce_,2016-11-29 06:05:50+00:00
2217,803479896379027457,Try the most dead on flavors!! #Vaping #eliquid https://t.co/VKXSy7d4bD,vape_crusader,2016-11-29 06:05:09+00:00
2218,803479110609698816,Few weeks ago (when it was still warm and sunny!) Juul learned to do the handstand and ever… https://t.co/R6hqqdi8wj,noeserEU,2016-11-29 06:02:02+00:00
2219,803479047816744960,Vape life 💨,INtice6goddess,2016-11-29 06:01:47+00:00
2220,803479034197897216,"PREMIUM VEHICLE JUST LIKE PREMIUM VAPING BY VIP!
#VIPsouthafrica
2006 Porsche 997 Carrera S - One Take https://t.co/VTiQrtkLmI via @YouTube",vip_africa,2016-11-29 06:01:44+00:00
2221,803479033228836864,"He been the bro ever since kasama freshman year, he's always dropped in swaggooo he vapes, overall great dude 🙌🏻 https://t.co/pOA5DPZ1JT",PurpleActivistt,2016-11-29 06:01:44+00:00
2222,803478894447710208,Watch a tuned-up vape explode in the pocket of this unexpecting guy https://t.co/DkMbNeE0nu #SoftWebLB #LetsTech https://t.co/S1jdq6XtQl,softweblb,2016-11-29 06:01:11+00:00
2223,803478866660655104,Eastwood Tobacco Vape Juice https://t.co/L07nIrBZfa #vapecommunity #vape #Tobacco https://t.co/BvJakHbzs8,4_Fox_Sakes,2016-11-29 06:01:04+00:00
2224,803478792878563328,"FDA's Ban on Vaping: The Ugly Truth - It's time to fight back!
by Jim McDonald @whycherrywhy 
https://t.co/zAbl1FMyc5",Vaping360,2016-11-29 06:00:46+00:00
2225,803478787925168128,"2 Hours Left!
#vape #vapeporn #vapelife #vapelyfe #calivapers #vapehooligans #ejuice #eliquid https://t.co/j84MynRuSU",yougotejuice,2016-11-29 06:00:45+00:00
2226,803478699425300480,Pero like do you even vape or you're jus like fakin... — Strictly lips  https://t.co/ZFyEzqcSVI,RickyLopez333,2016-11-29 06:00:24+00:00
2227,803478630022070272,a middle aged man just walked past me and blew the biggest vape cloud i think ive ever seen. incredible.,emchands,2016-11-29 06:00:07+00:00
2228,803478619049914368,Hurry up &amp; shop now because our #CYBERMONDAY #vape deals end in less than 3 hours! CLICK &amp; SAVE &gt;&gt; https://t.co/yCDpcUao1w https://t.co/nIQiL5hsDA,volcanoecigs,2016-11-29 06:00:05+00:00
2229,803478603266723840,Some of the bottles that stood out to me. I love the packaging and look of these! Can't wait to try them all! #Vape #VapeJuice #Vapor #Juice https://t.co/75EwbVv4PN,SiberianHusky03,2016-11-29 06:00:01+00:00
2230,803478505908555776,"✨✔😘😘Defeat The Ghost For Me! 👻 princess b 22:#vape #FeatureMe #Veri
https://t.co/OfCEfxK3aR https://t.co/5kJkgG5tKT",xPINKNOVAx,2016-11-29 05:59:38+00:00
2231,803477964650377217,does joe biden vape,KLobstar,2016-11-29 05:57:29+00:00
2232,803477938880581632,"I would like to buy a vape as a present, suggestions needed. via /r/vaporents @bernardmoss https://t.co/UOvCsmfg30 https://t.co/RK7Ivr8NuH",MrTHPQC,2016-11-29 05:57:23+00:00
2233,803477881460584450,"Sounds like another #Canadian winter, cold weather #vape candidate https://t.co/QLPNXKy29L",meetzman,2016-11-29 05:57:09+00:00
2234,803477417973190656,Have a chance to #win the KOOPOR Beast Kit by @SMOKTECHLOGY #vape #vaping #giveaway #vapepromote https://t.co/GiPzEXWlik,baileiz,2016-11-29 05:55:18+00:00
2235,803477328810491904,#Vape on / off @cathaypacific #Boeing #777 departure @yvrairport for #HKG #HongKong #BKQS #yvrspotters #Vancouver #B77W #BKQS #vapor #rain https://t.co/XswIVkk8Ts,Kent_YVR,2016-11-29 05:54:57+00:00
2236,803477038707261440,Check it out on YouTube or iTunes you will love it @VaporWhitehorse #whitehorsevaporca #vape… https://t.co/cUhvElkGL2,VaporWhitehorse,2016-11-29 05:53:48+00:00
2237,803476710142320640,shane gave me his old vape and i actually love it #vapeislife,stevenanaya_,2016-11-29 05:52:30+00:00
2238,803476466994446336,Strawberry Mimosa is an all week vape!! You need this in your life. #usa #beijing #shenzhen… https://t.co/AwLR6ebldE,MidnightRoyalVP,2016-11-29 05:51:32+00:00
2239,803476428394299392,"Ready Stock Hadaly Mirror Clone

Now Available in Offline Store Kedai Vape
Alamat: Jln.Hos… https://t.co/LhA2i84fxp",willybibeh,2016-11-29 05:51:23+00:00
2240,803475784849649664,I got vape juice in my eye this is it this is how I die,dopexthrone,2016-11-29 05:48:49+00:00
2241,803475720957784064,RT vaporjoes:Vapor Joes - Daily Vaping Deals: THE MORNING AFTER:  VAPORJOES NETWORK DROPS THE HA... https://t.co/6It3YEodiW #vaporjoes #Va…,VUClassifieds,2016-11-29 05:48:34+00:00
2242,803475586614169604,I just joined a new @DailyVapingNews &amp; @CoilMasterNet GIVEAWAY for new COIL MASTER vape gear! You can join here:  https://t.co/4kj0XkJJou,sptodd18,2016-11-29 05:48:02+00:00
2243,803475481643380737,Thank you sa Vape ☺😍😘💨💨,jaysonhabana143,2016-11-29 05:47:37+00:00
2244,803475468536180736,Vapor Joes - Daily Vaping Deals: THE MORNING AFTER:  VAPORJOES NETWORK DROPS THE HA... https://t.co/AKNLw4O3uk,vaporjoes,2016-11-29 05:47:34+00:00
2245,803475262851710976,This is my friend @Briii_Johnson with her vape life sticker https://t.co/d39G4PgioG,sammisugs,2016-11-29 05:46:45+00:00
2246,803475216814903296,Anti-Tobacco Legislation To Negatively Impact Vaping In Nation’s Capital https://t.co/oBF1VTiPoX #AgentVAPENewsandNotes #antitobaccolaws https://t.co/zRzI3QPHmK,twistedmistvape,2016-11-29 05:46:34+00:00
2247,803475106337095680,“Vape Museum”,big_microbe_,2016-11-29 05:46:07+00:00
2248,803474536083714048,Buying a Vape was the best purchase I made all year lol,retro_a_6,2016-11-29 05:43:51+00:00
2249,803474314771234816,i'll be able to actually fix my vape sooon.,makaylaml_,2016-11-29 05:42:59+00:00
2250,803474298518327296,I support #vape &amp; small businesses. I stopped smoking b/c: Vote NO - got clean xray @SenTedCruz @RepHensarling @RepLouieGohmert @JohnCornyn,dogusainc,2016-11-29 05:42:55+00:00
2251,803473998000504832,On a scale of one to vape how FUCKING 42,Viola_Ebooks,2016-11-29 05:41:43+00:00
2252,803473900789174272,I vape cause my head is always in the clouds. https://t.co/1PyV7lYV8i,TheYungSwervie,2016-11-29 05:41:20+00:00
2253,803473833831251972,"Shinsuke won't stop talking about this ""vaping"" thing...",tsurugibot_en,2016-11-29 05:41:04+00:00
2254,803473652025098240,I need a new vape,20keiS,2016-11-29 05:40:21+00:00
2255,803473353788882944,"""my teacher really thinks I did my work? the only pen I picked up last week was my vape pen""",thouxanbanren,2016-11-29 05:39:10+00:00
2256,803473320494645248,Anti-Tobacco Legislation To Negatively Impact Vaping In Nation’s Capital https://t.co/GIx54hM0OG #Vaping,ISpotVapes,2016-11-29 05:39:02+00:00
2257,803473051853721600,i thought the girl in the car next to me was talking into a walkie-talkie but it turned out to be a vape,mybadlmao,2016-11-29 05:37:58+00:00
2258,803472906554458112,This dude so silly. He snapchatted me a picture of a vape and said lets have high sex. LMAOOOO,jessicaaxsilva,2016-11-29 05:37:23+00:00
2259,803472696503844864,"Stainless steel materials, let the senior electronic cigarettes vapers going back to 2013,but more than that. https://t.co/E7VszzH72u",toby26999563,2016-11-29 05:36:33+00:00
2260,803472682666885120,"🎶Bananarama🎶
The GWEN
by juice.wayne.eliquid 

As far as banana vapes are concerned, this was… https://t.co/hCzyAB1OFU",dcinkslingerDT,2016-11-29 05:36:30+00:00
2261,803472337651769344,Let's talk about #vaping and let's talk about what it's really doing to you --&gt; https://t.co/jC58mFfPpx  #health #ECig #smoking https://t.co/q5sglSwkw4,dailyRx,2016-11-29 05:35:07+00:00
2262,803471714109767680,"Whenever I see someone on a long board, I want to yell at them ""we get it, you vape"" #doucheboard",apepelis,2016-11-29 05:32:39+00:00
2263,803471660355567617,I'm at Vape Century in Selangor https://t.co/a8qzDe02FI,ashleylicious_,2016-11-29 05:32:26+00:00
2264,803471523193319424,"Shall we gather for whiskey and cigars tonight?

Well, Scotch and vaping for me, but yeah I'm playing Dishonored 2 again (as Corvo!). https://t.co/Vy3dk5Gebg",dphrygian,2016-11-29 05:31:53+00:00
2265,803471246147067905,I can go all day with the comparatives to @LCBO products. GoC (@HealthCanada) cannot suck and blow (no pun intended) on the #vaping issue.,meetzman,2016-11-29 05:30:47+00:00
2266,803471214866006016,"norcal_exp ✨Photography! 📸
・・・
We get it. You vape.
..
.
.
.
.
#NSE_SIGHT #savage_lenzes… https://t.co/Wy509gFZ8b",CofTheBayArea,2016-11-29 05:30:40+00:00
2267,803471140928692225,"some girl just shook my hand and said this about my videos:
""I feel like i can now be the best vaper I can be""
""Your videos are progressive""",notalekmichael,2016-11-29 05:30:22+00:00
2268,803471122746331136,i left my vape charger at doras and i wanna DIE,EmpireCrowning,2016-11-29 05:30:18+00:00
2269,803471107835559936,Vape/drifting/never sleeping https://t.co/uFQPMgTjXe,sydkaye0621,2016-11-29 05:30:14+00:00
2270,803470754855682049,"Dessert!!! Now!
Da Vida
by juice.wayne.eliquid 

This was tasty! A good dessert vape, if I do… https://t.co/JF3QZBrJa6",dcinkslingerDT,2016-11-29 05:28:50+00:00
2271,803470416375414784,who wants to buy a vape,joelbarela1,2016-11-29 05:27:29+00:00
2272,803470177807503360,SMOK TFV8 V8-T10 Replacement Coils! #vaping #vape #vapefam https://t.co/pDSu3cx6KE,AspenValleyVape,2016-11-29 05:26:32+00:00
2273,803470150200606720,"""palate offers up a reminder of orange creamsicles."" Seriously? I can drink it, but possibly not #vape it? #cdnpoli https://t.co/IMvJYOToDU",meetzman,2016-11-29 05:26:26+00:00
2274,803470050233556992,Need to make my room a no vape zone bc of Tyler🙄,Abbbbbbbbbyy,2016-11-29 05:26:02+00:00
2275,803469818611515393,Star Wars: How Close Did We Come to Josh Trank's Boba Fett Movie? by @DenofGeekUS https://t.co/D6wu9LHWaj,vape_crusader,2016-11-29 05:25:07+00:00
2276,803469606795014144,#CultOfBlackPhillip lives on. https://t.co/BcgNW0ltsR,DTOM_Vape,2016-11-29 05:24:16+00:00
2277,803469593813680128,"""lemonade and lime sherbet aromas; lemonade and sweet lime flavours"" Again, not a #vape, @janephilpott https://t.co/Dsyg0gFeub",meetzman,2016-11-29 05:24:13+00:00
2278,803469579951505408,Talking amusing things with @CallMeBodhi. STILL WAITING ON MY VAPE TO WORK.,ItsJustWolfpack,2016-11-29 05:24:10+00:00
2279,803469266838323200,"""you know what happens to your type in detention? it rhymes w grape...vape"" *scares freshmen*",sofiianaranjo,2016-11-29 05:22:55+00:00
2280,803468996246929409,my vape finally went dry and i have no more vape juice fuckkkkk,tbslous,2016-11-29 05:21:51+00:00
2281,803468883730505728,I hate it when Lapis vapes the  GPS.  X'D,bzzzzzzzzzzzzzt,2016-11-29 05:21:24+00:00
2282,803468726037311488,"""Clear blue colour; aromas of candy-floss; sweet with citrus, blueberry and wine gum tones."" Not a #vape. https://t.co/J97AxIvV83",meetzman,2016-11-29 05:20:46+00:00
2283,803468566896836608,Maureen McCormick Fights Back Tears Remembering Her ‘Brady Bunch’ Mom Florence Henderson Days After Her… https://t.co/i04ca3pDNl @scottia https://t.co/aqlLkV5gBz,ragen_vaper,2016-11-29 05:20:08+00:00
2284,803468558504062976,Brandi Glanville Apologizes for Offensive Nativity Post https://t.co/3cBVmkLUVU @scottia https://t.co/iIII8DtkFR,ragen_vaper,2016-11-29 05:20:06+00:00
2285,803468527998881792,It's 4:20 and I'm vaping,WadeLye_,2016-11-29 05:19:59+00:00
2286,803468346565873666,Are you charging your fucking vape right now,Donttipme,2016-11-29 05:19:16+00:00
2287,803468242266116096,"So, I quit smoking and switched to vaping and my dog is very confused as to why I'm not going out for a cigarette every 15-30 minutes...",ghostofadreamer,2016-11-29 05:18:51+00:00
2288,803468175232929792,We get it you vape #PS4share https://t.co/0YrOi5qdKi,True_Tech,2016-11-29 05:18:35+00:00
2289,803468174666661888,Question from a new vaper via /r/Vaping101 https://t.co/vWibqOjZhR,VapingEnFrance,2016-11-29 05:18:35+00:00
2290,803468143981170688,vape gods https://t.co/lZyR1VJXIu,rhearlm,2016-11-29 05:18:27+00:00
2291,803467235700469760,"Rayvapor Family
vape fair 2016
see u next year!! #jvsvapefair2016 https://t.co/HhJhyn2oBA",rayvapor,2016-11-29 05:14:51+00:00
2292,803467235104870402,Mod Review - TESLA TWO SUB BOX 100W - Amy's Vape... https://t.co/VHORfsOWF7,vapeparsing,2016-11-29 05:14:51+00:00
2293,803467169606594560,"Vape, personality, smile, and cars https://t.co/pdOOrTmV2l",fmlteag,2016-11-29 05:14:35+00:00
2294,803466907651166208,I just joined a new @DailyVapingNews &amp; @CoilMasterNet GIVEAWAY for new COIL MASTER vape gear! You can join here:  https://t.co/lU5taQJ81y,MilsonV1,2016-11-29 05:13:33+00:00
2295,803466885631070208,ＳＩＭＰＳＯＮ ＶＡＰＥＲ ＷＡＶＥ,flatwoodsmonste,2016-11-29 05:13:27+00:00
2296,803466673479004162,In other news I found my vape. Long time no see. https://t.co/f0bMrSGy95,STACKbeezy,2016-11-29 05:12:37+00:00
2297,803466394914299904,We just got some new *$50 TopShelf 1/8th &amp; 1G Cannabis Vape cartridge*,INDROFIRE,2016-11-29 05:11:30+00:00
2298,803466242908635136,Not one comment on Obama/HIllary's FDA war on Vaping.,nibla_ebooks,2016-11-29 05:10:54+00:00
2299,803466143042150401,his vape and music https://t.co/m4hM5wjLkH,shelbybyler_,2016-11-29 05:10:30+00:00
2300,803465913949388800,Morning vapors looks like it cinnamon roll for work 😂 @yougotejuice @Sturm20132013 #vapefam #Vapenation #vapelife #vapemate #vape #vapeon 💨💨 https://t.co/bn7ZmPkKaD,Scottpoulton3,2016-11-29 05:09:36+00:00
2301,803465656817434624,OK. Who's seen my vape thingy?,ghost_shit,2016-11-29 05:08:34+00:00
2302,803465575020294148,I liked a @YouTube video from @kevinmackdaddy https://t.co/J05yVwVw0I Vape Lord Nord Picks Up Girls,lambokid2,2016-11-29 05:08:15+00:00
2303,803465502601474049,"Now watch ppl say ""I don't smoke I vape!"" 😒 

 #رساله_توجهها_للمدخن https://t.co/ta17W46jTy",iBritsy,2016-11-29 05:07:58+00:00
2304,803465490555281408,Gaming and vaping#Liveme Grayson Jae Landgraf: https://t.co/3GbAlNPnVA https://t.co/uIYSiqtZyh,KyleighKnight1,2016-11-29 05:07:55+00:00
2305,803465406329581568,Eleaf istick iJust 2600mAh Battery 2 Kit Mod with 5.5ML Tank 510 Thread Vape Kit https://t.co/fJ5YTFABhp https://t.co/aGzaqFicNY,OutstandingEle,2016-11-29 05:07:35+00:00
2306,803465299647287296,Panic discontinuing Status Board stats app following final iOS 10 support update https://t.co/ooAcHLjJOk @scottia https://t.co/dw1xVn7rU1,ragen_vaper,2016-11-29 05:07:09+00:00
2307,803465256613900288,"New post added at Get Best Experience With E Cigarette
SHOP AT https://t.co/DTxEP9G0As AND GET YOUR VAPE ON.  WE... https://t.co/tF0geHDW1a",ECIGCANADAZONE,2016-11-29 05:06:59+00:00
2308,803465244156850176,"New post added at Get Best Experience With E Cigarette
SHOP AT https://t.co/DTxEP9G0As AND GET YOUR VAPE ON.  WE... https://t.co/jRKZ0zFArr",ECIGCANADAZONE,2016-11-29 05:06:56+00:00
2309,803465211911045120,"New post added at Get Best Experience With E Cigarette
SHOP AT https://t.co/DTxEP9G0As AND GET YOUR VAPE ON.  WE... https://t.co/GwPaLkMhd0",ECIGCANADAZONE,2016-11-29 05:06:48+00:00
2310,803465206634520576,"New post added at Get Best Experience With E Cigarette
SHOP AT https://t.co/DTxEP9G0As AND GET YOUR VAPE ON.  WE... https://t.co/Yv8SETpLe2",ECIGCANADAZONE,2016-11-29 05:06:47+00:00
2311,803464898051248128,"New post added at Totally Wicked Smoke Juice
SHOP AT https://t.co/DTxEP9G0As AND GET YOUR VAPE ON.  WE SHIP FROM... https://t.co/pyFGO0D2fT",ECIGCANADAZONE,2016-11-29 05:05:34+00:00
2312,803464892544073728,"New post added at Totally Wicked Smoke Juice
SHOP AT https://t.co/DTxEP9G0As AND GET YOUR VAPE ON.  WE SHIP FROM... https://t.co/KQpP1CO2Y4",ECIGCANADAZONE,2016-11-29 05:05:32+00:00
2313,803464840178233344,"New post added at Totally Wicked Smoke Juice
SHOP AT https://t.co/DTxEP9G0As AND GET YOUR VAPE ON.  WE SHIP FROM... https://t.co/rvI96QwPzq",ECIGCANADAZONE,2016-11-29 05:05:20+00:00
2314,803464832133591040,"New post added at Totally Wicked Smoke Juice
SHOP AT https://t.co/DTxEP9G0As AND GET YOUR VAPE ON.  WE SHIP FROM... https://t.co/wqZkJXBBcM",ECIGCANADAZONE,2016-11-29 05:05:18+00:00
2315,803464798788845572,"Children are riding bicycles on crown corporation promoted cans of beer, @IvannaH5. Strangely craving a pumpkin spice #vape. https://t.co/QQu30v2jcl",meetzman,2016-11-29 05:05:10+00:00
2316,803464091083735040,"Don't really know him that well, but he is chill and hella nice and may or may not vape much https://t.co/4mYwEjcOEv",jasonmp15,2016-11-29 05:02:21+00:00
2317,803463937404575744,"New post added at The Late Late UK Vape Show - Nov 24th
SHOP AT https://t.co/DTxEP9G0As AND GET YOUR VAPE ON.  WE... https://t.co/8js54G7V6x",ECIGCANADAZONE,2016-11-29 05:01:44+00:00
2318,803463908182913024,"New post added at The Late Late UK Vape Show - Nov 24th
SHOP AT https://t.co/DTxEP9G0As AND GET YOUR VAPE ON.  WE... https://t.co/visjqpbCKQ",ECIGCANADAZONE,2016-11-29 05:01:38+00:00
2319,803463772652339200,"New post added at The Late Late UK Vape Show - Nov 24th
SHOP AT https://t.co/DTxEP9G0As AND GET YOUR VAPE ON.  WE... https://t.co/Kg2OX2bXkM",ECIGCANADAZONE,2016-11-29 05:01:05+00:00
2320,803463768512532480,Cookie Doodle Vape Juice https://t.co/72e8zaMddY #eliquid #vapecommunity #Candy https://t.co/aBMRkxDkY1,4_Fox_Sakes,2016-11-29 05:01:04+00:00
2321,803463733783695360,I'm gonna start vaping 😂,TheEbonyMessiah,2016-11-29 05:00:56+00:00
2322,803463668570685444,"3 Hours Left!
#vape #vapeporn #vapelife #vapelyfe #calivapers #vapehooligans #ejuice #eliquid https://t.co/hHbgqma9mn",yougotejuice,2016-11-29 05:00:40+00:00
2323,803463638455619584,happy 7th bday!! thanks for all the gn snaps even though they're not as good as mine 🙄 don't vape too hard today!! 🎉 #YIT @marwizzzle https://t.co/SHRljd08L0,dankstiny,2016-11-29 05:00:33+00:00
2324,803463520096374785,"Store Lead - Supervisory - King St W (Liberty Village) - 180 Smoke Vape Stores - Toronto, ON https://t.co/oDs4Kwns7j #JOBS #IT",jobs4Toronto,2016-11-29 05:00:05+00:00
2325,803463518569648128,"180 Smoke Vape Sales Consultant (Beaches) - 180 Smoke Vape Stores - Toronto, ON https://t.co/Wcf3wA7d4k #JOBS #IT",jobs4Toronto,2016-11-29 05:00:05+00:00
2326,803463518255284224,"Liquid City | Midtown Menthol

Stay cool and vape on some Midtown Menthol.
#LiquidCity https://t.co/iZhTKPvYFG",vapeliquidcity,2016-11-29 05:00:05+00:00
2327,803463516770496512,Time is running out for you to save over 70% on the best #vape gear during our #CYBERMONDAY sale. https://t.co/yCDpcUao1w &lt;&lt; SHOP &amp; SAVE NOW https://t.co/ka0Gj8ai9E,volcanoecigs,2016-11-29 05:00:04+00:00
2328,803463507568185344,Should I take a vid of me vaping the shatter despite how non existent your butt is,CloudyButt,2016-11-29 05:00:02+00:00
2329,803462695357796353,💨💨💨💨 (at Platinum Vape Store) — https://t.co/Rb3jNHTnx5,yandabattista,2016-11-29 04:56:48+00:00
2330,803462187603795968,💨💨 (with pebriani at Goods Vape Store®) — https://t.co/l2xdv0tmWn,David9HAYASHI,2016-11-29 04:54:47+00:00
2331,803462102891511808,I liked a @YouTube video from @djlsbvapes https://t.co/tdxYvhvI7U SMOK G-Priv Kit and Koopor Beast Kit + Big Giveaway - DJLsb Vapes,bearvape,2016-11-29 04:54:27+00:00
2332,803461817586642944,"Pre-order 
CE5 pentype vape

Pm me for orders =) https://t.co/4U3dhQidUf",iamtheresa1,2016-11-29 04:53:19+00:00
2333,803461759566835712,pass the vape in traffic,TrillInToronto,2016-11-29 04:53:05+00:00
2334,803461449041477632,#CYBERMONDAY #VAPE SALE ALERT! Only 10m remaining! Save up to 40% before this deal's gone forever! https://t.co/UowAVhYl1F https://t.co/362HCGNfEQ,vapefalcon,2016-11-29 04:51:51+00:00
2335,803461375678939136,almost started texting my mom about how i just vaped,_christewart,2016-11-29 04:51:34+00:00
2336,803461087760945155,"The only way to even start being part of the technical community, I had to worry about was the ability to vape.",meagan_ebooks,2016-11-29 04:50:25+00:00
2337,803460878561640448,"If you're going to vape, be sure to vape with the best @themedwoman13 🍁✨

#puffpuffpass #vapelife #marijuana... https://t.co/9dDHpFHX8Y",BlueEyedEnt,2016-11-29 04:49:35+00:00
2338,803460866993754112,"If you're going to vape, be sure to vape with the best @Lukeburrett 🍁✨

#puffpuffpass #vapelife… https://t.co/PSu6sCCqnL",BlueEyedEnt,2016-11-29 04:49:32+00:00
2339,803460792846786560,"Me- WOW she's gorgeous!!

*girl blows massive vape cloud*

Me- Hurry give me a ring before she realizes I'm weird",12_degroot,2016-11-29 04:49:15+00:00
2340,803460318387204096,"Real friends say ""maybe it's muscle"" when you tell them you gained 5 pounds over break",emo_juul,2016-11-29 04:47:22+00:00
