,TweetID,TweetContent,TweeterUsername,TweetDatetime
776,1326950403964084225,Has anyone taken a vape pen to DR before?,savingalejandra,2020-11-12 18:10:04+00:00
777,1326950359735042054,bitches that vape are always just chilling with the vape,guccinailss,2020-11-12 18:09:53+00:00
778,1326950321319518211,i come home and guess who set off the fire alarm by vaping AGAIN,batsugeemu,2020-11-12 18:09:44+00:00
779,1326950250045714433,"Gaystation User Bashes Xbox Series X with Fake Vaping Shit ..... Fuck Off you Idiots, since PS5 and Xbox Series X has Been Announced People bashing everything to the Ground Like snowflakes ..... 
You Guys are Disgusting These days 
What happend to the old Community 2 Years ago?! https://t.co/IJIe6bQeRQ",_kabuterimon,2020-11-12 18:09:27+00:00
780,1326950231699845120,Can you blow vape smoke in the #PlayStation5 ?,jnsavko,2020-11-12 18:09:23+00:00
781,1326950209373548544,"Yeah I vape

.",Smolbungus,2020-11-12 18:09:18+00:00
782,1326950147704565760,Xbox Responds to Series X Vape Smoke Videos https://t.co/pL2vmkvuHz,wooederrde,2020-11-12 18:09:03+00:00
783,1326950115328708608,Likely lawsuit isn’t main flaw with Missoula’s vaping ban https://t.co/YUimcH6tB8 via @missoulian,phil_w888,2020-11-12 18:08:55+00:00
784,1326950025147117568,"She deserved a blunt 
but
you were only a vape pen",trepkaprvokoff,2020-11-12 18:08:34+00:00
785,1326949927851790337,So people are rigging vapes to blow through their shiny new x boxes? Sounds like a smort idea. Can't wait to see how short a time that'll take to bite them in the ass. Water damage isn't covered on warranty boys.,JustJobiwan,2020-11-12 18:08:10+00:00
786,1326949542554726402,"Vape Avenue is not only here to generate ADA's but to also give those ADA's a greater value by offering vape products that you can buy with #ADA! the shop is coming soon and will have a online store where anyone can purchase products using #Cardano.  #AdapoolsO
#stakepool",VapeAvenue_ADA,2020-11-12 18:06:39+00:00
787,1326949519473455104,Why are the only fucking professional photos I have on hand of me vaping https://t.co/rG0czafU3Y,TheUtanium,2020-11-12 18:06:33+00:00
788,1326949472195239937,"Vaping: What do you know about it? Are you taking care of your lungs and family? Join this conversation from @the_nhhf in different forums, activities and most important: YOUR VOICE https://t.co/YDdGrAhdEh",dr_shaps,2020-11-12 18:06:22+00:00
789,1326949343077785607,Proud to carry the truly #American iconic Zippo lighters. Made in the #usa🇺🇸 #Cigars #cigar #baltimorecigars #marylandcigars #cigarlife #smoke #Hookah #Shisha #Tobacco #CBD #Kratom #glass #Pipe #pipesmoking #Vape #Vapes #Ejuice #Baltimore #Towson #maryland  #zippo #zippolighter https://t.co/Mqq4FE49Ia,district_smoke,2020-11-12 18:05:51+00:00
790,1326949084205260801,Xbox Series X owners:                      Me with a vape pen: https://t.co/dmGkqjJUKI,itsmcqueeb,2020-11-12 18:04:49+00:00
791,1326948919285182465,Current or former smokers/vapers are needed for a video documentary being created by Cuesta Public Health student interns. Participants receive a $20 gift card. Please contact cuestainterns@gmail.com to set up a Zoom meeting. https://t.co/nNpdppN44G,Cuesta_College,2020-11-12 18:04:10+00:00
792,1326948677357875200,Nigga that ain’t no vape u can hear the wires spark !!! https://t.co/AtMaID9BJN,bankroll_key,2020-11-12 18:03:12+00:00
793,1326948572454121475,"Lusciously fruity and bursting with flavour! Check out these delicious e-liquids from Lush, with such a huge range you're sure to find your fruity flavour! Shop here https://t.co/0hgah0GfiL

#vaped4u #lush #vaping #vape #eliquid #vapeshop #glasgow #fruity #flavour https://t.co/JUy4U2cHTj",vaped4u,2020-11-12 18:02:47+00:00
794,1326948531677048837,fucking losing my shit at binging with babish being a vape guy,sylvisorex,2020-11-12 18:02:38+00:00
795,1326948516296527872,"Searching for useful information about Tobacco-Free Nicotine products? eJuice Direct has you covered! Check out our FAQ at https://t.co/uHe5WfU1uu

#ejuice #vapelife #vapecommunity #vapestagram #eliquid #vapeon #vaping #instavape #vapedaily #ecig #vapejuicesale https://t.co/O3S1yWQEzD",eJuiceDirect,2020-11-12 18:02:34+00:00
796,1326948493131476992,Idk if I showed Twitter yet but here’s the official Vapes Bond car. https://t.co/1RlG2C9SIV,YaBoyTPotato,2020-11-12 18:02:28+00:00
797,1326948481014112256,Xbox: Do not blow vape smoke into your Xbox Series X https://t.co/nwJq0VKJOa #neogaf,NeoGAFThreads,2020-11-12 18:02:26+00:00
798,1326948479395115008,Michael Cohen: 'I believe Trump does go to jail' https://t.co/ROWTmqQfJz,Vaping_Gram,2020-11-12 18:02:25+00:00
799,1326948474332487680,Badly need a new vape or pod😭,ughleeeksis,2020-11-12 18:02:24+00:00
800,1326948428606222337,"Retweet if you love Glazed Donuts! 😋

Glazed Donuts - Delivering a warm glazed donut on the inhale with subtle notes of cinnamon on the exhale. 

#Loaded #LoadedELiquid #LetsGetLoaded #VapeCommunity #Vapers #FreebaseNic #FlavorChaser https://t.co/OPKU7yD5MF",loaded_ejuice,2020-11-12 18:02:13+00:00
801,1326948341704486918,"For free resources to help you quit smoking, chewing or vaping go to https://t.co/lFxwZc2QV0. https://t.co/El9mBsorH8",projectfilter,2020-11-12 18:01:52+00:00
802,1326948269050617856,"This is why people vape and dab, look at all the weed that was wasted!! 😂 #WakeNBake https://t.co/RIZETTDcLq",LeftCoastX,2020-11-12 18:01:35+00:00
803,1326948157574537225,People blowing vape into their new Xboxs has been my favorite trend this year,9kJonas,2020-11-12 18:01:08+00:00
804,1326948155510939649,Just read someone’s bio that said “hit kids not juuls” I-,jennamiles18,2020-11-12 18:01:08+00:00
805,1326948109168103425,Crazy #vape deals at https://t.co/id1ky4PIri and take another 10% off those deals with this #vapingtruth coupon code vapingtruth.,thevapegoods,2020-11-12 18:00:57+00:00
806,1326948047104991234,"A public service announcement from the people at #Microsoft...
😮‍💨🎮
#Xbox #SeriesX #vaping #blowingsmoke? https://t.co/4v6AN6Nhe3",meeplewich,2020-11-12 18:00:42+00:00
807,1326947917085745155,Find coupon codes for all things cannabis related online at https://t.co/LXDg7tjiQx! #Cannabis #Marijuana #Vape #Bong #Dank #Hydroponics #StonerFam #Pipes #THC #Ganja #Indica #Sativa #CBD #Terpenes #Dabrig #Stoned #Concentrates #Coupons #Deals #Shopping https://t.co/89vSSlPpmn,saveoncannabis,2020-11-12 18:00:11+00:00
808,1326947915655475201,"While some idiots decided to vape into their console to fake a smoking system, it seems a handful of units are having some legitimate issues. https://t.co/Lz4pc4nWFO",inputmag,2020-11-12 18:00:11+00:00
809,1326947874039590915,Banning #vapes won't help people quit but will only establish a black market. We need our governments to ensure access and safety - not to strip away our rights. #vapingsaveslives #wevapewevote https://t.co/vlmOJ7w0uZ,vapers_alliance,2020-11-12 18:00:01+00:00
810,1326947827868708864,Glad i don’t have one Bc I would have tried to vape out of it not in it https://t.co/lUM9o5h6Jb,justcallmecam20,2020-11-12 17:59:50+00:00
811,1326947717973684225,"every once in a while i gotta reign in my weed consumption

and im usually at 0, homie // zero herb

when i take mushy trips to reset myself -/

i love smoking while tripping, so this time.../+

i happen to have lil' oil left on my vape ...

me @ me 4 me",_pretty_ill,2020-11-12 17:59:24+00:00
812,1326947421486804993,I think vaping is the key to ending toxic masculinity. There is no way I'm gonna let someone criticize me for not knowing how to chang a head light when they suck on strawberry lollipop flavored smoke from a pen.,RockwoodJade,2020-11-12 17:58:13+00:00
813,1326947382702051329,"Relx may not be a name you will hear much about but within the next 10 years, they could be the shining beacon of hope for all vaping hardware manufacturers and vapers alike.

Read more here 👇
https://t.co/BY7QJ1wwQR",DripHacks,2020-11-12 17:58:04+00:00
814,1326947251382464512,jay vapes lounge. a channel for the people 💪🏼💨💨💨💨💨💨 https://t.co/RTbLjVgn7v,jayvapelounge,2020-11-12 17:57:32+00:00
815,1326946964953460737,i got myself a goth girls &amp; juuls 2 no cap,susjayxo,2020-11-12 17:56:24+00:00
816,1326946897794363392,Maybe the new #Xbox bit lacking on that vaping,adamghossen555,2020-11-12 17:56:08+00:00
817,1326946858292416512,all im saying is life didnt feel this hard when i had full access to mint juul pods,blazeddoughnutt,2020-11-12 17:55:59+00:00
818,1326946763652145153,"For your safety and comfort, this station operates a no vaping policy. Have a nice day.",traindroid_se,2020-11-12 17:55:36+00:00
819,1326946759826935833,people vaping there xbox poggers,bobandbanna,2020-11-12 17:55:35+00:00
820,1326946733528641536,People really bought a Xbox series x just to blow vape smoke in it to give it a negative review lmao,a1mighty_SO,2020-11-12 17:55:29+00:00
821,1326946668508549130,Tyler perry really be dragging these eposides bc it ain’t no way curtis been high off a vape pen the WHOLE eposide 😒,_lovvvveeeee,2020-11-12 17:55:13+00:00
822,1326946666889568261,State of Vape: What Lies Ahead For Vape https://t.co/au43TQw3IB,eliquidcom,2020-11-12 17:55:13+00:00
823,1326946542499098624,"I love #Vaping no matter what they say.....but you gotta be cautious out here in #America🇺🇸.....

https://t.co/7HpjOh3Wq7",ClayEnterprise,2020-11-12 17:54:43+00:00
824,1326946531640008705,"No one: 

Me on google: can vaping make you have the flu",brifolletttt,2020-11-12 17:54:41+00:00
825,1326946526137102336,The person who works at the king irving that rolls their eyes when I buy vape pods https://t.co/7pWJDF4Q6A,MamiMar666,2020-11-12 17:54:39+00:00
826,1326946468146581505,make every juul pod taste like laundry detergent and clean linen to prevent kids from getting into it,lowbatteryakira,2020-11-12 17:54:26+00:00
827,1326946397783027712,"I love when our ticker rises!  Big things are happening...can't wait to share.  Stay Tuned! 
$LVGI $HEALTHCARE $keto $Vape https://t.co/nbBwO8kuEP",lvginc_,2020-11-12 17:54:09+00:00
828,1326946325984784384,"I'm still waiting patiently for my #XboxSeriesX and you dumb motherfuckers are VAPING into it???

SMH

#Xbox #videogames #gaming #idiots",TTimeGames1,2020-11-12 17:53:52+00:00
829,1326946324147822593,I want a tattoo of a panda vaping and jacking off on my ballsack,ButterflyPimp8,2020-11-12 17:53:51+00:00
830,1326946273988124672,"Took a couple rips off my dads weed vape, tastes like lemon idk what he has in here but not bad. I like his flag thing, idk what you call all these parts &amp; shit. 
😂🙏 https://t.co/lBLjFZQh1n",JJ6122,2020-11-12 17:53:39+00:00
831,1326945866146435072,So how long before someone blows vape smoke in a PS5 today?,Mwood17,2020-11-12 17:52:02+00:00
832,1326945841366568964,"Bollocks

#TheChase 

Close, but no erm, vape https://t.co/CzVZOUkR3i",Shy_Teds,2020-11-12 17:51:56+00:00
833,1326945558326468608,TGIT finally its Thursday where all regular priced vapes are 25% OFF! When you refer a friend you can get a free preroll or gummy! Call Now!,DojaOfPortage,2020-11-12 17:50:49+00:00
834,1326945542233001987,I'm the guy thats been vaping inside all those xboxs,WeedYoda,2020-11-12 17:50:45+00:00
835,1326945430916182020,Who the fuck is blowing Vape smoke into the Xbox??🤔🤔🤔,legendary1jay,2020-11-12 17:50:18+00:00
836,1326945303606550531,i may have misplaced the juul i recently decided i wanted to get addicted to,peterkellyOKAY,2020-11-12 17:49:48+00:00
837,1326945282215436288,it really do be vape for breakfast sometime,ughlise_,2020-11-12 17:49:43+00:00
838,1326945268156293120,"Exclusive Hookah &amp;Vapes For new Generation

All smoking items you might need is available at cheap rate and within your reach, Delivery everywhere within less than 24 hours,
Click link below let's talk business
https://t.co/xRdHSsYg4X https://t.co/EkflGvNxpn",ATheTeam,2020-11-12 17:49:40+00:00
839,1326945141404397575,tbh my cisgender friend would get high off stemmy vape oil,gayweedbot,2020-11-12 17:49:09+00:00
840,1326945086727450627,imagine blowing #vape in ur #xbox to make it look broken? wow,heatherchqt,2020-11-12 17:48:56+00:00
841,1326945071862853640,We've added new REVIVE LEMON CBD VAPE PEN at our store. Check it out here: https://t.co/yt68lt998w.,FlowerPackaging,2020-11-12 17:48:53+00:00
842,1326944969215664129,JUUL goes bankrupt for selling counterfeit products now 47 billion in debt!,Boomer29275471,2020-11-12 17:48:28+00:00
843,1326944943227678722,"New York Post : Microsoft pleads with gamers not to vape into their new Xboxes. Let me give people some advice as Older Gamer U don't buy the new systems when they first come out. Wait for a Year or two. 
https://t.co/UXrBCChovo

via @GoogleNews",LetTheManSpeak1,2020-11-12 17:48:22+00:00
844,1326944938563670022,I just hate that I went through this revival phase like 4 years ago vaping and trolling listening to dirty vibe by skrillex and pc music and 3oh!3 and medic droid and now I'm being forced to watch it happen all over again when I'm a bitter old hag https://t.co/2el7HYnMsR,signiff,2020-11-12 17:48:21+00:00
845,1326944870678867969,damn that vape hits different when I put it through the xbox,squishlin,2020-11-12 17:48:05+00:00
846,1326944605523173378,"Check out this new vape juice: ""Polar Bear Cauliflower"".",buttsex_subtext,2020-11-12 17:47:02+00:00
847,1326944510018904064,Thanks guys! I was thinking of buying a vape and blowing the vape smoke into my brand new Xbox Series X! How helpful! 😀👍 https://t.co/YVZD5UQzSq,rgthenascarfan,2020-11-12 17:46:39+00:00
848,1326944472962224128,TGIT finally its Thursday where all regular priced vapes are 25% OFF! Also we have 4-25$ on Treetown cookies! Call Now for more FIRE deals!,DojaOfPortage,2020-11-12 17:46:30+00:00
849,1326944255651307521,Did juuls used to be better or was I just young and stupid,headymids,2020-11-12 17:45:38+00:00
850,1326944230766333953,"My vibes are fucked today. The crew was disrespectful as fuck at 5am, the textures of my salad are freaking me out, I just saw a project manager walk to his car to vape, and Luke afb is loud and annoying as fuck as usual",hamdrewbarfield,2020-11-12 17:45:32+00:00
851,1326944175430971392,"To the morons blowing vape smoke into the series x trying to make it look like it overheated and it’s smoking...

Stop clout chasing 🤦🏼‍♂️",BKthaGr808,2020-11-12 17:45:19+00:00
852,1326943956203151363,"tw // ship hate (I cant tag specific ship hate since its randomized, sorry, just be warned)

I hate Holly x Vape",ObjectShowHCBot,2020-11-12 17:44:27+00:00
853,1326943952021413888,Someone blew a vape into it but go off https://t.co/7DKNxu8Pso,_xofa,2020-11-12 17:44:26+00:00
854,1326943911940558848,"Is #Smoke from Marijuana or Vape causing damage to your home? The answer may surprise you.

#SERVPRO #Infographic https://t.co/nUmnTqth32",servprodowney,2020-11-12 17:44:16+00:00
855,1326943857179848704,"New @VaporessoEcig Giveaway Now Live! -  Enter now for a chance to win 1 of 8 Luxe PM40 kits - https://t.co/OYme1euLw4

#ecigclick #vape #vaporesso #vaporessoluxepm40 #vapegiveaway #vapefam #vaping #vapelyfe #giveaway",ChiSoxChiefs_78,2020-11-12 17:44:03+00:00
856,1326943852771635200,"Please do NOT vape into your xbox series x. 

The holes at the top are needed to fill the xbox series x with laundry detergent.",mikemaccana,2020-11-12 17:44:02+00:00
857,1326943839098167297,Favor. Can someone photoshop in a vape instead of the lung-dart? https://t.co/ZxZMwlBlPg,FridayGolfGuys,2020-11-12 17:43:59+00:00
858,1326943578837438479,"Whether I vape or not in the zoom lecture is none of your business, Randy. Unless you want a hit.",deathgrass2000,2020-11-12 17:42:57+00:00
859,1326943437501964289,my juul deadass never leaves my hand,lexlaferriere,2020-11-12 17:42:23+00:00
860,1326943424424124416,I love EightVape. It has the best e-juice and vape kit/accessories collections. Use my referral link to get a 30% OFF discount now! Must Spend $50 or more https://t.co/SKJm4cJ4gE vía @EightVape,RENEARISPE,2020-11-12 17:42:20+00:00
861,1326943296992780291,"Free Webinar: The Truth About Vaping

Expert in the field @Sharon_ACox will take us through the best evidence on E-Cigarette use in the UK. Hosted by Prof Chris Chandler
Friday 20th November, 12pm GMT

Book your free tickets: https://t.co/fWILdvxUpT

Pls share and RT https://t.co/BT3S16R8l9",DrJamesCMorgan,2020-11-12 17:41:50+00:00
862,1326943021255028744,I wonder how much crossover there is with the vape nation and Xbox fans. https://t.co/nBjtnk9ly3,HogtiedP,2020-11-12 17:40:44+00:00
863,1326942911716593665,can the PS5 vape,PlayStarRocker,2020-11-12 17:40:18+00:00
864,1326942893588819970,November 11th Sam [Redacted] buys her first vape at the ripe age of 21,saclboy,2020-11-12 17:40:13+00:00
865,1326942878082494468,First thing I do in the morning is stunt my breathing and hit my juul wbu,katieobrien28,2020-11-12 17:40:10+00:00
866,1326942836311339009,"One-third of #ecigarette users report signs of lung damage
via @UPI 

https://t.co/ahFqwluSQb
#vaping https://t.co/PvJfJ6jgz2",SMART_MD,2020-11-12 17:40:00+00:00
867,1326942675640070145,this is the second vape i’ve had quit working in a fucking month. so guess who’s going to vape shop and gonna pull a karen today cause i’m PISSED,emmaaaok,2020-11-12 17:39:21+00:00
868,1326942610125156355,"INNOKIN COOL FIRE IV PLUS /w ISUB APEX TANK

Enjoy free shipping 😊⁣

Vaping products contain nicotine. nicotine is highly addictive. vaping products also release chemicals that can harm your health. youth and adult non-smokers should not vape.⁣

#INNOKINCOOL #FIREPLUS #ISUB https://t.co/vDllN78rqf",Smokevape_ca,2020-11-12 17:39:06+00:00
869,1326942435231084545,📷 Side 2 (at The County Vape) https://t.co/1p0wYjomPf https://t.co/o2yR6kAr2K,Marshalls_best,2020-11-12 17:38:24+00:00
870,1326942420806889472,Side 2 @ The County Vape https://t.co/8EZzvYFGZV,Marshalls_best,2020-11-12 17:38:21+00:00
871,1326942367643996161,Just posted a photo @ Wise Guys Vapes https://t.co/QY0EcuamDr,WiseGuysVapes,2020-11-12 17:38:08+00:00
872,1326942305622896646,notice how absolutely nobody talking about xbox right now minus their shit smoking cause people were vaping in them 😭,jetsetvevo,2020-11-12 17:37:53+00:00
873,1326942284093468679,Sounds like something vape smoking craigs would do 😈😈 https://t.co/Fub9FJ0CER,KingAlakazam,2020-11-12 17:37:48+00:00
874,1326942032263311361,These mfs were blowing vape smoke into the new series x to make it look bad😂,kidinkev813,2020-11-12 17:36:48+00:00
875,1326941997949734912,Microsoft forced to release a statement about not blowing vape smoke into the Xbox Series X https://t.co/VaXI1rVesE,TheAVClub,2020-11-12 17:36:40+00:00
876,1326941836544368640,Check out what I just added to my closet on Poshmark: Nike Vaper metallic &amp; white  golf cleat si…. https://t.co/DJ0hDjdJg1 via @poshmarkapp #shopmycloset,Courtne28047105,2020-11-12 17:36:01+00:00
877,1326941674203963398,"The snowy season is here and so are the holiday deals! Our Palmetto promotion drops today featuring:

•Nuken 3.5g 
•Headband 3.5g 
•Shishkaberry 510 vape carts

Stop by and speak with your moodmaker for details #getlitwithus https://t.co/U4mybYAf2E",gardenvarietyca,2020-11-12 17:35:23+00:00
878,1326941466120384520,"#LiquidNicotine is a #poison, so treat it like one. Always store #vaping products up, away, and out of sight of children. https://t.co/jbC5HL1ni3   #BCBSKSPathways",StacieR68801671,2020-11-12 17:34:33+00:00
879,1326941391847477248,"Hey Alexa can you blast Vape Nation by Mom Jeans, we're fucking crying again tonight.",SushiiLol,2020-11-12 17:34:15+00:00
880,1326941282422321152,"Guys I can't cheat in the block game even if wanted to. The government would kill me.

Vape isn't allowed in Singapore noot noot",RealArmegon,2020-11-12 17:33:49+00:00
881,1326941218312495108,And this is why you should never even think about vaping. It isn't good for consoles or yourself. https://t.co/j8toM7zEGI,NikonDSquad,2020-11-12 17:33:34+00:00
882,1326940862895566849,Everyone showing all this hype for the PS5 meanwhile the only thing going on with Xbox is people blowing vape clouds into it...,Drageckon,2020-11-12 17:32:09+00:00
883,1326940703780429831,"if any of my followers vape, are any of yall open to trades ? i cant find my gift cards atm but i do have a $25 sephora gift card that i can trade if u want- so dm me pls :)",ltmluvz,2020-11-12 17:31:31+00:00
884,1326940431712727040,Super #vape deals at https://t.co/id1ky4PIri + take another 10% off those deals with the group coupon code vapingtruth. #vapingtruth,thevapegoods,2020-11-12 17:30:26+00:00
885,1326940426381766657,📷 A day late but its a month long thing in my eyes anyway (at The County Vape) https://t.co/09gAUbw4nN https://t.co/5FjBuRsVWf,Marshalls_best,2020-11-12 17:30:25+00:00
886,1326940423521263616,"Groundbreaking technologies, optimum efficiency.

Evolv DNA Boards at Stealthvape.

Stock up at promo prices now!

https://t.co/eg5x71xnWk

 #vape #dnaboard #vapemod #boxmod #modder #dnamod #evolv #stealthvapeUK https://t.co/fmfQqLpsGU",Stealthvape1,2020-11-12 17:30:24+00:00
887,1326940416239939585,A day late but its a month long thing in my eyes anyway @ The County Vape https://t.co/4t74BRx7OW,Marshalls_best,2020-11-12 17:30:23+00:00
888,1326940391137013760,"The NEW Vaporesso XROS pod kit is the ultimate Christmas present for anyone looking to make the switch to #Vaping 😁

Easy to use, super portable &amp; available online:
https://t.co/QCBLR2Q6W3

#VapeKit #Ecig #Ecigarette @VaporessoEcig https://t.co/CJNquReGvs",EvapoHub,2020-11-12 17:30:17+00:00
889,1326940366436786188,"As the American Heart Association’s conference approaches, the organisation releases a media briefing from an unpublished study claiming a third of all vapers suffer from EVALI

https://t.co/KOlgpgHzsR @American_Heart #vape #vapingnews #junkscience #EVALI #harmreduction https://t.co/fuPYVOcOsw",PVapes,2020-11-12 17:30:11+00:00
890,1326940337596665860,"Nintendo: Please don't eat our games!

Xbox: Don't put vape into our machine!

Sony: Can you guys please not liquify the console?",hotdogexpansion,2020-11-12 17:30:04+00:00
891,1326940319850524673,"It is important to take care of lung health, especially right now. Talk with your youth about the risks of vaping. Learn more with this Parenting for Prevention tip sheet!
https://t.co/XDTNXnMtxM",AshlandDAET,2020-11-12 17:30:00+00:00
892,1326940318839709696,"Got the chance to unbox the #XboxSeriesX  for the sis yesterday. I couldn’t find the vape feature, but it seems powerful enough. https://t.co/Xh9D88ZVLZ",MF_Brown,2020-11-12 17:30:00+00:00
893,1326940279685963791,If I don’t get my Ps5 today all hell will break loose &amp; I’m blowing vape all through this Xbox 🤷🏽‍♂️,Chief_DMJ,2020-11-12 17:29:50+00:00
894,1326940207329914880,I love EightVape. It has the best e-juice and vape kit/accessories collections. Use my referral link to get a 30% OFF discount now! Must Spend $50 or more https://t.co/3EzSK7CJcW via @EightVape,KyleHoggard4,2020-11-12 17:29:33+00:00
895,1326940107685945344,"“Can you go vape, your stress is worrying me” thanks boss I will",Heatuun,2020-11-12 17:29:09+00:00
896,1326940056313946112,If I don't take fat rips into my new Xbox then how will anyone know that I vape? https://t.co/bEpmJlocgr,0M3GA64,2020-11-12 17:28:57+00:00
897,1326939816794214403,"Customer: So my Xbox Series X broke
Xbox support: Were you vaping into it?
Customer: ........maybe
Xbox support: 🤦 🤦 🤦 🤦 🤦 https://t.co/MxfPE5uu4U",VGChartz,2020-11-12 17:28:00+00:00
898,1326939775681630218,"The government have announced that taxes on Tobacco are going up. From 16th Nov a pack of 20 will go up by 22p &amp;  30g of handrolled tobacco up by 65p.

Smoking costs around 3.5 times as much as e-cigarettes - @CR_UK

#Vaping can help you make the switch.

https://t.co/T9jJlNCFRv",Vaping_Industry,2020-11-12 17:27:50+00:00
899,1326939768391831552,"Congratulations to the @ICF team winning the prestigious @CDCGov Manuscript of the Year for journal article: Syndromic Surveillance for E-Cigarette, or Vaping, Product-Use-Associated Lung Injury (EVALI) published in @NEJM—out of 3,245 peer-reviewed pubs! https://t.co/RCtPGFSYho",AmandaRecruits1,2020-11-12 17:27:48+00:00
900,1326939663416832001,This new Vape I bought is shit. can't believe I spent $499 on it https://t.co/L186S0rZAP,gone_25,2020-11-12 17:27:23+00:00
901,1326939538560864256,Don’t call it vape smoke. That’s retarded. It’s either vape or smoke. Those are two different things. Mfs dumb. 🤷🏻‍♂️,dawsinofficial,2020-11-12 17:26:53+00:00
902,1326939503307710466,Voopoo Rex 80W &amp; UFORCE Vape Tank Mod Kit https://t.co/OJKAs5f3gl,UKVapeDeals,2020-11-12 17:26:45+00:00
903,1326939452095094789,Xbox Responds to Series X Vape Smoke Videos https://t.co/MYjHV3Hdkc https://t.co/HAKapNZfZP,VideoGameNews,2020-11-12 17:26:33+00:00
904,1326939368058187778,So anyone who vapes and has bought an Xbox Series X. Do NOT vape into your brand-new console. https://t.co/m4BEuqRnJj,TrunksWD,2020-11-12 17:26:13+00:00
905,1326939336751788032,Vape? cigarette? Same? Hell nah man.,Kalowwyyys,2020-11-12 17:26:05+00:00
906,1326939310172598273,Vape news: Microsoft forced to respond to viral videos of smoke billowing out of Xbox Series X https://t.co/vLN0B8sHWp,NewsAndStuffOk,2020-11-12 17:25:59+00:00
907,1326939299858812932,The fact that people either went out and bought an Xbox or were given one and then tried to make them look bad by blowing Vape smoke into them speaks volumes for gamers today.,Gigers39,2020-11-12 17:25:57+00:00
908,1326939261703172097,"No system transfer on the #ps5  annoyingly, back up to en external drive and copying back and forth is the only way around redownloading everything. 

Now we wait on all the ridiculous vape videos(!) #sony https://t.co/xNCEaW8j78",Old_Rosie,2020-11-12 17:25:47+00:00
