,TweetID,TweetContent,TweeterUsername,TweetDatetime
2315,1326759151909875715,"Vape Pen w/ Cartridge 
https://t.co/CnvVBeV8DY https://t.co/P8QiSWwggi",SupportOrenda,2020-11-12 05:30:06+00:00
2316,1326758886045519878,do yall know my name isnt juul or are yall also playing along with the joke,chixiez,2020-11-12 05:29:03+00:00
2317,1326758709230358528,send battery ng vape,YNfurukawa,2020-11-12 05:28:20+00:00
2318,1326758571686694912,Y’all quit vaping above yalls Xbox’s y’all aren’t fooling anyone https://t.co/3naBrBp5vY,lando1023,2020-11-12 05:27:48+00:00
2319,1326758385199554560,Ppl really vaping into the new xbox LMAO and made the company tweet bout it,JayRetro718,2020-11-12 05:27:03+00:00
2320,1326758224389926912,"The Xbox Series X Is Not on Fire, It Is Just Vaping 😂
https://t.co/kMh0th3nQ3",Rooc40,2020-11-12 05:26:25+00:00
2321,1326757941861605376,"Kids : vape
Man : cigarette
Legend : cigar
Gods : breathe in Delhi",vixhakha,2020-11-12 05:25:17+00:00
2322,1326757923951939586,my sonic having their own slogan saying “where the FUCK is elijah” and “bastard was crouching in the back vaping”,strwberrybabi,2020-11-12 05:25:13+00:00
2323,1326757889931964416,"PS5’s don’t look like a giant vape

This just proves XBOX users are of inferior intelligence #PSGang https://t.co/yDvvFhYRbS",_KyleHughes_,2020-11-12 05:25:05+00:00
2324,1326757804913401859,They didn’t say anything about the Series S! Vape away my brothers https://t.co/PFGNu7hKxd,LittleStar_Lord,2020-11-12 05:24:45+00:00
2325,1326757798768619520,I wanna vape into an xbox,PO_Tomato,2020-11-12 05:24:43+00:00
2326,1326757715897536517,Don’t worry I’ll vape it https://t.co/h9KI9yxCno,GamerFranzlio,2020-11-12 05:24:24+00:00
2327,1326756936340025344,"I hate how people sound right after taking vaping.

Cough you fucking gooey throated phlegm ignorer",St_Grog,2020-11-12 05:21:18+00:00
2328,1326756885412917248,"Sebastian Bach in Gilmore Girls - the man is always acting, even when the camera isn't focused on him. You can tell he has done this before.",vape_nap,2020-11-12 05:21:06+00:00
2329,1326756848125562886,a vape hater (vater)???? lmfaoooo you clearly do NOT get lit in ANY capacity. this tweet was so cringe bro https://t.co/prRLOOEnUg,OmegaProYT,2020-11-12 05:20:57+00:00
2330,1326756656399732737,How are people this stupid to vape into a $500 console? https://t.co/X5DKZrwi8g,RomanArmy10,2020-11-12 05:20:11+00:00
2331,1326756650074529792,"Hotboxing is just sitting in car with the heater blasting, while smoking nicotine juuls, with overweight ghosts, right?",StormingElysium,2020-11-12 05:20:09+00:00
2332,1326756614179840000,i just lost Another vape in my room but i found the one i lost months ago so ???? i guess it evens out but damn 😭,tiltyouback,2020-11-12 05:20:01+00:00
2333,1326756576418537472,"Yeah

1. Smoked or vape❌
2. Skipped achool❌
3. Snuck out of the house❌
4. Failed a class✔
5. Had sex ❌
6. Drank alcohol ✔
7. Had a bf/gf❌
8. Gotten detention ✔
9. Kissed somebody✔
10. Gotten high❌

My life is way too boring. https://t.co/5mc8SwMT9M",cash_hunting07,2020-11-12 05:19:52+00:00
2334,1326756532898422785,Ill never vape now https://t.co/342GuBDtAj,octo_vii,2020-11-12 05:19:42+00:00
2335,1326756434248265728,24hrs and stop vaping into your new Xbox's I need people slay tomorrow.,JokerBeJoking,2020-11-12 05:19:18+00:00
2336,1326756331601195008,Just once in this life I want to vape pure mountain dew syrup,modernmodron,2020-11-12 05:18:54+00:00
2337,1326756320989515777,"hate to say this, but do not release a console that blows vape smoke https://t.co/FFAYwIlqAL",Tenzin_Coale,2020-11-12 05:18:51+00:00
2338,1326756297908367365,Vaping gateway effect isn't a thing https://t.co/5V2ozpnuKb,ardosoonurm,2020-11-12 05:18:46+00:00
2339,1326756179452731392,"""Committee chair @hollieahughes  said the more than 8000 submissions had been overwhelmingly supportive of vaping and overwhelmingly not in favour of a script model"".

Read more from @rachelclun in the @smh here: https://t.co/2RjyizJ9fn https://t.co/n0xqOfxVSD",LegaliseVaping,2020-11-12 05:18:17+00:00
2340,1326755797074907136,if I take another dry ass hit off my vape I’m gonna SCREAM,spoopyminyoongi,2020-11-12 05:16:46+00:00
2341,1326755671296122882,i forgot i quit my puff and it’s only day 2😭😭 the exact same thing happened with my juul 😭 that shit be having you crave everything and eating nonstop,ox_mariaa,2020-11-12 05:16:16+00:00
2342,1326755375689981953,"Vape Pen w/ Cartridge 
https://t.co/CnvVBeV8DY https://t.co/mAm61ZFH01",SupportOrenda,2020-11-12 05:15:06+00:00
2343,1326755273105502208,hit the kazoo as an alternative to vaping https://t.co/9sSDZxXai8,02accordcoupe,2020-11-12 05:14:41+00:00
2344,1326755171775488007,"""Don't vape into your Xbox, you Enenra bitch""
-@maximilian_",kekutougame,2020-11-12 05:14:17+00:00
2345,1326754981496512513,"Life is filled w pain and I don't have the skills to get through it 
Jfc I can't even hit vape cartridges without them clogging and wasting them expeditiously 
Feel so bad about it 
N im just trying to use it to quell the pain of living 
My consciousness itself feels torturous",FlippyGrows,2020-11-12 05:13:32+00:00
2346,1326754920024875009,"You know, this takes a whole new comical meaning when realizing the smoke is actually from a vape.

Consoles are “smoking” 🚬 . Get it? Users are facing hardware issues because of it 😉? https://t.co/sK3ivzf1j1",RockEarthDragon,2020-11-12 05:13:17+00:00
2347,1326754714562686977,"Asks for one pack of JUUL pods, comes back with two packs.

Him: “You’ll be fine for a month right??”

Me: bro...",nihaokai20,2020-11-12 05:12:28+00:00
2348,1326754642110402562,jay vapes lounge logo https://t.co/ghBRNRi9L3,jayvapelounge,2020-11-12 05:12:11+00:00
2349,1326754482714112000,"Platinum Vape (PV) has seen continued growth since closing sale to  Red White &amp; Bloom Brands (RWB) with annualized run rate ~$90M. In addition, management is pleased to report that PV remains on track to launch in AZ later this year.

https://t.co/jieECr4BnM",highlyobjective,2020-11-12 05:11:33+00:00
2350,1326754449868673026,"🤣🤣 my xbox is so lit that it vapes, meanwhile your PS5 (Peace of Shit 5😂) doesn't even get invited to parties at all 😂🤣

i should've called amy adams before conversating with sony ponies 😂🤣 https://t.co/DDesE9HFCv https://t.co/AnvBXSpVKz",OmegaProYT,2020-11-12 05:11:25+00:00
2351,1326754285812649985,How can I call myself a gamer if I don't vape with the 'box? https://t.co/xTqW2jCLno,_ShonenSupreme_,2020-11-12 05:10:46+00:00
2352,1326754153700454400,"The GrowthOp: Five smoking and vaping alternatives for weed.
https://t.co/oAn1bUz8ZM

via @GoogleNews",LadyKitFaith,2020-11-12 05:10:14+00:00
2353,1326754114143879168,Just posted a photo @ Rumours Vape Bar https://t.co/duxtOhUemU,rumoursvapebar,2020-11-12 05:10:05+00:00
2354,1326754107097554944,"This discourages nobody, and will, in fact, make them do it for the meme even more 🤷🏽‍♀️ The trick is to make a better meme than the vape one guys! THIS IS THE INTERNET AND ALL WE DO IS MEME! https://t.co/sut2NUbA0W",DemShenanigans,2020-11-12 05:10:03+00:00
2355,1326754030341791745,oh someone was blowing vape smoke into it lolol https://t.co/a1dLFzeCUw,Mikebuysthedip,2020-11-12 05:09:45+00:00
2356,1326753590040530945,"Omg please actually do. If you are the type of person who vapes, and furthermore the type of person who would be inclined to blow vape into your Xbox Series X, please blow vape smoke into your Xbox Series X. https://t.co/09p41pQ81a",MrEPCOT,2020-11-12 05:08:00+00:00
2357,1326753560760111104,On another note why are people vaping into their Xbox’s?😂😂😂😂😂,harrylovesmilk,2020-11-12 05:07:53+00:00
2358,1326753538857431040,edging my vape,jeeneenuh,2020-11-12 05:07:48+00:00
2359,1326753400030158848,"“Labour’s decision to regulate vaping in the same way as cigarettes is the most damaging public health policy in a generation”, says ACT Leader David Seymour.
https://t.co/9JesCP9Soz
#panthr       
@PVC(18+)",ARI_PANTHR,2020-11-12 05:07:15+00:00
2360,1326753392018944000,"I can find two of my vape pens, but I did find $70 looking for them so I’m calling this a win",Sheila_la_la,2020-11-12 05:07:13+00:00
2361,1326753224934776832,Why the hell C.J. left that vape and weed mints at Curtis and Ella’s house?! They done took it! What was he thinking? #HouseOfPayne https://t.co/qonOf3TGjG,uniquelycortney,2020-11-12 05:06:33+00:00
2362,1326753033720455168,"no thoughts, only that one tiktok where its like “SHUT UP” “i just w-“ “SHUT UP” “i just wanna-“ “SHUT UP” “i just want-“ “SHUT UP” “i jsut want to hit ur juul” “and i want to slap my dad for leaving. anyways if you main princess peach on minecr.. no, mario kart, if you main",HlMlTOGAS,2020-11-12 05:05:47+00:00
2363,1326752928384901120,Don’t vape smoke into your Xbox 🤦‍♂️ https://t.co/a9I36ayBo9,zainss,2020-11-12 05:05:22+00:00
2364,1326752647605481474,People really out here blowing vape smoke into their new Xbox’s😂😅,No_Swag_Biker,2020-11-12 05:04:15+00:00
2365,1326752576482791424,"Can I use my PS5 to vape, pls advise",MagitekDad,2020-11-12 05:03:58+00:00
2366,1326752187871973377,I’m Naked Under the Vape....FUN FACT the original “vape Genie” is an old customer of mine from 2014 😭🙏 #memories #vapelife https://t.co/wLb7vOjUCo,DrakexHawaii,2020-11-12 05:02:26+00:00
2367,1326752097845403648,What idiot would blow vape smoke into their Series X like wtf bruh,fail_mar,2020-11-12 05:02:04+00:00
2368,1326751989942767616,"Bet you can blow as much vape smoke as you want on a ps5, lil hoe https://t.co/UC334K3zat",TRNDoU1,2020-11-12 05:01:38+00:00
2369,1326751985014616065,Monaco’s Stop Smoking Initiative – Vaping Post https://t.co/0Al2Jb0brw,vapotageorg,2020-11-12 05:01:37+00:00
2370,1326751848506732544,"""Why are people blowing vape smoke into their Xbox' for clout?"" is a question I never thought I'd have to ask.",FidlinOnRitalin,2020-11-12 05:01:05+00:00
2371,1326751630654627840,Shall I get cbd blueberry vape,gccocp866,2020-11-12 05:00:13+00:00
2372,1326751599658737665,"Vape Pen w/ Cartridge 
https://t.co/CnvVBeV8DY https://t.co/udCm0ry8NM",SupportOrenda,2020-11-12 05:00:05+00:00
2373,1326751305700872192,"the first time i ever ordered vape juice, i told my mom it was rubix cube lubricant",KxlliW,2020-11-12 04:58:55+00:00
2374,1326751111982829569,I mean sure why not https://t.co/n6PZ3N8gbl,oso_vapes,2020-11-12 04:58:09+00:00
2375,1326750976469061632,okay i’m st*ned and bored who wants a reading with the newest and coolest deck i own https://t.co/6c9euIYNpk,litdaddy_vape,2020-11-12 04:57:37+00:00
2376,1326750688395882497,Microsoft: ‘please do not blow vape smoke into your Xbox Series X’ https://t.co/q55pbntRc5 #technologie #feedly,die_wienburg,2020-11-12 04:56:28+00:00
2377,1326750653285347328,"Ballistic Vape - Praline Dream - Nic Salt 
➤ $ 16. 
➤ https://t.co/hVmZOg7XLw https://t.co/YzyaAj5mMi",VapeBallistic,2020-11-12 04:56:20+00:00
2378,1326750651703939072,Thinking about getting a juul what flavors are good?,bcsoares1,2020-11-12 04:56:19+00:00
2379,1326750458694787072,Highlight of the day is Xbox asking ppl to not blow vape into the console,Arealkushturtle,2020-11-12 04:55:33+00:00
2380,1326750323944329216,Xbox had to issue a statement that people shouldn't blow vape smoke into the Series X https://t.co/D7oAUfzCic,UPROXXSports,2020-11-12 04:55:01+00:00
2381,1326750111737798657,"Imagine being such a console fanboy loser you buy a Xbox just to vape in it ????????? LMAO WTF. I love Playstations more myself but come on

Hell I might even buy an Xbox someday because the pass for both PC and Xbox are good, so it would be nice to make use for it on console too",Fruitraka,2020-11-12 04:54:11+00:00
2382,1326749665946193921,Xbox warns players not to blow vape smoke through their new Xbox Series X – CNET https://t.co/H1HQPuk5q2,Dizzedcom,2020-11-12 04:52:24+00:00
2383,1326749598405287936,"I was gonna fart into an xbox series x as a response to the vaping videos, but smell-o-vision doesn't exist yet so my joke will have to wait",ThePantsManEX,2020-11-12 04:52:08+00:00
2384,1326749490594734080,paturo vape tricks 💨,tinniiiie,2020-11-12 04:51:43+00:00
2385,1326749281999593473,every time i get money my parents think i use it tobuy vape???????,purrrboii,2020-11-12 04:50:53+00:00
2386,1326748900045189120,i vape your titty because i can't help it,slime_sext,2020-11-12 04:49:22+00:00
2387,1326748823855616000,my insomniac ass considering about buying a melatonin juul pen,gilliankwong_,2020-11-12 04:49:04+00:00
2388,1326748644049973248,Vape Box 420 https://t.co/ahpt6R4t89,StevenLeeMay,2020-11-12 04:48:21+00:00
2389,1326748494128934913,People are something else. Using vape smoke to fake their new xbox overheating and smoking. https://t.co/vxmJgFASJg,corylyonsmusic,2020-11-12 04:47:45+00:00
2390,1326748383592259584,vape break 🥰,sadbeautifulseb,2020-11-12 04:47:19+00:00
2391,1326748364092837889,Don't forget to fresh wick #vape #vapecommunity #vapemanfess https://t.co/KEbXE9LmKZ,bobor404,2020-11-12 04:47:14+00:00
2392,1326747825808560130,"Vape Pen w/ Cartridge 
https://t.co/CnvVBeV8DY https://t.co/iSGsKCqmiL",SupportOrenda,2020-11-12 04:45:06+00:00
2393,1326747534694486016,"Doesn't it feel great that one half of Xbox Series X owners are scalping them for $800-1500. While the other half are blowing vape smoke in theirs to create a false narrative, while likely actually damaging it too. To top it off, your Amazon pre-order means nothing. https://t.co/AWGWcDwwAS",CreakyLegs,2020-11-12 04:43:56+00:00
2394,1326747342351970304,can’t believe how long it took me to be disillusioned with the belief that a juul will last forever and I’d never have to replace it.,cheyennehxrrxs,2020-11-12 04:43:10+00:00
2395,1326747284357451779,if vape have “harmful metals” why i still human? why i not turned into robot?,miichbiich,2020-11-12 04:42:57+00:00
2396,1326747273733214211,he vapes😻😻😻😻lung damage😻😻😻😻😻,lunarcalpurnia,2020-11-12 04:42:54+00:00
2397,1326747243278426112,Microsoft: ‘Please don’t blow vape smoke into your Xbox Series X’ https://t.co/E5PNp0k5wd,TBhasakar,2020-11-12 04:42:47+00:00
2398,1326747056786997249,She’s a Juul no wonder I’m fckin addicted,milktteapapi,2020-11-12 04:42:02+00:00
2399,1326746639332241417,just leo and his vape https://t.co/1S2o29uPSn,3ffystonem,2020-11-12 04:40:23+00:00
2400,1326746564170194945,"Flix: is pedo
Gabe: is supremacist
Apex: defends pedo

Xbox: vapes

that's today in a nutshell https://t.co/zHwdaiwkof",AlopeRuby,2020-11-12 04:40:05+00:00
2401,1326746535531597824,$500 and it can’t even Vape? weak. https://t.co/zgT3PRZRmq,austinvikander,2020-11-12 04:39:58+00:00
2402,1326746505655377922,"Xbox smoking or on fire? 

No worries, we’ve already created a PR campaign that claims you are just blowing your vape or toke into it. 

It’s all your imagination.",han_d_cap,2020-11-12 04:39:51+00:00
2403,1326746440656248832,Why are y'all vaping into your Xbox Series X's?,LeRandomBro,2020-11-12 04:39:35+00:00
2404,1326746394950995968,High Schoolers tell you that vaping isn't unhealthy but they're smoking out of this https://t.co/KoSy30ZRQH,Jaimayy1,2020-11-12 04:39:24+00:00
2405,1326746343478497280,one of my friends is really trying to tell me vaping is way worse then drinking and that you can’t get addicted to alcohol,famouslastwordd,2020-11-12 04:39:12+00:00
2406,1326746293100818432,Best vape for a heavy smoker https://t.co/5KbqvilikM,GoanIdle,2020-11-12 04:39:00+00:00
2407,1326746156211310592,"Sorry folks, I just dont get vaping.",mhenderson33,2020-11-12 04:38:28+00:00
2408,1326745809862479872,Vapes gotta be the worst invention I’ve seen in my lifetime shits absolutely tragic,yslosa,2020-11-12 04:37:05+00:00
2409,1326745756120674304,"#Vape Bright #CouponCode #35OFF #Fantabulouscoupon
Vape Bright Coupon Codes
- With Vape Bright coupon code, you can use this code to order and get an extra 35% Off at Vape Bright. Take your chance now!

https://t.co/Cm13bHfSDa https://t.co/saNx4Ovo72",fantabulous1268,2020-11-12 04:36:52+00:00
2410,1326745278960062464,I'm thinking on vaping. Idk,TheGoldenCross3,2020-11-12 04:34:58+00:00
2411,1326745018766385152,mom called to tell me that if i have covid it’s because i vape . points were  made,epicswagangel,2020-11-12 04:33:56+00:00
2412,1326744968413777920,"Interaction I just had with Indigo:

Indigo: *making a slurpy noise*

Me: It sounds like you’re vaping or slurping pussy.

Indigo: It’s my own...

Me: ... your own??? How???

Indigo: ...Karaoke...

And this is why I love this woman more than myself sometimes",peachy_witchga,2020-11-12 04:33:44+00:00
2413,1326744791426719744,YouTube’s back. They vaped on the servers because they wanted to be like Xbox.,readymadeyt,2020-11-12 04:33:02+00:00
2414,1326744617383944192,"Smoking Xbox Series X? Microsoft says not to blow vape smoke into your console
#laptop #technews #technology #orbitbrain #news #newtechnology
https://t.co/PBWWrBR4YD",OrbitBrain,2020-11-12 04:32:21+00:00
2415,1326744510588727296,THE XBOX VAPE??????,skittstuff,2020-11-12 04:31:55+00:00
2416,1326744117943160834,It looks like a vape tho https://t.co/MxdRJUCuwo,leeearmy83,2020-11-12 04:30:22+00:00
2417,1326743738929049600,i hope joe biden brings back flavored juul pods,wockygut,2020-11-12 04:28:51+00:00
2418,1326743733459628034,"i hate when guys ask me if i use nic, girl do you mean vape ? SAY VAPE",hondurantwink,2020-11-12 04:28:50+00:00
2419,1326743690400813056,"Vape naysh, rise up!! #XboxSeriesX #Xbox #XboxSeriesS https://t.co/z0gp8hjzQG",TerrancePryor,2020-11-12 04:28:40+00:00
2420,1326743616514109446,i wish i never started vaping https://t.co/HipVSijNqT,hondurantwink,2020-11-12 04:28:22+00:00
2421,1326743358551826433,Please DON'T Vape Into Your Xbox Series X!!! https://t.co/Z2NyQeMR3U via @YouTube,olpband,2020-11-12 04:27:21+00:00
2422,1326743328252157952,"Getting to the point where I have to recharge my vape at least twice per day. I suspect I really nuked the lithium ion battery by letting it discharge too low between charges. Goddammit.
If I can get another one then I'm gonna grab the biggest battery possible and a long cable.",MasterBismuth,2020-11-12 04:27:13+00:00
2423,1326743059149840385,xbox vape tweet https://t.co/CXUzzcSqc5,0xmcc,2020-11-12 04:26:09+00:00
2424,1326743032255885312,after not using a juul for almost 2 weeks my lungs are on fiiiire,siimunnyxx,2020-11-12 04:26:03+00:00
2425,1326742972164149248,hit the juul for the first time in 3 days where’s life alert,deadgirlmagick,2020-11-12 04:25:48+00:00
2426,1326742934809698306,"""Don't eat tide pods and don't blow vape smoke into your Xbox""... Damn wish someone told me BEFORE I did these things! https://t.co/FCCh0wC6gT",PhakzMachine,2020-11-12 04:25:40+00:00
2427,1326742864437587968,Morning Kickstart #Vape #Tea #Morning #Work #Eliquid #Cuppa https://t.co/ujOHd4xW20,KyleEdge01,2020-11-12 04:25:23+00:00
2428,1326742725694124032,I interpret this to mean its ok to blow vape smoke into an Xbox One X. https://t.co/ZIoFlU4b7z,Ashendar,2020-11-12 04:24:50+00:00
2429,1326742625043451905,"// vaping 

Excuse me w h a t https://t.co/Z9JsSXwY0z",Spookthhh,2020-11-12 04:24:26+00:00
2430,1326741887324200961,Niggas was really blowing their vapes in the Xbox to make it seem like it was buggin ? LMAO tf,BIL_NODAYSOFF,2020-11-12 04:21:30+00:00
2431,1326741805166190592,"Minor brag but I finally got over my nicotine addiction. You should all stop vaping. May not seem like it but it damages your physical, emotional, and financial health.",jvarvel74,2020-11-12 04:21:10+00:00
2432,1326741785411002369,"if there was ever a chance i’d get an xbox series x, that is out the window, i’d much rather have a vape-proof ps5 https://t.co/cpmSTIErYF",kyleotterbacher,2020-11-12 04:21:05+00:00
2433,1326741777647276032,Day 3 without no weed and my vape pen and gummies looking sexy to me.,headonfiraga,2020-11-12 04:21:04+00:00
2434,1326741708420296704,My vaping xbox has not shipped yet #sad,brookiicookiii,2020-11-12 04:20:47+00:00
2435,1326741707061407744,Vape?! No!... clay dust...,yellowflower999,2020-11-12 04:20:47+00:00
2436,1326741705077485575,"Console gamers... 🤦🏻‍♂️
Can’t lie though. When I vaped, I blew my fair share of clouds into my keyboards... https://t.co/KHZqGF3F7u",AndrewParker_3D,2020-11-12 04:20:46+00:00
2437,1326741641923846152,PlayStation would let blow vape smoke into it https://t.co/m3lYDFXRSk,DirectorJasio,2020-11-12 04:20:31+00:00
2438,1326741436075831297,"I’m not joking when I say this but it’s hella hard to get an Xbox Series X, especially since they had to mention not to smoke or vape into the Xbox Console itself",iMissKingLiden,2020-11-12 04:19:42+00:00
2439,1326741383286284290,"Mfs really out here buying a Series X just blow vape smoke on it and make it look bad. Ppl really have such miserable lives, don't they?",SnakesInAlaska,2020-11-12 04:19:30+00:00
2440,1326741240193323014,What good policy development for #harmreduction  looks like. Not jumping the gun with wild speculation on the efficacy of #ecigs and then realizing you have another epidemic of youth #vaping @PHE_uk https://t.co/6ig29WYl5b,TahirTturk,2020-11-12 04:18:55+00:00
2441,1326740924085366784,send battery ng vape,ssndr_,2020-11-12 04:17:40+00:00
2442,1326740405476601856,"ＶＡＰＥ
ＢＯＸ https://t.co/8ewkwlag1B",ZekkieZekka,2020-11-12 04:15:36+00:00
2443,1326740293274787846,Vape recorder,scottpaladin,2020-11-12 04:15:10+00:00
2444,1326740274928881665,"Vape Pen w/ Cartridge 
https://t.co/CnvVBeV8DY https://t.co/HXzHt8HO39",SupportOrenda,2020-11-12 04:15:05+00:00
2445,1326740064144125953,"yeah you put the vape oil directly into the xbox series x and it puffs the aerosolized product back out, duh https://t.co/LQCes15eaj",ldfreimund,2020-11-12 04:14:15+00:00
2446,1326740005948100613,Microsoft: ‘please do not blow vape smoke into your Xbox Series X’ https://t.co/8FHcGKkXCx,Rechain,2020-11-12 04:14:01+00:00
2447,1326739683594940419,"To the people blowing vape smoke into their Xbox, ya’ll are petty.",hebfawaz,2020-11-12 04:12:44+00:00
2448,1326739528082616320,"GS EGO 3 III 3200 Mah Battery With Authentic Scratch Code

#vape #vapelife #vapekit #vaping #vapor #vapers #vapeshop #vapedaily #eliquid #ejuice #vapelove #vapestore #vaporizer #vapes #ecig #ukvapers #smok

Our Price: £7.99

Shop now at: https://t.co/ejbia5ZBlk https://t.co/p2sVGtVHSo",ukvaporwaves,2020-11-12 04:12:07+00:00
2449,1326739424391143429,Crazy how some dickheads thinking it would be funny to blow vape smoke over their new gen Xbox probably cost Microsoft millions and millions of dollars.. I hate people,BullMoran,2020-11-12 04:11:43+00:00
2450,1326739364915912704,Vapes are kinda dangerous like it’s so easy to take 5 hits in like 10 mins and it’s too tasty,nekomimi_nymph,2020-11-12 04:11:28+00:00
2451,1326739301846175745,can’t tell if i’m actually sad or if i just need juul pods,lyssieee1535,2020-11-12 04:11:13+00:00
2452,1326739288214687751,I only vape in my own bathroom so I can relive my days at highschool,yathshakeitup,2020-11-12 04:11:10+00:00
2453,1326739262377586688,Release a fog machine / vaping attachment https://t.co/8MJNMiKmmy,stephendann,2020-11-12 04:11:04+00:00
2454,1326739075534098432,how does my 16 year old brother have a vape and i do not,sweetcloudyday,2020-11-12 04:10:19+00:00
2455,1326739030457901061,hiccuped in the middle of a juul hit and took critical damage to my hp,lovecorebug,2020-11-12 04:10:09+00:00
2456,1326738866745696257,"Microsoft: ‘please do not blow vape smoke into your Xbox Series X’

Well, that is a target demographic… https://t.co/ZNUzg276wu",rosyna,2020-11-12 04:09:30+00:00
2457,1326738796344434689,Am I too old to have a crush on a guy who uses a juul,caseyjanduran,2020-11-12 04:09:13+00:00
2458,1326738792498294785,"2017: Don't fucking vape on the pizza
2020: Don't fucking vape on the Xbox Series X
@Xbox",jonnyjonjon09,2020-11-12 04:09:12+00:00
2459,1326738651200548865,also see about not vaping at least until covid’s gone k? https://t.co/3ZuWhb9jjN,lalanl,2020-11-12 04:08:38+00:00
2460,1326738604639592448,Having a forbidden vape in the loo don’t tell staff https://t.co/CWN66t5upa,_TraceyNo,2020-11-12 04:08:27+00:00
2461,1326738496917131265,I just need to know the name of that vape pen he was hitting. Cause I’ve never been like that. I’m trying to get like uncle Curtis #HouseOfPayne,life5578,2020-11-12 04:08:01+00:00
2462,1326738457289482241,#fire #tree #shop #smoke #vape #goodies #lighters #torches #pipes #rigs #dabs #mods #ejuice #cbd #cannabis #herbal #natural #vapelife #smokelife #joints #blunts #cigars #tobacco #herbs #vaporizer #cig Vintage Metal Kerosene Flame Lighters https://t.co/lBQKP1wZ8C,FireTreeShop,2020-11-12 04:07:52+00:00
2463,1326738223767367682,imagine paying £450 for a brand new Xbox Series X just to blow vape smoke into it like a complete moron,Sabmerk,2020-11-12 04:06:56+00:00
2464,1326738220827111425,By omission I’m assuming vaping into a Series S is just fine. https://t.co/MDcps1bccE,Sonikku_a2,2020-11-12 04:06:56+00:00
2465,1326738164665380865,candice and jasmine want to go on a double vape date with me and flint and i'm scared,volkner_ebooks,2020-11-12 04:06:42+00:00
2466,1326738106528100352,LOOOOOL these fools really bought a Xbox to blow vape smoke in it and say it's broken. 😂😂😂😂😂😂 https://t.co/0qT1EX2cJQ,japespaulino,2020-11-12 04:06:28+00:00
2467,1326737957164904449,Vaping Lures Teens to Smoking: Study https://t.co/rJhO62G1sc,JeewakaF,2020-11-12 04:05:53+00:00
2468,1326737921513312257,I hope @Xbox sues the guy for #vaping in the #XboxSeriesX. Trying to make it seem like it was breaking. That tarnishes their brand. Teach him a lesson.,ZombieElite7426,2020-11-12 04:05:44+00:00
