,TweetID,TweetContent,TweeterUsername,TweetDatetime
0,1327038459161133058,"Vaping Australian senate enquiry. 

Emily Banks study for vaping effectivity: eligibility criteria, selection of ineffective vaping products with less than 0.1% of nicotine :) Science at its best. You are definitely not biased sweet Emily...",ElianaRubashkyn,2020-11-12 23:59:58+00:00
1,1327038223705645057,pod ou vape?,octaviohg_,2020-11-12 23:59:02+00:00
2,1327037327131115520,"We really blowing vape into the Series X for clout now, huh",Sattazahn15,2020-11-12 23:55:28+00:00
3,1327037128589471744,"New @VaporessoEcig Giveaway Now Live! -  Enter now for a chance to win 1 of 8 Luxe PM40 kits - https://t.co/xxmo2DSMjb

#ecigclick #vape #vaporesso #vaporessoluxepm40 #vapegiveaway #vapefam #vaping #vapelyfe #giveaway",vapecamp,2020-11-12 23:54:41+00:00
4,1327036647368699904,"Who wants to help me make a lo-fi hip hop collective that goes by the name ""Vaping Melatonin""",lmszu,2020-11-12 23:52:46+00:00
5,1327036470192971778,"Microsoft urges users ‘to not blow vape smoke into Xbox Series X’ after viral videos- Technology News, Firstpost https://t.co/fnoR72fS3P",TrendzNewsbd,2020-11-12 23:52:04+00:00
6,1327036264021970944,Someone make a picture w a herd of Juuls it’s very necessary,QueztionMark,2020-11-12 23:51:15+00:00
7,1327036111995203584,"Someone buy me an #XboxSeriesX so I can turn it into a fog machine with vape clouds.  I promise to follow 
@Xbox, subscribe, like, and comment on all of the videos with ""BABABOOEY"" https://t.co/bUvZuTvRhL",IRLWilliam,2020-11-12 23:50:38+00:00
8,1327035794293354498,Some dude sold me a dud vape i came back and he wouldn’t give me a new one. I then proceeded to throw the vape at the wall and called him a hoe.,BmurrayInThaCut,2020-11-12 23:49:23+00:00
9,1327035709321048064,It's the Vaffle Vape App 3rd anniversary! Great #vaping prizes - vape games - videos - tutorials - forums and #vape tools - check it out now: https://t.co/Cg1RZvihN3 #vapeapp #vapers #vapefam #ecigclick @vafflecom https://t.co/nn8wD6vgme,EcigClick,2020-11-12 23:49:02+00:00
10,1327035629935345664,who can I shotgun vape and make out with in my car 😠😠 and maybe also climb into the back to finger them 😠😠😠,spookypeen,2020-11-12 23:48:43+00:00
11,1327035376339464194,If Ozil wasn't a footballer he'd have a tattoo/vape shop somewhere in Amsterdam,Rogue_talk,2020-11-12 23:47:43+00:00
12,1327035086253023232,"I think working in the vape industry really set me up for ""Conspiracy Twitter""

Like...I've done so much research on my industry to know it's ins and outs and i'm still shocked that so many people walk around with smartphones but not one person can google.",Friend_Of_Lucy,2020-11-12 23:46:34+00:00
13,1327035057631072257,"Back in stock at OCS: 

Craft Vape 510 Thread Cartridge - Mixed Berry by FIGR in 0.5g

https://t.co/Zt95XUJcHB",OcsUpdater,2020-11-12 23:46:27+00:00
14,1327034885685604352,"Watermelon Zkittlez x Legend OG [ 74% THC ] [ Relax ] 

Our newest NUG Live Resin Vape flavor blends notes of watermelon and candy-like fruit together with smooth notes of earthy gas.
⠀⠀⠀⠀⠀⠀⠀⠀⠀⠀⠀⠀⠀⠀⠀⠀⠀⠀⠀⠀⠀⠀ 
FIND IT NOW: https://t.co/uWTApwV6da 

#NUGVape https://t.co/BCpmiTEKXN",NUG_brand,2020-11-12 23:45:46+00:00
15,1327034735441244160,"Absolutely brilliant line from @hollieahughes at the #vaping inquiry

""Not all #nicotine products are created equal""",BrianTaxpayers,2020-11-12 23:45:10+00:00
16,1327034726725668864,"UBLO NUMBERS E LIQUID VAPE 10ml 50/50 3mg 6mg 12mg 16mg 
20 GREAT FLAVOURS 

https://t.co/DBc7CTjwkV

#ublonumbers #vape #vapepen #vapeshop #vapestore #ecig #ejuice #vaping #vapelife #vapejuice #jbrt18vape #atsocailmedia #ublo https://t.co/jy46MP7bT0",ublo_uk,2020-11-12 23:45:08+00:00
17,1327034711437348869,"Break up with your vape. Get the help you need to quit at your own pace, on your own terms. Sign up for free text message support by texting VapeFreeFFX to 88709. #VapeFreeFFX https://t.co/J5ZblzThYJ https://t.co/YOJU1RsAup",ffxyouththrive,2020-11-12 23:45:04+00:00
18,1327034621968736257,Watching everyone tweet about the PS5 being out of stock and breaking their Xbox Series X by vaping into it makes me really appreciate being part of the Glorious PC Gaming Master Race https://t.co/MWyWRimLYW,sleepahoy,2020-11-12 23:44:43+00:00
19,1327034576485675009,the dude that vaped in his xbox probably got microsoft goons at his door lol,KrLarrys,2020-11-12 23:44:32+00:00
20,1327033967908892672,I don’t know why I feel like I’m playing the flute when I hit this vape.,CopaceticBunsz,2020-11-12 23:42:07+00:00
21,1327033884555481088,"can we just recap the past 24 hours? i got a doctors note excusing me from work for my final two weeks at my job, i got my last unemployment payment that nys owed me from march this week, annd my new vape came in the mail today. i’m literally in the best mood!",SelenaAlysia,2020-11-12 23:41:47+00:00
22,1327033786320654336,Is the anu essentially reviewing other #vaping reviews to write a review of reviews? @hollieahughes @mattjcan,BrianTaxpayers,2020-11-12 23:41:24+00:00
23,1327033689864192000,"Unpopular/popular opinion: Let’s ban cigarettes, cigars, and vapes. What y’all use em for? Making your own tar in your lungs?",AgocsYasmine,2020-11-12 23:41:01+00:00
24,1327033515305791488,I wanna smoke this vape but ik ima be high af,CiCiPrettyAsss,2020-11-12 23:40:19+00:00
25,1327033473698127872,Vaping linked to massive lung disease risk in healthy non-smokers https://t.co/GuGv90wMD9,AlyeskaDawn,2020-11-12 23:40:09+00:00
26,1327033448482152448,I’m so sick of looking for my vape. How doesn’t that shit have a tracker yet!!!,jessicaamal,2020-11-12 23:40:03+00:00
27,1327033409663856640,Beta testers needed for a program to help youth quit smoking and vaping.  https://t.co/aXaAtg62CO,PamRRT,2020-11-12 23:39:54+00:00
28,1327033369067139072,how can I tell my employers that they got masks that let air go through them without admitting I was Juuling while wearing it,MattyPea_,2020-11-12 23:39:44+00:00
29,1327033069891674112,"2017: Please don't lick your Switch games
2020: Please don't vape into your Xbox
Gamers: Challenge accepted",SmorezPoptart,2020-11-12 23:38:33+00:00
30,1327032963867918336,Not nicotine vape maybe. 😏 https://t.co/AD8vsDog3W,Maveric408,2020-11-12 23:38:08+00:00
31,1327032508706328576,need to stop hitting my pen like it’s my juul😹😹,ashleistweets,2020-11-12 23:36:19+00:00
32,1327032471255396353,this is how especially dangerous smoking/vaping is bc if someone knows how to play joseph they can literally fuck over demi from the start,scenebean13,2020-11-12 23:36:10+00:00
33,1327032299347644418,I fixed my vape today and I’ve already smoked alot less weed!🙌🏼,DaniAngel420,2020-11-12 23:35:29+00:00
34,1327032064537997316,why did a grain of rice fall out of my vape juice lid?,_TKayO,2020-11-12 23:34:33+00:00
35,1327031695665745920,I’ve done a lot of regrettable things but at least I’ve never hit a fucking juul,bajablastad,2020-11-12 23:33:05+00:00
36,1327031573791846401,"Bought my first e cigarette the other day probably my fault but I thought it’d be shaped in that cool cigarette futuristic look, naw it’s just a Juul",TheRafBrat,2020-11-12 23:32:36+00:00
37,1327031534675628033,"Microsoft Begs Gamers Not to Blow Vape Smoke Into the New Xbox - Futurism. You don’t need to blow vape smoke in to the X Box, it will overheat and catch fire by itself. Solution - buy a PS5. https://t.co/AiFXf7vIFC",jonmac57665694,2020-11-12 23:32:27+00:00
38,1327031446746312704,wow niggas really blowing vape smoke into Xbox Series X making it look like a malfunction smh This is what y'all women get when u buy your lame something new 😂,HatingAssRon,2020-11-12 23:32:06+00:00
39,1327031327053422592,"Hatori: Pass the Juul
Me: Shimazaki stole it
Shimazaki, making smoke rings with his eyes:",minegishibot_,2020-11-12 23:31:38+00:00
40,1327030981841227777,Vaping is worse then smoking so don’t vape or smoke. @TruthOrange Will tell you. SO DONT SMOKE :p,DontSmokeorelse,2020-11-12 23:30:15+00:00
41,1327030936597311488,"Vape Pen w/ Cartridge 
https://t.co/CnvVBeV8DY https://t.co/tAkg3KR92r",SupportOrenda,2020-11-12 23:30:04+00:00
42,1327030775418523649,"Live streaming of the public hearing of the Senate Select Committee on #THR  in Canberra today

Dr. Alex Wodak and Dr. Colin Mendelson are giving evidence at 4-5pm AEDT Other experts and vapers also appearing listed below

Watch the livestream here https://t.co/8lnVVsmJsV https://t.co/NUIWJ6PPWo",DannyWangTW,2020-11-12 23:29:26+00:00
43,1327030716949999618,We cannot believe that we have to say this but please do not blow vape smoke into the new Xbox Series X.,SSatanima,2020-11-12 23:29:12+00:00
44,1327030272920084480,The Houston Rockets Ryan Anderson had  to go to the bathroom during the game so he hit his juul.,Rocketsfunfacts,2020-11-12 23:27:26+00:00
45,1327030228514873344,I'm vaping so hard rn,BanzaiTakesAnal,2020-11-12 23:27:16+00:00
46,1327030192376860672,does anyone have a smok vape i need help xxxx,amarasxx,2020-11-12 23:27:07+00:00
47,1327029909957398528,"If you need to replace that indica vape on your nightstand before bedtime, you're in luck; we stay open til 8:30pm each evening.",ascendretail,2020-11-12 23:26:00+00:00
48,1327029748426436608,TGA just admitted that no other country in the world requires a prescription to access vape products. Why would we then impose such restrictions on people who just want to give up smoking!,mattjcan,2020-11-12 23:25:21+00:00
49,1327029695356018688,Meanwhile one guy blew some vape smoke in their Xbox now nobody wants one lol,KingHarry06,2020-11-12 23:25:09+00:00
50,1327029342870798338,"imagine having probably the biggest corporation tell your dumbass not to blow vape smoke into a machine, smh https://t.co/13prGQioFi",IshanKoch,2020-11-12 23:23:45+00:00
51,1327029308049723393,Aye they funny asf for this. Y’all dysfunctional chimney smoking ass system &amp; y’all blaming it on vape smoke? 😂😂😂😂 https://t.co/QMtm29aTwN,___chefJ,2020-11-12 23:23:36+00:00
52,1327029250197577728,Australian #smokers and #vapers need protection from the #Australian health department. In fact the world needs protection from these extremely dangerous people that have no issue with chasing lies as their truth. @hollieahughes @SenatorAbetz @mattjcan,SidStevens7,2020-11-12 23:23:22+00:00
53,1327029125828255746,Is the #PS5 having Vape Smoke 💨?! Cause we all know about the #XboxSeriesX lol 😂,DROCK9998,2020-11-12 23:22:53+00:00
54,1327029018017869824,"yeah i really miss school. In my house there aren’t any fuck boys to yell f*ggot at each other, get in my face and ask me dumb questions while laughing incessantly, or vape behind me while loudly calling girls they’ve slept with cumsluts",girlmeetsvoid_,2020-11-12 23:22:27+00:00
55,1327028868067201024,Vaping is currently my present.,SergioF60554428,2020-11-12 23:21:51+00:00
56,1327028681085218822,when i bought smarties flavored vape juice,ineedsommilk,2020-11-12 23:21:07+00:00
57,1327028426293866498,Of course my vape died while I’m waiting on covid results and not leaving my house OF COURSE!!! Today is not my day,rikkileegrand,2020-11-12 23:20:06+00:00
58,1327028068733636608,Why are people smoking/vaping into the Xbox don’t do that to any electronics,tall1grant,2020-11-12 23:18:41+00:00
59,1327027937800032257,something very cool about what we in show business call “grief” is that everything can be fine and then one thoughtless comment hours prior will have u suddenly crying in the vitamin aisle of kroger while sucking on a Lemon Blueberry flavored vape as though it is a paper bag,gracecamille_,2020-11-12 23:18:10+00:00
60,1327027693104279552,Almost have had Frank for a year which also means I’ve almost been vape free for a year YADIGGGGGG,qneekstv,2020-11-12 23:17:11+00:00
61,1327027588276084739,It’s sad that some dumb ass people are doing this for the pics not realizing that vapes are literally liquid and can seriously damage the console they just wasted $500 on 🤣 https://t.co/TFg5CMnwXZ,ThatGuyBertisha,2020-11-12 23:16:46+00:00
62,1327027580546019328,"“Vapes are millennial pacis”

@CrinkleCanine",DinoNuggie14,2020-11-12 23:16:44+00:00
63,1327027501982511111,"Microsoft paid someone to say they blew vape smoke in an Xbox, no wonder why william gates left yall dumbasses",SlimmCalhoun20,2020-11-12 23:16:26+00:00
64,1327027421388804097,"If you are watching the Senate Enquiry for the Australian Health Select Committee on Harm Reduction. Here is a nutshell a visual representation of the TGA ""deep evaluation of data and evidence"" on the effectivity and safety of vaping. (no bias at all 🙄). https://t.co/pSSlgUaYxF",ElianaRubashkyn,2020-11-12 23:16:06+00:00
65,1327027160742305794,"Vape Pen w/ Cartridge 
https://t.co/CnvVBeV8DY https://t.co/dXvrUwL6rn",SupportOrenda,2020-11-12 23:15:04+00:00
66,1327027142140387328,"Don't blow vape smoke into your #XboxSeriesX
https://t.co/I5Z5W9Al5W https://t.co/WpdaSu0gVe",VG247,2020-11-12 23:15:00+00:00
67,1327027138533466112,"As a Vaper I approve of this message. Exhaled vapor from a mod WILL leave a residue or film as it cools when it comes into contact with surfaces. The last thing you need is for your $500 Series X to short circuit because of something you thought would be ""cool"" https://t.co/saf7ChBTkY",JBlack1376,2020-11-12 23:14:59+00:00
68,1327027074478075904,magic to me: magic is when vape 75% battery life if i plug in i can't use if i use and fall asleep in chair without it plugged in i can plug it in when i go to bed 🛌,16_ripley,2020-11-12 23:14:44+00:00
69,1327026876162969610,Been there.  Quitting is hard as hell and took me years and switching to vaping was the only thing that finally got me off of them.  Been six years now. https://t.co/ovj47FKQRM,portdauphin,2020-11-12 23:13:56+00:00
70,1327026728095543296,I’ll hit a vape over smelling like a Newport forever but you right it’s not cool at all https://t.co/vNSajT6KrB,ADONISSOUND,2020-11-12 23:13:21+00:00
71,1327026533526073346,Vaping or ghost hunting #taskmaster,ketouzin,2020-11-12 23:12:35+00:00
72,1327026275781840898,The UK Vape Show - Episode 275  - With Blazn Vapes https://t.co/luZqZHOfUp,VapingWithVic,2020-11-12 23:11:33+00:00
73,1327026246123974661,all i did today was eat a protein bar vape and sleep,somniacals,2020-11-12 23:11:26+00:00
74,1327025932557836288,"two Juuls died on me this is my third one, Ill try to take care of it and see if it dies too",KayEduardo2,2020-11-12 23:10:11+00:00
75,1327025929047199744,Why Xbox put out a disclaimer to not blow vape smoke into the console? Tf you niggas doing?? 🤣🤣,SaLute_The_Bars,2020-11-12 23:10:11+00:00
76,1327025426074636288,Another happy vaper! 🤘🏻😃 https://t.co/ALNt0mwbPx,CustomAegis,2020-11-12 23:08:11+00:00
77,1327025407967846400,"how to quit juuling: smoke cigarettes 

how to quit cigarettes: start juuling",GamestopIsrael,2020-11-12 23:08:06+00:00
78,1327025044585930753,"I can Vape into my PlayStation, no problem, make better consoles https://t.co/1Z5Prx4fyQ",Christiaan_8,2020-11-12 23:06:40+00:00
79,1327024944476254210,Vaping for pussies if u gonna fuck if ur lungs might as well go all the way and start smoking a pack a day!,chasekorzo,2020-11-12 23:06:16+00:00
80,1327024934779023361,losing ur vape in bed has to be the most annoying thing ever,laurenmxckenzie,2020-11-12 23:06:14+00:00
81,1327024837974487042,Blowing vape in a $500 system smh...They leave toilet paper in they ass when they wipe. https://t.co/0gRR7RVTz4,G_HannahJr,2020-11-12 23:05:50+00:00
82,1327024703488266243,"New @VaporessoEcig Giveaway Now Live! -  Enter now for a chance to win 1 of 8 Luxe PM40 kits - https://t.co/Xrwo73e7cK

#ecigclick #vape #vaporesso #vaporessoluxepm40 #vapegiveaway #vapefam #vaping #vapelyfe #giveaway",leed2019,2020-11-12 23:05:18+00:00
83,1327024655052333056,"So theres still hope that I can vape out in the open reflexively while holding office, no lies needed. https://t.co/OE8GFUh4oH",mtreyens,2020-11-12 23:05:07+00:00
84,1327024641043542018,One week from today is the Great American Smokeout.  Have you thought about quitting smoking or vaping?  Check out these resources to learn more!  #RCFY  #MyLifeMyQuit https://t.co/w855eQN78U,RCFY,2020-11-12 23:05:04+00:00
85,1327024601336000516,"i really miss smoking real cigs i keep having dreams about it. and i know the second i try one itd taste like complete shit these days. but fellas that's just how a cowboy living off vapes has to live, especially when his balls smell like mine do.",wooser69,2020-11-12 23:04:54+00:00
86,1327024502665043969,"New @VaporessoEcig Giveaway Now Live! -  Enter now for a chance to win 1 of 8 Luxe PM40 kits - https://t.co/RtlEkDPPi1

#ecigclick #vape #vaporesso #vaporessoluxepm40 #vapegiveaway #vapefam #vaping #vapelyfe #giveaway",Miss_Piggy_1976,2020-11-12 23:04:31+00:00
87,1327024420037283840,please dont vape in your xbox series x,valuesxz,2020-11-12 23:04:11+00:00
88,1327024353683365888,Haven’t rolled up in time this vape got me lazy,OkayDX_,2020-11-12 23:03:55+00:00
89,1327024243704520705,This mofo really just gave me a juul and a cart😳,GrantHarris22,2020-11-12 23:03:29+00:00
90,1327024043204042754,"Well this #XboxSeriesX aint vaping no more. 🤣🤣🤣

https://t.co/41UNMKJP0U",PS_SaltyC,2020-11-12 23:02:41+00:00
91,1327023982965649409,"New @ecigclick Awards Giveaway Now Live! -  Enter now for a chance to win 1 of 27 Prizes from Murlz Modz, Innokin, Harleys Original E-Liquid &amp; Dovpo!  - https://t.co/Xrwo73e7cK

#ecigclick #harleysoriginal #murlzmodz #vapepod #vapegiveaway #innokin #dovpo #vape #giveaway",leed2019,2020-11-12 23:02:27+00:00
92,1327023814757105666,"New @VaporessoEcig Giveaway Now Live! -  Enter now for a chance to win 1 of 8 Luxe PM40 kits - https://t.co/EJsMjPZbwa

#ecigclick #vape #vaporesso #vaporessoluxepm40 #vapegiveaway #vapefam #vaping #vapelyfe #giveaway",Cptjhmiller,2020-11-12 23:01:47+00:00
93,1327023714303680518,"Avoiding e-cigarettes and tobacco use ...must remain a priority as nearly 9 out of 10 smokers start by age 18 according to the National Center for Chronic Disease Prevention and Health Promotion’s Office on Smoking and Health. 
#JUUL #ecigs #teens #COVID19 https://t.co/FPyqC2FMLH",TrustwellLaw,2020-11-12 23:01:23+00:00
94,1327023628840419328,$MVP $LSH Medical cannabis expert boosts Lifespot Health leadership ahead of vape pen trials (via SmallCaps) https://t.co/7H5AEBsQyI #MVP #MedicalDevelopmentsInternational #LSH #LifespotHealth #ASX #ausbiz #smallcaps #microcaps #ausstocks,newswiresau,2020-11-12 23:01:02+00:00
95,1327023614416326657,Just walked past somebody napping in LA could make everyone else feel left his juul at home,ClayBorrellBot,2020-11-12 23:00:59+00:00
96,1327023528290476033,"With its innovative screen-less design, the Cloud Kartz LED Vaporizer boasts smooth lines and a real ergonomic feel in your hand. Get it @ https://t.co/jcK4ac9gH0
#vapebattery #vapeworld #vapenation #vapedaily #vapepen #vaper #vape #vapegirls #vapelife #vapeclouds #vapes https://t.co/l22HdSluY8",TheStashShack,2020-11-12 23:00:38+00:00
97,1327023498242400257,did juul really got suspended,sunootokki,2020-11-12 23:00:31+00:00
98,1327023373994446849,Watch Someone Remake FIFA While Doing Vape Tricks,vg_headlinebot,2020-11-12 23:00:01+00:00
99,1327023371398369283,.@CBR: Xbox Addresses Series X Vaping Videos https://t.co/qJkVQYLLjw,FanbaseWeekly,2020-11-12 23:00:01+00:00
100,1327022812553498624,"Mandatory Lockdown Ordinance 33-69:
• Double masking is being a GOOD CITIZEN.
• One person per feeding trough
• Sun = Literally Satan
• Do NOT smile (very important)
• laughing KILLS grandma
• Some doctors suggest smoking Camels over vaping to flatten the curve https://t.co/er3fEa1qwX",KenTheroux,2020-11-12 22:57:48+00:00
101,1327022689337430017,"""vaping deaths and injuries"" #headdesk. They just keep lying. https://t.co/aPN0CC5Bn4",jimcollins,2020-11-12 22:57:18+00:00
102,1327022632466849792,My dishwasher and weed vape make the exact same noise when they turn off and it gets confusing depending on how much I use either,iJoshGoldstein,2020-11-12 22:57:05+00:00
103,1327022329600335872,Give the people vape proof escapism or get out of market. https://t.co/jrM3502jJj,DeekingAround,2020-11-12 22:55:52+00:00
104,1327022282510897155,"New @VaporessoEcig Giveaway Now Live! -  Enter now for a chance to win 1 of 8 Luxe PM40 kits - https://t.co/R8LkuMOz1X

#ecigclick #vape #vaporesso #vaporessoluxepm40 #vapegiveaway #vapefam #vaping #vapelyfe #giveaway",Jen_Turista,2020-11-12 22:55:41+00:00
105,1327021857766256641,"New @ecigclick Awards Giveaway Now Live! -  Enter now for a chance to win 1 of 27 Prizes from Murlz Modz, Innokin, Harleys Original E-Liquid &amp; Dovpo!  - https://t.co/mp0ePcwxB5

#ecigclick #harleysoriginal #murlzmodz #vapepod #vapegiveaway #innokin #dovpo #vape #giveaway",Ink_Feckted,2020-11-12 22:54:00+00:00
106,1327021672138829824,"God gave us the new Xbox, and kids started vaping in them",trenDcanada,2020-11-12 22:53:16+00:00
107,1327021662483582976,"Fake news, they blowing vape smoke inside https://t.co/U1xCb4zoSG",0R_Green3,2020-11-12 22:53:13+00:00
108,1327021617130696706,"""Please do not blow vape smoke into your Xbox Series X"" https://t.co/f8fjdDIXbI",vulture,2020-11-12 22:53:03+00:00
109,1327021523727650816,Are people really blowing vape into their Xbox or am I missing something? https://t.co/vJ59BvC3NO,WriterFloofy,2020-11-12 22:52:40+00:00
110,1327021330424688640,"VENVM VAPES - RESTOBAR

📍Shorthorn https://t.co/T9sMx3S6Wq",RMFinds,2020-11-12 22:51:54+00:00
111,1327020753485664258,Smoking on pressure don’t fuk wit no juul,1KingIce,2020-11-12 22:49:37+00:00
112,1327020437210099713,Go head copp that P5 king ya LunchBox niggas losin ya shit turnin into vapes,EBK_Koff,2020-11-12 22:48:21+00:00
113,1327020241193492482,"Gonna have a “hot couch” night: dippin’ my hot pocket in queso, bustin’ out my remaining supply of mango Juul pods, and pulling up Muse’s “Live at Wembley” on YouTube",geistcapital,2020-11-12 22:47:35+00:00
114,1327020204023574528,"New @VaporessoEcig Giveaway Now Live! -  Enter now for a chance to win 1 of 8 Luxe PM40 kits - https://t.co/6jvA2wWcKA

#ecigclick #vape #vaporesso #vaporessoluxepm40 #vapegiveaway #vapefam #vaping #vapelyfe #giveaway",BridgewoodSimon,2020-11-12 22:47:26+00:00
115,1327020193747509251,"New @VaporessoEcig Giveaway Now Live! -  Enter now for a chance to win 1 of 8 Luxe PM40 kits - https://t.co/IhmUcvqK5e

#ecigclick #vape #vaporesso #vaporessoluxepm40 #vapegiveaway #vapefam #vaping #vapelyfe #giveaway",Bibers021,2020-11-12 22:47:23+00:00
116,1327020102043066373,"Check out this vape flavor: ""Street Popcorn Maker"".",buttsex_subtext,2020-11-12 22:47:01+00:00
117,1327020070355292161,"tw: cutting 

my boyfriend: if you start cutting yourself again i’m gonna go back to vaping 😀",andradetpwk,2020-11-12 22:46:54+00:00
118,1327019753509179395,People really blowing vape into their Xbox’s 🤣 I hate this community.,Jotii_,2020-11-12 22:45:38+00:00
119,1327019629689122823,"Teens and Young Adults Can Enroll in E-Cigarette Quit Program

Free quit vaping text message service (text VapeFreeFFX to 88709); details: https://t.co/gAiJSrx2ps https://t.co/WE5oNrPRbA",fairfaxcounty,2020-11-12 22:45:09+00:00
120,1327019611863257088,"Vape Pen w/ Cartridge 
https://t.co/CnvVBeV8DY https://t.co/DrBTXXVWZG",SupportOrenda,2020-11-12 22:45:04+00:00
121,1327019592808423424,"I'm still waiting for my PS5 to be delivered. If Xbox consoles were vaping the other day, I have a feeling mine is in some back alley shooting heroin.",johnblueriggs,2020-11-12 22:45:00+00:00
122,1327019383630295040,crazy cause i can blow vape smoke into my ps5 https://t.co/Q8AGoFU4F3,griffindustries,2020-11-12 22:44:10+00:00
123,1327019365330542595,"Nintendo:: ""Don't lick the cartridges.""
Xbox: ""Don't blow vape into your console.""
Sony: To be determined.",MagicMimic,2020-11-12 22:44:06+00:00
124,1327019289950511104,"dont smoke or vape, the only thing that should go in your lungs is air",Mizuki_Moths,2020-11-12 22:43:48+00:00
125,1327019188821475331,got a new vape,djbabylou,2020-11-12 22:43:24+00:00
126,1327019126607450113,CONTAINING CHAOS | Vape Industry Reaction to 2020 U.S. Presidential Elec... https://t.co/QUjcTeE7lF via @YouTube,JonASaroea,2020-11-12 22:43:09+00:00
127,1327018983330111488,"Are you guy looking for a flavor out of this world? Then look no further! Vape City has got you covered. Come in today and try our Naked E-Juice! 

2584 W 4700 S, Taylorsville, UT 84129

#vapecity #naked #ejuice #vape #vapeshop #vapersofutah #utahvape #slc https://t.co/fBHfl0GRZr",vapecityslc,2020-11-12 22:42:35+00:00
128,1327018941286375424,Good with my hands but even better with the tool smoking on these niggas like a Juul,qxclosedcasket,2020-11-12 22:42:25+00:00
129,1327018883690147847,Vaffle is a global vape community for vapers all over the world. You can get all you need on vaping. https://t.co/rRcVPe72Mx https://t.co/GlFm22w587,108Aleks,2020-11-12 22:42:11+00:00
130,1327018795370565632,What Skerrit is saying in regard to not bringing #tobacco under the prescription model is complete rubbish. The @TGAgovau site explicitly mentions novel #nicotine products - #SLT &amp; #HTP.,vaper_the,2020-11-12 22:41:50+00:00
131,1327018545465745409,i’m not allowed to juul in the city md line huh 🤔,ennuiboy420,2020-11-12 22:40:50+00:00
132,1327018449009307649,"I See These 2 Dudes Standing Outside The Mall Vaping &amp; Then They Go Into The Mall

They're Refusing To Put On A Mask",Miss_Angel_Baby,2020-11-12 22:40:27+00:00
133,1327018417145204737,They look amazing good thing I don’t vape https://t.co/xSGPgCj3eB,MontgomeryTruax,2020-11-12 22:40:20+00:00
