,TweetID,TweetContent,TweeterUsername,TweetDatetime
0,1047275001999646720,Cop a juul or roll a wood. Decisions🙄🙄🙄,Itsdanny69,2018-10-02 23:59:52+00:00
1,1047274893828612098,"I liked a @YouTube video https://t.co/QHcX7UlSGn The True Vapors show #167 ""UNCENSORED VAPE TRICKS""!!!",cckitchen1978,2018-10-02 23:59:26+00:00
2,1047274744620376064,"Save the date for our Quarter 2 Parent Learning Community meeting Oct 17 @ 5:30 in the Library. We will discuss vaping, bullying and have a student speaker @HIDOE808 https://t.co/bxp55nKtAr",KonawaenaHSPrnt,2018-10-02 23:58:51+00:00
3,1047274723355365377,"Blue Raspberry Gummies By Blizarre Blue $22.99 ❄️ One of my favorite flavors! https://t.co/9AkrylODNa 
#vapejuice #vapedaily #vapefam #vape https://t.co/pwbN2YmvId",Smokes_Pro,2018-10-02 23:58:46+00:00
4,1047274626303369218,"The insurance rep came to the unit at the end of my shift to talk to me about potentially getting on a health plan. She starts to ask health questions like “do you smoke”. To which my preceptor yells in the middle of the nursing station “nah she just rips the juul” 

Goodbye.",_breannmarie,2018-10-02 23:58:22+00:00
5,1047274429397573632,"I liked a @YouTube video https://t.co/gaBNiG0lY5 Vapes Exploding, Batteries Venting Rant and Complaints",jl_cyrus,2018-10-02 23:57:36+00:00
6,1047274300019945472,#FDA seizes thousands of documents from e-cig startup #Juul https://t.co/EZ5BsvGMh8 https://t.co/EBodnoHK58,eugenplaton,2018-10-02 23:57:05+00:00
7,1047274222572240896,"Like cheap balanced #vape #juice ? Try Broke Dick! Hahaha i know how it sounds, but its for cheap bastards that have a budget till payday. The owner is named Richard...explains https://t.co/XqVBqDpWlT https://t.co/2uwypni2PR",MrMeeseeks187,2018-10-02 23:56:46+00:00
8,1047274221620137985,I’m with my crew smokin on juul,chloee0016,2018-10-02 23:56:46+00:00
9,1047274165852692480,Juul doesn’t even make a strawberry flavor so check your facts next time nerd https://t.co/EWdRNb3Acd,emilyyconnell,2018-10-02 23:56:33+00:00
10,1047274158508445696,omg today during lunch 2 of my friends (rachel &amp; cass) and i got into a bathroom stall together an one whipped out her juul. so they start smoking and then sum administrator walked in got in the stall next to us and we make cass stand in the middle while rachel and i+,blakeluvsariana,2018-10-02 23:56:31+00:00
11,1047274145795399680,"Correction: We said in today's edition that FDA inspectors showed up earlier at Juul's offices and seized a thousand-plus pages, but they materialized at the San Francisco company on Friday. (The FDA announced the maneuver this a.m.) Apologies, readers. What we get for rushing!",StrictlyVC,2018-10-02 23:56:28+00:00
12,1047274030829465601,I’ve started vaping and it’s the most millennial – and mystifying – thing I’ve ever done https://t.co/lIHHZZHpGg,coolrunning2009,2018-10-02 23:56:01+00:00
13,1047273997174558720,FDA seizes documents in surprise inspection of e-cigarette maker Juul https://t.co/f6c3kJ374J,_MTMTE,2018-10-02 23:55:52+00:00
14,1047273990312669184,Did I just see you with a vape?¿ https://t.co/xS9yP3IfOp,JimmyJrJr,2018-10-02 23:55:51+00:00
15,1047273873958264832,I know some of y’all like this shit so go see my brother at @FirstTimeVape get ya juul fix https://t.co/xZtRgUXumI,hhiro333,2018-10-02 23:55:23+00:00
16,1047273844174671872,"We've added new Green Slushie By Candy Corner 60ml Multipack at our store. Check it out here: https://t.co/NnuCvaqjLp.
#vape #vapelife #vaping #vapeporn #vapenation #vapecommunity #vapeon #vapefam #vapestagram #instavape #vapepics #vapelyfe #eliquid #vapetricks #vapedaily #vapef",retrovaperuk,2018-10-02 23:55:16+00:00
17,1047273631066144769,Vape is life step back and inhale,vape_apparel,2018-10-02 23:54:25+00:00
18,1047273597969096705,This guy vaping in front of me at this @cubs game needs to not.,beckyyaworski,2018-10-02 23:54:17+00:00
19,1047273591153278976,"Ask for it at your shop 👊
#vapestagram #vapedaily #vapeon #vapenation #vapepics #vaping #eliquid #clouds #vapor #vapefriends #vapelove #vapeshop #ecig #vaper #vapingcommunity #vapehard… https://t.co/AfAxIFTBcB",VapeMZ,2018-10-02 23:54:16+00:00
20,1047273582286557184,"My name is Afrikan Promotions, here are the services I offer:
💥Promoting Events/Parties/Businesses

💥Hookah Services: Charcoal ♨️ or Electronics (vapes💨) Available 

📸Photography📸… https://t.co/Ikk4YNnvak",DePromotress,2018-10-02 23:54:14+00:00
21,1047273457183084545,Eyo juul sessions during class breaks &gt;&gt;&gt;&gt;,I_amadoor,2018-10-02 23:53:44+00:00
22,1047273429727154181,"F.D.A. Raids Juul Headquarters, Seeking Documents

By JAN HOFFMAN from NYT Health https://t.co/VIsMgCFPP3
via IFTTT
October 02, 2018 at 02:50PM https://t.co/EviK8mW6Uo",healthn35974009,2018-10-02 23:53:37+00:00
23,1047273266115747841,They need a find my juul app,CantCatchKris,2018-10-02 23:52:58+00:00
24,1047273173786476544,"Armerah Dummy 510 #driptip #ecig mouthpiece multipack – short, round tip, narrow/small bore for a tight and tasty #vape, polycarbonate plastic in opaque colours, black, blue, clear, green, purple, red and yellow. Just £4.99 for 3 pack, UK stock, buy here https://t.co/JthBbOEwfv https://t.co/KqhL2wXrtV",armerahuk,2018-10-02 23:52:36+00:00
25,1047273169524903936,"Virginia woman badly burned by vaping device, airlifted to hospital, police say https://t.co/nHL8xU1U7C https://t.co/sjG1NE4UkK",Tmartin490,2018-10-02 23:52:35+00:00
26,1047273058044710913,I can’t find my JUUL and I’m pissed,CaseyRochelleXo,2018-10-02 23:52:09+00:00
27,1047273017435275269,"Beyond Brownies And Vape Pens, Here Are 18 Industries Cannabis Is Disrupting https://t.co/B6TMTRPwiP … via @cbinsights https://t.co/VnpOa3q7Z4",EarthAccounting,2018-10-02 23:51:59+00:00
28,1047272828809011200,FDA seizes documents in surprise inspection of e-cigarette maker Juul https://t.co/x7PL6Jy5zR #SmartNews,srauer20,2018-10-02 23:51:14+00:00
29,1047272783347175424,FDA makes surprise inspection visit to e-cigarette maker Juul. https://t.co/B3cDC2sXkN,NBCNews,2018-10-02 23:51:03+00:00
30,1047272625561636864,Could we eat him now?😀😋😜#China #vape #vapelife #vapepen #vaporizer #cbd #cbdoil #cbdvape #extracts #cannabis #sativa #indica #mmj #hybrid #essentialoil https://t.co/SFB2w9ORSx,RyanKon14551629,2018-10-02 23:50:25+00:00
31,1047272603054985216,Juul in FDA's Sights as U.S. Rethinks Position on E-Cigarettes - https://t.co/fpFFeAac4A,Hotpage_News,2018-10-02 23:50:20+00:00
32,1047272531223355393,My brother is vaping in the car I'm gonna snap 😔,riddlercrow,2018-10-02 23:50:03+00:00
33,1047272504769859584,MOST REQUESTED GIVEAWAYS WEEK #2 - NEW I4 INTELLIGENT CHARGER BY NITECORE https://t.co/e4ps1lTWoh #vape #vaping #vapefam #vapegiveaway #giveaway,hempgod2,2018-10-02 23:49:57+00:00
34,1047272403146039296,"they call me Dragon Jim,,
bc i vape",ByzJim,2018-10-02 23:49:32+00:00
35,1047272225915789312,Juul hit with surprise FDA inspection over marketing practices https://t.co/2aeyG8GCSJ,marciojmsilva,2018-10-02 23:48:50+00:00
36,1047272193158078464,"*hits the vape*

Grandpa: “ahora si parase que estamos asando elotes”

GRANDPA WHAT LOL",_asstomouth_,2018-10-02 23:48:42+00:00
37,1047272192239706113,"Juul marketing materials seized as FDA targets underage vaping The Federal Drug Administration has seized more than one thousands documents from e-cigarette company Juul,... https://t.co/456R5u5YmS",sam0rsy,2018-10-02 23:48:42+00:00
38,1047272169980514304,Is your dick hard? “Na that’s just my juul”,cloutcid,2018-10-02 23:48:37+00:00
39,1047272158462926848,Just saw 2 construction workers having a vape competition 😂,MayhemHD_,2018-10-02 23:48:34+00:00
40,1047272118881271809,Juul marketing materials seized as FDA targets underage vaping: The Federal Drug… https://t.co/21jaJYecuj,Feedjunkie,2018-10-02 23:48:25+00:00
41,1047272057464131585,They should make Juuls illegal,ihatethiskid,2018-10-02 23:48:10+00:00
42,1047272037172084738,People who juul have moth energy,zattata,2018-10-02 23:48:05+00:00
43,1047272010613755905,Juul marketing materials seized as FDA targets underage vaping https://t.co/TyxWc7H2vF https://t.co/oGVryCoxkm,7000xperts,2018-10-02 23:47:59+00:00
44,1047272001860194304,Juul marketing materials seized as FDA targets underage vaping https://t.co/h93LaGcZeh https://t.co/D2oXQ0xEEK,YaroStarak1,2018-10-02 23:47:57+00:00
45,1047271991156375552,Juul marketing materials seized as FDA targets underage vaping https://t.co/V7mjTvwtl6 https://t.co/J8G90uWm6q,7000xperts1,2018-10-02 23:47:54+00:00
46,1047271982436442112,Juul marketing materials seized as FDA targets underage vaping https://t.co/hlUipAeS4R https://t.co/90JMi1tfrh,Liam4mic,2018-10-02 23:47:52+00:00
47,1047271911661686784,"Sales of Juul E-Cigarettes Skyrocket | TUESDAY, Oct. 2, 2018 (HealthDay News) - In just a year, sales of Juul electronic cigarettes jumped 641 percent, a new U.S.... | https://t.co/y8Qa52QEeV",Rocketnews1,2018-10-02 23:47:35+00:00
48,1047271867474763776,BREAKING: @JUULvapor Raided by @US_FDA | Seizes Thousands of Documents as Pressure Mounts to Crackdown on Underage Vaping Epidemic [VIDEO] https://t.co/nXywzZAFaG https://t.co/Ms6DeCBIBa,ModernWallSt,2018-10-02 23:47:25+00:00
49,1047271865759281153,this vape juice is so strong when i opened the bottle the smell made me shudder,nonbinarynarcho,2018-10-02 23:47:24+00:00
50,1047271783785582592,FDA Conducted Surprise Inspection of Juul's Headquarters https://t.co/yjFPTjujXe https://t.co/mSOfCWlDph,eugenplaton,2018-10-02 23:47:05+00:00
51,1047271527874514945,"We love GIVEAWAYS! Enter to win our $100 weekly Hot Juice Giveaway &amp; check out our Blog for more giveaways! 🎉
VISIT: https://t.co/KtUa2EgLj2

#hotjuice #vapegiveaway #vapecontest #vapenation #vapelife #vapefam #vapecommunity  #ejuice #eliquid #vapejuice #cbdvape #vape #vaping https://t.co/mWQDqS2pc3",hotjuiceusa,2018-10-02 23:46:04+00:00
52,1047271503467827201,Juul Lab sounds like a good name for the bathrooms at school https://t.co/sNFdMDyiUt,rj_harkin,2018-10-02 23:45:58+00:00
53,1047271488527720449,"My name is Afrikan Promotions, here are the services I offer:
💥Promoting Events/Parties/Businesses

💥Hookah Services: Charcoal ♨️ or Electronics (vapes💨) Available 

📸Photography📸… https://t.co/7ap9uxYobq",DePromotress,2018-10-02 23:45:54+00:00
54,1047271473600258048,#TechLaw: FDA seizes 'more than a thousand pages' of documents in surprise inspection of e-cigarette maker Juul https://t.co/5cXORcohqg,iamtechlaw,2018-10-02 23:45:51+00:00
55,1047271464850874369,FDA conducts surprise inspection on Juul https://t.co/G8DoHkMTUB #trending #news #video,TrendingNewsTV,2018-10-02 23:45:49+00:00
56,1047271422568148993,CDC eyes skyrocketing JUUL sales due to teens https://t.co/oRSRrPLAaM https://t.co/HMTqCC4lcF,12News,2018-10-02 23:45:39+00:00
57,1047271377441628160,"My name is Afrikan Promotions, here are the services I offer:
💥Promoting Events/Parties/Businesses

💥Hookah Services: Charcoal ♨️ or Electronics (vapes💨) Available 

📸Photography📸… https://t.co/7iRVYySCyz",DePromotress,2018-10-02 23:45:28+00:00
58,1047271352661676032,y’all gotta stop hitting your juuls in the library please,alexflorias,2018-10-02 23:45:22+00:00
59,1047271291441635329,Anybody know where juul is,M02E_AYY,2018-10-02 23:45:07+00:00
60,1047271273754030080,"Juul Labs hands over 1,000 documents in FDA inspection https://t.co/kClx630PGi https://t.co/OzR5w62jnu",NGideon3,2018-10-02 23:45:03+00:00
61,1047271257790717952,My 90 year old grandma just got a Juul today,brennajbarnes,2018-10-02 23:44:59+00:00
62,1047271226295685123,"Mi Vape Co. by Vaping for Vapers, by Vapers is #NowPlaying on https://t.co/IBx3JZxB9Y https://t.co/wXwxi0t4hI https://t.co/foNg8lo2bK",CCS_Radio,2018-10-02 23:44:52+00:00
63,1047271206674714624,I’m ab to make a find my juul app !!,benthompson148,2018-10-02 23:44:47+00:00
64,1047271159731867648,"Sales of JUUL e-cigarettes skyrocket, posing danger to youth. https://t.co/cVF33auhpQ",sjcphs,2018-10-02 23:44:36+00:00
65,1047270995671875584,"I liked a @YouTube video https://t.co/Az3wfGrV5A USB Killer vs iPhone XS Max/XR Fake, Note 9 &amp; Juul! Instant Death?",ka6820,2018-10-02 23:43:57+00:00
66,1047270974419349509,FDA seizes documents in surprise inspection of e-cigarette maker Juul Express News https://t.co/ArhCgNvdAi via @Express News,NewExpressNews,2018-10-02 23:43:52+00:00
67,1047270770961997824,When you hit your vape not realizing it’s out of juice 🤮🤮🤮,itshollywithani,2018-10-02 23:43:03+00:00
68,1047270255347814401,When the vapers hit #southerncharm @shellheels https://t.co/oUJEt3QmWq,joeydoster,2018-10-02 23:41:00+00:00
69,1047270105158234114,“i’m gonna go sit in my car and juul and cry”,jarofchan9e,2018-10-02 23:40:25+00:00
70,1047270007347073026,FDA Seizes Documents From Juul in Latest #ECigarette Crackdown https://t.co/zFY2pp1qdn,EpochTimes,2018-10-02 23:40:01+00:00
71,1047269972320423943,A guy just laughed at the M&amp;M commercial before the movie starts. And now he’s vaping so it makes sense.,omgstephanie,2018-10-02 23:39:53+00:00
72,1047269955794698241,"Sales of JUUL e-cigarettes skyrocket, posing danger to youth. Product dominated the U.S. e-cigarette market by end of 2017. To read full Press Release, visit: https://t.co/FhdaMNdPfe https://t.co/UGxijpTACX",sjcphs,2018-10-02 23:39:49+00:00
73,1047269952997269504,"(F.D.A. Seizes Documents From Juul Headquarters)  

The Food and Drug Administration conducted a surprise inspection of the headquarters of the e-cigarette maker Juul Labs last... - https://t.co/e2dqsBjcIl",gooshi2000,2018-10-02 23:39:48+00:00
74,1047269948744249345,also@I realized all I did today was go to school and then come home and vape for 4 hours no wonder my voice is fucked,witherlily6,2018-10-02 23:39:47+00:00
75,1047269840015302656,#Juul marketing materials seized as #FDA targets underage vaping #SlashGear https://t.co/bYHp9Czw6S @slashgear https://t.co/hsEVycvwux,darrenculbreath,2018-10-02 23:39:21+00:00
76,1047269746536796166,Juul marketing materials seized as FDA targets underage vaping https://t.co/qKHLhoskG8 https://t.co/cW6A3MYqR9,slashgear,2018-10-02 23:38:59+00:00
77,1047269726051848192,F.D.A. Seizes Documents From Juul Headquarters https://t.co/azFouYMMuT,BlogBookMark,2018-10-02 23:38:54+00:00
78,1047269661686059008,i was packing up to leave class and i looked this guy dead in the eyes as he exhaled vape. couldn’t wait a minute to exit the lecture hall? damn 😂 y’all different,deathefangirl,2018-10-02 23:38:39+00:00
79,1047269627854819334,“i forgot that i kinda love vaping” -@ZechPluister,taysux,2018-10-02 23:38:31+00:00
80,1047269593616510981,"Got crafty with my juulvapor 
#professional #hired #charlotte #northcarolina #vape #creative #tattooed #alternative #published #printed #paid #photography #modeling #model #artist… https://t.co/XOdHSruCft",BarbarellaFm,2018-10-02 23:38:23+00:00
81,1047269519771820032,*Coughs while vaping*,sp7_bot,2018-10-02 23:38:05+00:00
82,1047269465149333504,this how i imagine people that smoke juuls https://t.co/ee38pc57c3,honeygom69,2018-10-02 23:37:52+00:00
83,1047269464784474112,"I’m out of weed, out of vape juice , out of money, and out of my god damn mind",Jewdanaa,2018-10-02 23:37:52+00:00
84,1047269421423706113,"When does the American public realise that billions of their tax dollars are used for federal &amp; supranational 'health' bodies whose only goal is protecting the #pharma industry revenues from competition?
#juul #vaping #Nicorette #fda #cannabis #opioids
https://t.co/l7rFCwGGRz",KlausKblog,2018-10-02 23:37:42+00:00
85,1047269337428635648,Most Americans Think Vaping is as Bad as Smoking https://t.co/Lh8SpjNjGI via @Vaping360,saraturner19,2018-10-02 23:37:22+00:00
86,1047269307791503360,MCOE will host Vaping Epidemic - Parent Education Workshop on October 18th at 6:30 p.m.  Thank you to our partners @MarinHHS and @SFMarinMedSoc https://t.co/5dAixzdWpT,MCOEPD,2018-10-02 23:37:14+00:00
87,1047269282730704897,"Just watched three different people walk out of the Rec–after working out, being healthy, bettering themselves–immediately take a huge drag of their vapes... like what?",tttthyd,2018-10-02 23:37:08+00:00
88,1047269235058040832,candice why is your vape pen on the dinner table,flintebooks,2018-10-02 23:36:57+00:00
89,1047269182465687557,"Got crafty with my juulvapor 
#professional #hired #charlotte #northcarolina #vape #creative #tattooed #alternative #published #printed #paid #photography #modeling #model #artist… https://t.co/8ZnTaw8vsh",BarbarellaFm,2018-10-02 23:36:45+00:00
90,1047268980153638912,"Got crafty with my juulvapor 
#professional #hired #charlotte #northcarolina #vape #creative #tattooed #alternative #published #printed #paid #photography #modeling #model #artist… https://t.co/YvV6Q6kT81",BarbarellaFm,2018-10-02 23:35:56+00:00
91,1047268881289678848,"Got crafty with my juulvapor 
#professional #hired #charlotte #northcarolina #vape #creative #tattooed #alternative #published #printed #paid #photography #modeling #model #artist… https://t.co/y06T6zk2h0",BarbarellaFm,2018-10-02 23:35:33+00:00
92,1047268880455028736,"Whoever is suckin on that grape bubblegum vape while hustling home, take it down a notch. It’s a Tuesday.",chilis2go,2018-10-02 23:35:33+00:00
93,1047268836603510785,#FDA Seizes Thousands Of Documents From E-Cigarette Maker #Juul: (CBS) — The Food and Drug… https://t.co/etpIEagmGx,chicagopixels,2018-10-02 23:35:22+00:00
94,1047268798770761728,"Got crafty with my juulvapor 
#professional #hired #charlotte #northcarolina #vape #creative #tattooed #alternative #published #printed #paid #photography #modeling #model #artist… https://t.co/vFeQWUzOOp",BarbarellaFm,2018-10-02 23:35:13+00:00
95,1047268770845093888,who down to get mood vape?,lleeexxxxiii,2018-10-02 23:35:06+00:00
96,1047268761001050112,"Great couple costumes for 2018:
Moth &amp; Lamp
Mac &amp; Dongles
Juul &amp; ""Can I Hit That Bro?""
Trump &amp; Putin
Your Mom &amp; Cat Videos
Bieber &amp; No Prenup
Riddim &amp; Dubstep
Midtempo &amp; Anonymous Producer
Monxx &amp; Lobster
AFK &amp; SvddenDeath
Pixel Terror",PixelTerrorBass,2018-10-02 23:35:04+00:00
97,1047268605153435648,Vaping is a sweeping fad; here's why parents should be concerned https://t.co/35OZSAHvfp https://t.co/YnYtEiQDST,ABQJournal,2018-10-02 23:34:27+00:00
98,1047268601378557954,FDA Seizes Thousands Of Documents From E-Cigarette Maker Juul https://t.co/2ZxpcEnRQ9,cbschicago,2018-10-02 23:34:26+00:00
99,1047268565441826818,Great day for Spaulding SALT team at the @NHIAA_LOA vaping education summit. https://t.co/a3b5zvgi9N,SpldngAthletics,2018-10-02 23:34:17+00:00
100,1047268436009738241,New mod i got cpl weeks ago with prince tank loving the prince tank and mod #smok develkin kit vaping #meshcoil. https://t.co/AzII1bAuJA,james11elliott,2018-10-02 23:33:47+00:00
101,1047268316098613248,So Juul’s a sponsor of @ESPNFantasy now? Yikes.,vjbrain,2018-10-02 23:33:18+00:00
102,1047268247870078976,"Juul Labs hands over 1,000 documents in FDA inspection https://t.co/ecEOvgfybr",FT,2018-10-02 23:33:02+00:00
103,1047268190387036160,This segment is brought to you by @B_DollarMarket CEO @beatbillionaire Presents to You His Own Vape Juice billiondollarvape It Levels To This!!!!!!!!!! #BDM #Bdv #BillionDollarMarketINC 😤😤😤😤 https://t.co/AYxQnzrgk1,JusSwaggTV,2018-10-02 23:32:48+00:00
104,1047268085357588482,"#health #healthnews Juul Labs hands over 1,000 documents in FDA inspection https://t.co/JP9QvpnEVm",AltiumCapitalNY,2018-10-02 23:32:23+00:00
105,1047268078994771969,Pulse X 90W et Pulse X RDA Vandy Vape &amp; Tony B Test Review Fr: https://t.co/2AKbCteHt3 via @YouTube,vape_du_palais,2018-10-02 23:32:21+00:00
106,1047268075547123712,I’m always misplacing my juul 🙄🙄,Sp00kyJaay,2018-10-02 23:32:21+00:00
107,1047267966067388416,I love Flawless Vape Shop! https://t.co/kJlqqe9VlY,McguRobert,2018-10-02 23:31:55+00:00
108,1047267871259283458,If I hear one more of y’all say shit like  “I’m so broke I can barely afford rent“ or “I can’t afford groceries” blah blah blah while you spending $90 a week shoving Juul pods up your ass I swear 😤,andrexmcmillion,2018-10-02 23:31:32+00:00
109,1047267852737286144,"Get ya vape on with tasty flavors @happyshackrino and @happyshackcolorado 
Flavors for all occasions! https://t.co/URyJoQdjc7",HappyShack_CO,2018-10-02 23:31:28+00:00
110,1047267807094824960,I liked a @YouTube video https://t.co/hMQ4THrvwq VAPE CARO VS BARATO,WhoIsGuaka,2018-10-02 23:31:17+00:00
111,1047267776874913792,Harvest by Vapewe... https://t.co/2nFlIbhOq1 now available @ https://t.co/sZ5eTCkr5c #1 Online Choice For 1000+ eJuice/eLiquid Vaping Brands,eJuiceDB,2018-10-02 23:31:09+00:00
112,1047267612512595969,I’m watching the last airbender series on Netflix while vaping l0l,jazzyjackstrr,2018-10-02 23:30:30+00:00
113,1047267576395571200,wow ur so cool with ur juul but little da ya know that lil pod is one of my packs ur not escaping nicotine addiction sweetie ur right here  with us,juuryll,2018-10-02 23:30:22+00:00
114,1047267530279149569,"Ready to hit the town this weekend and want to elevate your enjoyment even more? Why not pair your e-liquid with your drink of choice? Here is an article that has some really smart pairings: 

https://t.co/hEUcKxcGhL

#vaporauthority #vaping #fun #weekend #drinking #drinks #vape https://t.co/3XgSZwttFn",VaporAuthority,2018-10-02 23:30:11+00:00
115,1047267386708164610,Me to my vape https://t.co/wkrHKNCuio,bloopayah,2018-10-02 23:29:36+00:00
116,1047267333595697154,can someone get me a juul,thatss0ravyn,2018-10-02 23:29:24+00:00
117,1047267242105163776,Juul hit with surprise FDA inspection over marketing practices - CNET,juniorfresh02,2018-10-02 23:29:02+00:00
118,1047267047728730112,I was security at Louie’s for spring break this past year and I almost took a diabetic guys insulin pen because I thought it was a vape pen with the cannabis oil https://t.co/aqaM0ZVUeu,gordysalinas50,2018-10-02 23:28:16+00:00
119,1047266956536102912,Moms buying their underaged kids juuls and pods.....wyd? https://t.co/x3GXWDwo3z,madison_hill29,2018-10-02 23:27:54+00:00
120,1047266951515574272,CDC eyes skyrocketing JUUL sales https://t.co/SdGnKBMJoO,John_Walton_,2018-10-02 23:27:53+00:00
121,1047266921673121792,"F.D.A. Raids Juul Headquarters, Seeking Documents https://t.co/uSbJ0TADv8 https://t.co/8hqbx0c1Ni",ImIrshadAliKhan,2018-10-02 23:27:46+00:00
122,1047266891092385792,"F.D.A. Raids Juul Headquarters, Seeking Documents https://t.co/J2X8JXscqL https://t.co/zq5UkVv0At",ImIrshadAliKhan,2018-10-02 23:27:38+00:00
123,1047266803058204673,"This time Next Week Ask-a-Vaper returns on YouTube!

Make sure you tune in with all you Vape related questions! https://t.co/Oe203SAGiH",RVAvapes,2018-10-02 23:27:17+00:00
124,1047266760779599872,"The FDA surprised e-cigarette manufacturer Juul at its San Francisco headquarters and seized ""more than a thousand pages of documents"" related to the company's marketing practices. #tobacco #fda #ecigarette #cigarette https://t.co/nRGeuQuCrk",ForUsHealth247,2018-10-02 23:27:07+00:00
125,1047266701526650880,the prof just gave us a 5 minute break and the girl in front of me started vaping.... really sis https://t.co/QjfxzaN7Bq,imangojuice,2018-10-02 23:26:53+00:00
126,1047266666017673218,health insurance should cover juul pods,himquail,2018-10-02 23:26:45+00:00
127,1047266657666785280,cucumber juul pods are the move,whiskeyhippie,2018-10-02 23:26:43+00:00
128,1047266591573008384,Gifts for the Ocean lover in the family- Jumping In by Margaret Juul https://t.co/BlGYweOCrT,margaretj13,2018-10-02 23:26:27+00:00
129,1047266525311369216,are there cyanide pods for juuls yet,alejorwei,2018-10-02 23:26:11+00:00
130,1047266510975258629,will i ever find my fucking juul,Allywalterss,2018-10-02 23:26:08+00:00
131,1047266431300243456,📢 I'm starting 🔴 LIVE on #CallofDutyModernWarfareRemastered !  https://t.co/NCP7XqadcC #wizebot #twitch,vaping_gamers,2018-10-02 23:25:49+00:00
132,1047266407958896642,Y’all some fiends for them JUUL’s smh lmao .. fuckin addicts,alexxacamarena,2018-10-02 23:25:43+00:00
133,1047266245433802752,"SCREW THE FDA! WE'VE GOT MENTHOL-FLAVORED TROPWEN #EJUICE FOR 50% OFF! https://t.co/V4h4sxTpIa
#FDADEEMING #FDA #FLAVORBAN #ELIQUID #VAPES #VAPING #VAPOR #VAPESALE #VAPINGSALE #CHEAPVAPES #vapenation #vapeon #vapedaily #vapinghooligans #vgod #cloudchase #itsnotsmoke #VAPEDAILY https://t.co/Y0YrSnVetx",RastaVapors,2018-10-02 23:25:04+00:00
134,1047266164567552001,That's the whole point! Companies like Juul Labs vaping products are working together with big tobacco to try to get kids hooked on cigarettes it's right in front of your face. Manipulating children- it needs to be stopped!,LIB3RTYforALL,2018-10-02 23:24:45+00:00
135,1047266133420650496,Holy smokes! What a surprise! FDA seizes documents from e-cigarette maker Juul @CNN https://t.co/PjQZetexQs,jenniferjones,2018-10-02 23:24:38+00:00
136,1047266077015781381,"The government tryin to ban juul’s because of minors, BUT there minors who smoke cigarettes but since cigarettes make so much money they don’t do anything about it.",maxwell_trice,2018-10-02 23:24:24+00:00
137,1047266014302556164,Gift for the Ocean lover in the family- Watch the Wave by Margaret Juul- https://t.co/EZ9ct4qHpu,margaretj13,2018-10-02 23:24:09+00:00
138,1047265972116058113,"For my vaping friends available after this friday on my free link https://t.co/RPjlF5qLBa along with a lot of great cutting edge products. If I were you, I would get some and… https://t.co/wVLwYM2G84",healthycoffeguy,2018-10-02 23:23:59+00:00
