,TweetID,TweetContent,TweeterUsername,TweetDatetime
1099,1047212190275518464,In a spooky mood? We've got a whole day of Spooktober behind us so better get stocked up on scary vape juices like Strange Fruit E-Liquids and get your store decorated to match. If you do you could win our spooky set ups contest!! --&gt; https://t.co/NGNrfz7ySH 🎃 #Halloween #vape https://t.co/oDMy9YUk4f,EightCig_,2018-10-02 19:50:17+00:00
1100,1047212162240974848,"Get the new #Innokin Coolfire Mini Zenith, the latest and greatest in the Coolfire line! Check it out in store or online at #Flawless #VapeShop!
https://t.co/OxmXpVR2iZ
#vape #vaping #ejuice #eliquid #vapefam #vapelyfe #vapeon #vapestagram",UkFlawless,2018-10-02 19:50:10+00:00
1101,1047212151985901568,"UBLO 10ml E Liquid Vape Juice eliquid Max VG UK Cloud Chaser - FAST &amp; FREE
https://t.co/K8EQxni88C … … #tweetmaster #atsocialmedia #vapecommunity #vapefamily #vapenation #vapeshop #VapeTricks #Vape #cloudchaser #vapelife #vapeporn #JBRT18VAPE #ublo https://t.co/KVe5bEP2n4",sedgepaul,2018-10-02 19:50:07+00:00
1102,1047212093957705728,FDA seizes 'more than a thousand pages' of docs in surprise raid of e-cig maker Juul #NewsGrit https://t.co/f5f3006dBY,NewsGrit,2018-10-02 19:49:54+00:00
1103,1047212048055242753,When it’s time to chill out you need some Ice Cream. We’ve spent time making this the best Chocolate Ice Cream out there! https://t.co/qQYyBLF8Yx #peakyvapours #icecream #chocolate #desert #eliquid #ejuice #premium #vape #vaping #vapers #vapetricks #vapedaily #vapefam #vapelife https://t.co/ktbH2sHgF1,peakyvapours,2018-10-02 19:49:43+00:00
1104,1047212021517701120,"I feel like every time I lose my suorin I find my juul, and every time I lose my juul I find my suorin, guess god won’t let me have both baddies in my life...",zachissocool,2018-10-02 19:49:36+00:00
1105,1047211955767967745,"If you have teens or preteens, you know Juuling and e-cigarettes are an epidemic problem. Good work FDA. Let's see some teeth. https://t.co/xTW6wefv29",iampaulallen,2018-10-02 19:49:21+00:00
1106,1047211911492730880,It's okay I'll just have vape and iced coffee for breakfast again,KaitlynHamblin,2018-10-02 19:49:10+00:00
1107,1047211876009033728,I GOT DRUNK BOUGHT A MF JUUL DAMMIT IM PISSED,BasedGing,2018-10-02 19:49:02+00:00
1108,1047211826306605056,"Even though the consumption of cannabis through vaping devices is without any shadow of a doubt superior to smoking or any other kind of combustion, there are some important ... click below to read more trusted #cannabis #mmj knowledge! #RT #Follow https://t.co/908VWiW6PZ",Ganjly420,2018-10-02 19:48:50+00:00
1109,1047211737567694850,#juul pods 2 for $25 only @hypnoticsmokes1  #juulsale #juul #ejuice #kratom #vapor #hookah #shisha #backwoods #cigarette #cigar #tobaccopipe #hypnoticsmokeshop #hypnoticheadshop 🔥🔥🔥BEST… https://t.co/x8QRHxakDL,hypnoticsmokes1,2018-10-02 19:48:29+00:00
1110,1047211730231812096,"Contact VapePackagingBoxes to get best vape mod packaging designed and manufactured.

https://t.co/oFlobQincG
#packaging #custompackaging #customprinting #customboxes #boxes #customprinting #packagingdesign #packaginglabel #packagingideas #brandingdesign #vape 
#vapemods #boxmod https://t.co/kv2drV2V48",vape_packaging,2018-10-02 19:48:27+00:00
1111,1047211710841606146,"In this month's newsletter: Vote Early - October 25 through November 1 | October is Breast Cancer Awareness Month | FDA Issues Teen Vaping Health Statement | Community Grants Program Public Forum | Youth Town Hall - October 24 at 7:00 p.m.
https://t.co/LTsKpc3MiS",NancyFloreen,2018-10-02 19:48:22+00:00
1112,1047211582986567687,Juuls are wack but people who constantly complain about other people juuling are even more wack it's a free country yo stfu,tswagmcd,2018-10-02 19:47:52+00:00
1113,1047211545875238913,"FDA seizes thousands of documents from Juul: The Food and Drug Administration seized thousands of pages of documents last week during an inspection of the San Fransisco headquarters of e-cigarette maker Juul, the agency said… https://t.co/XXtOBTHgk2 #TheResistance #ImpeachTrump https://t.co/bRU3JtkySE",cahulaan,2018-10-02 19:47:43+00:00
1114,1047211536983511043,"New @CDCgov data on e-cigarette sales from 2013-2017 shows that by the end of 2017, JUUL was selling nearly 1 in 3 e-cigarettes in the United States. https://t.co/YWcQzHReHP https://t.co/MrIkJ8LPmf",HHSGov,2018-10-02 19:47:41+00:00
1115,1047211505316495360,"58' | Chance. Juul releases a strike from just outside the box which flies narrowly wide.
Consett 2-2 Ryhope CW",RyhopeCW,2018-10-02 19:47:33+00:00
1116,1047211474610016257,Dropping out of college to peruse my life time passion of writing reviews on knock off juul pods. Wish me luck as I get this bread 💯💰🤧😤,CryptoCowboyLLC,2018-10-02 19:47:26+00:00
1117,1047211425129811968,Sex is a great place for you and the vape. Yoooo 😂 https://t.co/9hbKuB2LhS,Cullen_Bailie,2018-10-02 19:47:14+00:00
1118,1047211249954643969,The Recurve Squonk from @wotofoofficial looks beautiful in Red 😍🔝👌📷💨💨💨💨#vape #vaper #vapeporn #vaping #vapingcommunity #vaperlifestyle #vapefamily #vapers #vaperlove #vaperlife… https://t.co/PeepGcZWwg,Azoresvaping,2018-10-02 19:46:32+00:00
1119,1047211195428691968,ThinkVape Sailboat 85w Mod Review - Mike Vapes https://t.co/P8kJSObVWc,Mike_Vapes,2018-10-02 19:46:19+00:00
1120,1047211164524933125,"Someone in my department nominated a seminar speaker from the clinical trials department at Juul...and I have to assume they didn't know what the company does. And now this.

https://t.co/FgBL718zGE",DrRachaelF,2018-10-02 19:46:12+00:00
1121,1047211157084286976,"Eat, Toke Or Vape: Teens Not Too Picky When It Comes To Pot’s Potpourri https://t.co/XQLVLqBYd5 via @khnews",jlandauARISE,2018-10-02 19:46:10+00:00
1122,1047211133554372608,"CAT: minons: What are you up to?
ME: wtf skeleton watch
CAT: 420 vape IT!

#BenBot
ME: Negative cop SMH",WeirdConvoBot,2018-10-02 19:46:05+00:00
1123,1047211093838331904,"Eat, Toke Or Vape: Teens Not Too Picky When It Comes To Pot’s Potpourri https://t.co/0K9MvaPs6i via @khnews",ARISE_Network,2018-10-02 19:45:55+00:00
1124,1047211093309841408,FDA seizes documents from Juul in latest e-cigarette crackdown: The U.S. Food and Drug Administration said on Tuesday it seized more than a thousand pages of documents from Juul Labs related to the company's… https://t.co/FYTyIZoyXD #ImpeachTrump #ImpeachKavanaugh #TheResistance https://t.co/vMGBaWogxK,cahulaan,2018-10-02 19:45:55+00:00
1125,1047211027350396928,"Mi Vape Co. by Vaping for Vapers, by Vapers is #NowPlaying on https://t.co/IBx3JZxB9Y https://t.co/wXwxi0t4hI https://t.co/Ya9zaWZmZd",CCS_Radio,2018-10-02 19:45:39+00:00
1126,1047211009377816576,Thank you @RochfordProject we certainly will 😊👍🏻💨💨💨 https://t.co/dT6LNLXcL8,vape_tube,2018-10-02 19:45:35+00:00
1127,1047210944684810240,"#Juul (e-cigarette maker) Raided by US FDA

https://t.co/jsEaJrjjnC",FinanJournal,2018-10-02 19:45:20+00:00
1128,1047210937646768133,The FDA showing up to Juul like https://t.co/xG3BjvYNAI,OwlTiffany,2018-10-02 19:45:18+00:00
1129,1047210923692158976,"From a debate on banning juuls/vapes on campus:

""Smoking is not cool. And think about your health.""

Lol as if I'm trying to look cool trying to calm down before dealing with some other fuckery school has to throw at me. Non-smokers stay using the ""health"" card.",Wulfhen,2018-10-02 19:45:15+00:00
1130,1047210899092787202,FDA seizes thousands of documents from Juul https://t.co/RPO3eMuYRH https://t.co/TVwWUr1fNa,HabariTimes,2018-10-02 19:45:09+00:00
1131,1047210872571973633,New Vaping Smoant Ranker 218W TC Box Mod https://t.co/yd8h3n43Je https://t.co/zKl8nxvHqE,VapingAve40,2018-10-02 19:45:02+00:00
1132,1047210863202127872,"#vape #vaping #eliquid  #vapeon #ecig #vapelifestyle #ecig #ecigs #ecigarette
https://t.co/3ev8BsGDdy
check out the Tesla Punk https://t.co/ob6KOHLyTR",economyvapes,2018-10-02 19:45:00+00:00
1133,1047210683102887941,YES! YES! YES! It’s about time! How many teens are addicted to nicotine because of Juul? Hope they’ve saved lots of money for all the cancer lawsuits!!! https://t.co/Eoa2ZKh1DP,dburnam,2018-10-02 19:44:17+00:00
1134,1047210643525435393,Do you vape? New CTFO CBD PRODUCTS AVAILABLE OCTOBER 5th! https://t.co/CjXrueqJzz,JulieBill5,2018-10-02 19:44:08+00:00
1135,1047210608205213696,An attack on #juul is an attack on liberty. Tell the FDA to back off; these ads are NOT targeted toward teens https://t.co/q0i7vbmJGZ,holyduck,2018-10-02 19:43:59+00:00
1136,1047210557164511232,"Still fighting feeling like crap. Got to sell those ads for Vape Radio though. .
.
.
.
.
#vapefollow #vape #vapeporn #vapenation #vapefam #vapelife #vapedaily #vapelyfe #vaper… https://t.co/ODOk1Z2dfD",SalesBubba,2018-10-02 19:43:47+00:00
1137,1047210414159925249,The FDA Conducted a Surprise Raid on Juul Headquarters https://t.co/wI6Mn49oUx,romy_gill,2018-10-02 19:43:13+00:00
1138,1047210310141169666,Threw my juul away out of anger yesterday &amp; it was probably my best decision in awhile,ameliahossage,2018-10-02 19:42:48+00:00
1139,1047210271025053696,weekly farm class report: it's rained every tuesday for the past 4 weeks &amp; ive bonded w the umass freshmen boys who juul in class,acesnsk8s,2018-10-02 19:42:39+00:00
1140,1047210265341829127,My grown ass when I hit a little boy’s weed juul on the corner https://t.co/QmlO9kJhNY,saraplaindtalll,2018-10-02 19:42:38+00:00
1141,1047210261948633088,The first review of the new Halo Vapour Co. Shortfills - and what a review from @MyVaping :) #eliquid #halovapourco #vaping https://t.co/zjJv4p1TIx,ECigDirect_UK,2018-10-02 19:42:37+00:00
1142,1047210133485506560,I’ve started #vaping and it’s the most #millennial – and mystifying – thing I’ve ever done | Ahir Shah https://t.co/u1Ex7crP8W,marti_orp,2018-10-02 19:42:06+00:00
1143,1047210093681496064,Teens Who Vape More Likely to Smoke and Vape in Early Adulthood #Pediatrics https://t.co/Wmm1ZQpei3,induspedia,2018-10-02 19:41:57+00:00
1144,1047210090837757952,"If you’re gonna vape next to me while I’m smoking a cigarette, I will blow my smoke in your face.",turbocunt0,2018-10-02 19:41:56+00:00
1145,1047209998466478081,#HLVIIKIRA #HLVII #VAPE #SMOK #towsonvaporium towsonvaporium  #MUSIC https://t.co/64KvXRKdhy,Hystyleown30,2018-10-02 19:41:34+00:00
1146,1047209937074573315,Kit Drizzle Fit Vaporesso https://t.co/yr7gTQtpAJ #vapote #vape #vaping #deals #bonplan #vapofolies #ecig,Vapofolies,2018-10-02 19:41:19+00:00
1147,1047209900517064704,Hey https://t.co/ATfspClAaE thanks for following Haze™ e-Juice. Visit https://t.co/W67XXvmBWt for up to 15% off. Happy Vaping! 😗💨,HazeEjuice,2018-10-02 19:41:11+00:00
1148,1047209892740616198,Okay so seeing #NameYourCarDay trending has me genuinely curious if any vapers name their mods... 😅😅 and maybe if I should name mine....... it's a black Uwell Nunchaku with the rainbow @wotofoofficial flow pro tank... Maybe WoWell??😂💨,EightCig_,2018-10-02 19:41:09+00:00
1149,1047209891377664000,It’s times like this I want to rip a whole juul pod in a single go,hollowrib,2018-10-02 19:41:08+00:00
1150,1047209881017745409,Health: Alcohol:Teenagers who vape ARE more likely to smoke real =&gt; https://t.co/pUWCkPQJLz #health https://t.co/qrjUDf5jYZ,HealthMDoctor,2018-10-02 19:41:06+00:00
1151,1047209846016299008,Observing the 40+ year olds at my work orientation rip their vape hard af during every 5 minute break is hilarious,ShootThe_Trey,2018-10-02 19:40:58+00:00
1152,1047209832699199488,Fun with editing. #vapelyfe #vapelifestyle #vapemods #vapelife #vape #hexohm #rda #loop #vapeporn #vapenation #vapefam #vaping #vapingcommunity #vapecommunity #vapefamily https://t.co/LbhjNLwPRO,WhatAGreatBeard,2018-10-02 19:40:54+00:00
1153,1047209828853145600,"51

RT @DrFrostELiquids: Hey, just wondering what the age range of some of our vapers are on here? #vape #vaping #vapefam",LordGanescha,2018-10-02 19:40:54+00:00
1154,1047209785949659137,FDA seizes thousands of documents from e-cigarette maker Juul https://t.co/KTNV7eFdf8 https://t.co/pJi4ip2JAZ,iBoldNews,2018-10-02 19:40:43+00:00
1155,1047209738524667904,Wonder how many ppl have dropped their juuls in the toilet or the tub,Spacey_Katie,2018-10-02 19:40:32+00:00
1156,1047209704743682048,Full range of 50ml bottles from @sixlicks600 #sixlicks #vaping💨 #vapeclouds #vape #vapecrazy #vapeon #ukejuice #bestjuice https://t.co/gaqBk0zxO5,carldj75,2018-10-02 19:40:24+00:00
1157,1047209694585081858,"Nik reminded me I have to redownload Jiyong's pic.
I am old lazy vape.
Wwhycan't I just get HD pics without trying
LMAO I need Siri for that...
It's so sad I don't even have Alexa to play Broke Lazy Bitch.mp3",Mrs_Shu_kwon,2018-10-02 19:40:22+00:00
1158,1047209681217880064,idk i just think it’s funny how the FDA is cracking down on juuls yet cigarettes are still being produced &amp; sold,lydiaaahawk,2018-10-02 19:40:18+00:00
1159,1047209634677903360,"Kanger Evod Pro V2 by Kangertech can by used for MTL (Mouth to lung) and DL (Direct Lung) vaping. Great Starter Kit!

Get yours at Vappora now https://t.co/TjQdVJyZx2

#EvodPro #Kangertech #vape #CLOCC https://t.co/kh5qpGvX97",vappora,2018-10-02 19:40:07+00:00
1160,1047209627081879552,FDA seizes documents from Juul in latest e-cigarette crackdown https://t.co/SSTMXYEfwK https://t.co/A7bNvkbjVd,MBHolistic,2018-10-02 19:40:05+00:00
1161,1047209551618031616,Finally my juul was found after two weeks and now my throat hurts to bad to even hit it. Life sucks.,BlatnerHeather,2018-10-02 19:39:47+00:00
1162,1047209503979188224,"Honestly amazing meeting the hottest people on earth 
“Fuck you Mom give me my Juul back “ @elijahdaniel @DJSamF https://t.co/clp9ndqYpO",Annieeevasquez,2018-10-02 19:39:36+00:00
1163,1047209435444236290,Health groups warn against #vaping ads in Ontario convenience stores | CBC News https://t.co/ql9d5RYfkS,christinecbc,2018-10-02 19:39:20+00:00
1164,1047209409955287040,"Juul gets a surprise visit from the FDA as part of agency’s crackdown: The Food and Drug Administration is tightening its leash on e-cigarette giant Juul Labs. On Friday, the FDA conducted a surprise inspection of the company’s headquarters, and took… https://t.co/kPMl8xwe43 https://t.co/jwSOo51jCQ",cahulaan,2018-10-02 19:39:14+00:00
1165,1047209367328755714,"Dude just hit his vape in my chem lab like it’s the most natural thing ever, like im ballsy but shit that’s insane",star8522,2018-10-02 19:39:04+00:00
1166,1047209209304154113,"Stop by and check out our new line by Elysian Labs. A1 Vapor Shop beside of Thomas's Butcher Shop and across from Kmart  Open until 10pm. .
.
.
.
.
#vape #vapelife #vapeon #vapepics… https://t.co/QgZHLR8GCn",Jcausey1214,2018-10-02 19:38:26+00:00
1167,1047209206355546118,juul got that drip drip,ravencardone,2018-10-02 19:38:25+00:00
1168,1047209106199666689,FDA seizes thousands of documents from Juul https://t.co/bwU7Oek4ze via @MailOnline,adoumani,2018-10-02 19:38:01+00:00
1169,1047209104182267905,"Juul, the popular e-cig startup under growing FDA scrutiny, says removing flavors is ‘on the table’ among other things https://t.co/0gApqhE40m",CounterTobacco,2018-10-02 19:38:01+00:00
1170,1047209076395057154,FDA Seizes Documents from Juul in Latest E-Cigarette Crackdown | https://t.co/7jZFjk3dVc #bioethics,bioethicsdotcom,2018-10-02 19:37:54+00:00
1171,1047208923147788288,if u never got hooked on cigarettes and was never addicted to nicotine in the first place why y’all dumb ass kids juuling I don’t even feel bad for y’all https://t.co/4WRDEJE3Ie,littlemarms,2018-10-02 19:37:18+00:00
1172,1047208916436758529,Havent vaped for two weeks now.,brooitspauline,2018-10-02 19:37:16+00:00
1173,1047208911642738689,"juul’s online store is 21+, which is hard to prove but it’s the same as selling alcohol online. In store sellers are responsible for IDing customers. Teens will always get their hands on products not legal to them. https://t.co/CWdZseA8wv",dinotor22,2018-10-02 19:37:15+00:00
1174,1047208844978532353,"The #FDA seized more than 1,000 pages of documents in a surprise inspection of #ecigarette maker #Juul Labs last week, an FDA spokesperson told Healio, who also said the paperwork was linked to Juul’s marketing and sales practices. https://t.co/r0qsak0BpU @US_FDA @SGottliebFDA",GoHealio,2018-10-02 19:36:59+00:00
1175,1047208827656048641,I’ve been down to the gym basically every weekday since I’ve been here and I’ve seen guys doing cardio like 5 times. Does juuling affect lung capacity or something?,theizkid40,2018-10-02 19:36:55+00:00
1176,1047208771968069632,Vapes are dumb nothing domes me like a slurpee,KyyyleHentschel,2018-10-02 19:36:42+00:00
1177,1047208761465745411,If I had a dollar for everytime I lost my fucking juul I could buy 100 more juuls,kenziashb,2018-10-02 19:36:39+00:00
1178,1047208750799605760,"So happy to see this! An entire generation that's been taught how deadly smoking is are now vaping in droves as they've been targeted w/marketing, flavors &amp; think it's safe! FDA conducts surprise inspection of e-cigarette maker Juul as part of crackdown https://t.co/B3QeUSjA73",caryconway,2018-10-02 19:36:37+00:00
1179,1047208707048837121,"The #FDA seized more than 1,000 pages of documents in a surprise inspection of #ecigarette maker #Juul Labs last week, an FDA spokesperson told Healio, who also said the paperwork was connected to Juul’s marketing and sales practices. https://t.co/DrH18rHVo4 @US_FDA @SGottliebFDA",HealioFM,2018-10-02 19:36:26+00:00
1180,1047208686962335744,FDA seizes documents from Juul in surprise inspection https://t.co/DOhsNPKy8u https://t.co/nH8zGGUU16,ReutersTV,2018-10-02 19:36:21+00:00
1181,1047208667572056066,Selling Juul with brand new pod and charger for $20 @ or DM me,dust_in_wind_,2018-10-02 19:36:17+00:00
1182,1047208657103020032,"I love to vape, *Says while blowing on a bubble wand.*",orcatxt,2018-10-02 19:36:14+00:00
1183,1047208642129346560,You'll be shocked to know this guy tossed a cigarette butt into the median while his buddy in the passenger seat was vaping like a chimney https://t.co/dkrUGC1NTh,wineaccguy,2018-10-02 19:36:11+00:00
1184,1047208600475557888,Vape with us while we wait for #YANDHI https://t.co/lcue7IijI7,EightVape,2018-10-02 19:36:01+00:00
1185,1047208553029750785,Vaping has got to be the most embarrassing thing u can do and your a pleb if you think otherwise x,taylorjadesull,2018-10-02 19:35:49+00:00
1186,1047208507366408194,FDA seizes documents in surprise inspection of e-cigarette maker Juul https://t.co/jhF5UN9XIW,NashSpaceBroker,2018-10-02 19:35:39+00:00
1187,1047208438290366464,Juul gets a surprise visit from the FDA as part of agency’s crackdown https://t.co/zElM2pEXXc https://t.co/ZMZdmjDi7c,TechFishNews,2018-10-02 19:35:22+00:00
1188,1047208415653761025,"Breaking News; What you need to know about JUULING,
with guest, Dr. Sanjay Gupta. - This afternoon at 2 on Dr. OZ. https://t.co/X9NAf3yAq8",KVOA,2018-10-02 19:35:17+00:00
1189,1047208408586313728,"Yea, I juul 😎
J. Believe 
U. In
U. Two
L. Genders",bigboofboi,2018-10-02 19:35:15+00:00
1190,1047208345520812032,"It seems like Juul should have taken a stronger positioning strategy in order to avoid this epidemic of non-smoking teens becoming addicted to nicotine. The product is meant to be marketed towards 'adult smokers', but this obviously has not been the case. #stratcomm4337 https://t.co/Wj7t5FA5YX",megkumar547,2018-10-02 19:35:00+00:00
1191,1047208329703870464,"The all new OVUS is now in stock! Refillable ceramic pods, or pop your juul pod in! --------
Check out our Website!
https://t.co/PBO40ixUxF
Vapor Krew 
8000 International Drive # 116
Orlando Fl… https://t.co/Jo6ooqOP5l",VaporKrew,2018-10-02 19:34:56+00:00
1192,1047208327611142144,Hello world! The Number One Vape Shop https://t.co/u1f803irEo,thehouseofvapeu,2018-10-02 19:34:56+00:00
1193,1047208323005595650,Vape with Us while playing #CallOfDutyBlackOps4 https://t.co/lcue7IijI7,EightVape,2018-10-02 19:34:55+00:00
1194,1047208224561278977,FDA seizes documents from Juul in latest e-cigarette crackdown https://t.co/1or4Cfvgcg,firstpressNg,2018-10-02 19:34:31+00:00
1195,1047208197797433344,"#MyFuneralWillHave vaping, lots of vaping. Most of my friends vape and I doubt my wife will mind much. Lastly, instructions to all my family and friends to continue my quest to find a way to time travel and live forever. When one of them accomplishes these tasks, then wake me up",parrotflock,2018-10-02 19:34:25+00:00
1196,1047208196052594689,My mom said I can’t juul anymore so who got crack,yxngsleepgxd,2018-10-02 19:34:24+00:00
1197,1047208175886368769,ordered some vape wicks from @AmazonUK and received 5 microfiber cloths and because the item i ordered was not eligible for returns i cant return the microfibre cloths that i didnt want,TheBatNaz,2018-10-02 19:34:19+00:00
1198,1047208116146720768,FDA seizes documents from Juul in latest e-cigarette crackdown #BreakingNews https://t.co/jurz7cdeKT https://t.co/OTUgtdpOXP,manatweets,2018-10-02 19:34:05+00:00
1199,1047208061277032449,I saw at least 4 people vaping on my way back to the sem today. #ProductiveDay,C_Corona98,2018-10-02 19:33:52+00:00
1200,1047207983220973568,college students charging their Juuls in class is a norm now,eruuca,2018-10-02 19:33:34+00:00
1201,1047207906813403136,My Everything - #deadrabbitrda #sigelei #kaosmod #vapemagazine #vapemagazinecom #vapunmagazine #vapeholic #vape #vaped #vapelife #vapelyfe #vapenation #vapefam #vapefamily #vapecommunity… https://t.co/ZuOMi5RlxF,bighec160,2018-10-02 19:33:15+00:00
1202,1047207711484649475,I've just posted a new blog: Juul gets a surprise visit from the FDA as part of agency’s crackdown https://t.co/1nbX97oKN6,akshaymcmb,2018-10-02 19:32:29+00:00
1203,1047207705339998208,"""FDA Seizes Documents From Juul in Latest e-Cigarette Crackdown"" by REUTERS via NYT https://t.co/wZ0GlAGoOp",FtrRetailNews,2018-10-02 19:32:27+00:00
1204,1047207636314345473,"USB Killer vs iPhone XS Max/XR Fake, Note 9 &amp; Juul! Instant Death? https://t.co/T3eXHlKyLJ 
What Happens? USB Killer Into a iPhone XS, XS Max, XR Clone, Galaxy Note 9, USB Wall Outlet, Juul Vape, Mini iPhone &amp; More! + EMP... https://t.co/yyh11cInDI",HeadlinePhone,2018-10-02 19:32:11+00:00
1205,1047207609684570112,Health groups warn against vaping ads in Ontario convenience stores https://t.co/fVkn6bqglr https://t.co/G89kCZlpu4,BMICalculatorCA,2018-10-02 19:32:04+00:00
1206,1047207577841557506,Fun data fact: Juuling is 100% not allowed in the ERC! We’ll call Public Safety on you 🌸😊🌸 https://t.co/vLp6vvhrhD,BarnardERC,2018-10-02 19:31:57+00:00
1207,1047207449734926338,Juuling is just another dumb thing in a long line of dumb things people do https://t.co/rF9PNw4Raa,JeffroDotVT,2018-10-02 19:31:26+00:00
1208,1047207414855061504,listening to lil baby and just hit my SMOCK VAPE EXTEME MARK VII man todays gonna be good,camelbluesmoker,2018-10-02 19:31:18+00:00
1209,1047207398631493632,"FDA Raids Vape Maker Juul, Seizes 'Thousands' of Documents #SmartNews  https://t.co/suFa7fvWK9",rhotwire,2018-10-02 19:31:14+00:00
1210,1047207378712760321,UPDATE 3-U.S. FDA seizes documents from Juul in latest e-cigarette crackdown https://t.co/kLyatdzXZg #news #reuters,JacekWierzbicki,2018-10-02 19:31:09+00:00
1211,1047207371246907394,FDA conducts surprise inspection of Juul headquarters as part of crackdown on e-cigarettes https://t.co/PSJ8KTu0j4 https://t.co/HK9Yp0axls,thehill,2018-10-02 19:31:08+00:00
1212,1047207279651696641,"https://t.co/OPH7A6URMC 
Benefits Of Vaping CBD E-Liquids And How To Use It?
#cbd #cbdoil #hempoil #cbdvape #vapejuice #bathbombs #balm #skincare #cbdfordogs",lorrierussell2,2018-10-02 19:30:46+00:00
1213,1047207216846127104,Dean of Academics for the Air Force Special Operations School canned. Henry Cobbs' crime — vaping a non-psychoactive form of cannabis to treat his prostate cancer. https://t.co/TOjl5dtw8A #cannabiscommunity #cannabiseducation #airforce,greenflwrmedia,2018-10-02 19:30:31+00:00
1214,1047207197560717312,Suck vapes not cocks @willflint_,the_Georgehood,2018-10-02 19:30:26+00:00
1215,1047207128497307648,"💚 Vapir #Vaporizer 💚

➡️ https://t.co/4JLnxOD9fW ⬅️

👉 15% OFF USE CODE “THE420WIRE” 👈
✅ FREE SHIPPING

🔞 🔞 🔞

#vape #vapelife #the420wire https://t.co/icei12ANJf",the420wire,2018-10-02 19:30:10+00:00
1216,1047207100840116225,"“don’t be a fool, drop the juul”",vicsaladbar,2018-10-02 19:30:03+00:00
1217,1047206999283441666,U would suck a dude just to smoke his fuckin juul,vexedblackboy,2018-10-02 19:29:39+00:00
1218,1047206955079684100,Dude is vaping in the stall next to me at work!!!!!!,GFentz,2018-10-02 19:29:28+00:00
1219,1047206883252207616,i just passed a grandma smoking a juul. day made.,hollyylouvieree,2018-10-02 19:29:11+00:00
1220,1047206783268397058,FDA seizes 'more than a thousand pages' of documents in surprise inspection of e-cigarette maker Juul - https://t.co/WvyYoHZGK9,Hotpage_News,2018-10-02 19:28:47+00:00
1221,1047206750594748417,"Check out my review of @ECigDirect_UK Halo Cream Custard. Short fill.

#ejuice #vaping #halo 

https://t.co/LgNkVL7vaq",MyVaping,2018-10-02 19:28:40+00:00
1222,1047206684513525760,"Eat, Toke Or Vape: Teens Not Too Picky When It Comes To Pot’s Potpourri https://t.co/wBTUf60OWj via @khnews",WJPomerantzMD,2018-10-02 19:28:24+00:00
1223,1047206652720676866,"Naboo md with naboo sub ohm tank by @Smoant https://t.co/7p01tfXbkE
Absolute stunner! #Stunning #vapelife #vape",adenh1982,2018-10-02 19:28:16+00:00
1224,1047206611239030784,"⁦@US_FDA⁩ seizes thousands of documents from ⁦@JUULvapor⁩ HQ in raid. ⁦Recent @RANDCorporation⁩ research 
showed teens who #vape more likely to smoke cigarettes.

If found to intentionally market to teens they should be penalized bigly.  https://t.co/TUizq5glHA",BenLevenson,2018-10-02 19:28:06+00:00
