,TweetID,TweetContent,TweeterUsername,TweetDatetime
2198,1047164934323404800,"from subohm_nebula_tvl  -  Always packing those @TVLSQUAD and a bottle of _birdejuice_. This carrot cake was perfect for the 1st day of October.
.
.
#vape #vaper #vapor #vapehooligans… https://t.co/ijeiGhyg2s",DOCPHEELGOOD,2018-10-02 16:42:30+00:00
2199,1047164859660550144,FDA Conducted Surprise Inspection of Juul's Headquarters https://t.co/3M9pZEvx31,earlduncand,2018-10-02 16:42:12+00:00
2200,1047164851997429760,This guy just pulled his juul out during our discussion and I’m just appalled,kemyahandrea,2018-10-02 16:42:10+00:00
2201,1047164845987192832,"Juul taking a lot of heat today

FDA says it seized documents at Juul headquarters in SF. And CDC releases company sales data showing a more than 600% jump in sales of the e-cigarette devices that are popular with teens. 

https://t.co/vyWCiePOtg",annaedney,2018-10-02 16:42:09+00:00
2202,1047164839926231040,FDA seizes thousands of documents from e-cig startup Juul https://t.co/EyCeR94xqi in @TechCrunch https://t.co/BdER28wxtr,HITpol,2018-10-02 16:42:07+00:00
2203,1047164838550691840,FDA seizes thousands of documents from e-cig startup Juul https://t.co/Hyl6lgdBl4,iApplenotice,2018-10-02 16:42:07+00:00
2204,1047164830287781888,#FDA seizes thousands of documents from e-cig startup #Juul https://t.co/ogC2EcV0xv,GeekInfoNow,2018-10-02 16:42:05+00:00
2205,1047164824008847361,#FDA seizes thousands of documents from e-cig startup #Juul https://t.co/MYKNg8WGuX,ISTincorp,2018-10-02 16:42:04+00:00
2206,1047164823430021120,FDA seizes thousands of documents from e-cig startup Juul https://t.co/QN0ZghDpZv https://t.co/PC77NXXOUY,Jackysu78,2018-10-02 16:42:03+00:00
2207,1047164820691214336,FDA seizes thousands of documents from e-cig startup Juul https://t.co/dzYJEGVhZq https://t.co/SJJJDFPK8F,NiveousTech,2018-10-02 16:42:03+00:00
2208,1047164819005165568,FDA seizes thousands of documents from e-cig startup Juul https://t.co/SN5yI1GM8h,bardtech_info,2018-10-02 16:42:02+00:00
2209,1047164818921123841,FDA collects documents from e-cigarette company Juul https://t.co/bpOY9phWdS https://t.co/HLwyoc9cPz,tekgrouphealth,2018-10-02 16:42:02+00:00
2210,1047164818623352832,"Smoked, Vaped, Eaten: U.S. Teens Use Pot in Many Ways https://t.co/3XmzuywBXw",Healthcampus360,2018-10-02 16:42:02+00:00
2211,1047164808506892295,Cant believe the FDA is going to use this tweet as top tier evidence against Juul. They don't even need the confiscated docs https://t.co/TykPvZ50px,SuMastodon,2018-10-02 16:42:00+00:00
2212,1047164746548617216,"new post FDA collects documents from e-cigarette company Juul,,https://t.co/4JConuae8D",BWN_Org,2018-10-02 16:41:45+00:00
2213,1047164743398674432,I only vape bts,Jthecreat0r,2018-10-02 16:41:44+00:00
2214,1047164627958865920,"FDA seizes documents in surprise inspection of e-cigarette maker Juul https://t.co/L1sA1UMNLq @CNBC 

#health #wellness",BarbaraFicarra,2018-10-02 16:41:17+00:00
2215,1047164572166238208,U.S. FDA collects documents from e-cigarette company Juul https://t.co/uFiSFDifNy,VernellLintner,2018-10-02 16:41:04+00:00
2216,1047164517422157825,I liked a @YouTube video https://t.co/KUQzpRpCEe how to vape without a battery/ pen/boxmod,ItsThaBOM,2018-10-02 16:40:50+00:00
2217,1047164505308971008,FDA collects documents from e-cigarette company Juul (Reuters) https://t.co/s2dBKe7ey1,choonsikyoo,2018-10-02 16:40:48+00:00
2218,1047164478675189760,FDA collects documents from e-cigarette company Juul - https://t.co/MCt4WtCl35,InvestingStockz,2018-10-02 16:40:41+00:00
2219,1047164474128523264,FDA collects documents from e-cigarette company Juul https://t.co/S730Wmod5f,ViralPromoX,2018-10-02 16:40:40+00:00
2220,1047164467128229888,people that start vaping even though they weren’t addicted to nicotine are the most frustrating,fairythotmom,2018-10-02 16:40:38+00:00
2221,1047164376678092801,I love Flawless Vape Shop! https://t.co/mFoErXhlZQ,CWeileman,2018-10-02 16:40:17+00:00
2222,1047164355555590149,FDA seizes thousands of documents from e-cig startup Juul https://t.co/KCf44fDP1Z,pandyavaibh,2018-10-02 16:40:12+00:00
2223,1047164354125131777,vape or die,kiawe_bot,2018-10-02 16:40:12+00:00
2224,1047164352518795264,FDA Conducted Surprise Inspection of Juul's Headquarters https://t.co/CPnP2aIuei https://t.co/scRFSFFw4y,shelbylaneMD,2018-10-02 16:40:11+00:00
2225,1047164344507781122,FDA collects documents from e-cigarette company Juul https://t.co/IvvxtLeLZ4,congotoday,2018-10-02 16:40:09+00:00
2226,1047164053343227904,Friends Sharing Juul In Starbucks Bathroom Unaware The Burden Of Repopulating Civilization Will Soon Fall Solely Upon Them,SUKumquat,2018-10-02 16:39:00+00:00
2227,1047163872904458241,FDA seizes thousands of documents from e-cig startup Juul https://t.co/IEFfFLexJF by @meganrosedickey https://t.co/B1fwQTFzG0,TechCrunch,2018-10-02 16:38:17+00:00
2228,1047163828683694080,Health groups warn against vaping advertising in Ontario convenience stores https://t.co/SFcaRh8zJX https://t.co/mgh9nFNLVX,globeandmail,2018-10-02 16:38:06+00:00
2229,1047163827601723392,FDA collects documents from e-cigarette company Juul https://t.co/52esrmFBSD,Reuters,2018-10-02 16:38:06+00:00
2230,1047163764145938433,How did you know that I wanted your cotton candy vape cloud blown in my face?,FlyestAsianEva,2018-10-02 16:37:51+00:00
2231,1047163760543240192,smok #novo kit all colors available @hypnoticsmokes1 #juul #vapor #shisha #hookah #backwoods #kratom #tobaccopipe #cigarette #cigar #hypnoticsmokeshop #hypnoticheadshop   🔥🔥BEST PRICES IN… https://t.co/UlzE0xTphG,hypnoticsmokes1,2018-10-02 16:37:50+00:00
2232,1047163756940288001,we just found our juul AFTER we bought a phix.🤦🏼‍♀️,DariaMichele,2018-10-02 16:37:49+00:00
2233,1047163688279592960,I’ve started vaping and it’s the most millennial – and mtsyfiying – thing I’ve ever done | Ahir Shah https://t.co/cA99PZd3y1,grauniad_news,2018-10-02 16:37:33+00:00
2234,1047163686383697923,I’ve started vaping and it’s the most millennial – and mystifying – thing I’ve ever done | Ahir Shah https://t.co/Ovf7jAA7xJ,guardian,2018-10-02 16:37:32+00:00
2235,1047163660483923969,"The Juuls at school Snapchat story is the worst thing ever, fuck all you people who want Juuls banned from campuses, buncha pussies who complain about smoke in their face, like suck it the fuck up bitch your lucky It’s not a cig",Todd_chavess,2018-10-02 16:37:26+00:00
2236,1047163576702496768,"Ripe Vapes VCT • The sophisticated blend of sexy vanilla up front with a rich fine tobacco and a hint of toasted almond. 

10% Off with Promo Code: ""EJV10""

https://t.co/tKORULBF0b https://t.co/4z3KUQsVVO",FlawlessSmoke,2018-10-02 16:37:06+00:00
2237,1047163573582123009,"you’re right, jerry. this juul got me gassed up, i need the lord",laneyvnol,2018-10-02 16:37:05+00:00
2238,1047163522088460288,"🕸️🕷️EightVape's Vape-O-Ween Contest 🕷️🕸️
For all of October, users can submit work in up to three competition categories: 
Pumpkin Carving! 🎃
Spooky Stories! 👻
Best Costume! 🧛‍♀️
MORE DETAILS HERE: https://t.co/7w6ymYsaCn #October #contest #vape",EightVape,2018-10-02 16:36:53+00:00
2239,1047163472864333825,FDA seizes documents from e-cigarette giant Juul's headquarters https://t.co/R0zPQCyvi2,Ice_Box_Logic,2018-10-02 16:36:41+00:00
2240,1047163403704389637,"SMOKZ VAPE STORE is here to help you make the switch to vaping this Stoptober. Swipe to see our Stoptober offers on hit pens. For more information, feel free to call us on: 0843 289 1103 

Shop at https://t.co/RlLJyUPjQ4 

#vapecommunity #vapelife #Stoptober https://t.co/cXuAisKCsI",smokzvapestore,2018-10-02 16:36:25+00:00
2241,1047163381587828737,"from @SuperDBN13  -  Yawn... I'm tired of posting slumps... This one, I caused. Got robbed recently.. Most of my vape gear got stolen. It's all good, though... Theives can't stop me,… https://t.co/UTqifvfy4k",DOCPHEELGOOD,2018-10-02 16:36:20+00:00
2242,1047163346024165376,The Wall Street Journal: Juul’s headquarters get surprise inspection by FDA https://t.co/iKAOFzRQMZ https://t.co/imrzXB1zfQ,GennechoFinance,2018-10-02 16:36:11+00:00
2243,1047163341796331521,FDA collects documents from e-cigarette company Juul https://t.co/7MYI65G93t https://t.co/llIrB9jSaB,zuleydi_perez,2018-10-02 16:36:10+00:00
2244,1047163322880077824,I just entered a Prize Giveaway! - Smok V8 Vape kit on https://t.co/lJqwigcBww https://t.co/2ObKoYgnOj #win #Fishbowlprizes,ashleymains3,2018-10-02 16:36:06+00:00
2245,1047163322108338178,FDA collects documents from e-cigarette company Juul https://t.co/Mi37WJnQeE https://t.co/9lDjPVroey,JornalMercantil,2018-10-02 16:36:06+00:00
2246,1047163185936130048,Let's go to try this lemonade!!! from @ThevapeshopMad 😋👍🔝💨😋 #sonsoftheclouds #loyal_vapers #familialoyalvapers #lvfam #lv #lvvapeclub #vapecommunity #vapeador #vape #vapelife #vapestagram… https://t.co/Yl0YqDmh3i,gokuhontoba,2018-10-02 16:35:33+00:00
2247,1047163064121020417,Bitch I haven’t had a cig in 5 days this Juul is LITERALLY hittin,lanc3yy,2018-10-02 16:35:04+00:00
2248,1047163061025402880,"has just added ""Breakfast of Champions 5ml Five Pack"" to https://t.co/WciBugmQpC #vaping #ecigarette #ecigs #vape",vaporfox,2018-10-02 16:35:03+00:00
2249,1047162957367586818,"Completely untapped market
Juul’s... but for straight people. @JUULvapor",GrantGarbrecht,2018-10-02 16:34:39+00:00
2250,1047162937843048448,had my juul on the charger the whole night &amp; woke up to a dead juul smh make sure u clean the charging things,VIRGlL_,2018-10-02 16:34:34+00:00
2251,1047162899725205505,FDA collects documents from e-cigarette company Juul [RTR https://t.co/4IkFmXPS0l],iNews24,2018-10-02 16:34:25+00:00
2252,1047162894352310272,"Beauty is in the Eye of the Beholder. 7-Color Resa Tank + Navy Blue Mag Right Mod.
(https://t.co/cLM2jiJtB9)

#vaping #vapeon #vapestagram #vapenation #vaporizer #vapelyfe  #vapecommunity #vapelife #vapedaily #ecig #vapepics #vapelove #vapeshop #vape #vaper #vapemod #rainbow https://t.co/E6X3KoSVa9",Econo_Vapes,2018-10-02 16:34:24+00:00
2253,1047162847581503488,FDA Seizes Documents at Headquarters of E-Cigarette Maker Juul https://t.co/jo9q8E5cdi,ronmc1,2018-10-02 16:34:12+00:00
2254,1047162818393518080,"The Food and Drug Administration seized ""thousands of pages of documents"" in a surprise inspection of e-cigarette maker Juul's San Francisco headquarters last week, the agency said Tuesday. https://t.co/x8SJSDT6x3",NBCPhiladelphia,2018-10-02 16:34:05+00:00
2255,1047162817218928640,FDA seizes documents from e-cigarette giant Juul's headquarters https://t.co/3CY6QG1V1I,LAXSmallBiz,2018-10-02 16:34:05+00:00
2256,1047162800957620224,Taken from a moving bus so not a great pic #arbroath #retail #buswanker #puffdaddy #vape #vaping #red #stagecoach https://t.co/pz8CvqGBF5,CPullampix,2018-10-02 16:34:01+00:00
2257,1047162767164071936,FDA seizes 'more than a thousand pages' of documents in surprise inspection of e-cigarette maker Juul https://t.co/E5ppeRNh3b,owenthall,2018-10-02 16:33:53+00:00
2258,1047162702316101632,"The Food and Drug Administration has staged a surprise inspection and seized ""over a thousand documents"" at the San Francisco headquarters of the nation's leading e-cigarette manufacturer. #Juul #SanFrancisco   https://t.co/TY7t4q9XE0 https://t.co/GzCUvegczc",KPIXtv,2018-10-02 16:33:38+00:00
2259,1047162624511754241,U.S. FDA collects documents from e-cigarette company Juul https://t.co/KCB4z0VQ27 | Reuters: Health News::: The U.S. Food And Drug Administration said on Tuesday it seized documents from Juul Labs related to its sales and marketing practices after conducting a surprise inspecti…,2premshakya,2018-10-02 16:33:19+00:00
2260,1047162580383531008,"SnowWolf Kit On Sale Now $87.99 ❄️ Goes up to 200 WATTS don’t miss out 🔥 https://t.co/9AkrylODNa 
#vapenation #vape #vapefam #vapedaily https://t.co/JgCjCVF324",Smokes_Pro,2018-10-02 16:33:09+00:00
2261,1047162578726662144,We have updated our point system so that you now have more control over how you spend them. Stop in this week to check it out! @ Sweet Tea's Vape Lounge https://t.co/qSHzHDM9wt,SweetTeasVape,2018-10-02 16:33:08+00:00
2262,1047162547940409344,"At the football game the other day, I witnessed this dude and his friends straight up finesse their way, straight up Tyrion Lannister their way, straight up talk and charm their way out of getting the dudes juul confiscated. It was.... inspiring.",joymabaggins,2018-10-02 16:33:01+00:00
2263,1047162547714084866,"Dead Rabbit RDA's have been gettin' a lot of hype within the vaping community, and it's easy to see why! They're compatible with single and dual coil builds, and a unique resin trip tip can be found with each RDA!

Hop on over to learn more and grab one today! 🐇 (404) 500-3983 https://t.co/MHauIVCtVH",sam_cbd,2018-10-02 16:33:01+00:00
2264,1047162498707869696,Is it illegal to hit the JUUL in the air port? Asking for a friend.,krystenpurple,2018-10-02 16:32:49+00:00
2265,1047162470543052801,FDA seizes JUUL documents as it considers e-cigarette bans https://t.co/4djNndjge9,leonardkl,2018-10-02 16:32:42+00:00
2266,1047162448980131840,"from coilmisfit_tvl  -  When your mod purges more than most produce you know you've got a tvl

@DRPHEELGOODTZ tvlsquad_orlando queen_kloudz_tvl bandit.vapes_tvl kaceerobinson_tvl… https://t.co/ekOiD8ckDP",DOCPHEELGOOD,2018-10-02 16:32:37+00:00
2267,1047162279417040896,"#Repost @ccmmods
・・・
Limited Edition @TVLSQUAD ➖➖➖➖➖➖➖➖➖➖➖
This Ole Vape Shop 
106 Calderwood Hwy
Maryville TN 37801
(865)980 VAPE
(865)888 OHMS
(865)236 6522
Open 7 days 
9am to 10pm
💯… https://t.co/rernfm6SZE",TVLSQUAD,2018-10-02 16:31:57+00:00
2268,1047162169035558912,"Y’all are really bold with this whole juul thing, wow",kianaless_,2018-10-02 16:31:31+00:00
2269,1047162150832226304,"Labelling affects likelihood of switching from smoking to a less harmful product 
#vaping

 https://t.co/6ynH0a6ZIp",grannylouisa,2018-10-02 16:31:26+00:00
2270,1047162095790428161,U.S. FDA collects documents from e-cigarette company Juul https://t.co/MQFt685Gam,Dauvg3jzX7KrDYJ,2018-10-02 16:31:13+00:00
2271,1047162022356504576,FDA seizes over a thousand documents from Juul HQ in San Fran. #ecigs #Juul https://t.co/r2x1fL22DI,HamaraTamara,2018-10-02 16:30:56+00:00
2272,1047161936826290176,FDA conducted surprise inspection of Juul’s headquarters https://t.co/uY6B1IdMaB via @WSJ,searchgirl40,2018-10-02 16:30:35+00:00
2273,1047161934586531841,bought a juul and an iphone xs max in gold yesterday it was a good day,electricwurms,2018-10-02 16:30:35+00:00
2274,1047161900482609152,**** CHECK OUT OUR LATEST DEALS **** Vape Pink Pink Swirl 60ml - Price: $19.99 https://t.co/LQpCihxGSn https://t.co/8zLJSGn9v1,ecig,2018-10-02 16:30:27+00:00
2275,1047161891766919168,me and this old lady just had a juul/cig smoke sesh outside of food lion. no words exchanged. i feel like we just had a bonding experience lmao,Itsthaplug,2018-10-02 16:30:24+00:00
2276,1047161858019348480,FDA seizes 'more than a thousand pages' of documents in surprise inspection of e-cigarette maker Juul https://t.co/g2JwphTkow,MotherOfMen_,2018-10-02 16:30:16+00:00
2277,1047161850528518144,"The statistics have been released from the European Commission consultation on a possible vape tax
https://t.co/qhMbyh3Tnm @EU_Commission @jsummers71 #vaping #vapenews #TPD #article20 #vapetax #harmreduction https://t.co/fg3epZQbNq",PVapes,2018-10-02 16:30:15+00:00
2278,1047161835634528262,"🔥 Haze #Vaporizer 🔥

➡️ https://t.co/4JLnxOD9fW ⬅️

👉 15% OFF USE CODE “THE420WIRE” 👈
✅ FREE SHIPPING

🔞 🔞 🔞

#vape #vapelife #the420wire https://t.co/nUGvnCiZVW",the420wire,2018-10-02 16:30:11+00:00
2279,1047161835445780480,"Antidepressants, mango juul pod, and an iced latte https://t.co/hgkNhsh7yi",glassnugget2,2018-10-02 16:30:11+00:00
2280,1047161835017920512,"i went to hand my chem teacher my usb drive and handed him the juul instead. 

you know he wanted to shmack it",shayla_mattes,2018-10-02 16:30:11+00:00
2281,1047161834082586625,Super #vape deals at https://t.co/id1ky4PIri + take another 10% off those deals with the group coupon code vapingtruth. #vapingtruth,thevapegoods,2018-10-02 16:30:11+00:00
2282,1047161816160321536,"FDA conducted surprise inspection of Juul Labs's offices, seeking information about the e-cigarette startup's sales and marketing practices https://t.co/3E9CdDM7Pp",WSJ,2018-10-02 16:30:06+00:00
2283,1047161796841365504,"Presenting Vype and their new Vype epen3! 
-
Click the link to learn more: 
https://t.co/3Dka3Z0lAI
-
#Vape #Vaping #Blog #NewBlog #VapeBlog #VapeShop #VapeStore #Eliquid #Ejuice #VapeJuice #VapeLiquid https://t.co/V7frZz5s5S",EvapoHub,2018-10-02 16:30:02+00:00
2284,1047161790650445825,"The number of teens who #vape has sharply increased, causing concern about the health and wellness challenges of the next generation. https://t.co/HSQseKQjjs",RMFFIndy,2018-10-02 16:30:00+00:00
2285,1047161790570754048,REPORT: FDA takes 'thousands' of documents in surprise Juul #inspection $PM $MO $BTI https://t.co/a1FFRWW8f6,theflynews,2018-10-02 16:30:00+00:00
2286,1047161788985483264,"ICYMI: State officials address what they call vaping epidemic among teens

Video: https://t.co/QOQjcOo6PA

(Toggle closed captions on and off through the video player settings.) https://t.co/FXz2PMKubD",MyFOX23,2018-10-02 16:30:00+00:00
2287,1047161788213616640,When you and your vape friends just got your first vape break of the day! #vapefam #vapestagram#vapeon #vapelyfe #ecig#vapers #vapeporn #ejuice #eliquid #vapenation #vapedaily#vapefriends #notblowingsmoke #vapetricks #vapesociety https://t.co/3zAq9yii6H,phantom_vape,2018-10-02 16:30:00+00:00
2288,1047161767711916032,U.S. FDA collects documents from e-cigarette company Juul https://t.co/Q29DztvXKJ,imranhaque505,2018-10-02 16:29:55+00:00
2289,1047161753510002688,"Juul-brand electronic cigarettes have become a contagion among students across America. The FDA is right to inspect the company.

In 2016, 1.7 million high-school students used e-cigarettes, plus another half million middle-school students https://t.co/Dv3PPUP9zQ https://t.co/pYBB8jqMno",opinion,2018-10-02 16:29:52+00:00
2290,1047161729682223104,I only used my juul bc it helped me have something to do when I'm anxious but I threw it away bc ew and now what am I supposed to do? eat kale or sumn?,catleeonline,2018-10-02 16:29:46+00:00
2291,1047161632344952832,I added a video to a @YouTube playlist https://t.co/6DaYjULcLo Dr. Konstantinos Farsalinos Presentation on Harm Reduction &amp; Vaping,180Smoke,2018-10-02 16:29:23+00:00
2292,1047161627404115969,U.S. FDA collects documents from e-cigarette company Juul https://t.co/gagGTZTH4R,xeling1,2018-10-02 16:29:21+00:00
2293,1047161577428983808,U.S. FDA collects documents from e-cigarette company Juul https://t.co/2gEZTuox6b,NY_Chiropractor,2018-10-02 16:29:10+00:00
2294,1047161503529533440,Are e-cigarettes better than conventional ones? Here’s what you need to know about vaping - Times Now https://t.co/PFEj00powL via @GoogleNews,DartmouthCTBH,2018-10-02 16:28:52+00:00
2295,1047161452031868928,U.S. FDA collects documents from e-cigarette company Juul ... more at https://t.co/TVCnYQWke7,NutritionDiet,2018-10-02 16:28:40+00:00
2296,1047161416631930885,U.S. FDA collects documents from e-cigarette company Juul https://t.co/zJfvdTzIJQ,gizemusta,2018-10-02 16:28:31+00:00
2297,1047161381286551552,Wtf is wrong with me I accidentally vaped inside the building and then a kid came around the corner into my smoke cloud fml,OddFlexButOk,2018-10-02 16:28:23+00:00
2298,1047161339544784896,U.S. FDA collects documents from e-cigarette company Juul https://t.co/VVmsm5Rms0,JonIlawrenceceo,2018-10-02 16:28:13+00:00
2299,1047161320527814657,JUST IN: U.S.-listed shares of British American Tobacco up 1.7 percent after FDA collects documents from e-cigarette company Juul https://t.co/o5QvRkdwpr,ReutersBiz,2018-10-02 16:28:08+00:00
2300,1047161286809796609,I reached Peak Badass today watching a YouTube tutorial to refill my juul pods,JG_Sweezy,2018-10-02 16:28:00+00:00
2301,1047161253637107717,Just realized I’ve been going through coils quick bc I never changed the watts down thats recommended for these coils ¯\_(ツ)_/¯ just your friendly neighborhood noob vaper,DemoanTV,2018-10-02 16:27:52+00:00
2302,1047161164822663169,"#hfxGOV

Ontario is allowing anyone to smoke cigarettes, vape or cannabis anywhere, no additional bylaws.  Same with BC, why is NS so ass backwards.

#nspoli",mini_bubbly,2018-10-02 16:27:31+00:00
2303,1047161136997494784,"Hi Guys, check out the white and gradient pattern of the Sailboat Mod. 💨💨👆📸😎😎💨💨
^^^^^^********^^^^^^^
•
#thinkvape #thinkvapesailboat #vape #電子タバコ #vaping #vapers #vaper #vapor #vapefun #vapeon #vapeonly #vapefam #vapefamily #vapefriends #vapegift #vapenation https://t.co/AAuCSrqV7g",thinkvape,2018-10-02 16:27:25+00:00
2304,1047161097336344576,"“WSJ News Alert: FDA Conducted Surprise Inspection of Juul’s Headquarters” 😇 
@danprimack",beardedmiguel,2018-10-02 16:27:15+00:00
2305,1047161064834654215,U.S. FDA collects documents from e-cigarette company Juul https://t.co/blwT9xDw4F,Ray_Noble1,2018-10-02 16:27:07+00:00
2306,1047161026431479808,"Happy freaking birthday to the vape queen herself! 🎉 I don’t know what I’d do without you Ji, you’re my soulmate and I love you and miss you so dang much. Have the best day ever ❤️ (If you need a quick laugh watch this compilation video) @Jill_King22 https://t.co/EON5lPRHUH",dominique_1718,2018-10-02 16:26:58+00:00
2307,1047161016008826881,My favorite vape shop name I’ve seen so far has got to be “Can’t stop. Won’t stop. Vape shop. Smoke shop.” Really just rolls off the tongue.,kellybinx,2018-10-02 16:26:56+00:00
2308,1047160951701721088,FDA Conducts Surprise Inspection of Juul’s Headquarters in San Francisco https://t.co/xhBYuCVqjl,PatrickChu88,2018-10-02 16:26:40+00:00
2309,1047160874073542657,The WHO is Criticized for Endorsing Countries Which Ban E-Cigarettes https://t.co/I8we98BBUE via @vaping_post,VaporTax,2018-10-02 16:26:22+00:00
2310,1047160873691860999,"Just saw a couple on campus holding hands with one hand and both hitting juuls with their other hand, and if that doesn’t describe 2018 idk what does",jqnew,2018-10-02 16:26:22+00:00
2311,1047160832705159168,UPDATE 1-U.S. FDA collects documents from e-cigarette company Juul https://t.co/sDhW3CY8sc #news #reuters,JacekWierzbicki,2018-10-02 16:26:12+00:00
2312,1047160806855663617,"“i hope you know it doesnt look cool when youre sucking on a juul”
yeah okay, well it doesnt look cool when youre sucking on a dick either but you still do it",hunterbrooke8,2018-10-02 16:26:06+00:00
2313,1047160805416783878,U.S. FDA collects documents from e-cigarette company Juul https://t.co/gPIWLW4aEu https://t.co/ByQJO4bEfp,tekgrouphealth,2018-10-02 16:26:05+00:00
2314,1047160782826422275,"Juuling makes you cough sometimes, but smoke one cig and your throat will be fucked for 3 days",NamesNasim2,2018-10-02 16:26:00+00:00
2315,1047160670083600389,y’all really getting caught with juuls and dab pens at school...💀,savanah__paige,2018-10-02 16:25:33+00:00
2316,1047160593692725248,#Promote your #marijuana #dispensary online #vape shop #wellness center take a look at our #classified section in our blog https://t.co/uaOiMyXH9K advertise and connect directly with the marijuana community #cannabis #dispensaries #hemp #legalizeit #legalize https://t.co/nW0m37Jkx5,MMPconnect,2018-10-02 16:25:15+00:00
2317,1047160570288529411,"The sweet frosted sugar cookie flavor of Soleil by 13thfloorelevapors will surely satisfy your sweet tooth! Come on down from 11-9 and get your sugar cookie on!
🚭🚭🚭
#vapeaddict #vape… https://t.co/m8XAGIa30X",centralavevapor,2018-10-02 16:25:09+00:00
2318,1047160570133340160,U.S. FDA collects documents from e-cigarette company Juul https://t.co/Olt1gcXNPh,HbbsVYlDn1A5SIL,2018-10-02 16:25:09+00:00
2319,1047160565859319809,#Promote your #marijuana #dispensary online #vape shop #wellness center take a look at our #classified section in our blog https://t.co/yOT81H1VZN advertise and connect directly with the marijuana community #cannabis #dispensaries #hemp #legalizeit #legalize https://t.co/EkEWhqgu7K,MMPconnection,2018-10-02 16:25:08+00:00
2320,1047160535421214720,"new post U.S. FDA collects documents from e-cigarette company Juul,,https://t.co/rMhQHrQTcq",BWN_Org,2018-10-02 16:25:01+00:00
2321,1047160503058018304,FDA conducted surprise inspection of Juul’s headquarters https://t.co/76fjxHiG1f,FuerstIttleman,2018-10-02 16:24:53+00:00
2322,1047160497034936320,FDA conducted surprise inspection of Juul’s headquarters https://t.co/R6uSMqba1V via @WSJ,OpioidWatch,2018-10-02 16:24:52+00:00
2323,1047160485148336129,"Vaporesso orca solo starter kit 

The Vasporesso Orca Solo AIO (All In One) vape kit has been designed for new users, a classic vape pen style kit, it features a built in 800 mAh battery that can be charged via... https://t.co/iaBpujoFsk",BitnPiecesVape,2018-10-02 16:24:49+00:00
2324,1047160425312391171,Juul’s are fucking shit how do yanks use this so much,dripwoosplash,2018-10-02 16:24:35+00:00
2325,1047160387202940928,U.S. FDA collects documents from e-cigarette company Juul https://t.co/hF7Yed8xVW,healthyandyeah,2018-10-02 16:24:26+00:00
2326,1047160381553238018,U.S. FDA collects documents from e-cigarette company Juul https://t.co/HL9mvrJ6Ms,KeQU5pYkHBgb6UK,2018-10-02 16:24:24+00:00
2327,1047160353572966401,U.S. FDA collects documents from e-cigarette company Juul https://t.co/Kta9X4UpKC,OnofredoBrena,2018-10-02 16:24:18+00:00
